test_and_tune/Adreno640.topinhw4c1.log.tmp
{"input": ["opencl -keys=opencl,gpu -max_num_threads=256", "tutorial/conv2d_no_batching", [1, 14, 14, 512, 256, 3, 3, [2, 2], [1, 1, 1, 1]], {}], "config": {"index": 3000, "code_hash": null, "entity": [["tile_ic", "sp", [-1, 1, 4]], ["tile_oc", "sp", [-1, 64]], ["tile_ow", "sp", [-1, 7, 1]], ["tile_oh", "sp", [-1, 1, 2]]]}, "result": [[0.0003372448], 0, 0.6556949615478516, 1615981131.251284], "version": 0.2, "tvm_version": "0.8.dev0"}
{"input": ["opencl -keys=opencl,gpu -max_num_threads=256", "tutorial/conv2d_no_batching", [1, 14, 14, 512, 256, 3, 3, [2, 2], [1, 1, 1, 1]], {}], "config": {"index": 3140, "code_hash": null, "entity": [["tile_ic", "sp", [-1, 1, 4]], ["tile_oc", "sp", [-1, 2]], ["tile_ow", "sp", [-1, 4, 2]], ["tile_oh", "sp", [-1, 1, 2]]]}, "result": [[0.0033889743], 0, 1.49940824508667, 1615981132.0312977], "version": 0.2, "tvm_version": "0.8.dev0"}
{"input": ["opencl -keys=opencl,gpu -max_num_threads=256", "tutorial/conv2d_no_batching", [1, 14, 14, 512, 256, 3, 3, [2, 2], [1, 1, 1, 1]], {}], "config": {"index": 3894, "code_hash": null, "entity": [["tile_ic", "sp", [-1, 4, 4]], ["tile_oc", "sp", [-1, 32]], ["tile_ow", "sp", [-1, 2, 1]], ["tile_oh", "sp", [-1, 4, 2]]]}, "result": [[0.0013398699], 0, 2.3051769733428955, 1615981132.810512], "version": 0.2, "tvm_version": "0.8.dev0"}
{"input": ["opencl -keys=opencl,gpu -max_num_threads=256", "tutorial/conv2d_no_batching", [1, 14, 14, 512, 256, 3, 3, [2, 2], [1, 1, 1, 1]], {}], "config": {"index": 3082, "code_hash": null, "entity": [["tile_ic", "sp", [-1, 4, 4]], ["tile_oc", "sp", [-1, 4]], ["tile_ow", "sp", [-1, 1, 2]], ["tile_oh", "sp", [-1, 1, 2]]]}, "result": [[0.0139219024], 0, 3.441117763519287, 1615981133.9899518], "version": 0.2, "tvm_version": "0.8.dev0"}
{"input": ["opencl -keys=opencl,gpu -max_num_threads=256", "tutorial/conv2d_no_batching", [1, 14, 14, 512, 256, 3, 3, [2, 2], [1, 1, 1, 1]], {}], "config": {"index": 1414, "code_hash": null, "entity": [["tile_ic", "sp", [-1, 4, 4]], ["tile_oc", "sp", [-1, 2]], ["tile_ow", "sp", [-1, 1, 8]], ["tile_oh", "sp", [-1, 4, 1]]]}, "result": [[0.007398276800000001], 0, 4.909322261810303, 1615981135.2497668], "version": 0.2, "tvm_version": "0.8.dev0"}
{"input": ["opencl -keys=opencl,gpu -max_num_threads=256", "tutorial/conv2d_no_batching", [1, 14, 14, 512, 256, 3, 3, [2, 2], [1, 1, 1, 1]], {}], "config": {"index": 6869, "code_hash": null, "entity": [["tile_ic", "sp", [-1, 2, 4]], ["tile_oc", "sp", [-1, 32]], ["tile_ow", "sp", [-1, 8, 1]], ["tile_oh", "sp", [-1, 1, 8]]]}, "result": [[0.0052712454], 0, 5.738781929016113, 1615981136.1755593], "version": 0.2, "tvm_version": "0.8.dev0"}
{"input": ["opencl -keys=opencl,gpu -max_num_threads=256", "tutorial/conv2d_no_batching", [1, 14, 14, 512, 256, 3, 3, [2, 2], [1, 1, 1, 1]], {}], "config": {"index": 6072, "code_hash": null, "entity": [["tile_ic", "sp", [-1, 1, 4]], ["tile_oc", "sp", [-1, 64]], ["tile_ow", "sp", [-1, 7, 2]], ["tile_oh", "sp", [-1, 1, 7]]]}, "result": [[0.00038414069999999996], 0, 6.396031141281128, 1615981136.9296129], "version": 0.2, "tvm_version": "0.8.dev0"}
{"input": ["opencl -keys=opencl,gpu -max_num_threads=256", "tutorial/conv2d_no_batching", [1, 14, 14, 512, 256, 3, 3, [2, 2], [1, 1, 1, 1]], {}], "config": {"index": 3610, "code_hash": null, "entity": [["tile_ic", "sp", [-1, 4, 4]], ["tile_oc", "sp", [-1, 64]], ["tile_ow", "sp", [-1, 2, 2]], ["tile_oh", "sp", [-1, 2, 2]]]}, "result": [[0.0080614123], 0, 8.597285032272339, 1615981138.9792562], "version": 0.2, "tvm_version": "0.8.dev0"}
{"input": ["opencl -keys=opencl,gpu -max_num_threads=256", "tutorial/conv2d_no_batching", [1, 14, 14, 512, 256, 3, 3, [2, 2], [1, 1, 1, 1]], {}], "config": {"index": 5985, "code_hash": null, "entity": [["tile_ic", "sp", [-1, 2, 4]], ["tile_oc", "sp", [-1, 1]], ["tile_ow", "sp", [-1, 2, 2]], ["tile_oh", "sp", [-1, 1, 7]]]}, "result": [[0.0484162028], 0, 11.520537376403809, 1615981141.865689], "version": 0.2, "tvm_version": "0.8.dev0"}
{"input": ["opencl -keys=opencl,gpu -max_num_threads=256", "tutorial/conv2d_no_batching", [1, 14, 14, 512, 256, 3, 3, [2, 2], [1, 1, 1, 1]], {}], "config": {"index": 961, "code_hash": null, "entity": [["tile_ic", "sp", [-1, 2, 4]], ["tile_oc", "sp", [-1, 1]], ["tile_ow", "sp", [-1, 1, 1]], ["tile_oh", "sp", [-1, 4, 1]]]}, "result": [[0.0061086152], 0, 12.137705564498901, 1615981142.7544603], "version": 0.2, "tvm_version": "0.8.dev0"}
{"input": ["opencl -keys=opencl,gpu -max_num_threads=256", "tutorial/conv2d_no_batching", [1, 14, 14, 512, 256, 3, 3, [2, 2], [1, 1, 1, 1]], {}], "config": {"index": 1947, "code_hash": null, "entity": [["tile_ic", "sp", [-1, 8, 4]], ["tile_oc", "sp", [-1, 64]], ["tile_ow", "sp", [-1, 1, 1]], ["tile_oh", "sp", [-1, 8, 1]]]}, "result": [[0.016259433900000002], 0, 13.445778369903564, 1615981143.980386], "version": 0.2, "tvm_version": "0.8.dev0"}
{"input": ["opencl -keys=opencl,gpu -max_num_threads=256", "tutorial/conv2d_no_batching", [1, 14, 14, 512, 256, 3, 3, [2, 2], [1, 1, 1, 1]], {}], "config": {"index": 4316, "code_hash": null, "entity": [["tile_ic", "sp", [-1, 1, 4]], ["tile_oc", "sp", [-1, 128]], ["tile_ow", "sp", [-1, 1, 8]], ["tile_oh", "sp", [-1, 4, 2]]]}, "result": [[0.0090038968], 0, 14.642004013061523, 1615981145.0575736], "version": 0.2, "tvm_version": "0.8.dev0"}
{"input": ["opencl -keys=opencl,gpu -max_num_threads=256", "tutorial/conv2d_no_batching", [1, 14, 14, 512, 256, 3, 3, [2, 2], [1, 1, 1, 1]], {}], "config": {"index": 2838, "code_hash": null, "entity": [["tile_ic", "sp", [-1, 4, 4]], ["tile_oc", "sp", [-1, 32]], ["tile_ow", "sp", [-1, 2, 7]], ["tile_oh", "sp", [-1, 14, 1]]]}, "result": [[0.0116732668], 0, 15.693111181259155, 1615981146.2346644], "version": 0.2, "tvm_version": "0.8.dev0"}
{"input": ["opencl -keys=opencl,gpu -max_num_threads=256", "tutorial/conv2d_no_batching", [1, 14, 14, 512, 256, 3, 3, [2, 2], [1, 1, 1, 1]], {}], "config": {"index": 1946, "code_hash": null, "entity": [["tile_ic", "sp", [-1, 4, 4]], ["tile_oc", "sp", [-1, 64]], ["tile_ow", "sp", [-1, 1, 1]], ["tile_oh", "sp", [-1, 8, 1]]]}, "result": [[0.0005643646], 0, 16.3356192111969, 1615981146.9294755], "version": 0.2, "tvm_version": "0.8.dev0"}
{"input": ["opencl -keys=opencl,gpu -max_num_threads=256", "tutorial/conv2d_no_batching", [1, 14, 14, 512, 256, 3, 3, [2, 2], [1, 1, 1, 1]], {}], "config": {"index": 1611, "code_hash": null, "entity": [["tile_ic", "sp", [-1, 8, 4]], ["tile_oc", "sp", [-1, 4]], ["tile_ow", "sp", [-1, 14, 1]], ["tile_oh", "sp", [-1, 7, 1]]]}, "result": [[0.0011054845], 0, 17.07306718826294, 1615981147.6489658], "version": 0.2, "tvm_version": "0.8.dev0"}
{"input": ["opencl -keys=opencl,gpu -max_num_threads=256", "tutorial/conv2d_no_batching", [1, 14, 14, 512, 256, 3, 3, [2, 2], [1, 1, 1, 1]], {}], "config": {"index": 2803, "code_hash": null, "entity": [["tile_ic", "sp", [-1, 8, 4]], ["tile_oc", "sp", [-1, 16]], ["tile_ow", "sp", [-1, 1, 7]], ["tile_oh", "sp", [-1, 14, 1]]]}, "result": [[0.0066844121], 0, 18.21909475326538, 1615981148.7268555], "version": 0.2, "tvm_version": "0.8.dev0"}
{"input": ["opencl -keys=opencl,gpu -max_num_threads=256", "tutorial/conv2d_no_batching", [1, 14, 14, 512, 256, 3, 3, [2, 2], [1, 1, 1, 1]], {}], "config": {"index": 5373, "code_hash": null, "entity": [["tile_ic", "sp", [-1, 2, 4]], ["tile_oc", "sp", [-1, 128]], ["tile_ow", "sp", [-1, 4, 1]], ["tile_oh", "sp", [-1, 2, 4]]]}, "result": [[0.0014807918], 0, 18.97124195098877, 1615981149.508004], "version": 0.2, "tvm_version": "0.8.dev0"}
{"input": ["opencl -keys=opencl,gpu -max_num_threads=256", "tutorial/conv2d_no_batching", [1, 14, 14, 512, 256, 3, 3, [2, 2], [1, 1, 1, 1]], {}], "config": {"index": 55, "code_hash": null, "entity": [["tile_ic", "sp", [-1, 8, 4]], ["tile_oc", "sp", [-1, 32]], ["tile_ow", "sp", [-1, 2, 1]], ["tile_oh", "sp", [-1, 1, 1]]]}, "result": [[0.0009494271], 0, 19.612013578414917, 1615981150.1963704], "version": 0.2, "tvm_version": "0.8.dev0"}
{"input": ["opencl -keys=opencl,gpu -max_num_threads=256", "tutorial/conv2d_no_batching", [1, 14, 14, 512, 256, 3, 3, [2, 2], [1, 1, 1, 1]], {}], "config": {"index": 3383, "code_hash": null, "entity": [["tile_ic", "sp", [-1, 8, 4]], ["tile_oc", "sp", [-1, 32]], ["tile_ow", "sp", [-1, 1, 1]], ["tile_oh", "sp", [-1, 2, 2]]]}, "result": [[0.0075035008], 0, 20.905859231948853, 1615981151.371968], "version": 0.2, "tvm_version": "0.8.dev0"}
{"input": ["opencl -keys=opencl,gpu -max_num_threads=256", "tutorial/conv2d_no_batching", [1, 14, 14, 512, 256, 3, 3, [2, 2], [1, 1, 1, 1]], {}], "config": {"index": 5618, "code_hash": null, "entity": [["tile_ic", "sp", [-1, 4, 4]], ["tile_oc", "sp", [-1, 16]], ["tile_ow", "sp", [-1, 1, 4]], ["tile_oh", "sp", [-1, 2, 4]]]}, "result": [[0.0070375475000000005], 0, 22.818700790405273, 1615981153.0060833], "version": 0.2, "tvm_version": "0.8.dev0"}
{"input": ["opencl -keys=opencl,gpu -max_num_threads=256", "tutorial/conv2d_no_batching", [1, 14, 14, 512, 256, 3, 3, [2, 2], [1, 1, 1, 1]], {}], "config": {"index": 3990, "code_hash": null, "entity": [["tile_ic", "sp", [-1, 4, 4]], ["tile_oc", "sp", [-1, 32]], ["tile_ow", "sp", [-1, 8, 1]], ["tile_oh", "sp", [-1, 4, 2]]]}, "result": [[0.0021921043], 0, 1.0662245750427246, 1615981154.9094856], "version": 0.2, "tvm_version": "0.8.dev0"}
{"input": ["opencl -keys=opencl,gpu -max_num_threads=256", "tutorial/conv2d_no_batching", [1, 14, 14, 512, 256, 3, 3, [2, 2], [1, 1, 1, 1]], {}], "config": {"index": 5761, "code_hash": null, "entity": [["tile_ic", "sp", [-1, 2, 4]], ["tile_oc", "sp", [-1, 1]], ["tile_ow", "sp", [-1, 1, 1]], ["tile_oh", "sp", [-1, 1, 7]]]}, "result": [[0.0164191475], 0, 2.2054271697998047, 1615981156.1254287], "version": 0.2, "tvm_version": "0.8.dev0"}
{"input": ["opencl -keys=opencl,gpu -max_num_threads=256", "tutorial/conv2d_no_batching", [1, 14, 14, 512, 256, 3, 3, [2, 2], [1, 1, 1, 1]], {}], "config": {"index": 5434, "code_hash": null, "entity": [["tile_ic", "sp", [-1, 4, 4]], ["tile_oc", "sp", [-1, 64]], ["tile_ow", "sp", [-1, 8, 1]], ["tile_oh", "sp", [-1, 2, 4]]]}, "result": [[0.0070187611], 0, 3.414367437362671, 1615981157.2433417], "version": 0.2, "tvm_version": "0.8.dev0"}
{"input": ["opencl -keys=opencl,gpu -max_num_threads=256", "tutorial/conv2d_no_batching", [1, 14, 14, 512, 256, 3, 3, [2, 2], [1, 1, 1, 1]], {}], "config": {"index": 5562, "code_hash": null, "entity": [["tile_ic", "sp", [-1, 4, 4]], ["tile_oc", "sp", [-1, 64]], ["tile_ow", "sp", [-1, 4, 2]], ["tile_oh", "sp", [-1, 2, 4]]]}, "result": [[0.0069042403], 0, 5.751872301101685, 1615981159.3105888], "version": 0.2, "tvm_version": "0.8.dev0"}
{"input": ["opencl -keys=opencl,gpu -max_num_threads=256", "tutorial/conv2d_no_batching", [1, 14, 14, 512, 256, 3, 3, [2, 2], [1, 1, 1, 1]], {}], "config": {"index": 5745, "code_hash": null, "entity": [["tile_ic", "sp", [-1, 2, 4]], ["tile_oc", "sp", [-1, 16]], ["tile_ow", "sp", [-1, 1, 8]], ["tile_oh", "sp", [-1, 2, 4]]]}, "result": [[0.0122527356], 0, 7.428874731063843, 1615981160.9325402], "version": 0.2, "tvm_version": "0.8.dev0"}
{"input": ["opencl -keys=opencl,gpu -max_num_threads=256", "tutorial/conv2d_no_batching", [1, 14, 14, 512, 256, 3, 3, [2, 2], [1, 1, 1, 1]], {}], "config": {"index": 6529, "code_hash": null, "entity": [["tile_ic", "sp", [-1, 2, 4]], ["tile_oc", "sp", [-1, 1]], ["tile_ow", "sp", [-1, 7, 2]], ["tile_oh", "sp", [-1, 2, 7]]]}, "result": [[0.0063017454], 0, 8.056241750717163, 1615981161.913756], "version": 0.2, "tvm_version": "0.8.dev0"}
{"input": ["opencl -keys=opencl,gpu -max_num_threads=256", "tutorial/conv2d_no_batching", [1, 14, 14, 512, 256, 3, 3, [2, 2], [1, 1, 1, 1]], {}], "config": {"index": 3079, "code_hash": null, "entity": [["tile_ic", "sp", [-1, 8, 4]], ["tile_oc", "sp", [-1, 2]], ["tile_ow", "sp", [-1, 1, 2]], ["tile_oh", "sp", [-1, 1, 2]]]}, "result": [[0.047483452599999997], 0, 10.381044864654541, 1615981164.227435], "version": 0.2, "tvm_version": "0.8.dev0"}
{"input": ["opencl -keys=opencl,gpu -max_num_threads=256", "tutorial/conv2d_no_batching", [1, 14, 14, 512, 256, 3, 3, [2, 2], [1, 1, 1, 1]], {}], "config": {"index": 506, "code_hash": null, "entity": [["tile_ic", "sp", [-1, 4, 4]], ["tile_oc", "sp", [-1, 64]], ["tile_ow", "sp", [-1, 1, 1]], ["tile_oh", "sp", [-1, 2, 1]]]}, "result": [[0.0013004637], 0, 13.499083042144775, 1615981167.4651313], "version": 0.2, "tvm_version": "0.8.dev0"}
{"input": ["opencl -keys=opencl,gpu -max_num_threads=256", "tutorial/conv2d_no_batching", [1, 14, 14, 512, 256, 3, 3, [2, 2], [1, 1, 1, 1]], {}], "config": {"index": 4579, "code_hash": null, "entity": [["tile_ic", "sp", [-1, 8, 4]], ["tile_oc", "sp", [-1, 1]], ["tile_ow", "sp", [-1, 4, 2]], ["tile_oh", "sp", [-1, 7, 2]]]}, "result": [[0.016612585], 0, 15.838665008544922, 1615981169.575885], "version": 0.2, "tvm_version": "0.8.dev0"}
{"input": ["opencl -keys=opencl,gpu -max_num_threads=256", "tutorial/conv2d_no_batching", [1, 14, 14, 512, 256, 3, 3, [2, 2], [1, 1, 1, 1]], {}], "config": {"index": 2019, "code_hash": null, "entity": [["tile_ic", "sp", [-1, 8, 4]], ["tile_oc", "sp", [-1, 1]], ["tile_ow", "sp", [-1, 7, 1]], ["tile_oh", "sp", [-1, 8, 1]]]}, "result": [[0.0163987517], 0, 16.95331120491028, 1615981170.8706665], "version": 0.2, "tvm_version": "0.8.dev0"}
{"input": ["opencl -keys=opencl,gpu -max_num_threads=256", "tutorial/conv2d_no_batching", [1, 14, 14, 512, 256, 3, 3, [2, 2], [1, 1, 1, 1]], {}], "config": {"index": 2856, "code_hash": null, "entity": [["tile_ic", "sp", [-1, 1, 4]], ["tile_oc", "sp", [-1, 4]], ["tile_ow", "sp", [-1, 1, 8]], ["tile_oh", "sp", [-1, 14, 1]]]}, "result": [[0.00042434380000000004], 0, 17.62269878387451, 1615981171.5803003], "version": 0.2, "tvm_version": "0.8.dev0"}
{"input": ["opencl -keys=opencl,gpu -max_num_threads=256", "tutorial/conv2d_no_batching", [1, 14, 14, 512, 256, 3, 3, [2, 2], [1, 1, 1, 1]], {}], "config": {"index": 7031, "code_hash": null, "entity": [["tile_ic", "sp", [-1, 8, 4]], ["tile_oc", "sp", [-1, 32]], ["tile_ow", "sp", [-1, 7, 2]], ["tile_oh", "sp", [-1, 1, 8]]]}, "result": [[0.0096675166], 0, 19.69929313659668, 1615981173.2361352], "version": 0.2, "tvm_version": "0.8.dev0"}
{"input": ["opencl -keys=opencl,gpu -max_num_threads=256", "tutorial/conv2d_no_batching", [1, 14, 14, 512, 256, 3, 3, [2, 2], [1, 1, 1, 1]], {}], "config": {"index": 1655, "code_hash": null, "entity": [["tile_ic", "sp", [-1, 8, 4]], ["tile_oc", "sp", [-1, 32]], ["tile_ow", "sp", [-1, 1, 2]], ["tile_oh", "sp", [-1, 7, 1]]]}, "result": [[0.0142011004], 0, 22.11210536956787, 1615981176.0344803], "version": 0.2, "tvm_version": "0.8.dev0"}
{"input": ["opencl -keys=opencl,gpu -max_num_threads=256", "tutorial/conv2d_no_batching", [1, 14, 14, 512, 256, 3, 3, [2, 2], [1, 1, 1, 1]], {}], "config": {"index": 3171, "code_hash": null, "entity": [["tile_ic", "sp", [-1, 8, 4]], ["tile_oc", "sp", [-1, 1]], ["tile_ow", "sp", [-1, 7, 2]], ["tile_oh", "sp", [-1, 1, 2]]]}, "result": [[0.0185945904], 0, 23.510856866836548, 1615981177.4447658], "version": 0.2, "tvm_version": "0.8.dev0"}
{"input": ["opencl -keys=opencl,gpu -max_num_threads=256", "tutorial/conv2d_no_batching", [1, 14, 14, 512, 256, 3, 3, [2, 2], [1, 1, 1, 1]], {}], "config": {"index": 603, "code_hash": null, "entity": [["tile_ic", "sp", [-1, 8, 4]], ["tile_oc", "sp", [-1, 64]], ["tile_ow", "sp", [-1, 7, 1]], ["tile_oh", "sp", [-1, 2, 1]]]}, "result": [[0.0008572501], 0, 24.18294882774353, 1615981178.1867545], "version": 0.2, "tvm_version": "0.8.dev0"}
{"input": ["opencl -keys=opencl,gpu -max_num_threads=256", "tutorial/conv2d_no_batching", [1, 14, 14, 512, 256, 3, 3, [2, 2], [1, 1, 1, 1]], {}], "config": {"index": 5958, "code_hash": null, "entity": [["tile_ic", "sp", [-1, 4, 4]], ["tile_oc", "sp", [-1, 2]], ["tile_ow", "sp", [-1, 1, 2]], ["tile_oh", "sp", [-1, 1, 7]]]}, "result": [[0.017485808999999998], 0, 25.724186420440674, 1615981179.5748615], "version": 0.2, "tvm_version": "0.8.dev0"}
{"input": ["opencl -keys=opencl,gpu -max_num_threads=256", "tutorial/conv2d_no_batching", [1, 14, 14, 512, 256, 3, 3, [2, 2], [1, 1, 1, 1]], {}], "config": {"index": 5554, "code_hash": null, "entity": [["tile_ic", "sp", [-1, 4, 4]], ["tile_oc", "sp", [-1, 16]], ["tile_ow", "sp", [-1, 4, 2]], ["tile_oh", "sp", [-1, 2, 4]]]}, "result": [[0.0067479278], 0, 7.544168949127197, 1615981187.5858138], "version": 0.2, "tvm_version": "0.8.dev0"}
{"input": ["opencl -keys=opencl,gpu -max_num_threads=256", "tutorial/conv2d_no_batching", [1, 14, 14, 512, 256, 3, 3, [2, 2], [1, 1, 1, 1]], {}], "config": {"index": 2790, "code_hash": null, "entity": [["tile_ic", "sp", [-1, 4, 4]], ["tile_oc", "sp", [-1, 2]], ["tile_ow", "sp", [-1, 1, 7]], ["tile_oh", "sp", [-1, 14, 1]]]}, "result": [[0.0072546101], 0, 8.225862741470337, 1615981188.5366156], "version": 0.2, "tvm_version": "0.8.dev0"}
{"input": ["opencl -keys=opencl,gpu -max_num_threads=256", "tutorial/conv2d_no_batching", [1, 14, 14, 512, 256, 3, 3, [2, 2], [1, 1, 1, 1]], {}], "config": {"index": 309, "code_hash": null, "entity": [["tile_ic", "sp", [-1, 2, 4]], ["tile_oc", "sp", [-1, 32]], ["tile_ow", "sp", [-1, 7, 2]], ["tile_oh", "sp", [-1, 1, 1]]]}, "result": [[0.0003165677], 0, 8.803301334381104, 1615981189.2012863], "version": 0.2, "tvm_version": "0.8.dev0"}
{"input": ["opencl -keys=opencl,gpu -max_num_threads=256", "tutorial/conv2d_no_batching", [1, 14, 14, 512, 256, 3, 3, [2, 2], [1, 1, 1, 1]], {}], "config": {"index": 802, "code_hash": null, "entity": [["tile_ic", "sp", [-1, 4, 4]], ["tile_oc", "sp", [-1, 1]], ["tile_ow", "sp", [-1, 1, 4]], ["tile_oh", "sp", [-1, 2, 1]]]}, "result": [[0.020812408299999998], 0, 10.291068315505981, 1615981190.6174603], "version": 0.2, "tvm_version": "0.8.dev0"}
{"input": ["opencl -keys=opencl,gpu -max_num_threads=256", "tutorial/conv2d_no_batching", [1, 14, 14, 512, 256, 3, 3, [2, 2], [1, 1, 1, 1]], {}], "config": {"index": 3451, "code_hash": null, "entity": [["tile_ic", "sp", [-1, 8, 4]], ["tile_oc", "sp", [-1, 64]], ["tile_ow", "sp", [-1, 4, 1]], ["tile_oh", "sp", [-1, 2, 2]]]}, "result": [[0.007676657000000001], 0, 12.054397821426392, 1615981192.2675886], "version": 0.2, "tvm_version": "0.8.dev0"}
{"input": ["opencl -keys=opencl,gpu -max_num_threads=256", "tutorial/conv2d_no_batching", [1, 14, 14, 512, 256, 3, 3, [2, 2], [1, 1, 1, 1]], {}], "config": {"index": 4461, "code_hash": null, "entity": [["tile_ic", "sp", [-1, 2, 4]], ["tile_oc", "sp", [-1, 8]], ["tile_ow", "sp", [-1, 8, 1]], ["tile_oh", "sp", [-1, 7, 2]]]}, "result": [[0.0004383646], 0, 12.555293321609497, 1615981192.9457695], "version": 0.2, "tvm_version": "0.8.dev0"}
{"input": ["opencl -keys=opencl,gpu -max_num_threads=256", "tutorial/conv2d_no_batching", [1, 14, 14, 512, 256, 3, 3, [2, 2], [1, 1, 1, 1]], {}], "config": {"index": 1355, "code_hash": null, "entity": [["tile_ic", "sp", [-1, 8, 4]], ["tile_oc", "sp", [-1, 4]], ["tile_ow", "sp", [-1, 1, 7]], ["tile_oh", "sp", [-1, 4, 1]]]}, "result": [[0.0084164904], 0, 14.793118476867676, 1615981194.8719194], "version": 0.2, "tvm_version": "0.8.dev0"}
{"input": ["opencl -keys=opencl,gpu -max_num_threads=256", "tutorial/conv2d_no_batching", [1, 14, 14, 512, 256, 3, 3, [2, 2], [1, 1, 1, 1]], {}], "config": {"index": 3989, "code_hash": null, "entity": [["tile_ic", "sp", [-1, 2, 4]], ["tile_oc", "sp", [-1, 32]], ["tile_ow", "sp", [-1, 8, 1]], ["tile_oh", "sp", [-1, 4, 2]]]}, "result": [[0.0010677501000000002], 0, 15.262387990951538, 1615981195.6294208], "version": 0.2, "tvm_version": "0.8.dev0"}
{"input": ["opencl -keys=opencl,gpu -max_num_threads=256", "tutorial/conv2d_no_batching", [1, 14, 14, 512, 256, 3, 3, [2, 2], [1, 1, 1, 1]], {}], "config": {"index": 477, "code_hash": null, "entity": [["tile_ic", "sp", [-1, 2, 4]], ["tile_oc", "sp", [-1, 128]], ["tile_ow", "sp", [-1, 1, 8]], ["tile_oh", "sp", [-1, 1, 1]]]}, "result": [[0.0017554741], 0, 16.04335045814514, 1615981196.4052317], "version": 0.2, "tvm_version": "0.8.dev0"}
{"input": ["opencl -keys=opencl,gpu -max_num_threads=256", "tutorial/conv2d_no_batching", [1, 14, 14, 512, 256, 3, 3, [2, 2], [1, 1, 1, 1]], {}], "config": {"index": 3578, "code_hash": null, "entity": [["tile_ic", "sp", [-1, 4, 4]], ["tile_oc", "sp", [-1, 64]], ["tile_ow", "sp", [-1, 1, 2]], ["tile_oh", "sp", [-1, 2, 2]]]}, "result": [[0.004482589], 0, 17.07459282875061, 1615981197.340904], "version": 0.2, "tvm_version": "0.8.dev0"}
{"input": ["opencl -keys=opencl,gpu -max_num_threads=256", "tutorial/conv2d_no_batching", [1, 14, 14, 512, 256, 3, 3, [2, 2], [1, 1, 1, 1]], {}], "config": {"index": 6593, "code_hash": null, "entity": [["tile_ic", "sp", [-1, 2, 4]], ["tile_oc", "sp", [-1, 1]], ["tile_ow", "sp", [-1, 2, 4]], ["tile_oh", "sp", [-1, 2, 7]]]}, "result": [[0.0226796116], 0, 19.887373685836792, 1615981199.9989443], "version": 0.2, "tvm_version": "0.8.dev0"}
{"input": ["opencl -keys=opencl,gpu -max_num_threads=256", "tutorial/conv2d_no_batching", [1, 14, 14, 512, 256, 3, 3, [2, 2], [1, 1, 1, 1]], {}], "config": {"index": 6642, "code_hash": null, "entity": [["tile_ic", "sp", [-1, 4, 4]], ["tile_oc", "sp", [-1, 16]], ["tile_ow", "sp", [-1, 1, 7]], ["tile_oh", "sp", [-1, 2, 7]]]}, "result": [[0.0252975807], 0, 22.43639326095581, 1615981202.4262345], "version": 0.2, "tvm_version": "0.8.dev0"}
{"input": ["opencl -keys=opencl,gpu -max_num_threads=256", "tutorial/conv2d_no_batching", [1, 14, 14, 512, 256, 3, 3, [2, 2], [1, 1, 1, 1]], {}], "config": {"index": 6477, "code_hash": null, "entity": [["tile_ic", "sp", [-1, 2, 4]], ["tile_oc", "sp", [-1, 8]], ["tile_ow", "sp", [-1, 2, 2]], ["tile_oh", "sp", [-1, 2, 7]]]}, "result": [[0.0072141570000000006], 0, 23.995094299316406, 1615981204.1772876], "version": 0.2, "tvm_version": "0.8.dev0"}
{"input": ["opencl -keys=opencl,gpu -max_num_threads=256", "tutorial/conv2d_no_batching", [1, 14, 14, 512, 256, 3, 3, [2, 2], [1, 1, 1, 1]], {}], "config": {"index": 3066, "code_hash": null, "entity": [["tile_ic", "sp", [-1, 4, 4]], ["tile_oc", "sp", [-1, 64]], ["tile_ow", "sp", [-1, 14, 1]], ["tile_oh", "sp", [-1, 1, 2]]]}, "result": [[0.0003795209], 0, 25.28572392463684, 1615981205.7170808], "version": 0.2, "tvm_version": "0.8.dev0"}
{"input": ["opencl -keys=opencl,gpu -max_num_threads=256", "tutorial/conv2d_no_batching", [1, 14, 14, 512, 256, 3, 3, [2, 2], [1, 1, 1, 1]], {}], "config": {"index": 709, "code_hash": null, "entity": [["tile_ic", "sp", [-1, 2, 4]], ["tile_oc", "sp", [-1, 2]], ["tile_ow", "sp", [-1, 2, 2]], ["tile_oh", "sp", [-1, 2, 1]]]}, "result": [[0.0045164848], 0, 24.624456644058228, 1615981205.029793], "version": 0.2, "tvm_version": "0.8.dev0"}
{"input": ["opencl -keys=opencl,gpu -max_num_threads=256", "tutorial/conv2d_no_batching", [1, 14, 14, 512, 256, 3, 3, [2, 2], [1, 1, 1, 1]], {}], "config": {"index": 3046, "code_hash": null, "entity": [["tile_ic", "sp", [-1, 4, 4]], ["tile_oc", "sp", [-1, 2]], ["tile_ow", "sp", [-1, 14, 1]], ["tile_oh", "sp", [-1, 1, 2]]]}, "result": [[0.0007594584], 0, 26.035677433013916, 1615981206.460099], "version": 0.2, "tvm_version": "0.8.dev0"}
{"input": ["opencl -keys=opencl,gpu -max_num_threads=256", "tutorial/conv2d_no_batching", [1, 14, 14, 512, 256, 3, 3, [2, 2], [1, 1, 1, 1]], {}], "config": {"index": 2947, "code_hash": null, "entity": [["tile_ic", "sp", [-1, 8, 4]], ["tile_oc", "sp", [-1, 1]], ["tile_ow", "sp", [-1, 4, 1]], ["tile_oh", "sp", [-1, 1, 2]]]}, "result": [[0.0352095348], 0, 27.97797131538391, 1615981208.3235908], "version": 0.2, "tvm_version": "0.8.dev0"}
{"input": ["opencl -keys=opencl,gpu -max_num_threads=256", "tutorial/conv2d_no_batching", [1, 14, 14, 512, 256, 3, 3, [2, 2], [1, 1, 1, 1]], {}], "config": {"index": 6820, "code_hash": null, "entity": [["tile_ic", "sp", [-1, 1, 4]], ["tile_oc", "sp", [-1, 2]], ["tile_ow", "sp", [-1, 7, 1]], ["tile_oh", "sp", [-1, 1, 8]]]}, "result": [[0.0013280835], 0, 28.68323040008545, 1615981209.0905874], "version": 0.2, "tvm_version": "0.8.dev0"}
{"input": ["opencl -keys=opencl,gpu -max_num_threads=256", "tutorial/conv2d_no_batching", [1, 14, 14, 512, 256, 3, 3, [2, 2], [1, 1, 1, 1]], {}], "config": {"index": 2694, "code_hash": null, "entity": [["tile_ic", "sp", [-1, 4, 4]], ["tile_oc", "sp", [-1, 2]], ["tile_ow", "sp", [-1, 7, 2]], ["tile_oh", "sp", [-1, 14, 1]]]}, "result": [[0.0005661562999999999], 0, 5.787355184555054, 1615981215.8104174], "version": 0.2, "tvm_version": "0.8.dev0"}
{"input": ["opencl -keys=opencl,gpu -max_num_threads=256", "tutorial/conv2d_no_batching", [1, 14, 14, 512, 256, 3, 3, [2, 2], [1, 1, 1, 1]], {}], "config": {"index": 1704, "code_hash": null, "entity": [["tile_ic", "sp", [-1, 1, 4]], ["tile_oc", "sp", [-1, 4]], ["tile_ow", "sp", [-1, 4, 2]], ["tile_oh", "sp", [-1, 7, 1]]]}, "result": [[0.0008082969000000001], 0, 6.433543920516968, 1615981216.4759846], "version": 0.2, "tvm_version": "0.8.dev0"}
{"input": ["opencl -keys=opencl,gpu -max_num_threads=256", "tutorial/conv2d_no_batching", [1, 14, 14, 512, 256, 3, 3, [2, 2], [1, 1, 1, 1]], {}], "config": {"index": 789, "code_hash": null, "entity": [["tile_ic", "sp", [-1, 2, 4]], ["tile_oc", "sp", [-1, 32]], ["tile_ow", "sp", [-1, 7, 2]], ["tile_oh", "sp", [-1, 2, 1]]]}, "result": [[0.00029420840000000004], 0, 7.115965843200684, 1615981217.162081], "version": 0.2, "tvm_version": "0.8.dev0"}
{"input": ["opencl -keys=opencl,gpu -max_num_threads=256", "tutorial/conv2d_no_batching", [1, 14, 14, 512, 256, 3, 3, [2, 2], [1, 1, 1, 1]], {}], "config": {"index": 6886, "code_hash": null, "entity": [["tile_ic", "sp", [-1, 4, 4]], ["tile_oc", "sp", [-1, 2]], ["tile_ow", "sp", [-1, 14, 1]], ["tile_oh", "sp", [-1, 1, 8]]]}, "result": [[0.0117617772], 0, 8.413477420806885, 1615981218.3594067], "version": 0.2, "tvm_version": "0.8.dev0"}
{"input": ["opencl -keys=opencl,gpu -max_num_threads=256", "tutorial/conv2d_no_batching", [1, 14, 14, 512, 256, 3, 3, [2, 2], [1, 1, 1, 1]], {}], "config": {"index": 3131, "code_hash": null, "entity": [["tile_ic", "sp", [-1, 8, 4]], ["tile_oc", "sp", [-1, 64]], ["tile_ow", "sp", [-1, 2, 2]], ["tile_oh", "sp", [-1, 1, 2]]]}, "result": [[0.0186872883], 0, 10.7434983253479, 1615981220.5204625], "version": 0.2, "tvm_version": "0.8.dev0"}
{"input": ["opencl -keys=opencl,gpu -max_num_threads=256", "tutorial/conv2d_no_batching", [1, 14, 14, 512, 256, 3, 3, [2, 2], [1, 1, 1, 1]], {}], "config": {"index": 3779, "code_hash": null, "entity": [["tile_ic", "sp", [-1, 8, 4]], ["tile_oc", "sp", [-1, 1]], ["tile_ow", "sp", [-1, 2, 7]], ["tile_oh", "sp", [-1, 2, 2]]]}, "result": [[0.0266534714], 0, 13.864910364151001, 1615981223.2182071], "version": 0.2, "tvm_version": "0.8.dev0"}
{"input": ["opencl -keys=opencl,gpu -max_num_threads=256", "tutorial/conv2d_no_batching", [1, 14, 14, 512, 256, 3, 3, [2, 2], [1, 1, 1, 1]], {}], "config": {"index": 5811, "code_hash": null, "entity": [["tile_ic", "sp", [-1, 8, 4]], ["tile_oc", "sp", [-1, 16]], ["tile_ow", "sp", [-1, 2, 1]], ["tile_oh", "sp", [-1, 1, 7]]]}, "result": [[0.0058929276], 0, 14.402817964553833, 1615981224.2533464], "version": 0.2, "tvm_version": "0.8.dev0"}
{"input": ["opencl -keys=opencl,gpu -max_num_threads=256", "tutorial/conv2d_no_batching", [1, 14, 14, 512, 256, 3, 3, [2, 2], [1, 1, 1, 1]], {}], "config": {"index": 1553, "code_hash": null, "entity": [["tile_ic", "sp", [-1, 2, 4]], ["tile_oc", "sp", [-1, 16]], ["tile_ow", "sp", [-1, 7, 1]], ["tile_oh", "sp", [-1, 7, 1]]]}, "result": [[0.0008924948], 0, 14.836247444152832, 1615981224.9223523], "version": 0.2, "tvm_version": "0.8.dev0"}
{"input": ["opencl -keys=opencl,gpu -max_num_threads=256", "tutorial/conv2d_no_batching", [1, 14, 14, 512, 256, 3, 3, [2, 2], [1, 1, 1, 1]], {}], "config": {"index": 2933, "code_hash": null, "entity": [["tile_ic", "sp", [-1, 2, 4]], ["tile_oc", "sp", [-1, 32]], ["tile_ow", "sp", [-1, 2, 1]], ["tile_oh", "sp", [-1, 1, 2]]]}, "result": [[0.0002892865], 0, 15.549321174621582, 1615981225.6261444], "version": 0.2, "tvm_version": "0.8.dev0"}
{"input": ["opencl -keys=opencl,gpu -max_num_threads=256", "tutorial/conv2d_no_batching", [1, 14, 14, 512, 256, 3, 3, [2, 2], [1, 1, 1, 1]], {}], "config": {"index": 4385, "code_hash": null, "entity": [["tile_ic", "sp", [-1, 2, 4]], ["tile_oc", "sp", [-1, 1]], ["tile_ow", "sp", [-1, 4, 1]], ["tile_oh", "sp", [-1, 7, 2]]]}, "result": [[0.0007957396], 0, 16.165908336639404, 1615981226.2374792], "version": 0.2, "tvm_version": "0.8.dev0"}
{"input": ["opencl -keys=opencl,gpu -max_num_threads=256", "tutorial/conv2d_no_batching", [1, 14, 14, 512, 256, 3, 3, [2, 2], [1, 1, 1, 1]], {}], "config": {"index": 5355, "code_hash": null, "entity": [["tile_ic", "sp", [-1, 8, 4]], ["tile_oc", "sp", [-1, 4]], ["tile_ow", "sp", [-1, 4, 1]], ["tile_oh", "sp", [-1, 2, 4]]]}, "result": [[0.0097397353], 0, 18.007251739501953, 1615981227.756152], "version": 0.2, "tvm_version": "0.8.dev0"}
{"input": ["opencl -keys=opencl,gpu -max_num_threads=256", "tutorial/conv2d_no_batching", [1, 14, 14, 512, 256, 3, 3, [2, 2], [1, 1, 1, 1]], {}], "config": {"index": 6532, "code_hash": null, "entity": [["tile_ic", "sp", [-1, 1, 4]], ["tile_oc", "sp", [-1, 2]], ["tile_ow", "sp", [-1, 7, 2]], ["tile_oh", "sp", [-1, 2, 7]]]}, "result": [[0.0007118386], 0, 18.491666555404663, 1615981228.5079005], "version": 0.2, "tvm_version": "0.8.dev0"}
{"input": ["opencl -keys=opencl,gpu -max_num_threads=256", "tutorial/conv2d_no_batching", [1, 14, 14, 512, 256, 3, 3, [2, 2], [1, 1, 1, 1]], {}], "config": {"index": 3783, "code_hash": null, "entity": [["tile_ic", "sp", [-1, 8, 4]], ["tile_oc", "sp", [-1, 2]], ["tile_ow", "sp", [-1, 2, 7]], ["tile_oh", "sp", [-1, 2, 2]]]}, "result": [[0.0160758923], 0, 21.50670886039734, 1615981230.8510802], "version": 0.2, "tvm_version": "0.8.dev0"}
{"input": ["opencl -keys=opencl,gpu -max_num_threads=256", "tutorial/conv2d_no_batching", [1, 14, 14, 512, 256, 3, 3, [2, 2], [1, 1, 1, 1]], {}], "config": {"index": 1433, "code_hash": null, "entity": [["tile_ic", "sp", [-1, 2, 4]], ["tile_oc", "sp", [-1, 64]], ["tile_ow", "sp", [-1, 1, 8]], ["tile_oh", "sp", [-1, 4, 1]]]}, "result": [[0.0047969745000000005], 0, 21.804893016815186, 1615981231.8121572], "version": 0.2, "tvm_version": "0.8.dev0"}
{"input": ["opencl -keys=opencl,gpu -max_num_threads=256", "tutorial/conv2d_no_batching", [1, 14, 14, 512, 256, 3, 3, [2, 2], [1, 1, 1, 1]], {}], "config": {"index": 3722, "code_hash": null, "entity": [["tile_ic", "sp", [-1, 4, 4]], ["tile_oc", "sp", [-1, 4]], ["tile_ow", "sp", [-1, 2, 4]], ["tile_oh", "sp", [-1, 2, 2]]]}, "result": [[0.008690782099999999], 0, 24.12553310394287, 1615981233.8408408], "version": 0.2, "tvm_version": "0.8.dev0"}
{"input": ["opencl -keys=opencl,gpu -max_num_threads=256", "tutorial/conv2d_no_batching", [1, 14, 14, 512, 256, 3, 3, [2, 2], [1, 1, 1, 1]], {}], "config": {"index": 3207, "code_hash": null, "entity": [["tile_ic", "sp", [-1, 8, 4]], ["tile_oc", "sp", [-1, 2]], ["tile_ow", "sp", [-1, 1, 4]], ["tile_oh", "sp", [-1, 1, 2]]]}, "result": [[0.0347301701], 0, 26.20027184486389, 1615981236.0633385], "version": 0.2, "tvm_version": "0.8.dev0"}
{"input": ["opencl -keys=opencl,gpu -max_num_threads=256", "tutorial/conv2d_no_batching", [1, 14, 14, 512, 256, 3, 3, [2, 2], [1, 1, 1, 1]], {}], "config": {"index": 5571, "code_hash": null, "entity": [["tile_ic", "sp", [-1, 8, 4]], ["tile_oc", "sp", [-1, 1]], ["tile_ow", "sp", [-1, 7, 2]], ["tile_oh", "sp", [-1, 2, 4]]]}, "result": [[0.0105330427], 0, 28.524998426437378, 1615981238.271545], "version": 0.2, "tvm_version": "0.8.dev0"}
{"input": ["opencl -keys=opencl,gpu -max_num_threads=256", "tutorial/conv2d_no_batching", [1, 14, 14, 512, 256, 3, 3, [2, 2], [1, 1, 1, 1]], {}], "config": {"index": 4961, "code_hash": null, "entity": [["tile_ic", "sp", [-1, 2, 4]], ["tile_oc", "sp", [-1, 1]], ["tile_ow", "sp", [-1, 14, 1]], ["tile_oh", "sp", [-1, 1, 4]]]}, "result": [[0.0016808699999999999], 0, 26.745725870132446, 1615981236.809775], "version": 0.2, "tvm_version": "0.8.dev0"}
{"input": ["opencl -keys=opencl,gpu -max_num_threads=256", "tutorial/conv2d_no_batching", [1, 14, 14, 512, 256, 3, 3, [2, 2], [1, 1, 1, 1]], {}], "config": {"index": 2997, "code_hash": null, "entity": [["tile_ic", "sp", [-1, 2, 4]], ["tile_oc", "sp", [-1, 32]], ["tile_ow", "sp", [-1, 7, 1]], ["tile_oh", "sp", [-1, 1, 2]]]}, "result": [[0.0003045885], 0, 0.777815580368042, 1615981270.2610154], "version": 0.2, "tvm_version": "0.8.dev0"}
{"input": ["opencl -keys=opencl,gpu -max_num_threads=256", "tutorial/conv2d_no_batching", [1, 14, 14, 512, 256, 3, 3, [2, 2], [1, 1, 1, 1]], {}], "config": {"index": 3061, "code_hash": null, "entity": [["tile_ic", "sp", [-1, 2, 4]], ["tile_oc", "sp", [-1, 32]], ["tile_ow", "sp", [-1, 14, 1]], ["tile_oh", "sp", [-1, 1, 2]]]}, "result": [[0.0002757604], 0, 1.4066123962402344, 1615981270.8995304], "version": 0.2, "tvm_version": "0.8.dev0"}
{"input": ["opencl -keys=opencl,gpu -max_num_threads=256", "tutorial/conv2d_no_batching", [1, 14, 14, 512, 256, 3, 3, [2, 2], [1, 1, 1, 1]], {}], "config": {"index": 785, "code_hash": null, "entity": [["tile_ic", "sp", [-1, 2, 4]], ["tile_oc", "sp", [-1, 16]], ["tile_ow", "sp", [-1, 7, 2]], ["tile_oh", "sp", [-1, 2, 1]]]}, "result": [[0.0003044844], 0, 2.0707383155822754, 1615981271.5712078], "version": 0.2, "tvm_version": "0.8.dev0"}
{"input": ["opencl -keys=opencl,gpu -max_num_threads=256", "tutorial/conv2d_no_batching", [1, 14, 14, 512, 256, 3, 3, [2, 2], [1, 1, 1, 1]], {}], "config": {"index": 305, "code_hash": null, "entity": [["tile_ic", "sp", [-1, 2, 4]], ["tile_oc", "sp", [-1, 16]], ["tile_ow", "sp", [-1, 7, 2]], ["tile_oh", "sp", [-1, 1, 1]]]}, "result": [[0.0003356562], 0, 2.7116353511810303, 1615981272.231769], "version": 0.2, "tvm_version": "0.8.dev0"}
{"input": ["opencl -keys=opencl,gpu -max_num_threads=256", "tutorial/conv2d_no_batching", [1, 14, 14, 512, 256, 3, 3, [2, 2], [1, 1, 1, 1]], {}], "config": {"index": 781, "code_hash": null, "entity": [["tile_ic", "sp", [-1, 2, 4]], ["tile_oc", "sp", [-1, 8]], ["tile_ow", "sp", [-1, 7, 2]], ["tile_oh", "sp", [-1, 2, 1]]]}, "result": [[0.00033429689999999997], 0, 3.3395192623138428, 1615981272.8897398], "version": 0.2, "tvm_version": "0.8.dev0"}
{"input": ["opencl -keys=opencl,gpu -max_num_threads=256", "tutorial/conv2d_no_batching", [1, 14, 14, 512, 256, 3, 3, [2, 2], [1, 1, 1, 1]], {}], "config": {"index": 3473, "code_hash": null, "entity": [["tile_ic", "sp", [-1, 2, 4]], ["tile_oc", "sp", [-1, 16]], ["tile_ow", "sp", [-1, 7, 1]], ["tile_oh", "sp", [-1, 2, 2]]]}, "result": [[0.0007915209], 0, 4.058703899383545, 1615981273.6100657], "version": 0.2, "tvm_version": "0.8.dev0"}
{"input": ["opencl -keys=opencl,gpu -max_num_threads=256", "tutorial/conv2d_no_batching", [1, 14, 14, 512, 256, 3, 3, [2, 2], [1, 1, 1, 1]], {}], "config": {"index": 693, "code_hash": null, "entity": [["tile_ic", "sp", [-1, 2, 4]], ["tile_oc", "sp", [-1, 32]], ["tile_ow", "sp", [-1, 1, 2]], ["tile_oh", "sp", [-1, 2, 1]]]}, "result": [[0.00029665109999999997], 0, 4.72932505607605, 1615981274.2571647], "version": 0.2, "tvm_version": "0.8.dev0"}
{"input": ["opencl -keys=opencl,gpu -max_num_threads=256", "tutorial/conv2d_no_batching", [1, 14, 14, 512, 256, 3, 3, [2, 2], [1, 1, 1, 1]], {}], "config": {"index": 3057, "code_hash": null, "entity": [["tile_ic", "sp", [-1, 2, 4]], ["tile_oc", "sp", [-1, 16]], ["tile_ow", "sp", [-1, 14, 1]], ["tile_oh", "sp", [-1, 1, 2]]]}, "result": [[0.0003213074], 0, 5.392598867416382, 1615981274.9401443], "version": 0.2, "tvm_version": "0.8.dev0"}
{"input": ["opencl -keys=opencl,gpu -max_num_threads=256", "tutorial/conv2d_no_batching", [1, 14, 14, 512, 256, 3, 3, [2, 2], [1, 1, 1, 1]], {}], "config": {"index": 780, "code_hash": null, "entity": [["tile_ic", "sp", [-1, 1, 4]], ["tile_oc", "sp", [-1, 8]], ["tile_ow", "sp", [-1, 7, 2]], ["tile_oh", "sp", [-1, 2, 1]]]}, "result": [[0.0003828386], 0, 6.089632272720337, 1615981275.6430023], "version": 0.2, "tvm_version": "0.8.dev0"}
{"input": ["opencl -keys=opencl,gpu -max_num_threads=256", "tutorial/conv2d_no_batching", [1, 14, 14, 512, 256, 3, 3, [2, 2], [1, 1, 1, 1]], {}], "config": {"index": 777, "code_hash": null, "entity": [["tile_ic", "sp", [-1, 2, 4]], ["tile_oc", "sp", [-1, 4]], ["tile_ow", "sp", [-1, 7, 2]], ["tile_oh", "sp", [-1, 2, 1]]]}, "result": [[0.0003307605], 0, 7.387838125228882, 1615981276.942353], "version": 0.2, "tvm_version": "0.8.dev0"}
{"input": ["opencl -keys=opencl,gpu -max_num_threads=256", "tutorial/conv2d_no_batching", [1, 14, 14, 512, 256, 3, 3, [2, 2], [1, 1, 1, 1]], {}], "config": {"index": 757, "code_hash": null, "entity": [["tile_ic", "sp", [-1, 2, 4]], ["tile_oc", "sp", [-1, 32]], ["tile_ow", "sp", [-1, 4, 2]], ["tile_oh", "sp", [-1, 2, 1]]]}, "result": [[0.0006770313], 0, 6.780795097351074, 1615981276.3140395], "version": 0.2, "tvm_version": "0.8.dev0"}
{"input": ["opencl -keys=opencl,gpu -max_num_threads=256", "tutorial/conv2d_no_batching", [1, 14, 14, 512, 256, 3, 3, [2, 2], [1, 1, 1, 1]], {}], "config": {"index": 2993, "code_hash": null, "entity": [["tile_ic", "sp", [-1, 2, 4]], ["tile_oc", "sp", [-1, 16]], ["tile_ow", "sp", [-1, 7, 1]], ["tile_oh", "sp", [-1, 1, 2]]]}, "result": [[0.0003165313], 0, 8.042587041854858, 1615981277.642081], "version": 0.2, "tvm_version": "0.8.dev0"}
{"input": ["opencl -keys=opencl,gpu -max_num_threads=256", "tutorial/conv2d_no_batching", [1, 14, 14, 512, 256, 3, 3, [2, 2], [1, 1, 1, 1]], {}], "config": {"index": 178, "code_hash": null, "entity": [["tile_ic", "sp", [-1, 4, 4]], ["tile_oc", "sp", [-1, 16]], ["tile_ow", "sp", [-1, 14, 1]], ["tile_oh", "sp", [-1, 1, 1]]]}, "result": [[0.0011315626], 0, 8.76251220703125, 1615981278.3142977], "version": 0.2, "tvm_version": "0.8.dev0"}
{"input": ["opencl -keys=opencl,gpu -max_num_threads=256", "tutorial/conv2d_no_batching", [1, 14, 14, 512, 256, 3, 3, [2, 2], [1, 1, 1, 1]], {}], "config": {"index": 3529, "code_hash": null, "entity": [["tile_ic", "sp", [-1, 2, 4]], ["tile_oc", "sp", [-1, 4]], ["tile_ow", "sp", [-1, 14, 1]], ["tile_oh", "sp", [-1, 2, 2]]]}, "result": [[0.0007769896], 0, 9.457709550857544, 1615981278.9914148], "version": 0.2, "tvm_version": "0.8.dev0"}
{"input": ["opencl -keys=opencl,gpu -max_num_threads=256", "tutorial/conv2d_no_batching", [1, 14, 14, 512, 256, 3, 3, [2, 2], [1, 1, 1, 1]], {}], "config": {"index": 1257, "code_hash": null, "entity": [["tile_ic", "sp", [-1, 2, 4]], ["tile_oc", "sp", [-1, 4]], ["tile_ow", "sp", [-1, 7, 2]], ["tile_oh", "sp", [-1, 4, 1]]]}, "result": [[0.0004474011], 0, 10.123678922653198, 1615981279.7002738], "version": 0.2, "tvm_version": "0.8.dev0"}
{"input": ["opencl -keys=opencl,gpu -max_num_threads=256", "tutorial/conv2d_no_batching", [1, 14, 14, 512, 256, 3, 3, [2, 2], [1, 1, 1, 1]], {}], "config": {"index": 594, "code_hash": null, "entity": [["tile_ic", "sp", [-1, 4, 4]], ["tile_oc", "sp", [-1, 16]], ["tile_ow", "sp", [-1, 7, 1]], ["tile_oh", "sp", [-1, 2, 1]]]}, "result": [[0.0011325939], 0, 11.450233221054077, 1615981281.0538273], "version": 0.2, "tvm_version": "0.8.dev0"}
{"input": ["opencl -keys=opencl,gpu -max_num_threads=256", "tutorial/conv2d_no_batching", [1, 14, 14, 512, 256, 3, 3, [2, 2], [1, 1, 1, 1]], {}], "config": {"index": 277, "code_hash": null, "entity": [["tile_ic", "sp", [-1, 2, 4]], ["tile_oc", "sp", [-1, 32]], ["tile_ow", "sp", [-1, 4, 2]], ["tile_oh", "sp", [-1, 1, 1]]]}, "result": [[0.0006400678], 0, 10.82375431060791, 1615981280.3919566], "version": 0.2, "tvm_version": "0.8.dev0"}
{"input": ["opencl -keys=opencl,gpu -max_num_threads=256", "tutorial/conv2d_no_batching", [1, 14, 14, 512, 256, 3, 3, [2, 2], [1, 1, 1, 1]], {}], "config": {"index": 593, "code_hash": null, "entity": [["tile_ic", "sp", [-1, 2, 4]], ["tile_oc", "sp", [-1, 16]], ["tile_ow", "sp", [-1, 7, 1]], ["tile_oh", "sp", [-1, 2, 1]]]}, "result": [[0.0009026459000000001], 0, 12.13014268875122, 1615981281.7393618], "version": 0.2, "tvm_version": "0.8.dev0"}
{"input": ["opencl -keys=opencl,gpu -max_num_threads=256", "tutorial/conv2d_no_batching", [1, 14, 14, 512, 256, 3, 3, [2, 2], [1, 1, 1, 1]], {}], "config": {"index": 589, "code_hash": null, "entity": [["tile_ic", "sp", [-1, 2, 4]], ["tile_oc", "sp", [-1, 8]], ["tile_ow", "sp", [-1, 7, 1]], ["tile_oh", "sp", [-1, 2, 1]]]}, "result": [[0.0008941407], 0, 12.724029541015625, 1615981282.3782094], "version": 0.2, "tvm_version": "0.8.dev0"}
{"input": ["opencl -keys=opencl,gpu -max_num_threads=256", "tutorial/conv2d_no_batching", [1, 14, 14, 512, 256, 3, 3, [2, 2], [1, 1, 1, 1]], {}], "config": {"index": 182, "code_hash": null, "entity": [["tile_ic", "sp", [-1, 4, 4]], ["tile_oc", "sp", [-1, 32]], ["tile_ow", "sp", [-1, 14, 1]], ["tile_oh", "sp", [-1, 1, 1]]]}, "result": [[0.001044349], 0, 13.434206247329712, 1615981283.052591], "version": 0.2, "tvm_version": "0.8.dev0"}
{"input": ["opencl -keys=opencl,gpu -max_num_threads=256", "tutorial/conv2d_no_batching", [1, 14, 14, 512, 256, 3, 3, [2, 2], [1, 1, 1, 1]], {}], "config": {"index": 3056, "code_hash": null, "entity": [["tile_ic", "sp", [-1, 1, 4]], ["tile_oc", "sp", [-1, 16]], ["tile_ow", "sp", [-1, 14, 1]], ["tile_oh", "sp", [-1, 1, 2]]]}, "result": [[0.00033763550000000004], 0, 0.6670336723327637, 1615981284.0061634], "version": 0.2, "tvm_version": "0.8.dev0"}
{"input": ["opencl -keys=opencl,gpu -max_num_threads=256", "tutorial/conv2d_no_batching", [1, 14, 14, 512, 256, 3, 3, [2, 2], [1, 1, 1, 1]], {}], "config": {"index": 2901, "code_hash": null, "entity": [["tile_ic", "sp", [-1, 2, 4]], ["tile_oc", "sp", [-1, 32]], ["tile_ow", "sp", [-1, 1, 1]], ["tile_oh", "sp", [-1, 1, 2]]]}, "result": [[0.0005108698], 0, 1.3370311260223389, 1615981284.6596162], "version": 0.2, "tvm_version": "0.8.dev0"}
{"input": ["opencl -keys=opencl,gpu -max_num_threads=256", "tutorial/conv2d_no_batching", [1, 14, 14, 512, 256, 3, 3, [2, 2], [1, 1, 1, 1]], {}], "config": {"index": 3465, "code_hash": null, "entity": [["tile_ic", "sp", [-1, 2, 4]], ["tile_oc", "sp", [-1, 4]], ["tile_ow", "sp", [-1, 7, 1]], ["tile_oh", "sp", [-1, 2, 2]]]}, "result": [[0.0007677917999999999], 0, 2.049240827560425, 1615981285.3439848], "version": 0.2, "tvm_version": "0.8.dev0"}
{"input": ["opencl -keys=opencl,gpu -max_num_threads=256", "tutorial/conv2d_no_batching", [1, 14, 14, 512, 256, 3, 3, [2, 2], [1, 1, 1, 1]], {}], "config": {"index": 3029, "code_hash": null, "entity": [["tile_ic", "sp", [-1, 2, 4]], ["tile_oc", "sp", [-1, 32]], ["tile_ow", "sp", [-1, 8, 1]], ["tile_oh", "sp", [-1, 1, 2]]]}, "result": [[0.00039075519999999997], 0, 2.7504723072052, 1615981286.056263], "version": 0.2, "tvm_version": "0.8.dev0"}
{"input": ["opencl -keys=opencl,gpu -max_num_threads=256", "tutorial/conv2d_no_batching", [1, 14, 14, 512, 256, 3, 3, [2, 2], [1, 1, 1, 1]], {}], "config": {"index": 304, "code_hash": null, "entity": [["tile_ic", "sp", [-1, 1, 4]], ["tile_oc", "sp", [-1, 16]], ["tile_ow", "sp", [-1, 7, 2]], ["tile_oh", "sp", [-1, 1, 1]]]}, "result": [[0.0003727761], 0, 3.35676646232605, 1615981286.6910605], "version": 0.2, "tvm_version": "0.8.dev0"}
{"input": ["opencl -keys=opencl,gpu -max_num_threads=256", "tutorial/conv2d_no_batching", [1, 14, 14, 512, 256, 3, 3, [2, 2], [1, 1, 1, 1]], {}], "config": {"index": 753, "code_hash": null, "entity": [["tile_ic", "sp", [-1, 2, 4]], ["tile_oc", "sp", [-1, 16]], ["tile_ow", "sp", [-1, 4, 2]], ["tile_oh", "sp", [-1, 2, 1]]]}, "result": [[0.0006699272], 0, 4.072114944458008, 1615981287.3819537], "version": 0.2, "tvm_version": "0.8.dev0"}
{"input": ["opencl -keys=opencl,gpu -max_num_threads=256", "tutorial/conv2d_no_batching", [1, 14, 14, 512, 256, 3, 3, [2, 2], [1, 1, 1, 1]], {}], "config": {"index": 301, "code_hash": null, "entity": [["tile_ic", "sp", [-1, 2, 4]], ["tile_oc", "sp", [-1, 8]], ["tile_ow", "sp", [-1, 7, 2]], ["tile_oh", "sp", [-1, 1, 1]]]}, "result": [[0.0003281823], 0, 4.722311973571777, 1615981288.085552], "version": 0.2, "tvm_version": "0.8.dev0"}
{"input": ["opencl -keys=opencl,gpu -max_num_threads=256", "tutorial/conv2d_no_batching", [1, 14, 14, 512, 256, 3, 3, [2, 2], [1, 1, 1, 1]], {}], "config": {"index": 3477, "code_hash": null, "entity": [["tile_ic", "sp", [-1, 2, 4]], ["tile_oc", "sp", [-1, 32]], ["tile_ow", "sp", [-1, 7, 1]], ["tile_oh", "sp", [-1, 2, 2]]]}, "result": [[0.0007176615], 0, 5.451147556304932, 1615981288.762885], "version": 0.2, "tvm_version": "0.8.dev0"}
{"input": ["opencl -keys=opencl,gpu -max_num_threads=256", "tutorial/conv2d_no_batching", [1, 14, 14, 512, 256, 3, 3, [2, 2], [1, 1, 1, 1]], {}], "config": {"index": 4005, "code_hash": null, "entity": [["tile_ic", "sp", [-1, 2, 4]], ["tile_oc", "sp", [-1, 2]], ["tile_ow", "sp", [-1, 14, 1]], ["tile_oh", "sp", [-1, 4, 2]]]}, "result": [[0.0008275886], 0, 6.131477117538452, 1615981289.4486883], "version": 0.2, "tvm_version": "0.8.dev0"}
{"input": ["opencl -keys=opencl,gpu -max_num_threads=256", "tutorial/conv2d_no_batching", [1, 14, 14, 512, 256, 3, 3, [2, 2], [1, 1, 1, 1]], {}], "config": {"index": 177, "code_hash": null, "entity": [["tile_ic", "sp", [-1, 2, 4]], ["tile_oc", "sp", [-1, 16]], ["tile_ow", "sp", [-1, 14, 1]], ["tile_oh", "sp", [-1, 1, 1]]]}, "result": [[0.0008870314000000001], 0, 7.422665357589722, 1615981290.79552], "version": 0.2, "tvm_version": "0.8.dev0"}
{"input": ["opencl -keys=opencl,gpu -max_num_threads=256", "tutorial/conv2d_no_batching", [1, 14, 14, 512, 256, 3, 3, [2, 2], [1, 1, 1, 1]], {}], "config": {"index": 2992, "code_hash": null, "entity": [["tile_ic", "sp", [-1, 1, 4]], ["tile_oc", "sp", [-1, 16]], ["tile_ow", "sp", [-1, 7, 1]], ["tile_oh", "sp", [-1, 1, 2]]]}, "result": [[0.0003601823], 0, 6.773519039154053, 1615981290.1461291], "version": 0.2, "tvm_version": "0.8.dev0"}
{"input": ["opencl -keys=opencl,gpu -max_num_threads=256", "tutorial/conv2d_no_batching", [1, 14, 14, 512, 256, 3, 3, [2, 2], [1, 1, 1, 1]], {}], "config": {"index": 4457, "code_hash": null, "entity": [["tile_ic", "sp", [-1, 2, 4]], ["tile_oc", "sp", [-1, 4]], ["tile_ow", "sp", [-1, 8, 1]], ["tile_oh", "sp", [-1, 7, 2]]]}, "result": [[0.000470026], 0, 8.10892105102539, 1615981291.448455], "version": 0.2, "tvm_version": "0.8.dev0"}
{"input": ["opencl -keys=opencl,gpu -max_num_threads=256", "tutorial/conv2d_no_batching", [1, 14, 14, 512, 256, 3, 3, [2, 2], [1, 1, 1, 1]], {}], "config": {"index": 653, "code_hash": null, "entity": [["tile_ic", "sp", [-1, 2, 4]], ["tile_oc", "sp", [-1, 8]], ["tile_ow", "sp", [-1, 14, 1]], ["tile_oh", "sp", [-1, 2, 1]]]}, "result": [[0.0008862500000000001], 0, 8.77252984046936, 1615981292.1484513], "version": 0.2, "tvm_version": "0.8.dev0"}
{"input": ["opencl -keys=opencl,gpu -max_num_threads=256", "tutorial/conv2d_no_batching", [1, 14, 14, 512, 256, 3, 3, [2, 2], [1, 1, 1, 1]], {}], "config": {"index": 4393, "code_hash": null, "entity": [["tile_ic", "sp", [-1, 2, 4]], ["tile_oc", "sp", [-1, 4]], ["tile_ow", "sp", [-1, 4, 1]], ["tile_oh", "sp", [-1, 7, 2]]]}, "result": [[0.0004427292], 0, 9.427429437637329, 1615981292.7770905], "version": 0.2, "tvm_version": "0.8.dev0"}
{"input": ["opencl -keys=opencl,gpu -max_num_threads=256", "tutorial/conv2d_no_batching", [1, 14, 14, 512, 256, 3, 3, [2, 2], [1, 1, 1, 1]], {}], "config": {"index": 784, "code_hash": null, "entity": [["tile_ic", "sp", [-1, 1, 4]], ["tile_oc", "sp", [-1, 16]], ["tile_ow", "sp", [-1, 7, 2]], ["tile_oh", "sp", [-1, 2, 1]]]}, "result": [[0.0003483281], 0, 10.037214756011963, 1615981293.4210372], "version": 0.2, "tvm_version": "0.8.dev0"}
{"input": ["opencl -keys=opencl,gpu -max_num_threads=256", "tutorial/conv2d_no_batching", [1, 14, 14, 512, 256, 3, 3, [2, 2], [1, 1, 1, 1]], {}], "config": {"index": 3052, "code_hash": null, "entity": [["tile_ic", "sp", [-1, 1, 4]], ["tile_oc", "sp", [-1, 8]], ["tile_ow", "sp", [-1, 14, 1]], ["tile_oh", "sp", [-1, 1, 2]]]}, "result": [[0.0003610261], 0, 10.709143877029419, 1615981294.0968268], "version": 0.2, "tvm_version": "0.8.dev0"}
{"input": ["opencl -keys=opencl,gpu -max_num_threads=256", "tutorial/conv2d_no_batching", [1, 14, 14, 512, 256, 3, 3, [2, 2], [1, 1, 1, 1]], {}], "config": {"index": 4009, "code_hash": null, "entity": [["tile_ic", "sp", [-1, 2, 4]], ["tile_oc", "sp", [-1, 4]], ["tile_ow", "sp", [-1, 14, 1]], ["tile_oh", "sp", [-1, 4, 2]]]}, "result": [[0.0008340886000000001], 0, 11.435384273529053, 1615981294.7906704], "version": 0.2, "tvm_version": "0.8.dev0"}
{"input": ["opencl -keys=opencl,gpu -max_num_threads=256", "tutorial/conv2d_no_batching", [1, 14, 14, 512, 256, 3, 3, [2, 2], [1, 1, 1, 1]], {}], "config": {"index": 4425, "code_hash": null, "entity": [["tile_ic", "sp", [-1, 2, 4]], ["tile_oc", "sp", [-1, 4]], ["tile_ow", "sp", [-1, 7, 1]], ["tile_oh", "sp", [-1, 7, 2]]]}, "result": [[0.0003719324], 0, 12.072356939315796, 1615981295.4541104], "version": 0.2, "tvm_version": "0.8.dev0"}
{"input": ["opencl -keys=opencl,gpu -max_num_threads=256", "tutorial/conv2d_no_batching", [1, 14, 14, 512, 256, 3, 3, [2, 2], [1, 1, 1, 1]], {}], "config": {"index": 3469, "code_hash": null, "entity": [["tile_ic", "sp", [-1, 2, 4]], ["tile_oc", "sp", [-1, 8]], ["tile_ow", "sp", [-1, 7, 1]], ["tile_oh", "sp", [-1, 2, 2]]]}, "result": [[0.0007740835], 0, 12.83138632774353, 1615981296.1904247], "version": 0.2, "tvm_version": "0.8.dev0"}
{"input": ["opencl -keys=opencl,gpu -max_num_threads=256", "tutorial/conv2d_no_batching", [1, 14, 14, 512, 256, 3, 3, [2, 2], [1, 1, 1, 1]], {}], "config": {"index": 3525, "code_hash": null, "entity": [["tile_ic", "sp", [-1, 2, 4]], ["tile_oc", "sp", [-1, 2]], ["tile_ow", "sp", [-1, 14, 1]], ["tile_oh", "sp", [-1, 2, 2]]]}, "result": [[0.0007777293], 0, 13.501266717910767, 1615981296.8782341], "version": 0.2, "tvm_version": "0.8.dev0"}
{"input": ["opencl -keys=opencl,gpu -max_num_threads=256", "tutorial/conv2d_no_batching", [1, 14, 14, 512, 256, 3, 3, [2, 2], [1, 1, 1, 1]], {}], "config": {"index": 4485, "code_hash": null, "entity": [["tile_ic", "sp", [-1, 2, 4]], ["tile_oc", "sp", [-1, 2]], ["tile_ow", "sp", [-1, 14, 1]], ["tile_oh", "sp", [-1, 7, 2]]]}, "result": [[0.0003620105], 0, 0.6797020435333252, 1615981297.7981772], "version": 0.2, "tvm_version": "0.8.dev0"}
{"input": ["opencl -keys=opencl,gpu -max_num_threads=256", "tutorial/conv2d_no_batching", [1, 14, 14, 512, 256, 3, 3, [2, 2], [1, 1, 1, 1]], {}], "config": {"index": 2665, "code_hash": null, "entity": [["tile_ic", "sp", [-1, 2, 4]], ["tile_oc", "sp", [-1, 4]], ["tile_ow", "sp", [-1, 4, 2]], ["tile_oh", "sp", [-1, 14, 1]]]}, "result": [[0.0007559948999999999], 0, 1.405273675918579, 1615981298.5056303], "version": 0.2, "tvm_version": "0.8.dev0"}
{"input": ["opencl -keys=opencl,gpu -max_num_threads=256", "tutorial/conv2d_no_batching", [1, 14, 14, 512, 256, 3, 3, [2, 2], [1, 1, 1, 1]], {}], "config": {"index": 3053, "code_hash": null, "entity": [["tile_ic", "sp", [-1, 2, 4]], ["tile_oc", "sp", [-1, 8]], ["tile_ow", "sp", [-1, 14, 1]], ["tile_oh", "sp", [-1, 1, 2]]]}, "result": [[0.00033234380000000003], 0, 2.08980131149292, 1615981299.2224975], "version": 0.2, "tvm_version": "0.8.dev0"}
{"input": ["opencl -keys=opencl,gpu -max_num_threads=256", "tutorial/conv2d_no_batching", [1, 14, 14, 512, 256, 3, 3, [2, 2], [1, 1, 1, 1]], {}], "config": {"index": 776, "code_hash": null, "entity": [["tile_ic", "sp", [-1, 1, 4]], ["tile_oc", "sp", [-1, 4]], ["tile_ow", "sp", [-1, 7, 2]], ["tile_oh", "sp", [-1, 2, 1]]]}, "result": [[0.0004908751], 0, 2.7456722259521484, 1615981299.8877964], "version": 0.2, "tvm_version": "0.8.dev0"}
{"input": ["opencl -keys=opencl,gpu -max_num_threads=256", "tutorial/conv2d_no_batching", [1, 14, 14, 512, 256, 3, 3, [2, 2], [1, 1, 1, 1]], {}], "config": {"index": 649, "code_hash": null, "entity": [["tile_ic", "sp", [-1, 2, 4]], ["tile_oc", "sp", [-1, 4]], ["tile_ow", "sp", [-1, 14, 1]], ["tile_oh", "sp", [-1, 2, 1]]]}, "result": [[0.0009099062999999999], 0, 3.4331040382385254, 1615981300.5837064], "version": 0.2, "tvm_version": "0.8.dev0"}
{"input": ["opencl -keys=opencl,gpu -max_num_threads=256", "tutorial/conv2d_no_batching", [1, 14, 14, 512, 256, 3, 3, [2, 2], [1, 1, 1, 1]], {}], "config": {"index": 598, "code_hash": null, "entity": [["tile_ic", "sp", [-1, 4, 4]], ["tile_oc", "sp", [-1, 32]], ["tile_ow", "sp", [-1, 7, 1]], ["tile_oh", "sp", [-1, 2, 1]]]}, "result": [[0.0010660678], 0, 4.1368982791900635, 1615981301.2639196], "version": 0.2, "tvm_version": "0.8.dev0"}
{"input": ["opencl -keys=opencl,gpu -max_num_threads=256", "tutorial/conv2d_no_batching", [1, 14, 14, 512, 256, 3, 3, [2, 2], [1, 1, 1, 1]], {}], "config": {"index": 654, "code_hash": null, "entity": [["tile_ic", "sp", [-1, 4, 4]], ["tile_oc", "sp", [-1, 8]], ["tile_ow", "sp", [-1, 14, 1]], ["tile_oh", "sp", [-1, 2, 1]]]}, "result": [[0.0011767761], 0, 5.547524929046631, 1615981302.6859794], "version": 0.2, "tvm_version": "0.8.dev0"}
{"input": ["opencl -keys=opencl,gpu -max_num_threads=256", "tutorial/conv2d_no_batching", [1, 14, 14, 512, 256, 3, 3, [2, 2], [1, 1, 1, 1]], {}], "config": {"index": 3537, "code_hash": null, "entity": [["tile_ic", "sp", [-1, 2, 4]], ["tile_oc", "sp", [-1, 16]], ["tile_ow", "sp", [-1, 14, 1]], ["tile_oh", "sp", [-1, 2, 2]]]}, "result": [[0.0007347136], 0, 6.245747327804565, 1615981303.358928], "version": 0.2, "tvm_version": "0.8.dev0"}
{"input": ["opencl -keys=opencl,gpu -max_num_threads=256", "tutorial/conv2d_no_batching", [1, 14, 14, 512, 256, 3, 3, [2, 2], [1, 1, 1, 1]], {}], "config": {"index": 745, "code_hash": null, "entity": [["tile_ic", "sp", [-1, 2, 4]], ["tile_oc", "sp", [-1, 4]], ["tile_ow", "sp", [-1, 4, 2]], ["tile_oh", "sp", [-1, 2, 1]]]}, "result": [[0.0011743803000000001], 0, 4.845867156982422, 1615981301.959707], "version": 0.2, "tvm_version": "0.8.dev0"}
{"input": ["opencl -keys=opencl,gpu -max_num_threads=256", "tutorial/conv2d_no_batching", [1, 14, 14, 512, 256, 3, 3, [2, 2], [1, 1, 1, 1]], {}], "config": {"index": 4489, "code_hash": null, "entity": [["tile_ic", "sp", [-1, 2, 4]], ["tile_oc", "sp", [-1, 4]], ["tile_ow", "sp", [-1, 14, 1]], ["tile_oh", "sp", [-1, 7, 2]]]}, "result": [[0.0003317865], 0, 7.555395841598511, 1615981304.7110677], "version": 0.2, "tvm_version": "0.8.dev0"}
{"input": ["opencl -keys=opencl,gpu -max_num_threads=256", "tutorial/conv2d_no_batching", [1, 14, 14, 512, 256, 3, 3, [2, 2], [1, 1, 1, 1]], {}], "config": {"index": 820, "code_hash": null, "entity": [["tile_ic", "sp", [-1, 1, 4]], ["tile_oc", "sp", [-1, 32]], ["tile_ow", "sp", [-1, 1, 4]], ["tile_oh", "sp", [-1, 2, 1]]]}, "result": [[0.0003268334], 0, 6.85450291633606, 1615981304.001155], "version": 0.2, "tvm_version": "0.8.dev0"}
{"input": ["opencl -keys=opencl,gpu -max_num_threads=256", "tutorial/conv2d_no_batching", [1, 14, 14, 512, 256, 3, 3, [2, 2], [1, 1, 1, 1]], {}], "config": {"index": 3049, "code_hash": null, "entity": [["tile_ic", "sp", [-1, 2, 4]], ["tile_oc", "sp", [-1, 4]], ["tile_ow", "sp", [-1, 14, 1]], ["tile_oh", "sp", [-1, 1, 2]]]}, "result": [[0.000326349], 0, 8.188992977142334, 1615981305.350404], "version": 0.2, "tvm_version": "0.8.dev0"}
{"input": ["opencl -keys=opencl,gpu -max_num_threads=256", "tutorial/conv2d_no_batching", [1, 14, 14, 512, 256, 3, 3, [2, 2], [1, 1, 1, 1]], {}], "config": {"index": 2965, "code_hash": null, "entity": [["tile_ic", "sp", [-1, 2, 4]], ["tile_oc", "sp", [-1, 32]], ["tile_ow", "sp", [-1, 4, 1]], ["tile_oh", "sp", [-1, 1, 2]]]}, "result": [[0.0004048594], 0, 9.587767839431763, 1615981306.7344093], "version": 0.2, "tvm_version": "0.8.dev0"}
{"input": ["opencl -keys=opencl,gpu -max_num_threads=256", "tutorial/conv2d_no_batching", [1, 14, 14, 512, 256, 3, 3, [2, 2], [1, 1, 1, 1]], {}], "config": {"index": 5380, "code_hash": null, "entity": [["tile_ic", "sp", [-1, 1, 4]], ["tile_oc", "sp", [-1, 2]], ["tile_ow", "sp", [-1, 7, 1]], ["tile_oh", "sp", [-1, 2, 4]]]}, "result": [[0.0009002137], 0, 8.8644278049469, 1615981306.016736], "version": 0.2, "tvm_version": "0.8.dev0"}
{"input": ["opencl -keys=opencl,gpu -max_num_threads=256", "tutorial/conv2d_no_batching", [1, 14, 14, 512, 256, 3, 3, [2, 2], [1, 1, 1, 1]], {}], "config": {"index": 2213, "code_hash": null, "entity": [["tile_ic", "sp", [-1, 2, 4]], ["tile_oc", "sp", [-1, 2]], ["tile_ow", "sp", [-1, 7, 2]], ["tile_oh", "sp", [-1, 8, 1]]]}, "result": [[0.0004792553], 0, 10.238529682159424, 1615981307.3933306], "version": 0.2, "tvm_version": "0.8.dev0"}
{"input": ["opencl -keys=opencl,gpu -max_num_threads=256", "tutorial/conv2d_no_batching", [1, 14, 14, 512, 256, 3, 3, [2, 2], [1, 1, 1, 1]], {}], "config": {"index": 3377, "code_hash": null, "entity": [["tile_ic", "sp", [-1, 2, 4]], ["tile_oc", "sp", [-1, 16]], ["tile_ow", "sp", [-1, 1, 1]], ["tile_oh", "sp", [-1, 2, 2]]]}, "result": [[0.001223745], 0, 11.608309268951416, 1615981308.7637177], "version": 0.2, "tvm_version": "0.8.dev0"}
{"input": ["opencl -keys=opencl,gpu -max_num_threads=256", "tutorial/conv2d_no_batching", [1, 14, 14, 512, 256, 3, 3, [2, 2], [1, 1, 1, 1]], {}], "config": {"index": 173, "code_hash": null, "entity": [["tile_ic", "sp", [-1, 2, 4]], ["tile_oc", "sp", [-1, 8]], ["tile_ow", "sp", [-1, 14, 1]], ["tile_oh", "sp", [-1, 1, 1]]]}, "result": [[0.0009141459], 0, 12.224941968917847, 1615981309.4186294], "version": 0.2, "tvm_version": "0.8.dev0"}
{"input": ["opencl -keys=opencl,gpu -max_num_threads=256", "tutorial/conv2d_no_batching", [1, 14, 14, 512, 256, 3, 3, [2, 2], [1, 1, 1, 1]], {}], "config": {"index": 300, "code_hash": null, "entity": [["tile_ic", "sp", [-1, 1, 4]], ["tile_oc", "sp", [-1, 8]], ["tile_ow", "sp", [-1, 7, 2]], ["tile_oh", "sp", [-1, 1, 1]]]}, "result": [[0.0004999793], 0, 10.830277919769287, 1615981308.0244503], "version": 0.2, "tvm_version": "0.8.dev0"}
{"input": ["opencl -keys=opencl,gpu -max_num_threads=256", "tutorial/conv2d_no_batching", [1, 14, 14, 512, 256, 3, 3, [2, 2], [1, 1, 1, 1]], {}], "config": {"index": 213, "code_hash": null, "entity": [["tile_ic", "sp", [-1, 2, 4]], ["tile_oc", "sp", [-1, 32]], ["tile_ow", "sp", [-1, 1, 2]], ["tile_oh", "sp", [-1, 1, 1]]]}, "result": [[0.0005119949000000001], 0, 13.573822259902954, 1615981310.7635906], "version": 0.2, "tvm_version": "0.8.dev0"}
{"input": ["opencl -keys=opencl,gpu -max_num_threads=256", "tutorial/conv2d_no_batching", [1, 14, 14, 512, 256, 3, 3, [2, 2], [1, 1, 1, 1]], {}], "config": {"index": 884, "code_hash": null, "entity": [["tile_ic", "sp", [-1, 1, 4]], ["tile_oc", "sp", [-1, 32]], ["tile_ow", "sp", [-1, 1, 7]], ["tile_oh", "sp", [-1, 2, 1]]]}, "result": [[0.00032941670000000004], 0, 12.905702114105225, 1615981310.0879257], "version": 0.2, "tvm_version": "0.8.dev0"}
{"input": ["opencl -keys=opencl,gpu -max_num_threads=256", "tutorial/conv2d_no_batching", [1, 14, 14, 512, 256, 3, 3, [2, 2], [1, 1, 1, 1]], {}], "config": {"index": 313, "code_hash": null, "entity": [["tile_ic", "sp", [-1, 2, 4]], ["tile_oc", "sp", [-1, 64]], ["tile_ow", "sp", [-1, 7, 2]], ["tile_oh", "sp", [-1, 1, 1]]]}, "result": [[0.0002971927], 0, 0.7752397060394287, 1615981327.962462], "version": 0.2, "tvm_version": "0.8.dev0"}
{"input": ["opencl -keys=opencl,gpu -max_num_threads=256", "tutorial/conv2d_no_batching", [1, 14, 14, 512, 256, 3, 3, [2, 2], [1, 1, 1, 1]], {}], "config": {"index": 3001, "code_hash": null, "entity": [["tile_ic", "sp", [-1, 2, 4]], ["tile_oc", "sp", [-1, 64]], ["tile_ow", "sp", [-1, 7, 1]], ["tile_oh", "sp", [-1, 1, 2]]]}, "result": [[0.0002892031], 0, 1.4685049057006836, 1615981328.628754], "version": 0.2, "tvm_version": "0.8.dev0"}
{"input": ["opencl -keys=opencl,gpu -max_num_threads=256", "tutorial/conv2d_no_batching", [1, 14, 14, 512, 256, 3, 3, [2, 2], [1, 1, 1, 1]], {}], "config": {"index": 4616, "code_hash": null, "entity": [["tile_ic", "sp", [-1, 1, 4]], ["tile_oc", "sp", [-1, 4]], ["tile_ow", "sp", [-1, 7, 2]], ["tile_oh", "sp", [-1, 7, 2]]]}, "result": [[0.0003275678], 0, 2.070157051086426, 1615981329.2692869], "version": 0.2, "tvm_version": "0.8.dev0"}
{"input": ["opencl -keys=opencl,gpu -max_num_threads=256", "tutorial/conv2d_no_batching", [1, 14, 14, 512, 256, 3, 3, [2, 2], [1, 1, 1, 1]], {}], "config": {"index": 2937, "code_hash": null, "entity": [["tile_ic", "sp", [-1, 2, 4]], ["tile_oc", "sp", [-1, 64]], ["tile_ow", "sp", [-1, 2, 1]], ["tile_oh", "sp", [-1, 1, 2]]]}, "result": [[0.00029734900000000003], 0, 2.7661635875701904, 1615981329.9547455], "version": 0.2, "tvm_version": "0.8.dev0"}
{"input": ["opencl -keys=opencl,gpu -max_num_threads=256", "tutorial/conv2d_no_batching", [1, 14, 14, 512, 256, 3, 3, [2, 2], [1, 1, 1, 1]], {}], "config": {"index": 3192, "code_hash": null, "entity": [["tile_ic", "sp", [-1, 1, 4]], ["tile_oc", "sp", [-1, 64]], ["tile_ow", "sp", [-1, 7, 2]], ["tile_oh", "sp", [-1, 1, 2]]]}, "result": [[0.0002724428], 0, 3.3032872676849365, 1615981330.5110493], "version": 0.2, "tvm_version": "0.8.dev0"}
{"input": ["opencl -keys=opencl,gpu -max_num_threads=256", "tutorial/conv2d_no_batching", [1, 14, 14, 512, 256, 3, 3, [2, 2], [1, 1, 1, 1]], {}], "config": {"index": 3188, "code_hash": null, "entity": [["tile_ic", "sp", [-1, 1, 4]], ["tile_oc", "sp", [-1, 32]], ["tile_ow", "sp", [-1, 7, 2]], ["tile_oh", "sp", [-1, 1, 2]]]}, "result": [[0.0002780209], 0, 3.9650332927703857, 1615981331.1592743], "version": 0.2, "tvm_version": "0.8.dev0"}
{"input": ["opencl -keys=opencl,gpu -max_num_threads=256", "tutorial/conv2d_no_batching", [1, 14, 14, 512, 256, 3, 3, [2, 2], [1, 1, 1, 1]], {}], "config": {"index": 3060, "code_hash": null, "entity": [["tile_ic", "sp", [-1, 1, 4]], ["tile_oc", "sp", [-1, 32]], ["tile_ow", "sp", [-1, 14, 1]], ["tile_oh", "sp", [-1, 1, 2]]]}, "result": [[0.00033611460000000003], 0, 4.622620344161987, 1615981331.855571], "version": 0.2, "tvm_version": "0.8.dev0"}
{"input": ["opencl -keys=opencl,gpu -max_num_threads=256", "tutorial/conv2d_no_batching", [1, 14, 14, 512, 256, 3, 3, [2, 2], [1, 1, 1, 1]], {}], "config": {"index": 2693, "code_hash": null, "entity": [["tile_ic", "sp", [-1, 2, 4]], ["tile_oc", "sp", [-1, 2]], ["tile_ow", "sp", [-1, 7, 2]], ["tile_oh", "sp", [-1, 14, 1]]]}, "result": [[0.000390224], 0, 5.284140110015869, 1615981332.5096714], "version": 0.2, "tvm_version": "0.8.dev0"}
{"input": ["opencl -keys=opencl,gpu -max_num_threads=256", "tutorial/conv2d_no_batching", [1, 14, 14, 512, 256, 3, 3, [2, 2], [1, 1, 1, 1]], {}], "config": {"index": 2932, "code_hash": null, "entity": [["tile_ic", "sp", [-1, 1, 4]], ["tile_oc", "sp", [-1, 32]], ["tile_ow", "sp", [-1, 2, 1]], ["tile_oh", "sp", [-1, 1, 2]]]}, "result": [[0.0004362344], 0, 5.918745040893555, 1615981333.1661625], "version": 0.2, "tvm_version": "0.8.dev0"}
{"input": ["opencl -keys=opencl,gpu -max_num_threads=256", "tutorial/conv2d_no_batching", [1, 14, 14, 512, 256, 3, 3, [2, 2], [1, 1, 1, 1]], {}], "config": {"index": 3096, "code_hash": null, "entity": [["tile_ic", "sp", [-1, 1, 4]], ["tile_oc", "sp", [-1, 64]], ["tile_ow", "sp", [-1, 1, 2]], ["tile_oh", "sp", [-1, 1, 2]]]}, "result": [[0.0002728855], 0, 6.614408254623413, 1615981333.8532708], "version": 0.2, "tvm_version": "0.8.dev0"}
{"input": ["opencl -keys=opencl,gpu -max_num_threads=256", "tutorial/conv2d_no_batching", [1, 14, 14, 512, 256, 3, 3, [2, 2], [1, 1, 1, 1]], {}], "config": {"index": 6404, "code_hash": null, "entity": [["tile_ic", "sp", [-1, 1, 4]], ["tile_oc", "sp", [-1, 2]], ["tile_ow", "sp", [-1, 14, 1]], ["tile_oh", "sp", [-1, 2, 7]]]}, "result": [[0.0002963646], 0, 7.280433654785156, 1615981334.487326], "version": 0.2, "tvm_version": "0.8.dev0"}
{"input": ["opencl -keys=opencl,gpu -max_num_threads=256", "tutorial/conv2d_no_batching", [1, 14, 14, 512, 256, 3, 3, [2, 2], [1, 1, 1, 1]], {}], "config": {"index": 312, "code_hash": null, "entity": [["tile_ic", "sp", [-1, 1, 4]], ["tile_oc", "sp", [-1, 64]], ["tile_ow", "sp", [-1, 7, 2]], ["tile_oh", "sp", [-1, 1, 1]]]}, "result": [[0.0003712448], 0, 9.258882999420166, 1615981336.5259635], "version": 0.2, "tvm_version": "0.8.dev0"}
{"input": ["opencl -keys=opencl,gpu -max_num_threads=256", "tutorial/conv2d_no_batching", [1, 14, 14, 512, 256, 3, 3, [2, 2], [1, 1, 1, 1]], {}], "config": {"index": 344, "code_hash": null, "entity": [["tile_ic", "sp", [-1, 1, 4]], ["tile_oc", "sp", [-1, 64]], ["tile_ow", "sp", [-1, 1, 4]], ["tile_oh", "sp", [-1, 1, 1]]]}, "result": [[0.0003450678], 0, 7.9103310108184814, 1615981335.1606543], "version": 0.2, "tvm_version": "0.8.dev0"}
