test_and_tune/android.topinhw4c.log.tmp
{"input": ["opencl -keys=opencl,gpu -max_num_threads=256", "tutorial/conv2d_no_batching", [1, 40, 40, 512, 256, 1, 1, [1, 1], [0, 0]], {}], "config": {"index": 6741, "code_hash": null, "entity": [["tile_ic", "sp", [-1, 1, 4]], ["tile_oc", "sp", [-1, 8]], ["tile_ow", "sp", [-1, 5, 4]], ["tile_oh", "sp", [-1, 5, 2]]]}, "result": [[0.0053260370000000005], 0, 62.52800154685974, 1612238470.0683286], "version": 0.2, "tvm_version": "0.8.dev0"}
{"input": ["opencl -keys=opencl,gpu -max_num_threads=256", "tutorial/conv2d_no_batching", [1, 40, 40, 512, 256, 1, 1, [1, 1], [0, 0]], {}], "config": {"index": 12187, "code_hash": null, "entity": [["tile_ic", "sp", [-1, 1, 4]], ["tile_oc", "sp", [-1, 32]], ["tile_ow", "sp", [-1, 1, 2]], ["tile_oh", "sp", [-1, 20, 2]]]}, "result": [[0.006225198600000001], 0, 4.717526912689209, 1612238518.7152069], "version": 0.2, "tvm_version": "0.8.dev0"}
{"input": ["opencl -keys=opencl,gpu -max_num_threads=256", "tutorial/conv2d_no_batching", [1, 40, 40, 512, 256, 1, 1, [1, 1], [0, 0]], {}], "config": {"index": 12629, "code_hash": null, "entity": [["tile_ic", "sp", [-1, 2, 4]], ["tile_oc", "sp", [-1, 16]], ["tile_ow", "sp", [-1, 1, 4]], ["tile_oh", "sp", [-1, 20, 2]]]}, "result": [[0.0060905006], 0, 25.408135652542114, 1612238539.4069614], "version": 0.2, "tvm_version": "0.8.dev0"}
{"input": ["opencl -keys=opencl,gpu -max_num_threads=256", "tutorial/conv2d_no_batching", [1, 40, 40, 512, 256, 1, 1, [1, 1], [0, 0]], {}], "config": {"index": 12628, "code_hash": null, "entity": [["tile_ic", "sp", [-1, 1, 4]], ["tile_oc", "sp", [-1, 16]], ["tile_ow", "sp", [-1, 1, 4]], ["tile_oh", "sp", [-1, 20, 2]]]}, "result": [[0.0060060527], 0, 4.991399765014648, 1612238641.3808825], "version": 0.2, "tvm_version": "0.8.dev0"}
{"input": ["opencl -keys=opencl,gpu -max_num_threads=256", "tutorial/conv2d_no_batching", [1, 40, 40, 512, 256, 1, 1, [1, 1], [0, 0]], {}], "config": {"index": 12621, "code_hash": null, "entity": [["tile_ic", "sp", [-1, 1, 4]], ["tile_oc", "sp", [-1, 8]], ["tile_ow", "sp", [-1, 1, 4]], ["tile_oh", "sp", [-1, 20, 2]]]}, "result": [[0.0062140475], 0, 9.976324558258057, 1612238646.432755], "version": 0.2, "tvm_version": "0.8.dev0"}
{"input": ["opencl -keys=opencl,gpu -max_num_threads=256", "tutorial/conv2d_no_batching", [1, 40, 40, 512, 256, 1, 1, [1, 1], [0, 0]], {}], "config": {"index": 12684, "code_hash": null, "entity": [["tile_ic", "sp", [-1, 1, 4]], ["tile_oc", "sp", [-1, 16]], ["tile_ow", "sp", [-1, 2, 4]], ["tile_oh", "sp", [-1, 20, 2]]]}, "result": [[0.0057003287], 0, 20.108848810195923, 1612238656.5130887], "version": 0.2, "tvm_version": "0.8.dev0"}
{"input": ["opencl -keys=opencl,gpu -max_num_threads=256", "tutorial/conv2d_no_batching", [1, 40, 40, 512, 256, 1, 1, [1, 1], [0, 0]], {}], "config": {"index": 12635, "code_hash": null, "entity": [["tile_ic", "sp", [-1, 1, 4]], ["tile_oc", "sp", [-1, 32]], ["tile_ow", "sp", [-1, 1, 4]], ["tile_oh", "sp", [-1, 20, 2]]]}, "result": [[0.005916349600000001], 0, 15.034383058547974, 1612238651.4989865], "version": 0.2, "tvm_version": "0.8.dev0"}
{"input": ["opencl -keys=opencl,gpu -max_num_threads=256", "tutorial/conv2d_no_batching", [1, 40, 40, 512, 256, 1, 1, [1, 1], [0, 0]], {}], "config": {"index": 12789, "code_hash": null, "entity": [["tile_ic", "sp", [-1, 1, 4]], ["tile_oc", "sp", [-1, 8]], ["tile_ow", "sp", [-1, 5, 4]], ["tile_oh", "sp", [-1, 20, 2]]]}, "result": [[0.0063869277], 0, 25.104369401931763, 1612238661.5772533], "version": 0.2, "tvm_version": "0.8.dev0"}
{"input": ["opencl -keys=opencl,gpu -max_num_threads=256", "tutorial/conv2d_no_batching", [1, 40, 40, 512, 256, 1, 1, [1, 1], [0, 0]], {}], "config": {"index": 12677, "code_hash": null, "entity": [["tile_ic", "sp", [-1, 1, 4]], ["tile_oc", "sp", [-1, 8]], ["tile_ow", "sp", [-1, 2, 4]], ["tile_oh", "sp", [-1, 20, 2]]]}, "result": [[0.0058236099], 0, 35.0748393535614, 1612238671.574574], "version": 0.2, "tvm_version": "0.8.dev0"}
{"input": ["opencl -keys=opencl,gpu -max_num_threads=256", "tutorial/conv2d_no_batching", [1, 40, 40, 512, 256, 1, 1, [1, 1], [0, 0]], {}], "config": {"index": 21308, "code_hash": null, "entity": [["tile_ic", "sp", [-1, 1, 4]], ["tile_oc", "sp", [-1, 16]], ["tile_ow", "sp", [-1, 2, 2]], ["tile_oh", "sp", [-1, 10, 4]]]}, "result": [[0.0025712555000000003], 0, 29.90307927131653, 1612238666.4514527], "version": 0.2, "tvm_version": "0.8.dev0"}
{"input": ["opencl -keys=opencl,gpu -max_num_threads=256", "tutorial/conv2d_no_batching", [1, 40, 40, 512, 256, 1, 1, [1, 1], [0, 0]], {}], "config": {"index": 21252, "code_hash": null, "entity": [["tile_ic", "sp", [-1, 1, 4]], ["tile_oc", "sp", [-1, 16]], ["tile_ow", "sp", [-1, 1, 2]], ["tile_oh", "sp", [-1, 10, 4]]]}, "result": [[0.0030072451], 0, 4.648057222366333, 1612238677.047703], "version": 0.2, "tvm_version": "0.8.dev0"}
{"input": ["opencl -keys=opencl,gpu -max_num_threads=256", "tutorial/conv2d_no_batching", [1, 40, 40, 512, 256, 1, 1, [1, 1], [0, 0]], {}], "config": {"index": 21301, "code_hash": null, "entity": [["tile_ic", "sp", [-1, 1, 4]], ["tile_oc", "sp", [-1, 8]], ["tile_ow", "sp", [-1, 2, 2]], ["tile_oh", "sp", [-1, 10, 4]]]}, "result": [[0.002956495], 0, 19.48288655281067, 1612238691.876366], "version": 0.2, "tvm_version": "0.8.dev0"}
{"input": ["opencl -keys=opencl,gpu -max_num_threads=256", "tutorial/conv2d_no_batching", [1, 40, 40, 512, 256, 1, 1, [1, 1], [0, 0]], {}], "config": {"index": 21245, "code_hash": null, "entity": [["tile_ic", "sp", [-1, 1, 4]], ["tile_oc", "sp", [-1, 8]], ["tile_ow", "sp", [-1, 1, 2]], ["tile_oh", "sp", [-1, 10, 4]]]}, "result": [[0.0040102764], 0, 9.657928466796875, 1612238682.0620306], "version": 0.2, "tvm_version": "0.8.dev0"}
{"input": ["opencl -keys=opencl,gpu -max_num_threads=256", "tutorial/conv2d_no_batching", [1, 40, 40, 512, 256, 1, 1, [1, 1], [0, 0]], {}], "config": {"index": 21364, "code_hash": null, "entity": [["tile_ic", "sp", [-1, 1, 4]], ["tile_oc", "sp", [-1, 16]], ["tile_ow", "sp", [-1, 4, 2]], ["tile_oh", "sp", [-1, 10, 4]]]}, "result": [[0.0049238234], 0, 24.591345071792603, 1612238697.0196939], "version": 0.2, "tvm_version": "0.8.dev0"}
{"input": ["opencl -keys=opencl,gpu -max_num_threads=256", "tutorial/conv2d_no_batching", [1, 40, 40, 512, 256, 1, 1, [1, 1], [0, 0]], {}], "config": {"index": 21357, "code_hash": null, "entity": [["tile_ic", "sp", [-1, 1, 4]], ["tile_oc", "sp", [-1, 8]], ["tile_ow", "sp", [-1, 4, 2]], ["tile_oh", "sp", [-1, 10, 4]]]}, "result": [[0.005067406700000001], 0, 14.604668855667114, 1612238687.0504658], "version": 0.2, "tvm_version": "0.8.dev0"}
{"input": ["opencl -keys=opencl,gpu -max_num_threads=256", "tutorial/conv2d_no_batching", [1, 40, 40, 512, 256, 1, 1, [1, 1], [0, 0]], {}], "config": {"index": 21266, "code_hash": null, "entity": [["tile_ic", "sp", [-1, 1, 4]], ["tile_oc", "sp", [-1, 64]], ["tile_ow", "sp", [-1, 1, 2]], ["tile_oh", "sp", [-1, 10, 4]]]}, "result": [[0.0025453909], 0, 29.569178819656372, 1612238702.0319972], "version": 0.2, "tvm_version": "0.8.dev0"}
{"input": ["opencl -keys=opencl,gpu -max_num_threads=256", "tutorial/conv2d_no_batching", [1, 40, 40, 512, 256, 1, 1, [1, 1], [0, 0]], {}], "config": {"index": 21315, "code_hash": null, "entity": [["tile_ic", "sp", [-1, 1, 4]], ["tile_oc", "sp", [-1, 32]], ["tile_ow", "sp", [-1, 2, 2]], ["tile_oh", "sp", [-1, 10, 4]]]}, "result": [[0.0026450054], 0, 4.613950729370117, 1612238707.402966], "version": 0.2, "tvm_version": "0.8.dev0"}
{"input": ["opencl -keys=opencl,gpu -max_num_threads=256", "tutorial/conv2d_no_batching", [1, 40, 40, 512, 256, 1, 1, [1, 1], [0, 0]], {}], "config": {"index": 21259, "code_hash": null, "entity": [["tile_ic", "sp", [-1, 1, 4]], ["tile_oc", "sp", [-1, 32]], ["tile_ow", "sp", [-1, 1, 2]], ["tile_oh", "sp", [-1, 10, 4]]]}, "result": [[0.0026670524], 0, 9.477187156677246, 1612238712.2691925], "version": 0.2, "tvm_version": "0.8.dev0"}
{"input": ["opencl -keys=opencl,gpu -max_num_threads=256", "tutorial/conv2d_no_batching", [1, 40, 40, 512, 256, 1, 1, [1, 1], [0, 0]], {}], "config": {"index": 21525, "code_hash": null, "entity": [["tile_ic", "sp", [-1, 1, 4]], ["tile_oc", "sp", [-1, 8]], ["tile_ow", "sp", [-1, 10, 2]], ["tile_oh", "sp", [-1, 10, 4]]]}, "result": [[0.006129885999999999], 0, 14.601991176605225, 1612238717.4027815], "version": 0.2, "tvm_version": "0.8.dev0"}
{"input": ["opencl -keys=opencl,gpu -max_num_threads=256", "tutorial/conv2d_no_batching", [1, 40, 40, 512, 256, 1, 1, [1, 1], [0, 0]], {}], "config": {"index": 21413, "code_hash": null, "entity": [["tile_ic", "sp", [-1, 1, 4]], ["tile_oc", "sp", [-1, 8]], ["tile_ow", "sp", [-1, 5, 2]], ["tile_oh", "sp", [-1, 10, 4]]]}, "result": [[0.0056255786], 0, 19.64146399497986, 1612238722.4559321], "version": 0.2, "tvm_version": "0.8.dev0"}
{"input": ["opencl -keys=opencl,gpu -max_num_threads=256", "tutorial/conv2d_no_batching", [1, 40, 40, 512, 256, 1, 1, [1, 1], [0, 0]], {}], "config": {"index": 12236, "code_hash": null, "entity": [["tile_ic", "sp", [-1, 1, 4]], ["tile_oc", "sp", [-1, 16]], ["tile_ow", "sp", [-1, 2, 2]], ["tile_oh", "sp", [-1, 20, 2]]]}, "result": [[0.0020044117], 0, 43.77095651626587, 1612238788.4670274], "version": 0.2, "tvm_version": "0.8.dev0"}
{"input": ["opencl -keys=opencl,gpu -max_num_threads=256", "tutorial/conv2d_no_batching", [1, 40, 40, 512, 256, 1, 1, [1, 1], [0, 0]], {}], "config": {"index": 12180, "code_hash": null, "entity": [["tile_ic", "sp", [-1, 1, 4]], ["tile_oc", "sp", [-1, 16]], ["tile_ow", "sp", [-1, 1, 2]], ["tile_oh", "sp", [-1, 20, 2]]]}, "result": [[0.0020487919], 0, 48.70197796821594, 1612238793.4256313], "version": 0.2, "tvm_version": "0.8.dev0"}
{"input": ["opencl -keys=opencl,gpu -max_num_threads=256", "tutorial/conv2d_no_batching", [1, 40, 40, 512, 256, 1, 1, [1, 1], [0, 0]], {}], "config": {"index": 12173, "code_hash": null, "entity": [["tile_ic", "sp", [-1, 1, 4]], ["tile_oc", "sp", [-1, 8]], ["tile_ow", "sp", [-1, 1, 2]], ["tile_oh", "sp", [-1, 20, 2]]]}, "result": [[0.0023350106], 0, 58.51358890533447, 1612238803.2457294], "version": 0.2, "tvm_version": "0.8.dev0"}
{"input": ["opencl -keys=opencl,gpu -max_num_threads=256", "tutorial/conv2d_no_batching", [1, 40, 40, 512, 256, 1, 1, [1, 1], [0, 0]], {}], "config": {"index": 12229, "code_hash": null, "entity": [["tile_ic", "sp", [-1, 1, 4]], ["tile_oc", "sp", [-1, 8]], ["tile_ow", "sp", [-1, 2, 2]], ["tile_oh", "sp", [-1, 20, 2]]]}, "result": [[0.0020001773000000002], 0, 53.603939056396484, 1612238798.343056], "version": 0.2, "tvm_version": "0.8.dev0"}
{"input": ["opencl -keys=opencl,gpu -max_num_threads=256", "tutorial/conv2d_no_batching", [1, 40, 40, 512, 256, 1, 1, [1, 1], [0, 0]], {}], "config": {"index": 12285, "code_hash": null, "entity": [["tile_ic", "sp", [-1, 1, 4]], ["tile_oc", "sp", [-1, 8]], ["tile_ow", "sp", [-1, 4, 2]], ["tile_oh", "sp", [-1, 20, 2]]]}, "result": [[0.0022624689], 0, 73.68033766746521, 1612238818.449501], "version": 0.2, "tvm_version": "0.8.dev0"}
{"input": ["opencl -keys=opencl,gpu -max_num_threads=256", "tutorial/conv2d_no_batching", [1, 40, 40, 512, 256, 1, 1, [1, 1], [0, 0]], {}], "config": {"index": 18284, "code_hash": null, "entity": [["tile_ic", "sp", [-1, 1, 4]], ["tile_oc", "sp", [-1, 16]], ["tile_ow", "sp", [-1, 2, 2]], ["tile_oh", "sp", [-1, 5, 4]]]}, "result": [[0.0025022607], 0, 63.430394411087036, 1612238808.1749406], "version": 0.2, "tvm_version": "0.8.dev0"}
{"input": ["opencl -keys=opencl,gpu -max_num_threads=256", "tutorial/conv2d_no_batching", [1, 40, 40, 512, 256, 1, 1, [1, 1], [0, 0]], {}], "config": {"index": 10717, "code_hash": null, "entity": [["tile_ic", "sp", [-1, 1, 4]], ["tile_oc", "sp", [-1, 8]], ["tile_ow", "sp", [-1, 2, 2]], ["tile_oh", "sp", [-1, 16, 2]]]}, "result": [[0.005858787], 0, 4.586487770080566, 1612238867.2013555], "version": 0.2, "tvm_version": "0.8.dev0"}
{"input": ["opencl -keys=opencl,gpu -max_num_threads=256", "tutorial/conv2d_no_batching", [1, 40, 40, 512, 256, 1, 1, [1, 1], [0, 0]], {}], "config": {"index": 9212, "code_hash": null, "entity": [["tile_ic", "sp", [-1, 1, 4]], ["tile_oc", "sp", [-1, 16]], ["tile_ow", "sp", [-1, 2, 2]], ["tile_oh", "sp", [-1, 10, 2]]]}, "result": [[0.0019428439], 0, 9.249194622039795, 1612238871.90962], "version": 0.2, "tvm_version": "0.8.dev0"}
{"input": ["opencl -keys=opencl,gpu -max_num_threads=256", "tutorial/conv2d_no_batching", [1, 40, 40, 512, 256, 1, 1, [1, 1], [0, 0]], {}], "config": {"index": 9261, "code_hash": null, "entity": [["tile_ic", "sp", [-1, 1, 4]], ["tile_oc", "sp", [-1, 8]], ["tile_ow", "sp", [-1, 4, 2]], ["tile_oh", "sp", [-1, 10, 2]]]}, "result": [[0.0021913231], 0, 14.062370300292969, 1612238876.7589798], "version": 0.2, "tvm_version": "0.8.dev0"}
{"input": ["opencl -keys=opencl,gpu -max_num_threads=256", "tutorial/conv2d_no_batching", [1, 40, 40, 512, 256, 1, 1, [1, 1], [0, 0]], {}], "config": {"index": 9205, "code_hash": null, "entity": [["tile_ic", "sp", [-1, 1, 4]], ["tile_oc", "sp", [-1, 8]], ["tile_ow", "sp", [-1, 2, 2]], ["tile_oh", "sp", [-1, 10, 2]]]}, "result": [[0.0022634168999999997], 0, 24.023574590682983, 1612238886.6915135], "version": 0.2, "tvm_version": "0.8.dev0"}
{"input": ["opencl -keys=opencl,gpu -max_num_threads=256", "tutorial/conv2d_no_batching", [1, 40, 40, 512, 256, 1, 1, [1, 1], [0, 0]], {}], "config": {"index": 12237, "code_hash": null, "entity": [["tile_ic", "sp", [-1, 2, 4]], ["tile_oc", "sp", [-1, 16]], ["tile_ow", "sp", [-1, 2, 2]], ["tile_oh", "sp", [-1, 20, 2]]]}, "result": [[0.0023867294], 0, 28.958086013793945, 1612238891.61279], "version": 0.2, "tvm_version": "0.8.dev0"}
{"input": ["opencl -keys=opencl,gpu -max_num_threads=256", "tutorial/conv2d_no_batching", [1, 40, 40, 512, 256, 1, 1, [1, 1], [0, 0]], {}], "config": {"index": 7700, "code_hash": null, "entity": [["tile_ic", "sp", [-1, 1, 4]], ["tile_oc", "sp", [-1, 16]], ["tile_ow", "sp", [-1, 2, 2]], ["tile_oh", "sp", [-1, 8, 2]]]}, "result": [[0.0043853442], 0, 19.13498592376709, 1612238881.7995458], "version": 0.2, "tvm_version": "0.8.dev0"}
{"input": ["opencl -keys=opencl,gpu -max_num_threads=256", "tutorial/conv2d_no_batching", [1, 40, 40, 512, 256, 1, 1, [1, 1], [0, 0]], {}], "config": {"index": 12181, "code_hash": null, "entity": [["tile_ic", "sp", [-1, 2, 4]], ["tile_oc", "sp", [-1, 16]], ["tile_ow", "sp", [-1, 1, 2]], ["tile_oh", "sp", [-1, 20, 2]]]}, "result": [[0.0025379742], 0, 33.876954555511475, 1612238896.572174], "version": 0.2, "tvm_version": "0.8.dev0"}
{"input": ["opencl -keys=opencl,gpu -max_num_threads=256", "tutorial/conv2d_no_batching", [1, 40, 40, 512, 256, 1, 1, [1, 1], [0, 0]], {}], "config": {"index": 9213, "code_hash": null, "entity": [["tile_ic", "sp", [-1, 2, 4]], ["tile_oc", "sp", [-1, 16]], ["tile_ow", "sp", [-1, 2, 2]], ["tile_oh", "sp", [-1, 10, 2]]]}, "result": [[0.0022918909000000003], 0, 38.91069722175598, 1612238901.6203594], "version": 0.2, "tvm_version": "0.8.dev0"}
{"input": ["opencl -keys=opencl,gpu -max_num_threads=256", "tutorial/conv2d_no_batching", [1, 40, 40, 512, 256, 1, 1, [1, 1], [0, 0]], {}], "config": {"index": 12230, "code_hash": null, "entity": [["tile_ic", "sp", [-1, 2, 4]], ["tile_oc", "sp", [-1, 8]], ["tile_ow", "sp", [-1, 2, 2]], ["tile_oh", "sp", [-1, 20, 2]]]}, "result": [[0.0023716096], 0, 43.765355348587036, 1612238906.5141313], "version": 0.2, "tvm_version": "0.8.dev0"}
{"input": ["opencl -keys=opencl,gpu -max_num_threads=256", "tutorial/conv2d_no_batching", [1, 40, 40, 512, 256, 1, 1, [1, 1], [0, 0]], {}], "config": {"index": 9156, "code_hash": null, "entity": [["tile_ic", "sp", [-1, 1, 4]], ["tile_oc", "sp", [-1, 16]], ["tile_ow", "sp", [-1, 1, 2]], ["tile_oh", "sp", [-1, 10, 2]]]}, "result": [[0.0022039221], 0, 48.58252429962158, 1612238911.3424294], "version": 0.2, "tvm_version": "0.8.dev0"}
{"input": ["opencl -keys=opencl,gpu -max_num_threads=256", "tutorial/conv2d_no_batching", [1, 40, 40, 512, 256, 1, 1, [1, 1], [0, 0]], {}], "config": {"index": 7693, "code_hash": null, "entity": [["tile_ic", "sp", [-1, 1, 4]], ["tile_oc", "sp", [-1, 8]], ["tile_ow", "sp", [-1, 2, 2]], ["tile_oh", "sp", [-1, 8, 2]]]}, "result": [[0.004718943099999999], 0, 53.453375816345215, 1612238916.1863005], "version": 0.2, "tvm_version": "0.8.dev0"}
{"input": ["opencl -keys=opencl,gpu -max_num_threads=256", "tutorial/conv2d_no_batching", [1, 40, 40, 512, 256, 1, 1, [1, 1], [0, 0]], {}], "config": {"index": 7749, "code_hash": null, "entity": [["tile_ic", "sp", [-1, 1, 4]], ["tile_oc", "sp", [-1, 8]], ["tile_ow", "sp", [-1, 4, 2]], ["tile_oh", "sp", [-1, 8, 2]]]}, "result": [[0.0045209536000000005], 0, 63.2971727848053, 1612238926.0561445], "version": 0.2, "tvm_version": "0.8.dev0"}
{"input": ["opencl -keys=opencl,gpu -max_num_threads=256", "tutorial/conv2d_no_batching", [1, 40, 40, 512, 256, 1, 1, [1, 1], [0, 0]], {}], "config": {"index": 10718, "code_hash": null, "entity": [["tile_ic", "sp", [-1, 2, 4]], ["tile_oc", "sp", [-1, 8]], ["tile_ow", "sp", [-1, 2, 2]], ["tile_oh", "sp", [-1, 16, 2]]]}, "result": [[0.0061941934], 0, 58.53558802604675, 1612238921.2762253], "version": 0.2, "tvm_version": "0.8.dev0"}
{"input": ["opencl -keys=opencl,gpu -max_num_threads=256", "tutorial/conv2d_no_batching", [1, 40, 40, 512, 256, 1, 1, [1, 1], [0, 0]], {}], "config": {"index": 4676, "code_hash": null, "entity": [["tile_ic", "sp", [-1, 1, 4]], ["tile_oc", "sp", [-1, 16]], ["tile_ow", "sp", [-1, 2, 2]], ["tile_oh", "sp", [-1, 4, 2]]]}, "result": [[0.0020191409], 0, 67.98091697692871, 1612238930.779306], "version": 0.2, "tvm_version": "0.8.dev0"}
{"input": ["opencl -keys=opencl,gpu -max_num_threads=256", "tutorial/conv2d_no_batching", [1, 40, 40, 512, 256, 1, 1, [1, 1], [0, 0]], {}], "config": {"index": 6188, "code_hash": null, "entity": [["tile_ic", "sp", [-1, 1, 4]], ["tile_oc", "sp", [-1, 16]], ["tile_ow", "sp", [-1, 2, 2]], ["tile_oh", "sp", [-1, 5, 2]]]}, "result": [[0.002224521], 0, 72.9678144454956, 1612238935.7734761], "version": 0.2, "tvm_version": "0.8.dev0"}
{"input": ["opencl -keys=opencl,gpu -max_num_threads=256", "tutorial/conv2d_no_batching", [1, 40, 40, 512, 256, 1, 1, [1, 1], [0, 0]], {}], "config": {"index": 10766, "code_hash": null, "entity": [["tile_ic", "sp", [-1, 1, 4]], ["tile_oc", "sp", [-1, 4]], ["tile_ow", "sp", [-1, 4, 2]], ["tile_oh", "sp", [-1, 16, 2]]]}, "result": [[0.0058374016], 0, 77.87985587120056, 1612238940.6831782], "version": 0.2, "tvm_version": "0.8.dev0"}
{"input": ["opencl -keys=opencl,gpu -max_num_threads=256", "tutorial/conv2d_no_batching", [1, 40, 40, 512, 256, 1, 1, [1, 1], [0, 0]], {}], "config": {"index": 10668, "code_hash": null, "entity": [["tile_ic", "sp", [-1, 1, 4]], ["tile_oc", "sp", [-1, 16]], ["tile_ow", "sp", [-1, 1, 2]], ["tile_oh", "sp", [-1, 16, 2]]]}, "result": [[0.0057289432], 0, 4.686870813369751, 1612238946.2281868], "version": 0.2, "tvm_version": "0.8.dev0"}
{"input": ["opencl -keys=opencl,gpu -max_num_threads=256", "tutorial/conv2d_no_batching", [1, 40, 40, 512, 256, 1, 1, [1, 1], [0, 0]], {}], "config": {"index": 10773, "code_hash": null, "entity": [["tile_ic", "sp", [-1, 1, 4]], ["tile_oc", "sp", [-1, 8]], ["tile_ow", "sp", [-1, 4, 2]], ["tile_oh", "sp", [-1, 16, 2]]]}, "result": [[0.005861537], 0, 9.792322635650635, 1612238951.3595266], "version": 0.2, "tvm_version": "0.8.dev0"}
{"input": ["opencl -keys=opencl,gpu -max_num_threads=256", "tutorial/conv2d_no_batching", [1, 40, 40, 512, 256, 1, 1, [1, 1], [0, 0]], {}], "config": {"index": 10724, "code_hash": null, "entity": [["tile_ic", "sp", [-1, 1, 4]], ["tile_oc", "sp", [-1, 16]], ["tile_ow", "sp", [-1, 2, 2]], ["tile_oh", "sp", [-1, 16, 2]]]}, "result": [[0.0054737349], 0, 14.829504489898682, 1612238956.3891041], "version": 0.2, "tvm_version": "0.8.dev0"}
{"input": ["opencl -keys=opencl,gpu -max_num_threads=256", "tutorial/conv2d_no_batching", [1, 40, 40, 512, 256, 1, 1, [1, 1], [0, 0]], {}], "config": {"index": 10661, "code_hash": null, "entity": [["tile_ic", "sp", [-1, 1, 4]], ["tile_oc", "sp", [-1, 8]], ["tile_ow", "sp", [-1, 1, 2]], ["tile_oh", "sp", [-1, 16, 2]]]}, "result": [[0.0059164485], 0, 19.79044485092163, 1612238961.3587642], "version": 0.2, "tvm_version": "0.8.dev0"}
{"input": ["opencl -keys=opencl,gpu -max_num_threads=256", "tutorial/conv2d_no_batching", [1, 40, 40, 512, 256, 1, 1, [1, 1], [0, 0]], {}], "config": {"index": 6132, "code_hash": null, "entity": [["tile_ic", "sp", [-1, 1, 4]], ["tile_oc", "sp", [-1, 16]], ["tile_ow", "sp", [-1, 1, 2]], ["tile_oh", "sp", [-1, 5, 2]]]}, "result": [[0.0028524222], 0, 24.751723051071167, 1612238966.3259923], "version": 0.2, "tvm_version": "0.8.dev0"}
{"input": ["opencl -keys=opencl,gpu -max_num_threads=256", "tutorial/conv2d_no_batching", [1, 40, 40, 512, 256, 1, 1, [1, 1], [0, 0]], {}], "config": {"index": 4620, "code_hash": null, "entity": [["tile_ic", "sp", [-1, 1, 4]], ["tile_oc", "sp", [-1, 16]], ["tile_ow", "sp", [-1, 1, 2]], ["tile_oh", "sp", [-1, 4, 2]]]}, "result": [[0.0020371148], 0, 29.500465869903564, 1612238971.1095161], "version": 0.2, "tvm_version": "0.8.dev0"}
{"input": ["opencl -keys=opencl,gpu -max_num_threads=256", "tutorial/conv2d_no_batching", [1, 40, 40, 512, 256, 1, 1, [1, 1], [0, 0]], {}], "config": {"index": 12278, "code_hash": null, "entity": [["tile_ic", "sp", [-1, 1, 4]], ["tile_oc", "sp", [-1, 4]], ["tile_ow", "sp", [-1, 4, 2]], ["tile_oh", "sp", [-1, 20, 2]]]}, "result": [[0.0023224689999999997], 0, 34.291141748428345, 1612238975.9111648], "version": 0.2, "tvm_version": "0.8.dev0"}
{"input": ["opencl -keys=opencl,gpu -max_num_threads=256", "tutorial/conv2d_no_batching", [1, 40, 40, 512, 256, 1, 1, [1, 1], [0, 0]], {}], "config": {"index": 9149, "code_hash": null, "entity": [["tile_ic", "sp", [-1, 1, 4]], ["tile_oc", "sp", [-1, 8]], ["tile_ow", "sp", [-1, 1, 2]], ["tile_oh", "sp", [-1, 10, 2]]]}, "result": [[0.0031368701], 0, 39.240379095077515, 1612238980.8702738], "version": 0.2, "tvm_version": "0.8.dev0"}
{"input": ["opencl -keys=opencl,gpu -max_num_threads=256", "tutorial/conv2d_no_batching", [1, 40, 40, 512, 256, 1, 1, [1, 1], [0, 0]], {}], "config": {"index": 7637, "code_hash": null, "entity": [["tile_ic", "sp", [-1, 1, 4]], ["tile_oc", "sp", [-1, 8]], ["tile_ow", "sp", [-1, 1, 2]], ["tile_oh", "sp", [-1, 8, 2]]]}, "result": [[0.0045931463], 0, 44.27624773979187, 1612238985.8558774], "version": 0.2, "tvm_version": "0.8.dev0"}
{"input": ["opencl -keys=opencl,gpu -max_num_threads=256", "tutorial/conv2d_no_batching", [1, 40, 40, 512, 256, 1, 1, [1, 1], [0, 0]], {}], "config": {"index": 9268, "code_hash": null, "entity": [["tile_ic", "sp", [-1, 1, 4]], ["tile_oc", "sp", [-1, 16]], ["tile_ow", "sp", [-1, 4, 2]], ["tile_oh", "sp", [-1, 10, 2]]]}, "result": [[0.0021078387], 0, 53.765342712402344, 1612238995.398715], "version": 0.2, "tvm_version": "0.8.dev0"}
{"input": ["opencl -keys=opencl,gpu -max_num_threads=256", "tutorial/conv2d_no_batching", [1, 40, 40, 512, 256, 1, 1, [1, 1], [0, 0]], {}], "config": {"index": 18242, "code_hash": null, "entity": [["tile_ic", "sp", [-1, 1, 4]], ["tile_oc", "sp", [-1, 64]], ["tile_ow", "sp", [-1, 1, 2]], ["tile_oh", "sp", [-1, 5, 4]]]}, "result": [[0.0024011461000000003], 0, 48.923407554626465, 1612238990.550529], "version": 0.2, "tvm_version": "0.8.dev0"}
{"input": ["opencl -keys=opencl,gpu -max_num_threads=256", "tutorial/conv2d_no_batching", [1, 40, 40, 512, 256, 1, 1, [1, 1], [0, 0]], {}], "config": {"index": 7701, "code_hash": null, "entity": [["tile_ic", "sp", [-1, 2, 4]], ["tile_oc", "sp", [-1, 16]], ["tile_ow", "sp", [-1, 2, 2]], ["tile_oh", "sp", [-1, 8, 2]]]}, "result": [[0.0044257973], 0, 59.01748609542847, 1612239000.583003], "version": 0.2, "tvm_version": "0.8.dev0"}
{"input": ["opencl -keys=opencl,gpu -max_num_threads=256", "tutorial/conv2d_no_batching", [1, 40, 40, 512, 256, 1, 1, [1, 1], [0, 0]], {}], "config": {"index": 6244, "code_hash": null, "entity": [["tile_ic", "sp", [-1, 1, 4]], ["tile_oc", "sp", [-1, 16]], ["tile_ow", "sp", [-1, 4, 2]], ["tile_oh", "sp", [-1, 5, 2]]]}, "result": [[0.0018851667999999998], 0, 68.92147135734558, 1612239010.5305839], "version": 0.2, "tvm_version": "0.8.dev0"}
{"input": ["opencl -keys=opencl,gpu -max_num_threads=256", "tutorial/conv2d_no_batching", [1, 40, 40, 512, 256, 1, 1, [1, 1], [0, 0]], {}], "config": {"index": 19747, "code_hash": null, "entity": [["tile_ic", "sp", [-1, 1, 4]], ["tile_oc", "sp", [-1, 32]], ["tile_ow", "sp", [-1, 1, 2]], ["tile_oh", "sp", [-1, 8, 4]]]}, "result": [[0.0078170268], 0, 64.1037974357605, 1612239005.684367], "version": 0.2, "tvm_version": "0.8.dev0"}
{"input": ["opencl -keys=opencl,gpu -max_num_threads=256", "tutorial/conv2d_no_batching", [1, 40, 40, 512, 256, 1, 1, [1, 1], [0, 0]], {}], "config": {"index": 18228, "code_hash": null, "entity": [["tile_ic", "sp", [-1, 1, 4]], ["tile_oc", "sp", [-1, 16]], ["tile_ow", "sp", [-1, 1, 2]], ["tile_oh", "sp", [-1, 5, 4]]]}, "result": [[0.0036731567], 0, 73.76367402076721, 1612239015.4255989], "version": 0.2, "tvm_version": "0.8.dev0"}
{"input": ["opencl -keys=opencl,gpu -max_num_threads=256", "tutorial/conv2d_no_batching", [1, 40, 40, 512, 256, 1, 1, [1, 1], [0, 0]], {}], "config": {"index": 9157, "code_hash": null, "entity": [["tile_ic", "sp", [-1, 2, 4]], ["tile_oc", "sp", [-1, 16]], ["tile_ow", "sp", [-1, 1, 2]], ["tile_oh", "sp", [-1, 10, 2]]]}, "result": [[0.0026284742], 0, 78.46817469596863, 1612239020.0998776], "version": 0.2, "tvm_version": "0.8.dev0"}
{"input": ["opencl -keys=opencl,gpu -max_num_threads=256", "tutorial/conv2d_no_batching", [1, 40, 40, 512, 256, 1, 1, [1, 1], [0, 0]], {}], "config": {"index": 7644, "code_hash": null, "entity": [["tile_ic", "sp", [-1, 1, 4]], ["tile_oc", "sp", [-1, 16]], ["tile_ow", "sp", [-1, 1, 2]], ["tile_oh", "sp", [-1, 8, 2]]]}, "result": [[0.004136292099999999], 0, 4.64972186088562, 1612239025.585434], "version": 0.2, "tvm_version": "0.8.dev0"}
{"input": ["opencl -keys=opencl,gpu -max_num_threads=256", "tutorial/conv2d_no_batching", [1, 40, 40, 512, 256, 1, 1, [1, 1], [0, 0]], {}], "config": {"index": 9317, "code_hash": null, "entity": [["tile_ic", "sp", [-1, 1, 4]], ["tile_oc", "sp", [-1, 8]], ["tile_ow", "sp", [-1, 5, 2]], ["tile_oh", "sp", [-1, 10, 2]]]}, "result": [[0.0023613961], 0, 9.463381290435791, 1612239030.4609556], "version": 0.2, "tvm_version": "0.8.dev0"}
{"input": ["opencl -keys=opencl,gpu -max_num_threads=256", "tutorial/conv2d_no_batching", [1, 40, 40, 512, 256, 1, 1, [1, 1], [0, 0]], {}], "config": {"index": 6195, "code_hash": null, "entity": [["tile_ic", "sp", [-1, 1, 4]], ["tile_oc", "sp", [-1, 32]], ["tile_ow", "sp", [-1, 2, 2]], ["tile_oh", "sp", [-1, 5, 2]]]}, "result": [[0.0019477606000000002], 0, 14.385581493377686, 1612239035.3715825], "version": 0.2, "tvm_version": "0.8.dev0"}
{"input": ["opencl -keys=opencl,gpu -max_num_threads=256", "tutorial/conv2d_no_batching", [1, 40, 40, 512, 256, 1, 1, [1, 1], [0, 0]], {}], "config": {"index": 4683, "code_hash": null, "entity": [["tile_ic", "sp", [-1, 1, 4]], ["tile_oc", "sp", [-1, 32]], ["tile_ow", "sp", [-1, 2, 2]], ["tile_oh", "sp", [-1, 4, 2]]]}, "result": [[0.0018919064], 0, 23.973411321640015, 1612239044.9853797], "version": 0.2, "tvm_version": "0.8.dev0"}
{"input": ["opencl -keys=opencl,gpu -max_num_threads=256", "tutorial/conv2d_no_batching", [1, 40, 40, 512, 256, 1, 1, [1, 1], [0, 0]], {}], "config": {"index": 16730, "code_hash": null, "entity": [["tile_ic", "sp", [-1, 1, 4]], ["tile_oc", "sp", [-1, 64]], ["tile_ow", "sp", [-1, 1, 2]], ["tile_oh", "sp", [-1, 4, 4]]]}, "result": [[0.0060518548], 0, 39.14368438720703, 1612239060.052436], "version": 0.2, "tvm_version": "0.8.dev0"}
{"input": ["opencl -keys=opencl,gpu -max_num_threads=256", "tutorial/conv2d_no_batching", [1, 40, 40, 512, 256, 1, 1, [1, 1], [0, 0]], {}], "config": {"index": 4732, "code_hash": null, "entity": [["tile_ic", "sp", [-1, 1, 4]], ["tile_oc", "sp", [-1, 16]], ["tile_ow", "sp", [-1, 4, 2]], ["tile_oh", "sp", [-1, 4, 2]]]}, "result": [[0.0019330679], 0, 28.751530170440674, 1612239049.7760608], "version": 0.2, "tvm_version": "0.8.dev0"}
{"input": ["opencl -keys=opencl,gpu -max_num_threads=256", "tutorial/conv2d_no_batching", [1, 40, 40, 512, 256, 1, 1, [1, 1], [0, 0]], {}], "config": {"index": 9269, "code_hash": null, "entity": [["tile_ic", "sp", [-1, 2, 4]], ["tile_oc", "sp", [-1, 16]], ["tile_ow", "sp", [-1, 4, 2]], ["tile_oh", "sp", [-1, 10, 2]]]}, "result": [[0.0024803805], 0, 19.221362352371216, 1612239040.2262633], "version": 0.2, "tvm_version": "0.8.dev0"}
{"input": ["opencl -keys=opencl,gpu -max_num_threads=256", "tutorial/conv2d_no_batching", [1, 40, 40, 512, 256, 1, 1, [1, 1], [0, 0]], {}], "config": {"index": 10725, "code_hash": null, "entity": [["tile_ic", "sp", [-1, 2, 4]], ["tile_oc", "sp", [-1, 16]], ["tile_ow", "sp", [-1, 2, 2]], ["tile_oh", "sp", [-1, 16, 2]]]}, "result": [[0.0058597557], 0, 33.90728521347046, 1612239054.8636527], "version": 0.2, "tvm_version": "0.8.dev0"}
{"input": ["opencl -keys=opencl,gpu -max_num_threads=256", "tutorial/conv2d_no_batching", [1, 40, 40, 512, 256, 1, 1, [1, 1], [0, 0]], {}], "config": {"index": 3157, "code_hash": null, "entity": [["tile_ic", "sp", [-1, 1, 4]], ["tile_oc", "sp", [-1, 8]], ["tile_ow", "sp", [-1, 2, 2]], ["tile_oh", "sp", [-1, 2, 2]]]}, "result": [[0.003723443], 0, 43.963051080703735, 1612239064.9913454], "version": 0.2, "tvm_version": "0.8.dev0"}
{"input": ["opencl -keys=opencl,gpu -max_num_threads=256", "tutorial/conv2d_no_batching", [1, 40, 40, 512, 256, 1, 1, [1, 1], [0, 0]], {}], "config": {"index": 1645, "code_hash": null, "entity": [["tile_ic", "sp", [-1, 1, 4]], ["tile_oc", "sp", [-1, 8]], ["tile_ow", "sp", [-1, 2, 2]], ["tile_oh", "sp", [-1, 1, 2]]]}, "result": [[0.0067779486], 0, 53.94037628173828, 1612239074.982465], "version": 0.2, "tvm_version": "0.8.dev0"}
{"input": ["opencl -keys=opencl,gpu -max_num_threads=256", "tutorial/conv2d_no_batching", [1, 40, 40, 512, 256, 1, 1, [1, 1], [0, 0]], {}], "config": {"index": 4669, "code_hash": null, "entity": [["tile_ic", "sp", [-1, 1, 4]], ["tile_oc", "sp", [-1, 8]], ["tile_ow", "sp", [-1, 2, 2]], ["tile_oh", "sp", [-1, 4, 2]]]}, "result": [[0.0019805836], 0, 48.92275261878967, 1612239069.9723754], "version": 0.2, "tvm_version": "0.8.dev0"}
{"input": ["opencl -keys=opencl,gpu -max_num_threads=256", "tutorial/conv2d_no_batching", [1, 40, 40, 512, 256, 1, 1, [1, 1], [0, 0]], {}], "config": {"index": 6181, "code_hash": null, "entity": [["tile_ic", "sp", [-1, 1, 4]], ["tile_oc", "sp", [-1, 8]], ["tile_ow", "sp", [-1, 2, 2]], ["tile_oh", "sp", [-1, 5, 2]]]}, "result": [[0.0029260939999999997], 0, 58.77004361152649, 1612239079.8225589], "version": 0.2, "tvm_version": "0.8.dev0"}
{"input": ["opencl -keys=opencl,gpu -max_num_threads=256", "tutorial/conv2d_no_batching", [1, 40, 40, 512, 256, 1, 1, [1, 1], [0, 0]], {}], "config": {"index": 18291, "code_hash": null, "entity": [["tile_ic", "sp", [-1, 1, 4]], ["tile_oc", "sp", [-1, 32]], ["tile_ow", "sp", [-1, 2, 2]], ["tile_oh", "sp", [-1, 5, 4]]]}, "result": [[0.0022009741999999997], 0, 63.69304418563843, 1612239084.7308724], "version": 0.2, "tvm_version": "0.8.dev0"}
{"input": ["opencl -keys=opencl,gpu -max_num_threads=256", "tutorial/conv2d_no_batching", [1, 40, 40, 512, 256, 1, 1, [1, 1], [0, 0]], {}], "config": {"index": 3178, "code_hash": null, "entity": [["tile_ic", "sp", [-1, 1, 4]], ["tile_oc", "sp", [-1, 64]], ["tile_ow", "sp", [-1, 2, 2]], ["tile_oh", "sp", [-1, 2, 2]]]}, "result": [[0.0019117658], 0, 73.53443241119385, 1612239094.5959914], "version": 0.2, "tvm_version": "0.8.dev0"}
{"input": ["opencl -keys=opencl,gpu -max_num_threads=256", "tutorial/conv2d_no_batching", [1, 40, 40, 512, 256, 1, 1, [1, 1], [0, 0]], {}], "config": {"index": 12174, "code_hash": null, "entity": [["tile_ic", "sp", [-1, 2, 4]], ["tile_oc", "sp", [-1, 8]], ["tile_ow", "sp", [-1, 1, 2]], ["tile_oh", "sp", [-1, 20, 2]]]}, "result": [[0.0027461148000000003], 0, 68.62015509605408, 1612239089.6912599], "version": 0.2, "tvm_version": "0.8.dev0"}
{"input": ["opencl -keys=opencl,gpu -max_num_threads=256", "tutorial/conv2d_no_batching", [1, 40, 40, 512, 256, 1, 1, [1, 1], [0, 0]], {}], "config": {"index": 10710, "code_hash": null, "entity": [["tile_ic", "sp", [-1, 1, 4]], ["tile_oc", "sp", [-1, 4]], ["tile_ow", "sp", [-1, 2, 2]], ["tile_oh", "sp", [-1, 16, 2]]]}, "result": [[0.0056794797], 0, 78.64823269844055, 1612239099.6937635], "version": 0.2, "tvm_version": "0.8.dev0"}
{"input": ["opencl -keys=opencl,gpu -max_num_threads=256", "tutorial/conv2d_no_batching", [1, 40, 40, 512, 256, 1, 1, [1, 1], [0, 0]], {}], "config": {"index": 10669, "code_hash": null, "entity": [["tile_ic", "sp", [-1, 2, 4]], ["tile_oc", "sp", [-1, 16]], ["tile_ow", "sp", [-1, 1, 2]], ["tile_oh", "sp", [-1, 16, 2]]]}, "result": [[0.0057917297], 0, 5.018027067184448, 1612239177.3820102], "version": 0.2, "tvm_version": "0.8.dev0"}
{"input": ["opencl -keys=opencl,gpu -max_num_threads=256", "tutorial/conv2d_no_batching", [1, 40, 40, 512, 256, 1, 1, [1, 1], [0, 0]], {}], "config": {"index": 7805, "code_hash": null, "entity": [["tile_ic", "sp", [-1, 1, 4]], ["tile_oc", "sp", [-1, 8]], ["tile_ow", "sp", [-1, 5, 2]], ["tile_oh", "sp", [-1, 8, 2]]]}, "result": [[0.0047566359], 0, 9.985549449920654, 1612239182.3892257], "version": 0.2, "tvm_version": "0.8.dev0"}
{"input": ["opencl -keys=opencl,gpu -max_num_threads=256", "tutorial/conv2d_no_batching", [1, 40, 40, 512, 256, 1, 1, [1, 1], [0, 0]], {}], "config": {"index": 9163, "code_hash": null, "entity": [["tile_ic", "sp", [-1, 1, 4]], ["tile_oc", "sp", [-1, 32]], ["tile_ow", "sp", [-1, 1, 2]], ["tile_oh", "sp", [-1, 10, 2]]]}, "result": [[0.0020587033], 0, 29.064860105514526, 1612239201.5069652], "version": 0.2, "tvm_version": "0.8.dev0"}
{"input": ["opencl -keys=opencl,gpu -max_num_threads=256", "tutorial/conv2d_no_batching", [1, 40, 40, 512, 256, 1, 1, [1, 1], [0, 0]], {}], "config": {"index": 7651, "code_hash": null, "entity": [["tile_ic", "sp", [-1, 1, 4]], ["tile_oc", "sp", [-1, 32]], ["tile_ow", "sp", [-1, 1, 2]], ["tile_oh", "sp", [-1, 8, 2]]]}, "result": [[0.0045152609], 0, 19.721217155456543, 1612239192.088539], "version": 0.2, "tvm_version": "0.8.dev0"}
{"input": ["opencl -keys=opencl,gpu -max_num_threads=256", "tutorial/conv2d_no_batching", [1, 40, 40, 512, 256, 1, 1, [1, 1], [0, 0]], {}], "config": {"index": 12286, "code_hash": null, "entity": [["tile_ic", "sp", [-1, 2, 4]], ["tile_oc", "sp", [-1, 8]], ["tile_ow", "sp", [-1, 4, 2]], ["tile_oh", "sp", [-1, 20, 2]]]}, "result": [[0.0026210941], 0, 14.850411653518677, 1612239187.2716231], "version": 0.2, "tvm_version": "0.8.dev0"}
{"input": ["opencl -keys=opencl,gpu -max_num_threads=256", "tutorial/conv2d_no_batching", [1, 40, 40, 512, 256, 1, 1, [1, 1], [0, 0]], {}], "config": {"index": 3129, "code_hash": null, "entity": [["tile_ic", "sp", [-1, 1, 4]], ["tile_oc", "sp", [-1, 128]], ["tile_ow", "sp", [-1, 1, 2]], ["tile_oh", "sp", [-1, 2, 2]]]}, "result": [[0.0020562815000000003], 0, 24.34712839126587, 1612239196.8133035], "version": 0.2, "tvm_version": "0.8.dev0"}
{"input": ["opencl -keys=opencl,gpu -max_num_threads=256", "tutorial/conv2d_no_batching", [1, 40, 40, 512, 256, 1, 1, [1, 1], [0, 0]], {}], "config": {"index": 9366, "code_hash": null, "entity": [["tile_ic", "sp", [-1, 1, 4]], ["tile_oc", "sp", [-1, 4]], ["tile_ow", "sp", [-1, 8, 2]], ["tile_oh", "sp", [-1, 10, 2]]]}, "result": [[0.0050323078], 0, 33.97348952293396, 1612239206.412201], "version": 0.2, "tvm_version": "0.8.dev0"}
{"input": ["opencl -keys=opencl,gpu -max_num_threads=256", "tutorial/conv2d_no_batching", [1, 40, 40, 512, 256, 1, 1, [1, 1], [0, 0]], {}], "config": {"index": 19796, "code_hash": null, "entity": [["tile_ic", "sp", [-1, 1, 4]], ["tile_oc", "sp", [-1, 16]], ["tile_ow", "sp", [-1, 2, 2]], ["tile_oh", "sp", [-1, 8, 4]]]}, "result": [[0.0076432871999999995], 0, 39.043370723724365, 1612239211.4322758], "version": 0.2, "tvm_version": "0.8.dev0"}
{"input": ["opencl -keys=opencl,gpu -max_num_threads=256", "tutorial/conv2d_no_batching", [1, 40, 40, 512, 256, 1, 1, [1, 1], [0, 0]], {}], "config": {"index": 12222, "code_hash": null, "entity": [["tile_ic", "sp", [-1, 1, 4]], ["tile_oc", "sp", [-1, 4]], ["tile_ow", "sp", [-1, 2, 2]], ["tile_oh", "sp", [-1, 20, 2]]]}, "result": [[0.002330594], 0, 43.84208941459656, 1612239216.2810385], "version": 0.2, "tvm_version": "0.8.dev0"}
{"input": ["opencl -keys=opencl,gpu -max_num_threads=256", "tutorial/conv2d_no_batching", [1, 40, 40, 512, 256, 1, 1, [1, 1], [0, 0]], {}], "config": {"index": 1652, "code_hash": null, "entity": [["tile_ic", "sp", [-1, 1, 4]], ["tile_oc", "sp", [-1, 16]], ["tile_ow", "sp", [-1, 2, 2]], ["tile_oh", "sp", [-1, 1, 2]]]}, "result": [[0.0035674848000000004], 0, 48.53217148780823, 1612239221.0247173], "version": 0.2, "tvm_version": "0.8.dev0"}
{"input": ["opencl -keys=opencl,gpu -max_num_threads=256", "tutorial/conv2d_no_batching", [1, 40, 40, 512, 256, 1, 1, [1, 1], [0, 0]], {}], "config": {"index": 3164, "code_hash": null, "entity": [["tile_ic", "sp", [-1, 1, 4]], ["tile_oc", "sp", [-1, 16]], ["tile_ow", "sp", [-1, 2, 2]], ["tile_oh", "sp", [-1, 2, 2]]]}, "result": [[0.0019598127], 0, 53.17719841003418, 1612239225.6690896], "version": 0.2, "tvm_version": "0.8.dev0"}
{"input": ["opencl -keys=opencl,gpu -max_num_threads=256", "tutorial/conv2d_no_batching", [1, 40, 40, 512, 256, 1, 1, [1, 1], [0, 0]], {}], "config": {"index": 9219, "code_hash": null, "entity": [["tile_ic", "sp", [-1, 1, 4]], ["tile_oc", "sp", [-1, 32]], ["tile_ow", "sp", [-1, 2, 2]], ["tile_oh", "sp", [-1, 10, 2]]]}, "result": [[0.0019286825], 0, 58.006598711013794, 1612239230.5005038], "version": 0.2, "tvm_version": "0.8.dev0"}
{"input": ["opencl -keys=opencl,gpu -max_num_threads=256", "tutorial/conv2d_no_batching", [1, 40, 40, 512, 256, 1, 1, [1, 1], [0, 0]], {}], "config": {"index": 6202, "code_hash": null, "entity": [["tile_ic", "sp", [-1, 1, 4]], ["tile_oc", "sp", [-1, 64]], ["tile_ow", "sp", [-1, 2, 2]], ["tile_oh", "sp", [-1, 5, 2]]]}, "result": [[0.0019283804], 0, 62.93562150001526, 1612239235.4426472], "version": 0.2, "tvm_version": "0.8.dev0"}
{"input": ["opencl -keys=opencl,gpu -max_num_threads=256", "tutorial/conv2d_no_batching", [1, 40, 40, 512, 256, 1, 1, [1, 1], [0, 0]], {}], "config": {"index": 4788, "code_hash": null, "entity": [["tile_ic", "sp", [-1, 1, 4]], ["tile_oc", "sp", [-1, 16]], ["tile_ow", "sp", [-1, 5, 2]], ["tile_oh", "sp", [-1, 4, 2]]]}, "result": [[0.0019261772], 0, 4.603710889816284, 1612239267.6642458], "version": 0.2, "tvm_version": "0.8.dev0"}
{"input": ["opencl -keys=opencl,gpu -max_num_threads=256", "tutorial/conv2d_no_batching", [1, 40, 40, 512, 256, 1, 1, [1, 1], [0, 0]], {}], "config": {"index": 6251, "code_hash": null, "entity": [["tile_ic", "sp", [-1, 1, 4]], ["tile_oc", "sp", [-1, 32]], ["tile_ow", "sp", [-1, 4, 2]], ["tile_oh", "sp", [-1, 5, 2]]]}, "result": [[0.0018876981000000002], 0, 9.313550233840942, 1612239272.41986], "version": 0.2, "tvm_version": "0.8.dev0"}
{"input": ["opencl -keys=opencl,gpu -max_num_threads=256", "tutorial/conv2d_no_batching", [1, 40, 40, 512, 256, 1, 1, [1, 1], [0, 0]], {}], "config": {"index": 4690, "code_hash": null, "entity": [["tile_ic", "sp", [-1, 1, 4]], ["tile_oc", "sp", [-1, 64]], ["tile_ow", "sp", [-1, 2, 2]], ["tile_oh", "sp", [-1, 4, 2]]]}, "result": [[0.0020248804], 0, 13.97547435760498, 1612239277.0859492], "version": 0.2, "tvm_version": "0.8.dev0"}
{"input": ["opencl -keys=opencl,gpu -max_num_threads=256", "tutorial/conv2d_no_batching", [1, 40, 40, 512, 256, 1, 1, [1, 1], [0, 0]], {}], "config": {"index": 4739, "code_hash": null, "entity": [["tile_ic", "sp", [-1, 1, 4]], ["tile_oc", "sp", [-1, 32]], ["tile_ow", "sp", [-1, 4, 2]], ["tile_oh", "sp", [-1, 4, 2]]]}, "result": [[0.0020092919], 0, 28.609108924865723, 1612239291.6956244], "version": 0.2, "tvm_version": "0.8.dev0"}
{"input": ["opencl -keys=opencl,gpu -max_num_threads=256", "tutorial/conv2d_no_batching", [1, 40, 40, 512, 256, 1, 1, [1, 1], [0, 0]], {}], "config": {"index": 6146, "code_hash": null, "entity": [["tile_ic", "sp", [-1, 1, 4]], ["tile_oc", "sp", [-1, 64]], ["tile_ow", "sp", [-1, 1, 2]], ["tile_oh", "sp", [-1, 5, 2]]]}, "result": [[0.0019267085], 0, 23.52880597114563, 1612239286.6432261], "version": 0.2, "tvm_version": "0.8.dev0"}
{"input": ["opencl -keys=opencl,gpu -max_num_threads=256", "tutorial/conv2d_no_batching", [1, 40, 40, 512, 256, 1, 1, [1, 1], [0, 0]], {}], "config": {"index": 3227, "code_hash": null, "entity": [["tile_ic", "sp", [-1, 1, 4]], ["tile_oc", "sp", [-1, 32]], ["tile_ow", "sp", [-1, 4, 2]], ["tile_oh", "sp", [-1, 2, 2]]]}, "result": [[0.0019125001999999998], 0, 18.71024250984192, 1612239281.8076048], "version": 0.2, "tvm_version": "0.8.dev0"}
{"input": ["opencl -keys=opencl,gpu -max_num_threads=256", "tutorial/conv2d_no_batching", [1, 40, 40, 512, 256, 1, 1, [1, 1], [0, 0]], {}], "config": {"index": 6196, "code_hash": null, "entity": [["tile_ic", "sp", [-1, 2, 4]], ["tile_oc", "sp", [-1, 32]], ["tile_ow", "sp", [-1, 2, 2]], ["tile_oh", "sp", [-1, 5, 2]]]}, "result": [[0.0023740575], 0, 33.382872343063354, 1612239296.4881756], "version": 0.2, "tvm_version": "0.8.dev0"}
{"input": ["opencl -keys=opencl,gpu -max_num_threads=256", "tutorial/conv2d_no_batching", [1, 40, 40, 512, 256, 1, 1, [1, 1], [0, 0]], {}], "config": {"index": 6300, "code_hash": null, "entity": [["tile_ic", "sp", [-1, 1, 4]], ["tile_oc", "sp", [-1, 16]], ["tile_ow", "sp", [-1, 5, 2]], ["tile_oh", "sp", [-1, 5, 2]]]}, "result": [[0.0023084117], 0, 38.31096529960632, 1612239301.4649258], "version": 0.2, "tvm_version": "0.8.dev0"}
{"input": ["opencl -keys=opencl,gpu -max_num_threads=256", "tutorial/conv2d_no_batching", [1, 40, 40, 512, 256, 1, 1, [1, 1], [0, 0]], {}], "config": {"index": 4740, "code_hash": null, "entity": [["tile_ic", "sp", [-1, 2, 4]], ["tile_oc", "sp", [-1, 32]], ["tile_ow", "sp", [-1, 4, 2]], ["tile_oh", "sp", [-1, 4, 2]]]}, "result": [[0.0022900888000000003], 0, 43.37530851364136, 1612239306.5209236], "version": 0.2, "tvm_version": "0.8.dev0"}
{"input": ["opencl -keys=opencl,gpu -max_num_threads=256", "tutorial/conv2d_no_batching", [1, 40, 40, 512, 256, 1, 1, [1, 1], [0, 0]], {}], "config": {"index": 6252, "code_hash": null, "entity": [["tile_ic", "sp", [-1, 2, 4]], ["tile_oc", "sp", [-1, 32]], ["tile_ow", "sp", [-1, 4, 2]], ["tile_oh", "sp", [-1, 5, 2]]]}, "result": [[0.0022556408], 0, 53.199403524398804, 1612239316.3537998], "version": 0.2, "tvm_version": "0.8.dev0"}
{"input": ["opencl -keys=opencl,gpu -max_num_threads=256", "tutorial/conv2d_no_batching", [1, 40, 40, 512, 256, 1, 1, [1, 1], [0, 0]], {}], "config": {"index": 6203, "code_hash": null, "entity": [["tile_ic", "sp", [-1, 2, 4]], ["tile_oc", "sp", [-1, 64]], ["tile_ow", "sp", [-1, 2, 2]], ["tile_oh", "sp", [-1, 5, 2]]]}, "result": [[0.0022673648000000003], 0, 48.26792621612549, 1612239311.4410079], "version": 0.2, "tvm_version": "0.8.dev0"}
{"input": ["opencl -keys=opencl,gpu -max_num_threads=256", "tutorial/conv2d_no_batching", [1, 40, 40, 512, 256, 1, 1, [1, 1], [0, 0]], {}], "config": {"index": 4634, "code_hash": null, "entity": [["tile_ic", "sp", [-1, 1, 4]], ["tile_oc", "sp", [-1, 64]], ["tile_ow", "sp", [-1, 1, 2]], ["tile_oh", "sp", [-1, 4, 2]]]}, "result": [[0.0019746824], 0, 63.03891062736511, 1612239326.246754], "version": 0.2, "tvm_version": "0.8.dev0"}
{"input": ["opencl -keys=opencl,gpu -max_num_threads=256", "tutorial/conv2d_no_batching", [1, 40, 40, 512, 256, 1, 1, [1, 1], [0, 0]], {}], "config": {"index": 15267, "code_hash": null, "entity": [["tile_ic", "sp", [-1, 1, 4]], ["tile_oc", "sp", [-1, 32]], ["tile_ow", "sp", [-1, 2, 2]], ["tile_oh", "sp", [-1, 2, 4]]]}, "result": [[0.0021327502], 0, 58.07363677024841, 1612239321.2659576], "version": 0.2, "tvm_version": "0.8.dev0"}
{"input": ["opencl -keys=opencl,gpu -max_num_threads=256", "tutorial/conv2d_no_batching", [1, 40, 40, 512, 256, 1, 1, [1, 1], [0, 0]], {}], "config": {"index": 6594, "code_hash": null, "entity": [["tile_ic", "sp", [-1, 1, 4]], ["tile_oc", "sp", [-1, 64]], ["tile_ow", "sp", [-1, 1, 4]], ["tile_oh", "sp", [-1, 5, 2]]]}, "result": [[0.0021693127], 0, 68.0280373096466, 1612239331.2351909], "version": 0.2, "tvm_version": "0.8.dev0"}
{"input": ["opencl -keys=opencl,gpu -max_num_threads=256", "tutorial/conv2d_no_batching", [1, 40, 40, 512, 256, 1, 1, [1, 1], [0, 0]], {}], "config": {"index": 3122, "code_hash": null, "entity": [["tile_ic", "sp", [-1, 1, 4]], ["tile_oc", "sp", [-1, 64]], ["tile_ow", "sp", [-1, 1, 2]], ["tile_oh", "sp", [-1, 2, 2]]]}, "result": [[0.0020320731], 0, 77.64748358726501, 1612239340.8843858], "version": 0.2, "tvm_version": "0.8.dev0"}
{"input": ["opencl -keys=opencl,gpu -max_num_threads=256", "tutorial/conv2d_no_batching", [1, 40, 40, 512, 256, 1, 1, [1, 1], [0, 0]], {}], "config": {"index": 9220, "code_hash": null, "entity": [["tile_ic", "sp", [-1, 2, 4]], ["tile_oc", "sp", [-1, 32]], ["tile_ow", "sp", [-1, 2, 2]], ["tile_oh", "sp", [-1, 10, 2]]]}, "result": [[0.0022829794000000002], 0, 72.91520929336548, 1612239336.141905], "version": 0.2, "tvm_version": "0.8.dev0"}
{"input": ["opencl -keys=opencl,gpu -max_num_threads=256", "tutorial/conv2d_no_batching", [1, 40, 40, 512, 256, 1, 1, [1, 1], [0, 0]], {}], "config": {"index": 1610, "code_hash": null, "entity": [["tile_ic", "sp", [-1, 1, 4]], ["tile_oc", "sp", [-1, 64]], ["tile_ow", "sp", [-1, 1, 2]], ["tile_oh", "sp", [-1, 1, 2]]]}, "result": [[0.0021463179], 0, 4.572606801986694, 1612239346.282635], "version": 0.2, "tvm_version": "0.8.dev0"}
{"input": ["opencl -keys=opencl,gpu -max_num_threads=256", "tutorial/conv2d_no_batching", [1, 40, 40, 512, 256, 1, 1, [1, 1], [0, 0]], {}], "config": {"index": 4684, "code_hash": null, "entity": [["tile_ic", "sp", [-1, 2, 4]], ["tile_oc", "sp", [-1, 32]], ["tile_ow", "sp", [-1, 2, 2]], ["tile_oh", "sp", [-1, 4, 2]]]}, "result": [[0.0023227867], 0, 9.372227907180786, 1612239351.1020975], "version": 0.2, "tvm_version": "0.8.dev0"}
{"input": ["opencl -keys=opencl,gpu -max_num_threads=256", "tutorial/conv2d_no_batching", [1, 40, 40, 512, 256, 1, 1, [1, 1], [0, 0]], {}], "config": {"index": 4691, "code_hash": null, "entity": [["tile_ic", "sp", [-1, 2, 4]], ["tile_oc", "sp", [-1, 64]], ["tile_ow", "sp", [-1, 2, 2]], ["tile_oh", "sp", [-1, 4, 2]]]}, "result": [[0.0023075576], 0, 18.67446994781494, 1612239360.4084947], "version": 0.2, "tvm_version": "0.8.dev0"}
{"input": ["opencl -keys=opencl,gpu -max_num_threads=256", "tutorial/conv2d_no_batching", [1, 40, 40, 512, 256, 1, 1, [1, 1], [0, 0]], {}], "config": {"index": 1666, "code_hash": null, "entity": [["tile_ic", "sp", [-1, 1, 4]], ["tile_oc", "sp", [-1, 64]], ["tile_ow", "sp", [-1, 2, 2]], ["tile_oh", "sp", [-1, 1, 2]]]}, "result": [[0.0019358909], 0, 14.000117540359497, 1612239355.7533739], "version": 0.2, "tvm_version": "0.8.dev0"}
{"input": ["opencl -keys=opencl,gpu -max_num_threads=256", "tutorial/conv2d_no_batching", [1, 40, 40, 512, 256, 1, 1, [1, 1], [0, 0]], {}], "config": {"index": 3276, "code_hash": null, "entity": [["tile_ic", "sp", [-1, 1, 4]], ["tile_oc", "sp", [-1, 16]], ["tile_ow", "sp", [-1, 5, 2]], ["tile_oh", "sp", [-1, 2, 2]]]}, "result": [[0.002267844], 0, 23.360446453094482, 1612239365.0732534], "version": 0.2, "tvm_version": "0.8.dev0"}
{"input": ["opencl -keys=opencl,gpu -max_num_threads=256", "tutorial/conv2d_no_batching", [1, 40, 40, 512, 256, 1, 1, [1, 1], [0, 0]], {}], "config": {"index": 6587, "code_hash": null, "entity": [["tile_ic", "sp", [-1, 1, 4]], ["tile_oc", "sp", [-1, 32]], ["tile_ow", "sp", [-1, 1, 4]], ["tile_oh", "sp", [-1, 5, 2]]]}, "result": [[0.0025789846], 0, 27.811149835586548, 1612239369.5607898], "version": 0.2, "tvm_version": "0.8.dev0"}
{"input": ["opencl -keys=opencl,gpu -max_num_threads=256", "tutorial/conv2d_no_batching", [1, 40, 40, 512, 256, 1, 1, [1, 1], [0, 0]], {}], "config": {"index": 6139, "code_hash": null, "entity": [["tile_ic", "sp", [-1, 1, 4]], ["tile_oc", "sp", [-1, 32]], ["tile_ow", "sp", [-1, 1, 2]], ["tile_oh", "sp", [-1, 5, 2]]]}, "result": [[0.0022469898], 0, 32.19603157043457, 1612239373.987211], "version": 0.2, "tvm_version": "0.8.dev0"}
{"input": ["opencl -keys=opencl,gpu -max_num_threads=256", "tutorial/conv2d_no_batching", [1, 40, 40, 512, 256, 1, 1, [1, 1], [0, 0]], {}], "config": {"index": 3108, "code_hash": null, "entity": [["tile_ic", "sp", [-1, 1, 4]], ["tile_oc", "sp", [-1, 16]], ["tile_ow", "sp", [-1, 1, 2]], ["tile_oh", "sp", [-1, 2, 2]]]}, "result": [[0.0036574692], 0, 36.63372468948364, 1612239378.4186609], "version": 0.2, "tvm_version": "0.8.dev0"}
{"input": ["opencl -keys=opencl,gpu -max_num_threads=256", "tutorial/conv2d_no_batching", [1, 40, 40, 512, 256, 1, 1, [1, 1], [0, 0]], {}], "config": {"index": 3283, "code_hash": null, "entity": [["tile_ic", "sp", [-1, 1, 4]], ["tile_oc", "sp", [-1, 32]], ["tile_ow", "sp", [-1, 5, 2]], ["tile_oh", "sp", [-1, 2, 2]]]}, "result": [[0.0019862554000000003], 0, 46.525139808654785, 1612239388.31013], "version": 0.2, "tvm_version": "0.8.dev0"}
{"input": ["opencl -keys=opencl,gpu -max_num_threads=256", "tutorial/conv2d_no_batching", [1, 40, 40, 512, 256, 1, 1, [1, 1], [0, 0]], {}], "config": {"index": 15218, "code_hash": null, "entity": [["tile_ic", "sp", [-1, 1, 4]], ["tile_oc", "sp", [-1, 64]], ["tile_ow", "sp", [-1, 1, 2]], ["tile_oh", "sp", [-1, 2, 4]]]}, "result": [[0.0021723439], 0, 41.93337607383728, 1612239383.7013137], "version": 0.2, "tvm_version": "0.8.dev0"}
{"input": ["opencl -keys=opencl,gpu -max_num_threads=256", "tutorial/conv2d_no_batching", [1, 40, 40, 512, 256, 1, 1, [1, 1], [0, 0]], {}], "config": {"index": 18235, "code_hash": null, "entity": [["tile_ic", "sp", [-1, 1, 4]], ["tile_oc", "sp", [-1, 32]], ["tile_ow", "sp", [-1, 1, 2]], ["tile_oh", "sp", [-1, 5, 4]]]}, "result": [[0.0025859324999999997], 0, 55.91267228126526, 1612239397.696364], "version": 0.2, "tvm_version": "0.8.dev0"}
{"input": ["opencl -keys=opencl,gpu -max_num_threads=256", "tutorial/conv2d_no_batching", [1, 40, 40, 512, 256, 1, 1, [1, 1], [0, 0]], {}], "config": {"index": 3570, "code_hash": null, "entity": [["tile_ic", "sp", [-1, 1, 4]], ["tile_oc", "sp", [-1, 64]], ["tile_ow", "sp", [-1, 1, 4]], ["tile_oh", "sp", [-1, 2, 2]]]}, "result": [[0.0021676511999999997], 0, 51.204668045043945, 1612239392.9924662], "version": 0.2, "tvm_version": "0.8.dev0"}
{"input": ["opencl -keys=opencl,gpu -max_num_threads=256", "tutorial/conv2d_no_batching", [1, 40, 40, 512, 256, 1, 1, [1, 1], [0, 0]], {}], "config": {"index": 9618, "code_hash": null, "entity": [["tile_ic", "sp", [-1, 1, 4]], ["tile_oc", "sp", [-1, 64]], ["tile_ow", "sp", [-1, 1, 4]], ["tile_oh", "sp", [-1, 10, 2]]]}, "result": [[0.0022851305], 0, 60.52490162849426, 1612239402.3274755], "version": 0.2, "tvm_version": "0.8.dev0"}
{"input": ["opencl -keys=opencl,gpu -max_num_threads=256", "tutorial/conv2d_no_batching", [1, 40, 40, 512, 256, 1, 1, [1, 1], [0, 0]], {}], "config": {"index": 3171, "code_hash": null, "entity": [["tile_ic", "sp", [-1, 1, 4]], ["tile_oc", "sp", [-1, 32]], ["tile_ow", "sp", [-1, 2, 2]], ["tile_oh", "sp", [-1, 2, 2]]]}, "result": [[0.002020094], 0, 65.24280023574829, 1612239407.0600855], "version": 0.2, "tvm_version": "0.8.dev0"}
{"input": ["opencl -keys=opencl,gpu -max_num_threads=256", "tutorial/conv2d_no_batching", [1, 40, 40, 512, 256, 1, 1, [1, 1], [0, 0]], {}], "config": {"index": 1659, "code_hash": null, "entity": [["tile_ic", "sp", [-1, 1, 4]], ["tile_oc", "sp", [-1, 32]], ["tile_ow", "sp", [-1, 2, 2]], ["tile_oh", "sp", [-1, 1, 2]]]}, "result": [[0.0019287866], 0, 70.093416929245, 1612239411.9217613], "version": 0.2, "tvm_version": "0.8.dev0"}
{"input": ["opencl -keys=opencl,gpu -max_num_threads=256", "tutorial/conv2d_no_batching", [1, 40, 40, 512, 256, 1, 1, [1, 1], [0, 0]], {}], "config": {"index": 6643, "code_hash": null, "entity": [["tile_ic", "sp", [-1, 1, 4]], ["tile_oc", "sp", [-1, 32]], ["tile_ow", "sp", [-1, 2, 4]], ["tile_oh", "sp", [-1, 5, 2]]]}, "result": [[0.0021596304], 0, 74.89990162849426, 1612239416.7107368], "version": 0.2, "tvm_version": "0.8.dev0"}
{"input": ["opencl -keys=opencl,gpu -max_num_threads=256", "tutorial/conv2d_no_batching", [1, 40, 40, 512, 256, 1, 1, [1, 1], [0, 0]], {}], "config": {"index": 1673, "code_hash": null, "entity": [["tile_ic", "sp", [-1, 1, 4]], ["tile_oc", "sp", [-1, 128]], ["tile_ow", "sp", [-1, 2, 2]], ["tile_oh", "sp", [-1, 1, 2]]]}, "result": [[0.0019091199999999998], 0, 4.6825737953186035, 1612239422.2496257], "version": 0.2, "tvm_version": "0.8.dev0"}
{"input": ["opencl -keys=opencl,gpu -max_num_threads=256", "tutorial/conv2d_no_batching", [1, 40, 40, 512, 256, 1, 1, [1, 1], [0, 0]], {}], "config": {"index": 4627, "code_hash": null, "entity": [["tile_ic", "sp", [-1, 1, 4]], ["tile_oc", "sp", [-1, 32]], ["tile_ow", "sp", [-1, 1, 2]], ["tile_oh", "sp", [-1, 4, 2]]]}, "result": [[0.0018774065], 0, 9.630449295043945, 1612239427.212584], "version": 0.2, "tvm_version": "0.8.dev0"}
{"input": ["opencl -keys=opencl,gpu -max_num_threads=256", "tutorial/conv2d_no_batching", [1, 40, 40, 512, 256, 1, 1, [1, 1], [0, 0]], {}], "config": {"index": 5082, "code_hash": null, "entity": [["tile_ic", "sp", [-1, 1, 4]], ["tile_oc", "sp", [-1, 64]], ["tile_ow", "sp", [-1, 1, 4]], ["tile_oh", "sp", [-1, 4, 2]]]}, "result": [[0.0021094117], 0, 14.80961561203003, 1612239432.3739672], "version": 0.2, "tvm_version": "0.8.dev0"}
{"input": ["opencl -keys=opencl,gpu -max_num_threads=256", "tutorial/conv2d_no_batching", [1, 40, 40, 512, 256, 1, 1, [1, 1], [0, 0]], {}], "config": {"index": 6147, "code_hash": null, "entity": [["tile_ic", "sp", [-1, 2, 4]], ["tile_oc", "sp", [-1, 64]], ["tile_ow", "sp", [-1, 1, 2]], ["tile_oh", "sp", [-1, 5, 2]]]}, "result": [[0.0023101981], 0, 19.873186349868774, 1612239437.4510057], "version": 0.2, "tvm_version": "0.8.dev0"}
{"input": ["opencl -keys=opencl,gpu -max_num_threads=256", "tutorial/conv2d_no_batching", [1, 40, 40, 512, 256, 1, 1, [1, 1], [0, 0]], {}], "config": {"index": 3179, "code_hash": null, "entity": [["tile_ic", "sp", [-1, 2, 4]], ["tile_oc", "sp", [-1, 64]], ["tile_ow", "sp", [-1, 2, 2]], ["tile_oh", "sp", [-1, 2, 2]]]}, "result": [[0.0022602658000000003], 0, 29.919265508651733, 1612239447.4411662], "version": 0.2, "tvm_version": "0.8.dev0"}
{"input": ["opencl -keys=opencl,gpu -max_num_threads=256", "tutorial/conv2d_no_batching", [1, 40, 40, 512, 256, 1, 1, [1, 1], [0, 0]], {}], "config": {"index": 1617, "code_hash": null, "entity": [["tile_ic", "sp", [-1, 1, 4]], ["tile_oc", "sp", [-1, 128]], ["tile_ow", "sp", [-1, 1, 2]], ["tile_oh", "sp", [-1, 1, 2]]]}, "result": [[0.0020984949999999997], 0, 24.92737102508545, 1612239442.5412781], "version": 0.2, "tvm_version": "0.8.dev0"}
{"input": ["opencl -keys=opencl,gpu -max_num_threads=256", "tutorial/conv2d_no_batching", [1, 40, 40, 512, 256, 1, 1, [1, 1], [0, 0]], {}], "config": {"index": 4795, "code_hash": null, "entity": [["tile_ic", "sp", [-1, 1, 4]], ["tile_oc", "sp", [-1, 32]], ["tile_ow", "sp", [-1, 5, 2]], ["tile_oh", "sp", [-1, 4, 2]]]}, "result": [[0.0019137918], 0, 34.7327024936676, 1612239452.3313708], "version": 0.2, "tvm_version": "0.8.dev0"}
{"input": ["opencl -keys=opencl,gpu -max_num_threads=256", "tutorial/conv2d_no_batching", [1, 40, 40, 512, 256, 1, 1, [1, 1], [0, 0]], {}], "config": {"index": 6237, "code_hash": null, "entity": [["tile_ic", "sp", [-1, 1, 4]], ["tile_oc", "sp", [-1, 8]], ["tile_ow", "sp", [-1, 4, 2]], ["tile_oh", "sp", [-1, 5, 2]]]}, "result": [[0.0022969377], 0, 39.60771036148071, 1612239457.2206562], "version": 0.2, "tvm_version": "0.8.dev0"}
{"input": ["opencl -keys=opencl,gpu -max_num_threads=256", "tutorial/conv2d_no_batching", [1, 40, 40, 512, 256, 1, 1, [1, 1], [0, 0]], {}], "config": {"index": 3115, "code_hash": null, "entity": [["tile_ic", "sp", [-1, 1, 4]], ["tile_oc", "sp", [-1, 32]], ["tile_ow", "sp", [-1, 1, 2]], ["tile_oh", "sp", [-1, 2, 2]]]}, "result": [[0.0020607346], 0, 54.28989839553833, 1612239471.9156172], "version": 0.2, "tvm_version": "0.8.dev0"}
{"input": ["opencl -keys=opencl,gpu -max_num_threads=256", "tutorial/conv2d_no_batching", [1, 40, 40, 512, 256, 1, 1, [1, 1], [0, 0]], {}], "config": {"index": 3234, "code_hash": null, "entity": [["tile_ic", "sp", [-1, 1, 4]], ["tile_oc", "sp", [-1, 64]], ["tile_ow", "sp", [-1, 4, 2]], ["tile_oh", "sp", [-1, 2, 2]]]}, "result": [[0.0019633075], 0, 49.50500202178955, 1612239467.1217926], "version": 0.2, "tvm_version": "0.8.dev0"}
{"input": ["opencl -keys=opencl,gpu -max_num_threads=256", "tutorial/conv2d_no_batching", [1, 40, 40, 512, 256, 1, 1, [1, 1], [0, 0]], {}], "config": {"index": 13706, "code_hash": null, "entity": [["tile_ic", "sp", [-1, 1, 4]], ["tile_oc", "sp", [-1, 64]], ["tile_ow", "sp", [-1, 1, 2]], ["tile_oh", "sp", [-1, 1, 4]]]}, "result": [[0.0022911825], 0, 44.65296983718872, 1612239462.2208898], "version": 0.2, "tvm_version": "0.8.dev0"}
{"input": ["opencl -keys=opencl,gpu -max_num_threads=256", "tutorial/conv2d_no_batching", [1, 40, 40, 512, 256, 1, 1, [1, 1], [0, 0]], {}], "config": {"index": 9170, "code_hash": null, "entity": [["tile_ic", "sp", [-1, 1, 4]], ["tile_oc", "sp", [-1, 64]], ["tile_ow", "sp", [-1, 1, 2]], ["tile_oh", "sp", [-1, 10, 2]]]}, "result": [[0.0020546044], 0, 59.116833448410034, 1612239476.7471204], "version": 0.2, "tvm_version": "0.8.dev0"}
{"input": ["opencl -keys=opencl,gpu -max_num_threads=256", "tutorial/conv2d_no_batching", [1, 40, 40, 512, 256, 1, 1, [1, 1], [0, 0]], {}], "config": {"index": 3220, "code_hash": null, "entity": [["tile_ic", "sp", [-1, 1, 4]], ["tile_oc", "sp", [-1, 16]], ["tile_ow", "sp", [-1, 4, 2]], ["tile_oh", "sp", [-1, 2, 2]]]}, "result": [[0.001938245], 0, 64.06036949157715, 1612239481.7027423], "version": 0.2, "tvm_version": "0.8.dev0"}
{"input": ["opencl -keys=opencl,gpu -max_num_threads=256", "tutorial/conv2d_no_batching", [1, 40, 40, 512, 256, 1, 1, [1, 1], [0, 0]], {}], "config": {"index": 9611, "code_hash": null, "entity": [["tile_ic", "sp", [-1, 1, 4]], ["tile_oc", "sp", [-1, 32]], ["tile_ow", "sp", [-1, 1, 4]], ["tile_oh", "sp", [-1, 10, 2]]]}, "result": [[0.0022129480999999998], 0, 69.09220170974731, 1612239486.7290852], "version": 0.2, "tvm_version": "0.8.dev0"}
{"input": ["opencl -keys=opencl,gpu -max_num_threads=256", "tutorial/conv2d_no_batching", [1, 40, 40, 512, 256, 1, 1, [1, 1], [0, 0]], {}], "config": {"index": 9164, "code_hash": null, "entity": [["tile_ic", "sp", [-1, 2, 4]], ["tile_oc", "sp", [-1, 32]], ["tile_ow", "sp", [-1, 1, 2]], ["tile_oh", "sp", [-1, 10, 2]]]}, "result": [[0.0023171929], 0, 79.134840965271, 1612239496.7819538], "version": 0.2, "tvm_version": "0.8.dev0"}
{"input": ["opencl -keys=opencl,gpu -max_num_threads=256", "tutorial/conv2d_no_batching", [1, 40, 40, 512, 256, 1, 1, [1, 1], [0, 0]], {}], "config": {"index": 4725, "code_hash": null, "entity": [["tile_ic", "sp", [-1, 1, 4]], ["tile_oc", "sp", [-1, 8]], ["tile_ow", "sp", [-1, 4, 2]], ["tile_oh", "sp", [-1, 4, 2]]]}, "result": [[0.0020941148], 0, 73.94539594650269, 1612239491.610036], "version": 0.2, "tvm_version": "0.8.dev0"}
{"input": ["opencl -keys=opencl,gpu -max_num_threads=256", "tutorial/conv2d_no_batching", [1, 40, 40, 512, 256, 1, 1, [1, 1], [0, 0]], {}], "config": {"index": 5131, "code_hash": null, "entity": [["tile_ic", "sp", [-1, 1, 4]], ["tile_oc", "sp", [-1, 32]], ["tile_ow", "sp", [-1, 2, 4]], ["tile_oh", "sp", [-1, 4, 2]]]}, "result": [[0.0021204013], 0, 4.7807838916778564, 1612239518.6956995], "version": 0.2, "tvm_version": "0.8.dev0"}
{"input": ["opencl -keys=opencl,gpu -max_num_threads=256", "tutorial/conv2d_no_batching", [1, 40, 40, 512, 256, 1, 1, [1, 1], [0, 0]], {}], "config": {"index": 1722, "code_hash": null, "entity": [["tile_ic", "sp", [-1, 1, 4]], ["tile_oc", "sp", [-1, 64]], ["tile_ow", "sp", [-1, 4, 2]], ["tile_oh", "sp", [-1, 1, 2]]]}, "result": [[0.0019001615999999998], 0, 9.810758352279663, 1612239523.7146604], "version": 0.2, "tvm_version": "0.8.dev0"}
{"input": ["opencl -keys=opencl,gpu -max_num_threads=256", "tutorial/conv2d_no_batching", [1, 40, 40, 512, 256, 1, 1, [1, 1], [0, 0]], {}], "config": {"index": 4796, "code_hash": null, "entity": [["tile_ic", "sp", [-1, 2, 4]], ["tile_oc", "sp", [-1, 32]], ["tile_ow", "sp", [-1, 5, 2]], ["tile_oh", "sp", [-1, 4, 2]]]}, "result": [[0.0022745418], 0, 14.840079545974731, 1612239528.7812855], "version": 0.2, "tvm_version": "0.8.dev0"}
{"input": ["opencl -keys=opencl,gpu -max_num_threads=256", "tutorial/conv2d_no_batching", [1, 40, 40, 512, 256, 1, 1, [1, 1], [0, 0]], {}], "config": {"index": 5075, "code_hash": null, "entity": [["tile_ic", "sp", [-1, 1, 4]], ["tile_oc", "sp", [-1, 32]], ["tile_ow", "sp", [-1, 1, 4]], ["tile_oh", "sp", [-1, 4, 2]]]}, "result": [[0.0021687867], 0, 39.54590964317322, 1612239553.4667642], "version": 0.2, "tvm_version": "0.8.dev0"}
{"input": ["opencl -keys=opencl,gpu -max_num_threads=256", "tutorial/conv2d_no_batching", [1, 40, 40, 512, 256, 1, 1, [1, 1], [0, 0]], {}], "config": {"index": 6307, "code_hash": null, "entity": [["tile_ic", "sp", [-1, 1, 4]], ["tile_oc", "sp", [-1, 32]], ["tile_ow", "sp", [-1, 5, 2]], ["tile_oh", "sp", [-1, 5, 2]]]}, "result": [[0.0020568803999999998], 0, 24.652995347976685, 1612239538.6218896], "version": 0.2, "tvm_version": "0.8.dev0"}
{"input": ["opencl -keys=opencl,gpu -max_num_threads=256", "tutorial/conv2d_no_batching", [1, 40, 40, 512, 256, 1, 1, [1, 1], [0, 0]], {}], "config": {"index": 9324, "code_hash": null, "entity": [["tile_ic", "sp", [-1, 1, 4]], ["tile_oc", "sp", [-1, 16]], ["tile_ow", "sp", [-1, 5, 2]], ["tile_oh", "sp", [-1, 10, 2]]]}, "result": [[0.0022396878], 0, 19.71869134902954, 1612239533.7004874], "version": 0.2, "tvm_version": "0.8.dev0"}
{"input": ["opencl -keys=opencl,gpu -max_num_threads=256", "tutorial/conv2d_no_batching", [1, 40, 40, 512, 256, 1, 1, [1, 1], [0, 0]], {}], "config": {"index": 6153, "code_hash": null, "entity": [["tile_ic", "sp", [-1, 1, 4]], ["tile_oc", "sp", [-1, 128]], ["tile_ow", "sp", [-1, 1, 2]], ["tile_oh", "sp", [-1, 5, 2]]]}, "result": [[0.0019049792999999999], 0, 29.449456930160522, 1612239543.4366555], "version": 0.2, "tvm_version": "0.8.dev0"}
{"input": ["opencl -keys=opencl,gpu -max_num_threads=256", "tutorial/conv2d_no_batching", [1, 40, 40, 512, 256, 1, 1, [1, 1], [0, 0]], {}], "config": {"index": 4789, "code_hash": null, "entity": [["tile_ic", "sp", [-1, 2, 4]], ["tile_oc", "sp", [-1, 16]], ["tile_ow", "sp", [-1, 5, 2]], ["tile_oh", "sp", [-1, 4, 2]]]}, "result": [[0.002428995], 0, 34.57789969444275, 1612239548.5525713], "version": 0.2, "tvm_version": "0.8.dev0"}
{"input": ["opencl -keys=opencl,gpu -max_num_threads=256", "tutorial/conv2d_no_batching", [1, 40, 40, 512, 256, 1, 1, [1, 1], [0, 0]], {}], "config": {"index": 6245, "code_hash": null, "entity": [["tile_ic", "sp", [-1, 2, 4]], ["tile_oc", "sp", [-1, 16]], ["tile_ow", "sp", [-1, 4, 2]], ["tile_oh", "sp", [-1, 5, 2]]]}, "result": [[0.0023530159], 0, 44.587859869003296, 1612239558.5613074], "version": 0.2, "tvm_version": "0.8.dev0"}
{"input": ["opencl -keys=opencl,gpu -max_num_threads=256", "tutorial/conv2d_no_batching", [1, 40, 40, 512, 256, 1, 1, [1, 1], [0, 0]], {}], "config": {"index": 13755, "code_hash": null, "entity": [["tile_ic", "sp", [-1, 1, 4]], ["tile_oc", "sp", [-1, 32]], ["tile_ow", "sp", [-1, 2, 2]], ["tile_oh", "sp", [-1, 1, 4]]]}, "result": [[0.0021804794], 0, 49.53881621360779, 1612239563.514866], "version": 0.2, "tvm_version": "0.8.dev0"}
{"input": ["opencl -keys=opencl,gpu -max_num_threads=256", "tutorial/conv2d_no_batching", [1, 40, 40, 512, 256, 1, 1, [1, 1], [0, 0]], {}], "config": {"index": 4635, "code_hash": null, "entity": [["tile_ic", "sp", [-1, 2, 4]], ["tile_oc", "sp", [-1, 64]], ["tile_ow", "sp", [-1, 1, 2]], ["tile_oh", "sp", [-1, 4, 2]]]}, "result": [[0.0022812659], 0, 54.74465012550354, 1612239568.732811], "version": 0.2, "tvm_version": "0.8.dev0"}
