test_and_tune/android.mobilenet_v1_1.0_224rs.log.tmp
{"input": ["opencl -keys=mali,opencl,gpu -device=mali -max_num_threads=256", "conv2d_nchw_spatial_pack_io.mali", [["TENSOR", [1, 256, 14, 14], "float32"], ["TENSOR", [256, 512, 1, 1], "float32"], [2, 2], [0, 0, 0, 0], [1, 1], "float32"], {}], "config": {"index": 65389, "code_hash": null, "entity": [["tile_co", "sp", [-1, 1, 128]], ["tile_oh", "sp", [-1, 1, 1]], ["tile_ow", "sp", [-1, 1, 1]], ["reorder_0", "re", [0, 1, 2, 3, 4, 5, 6, 7, 8, 9]], ["ann_reduce", "an", ["unroll", "none"]], ["ann_spatial", "an", ["vec", "none", "none"]]]}, "result": [[0.055227026199999994], 0, 9.187405109405518, 1614824678.400247], "version": 0.2, "tvm_version": "0.8.dev0"}
{"input": ["opencl -keys=mali,opencl,gpu -device=mali -max_num_threads=256", "conv2d_nchw_spatial_pack_io.mali", [["TENSOR", [1, 128, 28, 28], "float32"], ["TENSOR", [128, 256, 1, 1], "float32"], [2, 2], [0, 0, 0, 0], [1, 1], "float32"], {}], "config": {"index": 246935, "code_hash": null, "entity": [["tile_co", "sp", [-1, 8, 4]], ["tile_oh", "sp", [-1, 1, 7]], ["tile_ow", "sp", [-1, 1, 7]], ["reorder_0", "re", [0, 1, 2, 3, 4, 5, 6, 9, 7, 8]], ["ann_reduce", "an", ["none", "unroll"]], ["ann_spatial", "an", ["unroll", "none", "none"]]]}, "result": [[0.0252431484], 0, 9.27011227607727, 1614824709.266688], "version": 0.2, "tvm_version": "0.8.dev0"}
{"input": ["opencl -keys=mali,opencl,gpu -device=mali -max_num_threads=256", "conv2d_nchw_spatial_pack_io.mali", [["TENSOR", [1, 64, 56, 56], "float32"], ["TENSOR", [64, 128, 1, 1], "float32"], [2, 2], [0, 0, 0, 0], [1, 1], "float32"], {}], "config": {"index": 695777, "code_hash": null, "entity": [["tile_co", "sp", [-1, 32, 1]], ["tile_oh", "sp", [-1, 2, 7]], ["tile_ow", "sp", [-1, 7, 4]], ["reorder_0", "re", [0, 1, 2, 3, 4, 5, 6, 9, 7, 8]], ["ann_reduce", "an", ["none", "unroll"]], ["ann_spatial", "an", ["none", "vec", "unroll"]]]}, "result": [[0.0086602612], 0, 8.701875448226929, 1614824739.9434223], "version": 0.2, "tvm_version": "0.8.dev0"}
{"input": ["opencl -keys=mali,opencl,gpu -device=mali -max_num_threads=256", "conv2d_nchw_spatial_pack_io.mali", [["TENSOR", [1, 64, 56, 56], "float32"], ["TENSOR", [64, 64, 1, 1], "float32"], [1, 1], [0, 0, 0, 0], [1, 1], "float32"], {}], "config": {"index": 2612463, "code_hash": null, "entity": [["tile_co", "sp", [-1, 1, 2]], ["tile_oh", "sp", [-1, 4, 1]], ["tile_ow", "sp", [-1, 4, 7]], ["reorder_0", "re", [0, 1, 2, 3, 4, 5, 6, 9, 7, 8]], ["ann_reduce", "an", ["unroll", "unroll"]], ["ann_spatial", "an", ["unroll", "unroll", "unroll"]]]}, "result": [[0.0058892194], 0, 8.938249111175537, 1614824803.6161368], "version": 0.2, "tvm_version": "0.8.dev0"}
