test_and_tune/android.topi_depthwise_normal.log.tmp
{"input": ["opencl -keys=mali,opencl,gpu -device=mali -max_num_threads=256", "tutorial/conv2d_no_batching", [1, 64, 64, 512, 256, 3, 3, [1, 1], [1, 1]], {}], "config": {"index": 461906, "code_hash": null, "entity": [["tile_c", "sp", [-1, 4, 8]], ["tile_y", "sp", [-1, 8, 4]], ["tile_x", "sp", [-1, 4, 1]], ["ann_spatial", "an", ["unroll", "unroll", "vec"]]]}, "result": [[0.008521448800000001], 0, 28.297268867492676, 1614913089.8714259], "version": 0.2, "tvm_version": "0.8.dev0"}
{"input": ["opencl -keys=mali,opencl,gpu -device=mali -max_num_threads=256", "tutorial/conv2d_no_batching", [1, 64, 64, 512, 256, 3, 3, [1, 1], [1, 1]], {}], "config": {"index": 271885, "code_hash": null, "entity": [["tile_c", "sp", [-1, 2, 64]], ["tile_y", "sp", [-1, 8, 8]], ["tile_x", "sp", [-1, 2, 8]], ["ann_spatial", "an", ["none", "vec", "unroll"]]]}, "result": [[0.0151276734], 0, 57.13332009315491, 1614913118.6401458], "version": 0.2, "tvm_version": "0.8.dev0"}
{"input": ["opencl -keys=mali,opencl,gpu -device=mali -max_num_threads=256", "tutorial/conv2d_no_batching", [1, 64, 64, 512, 256, 3, 3, [1, 1], [1, 1]], {}], "config": {"index": 34837, "code_hash": null, "entity": [["tile_c", "sp", [-1, 128, 1]], ["tile_y", "sp", [-1, 1, 8]], ["tile_x", "sp", [-1, 1, 64]], ["ann_spatial", "an", ["none", "none", "none"]]]}, "result": [[0.0451575305], 0, 14.001653671264648, 1614913075.495399], "version": 0.2, "tvm_version": "0.8.dev0"}
{"input": ["opencl -keys=mali,opencl,gpu -device=mali -max_num_threads=256", "tutorial/conv2d_no_batching", [1, 64, 64, 512, 256, 3, 3, [1, 1], [1, 1]], {}], "config": {"index": 282626, "code_hash": null, "entity": [["tile_c", "sp", [-1, 4, 8]], ["tile_y", "sp", [-1, 2, 2]], ["tile_x", "sp", [-1, 1, 1]], ["ann_spatial", "an", ["unroll", "none", "none"]]]}, "result": [[0.0124736731], 0, 42.787378549575806, 1614913104.303953], "version": 0.2, "tvm_version": "0.8.dev0"}
{"input": ["opencl -keys=mali,opencl,gpu -device=mali -max_num_threads=256", "tutorial/conv2d_no_batching", [1, 64, 64, 512, 256, 3, 3, [1, 1], [1, 1]], {}], "config": {"index": 518467, "code_hash": null, "entity": [["tile_c", "sp", [-1, 32, 4]], ["tile_y", "sp", [-1, 1, 4]], ["tile_x", "sp", [-1, 2, 8]], ["ann_spatial", "an", ["unroll", "vec", "none"]]]}, "result": [[0.017832277799999997], 0, 112.0814733505249, 1614913174.4174707], "version": 0.2, "tvm_version": "0.8.dev0"}
{"input": ["opencl -keys=mali,opencl,gpu -device=mali -max_num_threads=256", "tutorial/conv2d_no_batching", [1, 64, 64, 512, 256, 3, 3, [1, 1], [1, 1]], {}], "config": {"index": 604755, "code_hash": null, "entity": [["tile_c", "sp", [-1, 1, 1]], ["tile_y", "sp", [-1, 1, 64]], ["tile_x", "sp", [-1, 8, 1]], ["ann_spatial", "an", ["vec", "none", "unroll"]]]}, "result": [[0.025895273400000002], 0, 84.25288701057434, 1614913146.4789257], "version": 0.2, "tvm_version": "0.8.dev0"}
{"input": ["opencl -keys=mali,opencl,gpu -device=mali -max_num_threads=256", "tutorial/conv2d_no_batching", [1, 64, 64, 512, 256, 3, 3, [1, 1], [1, 1]], {}], "config": {"index": 55479, "code_hash": null, "entity": [["tile_c", "sp", [-1, 1, 64]], ["tile_y", "sp", [-1, 1, 1]], ["tile_x", "sp", [-1, 8, 4]], ["ann_spatial", "an", ["none", "none", "unroll"]]]}, "result": [[0.025278638], 0, 71.34696435928345, 1614913132.9522495], "version": 0.2, "tvm_version": "0.8.dev0"}
{"input": ["opencl -keys=mali,opencl,gpu -device=mali -max_num_threads=256", "tutorial/conv2d_no_batching", [1, 64, 64, 512, 256, 3, 3, [1, 1], [1, 1]], {}], "config": {"index": 76479, "code_hash": null, "entity": [["tile_c", "sp", [-1, 1, 8]], ["tile_y", "sp", [-1, 2, 8]], ["tile_x", "sp", [-1, 16, 1]], ["ann_spatial", "an", ["none", "none", "vec"]]]}, "result": [[0.0231823096], 0, 98.19296336174011, 1614913160.6269267], "version": 0.2, "tvm_version": "0.8.dev0"}
{"input": ["opencl -keys=mali,opencl,gpu -device=mali -max_num_threads=256", "tutorial/conv2d_no_batching", [1, 64, 64, 512, 256, 3, 3, [1, 1], [1, 1]], {}], "config": {"index": 314152, "code_hash": null, "entity": [["tile_c", "sp", [-1, 128, 1]], ["tile_y", "sp", [-1, 4, 2]], ["tile_x", "sp", [-1, 1, 32]], ["ann_spatial", "an", ["unroll", "none", "none"]]]}, "result": [[0.0253108931], 0, 13.61333680152893, 1614913209.7608328], "version": 0.2, "tvm_version": "0.8.dev0"}
{"input": ["opencl -keys=mali,opencl,gpu -device=mali -max_num_threads=256", "tutorial/conv2d_no_batching", [1, 64, 64, 512, 256, 3, 3, [1, 1], [1, 1]], {}], "config": {"index": 383864, "code_hash": null, "entity": [["tile_c", "sp", [-1, 32, 2]], ["tile_y", "sp", [-1, 1, 8]], ["tile_x", "sp", [-1, 4, 16]], ["ann_spatial", "an", ["unroll", "none", "vec"]]]}, "result": [[0.012597204400000001], 0, 55.474159955978394, 1614913251.8282251], "version": 0.2, "tvm_version": "0.8.dev0"}
{"input": ["opencl -keys=mali,opencl,gpu -device=mali -max_num_threads=256", "tutorial/conv2d_no_batching", [1, 64, 64, 512, 256, 3, 3, [1, 1], [1, 1]], {}], "config": {"index": 346084, "code_hash": null, "entity": [["tile_c", "sp", [-1, 16, 16]], ["tile_y", "sp", [-1, 1, 8]], ["tile_x", "sp", [-1, 1, 16]], ["ann_spatial", "an", ["unroll", "none", "unroll"]]]}, "result": [[0.0116657928], 0, 28.23629140853882, 1614913224.2648458], "version": 0.2, "tvm_version": "0.8.dev0"}
{"input": ["opencl -keys=mali,opencl,gpu -device=mali -max_num_threads=256", "tutorial/conv2d_no_batching", [1, 64, 64, 512, 256, 3, 3, [1, 1], [1, 1]], {}], "config": {"index": 306113, "code_hash": null, "entity": [["tile_c", "sp", [-1, 64, 4]], ["tile_y", "sp", [-1, 2, 32]], ["tile_x", "sp", [-1, 1, 8]], ["ann_spatial", "an", ["unroll", "none", "none"]]]}, "result": [[0.0119668762], 0, 41.89076781272888, 1614913238.2447627], "version": 0.2, "tvm_version": "0.8.dev0"}
{"input": ["opencl -keys=mali,opencl,gpu -device=mali -max_num_threads=256", "tutorial/conv2d_no_batching", [1, 64, 64, 512, 256, 3, 3, [1, 1], [1, 1]], {}], "config": {"index": 482786, "code_hash": null, "entity": [["tile_c", "sp", [-1, 4, 8]], ["tile_y", "sp", [-1, 16, 1]], ["tile_x", "sp", [-1, 2, 8]], ["ann_spatial", "an", ["unroll", "unroll", "vec"]]]}, "result": [[0.009437011300000001], 0, 81.97559690475464, 1614913278.3258536], "version": 0.2, "tvm_version": "0.8.dev0"}
{"input": ["opencl -keys=mali,opencl,gpu -device=mali -max_num_threads=256", "tutorial/conv2d_no_batching", [1, 64, 64, 512, 256, 3, 3, [1, 1], [1, 1]], {}], "config": {"index": 688008, "code_hash": null, "entity": [["tile_c", "sp", [-1, 8, 1]], ["tile_y", "sp", [-1, 2, 1]], ["tile_x", "sp", [-1, 2, 4]], ["ann_spatial", "an", ["vec", "unroll", "unroll"]]]}, "result": [[0.0059051308], 0, 111.01374554634094, 1614913307.3465977], "version": 0.2, "tvm_version": "0.8.dev0"}
{"input": ["opencl -keys=mali,opencl,gpu -device=mali -max_num_threads=256", "tutorial/conv2d_no_batching", [1, 64, 64, 512, 256, 3, 3, [1, 1], [1, 1]], {}], "config": {"index": 460428, "code_hash": null, "entity": [["tile_c", "sp", [-1, 8, 16]], ["tile_y", "sp", [-1, 16, 2]], ["tile_x", "sp", [-1, 2, 1]], ["ann_spatial", "an", ["unroll", "unroll", "vec"]]]}, "result": [[0.008043792499999999], 0, 68.58566355705261, 1614913264.9331884], "version": 0.2, "tvm_version": "0.8.dev0"}
{"input": ["opencl -keys=mali,opencl,gpu -device=mali -max_num_threads=256", "tutorial/conv2d_no_batching", [1, 64, 64, 512, 256, 3, 3, [1, 1], [1, 1]], {}], "config": {"index": 134161, "code_hash": null, "entity": [["tile_c", "sp", [-1, 128, 2]], ["tile_y", "sp", [-1, 1, 4]], ["tile_x", "sp", [-1, 1, 16]], ["ann_spatial", "an", ["none", "unroll", "none"]]]}, "result": [[0.0376848683], 0, 128.40872430801392, 1614913324.7736723], "version": 0.2, "tvm_version": "0.8.dev0"}
{"input": ["opencl -keys=mali,opencl,gpu -device=mali -max_num_threads=256", "tutorial/conv2d_no_batching", [1, 64, 64, 512, 256, 3, 3, [1, 1], [1, 1]], {}], "config": {"index": 469770, "code_hash": null, "entity": [["tile_c", "sp", [-1, 64, 2]], ["tile_y", "sp", [-1, 2, 16]], ["tile_x", "sp", [-1, 2, 2]], ["ann_spatial", "an", ["unroll", "unroll", "vec"]]]}, "result": [[0.0072290060000000005], 0, 14.307225704193115, 1614913361.735379], "version": 0.2, "tvm_version": "0.8.dev0"}
{"input": ["opencl -keys=mali,opencl,gpu -device=mali -max_num_threads=256", "tutorial/conv2d_no_batching", [1, 64, 64, 512, 256, 3, 3, [1, 1], [1, 1]], {}], "config": {"index": 170814, "code_hash": null, "entity": [["tile_c", "sp", [-1, 1, 64]], ["tile_y", "sp", [-1, 4, 4]], ["tile_x", "sp", [-1, 2, 16]], ["ann_spatial", "an", ["none", "unroll", "unroll"]]]}, "result": [[0.029699930000000003], 0, 58.769367933273315, 1614913406.079444], "version": 0.2, "tvm_version": "0.8.dev0"}
{"input": ["opencl -keys=mali,opencl,gpu -device=mali -max_num_threads=256", "tutorial/conv2d_no_batching", [1, 64, 64, 512, 256, 3, 3, [1, 1], [1, 1]], {}], "config": {"index": 331385, "code_hash": null, "entity": [["tile_c", "sp", [-1, 32, 1]], ["tile_y", "sp", [-1, 1, 1]], ["tile_x", "sp", [-1, 16, 2]], ["ann_spatial", "an", ["unroll", "none", "unroll"]]]}, "result": [[0.0040478859], 0, 88.3843879699707, 1614913435.911179], "version": 0.2, "tvm_version": "0.8.dev0"}
{"input": ["opencl -keys=mali,opencl,gpu -device=mali -max_num_threads=256", "tutorial/conv2d_no_batching", [1, 64, 64, 512, 256, 3, 3, [1, 1], [1, 1]], {}], "config": {"index": 81285, "code_hash": null, "entity": [["tile_c", "sp", [-1, 64, 2]], ["tile_y", "sp", [-1, 2, 4]], ["tile_x", "sp", [-1, 2, 2]], ["ann_spatial", "an", ["none", "none", "vec"]]]}, "result": [[0.0050794588000000005], 0, 42.986063957214355, 1614913390.456576], "version": 0.2, "tvm_version": "0.8.dev0"}
{"input": ["opencl -keys=mali,opencl,gpu -device=mali -max_num_threads=256", "tutorial/conv2d_no_batching", [1, 64, 64, 512, 256, 3, 3, [1, 1], [1, 1]], {}], "config": {"index": 548310, "code_hash": null, "entity": [["tile_c", "sp", [-1, 1, 16]], ["tile_y", "sp", [-1, 16, 1]], ["tile_x", "sp", [-1, 4, 4]], ["ann_spatial", "an", ["unroll", "vec", "unroll"]]]}, "result": [[0.0240078618], 0, 29.242950201034546, 1614913376.7660432], "version": 0.2, "tvm_version": "0.8.dev0"}
{"input": ["opencl -keys=mali,opencl,gpu -device=mali -max_num_threads=256", "tutorial/conv2d_no_batching", [1, 64, 64, 512, 256, 3, 3, [1, 1], [1, 1]], {}], "config": {"index": 466270, "code_hash": null, "entity": [["tile_c", "sp", [-1, 2, 8]], ["tile_y", "sp", [-1, 2, 1]], ["tile_x", "sp", [-1, 64, 1]], ["ann_spatial", "an", ["unroll", "unroll", "vec"]]]}, "result": [[0.0133545482], 0, 73.87269234657288, 1614913421.44328], "version": 0.2, "tvm_version": "0.8.dev0"}
{"input": ["opencl -keys=mali,opencl,gpu -device=mali -max_num_threads=256", "tutorial/conv2d_no_batching", [1, 64, 64, 512, 256, 3, 3, [1, 1], [1, 1]], {}], "config": {"index": 291199, "code_hash": null, "entity": [["tile_c", "sp", [-1, 16, 1]], ["tile_y", "sp", [-1, 8, 1]], ["tile_x", "sp", [-1, 1, 2]], ["ann_spatial", "an", ["unroll", "none", "none"]]]}, "result": [[0.006970375700000001], 0, 101.71981739997864, 1614913449.3011756], "version": 0.2, "tvm_version": "0.8.dev0"}
{"input": ["opencl -keys=mali,opencl,gpu -device=mali -max_num_threads=256", "tutorial/conv2d_no_batching", [1, 64, 64, 512, 256, 3, 3, [1, 1], [1, 1]], {}], "config": {"index": 421179, "code_hash": null, "entity": [["tile_c", "sp", [-1, 1, 8]], ["tile_y", "sp", [-1, 1, 2]], ["tile_x", "sp", [-1, 2, 32]], ["ann_spatial", "an", ["unroll", "unroll", "none"]]]}, "result": [[0.0396534675], 0, 115.2630512714386, 1614913462.7780876], "version": 0.2, "tvm_version": "0.8.dev0"}
{"input": ["opencl -keys=mali,opencl,gpu -device=mali -max_num_threads=256", "tutorial/conv2d_no_batching", [1, 64, 64, 512, 256, 3, 3, [1, 1], [1, 1]], {}], "config": {"index": 416353, "code_hash": null, "entity": [["tile_c", "sp", [-1, 16, 2]], ["tile_y", "sp", [-1, 32, 2]], ["tile_x", "sp", [-1, 1, 16]], ["ann_spatial", "an", ["unroll", "unroll", "none"]]]}, "result": [[0.018175038299999998], 0, 144.6583275794983, 1614913492.3236854], "version": 0.2, "tvm_version": "0.8.dev0"}
{"input": ["opencl -keys=mali,opencl,gpu -device=mali -max_num_threads=256", "tutorial/conv2d_no_batching", [1, 64, 64, 512, 256, 3, 3, [1, 1], [1, 1]], {}], "config": {"index": 31959, "code_hash": null, "entity": [["tile_c", "sp", [-1, 1, 2]], ["tile_y", "sp", [-1, 8, 2]], ["tile_x", "sp", [-1, 1, 32]], ["ann_spatial", "an", ["none", "none", "none"]]]}, "result": [[0.028017945500000002], 0, 185.68469715118408, 1614913533.3618674], "version": 0.2, "tvm_version": "0.8.dev0"}
{"input": ["opencl -keys=mali,opencl,gpu -device=mali -max_num_threads=256", "tutorial/conv2d_no_batching", [1, 64, 64, 512, 256, 3, 3, [1, 1], [1, 1]], {}], "config": {"index": 347492, "code_hash": null, "entity": [["tile_c", "sp", [-1, 4, 1]], ["tile_y", "sp", [-1, 1, 16]], ["tile_x", "sp", [-1, 2, 16]], ["ann_spatial", "an", ["unroll", "none", "unroll"]]]}, "result": [[0.0120253815], 0, 171.32832884788513, 1614913518.8688474], "version": 0.2, "tvm_version": "0.8.dev0"}
{"input": ["opencl -keys=mali,opencl,gpu -device=mali -max_num_threads=256", "tutorial/conv2d_no_batching", [1, 64, 64, 512, 256, 3, 3, [1, 1], [1, 1]], {}], "config": {"index": 370311, "code_hash": null, "entity": [["tile_c", "sp", [-1, 64, 1]], ["tile_y", "sp", [-1, 1, 32]], ["tile_x", "sp", [-1, 1, 4]], ["ann_spatial", "an", ["unroll", "none", "vec"]]]}, "result": [[0.0070745424], 0, 157.5761377811432, 1614913505.2453954], "version": 0.2, "tvm_version": "0.8.dev0"}
{"input": ["opencl -keys=mali,opencl,gpu -device=mali -max_num_threads=256", "tutorial/conv2d_no_batching", [1, 64, 64, 512, 256, 3, 3, [1, 1], [1, 1]], {}], "config": {"index": 658243, "code_hash": null, "entity": [["tile_c", "sp", [-1, 16, 8]], ["tile_y", "sp", [-1, 16, 2]], ["tile_x", "sp", [-1, 1, 8]], ["ann_spatial", "an", ["vec", "unroll", "none"]]]}, "result": [[0.009195558199999999], 0, 13.168062448501587, 1614913569.724187], "version": 0.2, "tvm_version": "0.8.dev0"}
{"input": ["opencl -keys=mali,opencl,gpu -device=mali -max_num_threads=256", "tutorial/conv2d_no_batching", [1, 64, 64, 512, 256, 3, 3, [1, 1], [1, 1]], {}], "config": {"index": 140221, "code_hash": null, "entity": [["tile_c", "sp", [-1, 2, 1]], ["tile_y", "sp", [-1, 2, 2]], ["tile_x", "sp", [-1, 1, 64]], ["ann_spatial", "an", ["none", "unroll", "none"]]]}, "result": [[0.0209642781], 0, 27.595136642456055, 1614913584.1392548], "version": 0.2, "tvm_version": "0.8.dev0"}
{"input": ["opencl -keys=mali,opencl,gpu -device=mali -max_num_threads=256", "tutorial/conv2d_no_batching", [1, 64, 64, 512, 256, 3, 3, [1, 1], [1, 1]], {}], "config": {"index": 264666, "code_hash": null, "entity": [["tile_c", "sp", [-1, 16, 4]], ["tile_y", "sp", [-1, 2, 1]], ["tile_x", "sp", [-1, 2, 4]], ["ann_spatial", "an", ["none", "vec", "unroll"]]]}, "result": [[0.0045978129], 0, 56.23563861846924, 1614913612.7766123], "version": 0.2, "tvm_version": "0.8.dev0"}
{"input": ["opencl -keys=mali,opencl,gpu -device=mali -max_num_threads=256", "tutorial/conv2d_no_batching", [1, 64, 64, 512, 256, 3, 3, [1, 1], [1, 1]], {}], "config": {"index": 30546, "code_hash": null, "entity": [["tile_c", "sp", [-1, 2, 32]], ["tile_y", "sp", [-1, 64, 1]], ["tile_x", "sp", [-1, 4, 16]], ["ann_spatial", "an", ["none", "none", "none"]]]}, "result": [[0.025144476500000002], 0, 42.42409920692444, 1614913599.0008028], "version": 0.2, "tvm_version": "0.8.dev0"}
{"input": ["opencl -keys=mali,opencl,gpu -device=mali -max_num_threads=256", "tutorial/conv2d_no_batching", [1, 64, 64, 512, 256, 3, 3, [1, 1], [1, 1]], {}], "config": {"index": 554491, "code_hash": null, "entity": [["tile_c", "sp", [-1, 2, 1]], ["tile_y", "sp", [-1, 4, 1]], ["tile_x", "sp", [-1, 4, 8]], ["ann_spatial", "an", ["unroll", "vec", "unroll"]]]}, "result": [[0.013933121100000001], 0, 69.20748472213745, 1614913625.6391032], "version": 0.2, "tvm_version": "0.8.dev0"}
{"input": ["opencl -keys=mali,opencl,gpu -device=mali -max_num_threads=256", "tutorial/conv2d_no_batching", [1, 64, 64, 512, 256, 3, 3, [1, 1], [1, 1]], {}], "config": {"index": 346652, "code_hash": null, "entity": [["tile_c", "sp", [-1, 1, 4]], ["tile_y", "sp", [-1, 8, 1]], ["tile_x", "sp", [-1, 2, 16]], ["ann_spatial", "an", ["unroll", "none", "unroll"]]]}, "result": [[0.025860893200000002], 0, 139.076434135437, 1614913695.5237966], "version": 0.2, "tvm_version": "0.8.dev0"}
{"input": ["opencl -keys=mali,opencl,gpu -device=mali -max_num_threads=256", "tutorial/conv2d_no_batching", [1, 64, 64, 512, 256, 3, 3, [1, 1], [1, 1]], {}], "config": {"index": 57045, "code_hash": null, "entity": [["tile_c", "sp", [-1, 1, 16]], ["tile_y", "sp", [-1, 1, 2]], ["tile_x", "sp", [-1, 16, 4]], ["ann_spatial", "an", ["none", "none", "unroll"]]]}, "result": [[0.0243402941], 0, 96.49287366867065, 1614913653.0082219], "version": 0.2, "tvm_version": "0.8.dev0"}
{"input": ["opencl -keys=mali,opencl,gpu -device=mali -max_num_threads=256", "tutorial/conv2d_no_batching", [1, 64, 64, 512, 256, 3, 3, [1, 1], [1, 1]], {}], "config": {"index": 629673, "code_hash": null, "entity": [["tile_c", "sp", [-1, 8, 16]], ["tile_y", "sp", [-1, 4, 8]], ["tile_x", "sp", [-1, 2, 16]], ["ann_spatial", "an", ["vec", "none", "unroll"]]]}, "result": [[0.0130294076], 0, 82.1842348575592, 1614913638.563642], "version": 0.2, "tvm_version": "0.8.dev0"}
{"input": ["opencl -keys=mali,opencl,gpu -device=mali -max_num_threads=256", "tutorial/conv2d_no_batching", [1, 64, 64, 512, 256, 3, 3, [1, 1], [1, 1]], {}], "config": {"index": 466839, "code_hash": null, "entity": [["tile_c", "sp", [-1, 1, 2]], ["tile_y", "sp", [-1, 2, 4]], ["tile_x", "sp", [-1, 64, 1]], ["ann_spatial", "an", ["unroll", "unroll", "vec"]]]}, "result": [[0.023026611699999998], 0, 110.58633422851562, 1614913667.2306361], "version": 0.2, "tvm_version": "0.8.dev0"}
{"input": ["opencl -keys=mali,opencl,gpu -device=mali -max_num_threads=256", "tutorial/conv2d_no_batching", [1, 64, 64, 512, 256, 3, 3, [1, 1], [1, 1]], {}], "config": {"index": 16545, "code_hash": null, "entity": [["tile_c", "sp", [-1, 1, 16]], ["tile_y", "sp", [-1, 8, 1]], ["tile_x", "sp", [-1, 1, 4]], ["ann_spatial", "an", ["none", "none", "none"]]]}, "result": [[0.029516435299999998], 0, 152.2352979183197, 1614913709.7652073], "version": 0.2, "tvm_version": "0.8.dev0"}
{"input": ["opencl -keys=mali,opencl,gpu -device=mali -max_num_threads=256", "tutorial/conv2d_no_batching", [1, 64, 64, 512, 256, 3, 3, [1, 1], [1, 1]], {}], "config": {"index": 273654, "code_hash": null, "entity": [["tile_c", "sp", [-1, 1, 2]], ["tile_y", "sp", [-1, 32, 1]], ["tile_x", "sp", [-1, 8, 8]], ["ann_spatial", "an", ["none", "vec", "unroll"]]]}, "result": [[0.0244354556], 0, 124.66559505462646, 1614913681.2817168], "version": 0.2, "tvm_version": "0.8.dev0"}
