test_and_tune/android.image-18.log.tmp
{"input": ["opencl -keys=opencl,gpu -max_num_threads=256", "tutorial/conv2d_no_batching", [1, 38, 38, 512, 256, 1, 1, [1, 1], [1, 1]], {}], "config": {"index": 321343128, "code_hash": null, "entity": [["tile_f", "sp", [-1, 4, 16, 4]], ["tile_y", "sp", [-1, 4, 2, 1]], ["tile_x", "sp", [-1, 1, 5, 1]], ["tile_rc", "sp", [-1, 8, 1]], ["tile_ry", "sp", [-1, 1, 1]], ["tile_rx", "sp", [-1, 1, 1]], ["auto_unroll_max_step", "ot", 512], ["unroll_explicit", "ot", 1]]}, "result": [[0.0396802696], 0, 9.052473306655884, 1609933019.7617831], "version": 0.2, "tvm_version": "0.8.dev0"}
{"input": ["opencl -keys=opencl,gpu -max_num_threads=256", "tutorial/conv2d_no_batching", [1, 38, 38, 512, 256, 1, 1, [1, 1], [1, 1]], {}], "config": {"index": 329494924, "code_hash": null, "entity": [["tile_f", "sp", [-1, 16, 32, 1]], ["tile_y", "sp", [-1, 1, 10, 1]], ["tile_x", "sp", [-1, 2, 1, 1]], ["tile_rc", "sp", [-1, 1, 2]], ["tile_ry", "sp", [-1, 1, 1]], ["tile_rx", "sp", [-1, 1, 1]], ["auto_unroll_max_step", "ot", 512], ["unroll_explicit", "ot", 1]]}, "result": [[0.027880033999999998], 0, 59.2443630695343, 1609933445.413432], "version": 0.2, "tvm_version": "0.8.dev0"}
{"input": ["opencl -keys=opencl,gpu -max_num_threads=256", "tutorial/conv2d_no_batching", [1, 38, 38, 512, 256, 1, 1, [1, 1], [1, 1]], {}], "config": {"index": 131194739, "code_hash": null, "entity": [["tile_f", "sp", [-1, 2, 16, 8]], ["tile_y", "sp", [-1, 2, 5, 1]], ["tile_x", "sp", [-1, 1, 4, 1]], ["tile_rc", "sp", [-1, 8, 1]], ["tile_ry", "sp", [-1, 1, 1]], ["tile_rx", "sp", [-1, 1, 1]], ["auto_unroll_max_step", "ot", 512], ["unroll_explicit", "ot", 0]]}, "result": [[0.0452430306], 0, 37.85301685333252, 1609933713.7482975], "version": 0.2, "tvm_version": "0.8.dev0"}
{"input": ["opencl -keys=opencl,gpu -max_num_threads=256", "tutorial/conv2d_no_batching", [1, 38, 38, 512, 256, 1, 1, [1, 1], [1, 1]], {}], "config": {"index": 131262719, "code_hash": null, "entity": [["tile_f", "sp", [-1, 2, 16, 8]], ["tile_y", "sp", [-1, 1, 2, 1]], ["tile_x", "sp", [-1, 1, 5, 1]], ["tile_rc", "sp", [-1, 8, 1]], ["tile_ry", "sp", [-1, 1, 1]], ["tile_rx", "sp", [-1, 1, 1]], ["auto_unroll_max_step", "ot", 512], ["unroll_explicit", "ot", 0]]}, "result": [[0.0381442382], 0, 80.77211093902588, 1609933756.7203612], "version": 0.2, "tvm_version": "0.8.dev0"}
{"input": ["opencl -keys=opencl,gpu -max_num_threads=256", "tutorial/conv2d_no_batching", [1, 38, 38, 512, 256, 1, 1, [1, 1], [1, 1]], {}], "config": {"index": 321345764, "code_hash": null, "entity": [["tile_f", "sp", [-1, 8, 8, 4]], ["tile_y", "sp", [-1, 1, 8, 1]], ["tile_x", "sp", [-1, 1, 5, 1]], ["tile_rc", "sp", [-1, 8, 1]], ["tile_ry", "sp", [-1, 1, 1]], ["tile_rx", "sp", [-1, 1, 1]], ["auto_unroll_max_step", "ot", 512], ["unroll_explicit", "ot", 1]]}, "result": [[0.0216526532], 0, 16.140432834625244, 1609933778.1260602], "version": 0.2, "tvm_version": "0.8.dev0"}
{"input": ["opencl -keys=opencl,gpu -max_num_threads=256", "tutorial/conv2d_no_batching", [1, 38, 38, 512, 256, 1, 1, [1, 1], [1, 1]], {}], "config": {"index": 319762917, "code_hash": null, "entity": [["tile_f", "sp", [-1, 4, 4, 16]], ["tile_y", "sp", [-1, 1, 20, 1]], ["tile_x", "sp", [-1, 1, 2, 1]], ["tile_rc", "sp", [-1, 4, 1]], ["tile_ry", "sp", [-1, 1, 1]], ["tile_rx", "sp", [-1, 1, 1]], ["auto_unroll_max_step", "ot", 512], ["unroll_explicit", "ot", 1]]}, "result": [[0.0790346172], 0, 5.081426382064819, 1609933784.4910886], "version": 0.2, "tvm_version": "0.8.dev0"}
{"input": ["opencl -keys=opencl,gpu -max_num_threads=256", "tutorial/conv2d_no_batching", [1, 38, 38, 512, 256, 1, 1, [1, 1], [1, 1]], {}], "config": {"index": 321345792, "code_hash": null, "entity": [["tile_f", "sp", [-1, 8, 4, 8]], ["tile_y", "sp", [-1, 1, 8, 1]], ["tile_x", "sp", [-1, 1, 5, 1]], ["tile_rc", "sp", [-1, 8, 1]], ["tile_ry", "sp", [-1, 1, 1]], ["tile_rx", "sp", [-1, 1, 1]], ["auto_unroll_max_step", "ot", 512], ["unroll_explicit", "ot", 1]]}, "result": [[0.0495844633], 0, 9.373075008392334, 1609933788.83648], "version": 0.2, "tvm_version": "0.8.dev0"}
{"input": ["opencl -keys=opencl,gpu -max_num_threads=256", "tutorial/conv2d_no_batching", [1, 38, 38, 512, 256, 1, 1, [1, 1], [1, 1]], {}], "config": {"index": 321274736, "code_hash": null, "entity": [["tile_f", "sp", [-1, 4, 8, 8]], ["tile_y", "sp", [-1, 2, 5, 1]], ["tile_x", "sp", [-1, 1, 4, 1]], ["tile_rc", "sp", [-1, 8, 1]], ["tile_ry", "sp", [-1, 1, 1]], ["tile_rx", "sp", [-1, 1, 1]], ["auto_unroll_max_step", "ot", 512], ["unroll_explicit", "ot", 1]]}, "result": [[0.041679415600000005], 0, 3.682190179824829, 1609933793.6283722], "version": 0.2, "tvm_version": "0.8.dev0"}
{"input": ["opencl -keys=opencl,gpu -max_num_threads=256", "tutorial/conv2d_no_batching", [1, 38, 38, 512, 256, 1, 1, [1, 1], [1, 1]], {}], "config": {"index": 321345759, "code_hash": null, "entity": [["tile_f", "sp", [-1, 16, 4, 4]], ["tile_y", "sp", [-1, 1, 8, 1]], ["tile_x", "sp", [-1, 1, 5, 1]], ["tile_rc", "sp", [-1, 8, 1]], ["tile_ry", "sp", [-1, 1, 1]], ["tile_rx", "sp", [-1, 1, 1]], ["auto_unroll_max_step", "ot", 512], ["unroll_explicit", "ot", 1]]}, "result": [[0.0500890466], 0, 4.22020411491394, 1609933923.885261], "version": 0.2, "tvm_version": "0.8.dev0"}
{"input": ["opencl -keys=opencl,gpu -max_num_threads=256", "tutorial/conv2d_no_batching", [1, 38, 38, 512, 256, 1, 1, [1, 1], [1, 1]], {}], "config": {"index": 321344256, "code_hash": null, "entity": [["tile_f", "sp", [-1, 4, 8, 8]], ["tile_y", "sp", [-1, 2, 4, 1]], ["tile_x", "sp", [-1, 1, 5, 1]], ["tile_rc", "sp", [-1, 8, 1]], ["tile_ry", "sp", [-1, 1, 1]], ["tile_rx", "sp", [-1, 1, 1]], ["auto_unroll_max_step", "ot", 512], ["unroll_explicit", "ot", 1]]}, "result": [[0.0413917072], 0, 8.388254404067993, 1609933928.1006417], "version": 0.2, "tvm_version": "0.8.dev0"}
{"input": ["opencl -keys=opencl,gpu -max_num_threads=256", "tutorial/conv2d_no_batching", [1, 38, 38, 512, 256, 1, 1, [1, 1], [1, 1]], {}], "config": {"index": 321275836, "code_hash": null, "entity": [["tile_f", "sp", [-1, 4, 8, 8]], ["tile_y", "sp", [-1, 1, 10, 1]], ["tile_x", "sp", [-1, 1, 4, 1]], ["tile_rc", "sp", [-1, 8, 1]], ["tile_ry", "sp", [-1, 1, 1]], ["tile_rx", "sp", [-1, 1, 1]], ["auto_unroll_max_step", "ot", 512], ["unroll_explicit", "ot", 1]]}, "result": [[0.0215013251], 0, 14.027735710144043, 1609933933.771583], "version": 0.2, "tvm_version": "0.8.dev0"}
{"input": ["opencl -keys=opencl,gpu -max_num_threads=256", "tutorial/conv2d_no_batching", [1, 38, 38, 512, 256, 1, 1, [1, 1], [1, 1]], {}], "config": {"index": 321346199, "code_hash": null, "entity": [["tile_f", "sp", [-1, 16, 4, 4]], ["tile_y", "sp", [-1, 1, 10, 1]], ["tile_x", "sp", [-1, 1, 5, 1]], ["tile_rc", "sp", [-1, 8, 1]], ["tile_ry", "sp", [-1, 1, 1]], ["tile_rx", "sp", [-1, 1, 1]], ["auto_unroll_max_step", "ot", 512], ["unroll_explicit", "ot", 1]]}, "result": [[0.0662792931], 0, 19.130491971969604, 1609933938.9238489], "version": 0.2, "tvm_version": "0.8.dev0"}
{"input": ["opencl -keys=opencl,gpu -max_num_threads=256", "tutorial/conv2d_no_batching", [1, 38, 38, 512, 256, 1, 1, [1, 1], [1, 1]], {}], "config": {"index": 319762859, "code_hash": null, "entity": [["tile_f", "sp", [-1, 16, 4, 4]], ["tile_y", "sp", [-1, 1, 20, 1]], ["tile_x", "sp", [-1, 1, 2, 1]], ["tile_rc", "sp", [-1, 4, 1]], ["tile_ry", "sp", [-1, 1, 1]], ["tile_rx", "sp", [-1, 1, 1]], ["auto_unroll_max_step", "ot", 512], ["unroll_explicit", "ot", 1]]}, "result": [[0.0772309087], 0, 24.52995491027832, 1609933944.3825126], "version": 0.2, "tvm_version": "0.8.dev0"}
{"input": ["opencl -keys=opencl,gpu -max_num_threads=256", "tutorial/conv2d_no_batching", [1, 38, 38, 512, 256, 1, 1, [1, 1], [1, 1]], {}], "config": {"index": 332539836, "code_hash": null, "entity": [["tile_f", "sp", [-1, 4, 8, 8]], ["tile_y", "sp", [-1, 1, 10, 1]], ["tile_x", "sp", [-1, 1, 4, 1]], ["tile_rc", "sp", [-1, 4, 2]], ["tile_ry", "sp", [-1, 1, 1]], ["tile_rx", "sp", [-1, 1, 1]], ["auto_unroll_max_step", "ot", 512], ["unroll_explicit", "ot", 1]]}, "result": [[0.021475731300000002], 0, 27.823787450790405, 1609933947.7231283], "version": 0.2, "tvm_version": "0.8.dev0"}
{"input": ["opencl -keys=opencl,gpu -max_num_threads=256", "tutorial/conv2d_no_batching", [1, 38, 38, 512, 256, 1, 1, [1, 1], [1, 1]], {}], "config": {"index": 321345797, "code_hash": null, "entity": [["tile_f", "sp", [-1, 8, 8, 8]], ["tile_y", "sp", [-1, 1, 8, 1]], ["tile_x", "sp", [-1, 1, 5, 1]], ["tile_rc", "sp", [-1, 8, 1]], ["tile_ry", "sp", [-1, 1, 1]], ["tile_rx", "sp", [-1, 1, 1]], ["auto_unroll_max_step", "ot", 512], ["unroll_explicit", "ot", 1]]}, "result": [[0.0594890736], 0, 6.4039599895477295, 1609933955.6263971], "version": 0.2, "tvm_version": "0.8.dev0"}
{"input": ["opencl -keys=opencl,gpu -max_num_threads=256", "tutorial/conv2d_no_batching", [1, 38, 38, 512, 256, 1, 1, [1, 1], [1, 1]], {}], "config": {"index": 332539396, "code_hash": null, "entity": [["tile_f", "sp", [-1, 4, 8, 8]], ["tile_y", "sp", [-1, 1, 8, 1]], ["tile_x", "sp", [-1, 1, 4, 1]], ["tile_rc", "sp", [-1, 4, 2]], ["tile_ry", "sp", [-1, 1, 1]], ["tile_rx", "sp", [-1, 1, 1]], ["auto_unroll_max_step", "ot", 512], ["unroll_explicit", "ot", 1]]}, "result": [[0.0287506591], 0, 10.196237564086914, 1609933959.4403043], "version": 0.2, "tvm_version": "0.8.dev0"}
{"input": ["opencl -keys=opencl,gpu -max_num_threads=256", "tutorial/conv2d_no_batching", [1, 38, 38, 512, 256, 1, 1, [1, 1], [1, 1]], {}], "config": {"index": 319762817, "code_hash": null, "entity": [["tile_f", "sp", [-1, 32, 4, 2]], ["tile_y", "sp", [-1, 1, 20, 1]], ["tile_x", "sp", [-1, 1, 2, 1]], ["tile_rc", "sp", [-1, 4, 1]], ["tile_ry", "sp", [-1, 1, 1]], ["tile_rx", "sp", [-1, 1, 1]], ["auto_unroll_max_step", "ot", 512], ["unroll_explicit", "ot", 1]]}, "result": [[0.07285108009999999], 0, 21.907758951187134, 1609933971.1963637], "version": 0.2, "tvm_version": "0.8.dev0"}
{"input": ["opencl -keys=opencl,gpu -max_num_threads=256", "tutorial/conv2d_no_batching", [1, 38, 38, 512, 256, 1, 1, [1, 1], [1, 1]], {}], "config": {"index": 321346232, "code_hash": null, "entity": [["tile_f", "sp", [-1, 8, 4, 8]], ["tile_y", "sp", [-1, 1, 10, 1]], ["tile_x", "sp", [-1, 1, 5, 1]], ["tile_rc", "sp", [-1, 8, 1]], ["tile_ry", "sp", [-1, 1, 1]], ["tile_rx", "sp", [-1, 1, 1]], ["auto_unroll_max_step", "ot", 512], ["unroll_explicit", "ot", 1]]}, "result": [[0.0665321681], 0, 34.55694770812988, 1609933984.0367262], "version": 0.2, "tvm_version": "0.8.dev0"}
{"input": ["opencl -keys=opencl,gpu -max_num_threads=256", "tutorial/conv2d_no_batching", [1, 38, 38, 512, 256, 1, 1, [1, 1], [1, 1]], {}], "config": {"index": 318213442, "code_hash": null, "entity": [["tile_f", "sp", [-1, 2, 32, 8]], ["tile_y", "sp", [-1, 1, 10, 1]], ["tile_x", "sp", [-1, 1, 1, 1]], ["tile_rc", "sp", [-1, 2, 1]], ["tile_ry", "sp", [-1, 1, 1]], ["tile_rx", "sp", [-1, 1, 1]], ["auto_unroll_max_step", "ot", 512], ["unroll_explicit", "ot", 1]]}, "result": [[0.0779042994], 0, 10.922363042831421, 1609934003.6366177], "version": 0.2, "tvm_version": "0.8.dev0"}
{"input": ["opencl -keys=opencl,gpu -max_num_threads=256", "tutorial/conv2d_no_batching", [1, 38, 38, 512, 256, 1, 1, [1, 1], [1, 1]], {}], "config": {"index": 321349691, "code_hash": null, "entity": [["tile_f", "sp", [-1, 2, 32, 2]], ["tile_y", "sp", [-1, 1, 4, 2]], ["tile_x", "sp", [-1, 1, 5, 1]], ["tile_rc", "sp", [-1, 8, 1]], ["tile_ry", "sp", [-1, 1, 1]], ["tile_rx", "sp", [-1, 1, 1]], ["auto_unroll_max_step", "ot", 512], ["unroll_explicit", "ot", 1]]}, "result": [[0.0199764135], 0, 14.41824197769165, 1609934007.1524532], "version": 0.2, "tvm_version": "0.8.dev0"}
{"input": ["opencl -keys=opencl,gpu -max_num_threads=256", "tutorial/conv2d_no_batching", [1, 38, 38, 512, 256, 1, 1, [1, 1], [1, 1]], {}], "config": {"index": 321343971, "code_hash": null, "entity": [["tile_f", "sp", [-1, 2, 32, 2]], ["tile_y", "sp", [-1, 1, 4, 1]], ["tile_x", "sp", [-1, 1, 5, 1]], ["tile_rc", "sp", [-1, 8, 1]], ["tile_ry", "sp", [-1, 1, 1]], ["tile_rx", "sp", [-1, 1, 1]], ["auto_unroll_max_step", "ot", 512], ["unroll_explicit", "ot", 1]]}, "result": [[0.0292396384], 0, 18.14439630508423, 1609934010.8729231], "version": 0.2, "tvm_version": "0.8.dev0"}
{"input": ["opencl -keys=opencl,gpu -max_num_threads=256", "tutorial/conv2d_no_batching", [1, 38, 38, 512, 256, 1, 1, [1, 1], [1, 1]], {}], "config": {"index": 322856246, "code_hash": null, "entity": [["tile_f", "sp", [-1, 2, 16, 2]], ["tile_y", "sp", [-1, 1, 2, 1]], ["tile_x", "sp", [-1, 1, 10, 1]], ["tile_rc", "sp", [-1, 16, 1]], ["tile_ry", "sp", [-1, 1, 1]], ["tile_rx", "sp", [-1, 1, 1]], ["auto_unroll_max_step", "ot", 512], ["unroll_explicit", "ot", 1]]}, "result": [[0.0341350243], 0, 22.083751916885376, 1609934014.879189], "version": 0.2, "tvm_version": "0.8.dev0"}
{"input": ["opencl -keys=opencl,gpu -max_num_threads=256", "tutorial/conv2d_no_batching", [1, 38, 38, 512, 256, 1, 1, [1, 1], [1, 1]], {}], "config": {"index": 322682448, "code_hash": null, "entity": [["tile_f", "sp", [-1, 8, 16, 2]], ["tile_y", "sp", [-1, 1, 5, 1]], ["tile_x", "sp", [-1, 1, 4, 1]], ["tile_rc", "sp", [-1, 16, 1]], ["tile_ry", "sp", [-1, 1, 1]], ["tile_rx", "sp", [-1, 1, 1]], ["auto_unroll_max_step", "ot", 512], ["unroll_explicit", "ot", 1]]}, "result": [[0.028444555], 0, 27.631293058395386, 1609934020.5912318], "version": 0.2, "tvm_version": "0.8.dev0"}
{"input": ["opencl -keys=opencl,gpu -max_num_threads=256", "tutorial/conv2d_no_batching", [1, 38, 38, 512, 256, 1, 1, [1, 1], [1, 1]], {}], "config": {"index": 321342687, "code_hash": null, "entity": [["tile_f", "sp", [-1, 2, 16, 4]], ["tile_y", "sp", [-1, 1, 2, 1]], ["tile_x", "sp", [-1, 1, 5, 1]], ["tile_rc", "sp", [-1, 8, 1]], ["tile_ry", "sp", [-1, 1, 1]], ["tile_rx", "sp", [-1, 1, 1]], ["auto_unroll_max_step", "ot", 512], ["unroll_explicit", "ot", 1]]}, "result": [[0.0382483267], 0, 31.653476238250732, 1609934024.6993172], "version": 0.2, "tvm_version": "0.8.dev0"}
{"input": ["opencl -keys=opencl,gpu -max_num_threads=256", "tutorial/conv2d_no_batching", [1, 38, 38, 512, 256, 1, 1, [1, 1], [1, 1]], {}], "config": {"index": 129682242, "code_hash": null, "entity": [["tile_f", "sp", [-1, 2, 32, 8]], ["tile_y", "sp", [-1, 1, 10, 1]], ["tile_x", "sp", [-1, 1, 2, 1]], ["tile_rc", "sp", [-1, 4, 1]], ["tile_ry", "sp", [-1, 1, 1]], ["tile_rx", "sp", [-1, 1, 1]], ["auto_unroll_max_step", "ot", 512], ["unroll_explicit", "ot", 0]]}, "result": [[0.0304756436], 0, 3.2465572357177734, 1609934029.245175], "version": 0.2, "tvm_version": "0.8.dev0"}
{"input": ["opencl -keys=opencl,gpu -max_num_threads=256", "tutorial/conv2d_no_batching", [1, 38, 38, 512, 256, 1, 1, [1, 1], [1, 1]], {}], "config": {"index": 27263088, "code_hash": null, "entity": [["tile_f", "sp", [-1, 2, 8, 1]], ["tile_y", "sp", [-1, 5, 1, 1]], ["tile_x", "sp", [-1, 1, 40, 1]], ["tile_rc", "sp", [-1, 4, 4]], ["tile_ry", "sp", [-1, 1, 1]], ["tile_rx", "sp", [-1, 1, 1]], ["auto_unroll_max_step", "ot", 0], ["unroll_explicit", "ot", 0]]}, "result": [[0.022043502200000002], 0, 28.343924522399902, 1609934054.72735], "version": 0.2, "tvm_version": "0.8.dev0"}
{"input": ["opencl -keys=opencl,gpu -max_num_threads=256", "tutorial/conv2d_no_batching", [1, 38, 38, 512, 256, 1, 1, [1, 1], [1, 1]], {}], "config": {"index": 320007285, "code_hash": null, "entity": [["tile_f", "sp", [-1, 16, 8, 4]], ["tile_y", "sp", [-1, 1, 5, 1]], ["tile_x", "sp", [-1, 1, 8, 1]], ["tile_rc", "sp", [-1, 4, 1]], ["tile_ry", "sp", [-1, 1, 1]], ["tile_rx", "sp", [-1, 1, 1]], ["auto_unroll_max_step", "ot", 512], ["unroll_explicit", "ot", 1]]}, "result": [[0.0904214622], 0, 31.592148065567017, 1609934202.2369478], "version": 0.2, "tvm_version": "0.8.dev0"}
{"input": ["opencl -keys=opencl,gpu -max_num_threads=256", "tutorial/conv2d_no_batching", [1, 38, 38, 512, 256, 1, 1, [1, 1], [1, 1]], {}], "config": {"index": 320007244, "code_hash": null, "entity": [["tile_f", "sp", [-1, 32, 8, 2]], ["tile_y", "sp", [-1, 1, 5, 1]], ["tile_x", "sp", [-1, 1, 8, 1]], ["tile_rc", "sp", [-1, 4, 1]], ["tile_ry", "sp", [-1, 1, 1]], ["tile_rx", "sp", [-1, 1, 1]], ["auto_unroll_max_step", "ot", 512], ["unroll_explicit", "ot", 1]]}, "result": [[0.090810509], 0, 36.89375400543213, 1609934207.5624485], "version": 0.2, "tvm_version": "0.8.dev0"}
{"input": ["opencl -keys=opencl,gpu -max_num_threads=256", "tutorial/conv2d_no_batching", [1, 38, 38, 512, 256, 1, 1, [1, 1], [1, 1]], {}], "config": {"index": 319937765, "code_hash": null, "entity": [["tile_f", "sp", [-1, 16, 8, 4]], ["tile_y", "sp", [-1, 1, 8, 1]], ["tile_x", "sp", [-1, 1, 5, 1]], ["tile_rc", "sp", [-1, 4, 1]], ["tile_ry", "sp", [-1, 1, 1]], ["tile_rx", "sp", [-1, 1, 1]], ["auto_unroll_max_step", "ot", 512], ["unroll_explicit", "ot", 1]]}, "result": [[0.08400810210000001], 0, 65.83180212974548, 1609934236.5507982], "version": 0.2, "tvm_version": "0.8.dev0"}
{"input": ["opencl -keys=opencl,gpu -max_num_threads=256", "tutorial/conv2d_no_batching", [1, 38, 38, 512, 256, 1, 1, [1, 1], [1, 1]], {}], "config": {"index": 319936037, "code_hash": null, "entity": [["tile_f", "sp", [-1, 8, 8, 8]], ["tile_y", "sp", [-1, 1, 4, 1]], ["tile_x", "sp", [-1, 1, 5, 1]], ["tile_rc", "sp", [-1, 4, 1]], ["tile_ry", "sp", [-1, 1, 1]], ["tile_rx", "sp", [-1, 1, 1]], ["auto_unroll_max_step", "ot", 512], ["unroll_explicit", "ot", 1]]}, "result": [[0.0870202326], 0, 58.18241620063782, 1609934228.9080894], "version": 0.2, "tvm_version": "0.8.dev0"}
{"input": ["opencl -keys=opencl,gpu -max_num_threads=256", "tutorial/conv2d_no_batching", [1, 38, 38, 512, 256, 1, 1, [1, 1], [1, 1]], {}], "config": {"index": 321345724, "code_hash": null, "entity": [["tile_f", "sp", [-1, 32, 8, 2]], ["tile_y", "sp", [-1, 1, 8, 1]], ["tile_x", "sp", [-1, 1, 5, 1]], ["tile_rc", "sp", [-1, 8, 1]], ["tile_ry", "sp", [-1, 1, 1]], ["tile_rx", "sp", [-1, 1, 1]], ["auto_unroll_max_step", "ot", 512], ["unroll_explicit", "ot", 1]]}, "result": [[0.059266323600000004], 0, 84.50221991539001, 1609934255.3347855], "version": 0.2, "tvm_version": "0.8.dev0"}
{"input": ["opencl -keys=opencl,gpu -max_num_threads=256", "tutorial/conv2d_no_batching", [1, 38, 38, 512, 256, 1, 1, [1, 1], [1, 1]], {}], "config": {"index": 321275364, "code_hash": null, "entity": [["tile_f", "sp", [-1, 8, 8, 4]], ["tile_y", "sp", [-1, 1, 8, 1]], ["tile_x", "sp", [-1, 1, 4, 1]], ["tile_rc", "sp", [-1, 8, 1]], ["tile_ry", "sp", [-1, 1, 1]], ["tile_rx", "sp", [-1, 1, 1]], ["auto_unroll_max_step", "ot", 512], ["unroll_explicit", "ot", 1]]}, "result": [[0.0198440801], 0, 32.273983001708984, 1609934289.1694484], "version": 0.2, "tvm_version": "0.8.dev0"}
{"input": ["opencl -keys=opencl,gpu -max_num_threads=256", "tutorial/conv2d_no_batching", [1, 38, 38, 512, 256, 1, 1, [1, 1], [1, 1]], {}], "config": {"index": 321448251, "code_hash": null, "entity": [["tile_f", "sp", [-1, 2, 32, 2]], ["tile_y", "sp", [-1, 1, 2, 1]], ["tile_x", "sp", [-1, 1, 10, 1]], ["tile_rc", "sp", [-1, 8, 1]], ["tile_ry", "sp", [-1, 1, 1]], ["tile_rx", "sp", [-1, 1, 1]], ["auto_unroll_max_step", "ot", 512], ["unroll_explicit", "ot", 1]]}, "result": [[0.0329911282], 0, 4.448170900344849, 1609934347.69049], "version": 0.2, "tvm_version": "0.8.dev0"}
{"input": ["opencl -keys=opencl,gpu -max_num_threads=256", "tutorial/conv2d_no_batching", [1, 38, 38, 512, 256, 1, 1, [1, 1], [1, 1]], {}], "config": {"index": 256647285, "code_hash": null, "entity": [["tile_f", "sp", [-1, 16, 8, 4]], ["tile_y", "sp", [-1, 1, 5, 1]], ["tile_x", "sp", [-1, 1, 8, 1]], ["tile_rc", "sp", [-1, 4, 1]], ["tile_ry", "sp", [-1, 1, 1]], ["tile_rx", "sp", [-1, 1, 1]], ["auto_unroll_max_step", "ot", 256], ["unroll_explicit", "ot", 1]]}, "result": [[0.0919201029], 0, 64.61268424987793, 1609934407.9872587], "version": 0.2, "tvm_version": "0.8.dev0"}
{"input": ["opencl -keys=opencl,gpu -max_num_threads=256", "tutorial/conv2d_no_batching", [1, 38, 38, 512, 256, 1, 1, [1, 1], [1, 1]], {}], "config": {"index": 320041564, "code_hash": null, "entity": [["tile_f", "sp", [-1, 32, 8, 2]], ["tile_y", "sp", [-1, 1, 4, 1]], ["tile_x", "sp", [-1, 1, 10, 1]], ["tile_rc", "sp", [-1, 4, 1]], ["tile_ry", "sp", [-1, 1, 1]], ["tile_rx", "sp", [-1, 1, 1]], ["auto_unroll_max_step", "ot", 512], ["unroll_explicit", "ot", 1]]}, "result": [[0.09296711869999999], 0, 69.2540533542633, 1609934498.9522247], "version": 0.2, "tvm_version": "0.8.dev0"}
{"input": ["opencl -keys=opencl,gpu -max_num_threads=256", "tutorial/conv2d_no_batching", [1, 38, 38, 512, 256, 1, 1, [1, 1], [1, 1]], {}], "config": {"index": 322750651, "code_hash": null, "entity": [["tile_f", "sp", [-1, 2, 32, 2]], ["tile_y", "sp", [-1, 1, 2, 1]], ["tile_x", "sp", [-1, 1, 5, 1]], ["tile_rc", "sp", [-1, 16, 1]], ["tile_ry", "sp", [-1, 1, 1]], ["tile_rx", "sp", [-1, 1, 1]], ["auto_unroll_max_step", "ot", 512], ["unroll_explicit", "ot", 1]]}, "result": [[0.0446075773], 0, 10.054384231567383, 1609934641.592185], "version": 0.2, "tvm_version": "0.8.dev0"}
{"input": ["opencl -keys=opencl,gpu -max_num_threads=256", "tutorial/conv2d_no_batching", [1, 38, 38, 512, 256, 1, 1, [1, 1], [1, 1]], {}], "config": {"index": 322750872, "code_hash": null, "entity": [["tile_f", "sp", [-1, 4, 32, 2]], ["tile_y", "sp", [-1, 2, 2, 1]], ["tile_x", "sp", [-1, 1, 5, 1]], ["tile_rc", "sp", [-1, 16, 1]], ["tile_ry", "sp", [-1, 1, 1]], ["tile_rx", "sp", [-1, 1, 1]], ["auto_unroll_max_step", "ot", 512], ["unroll_explicit", "ot", 1]]}, "result": [[0.0928834728], 0, 21.126261949539185, 1609934652.720513], "version": 0.2, "tvm_version": "0.8.dev0"}
{"input": ["opencl -keys=opencl,gpu -max_num_threads=256", "tutorial/conv2d_no_batching", [1, 38, 38, 512, 256, 1, 1, [1, 1], [1, 1]], {}], "config": {"index": 322751968, "code_hash": null, "entity": [["tile_f", "sp", [-1, 8, 16, 2]], ["tile_y", "sp", [-1, 1, 4, 1]], ["tile_x", "sp", [-1, 1, 5, 1]], ["tile_rc", "sp", [-1, 16, 1]], ["tile_ry", "sp", [-1, 1, 1]], ["tile_rx", "sp", [-1, 1, 1]], ["auto_unroll_max_step", "ot", 512], ["unroll_explicit", "ot", 1]]}, "result": [[0.028392289199999997], 0, 24.192167043685913, 1609934655.8362553], "version": 0.2, "tvm_version": "0.8.dev0"}
{"input": ["opencl -keys=opencl,gpu -max_num_threads=256", "tutorial/conv2d_no_batching", [1, 38, 38, 512, 256, 1, 1, [1, 1], [1, 1]], {}], "config": {"index": 321342651, "code_hash": null, "entity": [["tile_f", "sp", [-1, 2, 32, 2]], ["tile_y", "sp", [-1, 1, 2, 1]], ["tile_x", "sp", [-1, 1, 5, 1]], ["tile_rc", "sp", [-1, 8, 1]], ["tile_ry", "sp", [-1, 1, 1]], ["tile_rx", "sp", [-1, 1, 1]], ["auto_unroll_max_step", "ot", 512], ["unroll_explicit", "ot", 1]]}, "result": [[0.0387528268], 0, 28.298348903656006, 1609934659.9439435], "version": 0.2, "tvm_version": "0.8.dev0"}
{"input": ["opencl -keys=opencl,gpu -max_num_threads=256", "tutorial/conv2d_no_batching", [1, 38, 38, 512, 256, 1, 1, [1, 1], [1, 1]], {}], "config": {"index": 321342872, "code_hash": null, "entity": [["tile_f", "sp", [-1, 4, 32, 2]], ["tile_y", "sp", [-1, 2, 2, 1]], ["tile_x", "sp", [-1, 1, 5, 1]], ["tile_rc", "sp", [-1, 8, 1]], ["tile_ry", "sp", [-1, 1, 1]], ["tile_rx", "sp", [-1, 1, 1]], ["auto_unroll_max_step", "ot", 512], ["unroll_explicit", "ot", 1]]}, "result": [[0.0242099138], 0, 37.26440691947937, 1609934668.9652452], "version": 0.2, "tvm_version": "0.8.dev0"}
{"input": ["opencl -keys=opencl,gpu -max_num_threads=256", "tutorial/conv2d_no_batching", [1, 38, 38, 512, 256, 1, 1, [1, 1], [1, 1]], {}], "config": {"index": 334014871, "code_hash": null, "entity": [["tile_f", "sp", [-1, 2, 32, 2]], ["tile_y", "sp", [-1, 2, 2, 1]], ["tile_x", "sp", [-1, 1, 5, 1]], ["tile_rc", "sp", [-1, 8, 2]], ["tile_ry", "sp", [-1, 1, 1]], ["tile_rx", "sp", [-1, 1, 1]], ["auto_unroll_max_step", "ot", 512], ["unroll_explicit", "ot", 1]]}, "result": [[0.025470382800000003], 0, 40.90405869483948, 1609934672.6712263], "version": 0.2, "tvm_version": "0.8.dev0"}
{"input": ["opencl -keys=opencl,gpu -max_num_threads=256", "tutorial/conv2d_no_batching", [1, 38, 38, 512, 256, 1, 1, [1, 1], [1, 1]], {}], "config": {"index": 321342871, "code_hash": null, "entity": [["tile_f", "sp", [-1, 2, 32, 2]], ["tile_y", "sp", [-1, 2, 2, 1]], ["tile_x", "sp", [-1, 1, 5, 1]], ["tile_rc", "sp", [-1, 8, 1]], ["tile_ry", "sp", [-1, 1, 1]], ["tile_rx", "sp", [-1, 1, 1]], ["auto_unroll_max_step", "ot", 512], ["unroll_explicit", "ot", 1]]}, "result": [[0.0213303771], 0, 44.40008997917175, 1609934676.181074], "version": 0.2, "tvm_version": "0.8.dev0"}
{"input": ["opencl -keys=opencl,gpu -max_num_threads=256", "tutorial/conv2d_no_batching", [1, 38, 38, 512, 256, 1, 1, [1, 1], [1, 1]], {}], "config": {"index": 322756763, "code_hash": null, "entity": [["tile_f", "sp", [-1, 8, 32, 1]], ["tile_y", "sp", [-1, 1, 2, 2]], ["tile_x", "sp", [-1, 1, 5, 1]], ["tile_rc", "sp", [-1, 16, 1]], ["tile_ry", "sp", [-1, 1, 1]], ["tile_rx", "sp", [-1, 1, 1]], ["auto_unroll_max_step", "ot", 512], ["unroll_explicit", "ot", 1]]}, "result": [[0.0919261602], 0, 50.19304299354553, 1609934682.0548973], "version": 0.2, "tvm_version": "0.8.dev0"}
{"input": ["opencl -keys=opencl,gpu -max_num_threads=256", "tutorial/conv2d_no_batching", [1, 38, 38, 512, 256, 1, 1, [1, 1], [1, 1]], {}], "config": {"index": 322752008, "code_hash": null, "entity": [["tile_f", "sp", [-1, 4, 16, 4]], ["tile_y", "sp", [-1, 1, 4, 1]], ["tile_x", "sp", [-1, 1, 5, 1]], ["tile_rc", "sp", [-1, 16, 1]], ["tile_ry", "sp", [-1, 1, 1]], ["tile_rx", "sp", [-1, 1, 1]], ["auto_unroll_max_step", "ot", 512], ["unroll_explicit", "ot", 1]]}, "result": [[0.029760174900000002], 0, 64.74942398071289, 1609934696.6947682], "version": 0.2, "tvm_version": "0.8.dev0"}
{"input": ["opencl -keys=opencl,gpu -max_num_threads=256", "tutorial/conv2d_no_batching", [1, 38, 38, 512, 256, 1, 1, [1, 1], [1, 1]], {}], "config": {"index": 332538704, "code_hash": null, "entity": [["tile_f", "sp", [-1, 8, 8, 4]], ["tile_y", "sp", [-1, 2, 5, 1]], ["tile_x", "sp", [-1, 1, 4, 1]], ["tile_rc", "sp", [-1, 4, 2]], ["tile_ry", "sp", [-1, 1, 1]], ["tile_rx", "sp", [-1, 1, 1]], ["auto_unroll_max_step", "ot", 512], ["unroll_explicit", "ot", 1]]}, "result": [[0.0531216719], 0, 75.2828357219696, 1609934707.2969806], "version": 0.2, "tvm_version": "0.8.dev0"}
{"input": ["opencl -keys=opencl,gpu -max_num_threads=256", "tutorial/conv2d_no_batching", [1, 38, 38, 512, 256, 1, 1, [1, 1], [1, 1]], {}], "config": {"index": 321349027, "code_hash": null, "entity": [["tile_f", "sp", [-1, 4, 16, 2]], ["tile_y", "sp", [-1, 2, 2, 2]], ["tile_x", "sp", [-1, 1, 5, 1]], ["tile_rc", "sp", [-1, 8, 1]], ["tile_ry", "sp", [-1, 1, 1]], ["tile_rx", "sp", [-1, 1, 1]], ["auto_unroll_max_step", "ot", 512], ["unroll_explicit", "ot", 1]]}, "result": [[0.0147752098], 0, 9.166075944900513, 1609934718.0798123], "version": 0.2, "tvm_version": "0.8.dev0"}
{"input": ["opencl -keys=opencl,gpu -max_num_threads=256", "tutorial/conv2d_no_batching", [1, 38, 38, 512, 256, 1, 1, [1, 1], [1, 1]], {}], "config": {"index": 321274704, "code_hash": null, "entity": [["tile_f", "sp", [-1, 8, 8, 4]], ["tile_y", "sp", [-1, 2, 5, 1]], ["tile_x", "sp", [-1, 1, 4, 1]], ["tile_rc", "sp", [-1, 8, 1]], ["tile_ry", "sp", [-1, 1, 1]], ["tile_rx", "sp", [-1, 1, 1]], ["auto_unroll_max_step", "ot", 512], ["unroll_explicit", "ot", 1]]}, "result": [[0.040829191599999995], 0, 18.593119621276855, 1609934727.5848198], "version": 0.2, "tvm_version": "0.8.dev0"}
{"input": ["opencl -keys=opencl,gpu -max_num_threads=256", "tutorial/conv2d_no_batching", [1, 38, 38, 512, 256, 1, 1, [1, 1], [1, 1]], {}], "config": {"index": 321275799, "code_hash": null, "entity": [["tile_f", "sp", [-1, 16, 4, 4]], ["tile_y", "sp", [-1, 1, 10, 1]], ["tile_x", "sp", [-1, 1, 4, 1]], ["tile_rc", "sp", [-1, 8, 1]], ["tile_ry", "sp", [-1, 1, 1]], ["tile_rx", "sp", [-1, 1, 1]], ["auto_unroll_max_step", "ot", 512], ["unroll_explicit", "ot", 1]]}, "result": [[0.0503674894], 0, 33.79686450958252, 1609934742.8732421], "version": 0.2, "tvm_version": "0.8.dev0"}
{"input": ["opencl -keys=opencl,gpu -max_num_threads=256", "tutorial/conv2d_no_batching", [1, 38, 38, 512, 256, 1, 1, [1, 1], [1, 1]], {}], "config": {"index": 322854491, "code_hash": null, "entity": [["tile_f", "sp", [-1, 2, 32, 2]], ["tile_y", "sp", [-1, 1, 1, 1]], ["tile_x", "sp", [-1, 1, 10, 1]], ["tile_rc", "sp", [-1, 16, 1]], ["tile_ry", "sp", [-1, 1, 1]], ["tile_rx", "sp", [-1, 1, 1]], ["auto_unroll_max_step", "ot", 512], ["unroll_explicit", "ot", 1]]}, "result": [[0.0496004893], 0, 29.180710792541504, 1609934738.3066237], "version": 0.2, "tvm_version": "0.8.dev0"}
{"input": ["opencl -keys=opencl,gpu -max_num_threads=256", "tutorial/conv2d_no_batching", [1, 38, 38, 512, 256, 1, 1, [1, 1], [1, 1]], {}], "config": {"index": 334014651, "code_hash": null, "entity": [["tile_f", "sp", [-1, 2, 32, 2]], ["tile_y", "sp", [-1, 1, 2, 1]], ["tile_x", "sp", [-1, 1, 5, 1]], ["tile_rc", "sp", [-1, 8, 2]], ["tile_ry", "sp", [-1, 1, 1]], ["tile_rx", "sp", [-1, 1, 1]], ["auto_unroll_max_step", "ot", 512], ["unroll_explicit", "ot", 1]]}, "result": [[0.044241884599999996], 0, 38.12969136238098, 1609934747.2499244], "version": 0.2, "tvm_version": "0.8.dev0"}
{"input": ["opencl -keys=opencl,gpu -max_num_threads=256", "tutorial/conv2d_no_batching", [1, 38, 38, 512, 256, 1, 1, [1, 1], [1, 1]], {}], "config": {"index": 132670651, "code_hash": null, "entity": [["tile_f", "sp", [-1, 2, 32, 2]], ["tile_y", "sp", [-1, 1, 2, 1]], ["tile_x", "sp", [-1, 1, 5, 1]], ["tile_rc", "sp", [-1, 16, 1]], ["tile_ry", "sp", [-1, 1, 1]], ["tile_rx", "sp", [-1, 1, 1]], ["auto_unroll_max_step", "ot", 512], ["unroll_explicit", "ot", 0]]}, "result": [[0.030055440500000002], 0, 41.762399435043335, 1609934750.9413598], "version": 0.2, "tvm_version": "0.8.dev0"}
{"input": ["opencl -keys=opencl,gpu -max_num_threads=256", "tutorial/conv2d_no_batching", [1, 38, 38, 512, 256, 1, 1, [1, 1], [1, 1]], {}], "config": {"index": 321342652, "code_hash": null, "entity": [["tile_f", "sp", [-1, 4, 32, 2]], ["tile_y", "sp", [-1, 1, 2, 1]], ["tile_x", "sp", [-1, 1, 5, 1]], ["tile_rc", "sp", [-1, 8, 1]], ["tile_ry", "sp", [-1, 1, 1]], ["tile_rx", "sp", [-1, 1, 1]], ["auto_unroll_max_step", "ot", 512], ["unroll_explicit", "ot", 1]]}, "result": [[0.046766187], 0, 53.2985360622406, 1609934762.5689428], "version": 0.2, "tvm_version": "0.8.dev0"}
{"input": ["opencl -keys=opencl,gpu -max_num_threads=256", "tutorial/conv2d_no_batching", [1, 38, 38, 512, 256, 1, 1, [1, 1], [1, 1]], {}], "config": {"index": 321273828, "code_hash": null, "entity": [["tile_f", "sp", [-1, 4, 16, 4]], ["tile_y", "sp", [-1, 2, 4, 1]], ["tile_x", "sp", [-1, 1, 4, 1]], ["tile_rc", "sp", [-1, 8, 1]], ["tile_ry", "sp", [-1, 1, 1]], ["tile_rx", "sp", [-1, 1, 1]], ["auto_unroll_max_step", "ot", 512], ["unroll_explicit", "ot", 1]]}, "result": [[0.0828546437], 0, 60.743088722229004, 1609934770.1328053], "version": 0.2, "tvm_version": "0.8.dev0"}
{"input": ["opencl -keys=opencl,gpu -max_num_threads=256", "tutorial/conv2d_no_batching", [1, 38, 38, 512, 256, 1, 1, [1, 1], [1, 1]], {}], "config": {"index": 322752188, "code_hash": null, "entity": [["tile_f", "sp", [-1, 8, 16, 2]], ["tile_y", "sp", [-1, 2, 4, 1]], ["tile_x", "sp", [-1, 1, 5, 1]], ["tile_rc", "sp", [-1, 16, 1]], ["tile_ry", "sp", [-1, 1, 1]], ["tile_rx", "sp", [-1, 1, 1]], ["auto_unroll_max_step", "ot", 512], ["unroll_explicit", "ot", 1]]}, "result": [[0.015672439], 0, 70.14240837097168, 1609934779.576633], "version": 0.2, "tvm_version": "0.8.dev0"}
{"input": ["opencl -keys=opencl,gpu -max_num_threads=256", "tutorial/conv2d_no_batching", [1, 38, 38, 512, 256, 1, 1, [1, 1], [1, 1]], {}], "config": {"index": 321342647, "code_hash": null, "entity": [["tile_f", "sp", [-1, 4, 16, 2]], ["tile_y", "sp", [-1, 1, 2, 1]], ["tile_x", "sp", [-1, 1, 5, 1]], ["tile_rc", "sp", [-1, 8, 1]], ["tile_ry", "sp", [-1, 1, 1]], ["tile_rx", "sp", [-1, 1, 1]], ["auto_unroll_max_step", "ot", 512], ["unroll_explicit", "ot", 1]]}, "result": [[0.040899967599999996], 0, 9.985339403152466, 1609934791.2290633], "version": 0.2, "tvm_version": "0.8.dev0"}
{"input": ["opencl -keys=opencl,gpu -max_num_threads=256", "tutorial/conv2d_no_batching", [1, 38, 38, 512, 256, 1, 1, [1, 1], [1, 1]], {}], "config": {"index": 334016008, "code_hash": null, "entity": [["tile_f", "sp", [-1, 4, 16, 4]], ["tile_y", "sp", [-1, 1, 4, 1]], ["tile_x", "sp", [-1, 1, 5, 1]], ["tile_rc", "sp", [-1, 8, 2]], ["tile_ry", "sp", [-1, 1, 1]], ["tile_rx", "sp", [-1, 1, 1]], ["auto_unroll_max_step", "ot", 512], ["unroll_explicit", "ot", 1]]}, "result": [[0.0294131227], 0, 13.669370651245117, 1609934794.9459193], "version": 0.2, "tvm_version": "0.8.dev0"}
{"input": ["opencl -keys=opencl,gpu -max_num_threads=256", "tutorial/conv2d_no_batching", [1, 38, 38, 512, 256, 1, 1, [1, 1], [1, 1]], {}], "config": {"index": 322750654, "code_hash": null, "entity": [["tile_f", "sp", [-1, 1, 64, 2]], ["tile_y", "sp", [-1, 1, 2, 1]], ["tile_x", "sp", [-1, 1, 5, 1]], ["tile_rc", "sp", [-1, 16, 1]], ["tile_ry", "sp", [-1, 1, 1]], ["tile_rx", "sp", [-1, 1, 1]], ["auto_unroll_max_step", "ot", 512], ["unroll_explicit", "ot", 1]]}, "result": [[0.0488711976], 0, 29.119739770889282, 1609934810.4863417], "version": 0.2, "tvm_version": "0.8.dev0"}
{"input": ["opencl -keys=opencl,gpu -max_num_threads=256", "tutorial/conv2d_no_batching", [1, 38, 38, 512, 256, 1, 1, [1, 1], [1, 1]], {}], "config": {"index": 334015962, "code_hash": null, "entity": [["tile_f", "sp", [-1, 8, 8, 2]], ["tile_y", "sp", [-1, 1, 4, 1]], ["tile_x", "sp", [-1, 1, 5, 1]], ["tile_rc", "sp", [-1, 8, 2]], ["tile_ry", "sp", [-1, 1, 1]], ["tile_rx", "sp", [-1, 1, 1]], ["auto_unroll_max_step", "ot", 512], ["unroll_explicit", "ot", 1]]}, "result": [[0.026728455800000002], 0, 38.95771503448486, 1609934820.3950438], "version": 0.2, "tvm_version": "0.8.dev0"}
{"input": ["opencl -keys=opencl,gpu -max_num_threads=256", "tutorial/conv2d_no_batching", [1, 38, 38, 512, 256, 1, 1, [1, 1], [1, 1]], {}], "config": {"index": 321448247, "code_hash": null, "entity": [["tile_f", "sp", [-1, 4, 16, 2]], ["tile_y", "sp", [-1, 1, 2, 1]], ["tile_x", "sp", [-1, 1, 10, 1]], ["tile_rc", "sp", [-1, 8, 1]], ["tile_ry", "sp", [-1, 1, 1]], ["tile_rx", "sp", [-1, 1, 1]], ["auto_unroll_max_step", "ot", 512], ["unroll_explicit", "ot", 1]]}, "result": [[0.0321848418], 0, 42.84044647216797, 1609934824.2862992], "version": 0.2, "tvm_version": "0.8.dev0"}
{"input": ["opencl -keys=opencl,gpu -max_num_threads=256", "tutorial/conv2d_no_batching", [1, 38, 38, 512, 256, 1, 1, [1, 1], [1, 1]], {}], "config": {"index": 332539364, "code_hash": null, "entity": [["tile_f", "sp", [-1, 8, 8, 4]], ["tile_y", "sp", [-1, 1, 8, 1]], ["tile_x", "sp", [-1, 1, 4, 1]], ["tile_rc", "sp", [-1, 4, 2]], ["tile_ry", "sp", [-1, 1, 1]], ["tile_rx", "sp", [-1, 1, 1]], ["auto_unroll_max_step", "ot", 512], ["unroll_explicit", "ot", 1]]}, "result": [[0.0286841434], 0, 46.686434745788574, 1609934828.202209], "version": 0.2, "tvm_version": "0.8.dev0"}
{"input": ["opencl -keys=opencl,gpu -max_num_threads=256", "tutorial/conv2d_no_batching", [1, 38, 38, 512, 256, 1, 1, [1, 1], [1, 1]], {}], "config": {"index": 321272472, "code_hash": null, "entity": [["tile_f", "sp", [-1, 4, 32, 2]], ["tile_y", "sp", [-1, 2, 2, 1]], ["tile_x", "sp", [-1, 1, 4, 1]], ["tile_rc", "sp", [-1, 8, 1]], ["tile_ry", "sp", [-1, 1, 1]], ["tile_rx", "sp", [-1, 1, 1]], ["auto_unroll_max_step", "ot", 512], ["unroll_explicit", "ot", 1]]}, "result": [[0.030034054999999997], 0, 50.635361671447754, 1609934832.17117], "version": 0.2, "tvm_version": "0.8.dev0"}
{"input": ["opencl -keys=opencl,gpu -max_num_threads=256", "tutorial/conv2d_no_batching", [1, 38, 38, 512, 256, 1, 1, [1, 1], [1, 1]], {}], "config": {"index": 131262651, "code_hash": null, "entity": [["tile_f", "sp", [-1, 2, 32, 2]], ["tile_y", "sp", [-1, 1, 2, 1]], ["tile_x", "sp", [-1, 1, 5, 1]], ["tile_rc", "sp", [-1, 8, 1]], ["tile_ry", "sp", [-1, 1, 1]], ["tile_rx", "sp", [-1, 1, 1]], ["auto_unroll_max_step", "ot", 512], ["unroll_explicit", "ot", 0]]}, "result": [[0.030753987500000003], 0, 10.648014545440674, 1609934873.7727485], "version": 0.2, "tvm_version": "0.8.dev0"}
{"input": ["opencl -keys=opencl,gpu -max_num_threads=256", "tutorial/conv2d_no_batching", [1, 38, 38, 512, 256, 1, 1, [1, 1], [1, 1]], {}], "config": {"index": 322757688, "code_hash": null, "entity": [["tile_f", "sp", [-1, 8, 16, 2]], ["tile_y", "sp", [-1, 1, 4, 2]], ["tile_x", "sp", [-1, 1, 5, 1]], ["tile_rc", "sp", [-1, 16, 1]], ["tile_ry", "sp", [-1, 1, 1]], ["tile_rx", "sp", [-1, 1, 1]], ["auto_unroll_max_step", "ot", 512], ["unroll_explicit", "ot", 1]]}, "result": [[0.016057527699999997], 0, 19.33623695373535, 1609934882.4731185], "version": 0.2, "tvm_version": "0.8.dev0"}
{"input": ["opencl -keys=opencl,gpu -max_num_threads=256", "tutorial/conv2d_no_batching", [1, 38, 38, 512, 256, 1, 1, [1, 1], [1, 1]], {}], "config": {"index": 322576851, "code_hash": null, "entity": [["tile_f", "sp", [-1, 2, 32, 2]], ["tile_y", "sp", [-1, 1, 5, 1]], ["tile_x", "sp", [-1, 1, 2, 1]], ["tile_rc", "sp", [-1, 16, 1]], ["tile_ry", "sp", [-1, 1, 1]], ["tile_rx", "sp", [-1, 1, 1]], ["auto_unroll_max_step", "ot", 512], ["unroll_explicit", "ot", 1]]}, "result": [[0.046786535899999995], 0, 37.155004262924194, 1609934900.426668], "version": 0.2, "tvm_version": "0.8.dev0"}
{"input": ["opencl -keys=opencl,gpu -max_num_threads=256", "tutorial/conv2d_no_batching", [1, 38, 38, 512, 256, 1, 1, [1, 1], [1, 1]], {}], "config": {"index": 322760283, "code_hash": null, "entity": [["tile_f", "sp", [-1, 8, 32, 1]], ["tile_y", "sp", [-1, 1, 2, 4]], ["tile_x", "sp", [-1, 1, 5, 1]], ["tile_rc", "sp", [-1, 16, 1]], ["tile_ry", "sp", [-1, 1, 1]], ["tile_rx", "sp", [-1, 1, 1]], ["auto_unroll_max_step", "ot", 512], ["unroll_explicit", "ot", 1]]}, "result": [[0.015080428600000001], 0, 40.55908560752869, 1609934903.8543897], "version": 0.2, "tvm_version": "0.8.dev0"}
{"input": ["opencl -keys=opencl,gpu -max_num_threads=256", "tutorial/conv2d_no_batching", [1, 38, 38, 512, 256, 1, 1, [1, 1], [1, 1]], {}], "config": {"index": 321730072, "code_hash": null, "entity": [["tile_f", "sp", [-1, 4, 32, 2]], ["tile_y", "sp", [-1, 2, 2, 1]], ["tile_x", "sp", [-1, 1, 4, 2]], ["tile_rc", "sp", [-1, 8, 1]], ["tile_ry", "sp", [-1, 1, 1]], ["tile_rx", "sp", [-1, 1, 1]], ["auto_unroll_max_step", "ot", 512], ["unroll_explicit", "ot", 1]]}, "result": [[0.0179232102], 0, 46.05509376525879, 1609934909.4012585], "version": 0.2, "tvm_version": "0.8.dev0"}
{"input": ["opencl -keys=opencl,gpu -max_num_threads=256", "tutorial/conv2d_no_batching", [1, 38, 38, 512, 256, 1, 1, [1, 1], [1, 1]], {}], "config": {"index": 321348812, "code_hash": null, "entity": [["tile_f", "sp", [-1, 4, 32, 2]], ["tile_y", "sp", [-1, 1, 2, 2]], ["tile_x", "sp", [-1, 1, 5, 1]], ["tile_rc", "sp", [-1, 8, 1]], ["tile_ry", "sp", [-1, 1, 1]], ["tile_rx", "sp", [-1, 1, 1]], ["auto_unroll_max_step", "ot", 512], ["unroll_explicit", "ot", 1]]}, "result": [[0.0249802004], 0, 49.68590450286865, 1609934913.0895011], "version": 0.2, "tvm_version": "0.8.dev0"}
{"input": ["opencl -keys=opencl,gpu -max_num_threads=256", "tutorial/conv2d_no_batching", [1, 38, 38, 512, 256, 1, 1, [1, 1], [1, 1]], {}], "config": {"index": 322757638, "code_hash": null, "entity": [["tile_f", "sp", [-1, 16, 16, 1]], ["tile_y", "sp", [-1, 1, 4, 2]], ["tile_x", "sp", [-1, 1, 5, 1]], ["tile_rc", "sp", [-1, 16, 1]], ["tile_ry", "sp", [-1, 1, 1]], ["tile_rx", "sp", [-1, 1, 1]], ["auto_unroll_max_step", "ot", 512], ["unroll_explicit", "ot", 1]]}, "result": [[0.016116928699999998], 0, 3.0770046710968018, 1609935038.7902155], "version": 0.2, "tvm_version": "0.8.dev0"}
{"input": ["opencl -keys=opencl,gpu -max_num_threads=256", "tutorial/conv2d_no_batching", [1, 38, 38, 512, 256, 1, 1, [1, 1], [1, 1]], {}], "config": {"index": 131262871, "code_hash": null, "entity": [["tile_f", "sp", [-1, 2, 32, 2]], ["tile_y", "sp", [-1, 2, 2, 1]], ["tile_x", "sp", [-1, 1, 5, 1]], ["tile_rc", "sp", [-1, 8, 1]], ["tile_ry", "sp", [-1, 1, 1]], ["tile_rx", "sp", [-1, 1, 1]], ["auto_unroll_max_step", "ot", 512], ["unroll_explicit", "ot", 0]]}, "result": [[0.017539033000000002], 0, 6.441153526306152, 1609935042.1935074], "version": 0.2, "tvm_version": "0.8.dev0"}
{"input": ["opencl -keys=opencl,gpu -max_num_threads=256", "tutorial/conv2d_no_batching", [1, 38, 38, 512, 256, 1, 1, [1, 1], [1, 1]], {}], "config": {"index": 321352282, "code_hash": null, "entity": [["tile_f", "sp", [-1, 4, 32, 1]], ["tile_y", "sp", [-1, 1, 2, 4]], ["tile_x", "sp", [-1, 1, 5, 1]], ["tile_rc", "sp", [-1, 8, 1]], ["tile_ry", "sp", [-1, 1, 1]], ["tile_rx", "sp", [-1, 1, 1]], ["auto_unroll_max_step", "ot", 512], ["unroll_explicit", "ot", 1]]}, "result": [[0.0142964024], 0, 9.700160026550293, 1609935045.5035474], "version": 0.2, "tvm_version": "0.8.dev0"}
{"input": ["opencl -keys=opencl,gpu -max_num_threads=256", "tutorial/conv2d_no_batching", [1, 38, 38, 512, 256, 1, 1, [1, 1], [1, 1]], {}], "config": {"index": 131272282, "code_hash": null, "entity": [["tile_f", "sp", [-1, 4, 32, 1]], ["tile_y", "sp", [-1, 1, 2, 4]], ["tile_x", "sp", [-1, 1, 5, 1]], ["tile_rc", "sp", [-1, 8, 1]], ["tile_ry", "sp", [-1, 1, 1]], ["tile_rx", "sp", [-1, 1, 1]], ["auto_unroll_max_step", "ot", 512], ["unroll_explicit", "ot", 0]]}, "result": [[0.012651558500000002], 0, 12.882535219192505, 1609935048.7251523], "version": 0.2, "tvm_version": "0.8.dev0"}
{"input": ["opencl -keys=opencl,gpu -max_num_threads=256", "tutorial/conv2d_no_batching", [1, 38, 38, 512, 256, 1, 1, [1, 1], [1, 1]], {}], "config": {"index": 131269027, "code_hash": null, "entity": [["tile_f", "sp", [-1, 4, 16, 2]], ["tile_y", "sp", [-1, 2, 2, 2]], ["tile_x", "sp", [-1, 1, 5, 1]], ["tile_rc", "sp", [-1, 8, 1]], ["tile_ry", "sp", [-1, 1, 1]], ["tile_rx", "sp", [-1, 1, 1]], ["auto_unroll_max_step", "ot", 512], ["unroll_explicit", "ot", 0]]}, "result": [[0.0406119155], 0, 16.934568881988525, 1609935052.7875988], "version": 0.2, "tvm_version": "0.8.dev0"}
{"input": ["opencl -keys=opencl,gpu -max_num_threads=256", "tutorial/conv2d_no_batching", [1, 38, 38, 512, 256, 1, 1, [1, 1], [1, 1]], {}], "config": {"index": 321499505, "code_hash": null, "entity": [["tile_f", "sp", [-1, 1, 16, 2]], ["tile_y", "sp", [-1, 2, 1, 1]], ["tile_x", "sp", [-1, 1, 20, 1]], ["tile_rc", "sp", [-1, 8, 1]], ["tile_ry", "sp", [-1, 1, 1]], ["tile_rx", "sp", [-1, 1, 1]], ["auto_unroll_max_step", "ot", 512], ["unroll_explicit", "ot", 1]]}, "result": [[0.015729069300000002], 0, 20.23548412322998, 1609935056.1224256], "version": 0.2, "tvm_version": "0.8.dev0"}
{"input": ["opencl -keys=opencl,gpu -max_num_threads=256", "tutorial/conv2d_no_batching", [1, 38, 38, 512, 256, 1, 1, [1, 1], [1, 1]], {}], "config": {"index": 321765267, "code_hash": null, "entity": [["tile_f", "sp", [-1, 4, 16, 2]], ["tile_y", "sp", [-1, 2, 2, 1]], ["tile_x", "sp", [-1, 1, 5, 2]], ["tile_rc", "sp", [-1, 8, 1]], ["tile_ry", "sp", [-1, 1, 1]], ["tile_rx", "sp", [-1, 1, 1]], ["auto_unroll_max_step", "ot", 512], ["unroll_explicit", "ot", 1]]}, "result": [[0.0145503661], 0, 26.90360689163208, 1609935062.7955253], "version": 0.2, "tvm_version": "0.8.dev0"}
{"input": ["opencl -keys=opencl,gpu -max_num_threads=256", "tutorial/conv2d_no_batching", [1, 38, 38, 512, 256, 1, 1, [1, 1], [1, 1]], {}], "config": {"index": 321448466, "code_hash": null, "entity": [["tile_f", "sp", [-1, 2, 16, 2]], ["tile_y", "sp", [-1, 2, 2, 1]], ["tile_x", "sp", [-1, 1, 10, 1]], ["tile_rc", "sp", [-1, 8, 1]], ["tile_ry", "sp", [-1, 1, 1]], ["tile_rx", "sp", [-1, 1, 1]], ["auto_unroll_max_step", "ot", 512], ["unroll_explicit", "ot", 1]]}, "result": [[0.0118395272], 0, 23.394442081451416, 1609935059.2956102], "version": 0.2, "tvm_version": "0.8.dev0"}
{"input": ["opencl -keys=opencl,gpu -max_num_threads=256", "tutorial/conv2d_no_batching", [1, 38, 38, 512, 256, 1, 1, [1, 1], [1, 1]], {}], "config": {"index": 131650072, "code_hash": null, "entity": [["tile_f", "sp", [-1, 4, 32, 2]], ["tile_y", "sp", [-1, 2, 2, 1]], ["tile_x", "sp", [-1, 1, 4, 2]], ["tile_rc", "sp", [-1, 8, 1]], ["tile_ry", "sp", [-1, 1, 1]], ["tile_rx", "sp", [-1, 1, 1]], ["auto_unroll_max_step", "ot", 512], ["unroll_explicit", "ot", 0]]}, "result": [[0.0413758844], 0, 31.02088475227356, 1609935066.9922726], "version": 0.2, "tvm_version": "0.8.dev0"}
{"input": ["opencl -keys=opencl,gpu -max_num_threads=256", "tutorial/conv2d_no_batching", [1, 38, 38, 512, 256, 1, 1, [1, 1], [1, 1]], {}], "config": {"index": 321499506, "code_hash": null, "entity": [["tile_f", "sp", [-1, 2, 16, 2]], ["tile_y", "sp", [-1, 2, 1, 1]], ["tile_x", "sp", [-1, 1, 20, 1]], ["tile_rc", "sp", [-1, 8, 1]], ["tile_ry", "sp", [-1, 1, 1]], ["tile_rx", "sp", [-1, 1, 1]], ["auto_unroll_max_step", "ot", 512], ["unroll_explicit", "ot", 1]]}, "result": [[0.0116250272], 0, 34.242011070251465, 1609935070.2470784], "version": 0.2, "tvm_version": "0.8.dev0"}
{"input": ["opencl -keys=opencl,gpu -max_num_threads=256", "tutorial/conv2d_no_batching", [1, 38, 38, 512, 256, 1, 1, [1, 1], [1, 1]], {}], "config": {"index": 322687728, "code_hash": null, "entity": [["tile_f", "sp", [-1, 8, 16, 2]], ["tile_y", "sp", [-1, 1, 5, 2]], ["tile_x", "sp", [-1, 1, 4, 1]], ["tile_rc", "sp", [-1, 16, 1]], ["tile_ry", "sp", [-1, 1, 1]], ["tile_rx", "sp", [-1, 1, 1]], ["auto_unroll_max_step", "ot", 512], ["unroll_explicit", "ot", 1]]}, "result": [[0.015878777599999998], 0, 41.0812714099884, 1609935077.0659328], "version": 0.2, "tvm_version": "0.8.dev0"}
{"input": ["opencl -keys=opencl,gpu -max_num_threads=256", "tutorial/conv2d_no_batching", [1, 38, 38, 512, 256, 1, 1, [1, 1], [1, 1]], {}], "config": {"index": 321352277, "code_hash": null, "entity": [["tile_f", "sp", [-1, 8, 16, 1]], ["tile_y", "sp", [-1, 1, 2, 4]], ["tile_x", "sp", [-1, 1, 5, 1]], ["tile_rc", "sp", [-1, 8, 1]], ["tile_ry", "sp", [-1, 1, 1]], ["tile_rx", "sp", [-1, 1, 1]], ["auto_unroll_max_step", "ot", 512], ["unroll_explicit", "ot", 1]]}, "result": [[0.0147258296], 0, 37.635814905166626, 1609935073.6848774], "version": 0.2, "tvm_version": "0.8.dev0"}
{"input": ["opencl -keys=opencl,gpu -max_num_threads=256", "tutorial/conv2d_no_batching", [1, 38, 38, 512, 256, 1, 1, [1, 1], [1, 1]], {}], "config": {"index": 319944282, "code_hash": null, "entity": [["tile_f", "sp", [-1, 4, 32, 1]], ["tile_y", "sp", [-1, 1, 2, 4]], ["tile_x", "sp", [-1, 1, 5, 1]], ["tile_rc", "sp", [-1, 4, 1]], ["tile_ry", "sp", [-1, 1, 1]], ["tile_rx", "sp", [-1, 1, 1]], ["auto_unroll_max_step", "ot", 512], ["unroll_explicit", "ot", 1]]}, "result": [[0.014742860899999998], 0, 44.25100493431091, 1609935080.3619785], "version": 0.2, "tvm_version": "0.8.dev0"}
{"input": ["opencl -keys=opencl,gpu -max_num_threads=256", "tutorial/conv2d_no_batching", [1, 38, 38, 512, 256, 1, 1, [1, 1], [1, 1]], {}], "config": {"index": 129864282, "code_hash": null, "entity": [["tile_f", "sp", [-1, 4, 32, 1]], ["tile_y", "sp", [-1, 1, 2, 4]], ["tile_x", "sp", [-1, 1, 5, 1]], ["tile_rc", "sp", [-1, 4, 1]], ["tile_ry", "sp", [-1, 1, 1]], ["tile_rx", "sp", [-1, 1, 1]], ["auto_unroll_max_step", "ot", 512], ["unroll_explicit", "ot", 0]]}, "result": [[0.0122681366], 0, 47.43772506713867, 1609935083.5992985], "version": 0.2, "tvm_version": "0.8.dev0"}
{"input": ["opencl -keys=opencl,gpu -max_num_threads=256", "tutorial/conv2d_no_batching", [1, 38, 38, 512, 256, 1, 1, [1, 1], [1, 1]], {}], "config": {"index": 321446926, "code_hash": null, "entity": [["tile_f", "sp", [-1, 2, 16, 2]], ["tile_y", "sp", [-1, 4, 1, 1]], ["tile_x", "sp", [-1, 1, 10, 1]], ["tile_rc", "sp", [-1, 8, 1]], ["tile_ry", "sp", [-1, 1, 1]], ["tile_rx", "sp", [-1, 1, 1]], ["auto_unroll_max_step", "ot", 512], ["unroll_explicit", "ot", 1]]}, "result": [[0.0119464335], 0, 50.76367211341858, 1609935086.9059355], "version": 0.2, "tvm_version": "0.8.dev0"}
{"input": ["opencl -keys=opencl,gpu -max_num_threads=256", "tutorial/conv2d_no_batching", [1, 38, 38, 512, 256, 1, 1, [1, 1], [1, 1]], {}], "config": {"index": 320056342, "code_hash": null, "entity": [["tile_f", "sp", [-1, 2, 8, 4]], ["tile_y", "sp", [-1, 2, 1, 1]], ["tile_x", "sp", [-1, 2, 10, 1]], ["tile_rc", "sp", [-1, 4, 1]], ["tile_ry", "sp", [-1, 1, 1]], ["tile_rx", "sp", [-1, 1, 1]], ["auto_unroll_max_step", "ot", 512], ["unroll_explicit", "ot", 1]]}, "result": [[0.0114512824], 0, 53.94723391532898, 1609935090.1341662], "version": 0.2, "tvm_version": "0.8.dev0"}
{"input": ["opencl -keys=opencl,gpu -max_num_threads=256", "tutorial/conv2d_no_batching", [1, 38, 38, 512, 256, 1, 1, [1, 1], [1, 1]], {}], "config": {"index": 131419506, "code_hash": null, "entity": [["tile_f", "sp", [-1, 2, 16, 2]], ["tile_y", "sp", [-1, 2, 1, 1]], ["tile_x", "sp", [-1, 1, 20, 1]], ["tile_rc", "sp", [-1, 8, 1]], ["tile_ry", "sp", [-1, 1, 1]], ["tile_rx", "sp", [-1, 1, 1]], ["auto_unroll_max_step", "ot", 512], ["unroll_explicit", "ot", 0]]}, "result": [[0.0122846366], 0, 2.708972454071045, 1609935094.267592], "version": 0.2, "tvm_version": "0.8.dev0"}
{"input": ["opencl -keys=opencl,gpu -max_num_threads=256", "tutorial/conv2d_no_batching", [1, 38, 38, 512, 256, 1, 1, [1, 1], [1, 1]], {}], "config": {"index": 131368466, "code_hash": null, "entity": [["tile_f", "sp", [-1, 2, 16, 2]], ["tile_y", "sp", [-1, 2, 2, 1]], ["tile_x", "sp", [-1, 1, 10, 1]], ["tile_rc", "sp", [-1, 8, 1]], ["tile_ry", "sp", [-1, 1, 1]], ["tile_rx", "sp", [-1, 1, 1]], ["auto_unroll_max_step", "ot", 512], ["unroll_explicit", "ot", 0]]}, "result": [[0.011706871], 0, 5.785794973373413, 1609935097.3704097], "version": 0.2, "tvm_version": "0.8.dev0"}
{"input": ["opencl -keys=opencl,gpu -max_num_threads=256", "tutorial/conv2d_no_batching", [1, 38, 38, 512, 256, 1, 1, [1, 1], [1, 1]], {}], "config": {"index": 321348811, "code_hash": null, "entity": [["tile_f", "sp", [-1, 2, 32, 2]], ["tile_y", "sp", [-1, 1, 2, 2]], ["tile_x", "sp", [-1, 1, 5, 1]], ["tile_rc", "sp", [-1, 8, 1]], ["tile_ry", "sp", [-1, 1, 1]], ["tile_rx", "sp", [-1, 1, 1]], ["auto_unroll_max_step", "ot", 512], ["unroll_explicit", "ot", 1]]}, "result": [[0.031989274], 0, 9.576168060302734, 1609935101.1674516], "version": 0.2, "tvm_version": "0.8.dev0"}
{"input": ["opencl -keys=opencl,gpu -max_num_threads=256", "tutorial/conv2d_no_batching", [1, 38, 38, 512, 256, 1, 1, [1, 1], [1, 1]], {}], "config": {"index": 131366706, "code_hash": null, "entity": [["tile_f", "sp", [-1, 2, 16, 2]], ["tile_y", "sp", [-1, 2, 1, 1]], ["tile_x", "sp", [-1, 1, 10, 1]], ["tile_rc", "sp", [-1, 8, 1]], ["tile_ry", "sp", [-1, 1, 1]], ["tile_rx", "sp", [-1, 1, 1]], ["auto_unroll_max_step", "ot", 512], ["unroll_explicit", "ot", 0]]}, "result": [[0.0175505278], 0, 12.814645051956177, 1609935104.4576836], "version": 0.2, "tvm_version": "0.8.dev0"}
{"input": ["opencl -keys=opencl,gpu -max_num_threads=256", "tutorial/conv2d_no_batching", [1, 38, 38, 512, 256, 1, 1, [1, 1], [1, 1]], {}], "config": {"index": 321453261, "code_hash": null, "entity": [["tile_f", "sp", [-1, 2, 32, 1]], ["tile_y", "sp", [-1, 2, 1, 2]], ["tile_x", "sp", [-1, 1, 10, 1]], ["tile_rc", "sp", [-1, 8, 1]], ["tile_ry", "sp", [-1, 1, 1]], ["tile_rx", "sp", [-1, 1, 1]], ["auto_unroll_max_step", "ot", 512], ["unroll_explicit", "ot", 1]]}, "result": [[0.015301209900000001], 0, 16.090656757354736, 1609935107.743111], "version": 0.2, "tvm_version": "0.8.dev0"}
{"input": ["opencl -keys=opencl,gpu -max_num_threads=256", "tutorial/conv2d_no_batching", [1, 38, 38, 512, 256, 1, 1, [1, 1], [1, 1]], {}], "config": {"index": 320062900, "code_hash": null, "entity": [["tile_f", "sp", [-1, 2, 8, 2]], ["tile_y", "sp", [-1, 2, 1, 2]], ["tile_x", "sp", [-1, 2, 10, 1]], ["tile_rc", "sp", [-1, 4, 1]], ["tile_ry", "sp", [-1, 1, 1]], ["tile_rx", "sp", [-1, 1, 1]], ["auto_unroll_max_step", "ot", 512], ["unroll_explicit", "ot", 1]]}, "result": [[0.0101820739], 0, 19.338258981704712, 1609935110.9964921], "version": 0.2, "tvm_version": "0.8.dev0"}
{"input": ["opencl -keys=opencl,gpu -max_num_threads=256", "tutorial/conv2d_no_batching", [1, 38, 38, 512, 256, 1, 1, [1, 1], [1, 1]], {}], "config": {"index": 132677688, "code_hash": null, "entity": [["tile_f", "sp", [-1, 8, 16, 2]], ["tile_y", "sp", [-1, 1, 4, 2]], ["tile_x", "sp", [-1, 1, 5, 1]], ["tile_rc", "sp", [-1, 16, 1]], ["tile_ry", "sp", [-1, 1, 1]], ["tile_rx", "sp", [-1, 1, 1]], ["auto_unroll_max_step", "ot", 512], ["unroll_explicit", "ot", 0]]}, "result": [[0.032230711499999995], 0, 23.219754934310913, 1609935114.9150755], "version": 0.2, "tvm_version": "0.8.dev0"}
{"input": ["opencl -keys=opencl,gpu -max_num_threads=256", "tutorial/conv2d_no_batching", [1, 38, 38, 512, 256, 1, 1, [1, 1], [1, 1]], {}], "config": {"index": 321765271, "code_hash": null, "entity": [["tile_f", "sp", [-1, 2, 32, 2]], ["tile_y", "sp", [-1, 2, 2, 1]], ["tile_x", "sp", [-1, 1, 5, 2]], ["tile_rc", "sp", [-1, 8, 1]], ["tile_ry", "sp", [-1, 1, 1]], ["tile_rx", "sp", [-1, 1, 1]], ["auto_unroll_max_step", "ot", 512], ["unroll_explicit", "ot", 1]]}, "result": [[0.0191648665], 0, 26.728269577026367, 1609935118.4248452], "version": 0.2, "tvm_version": "0.8.dev0"}
{"input": ["opencl -keys=opencl,gpu -max_num_threads=256", "tutorial/conv2d_no_batching", [1, 38, 38, 512, 256, 1, 1, [1, 1], [1, 1]], {}], "config": {"index": 131685267, "code_hash": null, "entity": [["tile_f", "sp", [-1, 4, 16, 2]], ["tile_y", "sp", [-1, 2, 2, 1]], ["tile_x", "sp", [-1, 1, 5, 2]], ["tile_rc", "sp", [-1, 8, 1]], ["tile_ry", "sp", [-1, 1, 1]], ["tile_rx", "sp", [-1, 1, 1]], ["auto_unroll_max_step", "ot", 512], ["unroll_explicit", "ot", 0]]}, "result": [[0.0404194623], 0, 30.862218379974365, 1609935122.6134768], "version": 0.2, "tvm_version": "0.8.dev0"}
{"input": ["opencl -keys=opencl,gpu -max_num_threads=256", "tutorial/conv2d_no_batching", [1, 38, 38, 512, 256, 1, 1, [1, 1], [1, 1]], {}], "config": {"index": 131373261, "code_hash": null, "entity": [["tile_f", "sp", [-1, 2, 32, 1]], ["tile_y", "sp", [-1, 2, 1, 2]], ["tile_x", "sp", [-1, 1, 10, 1]], ["tile_rc", "sp", [-1, 8, 1]], ["tile_ry", "sp", [-1, 1, 1]], ["tile_rx", "sp", [-1, 1, 1]], ["auto_unroll_max_step", "ot", 512], ["unroll_explicit", "ot", 0]]}, "result": [[0.0154470016], 0, 34.09134769439697, 1609935125.862652], "version": 0.2, "tvm_version": "0.8.dev0"}
{"input": ["opencl -keys=opencl,gpu -max_num_threads=256", "tutorial/conv2d_no_batching", [1, 38, 38, 512, 256, 1, 1, [1, 1], [1, 1]], {}], "config": {"index": 129982900, "code_hash": null, "entity": [["tile_f", "sp", [-1, 2, 8, 2]], ["tile_y", "sp", [-1, 2, 1, 2]], ["tile_x", "sp", [-1, 2, 10, 1]], ["tile_rc", "sp", [-1, 4, 1]], ["tile_ry", "sp", [-1, 1, 1]], ["tile_rx", "sp", [-1, 1, 1]], ["auto_unroll_max_step", "ot", 512], ["unroll_explicit", "ot", 0]]}, "result": [[0.0696231215], 0, 39.03906321525574, 1609935130.8549254], "version": 0.2, "tvm_version": "0.8.dev0"}
{"input": ["opencl -keys=opencl,gpu -max_num_threads=256", "tutorial/conv2d_no_batching", [1, 38, 38, 512, 256, 1, 1, [1, 1], [1, 1]], {}], "config": {"index": 321505886, "code_hash": null, "entity": [["tile_f", "sp", [-1, 2, 16, 2]], ["tile_y", "sp", [-1, 1, 1, 2]], ["tile_x", "sp", [-1, 1, 20, 1]], ["tile_rc", "sp", [-1, 8, 1]], ["tile_ry", "sp", [-1, 1, 1]], ["tile_rx", "sp", [-1, 1, 1]], ["auto_unroll_max_step", "ot", 512], ["unroll_explicit", "ot", 1]]}, "result": [[0.0116727615], 0, 42.18183922767639, 1609935134.0344677], "version": 0.2, "tvm_version": "0.8.dev0"}
{"input": ["opencl -keys=opencl,gpu -max_num_threads=256", "tutorial/conv2d_no_batching", [1, 38, 38, 512, 256, 1, 1, [1, 1], [1, 1]], {}], "config": {"index": 321369877, "code_hash": null, "entity": [["tile_f", "sp", [-1, 8, 16, 1]], ["tile_y", "sp", [-1, 1, 2, 4]], ["tile_x", "sp", [-1, 2, 5, 1]], ["tile_rc", "sp", [-1, 8, 1]], ["tile_ry", "sp", [-1, 1, 1]], ["tile_rx", "sp", [-1, 1, 1]], ["auto_unroll_max_step", "ot", 512], ["unroll_explicit", "ot", 1]]}, "result": [[0.0382116445], 0, 46.33598303794861, 1609935138.1581812], "version": 0.2, "tvm_version": "0.8.dev0"}
{"input": ["opencl -keys=opencl,gpu -max_num_threads=256", "tutorial/conv2d_no_batching", [1, 38, 38, 512, 256, 1, 1, [1, 1], [1, 1]], {}], "config": {"index": 129976342, "code_hash": null, "entity": [["tile_f", "sp", [-1, 2, 8, 4]], ["tile_y", "sp", [-1, 2, 1, 1]], ["tile_x", "sp", [-1, 2, 10, 1]], ["tile_rc", "sp", [-1, 4, 1]], ["tile_ry", "sp", [-1, 1, 1]], ["tile_rx", "sp", [-1, 1, 1]], ["auto_unroll_max_step", "ot", 512], ["unroll_explicit", "ot", 0]]}, "result": [[0.0700825591], 0, 51.236347675323486, 1609935143.1483083], "version": 0.2, "tvm_version": "0.8.dev0"}
{"input": ["opencl -keys=opencl,gpu -max_num_threads=256", "tutorial/conv2d_no_batching", [1, 38, 38, 512, 256, 1, 1, [1, 1], [1, 1]], {}], "config": {"index": 131272277, "code_hash": null, "entity": [["tile_f", "sp", [-1, 8, 16, 1]], ["tile_y", "sp", [-1, 1, 2, 4]], ["tile_x", "sp", [-1, 1, 5, 1]], ["tile_rc", "sp", [-1, 8, 1]], ["tile_ry", "sp", [-1, 1, 1]], ["tile_rx", "sp", [-1, 1, 1]], ["auto_unroll_max_step", "ot", 512], ["unroll_explicit", "ot", 0]]}, "result": [[0.040666873799999996], 0, 55.2954158782959, 1609935147.2510815], "version": 0.2, "tvm_version": "0.8.dev0"}
{"input": ["opencl -keys=opencl,gpu -max_num_threads=256", "tutorial/conv2d_no_batching", [1, 38, 38, 512, 256, 1, 1, [1, 1], [1, 1]], {}], "config": {"index": 131366926, "code_hash": null, "entity": [["tile_f", "sp", [-1, 2, 16, 2]], ["tile_y", "sp", [-1, 4, 1, 1]], ["tile_x", "sp", [-1, 1, 10, 1]], ["tile_rc", "sp", [-1, 8, 1]], ["tile_ry", "sp", [-1, 1, 1]], ["tile_rx", "sp", [-1, 1, 1]], ["auto_unroll_max_step", "ot", 512], ["unroll_explicit", "ot", 0]]}, "result": [[0.011736391799999999], 0, 58.61410927772522, 1609935150.5924685], "version": 0.2, "tvm_version": "0.8.dev0"}
{"input": ["opencl -keys=opencl,gpu -max_num_threads=256", "tutorial/conv2d_no_batching", [1, 38, 38, 512, 256, 1, 1, [1, 1], [1, 1]], {}], "config": {"index": 258139506, "code_hash": null, "entity": [["tile_f", "sp", [-1, 2, 16, 2]], ["tile_y", "sp", [-1, 2, 1, 1]], ["tile_x", "sp", [-1, 1, 20, 1]], ["tile_rc", "sp", [-1, 8, 1]], ["tile_ry", "sp", [-1, 1, 1]], ["tile_rx", "sp", [-1, 1, 1]], ["auto_unroll_max_step", "ot", 256], ["unroll_explicit", "ot", 1]]}, "result": [[0.0116537616], 0, 2.76536226272583, 1609935154.801347], "version": 0.2, "tvm_version": "0.8.dev0"}
{"input": ["opencl -keys=opencl,gpu -max_num_threads=256", "tutorial/conv2d_no_batching", [1, 38, 38, 512, 256, 1, 1, [1, 1], [1, 1]], {}], "config": {"index": 131425886, "code_hash": null, "entity": [["tile_f", "sp", [-1, 2, 16, 2]], ["tile_y", "sp", [-1, 1, 1, 2]], ["tile_x", "sp", [-1, 1, 20, 1]], ["tile_rc", "sp", [-1, 8, 1]], ["tile_ry", "sp", [-1, 1, 1]], ["tile_rx", "sp", [-1, 1, 1]], ["auto_unroll_max_step", "ot", 512], ["unroll_explicit", "ot", 0]]}, "result": [[0.0124065794], 0, 6.034003257751465, 1609935158.0996768], "version": 0.2, "tvm_version": "0.8.dev0"}
{"input": ["opencl -keys=opencl,gpu -max_num_threads=256", "tutorial/conv2d_no_batching", [1, 38, 38, 512, 256, 1, 1, [1, 1], [1, 1]], {}], "config": {"index": 257989027, "code_hash": null, "entity": [["tile_f", "sp", [-1, 4, 16, 2]], ["tile_y", "sp", [-1, 2, 2, 2]], ["tile_x", "sp", [-1, 1, 5, 1]], ["tile_rc", "sp", [-1, 8, 1]], ["tile_ry", "sp", [-1, 1, 1]], ["tile_rx", "sp", [-1, 1, 1]], ["auto_unroll_max_step", "ot", 256], ["unroll_explicit", "ot", 1]]}, "result": [[0.0111940428], 0, 14.176477193832397, 1609935166.227135], "version": 0.2, "tvm_version": "0.8.dev0"}
{"input": ["opencl -keys=opencl,gpu -max_num_threads=256", "tutorial/conv2d_no_batching", [1, 38, 38, 512, 256, 1, 1, [1, 1], [1, 1]], {}], "config": {"index": 320045521, "code_hash": null, "entity": [["tile_f", "sp", [-1, 4, 8, 2]], ["tile_y", "sp", [-1, 4, 1, 2]], ["tile_x", "sp", [-1, 1, 10, 1]], ["tile_rc", "sp", [-1, 4, 1]], ["tile_ry", "sp", [-1, 1, 1]], ["tile_rx", "sp", [-1, 1, 1]], ["auto_unroll_max_step", "ot", 512], ["unroll_explicit", "ot", 1]]}, "result": [[0.0539852554], 0, 10.937055349349976, 1609935163.0089476], "version": 0.2, "tvm_version": "0.8.dev0"}
{"input": ["opencl -keys=opencl,gpu -max_num_threads=256", "tutorial/conv2d_no_batching", [1, 38, 38, 512, 256, 1, 1, [1, 1], [1, 1]], {}], "config": {"index": 320425942, "code_hash": null, "entity": [["tile_f", "sp", [-1, 2, 8, 4]], ["tile_y", "sp", [-1, 2, 1, 1]], ["tile_x", "sp", [-1, 2, 10, 2]], ["tile_rc", "sp", [-1, 4, 1]], ["tile_ry", "sp", [-1, 1, 1]], ["tile_rx", "sp", [-1, 1, 1]], ["auto_unroll_max_step", "ot", 512], ["unroll_explicit", "ot", 1]]}, "result": [[0.029896466599999998], 0, 18.425973176956177, 1609935170.5412204], "version": 0.2, "tvm_version": "0.8.dev0"}
{"input": ["opencl -keys=opencl,gpu -max_num_threads=256", "tutorial/conv2d_no_batching", [1, 38, 38, 512, 256, 1, 1, [1, 1], [1, 1]], {}], "config": {"index": 68059506, "code_hash": null, "entity": [["tile_f", "sp", [-1, 2, 16, 2]], ["tile_y", "sp", [-1, 2, 1, 1]], ["tile_x", "sp", [-1, 1, 20, 1]], ["tile_rc", "sp", [-1, 8, 1]], ["tile_ry", "sp", [-1, 1, 1]], ["tile_rx", "sp", [-1, 1, 1]], ["auto_unroll_max_step", "ot", 256], ["unroll_explicit", "ot", 0]]}, "result": [[0.0122668918], 0, 32.88584756851196, 1609935185.0706599], "version": 0.2, "tvm_version": "0.8.dev0"}
{"input": ["opencl -keys=opencl,gpu -max_num_threads=256", "tutorial/conv2d_no_batching", [1, 38, 38, 512, 256, 1, 1, [1, 1], [1, 1]], {}], "config": {"index": 131685271, "code_hash": null, "entity": [["tile_f", "sp", [-1, 2, 32, 2]], ["tile_y", "sp", [-1, 2, 2, 1]], ["tile_x", "sp", [-1, 1, 5, 2]], ["tile_rc", "sp", [-1, 8, 1]], ["tile_ry", "sp", [-1, 1, 1]], ["tile_rx", "sp", [-1, 1, 1]], ["auto_unroll_max_step", "ot", 512], ["unroll_explicit", "ot", 0]]}, "result": [[0.0123855794], 0, 39.38478422164917, 1609935191.6003947], "version": 0.2, "tvm_version": "0.8.dev0"}
{"input": ["opencl -keys=opencl,gpu -max_num_threads=256", "tutorial/conv2d_no_batching", [1, 38, 38, 512, 256, 1, 1, [1, 1], [1, 1]], {}], "config": {"index": 321453310, "code_hash": null, "entity": [["tile_f", "sp", [-1, 1, 32, 2]], ["tile_y", "sp", [-1, 2, 1, 2]], ["tile_x", "sp", [-1, 1, 10, 1]], ["tile_rc", "sp", [-1, 8, 1]], ["tile_ry", "sp", [-1, 1, 1]], ["tile_rx", "sp", [-1, 1, 1]], ["auto_unroll_max_step", "ot", 512], ["unroll_explicit", "ot", 1]]}, "result": [[0.0152269182], 0, 36.21318340301514, 1609935188.4455833], "version": 0.2, "tvm_version": "0.8.dev0"}
{"input": ["opencl -keys=opencl,gpu -max_num_threads=256", "tutorial/conv2d_no_batching", [1, 38, 38, 512, 256, 1, 1, [1, 1], [1, 1]], {}], "config": {"index": 321453256, "code_hash": null, "entity": [["tile_f", "sp", [-1, 4, 16, 1]], ["tile_y", "sp", [-1, 2, 1, 2]], ["tile_x", "sp", [-1, 1, 10, 1]], ["tile_rc", "sp", [-1, 8, 1]], ["tile_ry", "sp", [-1, 1, 1]], ["tile_rx", "sp", [-1, 1, 1]], ["auto_unroll_max_step", "ot", 512], ["unroll_explicit", "ot", 1]]}, "result": [[0.012247011700000001], 0, 42.694514751434326, 1609935194.960897], "version": 0.2, "tvm_version": "0.8.dev0"}
{"input": ["opencl -keys=opencl,gpu -max_num_threads=256", "tutorial/conv2d_no_batching", [1, 38, 38, 512, 256, 1, 1, [1, 1], [1, 1]], {}], "config": {"index": 320443500, "code_hash": null, "entity": [["tile_f", "sp", [-1, 2, 8, 2]], ["tile_y", "sp", [-1, 2, 1, 1]], ["tile_x", "sp", [-1, 1, 20, 2]], ["tile_rc", "sp", [-1, 4, 1]], ["tile_ry", "sp", [-1, 1, 1]], ["tile_rx", "sp", [-1, 1, 1]], ["auto_unroll_max_step", "ot", 512], ["unroll_explicit", "ot", 1]]}, "result": [[0.010185126], 0, 45.83051633834839, 1609935198.118446], "version": 0.2, "tvm_version": "0.8.dev0"}
{"input": ["opencl -keys=opencl,gpu -max_num_threads=256", "tutorial/conv2d_no_batching", [1, 38, 38, 512, 256, 1, 1, [1, 1], [1, 1]], {}], "config": {"index": 131268761, "code_hash": null, "entity": [["tile_f", "sp", [-1, 2, 32, 1]], ["tile_y", "sp", [-1, 1, 2, 2]], ["tile_x", "sp", [-1, 1, 5, 1]], ["tile_rc", "sp", [-1, 8, 1]], ["tile_ry", "sp", [-1, 1, 1]], ["tile_rx", "sp", [-1, 1, 1]], ["auto_unroll_max_step", "ot", 512], ["unroll_explicit", "ot", 0]]}, "result": [[0.0246450389], 0, 49.29547572135925, 1609935201.606642], "version": 0.2, "tvm_version": "0.8.dev0"}
