test_and_tune/android.nhcw4c.log.tmp
{"input": ["opencl -keys=opencl,gpu -max_num_threads=256", "tutorial/conv2d_no_batching", [1, 40, 40, 512, 256, 1, 1, [1, 1], [0, 0]], {}], "config": {"index": 10172, "code_hash": null, "entity": [["tile_rc", "sp", [-1, 2, 4]], ["tile_f", "sp", [-1, 32]], ["tile_y", "sp", [-1, 2, 2]], ["tile_x", "sp", [-1, 4, 8]]]}, "result": [[0.008053995599999999], 0, 68.08599781990051, 1612442265.3316154], "version": 0.2, "tvm_version": "0.8.dev0"}
{"input": ["opencl -keys=opencl,gpu -max_num_threads=256", "tutorial/conv2d_no_batching", [1, 40, 40, 512, 256, 1, 1, [1, 1], [0, 0]], {}], "config": {"index": 1260, "code_hash": null, "entity": [["tile_rc", "sp", [-1, 1, 4]], ["tile_f", "sp", [-1, 16]], ["tile_y", "sp", [-1, 10, 2]], ["tile_x", "sp", [-1, 2, 4]]]}, "result": [[0.0067522193999999995], 0, 72.67533612251282, 1612442269.9153976], "version": 0.2, "tvm_version": "0.8.dev0"}
{"input": ["opencl -keys=opencl,gpu -max_num_threads=256", "tutorial/conv2d_no_batching", [1, 40, 40, 512, 256, 1, 1, [1, 1], [0, 0]], {}], "config": {"index": 512, "code_hash": null, "entity": [["tile_rc", "sp", [-1, 2, 4]], ["tile_f", "sp", [-1, 2]], ["tile_y", "sp", [-1, 10, 4]], ["tile_x", "sp", [-1, 1, 4]]]}, "result": [[0.012903918], 0, 52.40302395820618, 1612442336.357095], "version": 0.2, "tvm_version": "0.8.dev0"}
{"input": ["opencl -keys=opencl,gpu -max_num_threads=256", "tutorial/conv2d_no_batching", [1, 40, 40, 512, 256, 1, 1, [1, 1], [0, 0]], {}], "config": {"index": 12105, "code_hash": null, "entity": [["tile_rc", "sp", [-1, 4, 4]], ["tile_f", "sp", [-1, 2]], ["tile_y", "sp", [-1, 1, 2]], ["tile_x", "sp", [-1, 10, 8]]]}, "result": [[0.012237787699999999], 0, 31.88778519630432, 1612442401.522733], "version": 0.2, "tvm_version": "0.8.dev0"}
{"input": ["opencl -keys=opencl,gpu -max_num_threads=256", "tutorial/conv2d_no_batching", [1, 40, 40, 512, 256, 1, 1, [1, 1], [0, 0]], {}], "config": {"index": 24481, "code_hash": null, "entity": [["tile_rc", "sp", [-1, 4, 4]], ["tile_f", "sp", [-1, 2]], ["tile_y", "sp", [-1, 20, 2]], ["tile_x", "sp", [-1, 1, 40]]]}, "result": [[0.0315409615], 0, 48.289018869400024, 1612442417.9126444], "version": 0.2, "tvm_version": "0.8.dev0"}
{"input": ["opencl -keys=opencl,gpu -max_num_threads=256", "tutorial/conv2d_no_batching", [1, 40, 40, 512, 256, 1, 1, [1, 1], [0, 0]], {}], "config": {"index": 4271, "code_hash": null, "entity": [["tile_rc", "sp", [-1, 2, 4]], ["tile_f", "sp", [-1, 4]], ["tile_y", "sp", [-1, 10, 2]], ["tile_x", "sp", [-1, 8, 4]]]}, "result": [[0.0085801727], 0, 20.644334316253662, 1612442460.671586], "version": 0.2, "tvm_version": "0.8.dev0"}
{"input": ["opencl -keys=opencl,gpu -max_num_threads=256", "tutorial/conv2d_no_batching", [1, 40, 40, 512, 256, 1, 1, [1, 1], [0, 0]], {}], "config": {"index": 43, "code_hash": null, "entity": [["tile_rc", "sp", [-1, 2, 4]], ["tile_f", "sp", [-1, 64]], ["tile_y", "sp", [-1, 1, 2]], ["tile_x", "sp", [-1, 1, 4]]]}, "result": [[0.0147637671], 0, 25.843864679336548, 1612442465.8855133], "version": 0.2, "tvm_version": "0.8.dev0"}
{"input": ["opencl -keys=opencl,gpu -max_num_threads=256", "tutorial/conv2d_no_batching", [1, 40, 40, 512, 256, 1, 1, [1, 1], [0, 0]], {}], "config": {"index": 9500, "code_hash": null, "entity": [["tile_rc", "sp", [-1, 2, 4]], ["tile_f", "sp", [-1, 32]], ["tile_y", "sp", [-1, 2, 4]], ["tile_x", "sp", [-1, 2, 8]]]}, "result": [[0.0070403965], 0, 52.466235399246216, 1612442492.5202684], "version": 0.2, "tvm_version": "0.8.dev0"}
{"input": ["opencl -keys=opencl,gpu -max_num_threads=256", "tutorial/conv2d_no_batching", [1, 40, 40, 512, 256, 1, 1, [1, 1], [0, 0]], {}], "config": {"index": 9213, "code_hash": null, "entity": [["tile_rc", "sp", [-1, 2, 4]], ["tile_f", "sp", [-1, 16]], ["tile_y", "sp", [-1, 4, 2]], ["tile_x", "sp", [-1, 2, 8]]]}, "result": [[0.0083775061], 0, 4.549558877944946, 1612442535.801867], "version": 0.2, "tvm_version": "0.8.dev0"}
{"input": ["opencl -keys=opencl,gpu -max_num_threads=256", "tutorial/conv2d_no_batching", [1, 40, 40, 512, 256, 1, 1, [1, 1], [0, 0]], {}], "config": {"index": 9269, "code_hash": null, "entity": [["tile_rc", "sp", [-1, 2, 4]], ["tile_f", "sp", [-1, 16]], ["tile_y", "sp", [-1, 5, 2]], ["tile_x", "sp", [-1, 2, 8]]]}, "result": [[0.0084394384], 0, 9.595596551895142, 1612442540.8358743], "version": 0.2, "tvm_version": "0.8.dev0"}
{"input": ["opencl -keys=opencl,gpu -max_num_threads=256", "tutorial/conv2d_no_batching", [1, 40, 40, 512, 256, 1, 1, [1, 1], [0, 0]], {}], "config": {"index": 9206, "code_hash": null, "entity": [["tile_rc", "sp", [-1, 2, 4]], ["tile_f", "sp", [-1, 8]], ["tile_y", "sp", [-1, 4, 2]], ["tile_x", "sp", [-1, 2, 8]]]}, "result": [[0.00867348], 0, 14.540741443634033, 1612442545.8245826], "version": 0.2, "tvm_version": "0.8.dev0"}
{"input": ["opencl -keys=opencl,gpu -max_num_threads=256", "tutorial/conv2d_no_batching", [1, 40, 40, 512, 256, 1, 1, [1, 1], [0, 0]], {}], "config": {"index": 2423, "code_hash": null, "entity": [["tile_rc", "sp", [-1, 2, 4]], ["tile_f", "sp", [-1, 4]], ["tile_y", "sp", [-1, 2, 4]], ["tile_x", "sp", [-1, 4, 4]]]}, "result": [[0.0056922714], 0, 19.41474175453186, 1612442550.6659348], "version": 0.2, "tvm_version": "0.8.dev0"}
{"input": ["opencl -keys=opencl,gpu -max_num_threads=256", "tutorial/conv2d_no_batching", [1, 40, 40, 512, 256, 1, 1, [1, 1], [0, 0]], {}], "config": {"index": 9262, "code_hash": null, "entity": [["tile_rc", "sp", [-1, 2, 4]], ["tile_f", "sp", [-1, 8]], ["tile_y", "sp", [-1, 5, 2]], ["tile_x", "sp", [-1, 2, 8]]]}, "result": [[0.0082939904], 0, 43.63404297828674, 1612442574.9440863], "version": 0.2, "tvm_version": "0.8.dev0"}
{"input": ["opencl -keys=opencl,gpu -max_num_threads=256", "tutorial/conv2d_no_batching", [1, 40, 40, 512, 256, 1, 1, [1, 1], [0, 0]], {}], "config": {"index": 9199, "code_hash": null, "entity": [["tile_rc", "sp", [-1, 2, 4]], ["tile_f", "sp", [-1, 4]], ["tile_y", "sp", [-1, 4, 2]], ["tile_x", "sp", [-1, 2, 8]]]}, "result": [[0.009003329000000001], 0, 24.195564031600952, 1612442555.489318], "version": 0.2, "tvm_version": "0.8.dev0"}
{"input": ["opencl -keys=opencl,gpu -max_num_threads=256", "tutorial/conv2d_no_batching", [1, 40, 40, 512, 256, 1, 1, [1, 1], [0, 0]], {}], "config": {"index": 2430, "code_hash": null, "entity": [["tile_rc", "sp", [-1, 2, 4]], ["tile_f", "sp", [-1, 8]], ["tile_y", "sp", [-1, 2, 4]], ["tile_x", "sp", [-1, 4, 4]]]}, "result": [[0.0071728653], 0, 28.9848952293396, 1612442560.3210847], "version": 0.2, "tvm_version": "0.8.dev0"}
{"input": ["opencl -keys=opencl,gpu -max_num_threads=256", "tutorial/conv2d_no_batching", [1, 40, 40, 512, 256, 1, 1, [1, 1], [0, 0]], {}], "config": {"index": 9214, "code_hash": null, "entity": [["tile_rc", "sp", [-1, 4, 4]], ["tile_f", "sp", [-1, 16]], ["tile_y", "sp", [-1, 4, 2]], ["tile_x", "sp", [-1, 2, 8]]]}, "result": [[0.0091935843], 0, 33.79611086845398, 1612442565.1237073], "version": 0.2, "tvm_version": "0.8.dev0"}
{"input": ["opencl -keys=opencl,gpu -max_num_threads=256", "tutorial/conv2d_no_batching", [1, 40, 40, 512, 256, 1, 1, [1, 1], [0, 0]], {}], "config": {"index": 9270, "code_hash": null, "entity": [["tile_rc", "sp", [-1, 4, 4]], ["tile_f", "sp", [-1, 16]], ["tile_y", "sp", [-1, 5, 2]], ["tile_x", "sp", [-1, 2, 8]]]}, "result": [[0.0094682769], 0, 38.70558214187622, 1612442570.0387313], "version": 0.2, "tvm_version": "0.8.dev0"}
{"input": ["opencl -keys=opencl,gpu -max_num_threads=256", "tutorial/conv2d_no_batching", [1, 40, 40, 512, 256, 1, 1, [1, 1], [0, 0]], {}], "config": {"index": 2431, "code_hash": null, "entity": [["tile_rc", "sp", [-1, 4, 4]], ["tile_f", "sp", [-1, 8]], ["tile_y", "sp", [-1, 2, 4]], ["tile_x", "sp", [-1, 4, 4]]]}, "result": [[0.0078038966000000005], 0, 53.51915216445923, 1612442584.8660526], "version": 0.2, "tvm_version": "0.8.dev0"}
{"input": ["opencl -keys=opencl,gpu -max_num_threads=256", "tutorial/conv2d_no_batching", [1, 40, 40, 512, 256, 1, 1, [1, 1], [0, 0]], {}], "config": {"index": 9207, "code_hash": null, "entity": [["tile_rc", "sp", [-1, 4, 4]], ["tile_f", "sp", [-1, 8]], ["tile_y", "sp", [-1, 4, 2]], ["tile_x", "sp", [-1, 2, 8]]]}, "result": [[0.0092787561], 0, 48.56271457672119, 1612442579.9296522], "version": 0.2, "tvm_version": "0.8.dev0"}
{"input": ["opencl -keys=opencl,gpu -max_num_threads=256", "tutorial/conv2d_no_batching", [1, 40, 40, 512, 256, 1, 1, [1, 1], [0, 0]], {}], "config": {"index": 9255, "code_hash": null, "entity": [["tile_rc", "sp", [-1, 2, 4]], ["tile_f", "sp", [-1, 4]], ["tile_y", "sp", [-1, 5, 2]], ["tile_x", "sp", [-1, 2, 8]]]}, "result": [[0.0084889592], 0, 58.265507221221924, 1612442589.6503935], "version": 0.2, "tvm_version": "0.8.dev0"}
{"input": ["opencl -keys=opencl,gpu -max_num_threads=256", "tutorial/conv2d_no_batching", [1, 40, 40, 512, 256, 1, 1, [1, 1], [0, 0]], {}], "config": {"index": 3431, "code_hash": null, "entity": [["tile_rc", "sp", [-1, 2, 4]], ["tile_f", "sp", [-1, 4]], ["tile_y", "sp", [-1, 2, 4]], ["tile_x", "sp", [-1, 5, 4]]]}, "result": [[0.0063472871], 0, 62.95688199996948, 1612442594.3502169], "version": 0.2, "tvm_version": "0.8.dev0"}
{"input": ["opencl -keys=opencl,gpu -max_num_threads=256", "tutorial/conv2d_no_batching", [1, 40, 40, 512, 256, 1, 1, [1, 1], [0, 0]], {}], "config": {"index": 10158, "code_hash": null, "entity": [["tile_rc", "sp", [-1, 2, 4]], ["tile_f", "sp", [-1, 8]], ["tile_y", "sp", [-1, 2, 2]], ["tile_x", "sp", [-1, 4, 8]]]}, "result": [[0.0082064123], 0, 72.7630844116211, 1612442604.170864], "version": 0.2, "tvm_version": "0.8.dev0"}
{"input": ["opencl -keys=opencl,gpu -max_num_threads=256", "tutorial/conv2d_no_batching", [1, 40, 40, 512, 256, 1, 1, [1, 1], [0, 0]], {}], "config": {"index": 3157, "code_hash": null, "entity": [["tile_rc", "sp", [-1, 1, 4]], ["tile_f", "sp", [-1, 8]], ["tile_y", "sp", [-1, 4, 2]], ["tile_x", "sp", [-1, 5, 4]]]}, "result": [[0.0074083601], 0, 67.82740020751953, 1612442599.256352], "version": 0.2, "tvm_version": "0.8.dev0"}
{"input": ["opencl -keys=opencl,gpu -max_num_threads=256", "tutorial/conv2d_no_batching", [1, 40, 40, 512, 256, 1, 1, [1, 1], [0, 0]], {}], "config": {"index": 2205, "code_hash": null, "entity": [["tile_rc", "sp", [-1, 1, 4]], ["tile_f", "sp", [-1, 8]], ["tile_y", "sp", [-1, 5, 2]], ["tile_x", "sp", [-1, 4, 4]]]}, "result": [[0.0061913704], 0, 77.4160897731781, 1612442608.847761], "version": 0.2, "tvm_version": "0.8.dev0"}
{"input": ["opencl -keys=opencl,gpu -max_num_threads=256", "tutorial/conv2d_no_batching", [1, 40, 40, 512, 256, 1, 1, [1, 1], [0, 0]], {}], "config": {"index": 2149, "code_hash": null, "entity": [["tile_rc", "sp", [-1, 1, 4]], ["tile_f", "sp", [-1, 8]], ["tile_y", "sp", [-1, 4, 2]], ["tile_x", "sp", [-1, 4, 4]]]}, "result": [[0.0069214121000000005], 0, 4.520413637161255, 1612442614.2559137], "version": 0.2, "tvm_version": "0.8.dev0"}
{"input": ["opencl -keys=opencl,gpu -max_num_threads=256", "tutorial/conv2d_no_batching", [1, 40, 40, 512, 256, 1, 1, [1, 1], [0, 0]], {}], "config": {"index": 9205, "code_hash": null, "entity": [["tile_rc", "sp", [-1, 1, 4]], ["tile_f", "sp", [-1, 8]], ["tile_y", "sp", [-1, 4, 2]], ["tile_x", "sp", [-1, 2, 8]]]}, "result": [[0.008470459199999999], 0, 9.571967840194702, 1612442619.3224573], "version": 0.2, "tvm_version": "0.8.dev0"}
{"input": ["opencl -keys=opencl,gpu -max_num_threads=256", "tutorial/conv2d_no_batching", [1, 40, 40, 512, 256, 1, 1, [1, 1], [0, 0]], {}], "config": {"index": 3214, "code_hash": null, "entity": [["tile_rc", "sp", [-1, 2, 4]], ["tile_f", "sp", [-1, 8]], ["tile_y", "sp", [-1, 5, 2]], ["tile_x", "sp", [-1, 5, 4]]]}, "result": [[0.007683089299999999], 0, 14.4420166015625, 1612442624.1979485], "version": 0.2, "tvm_version": "0.8.dev0"}
{"input": ["opencl -keys=opencl,gpu -max_num_threads=256", "tutorial/conv2d_no_batching", [1, 40, 40, 512, 256, 1, 1, [1, 1], [0, 0]], {}], "config": {"index": 2429, "code_hash": null, "entity": [["tile_rc", "sp", [-1, 1, 4]], ["tile_f", "sp", [-1, 8]], ["tile_y", "sp", [-1, 2, 4]], ["tile_x", "sp", [-1, 4, 4]]]}, "result": [[0.0072053444999999995], 0, 19.338202714920044, 1612442629.0723548], "version": 0.2, "tvm_version": "0.8.dev0"}
{"input": ["opencl -keys=opencl,gpu -max_num_threads=256", "tutorial/conv2d_no_batching", [1, 40, 40, 512, 256, 1, 1, [1, 1], [0, 0]], {}], "config": {"index": 9212, "code_hash": null, "entity": [["tile_rc", "sp", [-1, 1, 4]], ["tile_f", "sp", [-1, 16]], ["tile_y", "sp", [-1, 4, 2]], ["tile_x", "sp", [-1, 2, 8]]]}, "result": [[0.0085494071], 0, 34.200231075286865, 1612442643.9446235], "version": 0.2, "tvm_version": "0.8.dev0"}
{"input": ["opencl -keys=opencl,gpu -max_num_threads=256", "tutorial/conv2d_no_batching", [1, 40, 40, 512, 256, 1, 1, [1, 1], [0, 0]], {}], "config": {"index": 9268, "code_hash": null, "entity": [["tile_rc", "sp", [-1, 1, 4]], ["tile_f", "sp", [-1, 16]], ["tile_y", "sp", [-1, 5, 2]], ["tile_x", "sp", [-1, 2, 8]]]}, "result": [[0.0083279904], 0, 24.18648886680603, 1612442633.9411497], "version": 0.2, "tvm_version": "0.8.dev0"}
{"input": ["opencl -keys=opencl,gpu -max_num_threads=256", "tutorial/conv2d_no_batching", [1, 40, 40, 512, 256, 1, 1, [1, 1], [0, 0]], {}], "config": {"index": 3213, "code_hash": null, "entity": [["tile_rc", "sp", [-1, 1, 4]], ["tile_f", "sp", [-1, 8]], ["tile_y", "sp", [-1, 5, 2]], ["tile_x", "sp", [-1, 5, 4]]]}, "result": [[0.0072142612], 0, 29.103088855743408, 1612442638.863508], "version": 0.2, "tvm_version": "0.8.dev0"}
{"input": ["opencl -keys=opencl,gpu -max_num_threads=256", "tutorial/conv2d_no_batching", [1, 40, 40, 512, 256, 1, 1, [1, 1], [0, 0]], {}], "config": {"index": 3206, "code_hash": null, "entity": [["tile_rc", "sp", [-1, 1, 4]], ["tile_f", "sp", [-1, 4]], ["tile_y", "sp", [-1, 5, 2]], ["tile_x", "sp", [-1, 5, 4]]]}, "result": [[0.0084190373], 0, 39.152184009552, 1612442648.9320812], "version": 0.2, "tvm_version": "0.8.dev0"}
{"input": ["opencl -keys=opencl,gpu -max_num_threads=256", "tutorial/conv2d_no_batching", [1, 40, 40, 512, 256, 1, 1, [1, 1], [0, 0]], {}], "config": {"index": 9261, "code_hash": null, "entity": [["tile_rc", "sp", [-1, 1, 4]], ["tile_f", "sp", [-1, 8]], ["tile_y", "sp", [-1, 5, 2]], ["tile_x", "sp", [-1, 2, 8]]]}, "result": [[0.007739776800000001], 0, 63.568922996520996, 1612442673.357371], "version": 0.2, "tvm_version": "0.8.dev0"}
{"input": ["opencl -keys=opencl,gpu -max_num_threads=256", "tutorial/conv2d_no_batching", [1, 40, 40, 512, 256, 1, 1, [1, 1], [0, 0]], {}], "config": {"index": 18334, "code_hash": null, "entity": [["tile_rc", "sp", [-1, 2, 4]], ["tile_f", "sp", [-1, 8]], ["tile_y", "sp", [-1, 5, 2]], ["tile_x", "sp", [-1, 1, 20]]]}, "result": [[0.00638011], 0, 44.07416081428528, 1612442653.8476999], "version": 0.2, "tvm_version": "0.8.dev0"}
{"input": ["opencl -keys=opencl,gpu -max_num_threads=256", "tutorial/conv2d_no_batching", [1, 40, 40, 512, 256, 1, 1, [1, 1], [0, 0]], {}], "config": {"index": 14253, "code_hash": null, "entity": [["tile_rc", "sp", [-1, 2, 4]], ["tile_f", "sp", [-1, 16]], ["tile_y", "sp", [-1, 4, 2]], ["tile_x", "sp", [-1, 1, 16]]]}, "result": [[0.0052107869], 0, 53.63954782485962, 1612442663.4283147], "version": 0.2, "tvm_version": "0.8.dev0"}
{"input": ["opencl -keys=opencl,gpu -max_num_threads=256", "tutorial/conv2d_no_batching", [1, 40, 40, 512, 256, 1, 1, [1, 1], [0, 0]], {}], "config": {"index": 14309, "code_hash": null, "entity": [["tile_rc", "sp", [-1, 2, 4]], ["tile_f", "sp", [-1, 16]], ["tile_y", "sp", [-1, 5, 2]], ["tile_x", "sp", [-1, 1, 16]]]}, "result": [[0.0073774382], 0, 48.86522626876831, 1612442658.6715083], "version": 0.2, "tvm_version": "0.8.dev0"}
{"input": ["opencl -keys=opencl,gpu -max_num_threads=256", "tutorial/conv2d_no_batching", [1, 40, 40, 512, 256, 1, 1, [1, 1], [0, 0]], {}], "config": {"index": 9193, "code_hash": null, "entity": [["tile_rc", "sp", [-1, 4, 4]], ["tile_f", "sp", [-1, 2]], ["tile_y", "sp", [-1, 4, 2]], ["tile_x", "sp", [-1, 2, 8]]]}, "result": [[0.0140664806], 0, 58.62577962875366, 1612442668.4345317], "version": 0.2, "tvm_version": "0.8.dev0"}
{"input": ["opencl -keys=opencl,gpu -max_num_threads=256", "tutorial/conv2d_no_batching", [1, 40, 40, 512, 256, 1, 1, [1, 1], [0, 0]], {}], "config": {"index": 3425, "code_hash": null, "entity": [["tile_rc", "sp", [-1, 4, 4]], ["tile_f", "sp", [-1, 2]], ["tile_y", "sp", [-1, 2, 4]], ["tile_x", "sp", [-1, 5, 4]]]}, "result": [[0.0116839334], 0, 68.55246710777283, 1612442678.3654933], "version": 0.2, "tvm_version": "0.8.dev0"}
{"input": ["opencl -keys=opencl,gpu -max_num_threads=256", "tutorial/conv2d_no_batching", [1, 40, 40, 512, 256, 1, 1, [1, 1], [0, 0]], {}], "config": {"index": 9249, "code_hash": null, "entity": [["tile_rc", "sp", [-1, 4, 4]], ["tile_f", "sp", [-1, 2]], ["tile_y", "sp", [-1, 5, 2]], ["tile_x", "sp", [-1, 2, 8]]]}, "result": [[0.012598168000000002], 0, 78.7917366027832, 1612442688.6371367], "version": 0.2, "tvm_version": "0.8.dev0"}
{"input": ["opencl -keys=opencl,gpu -max_num_threads=256", "tutorial/conv2d_no_batching", [1, 40, 40, 512, 256, 1, 1, [1, 1], [0, 0]], {}], "config": {"index": 2417, "code_hash": null, "entity": [["tile_rc", "sp", [-1, 4, 4]], ["tile_f", "sp", [-1, 2]], ["tile_y", "sp", [-1, 2, 4]], ["tile_x", "sp", [-1, 4, 4]]]}, "result": [[0.0137915586], 0, 73.64073371887207, 1612442683.4771962], "version": 0.2, "tvm_version": "0.8.dev0"}
{"input": ["opencl -keys=opencl,gpu -max_num_threads=256", "tutorial/conv2d_no_batching", [1, 40, 40, 512, 256, 1, 1, [1, 1], [0, 0]], {}], "config": {"index": 9200, "code_hash": null, "entity": [["tile_rc", "sp", [-1, 4, 4]], ["tile_f", "sp", [-1, 4]], ["tile_y", "sp", [-1, 4, 2]], ["tile_x", "sp", [-1, 2, 8]]]}, "result": [[0.0107476834], 0, 4.845427989959717, 1612442694.354762], "version": 0.2, "tvm_version": "0.8.dev0"}
{"input": ["opencl -keys=opencl,gpu -max_num_threads=256", "tutorial/conv2d_no_batching", [1, 40, 40, 512, 256, 1, 1, [1, 1], [0, 0]], {}], "config": {"index": 9185, "code_hash": null, "entity": [["tile_rc", "sp", [-1, 2, 4]], ["tile_f", "sp", [-1, 1]], ["tile_y", "sp", [-1, 4, 2]], ["tile_x", "sp", [-1, 2, 8]]]}, "result": [[0.0186891529], 0, 10.14858627319336, 1612442699.6490386], "version": 0.2, "tvm_version": "0.8.dev0"}
{"input": ["opencl -keys=opencl,gpu -max_num_threads=256", "tutorial/conv2d_no_batching", [1, 40, 40, 512, 256, 1, 1, [1, 1], [0, 0]], {}], "config": {"index": 2409, "code_hash": null, "entity": [["tile_rc", "sp", [-1, 2, 4]], ["tile_f", "sp", [-1, 1]], ["tile_y", "sp", [-1, 2, 4]], ["tile_x", "sp", [-1, 4, 4]]]}, "result": [[0.0179052882], 0, 15.211533308029175, 1612442704.7391338], "version": 0.2, "tvm_version": "0.8.dev0"}
{"input": ["opencl -keys=opencl,gpu -max_num_threads=256", "tutorial/conv2d_no_batching", [1, 40, 40, 512, 256, 1, 1, [1, 1], [0, 0]], {}], "config": {"index": 9248, "code_hash": null, "entity": [["tile_rc", "sp", [-1, 2, 4]], ["tile_f", "sp", [-1, 2]], ["tile_y", "sp", [-1, 5, 2]], ["tile_x", "sp", [-1, 2, 8]]]}, "result": [[0.0091878759], 0, 35.39864730834961, 1612442724.9298427], "version": 0.2, "tvm_version": "0.8.dev0"}
{"input": ["opencl -keys=opencl,gpu -max_num_threads=256", "tutorial/conv2d_no_batching", [1, 40, 40, 512, 256, 1, 1, [1, 1], [0, 0]], {}], "config": {"index": 3424, "code_hash": null, "entity": [["tile_rc", "sp", [-1, 2, 4]], ["tile_f", "sp", [-1, 2]], ["tile_y", "sp", [-1, 2, 4]], ["tile_x", "sp", [-1, 5, 4]]]}, "result": [[0.008427276899999999], 0, 20.176068782806396, 1612442709.6926434], "version": 0.2, "tvm_version": "0.8.dev0"}
{"input": ["opencl -keys=opencl,gpu -max_num_threads=256", "tutorial/conv2d_no_batching", [1, 40, 40, 512, 256, 1, 1, [1, 1], [0, 0]], {}], "config": {"index": 9241, "code_hash": null, "entity": [["tile_rc", "sp", [-1, 2, 4]], ["tile_f", "sp", [-1, 1]], ["tile_y", "sp", [-1, 5, 2]], ["tile_x", "sp", [-1, 2, 8]]]}, "result": [[0.015403678600000002], 0, 25.28452777862549, 1612442714.8218071], "version": 0.2, "tvm_version": "0.8.dev0"}
{"input": ["opencl -keys=opencl,gpu -max_num_threads=256", "tutorial/conv2d_no_batching", [1, 40, 40, 512, 256, 1, 1, [1, 1], [0, 0]], {}], "config": {"index": 3417, "code_hash": null, "entity": [["tile_rc", "sp", [-1, 2, 4]], ["tile_f", "sp", [-1, 1]], ["tile_y", "sp", [-1, 2, 4]], ["tile_x", "sp", [-1, 5, 4]]]}, "result": [[0.0150027255], 0, 30.427695989608765, 1612442719.9710126], "version": 0.2, "tvm_version": "0.8.dev0"}
{"input": ["opencl -keys=opencl,gpu -max_num_threads=256", "tutorial/conv2d_no_batching", [1, 40, 40, 512, 256, 1, 1, [1, 1], [0, 0]], {}], "config": {"index": 9256, "code_hash": null, "entity": [["tile_rc", "sp", [-1, 4, 4]], ["tile_f", "sp", [-1, 4]], ["tile_y", "sp", [-1, 5, 2]], ["tile_x", "sp", [-1, 2, 8]]]}, "result": [[0.0097655009], 0, 40.448734998703, 1612442729.9961946], "version": 0.2, "tvm_version": "0.8.dev0"}
{"input": ["opencl -keys=opencl,gpu -max_num_threads=256", "tutorial/conv2d_no_batching", [1, 40, 40, 512, 256, 1, 1, [1, 1], [0, 0]], {}], "config": {"index": 2424, "code_hash": null, "entity": [["tile_rc", "sp", [-1, 4, 4]], ["tile_f", "sp", [-1, 4]], ["tile_y", "sp", [-1, 2, 4]], ["tile_x", "sp", [-1, 4, 4]]]}, "result": [[0.0078778862], 0, 45.30606436729431, 1612442734.863078], "version": 0.2, "tvm_version": "0.8.dev0"}
{"input": ["opencl -keys=opencl,gpu -max_num_threads=256", "tutorial/conv2d_no_batching", [1, 40, 40, 512, 256, 1, 1, [1, 1], [0, 0]], {}], "config": {"index": 3432, "code_hash": null, "entity": [["tile_rc", "sp", [-1, 4, 4]], ["tile_f", "sp", [-1, 4]], ["tile_y", "sp", [-1, 2, 4]], ["tile_x", "sp", [-1, 5, 4]]]}, "result": [[0.007442604899999999], 0, 50.260931730270386, 1612442739.8190181], "version": 0.2, "tvm_version": "0.8.dev0"}
{"input": ["opencl -keys=opencl,gpu -max_num_threads=256", "tutorial/conv2d_no_batching", [1, 40, 40, 512, 256, 1, 1, [1, 1], [0, 0]], {}], "config": {"index": 2416, "code_hash": null, "entity": [["tile_rc", "sp", [-1, 2, 4]], ["tile_f", "sp", [-1, 2]], ["tile_y", "sp", [-1, 2, 4]], ["tile_x", "sp", [-1, 4, 4]]]}, "result": [[0.009369282199999999], 0, 55.27147102355957, 1612442744.8478944], "version": 0.2, "tvm_version": "0.8.dev0"}
{"input": ["opencl -keys=opencl,gpu -max_num_threads=256", "tutorial/conv2d_no_batching", [1, 40, 40, 512, 256, 1, 1, [1, 1], [0, 0]], {}], "config": {"index": 9192, "code_hash": null, "entity": [["tile_rc", "sp", [-1, 2, 4]], ["tile_f", "sp", [-1, 2]], ["tile_y", "sp", [-1, 4, 2]], ["tile_x", "sp", [-1, 2, 8]]]}, "result": [[0.0099136208], 0, 60.25262475013733, 1612442749.831692], "version": 0.2, "tvm_version": "0.8.dev0"}
{"input": ["opencl -keys=opencl,gpu -max_num_threads=256", "tutorial/conv2d_no_batching", [1, 40, 40, 512, 256, 1, 1, [1, 1], [0, 0]], {}], "config": {"index": 2486, "code_hash": null, "entity": [["tile_rc", "sp", [-1, 2, 4]], ["tile_f", "sp", [-1, 8]], ["tile_y", "sp", [-1, 5, 4]], ["tile_x", "sp", [-1, 4, 4]]]}, "result": [[0.0052526203], 0, 65.02234411239624, 1612442754.6198878], "version": 0.2, "tvm_version": "0.8.dev0"}
{"input": ["opencl -keys=opencl,gpu -max_num_threads=256", "tutorial/conv2d_no_batching", [1, 40, 40, 512, 256, 1, 1, [1, 1], [0, 0]], {}], "config": {"index": 9318, "code_hash": null, "entity": [["tile_rc", "sp", [-1, 2, 4]], ["tile_f", "sp", [-1, 8]], ["tile_y", "sp", [-1, 10, 2]], ["tile_x", "sp", [-1, 2, 8]]]}, "result": [[0.0078728237], 0, 69.85787749290466, 1612442759.460477], "version": 0.2, "tvm_version": "0.8.dev0"}
{"input": ["opencl -keys=opencl,gpu -max_num_threads=256", "tutorial/conv2d_no_batching", [1, 40, 40, 512, 256, 1, 1, [1, 1], [0, 0]], {}], "config": {"index": 3487, "code_hash": null, "entity": [["tile_rc", "sp", [-1, 2, 4]], ["tile_f", "sp", [-1, 4]], ["tile_y", "sp", [-1, 5, 4]], ["tile_x", "sp", [-1, 5, 4]]]}, "result": [[0.0074086049], 0, 74.51898550987244, 1612442764.126412], "version": 0.2, "tvm_version": "0.8.dev0"}
{"input": ["opencl -keys=opencl,gpu -max_num_threads=256", "tutorial/conv2d_no_batching", [1, 40, 40, 512, 256, 1, 1, [1, 1], [0, 0]], {}], "config": {"index": 10319, "code_hash": null, "entity": [["tile_rc", "sp", [-1, 2, 4]], ["tile_f", "sp", [-1, 4]], ["tile_y", "sp", [-1, 10, 2]], ["tile_x", "sp", [-1, 4, 8]]]}, "result": [[0.0082710373], 0, 79.320387840271, 1612442768.9389071], "version": 0.2, "tvm_version": "0.8.dev0"}
{"input": ["opencl -keys=opencl,gpu -max_num_threads=256", "tutorial/conv2d_no_batching", [1, 40, 40, 512, 256, 1, 1, [1, 1], [0, 0]], {}], "config": {"index": 18390, "code_hash": null, "entity": [["tile_rc", "sp", [-1, 2, 4]], ["tile_f", "sp", [-1, 8]], ["tile_y", "sp", [-1, 10, 2]], ["tile_x", "sp", [-1, 1, 20]]]}, "result": [[0.0084677873], 0, 4.554806232452393, 1612442778.7131338], "version": 0.2, "tvm_version": "0.8.dev0"}
{"input": ["opencl -keys=opencl,gpu -max_num_threads=256", "tutorial/conv2d_no_batching", [1, 40, 40, 512, 256, 1, 1, [1, 1], [0, 0]], {}], "config": {"index": 9542, "code_hash": null, "entity": [["tile_rc", "sp", [-1, 2, 4]], ["tile_f", "sp", [-1, 8]], ["tile_y", "sp", [-1, 5, 4]], ["tile_x", "sp", [-1, 2, 8]]]}, "result": [[0.0096945426], 0, 9.36184024810791, 1612442783.5429916], "version": 0.2, "tvm_version": "0.8.dev0"}
{"input": ["opencl -keys=opencl,gpu -max_num_threads=256", "tutorial/conv2d_no_batching", [1, 40, 40, 512, 256, 1, 1, [1, 1], [0, 0]], {}], "config": {"index": 10214, "code_hash": null, "entity": [["tile_rc", "sp", [-1, 2, 4]], ["tile_f", "sp", [-1, 8]], ["tile_y", "sp", [-1, 4, 2]], ["tile_x", "sp", [-1, 4, 8]]]}, "result": [[0.0070155632], 0, 14.106208324432373, 1612442788.2969692], "version": 0.2, "tvm_version": "0.8.dev0"}
{"input": ["opencl -keys=opencl,gpu -max_num_threads=256", "tutorial/conv2d_no_batching", [1, 40, 40, 512, 256, 1, 1, [1, 1], [0, 0]], {}], "config": {"index": 14358, "code_hash": null, "entity": [["tile_rc", "sp", [-1, 2, 4]], ["tile_f", "sp", [-1, 8]], ["tile_y", "sp", [-1, 10, 2]], ["tile_x", "sp", [-1, 1, 16]]]}, "result": [[0.008636829], 0, 18.912259340286255, 1612442793.0893095], "version": 0.2, "tvm_version": "0.8.dev0"}
{"input": ["opencl -keys=opencl,gpu -max_num_threads=256", "tutorial/conv2d_no_batching", [1, 40, 40, 512, 256, 1, 1, [1, 1], [0, 0]], {}], "config": {"index": 14365, "code_hash": null, "entity": [["tile_rc", "sp", [-1, 2, 4]], ["tile_f", "sp", [-1, 16]], ["tile_y", "sp", [-1, 10, 2]], ["tile_x", "sp", [-1, 1, 16]]]}, "result": [[0.0075450008], 0, 23.72098684310913, 1612442797.9078553], "version": 0.2, "tvm_version": "0.8.dev0"}
{"input": ["opencl -keys=opencl,gpu -max_num_threads=256", "tutorial/conv2d_no_batching", [1, 40, 40, 512, 256, 1, 1, [1, 1], [0, 0]], {}], "config": {"index": 10326, "code_hash": null, "entity": [["tile_rc", "sp", [-1, 2, 4]], ["tile_f", "sp", [-1, 8]], ["tile_y", "sp", [-1, 10, 2]], ["tile_x", "sp", [-1, 4, 8]]]}, "result": [[0.0067936205], 0, 28.442340850830078, 1612442802.642169], "version": 0.2, "tvm_version": "0.8.dev0"}
{"input": ["opencl -keys=opencl,gpu -max_num_threads=256", "tutorial/conv2d_no_batching", [1, 40, 40, 512, 256, 1, 1, [1, 1], [0, 0]], {}], "config": {"index": 15359, "code_hash": null, "entity": [["tile_rc", "sp", [-1, 2, 4]], ["tile_f", "sp", [-1, 4]], ["tile_y", "sp", [-1, 10, 2]], ["tile_x", "sp", [-1, 2, 16]]]}, "result": [[0.0085265008], 0, 33.22074604034424, 1612442807.421628], "version": 0.2, "tvm_version": "0.8.dev0"}
{"input": ["opencl -keys=opencl,gpu -max_num_threads=256", "tutorial/conv2d_no_batching", [1, 40, 40, 512, 256, 1, 1, [1, 1], [0, 0]], {}], "config": {"index": 11320, "code_hash": null, "entity": [["tile_rc", "sp", [-1, 2, 4]], ["tile_f", "sp", [-1, 2]], ["tile_y", "sp", [-1, 10, 2]], ["tile_x", "sp", [-1, 5, 8]]]}, "result": [[0.009334870700000001], 0, 38.0305540561676, 1612442812.2473247], "version": 0.2, "tvm_version": "0.8.dev0"}
{"input": ["opencl -keys=opencl,gpu -max_num_threads=256", "tutorial/conv2d_no_batching", [1, 40, 40, 512, 256, 1, 1, [1, 1], [0, 0]], {}], "config": {"index": 11271, "code_hash": null, "entity": [["tile_rc", "sp", [-1, 2, 4]], ["tile_f", "sp", [-1, 4]], ["tile_y", "sp", [-1, 5, 2]], ["tile_x", "sp", [-1, 5, 8]]]}, "result": [[0.007209985100000001], 0, 42.84156775474548, 1612442817.0591395], "version": 0.2, "tvm_version": "0.8.dev0"}
{"input": ["opencl -keys=opencl,gpu -max_num_threads=256", "tutorial/conv2d_no_batching", [1, 40, 40, 512, 256, 1, 1, [1, 1], [0, 0]], {}], "config": {"index": 15366, "code_hash": null, "entity": [["tile_rc", "sp", [-1, 2, 4]], ["tile_f", "sp", [-1, 8]], ["tile_y", "sp", [-1, 10, 2]], ["tile_x", "sp", [-1, 2, 16]]]}, "result": [[0.0071496153], 0, 47.507681369781494, 1612442821.7120845], "version": 0.2, "tvm_version": "0.8.dev0"}
{"input": ["opencl -keys=opencl,gpu -max_num_threads=256", "tutorial/conv2d_no_batching", [1, 40, 40, 512, 256, 1, 1, [1, 1], [0, 0]], {}], "config": {"index": 11327, "code_hash": null, "entity": [["tile_rc", "sp", [-1, 2, 4]], ["tile_f", "sp", [-1, 4]], ["tile_y", "sp", [-1, 10, 2]], ["tile_x", "sp", [-1, 5, 8]]]}, "result": [[0.008312131], 0, 52.24275326728821, 1612442826.4811544], "version": 0.2, "tvm_version": "0.8.dev0"}
{"input": ["opencl -keys=opencl,gpu -max_num_threads=256", "tutorial/conv2d_no_batching", [1, 40, 40, 512, 256, 1, 1, [1, 1], [0, 0]], {}], "config": {"index": 19335, "code_hash": null, "entity": [["tile_rc", "sp", [-1, 2, 4]], ["tile_f", "sp", [-1, 4]], ["tile_y", "sp", [-1, 5, 2]], ["tile_x", "sp", [-1, 2, 20]]]}, "result": [[0.0069757403], 0, 57.13619041442871, 1612442831.3655481], "version": 0.2, "tvm_version": "0.8.dev0"}
{"input": ["opencl -keys=opencl,gpu -max_num_threads=256", "tutorial/conv2d_no_batching", [1, 40, 40, 512, 256, 1, 1, [1, 1], [0, 0]], {}], "config": {"index": 15310, "code_hash": null, "entity": [["tile_rc", "sp", [-1, 2, 4]], ["tile_f", "sp", [-1, 8]], ["tile_y", "sp", [-1, 5, 2]], ["tile_x", "sp", [-1, 2, 16]]]}, "result": [[0.0085343498], 0, 61.83460283279419, 1612442836.0808063], "version": 0.2, "tvm_version": "0.8.dev0"}
{"input": ["opencl -keys=opencl,gpu -max_num_threads=256", "tutorial/conv2d_no_batching", [1, 40, 40, 512, 256, 1, 1, [1, 1], [0, 0]], {}], "config": {"index": 5502, "code_hash": null, "entity": [["tile_rc", "sp", [-1, 1, 4]], ["tile_f", "sp", [-1, 4]], ["tile_y", "sp", [-1, 5, 4]], ["tile_x", "sp", [-1, 10, 4]]]}, "result": [[0.0072690528], 0, 66.4645688533783, 1612442840.7142854], "version": 0.2, "tvm_version": "0.8.dev0"}
{"input": ["opencl -keys=opencl,gpu -max_num_threads=256", "tutorial/conv2d_no_batching", [1, 40, 40, 512, 256, 1, 1, [1, 1], [0, 0]], {}], "config": {"index": 2261, "code_hash": null, "entity": [["tile_rc", "sp", [-1, 1, 4]], ["tile_f", "sp", [-1, 8]], ["tile_y", "sp", [-1, 10, 2]], ["tile_x", "sp", [-1, 4, 4]]]}, "result": [[0.0114377303], 0, 4.6762707233428955, 1612442861.9809308], "version": 0.2, "tvm_version": "0.8.dev0"}
{"input": ["opencl -keys=opencl,gpu -max_num_threads=256", "tutorial/conv2d_no_batching", [1, 40, 40, 512, 256, 1, 1, [1, 1], [0, 0]], {}], "config": {"index": 9317, "code_hash": null, "entity": [["tile_rc", "sp", [-1, 1, 4]], ["tile_f", "sp", [-1, 8]], ["tile_y", "sp", [-1, 10, 2]], ["tile_x", "sp", [-1, 2, 8]]]}, "result": [[0.0078139122], 0, 9.498981952667236, 1612442866.815826], "version": 0.2, "tvm_version": "0.8.dev0"}
{"input": ["opencl -keys=opencl,gpu -max_num_threads=256", "tutorial/conv2d_no_batching", [1, 40, 40, 512, 256, 1, 1, [1, 1], [0, 0]], {}], "config": {"index": 10318, "code_hash": null, "entity": [["tile_rc", "sp", [-1, 1, 4]], ["tile_f", "sp", [-1, 4]], ["tile_y", "sp", [-1, 10, 2]], ["tile_x", "sp", [-1, 4, 8]]]}, "result": [[0.0079912665], 0, 19.27802085876465, 1612442876.5938296], "version": 0.2, "tvm_version": "0.8.dev0"}
{"input": ["opencl -keys=opencl,gpu -max_num_threads=256", "tutorial/conv2d_no_batching", [1, 40, 40, 512, 256, 1, 1, [1, 1], [0, 0]], {}], "config": {"index": 3486, "code_hash": null, "entity": [["tile_rc", "sp", [-1, 1, 4]], ["tile_f", "sp", [-1, 4]], ["tile_y", "sp", [-1, 5, 4]], ["tile_x", "sp", [-1, 5, 4]]]}, "result": [[0.0071671153000000005], 0, 14.346491813659668, 1612442871.6826391], "version": 0.2, "tvm_version": "0.8.dev0"}
{"input": ["opencl -keys=opencl,gpu -max_num_threads=256", "tutorial/conv2d_no_batching", [1, 40, 40, 512, 256, 1, 1, [1, 1], [0, 0]], {}], "config": {"index": 2478, "code_hash": null, "entity": [["tile_rc", "sp", [-1, 1, 4]], ["tile_f", "sp", [-1, 4]], ["tile_y", "sp", [-1, 5, 4]], ["tile_x", "sp", [-1, 4, 4]]]}, "result": [[0.0054662349], 0, 28.898285150527954, 1612442886.2335749], "version": 0.2, "tvm_version": "0.8.dev0"}
{"input": ["opencl -keys=opencl,gpu -max_num_threads=256", "tutorial/conv2d_no_batching", [1, 40, 40, 512, 256, 1, 1, [1, 1], [0, 0]], {}], "config": {"index": 11326, "code_hash": null, "entity": [["tile_rc", "sp", [-1, 1, 4]], ["tile_f", "sp", [-1, 4]], ["tile_y", "sp", [-1, 10, 2]], ["tile_x", "sp", [-1, 5, 8]]]}, "result": [[0.0078414747], 0, 24.118069410324097, 1612442881.464588], "version": 0.2, "tvm_version": "0.8.dev0"}
{"input": ["opencl -keys=opencl,gpu -max_num_threads=256", "tutorial/conv2d_no_batching", [1, 40, 40, 512, 256, 1, 1, [1, 1], [0, 0]], {}], "config": {"index": 4494, "code_hash": null, "entity": [["tile_rc", "sp", [-1, 1, 4]], ["tile_f", "sp", [-1, 4]], ["tile_y", "sp", [-1, 5, 4]], ["tile_x", "sp", [-1, 8, 4]]]}, "result": [[0.0069548445], 0, 33.60577702522278, 1612442890.9821026], "version": 0.2, "tvm_version": "0.8.dev0"}
{"input": ["opencl -keys=opencl,gpu -max_num_threads=256", "tutorial/conv2d_no_batching", [1, 40, 40, 512, 256, 1, 1, [1, 1], [0, 0]], {}], "config": {"index": 1253, "code_hash": null, "entity": [["tile_rc", "sp", [-1, 1, 4]], ["tile_f", "sp", [-1, 8]], ["tile_y", "sp", [-1, 10, 2]], ["tile_x", "sp", [-1, 2, 4]]]}, "result": [[0.006267156899999999], 0, 38.32124876976013, 1612442895.6935933], "version": 0.2, "tvm_version": "0.8.dev0"}
{"input": ["opencl -keys=opencl,gpu -max_num_threads=256", "tutorial/conv2d_no_batching", [1, 40, 40, 512, 256, 1, 1, [1, 1], [0, 0]], {}], "config": {"index": 2269, "code_hash": null, "entity": [["tile_rc", "sp", [-1, 2, 4]], ["tile_f", "sp", [-1, 16]], ["tile_y", "sp", [-1, 10, 2]], ["tile_x", "sp", [-1, 4, 4]]]}, "result": [[0.006232761], 0, 43.108967304229736, 1612442900.4982462], "version": 0.2, "tvm_version": "0.8.dev0"}
{"input": ["opencl -keys=opencl,gpu -max_num_threads=256", "tutorial/conv2d_no_batching", [1, 40, 40, 512, 256, 1, 1, [1, 1], [0, 0]], {}], "config": {"index": 14260, "code_hash": null, "entity": [["tile_rc", "sp", [-1, 2, 4]], ["tile_f", "sp", [-1, 32]], ["tile_y", "sp", [-1, 4, 2]], ["tile_x", "sp", [-1, 1, 16]]]}, "result": [[0.0053448443], 0, 47.86777663230896, 1612442905.2661023], "version": 0.2, "tvm_version": "0.8.dev0"}
{"input": ["opencl -keys=opencl,gpu -max_num_threads=256", "tutorial/conv2d_no_batching", [1, 40, 40, 512, 256, 1, 1, [1, 1], [0, 0]], {}], "config": {"index": 1204, "code_hash": null, "entity": [["tile_rc", "sp", [-1, 1, 4]], ["tile_f", "sp", [-1, 16]], ["tile_y", "sp", [-1, 5, 2]], ["tile_x", "sp", [-1, 2, 4]]]}, "result": [[0.0059233026], 0, 62.07234764099121, 1612442919.4818025], "version": 0.2, "tvm_version": "0.8.dev0"}
{"input": ["opencl -keys=opencl,gpu -max_num_threads=256", "tutorial/conv2d_no_batching", [1, 40, 40, 512, 256, 1, 1, [1, 1], [0, 0]], {}], "config": {"index": 2213, "code_hash": null, "entity": [["tile_rc", "sp", [-1, 2, 4]], ["tile_f", "sp", [-1, 16]], ["tile_y", "sp", [-1, 5, 2]], ["tile_x", "sp", [-1, 4, 4]]]}, "result": [[0.005925886], 0, 52.70741820335388, 1612442910.1391776], "version": 0.2, "tvm_version": "0.8.dev0"}
{"input": ["opencl -keys=opencl,gpu -max_num_threads=256", "tutorial/conv2d_no_batching", [1, 40, 40, 512, 256, 1, 1, [1, 1], [0, 0]], {}], "config": {"index": 2206, "code_hash": null, "entity": [["tile_rc", "sp", [-1, 2, 4]], ["tile_f", "sp", [-1, 8]], ["tile_y", "sp", [-1, 5, 2]], ["tile_x", "sp", [-1, 4, 4]]]}, "result": [[0.006858573599999999], 0, 57.399556398391724, 1612442914.8303254], "version": 0.2, "tvm_version": "0.8.dev0"}
{"input": ["opencl -keys=opencl,gpu -max_num_threads=256", "tutorial/conv2d_no_batching", [1, 40, 40, 512, 256, 1, 1, [1, 1], [0, 0]], {}], "config": {"index": 259, "code_hash": null, "entity": [["tile_rc", "sp", [-1, 1, 4]], ["tile_f", "sp", [-1, 32]], ["tile_y", "sp", [-1, 10, 2]], ["tile_x", "sp", [-1, 1, 4]]]}, "result": [[0.0100048968], 0, 66.72075772285461, 1612442924.1732209], "version": 0.2, "tvm_version": "0.8.dev0"}
{"input": ["opencl -keys=opencl,gpu -max_num_threads=256", "tutorial/conv2d_no_batching", [1, 40, 40, 512, 256, 1, 1, [1, 1], [0, 0]], {}], "config": {"index": 8485, "code_hash": null, "entity": [["tile_rc", "sp", [-1, 2, 4]], ["tile_f", "sp", [-1, 16]], ["tile_y", "sp", [-1, 2, 4]], ["tile_x", "sp", [-1, 1, 8]]]}, "result": [[0.0067878027], 0, 71.58487939834595, 1612442929.0272875], "version": 0.2, "tvm_version": "0.8.dev0"}
{"input": ["opencl -keys=opencl,gpu -max_num_threads=256", "tutorial/conv2d_no_batching", [1, 40, 40, 512, 256, 1, 1, [1, 1], [0, 0]], {}], "config": {"index": 308, "code_hash": null, "entity": [["tile_rc", "sp", [-1, 1, 4]], ["tile_f", "sp", [-1, 16]], ["tile_y", "sp", [-1, 20, 2]], ["tile_x", "sp", [-1, 1, 4]]]}, "result": [[0.010056240599999999], 0, 76.61862254142761, 1612442934.0747652], "version": 0.2, "tvm_version": "0.8.dev0"}
{"input": ["opencl -keys=opencl,gpu -max_num_threads=256", "tutorial/conv2d_no_batching", [1, 40, 40, 512, 256, 1, 1, [1, 1], [0, 0]], {}], "config": {"index": 2422, "code_hash": null, "entity": [["tile_rc", "sp", [-1, 1, 4]], ["tile_f", "sp", [-1, 4]], ["tile_y", "sp", [-1, 2, 4]], ["tile_x", "sp", [-1, 4, 4]]]}, "result": [[0.0055296099], 0, 4.426879405975342, 1612442939.326261], "version": 0.2, "tvm_version": "0.8.dev0"}
{"input": ["opencl -keys=opencl,gpu -max_num_threads=256", "tutorial/conv2d_no_batching", [1, 40, 40, 512, 256, 1, 1, [1, 1], [0, 0]], {}], "config": {"index": 9325, "code_hash": null, "entity": [["tile_rc", "sp", [-1, 2, 4]], ["tile_f", "sp", [-1, 16]], ["tile_y", "sp", [-1, 10, 2]], ["tile_x", "sp", [-1, 2, 8]]]}, "result": [[0.0070666465], 0, 9.222927570343018, 1612442944.1268525], "version": 0.2, "tvm_version": "0.8.dev0"}
{"input": ["opencl -keys=opencl,gpu -max_num_threads=256", "tutorial/conv2d_no_batching", [1, 40, 40, 512, 256, 1, 1, [1, 1], [0, 0]], {}], "config": {"index": 10269, "code_hash": null, "entity": [["tile_rc", "sp", [-1, 1, 4]], ["tile_f", "sp", [-1, 8]], ["tile_y", "sp", [-1, 5, 2]], ["tile_x", "sp", [-1, 4, 8]]]}, "result": [[0.007475870599999999], 0, 19.18025016784668, 1612442954.0851321], "version": 0.2, "tvm_version": "0.8.dev0"}
{"input": ["opencl -keys=opencl,gpu -max_num_threads=256", "tutorial/conv2d_no_batching", [1, 40, 40, 512, 256, 1, 1, [1, 1], [0, 0]], {}], "config": {"index": 2254, "code_hash": null, "entity": [["tile_rc", "sp", [-1, 1, 4]], ["tile_f", "sp", [-1, 4]], ["tile_y", "sp", [-1, 10, 2]], ["tile_x", "sp", [-1, 4, 4]]]}, "result": [[0.0111557147], 0, 14.265992879867554, 1612442949.1783273], "version": 0.2, "tvm_version": "0.8.dev0"}
{"input": ["opencl -keys=opencl,gpu -max_num_threads=256", "tutorial/conv2d_no_batching", [1, 40, 40, 512, 256, 1, 1, [1, 1], [0, 0]], {}], "config": {"index": 2485, "code_hash": null, "entity": [["tile_rc", "sp", [-1, 1, 4]], ["tile_f", "sp", [-1, 8]], ["tile_y", "sp", [-1, 5, 4]], ["tile_x", "sp", [-1, 4, 4]]]}, "result": [[0.0053447401], 0, 28.909947872161865, 1612442963.8249922], "version": 0.2, "tvm_version": "0.8.dev0"}
{"input": ["opencl -keys=opencl,gpu -max_num_threads=256", "tutorial/conv2d_no_batching", [1, 40, 40, 512, 256, 1, 1, [1, 1], [0, 0]], {}], "config": {"index": 10262, "code_hash": null, "entity": [["tile_rc", "sp", [-1, 1, 4]], ["tile_f", "sp", [-1, 4]], ["tile_y", "sp", [-1, 5, 2]], ["tile_x", "sp", [-1, 4, 8]]]}, "result": [[0.0073059747], 0, 24.16771960258484, 1612442959.1039932], "version": 0.2, "tvm_version": "0.8.dev0"}
{"input": ["opencl -keys=opencl,gpu -max_num_threads=256", "tutorial/conv2d_no_batching", [1, 40, 40, 512, 256, 1, 1, [1, 1], [0, 0]], {}], "config": {"index": 3150, "code_hash": null, "entity": [["tile_rc", "sp", [-1, 1, 4]], ["tile_f", "sp", [-1, 4]], ["tile_y", "sp", [-1, 4, 2]], ["tile_x", "sp", [-1, 5, 4]]]}, "result": [[0.00860573], 0, 48.26623725891113, 1612442983.1999667], "version": 0.2, "tvm_version": "0.8.dev0"}
{"input": ["opencl -keys=opencl,gpu -max_num_threads=256", "tutorial/conv2d_no_batching", [1, 40, 40, 512, 256, 1, 1, [1, 1], [0, 0]], {}], "config": {"index": 2192, "code_hash": null, "entity": [["tile_rc", "sp", [-1, 2, 4]], ["tile_f", "sp", [-1, 2]], ["tile_y", "sp", [-1, 5, 2]], ["tile_x", "sp", [-1, 4, 4]]]}, "result": [[0.0078388237], 0, 33.64792847633362, 1612442968.576632], "version": 0.2, "tvm_version": "0.8.dev0"}
{"input": ["opencl -keys=opencl,gpu -max_num_threads=256", "tutorial/conv2d_no_batching", [1, 40, 40, 512, 256, 1, 1, [1, 1], [0, 0]], {}], "config": {"index": 11270, "code_hash": null, "entity": [["tile_rc", "sp", [-1, 1, 4]], ["tile_f", "sp", [-1, 4]], ["tile_y", "sp", [-1, 5, 2]], ["tile_x", "sp", [-1, 5, 8]]]}, "result": [[0.0070665268], 0, 38.58609199523926, 1612442973.5177677], "version": 0.2, "tvm_version": "0.8.dev0"}
{"input": ["opencl -keys=opencl,gpu -max_num_threads=256", "tutorial/conv2d_no_batching", [1, 40, 40, 512, 256, 1, 1, [1, 1], [0, 0]], {}], "config": {"index": 10270, "code_hash": null, "entity": [["tile_rc", "sp", [-1, 2, 4]], ["tile_f", "sp", [-1, 8]], ["tile_y", "sp", [-1, 5, 2]], ["tile_x", "sp", [-1, 4, 8]]]}, "result": [[0.0075147091], 0, 43.482675313949585, 1612442978.4242203], "version": 0.2, "tvm_version": "0.8.dev0"}
{"input": ["opencl -keys=opencl,gpu -max_num_threads=256", "tutorial/conv2d_no_batching", [1, 40, 40, 512, 256, 1, 1, [1, 1], [0, 0]], {}], "config": {"index": 252, "code_hash": null, "entity": [["tile_rc", "sp", [-1, 1, 4]], ["tile_f", "sp", [-1, 16]], ["tile_y", "sp", [-1, 10, 2]], ["tile_x", "sp", [-1, 1, 4]]]}, "result": [[0.0090600373], 0, 53.34487462043762, 1612442988.2967596], "version": 0.2, "tvm_version": "0.8.dev0"}
{"input": ["opencl -keys=opencl,gpu -max_num_threads=256", "tutorial/conv2d_no_batching", [1, 40, 40, 512, 256, 1, 1, [1, 1], [0, 0]], {}], "config": {"index": 10325, "code_hash": null, "entity": [["tile_rc", "sp", [-1, 1, 4]], ["tile_f", "sp", [-1, 8]], ["tile_y", "sp", [-1, 10, 2]], ["tile_x", "sp", [-1, 4, 8]]]}, "result": [[0.0066888600000000005], 0, 77.8701958656311, 1612443012.8275025], "version": 0.2, "tvm_version": "0.8.dev0"}
{"input": ["opencl -keys=opencl,gpu -max_num_threads=256", "tutorial/conv2d_no_batching", [1, 40, 40, 512, 256, 1, 1, [1, 1], [0, 0]], {}], "config": {"index": 3262, "code_hash": null, "entity": [["tile_rc", "sp", [-1, 1, 4]], ["tile_f", "sp", [-1, 4]], ["tile_y", "sp", [-1, 10, 2]], ["tile_x", "sp", [-1, 5, 4]]]}, "result": [[0.011272626099999999], 0, 58.35307264328003, 1612442993.3152208], "version": 0.2, "tvm_version": "0.8.dev0"}
{"input": ["opencl -keys=opencl,gpu -max_num_threads=256", "tutorial/conv2d_no_batching", [1, 40, 40, 512, 256, 1, 1, [1, 1], [0, 0]], {}], "config": {"index": 4158, "code_hash": null, "entity": [["tile_rc", "sp", [-1, 1, 4]], ["tile_f", "sp", [-1, 4]], ["tile_y", "sp", [-1, 4, 2]], ["tile_x", "sp", [-1, 8, 4]]]}, "result": [[0.0107456573], 0, 63.36249804496765, 1612442998.329661], "version": 0.2, "tvm_version": "0.8.dev0"}
{"input": ["opencl -keys=opencl,gpu -max_num_threads=256", "tutorial/conv2d_no_batching", [1, 40, 40, 512, 256, 1, 1, [1, 1], [0, 0]], {}], "config": {"index": 3269, "code_hash": null, "entity": [["tile_rc", "sp", [-1, 1, 4]], ["tile_f", "sp", [-1, 8]], ["tile_y", "sp", [-1, 10, 2]], ["tile_x", "sp", [-1, 5, 4]]]}, "result": [[0.0103841365], 0, 68.26047873497009, 1612443003.2353263], "version": 0.2, "tvm_version": "0.8.dev0"}
{"input": ["opencl -keys=opencl,gpu -max_num_threads=256", "tutorial/conv2d_no_batching", [1, 40, 40, 512, 256, 1, 1, [1, 1], [0, 0]], {}], "config": {"index": 8316, "code_hash": null, "entity": [["tile_rc", "sp", [-1, 1, 4]], ["tile_f", "sp", [-1, 16]], ["tile_y", "sp", [-1, 10, 2]], ["tile_x", "sp", [-1, 1, 8]]]}, "result": [[0.0082658914], 0, 73.05283308029175, 1612443008.0346978], "version": 0.2, "tvm_version": "0.8.dev0"}
{"input": ["opencl -keys=opencl,gpu -max_num_threads=256", "tutorial/conv2d_no_batching", [1, 40, 40, 512, 256, 1, 1, [1, 1], [0, 0]], {}], "config": {"index": 18278, "code_hash": null, "entity": [["tile_rc", "sp", [-1, 2, 4]], ["tile_f", "sp", [-1, 8]], ["tile_y", "sp", [-1, 4, 2]], ["tile_x", "sp", [-1, 1, 20]]]}, "result": [[0.0071129434], 0, 4.460410833358765, 1612443018.1099179], "version": 0.2, "tvm_version": "0.8.dev0"}
{"input": ["opencl -keys=opencl,gpu -max_num_threads=256", "tutorial/conv2d_no_batching", [1, 40, 40, 512, 256, 1, 1, [1, 1], [0, 0]], {}], "config": {"index": 3270, "code_hash": null, "entity": [["tile_rc", "sp", [-1, 2, 4]], ["tile_f", "sp", [-1, 8]], ["tile_y", "sp", [-1, 10, 2]], ["tile_x", "sp", [-1, 5, 4]]]}, "result": [[0.0098342249], 0, 9.408004999160767, 1612443023.0744088], "version": 0.2, "tvm_version": "0.8.dev0"}
{"input": ["opencl -keys=opencl,gpu -max_num_threads=256", "tutorial/conv2d_no_batching", [1, 40, 40, 512, 256, 1, 1, [1, 1], [0, 0]], {}], "config": {"index": 1533, "code_hash": null, "entity": [["tile_rc", "sp", [-1, 1, 4]], ["tile_f", "sp", [-1, 8]], ["tile_y", "sp", [-1, 10, 4]], ["tile_x", "sp", [-1, 2, 4]]]}, "result": [[0.007444157], 0, 18.941913604736328, 1612443032.6124403], "version": 0.2, "tvm_version": "0.8.dev0"}
{"input": ["opencl -keys=opencl,gpu -max_num_threads=256", "tutorial/conv2d_no_batching", [1, 40, 40, 512, 256, 1, 1, [1, 1], [0, 0]], {}], "config": {"index": 2262, "code_hash": null, "entity": [["tile_rc", "sp", [-1, 2, 4]], ["tile_f", "sp", [-1, 8]], ["tile_y", "sp", [-1, 10, 2]], ["tile_x", "sp", [-1, 4, 4]]]}, "result": [[0.006665995399999999], 0, 23.800078630447388, 1612443037.4678326], "version": 0.2, "tvm_version": "0.8.dev0"}
{"input": ["opencl -keys=opencl,gpu -max_num_threads=256", "tutorial/conv2d_no_batching", [1, 40, 40, 512, 256, 1, 1, [1, 1], [0, 0]], {}], "config": {"index": 2212, "code_hash": null, "entity": [["tile_rc", "sp", [-1, 1, 4]], ["tile_f", "sp", [-1, 16]], ["tile_y", "sp", [-1, 5, 2]], ["tile_x", "sp", [-1, 4, 4]]]}, "result": [[0.006729688100000001], 0, 33.57921600341797, 1612443047.2717094], "version": 0.2, "tvm_version": "0.8.dev0"}
{"input": ["opencl -keys=opencl,gpu -max_num_threads=256", "tutorial/conv2d_no_batching", [1, 40, 40, 512, 256, 1, 1, [1, 1], [0, 0]], {}], "config": {"index": 15358, "code_hash": null, "entity": [["tile_rc", "sp", [-1, 1, 4]], ["tile_f", "sp", [-1, 4]], ["tile_y", "sp", [-1, 10, 2]], ["tile_x", "sp", [-1, 2, 16]]]}, "result": [[0.0065225059], 0, 14.211875677108765, 1612443027.8872285], "version": 0.2, "tvm_version": "0.8.dev0"}
{"input": ["opencl -keys=opencl,gpu -max_num_threads=256", "tutorial/conv2d_no_batching", [1, 40, 40, 512, 256, 1, 1, [1, 1], [0, 0]], {}], "config": {"index": 8324, "code_hash": null, "entity": [["tile_rc", "sp", [-1, 2, 4]], ["tile_f", "sp", [-1, 32]], ["tile_y", "sp", [-1, 10, 2]], ["tile_x", "sp", [-1, 1, 8]]]}, "result": [[0.0072841569999999994], 0, 28.615708589553833, 1612443042.3002005], "version": 0.2, "tvm_version": "0.8.dev0"}
{"input": ["opencl -keys=opencl,gpu -max_num_threads=256", "tutorial/conv2d_no_batching", [1, 40, 40, 512, 256, 1, 1, [1, 1], [0, 0]], {}], "config": {"index": 3158, "code_hash": null, "entity": [["tile_rc", "sp", [-1, 2, 4]], ["tile_f", "sp", [-1, 8]], ["tile_y", "sp", [-1, 4, 2]], ["tile_x", "sp", [-1, 5, 4]]]}, "result": [[0.0078184435], 0, 38.55170822143555, 1612443052.238605], "version": 0.2, "tvm_version": "0.8.dev0"}
{"input": ["opencl -keys=opencl,gpu -max_num_threads=256", "tutorial/conv2d_no_batching", [1, 40, 40, 512, 256, 1, 1, [1, 1], [0, 0]], {}], "config": {"index": 14301, "code_hash": null, "entity": [["tile_rc", "sp", [-1, 1, 4]], ["tile_f", "sp", [-1, 8]], ["tile_y", "sp", [-1, 5, 2]], ["tile_x", "sp", [-1, 1, 16]]]}, "result": [[0.0055863443], 0, 43.57320189476013, 1612443057.2649922], "version": 0.2, "tvm_version": "0.8.dev0"}
{"input": ["opencl -keys=opencl,gpu -max_num_threads=256", "tutorial/conv2d_no_batching", [1, 40, 40, 512, 256, 1, 1, [1, 1], [0, 0]], {}], "config": {"index": 2150, "code_hash": null, "entity": [["tile_rc", "sp", [-1, 2, 4]], ["tile_f", "sp", [-1, 8]], ["tile_y", "sp", [-1, 4, 2]], ["tile_x", "sp", [-1, 4, 4]]]}, "result": [[0.0063984017], 0, 48.608349561691284, 1612443062.312879], "version": 0.2, "tvm_version": "0.8.dev0"}
{"input": ["opencl -keys=opencl,gpu -max_num_threads=256", "tutorial/conv2d_no_batching", [1, 40, 40, 512, 256, 1, 1, [1, 1], [0, 0]], {}], "config": {"index": 3430, "code_hash": null, "entity": [["tile_rc", "sp", [-1, 1, 4]], ["tile_f", "sp", [-1, 4]], ["tile_y", "sp", [-1, 2, 4]], ["tile_x", "sp", [-1, 5, 4]]]}, "result": [[0.0060034694], 0, 53.587703227996826, 1612443067.2974439], "version": 0.2, "tvm_version": "0.8.dev0"}
{"input": ["opencl -keys=opencl,gpu -max_num_threads=256", "tutorial/conv2d_no_batching", [1, 40, 40, 512, 256, 1, 1, [1, 1], [0, 0]], {}], "config": {"index": 3494, "code_hash": null, "entity": [["tile_rc", "sp", [-1, 2, 4]], ["tile_f", "sp", [-1, 8]], ["tile_y", "sp", [-1, 5, 4]], ["tile_x", "sp", [-1, 5, 4]]]}, "result": [[0.006310037100000001], 0, 58.66552257537842, 1612443072.3735206], "version": 0.2, "tvm_version": "0.8.dev0"}
{"input": ["opencl -keys=opencl,gpu -max_num_threads=256", "tutorial/conv2d_no_batching", [1, 40, 40, 512, 256, 1, 1, [1, 1], [0, 0]], {}], "config": {"index": 1261, "code_hash": null, "entity": [["tile_rc", "sp", [-1, 2, 4]], ["tile_f", "sp", [-1, 16]], ["tile_y", "sp", [-1, 10, 2]], ["tile_x", "sp", [-1, 2, 4]]]}, "result": [[0.0065679798], 0, 63.636526584625244, 1612443077.356136], "version": 0.2, "tvm_version": "0.8.dev0"}
{"input": ["opencl -keys=opencl,gpu -max_num_threads=256", "tutorial/conv2d_no_batching", [1, 40, 40, 512, 256, 1, 1, [1, 1], [0, 0]], {}], "config": {"index": 2142, "code_hash": null, "entity": [["tile_rc", "sp", [-1, 1, 4]], ["tile_f", "sp", [-1, 4]], ["tile_y", "sp", [-1, 4, 2]], ["tile_x", "sp", [-1, 4, 4]]]}, "result": [[0.0080658654], 0, 68.60972571372986, 1612443082.3385153], "version": 0.2, "tvm_version": "0.8.dev0"}
{"input": ["opencl -keys=opencl,gpu -max_num_threads=256", "tutorial/conv2d_no_batching", [1, 40, 40, 512, 256, 1, 1, [1, 1], [0, 0]], {}], "config": {"index": 1148, "code_hash": null, "entity": [["tile_rc", "sp", [-1, 1, 4]], ["tile_f", "sp", [-1, 16]], ["tile_y", "sp", [-1, 4, 2]], ["tile_x", "sp", [-1, 2, 4]]]}, "result": [[0.0067172454], 0, 78.49050259590149, 1612443092.2307994], "version": 0.2, "tvm_version": "0.8.dev0"}
{"input": ["opencl -keys=opencl,gpu -max_num_threads=256", "tutorial/conv2d_no_batching", [1, 40, 40, 512, 256, 1, 1, [1, 1], [0, 0]], {}], "config": {"index": 14302, "code_hash": null, "entity": [["tile_rc", "sp", [-1, 2, 4]], ["tile_f", "sp", [-1, 8]], ["tile_y", "sp", [-1, 5, 2]], ["tile_x", "sp", [-1, 1, 16]]]}, "result": [[0.006825495400000001], 0, 73.53427958488464, 1612443087.2724805], "version": 0.2, "tvm_version": "0.8.dev0"}
{"input": ["opencl -keys=opencl,gpu -max_num_threads=256", "tutorial/conv2d_no_batching", [1, 40, 40, 512, 256, 1, 1, [1, 1], [0, 0]], {}], "config": {"index": 11334, "code_hash": null, "entity": [["tile_rc", "sp", [-1, 2, 4]], ["tile_f", "sp", [-1, 8]], ["tile_y", "sp", [-1, 10, 2]], ["tile_x", "sp", [-1, 5, 8]]]}, "result": [[0.0080690477], 0, 4.504979133605957, 1612443097.8966603], "version": 0.2, "tvm_version": "0.8.dev0"}
{"input": ["opencl -keys=opencl,gpu -max_num_threads=256", "tutorial/conv2d_no_batching", [1, 40, 40, 512, 256, 1, 1, [1, 1], [0, 0]], {}], "config": {"index": 2374, "code_hash": null, "entity": [["tile_rc", "sp", [-1, 2, 4]], ["tile_f", "sp", [-1, 8]], ["tile_y", "sp", [-1, 1, 4]], ["tile_x", "sp", [-1, 4, 4]]]}, "result": [[0.0054766047], 0, 9.349430561065674, 1612443102.7547648], "version": 0.2, "tvm_version": "0.8.dev0"}
{"input": ["opencl -keys=opencl,gpu -max_num_threads=256", "tutorial/conv2d_no_batching", [1, 40, 40, 512, 256, 1, 1, [1, 1], [0, 0]], {}], "config": {"index": 10213, "code_hash": null, "entity": [["tile_rc", "sp", [-1, 1, 4]], ["tile_f", "sp", [-1, 8]], ["tile_y", "sp", [-1, 4, 2]], ["tile_x", "sp", [-1, 4, 8]]]}, "result": [[0.0069357455], 0, 14.005027055740356, 1612443107.4133043], "version": 0.2, "tvm_version": "0.8.dev0"}
{"input": ["opencl -keys=opencl,gpu -max_num_threads=256", "tutorial/conv2d_no_batching", [1, 40, 40, 512, 256, 1, 1, [1, 1], [0, 0]], {}], "config": {"index": 1477, "code_hash": null, "entity": [["tile_rc", "sp", [-1, 1, 4]], ["tile_f", "sp", [-1, 8]], ["tile_y", "sp", [-1, 5, 4]], ["tile_x", "sp", [-1, 2, 4]]]}, "result": [[0.0058459172], 0, 23.5058696269989, 1612443116.9266317], "version": 0.2, "tvm_version": "0.8.dev0"}
{"input": ["opencl -keys=opencl,gpu -max_num_threads=256", "tutorial/conv2d_no_batching", [1, 40, 40, 512, 256, 1, 1, [1, 1], [0, 0]], {}], "config": {"index": 3479, "code_hash": null, "entity": [["tile_rc", "sp", [-1, 1, 4]], ["tile_f", "sp", [-1, 2]], ["tile_y", "sp", [-1, 5, 4]], ["tile_x", "sp", [-1, 5, 4]]]}, "result": [[0.0075602768], 0, 56.944013357162476, 1612443150.344846], "version": 0.2, "tvm_version": "0.8.dev0"}
{"input": ["opencl -keys=opencl,gpu -max_num_threads=256", "tutorial/conv2d_no_batching", [1, 40, 40, 512, 256, 1, 1, [1, 1], [0, 0]], {}], "config": {"index": 589, "code_hash": null, "entity": [["tile_rc", "sp", [-1, 2, 4]], ["tile_f", "sp", [-1, 16]], ["tile_y", "sp", [-1, 1, 8]], ["tile_x", "sp", [-1, 1, 4]]]}, "result": [[0.0122648242], 0, 18.848604202270508, 1612443112.2577267], "version": 0.2, "tvm_version": "0.8.dev0"}
{"input": ["opencl -keys=opencl,gpu -max_num_threads=256", "tutorial/conv2d_no_batching", [1, 40, 40, 512, 256, 1, 1, [1, 1], [0, 0]], {}], "config": {"index": 14357, "code_hash": null, "entity": [["tile_rc", "sp", [-1, 1, 4]], ["tile_f", "sp", [-1, 8]], ["tile_y", "sp", [-1, 10, 2]], ["tile_x", "sp", [-1, 1, 16]]]}, "result": [[0.006685016300000001], 0, 28.25356698036194, 1612443121.6717772], "version": 0.2, "tvm_version": "0.8.dev0"}
{"input": ["opencl -keys=opencl,gpu -max_num_threads=256", "tutorial/conv2d_no_batching", [1, 40, 40, 512, 256, 1, 1, [1, 1], [0, 0]], {}], "config": {"index": 4270, "code_hash": null, "entity": [["tile_rc", "sp", [-1, 1, 4]], ["tile_f", "sp", [-1, 4]], ["tile_y", "sp", [-1, 10, 2]], ["tile_x", "sp", [-1, 8, 4]]]}, "result": [[0.0131465638], 0, 33.060123443603516, 1612443126.485785], "version": 0.2, "tvm_version": "0.8.dev0"}
{"input": ["opencl -keys=opencl,gpu -max_num_threads=256", "tutorial/conv2d_no_batching", [1, 40, 40, 512, 256, 1, 1, [1, 1], [0, 0]], {}], "config": {"index": 1421, "code_hash": null, "entity": [["tile_rc", "sp", [-1, 1, 4]], ["tile_f", "sp", [-1, 8]], ["tile_y", "sp", [-1, 2, 4]], ["tile_x", "sp", [-1, 2, 4]]]}, "result": [[0.0051986828], 0, 37.64488101005554, 1612443131.073347], "version": 0.2, "tvm_version": "0.8.dev0"}
{"input": ["opencl -keys=opencl,gpu -max_num_threads=256", "tutorial/conv2d_no_batching", [1, 40, 40, 512, 256, 1, 1, [1, 1], [0, 0]], {}], "config": {"index": 15317, "code_hash": null, "entity": [["tile_rc", "sp", [-1, 2, 4]], ["tile_f", "sp", [-1, 16]], ["tile_y", "sp", [-1, 5, 2]], ["tile_x", "sp", [-1, 2, 16]]]}, "result": [[0.0072911517999999995], 0, 42.4200758934021, 1612443135.8486197], "version": 0.2, "tvm_version": "0.8.dev0"}
{"input": ["opencl -keys=opencl,gpu -max_num_threads=256", "tutorial/conv2d_no_batching", [1, 40, 40, 512, 256, 1, 1, [1, 1], [0, 0]], {}], "config": {"index": 14245, "code_hash": null, "entity": [["tile_rc", "sp", [-1, 1, 4]], ["tile_f", "sp", [-1, 8]], ["tile_y", "sp", [-1, 4, 2]], ["tile_x", "sp", [-1, 1, 16]]]}, "result": [[0.0051673859], 0, 47.29745030403137, 1612443140.7395198], "version": 0.2, "tvm_version": "0.8.dev0"}
{"input": ["opencl -keys=opencl,gpu -max_num_threads=256", "tutorial/conv2d_no_batching", [1, 40, 40, 512, 256, 1, 1, [1, 1], [0, 0]], {}], "config": {"index": 2157, "code_hash": null, "entity": [["tile_rc", "sp", [-1, 2, 4]], ["tile_f", "sp", [-1, 16]], ["tile_y", "sp", [-1, 4, 2]], ["tile_x", "sp", [-1, 4, 4]]]}, "result": [[0.0060088078], 0, 52.08116865158081, 1612443145.5267403], "version": 0.2, "tvm_version": "0.8.dev0"}
{"input": ["opencl -keys=opencl,gpu -max_num_threads=256", "tutorial/conv2d_no_batching", [1, 40, 40, 512, 256, 1, 1, [1, 1], [0, 0]], {}], "config": {"index": 1268, "code_hash": null, "entity": [["tile_rc", "sp", [-1, 2, 4]], ["tile_f", "sp", [-1, 32]], ["tile_y", "sp", [-1, 10, 2]], ["tile_x", "sp", [-1, 2, 4]]]}, "result": [[0.0071804643], 0, 72.39693450927734, 1612443165.8507738], "version": 0.2, "tvm_version": "0.8.dev0"}
{"input": ["opencl -keys=opencl,gpu -max_num_threads=256", "tutorial/conv2d_no_batching", [1, 40, 40, 512, 256, 1, 1, [1, 1], [0, 0]], {}], "config": {"index": 2600, "code_hash": null, "entity": [["tile_rc", "sp", [-1, 8, 4]], ["tile_f", "sp", [-1, 8]], ["tile_y", "sp", [-1, 1, 8]], ["tile_x", "sp", [-1, 4, 4]]]}, "result": [[0.0326447324], 0, 62.63162279129028, 1612443156.0372665], "version": 0.2, "tvm_version": "0.8.dev0"}
{"input": ["opencl -keys=opencl,gpu -max_num_threads=256", "tutorial/conv2d_no_batching", [1, 40, 40, 512, 256, 1, 1, [1, 1], [0, 0]], {}], "config": {"index": 18277, "code_hash": null, "entity": [["tile_rc", "sp", [-1, 1, 4]], ["tile_f", "sp", [-1, 8]], ["tile_y", "sp", [-1, 4, 2]], ["tile_x", "sp", [-1, 1, 20]]]}, "result": [[0.0056157506], 0, 4.535170316696167, 1612443180.667905], "version": 0.2, "tvm_version": "0.8.dev0"}
{"input": ["opencl -keys=opencl,gpu -max_num_threads=256", "tutorial/conv2d_no_batching", [1, 40, 40, 512, 256, 1, 1, [1, 1], [0, 0]], {}], "config": {"index": 18333, "code_hash": null, "entity": [["tile_rc", "sp", [-1, 1, 4]], ["tile_f", "sp", [-1, 8]], ["tile_y", "sp", [-1, 5, 2]], ["tile_x", "sp", [-1, 1, 20]]]}, "result": [[0.0056127662], 0, 9.20264744758606, 1612443185.3509512], "version": 0.2, "tvm_version": "0.8.dev0"}
{"input": ["opencl -keys=opencl,gpu -max_num_threads=256", "tutorial/conv2d_no_batching", [1, 40, 40, 512, 256, 1, 1, [1, 1], [0, 0]], {}], "config": {"index": 8477, "code_hash": null, "entity": [["tile_rc", "sp", [-1, 1, 4]], ["tile_f", "sp", [-1, 8]], ["tile_y", "sp", [-1, 2, 4]], ["tile_x", "sp", [-1, 1, 8]]]}, "result": [[0.0081749019], 0, 13.960384368896484, 1612443190.1132898], "version": 0.2, "tvm_version": "0.8.dev0"}
{"input": ["opencl -keys=opencl,gpu -max_num_threads=256", "tutorial/conv2d_no_batching", [1, 40, 40, 512, 256, 1, 1, [1, 1], [0, 0]], {}], "config": {"index": 1422, "code_hash": null, "entity": [["tile_rc", "sp", [-1, 2, 4]], ["tile_f", "sp", [-1, 8]], ["tile_y", "sp", [-1, 2, 4]], ["tile_x", "sp", [-1, 2, 4]]]}, "result": [[0.0055180735], 0, 18.75521183013916, 1612443194.8938956], "version": 0.2, "tvm_version": "0.8.dev0"}
{"input": ["opencl -keys=opencl,gpu -max_num_threads=256", "tutorial/conv2d_no_batching", [1, 40, 40, 512, 256, 1, 1, [1, 1], [0, 0]], {}], "config": {"index": 2493, "code_hash": null, "entity": [["tile_rc", "sp", [-1, 2, 4]], ["tile_f", "sp", [-1, 16]], ["tile_y", "sp", [-1, 5, 4]], ["tile_x", "sp", [-1, 4, 4]]]}, "result": [[0.0045823858], 0, 23.431785345077515, 1612443199.6080184], "version": 0.2, "tvm_version": "0.8.dev0"}
{"input": ["opencl -keys=opencl,gpu -max_num_threads=256", "tutorial/conv2d_no_batching", [1, 40, 40, 512, 256, 1, 1, [1, 1], [0, 0]], {}], "config": {"index": 8533, "code_hash": null, "entity": [["tile_rc", "sp", [-1, 1, 4]], ["tile_f", "sp", [-1, 8]], ["tile_y", "sp", [-1, 5, 4]], ["tile_x", "sp", [-1, 1, 8]]]}, "result": [[0.0051262818], 0, 42.343485832214355, 1612443218.5073762], "version": 0.2, "tvm_version": "0.8.dev0"}
{"input": ["opencl -keys=opencl,gpu -max_num_threads=256", "tutorial/conv2d_no_batching", [1, 40, 40, 512, 256, 1, 1, [1, 1], [0, 0]], {}], "config": {"index": 2373, "code_hash": null, "entity": [["tile_rc", "sp", [-1, 1, 4]], ["tile_f", "sp", [-1, 8]], ["tile_y", "sp", [-1, 1, 4]], ["tile_x", "sp", [-1, 4, 4]]]}, "result": [[0.0051405839000000005], 0, 28.105562925338745, 1612443204.3015156], "version": 0.2, "tvm_version": "0.8.dev0"}
{"input": ["opencl -keys=opencl,gpu -max_num_threads=256", "tutorial/conv2d_no_batching", [1, 40, 40, 512, 256, 1, 1, [1, 1], [0, 0]], {}], "config": {"index": 14581, "code_hash": null, "entity": [["tile_rc", "sp", [-1, 1, 4]], ["tile_f", "sp", [-1, 8]], ["tile_y", "sp", [-1, 5, 4]], ["tile_x", "sp", [-1, 1, 16]]]}, "result": [[0.006738875599999999], 0, 32.926339626312256, 1612443209.113103], "version": 0.2, "tvm_version": "0.8.dev0"}
{"input": ["opencl -keys=opencl,gpu -max_num_threads=256", "tutorial/conv2d_no_batching", [1, 40, 40, 512, 256, 1, 1, [1, 1], [0, 0]], {}], "config": {"index": 1205, "code_hash": null, "entity": [["tile_rc", "sp", [-1, 2, 4]], ["tile_f", "sp", [-1, 16]], ["tile_y", "sp", [-1, 5, 2]], ["tile_x", "sp", [-1, 2, 4]]]}, "result": [[0.0069554069], 0, 37.56618523597717, 1612443213.7615514], "version": 0.2, "tvm_version": "0.8.dev0"}
{"input": ["opencl -keys=opencl,gpu -max_num_threads=256", "tutorial/conv2d_no_batching", [1, 40, 40, 512, 256, 1, 1, [1, 1], [0, 0]], {}], "config": {"index": 1485, "code_hash": null, "entity": [["tile_rc", "sp", [-1, 2, 4]], ["tile_f", "sp", [-1, 16]], ["tile_y", "sp", [-1, 5, 4]], ["tile_x", "sp", [-1, 2, 4]]]}, "result": [[0.0053665786], 0, 47.04776310920715, 1612443223.2523513], "version": 0.2, "tvm_version": "0.8.dev0"}
{"input": ["opencl -keys=opencl,gpu -max_num_threads=256", "tutorial/conv2d_no_batching", [1, 40, 40, 512, 256, 1, 1, [1, 1], [0, 0]], {}], "config": {"index": 14532, "code_hash": null, "entity": [["tile_rc", "sp", [-1, 1, 4]], ["tile_f", "sp", [-1, 16]], ["tile_y", "sp", [-1, 2, 4]], ["tile_x", "sp", [-1, 1, 16]]]}, "result": [[0.0069824747000000005], 0, 51.96732425689697, 1612443228.1961784], "version": 0.2, "tvm_version": "0.8.dev0"}
{"input": ["opencl -keys=opencl,gpu -max_num_threads=256", "tutorial/conv2d_no_batching", [1, 40, 40, 512, 256, 1, 1, [1, 1], [0, 0]], {}], "config": {"index": 1037, "code_hash": null, "entity": [["tile_rc", "sp", [-1, 2, 4]], ["tile_f", "sp", [-1, 16]], ["tile_y", "sp", [-1, 1, 2]], ["tile_x", "sp", [-1, 2, 4]]]}, "result": [[0.006888828800000001], 0, 56.71887922286987, 1612443232.9686627], "version": 0.2, "tvm_version": "0.8.dev0"}
{"input": ["opencl -keys=opencl,gpu -max_num_threads=256", "tutorial/conv2d_no_batching", [1, 40, 40, 512, 256, 1, 1, [1, 1], [0, 0]], {}], "config": {"index": 9478, "code_hash": null, "entity": [["tile_rc", "sp", [-1, 1, 4]], ["tile_f", "sp", [-1, 4]], ["tile_y", "sp", [-1, 2, 4]], ["tile_x", "sp", [-1, 2, 8]]]}, "result": [[0.008281323699999999], 0, 66.34748983383179, 1612443242.592115], "version": 0.2, "tvm_version": "0.8.dev0"}
{"input": ["opencl -keys=opencl,gpu -max_num_threads=256", "tutorial/conv2d_no_batching", [1, 40, 40, 512, 256, 1, 1, [1, 1], [0, 0]], {}], "config": {"index": 2597, "code_hash": null, "entity": [["tile_rc", "sp", [-1, 1, 4]], ["tile_f", "sp", [-1, 8]], ["tile_y", "sp", [-1, 1, 8]], ["tile_x", "sp", [-1, 4, 4]]]}, "result": [[0.0051192244], 0, 71.2410717010498, 1612443247.5078914], "version": 0.2, "tvm_version": "0.8.dev0"}
{"input": ["opencl -keys=opencl,gpu -max_num_threads=256", "tutorial/conv2d_no_batching", [1, 40, 40, 512, 256, 1, 1, [1, 1], [0, 0]], {}], "config": {"index": 18292, "code_hash": null, "entity": [["tile_rc", "sp", [-1, 2, 4]], ["tile_f", "sp", [-1, 32]], ["tile_y", "sp", [-1, 4, 2]], ["tile_x", "sp", [-1, 1, 20]]]}, "result": [[0.0051064327999999996], 0, 61.43246507644653, 1612443237.7046652], "version": 0.2, "tvm_version": "0.8.dev0"}
{"input": ["opencl -keys=opencl,gpu -max_num_threads=256", "tutorial/conv2d_no_batching", [1, 40, 40, 512, 256, 1, 1, [1, 1], [0, 0]], {}], "config": {"index": 22309, "code_hash": null, "entity": [["tile_rc", "sp", [-1, 1, 4]], ["tile_f", "sp", [-1, 8]], ["tile_y", "sp", [-1, 4, 2]], ["tile_x", "sp", [-1, 1, 32]]]}, "result": [[0.0075093862], 0, 76.31477379798889, 1612443252.5981479], "version": 0.2, "tvm_version": "0.8.dev0"}
