test_and_tune/android.topi_winograd3x3.log.tmp
{"input": ["opencl -keys=mali,opencl,gpu -device=mali -max_num_threads=256", "tutorial/conv2d_no_batching", [1, 47, 47, 512, 512, 3, 3, [1, 1], [1, 1]], {}], "config": {"index": 25057337976, "code_hash": null, "entity": [["inv_cp", "sp", [-1, 1]], ["inv_wp", "sp", [-1, 2, 4]], ["inv_hp", "sp", [-1, 1, 4]], ["kernel_cp", "sp", [-1, 2]], ["kernel_kp", "sp", [-1, 8]], ["data_cp", "sp", [-1, 16]], ["data_wp", "sp", [-1, 4, 4]], ["data_hp", "sp", [-1, 16, 8]], ["bgemm_kp", "sp", [-1, 16]], ["bgemm_wp", "sp", [-1, 1, 4]], ["bgemm_hp", "sp", [-1, 2]]]}, "result": [[0.1467905354], 0, 32.6329505443573, 1615717238.25368], "version": 0.2, "tvm_version": "0.8.dev0"}
{"input": ["opencl -keys=mali,opencl,gpu -device=mali -max_num_threads=256", "tutorial/conv2d_no_batching", [1, 47, 47, 512, 512, 3, 3, [1, 1], [1, 1]], {}], "config": {"index": 50043720615, "code_hash": null, "entity": [["inv_cp", "sp", [-1, 8]], ["inv_wp", "sp", [-1, 6, 4]], ["inv_hp", "sp", [-1, 1, 4]], ["kernel_cp", "sp", [-1, 4]], ["kernel_kp", "sp", [-1, 4]], ["data_cp", "sp", [-1, 8]], ["data_wp", "sp", [-1, 16, 8]], ["data_hp", "sp", [-1, 2, 16]], ["bgemm_kp", "sp", [-1, 4]], ["bgemm_wp", "sp", [-1, 2, 4]], ["bgemm_hp", "sp", [-1, 4]]]}, "result": [[0.1495403951], 0, 9.346678972244263, 1615717215.1457195], "version": 0.2, "tvm_version": "0.8.dev0"}
{"input": ["opencl -keys=mali,opencl,gpu -device=mali -max_num_threads=256", "tutorial/conv2d_no_batching", [1, 47, 47, 512, 512, 3, 3, [1, 1], [1, 1]], {}], "config": {"index": 159278458095, "code_hash": null, "entity": [["inv_cp", "sp", [-1, 8]], ["inv_wp", "sp", [-1, 4, 1]], ["inv_hp", "sp", [-1, 4, 4]], ["kernel_cp", "sp", [-1, 32]], ["kernel_kp", "sp", [-1, 8]], ["data_cp", "sp", [-1, 32]], ["data_wp", "sp", [-1, 2, 32]], ["data_hp", "sp", [-1, 4, 8]], ["bgemm_kp", "sp", [-1, 2]], ["bgemm_wp", "sp", [-1, 2, 16]], ["bgemm_hp", "sp", [-1, 64]]]}, "result": [[0.0691009757], 0, 53.63240170478821, 1615717259.1077983], "version": 0.2, "tvm_version": "0.8.dev0"}
{"input": ["opencl -keys=mali,opencl,gpu -device=mali -max_num_threads=256", "tutorial/conv2d_no_batching", [1, 47, 47, 512, 512, 3, 3, [1, 1], [1, 1]], {}], "config": {"index": 68442846534, "code_hash": null, "entity": [["inv_cp", "sp", [-1, 4]], ["inv_wp", "sp", [-1, 2, 1]], ["inv_hp", "sp", [-1, 4, 4]], ["kernel_cp", "sp", [-1, 1]], ["kernel_kp", "sp", [-1, 16]], ["data_cp", "sp", [-1, 1]], ["data_wp", "sp", [-1, 1, 16]], ["data_hp", "sp", [-1, 4, 8]], ["bgemm_kp", "sp", [-1, 4]], ["bgemm_wp", "sp", [-1, 4, 32]], ["bgemm_hp", "sp", [-1, 4]]]}, "result": [[0.0152453401], 0, 72.82864618301392, 1615717278.5268378], "version": 0.2, "tvm_version": "0.8.dev0"}
{"input": ["opencl -keys=mali,opencl,gpu -device=mali -max_num_threads=256", "tutorial/conv2d_no_batching", [1, 47, 47, 512, 512, 3, 3, [1, 1], [1, 1]], {}], "config": {"index": 123365295678, "code_hash": null, "entity": [["inv_cp", "sp", [-1, 4]], ["inv_wp", "sp", [-1, 12, 1]], ["inv_hp", "sp", [-1, 1, 4]], ["kernel_cp", "sp", [-1, 8]], ["kernel_kp", "sp", [-1, 4]], ["data_cp", "sp", [-1, 4]], ["data_wp", "sp", [-1, 1, 16]], ["data_hp", "sp", [-1, 4, 8]], ["bgemm_kp", "sp", [-1, 1]], ["bgemm_wp", "sp", [-1, 4, 4]], ["bgemm_hp", "sp", [-1, 32]]]}, "result": [[0.1650000061], 0, 41.97574853897095, 1615717326.068904], "version": 0.2, "tvm_version": "0.8.dev0"}
{"input": ["opencl -keys=mali,opencl,gpu -device=mali -max_num_threads=256", "tutorial/conv2d_no_batching", [1, 47, 47, 512, 512, 3, 3, [1, 1], [1, 1]], {}], "config": {"index": 71089748163, "code_hash": null, "entity": [["inv_cp", "sp", [-1, 8]], ["inv_wp", "sp", [-1, 4, 18]], ["inv_hp", "sp", [-1, 4, 4]], ["kernel_cp", "sp", [-1, 8]], ["kernel_kp", "sp", [-1, 4]], ["data_cp", "sp", [-1, 8]], ["data_wp", "sp", [-1, 1, 128]], ["data_hp", "sp", [-1, 8, 4]], ["bgemm_kp", "sp", [-1, 16]], ["bgemm_wp", "sp", [-1, 2, 64]], ["bgemm_hp", "sp", [-1, 4]]]}, "result": [[0.0086530477], 0, 9.498551607131958, 1615717293.387183], "version": 0.2, "tvm_version": "0.8.dev0"}
{"input": ["opencl -keys=mali,opencl,gpu -device=mali -max_num_threads=256", "tutorial/conv2d_no_batching", [1, 47, 47, 512, 512, 3, 3, [1, 1], [1, 1]], {}], "config": {"index": 55515773180, "code_hash": null, "entity": [["inv_cp", "sp", [-1, 1]], ["inv_wp", "sp", [-1, 2, 18]], ["inv_hp", "sp", [-1, 4, 4]], ["kernel_cp", "sp", [-1, 8]], ["kernel_kp", "sp", [-1, 32]], ["data_cp", "sp", [-1, 16]], ["data_wp", "sp", [-1, 1, 64]], ["data_hp", "sp", [-1, 2, 4]], ["bgemm_kp", "sp", [-1, 2]], ["bgemm_wp", "sp", [-1, 1, 8]], ["bgemm_hp", "sp", [-1, 4]]]}, "result": [[0.2888672371], 0, 21.45946216583252, 1615717305.5354393], "version": 0.2, "tvm_version": "0.8.dev0"}
{"input": ["opencl -keys=mali,opencl,gpu -device=mali -max_num_threads=256", "tutorial/conv2d_no_batching", [1, 47, 47, 512, 512, 3, 3, [1, 1], [1, 1]], {}], "config": {"index": 35156988227, "code_hash": null, "entity": [["inv_cp", "sp", [-1, 8]], ["inv_wp", "sp", [-1, 6, 24]], ["inv_hp", "sp", [-1, 1, 4]], ["kernel_cp", "sp", [-1, 1]], ["kernel_kp", "sp", [-1, 2]], ["data_cp", "sp", [-1, 1]], ["data_wp", "sp", [-1, 2, 16]], ["data_hp", "sp", [-1, 2, 4]], ["bgemm_kp", "sp", [-1, 8]], ["bgemm_wp", "sp", [-1, 8, 8]], ["bgemm_hp", "sp", [-1, 2]]]}, "result": [[0.045652655599999994], 0, 5.880198955535889, 1615717289.882225], "version": 0.2, "tvm_version": "0.8.dev0"}
{"input": ["opencl -keys=mali,opencl,gpu -device=mali -max_num_threads=256", "tutorial/conv2d_no_batching", [1, 47, 47, 512, 512, 3, 3, [1, 1], [1, 1]], {}], "config": {"index": 41076516660, "code_hash": null, "entity": [["inv_cp", "sp", [-1, 1]], ["inv_wp", "sp", [-1, 8, 36]], ["inv_hp", "sp", [-1, 1, 4]], ["kernel_cp", "sp", [-1, 1]], ["kernel_kp", "sp", [-1, 4]], ["data_cp", "sp", [-1, 32]], ["data_wp", "sp", [-1, 1, 64]], ["data_hp", "sp", [-1, 1, 64]], ["bgemm_kp", "sp", [-1, 8]], ["bgemm_wp", "sp", [-1, 8, 16]], ["bgemm_hp", "sp", [-1, 2]]]}, "result": [[0.0259080026], 0, 45.92130923271179, 1615717330.2715867], "version": 0.2, "tvm_version": "0.8.dev0"}
{"input": ["opencl -keys=mali,opencl,gpu -device=mali -max_num_threads=256", "tutorial/conv2d_no_batching", [1, 47, 47, 512, 512, 3, 3, [1, 1], [1, 1]], {}], "config": {"index": 41612816861, "code_hash": null, "entity": [["inv_cp", "sp", [-1, 2]], ["inv_wp", "sp", [-1, 6, 12]], ["inv_hp", "sp", [-1, 1, 4]], ["kernel_cp", "sp", [-1, 1]], ["kernel_kp", "sp", [-1, 32]], ["data_cp", "sp", [-1, 4]], ["data_wp", "sp", [-1, 1, 16]], ["data_hp", "sp", [-1, 8, 16]], ["bgemm_kp", "sp", [-1, 1]], ["bgemm_wp", "sp", [-1, 1, 32]], ["bgemm_hp", "sp", [-1, 2]]]}, "result": [[0.2826127417], 0, 33.47990536689758, 1615717317.6493099], "version": 0.2, "tvm_version": "0.8.dev0"}
{"input": ["opencl -keys=mali,opencl,gpu -device=mali -max_num_threads=256", "tutorial/conv2d_no_batching", [1, 47, 47, 512, 512, 3, 3, [1, 1], [1, 1]], {}], "config": {"index": 190528376475, "code_hash": null, "entity": [["inv_cp", "sp", [-1, 8]], ["inv_wp", "sp", [-1, 3, 24]], ["inv_hp", "sp", [-1, 1, 4]], ["kernel_cp", "sp", [-1, 32]], ["kernel_kp", "sp", [-1, 8]], ["data_cp", "sp", [-1, 8]], ["data_wp", "sp", [-1, 4, 4]], ["data_hp", "sp", [-1, 8, 4]], ["bgemm_kp", "sp", [-1, 4]], ["bgemm_wp", "sp", [-1, 1, 64]], ["bgemm_hp", "sp", [-1, 128]]]}, "result": [[0.026959815199999997], 0, 5.029194355010986, 1615717339.687398], "version": 0.2, "tvm_version": "0.8.dev0"}
{"input": ["opencl -keys=mali,opencl,gpu -device=mali -max_num_threads=256", "tutorial/conv2d_no_batching", [1, 47, 47, 512, 512, 3, 3, [1, 1], [1, 1]], {}], "config": {"index": 167260625530, "code_hash": null, "entity": [["inv_cp", "sp", [-1, 4]], ["inv_wp", "sp", [-1, 18, 4]], ["inv_hp", "sp", [-1, 1, 4]], ["kernel_cp", "sp", [-1, 4]], ["kernel_kp", "sp", [-1, 2]], ["data_cp", "sp", [-1, 8]], ["data_wp", "sp", [-1, 8, 16]], ["data_hp", "sp", [-1, 1, 128]], ["bgemm_kp", "sp", [-1, 1]], ["bgemm_wp", "sp", [-1, 2, 64]], ["bgemm_hp", "sp", [-1, 64]]]}, "result": [[0.0232617576], 0, 8.710056781768799, 1615717343.4967556], "version": 0.2, "tvm_version": "0.8.dev0"}
{"input": ["opencl -keys=mali,opencl,gpu -device=mali -max_num_threads=256", "tutorial/conv2d_no_batching", [1, 47, 47, 512, 512, 3, 3, [1, 1], [1, 1]], {}], "config": {"index": 74870846131, "code_hash": null, "entity": [["inv_cp", "sp", [-1, 8]], ["inv_wp", "sp", [-1, 2, 12]], ["inv_hp", "sp", [-1, 2, 4]], ["kernel_cp", "sp", [-1, 4]], ["kernel_kp", "sp", [-1, 32]], ["data_cp", "sp", [-1, 8]], ["data_wp", "sp", [-1, 8, 8]], ["data_hp", "sp", [-1, 1, 64]], ["bgemm_kp", "sp", [-1, 32]], ["bgemm_wp", "sp", [-1, 2, 4]], ["bgemm_hp", "sp", [-1, 8]]]}, "result": [[0.0860479669], 0, 14.795830965042114, 1615717349.4931605], "version": 0.2, "tvm_version": "0.8.dev0"}
{"input": ["opencl -keys=mali,opencl,gpu -device=mali -max_num_threads=256", "tutorial/conv2d_no_batching", [1, 47, 47, 512, 512, 3, 3, [1, 1], [1, 1]], {}], "config": {"index": 192477841981, "code_hash": null, "entity": [["inv_cp", "sp", [-1, 2]], ["inv_wp", "sp", [-1, 72, 1]], ["inv_hp", "sp", [-1, 1, 4]], ["kernel_cp", "sp", [-1, 1]], ["kernel_kp", "sp", [-1, 16]], ["data_cp", "sp", [-1, 4]], ["data_wp", "sp", [-1, 1, 8]], ["data_hp", "sp", [-1, 1, 8]], ["bgemm_kp", "sp", [-1, 1]], ["bgemm_wp", "sp", [-1, 1, 128]], ["bgemm_hp", "sp", [-1, 128]]]}, "result": [[0.0225741168], 0, 23.650518894195557, 1615717358.3039339], "version": 0.2, "tvm_version": "0.8.dev0"}
{"input": ["opencl -keys=mali,opencl,gpu -device=mali -max_num_threads=256", "tutorial/conv2d_no_batching", [1, 47, 47, 512, 512, 3, 3, [1, 1], [1, 1]], {}], "config": {"index": 111795384707, "code_hash": null, "entity": [["inv_cp", "sp", [-1, 8]], ["inv_wp", "sp", [-1, 8, 12]], ["inv_hp", "sp", [-1, 4, 4]], ["kernel_cp", "sp", [-1, 2]], ["kernel_kp", "sp", [-1, 8]], ["data_cp", "sp", [-1, 16]], ["data_wp", "sp", [-1, 1, 8]], ["data_hp", "sp", [-1, 8, 4]], ["bgemm_kp", "sp", [-1, 1]], ["bgemm_wp", "sp", [-1, 4, 16]], ["bgemm_hp", "sp", [-1, 16]]]}, "result": [[0.0294830447], 0, 19.24190640449524, 1615717353.8903196], "version": 0.2, "tvm_version": "0.8.dev0"}
{"input": ["opencl -keys=mali,opencl,gpu -device=mali -max_num_threads=256", "tutorial/conv2d_no_batching", [1, 47, 47, 512, 512, 3, 3, [1, 1], [1, 1]], {}], "config": {"index": 33248174016, "code_hash": null, "entity": [["inv_cp", "sp", [-1, 1]], ["inv_wp", "sp", [-1, 6, 6]], ["inv_hp", "sp", [-1, 4, 4]], ["kernel_cp", "sp", [-1, 8]], ["kernel_kp", "sp", [-1, 2]], ["data_cp", "sp", [-1, 8]], ["data_wp", "sp", [-1, 4, 32]], ["data_hp", "sp", [-1, 4, 4]], ["bgemm_kp", "sp", [-1, 32]], ["bgemm_wp", "sp", [-1, 2, 8]], ["bgemm_hp", "sp", [-1, 2]]]}, "result": [[0.0445293169], 0, 28.43804121017456, 1615717363.1621523], "version": 0.2, "tvm_version": "0.8.dev0"}
{"input": ["opencl -keys=mali,opencl,gpu -device=mali -max_num_threads=256", "tutorial/conv2d_no_batching", [1, 47, 47, 512, 512, 3, 3, [1, 1], [1, 1]], {}], "config": {"index": 159630648817, "code_hash": null, "entity": [["inv_cp", "sp", [-1, 2]], ["inv_wp", "sp", [-1, 12, 4]], ["inv_hp", "sp", [-1, 2, 4]], ["kernel_cp", "sp", [-1, 2]], ["kernel_kp", "sp", [-1, 4]], ["data_cp", "sp", [-1, 16]], ["data_wp", "sp", [-1, 1, 8]], ["data_hp", "sp", [-1, 32, 4]], ["bgemm_kp", "sp", [-1, 8]], ["bgemm_wp", "sp", [-1, 2, 16]], ["bgemm_hp", "sp", [-1, 64]]]}, "result": [[0.05407647410000001], 0, 33.41472554206848, 1615717368.3111222], "version": 0.2, "tvm_version": "0.8.dev0"}
{"input": ["opencl -keys=mali,opencl,gpu -device=mali -max_num_threads=256", "tutorial/conv2d_no_batching", [1, 47, 47, 512, 512, 3, 3, [1, 1], [1, 1]], {}], "config": {"index": 40496373700, "code_hash": null, "entity": [["inv_cp", "sp", [-1, 1]], ["inv_wp", "sp", [-1, 3, 48]], ["inv_hp", "sp", [-1, 4, 4]], ["kernel_cp", "sp", [-1, 4]], ["kernel_kp", "sp", [-1, 16]], ["data_cp", "sp", [-1, 8]], ["data_wp", "sp", [-1, 8, 8]], ["data_hp", "sp", [-1, 1, 64]], ["bgemm_kp", "sp", [-1, 1]], ["bgemm_wp", "sp", [-1, 8, 16]], ["bgemm_hp", "sp", [-1, 2]]]}, "result": [[0.0832034406], 0, 8.038917779922485, 1615717381.7380455], "version": 0.2, "tvm_version": "0.8.dev0"}
{"input": ["opencl -keys=mali,opencl,gpu -device=mali -max_num_threads=256", "tutorial/conv2d_no_batching", [1, 47, 47, 512, 512, 3, 3, [1, 1], [1, 1]], {}], "config": {"index": 72326543954, "code_hash": null, "entity": [["inv_cp", "sp", [-1, 4]], ["inv_wp", "sp", [-1, 48, 12]], ["inv_hp", "sp", [-1, 4, 4]], ["kernel_cp", "sp", [-1, 32]], ["kernel_kp", "sp", [-1, 16]], ["data_cp", "sp", [-1, 16]], ["data_wp", "sp", [-1, 16, 4]], ["data_hp", "sp", [-1, 4, 16]], ["bgemm_kp", "sp", [-1, 16]], ["bgemm_wp", "sp", [-1, 1, 128]], ["bgemm_hp", "sp", [-1, 4]]]}, "result": [[0.0053046567], 0, 16.19644546508789, 1615717390.4015124], "version": 0.2, "tvm_version": "0.8.dev0"}
{"input": ["opencl -keys=mali,opencl,gpu -device=mali -max_num_threads=256", "tutorial/conv2d_no_batching", [1, 47, 47, 512, 512, 3, 3, [1, 1], [1, 1]], {}], "config": {"index": 61717153174, "code_hash": null, "entity": [["inv_cp", "sp", [-1, 4]], ["inv_wp", "sp", [-1, 2, 24]], ["inv_hp", "sp", [-1, 1, 4]], ["kernel_cp", "sp", [-1, 32]], ["kernel_kp", "sp", [-1, 8]], ["data_cp", "sp", [-1, 32]], ["data_wp", "sp", [-1, 1, 4]], ["data_hp", "sp", [-1, 4, 8]], ["bgemm_kp", "sp", [-1, 8]], ["bgemm_wp", "sp", [-1, 1, 16]], ["bgemm_hp", "sp", [-1, 4]]]}, "result": [[0.040425342600000004], 0, 13.01505446434021, 1615717386.656623], "version": 0.2, "tvm_version": "0.8.dev0"}
{"input": ["opencl -keys=mali,opencl,gpu -device=mali -max_num_threads=256", "tutorial/conv2d_no_batching", [1, 47, 47, 512, 512, 3, 3, [1, 1], [1, 1]], {}], "config": {"index": 118110859272, "code_hash": null, "entity": [["inv_cp", "sp", [-1, 1]], ["inv_wp", "sp", [-1, 4, 3]], ["inv_hp", "sp", [-1, 4, 4]], ["kernel_cp", "sp", [-1, 32]], ["kernel_kp", "sp", [-1, 2]], ["data_cp", "sp", [-1, 32]], ["data_wp", "sp", [-1, 2, 64]], ["data_hp", "sp", [-1, 1, 4]], ["bgemm_kp", "sp", [-1, 8]], ["bgemm_wp", "sp", [-1, 1, 64]], ["bgemm_hp", "sp", [-1, 16]]]}, "result": [[0.008381021700000001], 0, 20.26957392692566, 1615717394.2204719], "version": 0.2, "tvm_version": "0.8.dev0"}
{"input": ["opencl -keys=mali,opencl,gpu -device=mali -max_num_threads=256", "tutorial/conv2d_no_batching", [1, 47, 47, 512, 512, 3, 3, [1, 1], [1, 1]], {}], "config": {"index": 52859699783, "code_hash": null, "entity": [["inv_cp", "sp", [-1, 8]], ["inv_wp", "sp", [-1, 24, 8]], ["inv_hp", "sp", [-1, 1, 4]], ["kernel_cp", "sp", [-1, 32]], ["kernel_kp", "sp", [-1, 16]], ["data_cp", "sp", [-1, 2]], ["data_wp", "sp", [-1, 8, 8]], ["data_hp", "sp", [-1, 32, 4]], ["bgemm_kp", "sp", [-1, 32]], ["bgemm_wp", "sp", [-1, 8, 4]], ["bgemm_hp", "sp", [-1, 4]]]}, "result": [[0.0865400868], 0, 26.62364172935486, 1615717400.4726646], "version": 0.2, "tvm_version": "0.8.dev0"}
{"input": ["opencl -keys=mali,opencl,gpu -device=mali -max_num_threads=256", "tutorial/conv2d_no_batching", [1, 47, 47, 512, 512, 3, 3, [1, 1], [1, 1]], {}], "config": {"index": 123793271484, "code_hash": null, "entity": [["inv_cp", "sp", [-1, 1]], ["inv_wp", "sp", [-1, 6, 32]], ["inv_hp", "sp", [-1, 2, 4]], ["kernel_cp", "sp", [-1, 1]], ["kernel_kp", "sp", [-1, 4]], ["data_cp", "sp", [-1, 2]], ["data_wp", "sp", [-1, 2, 8]], ["data_hp", "sp", [-1, 4, 16]], ["bgemm_kp", "sp", [-1, 4]], ["bgemm_wp", "sp", [-1, 4, 4]], ["bgemm_hp", "sp", [-1, 32]]]}, "result": [[0.1118520059], 0, 33.39336085319519, 1615717407.2605147], "version": 0.2, "tvm_version": "0.8.dev0"}
{"input": ["opencl -keys=mali,opencl,gpu -device=mali -max_num_threads=256", "tutorial/conv2d_no_batching", [1, 47, 47, 512, 512, 3, 3, [1, 1], [1, 1]], {}], "config": {"index": 190126040785, "code_hash": null, "entity": [["inv_cp", "sp", [-1, 2]], ["inv_wp", "sp", [-1, 1, 96]], ["inv_hp", "sp", [-1, 4, 4]], ["kernel_cp", "sp", [-1, 32]], ["kernel_kp", "sp", [-1, 32]], ["data_cp", "sp", [-1, 8]], ["data_wp", "sp", [-1, 4, 4]], ["data_hp", "sp", [-1, 2, 4]], ["bgemm_kp", "sp", [-1, 1]], ["bgemm_wp", "sp", [-1, 1, 64]], ["bgemm_hp", "sp", [-1, 128]]]}, "result": [[0.037633128700000004], 0, 37.41194224357605, 1615717411.5404012], "version": 0.2, "tvm_version": "0.8.dev0"}
{"input": ["opencl -keys=mali,opencl,gpu -device=mali -max_num_threads=256", "tutorial/conv2d_no_batching", [1, 47, 47, 512, 512, 3, 3, [1, 1], [1, 1]], {}], "config": {"index": 60319853340, "code_hash": null, "entity": [["inv_cp", "sp", [-1, 1]], ["inv_wp", "sp", [-1, 12, 8]], ["inv_hp", "sp", [-1, 1, 4]], ["kernel_cp", "sp", [-1, 4]], ["kernel_kp", "sp", [-1, 16]], ["data_cp", "sp", [-1, 1]], ["data_wp", "sp", [-1, 32, 4]], ["data_hp", "sp", [-1, 4, 4]], ["bgemm_kp", "sp", [-1, 4]], ["bgemm_wp", "sp", [-1, 16, 8]], ["bgemm_hp", "sp", [-1, 4]]]}, "result": [[0.04976263], 0, 18.898757219314575, 1615717436.1005306], "version": 0.2, "tvm_version": "0.8.dev0"}
{"input": ["opencl -keys=mali,opencl,gpu -device=mali -max_num_threads=256", "tutorial/conv2d_no_batching", [1, 47, 47, 512, 512, 3, 3, [1, 1], [1, 1]], {}], "config": {"index": 50203041111, "code_hash": null, "entity": [["inv_cp", "sp", [-1, 8]], ["inv_wp", "sp", [-1, 2, 6]], ["inv_hp", "sp", [-1, 1, 4]], ["kernel_cp", "sp", [-1, 16]], ["kernel_kp", "sp", [-1, 8]], ["data_cp", "sp", [-1, 4]], ["data_wp", "sp", [-1, 2, 64]], ["data_hp", "sp", [-1, 4, 8]], ["bgemm_kp", "sp", [-1, 8]], ["bgemm_wp", "sp", [-1, 2, 4]], ["bgemm_hp", "sp", [-1, 4]]]}, "result": [[0.0862847898], 0, 8.636712789535522, 1615717425.565822], "version": 0.2, "tvm_version": "0.8.dev0"}
{"input": ["opencl -keys=mali,opencl,gpu -device=mali -max_num_threads=256", "tutorial/conv2d_no_batching", [1, 47, 47, 512, 512, 3, 3, [1, 1], [1, 1]], {}], "config": {"index": 192550843932, "code_hash": null, "entity": [["inv_cp", "sp", [-1, 1]], ["inv_wp", "sp", [-1, 6, 96]], ["inv_hp", "sp", [-1, 1, 4]], ["kernel_cp", "sp", [-1, 2]], ["kernel_kp", "sp", [-1, 8]], ["data_cp", "sp", [-1, 1]], ["data_wp", "sp", [-1, 1, 8]], ["data_hp", "sp", [-1, 8, 16]], ["bgemm_kp", "sp", [-1, 1]], ["bgemm_wp", "sp", [-1, 1, 128]], ["bgemm_hp", "sp", [-1, 128]]]}, "result": [[0.022968496999999997], 0, 26.353697061538696, 1615717443.5302544], "version": 0.2, "tvm_version": "0.8.dev0"}
{"input": ["opencl -keys=mali,opencl,gpu -device=mali -max_num_threads=256", "tutorial/conv2d_no_batching", [1, 47, 47, 512, 512, 3, 3, [1, 1], [1, 1]], {}], "config": {"index": 166827331282, "code_hash": null, "entity": [["inv_cp", "sp", [-1, 4]], ["inv_wp", "sp", [-1, 8, 3]], ["inv_hp", "sp", [-1, 2, 4]], ["kernel_cp", "sp", [-1, 1]], ["kernel_kp", "sp", [-1, 1]], ["data_cp", "sp", [-1, 8]], ["data_wp", "sp", [-1, 1, 8]], ["data_hp", "sp", [-1, 1, 32]], ["bgemm_kp", "sp", [-1, 16]], ["bgemm_wp", "sp", [-1, 1, 64]], ["bgemm_hp", "sp", [-1, 64]]]}, "result": [[0.0179471737], 0, 33.19880151748657, 1615717450.4675014], "version": 0.2, "tvm_version": "0.8.dev0"}
{"input": ["opencl -keys=mali,opencl,gpu -device=mali -max_num_threads=256", "tutorial/conv2d_no_batching", [1, 47, 47, 512, 512, 3, 3, [1, 1], [1, 1]], {}], "config": {"index": 76828557994, "code_hash": null, "entity": [["inv_cp", "sp", [-1, 4]], ["inv_wp", "sp", [-1, 64, 3]], ["inv_hp", "sp", [-1, 4, 4]], ["kernel_cp", "sp", [-1, 2]], ["kernel_kp", "sp", [-1, 8]], ["data_cp", "sp", [-1, 4]], ["data_wp", "sp", [-1, 1, 16]], ["data_hp", "sp", [-1, 2, 4]], ["bgemm_kp", "sp", [-1, 16]], ["bgemm_wp", "sp", [-1, 8, 4]], ["bgemm_hp", "sp", [-1, 8]]]}, "result": [[0.08588062319999999], 0, 14.256989479064941, 1615717431.2831295], "version": 0.2, "tvm_version": "0.8.dev0"}
{"input": ["opencl -keys=mali,opencl,gpu -device=mali -max_num_threads=256", "tutorial/conv2d_no_batching", [1, 47, 47, 512, 512, 3, 3, [1, 1], [1, 1]], {}], "config": {"index": 68941773708, "code_hash": null, "entity": [["inv_cp", "sp", [-1, 1]], ["inv_wp", "sp", [-1, 9, 2]], ["inv_hp", "sp", [-1, 2, 4]], ["kernel_cp", "sp", [-1, 4]], ["kernel_kp", "sp", [-1, 2]], ["data_cp", "sp", [-1, 32]], ["data_wp", "sp", [-1, 2, 4]], ["data_hp", "sp", [-1, 1, 4]], ["bgemm_kp", "sp", [-1, 32]], ["bgemm_wp", "sp", [-1, 4, 32]], ["bgemm_hp", "sp", [-1, 4]]]}, "result": [[0.0149702567], 0, 22.641828298568726, 1615717439.7138944], "version": 0.2, "tvm_version": "0.8.dev0"}
{"input": ["opencl -keys=mali,opencl,gpu -device=mali -max_num_threads=256", "tutorial/conv2d_no_batching", [1, 47, 47, 512, 512, 3, 3, [1, 1], [1, 1]], {}], "config": {"index": 96314791470, "code_hash": null, "entity": [["inv_cp", "sp", [-1, 4]], ["inv_wp", "sp", [-1, 72, 8]], ["inv_hp", "sp", [-1, 1, 4]], ["kernel_cp", "sp", [-1, 4]], ["kernel_kp", "sp", [-1, 16]], ["data_cp", "sp", [-1, 4]], ["data_wp", "sp", [-1, 8, 8]], ["data_hp", "sp", [-1, 1, 16]], ["bgemm_kp", "sp", [-1, 8]], ["bgemm_wp", "sp", [-1, 1, 128]], ["bgemm_hp", "sp", [-1, 8]]]}, "result": [[0.0047190734], 0, 29.45403027534485, 1615717446.7406528], "version": 0.2, "tvm_version": "0.8.dev0"}
{"input": ["opencl -keys=mali,opencl,gpu -device=mali -max_num_threads=256", "tutorial/conv2d_no_batching", [1, 47, 47, 512, 512, 3, 3, [1, 1], [1, 1]], {}], "config": {"index": 43429929335, "code_hash": null, "entity": [["inv_cp", "sp", [-1, 8]], ["inv_wp", "sp", [-1, 8, 1]], ["inv_hp", "sp", [-1, 4, 4]], ["kernel_cp", "sp", [-1, 2]], ["kernel_kp", "sp", [-1, 2]], ["data_cp", "sp", [-1, 4]], ["data_wp", "sp", [-1, 32, 4]], ["data_hp", "sp", [-1, 8, 4]], ["bgemm_kp", "sp", [-1, 16]], ["bgemm_wp", "sp", [-1, 2, 32]], ["bgemm_hp", "sp", [-1, 2]]]}, "result": [[0.0138621628], 0, 8.91216254234314, 1615717468.665228], "version": 0.2, "tvm_version": "0.8.dev0"}
{"input": ["opencl -keys=mali,opencl,gpu -device=mali -max_num_threads=256", "tutorial/conv2d_no_batching", [1, 47, 47, 512, 512, 3, 3, [1, 1], [1, 1]], {}], "config": {"index": 145223597998, "code_hash": null, "entity": [["inv_cp", "sp", [-1, 4]], ["inv_wp", "sp", [-1, 24, 12]], ["inv_hp", "sp", [-1, 4, 4]], ["kernel_cp", "sp", [-1, 1]], ["kernel_kp", "sp", [-1, 8]], ["data_cp", "sp", [-1, 16]], ["data_wp", "sp", [-1, 4, 32]], ["data_hp", "sp", [-1, 16, 4]], ["bgemm_kp", "sp", [-1, 1]], ["bgemm_wp", "sp", [-1, 1, 4]], ["bgemm_hp", "sp", [-1, 64]]]}, "result": [[0.3446111853], 0, 35.801249742507935, 1615717495.498841], "version": 0.2, "tvm_version": "0.8.dev0"}
{"input": ["opencl -keys=mali,opencl,gpu -device=mali -max_num_threads=256", "tutorial/conv2d_no_batching", [1, 47, 47, 512, 512, 3, 3, [1, 1], [1, 1]], {}], "config": {"index": 63586850310, "code_hash": null, "entity": [["inv_cp", "sp", [-1, 4]], ["inv_wp", "sp", [-1, 6, 2]], ["inv_hp", "sp", [-1, 2, 4]], ["kernel_cp", "sp", [-1, 4]], ["kernel_kp", "sp", [-1, 8]], ["data_cp", "sp", [-1, 8]], ["data_wp", "sp", [-1, 16, 8]], ["data_hp", "sp", [-1, 4, 4]], ["bgemm_kp", "sp", [-1, 2]], ["bgemm_wp", "sp", [-1, 4, 16]], ["bgemm_hp", "sp", [-1, 4]]]}, "result": [[0.0398006967], 0, 22.096303701400757, 1615717481.7292395], "version": 0.2, "tvm_version": "0.8.dev0"}
{"input": ["opencl -keys=mali,opencl,gpu -device=mali -max_num_threads=256", "tutorial/conv2d_no_batching", [1, 47, 47, 512, 512, 3, 3, [1, 1], [1, 1]], {}], "config": {"index": 111784332805, "code_hash": null, "entity": [["inv_cp", "sp", [-1, 2]], ["inv_wp", "sp", [-1, 6, 4]], ["inv_hp", "sp", [-1, 4, 4]], ["kernel_cp", "sp", [-1, 8]], ["kernel_kp", "sp", [-1, 2]], ["data_cp", "sp", [-1, 4]], ["data_wp", "sp", [-1, 4, 4]], ["data_hp", "sp", [-1, 4, 4]], ["bgemm_kp", "sp", [-1, 1]], ["bgemm_wp", "sp", [-1, 4, 16]], ["bgemm_hp", "sp", [-1, 16]]]}, "result": [[0.0290631331], 0, 17.59042501449585, 1615717477.2521112], "version": 0.2, "tvm_version": "0.8.dev0"}
{"input": ["opencl -keys=mali,opencl,gpu -device=mali -max_num_threads=256", "tutorial/conv2d_no_batching", [1, 47, 47, 512, 512, 3, 3, [1, 1], [1, 1]], {}], "config": {"index": 12490975973, "code_hash": null, "entity": [["inv_cp", "sp", [-1, 2]], ["inv_wp", "sp", [-1, 3, 48]], ["inv_hp", "sp", [-1, 2, 4]], ["kernel_cp", "sp", [-1, 4]], ["kernel_kp", "sp", [-1, 32]], ["data_cp", "sp", [-1, 16]], ["data_wp", "sp", [-1, 2, 64]], ["data_hp", "sp", [-1, 1, 4]], ["bgemm_kp", "sp", [-1, 32]], ["bgemm_wp", "sp", [-1, 16, 8]], ["bgemm_hp", "sp", [-1, 1]]]}, "result": [[0.0478919267], 0, 13.556360960006714, 1615717473.2834954], "version": 0.2, "tvm_version": "0.8.dev0"}
{"input": ["opencl -keys=mali,opencl,gpu -device=mali -max_num_threads=256", "tutorial/conv2d_no_batching", [1, 47, 47, 512, 512, 3, 3, [1, 1], [1, 1]], {}], "config": {"index": 117598171405, "code_hash": null, "entity": [["inv_cp", "sp", [-1, 2]], ["inv_wp", "sp", [-1, 6, 48]], ["inv_hp", "sp", [-1, 1, 4]], ["kernel_cp", "sp", [-1, 1]], ["kernel_kp", "sp", [-1, 2]], ["data_cp", "sp", [-1, 8]], ["data_wp", "sp", [-1, 1, 64]], ["data_hp", "sp", [-1, 2, 8]], ["bgemm_kp", "sp", [-1, 1]], ["bgemm_wp", "sp", [-1, 1, 64]], ["bgemm_hp", "sp", [-1, 16]]]}, "result": [[0.024234018], 0, 39.47959661483765, 1615717499.3878038], "version": 0.2, "tvm_version": "0.8.dev0"}
{"input": ["opencl -keys=mali,opencl,gpu -device=mali -max_num_threads=256", "tutorial/conv2d_no_batching", [1, 47, 47, 512, 512, 3, 3, [1, 1], [1, 1]], {}], "config": {"index": 29921221520, "code_hash": null, "entity": [["inv_cp", "sp", [-1, 1]], ["inv_wp", "sp", [-1, 8, 3]], ["inv_hp", "sp", [-1, 4, 4]], ["kernel_cp", "sp", [-1, 32]], ["kernel_kp", "sp", [-1, 2]], ["data_cp", "sp", [-1, 4]], ["data_wp", "sp", [-1, 1, 4]], ["data_hp", "sp", [-1, 4, 32]], ["bgemm_kp", "sp", [-1, 32]], ["bgemm_wp", "sp", [-1, 16, 4]], ["bgemm_hp", "sp", [-1, 2]]]}, "result": [[0.0846565085], 0, 22.7574143409729, 1615717526.2771242], "version": 0.2, "tvm_version": "0.8.dev0"}
{"input": ["opencl -keys=mali,opencl,gpu -device=mali -max_num_threads=256", "tutorial/conv2d_no_batching", [1, 47, 47, 512, 512, 3, 3, [1, 1], [1, 1]], {}], "config": {"index": 177767060574, "code_hash": null, "entity": [["inv_cp", "sp", [-1, 4]], ["inv_wp", "sp", [-1, 3, 4]], ["inv_hp", "sp", [-1, 2, 4]], ["kernel_cp", "sp", [-1, 32]], ["kernel_kp", "sp", [-1, 16]], ["data_cp", "sp", [-1, 32]], ["data_wp", "sp", [-1, 2, 16]], ["data_hp", "sp", [-1, 8, 16]], ["bgemm_kp", "sp", [-1, 2]], ["bgemm_wp", "sp", [-1, 2, 8]], ["bgemm_hp", "sp", [-1, 128]]]}, "result": [[0.20427268180000002], 0, 11.439589262008667, 1615717515.0393338], "version": 0.2, "tvm_version": "0.8.dev0"}
{"input": ["opencl -keys=mali,opencl,gpu -device=mali -max_num_threads=256", "tutorial/conv2d_no_batching", [1, 47, 47, 512, 512, 3, 3, [1, 1], [1, 1]], {}], "config": {"index": 62576419002, "code_hash": null, "entity": [["inv_cp", "sp", [-1, 4]], ["inv_wp", "sp", [-1, 2, 2]], ["inv_hp", "sp", [-1, 2, 4]], ["kernel_cp", "sp", [-1, 1]], ["kernel_kp", "sp", [-1, 2]], ["data_cp", "sp", [-1, 2]], ["data_wp", "sp", [-1, 1, 4]], ["data_hp", "sp", [-1, 1, 64]], ["bgemm_kp", "sp", [-1, 2]], ["bgemm_wp", "sp", [-1, 2, 16]], ["bgemm_hp", "sp", [-1, 4]]]}, "result": [[0.0763729607], 0, 16.968196630477905, 1615717520.4824727], "version": 0.2, "tvm_version": "0.8.dev0"}
{"input": ["opencl -keys=mali,opencl,gpu -device=mali -max_num_threads=256", "tutorial/conv2d_no_batching", [1, 47, 47, 512, 512, 3, 3, [1, 1], [1, 1]], {}], "config": {"index": 69260944475, "code_hash": null, "entity": [["inv_cp", "sp", [-1, 8]], ["inv_wp", "sp", [-1, 2, 16]], ["inv_hp", "sp", [-1, 1, 4]], ["kernel_cp", "sp", [-1, 32]], ["kernel_kp", "sp", [-1, 32]], ["data_cp", "sp", [-1, 16]], ["data_wp", "sp", [-1, 1, 128]], ["data_hp", "sp", [-1, 4, 16]], ["bgemm_kp", "sp", [-1, 1]], ["bgemm_wp", "sp", [-1, 1, 64]], ["bgemm_hp", "sp", [-1, 4]]]}, "result": [[0.0747975595], 0, 40.30432486534119, 1615717543.8689914], "version": 0.2, "tvm_version": "0.8.dev0"}
{"input": ["opencl -keys=mali,opencl,gpu -device=mali -max_num_threads=256", "tutorial/conv2d_no_batching", [1, 47, 47, 512, 512, 3, 3, [1, 1], [1, 1]], {}], "config": {"index": 7799536341, "code_hash": null, "entity": [["inv_cp", "sp", [-1, 2]], ["inv_wp", "sp", [-1, 1, 64]], ["inv_hp", "sp", [-1, 2, 4]], ["kernel_cp", "sp", [-1, 32]], ["kernel_kp", "sp", [-1, 1]], ["data_cp", "sp", [-1, 2]], ["data_wp", "sp", [-1, 2, 64]], ["data_hp", "sp", [-1, 2, 16]], ["bgemm_kp", "sp", [-1, 16]], ["bgemm_wp", "sp", [-1, 1, 8]], ["bgemm_hp", "sp", [-1, 1]]]}, "result": [[0.14447275399999998], 0, 34.8333694934845, 1615717538.3354728], "version": 0.2, "tvm_version": "0.8.dev0"}
{"input": ["opencl -keys=mali,opencl,gpu -device=mali -max_num_threads=256", "tutorial/conv2d_no_batching", [1, 47, 47, 512, 512, 3, 3, [1, 1], [1, 1]], {}], "config": {"index": 36255000601, "code_hash": null, "entity": [["inv_cp", "sp", [-1, 2]], ["inv_wp", "sp", [-1, 3, 24]], ["inv_hp", "sp", [-1, 1, 4]], ["kernel_cp", "sp", [-1, 32]], ["kernel_kp", "sp", [-1, 2]], ["data_cp", "sp", [-1, 8]], ["data_wp", "sp", [-1, 4, 16]], ["data_hp", "sp", [-1, 2, 32]], ["bgemm_kp", "sp", [-1, 4]], ["bgemm_wp", "sp", [-1, 16, 8]], ["bgemm_hp", "sp", [-1, 2]]]}, "result": [[0.048886072600000004], 0, 27.300134420394897, 1615717530.8259737], "version": 0.2, "tvm_version": "0.8.dev0"}
{"input": ["opencl -keys=mali,opencl,gpu -device=mali -max_num_threads=256", "tutorial/conv2d_no_batching", [1, 47, 47, 512, 512, 3, 3, [1, 1], [1, 1]], {}], "config": {"index": 75184561068, "code_hash": null, "entity": [["inv_cp", "sp", [-1, 1]], ["inv_wp", "sp", [-1, 96, 3]], ["inv_hp", "sp", [-1, 1, 4]], ["kernel_cp", "sp", [-1, 32]], ["kernel_kp", "sp", [-1, 4]], ["data_cp", "sp", [-1, 1]], ["data_wp", "sp", [-1, 2, 32]], ["data_hp", "sp", [-1, 16, 8]], ["bgemm_kp", "sp", [-1, 2]], ["bgemm_wp", "sp", [-1, 4, 4]], ["bgemm_hp", "sp", [-1, 8]]]}, "result": [[0.0929516342], 0, 7.37982439994812, 1615718593.4154093], "version": 0.2, "tvm_version": "0.8.dev0"}
{"input": ["opencl -keys=mali,opencl,gpu -device=mali -max_num_threads=256", "tutorial/conv2d_no_batching", [1, 47, 47, 512, 512, 3, 3, [1, 1], [1, 1]], {}], "config": {"index": 119709572820, "code_hash": null, "entity": [["inv_cp", "sp", [-1, 1]], ["inv_wp", "sp", [-1, 12, 3]], ["inv_hp", "sp", [-1, 2, 4]], ["kernel_cp", "sp", [-1, 16]], ["kernel_kp", "sp", [-1, 4]], ["data_cp", "sp", [-1, 2]], ["data_wp", "sp", [-1, 2, 32]], ["data_hp", "sp", [-1, 2, 8]], ["bgemm_kp", "sp", [-1, 32]], ["bgemm_wp", "sp", [-1, 2, 64]], ["bgemm_hp", "sp", [-1, 16]]]}, "result": [[0.009761360299999999], 0, 10.828393459320068, 1615718596.8432019], "version": 0.2, "tvm_version": "0.8.dev0"}
{"input": ["opencl -keys=mali,opencl,gpu -device=mali -max_num_threads=256", "tutorial/conv2d_no_batching", [1, 47, 47, 512, 512, 3, 3, [1, 1], [1, 1]], {}], "config": {"index": 94034305093, "code_hash": null, "entity": [["inv_cp", "sp", [-1, 2]], ["inv_wp", "sp", [-1, 12, 12]], ["inv_hp", "sp", [-1, 2, 4]], ["kernel_cp", "sp", [-1, 1]], ["kernel_kp", "sp", [-1, 16]], ["data_cp", "sp", [-1, 4]], ["data_wp", "sp", [-1, 2, 4]], ["data_hp", "sp", [-1, 8, 16]], ["bgemm_kp", "sp", [-1, 8]], ["bgemm_wp", "sp", [-1, 1, 64]], ["bgemm_hp", "sp", [-1, 8]]]}, "result": [[0.007521125700000001], 0, 29.80386257171631, 1615718615.9385667], "version": 0.2, "tvm_version": "0.8.dev0"}
{"input": ["opencl -keys=mali,opencl,gpu -device=mali -max_num_threads=256", "tutorial/conv2d_no_batching", [1, 47, 47, 512, 512, 3, 3, [1, 1], [1, 1]], {}], "config": {"index": 80307012877, "code_hash": null, "entity": [["inv_cp", "sp", [-1, 2]], ["inv_wp", "sp", [-1, 16, 6]], ["inv_hp", "sp", [-1, 4, 4]], ["kernel_cp", "sp", [-1, 32]], ["kernel_kp", "sp", [-1, 32]], ["data_cp", "sp", [-1, 4]], ["data_wp", "sp", [-1, 2, 64]], ["data_hp", "sp", [-1, 8, 4]], ["bgemm_kp", "sp", [-1, 16]], ["bgemm_wp", "sp", [-1, 1, 8]], ["bgemm_hp", "sp", [-1, 8]]]}, "result": [[0.0453472545], 0, 34.610002756118774, 1615718620.7283487], "version": 0.2, "tvm_version": "0.8.dev0"}
{"input": ["opencl -keys=mali,opencl,gpu -device=mali -max_num_threads=256", "tutorial/conv2d_no_batching", [1, 47, 47, 512, 512, 3, 3, [1, 1], [1, 1]], {}], "config": {"index": 121130851244, "code_hash": null, "entity": [["inv_cp", "sp", [-1, 1]], ["inv_wp", "sp", [-1, 8, 72]], ["inv_hp", "sp", [-1, 2, 4]], ["kernel_cp", "sp", [-1, 8]], ["kernel_kp", "sp", [-1, 16]], ["data_cp", "sp", [-1, 1]], ["data_wp", "sp", [-1, 16, 4]], ["data_hp", "sp", [-1, 2, 32]], ["bgemm_kp", "sp", [-1, 1]], ["bgemm_wp", "sp", [-1, 1, 4]], ["bgemm_hp", "sp", [-1, 32]]]}, "result": [[0.3424998362], 0, 47.97823166847229, 1615718634.5166812], "version": 0.2, "tvm_version": "0.8.dev0"}
{"input": ["opencl -keys=mali,opencl,gpu -device=mali -max_num_threads=256", "tutorial/conv2d_no_batching", [1, 47, 47, 512, 512, 3, 3, [1, 1], [1, 1]], {}], "config": {"index": 94248652182, "code_hash": null, "entity": [["inv_cp", "sp", [-1, 4]], ["inv_wp", "sp", [-1, 8, 8]], ["inv_hp", "sp", [-1, 2, 4]], ["kernel_cp", "sp", [-1, 8]], ["kernel_kp", "sp", [-1, 1]], ["data_cp", "sp", [-1, 16]], ["data_wp", "sp", [-1, 16, 8]], ["data_hp", "sp", [-1, 2, 32]], ["bgemm_kp", "sp", [-1, 16]], ["bgemm_wp", "sp", [-1, 1, 64]], ["bgemm_hp", "sp", [-1, 8]]]}, "result": [[0.0079801362], 0, 13.800124168395996, 1615718653.7954085], "version": 0.2, "tvm_version": "0.8.dev0"}
{"input": ["opencl -keys=mali,opencl,gpu -device=mali -max_num_threads=256", "tutorial/conv2d_no_batching", [1, 47, 47, 512, 512, 3, 3, [1, 1], [1, 1]], {}], "config": {"index": 15382929922, "code_hash": null, "entity": [["inv_cp", "sp", [-1, 4]], ["inv_wp", "sp", [-1, 6, 24]], ["inv_hp", "sp", [-1, 2, 4]], ["kernel_cp", "sp", [-1, 32]], ["kernel_kp", "sp", [-1, 1]], ["data_cp", "sp", [-1, 1]], ["data_wp", "sp", [-1, 16, 4]], ["data_hp", "sp", [-1, 4, 4]], ["bgemm_kp", "sp", [-1, 4]], ["bgemm_wp", "sp", [-1, 4, 16]], ["bgemm_hp", "sp", [-1, 1]]]}, "result": [[0.0761148253], 0, 6.334506273269653, 1615718646.5304837], "version": 0.2, "tvm_version": "0.8.dev0"}
{"input": ["opencl -keys=mali,opencl,gpu -device=mali -max_num_threads=256", "tutorial/conv2d_no_batching", [1, 47, 47, 512, 512, 3, 3, [1, 1], [1, 1]], {}], "config": {"index": 101773008529, "code_hash": null, "entity": [["inv_cp", "sp", [-1, 2]], ["inv_wp", "sp", [-1, 12, 4]], ["inv_hp", "sp", [-1, 1, 4]], ["kernel_cp", "sp", [-1, 32]], ["kernel_kp", "sp", [-1, 8]], ["data_cp", "sp", [-1, 32]], ["data_wp", "sp", [-1, 1, 8]], ["data_hp", "sp", [-1, 1, 128]], ["bgemm_kp", "sp", [-1, 2]], ["bgemm_wp", "sp", [-1, 16, 4]], ["bgemm_hp", "sp", [-1, 16]]]}, "result": [[0.0939370771], 0, 19.479841470718384, 1615718659.7715423], "version": 0.2, "tvm_version": "0.8.dev0"}
{"input": ["opencl -keys=mali,opencl,gpu -device=mali -max_num_threads=256", "tutorial/conv2d_no_batching", [1, 47, 47, 512, 512, 3, 3, [1, 1], [1, 1]], {}], "config": {"index": 96429320177, "code_hash": null, "entity": [["inv_cp", "sp", [-1, 2]], ["inv_wp", "sp", [-1, 12, 2]], ["inv_hp", "sp", [-1, 1, 4]], ["kernel_cp", "sp", [-1, 16]], ["kernel_kp", "sp", [-1, 16]], ["data_cp", "sp", [-1, 4]], ["data_wp", "sp", [-1, 1, 128]], ["data_hp", "sp", [-1, 4, 4]], ["bgemm_kp", "sp", [-1, 16]], ["bgemm_wp", "sp", [-1, 1, 128]], ["bgemm_hp", "sp", [-1, 8]]]}, "result": [[0.005015609900000001], 0, 10.4227294921875, 1615718650.375649], "version": 0.2, "tvm_version": "0.8.dev0"}
{"input": ["opencl -keys=mali,opencl,gpu -device=mali -max_num_threads=256", "tutorial/conv2d_no_batching", [1, 47, 47, 512, 512, 3, 3, [1, 1], [1, 1]], {}], "config": {"index": 118017277943, "code_hash": null, "entity": [["inv_cp", "sp", [-1, 8]], ["inv_wp", "sp", [-1, 1, 4]], ["inv_hp", "sp", [-1, 2, 4]], ["kernel_cp", "sp", [-1, 4]], ["kernel_kp", "sp", [-1, 32]], ["data_cp", "sp", [-1, 32]], ["data_wp", "sp", [-1, 8, 16]], ["data_hp", "sp", [-1, 1, 16]], ["bgemm_kp", "sp", [-1, 4]], ["bgemm_wp", "sp", [-1, 1, 64]], ["bgemm_hp", "sp", [-1, 16]]]}, "result": [[0.0079997404], 0, 23.185550212860107, 1615718663.2741117], "version": 0.2, "tvm_version": "0.8.dev0"}
{"input": ["opencl -keys=mali,opencl,gpu -device=mali -max_num_threads=256", "tutorial/conv2d_no_batching", [1, 47, 47, 512, 512, 3, 3, [1, 1], [1, 1]], {}], "config": {"index": 90372666893, "code_hash": null, "entity": [["inv_cp", "sp", [-1, 2]], ["inv_wp", "sp", [-1, 6, 3]], ["inv_hp", "sp", [-1, 4, 4]], ["kernel_cp", "sp", [-1, 2]], ["kernel_kp", "sp", [-1, 2]], ["data_cp", "sp", [-1, 16]], ["data_wp", "sp", [-1, 4, 16]], ["data_hp", "sp", [-1, 2, 16]], ["bgemm_kp", "sp", [-1, 4]], ["bgemm_wp", "sp", [-1, 1, 32]], ["bgemm_hp", "sp", [-1, 8]]]}, "result": [[0.022254595999999998], 0, 13.374651670455933, 1615718681.1411812], "version": 0.2, "tvm_version": "0.8.dev0"}
{"input": ["opencl -keys=mali,opencl,gpu -device=mali -max_num_threads=256", "tutorial/conv2d_no_batching", [1, 47, 47, 512, 512, 3, 3, [1, 1], [1, 1]], {}], "config": {"index": 47784773684, "code_hash": null, "entity": [["inv_cp", "sp", [-1, 1]], ["inv_wp", "sp", [-1, 16, 2]], ["inv_hp", "sp", [-1, 4, 4]], ["kernel_cp", "sp", [-1, 16]], ["kernel_kp", "sp", [-1, 1]], ["data_cp", "sp", [-1, 1]], ["data_wp", "sp", [-1, 16, 8]], ["data_hp", "sp", [-1, 4, 32]], ["bgemm_kp", "sp", [-1, 4]], ["bgemm_wp", "sp", [-1, 1, 128]], ["bgemm_hp", "sp", [-1, 2]]]}, "result": [[0.0228414659], 0, 9.393673181533813, 1615718677.2656105], "version": 0.2, "tvm_version": "0.8.dev0"}
{"input": ["opencl -keys=mali,opencl,gpu -device=mali -max_num_threads=256", "tutorial/conv2d_no_batching", [1, 47, 47, 512, 512, 3, 3, [1, 1], [1, 1]], {}], "config": {"index": 67151562098, "code_hash": null, "entity": [["inv_cp", "sp", [-1, 4]], ["inv_wp", "sp", [-1, 1, 32]], ["inv_hp", "sp", [-1, 2, 4]], ["kernel_cp", "sp", [-1, 1]], ["kernel_kp", "sp", [-1, 8]], ["data_cp", "sp", [-1, 16]], ["data_wp", "sp", [-1, 1, 8]], ["data_hp", "sp", [-1, 8, 16]], ["bgemm_kp", "sp", [-1, 2]], ["bgemm_wp", "sp", [-1, 2, 32]], ["bgemm_hp", "sp", [-1, 4]]]}, "result": [[0.0403016811], 0, 5.63023567199707, 1615718673.3019943], "version": 0.2, "tvm_version": "0.8.dev0"}
{"input": ["opencl -keys=mali,opencl,gpu -device=mali -max_num_threads=256", "tutorial/conv2d_no_batching", [1, 47, 47, 512, 512, 3, 3, [1, 1], [1, 1]], {}], "config": {"index": 120814031734, "code_hash": null, "entity": [["inv_cp", "sp", [-1, 4]], ["inv_wp", "sp", [-1, 1, 4]], ["inv_hp", "sp", [-1, 1, 4]], ["kernel_cp", "sp", [-1, 8]], ["kernel_kp", "sp", [-1, 4]], ["data_cp", "sp", [-1, 8]], ["data_wp", "sp", [-1, 1, 16]], ["data_hp", "sp", [-1, 4, 4]], ["bgemm_kp", "sp", [-1, 32]], ["bgemm_wp", "sp", [-1, 1, 128]], ["bgemm_hp", "sp", [-1, 16]]]}, "result": [[0.0059244642], 0, 16.810343980789185, 1615718684.6549802], "version": 0.2, "tvm_version": "0.8.dev0"}
{"input": ["opencl -keys=mali,opencl,gpu -device=mali -max_num_threads=256", "tutorial/conv2d_no_batching", [1, 47, 47, 512, 512, 3, 3, [1, 1], [1, 1]], {}], "config": {"index": 178869677903, "code_hash": null, "entity": [["inv_cp", "sp", [-1, 8]], ["inv_wp", "sp", [-1, 8, 72]], ["inv_hp", "sp", [-1, 2, 4]], ["kernel_cp", "sp", [-1, 4]], ["kernel_kp", "sp", [-1, 4]], ["data_cp", "sp", [-1, 1]], ["data_wp", "sp", [-1, 16, 4]], ["data_hp", "sp", [-1, 8, 8]], ["bgemm_kp", "sp", [-1, 2]], ["bgemm_wp", "sp", [-1, 4, 8]], ["bgemm_hp", "sp", [-1, 128]]]}, "result": [[0.1806439555], 0, 25.696237325668335, 1615718693.3418074], "version": 0.2, "tvm_version": "0.8.dev0"}
{"input": ["opencl -keys=mali,opencl,gpu -device=mali -max_num_threads=256", "tutorial/conv2d_no_batching", [1, 47, 47, 512, 512, 3, 3, [1, 1], [1, 1]], {}], "config": {"index": 41066470073, "code_hash": null, "entity": [["inv_cp", "sp", [-1, 2]], ["inv_wp", "sp", [-1, 4, 9]], ["inv_hp", "sp", [-1, 4, 4]], ["kernel_cp", "sp", [-1, 4]], ["kernel_kp", "sp", [-1, 32]], ["data_cp", "sp", [-1, 16]], ["data_wp", "sp", [-1, 2, 32]], ["data_hp", "sp", [-1, 4, 32]], ["bgemm_kp", "sp", [-1, 8]], ["bgemm_wp", "sp", [-1, 8, 16]], ["bgemm_hp", "sp", [-1, 2]]]}, "result": [[0.025478887900000004], 0, 29.835732221603394, 1615718697.7134526], "version": 0.2, "tvm_version": "0.8.dev0"}
{"input": ["opencl -keys=mali,opencl,gpu -device=mali -max_num_threads=256", "tutorial/conv2d_no_batching", [1, 47, 47, 512, 512, 3, 3, [1, 1], [1, 1]], {}], "config": {"index": 49479592239, "code_hash": null, "entity": [["inv_cp", "sp", [-1, 8]], ["inv_wp", "sp", [-1, 1, 12]], ["inv_hp", "sp", [-1, 2, 4]], ["kernel_cp", "sp", [-1, 16]], ["kernel_kp", "sp", [-1, 4]], ["data_cp", "sp", [-1, 1]], ["data_wp", "sp", [-1, 4, 32]], ["data_hp", "sp", [-1, 4, 16]], ["bgemm_kp", "sp", [-1, 32]], ["bgemm_wp", "sp", [-1, 1, 4]], ["bgemm_hp", "sp", [-1, 4]]]}, "result": [[0.0866045347], 0, 22.033674240112305, 1615718724.9046993], "version": 0.2, "tvm_version": "0.8.dev0"}
{"input": ["opencl -keys=mali,opencl,gpu -device=mali -max_num_threads=256", "tutorial/conv2d_no_batching", [1, 47, 47, 512, 512, 3, 3, [1, 1], [1, 1]], {}], "config": {"index": 74360553182, "code_hash": null, "entity": [["inv_cp", "sp", [-1, 4]], ["inv_wp", "sp", [-1, 72, 1]], ["inv_hp", "sp", [-1, 1, 4]], ["kernel_cp", "sp", [-1, 8]], ["kernel_kp", "sp", [-1, 16]], ["data_cp", "sp", [-1, 16]], ["data_wp", "sp", [-1, 4, 16]], ["data_hp", "sp", [-1, 16, 4]], ["bgemm_kp", "sp", [-1, 8]], ["bgemm_wp", "sp", [-1, 2, 4]], ["bgemm_hp", "sp", [-1, 8]]]}, "result": [[0.0861503888], 0, 27.93442964553833, 1615718730.8626413], "version": 0.2, "tvm_version": "0.8.dev0"}
{"input": ["opencl -keys=mali,opencl,gpu -device=mali -max_num_threads=256", "tutorial/conv2d_no_batching", [1, 47, 47, 512, 512, 3, 3, [1, 1], [1, 1]], {}], "config": {"index": 160510029248, "code_hash": null, "entity": [["inv_cp", "sp", [-1, 1]], ["inv_wp", "sp", [-1, 32, 2]], ["inv_hp", "sp", [-1, 1, 4]], ["kernel_cp", "sp", [-1, 4]], ["kernel_kp", "sp", [-1, 1]], ["data_cp", "sp", [-1, 2]], ["data_wp", "sp", [-1, 16, 8]], ["data_hp", "sp", [-1, 4, 32]], ["bgemm_kp", "sp", [-1, 2]], ["bgemm_wp", "sp", [-1, 4, 16]], ["bgemm_hp", "sp", [-1, 64]]]}, "result": [[0.0531622606], 0, 33.323304653167725, 1615718736.2373106], "version": 0.2, "tvm_version": "0.8.dev0"}
{"input": ["opencl -keys=mali,opencl,gpu -device=mali -max_num_threads=256", "tutorial/conv2d_no_batching", [1, 47, 47, 512, 512, 3, 3, [1, 1], [1, 1]], {}], "config": {"index": 77696259281, "code_hash": null, "entity": [["inv_cp", "sp", [-1, 2]], ["inv_wp", "sp", [-1, 24, 6]], ["inv_hp", "sp", [-1, 1, 4]], ["kernel_cp", "sp", [-1, 32]], ["kernel_kp", "sp", [-1, 2]], ["data_cp", "sp", [-1, 1]], ["data_wp", "sp", [-1, 8, 8]], ["data_hp", "sp", [-1, 2, 16]], ["bgemm_kp", "sp", [-1, 4]], ["bgemm_wp", "sp", [-1, 16, 4]], ["bgemm_hp", "sp", [-1, 8]]]}, "result": [[0.0909970351], 0, 39.41558289527893, 1615718742.510508], "version": 0.2, "tvm_version": "0.8.dev0"}
{"input": ["opencl -keys=mali,opencl,gpu -device=mali -max_num_threads=256", "tutorial/conv2d_no_batching", [1, 47, 47, 512, 512, 3, 3, [1, 1], [1, 1]], {}], "config": {"index": 66064088619, "code_hash": null, "entity": [["inv_cp", "sp", [-1, 8]], ["inv_wp", "sp", [-1, 9, 16]], ["inv_hp", "sp", [-1, 1, 4]], ["kernel_cp", "sp", [-1, 8]], ["kernel_kp", "sp", [-1, 8]], ["data_cp", "sp", [-1, 4]], ["data_wp", "sp", [-1, 4, 8]], ["data_hp", "sp", [-1, 1, 4]], ["bgemm_kp", "sp", [-1, 4]], ["bgemm_wp", "sp", [-1, 1, 32]], ["bgemm_hp", "sp", [-1, 4]]]}, "result": [[0.039457155], 0, 44.05046820640564, 1615718747.3623831], "version": 0.2, "tvm_version": "0.8.dev0"}
{"input": ["opencl -keys=mali,opencl,gpu -device=mali -max_num_threads=256", "tutorial/conv2d_no_batching", [1, 56, 56, 64, 64, 3, 3, [1, 1], [1, 1]], {}], "config": {"index": 367236496, "code_hash": null, "entity": [["inv_cp", "sp", [-1, 1]], ["inv_wp", "sp", [-1, 98, 4]], ["inv_hp", "sp", [-1, 4, 4]], ["kernel_cp", "sp", [-1, 2]], ["kernel_kp", "sp", [-1, 4]], ["data_cp", "sp", [-1, 16]], ["data_wp", "sp", [-1, 2, 8]], ["data_hp", "sp", [-1, 1, 16]], ["bgemm_kp", "sp", [-1, 4]], ["bgemm_wp", "sp", [-1, 1, 4]], ["bgemm_hp", "sp", [-1, 4]]]}, "result": [[0.033745180400000005], 0, 8.433803081512451, 1615817370.4677522], "version": 0.2, "tvm_version": "0.8.dev0"}
{"input": ["opencl -keys=mali,opencl,gpu -device=mali -max_num_threads=256", "tutorial/conv2d_no_batching", [1, 56, 56, 64, 64, 3, 3, [1, 1], [1, 1]], {}], "config": {"index": 211439458, "code_hash": null, "entity": [["inv_cp", "sp", [-1, 4]], ["inv_wp", "sp", [-1, 1, 56]], ["inv_hp", "sp", [-1, 1, 4]], ["kernel_cp", "sp", [-1, 8]], ["kernel_kp", "sp", [-1, 16]], ["data_cp", "sp", [-1, 1]], ["data_wp", "sp", [-1, 1, 8]], ["data_hp", "sp", [-1, 2, 4]], ["bgemm_kp", "sp", [-1, 2]], ["bgemm_wp", "sp", [-1, 2, 4]], ["bgemm_hp", "sp", [-1, 2]]]}, "result": [[0.1774092729], 0, 63.24243903160095, 1615817425.541564], "version": 0.2, "tvm_version": "0.8.dev0"}
{"input": ["opencl -keys=mali,opencl,gpu -device=mali -max_num_threads=256", "tutorial/conv2d_no_batching", [1, 56, 56, 64, 64, 3, 3, [1, 1], [1, 1]], {}], "config": {"index": 686598236, "code_hash": null, "entity": [["inv_cp", "sp", [-1, 1]], ["inv_wp", "sp", [-1, 4, 4]], ["inv_hp", "sp", [-1, 1, 4]], ["kernel_cp", "sp", [-1, 8]], ["kernel_kp", "sp", [-1, 2]], ["data_cp", "sp", [-1, 2]], ["data_wp", "sp", [-1, 4, 4]], ["data_hp", "sp", [-1, 2, 8]], ["bgemm_kp", "sp", [-1, 4]], ["bgemm_wp", "sp", [-1, 1, 16]], ["bgemm_hp", "sp", [-1, 8]]]}, "result": [[0.0452851972], 0, 66.0291657447815, 1615817428.340296], "version": 0.2, "tvm_version": "0.8.dev0"}
{"input": ["opencl -keys=mali,opencl,gpu -device=mali -max_num_threads=256", "tutorial/conv2d_no_batching", [1, 56, 56, 64, 64, 3, 3, [1, 1], [1, 1]], {}], "config": {"index": 432061607, "code_hash": null, "entity": [["inv_cp", "sp", [-1, 8]], ["inv_wp", "sp", [-1, 112, 1]], ["inv_hp", "sp", [-1, 1, 4]], ["kernel_cp", "sp", [-1, 2]], ["kernel_kp", "sp", [-1, 2]], ["data_cp", "sp", [-1, 1]], ["data_wp", "sp", [-1, 1, 8]], ["data_hp", "sp", [-1, 1, 4]], ["bgemm_kp", "sp", [-1, 16]], ["bgemm_wp", "sp", [-1, 4, 4]], ["bgemm_hp", "sp", [-1, 4]]]}, "result": [[0.3537534311], 0, 99.26243090629578, 1615817461.4146755], "version": 0.2, "tvm_version": "0.8.dev0"}
{"input": ["opencl -keys=mali,opencl,gpu -device=mali -max_num_threads=256", "tutorial/conv2d_no_batching", [1, 56, 56, 64, 64, 3, 3, [1, 1], [1, 1]], {}], "config": {"index": 871333704, "code_hash": null, "entity": [["inv_cp", "sp", [-1, 1]], ["inv_wp", "sp", [-1, 1, 7]], ["inv_hp", "sp", [-1, 2, 4]], ["kernel_cp", "sp", [-1, 1]], ["kernel_kp", "sp", [-1, 1]], ["data_cp", "sp", [-1, 8]], ["data_wp", "sp", [-1, 4, 4]], ["data_hp", "sp", [-1, 4, 4]], ["bgemm_kp", "sp", [-1, 16]], ["bgemm_wp", "sp", [-1, 1, 16]], ["bgemm_hp", "sp", [-1, 16]]]}, "result": [[0.0613873186], 0, 28.05386233329773, 1615817390.1923647], "version": 0.2, "tvm_version": "0.8.dev0"}
{"input": ["opencl -keys=mali,opencl,gpu -device=mali -max_num_threads=256", "tutorial/conv2d_no_batching", [1, 56, 56, 64, 64, 3, 3, [1, 1], [1, 1]], {}], "config": {"index": 58372960, "code_hash": null, "entity": [["inv_cp", "sp", [-1, 1]], ["inv_wp", "sp", [-1, 98, 1]], ["inv_hp", "sp", [-1, 1, 4]], ["kernel_cp", "sp", [-1, 2]], ["kernel_kp", "sp", [-1, 8]], ["data_cp", "sp", [-1, 2]], ["data_wp", "sp", [-1, 1, 4]], ["data_hp", "sp", [-1, 1, 4]], ["bgemm_kp", "sp", [-1, 1]], ["bgemm_wp", "sp", [-1, 4, 4]], ["bgemm_hp", "sp", [-1, 1]]]}, "result": [[0.1722800432], 0, 21.044646739959717, 1615817383.196718], "version": 0.2, "tvm_version": "0.8.dev0"}
{"input": ["opencl -keys=mali,opencl,gpu -device=mali -max_num_threads=256", "tutorial/conv2d_no_batching", [1, 56, 56, 64, 64, 3, 3, [1, 1], [1, 1]], {}], "config": {"index": 698740062, "code_hash": null, "entity": [["inv_cp", "sp", [-1, 4]], ["inv_wp", "sp", [-1, 7, 14]], ["inv_hp", "sp", [-1, 2, 4]], ["kernel_cp", "sp", [-1, 2]], ["kernel_kp", "sp", [-1, 1]], ["data_cp", "sp", [-1, 2]], ["data_wp", "sp", [-1, 1, 16]], ["data_hp", "sp", [-1, 2, 8]], ["bgemm_kp", "sp", [-1, 16]], ["bgemm_wp", "sp", [-1, 1, 16]], ["bgemm_hp", "sp", [-1, 8]]]}, "result": [[0.11191083930000001], 0, 35.592398166656494, 1615817397.7536292], "version": 0.2, "tvm_version": "0.8.dev0"}
{"input": ["opencl -keys=mali,opencl,gpu -device=mali -max_num_threads=256", "tutorial/conv2d_no_batching", [1, 56, 56, 64, 64, 3, 3, [1, 1], [1, 1]], {}], "config": {"index": 847503220, "code_hash": null, "entity": [["inv_cp", "sp", [-1, 1]], ["inv_wp", "sp", [-1, 7, 14]], ["inv_hp", "sp", [-1, 1, 4]], ["kernel_cp", "sp", [-1, 8]], ["kernel_kp", "sp", [-1, 4]], ["data_cp", "sp", [-1, 4]], ["data_wp", "sp", [-1, 1, 16]], ["data_hp", "sp", [-1, 2, 4]], ["bgemm_kp", "sp", [-1, 1]], ["bgemm_wp", "sp", [-1, 1, 16]], ["bgemm_hp", "sp", [-1, 16]]]}, "result": [[0.05934150070000001], 0, 24.627445936203003, 1615817386.7822943], "version": 0.2, "tvm_version": "0.8.dev0"}
{"input": ["opencl -keys=mali,opencl,gpu -device=mali -max_num_threads=256", "tutorial/conv2d_no_batching", [1, 56, 56, 64, 64, 3, 3, [1, 1], [1, 1]], {}], "config": {"index": 856803989, "code_hash": null, "entity": [["inv_cp", "sp", [-1, 2]], ["inv_wp", "sp", [-1, 28, 1]], ["inv_hp", "sp", [-1, 1, 4]], ["kernel_cp", "sp", [-1, 32]], ["kernel_kp", "sp", [-1, 4]], ["data_cp", "sp", [-1, 16]], ["data_wp", "sp", [-1, 4, 4]], ["data_hp", "sp", [-1, 1, 16]], ["bgemm_kp", "sp", [-1, 2]], ["bgemm_wp", "sp", [-1, 1, 16]], ["bgemm_hp", "sp", [-1, 16]]]}, "result": [[0.0291041696], 0, 30.87425398826599, 1615817393.0001268], "version": 0.2, "tvm_version": "0.8.dev0"}
{"input": ["opencl -keys=mali,opencl,gpu -device=mali -max_num_threads=256", "tutorial/conv2d_no_batching", [1, 56, 56, 64, 64, 3, 3, [1, 1], [1, 1]], {}], "config": {"index": 522987447, "code_hash": null, "entity": [["inv_cp", "sp", [-1, 8]], ["inv_wp", "sp", [-1, 8, 98]], ["inv_hp", "sp", [-1, 2, 4]], ["kernel_cp", "sp", [-1, 32]], ["kernel_kp", "sp", [-1, 4]], ["data_cp", "sp", [-1, 2]], ["data_wp", "sp", [-1, 1, 4]], ["data_hp", "sp", [-1, 2, 8]], ["bgemm_kp", "sp", [-1, 16]], ["bgemm_wp", "sp", [-1, 1, 16]], ["bgemm_hp", "sp", [-1, 4]]]}, "result": [[0.1092112921], 0, 14.078516483306885, 1615817376.178459], "version": 0.2, "tvm_version": "0.8.dev0"}
{"input": ["opencl -keys=mali,opencl,gpu -device=mali -max_num_threads=256", "tutorial/conv2d_no_batching", [1, 56, 56, 64, 64, 3, 3, [1, 1], [1, 1]], {}], "config": {"index": 689331841, "code_hash": null, "entity": [["inv_cp", "sp", [-1, 2]], ["inv_wp", "sp", [-1, 1, 16]], ["inv_hp", "sp", [-1, 1, 4]], ["kernel_cp", "sp", [-1, 4]], ["kernel_kp", "sp", [-1, 8]], ["data_cp", "sp", [-1, 1]], ["data_wp", "sp", [-1, 2, 4]], ["data_hp", "sp", [-1, 2, 4]], ["bgemm_kp", "sp", [-1, 8]], ["bgemm_wp", "sp", [-1, 1, 16]], ["bgemm_hp", "sp", [-1, 8]]]}, "result": [[0.116073897], 0, 5.431817293167114, 1615817367.4949303], "version": 0.2, "tvm_version": "0.8.dev0"}
{"input": ["opencl -keys=mali,opencl,gpu -device=mali -max_num_threads=256", "tutorial/conv2d_no_batching", [1, 56, 56, 64, 64, 3, 3, [1, 1], [1, 1]], {}], "config": {"index": 672794826, "code_hash": null, "entity": [["inv_cp", "sp", [-1, 4]], ["inv_wp", "sp", [-1, 1, 8]], ["inv_hp", "sp", [-1, 1, 4]], ["kernel_cp", "sp", [-1, 4]], ["kernel_kp", "sp", [-1, 2]], ["data_cp", "sp", [-1, 1]], ["data_wp", "sp", [-1, 2, 4]], ["data_hp", "sp", [-1, 4, 4]], ["bgemm_kp", "sp", [-1, 1]], ["bgemm_wp", "sp", [-1, 1, 16]], ["bgemm_hp", "sp", [-1, 8]]]}, "result": [[0.0595275059], 0, 81.6380398273468, 1615817444.0083303], "version": 0.2, "tvm_version": "0.8.dev0"}
{"input": ["opencl -keys=mali,opencl,gpu -device=mali -max_num_threads=256", "tutorial/conv2d_no_batching", [1, 56, 56, 64, 64, 3, 3, [1, 1], [1, 1]], {}], "config": {"index": 720267235, "code_hash": null, "entity": [["inv_cp", "sp", [-1, 8]], ["inv_wp", "sp", [-1, 2, 4]], ["inv_hp", "sp", [-1, 1, 4]], ["kernel_cp", "sp", [-1, 4]], ["kernel_kp", "sp", [-1, 4]], ["data_cp", "sp", [-1, 1]], ["data_wp", "sp", [-1, 1, 4]], ["data_hp", "sp", [-1, 1, 8]], ["bgemm_kp", "sp", [-1, 8]], ["bgemm_wp", "sp", [-1, 1, 4]], ["bgemm_hp", "sp", [-1, 16]]]}, "result": [[0.3587612284], 0, 56.016934871673584, 1615817418.3079967], "version": 0.2, "tvm_version": "0.8.dev0"}
{"input": ["opencl -keys=mali,opencl,gpu -device=mali -max_num_threads=256", "tutorial/conv2d_no_batching", [1, 56, 56, 64, 64, 3, 3, [1, 1], [1, 1]], {}], "config": {"index": 53703801, "code_hash": null, "entity": [["inv_cp", "sp", [-1, 2]], ["inv_wp", "sp", [-1, 14, 2]], ["inv_hp", "sp", [-1, 4, 4]], ["kernel_cp", "sp", [-1, 8]], ["kernel_kp", "sp", [-1, 4]], ["data_cp", "sp", [-1, 4]], ["data_wp", "sp", [-1, 2, 4]], ["data_hp", "sp", [-1, 2, 4]], ["bgemm_kp", "sp", [-1, 16]], ["bgemm_wp", "sp", [-1, 2, 4]], ["bgemm_hp", "sp", [-1, 1]]]}, "result": [[0.058339224499999995], 0, 38.796812295913696, 1615817400.966951], "version": 0.2, "tvm_version": "0.8.dev0"}
{"input": ["opencl -keys=mali,opencl,gpu -device=mali -max_num_threads=256", "tutorial/conv2d_no_batching", [1, 56, 56, 64, 64, 3, 3, [1, 1], [1, 1]], {}], "config": {"index": 280837972, "code_hash": null, "entity": [["inv_cp", "sp", [-1, 1]], ["inv_wp", "sp", [-1, 28, 7]], ["inv_hp", "sp", [-1, 1, 4]], ["kernel_cp", "sp", [-1, 2]], ["kernel_kp", "sp", [-1, 16]], ["data_cp", "sp", [-1, 4]], ["data_wp", "sp", [-1, 1, 16]], ["data_hp", "sp", [-1, 1, 4]], ["bgemm_kp", "sp", [-1, 8]], ["bgemm_wp", "sp", [-1, 1, 8]], ["bgemm_hp", "sp", [-1, 2]]]}, "result": [[0.0958257543], 0, 86.31635451316833, 1615817448.7218947], "version": 0.2, "tvm_version": "0.8.dev0"}
{"input": ["opencl -keys=mali,opencl,gpu -device=mali -max_num_threads=256", "tutorial/conv2d_no_batching", [1, 56, 56, 64, 64, 3, 3, [1, 1], [1, 1]], {}], "config": {"index": 319711703, "code_hash": null, "entity": [["inv_cp", "sp", [-1, 8]], ["inv_wp", "sp", [-1, 14, 1]], ["inv_hp", "sp", [-1, 2, 4]], ["kernel_cp", "sp", [-1, 2]], ["kernel_kp", "sp", [-1, 8]], ["data_cp", "sp", [-1, 4]], ["data_wp", "sp", [-1, 1, 16]], ["data_hp", "sp", [-1, 2, 8]], ["bgemm_kp", "sp", [-1, 16]], ["bgemm_wp", "sp", [-1, 2, 8]], ["bgemm_hp", "sp", [-1, 2]]]}, "result": [[0.07449112199999999], 0, 69.88354301452637, 1615817432.1688058], "version": 0.2, "tvm_version": "0.8.dev0"}
{"input": ["opencl -keys=mali,opencl,gpu -device=mali -max_num_threads=256", "tutorial/conv2d_no_batching", [1, 56, 56, 64, 64, 3, 3, [1, 1], [1, 1]], {}], "config": {"index": 596857414, "code_hash": null, "entity": [["inv_cp", "sp", [-1, 4]], ["inv_wp", "sp", [-1, 56, 2]], ["inv_hp", "sp", [-1, 4, 4]], ["kernel_cp", "sp", [-1, 8]], ["kernel_kp", "sp", [-1, 4]], ["data_cp", "sp", [-1, 2]], ["data_wp", "sp", [-1, 1, 4]], ["data_hp", "sp", [-1, 4, 4]], ["bgemm_kp", "sp", [-1, 4]], ["bgemm_wp", "sp", [-1, 4, 4]], ["bgemm_hp", "sp", [-1, 8]]]}, "result": [[0.0832013572], 0, 75.0890576839447, 1615817437.3809], "version": 0.2, "tvm_version": "0.8.dev0"}
{"input": ["opencl -keys=mali,opencl,gpu -device=mali -max_num_threads=256", "tutorial/conv2d_no_batching", [1, 56, 56, 64, 64, 3, 3, [1, 1], [1, 1]], {}], "config": {"index": 758150169, "code_hash": null, "entity": [["inv_cp", "sp", [-1, 2]], ["inv_wp", "sp", [-1, 49, 16]], ["inv_hp", "sp", [-1, 4, 4]], ["kernel_cp", "sp", [-1, 4]], ["kernel_kp", "sp", [-1, 8]], ["data_cp", "sp", [-1, 16]], ["data_wp", "sp", [-1, 1, 16]], ["data_hp", "sp", [-1, 1, 16]], ["bgemm_kp", "sp", [-1, 16]], ["bgemm_wp", "sp", [-1, 2, 4]], ["bgemm_hp", "sp", [-1, 16]]]}, "result": [[0.072099653], 0, 43.523247480392456, 1615817405.812856], "version": 0.2, "tvm_version": "0.8.dev0"}
{"input": ["opencl -keys=mali,opencl,gpu -device=mali -max_num_threads=256", "tutorial/conv2d_no_batching", [1, 56, 56, 64, 64, 3, 3, [1, 1], [1, 1]], {}], "config": {"index": 673963146, "code_hash": null, "entity": [["inv_cp", "sp", [-1, 4]], ["inv_wp", "sp", [-1, 7, 56]], ["inv_hp", "sp", [-1, 4, 4]], ["kernel_cp", "sp", [-1, 8]], ["kernel_kp", "sp", [-1, 2]], ["data_cp", "sp", [-1, 2]], ["data_wp", "sp", [-1, 4, 4]], ["data_hp", "sp", [-1, 1, 8]], ["bgemm_kp", "sp", [-1, 1]], ["bgemm_wp", "sp", [-1, 1, 16]], ["bgemm_hp", "sp", [-1, 8]]]}, "result": [[0.056192042], 0, 78.3776319026947, 1615817440.7275453], "version": 0.2, "tvm_version": "0.8.dev0"}
{"input": ["opencl -keys=mali,opencl,gpu -device=mali -max_num_threads=256", "tutorial/conv2d_no_batching", [1, 56, 56, 64, 64, 3, 3, [1, 1], [1, 1]], {}], "config": {"index": 766113842, "code_hash": null, "entity": [["inv_cp", "sp", [-1, 4]], ["inv_wp", "sp", [-1, 1, 1]], ["inv_hp", "sp", [-1, 4, 4]], ["kernel_cp", "sp", [-1, 4]], ["kernel_kp", "sp", [-1, 4]], ["data_cp", "sp", [-1, 1]], ["data_wp", "sp", [-1, 2, 4]], ["data_hp", "sp", [-1, 4, 4]], ["bgemm_kp", "sp", [-1, 2]], ["bgemm_wp", "sp", [-1, 4, 4]], ["bgemm_hp", "sp", [-1, 16]]]}, "result": [[0.0846803418], 0, 4.440572500228882, 1615817472.0461843], "version": 0.2, "tvm_version": "0.8.dev0"}
{"input": ["opencl -keys=mali,opencl,gpu -device=mali -max_num_threads=256", "tutorial/conv2d_no_batching", [1, 56, 56, 64, 64, 3, 3, [1, 1], [1, 1]], {}], "config": {"index": 597552133, "code_hash": null, "entity": [["inv_cp", "sp", [-1, 2]], ["inv_wp", "sp", [-1, 7, 1]], ["inv_hp", "sp", [-1, 1, 4]], ["kernel_cp", "sp", [-1, 32]], ["kernel_kp", "sp", [-1, 16]], ["data_cp", "sp", [-1, 4]], ["data_wp", "sp", [-1, 2, 8]], ["data_hp", "sp", [-1, 4, 4]], ["bgemm_kp", "sp", [-1, 4]], ["bgemm_wp", "sp", [-1, 4, 4]], ["bgemm_hp", "sp", [-1, 8]]]}, "result": [[0.0548226722], 0, 69.858225107193, 1615817537.637254], "version": 0.2, "tvm_version": "0.8.dev0"}
{"input": ["opencl -keys=mali,opencl,gpu -device=mali -max_num_threads=256", "tutorial/conv2d_no_batching", [1, 56, 56, 64, 64, 3, 3, [1, 1], [1, 1]], {}], "config": {"index": 690445753, "code_hash": null, "entity": [["inv_cp", "sp", [-1, 2]], ["inv_wp", "sp", [-1, 1, 98]], ["inv_hp", "sp", [-1, 2, 4]], ["kernel_cp", "sp", [-1, 2]], ["kernel_kp", "sp", [-1, 1]], ["data_cp", "sp", [-1, 1]], ["data_wp", "sp", [-1, 4, 4]], ["data_hp", "sp", [-1, 4, 4]], ["bgemm_kp", "sp", [-1, 8]], ["bgemm_wp", "sp", [-1, 1, 16]], ["bgemm_hp", "sp", [-1, 8]]]}, "result": [[0.0562155681], 0, 8.392357349395752, 1615817476.0755517], "version": 0.2, "tvm_version": "0.8.dev0"}
{"input": ["opencl -keys=mali,opencl,gpu -device=mali -max_num_threads=256", "tutorial/conv2d_no_batching", [1, 56, 56, 64, 64, 3, 3, [1, 1], [1, 1]], {}], "config": {"index": 505782290, "code_hash": null, "entity": [["inv_cp", "sp", [-1, 4]], ["inv_wp", "sp", [-1, 8, 49]], ["inv_hp", "sp", [-1, 4, 4]], ["kernel_cp", "sp", [-1, 16]], ["kernel_kp", "sp", [-1, 4]], ["data_cp", "sp", [-1, 1]], ["data_wp", "sp", [-1, 4, 4]], ["data_hp", "sp", [-1, 2, 8]], ["bgemm_kp", "sp", [-1, 2]], ["bgemm_wp", "sp", [-1, 1, 16]], ["bgemm_hp", "sp", [-1, 4]]]}, "result": [[0.05643130240000001], 0, 100.59364461898804, 1615817568.3966203], "version": 0.2, "tvm_version": "0.8.dev0"}
{"input": ["opencl -keys=mali,opencl,gpu -device=mali -max_num_threads=256", "tutorial/conv2d_no_batching", [1, 56, 56, 64, 64, 3, 3, [1, 1], [1, 1]], {}], "config": {"index": 400579607, "code_hash": null, "entity": [["inv_cp", "sp", [-1, 8]], ["inv_wp", "sp", [-1, 112, 1]], ["inv_hp", "sp", [-1, 1, 4]], ["kernel_cp", "sp", [-1, 32]], ["kernel_kp", "sp", [-1, 4]], ["data_cp", "sp", [-1, 8]], ["data_wp", "sp", [-1, 1, 4]], ["data_hp", "sp", [-1, 2, 8]], ["bgemm_kp", "sp", [-1, 8]], ["bgemm_wp", "sp", [-1, 2, 4]], ["bgemm_hp", "sp", [-1, 4]]]}, "result": [[0.0651151628], 0, 28.93753743171692, 1615817496.68293], "version": 0.2, "tvm_version": "0.8.dev0"}
{"input": ["opencl -keys=mali,opencl,gpu -device=mali -max_num_threads=256", "tutorial/conv2d_no_batching", [1, 56, 56, 64, 64, 3, 3, [1, 1], [1, 1]], {}], "config": {"index": 753774335, "code_hash": null, "entity": [["inv_cp", "sp", [-1, 8]], ["inv_wp", "sp", [-1, 2, 14]], ["inv_hp", "sp", [-1, 1, 4]], ["kernel_cp", "sp", [-1, 2]], ["kernel_kp", "sp", [-1, 8]], ["data_cp", "sp", [-1, 16]], ["data_wp", "sp", [-1, 4, 4]], ["data_hp", "sp", [-1, 2, 4]], ["bgemm_kp", "sp", [-1, 16]], ["bgemm_wp", "sp", [-1, 2, 4]], ["bgemm_hp", "sp", [-1, 16]]]}, "result": [[0.0687025173], 0, 55.61647915840149, 1615817523.3613875], "version": 0.2, "tvm_version": "0.8.dev0"}
{"input": ["opencl -keys=mali,opencl,gpu -device=mali -max_num_threads=256", "tutorial/conv2d_no_batching", [1, 56, 56, 64, 64, 3, 3, [1, 1], [1, 1]], {}], "config": {"index": 752252499, "code_hash": null, "entity": [["inv_cp", "sp", [-1, 8]], ["inv_wp", "sp", [-1, 98, 2]], ["inv_hp", "sp", [-1, 1, 4]], ["kernel_cp", "sp", [-1, 4]], ["kernel_kp", "sp", [-1, 8]], ["data_cp", "sp", [-1, 4]], ["data_wp", "sp", [-1, 1, 16]], ["data_hp", "sp", [-1, 1, 16]], ["bgemm_kp", "sp", [-1, 8]], ["bgemm_wp", "sp", [-1, 2, 4]], ["bgemm_hp", "sp", [-1, 16]]]}, "result": [[0.13512994579999998], 0, 17.63299036026001, 1615817485.382419], "version": 0.2, "tvm_version": "0.8.dev0"}
{"input": ["opencl -keys=mali,opencl,gpu -device=mali -max_num_threads=256", "tutorial/conv2d_no_batching", [1, 56, 56, 64, 64, 3, 3, [1, 1], [1, 1]], {}], "config": {"index": 361274707, "code_hash": null, "entity": [["inv_cp", "sp", [-1, 8]], ["inv_wp", "sp", [-1, 7, 56]], ["inv_hp", "sp", [-1, 2, 4]], ["kernel_cp", "sp", [-1, 2]], ["kernel_kp", "sp", [-1, 4]], ["data_cp", "sp", [-1, 1]], ["data_wp", "sp", [-1, 2, 8]], ["data_hp", "sp", [-1, 1, 16]], ["bgemm_kp", "sp", [-1, 2]], ["bgemm_wp", "sp", [-1, 1, 4]], ["bgemm_hp", "sp", [-1, 4]]]}, "result": [[0.1969819363], 0, 66.49028491973877, 1615817534.227423], "version": 0.2, "tvm_version": "0.8.dev0"}
{"input": ["opencl -keys=mali,opencl,gpu -device=mali -max_num_threads=256", "tutorial/conv2d_no_batching", [1, 56, 56, 64, 64, 3, 3, [1, 1], [1, 1]], {}], "config": {"index": 737797673, "code_hash": null, "entity": [["inv_cp", "sp", [-1, 2]], ["inv_wp", "sp", [-1, 2, 392]], ["inv_hp", "sp", [-1, 4, 4]], ["kernel_cp", "sp", [-1, 8]], ["kernel_kp", "sp", [-1, 4]], ["data_cp", "sp", [-1, 2]], ["data_wp", "sp", [-1, 1, 4]], ["data_hp", "sp", [-1, 1, 8]], ["bgemm_kp", "sp", [-1, 2]], ["bgemm_wp", "sp", [-1, 2, 4]], ["bgemm_hp", "sp", [-1, 16]]]}, "result": [[0.2138214744], 0, 37.161861181259155, 1615817504.9121287], "version": 0.2, "tvm_version": "0.8.dev0"}
{"input": ["opencl -keys=mali,opencl,gpu -device=mali -max_num_threads=256", "tutorial/conv2d_no_batching", [1, 56, 56, 64, 64, 3, 3, [1, 1], [1, 1]], {}], "config": {"index": 606717458, "code_hash": null, "entity": [["inv_cp", "sp", [-1, 4]], ["inv_wp", "sp", [-1, 98, 2]], ["inv_hp", "sp", [-1, 2, 4]], ["kernel_cp", "sp", [-1, 2]], ["kernel_kp", "sp", [-1, 16]], ["data_cp", "sp", [-1, 1]], ["data_wp", "sp", [-1, 2, 4]], ["data_hp", "sp", [-1, 1, 4]], ["bgemm_kp", "sp", [-1, 16]], ["bgemm_wp", "sp", [-1, 4, 4]], ["bgemm_hp", "sp", [-1, 8]]]}, "result": [[0.1970182905], 0, 25.45505428314209, 1615817493.203766], "version": 0.2, "tvm_version": "0.8.dev0"}
{"input": ["opencl -keys=mali,opencl,gpu -device=mali -max_num_threads=256", "tutorial/conv2d_no_batching", [1, 56, 56, 64, 64, 3, 3, [1, 1], [1, 1]], {}], "config": {"index": 66096447, "code_hash": null, "entity": [["inv_cp", "sp", [-1, 8]], ["inv_wp", "sp", [-1, 28, 2]], ["inv_hp", "sp", [-1, 2, 4]], ["kernel_cp", "sp", [-1, 1]], ["kernel_kp", "sp", [-1, 1]], ["data_cp", "sp", [-1, 1]], ["data_wp", "sp", [-1, 1, 4]], ["data_hp", "sp", [-1, 4, 4]], ["bgemm_kp", "sp", [-1, 2]], ["bgemm_wp", "sp", [-1, 4, 4]], ["bgemm_hp", "sp", [-1, 1]]]}, "result": [[0.1045872291], 0, 86.50273966789246, 1615817554.2708435], "version": 0.2, "tvm_version": "0.8.dev0"}
{"input": ["opencl -keys=mali,opencl,gpu -device=mali -max_num_threads=256", "tutorial/conv2d_no_batching", [1, 56, 56, 64, 64, 3, 3, [1, 1], [1, 1]], {}], "config": {"index": 455971136, "code_hash": null, "entity": [["inv_cp", "sp", [-1, 1]], ["inv_wp", "sp", [-1, 56, 7]], ["inv_hp", "sp", [-1, 2, 4]], ["kernel_cp", "sp", [-1, 32]], ["kernel_kp", "sp", [-1, 1]], ["data_cp", "sp", [-1, 8]], ["data_wp", "sp", [-1, 1, 4]], ["data_hp", "sp", [-1, 2, 4]], ["bgemm_kp", "sp", [-1, 8]], ["bgemm_wp", "sp", [-1, 1, 8]], ["bgemm_hp", "sp", [-1, 4]]]}, "result": [[0.0431742543], 0, 51.86935305595398, 1615817519.62952], "version": 0.2, "tvm_version": "0.8.dev0"}
