test_and_tune/android.topi_winograd.log.tmp
{"input": ["opencl -keys=mali,opencl,gpu -device=mali -max_num_threads=256", "tutorial/conv2d_no_batching", [1, 40, 40, 512, 256, 3, 3, [1, 1], [1, 1]], {}], "config": {"index": 16375, "code_hash": null, "entity": [["tile_bna", "ot", 1], ["tile_bnb", "ot", 1], ["tile_t1", "sp", [-1, 128]], ["tile_t2", "sp", [-1, 2]], ["c_unroll", "sp", [-1, 4]], ["yt", "ot", 4]]}, "result": [[0.5933390226], 0, 304.55388379096985, 1612186737.3511045], "version": 0.2, "tvm_version": "0.8.dev0"}
{"input": ["opencl -keys=mali,opencl,gpu -device=mali -max_num_threads=256", "tutorial/conv2d_no_batching", [1, 40, 40, 512, 256, 3, 3, [1, 1], [1, 1]], {}], "config": {"index": 17755, "code_hash": null, "entity": [["tile_bna", "ot", 1], ["tile_bnb", "ot", 2], ["tile_t1", "sp", [-1, 64]], ["tile_t2", "sp", [-1, 1]], ["c_unroll", "sp", [-1, 8]], ["yt", "ot", 4]]}, "result": [[0.334831674], 0, 269.2356233596802, 1612186702.0364778], "version": 0.2, "tvm_version": "0.8.dev0"}
{"input": ["opencl -keys=mali,opencl,gpu -device=mali -max_num_threads=256", "tutorial/conv2d_no_batching", [1, 40, 40, 512, 256, 3, 3, [1, 1], [1, 1]], {}], "config": {"index": 3187, "code_hash": null, "entity": [["tile_bna", "ot", 4], ["tile_bnb", "ot", 4], ["tile_t1", "sp", [-1, 128]], ["tile_t2", "sp", [-1, 128]], ["c_unroll", "sp", [-1, 2]], ["yt", "ot", 1]]}, "result": [[0.4713821146], 0, 28.560298442840576, 1612186460.1509414], "version": 0.2, "tvm_version": "0.8.dev0"}
{"input": ["opencl -keys=mali,opencl,gpu -device=mali -max_num_threads=256", "tutorial/conv2d_no_batching", [1, 40, 40, 512, 256, 3, 3, [1, 1], [1, 1]], {}], "config": {"index": 4752, "code_hash": null, "entity": [["tile_bna", "ot", 4], ["tile_bnb", "ot", 1], ["tile_t1", "sp", [-1, 64]], ["tile_t2", "sp", [-1, 128]], ["c_unroll", "sp", [-1, 4]], ["yt", "ot", 1]]}, "result": [[1.3926550658], 0, 126.32591533660889, 1612186558.4209726], "version": 0.2, "tvm_version": "0.8.dev0"}
{"input": ["opencl -keys=mali,opencl,gpu -device=mali -max_num_threads=256", "tutorial/conv2d_no_batching", [1, 40, 40, 512, 256, 3, 3, [1, 1], [1, 1]], {}], "config": {"index": 24625, "code_hash": null, "entity": [["tile_bna", "ot", 1], ["tile_bnb", "ot", 1], ["tile_t1", "sp", [-1, 2]], ["tile_t2", "sp", [-1, 8]], ["c_unroll", "sp", [-1, 8]], ["yt", "ot", 8]]}, "result": [[0.29247297699999997], 0, 141.73189043998718, 1612186574.2963798], "version": 0.2, "tvm_version": "0.8.dev0"}
{"input": ["opencl -keys=mali,opencl,gpu -device=mali -max_num_threads=256", "tutorial/conv2d_no_batching", [1, 40, 40, 512, 256, 3, 3, [1, 1], [1, 1]], {}], "config": {"index": 8060, "code_hash": null, "entity": [["tile_bna", "ot", 1], ["tile_bnb", "ot", 4], ["tile_t1", "sp", [-1, 4]], ["tile_t2", "sp", [-1, 1]], ["c_unroll", "sp", [-1, 2]], ["yt", "ot", 2]]}, "result": [[0.3886794241], 0, 224.6840238571167, 1612186657.6484256], "version": 0.2, "tvm_version": "0.8.dev0"}
{"input": ["opencl -keys=mali,opencl,gpu -device=mali -max_num_threads=256", "tutorial/conv2d_no_batching", [1, 40, 40, 512, 256, 3, 3, [1, 1], [1, 1]], {}], "config": {"index": 22469, "code_hash": null, "entity": [["tile_bna", "ot", 16], ["tile_bnb", "ot", 8], ["tile_t1", "sp", [-1, 4]], ["tile_t2", "sp", [-1, 1]], ["c_unroll", "sp", [-1, 4]], ["yt", "ot", 8]]}, "result": [[0.5682226087], 0, 253.09761548042297, 1612186684.5939898], "version": 0.2, "tvm_version": "0.8.dev0"}
{"input": ["opencl -keys=mali,opencl,gpu -device=mali -max_num_threads=256", "tutorial/conv2d_no_batching", [1, 40, 40, 512, 256, 3, 3, [1, 1], [1, 1]], {}], "config": {"index": 8134, "code_hash": null, "entity": [["tile_bna", "ot", 16], ["tile_bnb", "ot", 2], ["tile_t1", "sp", [-1, 32]], ["tile_t2", "sp", [-1, 1]], ["c_unroll", "sp", [-1, 2]], ["yt", "ot", 2]]}, "result": [[0.5773736201], 0, 67.69922757148743, 1612186498.7127929], "version": 0.2, "tvm_version": "0.8.dev0"}
{"input": ["opencl -keys=mali,opencl,gpu -device=mali -max_num_threads=256", "tutorial/conv2d_no_batching", [1, 40, 40, 512, 256, 3, 3, [1, 1], [1, 1]], {}], "config": {"index": 23975, "code_hash": null, "entity": [["tile_bna", "ot", 1], ["tile_bnb", "ot", 1], ["tile_t1", "sp", [-1, 128]], ["tile_t2", "sp", [-1, 128]], ["c_unroll", "sp", [-1, 4]], ["yt", "ot", 8]]}, "result": [[0.31882615150000004], 0, 205.23294806480408, 1612186638.5344565], "version": 0.2, "tvm_version": "0.8.dev0"}
{"input": ["opencl -keys=mali,opencl,gpu -device=mali -max_num_threads=256", "tutorial/conv2d_no_batching", [1, 40, 40, 512, 256, 3, 3, [1, 1], [1, 1]], {}], "config": {"index": 21990, "code_hash": null, "entity": [["tile_bna", "ot", 1], ["tile_bnb", "ot", 8], ["tile_t1", "sp", [-1, 128]], ["tile_t2", "sp", [-1, 32]], ["c_unroll", "sp", [-1, 2]], ["yt", "ot", 8]]}, "result": [[0.0939091812], 0, 167.16693019866943, 1612186599.6106951], "version": 0.2, "tvm_version": "0.8.dev0"}
{"input": ["opencl -keys=mali,opencl,gpu -device=mali -max_num_threads=256", "tutorial/conv2d_no_batching", [1, 40, 40, 512, 256, 3, 3, [1, 1], [1, 1]], {}], "config": {"index": 25507, "code_hash": null, "entity": [["tile_bna", "ot", 4], ["tile_bnb", "ot", 2], ["tile_t1", "sp", [-1, 16]], ["tile_t2", "sp", [-1, 128]], ["c_unroll", "sp", [-1, 8]], ["yt", "ot", 8]]}, "result": [[0.1451894989], 0, 189.72185277938843, 1612186621.7206285], "version": 0.2, "tvm_version": "0.8.dev0"}
{"input": ["opencl -keys=mali,opencl,gpu -device=mali -max_num_threads=256", "tutorial/conv2d_no_batching", [1, 40, 40, 512, 256, 3, 3, [1, 1], [1, 1]], {}], "config": {"index": 18732, "code_hash": null, "entity": [["tile_bna", "ot", 4], ["tile_bnb", "ot", 2], ["tile_t1", "sp", [-1, 32]], ["tile_t2", "sp", [-1, 32]], ["c_unroll", "sp", [-1, 8]], ["yt", "ot", 4]]}, "result": [[0.2254730902], 0, 156.86483716964722, 1612186588.620254], "version": 0.2, "tvm_version": "0.8.dev0"}
{"input": ["opencl -keys=mali,opencl,gpu -device=mali -max_num_threads=256", "tutorial/conv2d_no_batching", [1, 40, 40, 512, 256, 3, 3, [1, 1], [1, 1]], {}], "config": {"index": 19060, "code_hash": null, "entity": [["tile_bna", "ot", 1], ["tile_bnb", "ot", 4], ["tile_t1", "sp", [-1, 4]], ["tile_t2", "sp", [-1, 128]], ["c_unroll", "sp", [-1, 8]], ["yt", "ot", 4]]}, "result": [[0.18019917940000002], 0, 40.68625235557556, 1612186472.8010373], "version": 0.2, "tvm_version": "0.8.dev0"}
{"input": ["opencl -keys=mali,opencl,gpu -device=mali -max_num_threads=256", "tutorial/conv2d_no_batching", [1, 40, 40, 512, 256, 3, 3, [1, 1], [1, 1]], {}], "config": {"index": 18583, "code_hash": null, "entity": [["tile_bna", "ot", 8], ["tile_bnb", "ot", 2], ["tile_t1", "sp", [-1, 128]], ["tile_t2", "sp", [-1, 16]], ["c_unroll", "sp", [-1, 8]], ["yt", "ot", 4]]}, "result": [[0.2647456513], 0, 350.9056680202484, 1612187107.503693], "version": 0.2, "tvm_version": "0.8.dev0"}
{"input": ["opencl -keys=mali,opencl,gpu -device=mali -max_num_threads=256", "tutorial/conv2d_no_batching", [1, 40, 40, 512, 256, 3, 3, [1, 1], [1, 1]], {}], "config": {"index": 19628, "code_hash": null, "entity": [["tile_bna", "ot", 8], ["tile_bnb", "ot", 1], ["tile_t1", "sp", [-1, 2]], ["tile_t2", "sp", [-1, 4]], ["c_unroll", "sp", [-1, 1]], ["yt", "ot", 8]]}, "result": [[0.25873095290000003], 0, 264.25394654273987, 1612187021.2493382], "version": 0.2, "tvm_version": "0.8.dev0"}
{"input": ["opencl -keys=mali,opencl,gpu -device=mali -max_num_threads=256", "tutorial/conv2d_no_batching", [1, 40, 40, 512, 256, 3, 3, [1, 1], [1, 1]], {}], "config": {"index": 26466, "code_hash": null, "entity": [["tile_bna", "ot", 2], ["tile_bnb", "ot", 8], ["tile_t1", "sp", [-1, 4]], ["tile_t2", "sp", [-1, 16]], ["c_unroll", "sp", [-1, 1]], ["yt", "ot", 16]]}, "result": [[0.3080629265], 0, 175.89191579818726, 1612186932.1516461], "version": 0.2, "tvm_version": "0.8.dev0"}
{"input": ["opencl -keys=mali,opencl,gpu -device=mali -max_num_threads=256", "tutorial/conv2d_no_batching", [1, 40, 40, 512, 256, 3, 3, [1, 1], [1, 1]], {}], "config": {"index": 3131, "code_hash": null, "entity": [["tile_bna", "ot", 2], ["tile_bnb", "ot", 2], ["tile_t1", "sp", [-1, 32]], ["tile_t2", "sp", [-1, 128]], ["c_unroll", "sp", [-1, 2]], ["yt", "ot", 1]]}, "result": [[1.0218822736], 0, 232.58745980262756, 1612186989.9606616], "version": 0.2, "tvm_version": "0.8.dev0"}
{"input": ["opencl -keys=mali,opencl,gpu -device=mali -max_num_threads=256", "tutorial/conv2d_no_batching", [1, 40, 40, 512, 256, 3, 3, [1, 1], [1, 1]], {}], "config": {"index": 15777, "code_hash": null, "entity": [["tile_bna", "ot", 4], ["tile_bnb", "ot", 1], ["tile_t1", "sp", [-1, 128]], ["tile_t2", "sp", [-1, 64]], ["c_unroll", "sp", [-1, 2]], ["yt", "ot", 4]]}, "result": [[0.3863937312], 0, 193.60390162467957, 1612186951.1972153], "version": 0.2, "tvm_version": "0.8.dev0"}
{"input": ["opencl -keys=mali,opencl,gpu -device=mali -max_num_threads=256", "tutorial/conv2d_no_batching", [1, 40, 40, 512, 256, 3, 3, [1, 1], [1, 1]], {}], "config": {"index": 36402, "code_hash": null, "entity": [["tile_bna", "ot", 4], ["tile_bnb", "ot", 1], ["tile_t1", "sp", [-1, 1]], ["tile_t2", "sp", [-1, 64]], ["c_unroll", "sp", [-1, 4]], ["yt", "ot", 32]]}, "result": [[0.2752400691], 0, 22.153882265090942, 1612186779.495004], "version": 0.2, "tvm_version": "0.8.dev0"}
{"input": ["opencl -keys=mali,opencl,gpu -device=mali -max_num_threads=256", "tutorial/conv2d_no_batching", [1, 40, 40, 512, 256, 3, 3, [1, 1], [1, 1]], {}], "config": {"index": 12029, "code_hash": null, "entity": [["tile_bna", "ot", 16], ["tile_bnb", "ot", 1], ["tile_t1", "sp", [-1, 2]], ["tile_t2", "sp", [-1, 16]], ["c_unroll", "sp", [-1, 8]], ["yt", "ot", 2]]}, "result": [[2.0161115029000003], 0, 335.1394636631012, 1612187091.7395623], "version": 0.2, "tvm_version": "0.8.dev0"}
{"input": ["opencl -keys=mali,opencl,gpu -device=mali -max_num_threads=256", "tutorial/conv2d_no_batching", [1, 40, 40, 512, 256, 3, 3, [1, 1], [1, 1]], {}], "config": {"index": 3317, "code_hash": null, "entity": [["tile_bna", "ot", 4], ["tile_bnb", "ot", 8], ["tile_t1", "sp", [-1, 16]], ["tile_t2", "sp", [-1, 1]], ["c_unroll", "sp", [-1, 4]], ["yt", "ot", 1]]}, "result": [[0.41424831729999995], 0, 157.8022689819336, 1612186914.5047934], "version": 0.2, "tvm_version": "0.8.dev0"}
{"input": ["opencl -keys=mali,opencl,gpu -device=mali -max_num_threads=256", "tutorial/conv2d_no_batching", [1, 40, 40, 512, 256, 3, 3, [1, 1], [1, 1]], {}], "config": {"index": 17576, "code_hash": null, "entity": [["tile_bna", "ot", 2], ["tile_bnb", "ot", 1], ["tile_t1", "sp", [-1, 128]], ["tile_t2", "sp", [-1, 128]], ["c_unroll", "sp", [-1, 4]], ["yt", "ot", 4]]}, "result": [[0.4643142546], 0, 383.42828392982483, 1612187141.115458], "version": 0.2, "tvm_version": "0.8.dev0"}
{"input": ["opencl -keys=mali,opencl,gpu -device=mali -max_num_threads=256", "tutorial/conv2d_no_batching", [1, 40, 40, 512, 256, 3, 3, [1, 1], [1, 1]], {}], "config": {"index": 15100, "code_hash": null, "entity": [["tile_bna", "ot", 1], ["tile_bnb", "ot", 1], ["tile_t1", "sp", [-1, 16]], ["tile_t2", "sp", [-1, 8]], ["c_unroll", "sp", [-1, 2]], ["yt", "ot", 4]]}, "result": [[0.6489140334], 0, 70.90307116508484, 1612186828.9455562], "version": 0.2, "tvm_version": "0.8.dev0"}
{"input": ["opencl -keys=mali,opencl,gpu -device=mali -max_num_threads=256", "tutorial/conv2d_no_batching", [1, 40, 40, 512, 256, 3, 3, [1, 1], [1, 1]], {}], "config": {"index": 710, "code_hash": null, "entity": [["tile_bna", "ot", 1], ["tile_bnb", "ot", 4], ["tile_t1", "sp", [-1, 16]], ["tile_t2", "sp", [-1, 8]], ["c_unroll", "sp", [-1, 1]], ["yt", "ot", 1]]}, "result": [[0.9814758165], 0, 135.67713856697083, 1612186893.3163052], "version": 0.2, "tvm_version": "0.8.dev0"}
{"input": ["opencl -keys=mali,opencl,gpu -device=mali -max_num_threads=256", "tutorial/conv2d_no_batching", [1, 40, 40, 512, 256, 3, 3, [1, 1], [1, 1]], {}], "config": {"index": 22730, "code_hash": null, "entity": [["tile_bna", "ot", 1], ["tile_bnb", "ot", 2], ["tile_t1", "sp", [-1, 32]], ["tile_t2", "sp", [-1, 2]], ["c_unroll", "sp", [-1, 4]], ["yt", "ot", 8]]}, "result": [[0.1770051114], 0, 362.6883463859558, 1612187120.0313098], "version": 0.2, "tvm_version": "0.8.dev0"}
{"input": ["opencl -keys=mali,opencl,gpu -device=mali -max_num_threads=256", "tutorial/conv2d_no_batching", [1, 40, 40, 512, 256, 3, 3, [1, 1], [1, 1]], {}], "config": {"index": 31841, "code_hash": null, "entity": [["tile_bna", "ot", 2], ["tile_bnb", "ot", 8], ["tile_t1", "sp", [-1, 2]], ["tile_t2", "sp", [-1, 128]], ["c_unroll", "sp", [-1, 8]], ["yt", "ot", 16]]}, "result": [[0.6058989406], 0, 98.63238143920898, 1612186855.9079108], "version": 0.2, "tvm_version": "0.8.dev0"}
{"input": ["opencl -keys=mali,opencl,gpu -device=mali -max_num_threads=256", "tutorial/conv2d_no_batching", [1, 40, 40, 512, 256, 3, 3, [1, 1], [1, 1]], {}], "config": {"index": 13693, "code_hash": null, "entity": [["tile_bna", "ot", 8], ["tile_bnb", "ot", 8], ["tile_t1", "sp", [-1, 8]], ["tile_t2", "sp", [-1, 16]], ["c_unroll", "sp", [-1, 1]], ["yt", "ot", 4]]}, "result": [[0.22723590800000001], 0, 249.27232122421265, 1612187005.8501859], "version": 0.2, "tvm_version": "0.8.dev0"}
{"input": ["opencl -keys=mali,opencl,gpu -device=mali -max_num_threads=256", "tutorial/conv2d_no_batching", [1, 40, 40, 512, 256, 3, 3, [1, 1], [1, 1]], {}], "config": {"index": 25801, "code_hash": null, "entity": [["tile_bna", "ot", 2], ["tile_bnb", "ot", 1], ["tile_t1", "sp", [-1, 1]], ["tile_t2", "sp", [-1, 2]], ["c_unroll", "sp", [-1, 1]], ["yt", "ot", 16]]}, "result": [[0.2732235689], 0, 247.88455963134766, 1612187406.8744555], "version": 0.2, "tvm_version": "0.8.dev0"}
{"input": ["opencl -keys=mali,opencl,gpu -device=mali -max_num_threads=256", "tutorial/conv2d_no_batching", [1, 40, 40, 512, 256, 3, 3, [1, 1], [1, 1]], {}], "config": {"index": 1885, "code_hash": null, "entity": [["tile_bna", "ot", 1], ["tile_bnb", "ot", 4], ["tile_t1", "sp", [-1, 8]], ["tile_t2", "sp", [-1, 2]], ["c_unroll", "sp", [-1, 2]], ["yt", "ot", 1]]}, "result": [[0.7293626299], 0, 193.56450629234314, 1612187352.119601], "version": 0.2, "tvm_version": "0.8.dev0"}
{"input": ["opencl -keys=mali,opencl,gpu -device=mali -max_num_threads=256", "tutorial/conv2d_no_batching", [1, 40, 40, 512, 256, 3, 3, [1, 1], [1, 1]], {}], "config": {"index": 12532, "code_hash": null, "entity": [["tile_bna", "ot", 4], ["tile_bnb", "ot", 2], ["tile_t1", "sp", [-1, 32]], ["tile_t2", "sp", [-1, 64]], ["c_unroll", "sp", [-1, 8]], ["yt", "ot", 2]]}, "result": [[0.4236281047], 0, 233.73176789283752, 1612187391.5656571], "version": 0.2, "tvm_version": "0.8.dev0"}
{"input": ["opencl -keys=mali,opencl,gpu -device=mali -max_num_threads=256", "tutorial/conv2d_no_batching", [1, 40, 40, 512, 256, 3, 3, [1, 1], [1, 1]], {}], "config": {"index": 3359, "code_hash": null, "entity": [["tile_bna", "ot", 16], ["tile_bnb", "ot", 2], ["tile_t1", "sp", [-1, 64]], ["tile_t2", "sp", [-1, 1]], ["c_unroll", "sp", [-1, 4]], ["yt", "ot", 1]]}, "result": [[1.4107739583], 0, 80.03130865097046, 1612187236.9700744], "version": 0.2, "tvm_version": "0.8.dev0"}
{"input": ["opencl -keys=mali,opencl,gpu -device=mali -max_num_threads=256", "tutorial/conv2d_no_batching", [1, 40, 40, 512, 256, 3, 3, [1, 1], [1, 1]], {}], "config": {"index": 33509, "code_hash": null, "entity": [["tile_bna", "ot", 16], ["tile_bnb", "ot", 2], ["tile_t1", "sp", [-1, 16]], ["tile_t2", "sp", [-1, 128]], ["c_unroll", "sp", [-1, 1]], ["yt", "ot", 32]]}, "result": [[0.2077517915], 0, 311.78914165496826, 1612187470.8675141], "version": 0.2, "tvm_version": "0.8.dev0"}
{"input": ["opencl -keys=mali,opencl,gpu -device=mali -max_num_threads=256", "tutorial/conv2d_no_batching", [1, 40, 40, 512, 256, 3, 3, [1, 1], [1, 1]], {}], "config": {"index": 18951, "code_hash": null, "entity": [["tile_bna", "ot", 2], ["tile_bnb", "ot", 1], ["tile_t1", "sp", [-1, 64]], ["tile_t2", "sp", [-1, 64]], ["c_unroll", "sp", [-1, 8]], ["yt", "ot", 4]]}, "result": [[0.42471907880000004], 0, 26.502031326293945, 1612187184.9937348], "version": 0.2, "tvm_version": "0.8.dev0"}
{"input": ["opencl -keys=mali,opencl,gpu -device=mali -max_num_threads=256", "tutorial/conv2d_no_batching", [1, 40, 40, 512, 256, 3, 3, [1, 1], [1, 1]], {}], "config": {"index": 24777, "code_hash": null, "entity": [["tile_bna", "ot", 4], ["tile_bnb", "ot", 1], ["tile_t1", "sp", [-1, 128]], ["tile_t2", "sp", [-1, 8]], ["c_unroll", "sp", [-1, 8]], ["yt", "ot", 8]]}, "result": [[0.2771260537], 0, 369.884801864624, 1612187529.4301178], "version": 0.2, "tvm_version": "0.8.dev0"}
{"input": ["opencl -keys=mali,opencl,gpu -device=mali -max_num_threads=256", "tutorial/conv2d_no_batching", [1, 40, 40, 512, 256, 3, 3, [1, 1], [1, 1]], {}], "config": {"index": 28730, "code_hash": null, "entity": [["tile_bna", "ot", 1], ["tile_bnb", "ot", 2], ["tile_t1", "sp", [-1, 32]], ["tile_t2", "sp", [-1, 128]], ["c_unroll", "sp", [-1, 2]], ["yt", "ot", 16]]}, "result": [[0.12254106950000002], 0, 89.43609023094177, 1612187247.8907588], "version": 0.2, "tvm_version": "0.8.dev0"}
{"input": ["opencl -keys=mali,opencl,gpu -device=mali -max_num_threads=256", "tutorial/conv2d_no_batching", [1, 40, 40, 512, 256, 3, 3, [1, 1], [1, 1]], {}], "config": {"index": 35329, "code_hash": null, "entity": [["tile_bna", "ot", 16], ["tile_bnb", "ot", 1], ["tile_t1", "sp", [-1, 32]], ["tile_t2", "sp", [-1, 1]], ["c_unroll", "sp", [-1, 4]], ["yt", "ot", 32]]}, "result": [[0.3661544011], 0, 213.29213094711304, 1612187371.0881824], "version": 0.2, "tvm_version": "0.8.dev0"}
{"input": ["opencl -keys=mali,opencl,gpu -device=mali -max_num_threads=256", "tutorial/conv2d_no_batching", [1, 40, 40, 512, 256, 3, 3, [1, 1], [1, 1]], {}], "config": {"index": 35927, "code_hash": null, "entity": [["tile_bna", "ot", 4], ["tile_bnb", "ot", 1], ["tile_t1", "sp", [-1, 32]], ["tile_t2", "sp", [-1, 8]], ["c_unroll", "sp", [-1, 4]], ["yt", "ot", 32]]}, "result": [[0.2627184376], 0, 353.7192749977112, 1612187513.7970362], "version": 0.2, "tvm_version": "0.8.dev0"}
{"input": ["opencl -keys=mali,opencl,gpu -device=mali -max_num_threads=256", "tutorial/conv2d_no_batching", [1, 40, 40, 512, 256, 3, 3, [1, 1], [1, 1]], {}], "config": {"index": 36144, "code_hash": null, "entity": [["tile_bna", "ot", 16], ["tile_bnb", "ot", 8], ["tile_t1", "sp", [-1, 32]], ["tile_t2", "sp", [-1, 16]], ["c_unroll", "sp", [-1, 4]], ["yt", "ot", 32]]}, "result": [[0.2784989028], 0, 330.52900671958923, 1612187488.8672168], "version": 0.2, "tvm_version": "0.8.dev0"}
{"input": ["opencl -keys=mali,opencl,gpu -device=mali -max_num_threads=256", "tutorial/conv2d_no_batching", [1, 40, 40, 512, 256, 3, 3, [1, 1], [1, 1]], {}], "config": {"index": 701, "code_hash": null, "entity": [["tile_bna", "ot", 2], ["tile_bnb", "ot", 1], ["tile_t1", "sp", [-1, 16]], ["tile_t2", "sp", [-1, 8]], ["c_unroll", "sp", [-1, 1]], ["yt", "ot", 1]]}, "result": [[2.1857811553], 0, 163.5249502658844, 1612187322.5786834], "version": 0.2, "tvm_version": "0.8.dev0"}
{"input": ["opencl -keys=mali,opencl,gpu -device=mali -max_num_threads=256", "tutorial/conv2d_no_batching", [1, 40, 40, 512, 256, 3, 3, [1, 1], [1, 1]], {}], "config": {"index": 23275, "code_hash": null, "entity": [["tile_bna", "ot", 1], ["tile_bnb", "ot", 1], ["tile_t1", "sp", [-1, 8]], ["tile_t2", "sp", [-1, 16]], ["c_unroll", "sp", [-1, 4]], ["yt", "ot", 8]]}, "result": [[0.3131262916], 0, 44.48270392417908, 1612187588.6706626], "version": 0.2, "tvm_version": "0.8.dev0"}
{"input": ["opencl -keys=mali,opencl,gpu -device=mali -max_num_threads=256", "tutorial/conv2d_no_batching", [1, 40, 40, 512, 256, 3, 3, [1, 1], [1, 1]], {}], "config": {"index": 24958, "code_hash": null, "entity": [["tile_bna", "ot", 8], ["tile_bnb", "ot", 2], ["tile_t1", "sp", [-1, 64]], ["tile_t2", "sp", [-1, 16]], ["c_unroll", "sp", [-1, 8]], ["yt", "ot", 8]]}, "result": [[0.1806291378], 0, 91.82243323326111, 1612187634.855112], "version": 0.2, "tvm_version": "0.8.dev0"}
{"input": ["opencl -keys=mali,opencl,gpu -device=mali -max_num_threads=256", "tutorial/conv2d_no_batching", [1, 40, 40, 512, 256, 3, 3, [1, 1], [1, 1]], {}], "config": {"index": 1228, "code_hash": null, "entity": [["tile_bna", "ot", 8], ["tile_bnb", "ot", 1], ["tile_t1", "sp", [-1, 2]], ["tile_t2", "sp", [-1, 64]], ["c_unroll", "sp", [-1, 1]], ["yt", "ot", 1]]}, "result": [[1.3895562791], 0, 141.36109018325806, 1612187685.2232888], "version": 0.2, "tvm_version": "0.8.dev0"}
{"input": ["opencl -keys=mali,opencl,gpu -device=mali -max_num_threads=256", "tutorial/conv2d_no_batching", [1, 40, 40, 512, 256, 3, 3, [1, 1], [1, 1]], {}], "config": {"index": 33809, "code_hash": null, "entity": [["tile_bna", "ot", 16], ["tile_bnb", "ot", 2], ["tile_t1", "sp", [-1, 1]], ["tile_t2", "sp", [-1, 2]], ["c_unroll", "sp", [-1, 2]], ["yt", "ot", 32]]}, "result": [[0.24535480569999998], 0, 62.00730323791504, 1612187604.4068418], "version": 0.2, "tvm_version": "0.8.dev0"}
{"input": ["opencl -keys=mali,opencl,gpu -device=mali -max_num_threads=256", "tutorial/conv2d_no_batching", [1, 40, 40, 512, 256, 3, 3, [1, 1], [1, 1]], {}], "config": {"index": 24286, "code_hash": null, "entity": [["tile_bna", "ot", 2], ["tile_bnb", "ot", 4], ["tile_t1", "sp", [-1, 8]], ["tile_t2", "sp", [-1, 2]], ["c_unroll", "sp", [-1, 8]], ["yt", "ot", 8]]}, "result": [[0.084789946], 0, 296.1645793914795, 1612187840.6564276], "version": 0.2, "tvm_version": "0.8.dev0"}
{"input": ["opencl -keys=mali,opencl,gpu -device=mali -max_num_threads=256", "tutorial/conv2d_no_batching", [1, 40, 40, 512, 256, 3, 3, [1, 1], [1, 1]], {}], "config": {"index": 5363, "code_hash": null, "entity": [["tile_bna", "ot", 8], ["tile_bnb", "ot", 4], ["tile_t1", "sp", [-1, 64]], ["tile_t2", "sp", [-1, 4]], ["c_unroll", "sp", [-1, 8]], ["yt", "ot", 1]]}, "result": [[0.5905605483999999], 0, 178.1569859981537, 1612187721.8312116], "version": 0.2, "tvm_version": "0.8.dev0"}
{"input": ["opencl -keys=mali,opencl,gpu -device=mali -max_num_threads=256", "tutorial/conv2d_no_batching", [1, 40, 40, 512, 256, 3, 3, [1, 1], [1, 1]], {}], "config": {"index": 11544, "code_hash": null, "entity": [["tile_bna", "ot", 16], ["tile_bnb", "ot", 8], ["tile_t1", "sp", [-1, 32]], ["tile_t2", "sp", [-1, 2]], ["c_unroll", "sp", [-1, 8]], ["yt", "ot", 2]]}, "result": [[1.3648457662], 0, 255.2406177520752, 1612187797.9649496], "version": 0.2, "tvm_version": "0.8.dev0"}
{"input": ["opencl -keys=mali,opencl,gpu -device=mali -max_num_threads=256", "tutorial/conv2d_no_batching", [1, 40, 40, 512, 256, 3, 3, [1, 1], [1, 1]], {}], "config": {"index": 3513, "code_hash": null, "entity": [["tile_bna", "ot", 8], ["tile_bnb", "ot", 4], ["tile_t1", "sp", [-1, 16]], ["tile_t2", "sp", [-1, 2]], ["c_unroll", "sp", [-1, 4]], ["yt", "ot", 1]]}, "result": [[0.558393514], 0, 202.82657027244568, 1612187746.3861825], "version": 0.2, "tvm_version": "0.8.dev0"}
{"input": ["opencl -keys=mali,opencl,gpu -device=mali -max_num_threads=256", "tutorial/conv2d_no_batching", [1, 40, 40, 512, 256, 3, 3, [1, 1], [1, 1]], {}], "config": {"index": 23659, "code_hash": null, "entity": [["tile_bna", "ot", 16], ["tile_bnb", "ot", 2], ["tile_t1", "sp", [-1, 4]], ["tile_t2", "sp", [-1, 64]], ["c_unroll", "sp", [-1, 4]], ["yt", "ot", 8]]}, "result": [[0.2908113883], 0, 79.41881775856018, 1612187621.492234], "version": 0.2, "tvm_version": "0.8.dev0"}
{"input": ["opencl -keys=mali,opencl,gpu -device=mali -max_num_threads=256", "tutorial/conv2d_no_batching", [1, 40, 40, 512, 256, 3, 3, [1, 1], [1, 1]], {}], "config": {"index": 33255, "code_hash": null, "entity": [["tile_bna", "ot", 1], ["tile_bnb", "ot", 2], ["tile_t1", "sp", [-1, 4]], ["tile_t2", "sp", [-1, 64]], ["c_unroll", "sp", [-1, 1]], ["yt", "ot", 32]]}, "result": [[0.1217536736], 0, 151.66583156585693, 1612187696.2158659], "version": 0.2, "tvm_version": "0.8.dev0"}
{"input": ["opencl -keys=mali,opencl,gpu -device=mali -max_num_threads=256", "tutorial/conv2d_no_batching", [1, 40, 40, 512, 256, 3, 3, [1, 1], [1, 1]], {}], "config": {"index": 30625, "code_hash": null, "entity": [["tile_bna", "ot", 1], ["tile_bnb", "ot", 1], ["tile_t1", "sp", [-1, 2]], ["tile_t2", "sp", [-1, 2]], ["c_unroll", "sp", [-1, 8]], ["yt", "ot", 16]]}, "result": [[0.23382681500000002], 0, 310.72027373313904, 1612187854.2946732], "version": 0.2, "tvm_version": "0.8.dev0"}
{"input": ["opencl -keys=mali,opencl,gpu -device=mali -max_num_threads=256", "tutorial/conv2d_no_batching", [1, 40, 40, 512, 256, 3, 3, [1, 1], [1, 1]], {}], "config": {"index": 19681, "code_hash": null, "entity": [["tile_bna", "ot", 2], ["tile_bnb", "ot", 2], ["tile_t1", "sp", [-1, 8]], ["tile_t2", "sp", [-1, 4]], ["c_unroll", "sp", [-1, 1]], ["yt", "ot", 8]]}, "result": [[0.1686409647], 0, 265.43980598449707, 1612187809.8539305], "version": 0.2, "tvm_version": "0.8.dev0"}
{"input": ["opencl -keys=mali,opencl,gpu -device=mali -max_num_threads=256", "tutorial/conv2d_no_batching", [1, 40, 40, 512, 256, 3, 3, [1, 1], [1, 1]], {}], "config": {"index": 25457, "code_hash": null, "entity": [["tile_bna", "ot", 4], ["tile_bnb", "ot", 2], ["tile_t1", "sp", [-1, 4]], ["tile_t2", "sp", [-1, 128]], ["c_unroll", "sp", [-1, 8]], ["yt", "ot", 8]]}, "result": [[0.1471380719], 0, 29.91304612159729, 1612188636.1049602], "version": 0.2, "tvm_version": "0.8.dev0"}
{"input": ["opencl -keys=mali,opencl,gpu -device=mali -max_num_threads=256", "tutorial/conv2d_no_batching", [1, 40, 40, 512, 256, 3, 3, [1, 1], [1, 1]], {}], "config": {"index": 25461, "code_hash": null, "entity": [["tile_bna", "ot", 2], ["tile_bnb", "ot", 4], ["tile_t1", "sp", [-1, 4]], ["tile_t2", "sp", [-1, 128]], ["c_unroll", "sp", [-1, 8]], ["yt", "ot", 8]]}, "result": [[0.0848836282], 0, 170.21403908729553, 1612188777.0465446], "version": 0.2, "tvm_version": "0.8.dev0"}
{"input": ["opencl -keys=mali,opencl,gpu -device=mali -max_num_threads=256", "tutorial/conv2d_no_batching", [1, 40, 40, 512, 256, 3, 3, [1, 1], [1, 1]], {}], "config": {"index": 25486, "code_hash": null, "entity": [["tile_bna", "ot", 2], ["tile_bnb", "ot", 4], ["tile_t1", "sp", [-1, 8]], ["tile_t2", "sp", [-1, 128]], ["c_unroll", "sp", [-1, 8]], ["yt", "ot", 8]]}, "result": [[0.0800394611], 0, 79.69978380203247, 1612188686.1403606], "version": 0.2, "tvm_version": "0.8.dev0"}
{"input": ["opencl -keys=mali,opencl,gpu -device=mali -max_num_threads=256", "tutorial/conv2d_no_batching", [1, 40, 40, 512, 256, 3, 3, [1, 1], [1, 1]], {}], "config": {"index": 25482, "code_hash": null, "entity": [["tile_bna", "ot", 4], ["tile_bnb", "ot", 2], ["tile_t1", "sp", [-1, 8]], ["tile_t2", "sp", [-1, 128]], ["c_unroll", "sp", [-1, 8]], ["yt", "ot", 8]]}, "result": [[0.1447329571], 0, 193.99638390541077, 1612188800.8572252], "version": 0.2, "tvm_version": "0.8.dev0"}
{"input": ["opencl -keys=mali,opencl,gpu -device=mali -max_num_threads=256", "tutorial/conv2d_no_batching", [1, 40, 40, 512, 256, 3, 3, [1, 1], [1, 1]], {}], "config": {"index": 24257, "code_hash": null, "entity": [["tile_bna", "ot", 4], ["tile_bnb", "ot", 2], ["tile_t1", "sp", [-1, 4]], ["tile_t2", "sp", [-1, 2]], ["c_unroll", "sp", [-1, 8]], ["yt", "ot", 8]]}, "result": [[0.1522813902], 0, 182.33483362197876, 1612188789.124884], "version": 0.2, "tvm_version": "0.8.dev0"}
{"input": ["opencl -keys=mali,opencl,gpu -device=mali -max_num_threads=256", "tutorial/conv2d_no_batching", [1, 40, 40, 512, 256, 3, 3, [1, 1], [1, 1]], {}], "config": {"index": 21057, "code_hash": null, "entity": [["tile_bna", "ot", 4], ["tile_bnb", "ot", 2], ["tile_t1", "sp", [-1, 4]], ["tile_t2", "sp", [-1, 2]], ["c_unroll", "sp", [-1, 2]], ["yt", "ot", 8]]}, "result": [[0.1379073783], 0, 160.95988631248474, 1612188767.2736216], "version": 0.2, "tvm_version": "0.8.dev0"}
{"input": ["opencl -keys=mali,opencl,gpu -device=mali -max_num_threads=256", "tutorial/conv2d_no_batching", [1, 40, 40, 512, 256, 3, 3, [1, 1], [1, 1]], {}], "config": {"index": 25465, "code_hash": null, "entity": [["tile_bna", "ot", 1], ["tile_bnb", "ot", 8], ["tile_t1", "sp", [-1, 4]], ["tile_t2", "sp", [-1, 128]], ["c_unroll", "sp", [-1, 8]], ["yt", "ot", 8]]}, "result": [[0.3618833693], 0, 70.04140281677246, 1612188676.5630817], "version": 0.2, "tvm_version": "0.8.dev0"}
{"input": ["opencl -keys=mali,opencl,gpu -device=mali -max_num_threads=256", "tutorial/conv2d_no_batching", [1, 40, 40, 512, 256, 3, 3, [1, 1], [1, 1]], {}], "config": {"index": 21060, "code_hash": null, "entity": [["tile_bna", "ot", 1], ["tile_bnb", "ot", 4], ["tile_t1", "sp", [-1, 4]], ["tile_t2", "sp", [-1, 2]], ["c_unroll", "sp", [-1, 2]], ["yt", "ot", 8]]}, "result": [[0.12181763189999999], 0, 89.06057810783386, 1612188696.7368386], "version": 0.2, "tvm_version": "0.8.dev0"}
{"input": ["opencl -keys=mali,opencl,gpu -device=mali -max_num_threads=256", "tutorial/conv2d_no_batching", [1, 40, 40, 512, 256, 3, 3, [1, 1], [1, 1]], {}], "config": {"index": 24261, "code_hash": null, "entity": [["tile_bna", "ot", 2], ["tile_bnb", "ot", 4], ["tile_t1", "sp", [-1, 4]], ["tile_t2", "sp", [-1, 2]], ["c_unroll", "sp", [-1, 8]], ["yt", "ot", 8]]}, "result": [[0.0897768006], 0, 134.07918858528137, 1612188740.7188063], "version": 0.2, "tvm_version": "0.8.dev0"}
{"input": ["opencl -keys=mali,opencl,gpu -device=mali -max_num_threads=256", "tutorial/conv2d_no_batching", [1, 40, 40, 512, 256, 3, 3, [1, 1], [1, 1]], {}], "config": {"index": 25490, "code_hash": null, "entity": [["tile_bna", "ot", 1], ["tile_bnb", "ot", 8], ["tile_t1", "sp", [-1, 8]], ["tile_t2", "sp", [-1, 128]], ["c_unroll", "sp", [-1, 8]], ["yt", "ot", 8]]}, "result": [[0.22054100640000002], 0, 149.5645854473114, 1612188755.716615], "version": 0.2, "tvm_version": "0.8.dev0"}
{"input": ["opencl -keys=mali,opencl,gpu -device=mali -max_num_threads=256", "tutorial/conv2d_no_batching", [1, 40, 40, 512, 256, 3, 3, [1, 1], [1, 1]], {}], "config": {"index": 19460, "code_hash": null, "entity": [["tile_bna", "ot", 1], ["tile_bnb", "ot", 4], ["tile_t1", "sp", [-1, 4]], ["tile_t2", "sp", [-1, 2]], ["c_unroll", "sp", [-1, 1]], ["yt", "ot", 8]]}, "result": [[0.15846464600000001], 0, 124.13515329360962, 1612188731.2040465], "version": 0.2, "tvm_version": "0.8.dev0"}
{"input": ["opencl -keys=mali,opencl,gpu -device=mali -max_num_threads=256", "tutorial/conv2d_no_batching", [1, 40, 40, 512, 256, 3, 3, [1, 1], [1, 1]], {}], "config": {"index": 27480, "code_hash": null, "entity": [["tile_bna", "ot", 1], ["tile_bnb", "ot", 2], ["tile_t1", "sp", [-1, 8]], ["tile_t2", "sp", [-1, 2]], ["c_unroll", "sp", [-1, 2]], ["yt", "ot", 16]]}, "result": [[0.12327274669999999], 0, 40.494911909103394, 1612188647.2389164], "version": 0.2, "tvm_version": "0.8.dev0"}
{"input": ["opencl -keys=mali,opencl,gpu -device=mali -max_num_threads=256", "tutorial/conv2d_no_batching", [1, 40, 40, 512, 256, 3, 3, [1, 1], [1, 1]], {}], "config": {"index": 24282, "code_hash": null, "entity": [["tile_bna", "ot", 4], ["tile_bnb", "ot", 2], ["tile_t1", "sp", [-1, 8]], ["tile_t2", "sp", [-1, 2]], ["c_unroll", "sp", [-1, 8]], ["yt", "ot", 8]]}, "result": [[0.1497824264], 0, 112.89805006980896, 1612188719.6119118], "version": 0.2, "tvm_version": "0.8.dev0"}
{"input": ["opencl -keys=mali,opencl,gpu -device=mali -max_num_threads=256", "tutorial/conv2d_no_batching", [1, 40, 40, 512, 256, 3, 3, [1, 1], [1, 1]], {}], "config": {"index": 20857, "code_hash": null, "entity": [["tile_bna", "ot", 4], ["tile_bnb", "ot", 2], ["tile_t1", "sp", [-1, 4]], ["tile_t2", "sp", [-1, 1]], ["c_unroll", "sp", [-1, 2]], ["yt", "ot", 8]]}, "result": [[0.1431652382], 0, 101.51733589172363, 1612188708.1584535], "version": 0.2, "tvm_version": "0.8.dev0"}
{"input": ["opencl -keys=mali,opencl,gpu -device=mali -max_num_threads=256", "tutorial/conv2d_no_batching", [1, 40, 40, 512, 256, 3, 3, [1, 1], [1, 1]], {}], "config": {"index": 24457, "code_hash": null, "entity": [["tile_bna", "ot", 4], ["tile_bnb", "ot", 2], ["tile_t1", "sp", [-1, 4]], ["tile_t2", "sp", [-1, 4]], ["c_unroll", "sp", [-1, 8]], ["yt", "ot", 8]]}, "result": [[0.1494589523], 0, 18.241504907608032, 1612188624.600315], "version": 0.2, "tvm_version": "0.8.dev0"}
{"input": ["opencl -keys=mali,opencl,gpu -device=mali -max_num_threads=256", "tutorial/conv2d_no_batching", [1, 40, 40, 512, 256, 3, 3, [1, 1], [1, 1]], {}], "config": {"index": 27060, "code_hash": null, "entity": [["tile_bna", "ot", 1], ["tile_bnb", "ot", 4], ["tile_t1", "sp", [-1, 4]], ["tile_t2", "sp", [-1, 128]], ["c_unroll", "sp", [-1, 1]], ["yt", "ot", 16]]}, "result": [[0.0939700459], 0, 50.425212383270264, 1612188657.2549238], "version": 0.2, "tvm_version": "0.8.dev0"}
{"input": ["opencl -keys=mali,opencl,gpu -device=mali -max_num_threads=256", "tutorial/conv2d_no_batching", [1, 40, 40, 512, 256, 3, 3, [1, 1], [1, 1]], {}], "config": {"index": 27460, "code_hash": null, "entity": [["tile_bna", "ot", 1], ["tile_bnb", "ot", 4], ["tile_t1", "sp", [-1, 4]], ["tile_t2", "sp", [-1, 2]], ["c_unroll", "sp", [-1, 2]], ["yt", "ot", 16]]}, "result": [[0.0791055183], 0, 113.36224222183228, 1612188925.5170803], "version": 0.2, "tvm_version": "0.8.dev0"}
{"input": ["opencl -keys=mali,opencl,gpu -device=mali -max_num_threads=256", "tutorial/conv2d_no_batching", [1, 40, 40, 512, 256, 3, 3, [1, 1], [1, 1]], {}], "config": {"index": 21082, "code_hash": null, "entity": [["tile_bna", "ot", 4], ["tile_bnb", "ot", 2], ["tile_t1", "sp", [-1, 8]], ["tile_t2", "sp", [-1, 2]], ["c_unroll", "sp", [-1, 2]], ["yt", "ot", 8]]}, "result": [[0.13544521140000002], 0, 156.37857222557068, 1612188967.9479477], "version": 0.2, "tvm_version": "0.8.dev0"}
{"input": ["opencl -keys=mali,opencl,gpu -device=mali -max_num_threads=256", "tutorial/conv2d_no_batching", [1, 40, 40, 512, 256, 3, 3, [1, 1], [1, 1]], {}], "config": {"index": 22657, "code_hash": null, "entity": [["tile_bna", "ot", 4], ["tile_bnb", "ot", 2], ["tile_t1", "sp", [-1, 4]], ["tile_t2", "sp", [-1, 2]], ["c_unroll", "sp", [-1, 4]], ["yt", "ot", 8]]}, "result": [[0.1385545607], 0, 18.86397647857666, 1612188829.80561], "version": 0.2, "tvm_version": "0.8.dev0"}
{"input": ["opencl -keys=mali,opencl,gpu -device=mali -max_num_threads=256", "tutorial/conv2d_no_batching", [1, 40, 40, 512, 256, 3, 3, [1, 1], [1, 1]], {}], "config": {"index": 22257, "code_hash": null, "entity": [["tile_bna", "ot", 4], ["tile_bnb", "ot", 2], ["tile_t1", "sp", [-1, 4]], ["tile_t2", "sp", [-1, 128]], ["c_unroll", "sp", [-1, 2]], ["yt", "ot", 8]]}, "result": [[0.1336460602], 0, 179.07158660888672, 1612188990.095249], "version": 0.2, "tvm_version": "0.8.dev0"}
{"input": ["opencl -keys=mali,opencl,gpu -device=mali -max_num_threads=256", "tutorial/conv2d_no_batching", [1, 40, 40, 512, 256, 3, 3, [1, 1], [1, 1]], {}], "config": {"index": 21257, "code_hash": null, "entity": [["tile_bna", "ot", 4], ["tile_bnb", "ot", 2], ["tile_t1", "sp", [-1, 4]], ["tile_t2", "sp", [-1, 4]], ["c_unroll", "sp", [-1, 2]], ["yt", "ot", 8]]}, "result": [[0.1352685864], 0, 84.30436372756958, 1612188895.7245498], "version": 0.2, "tvm_version": "0.8.dev0"}
{"input": ["opencl -keys=mali,opencl,gpu -device=mali -max_num_threads=256", "tutorial/conv2d_no_batching", [1, 40, 40, 512, 256, 3, 3, [1, 1], [1, 1]], {}], "config": {"index": 28660, "code_hash": null, "entity": [["tile_bna", "ot", 1], ["tile_bnb", "ot", 4], ["tile_t1", "sp", [-1, 4]], ["tile_t2", "sp", [-1, 128]], ["c_unroll", "sp", [-1, 2]], ["yt", "ot", 16]]}, "result": [[0.0737148927], 0, 48.12665033340454, 1612188859.9814336], "version": 0.2, "tvm_version": "0.8.dev0"}
{"input": ["opencl -keys=mali,opencl,gpu -device=mali -max_num_threads=256", "tutorial/conv2d_no_batching", [1, 40, 40, 512, 256, 3, 3, [1, 1], [1, 1]], {}], "config": {"index": 27455, "code_hash": null, "entity": [["tile_bna", "ot", 1], ["tile_bnb", "ot", 2], ["tile_t1", "sp", [-1, 4]], ["tile_t2", "sp", [-1, 2]], ["c_unroll", "sp", [-1, 2]], ["yt", "ot", 16]]}, "result": [[0.1263109761], 0, 39.35402464866638, 1612188850.841128], "version": 0.2, "tvm_version": "0.8.dev0"}
{"input": ["opencl -keys=mali,opencl,gpu -device=mali -max_num_threads=256", "tutorial/conv2d_no_batching", [1, 40, 40, 512, 256, 3, 3, [1, 1], [1, 1]], {}], "config": {"index": 25860, "code_hash": null, "entity": [["tile_bna", "ot", 1], ["tile_bnb", "ot", 4], ["tile_t1", "sp", [-1, 4]], ["tile_t2", "sp", [-1, 2]], ["c_unroll", "sp", [-1, 1]], ["yt", "ot", 16]]}, "result": [[0.0966571399], 0, 27.653812885284424, 1612188839.6965215], "version": 0.2, "tvm_version": "0.8.dev0"}
{"input": ["opencl -keys=mali,opencl,gpu -device=mali -max_num_threads=256", "tutorial/conv2d_no_batching", [1, 40, 40, 512, 256, 3, 3, [1, 1], [1, 1]], {}], "config": {"index": 21260, "code_hash": null, "entity": [["tile_bna", "ot", 1], ["tile_bnb", "ot", 4], ["tile_t1", "sp", [-1, 4]], ["tile_t2", "sp", [-1, 4]], ["c_unroll", "sp", [-1, 2]], ["yt", "ot", 8]]}, "result": [[0.1185587306], 0, 94.22037506103516, 1612188906.3599358], "version": 0.2, "tvm_version": "0.8.dev0"}
{"input": ["opencl -keys=mali,opencl,gpu -device=mali -max_num_threads=256", "tutorial/conv2d_no_batching", [1, 40, 40, 512, 256, 3, 3, [1, 1], [1, 1]], {}], "config": {"index": 21056, "code_hash": null, "entity": [["tile_bna", "ot", 2], ["tile_bnb", "ot", 2], ["tile_t1", "sp", [-1, 4]], ["tile_t2", "sp", [-1, 2]], ["c_unroll", "sp", [-1, 2]], ["yt", "ot", 8]]}, "result": [[0.1613275005], 0, 60.65431070327759, 1612188872.3492014], "version": 0.2, "tvm_version": "0.8.dev0"}
{"input": ["opencl -keys=mali,opencl,gpu -device=mali -max_num_threads=256", "tutorial/conv2d_no_batching", [1, 40, 40, 512, 256, 3, 3, [1, 1], [1, 1]], {}], "config": {"index": 20681, "code_hash": null, "entity": [["tile_bna", "ot", 2], ["tile_bnb", "ot", 2], ["tile_t1", "sp", [-1, 8]], ["tile_t2", "sp", [-1, 128]], ["c_unroll", "sp", [-1, 1]], ["yt", "ot", 8]]}, "result": [[0.1664550791], 0, 144.97404789924622, 1612188956.4241421], "version": 0.2, "tvm_version": "0.8.dev0"}
{"input": ["opencl -keys=mali,opencl,gpu -device=mali -max_num_threads=256", "tutorial/conv2d_no_batching", [1, 40, 40, 512, 256, 3, 3, [1, 1], [1, 1]], {}], "config": {"index": 28680, "code_hash": null, "entity": [["tile_bna", "ot", 1], ["tile_bnb", "ot", 2], ["tile_t1", "sp", [-1, 8]], ["tile_t2", "sp", [-1, 128]], ["c_unroll", "sp", [-1, 2]], ["yt", "ot", 16]]}, "result": [[0.1187879025], 0, 166.81550097465515, 1612188978.72637], "version": 0.2, "tvm_version": "0.8.dev0"}
{"input": ["opencl -keys=mali,opencl,gpu -device=mali -max_num_threads=256", "tutorial/conv2d_no_batching", [1, 40, 40, 512, 256, 3, 3, [1, 1], [1, 1]], {}], "config": {"index": 24461, "code_hash": null, "entity": [["tile_bna", "ot", 2], ["tile_bnb", "ot", 4], ["tile_t1", "sp", [-1, 4]], ["tile_t2", "sp", [-1, 4]], ["c_unroll", "sp", [-1, 8]], ["yt", "ot", 8]]}, "result": [[0.0872760348], 0, 104.447420835495, 1612188916.161014], "version": 0.2, "tvm_version": "0.8.dev0"}
{"input": ["opencl -keys=mali,opencl,gpu -device=mali -max_num_threads=256", "tutorial/conv2d_no_batching", [1, 40, 40, 512, 256, 3, 3, [1, 1], [1, 1]], {}], "config": {"index": 24486, "code_hash": null, "entity": [["tile_bna", "ot", 2], ["tile_bnb", "ot", 4], ["tile_t1", "sp", [-1, 8]], ["tile_t2", "sp", [-1, 4]], ["c_unroll", "sp", [-1, 8]], ["yt", "ot", 8]]}, "result": [[0.0822559821], 0, 188.04373812675476, 1612188999.6572983], "version": 0.2, "tvm_version": "0.8.dev0"}
{"input": ["opencl -keys=mali,opencl,gpu -device=mali -max_num_threads=256", "tutorial/conv2d_no_batching", [1, 40, 40, 512, 256, 3, 3, [1, 1], [1, 1]], {}], "config": {"index": 21065, "code_hash": null, "entity": [["tile_bna", "ot", 1], ["tile_bnb", "ot", 8], ["tile_t1", "sp", [-1, 4]], ["tile_t2", "sp", [-1, 2]], ["c_unroll", "sp", [-1, 2]], ["yt", "ot", 8]]}, "result": [[0.3437719248], 0, 132.35329341888428, 1612188944.1931753], "version": 0.2, "tvm_version": "0.8.dev0"}
{"input": ["opencl -keys=mali,opencl,gpu -device=mali -max_num_threads=256", "tutorial/conv2d_no_batching", [1, 40, 40, 512, 256, 3, 3, [1, 1], [1, 1]], {}], "config": {"index": 20660, "code_hash": null, "entity": [["tile_bna", "ot", 1], ["tile_bnb", "ot", 4], ["tile_t1", "sp", [-1, 4]], ["tile_t2", "sp", [-1, 128]], ["c_unroll", "sp", [-1, 1]], ["yt", "ot", 8]]}, "result": [[0.15092416079999998], 0, 71.98573327064514, 1612188884.1196373], "version": 0.2, "tvm_version": "0.8.dev0"}
{"input": ["opencl -keys=mali,opencl,gpu -device=mali -max_num_threads=256", "tutorial/conv2d_no_batching", [1, 40, 40, 512, 256, 3, 3, [1, 1], [1, 1]], {}], "config": {"index": 19461, "code_hash": null, "entity": [["tile_bna", "ot", 2], ["tile_bnb", "ot", 4], ["tile_t1", "sp", [-1, 4]], ["tile_t2", "sp", [-1, 2]], ["c_unroll", "sp", [-1, 1]], ["yt", "ot", 8]]}, "result": [[0.1102933964], 0, 35.513248682022095, 1612189045.7021399], "version": 0.2, "tvm_version": "0.8.dev0"}
{"input": ["opencl -keys=mali,opencl,gpu -device=mali -max_num_threads=256", "tutorial/conv2d_no_batching", [1, 40, 40, 512, 256, 3, 3, [1, 1], [1, 1]], {}], "config": {"index": 20682, "code_hash": null, "entity": [["tile_bna", "ot", 4], ["tile_bnb", "ot", 2], ["tile_t1", "sp", [-1, 8]], ["tile_t2", "sp", [-1, 128]], ["c_unroll", "sp", [-1, 1]], ["yt", "ot", 8]]}, "result": [[0.15781043239999998], 0, 68.7903904914856, 1612189078.7091851], "version": 0.2, "tvm_version": "0.8.dev0"}
{"input": ["opencl -keys=mali,opencl,gpu -device=mali -max_num_threads=256", "tutorial/conv2d_no_batching", [1, 40, 40, 512, 256, 3, 3, [1, 1], [1, 1]], {}], "config": {"index": 22265, "code_hash": null, "entity": [["tile_bna", "ot", 1], ["tile_bnb", "ot", 8], ["tile_t1", "sp", [-1, 4]], ["tile_t2", "sp", [-1, 128]], ["c_unroll", "sp", [-1, 2]], ["yt", "ot", 8]]}, "result": [[0.33559492409999997], 0, 25.481250286102295, 1612189035.3320763], "version": 0.2, "tvm_version": "0.8.dev0"}
{"input": ["opencl -keys=mali,opencl,gpu -device=mali -max_num_threads=256", "tutorial/conv2d_no_batching", [1, 40, 40, 512, 256, 3, 3, [1, 1], [1, 1]], {}], "config": {"index": 20860, "code_hash": null, "entity": [["tile_bna", "ot", 1], ["tile_bnb", "ot", 4], ["tile_t1", "sp", [-1, 4]], ["tile_t2", "sp", [-1, 1]], ["c_unroll", "sp", [-1, 2]], ["yt", "ot", 8]]}, "result": [[0.126539674], 0, 103.02672791481018, 1612189113.5816813], "version": 0.2, "tvm_version": "0.8.dev0"}
{"input": ["opencl -keys=mali,opencl,gpu -device=mali -max_num_threads=256", "tutorial/conv2d_no_batching", [1, 40, 40, 512, 256, 3, 3, [1, 1], [1, 1]], {}], "config": {"index": 19660, "code_hash": null, "entity": [["tile_bna", "ot", 1], ["tile_bnb", "ot", 4], ["tile_t1", "sp", [-1, 4]], ["tile_t2", "sp", [-1, 4]], ["c_unroll", "sp", [-1, 1]], ["yt", "ot", 8]]}, "result": [[0.15607354680000002], 0, 162.33617448806763, 1612189172.9868186], "version": 0.2, "tvm_version": "0.8.dev0"}
{"input": ["opencl -keys=mali,opencl,gpu -device=mali -max_num_threads=256", "tutorial/conv2d_no_batching", [1, 40, 40, 512, 256, 3, 3, [1, 1], [1, 1]], {}], "config": {"index": 27680, "code_hash": null, "entity": [["tile_bna", "ot", 1], ["tile_bnb", "ot", 2], ["tile_t1", "sp", [-1, 8]], ["tile_t2", "sp", [-1, 4]], ["c_unroll", "sp", [-1, 2]], ["yt", "ot", 16]]}, "result": [[0.1209579548], 0, 150.73136830329895, 1612189161.2951112], "version": 0.2, "tvm_version": "0.8.dev0"}
{"input": ["opencl -keys=mali,opencl,gpu -device=mali -max_num_threads=256", "tutorial/conv2d_no_batching", [1, 40, 40, 512, 256, 3, 3, [1, 1], [1, 1]], {}], "config": {"index": 21061, "code_hash": null, "entity": [["tile_bna", "ot", 2], ["tile_bnb", "ot", 4], ["tile_t1", "sp", [-1, 4]], ["tile_t2", "sp", [-1, 2]], ["c_unroll", "sp", [-1, 2]], ["yt", "ot", 8]]}, "result": [[0.1002685517], 0, 193.71120405197144, 1612189204.0717998], "version": 0.2, "tvm_version": "0.8.dev0"}
{"input": ["opencl -keys=mali,opencl,gpu -device=mali -max_num_threads=256", "tutorial/conv2d_no_batching", [1, 40, 40, 512, 256, 3, 3, [1, 1], [1, 1]], {}], "config": {"index": 22260, "code_hash": null, "entity": [["tile_bna", "ot", 1], ["tile_bnb", "ot", 4], ["tile_t1", "sp", [-1, 4]], ["tile_t2", "sp", [-1, 128]], ["c_unroll", "sp", [-1, 2]], ["yt", "ot", 8]]}, "result": [[0.1165888137], 0, 113.46090292930603, 1612189123.9467256], "version": 0.2, "tvm_version": "0.8.dev0"}
{"input": ["opencl -keys=mali,opencl,gpu -device=mali -max_num_threads=256", "tutorial/conv2d_no_batching", [1, 40, 40, 512, 256, 3, 3, [1, 1], [1, 1]], {}], "config": {"index": 21090, "code_hash": null, "entity": [["tile_bna", "ot", 1], ["tile_bnb", "ot", 8], ["tile_t1", "sp", [-1, 8]], ["tile_t2", "sp", [-1, 2]], ["c_unroll", "sp", [-1, 2]], ["yt", "ot", 8]]}, "result": [[0.2015586711], 0, 140.39741587638855, 1612189150.430175], "version": 0.2, "tvm_version": "0.8.dev0"}
{"input": ["opencl -keys=mali,opencl,gpu -device=mali -max_num_threads=256", "tutorial/conv2d_no_batching", [1, 40, 40, 512, 256, 3, 3, [1, 1], [1, 1]], {}], "config": {"index": 24057, "code_hash": null, "entity": [["tile_bna", "ot", 4], ["tile_bnb", "ot", 2], ["tile_t1", "sp", [-1, 4]], ["tile_t2", "sp", [-1, 1]], ["c_unroll", "sp", [-1, 8]], ["yt", "ot", 8]]}, "result": [[0.1573591615], 0, 125.60467648506165, 1612189135.8115497], "version": 0.2, "tvm_version": "0.8.dev0"}
{"input": ["opencl -keys=mali,opencl,gpu -device=mali -max_num_threads=256", "tutorial/conv2d_no_batching", [1, 40, 40, 512, 256, 3, 3, [1, 1], [1, 1]], {}], "config": {"index": 20882, "code_hash": null, "entity": [["tile_bna", "ot", 4], ["tile_bnb", "ot", 2], ["tile_t1", "sp", [-1, 8]], ["tile_t2", "sp", [-1, 1]], ["c_unroll", "sp", [-1, 2]], ["yt", "ot", 8]]}, "result": [[0.1409319932], 0, 80.44750952720642, 1612189090.280565], "version": 0.2, "tvm_version": "0.8.dev0"}
{"input": ["opencl -keys=mali,opencl,gpu -device=mali -max_num_threads=256", "tutorial/conv2d_no_batching", [1, 40, 40, 512, 256, 3, 3, [1, 1], [1, 1]], {}], "config": {"index": 24482, "code_hash": null, "entity": [["tile_bna", "ot", 4], ["tile_bnb", "ot", 2], ["tile_t1", "sp", [-1, 8]], ["tile_t2", "sp", [-1, 4]], ["c_unroll", "sp", [-1, 8]], ["yt", "ot", 8]]}, "result": [[0.1470188167], 0, 174.8886375427246, 1612189184.8836331], "version": 0.2, "tvm_version": "0.8.dev0"}
{"input": ["opencl -keys=mali,opencl,gpu -device=mali -max_num_threads=256", "tutorial/conv2d_no_batching", [1, 40, 40, 512, 256, 3, 3, [1, 1], [1, 1]], {}], "config": {"index": 22457, "code_hash": null, "entity": [["tile_bna", "ot", 4], ["tile_bnb", "ot", 2], ["tile_t1", "sp", [-1, 4]], ["tile_t2", "sp", [-1, 1]], ["c_unroll", "sp", [-1, 4]], ["yt", "ot", 8]]}, "result": [[0.1427066965], 0, 47.21796727180481, 1612189057.2429812], "version": 0.2, "tvm_version": "0.8.dev0"}
{"input": ["opencl -keys=mali,opencl,gpu -device=mali -max_num_threads=256", "tutorial/conv2d_no_batching", [1, 40, 40, 512, 256, 3, 3, [1, 1], [1, 1]], {}], "config": {"index": 20656, "code_hash": null, "entity": [["tile_bna", "ot", 2], ["tile_bnb", "ot", 2], ["tile_t1", "sp", [-1, 4]], ["tile_t2", "sp", [-1, 128]], ["c_unroll", "sp", [-1, 1]], ["yt", "ot", 8]]}, "result": [[0.1722113192], 0, 92.43383264541626, 1612189102.7816129], "version": 0.2, "tvm_version": "0.8.dev0"}
{"input": ["opencl -keys=mali,opencl,gpu -device=mali -max_num_threads=256", "tutorial/conv2d_no_batching", [1, 40, 40, 512, 256, 3, 3, [1, 1], [1, 1]], {}], "config": {"index": 22661, "code_hash": null, "entity": [["tile_bna", "ot", 2], ["tile_bnb", "ot", 4], ["tile_t1", "sp", [-1, 4]], ["tile_t2", "sp", [-1, 2]], ["c_unroll", "sp", [-1, 4]], ["yt", "ot", 8]]}, "result": [[0.0888066651], 0, 56.74858522415161, 1612189066.7982683], "version": 0.2, "tvm_version": "0.8.dev0"}
{"input": ["opencl -keys=mali,opencl,gpu -device=mali -max_num_threads=256", "tutorial/conv2d_no_batching", [1, 40, 40, 512, 256, 3, 3, [1, 1], [1, 1]], {}], "config": {"index": 31885, "code_hash": null, "entity": [["tile_bna", "ot", 1], ["tile_bnb", "ot", 4], ["tile_t1", "sp", [-1, 8]], ["tile_t2", "sp", [-1, 128]], ["c_unroll", "sp", [-1, 8]], ["yt", "ot", 16]]}, "result": [[0.0660500326], 0, 183.73817133903503, 1612189193.860644], "version": 0.2, "tvm_version": "0.8.dev0"}
{"input": ["opencl -keys=mali,opencl,gpu -device=mali -max_num_threads=256", "tutorial/conv2d_no_batching", [1, 40, 40, 512, 256, 3, 3, [1, 1], [1, 1]], {}], "config": {"index": 30285, "code_hash": null, "entity": [["tile_bna", "ot", 1], ["tile_bnb", "ot", 4], ["tile_t1", "sp", [-1, 8]], ["tile_t2", "sp", [-1, 128]], ["c_unroll", "sp", [-1, 4]], ["yt", "ot", 16]]}, "result": [[0.0716446061], 0, 96.44120454788208, 1612189312.1566448], "version": 0.2, "tvm_version": "0.8.dev0"}
{"input": ["opencl -keys=mali,opencl,gpu -device=mali -max_num_threads=256", "tutorial/conv2d_no_batching", [1, 40, 40, 512, 256, 3, 3, [1, 1], [1, 1]], {}], "config": {"index": 27660, "code_hash": null, "entity": [["tile_bna", "ot", 1], ["tile_bnb", "ot", 4], ["tile_t1", "sp", [-1, 4]], ["tile_t2", "sp", [-1, 4]], ["c_unroll", "sp", [-1, 2]], ["yt", "ot", 16]]}, "result": [[0.0766614295], 0, 203.12668538093567, 1612189418.8349485], "version": 0.2, "tvm_version": "0.8.dev0"}
{"input": ["opencl -keys=mali,opencl,gpu -device=mali -max_num_threads=256", "tutorial/conv2d_no_batching", [1, 40, 40, 512, 256, 3, 3, [1, 1], [1, 1]], {}], "config": {"index": 22682, "code_hash": null, "entity": [["tile_bna", "ot", 4], ["tile_bnb", "ot", 2], ["tile_t1", "sp", [-1, 8]], ["tile_t2", "sp", [-1, 2]], ["c_unroll", "sp", [-1, 4]], ["yt", "ot", 8]]}, "result": [[0.1358107532], 0, 226.76347541809082, 1612189441.7497854], "version": 0.2, "tvm_version": "0.8.dev0"}
{"input": ["opencl -keys=mali,opencl,gpu -device=mali -max_num_threads=256", "tutorial/conv2d_no_batching", [1, 40, 40, 512, 256, 3, 3, [1, 1], [1, 1]], {}], "config": {"index": 28655, "code_hash": null, "entity": [["tile_bna", "ot", 1], ["tile_bnb", "ot", 2], ["tile_t1", "sp", [-1, 4]], ["tile_t2", "sp", [-1, 128]], ["c_unroll", "sp", [-1, 2]], ["yt", "ot", 16]]}, "result": [[0.12076845480000001], 0, 174.60878682136536, 1612189389.8411477], "version": 0.2, "tvm_version": "0.8.dev0"}
{"input": ["opencl -keys=mali,opencl,gpu -device=mali -max_num_threads=256", "tutorial/conv2d_no_batching", [1, 40, 40, 512, 256, 3, 3, [1, 1], [1, 1]], {}], "config": {"index": 22282, "code_hash": null, "entity": [["tile_bna", "ot", 4], ["tile_bnb", "ot", 2], ["tile_t1", "sp", [-1, 8]], ["tile_t2", "sp", [-1, 128]], ["c_unroll", "sp", [-1, 2]], ["yt", "ot", 8]]}, "result": [[0.1307851536], 0, 107.83395886421204, 1612189323.070398], "version": 0.2, "tvm_version": "0.8.dev0"}
{"input": ["opencl -keys=mali,opencl,gpu -device=mali -max_num_threads=256", "tutorial/conv2d_no_batching", [1, 40, 40, 512, 256, 3, 3, [1, 1], [1, 1]], {}], "config": {"index": 21282, "code_hash": null, "entity": [["tile_bna", "ot", 4], ["tile_bnb", "ot", 2], ["tile_t1", "sp", [-1, 8]], ["tile_t2", "sp", [-1, 4]], ["c_unroll", "sp", [-1, 2]], ["yt", "ot", 8]]}, "result": [[0.1329089611], 0, 45.79523587226868, 1612189260.51956], "version": 0.2, "tvm_version": "0.8.dev0"}
{"input": ["opencl -keys=mali,opencl,gpu -device=mali -max_num_threads=256", "tutorial/conv2d_no_batching", [1, 40, 40, 512, 256, 3, 3, [1, 1], [1, 1]], {}], "config": {"index": 22290, "code_hash": null, "entity": [["tile_bna", "ot", 1], ["tile_bnb", "ot", 8], ["tile_t1", "sp", [-1, 8]], ["tile_t2", "sp", [-1, 128]], ["c_unroll", "sp", [-1, 2]], ["yt", "ot", 8]]}, "result": [[0.1994345563], 0, 34.34440803527832, 1612189249.2927902], "version": 0.2, "tvm_version": "0.8.dev0"}
{"input": ["opencl -keys=mali,opencl,gpu -device=mali -max_num_threads=256", "tutorial/conv2d_no_batching", [1, 40, 40, 512, 256, 3, 3, [1, 1], [1, 1]], {}], "config": {"index": 21080, "code_hash": null, "entity": [["tile_bna", "ot", 1], ["tile_bnb", "ot", 2], ["tile_t1", "sp", [-1, 8]], ["tile_t2", "sp", [-1, 2]], ["c_unroll", "sp", [-1, 2]], ["yt", "ot", 8]]}, "result": [[0.1927049046], 0, 19.276952981948853, 1612189235.0038095], "version": 0.2, "tvm_version": "0.8.dev0"}
{"input": ["opencl -keys=mali,opencl,gpu -device=mali -max_num_threads=256", "tutorial/conv2d_no_batching", [1, 40, 40, 512, 256, 3, 3, [1, 1], [1, 1]], {}], "config": {"index": 23857, "code_hash": null, "entity": [["tile_bna", "ot", 4], ["tile_bnb", "ot", 2], ["tile_t1", "sp", [-1, 4]], ["tile_t2", "sp", [-1, 128]], ["c_unroll", "sp", [-1, 4]], ["yt", "ot", 8]]}, "result": [[0.13347186230000002], 0, 119.17037391662598, 1612189334.4201913], "version": 0.2, "tvm_version": "0.8.dev0"}
{"input": ["opencl -keys=mali,opencl,gpu -device=mali -max_num_threads=256", "tutorial/conv2d_no_batching", [1, 40, 40, 512, 256, 3, 3, [1, 1], [1, 1]], {}], "config": {"index": 22857, "code_hash": null, "entity": [["tile_bna", "ot", 4], ["tile_bnb", "ot", 2], ["tile_t1", "sp", [-1, 4]], ["tile_t2", "sp", [-1, 4]], ["c_unroll", "sp", [-1, 4]], ["yt", "ot", 8]]}, "result": [[0.13542500829999998], 0, 130.98298573493958, 1612189345.97218], "version": 0.2, "tvm_version": "0.8.dev0"}
{"input": ["opencl -keys=mali,opencl,gpu -device=mali -max_num_threads=256", "tutorial/conv2d_no_batching", [1, 40, 40, 512, 256, 3, 3, [1, 1], [1, 1]], {}], "config": {"index": 31857, "code_hash": null, "entity": [["tile_bna", "ot", 4], ["tile_bnb", "ot", 2], ["tile_t1", "sp", [-1, 4]], ["tile_t2", "sp", [-1, 128]], ["c_unroll", "sp", [-1, 8]], ["yt", "ot", 16]]}, "result": [[0.1325659663], 0, 215.24927854537964, 1612189430.2330215], "version": 0.2, "tvm_version": "0.8.dev0"}
{"input": ["opencl -keys=mali,opencl,gpu -device=mali -max_num_threads=256", "tutorial/conv2d_no_batching", [1, 40, 40, 512, 256, 3, 3, [1, 1], [1, 1]], {}], "config": {"index": 27085, "code_hash": null, "entity": [["tile_bna", "ot", 1], ["tile_bnb", "ot", 4], ["tile_t1", "sp", [-1, 8]], ["tile_t2", "sp", [-1, 128]], ["c_unroll", "sp", [-1, 1]], ["yt", "ot", 16]]}, "result": [[0.0875929775], 0, 54.61967635154724, 1612189270.1036468], "version": 0.2, "tvm_version": "0.8.dev0"}
{"input": ["opencl -keys=mali,opencl,gpu -device=mali -max_num_threads=256", "tutorial/conv2d_no_batching", [1, 40, 40, 512, 256, 3, 3, [1, 1], [1, 1]], {}], "config": {"index": 23865, "code_hash": null, "entity": [["tile_bna", "ot", 1], ["tile_bnb", "ot", 8], ["tile_t1", "sp", [-1, 4]], ["tile_t2", "sp", [-1, 128]], ["c_unroll", "sp", [-1, 4]], ["yt", "ot", 8]]}, "result": [[0.3706545734], 0, 194.15533804893494, 1612189409.5931504], "version": 0.2, "tvm_version": "0.8.dev0"}
{"input": ["opencl -keys=mali,opencl,gpu -device=mali -max_num_threads=256", "tutorial/conv2d_no_batching", [1, 40, 40, 512, 256, 3, 3, [1, 1], [1, 1]], {}], "config": {"index": 20304, "code_hash": null, "entity": [["tile_bna", "ot", 16], ["tile_bnb", "ot", 1], ["tile_t1", "sp", [-1, 16]], ["tile_t2", "sp", [-1, 32]], ["c_unroll", "sp", [-1, 1]], ["yt", "ot", 8]]}, "result": [[0.3288084807], 0, 88.45592832565308, 1612189303.3644586], "version": 0.2, "tvm_version": "0.8.dev0"}
{"input": ["opencl -keys=mali,opencl,gpu -device=mali -max_num_threads=256", "tutorial/conv2d_no_batching", [1, 40, 40, 512, 256, 3, 3, [1, 1], [1, 1]], {}], "config": {"index": 1807, "code_hash": null, "entity": [["tile_bna", "ot", 4], ["tile_bnb", "ot", 2], ["tile_t1", "sp", [-1, 1]], ["tile_t2", "sp", [-1, 2]], ["c_unroll", "sp", [-1, 2]], ["yt", "ot", 1]]}, "result": [[0.8241500352], 0, 163.74053621292114, 1612189378.9004922], "version": 0.2, "tvm_version": "0.8.dev0"}
{"input": ["opencl -keys=mali,opencl,gpu -device=mali -max_num_threads=256", "tutorial/conv2d_no_batching", [1, 40, 40, 512, 256, 3, 3, [1, 1], [1, 1]], {}], "config": {"index": 13035, "code_hash": null, "entity": [["tile_bna", "ot", 1], ["tile_bnb", "ot", 4], ["tile_t1", "sp", [-1, 2]], ["tile_t2", "sp", [-1, 2]], ["c_unroll", "sp", [-1, 1]], ["yt", "ot", 4]]}, "result": [[0.29097068], 0, 70.15185117721558, 1612189285.8043563], "version": 0.2, "tvm_version": "0.8.dev0"}
{"input": ["opencl -keys=mali,opencl,gpu -device=mali -max_num_threads=256", "tutorial/conv2d_no_batching", [1, 40, 40, 512, 256, 3, 3, [1, 1], [1, 1]], {}], "config": {"index": 28185, "code_hash": null, "entity": [["tile_bna", "ot", 1], ["tile_bnb", "ot", 4], ["tile_t1", "sp", [-1, 128]], ["tile_t2", "sp", [-1, 16]], ["c_unroll", "sp", [-1, 2]], ["yt", "ot", 16]]}, "result": [[0.0685703923], 0, 14.920422792434692, 1612189602.36264], "version": 0.2, "tvm_version": "0.8.dev0"}
{"input": ["opencl -keys=mali,opencl,gpu -device=mali -max_num_threads=256", "tutorial/conv2d_no_batching", [1, 40, 40, 512, 256, 3, 3, [1, 1], [1, 1]], {}], "config": {"index": 28385, "code_hash": null, "entity": [["tile_bna", "ot", 1], ["tile_bnb", "ot", 4], ["tile_t1", "sp", [-1, 128]], ["tile_t2", "sp", [-1, 32]], ["c_unroll", "sp", [-1, 2]], ["yt", "ot", 16]]}, "result": [[0.0691471058], 0, 24.39228129386902, 1612189611.5974307], "version": 0.2, "tvm_version": "0.8.dev0"}
{"input": ["opencl -keys=mali,opencl,gpu -device=mali -max_num_threads=256", "tutorial/conv2d_no_batching", [1, 40, 40, 512, 256, 3, 3, [1, 1], [1, 1]], {}], "config": {"index": 27985, "code_hash": null, "entity": [["tile_bna", "ot", 1], ["tile_bnb", "ot", 4], ["tile_t1", "sp", [-1, 128]], ["tile_t2", "sp", [-1, 8]], ["c_unroll", "sp", [-1, 2]], ["yt", "ot", 16]]}, "result": [[0.0693332101], 0, 70.41545987129211, 1612189657.9123638], "version": 0.2, "tvm_version": "0.8.dev0"}
{"input": ["opencl -keys=mali,opencl,gpu -device=mali -max_num_threads=256", "tutorial/conv2d_no_batching", [1, 40, 40, 512, 256, 3, 3, [1, 1], [1, 1]], {}], "config": {"index": 27785, "code_hash": null, "entity": [["tile_bna", "ot", 1], ["tile_bnb", "ot", 4], ["tile_t1", "sp", [-1, 128]], ["tile_t2", "sp", [-1, 4]], ["c_unroll", "sp", [-1, 2]], ["yt", "ot", 16]]}, "result": [[0.07054715289999999], 0, 125.10511779785156, 1612189712.5515544], "version": 0.2, "tvm_version": "0.8.dev0"}
{"input": ["opencl -keys=mali,opencl,gpu -device=mali -max_num_threads=256", "tutorial/conv2d_no_batching", [1, 40, 40, 512, 256, 3, 3, [1, 1], [1, 1]], {}], "config": {"index": 28160, "code_hash": null, "entity": [["tile_bna", "ot", 1], ["tile_bnb", "ot", 4], ["tile_t1", "sp", [-1, 64]], ["tile_t2", "sp", [-1, 16]], ["c_unroll", "sp", [-1, 2]], ["yt", "ot", 16]]}, "result": [[0.0691434131], 0, 134.03781914710999, 1612189721.5611157], "version": 0.2, "tvm_version": "0.8.dev0"}
{"input": ["opencl -keys=mali,opencl,gpu -device=mali -max_num_threads=256", "tutorial/conv2d_no_batching", [1, 40, 40, 512, 256, 3, 3, [1, 1], [1, 1]], {}], "config": {"index": 28060, "code_hash": null, "entity": [["tile_bna", "ot", 1], ["tile_bnb", "ot", 4], ["tile_t1", "sp", [-1, 4]], ["tile_t2", "sp", [-1, 16]], ["c_unroll", "sp", [-1, 2]], ["yt", "ot", 16]]}, "result": [[0.0740260647], 0, 152.11681628227234, 1612189739.854523], "version": 0.2, "tvm_version": "0.8.dev0"}
{"input": ["opencl -keys=mali,opencl,gpu -device=mali -max_num_threads=256", "tutorial/conv2d_no_batching", [1, 40, 40, 512, 256, 3, 3, [1, 1], [1, 1]], {}], "config": {"index": 27860, "code_hash": null, "entity": [["tile_bna", "ot", 1], ["tile_bnb", "ot", 4], ["tile_t1", "sp", [-1, 4]], ["tile_t2", "sp", [-1, 8]], ["c_unroll", "sp", [-1, 2]], ["yt", "ot", 16]]}, "result": [[0.0750645439], 0, 52.313382625579834, 1612189639.5827594], "version": 0.2, "tvm_version": "0.8.dev0"}
{"input": ["opencl -keys=mali,opencl,gpu -device=mali -max_num_threads=256", "tutorial/conv2d_no_batching", [1, 40, 40, 512, 256, 3, 3, [1, 1], [1, 1]], {}], "config": {"index": 29785, "code_hash": null, "entity": [["tile_bna", "ot", 1], ["tile_bnb", "ot", 4], ["tile_t1", "sp", [-1, 128]], ["tile_t2", "sp", [-1, 16]], ["c_unroll", "sp", [-1, 4]], ["yt", "ot", 16]]}, "result": [[0.0712683248], 0, 33.39676260948181, 1612189620.783178], "version": 0.2, "tvm_version": "0.8.dev0"}
{"input": ["opencl -keys=mali,opencl,gpu -device=mali -max_num_threads=256", "tutorial/conv2d_no_batching", [1, 40, 40, 512, 256, 3, 3, [1, 1], [1, 1]], {}], "config": {"index": 31385, "code_hash": null, "entity": [["tile_bna", "ot", 1], ["tile_bnb", "ot", 4], ["tile_t1", "sp", [-1, 128]], ["tile_t2", "sp", [-1, 16]], ["c_unroll", "sp", [-1, 8]], ["yt", "ot", 16]]}, "result": [[0.0652635951], 0, 79.3862714767456, 1612189666.8822017], "version": 0.2, "tvm_version": "0.8.dev0"}
{"input": ["opencl -keys=mali,opencl,gpu -device=mali -max_num_threads=256", "tutorial/conv2d_no_batching", [1, 40, 40, 512, 256, 3, 3, [1, 1], [1, 1]], {}], "config": {"index": 28260, "code_hash": null, "entity": [["tile_bna", "ot", 1], ["tile_bnb", "ot", 4], ["tile_t1", "sp", [-1, 4]], ["tile_t2", "sp", [-1, 32]], ["c_unroll", "sp", [-1, 2]], ["yt", "ot", 16]]}, "result": [[0.0743848147], 0, 42.53039479255676, 1612189630.0749674], "version": 0.2, "tvm_version": "0.8.dev0"}
{"input": ["opencl -keys=mali,opencl,gpu -device=mali -max_num_threads=256", "tutorial/conv2d_no_batching", [1, 40, 40, 512, 256, 3, 3, [1, 1], [1, 1]], {}], "config": {"index": 28085, "code_hash": null, "entity": [["tile_bna", "ot", 1], ["tile_bnb", "ot", 4], ["tile_t1", "sp", [-1, 8]], ["tile_t2", "sp", [-1, 16]], ["c_unroll", "sp", [-1, 2]], ["yt", "ot", 16]]}, "result": [[0.06944232980000001], 0, 106.76894545555115, 1612189693.9920635], "version": 0.2, "tvm_version": "0.8.dev0"}
{"input": ["opencl -keys=mali,opencl,gpu -device=mali -max_num_threads=256", "tutorial/conv2d_no_batching", [1, 40, 40, 512, 256, 3, 3, [1, 1], [1, 1]], {}], "config": {"index": 28360, "code_hash": null, "entity": [["tile_bna", "ot", 1], ["tile_bnb", "ot", 4], ["tile_t1", "sp", [-1, 64]], ["tile_t2", "sp", [-1, 32]], ["c_unroll", "sp", [-1, 2]], ["yt", "ot", 16]]}, "result": [[0.0684048609], 0, 61.11648917198181, 1612189648.7019982], "version": 0.2, "tvm_version": "0.8.dev0"}
{"input": ["opencl -keys=mali,opencl,gpu -device=mali -max_num_threads=256", "tutorial/conv2d_no_batching", [1, 40, 40, 512, 256, 3, 3, [1, 1], [1, 1]], {}], "config": {"index": 27685, "code_hash": null, "entity": [["tile_bna", "ot", 1], ["tile_bnb", "ot", 4], ["tile_t1", "sp", [-1, 8]], ["tile_t2", "sp", [-1, 4]], ["c_unroll", "sp", [-1, 2]], ["yt", "ot", 16]]}, "result": [[0.0716527988], 0, 88.6664731502533, 1612189676.0383565], "version": 0.2, "tvm_version": "0.8.dev0"}
{"input": ["opencl -keys=mali,opencl,gpu -device=mali -max_num_threads=256", "tutorial/conv2d_no_batching", [1, 40, 40, 512, 256, 3, 3, [1, 1], [1, 1]], {}], "config": {"index": 28460, "code_hash": null, "entity": [["tile_bna", "ot", 1], ["tile_bnb", "ot", 4], ["tile_t1", "sp", [-1, 4]], ["tile_t2", "sp", [-1, 64]], ["c_unroll", "sp", [-1, 2]], ["yt", "ot", 16]]}, "result": [[0.0742420386], 0, 115.98988580703735, 1612189703.4083016], "version": 0.2, "tvm_version": "0.8.dev0"}
{"input": ["opencl -keys=mali,opencl,gpu -device=mali -max_num_threads=256", "tutorial/conv2d_no_batching", [1, 40, 40, 512, 256, 3, 3, [1, 1], [1, 1]], {}], "config": {"index": 28285, "code_hash": null, "entity": [["tile_bna", "ot", 1], ["tile_bnb", "ot", 4], ["tile_t1", "sp", [-1, 8]], ["tile_t2", "sp", [-1, 32]], ["c_unroll", "sp", [-1, 2]], ["yt", "ot", 16]]}, "result": [[0.0696108454], 0, 97.5146996974945, 1612189684.9812686], "version": 0.2, "tvm_version": "0.8.dev0"}
{"input": ["opencl -keys=mali,opencl,gpu -device=mali -max_num_threads=256", "tutorial/conv2d_no_batching", [1, 40, 40, 512, 256, 3, 3, [1, 1], [1, 1]], {}], "config": {"index": 29985, "code_hash": null, "entity": [["tile_bna", "ot", 1], ["tile_bnb", "ot", 4], ["tile_t1", "sp", [-1, 128]], ["tile_t2", "sp", [-1, 32]], ["c_unroll", "sp", [-1, 4]], ["yt", "ot", 16]]}, "result": [[0.0714338405], 0, 143.32328009605408, 1612189730.6987865], "version": 0.2, "tvm_version": "0.8.dev0"}
{"input": ["opencl -keys=mali,opencl,gpu -device=mali -max_num_threads=256", "tutorial/conv2d_no_batching", [1, 40, 40, 512, 256, 3, 3, [1, 1], [1, 1]], {}], "config": {"index": 31585, "code_hash": null, "entity": [["tile_bna", "ot", 1], ["tile_bnb", "ot", 4], ["tile_t1", "sp", [-1, 128]], ["tile_t2", "sp", [-1, 32]], ["c_unroll", "sp", [-1, 8]], ["yt", "ot", 16]]}, "result": [[0.0648467825], 0, 149.08921575546265, 1612189899.5283105], "version": 0.2, "tvm_version": "0.8.dev0"}
{"input": ["opencl -keys=mali,opencl,gpu -device=mali -max_num_threads=256", "tutorial/conv2d_no_batching", [1, 40, 40, 512, 256, 3, 3, [1, 1], [1, 1]], {}], "config": {"index": 27960, "code_hash": null, "entity": [["tile_bna", "ot", 1], ["tile_bnb", "ot", 4], ["tile_t1", "sp", [-1, 64]], ["tile_t2", "sp", [-1, 8]], ["c_unroll", "sp", [-1, 2]], ["yt", "ot", 16]]}, "result": [[0.0699334393], 0, 24.555043697357178, 1612189776.1209555], "version": 0.2, "tvm_version": "0.8.dev0"}
