test_and_tune/android.nhcw4c.log.tmp
{"input": ["opencl -keys=opencl,gpu -max_num_threads=256", "tutorial/conv2d_no_batching", [1, 40, 40, 512, 256, 1, 1, [1, 1], [0, 0]], {}], "config": {"index": 6909, "code_hash": null, "entity": [["tile_rc", "sp", [-1, 1, 4]], ["tile_f", "sp", [-1, 8]], ["tile_y", "sp", [-1, 1, 20]], ["tile_x", "sp", [-1, 20, 4]]]}, "result": [[0.0479284736], 0, 11.264601707458496, 1615631623.5337608], "version": 0.2, "tvm_version": "0.8.dev0"}
{"input": ["opencl -keys=opencl,gpu -max_num_threads=256", "tutorial/conv2d_no_batching", [1, 40, 40, 512, 256, 1, 1, [1, 1], [0, 0]], {}], "config": {"index": 17726, "code_hash": null, "entity": [["tile_rc", "sp", [-1, 4, 4]], ["tile_f", "sp", [-1, 16]], ["tile_y", "sp", [-1, 1, 8]], ["tile_x", "sp", [-1, 10, 16]]]}, "result": [[0.0855007846], 0, 12.572932004928589, 1615631647.1977074], "version": 0.2, "tvm_version": "0.8.dev0"}
{"input": ["opencl -keys=opencl,gpu -max_num_threads=256", "tutorial/conv2d_no_batching", [1, 40, 40, 512, 256, 1, 1, [1, 1], [0, 0]], {}], "config": {"index": 4678, "code_hash": null, "entity": [["tile_rc", "sp", [-1, 4, 4]], ["tile_f", "sp", [-1, 16]], ["tile_y", "sp", [-1, 5, 8]], ["tile_x", "sp", [-1, 8, 4]]]}, "result": [[0.1048732917], 0, 20.939159870147705, 1615631655.8013055], "version": 0.2, "tvm_version": "0.8.dev0"}
{"input": ["opencl -keys=opencl,gpu -max_num_threads=256", "tutorial/conv2d_no_batching", [1, 40, 40, 512, 256, 1, 1, [1, 1], [0, 0]], {}], "config": {"index": 4844, "code_hash": null, "entity": [["tile_rc", "sp", [-1, 1, 4]], ["tile_f", "sp", [-1, 16]], ["tile_y", "sp", [-1, 4, 10]], ["tile_x", "sp", [-1, 8, 4]]]}, "result": [[0.0030485368], 0, 22.534655809402466, 1615631657.503073], "version": 0.2, "tvm_version": "0.8.dev0"}
{"input": ["opencl -keys=opencl,gpu -max_num_threads=256", "tutorial/conv2d_no_batching", [1, 40, 40, 512, 256, 1, 1, [1, 1], [0, 0]], {}], "config": {"index": 2713, "code_hash": null, "entity": [["tile_rc", "sp", [-1, 16, 4]], ["tile_f", "sp", [-1, 8]], ["tile_y", "sp", [-1, 1, 10]], ["tile_x", "sp", [-1, 4, 4]]]}, "result": [[0.0660073451], 0, 9.792863845825195, 1615631670.4519715], "version": 0.2, "tvm_version": "0.8.dev0"}
{"input": ["opencl -keys=opencl,gpu -max_num_threads=256", "tutorial/conv2d_no_batching", [1, 40, 40, 512, 256, 1, 1, [1, 1], [0, 0]], {}], "config": {"index": 4817, "code_hash": null, "entity": [["tile_rc", "sp", [-1, 2, 4]], ["tile_f", "sp", [-1, 1]], ["tile_y", "sp", [-1, 4, 10]], ["tile_x", "sp", [-1, 8, 4]]]}, "result": [[0.017252059], 0, 16.969584226608276, 1615631678.0420809], "version": 0.2, "tvm_version": "0.8.dev0"}
{"input": ["opencl -keys=opencl,gpu -max_num_threads=256", "tutorial/conv2d_no_batching", [1, 40, 40, 512, 256, 1, 1, [1, 1], [0, 0]], {}], "config": {"index": 22248, "code_hash": null, "entity": [["tile_rc", "sp", [-1, 4, 4]], ["tile_f", "sp", [-1, 4]], ["tile_y", "sp", [-1, 2, 2]], ["tile_x", "sp", [-1, 1, 32]]]}, "result": [[0.0480981038], 0, 13.856719493865967, 1615631717.2115948], "version": 0.2, "tvm_version": "0.8.dev0"}
{"input": ["opencl -keys=opencl,gpu -max_num_threads=256", "tutorial/conv2d_no_batching", [1, 40, 40, 512, 256, 1, 1, [1, 1], [0, 0]], {}], "config": {"index": 14394, "code_hash": null, "entity": [["tile_rc", "sp", [-1, 4, 4]], ["tile_f", "sp", [-1, 1]], ["tile_y", "sp", [-1, 20, 2]], ["tile_x", "sp", [-1, 1, 16]]]}, "result": [[0.0704135279], 0, 3.8349671363830566, 1615631739.4242651], "version": 0.2, "tvm_version": "0.8.dev0"}
{"input": ["opencl -keys=opencl,gpu -max_num_threads=256", "tutorial/conv2d_no_batching", [1, 40, 40, 512, 256, 1, 1, [1, 1], [0, 0]], {}], "config": {"index": 13842, "code_hash": null, "entity": [["tile_rc", "sp", [-1, 8, 4]], ["tile_f", "sp", [-1, 2]], ["tile_y", "sp", [-1, 2, 10]], ["tile_x", "sp", [-1, 20, 8]]]}, "result": [[0.0559365837], 0, 7.976585388183594, 1615631743.1755707], "version": 0.2, "tvm_version": "0.8.dev0"}
{"input": ["opencl -keys=opencl,gpu -max_num_threads=256", "tutorial/conv2d_no_batching", [1, 40, 40, 512, 256, 1, 1, [1, 1], [0, 0]], {}], "config": {"index": 4403, "code_hash": null, "entity": [["tile_rc", "sp", [-1, 1, 4]], ["tile_f", "sp", [-1, 32]], ["tile_y", "sp", [-1, 1, 4]], ["tile_x", "sp", [-1, 8, 4]]]}, "result": [[0.0019175834999999998], 0, 14.195708274841309, 1615631749.903258], "version": 0.2, "tvm_version": "0.8.dev0"}
{"input": ["opencl -keys=opencl,gpu -max_num_threads=256", "tutorial/conv2d_no_batching", [1, 40, 40, 512, 256, 1, 1, [1, 1], [0, 0]], {}], "config": {"index": 1065, "code_hash": null, "entity": [["tile_rc", "sp", [-1, 2, 4]], ["tile_f", "sp", [-1, 1]], ["tile_y", "sp", [-1, 2, 2]], ["tile_x", "sp", [-1, 2, 4]]]}, "result": [[0.029645305], 0, 31.475730180740356, 1615631801.3594334], "version": 0.2, "tvm_version": "0.8.dev0"}
{"input": ["opencl -keys=opencl,gpu -max_num_threads=256", "tutorial/conv2d_no_batching", [1, 40, 40, 512, 256, 1, 1, [1, 1], [0, 0]], {}], "config": {"index": 11216, "code_hash": null, "entity": [["tile_rc", "sp", [-1, 4, 4]], ["tile_f", "sp", [-1, 4]], ["tile_y", "sp", [-1, 4, 2]], ["tile_x", "sp", [-1, 5, 8]]]}, "result": [[0.0121819336], 0, 1.9685359001159668, 1615631839.9797778], "version": 0.2, "tvm_version": "0.8.dev0"}
{"input": ["opencl -keys=opencl,gpu -max_num_threads=256", "tutorial/conv2d_no_batching", [1, 40, 40, 512, 256, 1, 1, [1, 1], [0, 0]], {}], "config": {"index": 2583, "code_hash": null, "entity": [["tile_rc", "sp", [-1, 1, 4]], ["tile_f", "sp", [-1, 2]], ["tile_y", "sp", [-1, 1, 8]], ["tile_x", "sp", [-1, 4, 4]]]}, "result": [[0.0145129129], 0, 2.2321579456329346, 1615631944.5235791], "version": 0.2, "tvm_version": "0.8.dev0"}
{"input": ["opencl -keys=opencl,gpu -max_num_threads=256", "tutorial/conv2d_no_batching", [1, 40, 40, 512, 256, 1, 1, [1, 1], [0, 0]], {}], "config": {"index": 1582, "code_hash": null, "entity": [["tile_rc", "sp", [-1, 1, 4]], ["tile_f", "sp", [-1, 4]], ["tile_y", "sp", [-1, 1, 8]], ["tile_x", "sp", [-1, 2, 4]]]}, "result": [[0.014420803500000001], 0, 4.194790601730347, 1615631946.574525], "version": 0.2, "tvm_version": "0.8.dev0"}
{"input": ["opencl -keys=opencl,gpu -max_num_threads=256", "tutorial/conv2d_no_batching", [1, 40, 40, 512, 256, 1, 1, [1, 1], [0, 0]], {}], "config": {"index": 2590, "code_hash": null, "entity": [["tile_rc", "sp", [-1, 1, 4]], ["tile_f", "sp", [-1, 4]], ["tile_y", "sp", [-1, 1, 8]], ["tile_x", "sp", [-1, 4, 4]]]}, "result": [[0.0076569954999999995], 0, 5.952383041381836, 1615631948.2846253], "version": 0.2, "tvm_version": "0.8.dev0"}
{"input": ["opencl -keys=opencl,gpu -max_num_threads=256", "tutorial/conv2d_no_batching", [1, 40, 40, 512, 256, 1, 1, [1, 1], [0, 0]], {}], "config": {"index": 1750, "code_hash": null, "entity": [["tile_rc", "sp", [-1, 1, 4]], ["tile_f", "sp", [-1, 4]], ["tile_y", "sp", [-1, 2, 10]], ["tile_x", "sp", [-1, 2, 4]]]}, "result": [[0.0097464176], 0, 7.80966591835022, 1615631950.1736572], "version": 0.2, "tvm_version": "0.8.dev0"}
{"input": ["opencl -keys=opencl,gpu -max_num_threads=256", "tutorial/conv2d_no_batching", [1, 40, 40, 512, 256, 1, 1, [1, 1], [0, 0]], {}], "config": {"index": 2591, "code_hash": null, "entity": [["tile_rc", "sp", [-1, 2, 4]], ["tile_f", "sp", [-1, 4]], ["tile_y", "sp", [-1, 1, 8]], ["tile_x", "sp", [-1, 4, 4]]]}, "result": [[0.0086914123], 0, 9.733887195587158, 1615631952.0316672], "version": 0.2, "tvm_version": "0.8.dev0"}
{"input": ["opencl -keys=opencl,gpu -max_num_threads=256", "tutorial/conv2d_no_batching", [1, 40, 40, 512, 256, 1, 1, [1, 1], [0, 0]], {}], "config": {"index": 4375, "code_hash": null, "entity": [["tile_rc", "sp", [-1, 1, 4]], ["tile_f", "sp", [-1, 2]], ["tile_y", "sp", [-1, 1, 4]], ["tile_x", "sp", [-1, 8, 4]]]}, "result": [[0.006734334], 0, 11.255464792251587, 1615631953.6344345], "version": 0.2, "tvm_version": "0.8.dev0"}
{"input": ["opencl -keys=opencl,gpu -max_num_threads=256", "tutorial/conv2d_no_batching", [1, 40, 40, 512, 256, 1, 1, [1, 1], [0, 0]], {}], "config": {"index": 4382, "code_hash": null, "entity": [["tile_rc", "sp", [-1, 1, 4]], ["tile_f", "sp", [-1, 4]], ["tile_y", "sp", [-1, 1, 4]], ["tile_x", "sp", [-1, 8, 4]]]}, "result": [[0.0037489431], 0, 13.018143892288208, 1615631955.3790352], "version": 0.2, "tvm_version": "0.8.dev0"}
{"input": ["opencl -keys=opencl,gpu -max_num_threads=256", "tutorial/conv2d_no_batching", [1, 40, 40, 512, 256, 1, 1, [1, 1], [0, 0]], {}], "config": {"index": 3598, "code_hash": null, "entity": [["tile_rc", "sp", [-1, 1, 4]], ["tile_f", "sp", [-1, 4]], ["tile_y", "sp", [-1, 1, 8]], ["tile_x", "sp", [-1, 5, 4]]]}, "result": [[0.0065910267], 0, 14.74936819076538, 1615631957.0962973], "version": 0.2, "tvm_version": "0.8.dev0"}
{"input": ["opencl -keys=opencl,gpu -max_num_threads=256", "tutorial/conv2d_no_batching", [1, 40, 40, 512, 256, 1, 1, [1, 1], [0, 0]], {}], "config": {"index": 3591, "code_hash": null, "entity": [["tile_rc", "sp", [-1, 1, 4]], ["tile_f", "sp", [-1, 2]], ["tile_y", "sp", [-1, 1, 8]], ["tile_x", "sp", [-1, 5, 4]]]}, "result": [[0.0121468658], 0, 1.8776743412017822, 1615631959.2200234], "version": 0.2, "tvm_version": "0.8.dev0"}
{"input": ["opencl -keys=opencl,gpu -max_num_threads=256", "tutorial/conv2d_no_batching", [1, 40, 40, 512, 256, 1, 1, [1, 1], [0, 0]], {}], "config": {"index": 2422, "code_hash": null, "entity": [["tile_rc", "sp", [-1, 1, 4]], ["tile_f", "sp", [-1, 4]], ["tile_y", "sp", [-1, 2, 4]], ["tile_x", "sp", [-1, 4, 4]]]}, "result": [[0.0036247556], 0, 3.5873351097106934, 1615631960.9629242], "version": 0.2, "tvm_version": "0.8.dev0"}
{"input": ["opencl -keys=opencl,gpu -max_num_threads=256", "tutorial/conv2d_no_batching", [1, 40, 40, 512, 256, 1, 1, [1, 1], [0, 0]], {}], "config": {"index": 2415, "code_hash": null, "entity": [["tile_rc", "sp", [-1, 1, 4]], ["tile_f", "sp", [-1, 2]], ["tile_y", "sp", [-1, 2, 4]], ["tile_x", "sp", [-1, 4, 4]]]}, "result": [[0.0067849278], 0, 5.227585315704346, 1615631962.6092987], "version": 0.2, "tvm_version": "0.8.dev0"}
{"input": ["opencl -keys=opencl,gpu -max_num_threads=256", "tutorial/conv2d_no_batching", [1, 40, 40, 512, 256, 1, 1, [1, 1], [0, 0]], {}], "config": {"index": 9478, "code_hash": null, "entity": [["tile_rc", "sp", [-1, 1, 4]], ["tile_f", "sp", [-1, 4]], ["tile_y", "sp", [-1, 2, 4]], ["tile_x", "sp", [-1, 2, 8]]]}, "result": [[0.0078813237], 0, 7.015573024749756, 1615631964.376006], "version": 0.2, "tvm_version": "0.8.dev0"}
{"input": ["opencl -keys=opencl,gpu -max_num_threads=256", "tutorial/conv2d_no_batching", [1, 40, 40, 512, 256, 1, 1, [1, 1], [0, 0]], {}], "config": {"index": 1414, "code_hash": null, "entity": [["tile_rc", "sp", [-1, 1, 4]], ["tile_f", "sp", [-1, 4]], ["tile_y", "sp", [-1, 2, 4]], ["tile_x", "sp", [-1, 2, 4]]]}, "result": [[0.0066241205], 0, 8.84498381614685, 1615631966.240088], "version": 0.2, "tvm_version": "0.8.dev0"}
{"input": ["opencl -keys=opencl,gpu -max_num_threads=256", "tutorial/conv2d_no_batching", [1, 40, 40, 512, 256, 1, 1, [1, 1], [0, 0]], {}], "config": {"index": 2597, "code_hash": null, "entity": [["tile_rc", "sp", [-1, 1, 4]], ["tile_f", "sp", [-1, 8]], ["tile_y", "sp", [-1, 1, 8]], ["tile_x", "sp", [-1, 4, 4]]]}, "result": [[0.0041484951999999995], 0, 12.504941701889038, 1615631969.8861613], "version": 0.2, "tvm_version": "0.8.dev0"}
{"input": ["opencl -keys=opencl,gpu -max_num_threads=256", "tutorial/conv2d_no_batching", [1, 40, 40, 512, 256, 1, 1, [1, 1], [0, 0]], {}], "config": {"index": 1589, "code_hash": null, "entity": [["tile_rc", "sp", [-1, 1, 4]], ["tile_f", "sp", [-1, 8]], ["tile_y", "sp", [-1, 1, 8]], ["tile_x", "sp", [-1, 2, 4]]]}, "result": [[0.0074124018], 0, 10.696496486663818, 1615631968.085237], "version": 0.2, "tvm_version": "0.8.dev0"}
{"input": ["opencl -keys=opencl,gpu -max_num_threads=256", "tutorial/conv2d_no_batching", [1, 40, 40, 512, 256, 1, 1, [1, 1], [0, 0]], {}], "config": {"index": 581, "code_hash": null, "entity": [["tile_rc", "sp", [-1, 1, 4]], ["tile_f", "sp", [-1, 8]], ["tile_y", "sp", [-1, 1, 8]], ["tile_x", "sp", [-1, 1, 4]]]}, "result": [[0.014270616], 0, 14.429631471633911, 1615631971.8363764], "version": 0.2, "tvm_version": "0.8.dev0"}
{"input": ["opencl -keys=opencl,gpu -max_num_threads=256", "tutorial/conv2d_no_batching", [1, 40, 40, 512, 256, 1, 1, [1, 1], [0, 0]], {}], "config": {"index": 4383, "code_hash": null, "entity": [["tile_rc", "sp", [-1, 2, 4]], ["tile_f", "sp", [-1, 4]], ["tile_y", "sp", [-1, 1, 4]], ["tile_x", "sp", [-1, 8, 4]]]}, "result": [[0.0040364952], 0, 1.666837453842163, 1615631973.788888], "version": 0.2, "tvm_version": "0.8.dev0"}
{"input": ["opencl -keys=opencl,gpu -max_num_threads=256", "tutorial/conv2d_no_batching", [1, 40, 40, 512, 256, 1, 1, [1, 1], [0, 0]], {}], "config": {"index": 4376, "code_hash": null, "entity": [["tile_rc", "sp", [-1, 2, 4]], ["tile_f", "sp", [-1, 2]], ["tile_y", "sp", [-1, 1, 4]], ["tile_x", "sp", [-1, 8, 4]]]}, "result": [[0.008028730000000001], 0, 3.477216958999634, 1615631975.609916], "version": 0.2, "tvm_version": "0.8.dev0"}
{"input": ["opencl -keys=opencl,gpu -max_num_threads=256", "tutorial/conv2d_no_batching", [1, 40, 40, 512, 256, 1, 1, [1, 1], [0, 0]], {}], "config": {"index": 4599, "code_hash": null, "entity": [["tile_rc", "sp", [-1, 1, 4]], ["tile_f", "sp", [-1, 2]], ["tile_y", "sp", [-1, 1, 8]], ["tile_x", "sp", [-1, 8, 4]]]}, "result": [[0.007706584099999999], 0, 5.2871198654174805, 1615631977.4074752], "version": 0.2, "tvm_version": "0.8.dev0"}
{"input": ["opencl -keys=opencl,gpu -max_num_threads=256", "tutorial/conv2d_no_batching", [1, 40, 40, 512, 256, 1, 1, [1, 1], [0, 0]], {}], "config": {"index": 4606, "code_hash": null, "entity": [["tile_rc", "sp", [-1, 1, 4]], ["tile_f", "sp", [-1, 4]], ["tile_y", "sp", [-1, 1, 8]], ["tile_x", "sp", [-1, 8, 4]]]}, "result": [[0.0042964483], 0, 6.999655246734619, 1615631979.1164873], "version": 0.2, "tvm_version": "0.8.dev0"}
{"input": ["opencl -keys=opencl,gpu -max_num_threads=256", "tutorial/conv2d_no_batching", [1, 40, 40, 512, 256, 1, 1, [1, 1], [0, 0]], {}], "config": {"index": 3592, "code_hash": null, "entity": [["tile_rc", "sp", [-1, 2, 4]], ["tile_f", "sp", [-1, 2]], ["tile_y", "sp", [-1, 1, 8]], ["tile_x", "sp", [-1, 5, 4]]]}, "result": [[0.013209543], 0, 8.932120561599731, 1615631981.0449166], "version": 0.2, "tvm_version": "0.8.dev0"}
{"input": ["opencl -keys=opencl,gpu -max_num_threads=256", "tutorial/conv2d_no_batching", [1, 40, 40, 512, 256, 1, 1, [1, 1], [0, 0]], {}], "config": {"index": 3599, "code_hash": null, "entity": [["tile_rc", "sp", [-1, 2, 4]], ["tile_f", "sp", [-1, 4]], ["tile_y", "sp", [-1, 1, 8]], ["tile_x", "sp", [-1, 5, 4]]]}, "result": [[0.0069794382], 0, 10.652778148651123, 1615631982.7711935], "version": 0.2, "tvm_version": "0.8.dev0"}
{"input": ["opencl -keys=opencl,gpu -max_num_threads=256", "tutorial/conv2d_no_batching", [1, 40, 40, 512, 256, 1, 1, [1, 1], [0, 0]], {}], "config": {"index": 2423, "code_hash": null, "entity": [["tile_rc", "sp", [-1, 2, 4]], ["tile_f", "sp", [-1, 4]], ["tile_y", "sp", [-1, 2, 4]], ["tile_x", "sp", [-1, 4, 4]]]}, "result": [[0.0041799066], 0, 12.264916896820068, 1615631984.4145167], "version": 0.2, "tvm_version": "0.8.dev0"}
{"input": ["opencl -keys=opencl,gpu -max_num_threads=256", "tutorial/conv2d_no_batching", [1, 40, 40, 512, 256, 1, 1, [1, 1], [0, 0]], {}], "config": {"index": 2598, "code_hash": null, "entity": [["tile_rc", "sp", [-1, 2, 4]], ["tile_f", "sp", [-1, 8]], ["tile_y", "sp", [-1, 1, 8]], ["tile_x", "sp", [-1, 4, 4]]]}, "result": [[0.004363807799999999], 0, 14.03846549987793, 1615631986.1743073], "version": 0.2, "tvm_version": "0.8.dev0"}
{"input": ["opencl -keys=opencl,gpu -max_num_threads=256", "tutorial/conv2d_no_batching", [1, 40, 40, 512, 256, 1, 1, [1, 1], [0, 0]], {}], "config": {"index": 1590, "code_hash": null, "entity": [["tile_rc", "sp", [-1, 2, 4]], ["tile_f", "sp", [-1, 8]], ["tile_y", "sp", [-1, 1, 8]], ["tile_x", "sp", [-1, 2, 4]]]}, "result": [[0.0084502143], 0, 1.9855186939239502, 1615631988.3960078], "version": 0.2, "tvm_version": "0.8.dev0"}
{"input": ["opencl -keys=opencl,gpu -max_num_threads=256", "tutorial/conv2d_no_batching", [1, 40, 40, 512, 256, 1, 1, [1, 1], [0, 0]], {}], "config": {"index": 1358, "code_hash": null, "entity": [["tile_rc", "sp", [-1, 1, 4]], ["tile_f", "sp", [-1, 4]], ["tile_y", "sp", [-1, 1, 4]], ["tile_x", "sp", [-1, 2, 4]]]}, "result": [[0.0122231001], 0, 5.823357105255127, 1615631992.312408], "version": 0.2, "tvm_version": "0.8.dev0"}
{"input": ["opencl -keys=opencl,gpu -max_num_threads=256", "tutorial/conv2d_no_batching", [1, 40, 40, 512, 256, 1, 1, [1, 1], [0, 0]], {}], "config": {"index": 2359, "code_hash": null, "entity": [["tile_rc", "sp", [-1, 1, 4]], ["tile_f", "sp", [-1, 2]], ["tile_y", "sp", [-1, 1, 4]], ["tile_x", "sp", [-1, 4, 4]]]}, "result": [[0.012804022200000001], 0, 3.866769790649414, 1615631990.3588152], "version": 0.2, "tvm_version": "0.8.dev0"}
{"input": ["opencl -keys=opencl,gpu -max_num_threads=256", "tutorial/conv2d_no_batching", [1, 40, 40, 512, 256, 1, 1, [1, 1], [0, 0]], {}], "config": {"index": 2366, "code_hash": null, "entity": [["tile_rc", "sp", [-1, 1, 4]], ["tile_f", "sp", [-1, 4]], ["tile_y", "sp", [-1, 1, 4]], ["tile_x", "sp", [-1, 4, 4]]]}, "result": [[0.006708167399999999], 0, 7.584904670715332, 1615631994.0865223], "version": 0.2, "tvm_version": "0.8.dev0"}
{"input": ["opencl -keys=opencl,gpu -max_num_threads=256", "tutorial/conv2d_no_batching", [1, 40, 40, 512, 256, 1, 1, [1, 1], [0, 0]], {}], "config": {"index": 4607, "code_hash": null, "entity": [["tile_rc", "sp", [-1, 2, 4]], ["tile_f", "sp", [-1, 4]], ["tile_y", "sp", [-1, 1, 8]], ["tile_x", "sp", [-1, 8, 4]]]}, "result": [[0.0044771359], 0, 9.312387228012085, 1615631995.7658777], "version": 0.2, "tvm_version": "0.8.dev0"}
{"input": ["opencl -keys=opencl,gpu -max_num_threads=256", "tutorial/conv2d_no_batching", [1, 40, 40, 512, 256, 1, 1, [1, 1], [0, 0]], {}], "config": {"index": 4600, "code_hash": null, "entity": [["tile_rc", "sp", [-1, 2, 4]], ["tile_f", "sp", [-1, 2]], ["tile_y", "sp", [-1, 1, 8]], ["tile_x", "sp", [-1, 8, 4]]]}, "result": [[0.0087248134], 0, 11.167617082595825, 1615631997.6303248], "version": 0.2, "tvm_version": "0.8.dev0"}
{"input": ["opencl -keys=opencl,gpu -max_num_threads=256", "tutorial/conv2d_no_batching", [1, 40, 40, 512, 256, 1, 1, [1, 1], [0, 0]], {}], "config": {"index": 9198, "code_hash": null, "entity": [["tile_rc", "sp", [-1, 1, 4]], ["tile_f", "sp", [-1, 4]], ["tile_y", "sp", [-1, 4, 2]], ["tile_x", "sp", [-1, 2, 8]]]}, "result": [[0.0036313389000000003], 0, 12.779638528823853, 1615631999.2999258], "version": 0.2, "tvm_version": "0.8.dev0"}
{"input": ["opencl -keys=opencl,gpu -max_num_threads=256", "tutorial/conv2d_no_batching", [1, 40, 40, 512, 256, 1, 1, [1, 1], [0, 0]], {}], "config": {"index": 1575, "code_hash": null, "entity": [["tile_rc", "sp", [-1, 1, 4]], ["tile_f", "sp", [-1, 2]], ["tile_y", "sp", [-1, 1, 8]], ["tile_x", "sp", [-1, 2, 4]]]}, "result": [[0.027794560000000003], 0, 15.188699960708618, 1615632001.6945474], "version": 0.2, "tvm_version": "0.8.dev0"}
{"input": ["opencl -keys=opencl,gpu -max_num_threads=256", "tutorial/conv2d_no_batching", [1, 40, 40, 512, 256, 1, 1, [1, 1], [0, 0]], {}], "config": {"index": 567, "code_hash": null, "entity": [["tile_rc", "sp", [-1, 1, 4]], ["tile_f", "sp", [-1, 2]], ["tile_y", "sp", [-1, 1, 8]], ["tile_x", "sp", [-1, 1, 4]]]}, "result": [[0.054542771000000004], 0, 3.2489988803863525, 1615632005.3117955], "version": 0.2, "tvm_version": "0.8.dev0"}
{"input": ["opencl -keys=opencl,gpu -max_num_threads=256", "tutorial/conv2d_no_batching", [1, 40, 40, 512, 256, 1, 1, [1, 1], [0, 0]], {}], "config": {"index": 574, "code_hash": null, "entity": [["tile_rc", "sp", [-1, 1, 4]], ["tile_f", "sp", [-1, 4]], ["tile_y", "sp", [-1, 1, 8]], ["tile_x", "sp", [-1, 1, 4]]]}, "result": [[0.0273395339], 0, 5.81255841255188, 1615632007.8900263], "version": 0.2, "tvm_version": "0.8.dev0"}
{"input": ["opencl -keys=opencl,gpu -max_num_threads=256", "tutorial/conv2d_no_batching", [1, 40, 40, 512, 256, 1, 1, [1, 1], [0, 0]], {}], "config": {"index": 8799, "code_hash": null, "entity": [["tile_rc", "sp", [-1, 1, 4]], ["tile_f", "sp", [-1, 2]], ["tile_y", "sp", [-1, 2, 10]], ["tile_x", "sp", [-1, 1, 8]]]}, "result": [[0.0944708167], 0, 10.568888902664185, 1615632012.5205278], "version": 0.2, "tvm_version": "0.8.dev0"}
{"input": ["opencl -keys=opencl,gpu -max_num_threads=256", "tutorial/conv2d_no_batching", [1, 40, 40, 512, 256, 1, 1, [1, 1], [0, 0]], {}], "config": {"index": 1743, "code_hash": null, "entity": [["tile_rc", "sp", [-1, 1, 4]], ["tile_f", "sp", [-1, 2]], ["tile_y", "sp", [-1, 2, 10]], ["tile_x", "sp", [-1, 2, 4]]]}, "result": [[0.0194056009], 0, 12.529062986373901, 1615632014.5855496], "version": 0.2, "tvm_version": "0.8.dev0"}
{"input": ["opencl -keys=opencl,gpu -max_num_threads=256", "tutorial/conv2d_no_batching", [1, 40, 40, 512, 256, 1, 1, [1, 1], [0, 0]], {}], "config": {"index": 735, "code_hash": null, "entity": [["tile_rc", "sp", [-1, 1, 4]], ["tile_f", "sp", [-1, 2]], ["tile_y", "sp", [-1, 2, 10]], ["tile_x", "sp", [-1, 1, 4]]]}, "result": [[0.0366440557], 0, 17.419200658798218, 1615632019.4929051], "version": 0.2, "tvm_version": "0.8.dev0"}
{"input": ["opencl -keys=opencl,gpu -max_num_threads=256", "tutorial/conv2d_no_batching", [1, 40, 40, 512, 256, 1, 1, [1, 1], [0, 0]], {}], "config": {"index": 742, "code_hash": null, "entity": [["tile_rc", "sp", [-1, 1, 4]], ["tile_f", "sp", [-1, 4]], ["tile_y", "sp", [-1, 2, 10]], ["tile_x", "sp", [-1, 1, 4]]]}, "result": [[0.0190824342], 0, 14.750423669815063, 1615632016.8269491], "version": 0.2, "tvm_version": "0.8.dev0"}
{"input": ["opencl -keys=opencl,gpu -max_num_threads=256", "tutorial/conv2d_no_batching", [1, 40, 40, 512, 256, 1, 1, [1, 1], [0, 0]], {}], "config": {"index": 3605, "code_hash": null, "entity": [["tile_rc", "sp", [-1, 1, 4]], ["tile_f", "sp", [-1, 8]], ["tile_y", "sp", [-1, 1, 8]], ["tile_x", "sp", [-1, 5, 4]]]}, "result": [[0.0037098076], 0, 20.973856210708618, 1615632023.0713613], "version": 0.2, "tvm_version": "0.8.dev0"}
{"input": ["opencl -keys=opencl,gpu -max_num_threads=256", "tutorial/conv2d_no_batching", [1, 40, 40, 512, 256, 1, 1, [1, 1], [0, 0]], {}], "config": {"index": 2367, "code_hash": null, "entity": [["tile_rc", "sp", [-1, 2, 4]], ["tile_f", "sp", [-1, 4]], ["tile_y", "sp", [-1, 1, 4]], ["tile_x", "sp", [-1, 4, 4]]]}, "result": [[0.007736219599999999], 0, 19.290752410888672, 1615632021.4006855], "version": 0.2, "tvm_version": "0.8.dev0"}
{"input": ["opencl -keys=opencl,gpu -max_num_threads=256", "tutorial/conv2d_no_batching", [1, 40, 40, 512, 256, 1, 1, [1, 1], [0, 0]], {}], "config": {"index": 8477, "code_hash": null, "entity": [["tile_rc", "sp", [-1, 1, 4]], ["tile_f", "sp", [-1, 8]], ["tile_y", "sp", [-1, 2, 4]], ["tile_x", "sp", [-1, 1, 8]]]}, "result": [[0.0073184331000000005], 0, 1.807727336883545, 1615632025.1561954], "version": 0.2, "tvm_version": "0.8.dev0"}
{"input": ["opencl -keys=opencl,gpu -max_num_threads=256", "tutorial/conv2d_no_batching", [1, 40, 40, 512, 256, 1, 1, [1, 1], [0, 0]], {}], "config": {"index": 9485, "code_hash": null, "entity": [["tile_rc", "sp", [-1, 1, 4]], ["tile_f", "sp", [-1, 8]], ["tile_y", "sp", [-1, 2, 4]], ["tile_x", "sp", [-1, 2, 8]]]}, "result": [[0.0041624223], 0, 3.565347194671631, 1615632026.9176395], "version": 0.2, "tvm_version": "0.8.dev0"}
{"input": ["opencl -keys=opencl,gpu -max_num_threads=256", "tutorial/conv2d_no_batching", [1, 40, 40, 512, 256, 1, 1, [1, 1], [0, 0]], {}], "config": {"index": 2695, "code_hash": null, "entity": [["tile_rc", "sp", [-1, 1, 4]], ["tile_f", "sp", [-1, 2]], ["tile_y", "sp", [-1, 1, 10]], ["tile_x", "sp", [-1, 4, 4]]]}, "result": [[0.019587824900000002], 0, 5.681102514266968, 1615632029.0196583], "version": 0.2, "tvm_version": "0.8.dev0"}
{"input": ["opencl -keys=opencl,gpu -max_num_threads=256", "tutorial/conv2d_no_batching", [1, 40, 40, 512, 256, 1, 1, [1, 1], [0, 0]], {}], "config": {"index": 2702, "code_hash": null, "entity": [["tile_rc", "sp", [-1, 1, 4]], ["tile_f", "sp", [-1, 4]], ["tile_y", "sp", [-1, 1, 10]], ["tile_x", "sp", [-1, 4, 4]]]}, "result": [[0.0099982771], 0, 7.566259145736694, 1615632030.9256897], "version": 0.2, "tvm_version": "0.8.dev0"}
{"input": ["opencl -keys=opencl,gpu -max_num_threads=256", "tutorial/conv2d_no_batching", [1, 40, 40, 512, 256, 1, 1, [1, 1], [0, 0]], {}], "config": {"index": 4368, "code_hash": null, "entity": [["tile_rc", "sp", [-1, 1, 4]], ["tile_f", "sp", [-1, 1]], ["tile_y", "sp", [-1, 1, 4]], ["tile_x", "sp", [-1, 8, 4]]]}, "result": [[0.013085329400000002], 0, 9.391544342041016, 1615632032.8100438], "version": 0.2, "tvm_version": "0.8.dev0"}
{"input": ["opencl -keys=opencl,gpu -max_num_threads=256", "tutorial/conv2d_no_batching", [1, 40, 40, 512, 256, 1, 1, [1, 1], [0, 0]], {}], "config": {"index": 2584, "code_hash": null, "entity": [["tile_rc", "sp", [-1, 2, 4]], ["tile_f", "sp", [-1, 2]], ["tile_y", "sp", [-1, 1, 8]], ["tile_x", "sp", [-1, 4, 4]]]}, "result": [[0.01634421], 0, 11.628674030303955, 1615632034.9778962], "version": 0.2, "tvm_version": "0.8.dev0"}
{"input": ["opencl -keys=opencl,gpu -max_num_threads=256", "tutorial/conv2d_no_batching", [1, 40, 40, 512, 256, 1, 1, [1, 1], [0, 0]], {}], "config": {"index": 1583, "code_hash": null, "entity": [["tile_rc", "sp", [-1, 2, 4]], ["tile_f", "sp", [-1, 4]], ["tile_y", "sp", [-1, 1, 8]], ["tile_x", "sp", [-1, 2, 4]]]}, "result": [[0.0165919548], 0, 13.72590446472168, 1615632037.0914228], "version": 0.2, "tvm_version": "0.8.dev0"}
{"input": ["opencl -keys=opencl,gpu -max_num_threads=256", "tutorial/conv2d_no_batching", [1, 40, 40, 512, 256, 1, 1, [1, 1], [0, 0]], {}], "config": {"index": 575, "code_hash": null, "entity": [["tile_rc", "sp", [-1, 2, 4]], ["tile_f", "sp", [-1, 4]], ["tile_y", "sp", [-1, 1, 8]], ["tile_x", "sp", [-1, 1, 4]]]}, "result": [[0.0317186178], 0, 16.397719860076904, 1615632039.785309], "version": 0.2, "tvm_version": "0.8.dev0"}
{"input": ["opencl -keys=opencl,gpu -max_num_threads=256", "tutorial/conv2d_no_batching", [1, 40, 40, 512, 256, 1, 1, [1, 1], [0, 0]], {}], "config": {"index": 1576, "code_hash": null, "entity": [["tile_rc", "sp", [-1, 2, 4]], ["tile_f", "sp", [-1, 2]], ["tile_y", "sp", [-1, 1, 8]], ["tile_x", "sp", [-1, 2, 4]]]}, "result": [[0.0321512532], 0, 2.850687265396118, 1615632042.879069], "version": 0.2, "tvm_version": "0.8.dev0"}
{"input": ["opencl -keys=opencl,gpu -max_num_threads=256", "tutorial/conv2d_no_batching", [1, 40, 40, 512, 256, 1, 1, [1, 1], [0, 0]], {}], "config": {"index": 2751, "code_hash": null, "entity": [["tile_rc", "sp", [-1, 1, 4]], ["tile_f", "sp", [-1, 2]], ["tile_y", "sp", [-1, 2, 10]], ["tile_x", "sp", [-1, 4, 4]]]}, "result": [[0.0102554594], 0, 4.7966063022613525, 1615632044.8369534], "version": 0.2, "tvm_version": "0.8.dev0"}
{"input": ["opencl -keys=opencl,gpu -max_num_threads=256", "tutorial/conv2d_no_batching", [1, 40, 40, 512, 256, 1, 1, [1, 1], [0, 0]], {}], "config": {"index": 749, "code_hash": null, "entity": [["tile_rc", "sp", [-1, 1, 4]], ["tile_f", "sp", [-1, 8]], ["tile_y", "sp", [-1, 2, 10]], ["tile_x", "sp", [-1, 1, 4]]]}, "result": [[0.0101976521], 0, 6.654750347137451, 1615632046.7127945], "version": 0.2, "tvm_version": "0.8.dev0"}
{"input": ["opencl -keys=opencl,gpu -max_num_threads=256", "tutorial/conv2d_no_batching", [1, 40, 40, 512, 256, 1, 1, [1, 1], [0, 0]], {}], "config": {"index": 1757, "code_hash": null, "entity": [["tile_rc", "sp", [-1, 1, 4]], ["tile_f", "sp", [-1, 8]], ["tile_y", "sp", [-1, 2, 10]], ["tile_x", "sp", [-1, 2, 4]]]}, "result": [[0.0055035682], 0, 8.481796741485596, 1615632048.5276828], "version": 0.2, "tvm_version": "0.8.dev0"}
{"input": ["opencl -keys=opencl,gpu -max_num_threads=256", "tutorial/conv2d_no_batching", [1, 40, 40, 512, 256, 1, 1, [1, 1], [0, 0]], {}], "config": {"index": 2079, "code_hash": null, "entity": [["tile_rc", "sp", [-1, 1, 4]], ["tile_f", "sp", [-1, 2]], ["tile_y", "sp", [-1, 2, 2]], ["tile_x", "sp", [-1, 4, 4]]]}, "result": [[0.013823501399999999], 0, 10.302057266235352, 1615632050.4370737], "version": 0.2, "tvm_version": "0.8.dev0"}
{"input": ["opencl -keys=opencl,gpu -max_num_threads=256", "tutorial/conv2d_no_batching", [1, 40, 40, 512, 256, 1, 1, [1, 1], [0, 0]], {}], "config": {"index": 9142, "code_hash": null, "entity": [["tile_rc", "sp", [-1, 1, 4]], ["tile_f", "sp", [-1, 4]], ["tile_y", "sp", [-1, 2, 2]], ["tile_x", "sp", [-1, 2, 8]]]}, "result": [[0.0062438131000000004], 0, 12.150997400283813, 1615632052.2731016], "version": 0.2, "tvm_version": "0.8.dev0"}
{"input": ["opencl -keys=opencl,gpu -max_num_threads=256", "tutorial/conv2d_no_batching", [1, 40, 40, 512, 256, 1, 1, [1, 1], [0, 0]], {}], "config": {"index": 3584, "code_hash": null, "entity": [["tile_rc", "sp", [-1, 1, 4]], ["tile_f", "sp", [-1, 1]], ["tile_y", "sp", [-1, 1, 8]], ["tile_x", "sp", [-1, 5, 4]]]}, "result": [[0.023920512799999998], 0, 14.47226881980896, 1615632054.5759811], "version": 0.2, "tvm_version": "0.8.dev0"}
{"input": ["opencl -keys=opencl,gpu -max_num_threads=256", "tutorial/conv2d_no_batching", [1, 40, 40, 512, 256, 1, 1, [1, 1], [0, 0]], {}], "config": {"index": 4767, "code_hash": null, "entity": [["tile_rc", "sp", [-1, 1, 4]], ["tile_f", "sp", [-1, 2]], ["tile_y", "sp", [-1, 2, 10]], ["tile_x", "sp", [-1, 8, 4]]]}, "result": [[0.0053910995000000005], 0, 16.254822969436646, 1615632056.3439019], "version": 0.2, "tvm_version": "0.8.dev0"}
{"input": ["opencl -keys=opencl,gpu -max_num_threads=256", "tutorial/conv2d_no_batching", [1, 40, 40, 512, 256, 1, 1, [1, 1], [0, 0]], {}], "config": {"index": 1744, "code_hash": null, "entity": [["tile_rc", "sp", [-1, 2, 4]], ["tile_f", "sp", [-1, 2]], ["tile_y", "sp", [-1, 2, 10]], ["tile_x", "sp", [-1, 2, 4]]]}, "result": [[0.0608378863], 0, 3.740623712539673, 1615632069.814409], "version": 0.2, "tvm_version": "0.8.dev0"}
{"input": ["opencl -keys=opencl,gpu -max_num_threads=256", "tutorial/conv2d_no_batching", [1, 40, 40, 512, 256, 1, 1, [1, 1], [0, 0]], {}], "config": {"index": 743, "code_hash": null, "entity": [["tile_rc", "sp", [-1, 2, 4]], ["tile_f", "sp", [-1, 4]], ["tile_y", "sp", [-1, 2, 10]], ["tile_x", "sp", [-1, 1, 4]]]}, "result": [[0.06073227169999999], 0, 7.228082180023193, 1615632073.3770478], "version": 0.2, "tvm_version": "0.8.dev0"}
{"input": ["opencl -keys=opencl,gpu -max_num_threads=256", "tutorial/conv2d_no_batching", [1, 40, 40, 512, 256, 1, 1, [1, 1], [0, 0]], {}], "config": {"index": 1751, "code_hash": null, "entity": [["tile_rc", "sp", [-1, 2, 4]], ["tile_f", "sp", [-1, 4]], ["tile_y", "sp", [-1, 2, 10]], ["tile_x", "sp", [-1, 2, 4]]]}, "result": [[0.0323060553], 0, 9.920812606811523, 1615632076.073518], "version": 0.2, "tvm_version": "0.8.dev0"}
{"input": ["opencl -keys=opencl,gpu -max_num_threads=256", "tutorial/conv2d_no_batching", [1, 40, 40, 512, 256, 1, 1, [1, 1], [0, 0]], {}], "config": {"index": 4095, "code_hash": null, "entity": [["tile_rc", "sp", [-1, 1, 4]], ["tile_f", "sp", [-1, 2]], ["tile_y", "sp", [-1, 2, 2]], ["tile_x", "sp", [-1, 8, 4]]]}, "result": [[0.0070287507], 0, 11.6053307056427, 1615632077.8345704], "version": 0.2, "tvm_version": "0.8.dev0"}
{"input": ["opencl -keys=opencl,gpu -max_num_threads=256", "tutorial/conv2d_no_batching", [1, 40, 40, 512, 256, 1, 1, [1, 1], [0, 0]], {}], "config": {"index": 3606, "code_hash": null, "entity": [["tile_rc", "sp", [-1, 2, 4]], ["tile_f", "sp", [-1, 8]], ["tile_y", "sp", [-1, 1, 8]], ["tile_x", "sp", [-1, 5, 4]]]}, "result": [[0.0039245524], 0, 13.355854988098145, 1615632079.5061889], "version": 0.2, "tvm_version": "0.8.dev0"}
{"input": ["opencl -keys=opencl,gpu -max_num_threads=256", "tutorial/conv2d_no_batching", [1, 40, 40, 512, 256, 1, 1, [1, 1], [0, 0]], {}], "config": {"index": 3381, "code_hash": null, "entity": [["tile_rc", "sp", [-1, 1, 4]], ["tile_f", "sp", [-1, 8]], ["tile_y", "sp", [-1, 1, 4]], ["tile_x", "sp", [-1, 5, 4]]]}, "result": [[0.0029951408999999997], 0, 1.642301082611084, 1615632133.688047], "version": 0.2, "tvm_version": "0.8.dev0"}
{"input": ["opencl -keys=opencl,gpu -max_num_threads=256", "tutorial/conv2d_no_batching", [1, 40, 40, 512, 256, 1, 1, [1, 1], [0, 0]], {}], "config": {"index": 4389, "code_hash": null, "entity": [["tile_rc", "sp", [-1, 1, 4]], ["tile_f", "sp", [-1, 8]], ["tile_y", "sp", [-1, 1, 4]], ["tile_x", "sp", [-1, 8, 4]]]}, "result": [[0.0021147294000000002], 0, 3.4096415042877197, 1615632135.4222383], "version": 0.2, "tvm_version": "0.8.dev0"}
{"input": ["opencl -keys=opencl,gpu -max_num_threads=256", "tutorial/conv2d_no_batching", [1, 40, 40, 512, 256, 1, 1, [1, 1], [0, 0]], {}], "config": {"index": 2429, "code_hash": null, "entity": [["tile_rc", "sp", [-1, 1, 4]], ["tile_f", "sp", [-1, 8]], ["tile_y", "sp", [-1, 2, 4]], ["tile_x", "sp", [-1, 4, 4]]]}, "result": [[0.0020629273], 0, 5.027633190155029, 1615632137.0097506], "version": 0.2, "tvm_version": "0.8.dev0"}
{"input": ["opencl -keys=opencl,gpu -max_num_threads=256", "tutorial/conv2d_no_batching", [1, 40, 40, 512, 256, 1, 1, [1, 1], [0, 0]], {}], "config": {"index": 10150, "code_hash": null, "entity": [["tile_rc", "sp", [-1, 1, 4]], ["tile_f", "sp", [-1, 4]], ["tile_y", "sp", [-1, 2, 2]], ["tile_x", "sp", [-1, 4, 8]]]}, "result": [[0.0035664326000000002], 0, 6.608675241470337, 1615632138.5904865], "version": 0.2, "tvm_version": "0.8.dev0"}
{"input": ["opencl -keys=opencl,gpu -max_num_threads=256", "tutorial/conv2d_no_batching", [1, 40, 40, 512, 256, 1, 1, [1, 1], [0, 0]], {}], "config": {"index": 5390, "code_hash": null, "entity": [["tile_rc", "sp", [-1, 1, 4]], ["tile_f", "sp", [-1, 4]], ["tile_y", "sp", [-1, 1, 4]], ["tile_x", "sp", [-1, 10, 4]]]}, "result": [[0.0030309847000000003], 0, 8.130084037780762, 1615632140.1760988], "version": 0.2, "tvm_version": "0.8.dev0"}
{"input": ["opencl -keys=opencl,gpu -max_num_threads=256", "tutorial/conv2d_no_batching", [1, 40, 40, 512, 256, 1, 1, [1, 1], [0, 0]], {}], "config": {"index": 11109, "code_hash": null, "entity": [["tile_rc", "sp", [-1, 1, 4]], ["tile_f", "sp", [-1, 8]], ["tile_y", "sp", [-1, 1, 2]], ["tile_x", "sp", [-1, 5, 8]]]}, "result": [[0.0028842347], 0, 11.486517190933228, 1615632143.5059228], "version": 0.2, "tvm_version": "0.8.dev0"}
{"input": ["opencl -keys=opencl,gpu -max_num_threads=256", "tutorial/conv2d_no_batching", [1, 40, 40, 512, 256, 1, 1, [1, 1], [0, 0]], {}], "config": {"index": 3430, "code_hash": null, "entity": [["tile_rc", "sp", [-1, 1, 4]], ["tile_f", "sp", [-1, 4]], ["tile_y", "sp", [-1, 2, 4]], ["tile_x", "sp", [-1, 5, 4]]]}, "result": [[0.0032101566], 0, 9.804512739181519, 1615632141.834982], "version": 0.2, "tvm_version": "0.8.dev0"}
{"input": ["opencl -keys=opencl,gpu -max_num_threads=256", "tutorial/conv2d_no_batching", [1, 40, 40, 512, 256, 1, 1, [1, 1], [0, 0]], {}], "config": {"index": 10157, "code_hash": null, "entity": [["tile_rc", "sp", [-1, 1, 4]], ["tile_f", "sp", [-1, 8]], ["tile_y", "sp", [-1, 2, 2]], ["tile_x", "sp", [-1, 4, 8]]]}, "result": [[0.0020607658000000003], 0, 13.076692819595337, 1615632145.1447387], "version": 0.2, "tvm_version": "0.8.dev0"}
{"input": ["opencl -keys=opencl,gpu -max_num_threads=256", "tutorial/conv2d_no_batching", [1, 40, 40, 512, 256, 1, 1, [1, 1], [0, 0]], {}], "config": {"index": 11445, "code_hash": null, "entity": [["tile_rc", "sp", [-1, 1, 4]], ["tile_f", "sp", [-1, 8]], ["tile_y", "sp", [-1, 1, 4]], ["tile_x", "sp", [-1, 5, 8]]]}, "result": [[0.0036212295], 0, 1.670046329498291, 1615632147.059531], "version": 0.2, "tvm_version": "0.8.dev0"}
{"input": ["opencl -keys=opencl,gpu -max_num_threads=256", "tutorial/conv2d_no_batching", [1, 40, 40, 512, 256, 1, 1, [1, 1], [0, 0]], {}], "config": {"index": 4438, "code_hash": null, "entity": [["tile_rc", "sp", [-1, 1, 4]], ["tile_f", "sp", [-1, 4]], ["tile_y", "sp", [-1, 2, 4]], ["tile_x", "sp", [-1, 8, 4]]]}, "result": [[0.0020744897000000003], 0, 3.176792621612549, 1615632148.6032813], "version": 0.2, "tvm_version": "0.8.dev0"}
{"input": ["opencl -keys=opencl,gpu -max_num_threads=256", "tutorial/conv2d_no_batching", [1, 40, 40, 512, 256, 1, 1, [1, 1], [0, 0]], {}], "config": {"index": 10437, "code_hash": null, "entity": [["tile_rc", "sp", [-1, 1, 4]], ["tile_f", "sp", [-1, 8]], ["tile_y", "sp", [-1, 1, 4]], ["tile_x", "sp", [-1, 4, 8]]]}, "result": [[0.0042764327], 0, 4.938568353652954, 1615632150.337918], "version": 0.2, "tvm_version": "0.8.dev0"}
{"input": ["opencl -keys=opencl,gpu -max_num_threads=256", "tutorial/conv2d_no_batching", [1, 40, 40, 512, 256, 1, 1, [1, 1], [0, 0]], {}], "config": {"index": 4396, "code_hash": null, "entity": [["tile_rc", "sp", [-1, 1, 4]], ["tile_f", "sp", [-1, 16]], ["tile_y", "sp", [-1, 1, 4]], ["tile_x", "sp", [-1, 8, 4]]]}, "result": [[0.0020450835000000002], 0, 6.543219327926636, 1615632151.9871933], "version": 0.2, "tvm_version": "0.8.dev0"}
{"input": ["opencl -keys=opencl,gpu -max_num_threads=256", "tutorial/conv2d_no_batching", [1, 40, 40, 512, 256, 1, 1, [1, 1], [0, 0]], {}], "config": {"index": 3437, "code_hash": null, "entity": [["tile_rc", "sp", [-1, 1, 4]], ["tile_f", "sp", [-1, 8]], ["tile_y", "sp", [-1, 2, 4]], ["tile_x", "sp", [-1, 5, 4]]]}, "result": [[0.0029186462], 0, 8.170213460922241, 1615632153.6262083], "version": 0.2, "tvm_version": "0.8.dev0"}
{"input": ["opencl -keys=opencl,gpu -max_num_threads=256", "tutorial/conv2d_no_batching", [1, 40, 40, 512, 256, 1, 1, [1, 1], [0, 0]], {}], "config": {"index": 10486, "code_hash": null, "entity": [["tile_rc", "sp", [-1, 1, 4]], ["tile_f", "sp", [-1, 4]], ["tile_y", "sp", [-1, 2, 4]], ["tile_x", "sp", [-1, 4, 8]]]}, "result": [[0.0043413546], 0, 9.907082796096802, 1615632155.3298378], "version": 0.2, "tvm_version": "0.8.dev0"}
{"input": ["opencl -keys=opencl,gpu -max_num_threads=256", "tutorial/conv2d_no_batching", [1, 40, 40, 512, 256, 1, 1, [1, 1], [0, 0]], {}], "config": {"index": 11158, "code_hash": null, "entity": [["tile_rc", "sp", [-1, 1, 4]], ["tile_f", "sp", [-1, 4]], ["tile_y", "sp", [-1, 2, 2]], ["tile_x", "sp", [-1, 5, 8]]]}, "result": [[0.0029949378], 0, 11.531800746917725, 1615632157.0005307], "version": 0.2, "tvm_version": "0.8.dev0"}
{"input": ["opencl -keys=opencl,gpu -max_num_threads=256", "tutorial/conv2d_no_batching", [1, 40, 40, 512, 256, 1, 1, [1, 1], [0, 0]], {}], "config": {"index": 2436, "code_hash": null, "entity": [["tile_rc", "sp", [-1, 1, 4]], ["tile_f", "sp", [-1, 16]], ["tile_y", "sp", [-1, 2, 4]], ["tile_x", "sp", [-1, 4, 4]]]}, "result": [[0.0019417242000000002], 0, 13.114441156387329, 1615632158.5865958], "version": 0.2, "tvm_version": "0.8.dev0"}
{"input": ["opencl -keys=opencl,gpu -max_num_threads=256", "tutorial/conv2d_no_batching", [1, 40, 40, 512, 256, 1, 1, [1, 1], [0, 0]], {}], "config": {"index": 3388, "code_hash": null, "entity": [["tile_rc", "sp", [-1, 1, 4]], ["tile_f", "sp", [-1, 16]], ["tile_y", "sp", [-1, 1, 4]], ["tile_x", "sp", [-1, 5, 4]]]}, "result": [[0.0028813597], 0, 1.6660234928131104, 1615632160.543078], "version": 0.2, "tvm_version": "0.8.dev0"}
{"input": ["opencl -keys=opencl,gpu -max_num_threads=256", "tutorial/conv2d_no_batching", [1, 40, 40, 512, 256, 1, 1, [1, 1], [0, 0]], {}], "config": {"index": 9254, "code_hash": null, "entity": [["tile_rc", "sp", [-1, 1, 4]], ["tile_f", "sp", [-1, 4]], ["tile_y", "sp", [-1, 5, 2]], ["tile_x", "sp", [-1, 2, 8]]]}, "result": [[0.0031319014], 0, 3.241652727127075, 1615632162.1154585], "version": 0.2, "tvm_version": "0.8.dev0"}
{"input": ["opencl -keys=opencl,gpu -max_num_threads=256", "tutorial/conv2d_no_batching", [1, 40, 40, 512, 256, 1, 1, [1, 1], [0, 0]], {}], "config": {"index": 4390, "code_hash": null, "entity": [["tile_rc", "sp", [-1, 2, 4]], ["tile_f", "sp", [-1, 8]], ["tile_y", "sp", [-1, 1, 4]], ["tile_x", "sp", [-1, 8, 4]]]}, "result": [[0.0023783544], 0, 4.832136631011963, 1615632163.6990838], "version": 0.2, "tvm_version": "0.8.dev0"}
{"input": ["opencl -keys=opencl,gpu -max_num_threads=256", "tutorial/conv2d_no_batching", [1, 40, 40, 512, 256, 1, 1, [1, 1], [0, 0]], {}], "config": {"index": 1470, "code_hash": null, "entity": [["tile_rc", "sp", [-1, 1, 4]], ["tile_f", "sp", [-1, 4]], ["tile_y", "sp", [-1, 5, 4]], ["tile_x", "sp", [-1, 2, 4]]]}, "result": [[0.0030052399], 0, 8.268638610839844, 1615632167.1651735], "version": 0.2, "tvm_version": "0.8.dev0"}
{"input": ["opencl -keys=opencl,gpu -max_num_threads=256", "tutorial/conv2d_no_batching", [1, 40, 40, 512, 256, 1, 1, [1, 1], [0, 0]], {}], "config": {"index": 2709, "code_hash": null, "entity": [["tile_rc", "sp", [-1, 1, 4]], ["tile_f", "sp", [-1, 8]], ["tile_y", "sp", [-1, 1, 10]], ["tile_x", "sp", [-1, 4, 4]]]}, "result": [[0.0053792922], 0, 6.671363830566406, 1615632165.5410438], "version": 0.2, "tvm_version": "0.8.dev0"}
{"input": ["opencl -keys=opencl,gpu -max_num_threads=256", "tutorial/conv2d_no_batching", [1, 40, 40, 512, 256, 1, 1, [1, 1], [0, 0]], {}], "config": {"index": 2373, "code_hash": null, "entity": [["tile_rc", "sp", [-1, 1, 4]], ["tile_f", "sp", [-1, 8]], ["tile_y", "sp", [-1, 1, 4]], ["tile_x", "sp", [-1, 4, 4]]]}, "result": [[0.0035724587000000004], 0, 9.815963745117188, 1615632168.7414637], "version": 0.2, "tvm_version": "0.8.dev0"}
{"input": ["opencl -keys=opencl,gpu -max_num_threads=256", "tutorial/conv2d_no_batching", [1, 40, 40, 512, 256, 1, 1, [1, 1], [0, 0]], {}], "config": {"index": 9205, "code_hash": null, "entity": [["tile_rc", "sp", [-1, 1, 4]], ["tile_f", "sp", [-1, 8]], ["tile_y", "sp", [-1, 4, 2]], ["tile_x", "sp", [-1, 2, 8]]]}, "result": [[0.0020216773], 0, 12.959112167358398, 1615632171.882654], "version": 0.2, "tvm_version": "0.8.dev0"}
{"input": ["opencl -keys=opencl,gpu -max_num_threads=256", "tutorial/conv2d_no_batching", [1, 40, 40, 512, 256, 1, 1, [1, 1], [0, 0]], {}], "config": {"index": 11165, "code_hash": null, "entity": [["tile_rc", "sp", [-1, 1, 4]], ["tile_f", "sp", [-1, 8]], ["tile_y", "sp", [-1, 2, 2]], ["tile_x", "sp", [-1, 5, 8]]]}, "result": [[0.0028843805], 0, 11.334408521652222, 1615632170.252961], "version": 0.2, "tvm_version": "0.8.dev0"}
{"input": ["opencl -keys=opencl,gpu -max_num_threads=256", "tutorial/conv2d_no_batching", [1, 40, 40, 512, 256, 1, 1, [1, 1], [0, 0]], {}], "config": {"index": 10493, "code_hash": null, "entity": [["tile_rc", "sp", [-1, 1, 4]], ["tile_f", "sp", [-1, 8]], ["tile_y", "sp", [-1, 2, 4]], ["tile_x", "sp", [-1, 4, 8]]]}, "result": [[0.0023189586], 0, 1.6619610786437988, 1615632173.7892501], "version": 0.2, "tvm_version": "0.8.dev0"}
{"input": ["opencl -keys=opencl,gpu -max_num_threads=256", "tutorial/conv2d_no_batching", [1, 40, 40, 512, 256, 1, 1, [1, 1], [0, 0]], {}], "config": {"index": 5397, "code_hash": null, "entity": [["tile_rc", "sp", [-1, 1, 4]], ["tile_f", "sp", [-1, 8]], ["tile_y", "sp", [-1, 1, 4]], ["tile_x", "sp", [-1, 10, 4]]]}, "result": [[0.0028731253], 0, 3.3200738430023193, 1615632175.4908288], "version": 0.2, "tvm_version": "0.8.dev0"}
{"input": ["opencl -keys=opencl,gpu -max_num_threads=256", "tutorial/conv2d_no_batching", [1, 40, 40, 512, 256, 1, 1, [1, 1], [0, 0]], {}], "config": {"index": 2380, "code_hash": null, "entity": [["tile_rc", "sp", [-1, 1, 4]], ["tile_f", "sp", [-1, 16]], ["tile_y", "sp", [-1, 1, 4]], ["tile_x", "sp", [-1, 4, 4]]]}, "result": [[0.0019815836], 0, 4.901476860046387, 1615632177.08982], "version": 0.2, "tvm_version": "0.8.dev0"}
{"input": ["opencl -keys=opencl,gpu -max_num_threads=256", "tutorial/conv2d_no_batching", [1, 40, 40, 512, 256, 1, 1, [1, 1], [0, 0]], {}], "config": {"index": 8302, "code_hash": null, "entity": [["tile_rc", "sp", [-1, 1, 4]], ["tile_f", "sp", [-1, 4]], ["tile_y", "sp", [-1, 10, 2]], ["tile_x", "sp", [-1, 1, 8]]]}, "result": [[0.0031338128], 0, 6.526593923568726, 1615632178.7285645], "version": 0.2, "tvm_version": "0.8.dev0"}
{"input": ["opencl -keys=opencl,gpu -max_num_threads=256", "tutorial/conv2d_no_batching", [1, 40, 40, 512, 256, 1, 1, [1, 1], [0, 0]], {}], "config": {"index": 4445, "code_hash": null, "entity": [["tile_rc", "sp", [-1, 1, 4]], ["tile_f", "sp", [-1, 8]], ["tile_y", "sp", [-1, 2, 4]], ["tile_x", "sp", [-1, 8, 4]]]}, "result": [[0.0019724533], 0, 8.196417570114136, 1615632180.3927598], "version": 0.2, "tvm_version": "0.8.dev0"}
{"input": ["opencl -keys=opencl,gpu -max_num_threads=256", "tutorial/conv2d_no_batching", [1, 40, 40, 512, 256, 1, 1, [1, 1], [0, 0]], {}], "config": {"index": 10164, "code_hash": null, "entity": [["tile_rc", "sp", [-1, 1, 4]], ["tile_f", "sp", [-1, 16]], ["tile_y", "sp", [-1, 2, 2]], ["tile_x", "sp", [-1, 4, 8]]]}, "result": [[0.0020560627000000002], 0, 9.856451511383057, 1615632182.0693026], "version": 0.2, "tvm_version": "0.8.dev0"}
{"input": ["opencl -keys=opencl,gpu -max_num_threads=256", "tutorial/conv2d_no_batching", [1, 40, 40, 512, 256, 1, 1, [1, 1], [0, 0]], {}], "config": {"index": 11116, "code_hash": null, "entity": [["tile_rc", "sp", [-1, 1, 4]], ["tile_f", "sp", [-1, 16]], ["tile_y", "sp", [-1, 1, 2]], ["tile_x", "sp", [-1, 5, 8]]]}, "result": [[0.0028512503], 0, 11.566875696182251, 1615632183.7793825], "version": 0.2, "tvm_version": "0.8.dev0"}
{"input": ["opencl -keys=opencl,gpu -max_num_threads=256", "tutorial/conv2d_no_batching", [1, 40, 40, 512, 256, 1, 1, [1, 1], [0, 0]], {}], "config": {"index": 16149, "code_hash": null, "entity": [["tile_rc", "sp", [-1, 1, 4]], ["tile_f", "sp", [-1, 8]], ["tile_y", "sp", [-1, 1, 2]], ["tile_x", "sp", [-1, 5, 16]]]}, "result": [[0.0035265993], 0, 13.221275091171265, 1615632185.4183414], "version": 0.2, "tvm_version": "0.8.dev0"}
{"input": ["opencl -keys=opencl,gpu -max_num_threads=256", "tutorial/conv2d_no_batching", [1, 40, 40, 512, 256, 1, 1, [1, 1], [0, 0]], {}], "config": {"index": 1428, "code_hash": null, "entity": [["tile_rc", "sp", [-1, 1, 4]], ["tile_f", "sp", [-1, 16]], ["tile_y", "sp", [-1, 2, 4]], ["tile_x", "sp", [-1, 2, 4]]]}, "result": [[0.0019326719999999999], 0, 1.6960620880126953, 1615632187.4013557], "version": 0.2, "tvm_version": "0.8.dev0"}
{"input": ["opencl -keys=opencl,gpu -max_num_threads=256", "tutorial/conv2d_no_batching", [1, 40, 40, 512, 256, 1, 1, [1, 1], [0, 0]], {}], "config": {"index": 8253, "code_hash": null, "entity": [["tile_rc", "sp", [-1, 1, 4]], ["tile_f", "sp", [-1, 8]], ["tile_y", "sp", [-1, 5, 2]], ["tile_x", "sp", [-1, 1, 8]]]}, "result": [[0.003043417], 0, 3.385647773742676, 1615632189.107572], "version": 0.2, "tvm_version": "0.8.dev0"}
{"input": ["opencl -keys=opencl,gpu -max_num_threads=256", "tutorial/conv2d_no_batching", [1, 40, 40, 512, 256, 1, 1, [1, 1], [0, 0]], {}], "config": {"index": 2430, "code_hash": null, "entity": [["tile_rc", "sp", [-1, 2, 4]], ["tile_f", "sp", [-1, 8]], ["tile_y", "sp", [-1, 2, 4]], ["tile_x", "sp", [-1, 4, 4]]]}, "result": [[0.0023427971], 0, 5.0016069412231445, 1615632190.7106931], "version": 0.2, "tvm_version": "0.8.dev0"}
{"input": ["opencl -keys=opencl,gpu -max_num_threads=256", "tutorial/conv2d_no_batching", [1, 40, 40, 512, 256, 1, 1, [1, 1], [0, 0]], {}], "config": {"index": 5614, "code_hash": null, "entity": [["tile_rc", "sp", [-1, 1, 4]], ["tile_f", "sp", [-1, 4]], ["tile_y", "sp", [-1, 1, 8]], ["tile_x", "sp", [-1, 10, 4]]]}, "result": [[0.0035431253000000004], 0, 6.708988666534424, 1615632192.4168463], "version": 0.2, "tvm_version": "0.8.dev0"}
{"input": ["opencl -keys=opencl,gpu -max_num_threads=256", "tutorial/conv2d_no_batching", [1, 40, 40, 512, 256, 1, 1, [1, 1], [0, 0]], {}], "config": {"index": 2478, "code_hash": null, "entity": [["tile_rc", "sp", [-1, 1, 4]], ["tile_f", "sp", [-1, 4]], ["tile_y", "sp", [-1, 5, 4]], ["tile_x", "sp", [-1, 4, 4]]]}, "result": [[0.0029359691], 0, 8.36733627319336, 1615632194.1003258], "version": 0.2, "tvm_version": "0.8.dev0"}
{"input": ["opencl -keys=opencl,gpu -max_num_threads=256", "tutorial/conv2d_no_batching", [1, 40, 40, 512, 256, 1, 1, [1, 1], [0, 0]], {}], "config": {"index": 15197, "code_hash": null, "entity": [["tile_rc", "sp", [-1, 1, 4]], ["tile_f", "sp", [-1, 8]], ["tile_y", "sp", [-1, 2, 2]], ["tile_x", "sp", [-1, 2, 16]]]}, "result": [[0.0042287765], 0, 10.053394079208374, 1615632195.764455], "version": 0.2, "tvm_version": "0.8.dev0"}
{"input": ["opencl -keys=opencl,gpu -max_num_threads=256", "tutorial/conv2d_no_batching", [1, 40, 40, 512, 256, 1, 1, [1, 1], [0, 0]], {}], "config": {"index": 9261, "code_hash": null, "entity": [["tile_rc", "sp", [-1, 1, 4]], ["tile_f", "sp", [-1, 8]], ["tile_y", "sp", [-1, 5, 2]], ["tile_x", "sp", [-1, 2, 8]]]}, "result": [[0.0029670836], 0, 11.516152381896973, 1615632197.2674627], "version": 0.2, "tvm_version": "0.8.dev0"}
{"input": ["opencl -keys=opencl,gpu -max_num_threads=256", "tutorial/conv2d_no_batching", [1, 40, 40, 512, 256, 1, 1, [1, 1], [0, 0]], {}], "config": {"index": 10101, "code_hash": null, "entity": [["tile_rc", "sp", [-1, 1, 4]], ["tile_f", "sp", [-1, 8]], ["tile_y", "sp", [-1, 1, 2]], ["tile_x", "sp", [-1, 4, 8]]]}, "result": [[0.0035088181000000004], 0, 13.275316953659058, 1615632199.0329406], "version": 0.2, "tvm_version": "0.8.dev0"}
{"input": ["opencl -keys=opencl,gpu -max_num_threads=256", "tutorial/conv2d_no_batching", [1, 40, 40, 512, 256, 1, 1, [1, 1], [0, 0]], {}], "config": {"index": 5446, "code_hash": null, "entity": [["tile_rc", "sp", [-1, 1, 4]], ["tile_f", "sp", [-1, 4]], ["tile_y", "sp", [-1, 2, 4]], ["tile_x", "sp", [-1, 10, 4]]]}, "result": [[0.0029559326], 0, 1.6960418224334717, 1615632200.9850626], "version": 0.2, "tvm_version": "0.8.dev0"}
{"input": ["opencl -keys=opencl,gpu -max_num_threads=256", "tutorial/conv2d_no_batching", [1, 40, 40, 512, 256, 1, 1, [1, 1], [0, 0]], {}], "config": {"index": 4494, "code_hash": null, "entity": [["tile_rc", "sp", [-1, 1, 4]], ["tile_f", "sp", [-1, 4]], ["tile_y", "sp", [-1, 5, 4]], ["tile_x", "sp", [-1, 8, 4]]]}, "result": [[0.0022627398], 0, 3.290421962738037, 1615632202.592417], "version": 0.2, "tvm_version": "0.8.dev0"}
{"input": ["opencl -keys=opencl,gpu -max_num_threads=256", "tutorial/conv2d_no_batching", [1, 40, 40, 512, 256, 1, 1, [1, 1], [0, 0]], {}], "config": {"index": 12110, "code_hash": null, "entity": [["tile_rc", "sp", [-1, 1, 4]], ["tile_f", "sp", [-1, 4]], ["tile_y", "sp", [-1, 1, 2]], ["tile_x", "sp", [-1, 10, 8]]]}, "result": [[0.0030051305], 0, 4.880113363265991, 1615632204.1898744], "version": 0.2, "tvm_version": "0.8.dev0"}
{"input": ["opencl -keys=opencl,gpu -max_num_threads=256", "tutorial/conv2d_no_batching", [1, 40, 40, 512, 256, 1, 1, [1, 1], [0, 0]], {}], "config": {"index": 3444, "code_hash": null, "entity": [["tile_rc", "sp", [-1, 1, 4]], ["tile_f", "sp", [-1, 16]], ["tile_y", "sp", [-1, 2, 4]], ["tile_x", "sp", [-1, 5, 4]]]}, "result": [[0.0022489534], 0, 6.451799631118774, 1615632205.778345], "version": 0.2, "tvm_version": "0.8.dev0"}
{"input": ["opencl -keys=opencl,gpu -max_num_threads=256", "tutorial/conv2d_no_batching", [1, 40, 40, 512, 256, 1, 1, [1, 1], [0, 0]], {}], "config": {"index": 9212, "code_hash": null, "entity": [["tile_rc", "sp", [-1, 1, 4]], ["tile_f", "sp", [-1, 16]], ["tile_y", "sp", [-1, 4, 2]], ["tile_x", "sp", [-1, 2, 8]]]}, "result": [[0.001939495], 0, 8.07979965209961, 1615632207.4169517], "version": 0.2, "tvm_version": "0.8.dev0"}
{"input": ["opencl -keys=opencl,gpu -max_num_threads=256", "tutorial/conv2d_no_batching", [1, 40, 40, 512, 256, 1, 1, [1, 1], [0, 0]], {}], "config": {"index": 3395, "code_hash": null, "entity": [["tile_rc", "sp", [-1, 1, 4]], ["tile_f", "sp", [-1, 32]], ["tile_y", "sp", [-1, 1, 4]], ["tile_x", "sp", [-1, 5, 4]]]}, "result": [[0.0023065991], 0, 12.951860666275024, 1615632212.29325], "version": 0.2, "tvm_version": "0.8.dev0"}
{"input": ["opencl -keys=opencl,gpu -max_num_threads=256", "tutorial/conv2d_no_batching", [1, 40, 40, 512, 256, 1, 1, [1, 1], [0, 0]], {}], "config": {"index": 12117, "code_hash": null, "entity": [["tile_rc", "sp", [-1, 1, 4]], ["tile_f", "sp", [-1, 8]], ["tile_y", "sp", [-1, 1, 2]], ["tile_x", "sp", [-1, 10, 8]]]}, "result": [[0.0029398961], 0, 9.700990200042725, 1615632209.0451066], "version": 0.2, "tvm_version": "0.8.dev0"}
{"input": ["opencl -keys=opencl,gpu -max_num_threads=256", "tutorial/conv2d_no_batching", [1, 40, 40, 512, 256, 1, 1, [1, 1], [0, 0]], {}], "config": {"index": 10206, "code_hash": null, "entity": [["tile_rc", "sp", [-1, 1, 4]], ["tile_f", "sp", [-1, 4]], ["tile_y", "sp", [-1, 4, 2]], ["tile_x", "sp", [-1, 4, 8]]]}, "result": [[0.0019990887], 0, 11.346051692962646, 1615632210.693166], "version": 0.2, "tvm_version": "0.8.dev0"}
{"input": ["opencl -keys=opencl,gpu -max_num_threads=256", "tutorial/conv2d_no_batching", [1, 40, 40, 512, 256, 1, 1, [1, 1], [0, 0]], {}], "config": {"index": 3717, "code_hash": null, "entity": [["tile_rc", "sp", [-1, 1, 4]], ["tile_f", "sp", [-1, 8]], ["tile_y", "sp", [-1, 1, 10]], ["tile_x", "sp", [-1, 5, 4]]]}, "result": [[0.0046102192], 0, 1.6975746154785156, 1615632214.2511458], "version": 0.2, "tvm_version": "0.8.dev0"}
{"input": ["opencl -keys=opencl,gpu -max_num_threads=256", "tutorial/conv2d_no_batching", [1, 40, 40, 512, 256, 1, 1, [1, 1], [0, 0]], {}], "config": {"index": 7462, "code_hash": null, "entity": [["tile_rc", "sp", [-1, 1, 4]], ["tile_f", "sp", [-1, 4]], ["tile_y", "sp", [-1, 2, 4]], ["tile_x", "sp", [-1, 40, 4]]]}, "result": [[0.0021545366], 0, 3.3322365283966064, 1615632215.9448857], "version": 0.2, "tvm_version": "0.8.dev0"}
{"input": ["opencl -keys=opencl,gpu -max_num_threads=256", "tutorial/conv2d_no_batching", [1, 40, 40, 512, 256, 1, 1, [1, 1], [0, 0]], {}], "config": {"index": 10171, "code_hash": null, "entity": [["tile_rc", "sp", [-1, 1, 4]], ["tile_f", "sp", [-1, 32]], ["tile_y", "sp", [-1, 2, 2]], ["tile_x", "sp", [-1, 4, 8]]]}, "result": [[0.0020632762], 0, 4.999207973480225, 1615632217.6120672], "version": 0.2, "tvm_version": "0.8.dev0"}
{"input": ["opencl -keys=opencl,gpu -max_num_threads=256", "tutorial/conv2d_no_batching", [1, 40, 40, 512, 256, 1, 1, [1, 1], [0, 0]], {}], "config": {"index": 1526, "code_hash": null, "entity": [["tile_rc", "sp", [-1, 1, 4]], ["tile_f", "sp", [-1, 4]], ["tile_y", "sp", [-1, 10, 4]], ["tile_x", "sp", [-1, 2, 4]]]}, "result": [[0.0029960628], 0, 6.557122468948364, 1615632219.1855936], "version": 0.2, "tvm_version": "0.8.dev0"}
{"input": ["opencl -keys=opencl,gpu -max_num_threads=256", "tutorial/conv2d_no_batching", [1, 40, 40, 512, 256, 1, 1, [1, 1], [0, 0]], {}], "config": {"index": 19229, "code_hash": null, "entity": [["tile_rc", "sp", [-1, 1, 4]], ["tile_f", "sp", [-1, 8]], ["tile_y", "sp", [-1, 2, 2]], ["tile_x", "sp", [-1, 2, 20]]]}, "result": [[0.0053843131], 0, 8.314553499221802, 1615632220.8983705], "version": 0.2, "tvm_version": "0.8.dev0"}
{"input": ["opencl -keys=opencl,gpu -max_num_threads=256", "tutorial/conv2d_no_batching", [1, 40, 40, 512, 256, 1, 1, [1, 1], [0, 0]], {}], "config": {"index": 4397, "code_hash": null, "entity": [["tile_rc", "sp", [-1, 2, 4]], ["tile_f", "sp", [-1, 16]], ["tile_y", "sp", [-1, 1, 4]], ["tile_x", "sp", [-1, 8, 4]]]}, "result": [[0.0022534221], 0, 9.871707439422607, 1615632222.5049863], "version": 0.2, "tvm_version": "0.8.dev0"}
{"input": ["opencl -keys=opencl,gpu -max_num_threads=256", "tutorial/conv2d_no_batching", [1, 40, 40, 512, 256, 1, 1, [1, 1], [0, 0]], {}], "config": {"index": 9310, "code_hash": null, "entity": [["tile_rc", "sp", [-1, 1, 4]], ["tile_f", "sp", [-1, 4]], ["tile_y", "sp", [-1, 10, 2]], ["tile_x", "sp", [-1, 2, 8]]]}, "result": [[0.0029676566], 0, 11.584217309951782, 1615632224.2327313], "version": 0.2, "tvm_version": "0.8.dev0"}
{"input": ["opencl -keys=opencl,gpu -max_num_threads=256", "tutorial/conv2d_no_batching", [1, 40, 40, 512, 256, 1, 1, [1, 1], [0, 0]], {}], "config": {"index": 2443, "code_hash": null, "entity": [["tile_rc", "sp", [-1, 1, 4]], ["tile_f", "sp", [-1, 32]], ["tile_y", "sp", [-1, 2, 4]], ["tile_x", "sp", [-1, 4, 4]]]}, "result": [[0.0019350367], 0, 13.150346517562866, 1615632225.8058512], "version": 0.2, "tvm_version": "0.8.dev0"}
{"input": ["opencl -keys=opencl,gpu -max_num_threads=256", "tutorial/conv2d_no_batching", [1, 40, 40, 512, 256, 1, 1, [1, 1], [0, 0]], {}], "config": {"index": 10262, "code_hash": null, "entity": [["tile_rc", "sp", [-1, 1, 4]], ["tile_f", "sp", [-1, 4]], ["tile_y", "sp", [-1, 5, 2]], ["tile_x", "sp", [-1, 4, 8]]]}, "result": [[0.0030471878], 0, 1.7928426265716553, 1615632227.946146], "version": 0.2, "tvm_version": "0.8.dev0"}
{"input": ["opencl -keys=opencl,gpu -max_num_threads=256", "tutorial/conv2d_no_batching", [1, 40, 40, 512, 256, 1, 1, [1, 1], [0, 0]], {}], "config": {"index": 7630, "code_hash": null, "entity": [["tile_rc", "sp", [-1, 1, 4]], ["tile_f", "sp", [-1, 4]], ["tile_y", "sp", [-1, 1, 8]], ["tile_x", "sp", [-1, 40, 4]]]}, "result": [[0.0026421044000000003], 0, 3.5262954235076904, 1615632229.6763008], "version": 0.2, "tvm_version": "0.8.dev0"}
{"input": ["opencl -keys=opencl,gpu -max_num_threads=256", "tutorial/conv2d_no_batching", [1, 40, 40, 512, 256, 1, 1, [1, 1], [0, 0]], {}], "config": {"index": 10213, "code_hash": null, "entity": [["tile_rc", "sp", [-1, 1, 4]], ["tile_f", "sp", [-1, 8]], ["tile_y", "sp", [-1, 4, 2]], ["tile_x", "sp", [-1, 4, 8]]]}, "result": [[0.0021370523], 0, 5.027949571609497, 1615632231.1959307], "version": 0.2, "tvm_version": "0.8.dev0"}
{"input": ["opencl -keys=opencl,gpu -max_num_threads=256", "tutorial/conv2d_no_batching", [1, 40, 40, 512, 256, 1, 1, [1, 1], [0, 0]], {}], "config": {"index": 4452, "code_hash": null, "entity": [["tile_rc", "sp", [-1, 1, 4]], ["tile_f", "sp", [-1, 16]], ["tile_y", "sp", [-1, 2, 4]], ["tile_x", "sp", [-1, 8, 4]]]}, "result": [[0.0020226304000000002], 0, 6.606733083724976, 1615632232.7865355], "version": 0.2, "tvm_version": "0.8.dev0"}
{"input": ["opencl -keys=opencl,gpu -max_num_threads=256", "tutorial/conv2d_no_batching", [1, 40, 40, 512, 256, 1, 1, [1, 1], [0, 0]], {}], "config": {"index": 9149, "code_hash": null, "entity": [["tile_rc", "sp", [-1, 1, 4]], ["tile_f", "sp", [-1, 8]], ["tile_y", "sp", [-1, 2, 2]], ["tile_x", "sp", [-1, 2, 8]]]}, "result": [[0.0037046879], 0, 8.298814058303833, 1615632234.4860377], "version": 0.2, "tvm_version": "0.8.dev0"}
{"input": ["opencl -keys=opencl,gpu -max_num_threads=256", "tutorial/conv2d_no_batching", [1, 40, 40, 512, 256, 1, 1, [1, 1], [0, 0]], {}], "config": {"index": 4545, "code_hash": null, "entity": [["tile_rc", "sp", [-1, 4, 4]], ["tile_f", "sp", [-1, 2]], ["tile_y", "sp", [-1, 10, 4]], ["tile_x", "sp", [-1, 8, 4]]]}, "result": [[0.012582553299999999], 0, 10.372506380081177, 1615632236.5268145], "version": 0.2, "tvm_version": "0.8.dev0"}
{"input": ["opencl -keys=opencl,gpu -max_num_threads=256", "tutorial/conv2d_no_batching", [1, 40, 40, 512, 256, 1, 1, [1, 1], [0, 0]], {}], "config": {"index": 3550, "code_hash": null, "entity": [["tile_rc", "sp", [-1, 2, 4]], ["tile_f", "sp", [-1, 8]], ["tile_y", "sp", [-1, 10, 4]], ["tile_x", "sp", [-1, 5, 4]]]}, "result": [[0.0029559013], 0, 17.265047550201416, 1615632243.4497728], "version": 0.2, "tvm_version": "0.8.dev0"}
{"input": ["opencl -keys=opencl,gpu -max_num_threads=256", "tutorial/conv2d_no_batching", [1, 40, 40, 512, 256, 1, 1, [1, 1], [0, 0]], {}], "config": {"index": 4116, "code_hash": null, "entity": [["tile_rc", "sp", [-1, 1, 4]], ["tile_f", "sp", [-1, 16]], ["tile_y", "sp", [-1, 2, 2]], ["tile_x", "sp", [-1, 8, 4]]]}, "result": [[0.0025571617000000003], 0, 1.9139258861541748, 1615632258.4447947], "version": 0.2, "tvm_version": "0.8.dev0"}
{"input": ["opencl -keys=opencl,gpu -max_num_threads=256", "tutorial/conv2d_no_batching", [1, 40, 40, 512, 256, 1, 1, [1, 1], [0, 0]], {}], "config": {"index": 4165, "code_hash": null, "entity": [["tile_rc", "sp", [-1, 1, 4]], ["tile_f", "sp", [-1, 8]], ["tile_y", "sp", [-1, 4, 2]], ["tile_x", "sp", [-1, 8, 4]]]}, "result": [[0.0027467086000000003], 0, 3.5112087726593018, 1615632260.0836267], "version": 0.2, "tvm_version": "0.8.dev0"}
{"input": ["opencl -keys=opencl,gpu -max_num_threads=256", "tutorial/conv2d_no_batching", [1, 40, 40, 512, 256, 1, 1, [1, 1], [0, 0]], {}], "config": {"index": 4123, "code_hash": null, "entity": [["tile_rc", "sp", [-1, 1, 4]], ["tile_f", "sp", [-1, 32]], ["tile_y", "sp", [-1, 2, 2]], ["tile_x", "sp", [-1, 8, 4]]]}, "result": [[0.0026133074999999998], 0, 5.245992183685303, 1615632261.8074527], "version": 0.2, "tvm_version": "0.8.dev0"}
{"input": ["opencl -keys=opencl,gpu -max_num_threads=256", "tutorial/conv2d_no_batching", [1, 40, 40, 512, 256, 1, 1, [1, 1], [0, 0]], {}], "config": {"index": 4067, "code_hash": null, "entity": [["tile_rc", "sp", [-1, 1, 4]], ["tile_f", "sp", [-1, 32]], ["tile_y", "sp", [-1, 1, 2]], ["tile_x", "sp", [-1, 8, 4]]]}, "result": [[0.0025062345999999998], 0, 6.818200349807739, 1615632263.394253], "version": 0.2, "tvm_version": "0.8.dev0"}
{"input": ["opencl -keys=opencl,gpu -max_num_threads=256", "tutorial/conv2d_no_batching", [1, 40, 40, 512, 256, 1, 1, [1, 1], [0, 0]], {}], "config": {"index": 2156, "code_hash": null, "entity": [["tile_rc", "sp", [-1, 1, 4]], ["tile_f", "sp", [-1, 16]], ["tile_y", "sp", [-1, 4, 2]], ["tile_x", "sp", [-1, 4, 4]]]}, "result": [[0.0027898388], 0, 8.466193675994873, 1615632265.1005263], "version": 0.2, "tvm_version": "0.8.dev0"}
{"input": ["opencl -keys=opencl,gpu -max_num_threads=256", "tutorial/conv2d_no_batching", [1, 40, 40, 512, 256, 1, 1, [1, 1], [0, 0]], {}], "config": {"index": 4172, "code_hash": null, "entity": [["tile_rc", "sp", [-1, 1, 4]], ["tile_f", "sp", [-1, 16]], ["tile_y", "sp", [-1, 4, 2]], ["tile_x", "sp", [-1, 8, 4]]]}, "result": [[0.002722193], 0, 10.094095468521118, 1615632266.7000513], "version": 0.2, "tvm_version": "0.8.dev0"}
{"input": ["opencl -keys=opencl,gpu -max_num_threads=256", "tutorial/conv2d_no_batching", [1, 40, 40, 512, 256, 1, 1, [1, 1], [0, 0]], {}], "config": {"index": 2100, "code_hash": null, "entity": [["tile_rc", "sp", [-1, 1, 4]], ["tile_f", "sp", [-1, 16]], ["tile_y", "sp", [-1, 2, 2]], ["tile_x", "sp", [-1, 4, 4]]]}, "result": [[0.0026111305000000003], 0, 13.38750147819519, 1615632269.9907012], "version": 0.2, "tvm_version": "0.8.dev0"}
{"input": ["opencl -keys=opencl,gpu -max_num_threads=256", "tutorial/conv2d_no_batching", [1, 40, 40, 512, 256, 1, 1, [1, 1], [0, 0]], {}], "config": {"index": 2107, "code_hash": null, "entity": [["tile_rc", "sp", [-1, 1, 4]], ["tile_f", "sp", [-1, 32]], ["tile_y", "sp", [-1, 2, 2]], ["tile_x", "sp", [-1, 4, 4]]]}, "result": [[0.0026564222], 0, 11.663466691970825, 1615632268.3063443], "version": 0.2, "tvm_version": "0.8.dev0"}
{"input": ["opencl -keys=opencl,gpu -max_num_threads=256", "tutorial/conv2d_no_batching", [1, 40, 40, 512, 256, 1, 1, [1, 1], [0, 0]], {}], "config": {"index": 10220, "code_hash": null, "entity": [["tile_rc", "sp", [-1, 1, 4]], ["tile_f", "sp", [-1, 16]], ["tile_y", "sp", [-1, 4, 2]], ["tile_x", "sp", [-1, 4, 8]]]}, "result": [[0.00204637], 0, 1.5997190475463867, 1615632271.8278434], "version": 0.2, "tvm_version": "0.8.dev0"}
{"input": ["opencl -keys=opencl,gpu -max_num_threads=256", "tutorial/conv2d_no_batching", [1, 40, 40, 512, 256, 1, 1, [1, 1], [0, 0]], {}], "config": {"index": 4109, "code_hash": null, "entity": [["tile_rc", "sp", [-1, 1, 4]], ["tile_f", "sp", [-1, 8]], ["tile_y", "sp", [-1, 2, 2]], ["tile_x", "sp", [-1, 8, 4]]]}, "result": [[0.0025830055], 0, 3.2734415531158447, 1615632273.5355673], "version": 0.2, "tvm_version": "0.8.dev0"}
{"input": ["opencl -keys=opencl,gpu -max_num_threads=256", "tutorial/conv2d_no_batching", [1, 40, 40, 512, 256, 1, 1, [1, 1], [0, 0]], {}], "config": {"index": 5075, "code_hash": null, "entity": [["tile_rc", "sp", [-1, 1, 4]], ["tile_f", "sp", [-1, 32]], ["tile_y", "sp", [-1, 1, 2]], ["tile_x", "sp", [-1, 10, 4]]]}, "result": [[0.0026199273], 0, 4.840498924255371, 1615632275.1113548], "version": 0.2, "tvm_version": "0.8.dev0"}
{"input": ["opencl -keys=opencl,gpu -max_num_threads=256", "tutorial/conv2d_no_batching", [1, 40, 40, 512, 256, 1, 1, [1, 1], [0, 0]], {}], "config": {"index": 4060, "code_hash": null, "entity": [["tile_rc", "sp", [-1, 1, 4]], ["tile_f", "sp", [-1, 16]], ["tile_y", "sp", [-1, 1, 2]], ["tile_x", "sp", [-1, 8, 4]]]}, "result": [[0.0024941304], 0, 6.490020751953125, 1615632276.7604744], "version": 0.2, "tvm_version": "0.8.dev0"}
