test_and_tune/android.withoutshared.log.tmp
{"input": ["opencl -keys=opencl,gpu -max_num_threads=256", "tutorial/conv2d_no_batching", [1, 40, 40, 512, 256, 1, 1, [1, 1], [0, 0]], {}], "config": {"index": 45694022, "code_hash": null, "entity": [["tile_f", "sp", [-1, 8, 4, 1]], ["tile_y", "sp", [-1, 4, 5, 1]], ["tile_x", "sp", [-1, 1, 2, 2]], ["tile_rc", "sp", [-1, 32]], ["auto_unroll_max_step", "ot", 512], ["unroll_explicit", "ot", 0]]}, "result": [[0.043179691799999996], 0, 58.733949184417725, 1610988053.6136596], "version": 0.2, "tvm_version": "0.8.dev0"}
{"input": ["opencl -keys=opencl,gpu -max_num_threads=256", "tutorial/conv2d_no_batching", [1, 40, 40, 512, 256, 1, 1, [1, 1], [0, 0]], {}], "config": {"index": 24733528, "code_hash": null, "entity": [["tile_f", "sp", [-1, 2, 8, 1]], ["tile_y", "sp", [-1, 2, 10, 1]], ["tile_x", "sp", [-1, 1, 10, 2]], ["tile_rc", "sp", [-1, 256]], ["auto_unroll_max_step", "ot", 128], ["unroll_explicit", "ot", 0]]}, "result": [[0.0333557273], 0, 6.751615762710571, 1610988086.9774842], "version": 0.2, "tvm_version": "0.8.dev0"}
{"input": ["opencl -keys=opencl,gpu -max_num_threads=256", "tutorial/conv2d_no_batching", [1, 40, 40, 512, 256, 1, 1, [1, 1], [0, 0]], {}], "config": {"index": 88843746, "code_hash": null, "entity": [["tile_f", "sp", [-1, 2, 64, 1]], ["tile_y", "sp", [-1, 1, 4, 10]], ["tile_x", "sp", [-1, 40, 1, 1]], ["tile_rc", "sp", [-1, 1]], ["auto_unroll_max_step", "ot", 512], ["unroll_explicit", "ot", 1]]}, "result": [[0.052341791699999994], 0, 15.849416732788086, 1610988096.0712092], "version": 0.2, "tvm_version": "0.8.dev0"}
{"input": ["opencl -keys=opencl,gpu -max_num_threads=256", "tutorial/conv2d_no_batching", [1, 40, 40, 512, 256, 1, 1, [1, 1], [0, 0]], {}], "config": {"index": 78659836, "code_hash": null, "entity": [["tile_f", "sp", [-1, 4, 8, 8]], ["tile_y", "sp", [-1, 1, 10, 1]], ["tile_x", "sp", [-1, 1, 5, 8]], ["tile_rc", "sp", [-1, 2]], ["auto_unroll_max_step", "ot", 256], ["unroll_explicit", "ot", 1]]}, "result": [[0.0449708013], 0, 11.323909759521484, 1610988091.5369577], "version": 0.2, "tvm_version": "0.8.dev0"}
{"input": ["opencl -keys=opencl,gpu -max_num_threads=256", "tutorial/conv2d_no_batching", [1, 40, 40, 512, 256, 1, 1, [1, 1], [0, 0]], {}], "config": {"index": 35351152, "code_hash": null, "entity": [["tile_f", "sp", [-1, 4, 2, 1]], ["tile_y", "sp", [-1, 1, 20, 2]], ["tile_x", "sp", [-1, 1, 2, 1]], ["tile_rc", "sp", [-1, 128]], ["auto_unroll_max_step", "ot", 256], ["unroll_explicit", "ot", 0]]}, "result": [[0.0967230409], 0, 21.554698944091797, 1610988101.7747467], "version": 0.2, "tvm_version": "0.8.dev0"}
{"input": ["opencl -keys=opencl,gpu -max_num_threads=256", "tutorial/conv2d_no_batching", [1, 40, 40, 512, 256, 1, 1, [1, 1], [0, 0]], {}], "config": {"index": 3948122, "code_hash": null, "entity": [["tile_f", "sp", [-1, 4, 1, 1]], ["tile_y", "sp", [-1, 4, 10, 1]], ["tile_x", "sp", [-1, 1, 4, 5]], ["tile_rc", "sp", [-1, 4]], ["auto_unroll_max_step", "ot", 0], ["unroll_explicit", "ot", 0]]}, "result": [[0.053477995], 0, 47.54716515541077, 1610988127.7811394], "version": 0.2, "tvm_version": "0.8.dev0"}
{"input": ["opencl -keys=opencl,gpu -max_num_threads=256", "tutorial/conv2d_no_batching", [1, 40, 40, 512, 256, 1, 1, [1, 1], [0, 0]], {}], "config": {"index": 14570392, "code_hash": null, "entity": [["tile_f", "sp", [-1, 4, 2, 1]], ["tile_y", "sp", [-1, 1, 5, 8]], ["tile_x", "sp", [-1, 1, 20, 1]], ["tile_rc", "sp", [-1, 2]], ["auto_unroll_max_step", "ot", 128], ["unroll_explicit", "ot", 0]]}, "result": [[0.0655830222], 0, 57.75038719177246, 1610988137.9897518], "version": 0.2, "tvm_version": "0.8.dev0"}
{"input": ["opencl -keys=opencl,gpu -max_num_threads=256", "tutorial/conv2d_no_batching", [1, 40, 40, 512, 256, 1, 1, [1, 1], [0, 0]], {}], "config": {"index": 24695315, "code_hash": null, "entity": [["tile_f", "sp", [-1, 2, 64, 2]], ["tile_y", "sp", [-1, 5, 2, 1]], ["tile_x", "sp", [-1, 2, 5, 2]], ["tile_rc", "sp", [-1, 256]], ["auto_unroll_max_step", "ot", 128], ["unroll_explicit", "ot", 0]]}, "result": [[0.0330056699], 0, 61.527942419052124, 1610988141.7781196], "version": 0.2, "tvm_version": "0.8.dev0"}
{"input": ["opencl -keys=opencl,gpu -max_num_threads=256", "tutorial/conv2d_no_batching", [1, 40, 40, 512, 256, 1, 1, [1, 1], [0, 0]], {}], "config": {"index": 95597548, "code_hash": null, "entity": [["tile_f", "sp", [-1, 16, 2, 2]], ["tile_y", "sp", [-1, 1, 5, 4]], ["tile_x", "sp", [-1, 2, 1, 10]], ["tile_rc", "sp", [-1, 16]], ["auto_unroll_max_step", "ot", 512], ["unroll_explicit", "ot", 1]]}, "result": [[0.0821555499], 0, 83.9921522140503, 1610988164.2385788], "version": 0.2, "tvm_version": "0.8.dev0"}
{"input": ["opencl -keys=opencl,gpu -max_num_threads=256", "tutorial/conv2d_no_batching", [1, 40, 40, 512, 256, 1, 1, [1, 1], [0, 0]], {}], "config": {"index": 25623888, "code_hash": null, "entity": [["tile_f", "sp", [-1, 8, 64, 1]], ["tile_y", "sp", [-1, 4, 1, 10]], ["tile_x", "sp", [-1, 2, 4, 1]], ["tile_rc", "sp", [-1, 1]], ["auto_unroll_max_step", "ot", 256], ["unroll_explicit", "ot", 0]]}, "result": [[0.0231042783], 0, 21.396471977233887, 1610988186.971147], "version": 0.2, "tvm_version": "0.8.dev0"}
{"input": ["opencl -keys=opencl,gpu -max_num_threads=256", "tutorial/conv2d_no_batching", [1, 40, 40, 512, 256, 1, 1, [1, 1], [0, 0]], {}], "config": {"index": 72409671, "code_hash": null, "entity": [["tile_f", "sp", [-1, 2, 2, 32]], ["tile_y", "sp", [-1, 1, 4, 1]], ["tile_x", "sp", [-1, 10, 1, 2]], ["tile_rc", "sp", [-1, 64]], ["auto_unroll_max_step", "ot", 128], ["unroll_explicit", "ot", 1]]}, "result": [[0.0861940763], 0, 83.68252754211426, 1610988249.268234], "version": 0.2, "tvm_version": "0.8.dev0"}
{"input": ["opencl -keys=opencl,gpu -max_num_threads=256", "tutorial/conv2d_no_batching", [1, 40, 40, 512, 256, 1, 1, [1, 1], [0, 0]], {}], "config": {"index": 3684573, "code_hash": null, "entity": [["tile_f", "sp", [-1, 8, 2, 1]], ["tile_y", "sp", [-1, 2, 20, 1]], ["tile_x", "sp", [-1, 2, 1, 4]], ["tile_rc", "sp", [-1, 4]], ["auto_unroll_max_step", "ot", 0], ["unroll_explicit", "ot", 0]]}, "result": [[0.0487039789], 0, 3.850416660308838, 1610988254.7598486], "version": 0.2, "tvm_version": "0.8.dev0"}
{"input": ["opencl -keys=opencl,gpu -max_num_threads=256", "tutorial/conv2d_no_batching", [1, 40, 40, 512, 256, 1, 1, [1, 1], [0, 0]], {}], "config": {"index": 19912949, "code_hash": null, "entity": [["tile_f", "sp", [-1, 16, 16, 2]], ["tile_y", "sp", [-1, 5, 1, 2]], ["tile_x", "sp", [-1, 5, 2, 1]], ["tile_rc", "sp", [-1, 32]], ["auto_unroll_max_step", "ot", 128], ["unroll_explicit", "ot", 0]]}, "result": [[0.0580355214], 0, 21.869166374206543, 1610988272.781096], "version": 0.2, "tvm_version": "0.8.dev0"}
{"input": ["opencl -keys=opencl,gpu -max_num_threads=256", "tutorial/conv2d_no_batching", [1, 40, 40, 512, 256, 1, 1, [1, 1], [0, 0]], {}], "config": {"index": 98314653, "code_hash": null, "entity": [["tile_f", "sp", [-1, 8, 2, 16]], ["tile_y", "sp", [-1, 8, 1, 1]], ["tile_x", "sp", [-1, 1, 8, 5]], ["tile_rc", "sp", [-1, 64]], ["auto_unroll_max_step", "ot", 512], ["unroll_explicit", "ot", 1]]}, "result": [[0.0374357382], 0, 26.079015016555786, 1610988276.9871728], "version": 0.2, "tvm_version": "0.8.dev0"}
{"input": ["opencl -keys=opencl,gpu -max_num_threads=256", "tutorial/conv2d_no_batching", [1, 40, 40, 512, 256, 1, 1, [1, 1], [0, 0]], {}], "config": {"index": 82354980, "code_hash": null, "entity": [["tile_f", "sp", [-1, 2, 8, 16]], ["tile_y", "sp", [-1, 4, 5, 1]], ["tile_x", "sp", [-1, 10, 2, 2]], ["tile_rc", "sp", [-1, 16]], ["auto_unroll_max_step", "ot", 256], ["unroll_explicit", "ot", 1]]}, "result": [[0.0771252577], 0, 37.01609134674072, 1610988287.932515], "version": 0.2, "tvm_version": "0.8.dev0"}
{"input": ["opencl -keys=opencl,gpu -max_num_threads=256", "tutorial/conv2d_no_batching", [1, 40, 40, 512, 256, 1, 1, [1, 1], [0, 0]], {}], "config": {"index": 72943648, "code_hash": null, "entity": [["tile_f", "sp", [-1, 256, 1, 1]], ["tile_y", "sp", [-1, 1, 5, 2]], ["tile_x", "sp", [-1, 1, 4, 5]], ["tile_rc", "sp", [-1, 64]], ["auto_unroll_max_step", "ot", 128], ["unroll_explicit", "ot", 1]]}, "result": [[0.0624671521], 0, 43.75741481781006, 1610988294.689058], "version": 0.2, "tvm_version": "0.8.dev0"}
{"input": ["opencl -keys=opencl,gpu -max_num_threads=256", "tutorial/conv2d_no_batching", [1, 40, 40, 512, 256, 1, 1, [1, 1], [0, 0]], {}], "config": {"index": 93302786, "code_hash": null, "entity": [["tile_f", "sp", [-1, 1, 16, 4]], ["tile_y", "sp", [-1, 5, 8, 1]], ["tile_x", "sp", [-1, 8, 5, 1]], ["tile_rc", "sp", [-1, 8]], ["auto_unroll_max_step", "ot", 512], ["unroll_explicit", "ot", 1]]}, "result": [[0.022726205399999998], 0, 62.15813207626343, 1610988313.1049843], "version": 0.2, "tvm_version": "0.8.dev0"}
{"input": ["opencl -keys=opencl,gpu -max_num_threads=256", "tutorial/conv2d_no_batching", [1, 40, 40, 512, 256, 1, 1, [1, 1], [0, 0]], {}], "config": {"index": 90909528, "code_hash": null, "entity": [["tile_f", "sp", [-1, 2, 8, 1]], ["tile_y", "sp", [-1, 2, 10, 1]], ["tile_x", "sp", [-1, 1, 10, 2]], ["tile_rc", "sp", [-1, 2]], ["auto_unroll_max_step", "ot", 512], ["unroll_explicit", "ot", 1]]}, "result": [[0.033617670100000004], 0, 3.4456915855407715, 1610988431.654082], "version": 0.2, "tvm_version": "0.8.dev0"}
{"input": ["opencl -keys=opencl,gpu -max_num_threads=256", "tutorial/conv2d_no_batching", [1, 40, 40, 512, 256, 1, 1, [1, 1], [0, 0]], {}], "config": {"index": 38813528, "code_hash": null, "entity": [["tile_f", "sp", [-1, 2, 8, 1]], ["tile_y", "sp", [-1, 2, 10, 1]], ["tile_x", "sp", [-1, 1, 10, 2]], ["tile_rc", "sp", [-1, 1]], ["auto_unroll_max_step", "ot", 512], ["unroll_explicit", "ot", 0]]}, "result": [[0.0331595241], 0, 7.284147500991821, 1610988435.5458455], "version": 0.2, "tvm_version": "0.8.dev0"}
{"input": ["opencl -keys=opencl,gpu -max_num_threads=256", "tutorial/conv2d_no_batching", [1, 40, 40, 512, 256, 1, 1, [1, 1], [0, 0]], {}], "config": {"index": 40221528, "code_hash": null, "entity": [["tile_f", "sp", [-1, 2, 8, 1]], ["tile_y", "sp", [-1, 2, 10, 1]], ["tile_x", "sp", [-1, 1, 10, 2]], ["tile_rc", "sp", [-1, 2]], ["auto_unroll_max_step", "ot", 512], ["unroll_explicit", "ot", 0]]}, "result": [[0.0344765659], 0, 11.032517433166504, 1610988439.3417306], "version": 0.2, "tvm_version": "0.8.dev0"}
{"input": ["opencl -keys=opencl,gpu -max_num_threads=256", "tutorial/conv2d_no_batching", [1, 40, 40, 512, 256, 1, 1, [1, 1], [0, 0]], {}], "config": {"index": 90909522, "code_hash": null, "entity": [["tile_f", "sp", [-1, 8, 4, 1]], ["tile_y", "sp", [-1, 2, 10, 1]], ["tile_x", "sp", [-1, 1, 10, 2]], ["tile_rc", "sp", [-1, 2]], ["auto_unroll_max_step", "ot", 512], ["unroll_explicit", "ot", 1]]}, "result": [[0.0336658836], 0, 14.785392761230469, 1610988443.095009], "version": 0.2, "tvm_version": "0.8.dev0"}
{"input": ["opencl -keys=opencl,gpu -max_num_threads=256", "tutorial/conv2d_no_batching", [1, 40, 40, 512, 256, 1, 1, [1, 1], [0, 0]], {}], "config": {"index": 96541528, "code_hash": null, "entity": [["tile_f", "sp", [-1, 2, 8, 1]], ["tile_y", "sp", [-1, 2, 10, 1]], ["tile_x", "sp", [-1, 1, 10, 2]], ["tile_rc", "sp", [-1, 32]], ["auto_unroll_max_step", "ot", 512], ["unroll_explicit", "ot", 1]]}, "result": [[0.0460700202], 0, 27.225059032440186, 1610988455.5354621], "version": 0.2, "tvm_version": "0.8.dev0"}
{"input": ["opencl -keys=opencl,gpu -max_num_threads=256", "tutorial/conv2d_no_batching", [1, 40, 40, 512, 256, 1, 1, [1, 1], [0, 0]], {}], "config": {"index": 93725528, "code_hash": null, "entity": [["tile_f", "sp", [-1, 2, 8, 1]], ["tile_y", "sp", [-1, 2, 10, 1]], ["tile_x", "sp", [-1, 1, 10, 2]], ["tile_rc", "sp", [-1, 8]], ["auto_unroll_max_step", "ot", 512], ["unroll_explicit", "ot", 1]]}, "result": [[0.0466760255], 0, 18.998550415039062, 1610988447.3617446], "version": 0.2, "tvm_version": "0.8.dev0"}
{"input": ["opencl -keys=opencl,gpu -max_num_threads=256", "tutorial/conv2d_no_batching", [1, 40, 40, 512, 256, 1, 1, [1, 1], [0, 0]], {}], "config": {"index": 41629528, "code_hash": null, "entity": [["tile_f", "sp", [-1, 2, 8, 1]], ["tile_y", "sp", [-1, 2, 10, 1]], ["tile_x", "sp", [-1, 1, 10, 2]], ["tile_rc", "sp", [-1, 4]], ["auto_unroll_max_step", "ot", 512], ["unroll_explicit", "ot", 0]]}, "result": [[0.0344163159], 0, 31.0500009059906, 1610988459.4395216], "version": 0.2, "tvm_version": "0.8.dev0"}
{"input": ["opencl -keys=opencl,gpu -max_num_threads=256", "tutorial/conv2d_no_batching", [1, 40, 40, 512, 256, 1, 1, [1, 1], [0, 0]], {}], "config": {"index": 92317528, "code_hash": null, "entity": [["tile_f", "sp", [-1, 2, 8, 1]], ["tile_y", "sp", [-1, 2, 10, 1]], ["tile_x", "sp", [-1, 1, 10, 2]], ["tile_rc", "sp", [-1, 4]], ["auto_unroll_max_step", "ot", 512], ["unroll_explicit", "ot", 1]]}, "result": [[0.0346177066], 0, 22.805521965026855, 1610988451.2105765], "version": 0.2, "tvm_version": "0.8.dev0"}
{"input": ["opencl -keys=opencl,gpu -max_num_threads=256", "tutorial/conv2d_no_batching", [1, 40, 40, 512, 256, 1, 1, [1, 1], [0, 0]], {}], "config": {"index": 95133528, "code_hash": null, "entity": [["tile_f", "sp", [-1, 2, 8, 1]], ["tile_y", "sp", [-1, 2, 10, 1]], ["tile_x", "sp", [-1, 1, 10, 2]], ["tile_rc", "sp", [-1, 16]], ["auto_unroll_max_step", "ot", 512], ["unroll_explicit", "ot", 1]]}, "result": [[0.0466299682], 0, 35.28422999382019, 1610988463.6874635], "version": 0.2, "tvm_version": "0.8.dev0"}
{"input": ["opencl -keys=opencl,gpu -max_num_threads=256", "tutorial/conv2d_no_batching", [1, 40, 40, 512, 256, 1, 1, [1, 1], [0, 0]], {}], "config": {"index": 44445528, "code_hash": null, "entity": [["tile_f", "sp", [-1, 2, 8, 1]], ["tile_y", "sp", [-1, 2, 10, 1]], ["tile_x", "sp", [-1, 1, 10, 2]], ["tile_rc", "sp", [-1, 16]], ["auto_unroll_max_step", "ot", 512], ["unroll_explicit", "ot", 0]]}, "result": [[0.0331750398], 0, 43.240042209625244, 1610988471.6648605], "version": 0.2, "tvm_version": "0.8.dev0"}
{"input": ["opencl -keys=opencl,gpu -max_num_threads=256", "tutorial/conv2d_no_batching", [1, 40, 40, 512, 256, 1, 1, [1, 1], [0, 0]], {}], "config": {"index": 43037528, "code_hash": null, "entity": [["tile_f", "sp", [-1, 2, 8, 1]], ["tile_y", "sp", [-1, 2, 10, 1]], ["tile_x", "sp", [-1, 1, 10, 2]], ["tile_rc", "sp", [-1, 8]], ["auto_unroll_max_step", "ot", 512], ["unroll_explicit", "ot", 0]]}, "result": [[0.0468211453], 0, 39.45533895492554, 1610988467.9138885], "version": 0.2, "tvm_version": "0.8.dev0"}
{"input": ["opencl -keys=opencl,gpu -max_num_threads=256", "tutorial/conv2d_no_batching", [1, 40, 40, 512, 256, 1, 1, [1, 1], [0, 0]], {}], "config": {"index": 90909747, "code_hash": null, "entity": [["tile_f", "sp", [-1, 1, 8, 1]], ["tile_y", "sp", [-1, 4, 10, 1]], ["tile_x", "sp", [-1, 1, 10, 2]], ["tile_rc", "sp", [-1, 2]], ["auto_unroll_max_step", "ot", 512], ["unroll_explicit", "ot", 1]]}, "result": [[0.0338092221], 0, 3.3195271492004395, 1610988476.0637937], "version": 0.2, "tvm_version": "0.8.dev0"}
{"input": ["opencl -keys=opencl,gpu -max_num_threads=256", "tutorial/conv2d_no_batching", [1, 40, 40, 512, 256, 1, 1, [1, 1], [0, 0]], {}], "config": {"index": 89501747, "code_hash": null, "entity": [["tile_f", "sp", [-1, 1, 8, 1]], ["tile_y", "sp", [-1, 4, 10, 1]], ["tile_x", "sp", [-1, 1, 10, 2]], ["tile_rc", "sp", [-1, 1]], ["auto_unroll_max_step", "ot", 512], ["unroll_explicit", "ot", 1]]}, "result": [[0.033012847], 0, 7.145391464233398, 1610988479.9097853], "version": 0.2, "tvm_version": "0.8.dev0"}
{"input": ["opencl -keys=opencl,gpu -max_num_threads=256", "tutorial/conv2d_no_batching", [1, 40, 40, 512, 256, 1, 1, [1, 1], [0, 0]], {}], "config": {"index": 39904940, "code_hash": null, "entity": [["tile_f", "sp", [-1, 2, 4, 1]], ["tile_y", "sp", [-1, 4, 10, 1]], ["tile_x", "sp", [-1, 1, 20, 1]], ["tile_rc", "sp", [-1, 2]], ["auto_unroll_max_step", "ot", 512], ["unroll_explicit", "ot", 0]]}, "result": [[0.0571760214], 0, 15.483316659927368, 1610988488.256264], "version": 0.2, "tvm_version": "0.8.dev0"}
{"input": ["opencl -keys=opencl,gpu -max_num_threads=256", "tutorial/conv2d_no_batching", [1, 40, 40, 512, 256, 1, 1, [1, 1], [0, 0]], {}], "config": {"index": 40221747, "code_hash": null, "entity": [["tile_f", "sp", [-1, 1, 8, 1]], ["tile_y", "sp", [-1, 4, 10, 1]], ["tile_x", "sp", [-1, 1, 10, 2]], ["tile_rc", "sp", [-1, 2]], ["auto_unroll_max_step", "ot", 512], ["unroll_explicit", "ot", 0]]}, "result": [[0.0326167116], 0, 10.862663745880127, 1610988483.6461427], "version": 0.2, "tvm_version": "0.8.dev0"}
{"input": ["opencl -keys=opencl,gpu -max_num_threads=256", "tutorial/conv2d_no_batching", [1, 40, 40, 512, 256, 1, 1, [1, 1], [0, 0]], {}], "config": {"index": 38813747, "code_hash": null, "entity": [["tile_f", "sp", [-1, 1, 8, 1]], ["tile_y", "sp", [-1, 4, 10, 1]], ["tile_x", "sp", [-1, 1, 10, 2]], ["tile_rc", "sp", [-1, 1]], ["auto_unroll_max_step", "ot", 512], ["unroll_explicit", "ot", 0]]}, "result": [[0.033200727299999996], 0, 19.223859310150146, 1610988492.0182216], "version": 0.2, "tvm_version": "0.8.dev0"}
{"input": ["opencl -keys=opencl,gpu -max_num_threads=256", "tutorial/conv2d_no_batching", [1, 40, 40, 512, 256, 1, 1, [1, 1], [0, 0]], {}], "config": {"index": 38496940, "code_hash": null, "entity": [["tile_f", "sp", [-1, 2, 4, 1]], ["tile_y", "sp", [-1, 4, 10, 1]], ["tile_x", "sp", [-1, 1, 20, 1]], ["tile_rc", "sp", [-1, 1]], ["auto_unroll_max_step", "ot", 512], ["unroll_explicit", "ot", 0]]}, "result": [[0.055587807600000004], 0, 23.57446837425232, 1610988496.4424157], "version": 0.2, "tvm_version": "0.8.dev0"}
{"input": ["opencl -keys=opencl,gpu -max_num_threads=256", "tutorial/conv2d_no_batching", [1, 40, 40, 512, 256, 1, 1, [1, 1], [0, 0]], {}], "config": {"index": 40098775, "code_hash": null, "entity": [["tile_f", "sp", [-1, 2, 16, 1]], ["tile_y", "sp", [-1, 1, 20, 1]], ["tile_x", "sp", [-1, 5, 2, 2]], ["tile_rc", "sp", [-1, 2]], ["auto_unroll_max_step", "ot", 512], ["unroll_explicit", "ot", 0]]}, "result": [[0.032358622999999996], 0, 27.408350944519043, 1610988500.2827766], "version": 0.2, "tvm_version": "0.8.dev0"}
{"input": ["opencl -keys=opencl,gpu -max_num_threads=256", "tutorial/conv2d_no_batching", [1, 40, 40, 512, 256, 1, 1, [1, 1], [0, 0]], {}], "config": {"index": 89378775, "code_hash": null, "entity": [["tile_f", "sp", [-1, 2, 16, 1]], ["tile_y", "sp", [-1, 1, 20, 1]], ["tile_x", "sp", [-1, 5, 2, 2]], ["tile_rc", "sp", [-1, 1]], ["auto_unroll_max_step", "ot", 512], ["unroll_explicit", "ot", 1]]}, "result": [[0.035288456600000004], 0, 31.17732048034668, 1610988504.0628238], "version": 0.2, "tvm_version": "0.8.dev0"}
{"input": ["opencl -keys=opencl,gpu -max_num_threads=256", "tutorial/conv2d_no_batching", [1, 40, 40, 512, 256, 1, 1, [1, 1], [0, 0]], {}], "config": {"index": 40098335, "code_hash": null, "entity": [["tile_f", "sp", [-1, 2, 16, 1]], ["tile_y", "sp", [-1, 2, 10, 1]], ["tile_x", "sp", [-1, 5, 2, 2]], ["tile_rc", "sp", [-1, 2]], ["auto_unroll_max_step", "ot", 512], ["unroll_explicit", "ot", 0]]}, "result": [[0.028571919499999997], 0, 34.87700605392456, 1610988507.7888207], "version": 0.2, "tvm_version": "0.8.dev0"}
{"input": ["opencl -keys=opencl,gpu -max_num_threads=256", "tutorial/conv2d_no_batching", [1, 40, 40, 512, 256, 1, 1, [1, 1], [0, 0]], {}], "config": {"index": 90786335, "code_hash": null, "entity": [["tile_f", "sp", [-1, 2, 16, 1]], ["tile_y", "sp", [-1, 2, 10, 1]], ["tile_x", "sp", [-1, 5, 2, 2]], ["tile_rc", "sp", [-1, 2]], ["auto_unroll_max_step", "ot", 512], ["unroll_explicit", "ot", 1]]}, "result": [[0.028933872700000002], 0, 38.51371884346008, 1610988511.4359252], "version": 0.2, "tvm_version": "0.8.dev0"}
{"input": ["opencl -keys=opencl,gpu -max_num_threads=256", "tutorial/conv2d_no_batching", [1, 40, 40, 512, 256, 1, 1, [1, 1], [0, 0]], {}], "config": {"index": 27549528, "code_hash": null, "entity": [["tile_f", "sp", [-1, 2, 8, 1]], ["tile_y", "sp", [-1, 2, 10, 1]], ["tile_x", "sp", [-1, 1, 10, 2]], ["tile_rc", "sp", [-1, 2]], ["auto_unroll_max_step", "ot", 256], ["unroll_explicit", "ot", 0]]}, "result": [[0.0342290242], 0, 42.33262038230896, 1610988515.276014], "version": 0.2, "tvm_version": "0.8.dev0"}
{"input": ["opencl -keys=opencl,gpu -max_num_threads=256", "tutorial/conv2d_no_batching", [1, 40, 40, 512, 256, 1, 1, [1, 1], [0, 0]], {}], "config": {"index": 14877528, "code_hash": null, "entity": [["tile_f", "sp", [-1, 2, 8, 1]], ["tile_y", "sp", [-1, 2, 10, 1]], ["tile_x", "sp", [-1, 1, 10, 2]], ["tile_rc", "sp", [-1, 2]], ["auto_unroll_max_step", "ot", 128], ["unroll_explicit", "ot", 0]]}, "result": [[0.0343354565], 0, 46.1178081035614, 1610988519.0739086], "version": 0.2, "tvm_version": "0.8.dev0"}
{"input": ["opencl -keys=opencl,gpu -max_num_threads=256", "tutorial/conv2d_no_batching", [1, 40, 40, 512, 256, 1, 1, [1, 1], [0, 0]], {}], "config": {"index": 65565528, "code_hash": null, "entity": [["tile_f", "sp", [-1, 2, 8, 1]], ["tile_y", "sp", [-1, 2, 10, 1]], ["tile_x", "sp", [-1, 1, 10, 2]], ["tile_rc", "sp", [-1, 2]], ["auto_unroll_max_step", "ot", 128], ["unroll_explicit", "ot", 1]]}, "result": [[0.0337038836], 0, 49.962242126464844, 1610988522.9403558], "version": 0.2, "tvm_version": "0.8.dev0"}
{"input": ["opencl -keys=opencl,gpu -max_num_threads=256", "tutorial/conv2d_no_batching", [1, 40, 40, 512, 256, 1, 1, [1, 1], [0, 0]], {}], "config": {"index": 39904721, "code_hash": null, "entity": [["tile_f", "sp", [-1, 4, 4, 1]], ["tile_y", "sp", [-1, 2, 10, 1]], ["tile_x", "sp", [-1, 1, 20, 1]], ["tile_rc", "sp", [-1, 2]], ["auto_unroll_max_step", "ot", 512], ["unroll_explicit", "ot", 0]]}, "result": [[0.05706650049999999], 0, 4.0842814445495605, 1610988528.1074557], "version": 0.2, "tvm_version": "0.8.dev0"}
{"input": ["opencl -keys=opencl,gpu -max_num_threads=256", "tutorial/conv2d_no_batching", [1, 40, 40, 512, 256, 1, 1, [1, 1], [0, 0]], {}], "config": {"index": 38496721, "code_hash": null, "entity": [["tile_f", "sp", [-1, 4, 4, 1]], ["tile_y", "sp", [-1, 2, 10, 1]], ["tile_x", "sp", [-1, 1, 20, 1]], ["tile_rc", "sp", [-1, 1]], ["auto_unroll_max_step", "ot", 512], ["unroll_explicit", "ot", 0]]}, "result": [[0.055460125299999996], 0, 8.48913025856018, 1610988532.527548], "version": 0.2, "tvm_version": "0.8.dev0"}
{"input": ["opencl -keys=opencl,gpu -max_num_threads=256", "tutorial/conv2d_no_batching", [1, 40, 40, 512, 256, 1, 1, [1, 1], [0, 0]], {}], "config": {"index": 90592721, "code_hash": null, "entity": [["tile_f", "sp", [-1, 4, 4, 1]], ["tile_y", "sp", [-1, 2, 10, 1]], ["tile_x", "sp", [-1, 1, 20, 1]], ["tile_rc", "sp", [-1, 2]], ["auto_unroll_max_step", "ot", 512], ["unroll_explicit", "ot", 1]]}, "result": [[0.0570126151], 0, 17.466304779052734, 1610988541.517071], "version": 0.2, "tvm_version": "0.8.dev0"}
{"input": ["opencl -keys=opencl,gpu -max_num_threads=256", "tutorial/conv2d_no_batching", [1, 40, 40, 512, 256, 1, 1, [1, 1], [0, 0]], {}], "config": {"index": 89184721, "code_hash": null, "entity": [["tile_f", "sp", [-1, 4, 4, 1]], ["tile_y", "sp", [-1, 2, 10, 1]], ["tile_x", "sp", [-1, 1, 20, 1]], ["tile_rc", "sp", [-1, 1]], ["auto_unroll_max_step", "ot", 512], ["unroll_explicit", "ot", 1]]}, "result": [[0.055482667], 0, 12.903076887130737, 1610988536.966373], "version": 0.2, "tvm_version": "0.8.dev0"}
{"input": ["opencl -keys=opencl,gpu -max_num_threads=256", "tutorial/conv2d_no_batching", [1, 40, 40, 512, 256, 1, 1, [1, 1], [0, 0]], {}], "config": {"index": 40221961, "code_hash": null, "entity": [["tile_f", "sp", [-1, 4, 4, 1]], ["tile_y", "sp", [-1, 1, 20, 1]], ["tile_x", "sp", [-1, 1, 10, 2]], ["tile_rc", "sp", [-1, 2]], ["auto_unroll_max_step", "ot", 512], ["unroll_explicit", "ot", 0]]}, "result": [[0.0466965307], 0, 21.62034273147583, 1610988545.6957977], "version": 0.2, "tvm_version": "0.8.dev0"}
{"input": ["opencl -keys=opencl,gpu -max_num_threads=256", "tutorial/conv2d_no_batching", [1, 40, 40, 512, 256, 1, 1, [1, 1], [0, 0]], {}], "config": {"index": 90909961, "code_hash": null, "entity": [["tile_f", "sp", [-1, 4, 4, 1]], ["tile_y", "sp", [-1, 1, 20, 1]], ["tile_x", "sp", [-1, 1, 10, 2]], ["tile_rc", "sp", [-1, 2]], ["auto_unroll_max_step", "ot", 512], ["unroll_explicit", "ot", 1]]}, "result": [[0.0463432078], 0, 25.78619885444641, 1610988549.8607974], "version": 0.2, "tvm_version": "0.8.dev0"}
{"input": ["opencl -keys=opencl,gpu -max_num_threads=256", "tutorial/conv2d_no_batching", [1, 40, 40, 512, 256, 1, 1, [1, 1], [0, 0]], {}], "config": {"index": 96541522, "code_hash": null, "entity": [["tile_f", "sp", [-1, 8, 4, 1]], ["tile_y", "sp", [-1, 2, 10, 1]], ["tile_x", "sp", [-1, 1, 10, 2]], ["tile_rc", "sp", [-1, 32]], ["auto_unroll_max_step", "ot", 512], ["unroll_explicit", "ot", 1]]}, "result": [[0.0470546505], 0, 34.56586718559265, 1610988558.64053], "version": 0.2, "tvm_version": "0.8.dev0"}
{"input": ["opencl -keys=opencl,gpu -max_num_threads=256", "tutorial/conv2d_no_batching", [1, 40, 40, 512, 256, 1, 1, [1, 1], [0, 0]], {}], "config": {"index": 95133522, "code_hash": null, "entity": [["tile_f", "sp", [-1, 8, 4, 1]], ["tile_y", "sp", [-1, 2, 10, 1]], ["tile_x", "sp", [-1, 1, 10, 2]], ["tile_rc", "sp", [-1, 16]], ["auto_unroll_max_step", "ot", 512], ["unroll_explicit", "ot", 1]]}, "result": [[0.0473407547], 0, 30.05757784843445, 1610988554.1696553], "version": 0.2, "tvm_version": "0.8.dev0"}
{"input": ["opencl -keys=opencl,gpu -max_num_threads=256", "tutorial/conv2d_no_batching", [1, 40, 40, 512, 256, 1, 1, [1, 1], [0, 0]], {}], "config": {"index": 45853522, "code_hash": null, "entity": [["tile_f", "sp", [-1, 8, 4, 1]], ["tile_y", "sp", [-1, 2, 10, 1]], ["tile_x", "sp", [-1, 1, 10, 2]], ["tile_rc", "sp", [-1, 32]], ["auto_unroll_max_step", "ot", 512], ["unroll_explicit", "ot", 0]]}, "result": [[0.0345188836], 0, 38.36936831474304, 1610988562.4885688], "version": 0.2, "tvm_version": "0.8.dev0"}
{"input": ["opencl -keys=opencl,gpu -max_num_threads=256", "tutorial/conv2d_no_batching", [1, 40, 40, 512, 256, 1, 1, [1, 1], [0, 0]], {}], "config": {"index": 45730775, "code_hash": null, "entity": [["tile_f", "sp", [-1, 2, 16, 1]], ["tile_y", "sp", [-1, 1, 20, 1]], ["tile_x", "sp", [-1, 5, 2, 2]], ["tile_rc", "sp", [-1, 32]], ["auto_unroll_max_step", "ot", 512], ["unroll_explicit", "ot", 0]]}, "result": [[0.0353589983], 0, 46.58560609817505, 1610988570.7354717], "version": 0.2, "tvm_version": "0.8.dev0"}
{"input": ["opencl -keys=opencl,gpu -max_num_threads=256", "tutorial/conv2d_no_batching", [1, 40, 40, 512, 256, 1, 1, [1, 1], [0, 0]], {}], "config": {"index": 96418775, "code_hash": null, "entity": [["tile_f", "sp", [-1, 2, 16, 1]], ["tile_y", "sp", [-1, 1, 20, 1]], ["tile_x", "sp", [-1, 5, 2, 2]], ["tile_rc", "sp", [-1, 32]], ["auto_unroll_max_step", "ot", 512], ["unroll_explicit", "ot", 1]]}, "result": [[0.050362999799999995], 0, 42.75957989692688, 1610988566.9018116], "version": 0.2, "tvm_version": "0.8.dev0"}
{"input": ["opencl -keys=opencl,gpu -max_num_threads=256", "tutorial/conv2d_no_batching", [1, 40, 40, 512, 256, 1, 1, [1, 1], [0, 0]], {}], "config": {"index": 96418335, "code_hash": null, "entity": [["tile_f", "sp", [-1, 2, 16, 1]], ["tile_y", "sp", [-1, 2, 10, 1]], ["tile_x", "sp", [-1, 5, 2, 2]], ["tile_rc", "sp", [-1, 32]], ["auto_unroll_max_step", "ot", 512], ["unroll_explicit", "ot", 1]]}, "result": [[0.0303106176], 0, 50.626874923706055, 1610988574.7744305], "version": 0.2, "tvm_version": "0.8.dev0"}
{"input": ["opencl -keys=opencl,gpu -max_num_threads=256", "tutorial/conv2d_no_batching", [1, 40, 40, 512, 256, 1, 1, [1, 1], [0, 0]], {}], "config": {"index": 45730335, "code_hash": null, "entity": [["tile_f", "sp", [-1, 2, 16, 1]], ["tile_y", "sp", [-1, 2, 10, 1]], ["tile_x", "sp", [-1, 5, 2, 2]], ["tile_rc", "sp", [-1, 32]], ["auto_unroll_max_step", "ot", 512], ["unroll_explicit", "ot", 0]]}, "result": [[0.0290016279], 0, 54.24695444107056, 1610988578.4330704], "version": 0.2, "tvm_version": "0.8.dev0"}
{"input": ["opencl -keys=opencl,gpu -max_num_threads=256", "tutorial/conv2d_no_batching", [1, 40, 40, 512, 256, 1, 1, [1, 1], [0, 0]], {}], "config": {"index": 43036435, "code_hash": null, "entity": [["tile_f", "sp", [-1, 2, 16, 1]], ["tile_y", "sp", [-1, 4, 5, 1]], ["tile_x", "sp", [-1, 1, 10, 2]], ["tile_rc", "sp", [-1, 8]], ["auto_unroll_max_step", "ot", 512], ["unroll_explicit", "ot", 0]]}, "result": [[0.0363036599], 0, 62.156367778778076, 1610988586.35831], "version": 0.2, "tvm_version": "0.8.dev0"}
{"input": ["opencl -keys=opencl,gpu -max_num_threads=256", "tutorial/conv2d_no_batching", [1, 40, 40, 512, 256, 1, 1, [1, 1], [0, 0]], {}], "config": {"index": 95132435, "code_hash": null, "entity": [["tile_f", "sp", [-1, 2, 16, 1]], ["tile_y", "sp", [-1, 4, 5, 1]], ["tile_x", "sp", [-1, 1, 10, 2]], ["tile_rc", "sp", [-1, 16]], ["auto_unroll_max_step", "ot", 512], ["unroll_explicit", "ot", 1]]}, "result": [[0.0356042119], 0, 58.206100940704346, 1610988582.4159458], "version": 0.2, "tvm_version": "0.8.dev0"}
{"input": ["opencl -keys=opencl,gpu -max_num_threads=256", "tutorial/conv2d_no_batching", [1, 40, 40, 512, 256, 1, 1, [1, 1], [0, 0]], {}], "config": {"index": 44444435, "code_hash": null, "entity": [["tile_f", "sp", [-1, 2, 16, 1]], ["tile_y", "sp", [-1, 4, 5, 1]], ["tile_x", "sp", [-1, 1, 10, 2]], ["tile_rc", "sp", [-1, 16]], ["auto_unroll_max_step", "ot", 512], ["unroll_explicit", "ot", 0]]}, "result": [[0.0213689396], 0, 65.51216125488281, 1610988589.7584624], "version": 0.2, "tvm_version": "0.8.dev0"}
{"input": ["opencl -keys=opencl,gpu -max_num_threads=256", "tutorial/conv2d_no_batching", [1, 40, 40, 512, 256, 1, 1, [1, 1], [0, 0]], {}], "config": {"index": 93724435, "code_hash": null, "entity": [["tile_f", "sp", [-1, 2, 16, 1]], ["tile_y", "sp", [-1, 4, 5, 1]], ["tile_x", "sp", [-1, 1, 10, 2]], ["tile_rc", "sp", [-1, 8]], ["auto_unroll_max_step", "ot", 512], ["unroll_explicit", "ot", 1]]}, "result": [[0.035844764], 0, 3.5182199478149414, 1610988594.3551402], "version": 0.2, "tvm_version": "0.8.dev0"}
{"input": ["opencl -keys=opencl,gpu -max_num_threads=256", "tutorial/conv2d_no_batching", [1, 40, 40, 512, 256, 1, 1, [1, 1], [0, 0]], {}], "config": {"index": 92316435, "code_hash": null, "entity": [["tile_f", "sp", [-1, 2, 16, 1]], ["tile_y", "sp", [-1, 4, 5, 1]], ["tile_x", "sp", [-1, 1, 10, 2]], ["tile_rc", "sp", [-1, 4]], ["auto_unroll_max_step", "ot", 512], ["unroll_explicit", "ot", 1]]}, "result": [[0.023382804400000002], 0, 7.045876741409302, 1610988597.899844], "version": 0.2, "tvm_version": "0.8.dev0"}
{"input": ["opencl -keys=opencl,gpu -max_num_threads=256", "tutorial/conv2d_no_batching", [1, 40, 40, 512, 256, 1, 1, [1, 1], [0, 0]], {}], "config": {"index": 41628435, "code_hash": null, "entity": [["tile_f", "sp", [-1, 2, 16, 1]], ["tile_y", "sp", [-1, 4, 5, 1]], ["tile_x", "sp", [-1, 1, 10, 2]], ["tile_rc", "sp", [-1, 4]], ["auto_unroll_max_step", "ot", 512], ["unroll_explicit", "ot", 0]]}, "result": [[0.0231547627], 0, 10.706166744232178, 1610988601.5683098], "version": 0.2, "tvm_version": "0.8.dev0"}
{"input": ["opencl -keys=opencl,gpu -max_num_threads=256", "tutorial/conv2d_no_batching", [1, 40, 40, 512, 256, 1, 1, [1, 1], [0, 0]], {}], "config": {"index": 45852435, "code_hash": null, "entity": [["tile_f", "sp", [-1, 2, 16, 1]], ["tile_y", "sp", [-1, 4, 5, 1]], ["tile_x", "sp", [-1, 1, 10, 2]], ["tile_rc", "sp", [-1, 32]], ["auto_unroll_max_step", "ot", 512], ["unroll_explicit", "ot", 0]]}, "result": [[0.0212406272], 0, 14.252149820327759, 1610988605.1317103], "version": 0.2, "tvm_version": "0.8.dev0"}
{"input": ["opencl -keys=opencl,gpu -max_num_threads=256", "tutorial/conv2d_no_batching", [1, 40, 40, 512, 256, 1, 1, [1, 1], [0, 0]], {}], "config": {"index": 89185372, "code_hash": null, "entity": [["tile_f", "sp", [-1, 4, 2, 1]], ["tile_y", "sp", [-1, 2, 20, 1]], ["tile_x", "sp", [-1, 1, 20, 1]], ["tile_rc", "sp", [-1, 1]], ["auto_unroll_max_step", "ot", 512], ["unroll_explicit", "ot", 1]]}, "result": [[0.0613559176], 0, 18.948356866836548, 1610988609.8308704], "version": 0.2, "tvm_version": "0.8.dev0"}
{"input": ["opencl -keys=opencl,gpu -max_num_threads=256", "tutorial/conv2d_no_batching", [1, 40, 40, 512, 256, 1, 1, [1, 1], [0, 0]], {}], "config": {"index": 38764921, "code_hash": null, "entity": [["tile_f", "sp", [-1, 2, 32, 1]], ["tile_y", "sp", [-1, 4, 5, 2]], ["tile_x", "sp", [-1, 1, 5, 2]], ["tile_rc", "sp", [-1, 1]], ["auto_unroll_max_step", "ot", 512], ["unroll_explicit", "ot", 0]]}, "result": [[0.047704228700000004], 0, 3.857775926589966, 1610988742.086081], "version": 0.2, "tvm_version": "0.8.dev0"}
{"input": ["opencl -keys=opencl,gpu -max_num_threads=256", "tutorial/conv2d_no_batching", [1, 40, 40, 512, 256, 1, 1, [1, 1], [0, 0]], {}], "config": {"index": 38777240, "code_hash": null, "entity": [["tile_f", "sp", [-1, 1, 32, 1]], ["tile_y", "sp", [-1, 4, 5, 1]], ["tile_x", "sp", [-1, 2, 5, 2]], ["tile_rc", "sp", [-1, 1]], ["auto_unroll_max_step", "ot", 512], ["unroll_explicit", "ot", 0]]}, "result": [[0.0253369244], 0, 7.3460776805877686, 1610988745.6046498], "version": 0.2, "tvm_version": "0.8.dev0"}
{"input": ["opencl -keys=opencl,gpu -max_num_threads=256", "tutorial/conv2d_no_batching", [1, 40, 40, 512, 256, 1, 1, [1, 1], [0, 0]], {}], "config": {"index": 38276311, "code_hash": null, "entity": [["tile_f", "sp", [-1, 4, 128, 1]], ["tile_y", "sp", [-1, 4, 2, 5]], ["tile_x", "sp", [-1, 1, 4, 1]], ["tile_rc", "sp", [-1, 1]], ["auto_unroll_max_step", "ot", 512], ["unroll_explicit", "ot", 0]]}, "result": [[0.0445606607], 0, 11.581326246261597, 1610988749.8715894], "version": 0.2, "tvm_version": "0.8.dev0"}
{"input": ["opencl -keys=opencl,gpu -max_num_threads=256", "tutorial/conv2d_no_batching", [1, 40, 40, 512, 256, 1, 1, [1, 1], [0, 0]], {}], "config": {"index": 38293911, "code_hash": null, "entity": [["tile_f", "sp", [-1, 4, 128, 1]], ["tile_y", "sp", [-1, 4, 2, 5]], ["tile_x", "sp", [-1, 2, 4, 1]], ["tile_rc", "sp", [-1, 1]], ["auto_unroll_max_step", "ot", 512], ["unroll_explicit", "ot", 0]]}, "result": [[0.0528642865], 0, 15.927074193954468, 1610988754.261278], "version": 0.2, "tvm_version": "0.8.dev0"}
{"input": ["opencl -keys=opencl,gpu -max_num_threads=256", "tutorial/conv2d_no_batching", [1, 40, 40, 512, 256, 1, 1, [1, 1], [0, 0]], {}], "config": {"index": 89465240, "code_hash": null, "entity": [["tile_f", "sp", [-1, 1, 32, 1]], ["tile_y", "sp", [-1, 4, 5, 1]], ["tile_x", "sp", [-1, 2, 5, 2]], ["tile_rc", "sp", [-1, 1]], ["auto_unroll_max_step", "ot", 512], ["unroll_explicit", "ot", 1]]}, "result": [[0.0252932369], 0, 19.42906618118286, 1610988757.7756305], "version": 0.2, "tvm_version": "0.8.dev0"}
{"input": ["opencl -keys=opencl,gpu -max_num_threads=256", "tutorial/conv2d_no_batching", [1, 40, 40, 512, 256, 1, 1, [1, 1], [0, 0]], {}], "config": {"index": 39024310, "code_hash": null, "entity": [["tile_f", "sp", [-1, 2, 128, 1]], ["tile_y", "sp", [-1, 5, 8, 1]], ["tile_x", "sp", [-1, 1, 1, 5]], ["tile_rc", "sp", [-1, 1]], ["auto_unroll_max_step", "ot", 512], ["unroll_explicit", "ot", 0]]}, "result": [[0.0791918152], 0, 24.638055324554443, 1610988762.9787948], "version": 0.2, "tvm_version": "0.8.dev0"}
{"input": ["opencl -keys=opencl,gpu -max_num_threads=256", "tutorial/conv2d_no_batching", [1, 40, 40, 512, 256, 1, 1, [1, 1], [0, 0]], {}], "config": {"index": 39024968, "code_hash": null, "entity": [["tile_f", "sp", [-1, 8, 64, 1]], ["tile_y", "sp", [-1, 4, 10, 1]], ["tile_x", "sp", [-1, 1, 1, 5]], ["tile_rc", "sp", [-1, 1]], ["auto_unroll_max_step", "ot", 512], ["unroll_explicit", "ot", 0]]}, "result": [[0.0793995913], 0, 29.768069982528687, 1610988768.1682], "version": 0.2, "tvm_version": "0.8.dev0"}
{"input": ["opencl -keys=opencl,gpu -max_num_threads=256", "tutorial/conv2d_no_batching", [1, 40, 40, 512, 256, 1, 1, [1, 1], [0, 0]], {}], "config": {"index": 40080306, "code_hash": null, "entity": [["tile_f", "sp", [-1, 2, 64, 1]], ["tile_y", "sp", [-1, 5, 8, 1]], ["tile_x", "sp", [-1, 2, 2, 2]], ["tile_rc", "sp", [-1, 2]], ["auto_unroll_max_step", "ot", 512], ["unroll_explicit", "ot", 0]]}, "result": [[0.0241699451], 0, 33.352179527282715, 1610988771.7751856], "version": 0.2, "tvm_version": "0.8.dev0"}
{"input": ["opencl -keys=opencl,gpu -max_num_threads=256", "tutorial/conv2d_no_batching", [1, 40, 40, 512, 256, 1, 1, [1, 1], [0, 0]], {}], "config": {"index": 40080307, "code_hash": null, "entity": [["tile_f", "sp", [-1, 4, 64, 1]], ["tile_y", "sp", [-1, 5, 8, 1]], ["tile_x", "sp", [-1, 2, 2, 2]], ["tile_rc", "sp", [-1, 2]], ["auto_unroll_max_step", "ot", 512], ["unroll_explicit", "ot", 0]]}, "result": [[0.0254572994], 0, 36.84932041168213, 1610988775.2895572], "version": 0.2, "tvm_version": "0.8.dev0"}
{"input": ["opencl -keys=opencl,gpu -max_num_threads=256", "tutorial/conv2d_no_batching", [1, 40, 40, 512, 256, 1, 1, [1, 1], [0, 0]], {}], "config": {"index": 38672306, "code_hash": null, "entity": [["tile_f", "sp", [-1, 2, 64, 1]], ["tile_y", "sp", [-1, 5, 8, 1]], ["tile_x", "sp", [-1, 2, 2, 2]], ["tile_rc", "sp", [-1, 1]], ["auto_unroll_max_step", "ot", 512], ["unroll_explicit", "ot", 0]]}, "result": [[0.024963924300000002], 0, 40.4278826713562, 1610988778.8922143], "version": 0.2, "tvm_version": "0.8.dev0"}
{"input": ["opencl -keys=opencl,gpu -max_num_threads=256", "tutorial/conv2d_no_batching", [1, 40, 40, 512, 256, 1, 1, [1, 1], [0, 0]], {}], "config": {"index": 89452921, "code_hash": null, "entity": [["tile_f", "sp", [-1, 2, 32, 1]], ["tile_y", "sp", [-1, 4, 5, 2]], ["tile_x", "sp", [-1, 1, 5, 2]], ["tile_rc", "sp", [-1, 1]], ["auto_unroll_max_step", "ot", 512], ["unroll_explicit", "ot", 1]]}, "result": [[0.0478568017], 0, 44.77311420440674, 1610988783.2570636], "version": 0.2, "tvm_version": "0.8.dev0"}
{"input": ["opencl -keys=opencl,gpu -max_num_threads=256", "tutorial/conv2d_no_batching", [1, 40, 40, 512, 256, 1, 1, [1, 1], [0, 0]], {}], "config": {"index": 40080961, "code_hash": null, "entity": [["tile_f", "sp", [-1, 2, 32, 1]], ["tile_y", "sp", [-1, 4, 10, 1]], ["tile_x", "sp", [-1, 2, 2, 2]], ["tile_rc", "sp", [-1, 2]], ["auto_unroll_max_step", "ot", 512], ["unroll_explicit", "ot", 0]]}, "result": [[0.025175153500000002], 0, 48.257545471191406, 1610988786.7525563], "version": 0.2, "tvm_version": "0.8.dev0"}
{"input": ["opencl -keys=opencl,gpu -max_num_threads=256", "tutorial/conv2d_no_batching", [1, 40, 40, 512, 256, 1, 1, [1, 1], [0, 0]], {}], "config": {"index": 88964311, "code_hash": null, "entity": [["tile_f", "sp", [-1, 4, 128, 1]], ["tile_y", "sp", [-1, 4, 2, 5]], ["tile_x", "sp", [-1, 1, 4, 1]], ["tile_rc", "sp", [-1, 1]], ["auto_unroll_max_step", "ot", 512], ["unroll_explicit", "ot", 1]]}, "result": [[0.045495843], 0, 52.375770568847656, 1610988790.8960726], "version": 0.2, "tvm_version": "0.8.dev0"}
{"input": ["opencl -keys=opencl,gpu -max_num_threads=256", "tutorial/conv2d_no_batching", [1, 40, 40, 512, 256, 1, 1, [1, 1], [0, 0]], {}], "config": {"index": 38672961, "code_hash": null, "entity": [["tile_f", "sp", [-1, 2, 32, 1]], ["tile_y", "sp", [-1, 4, 10, 1]], ["tile_x", "sp", [-1, 2, 2, 2]], ["tile_rc", "sp", [-1, 1]], ["auto_unroll_max_step", "ot", 512], ["unroll_explicit", "ot", 0]]}, "result": [[0.0257113255], 0, 59.45071291923523, 1610988798.0024774], "version": 0.2, "tvm_version": "0.8.dev0"}
{"input": ["opencl -keys=opencl,gpu -max_num_threads=256", "tutorial/conv2d_no_batching", [1, 40, 40, 512, 256, 1, 1, [1, 1], [0, 0]], {}], "config": {"index": 26105240, "code_hash": null, "entity": [["tile_f", "sp", [-1, 1, 32, 1]], ["tile_y", "sp", [-1, 4, 5, 1]], ["tile_x", "sp", [-1, 2, 5, 2]], ["tile_rc", "sp", [-1, 1]], ["auto_unroll_max_step", "ot", 256], ["unroll_explicit", "ot", 0]]}, "result": [[0.0253307578], 0, 55.891525745391846, 1610988794.4681156], "version": 0.2, "tvm_version": "0.8.dev0"}
{"input": ["opencl -keys=opencl,gpu -max_num_threads=256", "tutorial/conv2d_no_batching", [1, 40, 40, 512, 256, 1, 1, [1, 1], [0, 0]], {}], "config": {"index": 761240, "code_hash": null, "entity": [["tile_f", "sp", [-1, 1, 32, 1]], ["tile_y", "sp", [-1, 4, 5, 1]], ["tile_x", "sp", [-1, 2, 5, 2]], ["tile_rc", "sp", [-1, 1]], ["auto_unroll_max_step", "ot", 0], ["unroll_explicit", "ot", 0]]}, "result": [[0.025473638], 0, 62.966577768325806, 1610988801.5700073], "version": 0.2, "tvm_version": "0.8.dev0"}
{"input": ["opencl -keys=opencl,gpu -max_num_threads=256", "tutorial/conv2d_no_batching", [1, 40, 40, 512, 256, 1, 1, [1, 1], [0, 0]], {}], "config": {"index": 13433240, "code_hash": null, "entity": [["tile_f", "sp", [-1, 1, 32, 1]], ["tile_y", "sp", [-1, 4, 5, 1]], ["tile_x", "sp", [-1, 2, 5, 2]], ["tile_rc", "sp", [-1, 1]], ["auto_unroll_max_step", "ot", 128], ["unroll_explicit", "ot", 0]]}, "result": [[0.0253356953], 0, 3.089984655380249, 1610988805.9167712], "version": 0.2, "tvm_version": "0.8.dev0"}
{"input": ["opencl -keys=opencl,gpu -max_num_threads=256", "tutorial/conv2d_no_batching", [1, 40, 40, 512, 256, 1, 1, [1, 1], [0, 0]], {}], "config": {"index": 38276091, "code_hash": null, "entity": [["tile_f", "sp", [-1, 4, 128, 1]], ["tile_y", "sp", [-1, 2, 2, 5]], ["tile_x", "sp", [-1, 1, 4, 1]], ["tile_rc", "sp", [-1, 1]], ["auto_unroll_max_step", "ot", 512], ["unroll_explicit", "ot", 0]]}, "result": [[0.0410790718], 0, 7.058681964874268, 1610988809.9126196], "version": 0.2, "tvm_version": "0.8.dev0"}
{"input": ["opencl -keys=opencl,gpu -max_num_threads=256", "tutorial/conv2d_no_batching", [1, 40, 40, 512, 256, 1, 1, [1, 1], [0, 0]], {}], "config": {"index": 38654705, "code_hash": null, "entity": [["tile_f", "sp", [-1, 1, 64, 1]], ["tile_y", "sp", [-1, 5, 8, 1]], ["tile_x", "sp", [-1, 1, 2, 2]], ["tile_rc", "sp", [-1, 1]], ["auto_unroll_max_step", "ot", 512], ["unroll_explicit", "ot", 0]]}, "result": [[0.0239278305], 0, 10.573546171188354, 1610988813.4424415], "version": 0.2, "tvm_version": "0.8.dev0"}
{"input": ["opencl -keys=opencl,gpu -max_num_threads=256", "tutorial/conv2d_no_batching", [1, 40, 40, 512, 256, 1, 1, [1, 1], [0, 0]], {}], "config": {"index": 25604311, "code_hash": null, "entity": [["tile_f", "sp", [-1, 4, 128, 1]], ["tile_y", "sp", [-1, 4, 2, 5]], ["tile_x", "sp", [-1, 1, 4, 1]], ["tile_rc", "sp", [-1, 1]], ["auto_unroll_max_step", "ot", 256], ["unroll_explicit", "ot", 0]]}, "result": [[0.0448223013], 0, 14.687381505966187, 1610988817.5756075], "version": 0.2, "tvm_version": "0.8.dev0"}
{"input": ["opencl -keys=opencl,gpu -max_num_threads=256", "tutorial/conv2d_no_batching", [1, 40, 40, 512, 256, 1, 1, [1, 1], [0, 0]], {}], "config": {"index": 90768307, "code_hash": null, "entity": [["tile_f", "sp", [-1, 4, 64, 1]], ["tile_y", "sp", [-1, 5, 8, 1]], ["tile_x", "sp", [-1, 2, 2, 2]], ["tile_rc", "sp", [-1, 2]], ["auto_unroll_max_step", "ot", 512], ["unroll_explicit", "ot", 1]]}, "result": [[0.0261601433], 0, 18.269147634506226, 1610988821.1789591], "version": 0.2, "tvm_version": "0.8.dev0"}
{"input": ["opencl -keys=opencl,gpu -max_num_threads=256", "tutorial/conv2d_no_batching", [1, 40, 40, 512, 256, 1, 1, [1, 1], [0, 0]], {}], "config": {"index": 90768306, "code_hash": null, "entity": [["tile_f", "sp", [-1, 2, 64, 1]], ["tile_y", "sp", [-1, 5, 8, 1]], ["tile_x", "sp", [-1, 2, 2, 2]], ["tile_rc", "sp", [-1, 2]], ["auto_unroll_max_step", "ot", 512], ["unroll_explicit", "ot", 1]]}, "result": [[0.0245678254], 0, 21.780957460403442, 1610988824.690906], "version": 0.2, "tvm_version": "0.8.dev0"}
{"input": ["opencl -keys=opencl,gpu -max_num_threads=256", "tutorial/conv2d_no_batching", [1, 40, 40, 512, 256, 1, 1, [1, 1], [0, 0]], {}], "config": {"index": 89342705, "code_hash": null, "entity": [["tile_f", "sp", [-1, 1, 64, 1]], ["tile_y", "sp", [-1, 5, 8, 1]], ["tile_x", "sp", [-1, 1, 2, 2]], ["tile_rc", "sp", [-1, 1]], ["auto_unroll_max_step", "ot", 512], ["unroll_explicit", "ot", 1]]}, "result": [[0.0239788878], 0, 25.181520223617554, 1610988828.1260102], "version": 0.2, "tvm_version": "0.8.dev0"}
{"input": ["opencl -keys=opencl,gpu -max_num_threads=256", "tutorial/conv2d_no_batching", [1, 40, 40, 512, 256, 1, 1, [1, 1], [0, 0]], {}], "config": {"index": 40062706, "code_hash": null, "entity": [["tile_f", "sp", [-1, 2, 64, 1]], ["tile_y", "sp", [-1, 5, 8, 1]], ["tile_x", "sp", [-1, 1, 2, 2]], ["tile_rc", "sp", [-1, 2]], ["auto_unroll_max_step", "ot", 512], ["unroll_explicit", "ot", 0]]}, "result": [[0.0239221638], 0, 28.604011058807373, 1610988831.5799565], "version": 0.2, "tvm_version": "0.8.dev0"}
{"input": ["opencl -keys=opencl,gpu -max_num_threads=256", "tutorial/conv2d_no_batching", [1, 40, 40, 512, 256, 1, 1, [1, 1], [0, 0]], {}], "config": {"index": 25621911, "code_hash": null, "entity": [["tile_f", "sp", [-1, 4, 128, 1]], ["tile_y", "sp", [-1, 4, 2, 5]], ["tile_x", "sp", [-1, 2, 4, 1]], ["tile_rc", "sp", [-1, 1]], ["auto_unroll_max_step", "ot", 256], ["unroll_explicit", "ot", 0]]}, "result": [[0.0530565574], 0, 32.97810673713684, 1610988835.9765553], "version": 0.2, "tvm_version": "0.8.dev0"}
{"input": ["opencl -keys=opencl,gpu -max_num_threads=256", "tutorial/conv2d_no_batching", [1, 40, 40, 512, 256, 1, 1, [1, 1], [0, 0]], {}], "config": {"index": 39024967, "code_hash": null, "entity": [["tile_f", "sp", [-1, 4, 64, 1]], ["tile_y", "sp", [-1, 4, 10, 1]], ["tile_x", "sp", [-1, 1, 1, 5]], ["tile_rc", "sp", [-1, 1]], ["auto_unroll_max_step", "ot", 512], ["unroll_explicit", "ot", 0]]}, "result": [[0.0774029609], 0, 38.12453842163086, 1610988841.1277218], "version": 0.2, "tvm_version": "0.8.dev0"}
{"input": ["opencl -keys=opencl,gpu -max_num_threads=256", "tutorial/conv2d_no_batching", [1, 40, 40, 512, 256, 1, 1, [1, 1], [0, 0]], {}], "config": {"index": 89360306, "code_hash": null, "entity": [["tile_f", "sp", [-1, 2, 64, 1]], ["tile_y", "sp", [-1, 5, 8, 1]], ["tile_x", "sp", [-1, 2, 2, 2]], ["tile_rc", "sp", [-1, 1]], ["auto_unroll_max_step", "ot", 512], ["unroll_explicit", "ot", 1]]}, "result": [[0.024957231599999997], 0, 41.733821630477905, 1610988844.7538285], "version": 0.2, "tvm_version": "0.8.dev0"}
{"input": ["opencl -keys=opencl,gpu -max_num_threads=256", "tutorial/conv2d_no_batching", [1, 40, 40, 512, 256, 1, 1, [1, 1], [0, 0]], {}], "config": {"index": 38729065, "code_hash": null, "entity": [["tile_f", "sp", [-1, 1, 64, 1]], ["tile_y", "sp", [-1, 5, 4, 2]], ["tile_x", "sp", [-1, 1, 4, 2]], ["tile_rc", "sp", [-1, 1]], ["auto_unroll_max_step", "ot", 512], ["unroll_explicit", "ot", 0]]}, "result": [[0.0327948366], 0, 45.46200942993164, 1610988848.5067735], "version": 0.2, "tvm_version": "0.8.dev0"}
{"input": ["opencl -keys=opencl,gpu -max_num_threads=256", "tutorial/conv2d_no_batching", [1, 40, 40, 512, 256, 1, 1, [1, 1], [0, 0]], {}], "config": {"index": 38654707, "code_hash": null, "entity": [["tile_f", "sp", [-1, 4, 64, 1]], ["tile_y", "sp", [-1, 5, 8, 1]], ["tile_x", "sp", [-1, 1, 2, 2]], ["tile_rc", "sp", [-1, 1]], ["auto_unroll_max_step", "ot", 512], ["unroll_explicit", "ot", 0]]}, "result": [[0.02506119], 0, 52.43378973007202, 1610988855.5230746], "version": 0.2, "tvm_version": "0.8.dev0"}
{"input": ["opencl -keys=opencl,gpu -max_num_threads=256", "tutorial/conv2d_no_batching", [1, 40, 40, 512, 256, 1, 1, [1, 1], [0, 0]], {}], "config": {"index": 38654706, "code_hash": null, "entity": [["tile_f", "sp", [-1, 2, 64, 1]], ["tile_y", "sp", [-1, 5, 8, 1]], ["tile_x", "sp", [-1, 1, 2, 2]], ["tile_rc", "sp", [-1, 1]], ["auto_unroll_max_step", "ot", 512], ["unroll_explicit", "ot", 0]]}, "result": [[0.0245587368], 0, 48.93584108352661, 1610988852.0347948], "version": 0.2, "tvm_version": "0.8.dev0"}
{"input": ["opencl -keys=opencl,gpu -max_num_threads=256", "tutorial/conv2d_no_batching", [1, 40, 40, 512, 256, 1, 1, [1, 1], [0, 0]], {}], "config": {"index": 38725103, "code_hash": null, "entity": [["tile_f", "sp", [-1, 8, 32, 1]], ["tile_y", "sp", [-1, 5, 8, 1]], ["tile_x", "sp", [-1, 1, 4, 2]], ["tile_rc", "sp", [-1, 1]], ["auto_unroll_max_step", "ot", 512], ["unroll_explicit", "ot", 0]]}, "result": [[0.0176809445], 0, 55.66129660606384, 1610988858.7994578], "version": 0.2, "tvm_version": "0.8.dev0"}
{"input": ["opencl -keys=opencl,gpu -max_num_threads=256", "tutorial/conv2d_no_batching", [1, 40, 40, 512, 256, 1, 1, [1, 1], [0, 0]], {}], "config": {"index": 38725102, "code_hash": null, "entity": [["tile_f", "sp", [-1, 4, 32, 1]], ["tile_y", "sp", [-1, 5, 8, 1]], ["tile_x", "sp", [-1, 1, 4, 2]], ["tile_rc", "sp", [-1, 1]], ["auto_unroll_max_step", "ot", 512], ["unroll_explicit", "ot", 0]]}, "result": [[0.016368335], 0, 58.78198027610779, 1610988861.9414876], "version": 0.2, "tvm_version": "0.8.dev0"}
{"input": ["opencl -keys=opencl,gpu -max_num_threads=256", "tutorial/conv2d_no_batching", [1, 40, 40, 512, 256, 1, 1, [1, 1], [0, 0]], {}], "config": {"index": 40185240, "code_hash": null, "entity": [["tile_f", "sp", [-1, 1, 32, 1]], ["tile_y", "sp", [-1, 4, 5, 1]], ["tile_x", "sp", [-1, 2, 5, 2]], ["tile_rc", "sp", [-1, 2]], ["auto_unroll_max_step", "ot", 512], ["unroll_explicit", "ot", 0]]}, "result": [[0.0249370702], 0, 3.0694046020507812, 1610988866.253046], "version": 0.2, "tvm_version": "0.8.dev0"}
{"input": ["opencl -keys=opencl,gpu -max_num_threads=256", "tutorial/conv2d_no_batching", [1, 40, 40, 512, 256, 1, 1, [1, 1], [0, 0]], {}], "config": {"index": 40172921, "code_hash": null, "entity": [["tile_f", "sp", [-1, 2, 32, 1]], ["tile_y", "sp", [-1, 4, 5, 2]], ["tile_x", "sp", [-1, 1, 5, 2]], ["tile_rc", "sp", [-1, 2]], ["auto_unroll_max_step", "ot", 512], ["unroll_explicit", "ot", 0]]}, "result": [[0.0401134883], 0, 7.0968780517578125, 1610988870.3042638], "version": 0.2, "tvm_version": "0.8.dev0"}
{"input": ["opencl -keys=opencl,gpu -max_num_threads=256", "tutorial/conv2d_no_batching", [1, 40, 40, 512, 256, 1, 1, [1, 1], [0, 0]], {}], "config": {"index": 38936308, "code_hash": null, "entity": [["tile_f", "sp", [-1, 8, 64, 1]], ["tile_y", "sp", [-1, 5, 8, 1]], ["tile_x", "sp", [-1, 1, 2, 4]], ["tile_rc", "sp", [-1, 1]], ["auto_unroll_max_step", "ot", 512], ["unroll_explicit", "ot", 0]]}, "result": [[0.015588662999999999], 0, 10.314323663711548, 1610988873.5342648], "version": 0.2, "tvm_version": "0.8.dev0"}
{"input": ["opencl -keys=opencl,gpu -max_num_threads=256", "tutorial/conv2d_no_batching", [1, 40, 40, 512, 256, 1, 1, [1, 1], [0, 0]], {}], "config": {"index": 89712310, "code_hash": null, "entity": [["tile_f", "sp", [-1, 2, 128, 1]], ["tile_y", "sp", [-1, 5, 8, 1]], ["tile_x", "sp", [-1, 1, 1, 5]], ["tile_rc", "sp", [-1, 1]], ["auto_unroll_max_step", "ot", 512], ["unroll_explicit", "ot", 1]]}, "result": [[0.0784789245], 0, 15.521827936172485, 1610988878.7597938], "version": 0.2, "tvm_version": "0.8.dev0"}
{"input": ["opencl -keys=opencl,gpu -max_num_threads=256", "tutorial/conv2d_no_batching", [1, 40, 40, 512, 256, 1, 1, [1, 1], [0, 0]], {}], "config": {"index": 38417544, "code_hash": null, "entity": [["tile_f", "sp", [-1, 16, 32, 1]], ["tile_y", "sp", [-1, 2, 4, 5]], ["tile_x", "sp", [-1, 1, 8, 1]], ["tile_rc", "sp", [-1, 1]], ["auto_unroll_max_step", "ot", 512], ["unroll_explicit", "ot", 0]]}, "result": [[0.0202250229], 0, 18.92227268218994, 1610988882.1834075], "version": 0.2, "tvm_version": "0.8.dev0"}
{"input": ["opencl -keys=opencl,gpu -max_num_threads=256", "tutorial/conv2d_no_batching", [1, 40, 40, 512, 256, 1, 1, [1, 1], [0, 0]], {}], "config": {"index": 13420921, "code_hash": null, "entity": [["tile_f", "sp", [-1, 2, 32, 1]], ["tile_y", "sp", [-1, 4, 5, 2]], ["tile_x", "sp", [-1, 1, 5, 2]], ["tile_rc", "sp", [-1, 1]], ["auto_unroll_max_step", "ot", 128], ["unroll_explicit", "ot", 0]]}, "result": [[0.0476903016], 0, 23.213787317276, 1610988886.504922], "version": 0.2, "tvm_version": "0.8.dev0"}
{"input": ["opencl -keys=opencl,gpu -max_num_threads=256", "tutorial/conv2d_no_batching", [1, 40, 40, 512, 256, 1, 1, [1, 1], [0, 0]], {}], "config": {"index": 748921, "code_hash": null, "entity": [["tile_f", "sp", [-1, 2, 32, 1]], ["tile_y", "sp", [-1, 4, 5, 2]], ["tile_x", "sp", [-1, 1, 5, 2]], ["tile_rc", "sp", [-1, 1]], ["auto_unroll_max_step", "ot", 0], ["unroll_explicit", "ot", 0]]}, "result": [[0.047653791200000004], 0, 27.439873456954956, 1610988890.7362826], "version": 0.2, "tvm_version": "0.8.dev0"}
{"input": ["opencl -keys=opencl,gpu -max_num_threads=256", "tutorial/conv2d_no_batching", [1, 40, 40, 512, 256, 1, 1, [1, 1], [0, 0]], {}], "config": {"index": 38047953, "code_hash": null, "entity": [["tile_f", "sp", [-1, 2, 256, 1]], ["tile_y", "sp", [-1, 2, 4, 5]], ["tile_x", "sp", [-1, 2, 1, 1]], ["tile_rc", "sp", [-1, 1]], ["auto_unroll_max_step", "ot", 512], ["unroll_explicit", "ot", 0]]}, "result": [[0.06435898030000001], 0, 32.11996412277222, 1610988895.4616516], "version": 0.2, "tvm_version": "0.8.dev0"}
{"input": ["opencl -keys=opencl,gpu -max_num_threads=256", "tutorial/conv2d_no_batching", [1, 40, 40, 512, 256, 1, 1, [1, 1], [0, 0]], {}], "config": {"index": 76793240, "code_hash": null, "entity": [["tile_f", "sp", [-1, 1, 32, 1]], ["tile_y", "sp", [-1, 4, 5, 1]], ["tile_x", "sp", [-1, 2, 5, 2]], ["tile_rc", "sp", [-1, 1]], ["auto_unroll_max_step", "ot", 256], ["unroll_explicit", "ot", 1]]}, "result": [[0.0253071587], 0, 35.6437451839447, 1610988898.9907115], "version": 0.2, "tvm_version": "0.8.dev0"}
{"input": ["opencl -keys=opencl,gpu -max_num_threads=256", "tutorial/conv2d_no_batching", [1, 40, 40, 512, 256, 1, 1, [1, 1], [0, 0]], {}], "config": {"index": 38761006, "code_hash": null, "entity": [["tile_f", "sp", [-1, 2, 16, 2]], ["tile_y", "sp", [-1, 4, 10, 1]], ["tile_x", "sp", [-1, 1, 5, 2]], ["tile_rc", "sp", [-1, 1]], ["auto_unroll_max_step", "ot", 512], ["unroll_explicit", "ot", 0]]}, "result": [[0.017159006900000003], 0, 38.90142059326172, 1610988902.2596903], "version": 0.2, "tvm_version": "0.8.dev0"}
{"input": ["opencl -keys=opencl,gpu -max_num_threads=256", "tutorial/conv2d_no_batching", [1, 40, 40, 512, 256, 1, 1, [1, 1], [0, 0]], {}], "config": {"index": 26352310, "code_hash": null, "entity": [["tile_f", "sp", [-1, 2, 128, 1]], ["tile_y", "sp", [-1, 5, 8, 1]], ["tile_x", "sp", [-1, 1, 1, 5]], ["tile_rc", "sp", [-1, 1]], ["auto_unroll_max_step", "ot", 256], ["unroll_explicit", "ot", 0]]}, "result": [[0.07923643500000001], 0, 44.111395597457886, 1610988907.484024], "version": 0.2, "tvm_version": "0.8.dev0"}
{"input": ["opencl -keys=opencl,gpu -max_num_threads=256", "tutorial/conv2d_no_batching", [1, 40, 40, 512, 256, 1, 1, [1, 1], [0, 0]], {}], "config": {"index": 39147502, "code_hash": null, "entity": [["tile_f", "sp", [-1, 4, 32, 1]], ["tile_y", "sp", [-1, 5, 8, 1]], ["tile_x", "sp", [-1, 1, 4, 5]], ["tile_rc", "sp", [-1, 1]], ["auto_unroll_max_step", "ot", 512], ["unroll_explicit", "ot", 0]]}, "result": [[0.054891942900000004], 0, 52.6979877948761, 1610988916.1133547], "version": 0.2, "tvm_version": "0.8.dev0"}
{"input": ["opencl -keys=opencl,gpu -max_num_threads=256", "tutorial/conv2d_no_batching", [1, 40, 40, 512, 256, 1, 1, [1, 1], [0, 0]], {}], "config": {"index": 12932311, "code_hash": null, "entity": [["tile_f", "sp", [-1, 4, 128, 1]], ["tile_y", "sp", [-1, 4, 2, 5]], ["tile_x", "sp", [-1, 1, 4, 1]], ["tile_rc", "sp", [-1, 1]], ["auto_unroll_max_step", "ot", 128], ["unroll_explicit", "ot", 0]]}, "result": [[0.0447764888], 0, 48.24366044998169, 1610988911.6887288], "version": 0.2, "tvm_version": "0.8.dev0"}
{"input": ["opencl -keys=opencl,gpu -max_num_threads=256", "tutorial/conv2d_no_batching", [1, 40, 40, 512, 256, 1, 1, [1, 1], [0, 0]], {}], "config": {"index": 38725100, "code_hash": null, "entity": [["tile_f", "sp", [-1, 1, 32, 1]], ["tile_y", "sp", [-1, 5, 8, 1]], ["tile_x", "sp", [-1, 1, 4, 2]], ["tile_rc", "sp", [-1, 1]], ["auto_unroll_max_step", "ot", 512], ["unroll_explicit", "ot", 0]]}, "result": [[0.015617340099999998], 0, 55.89650893211365, 1610988919.3612862], "version": 0.2, "tvm_version": "0.8.dev0"}
{"input": ["opencl -keys=opencl,gpu -max_num_threads=256", "tutorial/conv2d_no_batching", [1, 40, 40, 512, 256, 1, 1, [1, 1], [0, 0]], {}], "config": {"index": 38778335, "code_hash": null, "entity": [["tile_f", "sp", [-1, 2, 16, 1]], ["tile_y", "sp", [-1, 2, 10, 1]], ["tile_x", "sp", [-1, 2, 5, 2]], ["tile_rc", "sp", [-1, 1]], ["auto_unroll_max_step", "ot", 512], ["unroll_explicit", "ot", 0]]}, "result": [[0.0290060081], 0, 63.29244375228882, 1610988926.7828257], "version": 0.2, "tvm_version": "0.8.dev0"}
{"input": ["opencl -keys=opencl,gpu -max_num_threads=256", "tutorial/conv2d_no_batching", [1, 40, 40, 512, 256, 1, 1, [1, 1], [0, 0]], {}], "config": {"index": 38778336, "code_hash": null, "entity": [["tile_f", "sp", [-1, 4, 16, 1]], ["tile_y", "sp", [-1, 2, 10, 1]], ["tile_x", "sp", [-1, 2, 5, 2]], ["tile_rc", "sp", [-1, 1]], ["auto_unroll_max_step", "ot", 512], ["unroll_explicit", "ot", 0]]}, "result": [[0.0301945395], 0, 59.51764130592346, 1610988923.0429528], "version": 0.2, "tvm_version": "0.8.dev0"}
{"input": ["opencl -keys=opencl,gpu -max_num_threads=256", "tutorial/conv2d_no_batching", [1, 40, 40, 512, 256, 1, 1, [1, 1], [0, 0]], {}], "config": {"index": 39179847, "code_hash": null, "entity": [["tile_f", "sp", [-1, 4, 64, 1]], ["tile_y", "sp", [-1, 4, 2, 1]], ["tile_x", "sp", [-1, 1, 8, 5]], ["tile_rc", "sp", [-1, 1]], ["auto_unroll_max_step", "ot", 512], ["unroll_explicit", "ot", 0]]}, "result": [[0.0663522566], 0, 4.377211809158325, 1610988932.401459], "version": 0.2, "tvm_version": "0.8.dev0"}
{"input": ["opencl -keys=opencl,gpu -max_num_threads=256", "tutorial/conv2d_no_batching", [1, 40, 40, 512, 256, 1, 1, [1, 1], [0, 0]], {}], "config": {"index": 89712968, "code_hash": null, "entity": [["tile_f", "sp", [-1, 8, 64, 1]], ["tile_y", "sp", [-1, 4, 10, 1]], ["tile_x", "sp", [-1, 1, 1, 5]], ["tile_rc", "sp", [-1, 1]], ["auto_unroll_max_step", "ot", 512], ["unroll_explicit", "ot", 1]]}, "result": [[0.07898121620000001], 0, 9.549582958221436, 1610988937.5993047], "version": 0.2, "tvm_version": "0.8.dev0"}
{"input": ["opencl -keys=opencl,gpu -max_num_threads=256", "tutorial/conv2d_no_batching", [1, 40, 40, 512, 256, 1, 1, [1, 1], [0, 0]], {}], "config": {"index": 38729068, "code_hash": null, "entity": [["tile_f", "sp", [-1, 8, 64, 1]], ["tile_y", "sp", [-1, 5, 4, 2]], ["tile_x", "sp", [-1, 1, 4, 2]], ["tile_rc", "sp", [-1, 1]], ["auto_unroll_max_step", "ot", 512], ["unroll_explicit", "ot", 0]]}, "result": [[0.0389305872], 0, 13.51100206375122, 1610988941.571085], "version": 0.2, "tvm_version": "0.8.dev0"}
{"input": ["opencl -keys=opencl,gpu -max_num_threads=256", "tutorial/conv2d_no_batching", [1, 40, 40, 512, 256, 1, 1, [1, 1], [0, 0]], {}], "config": {"index": 40186335, "code_hash": null, "entity": [["tile_f", "sp", [-1, 2, 16, 1]], ["tile_y", "sp", [-1, 2, 10, 1]], ["tile_x", "sp", [-1, 2, 5, 2]], ["tile_rc", "sp", [-1, 2]], ["auto_unroll_max_step", "ot", 512], ["unroll_explicit", "ot", 0]]}, "result": [[0.029094206], 0, 17.15035057067871, 1610988945.2371051], "version": 0.2, "tvm_version": "0.8.dev0"}
{"input": ["opencl -keys=opencl,gpu -max_num_threads=256", "tutorial/conv2d_no_batching", [1, 40, 40, 512, 256, 1, 1, [1, 1], [0, 0]], {}], "config": {"index": 277911, "code_hash": null, "entity": [["tile_f", "sp", [-1, 4, 128, 1]], ["tile_y", "sp", [-1, 4, 2, 5]], ["tile_x", "sp", [-1, 2, 4, 1]], ["tile_rc", "sp", [-1, 1]], ["auto_unroll_max_step", "ot", 0], ["unroll_explicit", "ot", 0]]}, "result": [[0.053395140699999996], 0, 21.656553030014038, 1610988949.7568579], "version": 0.2, "tvm_version": "0.8.dev0"}
{"input": ["opencl -keys=opencl,gpu -max_num_threads=256", "tutorial/conv2d_no_batching", [1, 40, 40, 512, 256, 1, 1, [1, 1], [0, 0]], {}], "config": {"index": 12949911, "code_hash": null, "entity": [["tile_f", "sp", [-1, 4, 128, 1]], ["tile_y", "sp", [-1, 4, 2, 5]], ["tile_x", "sp", [-1, 2, 4, 1]], ["tile_rc", "sp", [-1, 1]], ["auto_unroll_max_step", "ot", 128], ["unroll_explicit", "ot", 0]]}, "result": [[0.05308372930000001], 0, 26.023943662643433, 1610988954.1426914], "version": 0.2, "tvm_version": "0.8.dev0"}
{"input": ["opencl -keys=opencl,gpu -max_num_threads=256", "tutorial/conv2d_no_batching", [1, 40, 40, 512, 256, 1, 1, [1, 1], [0, 0]], {}], "config": {"index": 90750706, "code_hash": null, "entity": [["tile_f", "sp", [-1, 2, 64, 1]], ["tile_y", "sp", [-1, 5, 8, 1]], ["tile_x", "sp", [-1, 1, 2, 2]], ["tile_rc", "sp", [-1, 2]], ["auto_unroll_max_step", "ot", 512], ["unroll_explicit", "ot", 1]]}, "result": [[0.0245371274], 0, 29.6128568649292, 1610988957.7626379], "version": 0.2, "tvm_version": "0.8.dev0"}
{"input": ["opencl -keys=opencl,gpu -max_num_threads=256", "tutorial/conv2d_no_batching", [1, 40, 40, 512, 256, 1, 1, [1, 1], [0, 0]], {}], "config": {"index": 38777243, "code_hash": null, "entity": [["tile_f", "sp", [-1, 8, 32, 1]], ["tile_y", "sp", [-1, 4, 5, 1]], ["tile_x", "sp", [-1, 2, 5, 2]], ["tile_rc", "sp", [-1, 1]], ["auto_unroll_max_step", "ot", 512], ["unroll_explicit", "ot", 0]]}, "result": [[0.0347392118], 0, 33.42053484916687, 1610988961.5920813], "version": 0.2, "tvm_version": "0.8.dev0"}
{"input": ["opencl -keys=opencl,gpu -max_num_threads=256", "tutorial/conv2d_no_batching", [1, 40, 40, 512, 256, 1, 1, [1, 1], [0, 0]], {}], "config": {"index": 38276308, "code_hash": null, "entity": [["tile_f", "sp", [-1, 8, 64, 1]], ["tile_y", "sp", [-1, 4, 2, 5]], ["tile_x", "sp", [-1, 1, 4, 1]], ["tile_rc", "sp", [-1, 1]], ["auto_unroll_max_step", "ot", 512], ["unroll_explicit", "ot", 0]]}, "result": [[0.048316124599999996], 0, 37.66544485092163, 1610988965.837099], "version": 0.2, "tvm_version": "0.8.dev0"}
{"input": ["opencl -keys=opencl,gpu -max_num_threads=256", "tutorial/conv2d_no_batching", [1, 40, 40, 512, 256, 1, 1, [1, 1], [0, 0]], {}], "config": {"index": 40080301, "code_hash": null, "entity": [["tile_f", "sp", [-1, 2, 32, 1]], ["tile_y", "sp", [-1, 5, 8, 1]], ["tile_x", "sp", [-1, 2, 2, 2]], ["tile_rc", "sp", [-1, 2]], ["auto_unroll_max_step", "ot", 512], ["unroll_explicit", "ot", 0]]}, "result": [[0.0241825284], 0, 41.1118049621582, 1610988969.304966], "version": 0.2, "tvm_version": "0.8.dev0"}
{"input": ["opencl -keys=opencl,gpu -max_num_threads=256", "tutorial/conv2d_no_batching", [1, 40, 40, 512, 256, 1, 1, [1, 1], [0, 0]], {}], "config": {"index": 40062705, "code_hash": null, "entity": [["tile_f", "sp", [-1, 1, 64, 1]], ["tile_y", "sp", [-1, 5, 8, 1]], ["tile_x", "sp", [-1, 1, 2, 2]], ["tile_rc", "sp", [-1, 2]], ["auto_unroll_max_step", "ot", 512], ["unroll_explicit", "ot", 0]]}, "result": [[0.0234142888], 0, 44.525131940841675, 1610988972.7623708], "version": 0.2, "tvm_version": "0.8.dev0"}
{"input": ["opencl -keys=opencl,gpu -max_num_threads=256", "tutorial/conv2d_no_batching", [1, 40, 40, 512, 256, 1, 1, [1, 1], [0, 0]], {}], "config": {"index": 38360121, "code_hash": null, "entity": [["tile_f", "sp", [-1, 2, 32, 1]], ["tile_y", "sp", [-1, 4, 5, 2]], ["tile_x", "sp", [-1, 2, 5, 1]], ["tile_rc", "sp", [-1, 1]], ["auto_unroll_max_step", "ot", 512], ["unroll_explicit", "ot", 0]]}, "result": [[0.0343038055], 0, 48.30146861076355, 1610988976.554835], "version": 0.2, "tvm_version": "0.8.dev0"}
{"input": ["opencl -keys=opencl,gpu -max_num_threads=256", "tutorial/conv2d_no_batching", [1, 40, 40, 512, 256, 1, 1, [1, 1], [0, 0]], {}], "config": {"index": 40062708, "code_hash": null, "entity": [["tile_f", "sp", [-1, 8, 64, 1]], ["tile_y", "sp", [-1, 5, 8, 1]], ["tile_x", "sp", [-1, 1, 2, 2]], ["tile_rc", "sp", [-1, 2]], ["auto_unroll_max_step", "ot", 512], ["unroll_explicit", "ot", 0]]}, "result": [[0.025523992099999997], 0, 58.167929887771606, 1610988986.4305558], "version": 0.2, "tvm_version": "0.8.dev0"}
{"input": ["opencl -keys=opencl,gpu -max_num_threads=256", "tutorial/conv2d_no_batching", [1, 40, 40, 512, 256, 1, 1, [1, 1], [0, 0]], {}], "config": {"index": 48178281, "code_hash": null, "entity": [["tile_f", "sp", [-1, 2, 32, 1]], ["tile_y", "sp", [-1, 4, 1, 2]], ["tile_x", "sp", [-1, 10, 4, 1]], ["tile_rc", "sp", [-1, 128]], ["auto_unroll_max_step", "ot", 512], ["unroll_explicit", "ot", 0]]}, "result": [[0.0591438861], 0, 62.76992678642273, 1610988991.090421], "version": 0.2, "tvm_version": "0.8.dev0"}
