test_and_tune/android.topi_depthwise3x3.log.tmp
{"input": ["opencl -keys=mali,opencl,gpu -device=mali -max_num_threads=256", "tutorial/conv2d_no_batching", [1, 64, 64, 512, 256, 3, 3, [1, 1], [1, 1]], {}], "config": {"index": 446056, "code_hash": null, "entity": [["tile_ic", "ot", 4], ["tile_oc", "ot", 4], ["tile_ow", "sp", [-1, 4]], ["unroll_kw", "ot", true], ["tile_cp", "sp", [-1, 16]], ["tile_hp", "sp", [-1, 4, 4]], ["tile_wp", "sp", [-1, 1, 16]], ["ann_spatial", "an", ["unroll", "vec"]]]}, "result": [[0.016741564100000002], 0, 13.454948663711548, 1614849680.6327453], "version": 0.2, "tvm_version": "0.8.dev0"}
{"input": ["opencl -keys=mali,opencl,gpu -device=mali -max_num_threads=256", "tutorial/conv2d_no_batching", [1, 64, 64, 512, 256, 3, 3, [1, 1], [1, 1]], {}], "config": {"index": 27289, "code_hash": null, "entity": [["tile_ic", "ot", 4], ["tile_oc", "ot", 4], ["tile_ow", "sp", [-1, 8]], ["unroll_kw", "ot", true], ["tile_cp", "sp", [-1, 8]], ["tile_hp", "sp", [-1, 2, 32]], ["tile_wp", "sp", [-1, 4, 2]], ["ann_spatial", "an", ["none", "none"]]]}, "result": [[0.0014907396999999998], 0, 27.6357159614563, 1614849694.8645477], "version": 0.2, "tvm_version": "0.8.dev0"}
{"input": ["opencl -keys=mali,opencl,gpu -device=mali -max_num_threads=256", "tutorial/conv2d_no_batching", [1, 64, 64, 512, 256, 3, 3, [1, 1], [1, 1]], {}], "config": {"index": 150203, "code_hash": null, "entity": [["tile_ic", "ot", 4], ["tile_oc", "ot", 4], ["tile_ow", "sp", [-1, 16]], ["unroll_kw", "ot", false], ["tile_cp", "sp", [-1, 16]], ["tile_hp", "sp", [-1, 4, 8]], ["tile_wp", "sp", [-1, 2, 32]], ["ann_spatial", "an", ["none", "unroll"]]]}, "result": [[0.0139341524], 0, 74.38458204269409, 1614849741.712175], "version": 0.2, "tvm_version": "0.8.dev0"}
{"input": ["opencl -keys=mali,opencl,gpu -device=mali -max_num_threads=256", "tutorial/conv2d_no_batching", [1, 64, 64, 512, 256, 3, 3, [1, 1], [1, 1]], {}], "config": {"index": 8225, "code_hash": null, "entity": [["tile_ic", "ot", 4], ["tile_oc", "ot", 4], ["tile_ow", "sp", [-1, 1]], ["unroll_kw", "ot", false], ["tile_cp", "sp", [-1, 64]], ["tile_hp", "sp", [-1, 1, 64]], ["tile_wp", "sp", [-1, 4, 1]], ["ann_spatial", "an", ["none", "none"]]]}, "result": [[0.0022532294], 0, 59.05500078201294, 1614849726.450014], "version": 0.2, "tvm_version": "0.8.dev0"}
{"input": ["opencl -keys=mali,opencl,gpu -device=mali -max_num_threads=256", "tutorial/conv2d_no_batching", [1, 64, 64, 512, 256, 3, 3, [1, 1], [1, 1]], {}], "config": {"index": 105213, "code_hash": null, "entity": [["tile_ic", "ot", 4], ["tile_oc", "ot", 4], ["tile_ow", "sp", [-1, 8]], ["unroll_kw", "ot", true], ["tile_cp", "sp", [-1, 16]], ["tile_hp", "sp", [-1, 4, 2]], ["tile_wp", "sp", [-1, 8, 2]], ["ann_spatial", "an", ["none", "unroll"]]]}, "result": [[0.0013659845], 0, 41.734437465667725, 1614849709.0980012], "version": 0.2, "tvm_version": "0.8.dev0"}
{"input": ["opencl -keys=mali,opencl,gpu -device=mali -max_num_threads=256", "tutorial/conv2d_no_batching", [1, 64, 64, 512, 256, 3, 3, [1, 1], [1, 1]], {}], "config": {"index": 353033, "code_hash": null, "entity": [["tile_ic", "ot", 4], ["tile_oc", "ot", 4], ["tile_ow", "sp", [-1, 4]], ["unroll_kw", "ot", false], ["tile_cp", "sp", [-1, 4]], ["tile_hp", "sp", [-1, 1, 8]], ["tile_wp", "sp", [-1, 8, 4]], ["ann_spatial", "an", ["unroll", "unroll"]]]}, "result": [[0.0046221307], 0, 86.08924102783203, 1614849753.507743], "version": 0.2, "tvm_version": "0.8.dev0"}
{"input": ["opencl -keys=mali,opencl,gpu -device=mali -max_num_threads=256", "tutorial/conv2d_no_batching", [1, 64, 64, 512, 256, 3, 3, [1, 1], [1, 1]], {}], "config": {"index": 457383, "code_hash": null, "entity": [["tile_ic", "ot", 4], ["tile_oc", "ot", 4], ["tile_ow", "sp", [-1, 8]], ["unroll_kw", "ot", true], ["tile_cp", "sp", [-1, 2]], ["tile_hp", "sp", [-1, 2, 8]], ["tile_wp", "sp", [-1, 2, 32]], ["ann_spatial", "an", ["unroll", "vec"]]]}, "result": [[0.0068799746999999994], 0, 157.1976454257965, 1614849824.8300395], "version": 0.2, "tvm_version": "0.8.dev0"}
{"input": ["opencl -keys=mali,opencl,gpu -device=mali -max_num_threads=256", "tutorial/conv2d_no_batching", [1, 64, 64, 512, 256, 3, 3, [1, 1], [1, 1]], {}], "config": {"index": 434184, "code_hash": null, "entity": [["tile_ic", "ot", 4], ["tile_oc", "ot", 4], ["tile_ow", "sp", [-1, 4]], ["unroll_kw", "ot", true], ["tile_cp", "sp", [-1, 8]], ["tile_hp", "sp", [-1, 64, 1]], ["tile_wp", "sp", [-1, 1, 8]], ["ann_spatial", "an", ["unroll", "vec"]]]}, "result": [[0.0142229233], 0, 144.17479014396667, 1614849811.782621], "version": 0.2, "tvm_version": "0.8.dev0"}
{"input": ["opencl -keys=mali,opencl,gpu -device=mali -max_num_threads=256", "tutorial/conv2d_no_batching", [1, 64, 64, 512, 256, 3, 3, [1, 1], [1, 1]], {}], "config": {"index": 563912, "code_hash": null, "entity": [["tile_ic", "ot", 4], ["tile_oc", "ot", 4], ["tile_ow", "sp", [-1, 64]], ["unroll_kw", "ot", true], ["tile_cp", "sp", [-1, 2]], ["tile_hp", "sp", [-1, 2, 4]], ["tile_wp", "sp", [-1, 4, 2]], ["ann_spatial", "an", ["vec", "unroll"]]]}, "result": [[0.0025135002999999998], 0, 99.65131998062134, 1614849767.2200818], "version": 0.2, "tvm_version": "0.8.dev0"}
{"input": ["opencl -keys=mali,opencl,gpu -device=mali -max_num_threads=256", "tutorial/conv2d_no_batching", [1, 64, 64, 512, 256, 3, 3, [1, 1], [1, 1]], {}], "config": {"index": 250163, "code_hash": null, "entity": [["tile_ic", "ot", 4], ["tile_oc", "ot", 4], ["tile_ow", "sp", [-1, 16]], ["unroll_kw", "ot", false], ["tile_cp", "sp", [-1, 16]], ["tile_hp", "sp", [-1, 16, 1]], ["tile_wp", "sp", [-1, 1, 2]], ["ann_spatial", "an", ["unroll", "none"]]]}, "result": [[0.0013752814], 0, 113.50128984451294, 1614849781.0738335], "version": 0.2, "tvm_version": "0.8.dev0"}
{"input": ["opencl -keys=mali,opencl,gpu -device=mali -max_num_threads=256", "tutorial/conv2d_no_batching", [1, 64, 64, 512, 256, 3, 3, [1, 1], [1, 1]], {}], "config": {"index": 303628, "code_hash": null, "entity": [["tile_ic", "ot", 4], ["tile_oc", "ot", 4], ["tile_ow", "sp", [-1, 8]], ["unroll_kw", "ot", false], ["tile_cp", "sp", [-1, 2]], ["tile_hp", "sp", [-1, 1, 8]], ["tile_wp", "sp", [-1, 2, 32]], ["ann_spatial", "an", ["unroll", "none"]]]}, "result": [[0.0095162145], 0, 38.61955785751343, 1614849877.99377], "version": 0.2, "tvm_version": "0.8.dev0"}
{"input": ["opencl -keys=mali,opencl,gpu -device=mali -max_num_threads=256", "tutorial/conv2d_no_batching", [1, 64, 64, 512, 256, 3, 3, [1, 1], [1, 1]], {}], "config": {"index": 291338, "code_hash": null, "entity": [["tile_ic", "ot", 4], ["tile_oc", "ot", 4], ["tile_ow", "sp", [-1, 32]], ["unroll_kw", "ot", false], ["tile_cp", "sp", [-1, 32]], ["tile_hp", "sp", [-1, 16, 1]], ["tile_wp", "sp", [-1, 1, 16]], ["ann_spatial", "an", ["unroll", "none"]]]}, "result": [[0.013697256599999999], 0, 52.27965235710144, 1614849891.4037764], "version": 0.2, "tvm_version": "0.8.dev0"}
{"input": ["opencl -keys=mali,opencl,gpu -device=mali -max_num_threads=256", "tutorial/conv2d_no_batching", [1, 64, 64, 512, 256, 3, 3, [1, 1], [1, 1]], {}], "config": {"index": 370438, "code_hash": null, "entity": [["tile_ic", "ot", 4], ["tile_oc", "ot", 4], ["tile_ow", "sp", [-1, 32]], ["unroll_kw", "ot", false], ["tile_cp", "sp", [-1, 64]], ["tile_hp", "sp", [-1, 1, 64]], ["tile_wp", "sp", [-1, 1, 16]], ["ann_spatial", "an", ["unroll", "unroll"]]]}, "result": [[0.0095513967], 0, 103.93664860725403, 1614849943.4270515], "version": 0.2, "tvm_version": "0.8.dev0"}
{"input": ["opencl -keys=mali,opencl,gpu -device=mali -max_num_threads=256", "tutorial/conv2d_no_batching", [1, 64, 64, 512, 256, 3, 3, [1, 1], [1, 1]], {}], "config": {"index": 153139, "code_hash": null, "entity": [["tile_ic", "ot", 4], ["tile_oc", "ot", 4], ["tile_ow", "sp", [-1, 1]], ["unroll_kw", "ot", false], ["tile_cp", "sp", [-1, 16]], ["tile_hp", "sp", [-1, 1, 16]], ["tile_wp", "sp", [-1, 1, 64]], ["ann_spatial", "an", ["none", "unroll"]]]}, "result": [[0.0071671153000000005], 0, 77.77622842788696, 1614849917.2547019], "version": 0.2, "tvm_version": "0.8.dev0"}
{"input": ["opencl -keys=mali,opencl,gpu -device=mali -max_num_threads=256", "tutorial/conv2d_no_batching", [1, 64, 64, 512, 256, 3, 3, [1, 1], [1, 1]], {}], "config": {"index": 438325, "code_hash": null, "entity": [["tile_ic", "ot", 4], ["tile_oc", "ot", 4], ["tile_ow", "sp", [-1, 64]], ["unroll_kw", "ot", false], ["tile_cp", "sp", [-1, 16]], ["tile_hp", "sp", [-1, 4, 8]], ["tile_wp", "sp", [-1, 2, 8]], ["ann_spatial", "an", ["unroll", "vec"]]]}, "result": [[0.014827574399999998], 0, 25.19153618812561, 1614849864.5339904], "version": 0.2, "tvm_version": "0.8.dev0"}
{"input": ["opencl -keys=mali,opencl,gpu -device=mali -max_num_threads=256", "tutorial/conv2d_no_batching", [1, 64, 64, 512, 256, 3, 3, [1, 1], [1, 1]], {}], "config": {"index": 26283, "code_hash": null, "entity": [["tile_ic", "ot", 4], ["tile_oc", "ot", 4], ["tile_ow", "sp", [-1, 32]], ["unroll_kw", "ot", true], ["tile_cp", "sp", [-1, 2]], ["tile_hp", "sp", [-1, 8, 4]], ["tile_wp", "sp", [-1, 4, 2]], ["ann_spatial", "an", ["none", "none"]]]}, "result": [[0.0013741043], 0, 65.01872897148132, 1614849904.4413965], "version": 0.2, "tvm_version": "0.8.dev0"}
{"input": ["opencl -keys=mali,opencl,gpu -device=mali -max_num_threads=256", "tutorial/conv2d_no_batching", [1, 64, 64, 512, 256, 3, 3, [1, 1], [1, 1]], {}], "config": {"index": 489825, "code_hash": null, "entity": [["tile_ic", "ot", 4], ["tile_oc", "ot", 4], ["tile_ow", "sp", [-1, 1]], ["unroll_kw", "ot", false], ["tile_cp", "sp", [-1, 2]], ["tile_hp", "sp", [-1, 2, 4]], ["tile_wp", "sp", [-1, 8, 2]], ["ann_spatial", "an", ["vec", "none"]]]}, "result": [[0.0016793908], 0, 131.32884430885315, 1614849970.8248816], "version": 0.2, "tvm_version": "0.8.dev0"}
{"input": ["opencl -keys=mali,opencl,gpu -device=mali -max_num_threads=256", "tutorial/conv2d_no_batching", [1, 64, 64, 512, 256, 3, 3, [1, 1], [1, 1]], {}], "config": {"index": 257297, "code_hash": null, "entity": [["tile_ic", "ot", 4], ["tile_oc", "ot", 4], ["tile_ow", "sp", [-1, 32]], ["unroll_kw", "ot", true], ["tile_cp", "sp", [-1, 8]], ["tile_hp", "sp", [-1, 8, 8]], ["tile_wp", "sp", [-1, 4, 2]], ["ann_spatial", "an", ["unroll", "none"]]]}, "result": [[0.0016081095], 0, 117.20312476158142, 1614849956.6320145], "version": 0.2, "tvm_version": "0.8.dev0"}
{"input": ["opencl -keys=mali,opencl,gpu -device=mali -max_num_threads=256", "tutorial/conv2d_no_batching", [1, 64, 64, 512, 256, 3, 3, [1, 1], [1, 1]], {}], "config": {"index": 528816, "code_hash": null, "entity": [["tile_ic", "ot", 4], ["tile_oc", "ot", 4], ["tile_ow", "sp", [-1, 2]], ["unroll_kw", "ot", false], ["tile_cp", "sp", [-1, 1]], ["tile_hp", "sp", [-1, 4, 8]], ["tile_wp", "sp", [-1, 4, 16]], ["ann_spatial", "an", ["vec", "none"]]]}, "result": [[0.006670042399999999], 0, 11.798547267913818, 1614849851.0880084], "version": 0.2, "tvm_version": "0.8.dev0"}
{"input": ["opencl -keys=mali,opencl,gpu -device=mali -max_num_threads=256", "tutorial/conv2d_no_batching", [1, 64, 64, 512, 256, 3, 3, [1, 1], [1, 1]], {}], "config": {"index": 369616, "code_hash": null, "entity": [["tile_ic", "ot", 4], ["tile_oc", "ot", 4], ["tile_ow", "sp", [-1, 4]], ["unroll_kw", "ot", true], ["tile_cp", "sp", [-1, 16]], ["tile_hp", "sp", [-1, 2, 8]], ["tile_wp", "sp", [-1, 1, 16]], ["ann_spatial", "an", ["unroll", "unroll"]]]}, "result": [[0.0114294022], 0, 91.02532482147217, 1614849930.4404564], "version": 0.2, "tvm_version": "0.8.dev0"}
{"input": ["opencl -keys=mali,opencl,gpu -device=mali -max_num_threads=256", "tutorial/conv2d_no_batching", [1, 64, 64, 512, 256, 3, 3, [1, 1], [1, 1]], {}], "config": {"index": 148776, "code_hash": null, "entity": [["tile_ic", "ot", 4], ["tile_oc", "ot", 4], ["tile_ow", "sp", [-1, 32]], ["unroll_kw", "ot", false], ["tile_cp", "sp", [-1, 1]], ["tile_hp", "sp", [-1, 64, 1]], ["tile_wp", "sp", [-1, 2, 32]], ["ann_spatial", "an", ["none", "unroll"]]]}, "result": [[0.014402626399999998], 0, 54.56050777435303, 1614850039.6556396], "version": 0.2, "tvm_version": "0.8.dev0"}
{"input": ["opencl -keys=mali,opencl,gpu -device=mali -max_num_threads=256", "tutorial/conv2d_no_batching", [1, 64, 64, 512, 256, 3, 3, [1, 1], [1, 1]], {}], "config": {"index": 491685, "code_hash": null, "entity": [["tile_ic", "ot", 4], ["tile_oc", "ot", 4], ["tile_ow", "sp", [-1, 32]], ["unroll_kw", "ot", true], ["tile_cp", "sp", [-1, 2]], ["tile_hp", "sp", [-1, 32, 1]], ["tile_wp", "sp", [-1, 16, 2]], ["ann_spatial", "an", ["vec", "none"]]]}, "result": [[0.0010431823999999998], 0, 13.532494306564331, 1614849998.5472405], "version": 0.2, "tvm_version": "0.8.dev0"}
{"input": ["opencl -keys=mali,opencl,gpu -device=mali -max_num_threads=256", "tutorial/conv2d_no_batching", [1, 64, 64, 512, 256, 3, 3, [1, 1], [1, 1]], {}], "config": {"index": 366438, "code_hash": null, "entity": [["tile_ic", "ot", 4], ["tile_oc", "ot", 4], ["tile_ow", "sp", [-1, 4]], ["unroll_kw", "ot", true], ["tile_cp", "sp", [-1, 2]], ["tile_hp", "sp", [-1, 4, 4]], ["tile_wp", "sp", [-1, 8, 8]], ["ann_spatial", "an", ["unroll", "unroll"]]]}, "result": [[0.014310740999999998], 0, 41.502665996551514, 1614850026.382396], "version": 0.2, "tvm_version": "0.8.dev0"}
{"input": ["opencl -keys=mali,opencl,gpu -device=mali -max_num_threads=256", "tutorial/conv2d_no_batching", [1, 64, 64, 512, 256, 3, 3, [1, 1], [1, 1]], {}], "config": {"index": 128593, "code_hash": null, "entity": [["tile_ic", "ot", 4], ["tile_oc", "ot", 4], ["tile_ow", "sp", [-1, 8]], ["unroll_kw", "ot", true], ["tile_cp", "sp", [-1, 2]], ["tile_hp", "sp", [-1, 4, 16]], ["tile_wp", "sp", [-1, 1, 8]], ["ann_spatial", "an", ["none", "unroll"]]]}, "result": [[0.0076405164], 0, 177.55097246170044, 1614850162.788868], "version": 0.2, "tvm_version": "0.8.dev0"}
{"input": ["opencl -keys=mali,opencl,gpu -device=mali -max_num_threads=256", "tutorial/conv2d_no_batching", [1, 64, 64, 512, 256, 3, 3, [1, 1], [1, 1]], {}], "config": {"index": 277397, "code_hash": null, "entity": [["tile_ic", "ot", 4], ["tile_oc", "ot", 4], ["tile_ow", "sp", [-1, 2]], ["unroll_kw", "ot", true], ["tile_cp", "sp", [-1, 16]], ["tile_hp", "sp", [-1, 4, 1]], ["tile_wp", "sp", [-1, 16, 4]], ["ann_spatial", "an", ["unroll", "none"]]]}, "result": [[0.0073292715], 0, 27.6797456741333, 1614850012.7527719], "version": 0.2, "tvm_version": "0.8.dev0"}
{"input": ["opencl -keys=mali,opencl,gpu -device=mali -max_num_threads=256", "tutorial/conv2d_no_batching", [1, 64, 64, 512, 256, 3, 3, [1, 1], [1, 1]], {}], "config": {"index": 470409, "code_hash": null, "entity": [["tile_ic", "ot", 4], ["tile_oc", "ot", 4], ["tile_ow", "sp", [-1, 4]], ["unroll_kw", "ot", false], ["tile_cp", "sp", [-1, 1]], ["tile_hp", "sp", [-1, 32, 2]], ["tile_wp", "sp", [-1, 8, 1]], ["ann_spatial", "an", ["vec", "none"]]]}, "result": [[0.0015983387000000002], 0, 68.77956080436707, 1614850053.7937746], "version": 0.2, "tvm_version": "0.8.dev0"}
{"input": ["opencl -keys=mali,opencl,gpu -device=mali -max_num_threads=256", "tutorial/conv2d_no_batching", [1, 64, 64, 512, 256, 3, 3, [1, 1], [1, 1]], {}], "config": {"index": 337506, "code_hash": null, "entity": [["tile_ic", "ot", 4], ["tile_oc", "ot", 4], ["tile_ow", "sp", [-1, 2]], ["unroll_kw", "ot", false], ["tile_cp", "sp", [-1, 64]], ["tile_hp", "sp", [-1, 1, 64]], ["tile_wp", "sp", [-1, 8, 2]], ["ann_spatial", "an", ["unroll", "unroll"]]]}, "result": [[0.0016093073999999998], 0, 150.67301440238953, 1614850135.7208512], "version": 0.2, "tvm_version": "0.8.dev0"}
{"input": ["opencl -keys=mali,opencl,gpu -device=mali -max_num_threads=256", "tutorial/conv2d_no_batching", [1, 64, 64, 512, 256, 3, 3, [1, 1], [1, 1]], {}], "config": {"index": 517146, "code_hash": null, "entity": [["tile_ic", "ot", 4], ["tile_oc", "ot", 4], ["tile_ow", "sp", [-1, 1]], ["unroll_kw", "ot", true], ["tile_cp", "sp", [-1, 1]], ["tile_hp", "sp", [-1, 1, 4]], ["tile_wp", "sp", [-1, 4, 8]], ["ann_spatial", "an", ["vec", "none"]]]}, "result": [[0.0091299749], 0, 110.04388618469238, 1614850095.0796518], "version": 0.2, "tvm_version": "0.8.dev0"}
{"input": ["opencl -keys=mali,opencl,gpu -device=mali -max_num_threads=256", "tutorial/conv2d_no_batching", [1, 64, 64, 512, 256, 3, 3, [1, 1], [1, 1]], {}], "config": {"index": 543528, "code_hash": null, "entity": [["tile_ic", "ot", 4], ["tile_oc", "ot", 4], ["tile_ow", "sp", [-1, 64]], ["unroll_kw", "ot", true], ["tile_cp", "sp", [-1, 2]], ["tile_hp", "sp", [-1, 4, 1]], ["tile_wp", "sp", [-1, 4, 1]], ["ann_spatial", "an", ["vec", "unroll"]]]}, "result": [[0.0030275316], 0, 82.72717523574829, 1614850067.756601], "version": 0.2, "tvm_version": "0.8.dev0"}
{"input": ["opencl -keys=mali,opencl,gpu -device=mali -max_num_threads=256", "tutorial/conv2d_no_batching", [1, 64, 64, 512, 256, 3, 3, [1, 1], [1, 1]], {}], "config": {"index": 608894, "code_hash": null, "entity": [["tile_ic", "ot", 4], ["tile_oc", "ot", 4], ["tile_ow", "sp", [-1, 64]], ["unroll_kw", "ot", true], ["tile_cp", "sp", [-1, 2]], ["tile_hp", "sp", [-1, 1, 32]], ["tile_wp", "sp", [-1, 1, 32]], ["ann_spatial", "an", ["vec", "unroll"]]]}, "result": [[0.0166927986], 0, 137.17172646522522, 1614850122.286297], "version": 0.2, "tvm_version": "0.8.dev0"}
{"input": ["opencl -keys=mali,opencl,gpu -device=mali -max_num_threads=256", "tutorial/conv2d_no_batching", [1, 64, 64, 512, 256, 3, 3, [1, 1], [1, 1]], {}], "config": {"index": 65431, "code_hash": null, "entity": [["tile_ic", "ot", 4], ["tile_oc", "ot", 4], ["tile_ow", "sp", [-1, 4]], ["unroll_kw", "ot", false], ["tile_cp", "sp", [-1, 16]], ["tile_hp", "sp", [-1, 2, 16]], ["tile_wp", "sp", [-1, 2, 16]], ["ann_spatial", "an", ["none", "none"]]]}, "result": [[0.014583168099999998], 0, 164.0384976863861, 1614850149.2354329], "version": 0.2, "tvm_version": "0.8.dev0"}
{"input": ["opencl -keys=mali,opencl,gpu -device=mali -max_num_threads=256", "tutorial/conv2d_no_batching", [1, 64, 64, 512, 256, 3, 3, [1, 1], [1, 1]], {}], "config": {"index": 192789, "code_hash": null, "entity": [["tile_ic", "ot", 4], ["tile_oc", "ot", 4], ["tile_ow", "sp", [-1, 4]], ["unroll_kw", "ot", false], ["tile_cp", "sp", [-1, 2]], ["tile_hp", "sp", [-1, 1, 2]], ["tile_wp", "sp", [-1, 2, 4]], ["ann_spatial", "an", ["none", "vec"]]]}, "result": [[0.008406526899999999], 0, 96.56755781173706, 1614850081.5932226], "version": 0.2, "tvm_version": "0.8.dev0"}
{"input": ["opencl -keys=mali,opencl,gpu -device=mali -max_num_threads=256", "tutorial/conv2d_no_batching", [1, 64, 64, 512, 256, 3, 3, [1, 1], [1, 1]], {}], "config": {"index": 482736, "code_hash": null, "entity": [["tile_ic", "ot", 4], ["tile_oc", "ot", 4], ["tile_ow", "sp", [-1, 4]], ["unroll_kw", "ot", true], ["tile_cp", "sp", [-1, 64]], ["tile_hp", "sp", [-1, 1, 32]], ["tile_wp", "sp", [-1, 1, 2]], ["ann_spatial", "an", ["vec", "none"]]]}, "result": [[0.004405891], 0, 123.29778575897217, 1614850108.4005556], "version": 0.2, "tvm_version": "0.8.dev0"}
{"input": ["opencl -keys=mali,opencl,gpu -device=mali -max_num_threads=256", "tutorial/conv2d_no_batching", [1, 64, 64, 512, 256, 3, 3, [1, 1], [1, 1]], {}], "config": {"index": 29998, "code_hash": null, "entity": [["tile_ic", "ot", 4], ["tile_oc", "ot", 4], ["tile_ow", "sp", [-1, 8]], ["unroll_kw", "ot", false], ["tile_cp", "sp", [-1, 1]], ["tile_hp", "sp", [-1, 2, 32]], ["tile_wp", "sp", [-1, 8, 2]], ["ann_spatial", "an", ["none", "none"]]]}, "result": [[0.0025237606], 0, 12.193842887878418, 1614850189.1390822], "version": 0.2, "tvm_version": "0.8.dev0"}
{"input": ["opencl -keys=mali,opencl,gpu -device=mali -max_num_threads=256", "tutorial/conv2d_no_batching", [1, 64, 64, 512, 256, 3, 3, [1, 1], [1, 1]], {}], "config": {"index": 466334, "code_hash": null, "entity": [["tile_ic", "ot", 4], ["tile_oc", "ot", 4], ["tile_ow", "sp", [-1, 2]], ["unroll_kw", "ot", false], ["tile_cp", "sp", [-1, 8]], ["tile_hp", "sp", [-1, 2, 32]], ["tile_wp", "sp", [-1, 2, 1]], ["ann_spatial", "an", ["vec", "none"]]]}, "result": [[0.0022923596], 0, 63.87453889846802, 1614850240.8003411], "version": 0.2, "tvm_version": "0.8.dev0"}
{"input": ["opencl -keys=mali,opencl,gpu -device=mali -max_num_threads=256", "tutorial/conv2d_no_batching", [1, 64, 64, 512, 256, 3, 3, [1, 1], [1, 1]], {}], "config": {"index": 323942, "code_hash": null, "entity": [["tile_ic", "ot", 4], ["tile_oc", "ot", 4], ["tile_ow", "sp", [-1, 8]], ["unroll_kw", "ot", false], ["tile_cp", "sp", [-1, 8]], ["tile_hp", "sp", [-1, 2, 1]], ["tile_wp", "sp", [-1, 64, 1]], ["ann_spatial", "an", ["unroll", "unroll"]]]}, "result": [[0.0010377291999999999], 0, 38.233328104019165, 1614850215.1932175], "version": 0.2, "tvm_version": "0.8.dev0"}
{"input": ["opencl -keys=mali,opencl,gpu -device=mali -max_num_threads=256", "tutorial/conv2d_no_batching", [1, 64, 64, 512, 256, 3, 3, [1, 1], [1, 1]], {}], "config": {"index": 560312, "code_hash": null, "entity": [["tile_ic", "ot", 4], ["tile_oc", "ot", 4], ["tile_ow", "sp", [-1, 16]], ["unroll_kw", "ot", true], ["tile_cp", "sp", [-1, 8]], ["tile_hp", "sp", [-1, 32, 1]], ["tile_wp", "sp", [-1, 2, 2]], ["ann_spatial", "an", ["vec", "unroll"]]]}, "result": [[0.0011152241], 0, 50.91902184486389, 1614850227.8750381], "version": 0.2, "tvm_version": "0.8.dev0"}
{"input": ["opencl -keys=mali,opencl,gpu -device=mali -max_num_threads=256", "tutorial/conv2d_no_batching", [1, 64, 64, 512, 256, 3, 3, [1, 1], [1, 1]], {}], "config": {"index": 588954, "code_hash": null, "entity": [["tile_ic", "ot", 4], ["tile_oc", "ot", 4], ["tile_ow", "sp", [-1, 4]], ["unroll_kw", "ot", true], ["tile_cp", "sp", [-1, 32]], ["tile_hp", "sp", [-1, 16, 4]], ["tile_wp", "sp", [-1, 1, 8]], ["ann_spatial", "an", ["vec", "unroll"]]]}, "result": [[0.0159592881], 0, 25.332776308059692, 1614850202.2933125], "version": 0.2, "tvm_version": "0.8.dev0"}
{"input": ["opencl -keys=mali,opencl,gpu -device=mali -max_num_threads=256", "tutorial/conv2d_no_batching", [1, 64, 64, 512, 256, 3, 3, [1, 1], [1, 1]], {}], "config": {"index": 182794, "code_hash": null, "entity": [["tile_ic", "ot", 4], ["tile_oc", "ot", 4], ["tile_ow", "sp", [-1, 8]], ["unroll_kw", "ot", false], ["tile_cp", "sp", [-1, 2]], ["tile_hp", "sp", [-1, 16, 4]], ["tile_wp", "sp", [-1, 8, 2]], ["ann_spatial", "an", ["none", "vec"]]]}, "result": [[0.0013016616], 0, 76.49085211753845, 1614850253.4945188], "version": 0.2, "tvm_version": "0.8.dev0"}
{"input": ["opencl -keys=mali,opencl,gpu -device=mali -max_num_threads=256", "tutorial/conv2d_no_batching", [1, 64, 64, 512, 256, 3, 3, [1, 1], [1, 1]], {}], "config": {"index": 210928, "code_hash": null, "entity": [["tile_ic", "ot", 4], ["tile_oc", "ot", 4], ["tile_ow", "sp", [-1, 16]], ["unroll_kw", "ot", true], ["tile_cp", "sp", [-1, 4]], ["tile_hp", "sp", [-1, 4, 16]], ["tile_wp", "sp", [-1, 4, 8]], ["ann_spatial", "an", ["none", "vec"]]]}, "result": [[0.0142544076], 0, 89.68008232116699, 1614850266.7217455], "version": 0.2, "tvm_version": "0.8.dev0"}
{"input": ["opencl -keys=mali,opencl,gpu -device=mali -max_num_threads=256", "tutorial/conv2d_no_batching", [1, 64, 64, 512, 256, 3, 3, [1, 1], [1, 1]], {}], "config": {"index": 471558, "code_hash": null, "entity": [["tile_ic", "ot", 4], ["tile_oc", "ot", 4], ["tile_ow", "sp", [-1, 8]], ["unroll_kw", "ot", false], ["tile_cp", "sp", [-1, 32]], ["tile_hp", "sp", [-1, 2, 16]], ["tile_wp", "sp", [-1, 8, 1]], ["ann_spatial", "an", ["vec", "none"]]]}, "result": [[0.0017547293], 0, 116.83932042121887, 1614850293.8399084], "version": 0.2, "tvm_version": "0.8.dev0"}
{"input": ["opencl -keys=mali,opencl,gpu -device=mali -max_num_threads=256", "tutorial/conv2d_no_batching", [1, 64, 64, 512, 256, 3, 3, [1, 1], [1, 1]], {}], "config": {"index": 55076, "code_hash": null, "entity": [["tile_ic", "ot", 4], ["tile_oc", "ot", 4], ["tile_ow", "sp", [-1, 1]], ["unroll_kw", "ot", true], ["tile_cp", "sp", [-1, 1]], ["tile_hp", "sp", [-1, 4, 1]], ["tile_wp", "sp", [-1, 4, 8]], ["ann_spatial", "an", ["none", "none"]]]}, "result": [[0.0074838028], 0, 103.38980531692505, 1614850280.438289], "version": 0.2, "tvm_version": "0.8.dev0"}
{"input": ["opencl -keys=mali,opencl,gpu -device=mali -max_num_threads=256", "tutorial/conv2d_no_batching", [1, 64, 64, 512, 256, 3, 3, [1, 1], [1, 1]], {}], "config": {"index": 492797, "code_hash": null, "entity": [["tile_ic", "ot", 4], ["tile_oc", "ot", 4], ["tile_ow", "sp", [-1, 16]], ["unroll_kw", "ot", false], ["tile_cp", "sp", [-1, 8]], ["tile_hp", "sp", [-1, 8, 4]], ["tile_wp", "sp", [-1, 16, 2]], ["ann_spatial", "an", ["vec", "none"]]]}, "result": [[0.0013667917999999999], 0, 143.66848134994507, 1614850320.7627206], "version": 0.2, "tvm_version": "0.8.dev0"}
{"input": ["opencl -keys=mali,opencl,gpu -device=mali -max_num_threads=256", "tutorial/conv2d_no_batching", [1, 64, 64, 512, 256, 3, 3, [1, 1], [1, 1]], {}], "config": {"index": 612773, "code_hash": null, "entity": [["tile_ic", "ot", 4], ["tile_oc", "ot", 4], ["tile_ow", "sp", [-1, 1]], ["unroll_kw", "ot", false], ["tile_cp", "sp", [-1, 32]], ["tile_hp", "sp", [-1, 2, 2]], ["tile_wp", "sp", [-1, 1, 64]], ["ann_spatial", "an", ["vec", "unroll"]]]}, "result": [[0.018225006999999998], 0, 130.46238136291504, 1614850307.5530896], "version": 0.2, "tvm_version": "0.8.dev0"}
{"input": ["opencl -keys=mali,opencl,gpu -device=mali -max_num_threads=256", "tutorial/conv2d_no_batching", [1, 64, 64, 512, 256, 3, 3, [1, 1], [1, 1]], {}], "config": {"index": 230720, "code_hash": null, "entity": [["tile_ic", "ot", 4], ["tile_oc", "ot", 4], ["tile_ow", "sp", [-1, 1]], ["unroll_kw", "ot", true], ["tile_cp", "sp", [-1, 4]], ["tile_hp", "sp", [-1, 4, 1]], ["tile_wp", "sp", [-1, 1, 1]], ["ann_spatial", "an", ["unroll", "none"]]]}, "result": [[0.0032985681000000005], 0, 24.617522954940796, 1614850707.7981112], "version": 0.2, "tvm_version": "0.8.dev0"}
{"input": ["opencl -keys=mali,opencl,gpu -device=mali -max_num_threads=256", "tutorial/conv2d_no_batching", [1, 64, 64, 512, 256, 3, 3, [1, 1], [1, 1]], {}], "config": {"index": 401920, "code_hash": null, "entity": [["tile_ic", "ot", 4], ["tile_oc", "ot", 4], ["tile_ow", "sp", [-1, 2]], ["unroll_kw", "ot", false], ["tile_cp", "sp", [-1, 2]], ["tile_hp", "sp", [-1, 1, 4]], ["tile_wp", "sp", [-1, 64, 1]], ["ann_spatial", "an", ["unroll", "vec"]]]}, "result": [[0.0011059116], 0, 12.109430313110352, 1614850695.2162683], "version": 0.2, "tvm_version": "0.8.dev0"}
{"input": ["opencl -keys=mali,opencl,gpu -device=mali -max_num_threads=256", "tutorial/conv2d_no_batching", [1, 64, 64, 512, 256, 3, 3, [1, 1], [1, 1]], {}], "config": {"index": 208779, "code_hash": null, "entity": [["tile_ic", "ot", 4], ["tile_oc", "ot", 4], ["tile_ow", "sp", [-1, 16]], ["unroll_kw", "ot", false], ["tile_cp", "sp", [-1, 4]], ["tile_hp", "sp", [-1, 4, 1]], ["tile_wp", "sp", [-1, 4, 8]], ["ann_spatial", "an", ["none", "vec"]]]}, "result": [[0.014617798300000002], 0, 47.73107600212097, 1614850730.652629], "version": 0.2, "tvm_version": "0.8.dev0"}
{"input": ["opencl -keys=mali,opencl,gpu -device=mali -max_num_threads=256", "tutorial/conv2d_no_batching", [1, 64, 64, 512, 256, 3, 3, [1, 1], [1, 1]], {}], "config": {"index": 392609, "code_hash": null, "entity": [["tile_ic", "ot", 4], ["tile_oc", "ot", 4], ["tile_ow", "sp", [-1, 1]], ["unroll_kw", "ot", false], ["tile_cp", "sp", [-1, 2]], ["tile_hp", "sp", [-1, 4, 1]], ["tile_wp", "sp", [-1, 8, 1]], ["ann_spatial", "an", ["unroll", "vec"]]]}, "result": [[0.0012340366], 0, 59.04915428161621, 1614850742.1843002], "version": 0.2, "tvm_version": "0.8.dev0"}
{"input": ["opencl -keys=mali,opencl,gpu -device=mali -max_num_threads=256", "tutorial/conv2d_no_batching", [1, 64, 64, 512, 256, 3, 3, [1, 1], [1, 1]], {}], "config": {"index": 114649, "code_hash": null, "entity": [["tile_ic", "ot", 4], ["tile_oc", "ot", 4], ["tile_ow", "sp", [-1, 8]], ["unroll_kw", "ot", true], ["tile_cp", "sp", [-1, 64]], ["tile_hp", "sp", [-1, 8, 8]], ["tile_wp", "sp", [-1, 1, 4]], ["ann_spatial", "an", ["none", "unroll"]]]}, "result": [[0.005768698500000001], 0, 35.559518575668335, 1614850718.6715467], "version": 0.2, "tvm_version": "0.8.dev0"}
{"input": ["opencl -keys=mali,opencl,gpu -device=mali -max_num_threads=256", "tutorial/conv2d_no_batching", [1, 64, 64, 512, 256, 3, 3, [1, 1], [1, 1]], {}], "config": {"index": 60847, "code_hash": null, "entity": [["tile_ic", "ot", 4], ["tile_oc", "ot", 4], ["tile_ow", "sp", [-1, 8]], ["unroll_kw", "ot", true], ["tile_cp", "sp", [-1, 64]], ["tile_hp", "sp", [-1, 16, 1]], ["tile_wp", "sp", [-1, 1, 16]], ["ann_spatial", "an", ["none", "none"]]]}, "result": [[0.0144499598], 0, 70.36247873306274, 1614850753.5562115], "version": 0.2, "tvm_version": "0.8.dev0"}
{"input": ["opencl -keys=mali,opencl,gpu -device=mali -max_num_threads=256", "tutorial/conv2d_no_batching", [1, 64, 64, 512, 256, 3, 3, [1, 1], [1, 1]], {}], "config": {"index": 4676, "code_hash": null, "entity": [["tile_ic", "ot", 4], ["tile_oc", "ot", 4], ["tile_ow", "sp", [-1, 1]], ["unroll_kw", "ot", true], ["tile_cp", "sp", [-1, 32]], ["tile_hp", "sp", [-1, 2, 8]], ["tile_wp", "sp", [-1, 2, 1]], ["ann_spatial", "an", ["none", "none"]]]}, "result": [[0.0028678336], 0, 127.4384503364563, 1614850810.8437345], "version": 0.2, "tvm_version": "0.8.dev0"}
{"input": ["opencl -keys=mali,opencl,gpu -device=mali -max_num_threads=256", "tutorial/conv2d_no_batching", [1, 64, 64, 512, 256, 3, 3, [1, 1], [1, 1]], {}], "config": {"index": 307616, "code_hash": null, "entity": [["tile_ic", "ot", 4], ["tile_oc", "ot", 4], ["tile_ow", "sp", [-1, 2]], ["unroll_kw", "ot", false], ["tile_cp", "sp", [-1, 64]], ["tile_hp", "sp", [-1, 4, 1]], ["tile_wp", "sp", [-1, 1, 1]], ["ann_spatial", "an", ["unroll", "unroll"]]]}, "result": [[0.0023732867000000003], 0, 92.45411562919617, 1614850775.85927], "version": 0.2, "tvm_version": "0.8.dev0"}
{"input": ["opencl -keys=mali,opencl,gpu -device=mali -max_num_threads=256", "tutorial/conv2d_no_batching", [1, 64, 64, 512, 256, 3, 3, [1, 1], [1, 1]], {}], "config": {"index": 259360, "code_hash": null, "entity": [["tile_ic", "ot", 4], ["tile_oc", "ot", 4], ["tile_ow", "sp", [-1, 8]], ["unroll_kw", "ot", false], ["tile_cp", "sp", [-1, 8]], ["tile_hp", "sp", [-1, 2, 4]], ["tile_wp", "sp", [-1, 8, 2]], ["ann_spatial", "an", ["unroll", "none"]]]}, "result": [[0.0014542814], 0, 104.38560199737549, 1614850787.8084629], "version": 0.2, "tvm_version": "0.8.dev0"}
{"input": ["opencl -keys=mali,opencl,gpu -device=mali -max_num_threads=256", "tutorial/conv2d_no_batching", [1, 64, 64, 512, 256, 3, 3, [1, 1], [1, 1]], {}], "config": {"index": 174241, "code_hash": null, "entity": [["tile_ic", "ot", 4], ["tile_oc", "ot", 4], ["tile_ow", "sp", [-1, 16]], ["unroll_kw", "ot", false], ["tile_cp", "sp", [-1, 64]], ["tile_hp", "sp", [-1, 1, 4]], ["tile_wp", "sp", [-1, 1, 2]], ["ann_spatial", "an", ["none", "vec"]]]}, "result": [[0.0037059483], 0, 176.47470712661743, 1614850859.9412067], "version": 0.2, "tvm_version": "0.8.dev0"}
{"input": ["opencl -keys=mali,opencl,gpu -device=mali -max_num_threads=256", "tutorial/conv2d_no_batching", [1, 64, 64, 512, 256, 3, 3, [1, 1], [1, 1]], {}], "config": {"index": 121576, "code_hash": null, "entity": [["tile_ic", "ot", 4], ["tile_oc", "ot", 4], ["tile_ow", "sp", [-1, 1]], ["unroll_kw", "ot", true], ["tile_cp", "sp", [-1, 16]], ["tile_hp", "sp", [-1, 2, 2]], ["tile_wp", "sp", [-1, 8, 4]], ["ann_spatial", "an", ["none", "unroll"]]]}, "result": [[0.0058128912], 0, 115.98715400695801, 1614850799.3777533], "version": 0.2, "tvm_version": "0.8.dev0"}
{"input": ["opencl -keys=mali,opencl,gpu -device=mali -max_num_threads=256", "tutorial/conv2d_no_batching", [1, 64, 64, 512, 256, 3, 3, [1, 1], [1, 1]], {}], "config": {"index": 216717, "code_hash": null, "entity": [["tile_ic", "ot", 4], ["tile_oc", "ot", 4], ["tile_ow", "sp", [-1, 16]], ["unroll_kw", "ot", false], ["tile_cp", "sp", [-1, 4]], ["tile_hp", "sp", [-1, 1, 64]], ["tile_wp", "sp", [-1, 1, 16]], ["ann_spatial", "an", ["none", "vec"]]]}, "result": [[0.0091639436], 0, 81.3088390827179, 1614850764.7508016], "version": 0.2, "tvm_version": "0.8.dev0"}
{"input": ["opencl -keys=mali,opencl,gpu -device=mali -max_num_threads=256", "tutorial/conv2d_no_batching", [1, 64, 64, 512, 256, 3, 3, [1, 1], [1, 1]], {}], "config": {"index": 200426, "code_hash": null, "entity": [["tile_ic", "ot", 4], ["tile_oc", "ot", 4], ["tile_ow", "sp", [-1, 4]], ["unroll_kw", "ot", true], ["tile_cp", "sp", [-1, 2]], ["tile_hp", "sp", [-1, 2, 1]], ["tile_wp", "sp", [-1, 16, 4]], ["ann_spatial", "an", ["none", "vec"]]]}, "result": [[0.0074461985999999996], 0, 164.01070475578308, 1614850847.4688206], "version": 0.2, "tvm_version": "0.8.dev0"}
{"input": ["opencl -keys=mali,opencl,gpu -device=mali -max_num_threads=256", "tutorial/conv2d_no_batching", [1, 64, 64, 512, 256, 3, 3, [1, 1], [1, 1]], {}], "config": {"index": 233227, "code_hash": null, "entity": [["tile_ic", "ot", 4], ["tile_oc", "ot", 4], ["tile_ow", "sp", [-1, 2]], ["unroll_kw", "ot", true], ["tile_cp", "sp", [-1, 64]], ["tile_hp", "sp", [-1, 1, 64]], ["tile_wp", "sp", [-1, 1, 1]], ["ann_spatial", "an", ["unroll", "none"]]]}, "result": [[0.0104387354], 0, 138.10766792297363, 1614850821.5677984], "version": 0.2, "tvm_version": "0.8.dev0"}
{"input": ["opencl -keys=mali,opencl,gpu -device=mali -max_num_threads=256", "tutorial/conv2d_no_batching", [1, 64, 64, 512, 256, 3, 3, [1, 1], [1, 1]], {}], "config": {"index": 380294, "code_hash": null, "entity": [["tile_ic", "ot", 4], ["tile_oc", "ot", 4], ["tile_ow", "sp", [-1, 32]], ["unroll_kw", "ot", false], ["tile_cp", "sp", [-1, 8]], ["tile_hp", "sp", [-1, 8, 4]], ["tile_wp", "sp", [-1, 2, 32]], ["ann_spatial", "an", ["unroll", "unroll"]]]}, "result": [[0.0166306944], 0, 150.69070982933044, 1614850834.1170893], "version": 0.2, "tvm_version": "0.8.dev0"}
{"input": ["opencl -keys=mali,opencl,gpu -device=mali -max_num_threads=256", "tutorial/conv2d_no_batching", [1, 64, 64, 512, 256, 3, 3, [1, 1], [1, 1]], {}], "config": {"index": 576662, "code_hash": null, "entity": [["tile_ic", "ot", 4], ["tile_oc", "ot", 4], ["tile_ow", "sp", [-1, 4]], ["unroll_kw", "ot", true], ["tile_cp", "sp", [-1, 4]], ["tile_hp", "sp", [-1, 16, 1]], ["tile_wp", "sp", [-1, 2, 4]], ["ann_spatial", "an", ["vec", "unroll"]]]}, "result": [[0.0077824122], 0, 40.7807936668396, 1614850913.109984], "version": 0.2, "tvm_version": "0.8.dev0"}
{"input": ["opencl -keys=mali,opencl,gpu -device=mali -max_num_threads=256", "tutorial/conv2d_no_batching", [1, 64, 64, 512, 256, 3, 3, [1, 1], [1, 1]], {}], "config": {"index": 323111, "code_hash": null, "entity": [["tile_ic", "ot", 4], ["tile_oc", "ot", 4], ["tile_ow", "sp", [-1, 32]], ["unroll_kw", "ot", true], ["tile_cp", "sp", [-1, 1]], ["tile_hp", "sp", [-1, 8, 8]], ["tile_wp", "sp", [-1, 32, 1]], ["ann_spatial", "an", ["unroll", "unroll"]]]}, "result": [[0.0011941408], 0, 12.996675491333008, 1614850885.07177], "version": 0.2, "tvm_version": "0.8.dev0"}
{"input": ["opencl -keys=mali,opencl,gpu -device=mali -max_num_threads=256", "tutorial/conv2d_no_batching", [1, 64, 64, 512, 256, 3, 3, [1, 1], [1, 1]], {}], "config": {"index": 263163, "code_hash": null, "entity": [["tile_ic", "ot", 4], ["tile_oc", "ot", 4], ["tile_ow", "sp", [-1, 32]], ["unroll_kw", "ot", true], ["tile_cp", "sp", [-1, 4]], ["tile_hp", "sp", [-1, 1, 32]], ["tile_wp", "sp", [-1, 16, 2]], ["ann_spatial", "an", ["unroll", "none"]]]}, "result": [[0.0012992241], 0, 116.43426966667175, 1614850988.9630034], "version": 0.2, "tvm_version": "0.8.dev0"}
{"input": ["opencl -keys=mali,opencl,gpu -device=mali -max_num_threads=256", "tutorial/conv2d_no_batching", [1, 64, 64, 512, 256, 3, 3, [1, 1], [1, 1]], {}], "config": {"index": 312119, "code_hash": null, "entity": [["tile_ic", "ot", 4], ["tile_oc", "ot", 4], ["tile_ow", "sp", [-1, 8]], ["unroll_kw", "ot", true], ["tile_cp", "sp", [-1, 64]], ["tile_hp", "sp", [-1, 4, 8]], ["tile_wp", "sp", [-1, 2, 1]], ["ann_spatial", "an", ["unroll", "unroll"]]]}, "result": [[0.006619146500000001], 0, 194.14629864692688, 1614851066.5591412], "version": 0.2, "tvm_version": "0.8.dev0"}
{"input": ["opencl -keys=mali,opencl,gpu -device=mali -max_num_threads=256", "tutorial/conv2d_no_batching", [1, 64, 64, 512, 256, 3, 3, [1, 1], [1, 1]], {}], "config": {"index": 303220, "code_hash": null, "entity": [["tile_ic", "ot", 4], ["tile_oc", "ot", 4], ["tile_ow", "sp", [-1, 2]], ["unroll_kw", "ot", false], ["tile_cp", "sp", [-1, 1]], ["tile_hp", "sp", [-1, 2, 4]], ["tile_wp", "sp", [-1, 2, 32]], ["ann_spatial", "an", ["unroll", "none"]]]}, "result": [[0.00846748], 0, 143.51482009887695, 1614851016.0467575], "version": 0.2, "tvm_version": "0.8.dev0"}
{"input": ["opencl -keys=mali,opencl,gpu -device=mali -max_num_threads=256", "tutorial/conv2d_no_batching", [1, 64, 64, 512, 256, 3, 3, [1, 1], [1, 1]], {}], "config": {"index": 609377, "code_hash": null, "entity": [["tile_ic", "ot", 4], ["tile_oc", "ot", 4], ["tile_ow", "sp", [-1, 64]], ["unroll_kw", "ot", false], ["tile_cp", "sp", [-1, 1]], ["tile_hp", "sp", [-1, 4, 1]], ["tile_wp", "sp", [-1, 2, 32]], ["ann_spatial", "an", ["vec", "unroll"]]]}, "result": [[0.0062924277], 0, 168.97759175300598, 1614851041.5220575], "version": 0.2, "tvm_version": "0.8.dev0"}
{"input": ["opencl -keys=mali,opencl,gpu -device=mali -max_num_threads=256", "tutorial/conv2d_no_batching", [1, 64, 64, 512, 256, 3, 3, [1, 1], [1, 1]], {}], "config": {"index": 441670, "code_hash": null, "entity": [["tile_ic", "ot", 4], ["tile_oc", "ot", 4], ["tile_ow", "sp", [-1, 32]], ["unroll_kw", "ot", false], ["tile_cp", "sp", [-1, 32]], ["tile_hp", "sp", [-1, 2, 32]], ["tile_wp", "sp", [-1, 4, 8]], ["ann_spatial", "an", ["unroll", "vec"]]]}, "result": [[0.014673350499999998], 0, 130.62688851356506, 1614851003.1307878], "version": 0.2, "tvm_version": "0.8.dev0"}
{"input": ["opencl -keys=mali,opencl,gpu -device=mali -max_num_threads=256", "tutorial/conv2d_no_batching", [1, 64, 64, 512, 256, 3, 3, [1, 1], [1, 1]], {}], "config": {"index": 154436, "code_hash": null, "entity": [["tile_ic", "ot", 4], ["tile_oc", "ot", 4], ["tile_ow", "sp", [-1, 4]], ["unroll_kw", "ot", true], ["tile_cp", "sp", [-1, 64]], ["tile_hp", "sp", [-1, 1, 2]], ["tile_wp", "sp", [-1, 1, 1]], ["ann_spatial", "an", ["none", "vec"]]]}, "result": [[0.0024159534], 0, 65.50280618667603, 1614850937.8505745], "version": 0.2, "tvm_version": "0.8.dev0"}
{"input": ["opencl -keys=mali,opencl,gpu -device=mali -max_num_threads=256", "tutorial/conv2d_no_batching", [1, 64, 64, 512, 256, 3, 3, [1, 1], [1, 1]], {}], "config": {"index": 97093, "code_hash": null, "entity": [["tile_ic", "ot", 4], ["tile_oc", "ot", 4], ["tile_ow", "sp", [-1, 8]], ["unroll_kw", "ot", true], ["tile_cp", "sp", [-1, 32]], ["tile_hp", "sp", [-1, 8, 2]], ["tile_wp", "sp", [-1, 1, 2]], ["ann_spatial", "an", ["none", "unroll"]]]}, "result": [[0.0037891930999999998], 0, 53.36243653297424, 1614850925.6212823], "version": 0.2, "tvm_version": "0.8.dev0"}
{"input": ["opencl -keys=mali,opencl,gpu -device=mali -max_num_threads=256", "tutorial/conv2d_no_batching", [1, 64, 64, 512, 256, 3, 3, [1, 1], [1, 1]], {}], "config": {"index": 63622, "code_hash": null, "entity": [["tile_ic", "ot", 4], ["tile_oc", "ot", 4], ["tile_ow", "sp", [-1, 64]], ["unroll_kw", "ot", true], ["tile_cp", "sp", [-1, 2]], ["tile_hp", "sp", [-1, 32, 1]], ["tile_wp", "sp", [-1, 2, 16]], ["ann_spatial", "an", ["none", "none"]]]}, "result": [[0.0135420638], 0, 103.45529246330261, 1614850975.9200988], "version": 0.2, "tvm_version": "0.8.dev0"}
{"input": ["opencl -keys=mali,opencl,gpu -device=mali -max_num_threads=256", "tutorial/conv2d_no_batching", [1, 64, 64, 512, 256, 3, 3, [1, 1], [1, 1]], {}], "config": {"index": 507316, "code_hash": null, "entity": [["tile_ic", "ot", 4], ["tile_oc", "ot", 4], ["tile_ow", "sp", [-1, 32]], ["unroll_kw", "ot", false], ["tile_cp", "sp", [-1, 16]], ["tile_hp", "sp", [-1, 4, 16]], ["tile_wp", "sp", [-1, 8, 4]], ["ann_spatial", "an", ["vec", "none"]]]}, "result": [[0.0054575266], 0, 155.51241493225098, 1614851028.0134077], "version": 0.2, "tvm_version": "0.8.dev0"}
{"input": ["opencl -keys=mali,opencl,gpu -device=mali -max_num_threads=256", "tutorial/conv2d_no_batching", [1, 64, 64, 512, 256, 3, 3, [1, 1], [1, 1]], {}], "config": {"index": 109482, "code_hash": null, "entity": [["tile_ic", "ot", 4], ["tile_oc", "ot", 4], ["tile_ow", "sp", [-1, 4]], ["unroll_kw", "ot", true], ["tile_cp", "sp", [-1, 2]], ["tile_hp", "sp", [-1, 1, 32]], ["tile_wp", "sp", [-1, 16, 2]], ["ann_spatial", "an", ["none", "unroll"]]]}, "result": [[0.0015210783], 0, 181.02144479751587, 1614851053.5538402], "version": 0.2, "tvm_version": "0.8.dev0"}
{"input": ["opencl -keys=mali,opencl,gpu -device=mali -max_num_threads=256", "tutorial/conv2d_no_batching", [1, 64, 64, 512, 256, 3, 3, [1, 1], [1, 1]], {}], "config": {"index": 346698, "code_hash": null, "entity": [["tile_ic", "ot", 4], ["tile_oc", "ot", 4], ["tile_ow", "sp", [-1, 4]], ["unroll_kw", "ot", true], ["tile_cp", "sp", [-1, 32]], ["tile_hp", "sp", [-1, 4, 2]], ["tile_wp", "sp", [-1, 2, 4]], ["ann_spatial", "an", ["unroll", "unroll"]]]}, "result": [[0.0068530163000000005], 0, 26.882530689239502, 1614850899.1205273], "version": 0.2, "tvm_version": "0.8.dev0"}
{"input": ["opencl -keys=mali,opencl,gpu -device=mali -max_num_threads=256", "tutorial/conv2d_no_batching", [1, 64, 64, 512, 256, 3, 3, [1, 1], [1, 1]], {}], "config": {"index": 217241, "code_hash": null, "entity": [["tile_ic", "ot", 4], ["tile_oc", "ot", 4], ["tile_ow", "sp", [-1, 8]], ["unroll_kw", "ot", true], ["tile_cp", "sp", [-1, 32]], ["tile_hp", "sp", [-1, 16, 1]], ["tile_wp", "sp", [-1, 2, 16]], ["ann_spatial", "an", ["none", "vec"]]]}, "result": [[0.013338792999999998], 0, 89.95917582511902, 1614850962.3027902], "version": 0.2, "tvm_version": "0.8.dev0"}
{"input": ["opencl -keys=mali,opencl,gpu -device=mali -max_num_threads=256", "tutorial/conv2d_no_batching", [1, 64, 64, 512, 256, 3, 3, [1, 1], [1, 1]], {}], "config": {"index": 494412, "code_hash": null, "entity": [["tile_ic", "ot", 4], ["tile_oc", "ot", 4], ["tile_ow", "sp", [-1, 4]], ["unroll_kw", "ot", true], ["tile_cp", "sp", [-1, 1]], ["tile_hp", "sp", [-1, 32, 1]], ["tile_wp", "sp", [-1, 32, 2]], ["ann_spatial", "an", ["vec", "none"]]]}, "result": [[0.0011252814], 0, 77.27360701560974, 1614850949.6161072], "version": 0.2, "tvm_version": "0.8.dev0"}
{"input": ["opencl -keys=mali,opencl,gpu -device=mali -max_num_threads=256", "tutorial/conv2d_no_batching", [1, 64, 64, 512, 256, 3, 3, [1, 1], [1, 1]], {}], "config": {"index": 31796, "code_hash": null, "entity": [["tile_ic", "ot", 4], ["tile_oc", "ot", 4], ["tile_cp", "sp", [-1, 4]], ["tile_hp", "sp", [-1, 64, 1]], ["tile_wp", "sp", [-1, 1, 16]], ["ann_spatial", "an", ["unroll", "vec"]]]}, "result": [[0.0143691942], 0, 26.7156925201416, 1614911905.8689473], "version": 0.2, "tvm_version": "0.8.dev0"}
{"input": ["opencl -keys=mali,opencl,gpu -device=mali -max_num_threads=256", "tutorial/conv2d_no_batching", [1, 64, 64, 512, 256, 3, 3, [1, 1], [1, 1]], {}], "config": {"index": 8631, "code_hash": null, "entity": [["tile_ic", "ot", 4], ["tile_oc", "ot", 4], ["tile_cp", "sp", [-1, 1]], ["tile_hp", "sp", [-1, 2, 1]], ["tile_wp", "sp", [-1, 8, 4]], ["ann_spatial", "an", ["none", "unroll"]]]}, "result": [[0.0042457452], 0, 13.484655618667603, 1614911892.6508453], "version": 0.2, "tvm_version": "0.8.dev0"}
{"input": ["opencl -keys=mali,opencl,gpu -device=mali -max_num_threads=256", "tutorial/conv2d_no_batching", [1, 64, 64, 512, 256, 3, 3, [1, 1], [1, 1]], {}], "config": {"index": 16885, "code_hash": null, "entity": [["tile_ic", "ot", 4], ["tile_oc", "ot", 4], ["tile_cp", "sp", [-1, 2]], ["tile_hp", "sp", [-1, 16, 1]], ["tile_wp", "sp", [-1, 4, 1]], ["ann_spatial", "an", ["unroll", "none"]]]}, "result": [[0.001301448], 0, 39.460957288742065, 1614911918.6525052], "version": 0.2, "tvm_version": "0.8.dev0"}
{"input": ["opencl -keys=mali,opencl,gpu -device=mali -max_num_threads=256", "tutorial/conv2d_no_batching", [1, 64, 64, 512, 256, 3, 3, [1, 1], [1, 1]], {}], "config": {"index": 42500, "code_hash": null, "entity": [["tile_ic", "ot", 4], ["tile_oc", "ot", 4], ["tile_cp", "sp", [-1, 8]], ["tile_hp", "sp", [-1, 2, 16]], ["tile_wp", "sp", [-1, 4, 8]], ["ann_spatial", "an", ["vec", "unroll"]]]}, "result": [[0.0171268142], 0, 93.57542276382446, 1614911972.8413582], "version": 0.2, "tvm_version": "0.8.dev0"}
{"input": ["opencl -keys=mali,opencl,gpu -device=mali -max_num_threads=256", "tutorial/conv2d_no_batching", [1, 64, 64, 512, 256, 3, 3, [1, 1], [1, 1]], {}], "config": {"index": 15194, "code_hash": null, "entity": [["tile_ic", "ot", 4], ["tile_oc", "ot", 4], ["tile_cp", "sp", [-1, 16]], ["tile_hp", "sp", [-1, 2, 4]], ["tile_wp", "sp", [-1, 8, 8]], ["ann_spatial", "an", ["none", "vec"]]]}, "result": [[0.0155964286], 0, 65.83499693870544, 1614911945.0788167], "version": 0.2, "tvm_version": "0.8.dev0"}
{"input": ["opencl -keys=mali,opencl,gpu -device=mali -max_num_threads=256", "tutorial/conv2d_no_batching", [1, 64, 64, 512, 256, 3, 3, [1, 1], [1, 1]], {}], "config": {"index": 4984, "code_hash": null, "entity": [["tile_ic", "ot", 4], ["tile_oc", "ot", 4], ["tile_cp", "sp", [-1, 1]], ["tile_hp", "sp", [-1, 32, 2]], ["tile_wp", "sp", [-1, 1, 32]], ["ann_spatial", "an", ["none", "none"]]]}, "result": [[0.0117958553], 0, 79.56570553779602, 1614911958.841913], "version": 0.2, "tvm_version": "0.8.dev0"}
{"input": ["opencl -keys=mali,opencl,gpu -device=mali -max_num_threads=256", "tutorial/conv2d_no_batching", [1, 64, 64, 512, 256, 3, 3, [1, 1], [1, 1]], {}], "config": {"index": 6274, "code_hash": null, "entity": [["tile_ic", "ot", 4], ["tile_oc", "ot", 4], ["tile_cp", "sp", [-1, 4]], ["tile_hp", "sp", [-1, 1, 1]], ["tile_wp", "sp", [-1, 16, 1]], ["ann_spatial", "an", ["none", "unroll"]]]}, "result": [[0.0011782605], 0, 52.46917986869812, 1614911931.69985], "version": 0.2, "tvm_version": "0.8.dev0"}
{"input": ["opencl -keys=mali,opencl,gpu -device=mali -max_num_threads=256", "tutorial/conv2d_no_batching", [1, 64, 64, 512, 256, 3, 3, [1, 1], [1, 1]], {}], "config": {"index": 13505, "code_hash": null, "entity": [["tile_ic", "ot", 4], ["tile_oc", "ot", 4], ["tile_cp", "sp", [-1, 4]], ["tile_hp", "sp", [-1, 1, 32]], ["tile_wp", "sp", [-1, 32, 2]], ["ann_spatial", "an", ["none", "vec"]]]}, "result": [[0.0011459376], 0, 120.97360181808472, 1614912000.3301647], "version": 0.2, "tvm_version": "0.8.dev0"}
{"input": ["opencl -keys=mali,opencl,gpu -device=mali -max_num_threads=256", "tutorial/conv2d_no_batching", [1, 64, 64, 512, 256, 3, 3, [1, 1], [1, 1]], {}], "config": {"index": 3851, "code_hash": null, "entity": [["tile_ic", "ot", 4], ["tile_oc", "ot", 4], ["tile_cp", "sp", [-1, 2]], ["tile_hp", "sp", [-1, 1, 8]], ["tile_wp", "sp", [-1, 2, 8]], ["ann_spatial", "an", ["none", "none"]]]}, "result": [[0.0084812456], 0, 107.3819031715393, 1614911986.727895], "version": 0.2, "tvm_version": "0.8.dev0"}
{"input": ["opencl -keys=mali,opencl,gpu -device=mali -max_num_threads=256", "tutorial/conv2d_no_batching", [1, 64, 64, 512, 256, 3, 3, [1, 1], [1, 1]], {}], "config": {"index": 2315, "code_hash": null, "entity": [["tile_ic", "ot", 4], ["tile_oc", "ot", 4], ["tile_cp", "sp", [-1, 32]], ["tile_hp", "sp", [-1, 1, 16]], ["tile_wp", "sp", [-1, 16, 2]], ["ann_spatial", "an", ["none", "none"]]]}, "result": [[0.0012654429], 0, 149.68115043640137, 1614912029.044274], "version": 0.2, "tvm_version": "0.8.dev0"}
{"input": ["opencl -keys=mali,opencl,gpu -device=mali -max_num_threads=256", "tutorial/conv2d_no_batching", [1, 64, 64, 512, 256, 3, 3, [1, 1], [1, 1]], {}], "config": {"index": 41447, "code_hash": null, "entity": [["tile_ic", "ot", 4], ["tile_oc", "ot", 4], ["tile_cp", "sp", [-1, 1]], ["tile_hp", "sp", [-1, 1, 4]], ["tile_wp", "sp", [-1, 4, 4]], ["ann_spatial", "an", ["vec", "unroll"]]]}, "result": [[0.0090312196], 0, 163.36348485946655, 1614912042.7279894], "version": 0.2, "tvm_version": "0.8.dev0"}
{"input": ["opencl -keys=mali,opencl,gpu -device=mali -max_num_threads=256", "tutorial/conv2d_no_batching", [1, 64, 64, 512, 256, 3, 3, [1, 1], [1, 1]], {}], "config": {"index": 14502, "code_hash": null, "entity": [["tile_ic", "ot", 4], ["tile_oc", "ot", 4], ["tile_cp", "sp", [-1, 32]], ["tile_hp", "sp", [-1, 1, 64]], ["tile_wp", "sp", [-1, 16, 4]], ["ann_spatial", "an", ["none", "vec"]]]}, "result": [[0.001719594], 0, 134.24367475509644, 1614912013.6241627], "version": 0.2, "tvm_version": "0.8.dev0"}
{"input": ["opencl -keys=mali,opencl,gpu -device=mali -max_num_threads=256", "tutorial/conv2d_no_batching", [1, 64, 64, 512, 256, 3, 3, [1, 1], [1, 1]], {}], "config": {"index": 19465, "code_hash": null, "entity": [["tile_ic", "ot", 4], ["tile_oc", "ot", 4], ["tile_cp", "sp", [-1, 32]], ["tile_hp", "sp", [-1, 2, 2]], ["tile_wp", "sp", [-1, 4, 4]], ["ann_spatial", "an", ["unroll", "none"]]]}, "result": [[0.006174985], 0, 12.748048782348633, 1614912077.4453976], "version": 0.2, "tvm_version": "0.8.dev0"}
{"input": ["opencl -keys=mali,opencl,gpu -device=mali -max_num_threads=256", "tutorial/conv2d_no_batching", [1, 64, 64, 512, 256, 3, 3, [1, 1], [1, 1]], {}], "config": {"index": 30023, "code_hash": null, "entity": [["tile_ic", "ot", 4], ["tile_oc", "ot", 4], ["tile_cp", "sp", [-1, 1]], ["tile_hp", "sp", [-1, 32, 1]], ["tile_wp", "sp", [-1, 1, 4]], ["ann_spatial", "an", ["unroll", "vec"]]]}, "result": [[0.0055452974], 0, 39.25566101074219, 1614912103.9506898], "version": 0.2, "tvm_version": "0.8.dev0"}
{"input": ["opencl -keys=mali,opencl,gpu -device=mali -max_num_threads=256", "tutorial/conv2d_no_batching", [1, 64, 64, 512, 256, 3, 3, [1, 1], [1, 1]], {}], "config": {"index": 43618, "code_hash": null, "entity": [["tile_ic", "ot", 4], ["tile_oc", "ot", 4], ["tile_cp", "sp", [-1, 2]], ["tile_hp", "sp", [-1, 4, 4]], ["tile_wp", "sp", [-1, 2, 32]], ["ann_spatial", "an", ["vec", "unroll"]]]}, "result": [[0.0081130893], 0, 26.10090398788452, 1614912090.8449762], "version": 0.2, "tvm_version": "0.8.dev0"}
{"input": ["opencl -keys=mali,opencl,gpu -device=mali -max_num_threads=256", "tutorial/conv2d_no_batching", [1, 64, 64, 512, 256, 3, 3, [1, 1], [1, 1]], {}], "config": {"index": 29377, "code_hash": null, "entity": [["tile_ic", "ot", 4], ["tile_oc", "ot", 4], ["tile_cp", "sp", [-1, 32]], ["tile_hp", "sp", [-1, 4, 16]], ["tile_wp", "sp", [-1, 4, 2]], ["ann_spatial", "an", ["unroll", "vec"]]]}, "result": [[0.0021386825], 0, 52.28415274620056, 1614912116.9905968], "version": 0.2, "tvm_version": "0.8.dev0"}
{"input": ["opencl -keys=mali,opencl,gpu -device=mali -max_num_threads=256", "tutorial/conv2d_no_batching", [1, 64, 64, 512, 256, 3, 3, [1, 1], [1, 1]], {}], "config": {"index": 26838, "code_hash": null, "entity": [["tile_ic", "ot", 4], ["tile_oc", "ot", 4], ["tile_cp", "sp", [-1, 1]], ["tile_hp", "sp", [-1, 2, 32]], ["tile_wp", "sp", [-1, 4, 16]], ["ann_spatial", "an", ["unroll", "unroll"]]]}, "result": [[0.0069809225], 0, 116.13549757003784, 1614912181.0018766], "version": 0.2, "tvm_version": "0.8.dev0"}
{"input": ["opencl -keys=mali,opencl,gpu -device=mali -max_num_threads=256", "tutorial/conv2d_no_batching", [1, 64, 64, 512, 256, 3, 3, [1, 1], [1, 1]], {}], "config": {"index": 10755, "code_hash": null, "entity": [["tile_ic", "ot", 4], ["tile_oc", "ot", 4], ["tile_cp", "sp", [-1, 8]], ["tile_hp", "sp", [-1, 4, 16]], ["tile_wp", "sp", [-1, 2, 32]], ["ann_spatial", "an", ["none", "unroll"]]]}, "result": [[0.010937730199999999], 0, 142.47906231880188, 1614912207.3583786], "version": 0.2, "tvm_version": "0.8.dev0"}
{"input": ["opencl -keys=mali,opencl,gpu -device=mali -max_num_threads=256", "tutorial/conv2d_no_batching", [1, 64, 64, 512, 256, 3, 3, [1, 1], [1, 1]], {}], "config": {"index": 6276, "code_hash": null, "entity": [["tile_ic", "ot", 4], ["tile_oc", "ot", 4], ["tile_cp", "sp", [-1, 16]], ["tile_hp", "sp", [-1, 1, 1]], ["tile_wp", "sp", [-1, 16, 1]], ["ann_spatial", "an", ["none", "unroll"]]]}, "result": [[0.0013323699], 0, 64.8661117553711, 1614912129.6493232], "version": 0.2, "tvm_version": "0.8.dev0"}
{"input": ["opencl -keys=mali,opencl,gpu -device=mali -max_num_threads=256", "tutorial/conv2d_no_batching", [1, 64, 64, 512, 256, 3, 3, [1, 1], [1, 1]], {}], "config": {"index": 38497, "code_hash": null, "entity": [["tile_ic", "ot", 4], ["tile_oc", "ot", 4], ["tile_cp", "sp", [-1, 16]], ["tile_hp", "sp", [-1, 16, 2]], ["tile_wp", "sp", [-1, 1, 1]], ["ann_spatial", "an", ["vec", "unroll"]]]}, "result": [[0.0059653652], 0, 170.23205757141113, 1614912235.1151705], "version": 0.2, "tvm_version": "0.8.dev0"}
{"input": ["opencl -keys=mali,opencl,gpu -device=mali -max_num_threads=256", "tutorial/conv2d_no_batching", [1, 64, 64, 512, 256, 3, 3, [1, 1], [1, 1]], {}], "config": {"index": 15807, "code_hash": null, "entity": [["tile_ic", "ot", 4], ["tile_oc", "ot", 4], ["tile_cp", "sp", [-1, 2]], ["tile_hp", "sp", [-1, 1, 8]], ["tile_wp", "sp", [-1, 4, 16]], ["ann_spatial", "an", ["none", "vec"]]]}, "result": [[0.007060844500000001], 0, 77.98140931129456, 1614912142.7514055], "version": 0.2, "tvm_version": "0.8.dev0"}
{"input": ["opencl -keys=mali,opencl,gpu -device=mali -max_num_threads=256", "tutorial/conv2d_no_batching", [1, 64, 64, 512, 256, 3, 3, [1, 1], [1, 1]], {}], "config": {"index": 12, "code_hash": null, "entity": [["tile_ic", "ot", 4], ["tile_oc", "ot", 4], ["tile_cp", "sp", [-1, 32]], ["tile_hp", "sp", [-1, 2, 1]], ["tile_wp", "sp", [-1, 1, 1]], ["ann_spatial", "an", ["none", "none"]]]}, "result": [[0.0018621980999999998], 0, 129.17722153663635, 1614912194.0477195], "version": 0.2, "tvm_version": "0.8.dev0"}
{"input": ["opencl -keys=mali,opencl,gpu -device=mali -max_num_threads=256", "tutorial/conv2d_no_batching", [1, 64, 64, 512, 256, 3, 3, [1, 1], [1, 1]], {}], "config": {"index": 9514, "code_hash": null, "entity": [["tile_ic", "ot", 4], ["tile_oc", "ot", 4], ["tile_cp", "sp", [-1, 2]], ["tile_hp", "sp", [-1, 4, 4]], ["tile_wp", "sp", [-1, 4, 8]], ["ann_spatial", "an", ["none", "unroll"]]]}, "result": [[0.0112247927], 0, 156.33080792427063, 1614912221.1748226], "version": 0.2, "tvm_version": "0.8.dev0"}
{"input": ["opencl -keys=mali,opencl,gpu -device=mali -max_num_threads=256", "tutorial/conv2d_no_batching", [1, 64, 64, 512, 256, 3, 3, [1, 1], [1, 1]], {}], "config": {"index": 39413, "code_hash": null, "entity": [["tile_ic", "ot", 4], ["tile_oc", "ot", 4], ["tile_cp", "sp", [-1, 8]], ["tile_hp", "sp", [-1, 4, 1]], ["tile_wp", "sp", [-1, 32, 1]], ["ann_spatial", "an", ["vec", "unroll"]]]}, "result": [[0.0012891563], 0, 90.69131922721863, 1614912155.4452424], "version": 0.2, "tvm_version": "0.8.dev0"}
{"input": ["opencl -keys=mali,opencl,gpu -device=mali -max_num_threads=256", "tutorial/conv2d_no_batching", [1, 64, 64, 512, 256, 3, 3, [1, 1], [1, 1]], {}], "config": {"index": 1727, "code_hash": null, "entity": [["tile_ic", "ot", 4], ["tile_oc", "ot", 4], ["tile_cp", "sp", [-1, 32]], ["tile_hp", "sp", [-1, 1, 16]], ["tile_wp", "sp", [-1, 2, 2]], ["ann_spatial", "an", ["none", "none"]]]}, "result": [[0.0019562606], 0, 103.17529511451721, 1614912167.9365408], "version": 0.2, "tvm_version": "0.8.dev0"}
{"input": ["opencl -keys=mali,opencl,gpu -device=mali -max_num_threads=256", "tutorial/conv2d_no_batching", [1, 64, 64, 512, 256, 3, 3, [1, 1], [1, 1]], {}], "config": {"index": 9184, "code_hash": null, "entity": [["tile_ic", "ot", 4], ["tile_oc", "ot", 4], ["tile_cp", "sp", [-1, 1]], ["tile_hp", "sp", [-1, 4, 16]], ["tile_wp", "sp", [-1, 1, 8]], ["ann_spatial", "an", ["none", "unroll"]]]}, "result": [[0.0086288915], 0, 28.20789623260498, 1614912286.3029683], "version": 0.2, "tvm_version": "0.8.dev0"}
{"input": ["opencl -keys=mali,opencl,gpu -device=mali -max_num_threads=256", "tutorial/conv2d_no_batching", [1, 64, 64, 512, 256, 3, 3, [1, 1], [1, 1]], {}], "config": {"index": 3695, "code_hash": null, "entity": [["tile_ic", "ot", 4], ["tile_oc", "ot", 4], ["tile_cp", "sp", [-1, 64]], ["tile_hp", "sp", [-1, 2, 16]], ["tile_wp", "sp", [-1, 1, 8]], ["ann_spatial", "an", ["none", "none"]]]}, "result": [[0.0194894238], 0, 44.146031856536865, 1614912302.2425544], "version": 0.2, "tvm_version": "0.8.dev0"}
{"input": ["opencl -keys=mali,opencl,gpu -device=mali -max_num_threads=256", "tutorial/conv2d_no_batching", [1, 64, 64, 512, 256, 3, 3, [1, 1], [1, 1]], {}], "config": {"index": 28051, "code_hash": null, "entity": [["tile_ic", "ot", 4], ["tile_oc", "ot", 4], ["tile_cp", "sp", [-1, 4]], ["tile_hp", "sp", [-1, 8, 1]], ["tile_wp", "sp", [-1, 8, 1]], ["ann_spatial", "an", ["unroll", "vec"]]]}, "result": [[0.0012597762], 0, 58.58226227760315, 1614912316.6766608], "version": 0.2, "tvm_version": "0.8.dev0"}
{"input": ["opencl -keys=mali,opencl,gpu -device=mali -max_num_threads=256", "tutorial/conv2d_no_batching", [1, 64, 64, 512, 256, 3, 3, [1, 1], [1, 1]], {}], "config": {"index": 16082, "code_hash": null, "entity": [["tile_ic", "ot", 4], ["tile_oc", "ot", 4], ["tile_cp", "sp", [-1, 8]], ["tile_hp", "sp", [-1, 2, 1]], ["tile_wp", "sp", [-1, 2, 32]], ["ann_spatial", "an", ["none", "vec"]]]}, "result": [[0.0109465688], 0, 13.345327615737915, 1614912271.4367623], "version": 0.2, "tvm_version": "0.8.dev0"}
{"input": ["opencl -keys=mali,opencl,gpu -device=mali -max_num_threads=256", "tutorial/conv2d_no_batching", [1, 64, 64, 512, 256, 3, 3, [1, 1], [1, 1]], {}], "config": {"index": 11727, "code_hash": null, "entity": [["tile_ic", "ot", 4], ["tile_oc", "ot", 4], ["tile_cp", "sp", [-1, 4]], ["tile_hp", "sp", [-1, 2, 16]], ["tile_wp", "sp", [-1, 8, 1]], ["ann_spatial", "an", ["none", "vec"]]]}, "result": [[0.0011898021999999999], 0, 85.82761478424072, 1614912344.0137582], "version": 0.2, "tvm_version": "0.8.dev0"}
{"input": ["opencl -keys=mali,opencl,gpu -device=mali -max_num_threads=256", "tutorial/conv2d_no_batching", [1, 64, 64, 512, 256, 3, 3, [1, 1], [1, 1]], {}], "config": {"index": 4616, "code_hash": null, "entity": [["tile_ic", "ot", 4], ["tile_oc", "ot", 4], ["tile_cp", "sp", [-1, 8]], ["tile_hp", "sp", [-1, 4, 4]], ["tile_wp", "sp", [-1, 2, 16]], ["ann_spatial", "an", ["none", "none"]]]}, "result": [[0.0164716162], 0, 112.27127528190613, 1614912370.7010448], "version": 0.2, "tvm_version": "0.8.dev0"}
{"input": ["opencl -keys=mali,opencl,gpu -device=mali -max_num_threads=256", "tutorial/conv2d_no_batching", [1, 64, 64, 512, 256, 3, 3, [1, 1], [1, 1]], {}], "config": {"index": 18373, "code_hash": null, "entity": [["tile_ic", "ot", 4], ["tile_oc", "ot", 4], ["tile_cp", "sp", [-1, 32]], ["tile_hp", "sp", [-1, 4, 8]], ["tile_wp", "sp", [-1, 4, 2]], ["ann_spatial", "an", ["unroll", "none"]]]}, "result": [[0.0021153855999999998], 0, 125.55508089065552, 1614912383.992484], "version": 0.2, "tvm_version": "0.8.dev0"}
{"input": ["opencl -keys=mali,opencl,gpu -device=mali -max_num_threads=256", "tutorial/conv2d_no_batching", [1, 64, 64, 512, 256, 3, 3, [1, 1], [1, 1]], {}], "config": {"index": 35717, "code_hash": null, "entity": [["tile_ic", "ot", 4], ["tile_oc", "ot", 4], ["tile_cp", "sp", [-1, 8]], ["tile_hp", "sp", [-1, 64, 1]], ["tile_wp", "sp", [-1, 2, 4]], ["ann_spatial", "an", ["vec", "none"]]]}, "result": [[0.0084950946], 0, 72.80184388160706, 1614912330.974309], "version": 0.2, "tvm_version": "0.8.dev0"}
{"input": ["opencl -keys=mali,opencl,gpu -device=mali -max_num_threads=256", "tutorial/conv2d_no_batching", [1, 64, 64, 512, 256, 3, 3, [1, 1], [1, 1]], {}], "config": {"index": 24977, "code_hash": null, "entity": [["tile_ic", "ot", 4], ["tile_oc", "ot", 4], ["tile_cp", "sp", [-1, 2]], ["tile_hp", "sp", [-1, 32, 2]], ["tile_wp", "sp", [-1, 4, 4]], ["ann_spatial", "an", ["unroll", "unroll"]]]}, "result": [[0.0060414225], 0, 139.03905272483826, 1614912397.3038304], "version": 0.2, "tvm_version": "0.8.dev0"}
{"input": ["opencl -keys=mali,opencl,gpu -device=mali -max_num_threads=256", "tutorial/conv2d_no_batching", [1, 64, 64, 512, 256, 3, 3, [1, 1], [1, 1]], {}], "config": {"index": 37569, "code_hash": null, "entity": [["tile_ic", "ot", 4], ["tile_oc", "ot", 4], ["tile_cp", "sp", [-1, 1]], ["tile_hp", "sp", [-1, 2, 8]], ["tile_wp", "sp", [-1, 2, 16]], ["ann_spatial", "an", ["vec", "none"]]]}, "result": [[0.0091534072], 0, 165.09879660606384, 1614912423.795132], "version": 0.2, "tvm_version": "0.8.dev0"}
{"input": ["opencl -keys=mali,opencl,gpu -device=mali -max_num_threads=256", "tutorial/conv2d_no_batching", [1, 64, 64, 512, 256, 3, 3, [1, 1], [1, 1]], {}], "config": {"index": 1164, "code_hash": null, "entity": [["tile_ic", "ot", 4], ["tile_oc", "ot", 4], ["tile_cp", "sp", [-1, 4]], ["tile_hp", "sp", [-1, 2, 32]], ["tile_wp", "sp", [-1, 32, 1]], ["ann_spatial", "an", ["none", "none"]]]}, "result": [[0.0010859845], 0, 98.80036067962646, 1614912357.056383], "version": 0.2, "tvm_version": "0.8.dev0"}
{"input": ["opencl -keys=mali,opencl,gpu -device=mali -max_num_threads=256", "tutorial/conv2d_no_batching", [1, 64, 64, 512, 256, 3, 3, [1, 1], [1, 1]], {}], "config": {"index": 17989, "code_hash": null, "entity": [["tile_ic", "ot", 4], ["tile_oc", "ot", 4], ["tile_cp", "sp", [-1, 64]], ["tile_hp", "sp", [-1, 8, 8]], ["tile_wp", "sp", [-1, 1, 2]], ["ann_spatial", "an", ["unroll", "none"]]]}, "result": [[0.0097384541], 0, 152.07358980178833, 1614912410.6698601], "version": 0.2, "tvm_version": "0.8.dev0"}
{"input": ["opencl -keys=mali,opencl,gpu -device=mali -max_num_threads=256", "tutorial/conv2d_no_batching", [1, 64, 64, 512, 256, 3, 3, [1, 1], [1, 1]], {}], "config": {"index": 11048, "code_hash": null, "entity": [["tile_ic", "ot", 4], ["tile_oc", "ot", 4], ["tile_cp", "sp", [-1, 4]], ["tile_hp", "sp", [-1, 8, 2]], ["tile_wp", "sp", [-1, 1, 1]], ["ann_spatial", "an", ["none", "vec"]]]}, "result": [[0.0020056565], 0, 11.890238761901855, 1614912456.1602616], "version": 0.2, "tvm_version": "0.8.dev0"}
{"input": ["opencl -keys=mali,opencl,gpu -device=mali -max_num_threads=256", "tutorial/conv2d_no_batching", [1, 64, 64, 512, 256, 3, 3, [1, 1], [1, 1]], {}], "config": {"index": 31428, "code_hash": null, "entity": [["tile_ic", "ot", 4], ["tile_oc", "ot", 4], ["tile_cp", "sp", [-1, 32]], ["tile_hp", "sp", [-1, 4, 2]], ["tile_wp", "sp", [-1, 4, 8]], ["ann_spatial", "an", ["unroll", "vec"]]]}, "result": [[0.0144846577], 0, 54.12716007232666, 1614912498.3809526], "version": 0.2, "tvm_version": "0.8.dev0"}
{"input": ["opencl -keys=mali,opencl,gpu -device=mali -max_num_threads=256", "tutorial/conv2d_no_batching", [1, 64, 64, 512, 256, 3, 3, [1, 1], [1, 1]], {}], "config": {"index": 9381, "code_hash": null, "entity": [["tile_ic", "ot", 4], ["tile_oc", "ot", 4], ["tile_cp", "sp", [-1, 2]], ["tile_hp", "sp", [-1, 4, 16]], ["tile_wp", "sp", [-1, 2, 8]], ["ann_spatial", "an", ["none", "unroll"]]]}, "result": [[0.007286224700000001], 0, 69.08646655082703, 1614912513.3821323], "version": 0.2, "tvm_version": "0.8.dev0"}
{"input": ["opencl -keys=mali,opencl,gpu -device=mali -max_num_threads=256", "tutorial/conv2d_no_batching", [1, 64, 64, 512, 256, 3, 3, [1, 1], [1, 1]], {}], "config": {"index": 25, "code_hash": null, "entity": [["tile_ic", "ot", 4], ["tile_oc", "ot", 4], ["tile_cp", "sp", [-1, 16]], ["tile_hp", "sp", [-1, 8, 1]], ["tile_wp", "sp", [-1, 1, 1]], ["ann_spatial", "an", ["none", "none"]]]}, "result": [[0.0014416668000000001], 0, 153.71144270896912, 1614912598.364318], "version": 0.2, "tvm_version": "0.8.dev0"}
{"input": ["opencl -keys=mali,opencl,gpu -device=mali -max_num_threads=256", "tutorial/conv2d_no_batching", [1, 64, 64, 512, 256, 3, 3, [1, 1], [1, 1]], {}], "config": {"index": 16432, "code_hash": null, "entity": [["tile_ic", "ot", 4], ["tile_oc", "ot", 4], ["tile_cp", "sp", [-1, 8]], ["tile_hp", "sp", [-1, 2, 16]], ["tile_wp", "sp", [-1, 1, 64]], ["ann_spatial", "an", ["none", "vec"]]]}, "result": [[0.0075555945], 0, 39.30926156044006, 1614912483.617024], "version": 0.2, "tvm_version": "0.8.dev0"}
{"input": ["opencl -keys=mali,opencl,gpu -device=mali -max_num_threads=256", "tutorial/conv2d_no_batching", [1, 64, 64, 512, 256, 3, 3, [1, 1], [1, 1]], {}], "config": {"index": 36249, "code_hash": null, "entity": [["tile_ic", "ot", 4], ["tile_oc", "ot", 4], ["tile_cp", "sp", [-1, 8]], ["tile_hp", "sp", [-1, 2, 32]], ["tile_wp", "sp", [-1, 8, 4]], ["ann_spatial", "an", ["vec", "none"]]]}, "result": [[0.0054078651], 0, 126.7195315361023, 1614912571.057615], "version": 0.2, "tvm_version": "0.8.dev0"}
