test_and_tune/android.nhcw4c.log.tmp
{"input": ["opencl -keys=opencl,gpu -max_num_threads=256", "tutorial/conv2d_no_batching", [1, 40, 40, 512, 256, 1, 1, [1, 1], [0, 0]], {}], "config": {"index": 7675, "code_hash": null, "entity": [["tile_rc", "sp", [-1, 8, 4]], ["tile_f", "sp", [-1, 1]], ["tile_y", "sp", [-1, 5, 8]], ["tile_x", "sp", [-1, 40, 4]]]}, "result": [[0.0468983224], 0, 15.669213771820068, 1611209013.6144981], "version": 0.2, "tvm_version": "0.8.dev0"}
{"input": ["opencl -keys=opencl,gpu -max_num_threads=256", "tutorial/conv2d_no_batching", [1, 40, 40, 512, 256, 1, 1, [1, 1], [0, 0]], {}], "config": {"index": 4081, "code_hash": null, "entity": [["tile_rc", "sp", [-1, 1, 4]], ["tile_f", "sp", [-1, 128]], ["tile_y", "sp", [-1, 1, 2]], ["tile_x", "sp", [-1, 8, 4]]]}, "result": [[0.0052613391], 0, 32.0494110584259, 1611209030.0507858], "version": 0.2, "tvm_version": "0.8.dev0"}
{"input": ["opencl -keys=opencl,gpu -max_num_threads=256", "tutorial/conv2d_no_batching", [1, 40, 40, 512, 256, 1, 1, [1, 1], [0, 0]], {}], "config": {"index": 9872, "code_hash": null, "entity": [["tile_rc", "sp", [-1, 4, 4]], ["tile_f", "sp", [-1, 4]], ["tile_y", "sp", [-1, 4, 10]], ["tile_x", "sp", [-1, 2, 8]]]}, "result": [[0.06962497050000001], 0, 51.97095441818237, 1611209049.9248807], "version": 0.2, "tvm_version": "0.8.dev0"}
{"input": ["opencl -keys=opencl,gpu -max_num_threads=256", "tutorial/conv2d_no_batching", [1, 40, 40, 512, 256, 1, 1, [1, 1], [0, 0]], {}], "config": {"index": 22274, "code_hash": null, "entity": [["tile_rc", "sp", [-1, 1, 4]], ["tile_f", "sp", [-1, 64]], ["tile_y", "sp", [-1, 2, 2]], ["tile_x", "sp", [-1, 1, 32]]]}, "result": [[0.031069852], 0, 41.27897024154663, 1611209039.2740557], "version": 0.2, "tvm_version": "0.8.dev0"}
{"input": ["opencl -keys=opencl,gpu -max_num_threads=256", "tutorial/conv2d_no_batching", [1, 40, 40, 512, 256, 1, 1, [1, 1], [0, 0]], {}], "config": {"index": 2814, "code_hash": null, "entity": [["tile_rc", "sp", [-1, 1, 4]], ["tile_f", "sp", [-1, 4]], ["tile_y", "sp", [-1, 4, 10]], ["tile_x", "sp", [-1, 4, 4]]]}, "result": [[0.0373938735], 0, 29.48055672645569, 1611209098.7450144], "version": 0.2, "tvm_version": "0.8.dev0"}
{"input": ["opencl -keys=opencl,gpu -max_num_threads=256", "tutorial/conv2d_no_batching", [1, 40, 40, 512, 256, 1, 1, [1, 1], [0, 0]], {}], "config": {"index": 6609, "code_hash": null, "entity": [["tile_rc", "sp", [-1, 2, 4]], ["tile_f", "sp", [-1, 1]], ["tile_y", "sp", [-1, 1, 8]], ["tile_x", "sp", [-1, 20, 4]]]}, "result": [[0.050131781], 0, 51.0158486366272, 1611209120.2951272], "version": 0.2, "tvm_version": "0.8.dev0"}
{"input": ["opencl -keys=opencl,gpu -max_num_threads=256", "tutorial/conv2d_no_batching", [1, 40, 40, 512, 256, 1, 1, [1, 1], [0, 0]], {}], "config": {"index": 6127, "code_hash": null, "entity": [["tile_rc", "sp", [-1, 4, 4]], ["tile_f", "sp", [-1, 8]], ["tile_y", "sp", [-1, 2, 2]], ["tile_x", "sp", [-1, 20, 4]]]}, "result": [[0.0388559622], 0, 55.060219526290894, 1611209124.3462586], "version": 0.2, "tvm_version": "0.8.dev0"}
{"input": ["opencl -keys=opencl,gpu -max_num_threads=256", "tutorial/conv2d_no_batching", [1, 40, 40, 512, 256, 1, 1, [1, 1], [0, 0]], {}], "config": {"index": 2521, "code_hash": null, "entity": [["tile_rc", "sp", [-1, 2, 4]], ["tile_f", "sp", [-1, 1]], ["tile_y", "sp", [-1, 10, 4]], ["tile_x", "sp", [-1, 4, 4]]]}, "result": [[0.0374174361], 0, 21.930260181427002, 1611209186.372856], "version": 0.2, "tvm_version": "0.8.dev0"}
{"input": ["opencl -keys=opencl,gpu -max_num_threads=256", "tutorial/conv2d_no_batching", [1, 40, 40, 512, 256, 1, 1, [1, 1], [0, 0]], {}], "config": {"index": 5887, "code_hash": null, "entity": [["tile_rc", "sp", [-1, 1, 4]], ["tile_f", "sp", [-1, 2]], ["tile_y", "sp", [-1, 1, 20]], ["tile_x", "sp", [-1, 10, 4]]]}, "result": [[0.044251843], 0, 52.82819366455078, 1611209217.27661], "version": 0.2, "tvm_version": "0.8.dev0"}
{"input": ["opencl -keys=opencl,gpu -max_num_threads=256", "tutorial/conv2d_no_batching", [1, 40, 40, 512, 256, 1, 1, [1, 1], [0, 0]], {}], "config": {"index": 19524, "code_hash": null, "entity": [["tile_rc", "sp", [-1, 2, 4]], ["tile_f", "sp", [-1, 32]], ["tile_y", "sp", [-1, 1, 4]], ["tile_x", "sp", [-1, 2, 20]]]}, "result": [[0.0412428843], 0, 9.230262994766235, 1611209238.5121694], "version": 0.2, "tvm_version": "0.8.dev0"}
{"input": ["opencl -keys=opencl,gpu -max_num_threads=256", "tutorial/conv2d_no_batching", [1, 40, 40, 512, 256, 1, 1, [1, 1], [0, 0]], {}], "config": {"index": 4202, "code_hash": null, "entity": [["tile_rc", "sp", [-1, 4, 4]], ["tile_f", "sp", [-1, 1]], ["tile_y", "sp", [-1, 5, 2]], ["tile_x", "sp", [-1, 8, 4]]]}, "result": [[0.0343560087], 0, 13.184035539627075, 1611209242.497039], "version": 0.2, "tvm_version": "0.8.dev0"}
{"input": ["opencl -keys=opencl,gpu -max_num_threads=256", "tutorial/conv2d_no_batching", [1, 40, 40, 512, 256, 1, 1, [1, 1], [0, 0]], {}], "config": {"index": 5806, "code_hash": null, "entity": [["tile_rc", "sp", [-1, 8, 4]], ["tile_f", "sp", [-1, 32]], ["tile_y", "sp", [-1, 2, 10]], ["tile_x", "sp", [-1, 10, 4]]]}, "result": [[0.0627319854], 0, 18.330238342285156, 1611209247.6262126], "version": 0.2, "tvm_version": "0.8.dev0"}
{"input": ["opencl -keys=opencl,gpu -max_num_threads=256", "tutorial/conv2d_no_batching", [1, 40, 40, 512, 256, 1, 1, [1, 1], [0, 0]], {}], "config": {"index": 16191, "code_hash": null, "entity": [["tile_rc", "sp", [-1, 1, 4]], ["tile_f", "sp", [-1, 2]], ["tile_y", "sp", [-1, 2, 2]], ["tile_x", "sp", [-1, 5, 16]]]}, "result": [[0.0191078665], 0, 28.94492506980896, 1611209258.2861106], "version": 0.2, "tvm_version": "0.8.dev0"}
{"input": ["opencl -keys=opencl,gpu -max_num_threads=256", "tutorial/conv2d_no_batching", [1, 40, 40, 512, 256, 1, 1, [1, 1], [0, 0]], {}], "config": {"index": 4130, "code_hash": null, "entity": [["tile_rc", "sp", [-1, 1, 4]], ["tile_f", "sp", [-1, 64]], ["tile_y", "sp", [-1, 2, 2]], ["tile_x", "sp", [-1, 8, 4]]]}, "result": [[0.005387688], 0, 31.863346576690674, 1611209261.2076163], "version": 0.2, "tvm_version": "0.8.dev0"}
{"input": ["opencl -keys=opencl,gpu -max_num_threads=256", "tutorial/conv2d_no_batching", [1, 40, 40, 512, 256, 1, 1, [1, 1], [0, 0]], {}], "config": {"index": 26406, "code_hash": null, "entity": [["tile_rc", "sp", [-1, 4, 4]], ["tile_f", "sp", [-1, 16]], ["tile_y", "sp", [-1, 5, 2]], ["tile_x", "sp", [-1, 4, 40]]]}, "result": [[0.0733346375], 0, 47.932254791259766, 1611209277.2628624], "version": 0.2, "tvm_version": "0.8.dev0"}
{"input": ["opencl -keys=opencl,gpu -max_num_threads=256", "tutorial/conv2d_no_batching", [1, 40, 40, 512, 256, 1, 1, [1, 1], [0, 0]], {}], "config": {"index": 9436, "code_hash": null, "entity": [["tile_rc", "sp", [-1, 1, 4]], ["tile_f", "sp", [-1, 16]], ["tile_y", "sp", [-1, 1, 4]], ["tile_x", "sp", [-1, 2, 8]]]}, "result": [[0.0120198449], 0, 2.915806770324707, 1611209304.705635], "version": 0.2, "tvm_version": "0.8.dev0"}
{"input": ["opencl -keys=opencl,gpu -max_num_threads=256", "tutorial/conv2d_no_batching", [1, 40, 40, 512, 256, 1, 1, [1, 1], [0, 0]], {}], "config": {"index": 1596, "code_hash": null, "entity": [["tile_rc", "sp", [-1, 1, 4]], ["tile_f", "sp", [-1, 16]], ["tile_y", "sp", [-1, 1, 8]], ["tile_x", "sp", [-1, 2, 4]]]}, "result": [[0.012069923100000001], 0, 6.111567974090576, 1611209307.910182], "version": 0.2, "tvm_version": "0.8.dev0"}
{"input": ["opencl -keys=opencl,gpu -max_num_threads=256", "tutorial/conv2d_no_batching", [1, 40, 40, 512, 256, 1, 1, [1, 1], [0, 0]], {}], "config": {"index": 1379, "code_hash": null, "entity": [["tile_rc", "sp", [-1, 1, 4]], ["tile_f", "sp", [-1, 32]], ["tile_y", "sp", [-1, 1, 4]], ["tile_x", "sp", [-1, 2, 4]]]}, "result": [[0.005468636000000001], 0, 12.39130687713623, 1611209314.2001297], "version": 0.2, "tvm_version": "0.8.dev0"}
{"input": ["opencl -keys=opencl,gpu -max_num_threads=256", "tutorial/conv2d_no_batching", [1, 40, 40, 512, 256, 1, 1, [1, 1], [0, 0]], {}], "config": {"index": 14196, "code_hash": null, "entity": [["tile_rc", "sp", [-1, 1, 4]], ["tile_f", "sp", [-1, 16]], ["tile_y", "sp", [-1, 2, 2]], ["tile_x", "sp", [-1, 1, 16]]]}, "result": [[0.0121367929], 0, 9.357044458389282, 1611209311.1737595], "version": 0.2, "tvm_version": "0.8.dev0"}
{"input": ["opencl -keys=opencl,gpu -max_num_threads=256", "tutorial/conv2d_no_batching", [1, 40, 40, 512, 256, 1, 1, [1, 1], [0, 0]], {}], "config": {"index": 9212, "code_hash": null, "entity": [["tile_rc", "sp", [-1, 1, 4]], ["tile_f", "sp", [-1, 16]], ["tile_y", "sp", [-1, 4, 2]], ["tile_x", "sp", [-1, 2, 8]]]}, "result": [[0.0055091412], 0, 15.349877119064331, 1611209317.1958356], "version": 0.2, "tvm_version": "0.8.dev0"}
{"input": ["opencl -keys=opencl,gpu -max_num_threads=256", "tutorial/conv2d_no_batching", [1, 40, 40, 512, 256, 1, 1, [1, 1], [0, 0]], {}], "config": {"index": 8211, "code_hash": null, "entity": [["tile_rc", "sp", [-1, 1, 4]], ["tile_f", "sp", [-1, 32]], ["tile_y", "sp", [-1, 4, 2]], ["tile_x", "sp", [-1, 1, 8]]]}, "result": [[0.0054759016], 0, 18.375948429107666, 1611209320.2172842], "version": 0.2, "tvm_version": "0.8.dev0"}
{"input": ["opencl -keys=opencl,gpu -max_num_threads=256", "tutorial/conv2d_no_batching", [1, 40, 40, 512, 256, 1, 1, [1, 1], [0, 0]], {}], "config": {"index": 8204, "code_hash": null, "entity": [["tile_rc", "sp", [-1, 1, 4]], ["tile_f", "sp", [-1, 16]], ["tile_y", "sp", [-1, 4, 2]], ["tile_x", "sp", [-1, 1, 8]]]}, "result": [[0.0054711411], 0, 21.366912126541138, 1611209323.2276275], "version": 0.2, "tvm_version": "0.8.dev0"}
{"input": ["opencl -keys=opencl,gpu -max_num_threads=256", "tutorial/conv2d_no_batching", [1, 40, 40, 512, 256, 1, 1, [1, 1], [0, 0]], {}], "config": {"index": 371, "code_hash": null, "entity": [["tile_rc", "sp", [-1, 1, 4]], ["tile_f", "sp", [-1, 32]], ["tile_y", "sp", [-1, 1, 4]], ["tile_x", "sp", [-1, 1, 4]]]}, "result": [[0.0105711886], 0, 24.470460176467896, 1611209326.3477046], "version": 0.2, "tvm_version": "0.8.dev0"}
{"input": ["opencl -keys=opencl,gpu -max_num_threads=256", "tutorial/conv2d_no_batching", [1, 40, 40, 512, 256, 1, 1, [1, 1], [0, 0]], {}], "config": {"index": 15204, "code_hash": null, "entity": [["tile_rc", "sp", [-1, 1, 4]], ["tile_f", "sp", [-1, 16]], ["tile_y", "sp", [-1, 2, 2]], ["tile_x", "sp", [-1, 2, 16]]]}, "result": [[0.0062198339], 0, 27.677148580551147, 1611209329.5490766], "version": 0.2, "tvm_version": "0.8.dev0"}
{"input": ["opencl -keys=opencl,gpu -max_num_threads=256", "tutorial/conv2d_no_batching", [1, 40, 40, 512, 256, 1, 1, [1, 1], [0, 0]], {}], "config": {"index": 15148, "code_hash": null, "entity": [["tile_rc", "sp", [-1, 1, 4]], ["tile_f", "sp", [-1, 16]], ["tile_y", "sp", [-1, 1, 2]], ["tile_x", "sp", [-1, 2, 16]]]}, "result": [[0.0120679699], 0, 37.000720500946045, 1611209338.8963988], "version": 0.2, "tvm_version": "0.8.dev0"}
{"input": ["opencl -keys=opencl,gpu -max_num_threads=256", "tutorial/conv2d_no_batching", [1, 40, 40, 512, 256, 1, 1, [1, 1], [0, 0]], {}], "config": {"index": 10220, "code_hash": null, "entity": [["tile_rc", "sp", [-1, 1, 4]], ["tile_f", "sp", [-1, 16]], ["tile_y", "sp", [-1, 4, 2]], ["tile_x", "sp", [-1, 4, 8]]]}, "result": [[0.0055212141], 0, 30.579959392547607, 1611209332.4757497], "version": 0.2, "tvm_version": "0.8.dev0"}
{"input": ["opencl -keys=opencl,gpu -max_num_threads=256", "tutorial/conv2d_no_batching", [1, 40, 40, 512, 256, 1, 1, [1, 1], [0, 0]], {}], "config": {"index": 14252, "code_hash": null, "entity": [["tile_rc", "sp", [-1, 1, 4]], ["tile_f", "sp", [-1, 16]], ["tile_y", "sp", [-1, 4, 2]], ["tile_x", "sp", [-1, 1, 16]]]}, "result": [[0.006241709], 0, 33.60589551925659, 1611209335.518132], "version": 0.2, "tvm_version": "0.8.dev0"}
{"input": ["opencl -keys=opencl,gpu -max_num_threads=256", "tutorial/conv2d_no_batching", [1, 40, 40, 512, 256, 1, 1, [1, 1], [0, 0]], {}], "config": {"index": 15302, "code_hash": null, "entity": [["tile_rc", "sp", [-1, 1, 4]], ["tile_f", "sp", [-1, 4]], ["tile_y", "sp", [-1, 5, 2]], ["tile_x", "sp", [-1, 2, 16]]]}, "result": [[0.009682334300000001], 0, 40.12822389602661, 1611209342.0456066], "version": 0.2, "tvm_version": "0.8.dev0"}
{"input": ["opencl -keys=opencl,gpu -max_num_threads=256", "tutorial/conv2d_no_batching", [1, 40, 40, 512, 256, 1, 1, [1, 1], [0, 0]], {}], "config": {"index": 8155, "code_hash": null, "entity": [["tile_rc", "sp", [-1, 1, 4]], ["tile_f", "sp", [-1, 32]], ["tile_y", "sp", [-1, 2, 2]], ["tile_x", "sp", [-1, 1, 8]]]}, "result": [[0.0054963026], 0, 43.13293147087097, 1611209345.0527961], "version": 0.2, "tvm_version": "0.8.dev0"}
{"input": ["opencl -keys=opencl,gpu -max_num_threads=256", "tutorial/conv2d_no_batching", [1, 40, 40, 512, 256, 1, 1, [1, 1], [0, 0]], {}], "config": {"index": 10199, "code_hash": null, "entity": [["tile_rc", "sp", [-1, 1, 4]], ["tile_f", "sp", [-1, 2]], ["tile_y", "sp", [-1, 4, 2]], ["tile_x", "sp", [-1, 4, 8]]]}, "result": [[0.0106341886], 0, 46.20301628112793, 1611209348.1511722], "version": 0.2, "tvm_version": "0.8.dev0"}
{"input": ["opencl -keys=opencl,gpu -max_num_threads=256", "tutorial/conv2d_no_batching", [1, 40, 40, 512, 256, 1, 1, [1, 1], [0, 0]], {}], "config": {"index": 9107, "code_hash": null, "entity": [["tile_rc", "sp", [-1, 1, 4]], ["tile_f", "sp", [-1, 32]], ["tile_y", "sp", [-1, 1, 2]], ["tile_x", "sp", [-1, 2, 8]]]}, "result": [[0.0055193547], 0, 49.13497185707092, 1611209351.0912044], "version": 0.2, "tvm_version": "0.8.dev0"}
{"input": ["opencl -keys=opencl,gpu -max_num_threads=256", "tutorial/conv2d_no_batching", [1, 40, 40, 512, 256, 1, 1, [1, 1], [0, 0]], {}], "config": {"index": 98, "code_hash": null, "entity": [["tile_rc", "sp", [-1, 1, 4]], ["tile_f", "sp", [-1, 64]], ["tile_y", "sp", [-1, 2, 2]], ["tile_x", "sp", [-1, 1, 4]]]}, "result": [[0.0053629693], 0, 2.5432677268981934, 1611209354.466371], "version": 0.2, "tvm_version": "0.8.dev0"}
{"input": ["opencl -keys=opencl,gpu -max_num_threads=256", "tutorial/conv2d_no_batching", [1, 40, 40, 512, 256, 1, 1, [1, 1], [0, 0]], {}], "config": {"index": 1099, "code_hash": null, "entity": [["tile_rc", "sp", [-1, 1, 4]], ["tile_f", "sp", [-1, 32]], ["tile_y", "sp", [-1, 2, 2]], ["tile_x", "sp", [-1, 2, 4]]]}, "result": [[0.0053407870000000005], 0, 5.533712387084961, 1611209357.4534209], "version": 0.2, "tvm_version": "0.8.dev0"}
{"input": ["opencl -keys=opencl,gpu -max_num_threads=256", "tutorial/conv2d_no_batching", [1, 40, 40, 512, 256, 1, 1, [1, 1], [0, 0]], {}], "config": {"index": 8435, "code_hash": null, "entity": [["tile_rc", "sp", [-1, 1, 4]], ["tile_f", "sp", [-1, 32]], ["tile_y", "sp", [-1, 1, 4]], ["tile_x", "sp", [-1, 1, 8]]]}, "result": [[0.012123345], 0, 8.730574131011963, 1611209360.6577532], "version": 0.2, "tvm_version": "0.8.dev0"}
{"input": ["opencl -keys=opencl,gpu -max_num_threads=256", "tutorial/conv2d_no_batching", [1, 40, 40, 512, 256, 1, 1, [1, 1], [0, 0]], {}], "config": {"index": 15260, "code_hash": null, "entity": [["tile_rc", "sp", [-1, 1, 4]], ["tile_f", "sp", [-1, 16]], ["tile_y", "sp", [-1, 4, 2]], ["tile_x", "sp", [-1, 2, 16]]]}, "result": [[0.0062380319], 0, 18.161823272705078, 1611209370.0819297], "version": 0.2, "tvm_version": "0.8.dev0"}
{"input": ["opencl -keys=opencl,gpu -max_num_threads=256", "tutorial/conv2d_no_batching", [1, 40, 40, 512, 256, 1, 1, [1, 1], [0, 0]], {}], "config": {"index": 15197, "code_hash": null, "entity": [["tile_rc", "sp", [-1, 1, 4]], ["tile_f", "sp", [-1, 8]], ["tile_y", "sp", [-1, 2, 2]], ["tile_x", "sp", [-1, 2, 16]]]}, "result": [[0.0120768553], 0, 11.983857870101929, 1611209363.9111288], "version": 0.2, "tvm_version": "0.8.dev0"}
{"input": ["opencl -keys=opencl,gpu -max_num_threads=256", "tutorial/conv2d_no_batching", [1, 40, 40, 512, 256, 1, 1, [1, 1], [0, 0]], {}], "config": {"index": 2380, "code_hash": null, "entity": [["tile_rc", "sp", [-1, 1, 4]], ["tile_f", "sp", [-1, 16]], ["tile_y", "sp", [-1, 1, 4]], ["tile_x", "sp", [-1, 4, 4]]]}, "result": [[0.0055174433], 0, 15.029907703399658, 1611209366.9724221], "version": 0.2, "tvm_version": "0.8.dev0"}
{"input": ["opencl -keys=opencl,gpu -max_num_threads=256", "tutorial/conv2d_no_batching", [1, 40, 40, 512, 256, 1, 1, [1, 1], [0, 0]], {}], "config": {"index": 4116, "code_hash": null, "entity": [["tile_rc", "sp", [-1, 1, 4]], ["tile_f", "sp", [-1, 16]], ["tile_y", "sp", [-1, 2, 2]], ["tile_x", "sp", [-1, 8, 4]]]}, "result": [[0.0053126672], 0, 24.88584017753601, 1611209376.8495097], "version": 0.2, "tvm_version": "0.8.dev0"}
{"input": ["opencl -keys=opencl,gpu -max_num_threads=256", "tutorial/conv2d_no_batching", [1, 40, 40, 512, 256, 1, 1, [1, 1], [0, 0]], {}], "config": {"index": 18228, "code_hash": null, "entity": [["tile_rc", "sp", [-1, 1, 4]], ["tile_f", "sp", [-1, 16]], ["tile_y", "sp", [-1, 2, 2]], ["tile_x", "sp", [-1, 1, 20]]]}, "result": [[0.0291037164], 0, 21.90498399734497, 1611209373.8516817], "version": 0.2, "tvm_version": "0.8.dev0"}
{"input": ["opencl -keys=opencl,gpu -max_num_threads=256", "tutorial/conv2d_no_batching", [1, 40, 40, 512, 256, 1, 1, [1, 1], [0, 0]], {}], "config": {"index": 2107, "code_hash": null, "entity": [["tile_rc", "sp", [-1, 1, 4]], ["tile_f", "sp", [-1, 32]], ["tile_y", "sp", [-1, 2, 2]], ["tile_x", "sp", [-1, 4, 4]]]}, "result": [[0.0053339328999999994], 0, 27.80018448829651, 1611209379.757735], "version": 0.2, "tvm_version": "0.8.dev0"}
{"input": ["opencl -keys=opencl,gpu -max_num_threads=256", "tutorial/conv2d_no_batching", [1, 40, 40, 512, 256, 1, 1, [1, 1], [0, 0]], {}], "config": {"index": 3115, "code_hash": null, "entity": [["tile_rc", "sp", [-1, 1, 4]], ["tile_f", "sp", [-1, 32]], ["tile_y", "sp", [-1, 2, 2]], ["tile_x", "sp", [-1, 5, 4]]]}, "result": [[0.0062735735], 0, 36.934863805770874, 1611209388.88841], "version": 0.2, "tvm_version": "0.8.dev0"}
{"input": ["opencl -keys=opencl,gpu -max_num_threads=256", "tutorial/conv2d_no_batching", [1, 40, 40, 512, 256, 1, 1, [1, 1], [0, 0]], {}], "config": {"index": 1106, "code_hash": null, "entity": [["tile_rc", "sp", [-1, 1, 4]], ["tile_f", "sp", [-1, 64]], ["tile_y", "sp", [-1, 2, 2]], ["tile_x", "sp", [-1, 2, 4]]]}, "result": [[0.0053331932], 0, 30.727980613708496, 1611209382.687081], "version": 0.2, "tvm_version": "0.8.dev0"}
{"input": ["opencl -keys=opencl,gpu -max_num_threads=256", "tutorial/conv2d_no_batching", [1, 40, 40, 512, 256, 1, 1, [1, 1], [0, 0]], {}], "config": {"index": 8099, "code_hash": null, "entity": [["tile_rc", "sp", [-1, 1, 4]], ["tile_f", "sp", [-1, 32]], ["tile_y", "sp", [-1, 1, 2]], ["tile_x", "sp", [-1, 1, 8]]]}, "result": [[0.0106790063], 0, 33.94341206550598, 1611209385.909177], "version": 0.2, "tvm_version": "0.8.dev0"}
{"input": ["opencl -keys=opencl,gpu -max_num_threads=256", "tutorial/conv2d_no_batching", [1, 40, 40, 512, 256, 1, 1, [1, 1], [0, 0]], {}], "config": {"index": 1372, "code_hash": null, "entity": [["tile_rc", "sp", [-1, 1, 4]], ["tile_f", "sp", [-1, 16]], ["tile_y", "sp", [-1, 1, 4]], ["tile_x", "sp", [-1, 2, 4]]]}, "result": [[0.0105416989], 0, 39.99960660934448, 1611209391.975348], "version": 0.2, "tvm_version": "0.8.dev0"}
{"input": ["opencl -keys=opencl,gpu -max_num_threads=256", "tutorial/conv2d_no_batching", [1, 40, 40, 512, 256, 1, 1, [1, 1], [0, 0]], {}], "config": {"index": 18277, "code_hash": null, "entity": [["tile_rc", "sp", [-1, 1, 4]], ["tile_f", "sp", [-1, 8]], ["tile_y", "sp", [-1, 4, 2]], ["tile_x", "sp", [-1, 1, 20]]]}, "result": [[0.029509148800000003], 0, 43.860233783721924, 1611209395.843907], "version": 0.2, "tvm_version": "0.8.dev0"}
{"input": ["opencl -keys=opencl,gpu -max_num_threads=256", "tutorial/conv2d_no_batching", [1, 40, 40, 512, 256, 1, 1, [1, 1], [0, 0]], {}], "config": {"index": 15246, "code_hash": null, "entity": [["tile_rc", "sp", [-1, 1, 4]], ["tile_f", "sp", [-1, 4]], ["tile_y", "sp", [-1, 4, 2]], ["tile_x", "sp", [-1, 2, 16]]]}, "result": [[0.0120716887], 0, 47.143505573272705, 1611209399.1307335], "version": 0.2, "tvm_version": "0.8.dev0"}
{"input": ["opencl -keys=opencl,gpu -max_num_threads=256", "tutorial/conv2d_no_batching", [1, 40, 40, 512, 256, 1, 1, [1, 1], [0, 0]], {}], "config": {"index": 4046, "code_hash": null, "entity": [["tile_rc", "sp", [-1, 1, 4]], ["tile_f", "sp", [-1, 4]], ["tile_y", "sp", [-1, 1, 2]], ["tile_x", "sp", [-1, 8, 4]]]}, "result": [[0.013359194], 0, 50.34007787704468, 1611209402.3409762], "version": 0.2, "tvm_version": "0.8.dev0"}
{"input": ["opencl -keys=opencl,gpu -max_num_threads=256", "tutorial/conv2d_no_batching", [1, 40, 40, 512, 256, 1, 1, [1, 1], [0, 0]], {}], "config": {"index": 1428, "code_hash": null, "entity": [["tile_rc", "sp", [-1, 1, 4]], ["tile_f", "sp", [-1, 16]], ["tile_y", "sp", [-1, 2, 4]], ["tile_x", "sp", [-1, 2, 4]]]}, "result": [[0.005496380800000001], 0, 2.537822961807251, 1611209405.7195253], "version": 0.2, "tvm_version": "0.8.dev0"}
{"input": ["opencl -keys=opencl,gpu -max_num_threads=256", "tutorial/conv2d_no_batching", [1, 40, 40, 512, 256, 1, 1, [1, 1], [0, 0]], {}], "config": {"index": 427, "code_hash": null, "entity": [["tile_rc", "sp", [-1, 1, 4]], ["tile_f", "sp", [-1, 32]], ["tile_y", "sp", [-1, 2, 4]], ["tile_x", "sp", [-1, 1, 4]]]}, "result": [[0.0055258964], 0, 5.492834806442261, 1611209408.6782756], "version": 0.2, "tvm_version": "0.8.dev0"}
{"input": ["opencl -keys=opencl,gpu -max_num_threads=256", "tutorial/conv2d_no_batching", [1, 40, 40, 512, 256, 1, 1, [1, 1], [0, 0]], {}], "config": {"index": 9268, "code_hash": null, "entity": [["tile_rc", "sp", [-1, 1, 4]], ["tile_f", "sp", [-1, 16]], ["tile_y", "sp", [-1, 5, 2]], ["tile_x", "sp", [-1, 2, 8]]]}, "result": [[0.0064818809000000005], 0, 20.57841420173645, 1611209423.774995], "version": 0.2, "tvm_version": "0.8.dev0"}
{"input": ["opencl -keys=opencl,gpu -max_num_threads=256", "tutorial/conv2d_no_batching", [1, 40, 40, 512, 256, 1, 1, [1, 1], [0, 0]], {}], "config": {"index": 8260, "code_hash": null, "entity": [["tile_rc", "sp", [-1, 1, 4]], ["tile_f", "sp", [-1, 16]], ["tile_y", "sp", [-1, 5, 2]], ["tile_x", "sp", [-1, 1, 8]]]}, "result": [[0.0085925217], 0, 8.531033039093018, 1611209411.7264166], "version": 0.2, "tvm_version": "0.8.dev0"}
{"input": ["opencl -keys=opencl,gpu -max_num_threads=256", "tutorial/conv2d_no_batching", [1, 40, 40, 512, 256, 1, 1, [1, 1], [0, 0]], {}], "config": {"index": 9219, "code_hash": null, "entity": [["tile_rc", "sp", [-1, 1, 4]], ["tile_f", "sp", [-1, 32]], ["tile_y", "sp", [-1, 4, 2]], ["tile_x", "sp", [-1, 2, 8]]]}, "result": [[0.0055025682], 0, 11.507301092147827, 1611209414.6911778], "version": 0.2, "tvm_version": "0.8.dev0"}
{"input": ["opencl -keys=opencl,gpu -max_num_threads=256", "tutorial/conv2d_no_batching", [1, 40, 40, 512, 256, 1, 1, [1, 1], [0, 0]], {}], "config": {"index": 9156, "code_hash": null, "entity": [["tile_rc", "sp", [-1, 1, 4]], ["tile_f", "sp", [-1, 16]], ["tile_y", "sp", [-1, 2, 2]], ["tile_x", "sp", [-1, 2, 8]]]}, "result": [[0.0055284328], 0, 14.512754678726196, 1611209417.70826], "version": 0.2, "tvm_version": "0.8.dev0"}
{"input": ["opencl -keys=opencl,gpu -max_num_threads=256", "tutorial/conv2d_no_batching", [1, 40, 40, 512, 256, 1, 1, [1, 1], [0, 0]], {}], "config": {"index": 2100, "code_hash": null, "entity": [["tile_rc", "sp", [-1, 1, 4]], ["tile_f", "sp", [-1, 16]], ["tile_y", "sp", [-1, 2, 2]], ["tile_x", "sp", [-1, 4, 4]]]}, "result": [[0.0054044901], 0, 17.433436393737793, 1611209420.6474426], "version": 0.2, "tvm_version": "0.8.dev0"}
{"input": ["opencl -keys=opencl,gpu -max_num_threads=256", "tutorial/conv2d_no_batching", [1, 40, 40, 512, 256, 1, 1, [1, 1], [0, 0]], {}], "config": {"index": 3108, "code_hash": null, "entity": [["tile_rc", "sp", [-1, 1, 4]], ["tile_f", "sp", [-1, 16]], ["tile_y", "sp", [-1, 2, 2]], ["tile_x", "sp", [-1, 5, 4]]]}, "result": [[0.0070005944], 0, 23.603314876556396, 1611209426.8137608], "version": 0.2, "tvm_version": "0.8.dev0"}
{"input": ["opencl -keys=opencl,gpu -max_num_threads=256", "tutorial/conv2d_no_batching", [1, 40, 40, 512, 256, 1, 1, [1, 1], [0, 0]], {}], "config": {"index": 3059, "code_hash": null, "entity": [["tile_rc", "sp", [-1, 1, 4]], ["tile_f", "sp", [-1, 32]], ["tile_y", "sp", [-1, 1, 2]], ["tile_x", "sp", [-1, 5, 4]]]}, "result": [[0.0069202767], 0, 26.576892375946045, 1611209429.7880304], "version": 0.2, "tvm_version": "0.8.dev0"}
{"input": ["opencl -keys=opencl,gpu -max_num_threads=256", "tutorial/conv2d_no_batching", [1, 40, 40, 512, 256, 1, 1, [1, 1], [0, 0]], {}], "config": {"index": 2051, "code_hash": null, "entity": [["tile_rc", "sp", [-1, 1, 4]], ["tile_f", "sp", [-1, 32]], ["tile_y", "sp", [-1, 1, 2]], ["tile_x", "sp", [-1, 4, 4]]]}, "result": [[0.0053460318], 0, 35.807438135147095, 1611209439.0271957], "version": 0.2, "tvm_version": "0.8.dev0"}
{"input": ["opencl -keys=opencl,gpu -max_num_threads=256", "tutorial/conv2d_no_batching", [1, 40, 40, 512, 256, 1, 1, [1, 1], [0, 0]], {}], "config": {"index": 1050, "code_hash": null, "entity": [["tile_rc", "sp", [-1, 1, 4]], ["tile_f", "sp", [-1, 64]], ["tile_y", "sp", [-1, 1, 2]], ["tile_x", "sp", [-1, 2, 4]]]}, "result": [[0.0053419953], 0, 29.641342878341675, 1611209432.8672323], "version": 0.2, "tvm_version": "0.8.dev0"}
{"input": ["opencl -keys=opencl,gpu -max_num_threads=256", "tutorial/conv2d_no_batching", [1, 40, 40, 512, 256, 1, 1, [1, 1], [0, 0]], {}], "config": {"index": 8484, "code_hash": null, "entity": [["tile_rc", "sp", [-1, 1, 4]], ["tile_f", "sp", [-1, 16]], ["tile_y", "sp", [-1, 2, 4]], ["tile_x", "sp", [-1, 1, 8]]]}, "result": [[0.0120118084], 0, 32.83026909828186, 1611209436.0505843], "version": 0.2, "tvm_version": "0.8.dev0"}
{"input": ["opencl -keys=opencl,gpu -max_num_threads=256", "tutorial/conv2d_no_batching", [1, 40, 40, 512, 256, 1, 1, [1, 1], [0, 0]], {}], "config": {"index": 14308, "code_hash": null, "entity": [["tile_rc", "sp", [-1, 1, 4]], ["tile_f", "sp", [-1, 16]], ["tile_y", "sp", [-1, 5, 2]], ["tile_x", "sp", [-1, 1, 16]]]}, "result": [[0.009704277], 0, 38.91966485977173, 1611209442.1499276], "version": 0.2, "tvm_version": "0.8.dev0"}
{"input": ["opencl -keys=opencl,gpu -max_num_threads=256", "tutorial/conv2d_no_batching", [1, 40, 40, 512, 256, 1, 1, [1, 1], [0, 0]], {}], "config": {"index": 10164, "code_hash": null, "entity": [["tile_rc", "sp", [-1, 1, 4]], ["tile_f", "sp", [-1, 16]], ["tile_y", "sp", [-1, 2, 2]], ["tile_x", "sp", [-1, 4, 8]]]}, "result": [[0.0055283287], 0, 42.040048599243164, 1611209445.2801669], "version": 0.2, "tvm_version": "0.8.dev0"}
{"input": ["opencl -keys=opencl,gpu -max_num_threads=256", "tutorial/conv2d_no_batching", [1, 40, 40, 512, 256, 1, 1, [1, 1], [0, 0]], {}], "config": {"index": 9163, "code_hash": null, "entity": [["tile_rc", "sp", [-1, 1, 4]], ["tile_f", "sp", [-1, 32]], ["tile_y", "sp", [-1, 2, 2]], ["tile_x", "sp", [-1, 2, 8]]]}, "result": [[0.0056033495], 0, 48.06271576881409, 1611209451.3106742], "version": 0.2, "tvm_version": "0.8.dev0"}
{"input": ["opencl -keys=opencl,gpu -max_num_threads=256", "tutorial/conv2d_no_batching", [1, 40, 40, 512, 256, 1, 1, [1, 1], [0, 0]], {}], "config": {"index": 15316, "code_hash": null, "entity": [["tile_rc", "sp", [-1, 1, 4]], ["tile_f", "sp", [-1, 16]], ["tile_y", "sp", [-1, 5, 2]], ["tile_x", "sp", [-1, 2, 16]]]}, "result": [[0.0074524747], 0, 45.08606505393982, 1611209448.3393016], "version": 0.2, "tvm_version": "0.8.dev0"}
{"input": ["opencl -keys=opencl,gpu -max_num_threads=256", "tutorial/conv2d_no_batching", [1, 40, 40, 512, 256, 1, 1, [1, 1], [0, 0]], {}], "config": {"index": 10255, "code_hash": null, "entity": [["tile_rc", "sp", [-1, 1, 4]], ["tile_f", "sp", [-1, 2]], ["tile_y", "sp", [-1, 5, 2]], ["tile_x", "sp", [-1, 4, 8]]]}, "result": [[0.0087062821], 0, 2.614152669906616, 1611209454.9360633], "version": 0.2, "tvm_version": "0.8.dev0"}
{"input": ["opencl -keys=opencl,gpu -max_num_threads=256", "tutorial/conv2d_no_batching", [1, 40, 40, 512, 256, 1, 1, [1, 1], [0, 0]], {}], "config": {"index": 595, "code_hash": null, "entity": [["tile_rc", "sp", [-1, 1, 4]], ["tile_f", "sp", [-1, 32]], ["tile_y", "sp", [-1, 1, 8]], ["tile_x", "sp", [-1, 1, 4]]]}, "result": [[0.012080121000000001], 0, 5.8104588985443115, 1611209458.1163948], "version": 0.2, "tvm_version": "0.8.dev0"}
{"input": ["opencl -keys=opencl,gpu -max_num_threads=256", "tutorial/conv2d_no_batching", [1, 40, 40, 512, 256, 1, 1, [1, 1], [0, 0]], {}], "config": {"index": 4095, "code_hash": null, "entity": [["tile_rc", "sp", [-1, 1, 4]], ["tile_f", "sp", [-1, 2]], ["tile_y", "sp", [-1, 2, 2]], ["tile_x", "sp", [-1, 8, 4]]]}, "result": [[0.013459699299999999], 0, 11.987646341323853, 1611209464.3153708], "version": 0.2, "tvm_version": "0.8.dev0"}
{"input": ["opencl -keys=opencl,gpu -max_num_threads=256", "tutorial/conv2d_no_batching", [1, 40, 40, 512, 256, 1, 1, [1, 1], [0, 0]], {}], "config": {"index": 378, "code_hash": null, "entity": [["tile_rc", "sp", [-1, 1, 4]], ["tile_f", "sp", [-1, 64]], ["tile_y", "sp", [-1, 1, 4]], ["tile_x", "sp", [-1, 1, 4]]]}, "result": [[0.005515188], 0, 8.816087007522583, 1611209461.14755], "version": 0.2, "tvm_version": "0.8.dev0"}
{"input": ["opencl -keys=opencl,gpu -max_num_threads=256", "tutorial/conv2d_no_batching", [1, 40, 40, 512, 256, 1, 1, [1, 1], [0, 0]], {}], "config": {"index": 91, "code_hash": null, "entity": [["tile_rc", "sp", [-1, 1, 4]], ["tile_f", "sp", [-1, 32]], ["tile_y", "sp", [-1, 2, 2]], ["tile_x", "sp", [-1, 1, 4]]]}, "result": [[0.0071028288], 0, 14.942312479019165, 1611209467.2596326], "version": 0.2, "tvm_version": "0.8.dev0"}
{"input": ["opencl -keys=opencl,gpu -max_num_threads=256", "tutorial/conv2d_no_batching", [1, 40, 40, 512, 256, 1, 1, [1, 1], [0, 0]], {}], "config": {"index": 18179, "code_hash": null, "entity": [["tile_rc", "sp", [-1, 1, 4]], ["tile_f", "sp", [-1, 32]], ["tile_y", "sp", [-1, 1, 2]], ["tile_x", "sp", [-1, 1, 20]]]}, "result": [[0.0300667425], 0, 18.72804284095764, 1611209471.062203], "version": 0.2, "tvm_version": "0.8.dev0"}
{"input": ["opencl -keys=opencl,gpu -max_num_threads=256", "tutorial/conv2d_no_batching", [1, 40, 40, 512, 256, 1, 1, [1, 1], [0, 0]], {}], "config": {"index": 1435, "code_hash": null, "entity": [["tile_rc", "sp", [-1, 1, 4]], ["tile_f", "sp", [-1, 32]], ["tile_y", "sp", [-1, 2, 4]], ["tile_x", "sp", [-1, 2, 4]]]}, "result": [[0.005458735], 0, 21.787426233291626, 1611209474.1338036], "version": 0.2, "tvm_version": "0.8.dev0"}
{"input": ["opencl -keys=opencl,gpu -max_num_threads=256", "tutorial/conv2d_no_batching", [1, 40, 40, 512, 256, 1, 1, [1, 1], [0, 0]], {}], "config": {"index": 2436, "code_hash": null, "entity": [["tile_rc", "sp", [-1, 1, 4]], ["tile_f", "sp", [-1, 16]], ["tile_y", "sp", [-1, 2, 4]], ["tile_x", "sp", [-1, 4, 4]]]}, "result": [[0.0054694901], 0, 24.75430727005005, 1611209477.098573], "version": 0.2, "tvm_version": "0.8.dev0"}
{"input": ["opencl -keys=opencl,gpu -max_num_threads=256", "tutorial/conv2d_no_batching", [1, 40, 40, 512, 256, 1, 1, [1, 1], [0, 0]], {}], "config": {"index": 10108, "code_hash": null, "entity": [["tile_rc", "sp", [-1, 1, 4]], ["tile_f", "sp", [-1, 16]], ["tile_y", "sp", [-1, 1, 2]], ["tile_x", "sp", [-1, 4, 8]]]}, "result": [[0.0054825839], 0, 27.68894624710083, 1611209480.0433023], "version": 0.2, "tvm_version": "0.8.dev0"}
{"input": ["opencl -keys=opencl,gpu -max_num_threads=256", "tutorial/conv2d_no_batching", [1, 40, 40, 512, 256, 1, 1, [1, 1], [0, 0]], {}], "config": {"index": 14203, "code_hash": null, "entity": [["tile_rc", "sp", [-1, 1, 4]], ["tile_f", "sp", [-1, 32]], ["tile_y", "sp", [-1, 2, 2]], ["tile_x", "sp", [-1, 1, 16]]]}, "result": [[0.0062882246000000004], 0, 30.698563814163208, 1611209483.0497892], "version": 0.2, "tvm_version": "0.8.dev0"}
{"input": ["opencl -keys=opencl,gpu -max_num_threads=256", "tutorial/conv2d_no_batching", [1, 40, 40, 512, 256, 1, 1, [1, 1], [0, 0]], {}], "config": {"index": 10101, "code_hash": null, "entity": [["tile_rc", "sp", [-1, 1, 4]], ["tile_f", "sp", [-1, 8]], ["tile_y", "sp", [-1, 1, 2]], ["tile_x", "sp", [-1, 4, 8]]]}, "result": [[0.0106334906], 0, 33.85256314277649, 1611209486.2160454], "version": 0.2, "tvm_version": "0.8.dev0"}
{"input": ["opencl -keys=opencl,gpu -max_num_threads=256", "tutorial/conv2d_no_batching", [1, 40, 40, 512, 256, 1, 1, [1, 1], [0, 0]], {}], "config": {"index": 420, "code_hash": null, "entity": [["tile_rc", "sp", [-1, 1, 4]], ["tile_f", "sp", [-1, 16]], ["tile_y", "sp", [-1, 2, 4]], ["tile_x", "sp", [-1, 1, 4]]]}, "result": [[0.0105308292], 0, 37.055415630340576, 1611209489.4206197], "version": 0.2, "tvm_version": "0.8.dev0"}
{"input": ["opencl -keys=opencl,gpu -max_num_threads=256", "tutorial/conv2d_no_batching", [1, 40, 40, 512, 256, 1, 1, [1, 1], [0, 0]], {}], "config": {"index": 10150, "code_hash": null, "entity": [["tile_rc", "sp", [-1, 1, 4]], ["tile_f", "sp", [-1, 4]], ["tile_y", "sp", [-1, 2, 2]], ["tile_x", "sp", [-1, 4, 8]]]}, "result": [[0.0106368032], 0, 40.22617816925049, 1611209492.6041496], "version": 0.2, "tvm_version": "0.8.dev0"}
{"input": ["opencl -keys=opencl,gpu -max_num_threads=256", "tutorial/conv2d_no_batching", [1, 40, 40, 512, 256, 1, 1, [1, 1], [0, 0]], {}], "config": {"index": 3532, "code_hash": null, "entity": [["tile_rc", "sp", [-1, 16, 4]], ["tile_f", "sp", [-1, 1]], ["tile_y", "sp", [-1, 10, 4]], ["tile_x", "sp", [-1, 5, 4]]]}, "result": [[0.0882465401], 0, 57.608768939971924, 1611209509.9817636], "version": 0.2, "tvm_version": "0.8.dev0"}
{"input": ["opencl -keys=opencl,gpu -max_num_threads=256", "tutorial/conv2d_no_batching", [1, 40, 40, 512, 256, 1, 1, [1, 1], [0, 0]], {}], "config": {"index": 1057, "code_hash": null, "entity": [["tile_rc", "sp", [-1, 1, 4]], ["tile_f", "sp", [-1, 128]], ["tile_y", "sp", [-1, 1, 2]], ["tile_x", "sp", [-1, 2, 4]]]}, "result": [[0.005322813], 0, 2.576321840286255, 1611209517.1795788], "version": 0.2, "tvm_version": "0.8.dev0"}
{"input": ["opencl -keys=opencl,gpu -max_num_threads=256", "tutorial/conv2d_no_batching", [1, 40, 40, 512, 256, 1, 1, [1, 1], [0, 0]], {}], "config": {"index": 1113, "code_hash": null, "entity": [["tile_rc", "sp", [-1, 1, 4]], ["tile_f", "sp", [-1, 128]], ["tile_y", "sp", [-1, 2, 2]], ["tile_x", "sp", [-1, 2, 4]]]}, "result": [[0.0052803338], 0, 5.520020484924316, 1611209520.1695862], "version": 0.2, "tvm_version": "0.8.dev0"}
{"input": ["opencl -keys=opencl,gpu -max_num_threads=256", "tutorial/conv2d_no_batching", [1, 40, 40, 512, 256, 1, 1, [1, 1], [0, 0]], {}], "config": {"index": 1162, "code_hash": null, "entity": [["tile_rc", "sp", [-1, 1, 4]], ["tile_f", "sp", [-1, 64]], ["tile_y", "sp", [-1, 4, 2]], ["tile_x", "sp", [-1, 2, 4]]]}, "result": [[0.0053425839000000004], 0, 12.247074604034424, 1611209526.8967478], "version": 0.2, "tvm_version": "0.8.dev0"}
{"input": ["opencl -keys=opencl,gpu -max_num_threads=256", "tutorial/conv2d_no_batching", [1, 40, 40, 512, 256, 1, 1, [1, 1], [0, 0]], {}], "config": {"index": 1114, "code_hash": null, "entity": [["tile_rc", "sp", [-1, 2, 4]], ["tile_f", "sp", [-1, 128]], ["tile_y", "sp", [-1, 2, 2]], ["tile_x", "sp", [-1, 2, 4]]]}, "result": [[0.0312594718], 0, 9.280755519866943, 1611209523.919905], "version": 0.2, "tvm_version": "0.8.dev0"}
{"input": ["opencl -keys=opencl,gpu -max_num_threads=256", "tutorial/conv2d_no_batching", [1, 40, 40, 512, 256, 1, 1, [1, 1], [0, 0]], {}], "config": {"index": 2058, "code_hash": null, "entity": [["tile_rc", "sp", [-1, 1, 4]], ["tile_f", "sp", [-1, 64]], ["tile_y", "sp", [-1, 1, 2]], ["tile_x", "sp", [-1, 4, 4]]]}, "result": [[0.0053280891], 0, 30.10533332824707, 1611209544.7482905], "version": 0.2, "tvm_version": "0.8.dev0"}
{"input": ["opencl -keys=opencl,gpu -max_num_threads=256", "tutorial/conv2d_no_batching", [1, 40, 40, 512, 256, 1, 1, [1, 1], [0, 0]], {}], "config": {"index": 2065, "code_hash": null, "entity": [["tile_rc", "sp", [-1, 1, 4]], ["tile_f", "sp", [-1, 128]], ["tile_y", "sp", [-1, 1, 2]], ["tile_x", "sp", [-1, 4, 4]]]}, "result": [[0.0053221933], 0, 15.159012794494629, 1611209529.837268], "version": 0.2, "tvm_version": "0.8.dev0"}
{"input": ["opencl -keys=opencl,gpu -max_num_threads=256", "tutorial/conv2d_no_batching", [1, 40, 40, 512, 256, 1, 1, [1, 1], [0, 0]], {}], "config": {"index": 2114, "code_hash": null, "entity": [["tile_rc", "sp", [-1, 1, 4]], ["tile_f", "sp", [-1, 64]], ["tile_y", "sp", [-1, 2, 2]], ["tile_x", "sp", [-1, 4, 4]]]}, "result": [[0.0053300318], 0, 21.27027702331543, 1611209535.945183], "version": 0.2, "tvm_version": "0.8.dev0"}
{"input": ["opencl -keys=opencl,gpu -max_num_threads=256", "tutorial/conv2d_no_batching", [1, 40, 40, 512, 256, 1, 1, [1, 1], [0, 0]], {}], "config": {"index": 1386, "code_hash": null, "entity": [["tile_rc", "sp", [-1, 1, 4]], ["tile_f", "sp", [-1, 64]], ["tile_y", "sp", [-1, 1, 4]], ["tile_x", "sp", [-1, 2, 4]]]}, "result": [[0.0054578703], 0, 18.189483880996704, 1611209532.867884], "version": 0.2, "tvm_version": "0.8.dev0"}
{"input": ["opencl -keys=opencl,gpu -max_num_threads=256", "tutorial/conv2d_no_batching", [1, 40, 40, 512, 256, 1, 1, [1, 1], [0, 0]], {}], "config": {"index": 8162, "code_hash": null, "entity": [["tile_rc", "sp", [-1, 1, 4]], ["tile_f", "sp", [-1, 64]], ["tile_y", "sp", [-1, 2, 2]], ["tile_x", "sp", [-1, 1, 8]]]}, "result": [[0.0054853651], 0, 24.187745094299316, 1611209538.892889], "version": 0.2, "tvm_version": "0.8.dev0"}
{"input": ["opencl -keys=opencl,gpu -max_num_threads=256", "tutorial/conv2d_no_batching", [1, 40, 40, 512, 256, 1, 1, [1, 1], [0, 0]], {}], "config": {"index": 4060, "code_hash": null, "entity": [["tile_rc", "sp", [-1, 1, 4]], ["tile_f", "sp", [-1, 16]], ["tile_y", "sp", [-1, 1, 2]], ["tile_x", "sp", [-1, 8, 4]]]}, "result": [[0.0053214329], 0, 27.088112354278564, 1611209541.8160617], "version": 0.2, "tvm_version": "0.8.dev0"}
{"input": ["opencl -keys=opencl,gpu -max_num_threads=256", "tutorial/conv2d_no_batching", [1, 40, 40, 512, 256, 1, 1, [1, 1], [0, 0]], {}], "config": {"index": 105, "code_hash": null, "entity": [["tile_rc", "sp", [-1, 1, 4]], ["tile_f", "sp", [-1, 128]], ["tile_y", "sp", [-1, 2, 2]], ["tile_x", "sp", [-1, 1, 4]]]}, "result": [[0.0053846776], 0, 32.984813928604126, 1611209547.7022808], "version": 0.2, "tvm_version": "0.8.dev0"}
{"input": ["opencl -keys=opencl,gpu -max_num_threads=256", "tutorial/conv2d_no_batching", [1, 40, 40, 512, 256, 1, 1, [1, 1], [0, 0]], {}], "config": {"index": 8218, "code_hash": null, "entity": [["tile_rc", "sp", [-1, 1, 4]], ["tile_f", "sp", [-1, 64]], ["tile_y", "sp", [-1, 4, 2]], ["tile_x", "sp", [-1, 1, 8]]]}, "result": [[0.005503912], 0, 42.061930894851685, 1611209556.7939303], "version": 0.2, "tvm_version": "0.8.dev0"}
{"input": ["opencl -keys=opencl,gpu -max_num_threads=256", "tutorial/conv2d_no_batching", [1, 40, 40, 512, 256, 1, 1, [1, 1], [0, 0]], {}], "config": {"index": 1155, "code_hash": null, "entity": [["tile_rc", "sp", [-1, 1, 4]], ["tile_f", "sp", [-1, 32]], ["tile_y", "sp", [-1, 4, 2]], ["tile_x", "sp", [-1, 2, 4]]]}, "result": [[0.0053342089], 0, 36.02619481086731, 1611209550.7752569], "version": 0.2, "tvm_version": "0.8.dev0"}
{"input": ["opencl -keys=opencl,gpu -max_num_threads=256", "tutorial/conv2d_no_batching", [1, 40, 40, 512, 256, 1, 1, [1, 1], [0, 0]], {}], "config": {"index": 2121, "code_hash": null, "entity": [["tile_rc", "sp", [-1, 1, 4]], ["tile_f", "sp", [-1, 128]], ["tile_y", "sp", [-1, 2, 2]], ["tile_x", "sp", [-1, 4, 4]]]}, "result": [[0.0052719797], 0, 39.02497339248657, 1611209553.790341], "version": 0.2, "tvm_version": "0.8.dev0"}
{"input": ["opencl -keys=opencl,gpu -max_num_threads=256", "tutorial/conv2d_no_batching", [1, 40, 40, 512, 256, 1, 1, [1, 1], [0, 0]], {}], "config": {"index": 154, "code_hash": null, "entity": [["tile_rc", "sp", [-1, 1, 4]], ["tile_f", "sp", [-1, 64]], ["tile_y", "sp", [-1, 4, 2]], ["tile_x", "sp", [-1, 1, 4]]]}, "result": [[0.0053465734000000004], 0, 44.929028034210205, 1611209559.7036784], "version": 0.2, "tvm_version": "0.8.dev0"}
{"input": ["opencl -keys=opencl,gpu -max_num_threads=256", "tutorial/conv2d_no_batching", [1, 40, 40, 512, 256, 1, 1, [1, 1], [0, 0]], {}], "config": {"index": 3073, "code_hash": null, "entity": [["tile_rc", "sp", [-1, 1, 4]], ["tile_f", "sp", [-1, 128]], ["tile_y", "sp", [-1, 1, 2]], ["tile_x", "sp", [-1, 5, 4]]]}, "result": [[0.0052807297], 0, 47.8209011554718, 1611209562.609004], "version": 0.2, "tvm_version": "0.8.dev0"}
{"input": ["opencl -keys=opencl,gpu -max_num_threads=256", "tutorial/conv2d_no_batching", [1, 40, 40, 512, 256, 1, 1, [1, 1], [0, 0]], {}], "config": {"index": 2122, "code_hash": null, "entity": [["tile_rc", "sp", [-1, 2, 4]], ["tile_f", "sp", [-1, 128]], ["tile_y", "sp", [-1, 2, 2]], ["tile_x", "sp", [-1, 4, 4]]]}, "result": [[0.030368930100000004], 0, 3.3607332706451416, 1611209566.8058558], "version": 0.2, "tvm_version": "0.8.dev0"}
{"input": ["opencl -keys=opencl,gpu -max_num_threads=256", "tutorial/conv2d_no_batching", [1, 40, 40, 512, 256, 1, 1, [1, 1], [0, 0]], {}], "config": {"index": 1169, "code_hash": null, "entity": [["tile_rc", "sp", [-1, 1, 4]], ["tile_f", "sp", [-1, 128]], ["tile_y", "sp", [-1, 4, 2]], ["tile_x", "sp", [-1, 2, 4]]]}, "result": [[0.0052534329], 0, 6.257930755615234, 1611209569.7045994], "version": 0.2, "tvm_version": "0.8.dev0"}
{"input": ["opencl -keys=opencl,gpu -max_num_threads=256", "tutorial/conv2d_no_batching", [1, 40, 40, 512, 256, 1, 1, [1, 1], [0, 0]], {}], "config": {"index": 1170, "code_hash": null, "entity": [["tile_rc", "sp", [-1, 2, 4]], ["tile_f", "sp", [-1, 128]], ["tile_y", "sp", [-1, 4, 2]], ["tile_x", "sp", [-1, 2, 4]]]}, "result": [[0.031073023900000003], 0, 10.035509824752808, 1611209573.4857063], "version": 0.2, "tvm_version": "0.8.dev0"}
{"input": ["opencl -keys=opencl,gpu -max_num_threads=256", "tutorial/conv2d_no_batching", [1, 40, 40, 512, 256, 1, 1, [1, 1], [0, 0]], {}], "config": {"index": 4074, "code_hash": null, "entity": [["tile_rc", "sp", [-1, 1, 4]], ["tile_f", "sp", [-1, 64]], ["tile_y", "sp", [-1, 1, 2]], ["tile_x", "sp", [-1, 8, 4]]]}, "result": [[0.0052691568], 0, 12.91484022140503, 1611209576.3869734], "version": 0.2, "tvm_version": "0.8.dev0"}
{"input": ["opencl -keys=opencl,gpu -max_num_threads=256", "tutorial/conv2d_no_batching", [1, 40, 40, 512, 256, 1, 1, [1, 1], [0, 0]], {}], "config": {"index": 2066, "code_hash": null, "entity": [["tile_rc", "sp", [-1, 2, 4]], ["tile_f", "sp", [-1, 128]], ["tile_y", "sp", [-1, 1, 2]], ["tile_x", "sp", [-1, 4, 4]]]}, "result": [[0.030474758299999998], 0, 16.704559087753296, 1611209580.1593244], "version": 0.2, "tvm_version": "0.8.dev0"}
{"input": ["opencl -keys=opencl,gpu -max_num_threads=256", "tutorial/conv2d_no_batching", [1, 40, 40, 512, 256, 1, 1, [1, 1], [0, 0]], {}], "config": {"index": 1442, "code_hash": null, "entity": [["tile_rc", "sp", [-1, 1, 4]], ["tile_f", "sp", [-1, 64]], ["tile_y", "sp", [-1, 2, 4]], ["tile_x", "sp", [-1, 2, 4]]]}, "result": [[0.005409037], 0, 19.723609685897827, 1611209583.1829965], "version": 0.2, "tvm_version": "0.8.dev0"}
{"input": ["opencl -keys=opencl,gpu -max_num_threads=256", "tutorial/conv2d_no_batching", [1, 40, 40, 512, 256, 1, 1, [1, 1], [0, 0]], {}], "config": {"index": 3066, "code_hash": null, "entity": [["tile_rc", "sp", [-1, 1, 4]], ["tile_f", "sp", [-1, 64]], ["tile_y", "sp", [-1, 1, 2]], ["tile_x", "sp", [-1, 5, 4]]]}, "result": [[0.0062451934], 0, 22.7070095539093, 1611209586.178668], "version": 0.2, "tvm_version": "0.8.dev0"}
{"input": ["opencl -keys=opencl,gpu -max_num_threads=256", "tutorial/conv2d_no_batching", [1, 40, 40, 512, 256, 1, 1, [1, 1], [0, 0]], {}], "config": {"index": 49, "code_hash": null, "entity": [["tile_rc", "sp", [-1, 1, 4]], ["tile_f", "sp", [-1, 128]], ["tile_y", "sp", [-1, 1, 2]], ["tile_x", "sp", [-1, 1, 4]]]}, "result": [[0.0062861516000000004], 0, 25.641378164291382, 1611209589.110406], "version": 0.2, "tvm_version": "0.8.dev0"}
{"input": ["opencl -keys=opencl,gpu -max_num_threads=256", "tutorial/conv2d_no_batching", [1, 40, 40, 512, 256, 1, 1, [1, 1], [0, 0]], {}], "config": {"index": 1148, "code_hash": null, "entity": [["tile_rc", "sp", [-1, 1, 4]], ["tile_f", "sp", [-1, 16]], ["tile_y", "sp", [-1, 4, 2]], ["tile_x", "sp", [-1, 2, 4]]]}, "result": [[0.0053813756], 0, 28.634990215301514, 1611209592.1230726], "version": 0.2, "tvm_version": "0.8.dev0"}
{"input": ["opencl -keys=opencl,gpu -max_num_threads=256", "tutorial/conv2d_no_batching", [1, 40, 40, 512, 256, 1, 1, [1, 1], [0, 0]], {}], "config": {"index": 2115, "code_hash": null, "entity": [["tile_rc", "sp", [-1, 2, 4]], ["tile_f", "sp", [-1, 64]], ["tile_y", "sp", [-1, 2, 2]], ["tile_x", "sp", [-1, 4, 4]]]}, "result": [[0.0303218312], 0, 32.40484118461609, 1611209595.9002974], "version": 0.2, "tvm_version": "0.8.dev0"}
{"input": ["opencl -keys=opencl,gpu -max_num_threads=256", "tutorial/conv2d_no_batching", [1, 40, 40, 512, 256, 1, 1, [1, 1], [0, 0]], {}], "config": {"index": 1163, "code_hash": null, "entity": [["tile_rc", "sp", [-1, 2, 4]], ["tile_f", "sp", [-1, 64]], ["tile_y", "sp", [-1, 4, 2]], ["tile_x", "sp", [-1, 2, 4]]]}, "result": [[0.030908893700000002], 0, 36.20592164993286, 1611209599.698408], "version": 0.2, "tvm_version": "0.8.dev0"}
{"input": ["opencl -keys=opencl,gpu -max_num_threads=256", "tutorial/conv2d_no_batching", [1, 40, 40, 512, 256, 1, 1, [1, 1], [0, 0]], {}], "config": {"index": 9170, "code_hash": null, "entity": [["tile_rc", "sp", [-1, 1, 4]], ["tile_f", "sp", [-1, 64]], ["tile_y", "sp", [-1, 2, 2]], ["tile_x", "sp", [-1, 2, 8]]]}, "result": [[0.0054571099], 0, 39.2160222530365, 1611209602.7111182], "version": 0.2, "tvm_version": "0.8.dev0"}
{"input": ["opencl -keys=opencl,gpu -max_num_threads=256", "tutorial/conv2d_no_batching", [1, 40, 40, 512, 256, 1, 1, [1, 1], [0, 0]], {}], "config": {"index": 2394, "code_hash": null, "entity": [["tile_rc", "sp", [-1, 1, 4]], ["tile_f", "sp", [-1, 64]], ["tile_y", "sp", [-1, 1, 4]], ["tile_x", "sp", [-1, 4, 4]]]}, "result": [[0.0054468235], 0, 45.210938930511475, 1611209608.7224436], "version": 0.2, "tvm_version": "0.8.dev0"}
{"input": ["opencl -keys=opencl,gpu -max_num_threads=256", "tutorial/conv2d_no_batching", [1, 40, 40, 512, 256, 1, 1, [1, 1], [0, 0]], {}], "config": {"index": 161, "code_hash": null, "entity": [["tile_rc", "sp", [-1, 1, 4]], ["tile_f", "sp", [-1, 128]], ["tile_y", "sp", [-1, 4, 2]], ["tile_x", "sp", [-1, 1, 4]]]}, "result": [[0.0053320631], 0, 48.10844540596008, 1611209611.6218011], "version": 0.2, "tvm_version": "0.8.dev0"}
{"input": ["opencl -keys=opencl,gpu -max_num_threads=256", "tutorial/conv2d_no_batching", [1, 40, 40, 512, 256, 1, 1, [1, 1], [0, 0]], {}], "config": {"index": 210, "code_hash": null, "entity": [["tile_rc", "sp", [-1, 1, 4]], ["tile_f", "sp", [-1, 64]], ["tile_y", "sp", [-1, 5, 2]], ["tile_x", "sp", [-1, 1, 4]]]}, "result": [[0.006264958900000001], 0, 42.193098068237305, 1611209605.7202358], "version": 0.2, "tvm_version": "0.8.dev0"}
{"input": ["opencl -keys=opencl,gpu -max_num_threads=256", "tutorial/conv2d_no_batching", [1, 40, 40, 512, 256, 1, 1, [1, 1], [0, 0]], {}], "config": {"index": 434, "code_hash": null, "entity": [["tile_rc", "sp", [-1, 1, 4]], ["tile_f", "sp", [-1, 64]], ["tile_y", "sp", [-1, 2, 4]], ["tile_x", "sp", [-1, 1, 4]]]}, "result": [[0.0054828546999999995], 0, 2.5162289142608643, 1611209614.9834685], "version": 0.2, "tvm_version": "0.8.dev0"}
{"input": ["opencl -keys=opencl,gpu -max_num_threads=256", "tutorial/conv2d_no_batching", [1, 40, 40, 512, 256, 1, 1, [1, 1], [0, 0]], {}], "config": {"index": 4067, "code_hash": null, "entity": [["tile_rc", "sp", [-1, 1, 4]], ["tile_f", "sp", [-1, 32]], ["tile_y", "sp", [-1, 1, 2]], ["tile_x", "sp", [-1, 8, 4]]]}, "result": [[0.0052719537], 0, 5.41644287109375, 1611209617.8977704], "version": 0.2, "tvm_version": "0.8.dev0"}
{"input": ["opencl -keys=opencl,gpu -max_num_threads=256", "tutorial/conv2d_no_batching", [1, 40, 40, 512, 256, 1, 1, [1, 1], [0, 0]], {}], "config": {"index": 1218, "code_hash": null, "entity": [["tile_rc", "sp", [-1, 1, 4]], ["tile_f", "sp", [-1, 64]], ["tile_y", "sp", [-1, 5, 2]], ["tile_x", "sp", [-1, 2, 4]]]}, "result": [[0.005260313], 0, 8.368472337722778, 1611209620.8362284], "version": 0.2, "tvm_version": "0.8.dev0"}
{"input": ["opencl -keys=opencl,gpu -max_num_threads=256", "tutorial/conv2d_no_batching", [1, 40, 40, 512, 256, 1, 1, [1, 1], [0, 0]], {}], "config": {"index": 1058, "code_hash": null, "entity": [["tile_rc", "sp", [-1, 2, 4]], ["tile_f", "sp", [-1, 128]], ["tile_y", "sp", [-1, 1, 2]], ["tile_x", "sp", [-1, 2, 4]]]}, "result": [[0.031636419799999996], 0, 12.120112895965576, 1611209624.6013966], "version": 0.2, "tvm_version": "0.8.dev0"}
{"input": ["opencl -keys=opencl,gpu -max_num_threads=256", "tutorial/conv2d_no_batching", [1, 40, 40, 512, 256, 1, 1, [1, 1], [0, 0]], {}], "config": {"index": 2387, "code_hash": null, "entity": [["tile_rc", "sp", [-1, 1, 4]], ["tile_f", "sp", [-1, 32]], ["tile_y", "sp", [-1, 1, 4]], ["tile_x", "sp", [-1, 4, 4]]]}, "result": [[0.0054446984], 0, 15.188815355300903, 1611209627.660479], "version": 0.2, "tvm_version": "0.8.dev0"}
{"input": ["opencl -keys=opencl,gpu -max_num_threads=256", "tutorial/conv2d_no_batching", [1, 40, 40, 512, 256, 1, 1, [1, 1], [0, 0]], {}], "config": {"index": 2044, "code_hash": null, "entity": [["tile_rc", "sp", [-1, 1, 4]], ["tile_f", "sp", [-1, 16]], ["tile_y", "sp", [-1, 1, 2]], ["tile_x", "sp", [-1, 4, 4]]]}, "result": [[0.0069962559], 0, 18.11544132232666, 1611209630.6013863], "version": 0.2, "tvm_version": "0.8.dev0"}
{"input": ["opencl -keys=opencl,gpu -max_num_threads=256", "tutorial/conv2d_no_batching", [1, 40, 40, 512, 256, 1, 1, [1, 1], [0, 0]], {}], "config": {"index": 2108, "code_hash": null, "entity": [["tile_rc", "sp", [-1, 2, 4]], ["tile_f", "sp", [-1, 32]], ["tile_y", "sp", [-1, 2, 2]], ["tile_x", "sp", [-1, 4, 4]]]}, "result": [[0.030321503], 0, 21.823346853256226, 1611209634.3055294], "version": 0.2, "tvm_version": "0.8.dev0"}
{"input": ["opencl -keys=opencl,gpu -max_num_threads=256", "tutorial/conv2d_no_batching", [1, 40, 40, 512, 256, 1, 1, [1, 1], [0, 0]], {}], "config": {"index": 4082, "code_hash": null, "entity": [["tile_rc", "sp", [-1, 2, 4]], ["tile_f", "sp", [-1, 128]], ["tile_y", "sp", [-1, 1, 2]], ["tile_x", "sp", [-1, 8, 4]]]}, "result": [[0.030344591599999998], 0, 25.513925790786743, 1611209638.0100355], "version": 0.2, "tvm_version": "0.8.dev0"}
{"input": ["opencl -keys=opencl,gpu -max_num_threads=256", "tutorial/conv2d_no_batching", [1, 40, 40, 512, 256, 1, 1, [1, 1], [0, 0]], {}], "config": {"index": 1393, "code_hash": null, "entity": [["tile_rc", "sp", [-1, 1, 4]], ["tile_f", "sp", [-1, 128]], ["tile_y", "sp", [-1, 1, 4]], ["tile_x", "sp", [-1, 2, 4]]]}, "result": [[0.0054711932], 0, 35.24719214439392, 1611209647.7516015], "version": 0.2, "tvm_version": "0.8.dev0"}
{"input": ["opencl -keys=opencl,gpu -max_num_threads=256", "tutorial/conv2d_no_batching", [1, 40, 40, 512, 256, 1, 1, [1, 1], [0, 0]], {}], "config": {"index": 4172, "code_hash": null, "entity": [["tile_rc", "sp", [-1, 1, 4]], ["tile_f", "sp", [-1, 16]], ["tile_y", "sp", [-1, 4, 2]], ["tile_x", "sp", [-1, 8, 4]]]}, "result": [[0.0053341672], 0, 28.435137510299683, 1611209640.9370065], "version": 0.2, "tvm_version": "0.8.dev0"}
{"input": ["opencl -keys=opencl,gpu -max_num_threads=256", "tutorial/conv2d_no_batching", [1, 40, 40, 512, 256, 1, 1, [1, 1], [0, 0]], {}], "config": {"index": 1107, "code_hash": null, "entity": [["tile_rc", "sp", [-1, 2, 4]], ["tile_f", "sp", [-1, 64]], ["tile_y", "sp", [-1, 2, 2]], ["tile_x", "sp", [-1, 2, 4]]]}, "result": [[0.031081706199999996], 0, 32.200623989105225, 1611209644.711814], "version": 0.2, "tvm_version": "0.8.dev0"}
{"input": ["opencl -keys=opencl,gpu -max_num_threads=256", "tutorial/conv2d_no_batching", [1, 40, 40, 512, 256, 1, 1, [1, 1], [0, 0]], {}], "config": {"index": 4123, "code_hash": null, "entity": [["tile_rc", "sp", [-1, 1, 4]], ["tile_f", "sp", [-1, 32]], ["tile_y", "sp", [-1, 2, 2]], ["tile_x", "sp", [-1, 8, 4]]]}, "result": [[0.0053438806999999994], 0, 38.30507159233093, 1611209650.8238566], "version": 0.2, "tvm_version": "0.8.dev0"}
{"input": ["opencl -keys=opencl,gpu -max_num_threads=256", "tutorial/conv2d_no_batching", [1, 40, 40, 512, 256, 1, 1, [1, 1], [0, 0]], {}], "config": {"index": 2163, "code_hash": null, "entity": [["tile_rc", "sp", [-1, 1, 4]], ["tile_f", "sp", [-1, 32]], ["tile_y", "sp", [-1, 4, 2]], ["tile_x", "sp", [-1, 4, 4]]]}, "result": [[0.0053457453], 0, 41.19671583175659, 1611209653.7214427], "version": 0.2, "tvm_version": "0.8.dev0"}
{"input": ["opencl -keys=opencl,gpu -max_num_threads=256", "tutorial/conv2d_no_batching", [1, 40, 40, 512, 256, 1, 1, [1, 1], [0, 0]], {}], "config": {"index": 1043, "code_hash": null, "entity": [["tile_rc", "sp", [-1, 1, 4]], ["tile_f", "sp", [-1, 32]], ["tile_y", "sp", [-1, 1, 2]], ["tile_x", "sp", [-1, 2, 4]]]}, "result": [[0.0070316934], 0, 44.15765571594238, 1611209656.6880786], "version": 0.2, "tvm_version": "0.8.dev0"}
{"input": ["opencl -keys=opencl,gpu -max_num_threads=256", "tutorial/conv2d_no_batching", [1, 40, 40, 512, 256, 1, 1, [1, 1], [0, 0]], {}], "config": {"index": 217, "code_hash": null, "entity": [["tile_rc", "sp", [-1, 1, 4]], ["tile_f", "sp", [-1, 128]], ["tile_y", "sp", [-1, 5, 2]], ["tile_x", "sp", [-1, 1, 4]]]}, "result": [[0.0053515682], 0, 47.04972577095032, 1611209659.595655], "version": 0.2, "tvm_version": "0.8.dev0"}
{"input": ["opencl -keys=opencl,gpu -max_num_threads=256", "tutorial/conv2d_no_batching", [1, 40, 40, 512, 256, 1, 1, [1, 1], [0, 0]], {}], "config": {"index": 2170, "code_hash": null, "entity": [["tile_rc", "sp", [-1, 1, 4]], ["tile_f", "sp", [-1, 64]], ["tile_y", "sp", [-1, 4, 2]], ["tile_x", "sp", [-1, 4, 4]]]}, "result": [[0.0053613963], 0, 2.491727828979492, 1611209664.130188], "version": 0.2, "tvm_version": "0.8.dev0"}
{"input": ["opencl -keys=opencl,gpu -max_num_threads=256", "tutorial/conv2d_no_batching", [1, 40, 40, 512, 256, 1, 1, [1, 1], [0, 0]], {}], "config": {"index": 2156, "code_hash": null, "entity": [["tile_rc", "sp", [-1, 1, 4]], ["tile_f", "sp", [-1, 16]], ["tile_y", "sp", [-1, 4, 2]], ["tile_x", "sp", [-1, 4, 4]]]}, "result": [[0.0053599068], 0, 11.488579750061035, 1611209673.1355803], "version": 0.2, "tvm_version": "0.8.dev0"}
{"input": ["opencl -keys=opencl,gpu -max_num_threads=256", "tutorial/conv2d_no_batching", [1, 40, 40, 512, 256, 1, 1, [1, 1], [0, 0]], {}], "config": {"index": 4068, "code_hash": null, "entity": [["tile_rc", "sp", [-1, 2, 4]], ["tile_f", "sp", [-1, 32]], ["tile_y", "sp", [-1, 1, 2]], ["tile_x", "sp", [-1, 8, 4]]]}, "result": [[0.0302165394], 0, 35.55399990081787, 1611209697.1881096], "version": 0.2, "tvm_version": "0.8.dev0"}
{"input": ["opencl -keys=opencl,gpu -max_num_threads=256", "tutorial/conv2d_no_batching", [1, 40, 40, 512, 256, 1, 1, [1, 1], [0, 0]], {}], "config": {"index": 10115, "code_hash": null, "entity": [["tile_rc", "sp", [-1, 1, 4]], ["tile_f", "sp", [-1, 32]], ["tile_y", "sp", [-1, 1, 2]], ["tile_x", "sp", [-1, 4, 8]]]}, "result": [[0.0055082193000000005], 0, 5.520159959793091, 1611209667.1574185], "version": 0.2, "tvm_version": "0.8.dev0"}
{"input": ["opencl -keys=opencl,gpu -max_num_threads=256", "tutorial/conv2d_no_batching", [1, 40, 40, 512, 256, 1, 1, [1, 1], [0, 0]], {}], "config": {"index": 3122, "code_hash": null, "entity": [["tile_rc", "sp", [-1, 1, 4]], ["tile_f", "sp", [-1, 64]], ["tile_y", "sp", [-1, 2, 2]], ["tile_x", "sp", [-1, 5, 4]]]}, "result": [[0.0053644693], 0, 8.430859804153442, 1611209670.0806804], "version": 0.2, "tvm_version": "0.8.dev0"}
{"input": ["opencl -keys=opencl,gpu -max_num_threads=256", "tutorial/conv2d_no_batching", [1, 40, 40, 512, 256, 1, 1, [1, 1], [0, 0]], {}], "config": {"index": 3052, "code_hash": null, "entity": [["tile_rc", "sp", [-1, 1, 4]], ["tile_f", "sp", [-1, 16]], ["tile_y", "sp", [-1, 1, 2]], ["tile_x", "sp", [-1, 5, 4]]]}, "result": [[0.0078150946], 0, 14.461495399475098, 1611209676.1144295], "version": 0.2, "tvm_version": "0.8.dev0"}
{"input": ["opencl -keys=opencl,gpu -max_num_threads=256", "tutorial/conv2d_no_batching", [1, 40, 40, 512, 256, 1, 1, [1, 1], [0, 0]], {}], "config": {"index": 9114, "code_hash": null, "entity": [["tile_rc", "sp", [-1, 1, 4]], ["tile_f", "sp", [-1, 64]], ["tile_y", "sp", [-1, 1, 2]], ["tile_x", "sp", [-1, 2, 8]]]}, "result": [[0.0055230266], 0, 17.419193029403687, 1611209679.0897808], "version": 0.2, "tvm_version": "0.8.dev0"}
{"input": ["opencl -keys=opencl,gpu -max_num_threads=256", "tutorial/conv2d_no_batching", [1, 40, 40, 512, 256, 1, 1, [1, 1], [0, 0]], {}], "config": {"index": 2059, "code_hash": null, "entity": [["tile_rc", "sp", [-1, 2, 4]], ["tile_f", "sp", [-1, 64]], ["tile_y", "sp", [-1, 1, 2]], ["tile_x", "sp", [-1, 4, 4]]]}, "result": [[0.030293529000000003], 0, 21.32259750366211, 1611209682.9891424], "version": 0.2, "tvm_version": "0.8.dev0"}
{"input": ["opencl -keys=opencl,gpu -max_num_threads=256", "tutorial/conv2d_no_batching", [1, 40, 40, 512, 256, 1, 1, [1, 1], [0, 0]], {}], "config": {"index": 4124, "code_hash": null, "entity": [["tile_rc", "sp", [-1, 2, 4]], ["tile_f", "sp", [-1, 32]], ["tile_y", "sp", [-1, 2, 2]], ["tile_x", "sp", [-1, 8, 4]]]}, "result": [[0.030275826], 0, 25.04166054725647, 1611209686.7164578], "version": 0.2, "tvm_version": "0.8.dev0"}
{"input": ["opencl -keys=opencl,gpu -max_num_threads=256", "tutorial/conv2d_no_batching", [1, 40, 40, 512, 256, 1, 1, [1, 1], [0, 0]], {}], "config": {"index": 162, "code_hash": null, "entity": [["tile_rc", "sp", [-1, 2, 4]], ["tile_f", "sp", [-1, 128]], ["tile_y", "sp", [-1, 4, 2]], ["tile_x", "sp", [-1, 1, 4]]]}, "result": [[0.0319601125], 0, 28.825533151626587, 1611209690.5114055], "version": 0.2, "tvm_version": "0.8.dev0"}
{"input": ["opencl -keys=opencl,gpu -max_num_threads=256", "tutorial/conv2d_no_batching", [1, 40, 40, 512, 256, 1, 1, [1, 1], [0, 0]], {}], "config": {"index": 8169, "code_hash": null, "entity": [["tile_rc", "sp", [-1, 1, 4]], ["tile_f", "sp", [-1, 128]], ["tile_y", "sp", [-1, 2, 2]], ["tile_x", "sp", [-1, 1, 8]]]}, "result": [[0.0055313702999999995], 0, 31.77218794822693, 1611209693.4561734], "version": 0.2, "tvm_version": "0.8.dev0"}
{"input": ["opencl -keys=opencl,gpu -max_num_threads=256", "tutorial/conv2d_no_batching", [1, 40, 40, 512, 256, 1, 1, [1, 1], [0, 0]], {}], "config": {"index": 4228, "code_hash": null, "entity": [["tile_rc", "sp", [-1, 1, 4]], ["tile_f", "sp", [-1, 16]], ["tile_y", "sp", [-1, 5, 2]], ["tile_x", "sp", [-1, 8, 4]]]}, "result": [[0.0052894068], 0, 38.40526723861694, 1611209700.1072848], "version": 0.2, "tvm_version": "0.8.dev0"}
{"input": ["opencl -keys=opencl,gpu -max_num_threads=256", "tutorial/conv2d_no_batching", [1, 40, 40, 512, 256, 1, 1, [1, 1], [0, 0]], {}], "config": {"index": 13692, "code_hash": null, "entity": [["tile_rc", "sp", [-1, 1, 4]], ["tile_f", "sp", [-1, 16]], ["tile_y", "sp", [-1, 1, 8]], ["tile_x", "sp", [-1, 20, 8]]]}, "result": [[0.0314524354], 0, 42.35232067108154, 1611209704.0578709], "version": 0.2, "tvm_version": "0.8.dev0"}
{"input": ["opencl -keys=opencl,gpu -max_num_threads=256", "tutorial/conv2d_no_batching", [1, 40, 40, 512, 256, 1, 1, [1, 1], [0, 0]], {}], "config": {"index": 5180, "code_hash": null, "entity": [["tile_rc", "sp", [-1, 1, 4]], ["tile_f", "sp", [-1, 16]], ["tile_y", "sp", [-1, 4, 2]], ["tile_x", "sp", [-1, 10, 4]]]}, "result": [[0.0053989016], 0, 2.57147479057312, 1611209722.020443], "version": 0.2, "tvm_version": "0.8.dev0"}
{"input": ["opencl -keys=opencl,gpu -max_num_threads=256", "tutorial/conv2d_no_batching", [1, 40, 40, 512, 256, 1, 1, [1, 1], [0, 0]], {}], "config": {"index": 5082, "code_hash": null, "entity": [["tile_rc", "sp", [-1, 1, 4]], ["tile_f", "sp", [-1, 64]], ["tile_y", "sp", [-1, 1, 2]], ["tile_x", "sp", [-1, 10, 4]]]}, "result": [[0.0052543339], 0, 5.531806945800781, 1611209724.946826], "version": 0.2, "tvm_version": "0.8.dev0"}
{"input": ["opencl -keys=opencl,gpu -max_num_threads=256", "tutorial/conv2d_no_batching", [1, 40, 40, 512, 256, 1, 1, [1, 1], [0, 0]], {}], "config": {"index": 5236, "code_hash": null, "entity": [["tile_rc", "sp", [-1, 1, 4]], ["tile_f", "sp", [-1, 16]], ["tile_y", "sp", [-1, 5, 2]], ["tile_x", "sp", [-1, 10, 4]]]}, "result": [[0.0056062923], 0, 11.482273578643799, 1611209730.9245267], "version": 0.2, "tvm_version": "0.8.dev0"}
{"input": ["opencl -keys=opencl,gpu -max_num_threads=256", "tutorial/conv2d_no_batching", [1, 40, 40, 512, 256, 1, 1, [1, 1], [0, 0]], {}], "config": {"index": 2443, "code_hash": null, "entity": [["tile_rc", "sp", [-1, 1, 4]], ["tile_f", "sp", [-1, 32]], ["tile_y", "sp", [-1, 2, 4]], ["tile_x", "sp", [-1, 4, 4]]]}, "result": [[0.0054452558], 0, 8.428442001342773, 1611209727.8973742], "version": 0.2, "tvm_version": "0.8.dev0"}
{"input": ["opencl -keys=opencl,gpu -max_num_threads=256", "tutorial/conv2d_no_batching", [1, 40, 40, 512, 256, 1, 1, [1, 1], [0, 0]], {}], "config": {"index": 2219, "code_hash": null, "entity": [["tile_rc", "sp", [-1, 1, 4]], ["tile_f", "sp", [-1, 32]], ["tile_y", "sp", [-1, 5, 2]], ["tile_x", "sp", [-1, 4, 4]]]}, "result": [[0.0052785787], 0, 14.339547395706177, 1611209733.8224268], "version": 0.2, "tvm_version": "0.8.dev0"}
{"input": ["opencl -keys=opencl,gpu -max_num_threads=256", "tutorial/conv2d_no_batching", [1, 40, 40, 512, 256, 1, 1, [1, 1], [0, 0]], {}], "config": {"index": 6237, "code_hash": null, "entity": [["tile_rc", "sp", [-1, 1, 4]], ["tile_f", "sp", [-1, 8]], ["tile_y", "sp", [-1, 5, 2]], ["tile_x", "sp", [-1, 20, 4]]]}, "result": [[0.0057905214], 0, 17.370030403137207, 1611209736.8560562], "version": 0.2, "tvm_version": "0.8.dev0"}
{"input": ["opencl -keys=opencl,gpu -max_num_threads=256", "tutorial/conv2d_no_batching", [1, 40, 40, 512, 256, 1, 1, [1, 1], [0, 0]], {}], "config": {"index": 4179, "code_hash": null, "entity": [["tile_rc", "sp", [-1, 1, 4]], ["tile_f", "sp", [-1, 32]], ["tile_y", "sp", [-1, 4, 2]], ["tile_x", "sp", [-1, 8, 4]]]}, "result": [[0.0053928911], 0, 20.272822856903076, 1611209739.7872443], "version": 0.2, "tvm_version": "0.8.dev0"}
{"input": ["opencl -keys=opencl,gpu -max_num_threads=256", "tutorial/conv2d_no_batching", [1, 40, 40, 512, 256, 1, 1, [1, 1], [0, 0]], {}], "config": {"index": 6181, "code_hash": null, "entity": [["tile_rc", "sp", [-1, 1, 4]], ["tile_f", "sp", [-1, 8]], ["tile_y", "sp", [-1, 4, 2]], ["tile_x", "sp", [-1, 20, 4]]]}, "result": [[0.0054642037], 0, 23.299549102783203, 1611209742.8041077], "version": 0.2, "tvm_version": "0.8.dev0"}
{"input": ["opencl -keys=opencl,gpu -max_num_threads=256", "tutorial/conv2d_no_batching", [1, 40, 40, 512, 256, 1, 1, [1, 1], [0, 0]], {}], "config": {"index": 2268, "code_hash": null, "entity": [["tile_rc", "sp", [-1, 1, 4]], ["tile_f", "sp", [-1, 16]], ["tile_y", "sp", [-1, 10, 2]], ["tile_x", "sp", [-1, 4, 4]]]}, "result": [[0.005317011], 0, 26.16980218887329, 1611209745.7029562], "version": 0.2, "tvm_version": "0.8.dev0"}
{"input": ["opencl -keys=opencl,gpu -max_num_threads=256", "tutorial/conv2d_no_batching", [1, 40, 40, 512, 256, 1, 1, [1, 1], [0, 0]], {}], "config": {"index": 4403, "code_hash": null, "entity": [["tile_rc", "sp", [-1, 1, 4]], ["tile_f", "sp", [-1, 32]], ["tile_y", "sp", [-1, 1, 4]], ["tile_x", "sp", [-1, 8, 4]]]}, "result": [[0.0055130160999999995], 0, 29.25418448448181, 1611209748.7892306], "version": 0.2, "tvm_version": "0.8.dev0"}
{"input": ["opencl -keys=opencl,gpu -max_num_threads=256", "tutorial/conv2d_no_batching", [1, 40, 40, 512, 256, 1, 1, [1, 1], [0, 0]], {}], "config": {"index": 10171, "code_hash": null, "entity": [["tile_rc", "sp", [-1, 1, 4]], ["tile_f", "sp", [-1, 32]], ["tile_y", "sp", [-1, 2, 2]], ["tile_x", "sp", [-1, 4, 8]]]}, "result": [[0.0054558443], 0, 32.28734540939331, 1611209751.8339434], "version": 0.2, "tvm_version": "0.8.dev0"}
{"input": ["opencl -keys=opencl,gpu -max_num_threads=256", "tutorial/conv2d_no_batching", [1, 40, 40, 512, 256, 1, 1, [1, 1], [0, 0]], {}], "config": {"index": 4396, "code_hash": null, "entity": [["tile_rc", "sp", [-1, 1, 4]], ["tile_f", "sp", [-1, 16]], ["tile_y", "sp", [-1, 1, 4]], ["tile_x", "sp", [-1, 8, 4]]]}, "result": [[0.0055045735], 0, 35.21100735664368, 1611209754.7786665], "version": 0.2, "tvm_version": "0.8.dev0"}
