test_and_tune/climgfloatr32.mobilenet_v1_1.0_224.log.tmp1
{"input": ["opencl -keys=mali,opencl,gpu -device=mali -max_num_threads=256", "conv2d_NCHWc_io.mali", [["TENSOR", [1, 4, 224, 224], "climgfloatw32"], ["TENSOR", [4, 32, 3, 3], "climgfloatw32"], [2, 2], [1, 1, 1, 1], [1, 1], "NCHW", "NCHW4c", "climgfloatw32"], {}], "config": {"index": 3667, "code_hash": null, "entity": [["tile_ic", "sp", [-1, 1, 4]], ["tile_oc", "sp", [-1, 8]], ["tile_ow", "sp", [-1, 1, 2]], ["tile_oh", "sp", [-1, 28, 2]]]}, "result": [[0.0119539386], 0, 1.752295970916748, 1615725056.7503982], "version": 0.2, "tvm_version": "0.8.dev0"}
{"input": ["opencl -keys=mali,opencl,gpu -device=mali -max_num_threads=256", "conv2d_NCHWc_io.mali", [["TENSOR", [1, 4, 224, 224], "climgfloatw32"], ["TENSOR", [4, 32, 3, 3], "climgfloatw32"], [2, 2], [1, 1, 1, 1], [1, 1], "NCHW", "NCHW4c", "climgfloatw32"], {}], "config": {"index": 149, "code_hash": null, "entity": [["tile_ic", "sp", [-1, 1, 4]], ["tile_oc", "sp", [-1, 2]], ["tile_ow", "sp", [-1, 1, 8]], ["tile_oh", "sp", [-1, 32, 1]]]}, "result": [[0.007744959], 0, 4.069675445556641, 1615725058.6685073], "version": 0.2, "tvm_version": "0.8.dev0"}
{"input": ["opencl -keys=mali,opencl,gpu -device=mali -max_num_threads=256", "conv2d_NCHWc_io.mali", [["TENSOR", [1, 4, 224, 224], "climgfloatw32"], ["TENSOR", [4, 32, 3, 3], "climgfloatw32"], [2, 2], [1, 1, 1, 1], [1, 1], "NCHW", "NCHW4c", "climgfloatw32"], {}], "config": {"index": 1357, "code_hash": null, "entity": [["tile_ic", "sp", [-1, 1, 4]], ["tile_oc", "sp", [-1, 2]], ["tile_ow", "sp", [-1, 2, 8]], ["tile_oh", "sp", [-1, 14, 1]]]}, "result": [[0.0201733042], 0, 5.551448106765747, 1615725060.350754], "version": 0.2, "tvm_version": "0.8.dev0"}
{"input": ["opencl -keys=mali,opencl,gpu -device=mali -max_num_threads=256", "conv2d_NCHWc_io.mali", [["TENSOR", [1, 4, 224, 224], "climgfloatw32"], ["TENSOR", [4, 32, 3, 3], "climgfloatw32"], [2, 2], [1, 1, 1, 1], [1, 1], "NCHW", "NCHW4c", "climgfloatw32"], {}], "config": {"index": 857, "code_hash": null, "entity": [["tile_ic", "sp", [-1, 1, 4]], ["tile_oc", "sp", [-1, 2]], ["tile_ow", "sp", [-1, 14, 8]], ["tile_oh", "sp", [-1, 4, 1]]]}, "result": [[0.0204645436], 0, 7.23012900352478, 1615725062.14714], "version": 0.2, "tvm_version": "0.8.dev0"}
{"input": ["opencl -keys=mali,opencl,gpu -device=mali -max_num_threads=256", "conv2d_NCHWc_io.mali", [["TENSOR", [1, 4, 224, 224], "climgfloatw32"], ["TENSOR", [4, 32, 3, 3], "climgfloatw32"], [2, 2], [1, 1, 1, 1], [1, 1], "NCHW", "NCHW4c", "climgfloatw32"], {}], "config": {"index": 7229, "code_hash": null, "entity": [["tile_ic", "sp", [-1, 1, 4]], ["tile_oc", "sp", [-1, 2]], ["tile_ow", "sp", [-1, 1, 1]], ["tile_oh", "sp", [-1, 14, 8]]]}, "result": [[0.010983647000000001], 0, 8.796196222305298, 1615725063.7203932], "version": 0.2, "tvm_version": "0.8.dev0"}
{"input": ["opencl -keys=mali,opencl,gpu -device=mali -max_num_threads=256", "conv2d_NCHWc_io.mali", [["TENSOR", [1, 4, 224, 224], "climgfloatw32"], ["TENSOR", [4, 32, 3, 3], "climgfloatw32"], [2, 2], [1, 1, 1, 1], [1, 1], "NCHW", "NCHW4c", "climgfloatw32"], {}], "config": {"index": 1326, "code_hash": null, "entity": [["tile_ic", "sp", [-1, 1, 4]], ["tile_oc", "sp", [-1, 4]], ["tile_ow", "sp", [-1, 1, 7]], ["tile_oh", "sp", [-1, 14, 1]]]}, "result": [[0.0210485646], 0, 10.600971937179565, 1615725065.510714], "version": 0.2, "tvm_version": "0.8.dev0"}
{"input": ["opencl -keys=mali,opencl,gpu -device=mali -max_num_threads=256", "conv2d_NCHWc_io.mali", [["TENSOR", [1, 4, 224, 224], "climgfloatw32"], ["TENSOR", [4, 32, 3, 3], "climgfloatw32"], [2, 2], [1, 1, 1, 1], [1, 1], "NCHW", "NCHW4c", "climgfloatw32"], {}], "config": {"index": 5433, "code_hash": null, "entity": [["tile_ic", "sp", [-1, 1, 4]], ["tile_oc", "sp", [-1, 2]], ["tile_ow", "sp", [-1, 7, 4]], ["tile_oh", "sp", [-1, 2, 7]]]}, "result": [[0.0068658862], 0, 13.028652667999268, 1615725067.5216901], "version": 0.2, "tvm_version": "0.8.dev0"}
{"input": ["opencl -keys=mali,opencl,gpu -device=mali -max_num_threads=256", "conv2d_NCHWc_io.mali", [["TENSOR", [1, 4, 224, 224], "climgfloatw32"], ["TENSOR", [4, 32, 3, 3], "climgfloatw32"], [2, 2], [1, 1, 1, 1], [1, 1], "NCHW", "NCHW4c", "climgfloatw32"], {}], "config": {"index": 1568, "code_hash": null, "entity": [["tile_ic", "sp", [-1, 1, 4]], ["tile_oc", "sp", [-1, 1]], ["tile_ow", "sp", [-1, 7, 1]], ["tile_oh", "sp", [-1, 112, 1]]]}, "result": [[0.0119231366], 0, 1.51078200340271, 1615725072.2537363], "version": 0.2, "tvm_version": "0.8.dev0"}
{"input": ["opencl -keys=mali,opencl,gpu -device=mali -max_num_threads=256", "conv2d_NCHWc_io.mali", [["TENSOR", [1, 4, 224, 224], "climgfloatw32"], ["TENSOR", [4, 32, 3, 3], "climgfloatw32"], [2, 2], [1, 1, 1, 1], [1, 1], "NCHW", "NCHW4c", "climgfloatw32"], {}], "config": {"index": 5338, "code_hash": null, "entity": [["tile_ic", "sp", [-1, 1, 4]], ["tile_oc", "sp", [-1, 4]], ["tile_ow", "sp", [-1, 1, 1]], ["tile_oh", "sp", [-1, 2, 7]]]}, "result": [[0.0058092818], 0, 3.103151559829712, 1615725073.69715], "version": 0.2, "tvm_version": "0.8.dev0"}
{"input": ["opencl -keys=mali,opencl,gpu -device=mali -max_num_threads=256", "conv2d_NCHWc_io.mali", [["TENSOR", [1, 4, 224, 224], "climgfloatw32"], ["TENSOR", [4, 32, 3, 3], "climgfloatw32"], [2, 2], [1, 1, 1, 1], [1, 1], "NCHW", "NCHW4c", "climgfloatw32"], {}], "config": {"index": 5364, "code_hash": null, "entity": [["tile_ic", "sp", [-1, 1, 4]], ["tile_oc", "sp", [-1, 1]], ["tile_ow", "sp", [-1, 16, 1]], ["tile_oh", "sp", [-1, 2, 7]]]}, "result": [[0.0120705742], 0, 4.900001525878906, 1615725075.352434], "version": 0.2, "tvm_version": "0.8.dev0"}
{"input": ["opencl -keys=mali,opencl,gpu -device=mali -max_num_threads=256", "conv2d_NCHWc_io.mali", [["TENSOR", [1, 4, 224, 224], "climgfloatw32"], ["TENSOR", [4, 32, 3, 3], "climgfloatw32"], [2, 2], [1, 1, 1, 1], [1, 1], "NCHW", "NCHW4c", "climgfloatw32"], {}], "config": {"index": 5373, "code_hash": null, "entity": [["tile_ic", "sp", [-1, 1, 4]], ["tile_oc", "sp", [-1, 2]], ["tile_ow", "sp", [-1, 56, 1]], ["tile_oh", "sp", [-1, 2, 7]]]}, "result": [[0.0154081786], 0, 16.62038826942444, 1615725087.1775367], "version": 0.2, "tvm_version": "0.8.dev0"}
{"input": ["opencl -keys=mali,opencl,gpu -device=mali -max_num_threads=256", "conv2d_NCHWc_io.mali", [["TENSOR", [1, 4, 224, 224], "climgfloatw32"], ["TENSOR", [4, 32, 3, 3], "climgfloatw32"], [2, 2], [1, 1, 1, 1], [1, 1], "NCHW", "NCHW4c", "climgfloatw32"], {}], "config": {"index": 299, "code_hash": null, "entity": [["tile_ic", "sp", [-1, 1, 4]], ["tile_oc", "sp", [-1, 8]], ["tile_ow", "sp", [-1, 2, 7]], ["tile_oh", "sp", [-1, 1, 1]]]}, "result": [[0.0063570216], 0, 28.25225329399109, 1615725098.8255844], "version": 0.2, "tvm_version": "0.8.dev0"}
{"input": ["opencl -keys=mali,opencl,gpu -device=mali -max_num_threads=256", "conv2d_NCHWc_io.mali", [["TENSOR", [1, 4, 224, 224], "climgfloatw32"], ["TENSOR", [4, 32, 3, 3], "climgfloatw32"], [2, 2], [1, 1, 1, 1], [1, 1], "NCHW", "NCHW4c", "climgfloatw32"], {}], "config": {"index": 2195, "code_hash": null, "entity": [["tile_ic", "sp", [-1, 1, 4]], ["tile_oc", "sp", [-1, 8]], ["tile_ow", "sp", [-1, 4, 7]], ["tile_oh", "sp", [-1, 32, 2]]]}, "result": [[0.0160135432], 0, 3.804499626159668, 1615725102.839231], "version": 0.2, "tvm_version": "0.8.dev0"}
{"input": ["opencl -keys=mali,opencl,gpu -device=mali -max_num_threads=256", "conv2d_NCHWc_io.mali", [["TENSOR", [1, 4, 224, 224], "climgfloatw32"], ["TENSOR", [4, 32, 3, 3], "climgfloatw32"], [2, 2], [1, 1, 1, 1], [1, 1], "NCHW", "NCHW4c", "climgfloatw32"], {}], "config": {"index": 6561, "code_hash": null, "entity": [["tile_ic", "sp", [-1, 1, 4]], ["tile_oc", "sp", [-1, 2]], ["tile_ow", "sp", [-1, 8, 1]], ["tile_oh", "sp", [-1, 2, 8]]]}, "result": [[0.010777782199999999], 0, 4.770581960678101, 1615725104.453244], "version": 0.2, "tvm_version": "0.8.dev0"}
{"input": ["opencl -keys=mali,opencl,gpu -device=mali -max_num_threads=256", "conv2d_NCHWc_io.mali", [["TENSOR", [1, 4, 224, 224], "climgfloatw32"], ["TENSOR", [4, 32, 3, 3], "climgfloatw32"], [2, 2], [1, 1, 1, 1], [1, 1], "NCHW", "NCHW4c", "climgfloatw32"], {}], "config": {"index": 2733, "code_hash": null, "entity": [["tile_ic", "sp", [-1, 1, 4]], ["tile_oc", "sp", [-1, 2]], ["tile_ow", "sp", [-1, 2, 8]], ["tile_oh", "sp", [-1, 4, 2]]]}, "result": [[0.0060989901999999995], 0, 6.7154858112335205, 1615725106.1914673], "version": 0.2, "tvm_version": "0.8.dev0"}
{"input": ["opencl -keys=mali,opencl,gpu -device=mali -max_num_threads=256", "conv2d_NCHWc_io.mali", [["TENSOR", [1, 4, 224, 224], "climgfloatw32"], ["TENSOR", [4, 32, 3, 3], "climgfloatw32"], [2, 2], [1, 1, 1, 1], [1, 1], "NCHW", "NCHW4c", "climgfloatw32"], {}], "config": {"index": 1781, "code_hash": null, "entity": [["tile_ic", "sp", [-1, 1, 4]], ["tile_oc", "sp", [-1, 2]], ["tile_ow", "sp", [-1, 4, 2]], ["tile_oh", "sp", [-1, 56, 1]]]}, "result": [[0.0146798244], 0, 7.776256799697876, 1615725107.6660361], "version": 0.2, "tvm_version": "0.8.dev0"}
{"input": ["opencl -keys=mali,opencl,gpu -device=mali -max_num_threads=256", "conv2d_NCHWc_io.mali", [["TENSOR", [1, 4, 224, 224], "climgfloatw32"], ["TENSOR", [4, 32, 3, 3], "climgfloatw32"], [2, 2], [1, 1, 1, 1], [1, 1], "NCHW", "NCHW4c", "climgfloatw32"], {}], "config": {"index": 6044, "code_hash": null, "entity": [["tile_ic", "sp", [-1, 1, 4]], ["tile_oc", "sp", [-1, 1]], ["tile_ow", "sp", [-1, 8, 1]], ["tile_oh", "sp", [-1, 14, 7]]]}, "result": [[0.0052956254], 0, 9.897748470306396, 1615725109.366264], "version": 0.2, "tvm_version": "0.8.dev0"}
{"input": ["opencl -keys=mali,opencl,gpu -device=mali -max_num_threads=256", "conv2d_NCHWc_io.mali", [["TENSOR", [1, 4, 224, 224], "climgfloatw32"], ["TENSOR", [4, 32, 3, 3], "climgfloatw32"], [2, 2], [1, 1, 1, 1], [1, 1], "NCHW", "NCHW4c", "climgfloatw32"], {}], "config": {"index": 5923, "code_hash": null, "entity": [["tile_ic", "sp", [-1, 1, 4]], ["tile_oc", "sp", [-1, 8]], ["tile_ow", "sp", [-1, 14, 2]], ["tile_oh", "sp", [-1, 8, 7]]]}, "result": [[0.0206885854], 0, 11.68014669418335, 1615725111.211556], "version": 0.2, "tvm_version": "0.8.dev0"}
{"input": ["opencl -keys=mali,opencl,gpu -device=mali -max_num_threads=256", "conv2d_NCHWc_io.mali", [["TENSOR", [1, 4, 224, 224], "climgfloatw32"], ["TENSOR", [4, 32, 3, 3], "climgfloatw32"], [2, 2], [1, 1, 1, 1], [1, 1], "NCHW", "NCHW4c", "climgfloatw32"], {}], "config": {"index": 101, "code_hash": null, "entity": [["tile_ic", "sp", [-1, 1, 4]], ["tile_oc", "sp", [-1, 2]], ["tile_ow", "sp", [-1, 7, 4]], ["tile_oh", "sp", [-1, 32, 1]]]}, "result": [[0.005930188], 0, 13.06518030166626, 1615725112.6449082], "version": 0.2, "tvm_version": "0.8.dev0"}
{"input": ["opencl -keys=mali,opencl,gpu -device=mali -max_num_threads=256", "conv2d_NCHWc_io.mali", [["TENSOR", [1, 4, 224, 224], "climgfloatw32"], ["TENSOR", [4, 32, 3, 3], "climgfloatw32"], [2, 2], [1, 1, 1, 1], [1, 1], "NCHW", "NCHW4c", "climgfloatw32"], {}], "config": {"index": 3181, "code_hash": null, "entity": [["tile_ic", "sp", [-1, 1, 4]], ["tile_oc", "sp", [-1, 2]], ["tile_ow", "sp", [-1, 28, 2]], ["tile_oh", "sp", [-1, 14, 2]]]}, "result": [[0.0114391886], 0, 1.765991449356079, 1615725115.3517053], "version": 0.2, "tvm_version": "0.8.dev0"}
{"input": ["opencl -keys=mali,opencl,gpu -device=mali -max_num_threads=256", "conv2d_NCHWc_io.mali", [["TENSOR", [1, 4, 224, 224], "climgfloatw32"], ["TENSOR", [4, 32, 3, 3], "climgfloatw32"], [2, 2], [1, 1, 1, 1], [1, 1], "NCHW", "NCHW4c", "climgfloatw32"], {}], "config": {"index": 846, "code_hash": null, "entity": [["tile_ic", "sp", [-1, 1, 4]], ["tile_oc", "sp", [-1, 4]], ["tile_ow", "sp", [-1, 4, 8]], ["tile_oh", "sp", [-1, 4, 1]]]}, "result": [[0.0103522718], 0, 5.256061553955078, 1615725118.4485002], "version": 0.2, "tvm_version": "0.8.dev0"}
{"input": ["opencl -keys=mali,opencl,gpu -device=mali -max_num_threads=256", "conv2d_NCHWc_io.mali", [["TENSOR", [1, 4, 224, 224], "climgfloatw32"], ["TENSOR", [4, 32, 3, 3], "climgfloatw32"], [2, 2], [1, 1, 1, 1], [1, 1], "NCHW", "NCHW4c", "climgfloatw32"], {}], "config": {"index": 5287, "code_hash": null, "entity": [["tile_ic", "sp", [-1, 1, 4]], ["tile_oc", "sp", [-1, 8]], ["tile_ow", "sp", [-1, 2, 7]], ["tile_oh", "sp", [-1, 1, 7]]]}, "result": [[0.0197450124], 0, 10.39903712272644, 1615725123.319482], "version": 0.2, "tvm_version": "0.8.dev0"}
{"input": ["opencl -keys=mali,opencl,gpu -device=mali -max_num_threads=256", "conv2d_NCHWc_io.mali", [["TENSOR", [1, 4, 224, 224], "climgfloatw32"], ["TENSOR", [4, 32, 3, 3], "climgfloatw32"], [2, 2], [1, 1, 1, 1], [1, 1], "NCHW", "NCHW4c", "climgfloatw32"], {}], "config": {"index": 3123, "code_hash": null, "entity": [["tile_ic", "sp", [-1, 1, 4]], ["tile_oc", "sp", [-1, 8]], ["tile_ow", "sp", [-1, 8, 1]], ["tile_oh", "sp", [-1, 14, 2]]]}, "result": [[0.011230251], 0, 11.105716466903687, 1615725124.7720356], "version": 0.2, "tvm_version": "0.8.dev0"}
{"input": ["opencl -keys=mali,opencl,gpu -device=mali -max_num_threads=256", "conv2d_NCHWc_io.mali", [["TENSOR", [1, 4, 224, 224], "climgfloatw32"], ["TENSOR", [4, 32, 3, 3], "climgfloatw32"], [2, 2], [1, 1, 1, 1], [1, 1], "NCHW", "NCHW4c", "climgfloatw32"], {}], "config": {"index": 7060, "code_hash": null, "entity": [["tile_ic", "sp", [-1, 1, 4]], ["tile_oc", "sp", [-1, 1]], ["tile_ow", "sp", [-1, 2, 1]], ["tile_oh", "sp", [-1, 8, 8]]]}, "result": [[0.0064760213999999995], 0, 7.270997524261475, 1615725120.42875], "version": 0.2, "tvm_version": "0.8.dev0"}
{"input": ["opencl -keys=mali,opencl,gpu -device=mali -max_num_threads=256", "conv2d_NCHWc_io.mali", [["TENSOR", [1, 4, 224, 224], "climgfloatw32"], ["TENSOR", [4, 32, 3, 3], "climgfloatw32"], [2, 2], [1, 1, 1, 1], [1, 1], "NCHW", "NCHW4c", "climgfloatw32"], {}], "config": {"index": 3834, "code_hash": null, "entity": [["tile_ic", "sp", [-1, 1, 4]], ["tile_oc", "sp", [-1, 4]], ["tile_ow", "sp", [-1, 32, 2]], ["tile_oh", "sp", [-1, 1, 4]]]}, "result": [[0.0059830422], 0, 2.7885212898254395, 1615725129.6269436], "version": 0.2, "tvm_version": "0.8.dev0"}
{"input": ["opencl -keys=mali,opencl,gpu -device=mali -max_num_threads=256", "conv2d_NCHWc_io.mali", [["TENSOR", [1, 4, 224, 224], "climgfloatw32"], ["TENSOR", [4, 32, 3, 3], "climgfloatw32"], [2, 2], [1, 1, 1, 1], [1, 1], "NCHW", "NCHW4c", "climgfloatw32"], {}], "config": {"index": 129, "code_hash": null, "entity": [["tile_ic", "sp", [-1, 1, 4]], ["tile_oc", "sp", [-1, 2]], ["tile_ow", "sp", [-1, 4, 7]], ["tile_oh", "sp", [-1, 32, 1]]]}, "result": [[0.008409282], 0, 14.631753921508789, 1615725141.5299168], "version": 0.2, "tvm_version": "0.8.dev0"}
{"input": ["opencl -keys=mali,opencl,gpu -device=mali -max_num_threads=256", "conv2d_NCHWc_io.mali", [["TENSOR", [1, 4, 224, 224], "climgfloatw32"], ["TENSOR", [4, 32, 3, 3], "climgfloatw32"], [2, 2], [1, 1, 1, 1], [1, 1], "NCHW", "NCHW4c", "climgfloatw32"], {}], "config": {"index": 4488, "code_hash": null, "entity": [["tile_ic", "sp", [-1, 1, 4]], ["tile_oc", "sp", [-1, 1]], ["tile_ow", "sp", [-1, 4, 1]], ["tile_oh", "sp", [-1, 8, 4]]]}, "result": [[0.0040543546], 0, 16.02091073989868, 1615725143.067752], "version": 0.2, "tvm_version": "0.8.dev0"}
{"input": ["opencl -keys=mali,opencl,gpu -device=mali -max_num_threads=256", "conv2d_NCHWc_io.mali", [["TENSOR", [1, 4, 224, 224], "climgfloatw32"], ["TENSOR", [4, 32, 3, 3], "climgfloatw32"], [2, 2], [1, 1, 1, 1], [1, 1], "NCHW", "NCHW4c", "climgfloatw32"], {}], "config": {"index": 3548, "code_hash": null, "entity": [["tile_ic", "sp", [-1, 1, 4]], ["tile_oc", "sp", [-1, 1]], ["tile_ow", "sp", [-1, 14, 4]], ["tile_oh", "sp", [-1, 56, 2]]]}, "result": [[0.0189870018], 0, 17.51311445236206, 1615725144.7762525], "version": 0.2, "tvm_version": "0.8.dev0"}
{"input": ["opencl -keys=mali,opencl,gpu -device=mali -max_num_threads=256", "conv2d_NCHWc_io.mali", [["TENSOR", [1, 4, 224, 224], "climgfloatw32"], ["TENSOR", [4, 32, 3, 3], "climgfloatw32"], [2, 2], [1, 1, 1, 1], [1, 1], "NCHW", "NCHW4c", "climgfloatw32"], {}], "config": {"index": 3669, "code_hash": null, "entity": [["tile_ic", "sp", [-1, 1, 4]], ["tile_oc", "sp", [-1, 2]], ["tile_ow", "sp", [-1, 2, 2]], ["tile_oh", "sp", [-1, 28, 2]]]}, "result": [[0.0112165636], 0, 1.7779123783111572, 1615725148.1134274], "version": 0.2, "tvm_version": "0.8.dev0"}
{"input": ["opencl -keys=mali,opencl,gpu -device=mali -max_num_threads=256", "conv2d_NCHWc_io.mali", [["TENSOR", [1, 4, 224, 224], "climgfloatw32"], ["TENSOR", [4, 32, 3, 3], "climgfloatw32"], [2, 2], [1, 1, 1, 1], [1, 1], "NCHW", "NCHW4c", "climgfloatw32"], {}], "config": {"index": 5257, "code_hash": null, "entity": [["tile_ic", "sp", [-1, 1, 4]], ["tile_oc", "sp", [-1, 2]], ["tile_ow", "sp", [-1, 4, 4]], ["tile_oh", "sp", [-1, 1, 7]]]}, "result": [[0.008471146799999999], 0, 4.355808734893799, 1615725150.158343], "version": 0.2, "tvm_version": "0.8.dev0"}
{"input": ["opencl -keys=mali,opencl,gpu -device=mali -max_num_threads=256", "conv2d_NCHWc_io.mali", [["TENSOR", [1, 4, 224, 224], "climgfloatw32"], ["TENSOR", [4, 32, 3, 3], "climgfloatw32"], [2, 2], [1, 1, 1, 1], [1, 1], "NCHW", "NCHW4c", "climgfloatw32"], {}], "config": {"index": 1173, "code_hash": null, "entity": [["tile_ic", "sp", [-1, 1, 4]], ["tile_oc", "sp", [-1, 2]], ["tile_ow", "sp", [-1, 14, 7]], ["tile_oh", "sp", [-1, 8, 1]]]}, "result": [[0.0072771673999999995], 0, 6.771782159805298, 1615725152.637352], "version": 0.2, "tvm_version": "0.8.dev0"}
{"input": ["opencl -keys=mali,opencl,gpu -device=mali -max_num_threads=256", "conv2d_NCHWc_io.mali", [["TENSOR", [1, 4, 224, 224], "climgfloatw32"], ["TENSOR", [4, 32, 3, 3], "climgfloatw32"], [2, 2], [1, 1, 1, 1], [1, 1], "NCHW", "NCHW4c", "climgfloatw32"], {}], "config": {"index": 4878, "code_hash": null, "entity": [["tile_ic", "sp", [-1, 1, 4]], ["tile_oc", "sp", [-1, 4]], ["tile_ow", "sp", [-1, 4, 2]], ["tile_oh", "sp", [-1, 16, 4]]]}, "result": [[0.0070301882], 0, 18.64898109436035, 1615725164.6110854], "version": 0.2, "tvm_version": "0.8.dev0"}
{"input": ["opencl -keys=mali,opencl,gpu -device=mali -max_num_threads=256", "conv2d_NCHWc_io.mali", [["TENSOR", [1, 4, 224, 224], "climgfloatw32"], ["TENSOR", [4, 32, 3, 3], "climgfloatw32"], [2, 2], [1, 1, 1, 1], [1, 1], "NCHW", "NCHW4c", "climgfloatw32"], {}], "config": {"index": 2808, "code_hash": null, "entity": [["tile_ic", "sp", [-1, 1, 4]], ["tile_oc", "sp", [-1, 1]], ["tile_ow", "sp", [-1, 2, 2]], ["tile_oh", "sp", [-1, 7, 2]]]}, "result": [[0.006081823599999999], 0, 19.730700731277466, 1615725166.1028814], "version": 0.2, "tvm_version": "0.8.dev0"}
{"input": ["opencl -keys=mali,opencl,gpu -device=mali -max_num_threads=256", "conv2d_NCHWc_io.mali", [["TENSOR", [1, 4, 224, 224], "climgfloatw32"], ["TENSOR", [4, 32, 3, 3], "climgfloatw32"], [2, 2], [1, 1, 1, 1], [1, 1], "NCHW", "NCHW4c", "climgfloatw32"], {}], "config": {"index": 614, "code_hash": null, "entity": [["tile_ic", "sp", [-1, 1, 4]], ["tile_oc", "sp", [-1, 4]], ["tile_ow", "sp", [-1, 4, 4]], ["tile_oh", "sp", [-1, 64, 1]]]}, "result": [[0.0061129797999999996], 0, 23.31441330909729, 1615725169.501692], "version": 0.2, "tvm_version": "0.8.dev0"}
{"input": ["opencl -keys=mali,opencl,gpu -device=mali -max_num_threads=256", "conv2d_NCHWc_io.mali", [["TENSOR", [1, 4, 224, 224], "climgfloatw32"], ["TENSOR", [4, 32, 3, 3], "climgfloatw32"], [2, 2], [1, 1, 1, 1], [1, 1], "NCHW", "NCHW4c", "climgfloatw32"], {}], "config": {"index": 2577, "code_hash": null, "entity": [["tile_ic", "sp", [-1, 1, 4]], ["tile_oc", "sp", [-1, 2]], ["tile_ow", "sp", [-1, 14, 8]], ["tile_oh", "sp", [-1, 2, 2]]]}, "result": [[0.0191518978], 0, 21.837930917739868, 1615725167.9055903], "version": 0.2, "tvm_version": "0.8.dev0"}
{"input": ["opencl -keys=mali,opencl,gpu -device=mali -max_num_threads=256", "conv2d_NCHWc_io.mali", [["TENSOR", [1, 4, 224, 224], "climgfloatw32"], ["TENSOR", [4, 32, 3, 3], "climgfloatw32"], [2, 2], [1, 1, 1, 1], [1, 1], "NCHW", "NCHW4c", "climgfloatw32"], {}], "config": {"index": 955, "code_hash": null, "entity": [["tile_ic", "sp", [-1, 1, 4]], ["tile_oc", "sp", [-1, 8]], ["tile_ow", "sp", [-1, 2, 4]], ["tile_oh", "sp", [-1, 7, 1]]]}, "result": [[0.012122095], 0, 1.778332233428955, 1615725172.297797], "version": 0.2, "tvm_version": "0.8.dev0"}
{"input": ["opencl -keys=mali,opencl,gpu -device=mali -max_num_threads=256", "conv2d_NCHWc_io.mali", [["TENSOR", [1, 4, 224, 224], "climgfloatw32"], ["TENSOR", [4, 32, 3, 3], "climgfloatw32"], [2, 2], [1, 1, 1, 1], [1, 1], "NCHW", "NCHW4c", "climgfloatw32"], {}], "config": {"index": 5598, "code_hash": null, "entity": [["tile_ic", "sp", [-1, 1, 4]], ["tile_oc", "sp", [-1, 4]], ["tile_ow", "sp", [-1, 2, 4]], ["tile_oh", "sp", [-1, 4, 7]]]}, "result": [[0.007374615399999999], 0, 4.318542718887329, 1615725174.2581034], "version": 0.2, "tvm_version": "0.8.dev0"}
{"input": ["opencl -keys=mali,opencl,gpu -device=mali -max_num_threads=256", "conv2d_NCHWc_io.mali", [["TENSOR", [1, 4, 224, 224], "climgfloatw32"], ["TENSOR", [4, 32, 3, 3], "climgfloatw32"], [2, 2], [1, 1, 1, 1], [1, 1], "NCHW", "NCHW4c", "climgfloatw32"], {}], "config": {"index": 2664, "code_hash": null, "entity": [["tile_ic", "sp", [-1, 1, 4]], ["tile_oc", "sp", [-1, 1]], ["tile_ow", "sp", [-1, 28, 2]], ["tile_oh", "sp", [-1, 4, 2]]]}, "result": [[0.0107893032], 0, 5.209997653961182, 1615725175.7577484], "version": 0.2, "tvm_version": "0.8.dev0"}
{"input": ["opencl -keys=mali,opencl,gpu -device=mali -max_num_threads=256", "conv2d_NCHWc_io.mali", [["TENSOR", [1, 4, 224, 224], "climgfloatw32"], ["TENSOR", [4, 32, 3, 3], "climgfloatw32"], [2, 2], [1, 1, 1, 1], [1, 1], "NCHW", "NCHW4c", "climgfloatw32"], {}], "config": {"index": 2128, "code_hash": null, "entity": [["tile_ic", "sp", [-1, 1, 4]], ["tile_oc", "sp", [-1, 1]], ["tile_ow", "sp", [-1, 7, 2]], ["tile_oh", "sp", [-1, 32, 2]]]}, "result": [[0.004297500399999999], 0, 8.912332773208618, 1615725179.223967], "version": 0.2, "tvm_version": "0.8.dev0"}
{"input": ["opencl -keys=mali,opencl,gpu -device=mali -max_num_threads=256", "conv2d_NCHWc_io.mali", [["TENSOR", [1, 4, 224, 224], "climgfloatw32"], ["TENSOR", [4, 32, 3, 3], "climgfloatw32"], [2, 2], [1, 1, 1, 1], [1, 1], "NCHW", "NCHW4c", "climgfloatw32"], {}], "config": {"index": 4746, "code_hash": null, "entity": [["tile_ic", "sp", [-1, 1, 4]], ["tile_oc", "sp", [-1, 4]], ["tile_ow", "sp", [-1, 7, 4]], ["tile_oh", "sp", [-1, 14, 4]]]}, "result": [[0.0192717936], 0, 7.437068700790405, 1615725177.7214677], "version": 0.2, "tvm_version": "0.8.dev0"}
{"input": ["opencl -keys=mali,opencl,gpu -device=mali -max_num_threads=256", "conv2d_NCHWc_io.mali", [["TENSOR", [1, 4, 224, 224], "climgfloatw32"], ["TENSOR", [4, 32, 3, 3], "climgfloatw32"], [2, 2], [1, 1, 1, 1], [1, 1], "NCHW", "NCHW4c", "climgfloatw32"], {}], "config": {"index": 5746, "code_hash": null, "entity": [["tile_ic", "sp", [-1, 1, 4]], ["tile_oc", "sp", [-1, 4]], ["tile_ow", "sp", [-1, 8, 2]], ["tile_oh", "sp", [-1, 7, 7]]]}, "result": [[0.0109468866], 0, 13.957923889160156, 1615725183.7184467], "version": 0.2, "tvm_version": "0.8.dev0"}
{"input": ["opencl -keys=mali,opencl,gpu -device=mali -max_num_threads=256", "conv2d_NCHWc_io.mali", [["TENSOR", [1, 4, 224, 224], "climgfloatw32"], ["TENSOR", [4, 32, 3, 3], "climgfloatw32"], [2, 2], [1, 1, 1, 1], [1, 1], "NCHW", "NCHW4c", "climgfloatw32"], {}], "config": {"index": 5696, "code_hash": null, "entity": [["tile_ic", "sp", [-1, 1, 4]], ["tile_oc", "sp", [-1, 1]], ["tile_ow", "sp", [-1, 7, 1]], ["tile_oh", "sp", [-1, 7, 7]]]}, "result": [[0.004769906799999999], 0, 10.92349648475647, 1615725181.0238886], "version": 0.2, "tvm_version": "0.8.dev0"}
{"input": ["opencl -keys=mali,opencl,gpu -device=mali -max_num_threads=256", "conv2d_NCHWc_io.mali", [["TENSOR", [1, 4, 224, 224], "climgfloatw32"], ["TENSOR", [4, 32, 3, 3], "climgfloatw32"], [2, 2], [1, 1, 1, 1], [1, 1], "NCHW", "NCHW4c", "climgfloatw32"], {}], "config": {"index": 764, "code_hash": null, "entity": [["tile_ic", "sp", [-1, 1, 4]], ["tile_oc", "sp", [-1, 1]], ["tile_ow", "sp", [-1, 16, 2]], ["tile_oh", "sp", [-1, 4, 1]]]}, "result": [[0.0041574066], 0, 14.569230318069458, 1615725185.090142], "version": 0.2, "tvm_version": "0.8.dev0"}
{"input": ["opencl -keys=mali,opencl,gpu -device=mali -max_num_threads=256", "conv2d_NCHWc_io.mali", [["TENSOR", [1, 4, 224, 224], "climgfloatw32"], ["TENSOR", [4, 32, 3, 3], "climgfloatw32"], [2, 2], [1, 1, 1, 1], [1, 1], "NCHW", "NCHW4c", "climgfloatw32"], {}], "config": {"index": 3904, "code_hash": null, "entity": [["tile_ic", "sp", [-1, 1, 4]], ["tile_oc", "sp", [-1, 1]], ["tile_ow", "sp", [-1, 1, 7]], ["tile_oh", "sp", [-1, 1, 4]]]}, "result": [[0.065342621], 0, 3.4157874584198, 1615725188.7544472], "version": 0.2, "tvm_version": "0.8.dev0"}
{"input": ["opencl -keys=mali,opencl,gpu -device=mali -max_num_threads=256", "conv2d_NCHWc_io.mali", [["TENSOR", [1, 4, 224, 224], "climgfloatw32"], ["TENSOR", [4, 32, 3, 3], "climgfloatw32"], [2, 2], [1, 1, 1, 1], [1, 1], "NCHW", "NCHW4c", "climgfloatw32"], {}], "config": {"index": 5852, "code_hash": null, "entity": [["tile_ic", "sp", [-1, 1, 4]], ["tile_oc", "sp", [-1, 1]], ["tile_ow", "sp", [-1, 1, 1]], ["tile_oh", "sp", [-1, 8, 7]]]}, "result": [[0.0051827088], 0, 4.672102928161621, 1615725190.295302], "version": 0.2, "tvm_version": "0.8.dev0"}
{"input": ["opencl -keys=mali,opencl,gpu -device=mali -max_num_threads=256", "conv2d_NCHWc_io.mali", [["TENSOR", [1, 4, 224, 224], "climgfloatw32"], ["TENSOR", [4, 32, 3, 3], "climgfloatw32"], [2, 2], [1, 1, 1, 1], [1, 1], "NCHW", "NCHW4c", "climgfloatw32"], {}], "config": {"index": 3021, "code_hash": null, "entity": [["tile_ic", "sp", [-1, 1, 4]], ["tile_oc", "sp", [-1, 2]], ["tile_ow", "sp", [-1, 4, 4]], ["tile_oh", "sp", [-1, 8, 2]]]}, "result": [[0.0189732726], 0, 6.391834497451782, 1615725191.9611742], "version": 0.2, "tvm_version": "0.8.dev0"}
{"input": ["opencl -keys=mali,opencl,gpu -device=mali -max_num_threads=256", "conv2d_NCHWc_io.mali", [["TENSOR", [1, 4, 224, 224], "climgfloatw32"], ["TENSOR", [4, 32, 3, 3], "climgfloatw32"], [2, 2], [1, 1, 1, 1], [1, 1], "NCHW", "NCHW4c", "climgfloatw32"], {}], "config": {"index": 3728, "code_hash": null, "entity": [["tile_ic", "sp", [-1, 1, 4]], ["tile_oc", "sp", [-1, 1]], ["tile_ow", "sp", [-1, 28, 4]], ["tile_oh", "sp", [-1, 28, 2]]]}, "result": [[0.0194771478], 0, 8.090256452560425, 1615725193.7141967], "version": 0.2, "tvm_version": "0.8.dev0"}
{"input": ["opencl -keys=mali,opencl,gpu -device=mali -max_num_threads=256", "conv2d_NCHWc_io.mali", [["TENSOR", [1, 4, 224, 224], "climgfloatw32"], ["TENSOR", [4, 32, 3, 3], "climgfloatw32"], [2, 2], [1, 1, 1, 1], [1, 1], "NCHW", "NCHW4c", "climgfloatw32"], {}], "config": {"index": 4103, "code_hash": null, "entity": [["tile_ic", "sp", [-1, 1, 4]], ["tile_oc", "sp", [-1, 8]], ["tile_ow", "sp", [-1, 16, 7]], ["tile_oh", "sp", [-1, 2, 4]]]}, "result": [[0.0167916788], 0, 10.492177248001099, 1615725195.8651514], "version": 0.2, "tvm_version": "0.8.dev0"}
{"input": ["opencl -keys=mali,opencl,gpu -device=mali -max_num_threads=256", "conv2d_NCHWc_io.mali", [["TENSOR", [1, 4, 224, 224], "climgfloatw32"], ["TENSOR", [4, 32, 3, 3], "climgfloatw32"], [2, 2], [1, 1, 1, 1], [1, 1], "NCHW", "NCHW4c", "climgfloatw32"], {}], "config": {"index": 3356, "code_hash": null, "entity": [["tile_ic", "sp", [-1, 1, 4]], ["tile_oc", "sp", [-1, 1]], ["tile_ow", "sp", [-1, 1, 4]], ["tile_oh", "sp", [-1, 16, 2]]]}, "result": [[0.0048592818], 0, 12.311092853546143, 1615725197.7335036], "version": 0.2, "tvm_version": "0.8.dev0"}
{"input": ["opencl -keys=mali,opencl,gpu -device=mali -max_num_threads=256", "conv2d_NCHWc_io.mali", [["TENSOR", [1, 4, 224, 224], "climgfloatw32"], ["TENSOR", [4, 32, 3, 3], "climgfloatw32"], [2, 2], [1, 1, 1, 1], [1, 1], "NCHW", "NCHW4c", "climgfloatw32"], {}], "config": {"index": 4528, "code_hash": null, "entity": [["tile_ic", "sp", [-1, 1, 4]], ["tile_oc", "sp", [-1, 1]], ["tile_ow", "sp", [-1, 2, 2]], ["tile_oh", "sp", [-1, 8, 4]]]}, "result": [[0.0056800838], 0, 2.489778995513916, 1615725260.193322], "version": 0.2, "tvm_version": "0.8.dev0"}
{"input": ["opencl -keys=mali,opencl,gpu -device=mali -max_num_threads=256", "conv2d_NCHWc_io.mali", [["TENSOR", [1, 4, 224, 224], "climgfloatw32"], ["TENSOR", [4, 32, 3, 3], "climgfloatw32"], [2, 2], [1, 1, 1, 1], [1, 1], "NCHW", "NCHW4c", "climgfloatw32"], {}], "config": {"index": 2772, "code_hash": null, "entity": [["tile_ic", "sp", [-1, 1, 4]], ["tile_oc", "sp", [-1, 1]], ["tile_ow", "sp", [-1, 7, 1]], ["tile_oh", "sp", [-1, 7, 2]]]}, "result": [[0.0104133344], 0, 3.541116952896118, 1615725261.7172697], "version": 0.2, "tvm_version": "0.8.dev0"}
{"input": ["opencl -keys=mali,opencl,gpu -device=mali -max_num_threads=256", "conv2d_NCHWc_io.mali", [["TENSOR", [1, 4, 224, 224], "climgfloatw32"], ["TENSOR", [4, 32, 3, 3], "climgfloatw32"], [2, 2], [1, 1, 1, 1], [1, 1], "NCHW", "NCHW4c", "climgfloatw32"], {}], "config": {"index": 3328, "code_hash": null, "entity": [["tile_ic", "sp", [-1, 1, 4]], ["tile_oc", "sp", [-1, 1]], ["tile_ow", "sp", [-1, 4, 2]], ["tile_oh", "sp", [-1, 16, 2]]]}, "result": [[0.0049235108], 0, 5.2047436237335205, 1615725263.1718624], "version": 0.2, "tvm_version": "0.8.dev0"}
{"input": ["opencl -keys=mali,opencl,gpu -device=mali -max_num_threads=256", "conv2d_NCHWc_io.mali", [["TENSOR", [1, 4, 224, 224], "climgfloatw32"], ["TENSOR", [4, 32, 3, 3], "climgfloatw32"], [2, 2], [1, 1, 1, 1], [1, 1], "NCHW", "NCHW4c", "climgfloatw32"], {}], "config": {"index": 2600, "code_hash": null, "entity": [["tile_ic", "sp", [-1, 1, 4]], ["tile_oc", "sp", [-1, 1]], ["tile_ow", "sp", [-1, 7, 1]], ["tile_oh", "sp", [-1, 4, 2]]]}, "result": [[0.008247928], 0, 6.391943693161011, 1615725264.583615], "version": 0.2, "tvm_version": "0.8.dev0"}
{"input": ["opencl -keys=mali,opencl,gpu -device=mali -max_num_threads=256", "conv2d_NCHWc_io.mali", [["TENSOR", [1, 4, 224, 224], "climgfloatw32"], ["TENSOR", [4, 32, 3, 3], "climgfloatw32"], [2, 2], [1, 1, 1, 1], [1, 1], "NCHW", "NCHW4c", "climgfloatw32"], {}], "config": {"index": 4316, "code_hash": null, "entity": [["tile_ic", "sp", [-1, 1, 4]], ["tile_oc", "sp", [-1, 1]], ["tile_ow", "sp", [-1, 4, 1]], ["tile_oh", "sp", [-1, 7, 4]]]}, "result": [[0.007191563199999999], 0, 7.833861351013184, 1615725265.9793367], "version": 0.2, "tvm_version": "0.8.dev0"}
{"input": ["opencl -keys=mali,opencl,gpu -device=mali -max_num_threads=256", "conv2d_NCHWc_io.mali", [["TENSOR", [1, 4, 224, 224], "climgfloatw32"], ["TENSOR", [4, 32, 3, 3], "climgfloatw32"], [2, 2], [1, 1, 1, 1], [1, 1], "NCHW", "NCHW4c", "climgfloatw32"], {}], "config": {"index": 5692, "code_hash": null, "entity": [["tile_ic", "sp", [-1, 1, 4]], ["tile_oc", "sp", [-1, 1]], ["tile_ow", "sp", [-1, 4, 1]], ["tile_oh", "sp", [-1, 7, 7]]]}, "result": [[0.0048202192], 0, 9.93803596496582, 1615725267.7154696], "version": 0.2, "tvm_version": "0.8.dev0"}
{"input": ["opencl -keys=mali,opencl,gpu -device=mali -max_num_threads=256", "conv2d_NCHWc_io.mali", [["TENSOR", [1, 4, 224, 224], "climgfloatw32"], ["TENSOR", [4, 32, 3, 3], "climgfloatw32"], [2, 2], [1, 1, 1, 1], [1, 1], "NCHW", "NCHW4c", "climgfloatw32"], {}], "config": {"index": 2601, "code_hash": null, "entity": [["tile_ic", "sp", [-1, 1, 4]], ["tile_oc", "sp", [-1, 2]], ["tile_ow", "sp", [-1, 7, 1]], ["tile_oh", "sp", [-1, 4, 2]]]}, "result": [[0.0101822198], 0, 12.51295781135559, 1615725270.7187262], "version": 0.2, "tvm_version": "0.8.dev0"}
{"input": ["opencl -keys=mali,opencl,gpu -device=mali -max_num_threads=256", "conv2d_NCHWc_io.mali", [["TENSOR", [1, 4, 224, 224], "climgfloatw32"], ["TENSOR", [4, 32, 3, 3], "climgfloatw32"], [2, 2], [1, 1, 1, 1], [1, 1], "NCHW", "NCHW4c", "climgfloatw32"], {}], "config": {"index": 4832, "code_hash": null, "entity": [["tile_ic", "sp", [-1, 1, 4]], ["tile_oc", "sp", [-1, 1]], ["tile_ow", "sp", [-1, 4, 1]], ["tile_oh", "sp", [-1, 16, 4]]]}, "result": [[0.004108469], 0, 11.329375267028809, 1615725269.3009493], "version": 0.2, "tvm_version": "0.8.dev0"}
{"input": ["opencl -keys=mali,opencl,gpu -device=mali -max_num_threads=256", "conv2d_NCHWc_io.mali", [["TENSOR", [1, 4, 224, 224], "climgfloatw32"], ["TENSOR", [4, 32, 3, 3], "climgfloatw32"], [2, 2], [1, 1, 1, 1], [1, 1], "NCHW", "NCHW4c", "climgfloatw32"], {}], "config": {"index": 4868, "code_hash": null, "entity": [["tile_ic", "sp", [-1, 1, 4]], ["tile_oc", "sp", [-1, 1]], ["tile_ow", "sp", [-1, 1, 2]], ["tile_oh", "sp", [-1, 16, 4]]]}, "result": [[0.0057465214], 0, 2.3044183254241943, 1615725273.3648005], "version": 0.2, "tvm_version": "0.8.dev0"}
{"input": ["opencl -keys=mali,opencl,gpu -device=mali -max_num_threads=256", "conv2d_NCHWc_io.mali", [["TENSOR", [1, 4, 224, 224], "climgfloatw32"], ["TENSOR", [4, 32, 3, 3], "climgfloatw32"], [2, 2], [1, 1, 1, 1], [1, 1], "NCHW", "NCHW4c", "climgfloatw32"], {}], "config": {"index": 4525, "code_hash": null, "entity": [["tile_ic", "sp", [-1, 1, 4]], ["tile_oc", "sp", [-1, 2]], ["tile_ow", "sp", [-1, 1, 2]], ["tile_oh", "sp", [-1, 8, 4]]]}, "result": [[0.0053387192], 0, 4.029231309890747, 1615725275.134423], "version": 0.2, "tvm_version": "0.8.dev0"}
{"input": ["opencl -keys=mali,opencl,gpu -device=mali -max_num_threads=256", "conv2d_NCHWc_io.mali", [["TENSOR", [1, 4, 224, 224], "climgfloatw32"], ["TENSOR", [4, 32, 3, 3], "climgfloatw32"], [2, 2], [1, 1, 1, 1], [1, 1], "NCHW", "NCHW4c", "climgfloatw32"], {}], "config": {"index": 3288, "code_hash": null, "entity": [["tile_ic", "sp", [-1, 1, 4]], ["tile_oc", "sp", [-1, 1]], ["tile_ow", "sp", [-1, 7, 1]], ["tile_oh", "sp", [-1, 16, 2]]]}, "result": [[0.0038406358], 0, 5.071106195449829, 1615725276.4431758], "version": 0.2, "tvm_version": "0.8.dev0"}
{"input": ["opencl -keys=mali,opencl,gpu -device=mali -max_num_threads=256", "conv2d_NCHWc_io.mali", [["TENSOR", [1, 4, 224, 224], "climgfloatw32"], ["TENSOR", [4, 32, 3, 3], "climgfloatw32"], [2, 2], [1, 1, 1, 1], [1, 1], "NCHW", "NCHW4c", "climgfloatw32"], {}], "config": {"index": 4872, "code_hash": null, "entity": [["tile_ic", "sp", [-1, 1, 4]], ["tile_oc", "sp", [-1, 1]], ["tile_ow", "sp", [-1, 2, 2]], ["tile_oh", "sp", [-1, 16, 4]]]}, "result": [[0.004398167], 0, 7.174604177474976, 1615725278.1773317], "version": 0.2, "tvm_version": "0.8.dev0"}
{"input": ["opencl -keys=mali,opencl,gpu -device=mali -max_num_threads=256", "conv2d_NCHWc_io.mali", [["TENSOR", [1, 4, 224, 224], "climgfloatw32"], ["TENSOR", [4, 32, 3, 3], "climgfloatw32"], [2, 2], [1, 1, 1, 1], [1, 1], "NCHW", "NCHW4c", "climgfloatw32"], {}], "config": {"index": 2608, "code_hash": null, "entity": [["tile_ic", "sp", [-1, 1, 4]], ["tile_oc", "sp", [-1, 1]], ["tile_ow", "sp", [-1, 14, 1]], ["tile_oh", "sp", [-1, 4, 2]]]}, "result": [[0.010296240600000001], 0, 8.058745861053467, 1615725279.600352], "version": 0.2, "tvm_version": "0.8.dev0"}
{"input": ["opencl -keys=mali,opencl,gpu -device=mali -max_num_threads=256", "conv2d_NCHWc_io.mali", [["TENSOR", [1, 4, 224, 224], "climgfloatw32"], ["TENSOR", [4, 32, 3, 3], "climgfloatw32"], [2, 2], [1, 1, 1, 1], [1, 1], "NCHW", "NCHW4c", "climgfloatw32"], {}], "config": {"index": 4529, "code_hash": null, "entity": [["tile_ic", "sp", [-1, 1, 4]], ["tile_oc", "sp", [-1, 2]], ["tile_ow", "sp", [-1, 2, 2]], ["tile_oh", "sp", [-1, 8, 4]]]}, "result": [[0.0045282192], 0, 10.454423904418945, 1615725281.4608066], "version": 0.2, "tvm_version": "0.8.dev0"}
{"input": ["opencl -keys=mali,opencl,gpu -device=mali -max_num_threads=256", "conv2d_NCHWc_io.mali", [["TENSOR", [1, 4, 224, 224], "climgfloatw32"], ["TENSOR", [4, 32, 3, 3], "climgfloatw32"], [2, 2], [1, 1, 1, 1], [1, 1], "NCHW", "NCHW4c", "climgfloatw32"], {}], "config": {"index": 2776, "code_hash": null, "entity": [["tile_ic", "sp", [-1, 1, 4]], ["tile_oc", "sp", [-1, 1]], ["tile_ow", "sp", [-1, 8, 1]], ["tile_oh", "sp", [-1, 7, 2]]]}, "result": [[0.010679167600000001], 0, 11.363420963287354, 1615725282.91913], "version": 0.2, "tvm_version": "0.8.dev0"}
{"input": ["opencl -keys=mali,opencl,gpu -device=mali -max_num_threads=256", "conv2d_NCHWc_io.mali", [["TENSOR", [1, 4, 224, 224], "climgfloatw32"], ["TENSOR", [4, 32, 3, 3], "climgfloatw32"], [2, 2], [1, 1, 1, 1], [1, 1], "NCHW", "NCHW4c", "climgfloatw32"], {}], "config": {"index": 4148, "code_hash": null, "entity": [["tile_ic", "sp", [-1, 1, 4]], ["tile_oc", "sp", [-1, 1]], ["tile_ow", "sp", [-1, 7, 1]], ["tile_oh", "sp", [-1, 4, 4]]]}, "result": [[0.007049240199999999], 0, 12.822814226150513, 1615725284.3185973], "version": 0.2, "tvm_version": "0.8.dev0"}
{"input": ["opencl -keys=mali,opencl,gpu -device=mali -max_num_threads=256", "conv2d_NCHWc_io.mali", [["TENSOR", [1, 4, 224, 224], "climgfloatw32"], ["TENSOR", [4, 32, 3, 3], "climgfloatw32"], [2, 2], [1, 1, 1, 1], [1, 1], "NCHW", "NCHW4c", "climgfloatw32"], {}], "config": {"index": 3324, "code_hash": null, "entity": [["tile_ic", "sp", [-1, 1, 4]], ["tile_oc", "sp", [-1, 1]], ["tile_ow", "sp", [-1, 2, 2]], ["tile_oh", "sp", [-1, 16, 2]]]}, "result": [[0.0038208753999999998], 0, 1.9151735305786133, 1615725287.1112509], "version": 0.2, "tvm_version": "0.8.dev0"}
{"input": ["opencl -keys=mali,opencl,gpu -device=mali -max_num_threads=256", "conv2d_NCHWc_io.mali", [["TENSOR", [1, 4, 224, 224], "climgfloatw32"], ["TENSOR", [4, 32, 3, 3], "climgfloatw32"], [2, 2], [1, 1, 1, 1], [1, 1], "NCHW", "NCHW4c", "climgfloatw32"], {}], "config": {"index": 4144, "code_hash": null, "entity": [["tile_ic", "sp", [-1, 1, 4]], ["tile_oc", "sp", [-1, 1]], ["tile_ow", "sp", [-1, 4, 1]], ["tile_oh", "sp", [-1, 4, 4]]]}, "result": [[0.0055979278], 0, 3.1781532764434814, 1615725288.5541117], "version": 0.2, "tvm_version": "0.8.dev0"}
{"input": ["opencl -keys=mali,opencl,gpu -device=mali -max_num_threads=256", "conv2d_NCHWc_io.mali", [["TENSOR", [1, 4, 224, 224], "climgfloatw32"], ["TENSOR", [4, 32, 3, 3], "climgfloatw32"], [2, 2], [1, 1, 1, 1], [1, 1], "NCHW", "NCHW4c", "climgfloatw32"], {}], "config": {"index": 4145, "code_hash": null, "entity": [["tile_ic", "sp", [-1, 1, 4]], ["tile_oc", "sp", [-1, 2]], ["tile_ow", "sp", [-1, 4, 1]], ["tile_oh", "sp", [-1, 4, 4]]]}, "result": [[0.007083157], 0, 4.580307245254517, 1615725289.9554691], "version": 0.2, "tvm_version": "0.8.dev0"}
{"input": ["opencl -keys=mali,opencl,gpu -device=mali -max_num_threads=256", "conv2d_NCHWc_io.mali", [["TENSOR", [1, 4, 224, 224], "climgfloatw32"], ["TENSOR", [4, 32, 3, 3], "climgfloatw32"], [2, 2], [1, 1, 1, 1], [1, 1], "NCHW", "NCHW4c", "climgfloatw32"], {}], "config": {"index": 6764, "code_hash": null, "entity": [["tile_ic", "sp", [-1, 1, 4]], ["tile_oc", "sp", [-1, 1]], ["tile_ow", "sp", [-1, 2, 2]], ["tile_oh", "sp", [-1, 4, 8]]]}, "result": [[0.009341907200000001], 0, 9.874569654464722, 1615725294.4597194], "version": 0.2, "tvm_version": "0.8.dev0"}
{"input": ["opencl -keys=mali,opencl,gpu -device=mali -max_num_threads=256", "conv2d_NCHWc_io.mali", [["TENSOR", [1, 4, 224, 224], "climgfloatw32"], ["TENSOR", [4, 32, 3, 3], "climgfloatw32"], [2, 2], [1, 1, 1, 1], [1, 1], "NCHW", "NCHW4c", "climgfloatw32"], {}], "config": {"index": 2124, "code_hash": null, "entity": [["tile_ic", "sp", [-1, 1, 4]], ["tile_oc", "sp", [-1, 1]], ["tile_ow", "sp", [-1, 4, 2]], ["tile_oh", "sp", [-1, 32, 2]]]}, "result": [[0.004830375600000001], 0, 6.165121555328369, 1615725291.347427], "version": 0.2, "tvm_version": "0.8.dev0"}
{"input": ["opencl -keys=mali,opencl,gpu -device=mali -max_num_threads=256", "conv2d_NCHWc_io.mali", [["TENSOR", [1, 4, 224, 224], "climgfloatw32"], ["TENSOR", [4, 32, 3, 3], "climgfloatw32"], [2, 2], [1, 1, 1, 1], [1, 1], "NCHW", "NCHW4c", "climgfloatw32"], {}], "config": {"index": 3332, "code_hash": null, "entity": [["tile_ic", "sp", [-1, 1, 4]], ["tile_oc", "sp", [-1, 1]], ["tile_ow", "sp", [-1, 7, 2]], ["tile_oh", "sp", [-1, 16, 2]]]}, "result": [[0.0048733338], 0, 12.046321630477905, 1615725297.2268748], "version": 0.2, "tvm_version": "0.8.dev0"}
{"input": ["opencl -keys=mali,opencl,gpu -device=mali -max_num_threads=256", "conv2d_NCHWc_io.mali", [["TENSOR", [1, 4, 224, 224], "climgfloatw32"], ["TENSOR", [4, 32, 3, 3], "climgfloatw32"], [2, 2], [1, 1, 1, 1], [1, 1], "NCHW", "NCHW4c", "climgfloatw32"], {}], "config": {"index": 3292, "code_hash": null, "entity": [["tile_ic", "sp", [-1, 1, 4]], ["tile_oc", "sp", [-1, 1]], ["tile_ow", "sp", [-1, 8, 1]], ["tile_oh", "sp", [-1, 16, 2]]]}, "result": [[0.0036554482], 0, 10.437562227249146, 1615725295.7862637], "version": 0.2, "tvm_version": "0.8.dev0"}
{"input": ["opencl -keys=mali,opencl,gpu -device=mali -max_num_threads=256", "conv2d_NCHWc_io.mali", [["TENSOR", [1, 4, 224, 224], "climgfloatw32"], ["TENSOR", [4, 32, 3, 3], "climgfloatw32"], [2, 2], [1, 1, 1, 1], [1, 1], "NCHW", "NCHW4c", "climgfloatw32"], {}], "config": {"index": 4524, "code_hash": null, "entity": [["tile_ic", "sp", [-1, 1, 4]], ["tile_oc", "sp", [-1, 1]], ["tile_ow", "sp", [-1, 1, 2]], ["tile_oh", "sp", [-1, 8, 4]]]}, "result": [[0.0082061258], 0, 14.006742000579834, 1615725299.0434616], "version": 0.2, "tvm_version": "0.8.dev0"}
{"input": ["opencl -keys=mali,opencl,gpu -device=mali -max_num_threads=256", "conv2d_NCHWc_io.mali", [["TENSOR", [1, 4, 224, 224], "climgfloatw32"], ["TENSOR", [4, 32, 3, 3], "climgfloatw32"], [2, 2], [1, 1, 1, 1], [1, 1], "NCHW", "NCHW4c", "climgfloatw32"], {}], "config": {"index": 4317, "code_hash": null, "entity": [["tile_ic", "sp", [-1, 1, 4]], ["tile_oc", "sp", [-1, 2]], ["tile_ow", "sp", [-1, 4, 1]], ["tile_oh", "sp", [-1, 7, 4]]]}, "result": [[0.0088211362], 0, 1.6640701293945312, 1615725301.3326871], "version": 0.2, "tvm_version": "0.8.dev0"}
{"input": ["opencl -keys=mali,opencl,gpu -device=mali -max_num_threads=256", "conv2d_NCHWc_io.mali", [["TENSOR", [1, 4, 224, 224], "climgfloatw32"], ["TENSOR", [4, 32, 3, 3], "climgfloatw32"], [2, 2], [1, 1, 1, 1], [1, 1], "NCHW", "NCHW4c", "climgfloatw32"], {}], "config": {"index": 4489, "code_hash": null, "entity": [["tile_ic", "sp", [-1, 1, 4]], ["tile_oc", "sp", [-1, 2]], ["tile_ow", "sp", [-1, 4, 1]], ["tile_oh", "sp", [-1, 8, 4]]]}, "result": [[0.0040610316], 0, 3.5313808917999268, 1615725302.9914267], "version": 0.2, "tvm_version": "0.8.dev0"}
{"input": ["opencl -keys=mali,opencl,gpu -device=mali -max_num_threads=256", "conv2d_NCHWc_io.mali", [["TENSOR", [1, 4, 224, 224], "climgfloatw32"], ["TENSOR", [4, 32, 3, 3], "climgfloatw32"], [2, 2], [1, 1, 1, 1], [1, 1], "NCHW", "NCHW4c", "climgfloatw32"], {}], "config": {"index": 5684, "code_hash": null, "entity": [["tile_ic", "sp", [-1, 1, 4]], ["tile_oc", "sp", [-1, 1]], ["tile_ow", "sp", [-1, 2, 1]], ["tile_oh", "sp", [-1, 7, 7]]]}, "result": [[0.0063636466], 0, 5.4748101234436035, 1615725304.7628365], "version": 0.2, "tvm_version": "0.8.dev0"}
{"input": ["opencl -keys=mali,opencl,gpu -device=mali -max_num_threads=256", "conv2d_NCHWc_io.mali", [["TENSOR", [1, 4, 224, 224], "climgfloatw32"], ["TENSOR", [4, 32, 3, 3], "climgfloatw32"], [2, 2], [1, 1, 1, 1], [1, 1], "NCHW", "NCHW4c", "climgfloatw32"], {}], "config": {"index": 3814, "code_hash": null, "entity": [["tile_ic", "sp", [-1, 1, 4]], ["tile_oc", "sp", [-1, 4]], ["tile_ow", "sp", [-1, 14, 1]], ["tile_oh", "sp", [-1, 1, 4]]]}, "result": [[0.0086193342], 0, 6.530497074127197, 1615725306.2228756], "version": 0.2, "tvm_version": "0.8.dev0"}
{"input": ["opencl -keys=mali,opencl,gpu -device=mali -max_num_threads=256", "conv2d_NCHWc_io.mali", [["TENSOR", [1, 4, 224, 224], "climgfloatw32"], ["TENSOR", [4, 32, 3, 3], "climgfloatw32"], [2, 2], [1, 1, 1, 1], [1, 1], "NCHW", "NCHW4c", "climgfloatw32"], {}], "config": {"index": 2944, "code_hash": null, "entity": [["tile_ic", "sp", [-1, 1, 4]], ["tile_oc", "sp", [-1, 1]], ["tile_ow", "sp", [-1, 7, 1]], ["tile_oh", "sp", [-1, 8, 2]]]}, "result": [[0.0104024282], 0, 7.846626281738281, 1615725307.6284933], "version": 0.2, "tvm_version": "0.8.dev0"}
{"input": ["opencl -keys=mali,opencl,gpu -device=mali -max_num_threads=256", "conv2d_NCHWc_io.mali", [["TENSOR", [1, 4, 224, 224], "climgfloatw32"], ["TENSOR", [4, 32, 3, 3], "climgfloatw32"], [2, 2], [1, 1, 1, 1], [1, 1], "NCHW", "NCHW4c", "climgfloatw32"], {}], "config": {"index": 4492, "code_hash": null, "entity": [["tile_ic", "sp", [-1, 1, 4]], ["tile_oc", "sp", [-1, 1]], ["tile_ow", "sp", [-1, 7, 1]], ["tile_oh", "sp", [-1, 8, 4]]]}, "result": [[0.0041206566], 0, 9.618494749069214, 1615725309.1108847], "version": 0.2, "tvm_version": "0.8.dev0"}
{"input": ["opencl -keys=mali,opencl,gpu -device=mali -max_num_threads=256", "conv2d_NCHWc_io.mali", [["TENSOR", [1, 4, 224, 224], "climgfloatw32"], ["TENSOR", [4, 32, 3, 3], "climgfloatw32"], [2, 2], [1, 1, 1, 1], [1, 1], "NCHW", "NCHW4c", "climgfloatw32"], {}], "config": {"index": 3116, "code_hash": null, "entity": [["tile_ic", "sp", [-1, 1, 4]], ["tile_oc", "sp", [-1, 1]], ["tile_ow", "sp", [-1, 7, 1]], ["tile_oh", "sp", [-1, 14, 2]]]}, "result": [[0.0124264076], 0, 10.763922452926636, 1615725310.5714436], "version": 0.2, "tvm_version": "0.8.dev0"}
{"input": ["opencl -keys=mali,opencl,gpu -device=mali -max_num_threads=256", "conv2d_NCHWc_io.mali", [["TENSOR", [1, 4, 224, 224], "climgfloatw32"], ["TENSOR", [4, 32, 3, 3], "climgfloatw32"], [2, 2], [1, 1, 1, 1], [1, 1], "NCHW", "NCHW4c", "climgfloatw32"], {}], "config": {"index": 3976, "code_hash": null, "entity": [["tile_ic", "sp", [-1, 1, 4]], ["tile_oc", "sp", [-1, 1]], ["tile_ow", "sp", [-1, 7, 1]], ["tile_oh", "sp", [-1, 2, 4]]]}, "result": [[0.0056644068], 0, 12.250468015670776, 1615725311.977407], "version": 0.2, "tvm_version": "0.8.dev0"}
{"input": ["opencl -keys=mali,opencl,gpu -device=mali -max_num_threads=256", "conv2d_NCHWc_io.mali", [["TENSOR", [1, 4, 224, 224], "climgfloatw32"], ["TENSOR", [4, 32, 3, 3], "climgfloatw32"], [2, 2], [1, 1, 1, 1], [1, 1], "NCHW", "NCHW4c", "climgfloatw32"], {}], "config": {"index": 2604, "code_hash": null, "entity": [["tile_ic", "sp", [-1, 1, 4]], ["tile_oc", "sp", [-1, 1]], ["tile_ow", "sp", [-1, 8, 1]], ["tile_oh", "sp", [-1, 4, 2]]]}, "result": [[0.0088877508], 0, 1.490013599395752, 1615725314.4651535], "version": 0.2, "tvm_version": "0.8.dev0"}
{"input": ["opencl -keys=mali,opencl,gpu -device=mali -max_num_threads=256", "conv2d_NCHWc_io.mali", [["TENSOR", [1, 4, 224, 224], "climgfloatw32"], ["TENSOR", [4, 32, 3, 3], "climgfloatw32"], [2, 2], [1, 1, 1, 1], [1, 1], "NCHW", "NCHW4c", "climgfloatw32"], {}], "config": {"index": 2428, "code_hash": null, "entity": [["tile_ic", "sp", [-1, 1, 4]], ["tile_oc", "sp", [-1, 1]], ["tile_ow", "sp", [-1, 7, 1]], ["tile_oh", "sp", [-1, 2, 2]]]}, "result": [[0.007882500800000001], 0, 2.9176392555236816, 1615725315.8962455], "version": 0.2, "tvm_version": "0.8.dev0"}
{"input": ["opencl -keys=mali,opencl,gpu -device=mali -max_num_threads=256", "conv2d_NCHWc_io.mali", [["TENSOR", [1, 4, 224, 224], "climgfloatw32"], ["TENSOR", [4, 32, 3, 3], "climgfloatw32"], [2, 2], [1, 1, 1, 1], [1, 1], "NCHW", "NCHW4c", "climgfloatw32"], {}], "config": {"index": 5732, "code_hash": null, "entity": [["tile_ic", "sp", [-1, 1, 4]], ["tile_oc", "sp", [-1, 1]], ["tile_ow", "sp", [-1, 2, 2]], ["tile_oh", "sp", [-1, 7, 7]]]}, "result": [[0.0070146258], 0, 6.291865587234497, 1615725318.5339699], "version": 0.2, "tvm_version": "0.8.dev0"}
{"input": ["opencl -keys=mali,opencl,gpu -device=mali -max_num_threads=256", "conv2d_NCHWc_io.mali", [["TENSOR", [1, 4, 224, 224], "climgfloatw32"], ["TENSOR", [4, 32, 3, 3], "climgfloatw32"], [2, 2], [1, 1, 1, 1], [1, 1], "NCHW", "NCHW4c", "climgfloatw32"], {}], "config": {"index": 2436, "code_hash": null, "entity": [["tile_ic", "sp", [-1, 1, 4]], ["tile_oc", "sp", [-1, 1]], ["tile_ow", "sp", [-1, 14, 1]], ["tile_oh", "sp", [-1, 2, 2]]]}, "result": [[0.008285428000000001], 0, 8.431013345718384, 1615725321.416219], "version": 0.2, "tvm_version": "0.8.dev0"}
{"input": ["opencl -keys=mali,opencl,gpu -device=mali -max_num_threads=256", "conv2d_NCHWc_io.mali", [["TENSOR", [1, 4, 224, 224], "climgfloatw32"], ["TENSOR", [4, 32, 3, 3], "climgfloatw32"], [2, 2], [1, 1, 1, 1], [1, 1], "NCHW", "NCHW4c", "climgfloatw32"], {}], "config": {"index": 4320, "code_hash": null, "entity": [["tile_ic", "sp", [-1, 1, 4]], ["tile_oc", "sp", [-1, 1]], ["tile_ow", "sp", [-1, 7, 1]], ["tile_oh", "sp", [-1, 7, 4]]]}, "result": [[0.009456553], 0, 7.043081760406494, 1615725319.9851549], "version": 0.2, "tvm_version": "0.8.dev0"}
{"input": ["opencl -keys=mali,opencl,gpu -device=mali -max_num_threads=256", "conv2d_NCHWc_io.mali", [["TENSOR", [1, 4, 224, 224], "climgfloatw32"], ["TENSOR", [4, 32, 3, 3], "climgfloatw32"], [2, 2], [1, 1, 1, 1], [1, 1], "NCHW", "NCHW4c", "climgfloatw32"], {}], "config": {"index": 3284, "code_hash": null, "entity": [["tile_ic", "sp", [-1, 1, 4]], ["tile_oc", "sp", [-1, 1]], ["tile_ow", "sp", [-1, 4, 1]], ["tile_oh", "sp", [-1, 16, 2]]]}, "result": [[0.0039110524], 0, 9.861295700073242, 1615725322.723971], "version": 0.2, "tvm_version": "0.8.dev0"}
{"input": ["opencl -keys=mali,opencl,gpu -device=mali -max_num_threads=256", "conv2d_NCHWc_io.mali", [["TENSOR", [1, 4, 224, 224], "climgfloatw32"], ["TENSOR", [4, 32, 3, 3], "climgfloatw32"], [2, 2], [1, 1, 1, 1], [1, 1], "NCHW", "NCHW4c", "climgfloatw32"], {}], "config": {"index": 2605, "code_hash": null, "entity": [["tile_ic", "sp", [-1, 1, 4]], ["tile_oc", "sp", [-1, 2]], ["tile_ow", "sp", [-1, 8, 1]], ["tile_oh", "sp", [-1, 4, 2]]]}, "result": [[0.0106755532], 0, 11.218937873840332, 1615725324.2252805], "version": 0.2, "tvm_version": "0.8.dev0"}
{"input": ["opencl -keys=mali,opencl,gpu -device=mali -max_num_threads=256", "conv2d_NCHWc_io.mali", [["TENSOR", [1, 4, 224, 224], "climgfloatw32"], ["TENSOR", [4, 32, 3, 3], "climgfloatw32"], [2, 2], [1, 1, 1, 1], [1, 1], "NCHW", "NCHW4c", "climgfloatw32"], {}], "config": {"index": 100, "code_hash": null, "entity": [["tile_ic", "sp", [-1, 1, 4]], ["tile_oc", "sp", [-1, 1]], ["tile_ow", "sp", [-1, 7, 4]], ["tile_oh", "sp", [-1, 32, 1]]]}, "result": [[0.0054338652000000005], 0, 12.967409133911133, 1615725325.699752], "version": 0.2, "tvm_version": "0.8.dev0"}
{"input": ["opencl -keys=mali,opencl,gpu -device=mali -max_num_threads=256", "conv2d_NCHWc_io.mali", [["TENSOR", [1, 4, 224, 224], "climgfloatw32"], ["TENSOR", [4, 32, 3, 3], "climgfloatw32"], [2, 2], [1, 1, 1, 1], [1, 1], "NCHW", "NCHW4c", "climgfloatw32"], {}], "config": {"index": 2780, "code_hash": null, "entity": [["tile_ic", "sp", [-1, 1, 4]], ["tile_oc", "sp", [-1, 1]], ["tile_ow", "sp", [-1, 14, 1]], ["tile_oh", "sp", [-1, 7, 2]]]}, "result": [[0.0123727096], 0, 3.1027400493621826, 1615725329.7223783], "version": 0.2, "tvm_version": "0.8.dev0"}
{"input": ["opencl -keys=mali,opencl,gpu -device=mali -max_num_threads=256", "conv2d_NCHWc_io.mali", [["TENSOR", [1, 4, 224, 224], "climgfloatw32"], ["TENSOR", [4, 32, 3, 3], "climgfloatw32"], [2, 2], [1, 1, 1, 1], [1, 1], "NCHW", "NCHW4c", "climgfloatw32"], {}], "config": {"index": 3120, "code_hash": null, "entity": [["tile_ic", "sp", [-1, 1, 4]], ["tile_oc", "sp", [-1, 1]], ["tile_ow", "sp", [-1, 8, 1]], ["tile_oh", "sp", [-1, 14, 2]]]}, "result": [[0.0118656054], 0, 1.6302235126495361, 1615725328.2555923], "version": 0.2, "tvm_version": "0.8.dev0"}
{"input": ["opencl -keys=mali,opencl,gpu -device=mali -max_num_threads=256", "conv2d_NCHWc_io.mali", [["TENSOR", [1, 4, 224, 224], "climgfloatw32"], ["TENSOR", [4, 32, 3, 3], "climgfloatw32"], [2, 2], [1, 1, 1, 1], [1, 1], "NCHW", "NCHW4c", "climgfloatw32"], {}], "config": {"index": 4496, "code_hash": null, "entity": [["tile_ic", "sp", [-1, 1, 4]], ["tile_oc", "sp", [-1, 1]], ["tile_ow", "sp", [-1, 8, 1]], ["tile_oh", "sp", [-1, 8, 4]]]}, "result": [[0.003997323400000001], 0, 4.785157918930054, 1615725331.1549578], "version": 0.2, "tvm_version": "0.8.dev0"}
{"input": ["opencl -keys=mali,opencl,gpu -device=mali -max_num_threads=256", "conv2d_NCHWc_io.mali", [["TENSOR", [1, 4, 224, 224], "climgfloatw32"], ["TENSOR", [4, 32, 3, 3], "climgfloatw32"], [2, 2], [1, 1, 1, 1], [1, 1], "NCHW", "NCHW4c", "climgfloatw32"], {}], "config": {"index": 2314, "code_hash": null, "entity": [["tile_ic", "sp", [-1, 1, 4]], ["tile_oc", "sp", [-1, 4]], ["tile_ow", "sp", [-1, 16, 2]], ["tile_oh", "sp", [-1, 1, 2]]]}, "result": [[0.0046419692], 0, 6.1603899002075195, 1615725332.5544662], "version": 0.2, "tvm_version": "0.8.dev0"}
{"input": ["opencl -keys=mali,opencl,gpu -device=mali -max_num_threads=256", "conv2d_NCHWc_io.mali", [["TENSOR", [1, 4, 224, 224], "climgfloatw32"], ["TENSOR", [4, 32, 3, 3], "climgfloatw32"], [2, 2], [1, 1, 1, 1], [1, 1], "NCHW", "NCHW4c", "climgfloatw32"], {}], "config": {"index": 5520, "code_hash": null, "entity": [["tile_ic", "sp", [-1, 1, 4]], ["tile_oc", "sp", [-1, 1]], ["tile_ow", "sp", [-1, 4, 1]], ["tile_oh", "sp", [-1, 4, 7]]]}, "result": [[0.0089985842], 0, 7.662860870361328, 1615725334.101362], "version": 0.2, "tvm_version": "0.8.dev0"}
{"input": ["opencl -keys=mali,opencl,gpu -device=mali -max_num_threads=256", "conv2d_NCHWc_io.mali", [["TENSOR", [1, 4, 224, 224], "climgfloatw32"], ["TENSOR", [4, 32, 3, 3], "climgfloatw32"], [2, 2], [1, 1, 1, 1], [1, 1], "NCHW", "NCHW4c", "climgfloatw32"], {}], "config": {"index": 5728, "code_hash": null, "entity": [["tile_ic", "sp", [-1, 1, 4]], ["tile_oc", "sp", [-1, 1]], ["tile_ow", "sp", [-1, 1, 2]], ["tile_oh", "sp", [-1, 7, 7]]]}, "result": [[0.0106983032], 0, 10.827155351638794, 1615725336.8098474], "version": 0.2, "tvm_version": "0.8.dev0"}
{"input": ["opencl -keys=mali,opencl,gpu -device=mali -max_num_threads=256", "conv2d_NCHWc_io.mali", [["TENSOR", [1, 4, 224, 224], "climgfloatw32"], ["TENSOR", [4, 32, 3, 3], "climgfloatw32"], [2, 2], [1, 1, 1, 1], [1, 1], "NCHW", "NCHW4c", "climgfloatw32"], {}], "config": {"index": 5856, "code_hash": null, "entity": [["tile_ic", "sp", [-1, 1, 4]], ["tile_oc", "sp", [-1, 1]], ["tile_ow", "sp", [-1, 2, 1]], ["tile_oh", "sp", [-1, 8, 7]]]}, "result": [[0.0094045946], 0, 11.912187814712524, 1615725338.4298878], "version": 0.2, "tvm_version": "0.8.dev0"}
{"input": ["opencl -keys=mali,opencl,gpu -device=mali -max_num_threads=256", "conv2d_NCHWc_io.mali", [["TENSOR", [1, 4, 224, 224], "climgfloatw32"], ["TENSOR", [4, 32, 3, 3], "climgfloatw32"], [2, 2], [1, 1, 1, 1], [1, 1], "NCHW", "NCHW4c", "climgfloatw32"], {}], "config": {"index": 2773, "code_hash": null, "entity": [["tile_ic", "sp", [-1, 1, 4]], ["tile_oc", "sp", [-1, 2]], ["tile_ow", "sp", [-1, 7, 1]], ["tile_oh", "sp", [-1, 7, 2]]]}, "result": [[0.0121955846], 0, 13.22917127609253, 1615725339.8942451], "version": 0.2, "tvm_version": "0.8.dev0"}
{"input": ["opencl -keys=mali,opencl,gpu -device=mali -max_num_threads=256", "conv2d_NCHWc_io.mali", [["TENSOR", [1, 4, 224, 224], "climgfloatw32"], ["TENSOR", [4, 32, 3, 3], "climgfloatw32"], [2, 2], [1, 1, 1, 1], [1, 1], "NCHW", "NCHW4c", "climgfloatw32"], {}], "config": {"index": 4660, "code_hash": null, "entity": [["tile_ic", "sp", [-1, 1, 4]], ["tile_oc", "sp", [-1, 1]], ["tile_ow", "sp", [-1, 4, 1]], ["tile_oh", "sp", [-1, 14, 4]]]}, "result": [[0.0097155426], 0, 1.6278691291809082, 1615725341.8975565], "version": 0.2, "tvm_version": "0.8.dev0"}
{"input": ["opencl -keys=mali,opencl,gpu -device=mali -max_num_threads=256", "conv2d_NCHWc_io.mali", [["TENSOR", [1, 4, 224, 224], "climgfloatw32"], ["TENSOR", [4, 32, 3, 3], "climgfloatw32"], [2, 2], [1, 1, 1, 1], [1, 1], "NCHW", "NCHW4c", "climgfloatw32"], {}], "config": {"index": 2120, "code_hash": null, "entity": [["tile_ic", "sp", [-1, 1, 4]], ["tile_oc", "sp", [-1, 1]], ["tile_ow", "sp", [-1, 2, 2]], ["tile_oh", "sp", [-1, 32, 2]]]}, "result": [[0.0048539484], 0, 3.2855679988861084, 1615725343.4216409], "version": 0.2, "tvm_version": "0.8.dev0"}
{"input": ["opencl -keys=mali,opencl,gpu -device=mali -max_num_threads=256", "conv2d_NCHWc_io.mali", [["TENSOR", [1, 4, 224, 224], "climgfloatw32"], ["TENSOR", [4, 32, 3, 3], "climgfloatw32"], [2, 2], [1, 1, 1, 1], [1, 1], "NCHW", "NCHW4c", "climgfloatw32"], {}], "config": {"index": 3973, "code_hash": null, "entity": [["tile_ic", "sp", [-1, 1, 4]], ["tile_oc", "sp", [-1, 2]], ["tile_ow", "sp", [-1, 4, 1]], ["tile_oh", "sp", [-1, 2, 4]]]}, "result": [[0.0055221778], 0, 4.555094480514526, 1615725344.8489108], "version": 0.2, "tvm_version": "0.8.dev0"}
{"input": ["opencl -keys=mali,opencl,gpu -device=mali -max_num_threads=256", "conv2d_NCHWc_io.mali", [["TENSOR", [1, 4, 224, 224], "climgfloatw32"], ["TENSOR", [4, 32, 3, 3], "climgfloatw32"], [2, 2], [1, 1, 1, 1], [1, 1], "NCHW", "NCHW4c", "climgfloatw32"], {}], "config": {"index": 3325, "code_hash": null, "entity": [["tile_ic", "sp", [-1, 1, 4]], ["tile_oc", "sp", [-1, 2]], ["tile_ow", "sp", [-1, 2, 2]], ["tile_oh", "sp", [-1, 16, 2]]]}, "result": [[0.004894562999999999], 0, 6.1602864265441895, 1615725346.3101544], "version": 0.2, "tvm_version": "0.8.dev0"}
{"input": ["opencl -keys=mali,opencl,gpu -device=mali -max_num_threads=256", "conv2d_NCHWc_io.mali", [["TENSOR", [1, 4, 224, 224], "climgfloatw32"], ["TENSOR", [4, 32, 3, 3], "climgfloatw32"], [2, 2], [1, 1, 1, 1], [1, 1], "NCHW", "NCHW4c", "climgfloatw32"], {}], "config": {"index": 2644, "code_hash": null, "entity": [["tile_ic", "sp", [-1, 1, 4]], ["tile_oc", "sp", [-1, 1]], ["tile_ow", "sp", [-1, 7, 2]], ["tile_oh", "sp", [-1, 4, 2]]]}, "result": [[0.007680063199999999], 0, 7.482410192489624, 1615725347.8147132], "version": 0.2, "tvm_version": "0.8.dev0"}
{"input": ["opencl -keys=mali,opencl,gpu -device=mali -max_num_threads=256", "conv2d_NCHWc_io.mali", [["TENSOR", [1, 4, 224, 224], "climgfloatw32"], ["TENSOR", [4, 32, 3, 3], "climgfloatw32"], [2, 2], [1, 1, 1, 1], [1, 1], "NCHW", "NCHW4c", "climgfloatw32"], {}], "config": {"index": 3818, "code_hash": null, "entity": [["tile_ic", "sp", [-1, 1, 4]], ["tile_oc", "sp", [-1, 4]], ["tile_ow", "sp", [-1, 16, 1]], ["tile_oh", "sp", [-1, 1, 4]]]}, "result": [[0.0094534176], 0, 10.3885657787323, 1615725350.7198691], "version": 0.2, "tvm_version": "0.8.dev0"}
{"input": ["opencl -keys=mali,opencl,gpu -device=mali -max_num_threads=256", "conv2d_NCHWc_io.mali", [["TENSOR", [1, 4, 224, 224], "climgfloatw32"], ["TENSOR", [4, 32, 3, 3], "climgfloatw32"], [2, 2], [1, 1, 1, 1], [1, 1], "NCHW", "NCHW4c", "climgfloatw32"], {}], "config": {"index": 3985, "code_hash": null, "entity": [["tile_ic", "sp", [-1, 1, 4]], ["tile_oc", "sp", [-1, 2]], ["tile_ow", "sp", [-1, 14, 1]], ["tile_oh", "sp", [-1, 2, 4]]]}, "result": [[0.0086275216], 0, 8.90074348449707, 1615725349.2451622], "version": 0.2, "tvm_version": "0.8.dev0"}
{"input": ["opencl -keys=mali,opencl,gpu -device=mali -max_num_threads=256", "conv2d_NCHWc_io.mali", [["TENSOR", [1, 4, 224, 224], "climgfloatw32"], ["TENSOR", [4, 32, 3, 3], "climgfloatw32"], [2, 2], [1, 1, 1, 1], [1, 1], "NCHW", "NCHW4c", "climgfloatw32"], {}], "config": {"index": 2116, "code_hash": null, "entity": [["tile_ic", "sp", [-1, 1, 4]], ["tile_oc", "sp", [-1, 1]], ["tile_ow", "sp", [-1, 1, 2]], ["tile_oh", "sp", [-1, 32, 2]]]}, "result": [[0.004145479400000001], 0, 12.007680892944336, 1615725352.227281], "version": 0.2, "tvm_version": "0.8.dev0"}
{"input": ["opencl -keys=mali,opencl,gpu -device=mali -max_num_threads=256", "conv2d_NCHWc_io.mali", [["TENSOR", [1, 4, 224, 224], "climgfloatw32"], ["TENSOR", [4, 32, 3, 3], "climgfloatw32"], [2, 2], [1, 1, 1, 1], [1, 1], "NCHW", "NCHW4c", "climgfloatw32"], {}], "config": {"index": 5513, "code_hash": null, "entity": [["tile_ic", "sp", [-1, 1, 4]], ["tile_oc", "sp", [-1, 2]], ["tile_ow", "sp", [-1, 2, 1]], ["tile_oh", "sp", [-1, 4, 7]]]}, "result": [[0.009177771599999999], 0, 1.7874469757080078, 1615725354.4693534], "version": 0.2, "tvm_version": "0.8.dev0"}
{"input": ["opencl -keys=mali,opencl,gpu -device=mali -max_num_threads=256", "conv2d_NCHWc_io.mali", [["TENSOR", [1, 4, 224, 224], "climgfloatw32"], ["TENSOR", [4, 32, 3, 3], "climgfloatw32"], [2, 2], [1, 1, 1, 1], [1, 1], "NCHW", "NCHW4c", "climgfloatw32"], {}], "config": {"index": 2768, "code_hash": null, "entity": [["tile_ic", "sp", [-1, 1, 4]], ["tile_oc", "sp", [-1, 1]], ["tile_ow", "sp", [-1, 4, 1]], ["tile_oh", "sp", [-1, 7, 2]]]}, "result": [[0.0085707508], 0, 3.1685895919799805, 1615725355.965783], "version": 0.2, "tvm_version": "0.8.dev0"}
{"input": ["opencl -keys=mali,opencl,gpu -device=mali -max_num_threads=256", "conv2d_NCHWc_io.mali", [["TENSOR", [1, 4, 224, 224], "climgfloatw32"], ["TENSOR", [4, 32, 3, 3], "climgfloatw32"], [2, 2], [1, 1, 1, 1], [1, 1], "NCHW", "NCHW4c", "climgfloatw32"], {}], "config": {"index": 2948, "code_hash": null, "entity": [["tile_ic", "sp", [-1, 1, 4]], ["tile_oc", "sp", [-1, 1]], ["tile_ow", "sp", [-1, 8, 1]], ["tile_oh", "sp", [-1, 8, 2]]]}, "result": [[0.0118207824], 0, 4.688133716583252, 1615725357.4846199], "version": 0.2, "tvm_version": "0.8.dev0"}
{"input": ["opencl -keys=mali,opencl,gpu -device=mali -max_num_threads=256", "conv2d_NCHWc_io.mali", [["TENSOR", [1, 4, 224, 224], "climgfloatw32"], ["TENSOR", [4, 32, 3, 3], "climgfloatw32"], [2, 2], [1, 1, 1, 1], [1, 1], "NCHW", "NCHW4c", "climgfloatw32"], {}], "config": {"index": 1108, "code_hash": null, "entity": [["tile_ic", "sp", [-1, 1, 4]], ["tile_oc", "sp", [-1, 1]], ["tile_ow", "sp", [-1, 16, 2]], ["tile_oh", "sp", [-1, 8, 1]]]}, "result": [[0.0041091774], 0, 6.221085071563721, 1615725358.9237077], "version": 0.2, "tvm_version": "0.8.dev0"}
{"input": ["opencl -keys=mali,opencl,gpu -device=mali -max_num_threads=256", "conv2d_NCHWc_io.mali", [["TENSOR", [1, 4, 224, 224], "climgfloatw32"], ["TENSOR", [4, 32, 3, 3], "climgfloatw32"], [2, 2], [1, 1, 1, 1], [1, 1], "NCHW", "NCHW4c", "climgfloatw32"], {}], "config": {"index": 3320, "code_hash": null, "entity": [["tile_ic", "sp", [-1, 1, 4]], ["tile_oc", "sp", [-1, 1]], ["tile_ow", "sp", [-1, 1, 2]], ["tile_oh", "sp", [-1, 16, 2]]]}, "result": [[0.0042233546], 0, 7.799025058746338, 1615725360.3919656], "version": 0.2, "tvm_version": "0.8.dev0"}
{"input": ["opencl -keys=mali,opencl,gpu -device=mali -max_num_threads=256", "conv2d_NCHWc_io.mali", [["TENSOR", [1, 4, 224, 224], "climgfloatw32"], ["TENSOR", [4, 32, 3, 3], "climgfloatw32"], [2, 2], [1, 1, 1, 1], [1, 1], "NCHW", "NCHW4c", "climgfloatw32"], {}], "config": {"index": 2656, "code_hash": null, "entity": [["tile_ic", "sp", [-1, 1, 4]], ["tile_oc", "sp", [-1, 1]], ["tile_ow", "sp", [-1, 16, 2]], ["tile_oh", "sp", [-1, 4, 2]]]}, "result": [[0.0047782296], 0, 9.34081768989563, 1615725361.9488301], "version": 0.2, "tvm_version": "0.8.dev0"}
{"input": ["opencl -keys=mali,opencl,gpu -device=mali -max_num_threads=256", "conv2d_NCHWc_io.mali", [["TENSOR", [1, 4, 224, 224], "climgfloatw32"], ["TENSOR", [4, 32, 3, 3], "climgfloatw32"], [2, 2], [1, 1, 1, 1], [1, 1], "NCHW", "NCHW4c", "climgfloatw32"], {}], "config": {"index": 4761, "code_hash": null, "entity": [["tile_ic", "sp", [-1, 1, 4]], ["tile_oc", "sp", [-1, 2]], ["tile_ow", "sp", [-1, 28, 4]], ["tile_oh", "sp", [-1, 14, 4]]]}, "result": [[0.020356179], 0, 11.304252624511719, 1615725363.8346286], "version": 0.2, "tvm_version": "0.8.dev0"}
{"input": ["opencl -keys=mali,opencl,gpu -device=mali -max_num_threads=256", "conv2d_NCHWc_io.mali", [["TENSOR", [1, 4, 224, 224], "climgfloatw32"], ["TENSOR", [4, 32, 3, 3], "climgfloatw32"], [2, 2], [1, 1, 1, 1], [1, 1], "NCHW", "NCHW4c", "climgfloatw32"], {}], "config": {"index": 3272, "code_hash": null, "entity": [["tile_ic", "sp", [-1, 1, 4]], ["tile_oc", "sp", [-1, 1]], ["tile_ow", "sp", [-1, 1, 1]], ["tile_oh", "sp", [-1, 16, 2]]]}, "result": [[0.0034612087999999997], 0, 1.60274076461792, 1615725392.716245], "version": 0.2, "tvm_version": "0.8.dev0"}
{"input": ["opencl -keys=mali,opencl,gpu -device=mali -max_num_threads=256", "conv2d_NCHWc_io.mali", [["TENSOR", [1, 4, 224, 224], "climgfloatw32"], ["TENSOR", [4, 32, 3, 3], "climgfloatw32"], [2, 2], [1, 1, 1, 1], [1, 1], "NCHW", "NCHW4c", "climgfloatw32"], {}], "config": {"index": 3276, "code_hash": null, "entity": [["tile_ic", "sp", [-1, 1, 4]], ["tile_oc", "sp", [-1, 1]], ["tile_ow", "sp", [-1, 2, 1]], ["tile_oh", "sp", [-1, 16, 2]]]}, "result": [[0.0029402502000000002], 0, 3.1327688694000244, 1615725394.1619108], "version": 0.2, "tvm_version": "0.8.dev0"}
