test_and_tune/climgfloatr32.mobilenet_v1_1.0_224.log.tmp
{"input": ["opencl -keys=mali,opencl,gpu -device=mali -max_num_threads=256", "conv2d_NCHWc_io.mali", [["TENSOR", [1, 256, 14, 14], "climgfloatw32"], ["TENSOR", [256, 512, 1, 1], "climgfloatw32"], [2, 2], [0, 0, 0, 0], [1, 1], "NCHW", "NCHW4c", "climgfloatw32"], {}], "config": {"index": 1700, "code_hash": null, "entity": [["tile_ic", "sp", [-1, 1, 4]], ["tile_oc", "sp", [-1, 2]], ["tile_ow", "sp", [-1, 2, 2]], ["tile_oh", "sp", [-1, 1, 4]]]}, "result": [[0.0065706568000000005], 0, 0.6497747898101807, 1615813402.8711421], "version": 0.2, "tvm_version": "0.8.dev0"}
{"input": ["opencl -keys=mali,opencl,gpu -device=mali -max_num_threads=256", "conv2d_NCHWc_io.mali", [["TENSOR", [1, 256, 14, 14], "climgfloatw32"], ["TENSOR", [256, 512, 1, 1], "climgfloatw32"], [2, 2], [0, 0, 0, 0], [1, 1], "NCHW", "NCHW4c", "climgfloatw32"], {}], "config": {"index": 761, "code_hash": null, "entity": [["tile_ic", "sp", [-1, 2, 4]], ["tile_oc", "sp", [-1, 64]], ["tile_ow", "sp", [-1, 1, 7]], ["tile_oh", "sp", [-1, 4, 1]]]}, "result": [[0.001855625], 0, 7.290087461471558, 1615813410.1572356], "version": 0.2, "tvm_version": "0.8.dev0"}
{"input": ["opencl -keys=mali,opencl,gpu -device=mali -max_num_threads=256", "conv2d_NCHWc_io.mali", [["TENSOR", [1, 256, 14, 14], "climgfloatw32"], ["TENSOR", [256, 512, 1, 1], "climgfloatw32"], [2, 2], [0, 0, 0, 0], [1, 1], "NCHW", "NCHW4c", "climgfloatw32"], {}], "config": {"index": 1180, "code_hash": null, "entity": [["tile_ic", "sp", [-1, 1, 4]], ["tile_oc", "sp", [-1, 128]], ["tile_ow", "sp", [-1, 1, 2]], ["tile_oh", "sp", [-1, 1, 2]]]}, "result": [[0.0002443958], 0, 1.6503381729125977, 1615813403.913793], "version": 0.2, "tvm_version": "0.8.dev0"}
{"input": ["opencl -keys=mali,opencl,gpu -device=mali -max_num_threads=256", "conv2d_NCHWc_io.mali", [["TENSOR", [1, 256, 14, 14], "climgfloatw32"], ["TENSOR", [256, 512, 1, 1], "climgfloatw32"], [2, 2], [0, 0, 0, 0], [1, 1], "NCHW", "NCHW4c", "climgfloatw32"], {}], "config": {"index": 1481, "code_hash": null, "entity": [["tile_ic", "sp", [-1, 2, 4]], ["tile_oc", "sp", [-1, 4]], ["tile_ow", "sp", [-1, 1, 4]], ["tile_oh", "sp", [-1, 2, 2]]]}, "result": [[0.0043630942], 0, 3.2912380695343018, 1615813405.6243112], "version": 0.2, "tvm_version": "0.8.dev0"}
{"input": ["opencl -keys=mali,opencl,gpu -device=mali -max_num_threads=256", "conv2d_NCHWc_io.mali", [["TENSOR", [1, 256, 14, 14], "climgfloatw32"], ["TENSOR", [256, 512, 1, 1], "climgfloatw32"], [2, 2], [0, 0, 0, 0], [1, 1], "NCHW", "NCHW4c", "climgfloatw32"], {}], "config": {"index": 310, "code_hash": null, "entity": [["tile_ic", "sp", [-1, 4, 4]], ["tile_oc", "sp", [-1, 32]], ["tile_ow", "sp", [-1, 2, 1]], ["tile_oh", "sp", [-1, 2, 1]]]}, "result": [[0.000324052], 0, 2.090324878692627, 1615813404.4007761], "version": 0.2, "tvm_version": "0.8.dev0"}
{"input": ["opencl -keys=mali,opencl,gpu -device=mali -max_num_threads=256", "conv2d_NCHWc_io.mali", [["TENSOR", [1, 256, 14, 14], "climgfloatw32"], ["TENSOR", [256, 512, 1, 1], "climgfloatw32"], [2, 2], [0, 0, 0, 0], [1, 1], "NCHW", "NCHW4c", "climgfloatw32"], {}], "config": {"index": 598, "code_hash": null, "entity": [["tile_ic", "sp", [-1, 4, 4]], ["tile_oc", "sp", [-1, 32]], ["tile_ow", "sp", [-1, 4, 1]], ["tile_oh", "sp", [-1, 4, 1]]]}, "result": [[0.0003498854], 0, 10.139405012130737, 1615813413.327654], "version": 0.2, "tvm_version": "0.8.dev0"}
{"input": ["opencl -keys=mali,opencl,gpu -device=mali -max_num_threads=256", "conv2d_NCHWc_io.mali", [["TENSOR", [1, 256, 14, 14], "climgfloatw32"], ["TENSOR", [256, 512, 1, 1], "climgfloatw32"], [2, 2], [0, 0, 0, 0], [1, 1], "NCHW", "NCHW4c", "climgfloatw32"], {}], "config": {"index": 1453, "code_hash": null, "entity": [["tile_ic", "sp", [-1, 2, 4]], ["tile_oc", "sp", [-1, 8]], ["tile_ow", "sp", [-1, 2, 2]], ["tile_oh", "sp", [-1, 2, 2]]]}, "result": [[0.0029259378], 0, 4.4402453899383545, 1615813407.1429322], "version": 0.2, "tvm_version": "0.8.dev0"}
{"input": ["opencl -keys=mali,opencl,gpu -device=mali -max_num_threads=256", "conv2d_NCHWc_io.mali", [["TENSOR", [1, 256, 14, 14], "climgfloatw32"], ["TENSOR", [256, 512, 1, 1], "climgfloatw32"], [2, 2], [0, 0, 0, 0], [1, 1], "NCHW", "NCHW4c", "climgfloatw32"], {}], "config": {"index": 733, "code_hash": null, "entity": [["tile_ic", "sp", [-1, 2, 4]], ["tile_oc", "sp", [-1, 128]], ["tile_ow", "sp", [-1, 1, 4]], ["tile_oh", "sp", [-1, 4, 1]]]}, "result": [[0.0034049273999999996], 0, 9.661544799804688, 1615813412.8418927], "version": 0.2, "tvm_version": "0.8.dev0"}
{"input": ["opencl -keys=mali,opencl,gpu -device=mali -max_num_threads=256", "conv2d_NCHWc_io.mali", [["TENSOR", [1, 256, 14, 14], "climgfloatw32"], ["TENSOR", [256, 512, 1, 1], "climgfloatw32"], [2, 2], [0, 0, 0, 0], [1, 1], "NCHW", "NCHW4c", "climgfloatw32"], {}], "config": {"index": 1285, "code_hash": null, "entity": [["tile_ic", "sp", [-1, 2, 4]], ["tile_oc", "sp", [-1, 2]], ["tile_ow", "sp", [-1, 1, 1]], ["tile_oh", "sp", [-1, 2, 2]]]}, "result": [[0.0034898961999999998], 0, 7.62800407409668, 1615813410.6908371], "version": 0.2, "tvm_version": "0.8.dev0"}
{"input": ["opencl -keys=mali,opencl,gpu -device=mali -max_num_threads=256", "conv2d_NCHWc_io.mali", [["TENSOR", [1, 256, 14, 14], "climgfloatw32"], ["TENSOR", [256, 512, 1, 1], "climgfloatw32"], [2, 2], [0, 0, 0, 0], [1, 1], "NCHW", "NCHW4c", "climgfloatw32"], {}], "config": {"index": 1376, "code_hash": null, "entity": [["tile_ic", "sp", [-1, 1, 4]], ["tile_oc", "sp", [-1, 1]], ["tile_ow", "sp", [-1, 7, 1]], ["tile_oh", "sp", [-1, 2, 2]]]}, "result": [[0.0012178022], 0, 11.689672708511353, 1615813414.895954], "version": 0.2, "tvm_version": "0.8.dev0"}
{"input": ["opencl -keys=mali,opencl,gpu -device=mali -max_num_threads=256", "conv2d_NCHWc_io.mali", [["TENSOR", [1, 256, 14, 14], "climgfloatw32"], ["TENSOR", [256, 512, 1, 1], "climgfloatw32"], [2, 2], [0, 0, 0, 0], [1, 1], "NCHW", "NCHW4c", "climgfloatw32"], {}], "config": {"index": 647, "code_hash": null, "entity": [["tile_ic", "sp", [-1, 8, 4]], ["tile_oc", "sp", [-1, 2]], ["tile_ow", "sp", [-1, 1, 2]], ["tile_oh", "sp", [-1, 4, 1]]]}, "result": [[0.0042195212000000005], 0, 6.697531223297119, 1615813409.571912], "version": 0.2, "tvm_version": "0.8.dev0"}
{"input": ["opencl -keys=mali,opencl,gpu -device=mali -max_num_threads=256", "conv2d_NCHWc_io.mali", [["TENSOR", [1, 256, 14, 14], "climgfloatw32"], ["TENSOR", [256, 512, 1, 1], "climgfloatw32"], [2, 2], [0, 0, 0, 0], [1, 1], "NCHW", "NCHW4c", "climgfloatw32"], {}], "config": {"index": 1876, "code_hash": null, "entity": [["tile_ic", "sp", [-1, 1, 4]], ["tile_oc", "sp", [-1, 32]], ["tile_ow", "sp", [-1, 4, 1]], ["tile_oh", "sp", [-1, 1, 7]]]}, "result": [[0.000240354], 0, 2.600182056427002, 1615813404.945511], "version": 0.2, "tvm_version": "0.8.dev0"}
{"input": ["opencl -keys=mali,opencl,gpu -device=mali -max_num_threads=256", "conv2d_NCHWc_io.mali", [["TENSOR", [1, 256, 14, 14], "climgfloatw32"], ["TENSOR", [256, 512, 1, 1], "climgfloatw32"], [2, 2], [0, 0, 0, 0], [1, 1], "NCHW", "NCHW4c", "climgfloatw32"], {}], "config": {"index": 499, "code_hash": null, "entity": [["tile_ic", "sp", [-1, 8, 4]], ["tile_oc", "sp", [-1, 16]], ["tile_ow", "sp", [-1, 1, 7]], ["tile_oh", "sp", [-1, 2, 1]]]}, "result": [[0.0039124482], 0, 9.12904167175293, 1615813412.2571743], "version": 0.2, "tvm_version": "0.8.dev0"}
{"input": ["opencl -keys=mali,opencl,gpu -device=mali -max_num_threads=256", "conv2d_NCHWc_io.mali", [["TENSOR", [1, 256, 14, 14], "climgfloatw32"], ["TENSOR", [256, 512, 1, 1], "climgfloatw32"], [2, 2], [0, 0, 0, 0], [1, 1], "NCHW", "NCHW4c", "climgfloatw32"], {}], "config": {"index": 1254, "code_hash": null, "entity": [["tile_ic", "sp", [-1, 4, 4]], ["tile_oc", "sp", [-1, 2]], ["tile_ow", "sp", [-1, 1, 7]], ["tile_oh", "sp", [-1, 1, 2]]]}, "result": [[0.0116512824], 0, 5.339486598968506, 1615813408.0940702], "version": 0.2, "tvm_version": "0.8.dev0"}
{"input": ["opencl -keys=mali,opencl,gpu -device=mali -max_num_threads=256", "conv2d_NCHWc_io.mali", [["TENSOR", [1, 256, 14, 14], "climgfloatw32"], ["TENSOR", [256, 512, 1, 1], "climgfloatw32"], [2, 2], [0, 0, 0, 0], [1, 1], "NCHW", "NCHW4c", "climgfloatw32"], {}], "config": {"index": 1277, "code_hash": null, "entity": [["tile_ic", "sp", [-1, 2, 4]], ["tile_oc", "sp", [-1, 128]], ["tile_ow", "sp", [-1, 1, 7]], ["tile_oh", "sp", [-1, 1, 2]]]}, "result": [[0.0028376566], 0, 5.995043992996216, 1615813408.78416], "version": 0.2, "tvm_version": "0.8.dev0"}
{"input": ["opencl -keys=mali,opencl,gpu -device=mali -max_num_threads=256", "conv2d_NCHWc_io.mali", [["TENSOR", [1, 256, 14, 14], "climgfloatw32"], ["TENSOR", [256, 512, 1, 1], "climgfloatw32"], [2, 2], [0, 0, 0, 0], [1, 1], "NCHW", "NCHW4c", "climgfloatw32"], {}], "config": {"index": 993, "code_hash": null, "entity": [["tile_ic", "sp", [-1, 2, 4]], ["tile_oc", "sp", [-1, 1]], ["tile_ow", "sp", [-1, 1, 7]], ["tile_oh", "sp", [-1, 7, 1]]]}, "result": [[0.0007387188], 0, 11.263598680496216, 1615813414.3970714], "version": 0.2, "tvm_version": "0.8.dev0"}
{"input": ["opencl -keys=mali,opencl,gpu -device=mali -max_num_threads=256", "conv2d_NCHWc_io.mali", [["TENSOR", [1, 256, 14, 14], "climgfloatw32"], ["TENSOR", [256, 512, 1, 1], "climgfloatw32"], [2, 2], [0, 0, 0, 0], [1, 1], "NCHW", "NCHW4c", "climgfloatw32"], {}], "config": {"index": 922, "code_hash": null, "entity": [["tile_ic", "sp", [-1, 4, 4]], ["tile_oc", "sp", [-1, 64]], ["tile_ow", "sp", [-1, 1, 2]], ["tile_oh", "sp", [-1, 7, 1]]]}, "result": [[0.0006829168], 0, 10.707502603530884, 1615813413.8932536], "version": 0.2, "tvm_version": "0.8.dev0"}
{"input": ["opencl -keys=mali,opencl,gpu -device=mali -max_num_threads=256", "conv2d_NCHWc_io.mali", [["TENSOR", [1, 256, 14, 14], "climgfloatw32"], ["TENSOR", [256, 512, 1, 1], "climgfloatw32"], [2, 2], [0, 0, 0, 0], [1, 1], "NCHW", "NCHW4c", "climgfloatw32"], {}], "config": {"index": 1473, "code_hash": null, "entity": [["tile_ic", "sp", [-1, 2, 4]], ["tile_oc", "sp", [-1, 1]], ["tile_ow", "sp", [-1, 1, 4]], ["tile_oh", "sp", [-1, 2, 2]]]}, "result": [[0.014341241], 0, 4.104487895965576, 1615813406.4830618], "version": 0.2, "tvm_version": "0.8.dev0"}
{"input": ["opencl -keys=mali,opencl,gpu -device=mali -max_num_threads=256", "conv2d_NCHWc_io.mali", [["TENSOR", [1, 256, 14, 14], "climgfloatw32"], ["TENSOR", [256, 512, 1, 1], "climgfloatw32"], [2, 2], [0, 0, 0, 0], [1, 1], "NCHW", "NCHW4c", "climgfloatw32"], {}], "config": {"index": 1044, "code_hash": null, "entity": [["tile_ic", "sp", [-1, 1, 4]], ["tile_oc", "sp", [-1, 32]], ["tile_ow", "sp", [-1, 1, 1]], ["tile_oh", "sp", [-1, 1, 2]]]}, "result": [[0.0006594687999999999], 0, 1.1133613586425781, 1615813403.3849785], "version": 0.2, "tvm_version": "0.8.dev0"}
{"input": ["opencl -keys=mali,opencl,gpu -device=mali -max_num_threads=256", "conv2d_NCHWc_io.mali", [["TENSOR", [1, 256, 14, 14], "climgfloatw32"], ["TENSOR", [256, 512, 1, 1], "climgfloatw32"], [2, 2], [0, 0, 0, 0], [1, 1], "NCHW", "NCHW4c", "climgfloatw32"], {}], "config": {"index": 1550, "code_hash": null, "entity": [["tile_ic", "sp", [-1, 4, 4]], ["tile_oc", "sp", [-1, 8]], ["tile_ow", "sp", [-1, 1, 1]], ["tile_oh", "sp", [-1, 1, 4]]]}, "result": [[0.0043999588], 0, 4.156579256057739, 1615813430.1581588], "version": 0.2, "tvm_version": "0.8.dev0"}
{"input": ["opencl -keys=mali,opencl,gpu -device=mali -max_num_threads=256", "conv2d_NCHWc_io.mali", [["TENSOR", [1, 256, 14, 14], "climgfloatw32"], ["TENSOR", [256, 512, 1, 1], "climgfloatw32"], [2, 2], [0, 0, 0, 0], [1, 1], "NCHW", "NCHW4c", "climgfloatw32"], {}], "config": {"index": 1115, "code_hash": null, "entity": [["tile_ic", "sp", [-1, 8, 4]], ["tile_oc", "sp", [-1, 64]], ["tile_ow", "sp", [-1, 4, 1]], ["tile_oh", "sp", [-1, 1, 2]]]}, "result": [[0.005720084], 0, 9.61452579498291, 1615813436.0129762], "version": 0.2, "tvm_version": "0.8.dev0"}
{"input": ["opencl -keys=mali,opencl,gpu -device=mali -max_num_threads=256", "conv2d_NCHWc_io.mali", [["TENSOR", [1, 256, 14, 14], "climgfloatw32"], ["TENSOR", [256, 512, 1, 1], "climgfloatw32"], [2, 2], [0, 0, 0, 0], [1, 1], "NCHW", "NCHW4c", "climgfloatw32"], {}], "config": {"index": 223, "code_hash": null, "entity": [["tile_ic", "sp", [-1, 8, 4]], ["tile_oc", "sp", [-1, 128]], ["tile_ow", "sp", [-1, 1, 4]], ["tile_oh", "sp", [-1, 1, 1]]]}, "result": [[0.0037588546], 0, 6.643091201782227, 1615813432.6760802], "version": 0.2, "tvm_version": "0.8.dev0"}
{"input": ["opencl -keys=mali,opencl,gpu -device=mali -max_num_threads=256", "conv2d_NCHWc_io.mali", [["TENSOR", [1, 256, 14, 14], "climgfloatw32"], ["TENSOR", [256, 512, 1, 1], "climgfloatw32"], [2, 2], [0, 0, 0, 0], [1, 1], "NCHW", "NCHW4c", "climgfloatw32"], {}], "config": {"index": 422, "code_hash": null, "entity": [["tile_ic", "sp", [-1, 4, 4]], ["tile_oc", "sp", [-1, 2]], ["tile_ow", "sp", [-1, 2, 2]], ["tile_oh", "sp", [-1, 2, 1]]]}, "result": [[0.0018758543999999999], 0, 8.838256359100342, 1615813435.274161], "version": 0.2, "tvm_version": "0.8.dev0"}
{"input": ["opencl -keys=mali,opencl,gpu -device=mali -max_num_threads=256", "conv2d_NCHWc_io.mali", [["TENSOR", [1, 256, 14, 14], "climgfloatw32"], ["TENSOR", [256, 512, 1, 1], "climgfloatw32"], [2, 2], [0, 0, 0, 0], [1, 1], "NCHW", "NCHW4c", "climgfloatw32"], {}], "config": {"index": 129, "code_hash": null, "entity": [["tile_ic", "sp", [-1, 2, 4]], ["tile_oc", "sp", [-1, 1]], ["tile_ow", "sp", [-1, 1, 2]], ["tile_oh", "sp", [-1, 1, 1]]]}, "result": [[0.009298219600000001], 0, 4.715176343917847, 1615813430.777549], "version": 0.2, "tvm_version": "0.8.dev0"}
{"input": ["opencl -keys=mali,opencl,gpu -device=mali -max_num_threads=256", "conv2d_NCHWc_io.mali", [["TENSOR", [1, 256, 14, 14], "climgfloatw32"], ["TENSOR", [256, 512, 1, 1], "climgfloatw32"], [2, 2], [0, 0, 0, 0], [1, 1], "NCHW", "NCHW4c", "climgfloatw32"], {}], "config": {"index": 748, "code_hash": null, "entity": [["tile_ic", "sp", [-1, 1, 4]], ["tile_oc", "sp", [-1, 8]], ["tile_ow", "sp", [-1, 1, 7]], ["tile_oh", "sp", [-1, 4, 1]]]}, "result": [[0.000263875], 0, 5.260295152664185, 1615813431.3384726], "version": 0.2, "tvm_version": "0.8.dev0"}
{"input": ["opencl -keys=mali,opencl,gpu -device=mali -max_num_threads=256", "conv2d_NCHWc_io.mali", [["TENSOR", [1, 256, 14, 14], "climgfloatw32"], ["TENSOR", [256, 512, 1, 1], "climgfloatw32"], [2, 2], [0, 0, 0, 0], [1, 1], "NCHW", "NCHW4c", "climgfloatw32"], {}], "config": {"index": 901, "code_hash": null, "entity": [["tile_ic", "sp", [-1, 2, 4]], ["tile_oc", "sp", [-1, 2]], ["tile_ow", "sp", [-1, 1, 2]], ["tile_oh", "sp", [-1, 7, 1]]]}, "result": [[0.0009279168], 0, 3.42962384223938, 1615813429.4726129], "version": 0.2, "tvm_version": "0.8.dev0"}
{"input": ["opencl -keys=mali,opencl,gpu -device=mali -max_num_threads=256", "conv2d_NCHWc_io.mali", [["TENSOR", [1, 256, 14, 14], "climgfloatw32"], ["TENSOR", [256, 512, 1, 1], "climgfloatw32"], [2, 2], [0, 0, 0, 0], [1, 1], "NCHW", "NCHW4c", "climgfloatw32"], {}], "config": {"index": 595, "code_hash": null, "entity": [["tile_ic", "sp", [-1, 8, 4]], ["tile_oc", "sp", [-1, 16]], ["tile_ow", "sp", [-1, 4, 1]], ["tile_oh", "sp", [-1, 4, 1]]]}, "result": [[0.007559146599999999], 0, 0.6378834247589111, 1615813426.6696906], "version": 0.2, "tvm_version": "0.8.dev0"}
{"input": ["opencl -keys=mali,opencl,gpu -device=mali -max_num_threads=256", "conv2d_NCHWc_io.mali", [["TENSOR", [1, 256, 14, 14], "climgfloatw32"], ["TENSOR", [256, 512, 1, 1], "climgfloatw32"], [2, 2], [0, 0, 0, 0], [1, 1], "NCHW", "NCHW4c", "climgfloatw32"], {}], "config": {"index": 847, "code_hash": null, "entity": [["tile_ic", "sp", [-1, 8, 4]], ["tile_oc", "sp", [-1, 8]], ["tile_ow", "sp", [-1, 4, 1]], ["tile_oh", "sp", [-1, 7, 1]]]}, "result": [[0.0050789172], 0, 8.419702291488647, 1615813434.6629825], "version": 0.2, "tvm_version": "0.8.dev0"}
{"input": ["opencl -keys=mali,opencl,gpu -device=mali -max_num_threads=256", "conv2d_NCHWc_io.mali", [["TENSOR", [1, 256, 14, 14], "climgfloatw32"], ["TENSOR", [256, 512, 1, 1], "climgfloatw32"], [2, 2], [0, 0, 0, 0], [1, 1], "NCHW", "NCHW4c", "climgfloatw32"], {}], "config": {"index": 1459, "code_hash": null, "entity": [["tile_ic", "sp", [-1, 8, 4]], ["tile_oc", "sp", [-1, 16]], ["tile_ow", "sp", [-1, 2, 2]], ["tile_oh", "sp", [-1, 2, 2]]]}, "result": [[0.004903667], 0, 10.518157958984375, 1615813437.012302], "version": 0.2, "tvm_version": "0.8.dev0"}
{"input": ["opencl -keys=mali,opencl,gpu -device=mali -max_num_threads=256", "conv2d_NCHWc_io.mali", [["TENSOR", [1, 256, 14, 14], "climgfloatw32"], ["TENSOR", [256, 512, 1, 1], "climgfloatw32"], [2, 2], [0, 0, 0, 0], [1, 1], "NCHW", "NCHW4c", "climgfloatw32"], {}], "config": {"index": 490, "code_hash": null, "entity": [["tile_ic", "sp", [-1, 4, 4]], ["tile_oc", "sp", [-1, 4]], ["tile_ow", "sp", [-1, 1, 7]], ["tile_oh", "sp", [-1, 2, 1]]]}, "result": [[0.0028276878], 0, 7.9178786277771, 1615813434.043049], "version": 0.2, "tvm_version": "0.8.dev0"}
{"input": ["opencl -keys=mali,opencl,gpu -device=mali -max_num_threads=256", "conv2d_NCHWc_io.mali", [["TENSOR", [1, 256, 14, 14], "climgfloatw32"], ["TENSOR", [256, 512, 1, 1], "climgfloatw32"], [2, 2], [0, 0, 0, 0], [1, 1], "NCHW", "NCHW4c", "climgfloatw32"], {}], "config": {"index": 1263, "code_hash": null, "entity": [["tile_ic", "sp", [-1, 8, 4]], ["tile_oc", "sp", [-1, 8]], ["tile_ow", "sp", [-1, 1, 7]], ["tile_oh", "sp", [-1, 1, 2]]]}, "result": [[0.008268907], 0, 2.9522483348846436, 1615813428.9114535], "version": 0.2, "tvm_version": "0.8.dev0"}
{"input": ["opencl -keys=mali,opencl,gpu -device=mali -max_num_threads=256", "conv2d_NCHWc_io.mali", [["TENSOR", [1, 256, 14, 14], "climgfloatw32"], ["TENSOR", [256, 512, 1, 1], "climgfloatw32"], [2, 2], [0, 0, 0, 0], [1, 1], "NCHW", "NCHW4c", "climgfloatw32"], {}], "config": {"index": 1568, "code_hash": null, "entity": [["tile_ic", "sp", [-1, 1, 4]], ["tile_oc", "sp", [-1, 1]], ["tile_ow", "sp", [-1, 2, 1]], ["tile_oh", "sp", [-1, 1, 4]]]}, "result": [[0.0028735314], 0, 1.2148752212524414, 1615813427.2481313], "version": 0.2, "tvm_version": "0.8.dev0"}
{"input": ["opencl -keys=mali,opencl,gpu -device=mali -max_num_threads=256", "conv2d_NCHWc_io.mali", [["TENSOR", [1, 256, 14, 14], "climgfloatw32"], ["TENSOR", [256, 512, 1, 1], "climgfloatw32"], [2, 2], [0, 0, 0, 0], [1, 1], "NCHW", "NCHW4c", "climgfloatw32"], {}], "config": {"index": 968, "code_hash": null, "entity": [["tile_ic", "sp", [-1, 1, 4]], ["tile_oc", "sp", [-1, 4]], ["tile_ow", "sp", [-1, 1, 4]], ["tile_oh", "sp", [-1, 7, 1]]]}, "result": [[0.0004191874], 0, 1.6834783554077148, 1615813427.7123659], "version": 0.2, "tvm_version": "0.8.dev0"}
{"input": ["opencl -keys=mali,opencl,gpu -device=mali -max_num_threads=256", "conv2d_NCHWc_io.mali", [["TENSOR", [1, 256, 14, 14], "climgfloatw32"], ["TENSOR", [256, 512, 1, 1], "climgfloatw32"], [2, 2], [0, 0, 0, 0], [1, 1], "NCHW", "NCHW4c", "climgfloatw32"], {}], "config": {"index": 1589, "code_hash": null, "entity": [["tile_ic", "sp", [-1, 2, 4]], ["tile_oc", "sp", [-1, 32]], ["tile_ow", "sp", [-1, 2, 1]], ["tile_oh", "sp", [-1, 1, 4]]]}, "result": [[0.0028283128], 0, 7.221629619598389, 1615813433.2861073], "version": 0.2, "tvm_version": "0.8.dev0"}
{"input": ["opencl -keys=mali,opencl,gpu -device=mali -max_num_threads=256", "conv2d_NCHWc_io.mali", [["TENSOR", [1, 256, 14, 14], "climgfloatw32"], ["TENSOR", [256, 512, 1, 1], "climgfloatw32"], [2, 2], [0, 0, 0, 0], [1, 1], "NCHW", "NCHW4c", "climgfloatw32"], {}], "config": {"index": 855, "code_hash": null, "entity": [["tile_ic", "sp", [-1, 8, 4]], ["tile_oc", "sp", [-1, 32]], ["tile_ow", "sp", [-1, 4, 1]], ["tile_oh", "sp", [-1, 7, 1]]]}, "result": [[0.005328438], 0, 5.884162187576294, 1615813431.9526467], "version": 0.2, "tvm_version": "0.8.dev0"}
{"input": ["opencl -keys=mali,opencl,gpu -device=mali -max_num_threads=256", "conv2d_NCHWc_io.mali", [["TENSOR", [1, 256, 14, 14], "climgfloatw32"], ["TENSOR", [256, 512, 1, 1], "climgfloatw32"], [2, 2], [0, 0, 0, 0], [1, 1], "NCHW", "NCHW4c", "climgfloatw32"], {}], "config": {"index": 980, "code_hash": null, "entity": [["tile_ic", "sp", [-1, 1, 4]], ["tile_oc", "sp", [-1, 32]], ["tile_ow", "sp", [-1, 1, 4]], ["tile_oh", "sp", [-1, 7, 1]]]}, "result": [[0.0001721874], 0, 11.085790872573853, 1615813459.3967662], "version": 0.2, "tvm_version": "0.8.dev0"}
{"input": ["opencl -keys=mali,opencl,gpu -device=mali -max_num_threads=256", "conv2d_NCHWc_io.mali", [["TENSOR", [1, 256, 14, 14], "climgfloatw32"], ["TENSOR", [256, 512, 1, 1], "climgfloatw32"], [2, 2], [0, 0, 0, 0], [1, 1], "NCHW", "NCHW4c", "climgfloatw32"], {}], "config": {"index": 430, "code_hash": null, "entity": [["tile_ic", "sp", [-1, 4, 4]], ["tile_oc", "sp", [-1, 8]], ["tile_ow", "sp", [-1, 2, 2]], ["tile_oh", "sp", [-1, 2, 1]]]}, "result": [[0.0005906042000000001], 0, 8.793028831481934, 1615813457.0619638], "version": 0.2, "tvm_version": "0.8.dev0"}
{"input": ["opencl -keys=mali,opencl,gpu -device=mali -max_num_threads=256", "conv2d_NCHWc_io.mali", [["TENSOR", [1, 256, 14, 14], "climgfloatw32"], ["TENSOR", [256, 512, 1, 1], "climgfloatw32"], [2, 2], [0, 0, 0, 0], [1, 1], "NCHW", "NCHW4c", "climgfloatw32"], {}], "config": {"index": 645, "code_hash": null, "entity": [["tile_ic", "sp", [-1, 2, 4]], ["tile_oc", "sp", [-1, 2]], ["tile_ow", "sp", [-1, 1, 2]], ["tile_oh", "sp", [-1, 4, 1]]]}, "result": [[0.001109573], 0, 0.9824457168579102, 1615813448.5352027], "version": 0.2, "tvm_version": "0.8.dev0"}
{"input": ["opencl -keys=mali,opencl,gpu -device=mali -max_num_threads=256", "conv2d_NCHWc_io.mali", [["TENSOR", [1, 256, 14, 14], "climgfloatw32"], ["TENSOR", [256, 512, 1, 1], "climgfloatw32"], [2, 2], [0, 0, 0, 0], [1, 1], "NCHW", "NCHW4c", "climgfloatw32"], {}], "config": {"index": 173, "code_hash": null, "entity": [["tile_ic", "sp", [-1, 2, 4]], ["tile_oc", "sp", [-1, 8]], ["tile_ow", "sp", [-1, 2, 2]], ["tile_oh", "sp", [-1, 1, 1]]]}, "result": [[0.0010466042], 0, 0.4885828495025635, 1615813447.991633], "version": 0.2, "tvm_version": "0.8.dev0"}
{"input": ["opencl -keys=mali,opencl,gpu -device=mali -max_num_threads=256", "conv2d_NCHWc_io.mali", [["TENSOR", [1, 256, 14, 14], "climgfloatw32"], ["TENSOR", [256, 512, 1, 1], "climgfloatw32"], [2, 2], [0, 0, 0, 0], [1, 1], "NCHW", "NCHW4c", "climgfloatw32"], {}], "config": {"index": 574, "code_hash": null, "entity": [["tile_ic", "sp", [-1, 4, 4]], ["tile_oc", "sp", [-1, 128]], ["tile_ow", "sp", [-1, 2, 1]], ["tile_oh", "sp", [-1, 4, 1]]]}, "result": [[0.00040591680000000004], 0, 6.120289325714111, 1615813453.677016], "version": 0.2, "tvm_version": "0.8.dev0"}
{"input": ["opencl -keys=mali,opencl,gpu -device=mali -max_num_threads=256", "conv2d_NCHWc_io.mali", [["TENSOR", [1, 256, 14, 14], "climgfloatw32"], ["TENSOR", [256, 512, 1, 1], "climgfloatw32"], [2, 2], [0, 0, 0, 0], [1, 1], "NCHW", "NCHW4c", "climgfloatw32"], {}], "config": {"index": 1810, "code_hash": null, "entity": [["tile_ic", "sp", [-1, 4, 4]], ["tile_oc", "sp", [-1, 16]], ["tile_ow", "sp", [-1, 1, 1]], ["tile_oh", "sp", [-1, 1, 7]]]}, "result": [[0.0019085522], 0, 7.58886194229126, 1615813455.8031642], "version": 0.2, "tvm_version": "0.8.dev0"}
{"input": ["opencl -keys=mali,opencl,gpu -device=mali -max_num_threads=256", "conv2d_NCHWc_io.mali", [["TENSOR", [1, 256, 14, 14], "climgfloatw32"], ["TENSOR", [256, 512, 1, 1], "climgfloatw32"], [2, 2], [0, 0, 0, 0], [1, 1], "NCHW", "NCHW4c", "climgfloatw32"], {}], "config": {"index": 359, "code_hash": null, "entity": [["tile_ic", "sp", [-1, 8, 4]], ["tile_oc", "sp", [-1, 2]], ["tile_ow", "sp", [-1, 7, 1]], ["tile_oh", "sp", [-1, 2, 1]]]}, "result": [[0.0030703336], 0, 6.784335613250732, 1615813454.7430298], "version": 0.2, "tvm_version": "0.8.dev0"}
{"input": ["opencl -keys=mali,opencl,gpu -device=mali -max_num_threads=256", "conv2d_NCHWc_io.mali", [["TENSOR", [1, 256, 14, 14], "climgfloatw32"], ["TENSOR", [256, 512, 1, 1], "climgfloatw32"], [2, 2], [0, 0, 0, 0], [1, 1], "NCHW", "NCHW4c", "climgfloatw32"], {}], "config": {"index": 944, "code_hash": null, "entity": [["tile_ic", "sp", [-1, 1, 4]], ["tile_oc", "sp", [-1, 16]], ["tile_ow", "sp", [-1, 2, 2]], ["tile_oh", "sp", [-1, 7, 1]]]}, "result": [[0.0003095], 0, 6.5718231201171875, 1615813454.142526], "version": 0.2, "tvm_version": "0.8.dev0"}
{"input": ["opencl -keys=mali,opencl,gpu -device=mali -max_num_threads=256", "conv2d_NCHWc_io.mali", [["TENSOR", [1, 256, 14, 14], "climgfloatw32"], ["TENSOR", [256, 512, 1, 1], "climgfloatw32"], [2, 2], [0, 0, 0, 0], [1, 1], "NCHW", "NCHW4c", "climgfloatw32"], {}], "config": {"index": 1658, "code_hash": null, "entity": [["tile_ic", "sp", [-1, 4, 4]], ["tile_oc", "sp", [-1, 64]], ["tile_ow", "sp", [-1, 7, 1]], ["tile_oh", "sp", [-1, 1, 4]]]}, "result": [[0.0057895214], 0, 8.30311632156372, 1615813456.49271], "version": 0.2, "tvm_version": "0.8.dev0"}
{"input": ["opencl -keys=mali,opencl,gpu -device=mali -max_num_threads=256", "conv2d_NCHWc_io.mali", [["TENSOR", [1, 256, 14, 14], "climgfloatw32"], ["TENSOR", [256, 512, 1, 1], "climgfloatw32"], [2, 2], [0, 0, 0, 0], [1, 1], "NCHW", "NCHW4c", "climgfloatw32"], {}], "config": {"index": 207, "code_hash": null, "entity": [["tile_ic", "sp", [-1, 8, 4]], ["tile_oc", "sp", [-1, 8]], ["tile_ow", "sp", [-1, 1, 4]], ["tile_oh", "sp", [-1, 1, 1]]]}, "result": [[0.0043383128], 0, 9.469970703125, 1615813457.765598], "version": 0.2, "tvm_version": "0.8.dev0"}
{"input": ["opencl -keys=mali,opencl,gpu -device=mali -max_num_threads=256", "conv2d_NCHWc_io.mali", [["TENSOR", [1, 256, 14, 14], "climgfloatw32"], ["TENSOR", [256, 512, 1, 1], "climgfloatw32"], [2, 2], [0, 0, 0, 0], [1, 1], "NCHW", "NCHW4c", "climgfloatw32"], {}], "config": {"index": 796, "code_hash": null, "entity": [["tile_ic", "sp", [-1, 1, 4]], ["tile_oc", "sp", [-1, 128]], ["tile_ow", "sp", [-1, 1, 1]], ["tile_oh", "sp", [-1, 7, 1]]]}, "result": [[0.0002512708], 0, 7.0705482959747314, 1615813455.2430062], "version": 0.2, "tvm_version": "0.8.dev0"}
{"input": ["opencl -keys=mali,opencl,gpu -device=mali -max_num_threads=256", "conv2d_NCHWc_io.mali", [["TENSOR", [1, 256, 14, 14], "climgfloatw32"], ["TENSOR", [256, 512, 1, 1], "climgfloatw32"], [2, 2], [0, 0, 0, 0], [1, 1], "NCHW", "NCHW4c", "climgfloatw32"], {}], "config": {"index": 250, "code_hash": null, "entity": [["tile_ic", "sp", [-1, 4, 4]], ["tile_oc", "sp", [-1, 64]], ["tile_ow", "sp", [-1, 1, 7]], ["tile_oh", "sp", [-1, 1, 1]]]}, "result": [[0.0030213234], 0, 4.359597682952881, 1615813451.9262512], "version": 0.2, "tvm_version": "0.8.dev0"}
{"input": ["opencl -keys=mali,opencl,gpu -device=mali -max_num_threads=256", "conv2d_NCHWc_io.mali", [["TENSOR", [1, 256, 14, 14], "climgfloatw32"], ["TENSOR", [256, 512, 1, 1], "climgfloatw32"], [2, 2], [0, 0, 0, 0], [1, 1], "NCHW", "NCHW4c", "climgfloatw32"], {}], "config": {"index": 1499, "code_hash": null, "entity": [["tile_ic", "sp", [-1, 8, 4]], ["tile_oc", "sp", [-1, 64]], ["tile_ow", "sp", [-1, 1, 4]], ["tile_oh", "sp", [-1, 2, 2]]]}, "result": [[0.0060593964], 0, 2.6846296787261963, 1615813450.1939504], "version": 0.2, "tvm_version": "0.8.dev0"}
{"input": ["opencl -keys=mali,opencl,gpu -device=mali -max_num_threads=256", "conv2d_NCHWc_io.mali", [["TENSOR", [1, 256, 14, 14], "climgfloatw32"], ["TENSOR", [256, 512, 1, 1], "climgfloatw32"], [2, 2], [0, 0, 0, 0], [1, 1], "NCHW", "NCHW4c", "climgfloatw32"], {}], "config": {"index": 1410, "code_hash": null, "entity": [["tile_ic", "sp", [-1, 4, 4]], ["tile_oc", "sp", [-1, 1]], ["tile_ow", "sp", [-1, 1, 2]], ["tile_oh", "sp", [-1, 2, 2]]]}, "result": [[0.0198787936], 0, 3.716324806213379, 1615813451.277182], "version": 0.2, "tvm_version": "0.8.dev0"}
{"input": ["opencl -keys=mali,opencl,gpu -device=mali -max_num_threads=256", "conv2d_NCHWc_io.mali", [["TENSOR", [1, 256, 14, 14], "climgfloatw32"], ["TENSOR", [256, 512, 1, 1], "climgfloatw32"], [2, 2], [0, 0, 0, 0], [1, 1], "NCHW", "NCHW4c", "climgfloatw32"], {}], "config": {"index": 1921, "code_hash": null, "entity": [["tile_ic", "sp", [-1, 2, 4]], ["tile_oc", "sp", [-1, 1]], ["tile_ow", "sp", [-1, 1, 2]], ["tile_oh", "sp", [-1, 1, 7]]]}, "result": [[0.024517846200000002], 0, 10.570836782455444, 1615813458.8759718], "version": 0.2, "tvm_version": "0.8.dev0"}
{"input": ["opencl -keys=mali,opencl,gpu -device=mali -max_num_threads=256", "conv2d_NCHWc_io.mali", [["TENSOR", [1, 256, 14, 14], "climgfloatw32"], ["TENSOR", [256, 512, 1, 1], "climgfloatw32"], [2, 2], [0, 0, 0, 0], [1, 1], "NCHW", "NCHW4c", "climgfloatw32"], {}], "config": {"index": 236, "code_hash": null, "entity": [["tile_ic", "sp", [-1, 1, 4]], ["tile_oc", "sp", [-1, 8]], ["tile_ow", "sp", [-1, 1, 7]], ["tile_oh", "sp", [-1, 1, 1]]]}, "result": [[0.0005572812], 0, 11.24755048751831, 1615813459.8866787], "version": 0.2, "tvm_version": "0.8.dev0"}
{"input": ["opencl -keys=mali,opencl,gpu -device=mali -max_num_threads=256", "conv2d_NCHWc_io.mali", [["TENSOR", [1, 256, 14, 14], "climgfloatw32"], ["TENSOR", [256, 512, 1, 1], "climgfloatw32"], [2, 2], [0, 0, 0, 0], [1, 1], "NCHW", "NCHW4c", "climgfloatw32"], {}], "config": {"index": 1983, "code_hash": null, "entity": [["tile_ic", "sp", [-1, 8, 4]], ["tile_oc", "sp", [-1, 128]], ["tile_ow", "sp", [-1, 2, 2]], ["tile_oh", "sp", [-1, 1, 7]]]}, "result": [[0.006320729799999999], 0, 14.581879377365112, 1615813463.166933], "version": 0.2, "tvm_version": "0.8.dev0"}
{"input": ["opencl -keys=mali,opencl,gpu -device=mali -max_num_threads=256", "conv2d_NCHWc_io.mali", [["TENSOR", [1, 256, 14, 14], "climgfloatw32"], ["TENSOR", [256, 512, 1, 1], "climgfloatw32"], [2, 2], [0, 0, 0, 0], [1, 1], "NCHW", "NCHW4c", "climgfloatw32"], {}], "config": {"index": 1742, "code_hash": null, "entity": [["tile_ic", "sp", [-1, 4, 4]], ["tile_oc", "sp", [-1, 8]], ["tile_ow", "sp", [-1, 1, 4]], ["tile_oh", "sp", [-1, 1, 4]]]}, "result": [[0.0065856466], 0, 5.6093223094940186, 1615813453.1139455], "version": 0.2, "tvm_version": "0.8.dev0"}
{"input": ["opencl -keys=mali,opencl,gpu -device=mali -max_num_threads=256", "conv2d_NCHWc_io.mali", [["TENSOR", [1, 256, 14, 14], "climgfloatw32"], ["TENSOR", [256, 512, 1, 1], "climgfloatw32"], [2, 2], [0, 0, 0, 0], [1, 1], "NCHW", "NCHW4c", "climgfloatw32"], {}], "config": {"index": 397, "code_hash": null, "entity": [["tile_ic", "sp", [-1, 2, 4]], ["tile_oc", "sp", [-1, 8]], ["tile_ow", "sp", [-1, 1, 2]], ["tile_oh", "sp", [-1, 2, 1]]]}, "result": [[0.0006190522], 0, 1.449526071548462, 1615813449.011884], "version": 0.2, "tvm_version": "0.8.dev0"}
{"input": ["opencl -keys=mali,opencl,gpu -device=mali -max_num_threads=256", "conv2d_NCHWc_io.mali", [["TENSOR", [1, 256, 14, 14], "climgfloatw32"], ["TENSOR", [256, 512, 1, 1], "climgfloatw32"], [2, 2], [0, 0, 0, 0], [1, 1], "NCHW", "NCHW4c", "climgfloatw32"], {}], "config": {"index": 306, "code_hash": null, "entity": [["tile_ic", "sp", [-1, 4, 4]], ["tile_oc", "sp", [-1, 16]], ["tile_ow", "sp", [-1, 2, 1]], ["tile_oh", "sp", [-1, 2, 1]]]}, "result": [[0.0003878126], 0, 0.5067532062530518, 1615813466.2457328], "version": 0.2, "tvm_version": "0.8.dev0"}
{"input": ["opencl -keys=mali,opencl,gpu -device=mali -max_num_threads=256", "conv2d_NCHWc_io.mali", [["TENSOR", [1, 256, 14, 14], "climgfloatw32"], ["TENSOR", [256, 512, 1, 1], "climgfloatw32"], [2, 2], [0, 0, 0, 0], [1, 1], "NCHW", "NCHW4c", "climgfloatw32"], {}], "config": {"index": 320, "code_hash": null, "entity": [["tile_ic", "sp", [-1, 1, 4]], ["tile_oc", "sp", [-1, 1]], ["tile_ow", "sp", [-1, 4, 1]], ["tile_oh", "sp", [-1, 2, 1]]]}, "result": [[0.001972344], 0, 1.734539270401001, 1615813467.7466676], "version": 0.2, "tvm_version": "0.8.dev0"}
{"input": ["opencl -keys=mali,opencl,gpu -device=mali -max_num_threads=256", "conv2d_NCHWc_io.mali", [["TENSOR", [1, 256, 14, 14], "climgfloatw32"], ["TENSOR", [256, 512, 1, 1], "climgfloatw32"], [2, 2], [0, 0, 0, 0], [1, 1], "NCHW", "NCHW4c", "climgfloatw32"], {}], "config": {"index": 1112, "code_hash": null, "entity": [["tile_ic", "sp", [-1, 1, 4]], ["tile_oc", "sp", [-1, 64]], ["tile_ow", "sp", [-1, 4, 1]], ["tile_oh", "sp", [-1, 1, 2]]]}, "result": [[0.000301323], 0, 1.4608995914459229, 1615813467.2536376], "version": 0.2, "tvm_version": "0.8.dev0"}
{"input": ["opencl -keys=mali,opencl,gpu -device=mali -max_num_threads=256", "conv2d_NCHWc_io.mali", [["TENSOR", [1, 256, 14, 14], "climgfloatw32"], ["TENSOR", [256, 512, 1, 1], "climgfloatw32"], [2, 2], [0, 0, 0, 0], [1, 1], "NCHW", "NCHW4c", "climgfloatw32"], {}], "config": {"index": 396, "code_hash": null, "entity": [["tile_ic", "sp", [-1, 1, 4]], ["tile_oc", "sp", [-1, 8]], ["tile_ow", "sp", [-1, 1, 2]], ["tile_oh", "sp", [-1, 2, 1]]]}, "result": [[0.0007850417999999999], 0, 0.9234664440155029, 1615813466.7142541], "version": 0.2, "tvm_version": "0.8.dev0"}
