test_and_tune/float32.mobilenet_v1_1.0_224.log.tmp
{"input": ["opencl -keys=mali,opencl,gpu -device=mali -max_num_threads=256", "conv2d_NCHWc_io.mali", [["TENSOR", [1, 4, 224, 224], "float32"], ["TENSOR", [4, 32, 3, 3], "float32"], [2, 2], [1, 1, 1, 1], [1, 1], "NCHW", "NCHW4c", "float32"], {}], "config": {"index": 2753, "code_hash": null, "entity": [["tile_ic", "sp", [-1, 1, 4]], ["tile_oc", "sp", [-1, 2]], ["tile_ow", "sp", [-1, 7, 4]], ["tile_oh", "sp", [-1, 7, 4]]]}, "result": [[0.012700313599999999], 0, 11.443755388259888, 1615297903.2549767], "version": 0.2, "tvm_version": "0.8.dev0"}
{"input": ["opencl -keys=mali,opencl,gpu -device=mali -max_num_threads=256", "conv2d_NCHWc_io.mali", [["TENSOR", [1, 4, 224, 224], "float32"], ["TENSOR", [4, 32, 3, 3], "float32"], [2, 2], [1, 1, 1, 1], [1, 1], "NCHW", "NCHW4c", "float32"], {}], "config": {"index": 1197, "code_hash": null, "entity": [["tile_ic", "sp", [-1, 1, 4]], ["tile_oc", "sp", [-1, 2]], ["tile_ow", "sp", [-1, 4, 2]], ["tile_oh", "sp", [-1, 8, 2]]]}, "result": [[0.0115064386], 0, 41.451032876968384, 1615297933.5474772], "version": 0.2, "tvm_version": "0.8.dev0"}
{"input": ["opencl -keys=mali,opencl,gpu -device=mali -max_num_threads=256", "conv2d_NCHWc_io.mali", [["TENSOR", [1, 4, 224, 224], "float32"], ["TENSOR", [4, 32, 3, 3], "float32"], [2, 2], [1, 1, 1, 1], [1, 1], "NCHW", "NCHW4c", "float32"], {}], "config": {"index": 3547, "code_hash": null, "entity": [["tile_ic", "sp", [-1, 1, 4]], ["tile_oc", "sp", [-1, 8]], ["tile_ow", "sp", [-1, 2, 2]], ["tile_oh", "sp", [-1, 1, 8]]]}, "result": [[0.0063296258], 0, 94.43301749229431, 1615297986.2854347], "version": 0.2, "tvm_version": "0.8.dev0"}
{"input": ["opencl -keys=mali,opencl,gpu -device=mali -max_num_threads=256", "conv2d_NCHWc_io.mali", [["TENSOR", [1, 4, 224, 224], "float32"], ["TENSOR", [4, 32, 3, 3], "float32"], [2, 2], [1, 1, 1, 1], [1, 1], "NCHW", "NCHW4c", "float32"], {}], "config": {"index": 1937, "code_hash": null, "entity": [["tile_ic", "sp", [-1, 1, 4]], ["tile_oc", "sp", [-1, 2]], ["tile_ow", "sp", [-1, 2, 8]], ["tile_oh", "sp", [-1, 28, 2]]]}, "result": [[0.0154134912], 0, 115.76525592803955, 1615298007.6504548], "version": 0.2, "tvm_version": "0.8.dev0"}
{"input": ["opencl -keys=mali,opencl,gpu -device=mali -max_num_threads=256", "conv2d_NCHWc_io.mali", [["TENSOR", [1, 4, 224, 224], "float32"], ["TENSOR", [4, 32, 3, 3], "float32"], [2, 2], [1, 1, 1, 1], [1, 1], "NCHW", "NCHW4c", "float32"], {}], "config": {"index": 1189, "code_hash": null, "entity": [["tile_ic", "sp", [-1, 1, 4]], ["tile_oc", "sp", [-1, 2]], ["tile_ow", "sp", [-1, 1, 2]], ["tile_oh", "sp", [-1, 8, 2]]]}, "result": [[0.0063072506], 0, 146.24881410598755, 1615298038.4846985], "version": 0.2, "tvm_version": "0.8.dev0"}
{"input": ["opencl -keys=mali,opencl,gpu -device=mali -max_num_threads=256", "conv2d_NCHWc_io.mali", [["TENSOR", [1, 4, 224, 224], "float32"], ["TENSOR", [4, 32, 3, 3], "float32"], [2, 2], [1, 1, 1, 1], [1, 1], "NCHW", "NCHW4c", "float32"], {}], "config": {"index": 3114, "code_hash": null, "entity": [["tile_ic", "sp", [-1, 1, 4]], ["tile_oc", "sp", [-1, 4]], ["tile_ow", "sp", [-1, 2, 8]], ["tile_oh", "sp", [-1, 14, 4]]]}, "result": [[0.008583250800000001], 0, 158.94869256019592, 1615298206.5295875], "version": 0.2, "tvm_version": "0.8.dev0"}
{"input": ["opencl -keys=mali,opencl,gpu -device=mali -max_num_threads=256", "conv2d_NCHWc_io.mali", [["TENSOR", [1, 4, 224, 224], "float32"], ["TENSOR", [4, 32, 3, 3], "float32"], [2, 2], [1, 1, 1, 1], [1, 1], "NCHW", "NCHW4c", "float32"], {}], "config": {"index": 3543, "code_hash": null, "entity": [["tile_ic", "sp", [-1, 1, 4]], ["tile_oc", "sp", [-1, 8]], ["tile_ow", "sp", [-1, 1, 2]], ["tile_oh", "sp", [-1, 1, 8]]]}, "result": [[0.0083635946], 0, 52.83936166763306, 1615298101.0216951], "version": 0.2, "tvm_version": "0.8.dev0"}
{"input": ["opencl -keys=mali,opencl,gpu -device=mali -max_num_threads=256", "conv2d_NCHWc_io.mali", [["TENSOR", [1, 4, 224, 224], "float32"], ["TENSOR", [4, 32, 3, 3], "float32"], [2, 2], [1, 1, 1, 1], [1, 1], "NCHW", "NCHW4c", "float32"], {}], "config": {"index": 1303, "code_hash": null, "entity": [["tile_ic", "sp", [-1, 1, 4]], ["tile_oc", "sp", [-1, 8]], ["tile_ow", "sp", [-1, 8, 14]], ["tile_oh", "sp", [-1, 8, 2]]]}, "result": [[0.0096210426], 0, 63.7619354724884, 1615298111.4617105], "version": 0.2, "tvm_version": "0.8.dev0"}
{"input": ["opencl -keys=mali,opencl,gpu -device=mali -max_num_threads=256", "conv2d_NCHWc_io.mali", [["TENSOR", [1, 4, 224, 224], "float32"], ["TENSOR", [4, 32, 3, 3], "float32"], [2, 2], [1, 1, 1, 1], [1, 1], "NCHW", "NCHW4c", "float32"], {}], "config": {"index": 3386, "code_hash": null, "entity": [["tile_ic", "sp", [-1, 1, 4]], ["tile_oc", "sp", [-1, 4]], ["tile_ow", "sp", [-1, 7, 2]], ["tile_oh", "sp", [-1, 28, 4]]]}, "result": [[0.010530949000000001], 0, 73.63177371025085, 1615298121.8583934], "version": 0.2, "tvm_version": "0.8.dev0"}
{"input": ["opencl -keys=mali,opencl,gpu -device=mali -max_num_threads=256", "conv2d_NCHWc_io.mali", [["TENSOR", [1, 4, 224, 224], "float32"], ["TENSOR", [4, 32, 3, 3], "float32"], [2, 2], [1, 1, 1, 1], [1, 1], "NCHW", "NCHW4c", "float32"], {}], "config": {"index": 4751, "code_hash": null, "entity": [["tile_ic", "sp", [-1, 1, 4]], ["tile_oc", "sp", [-1, 8]], ["tile_ow", "sp", [-1, 28, 2]], ["tile_oh", "sp", [-1, 2, 14]]]}, "result": [[0.007984261199999999], 0, 85.09265971183777, 1615298132.718574], "version": 0.2, "tvm_version": "0.8.dev0"}
{"input": ["opencl -keys=mali,opencl,gpu -device=mali -max_num_threads=256", "conv2d_NCHWc_io.mali", [["TENSOR", [1, 4, 224, 224], "float32"], ["TENSOR", [4, 32, 3, 3], "float32"], [2, 2], [1, 1, 1, 1], [1, 1], "NCHW", "NCHW4c", "float32"], {}], "config": {"index": 2382, "code_hash": null, "entity": [["tile_ic", "sp", [-1, 1, 4]], ["tile_oc", "sp", [-1, 4]], ["tile_ow", "sp", [-1, 8, 2]], ["tile_oh", "sp", [-1, 2, 4]]]}, "result": [[0.009469553], 0, 94.82262969017029, 1615298143.051135], "version": 0.2, "tvm_version": "0.8.dev0"}
{"input": ["opencl -keys=mali,opencl,gpu -device=mali -max_num_threads=256", "conv2d_NCHWc_io.mali", [["TENSOR", [1, 4, 224, 224], "float32"], ["TENSOR", [4, 32, 3, 3], "float32"], [2, 2], [1, 1, 1, 1], [1, 1], "NCHW", "NCHW4c", "float32"], {}], "config": {"index": 1908, "code_hash": null, "entity": [["tile_ic", "sp", [-1, 1, 4]], ["tile_oc", "sp", [-1, 1]], ["tile_ow", "sp", [-1, 4, 4]], ["tile_oh", "sp", [-1, 28, 2]]]}, "result": [[0.0113083656], 0, 105.08870100975037, 1615298153.3357272], "version": 0.2, "tvm_version": "0.8.dev0"}
{"input": ["opencl -keys=mali,opencl,gpu -device=mali -max_num_threads=256", "conv2d_NCHWc_io.mali", [["TENSOR", [1, 4, 224, 224], "float32"], ["TENSOR", [4, 32, 3, 3], "float32"], [2, 2], [1, 1, 1, 1], [1, 1], "NCHW", "NCHW4c", "float32"], {}], "config": {"index": 1366, "code_hash": null, "entity": [["tile_ic", "sp", [-1, 1, 4]], ["tile_oc", "sp", [-1, 4]], ["tile_ow", "sp", [-1, 4, 2]], ["tile_oh", "sp", [-1, 14, 2]]]}, "result": [[0.0119130534], 0, 10.267680406570435, 1615298227.1601503], "version": 0.2, "tvm_version": "0.8.dev0"}
{"input": ["opencl -keys=mali,opencl,gpu -device=mali -max_num_threads=256", "conv2d_NCHWc_io.mali", [["TENSOR", [1, 4, 224, 224], "float32"], ["TENSOR", [4, 32, 3, 3], "float32"], [2, 2], [1, 1, 1, 1], [1, 1], "NCHW", "NCHW4c", "float32"], {}], "config": {"index": 5399, "code_hash": null, "entity": [["tile_ic", "sp", [-1, 1, 4]], ["tile_oc", "sp", [-1, 8]], ["tile_ow", "sp", [-1, 4, 2]], ["tile_oh", "sp", [-1, 1, 16]]]}, "result": [[0.0057423234], 0, 21.84368062019348, 1615298238.0260234], "version": 0.2, "tvm_version": "0.8.dev0"}
{"input": ["opencl -keys=mali,opencl,gpu -device=mali -max_num_threads=256", "conv2d_NCHWc_io.mali", [["TENSOR", [1, 4, 224, 224], "float32"], ["TENSOR", [4, 32, 3, 3], "float32"], [2, 2], [1, 1, 1, 1], [1, 1], "NCHW", "NCHW4c", "float32"], {}], "config": {"index": 740, "code_hash": null, "entity": [["tile_ic", "sp", [-1, 1, 4]], ["tile_oc", "sp", [-1, 1]], ["tile_ow", "sp", [-1, 8, 4]], ["tile_oh", "sp", [-1, 2, 2]]]}, "result": [[0.0075786882], 0, 32.909682512283325, 1615298249.1497371], "version": 0.2, "tvm_version": "0.8.dev0"}
{"input": ["opencl -keys=mali,opencl,gpu -device=mali -max_num_threads=256", "conv2d_NCHWc_io.mali", [["TENSOR", [1, 4, 224, 224], "float32"], ["TENSOR", [4, 32, 3, 3], "float32"], [2, 2], [1, 1, 1, 1], [1, 1], "NCHW", "NCHW4c", "float32"], {}], "config": {"index": 2784, "code_hash": null, "entity": [["tile_ic", "sp", [-1, 1, 4]], ["tile_oc", "sp", [-1, 1]], ["tile_ow", "sp", [-1, 7, 8]], ["tile_oh", "sp", [-1, 7, 4]]]}, "result": [[0.008366219599999999], 0, 64.74924087524414, 1615298280.9645584], "version": 0.2, "tvm_version": "0.8.dev0"}
{"input": ["opencl -keys=mali,opencl,gpu -device=mali -max_num_threads=256", "conv2d_NCHWc_io.mali", [["TENSOR", [1, 4, 224, 224], "float32"], ["TENSOR", [4, 32, 3, 3], "float32"], [2, 2], [1, 1, 1, 1], [1, 1], "NCHW", "NCHW4c", "float32"], {}], "config": {"index": 2581, "code_hash": null, "entity": [["tile_ic", "sp", [-1, 1, 4]], ["tile_oc", "sp", [-1, 2]], ["tile_ow", "sp", [-1, 4, 4]], ["tile_oh", "sp", [-1, 4, 4]]]}, "result": [[0.0092567302], 0, 106.08791303634644, 1615298322.781644], "version": 0.2, "tvm_version": "0.8.dev0"}
{"input": ["opencl -keys=mali,opencl,gpu -device=mali -max_num_threads=256", "conv2d_NCHWc_io.mali", [["TENSOR", [1, 4, 224, 224], "float32"], ["TENSOR", [4, 32, 3, 3], "float32"], [2, 2], [1, 1, 1, 1], [1, 1], "NCHW", "NCHW4c", "float32"], {}], "config": {"index": 1034, "code_hash": null, "entity": [["tile_ic", "sp", [-1, 1, 4]], ["tile_oc", "sp", [-1, 4]], ["tile_ow", "sp", [-1, 7, 2]], ["tile_oh", "sp", [-1, 7, 2]]]}, "result": [[0.0116582096], 0, 53.04593586921692, 1615298397.5097587], "version": 0.2, "tvm_version": "0.8.dev0"}
{"input": ["opencl -keys=mali,opencl,gpu -device=mali -max_num_threads=256", "conv2d_NCHWc_io.mali", [["TENSOR", [1, 4, 224, 224], "float32"], ["TENSOR", [4, 32, 3, 3], "float32"], [2, 2], [1, 1, 1, 1], [1, 1], "NCHW", "NCHW4c", "float32"], {}], "config": {"index": 517, "code_hash": null, "entity": [["tile_ic", "sp", [-1, 1, 4]], ["tile_oc", "sp", [-1, 2]], ["tile_ow", "sp", [-1, 1, 2]], ["tile_oh", "sp", [-1, 1, 2]]]}, "result": [[0.0115130532], 0, 63.26954960823059, 1615298407.8597357], "version": 0.2, "tvm_version": "0.8.dev0"}
{"input": ["opencl -keys=mali,opencl,gpu -device=mali -max_num_threads=256", "conv2d_NCHWc_io.mali", [["TENSOR", [1, 4, 224, 224], "float32"], ["TENSOR", [4, 32, 3, 3], "float32"], [2, 2], [1, 1, 1, 1], [1, 1], "NCHW", "NCHW4c", "float32"], {}], "config": {"index": 892, "code_hash": null, "entity": [["tile_ic", "sp", [-1, 1, 4]], ["tile_oc", "sp", [-1, 1]], ["tile_ow", "sp", [-1, 1, 4]], ["tile_oh", "sp", [-1, 4, 2]]]}, "result": [[0.0083234592], 0, 73.975909948349, 1615298418.3994346], "version": 0.2, "tvm_version": "0.8.dev0"}
{"input": ["opencl -keys=mali,opencl,gpu -device=mali -max_num_threads=256", "conv2d_NCHWc_io.mali", [["TENSOR", [1, 4, 224, 224], "float32"], ["TENSOR", [4, 32, 3, 3], "float32"], [2, 2], [1, 1, 1, 1], [1, 1], "NCHW", "NCHW4c", "float32"], {}], "config": {"index": 866, "code_hash": null, "entity": [["tile_ic", "sp", [-1, 1, 4]], ["tile_oc", "sp", [-1, 4]], ["tile_ow", "sp", [-1, 7, 2]], ["tile_oh", "sp", [-1, 4, 2]]]}, "result": [[0.011381969799999999], 0, 148.63907718658447, 1615298493.0995002], "version": 0.2, "tvm_version": "0.8.dev0"}
{"input": ["opencl -keys=mali,opencl,gpu -device=mali -max_num_threads=256", "conv2d_NCHWc_io.mali", [["TENSOR", [1, 4, 224, 224], "float32"], ["TENSOR", [4, 32, 3, 3], "float32"], [2, 2], [1, 1, 1, 1], [1, 1], "NCHW", "NCHW4c", "float32"], {}], "config": {"index": 3715, "code_hash": null, "entity": [["tile_ic", "sp", [-1, 1, 4]], ["tile_oc", "sp", [-1, 8]], ["tile_ow", "sp", [-1, 2, 2]], ["tile_oh", "sp", [-1, 2, 8]]]}, "result": [[0.008418375799999999], 0, 11.069366216659546, 1615298567.501269], "version": 0.2, "tvm_version": "0.8.dev0"}
{"input": ["opencl -keys=mali,opencl,gpu -device=mali -max_num_threads=256", "conv2d_NCHWc_io.mali", [["TENSOR", [1, 4, 224, 224], "float32"], ["TENSOR", [4, 32, 3, 3], "float32"], [2, 2], [1, 1, 1, 1], [1, 1], "NCHW", "NCHW4c", "float32"], {}], "config": {"index": 2575, "code_hash": null, "entity": [["tile_ic", "sp", [-1, 1, 4]], ["tile_oc", "sp", [-1, 8]], ["tile_ow", "sp", [-1, 1, 4]], ["tile_oh", "sp", [-1, 4, 4]]]}, "result": [[0.0091090634], 0, 21.157848596572876, 1615298577.671302], "version": 0.2, "tvm_version": "0.8.dev0"}
{"input": ["opencl -keys=mali,opencl,gpu -device=mali -max_num_threads=256", "conv2d_NCHWc_io.mali", [["TENSOR", [1, 4, 224, 224], "float32"], ["TENSOR", [4, 32, 3, 3], "float32"], [2, 2], [1, 1, 1, 1], [1, 1], "NCHW", "NCHW4c", "float32"], {}], "config": {"index": 1229, "code_hash": null, "entity": [["tile_ic", "sp", [-1, 1, 4]], ["tile_oc", "sp", [-1, 2]], ["tile_ow", "sp", [-1, 1, 4]], ["tile_oh", "sp", [-1, 8, 2]]]}, "result": [[0.0055391672], 0, 31.078377962112427, 1615298588.001643], "version": 0.2, "tvm_version": "0.8.dev0"}
{"input": ["opencl -keys=mali,opencl,gpu -device=mali -max_num_threads=256", "conv2d_NCHWc_io.mali", [["TENSOR", [1, 4, 224, 224], "float32"], ["TENSOR", [4, 32, 3, 3], "float32"], [2, 2], [1, 1, 1, 1], [1, 1], "NCHW", "NCHW4c", "float32"], {}], "config": {"index": 2579, "code_hash": null, "entity": [["tile_ic", "sp", [-1, 1, 4]], ["tile_oc", "sp", [-1, 8]], ["tile_ow", "sp", [-1, 2, 4]], ["tile_oh", "sp", [-1, 4, 4]]]}, "result": [[0.0125991262], 0, 42.604355812072754, 1615298598.9779968], "version": 0.2, "tvm_version": "0.8.dev0"}
{"input": ["opencl -keys=mali,opencl,gpu -device=mali -max_num_threads=256", "conv2d_NCHWc_io.mali", [["TENSOR", [1, 4, 224, 224], "float32"], ["TENSOR", [4, 32, 3, 3], "float32"], [2, 2], [1, 1, 1, 1], [1, 1], "NCHW", "NCHW4c", "float32"], {}], "config": {"index": 898, "code_hash": null, "entity": [["tile_ic", "sp", [-1, 1, 4]], ["tile_oc", "sp", [-1, 4]], ["tile_ow", "sp", [-1, 2, 4]], ["tile_oh", "sp", [-1, 4, 2]]]}, "result": [[0.0076474798], 0, 52.44138050079346, 1615298609.179425], "version": 0.2, "tvm_version": "0.8.dev0"}
{"input": ["opencl -keys=mali,opencl,gpu -device=mali -max_num_threads=256", "conv2d_NCHWc_io.mali", [["TENSOR", [1, 4, 224, 224], "float32"], ["TENSOR", [4, 32, 3, 3], "float32"], [2, 2], [1, 1, 1, 1], [1, 1], "NCHW", "NCHW4c", "float32"], {}], "config": {"index": 1065, "code_hash": null, "entity": [["tile_ic", "sp", [-1, 1, 4]], ["tile_oc", "sp", [-1, 2]], ["tile_ow", "sp", [-1, 2, 4]], ["tile_oh", "sp", [-1, 7, 2]]]}, "result": [[0.0066445110000000005], 0, 63.1116578578949, 1615298619.8583925], "version": 0.2, "tvm_version": "0.8.dev0"}
{"input": ["opencl -keys=mali,opencl,gpu -device=mali -max_num_threads=256", "conv2d_NCHWc_io.mali", [["TENSOR", [1, 4, 224, 224], "float32"], ["TENSOR", [4, 32, 3, 3], "float32"], [2, 2], [1, 1, 1, 1], [1, 1], "NCHW", "NCHW4c", "float32"], {}], "config": {"index": 2607, "code_hash": null, "entity": [["tile_ic", "sp", [-1, 1, 4]], ["tile_oc", "sp", [-1, 8]], ["tile_ow", "sp", [-1, 1, 8]], ["tile_oh", "sp", [-1, 4, 4]]]}, "result": [[0.0070547299999999995], 0, 74.61085939407349, 1615298630.9821403], "version": 0.2, "tvm_version": "0.8.dev0"}
{"input": ["opencl -keys=mali,opencl,gpu -device=mali -max_num_threads=256", "conv2d_NCHWc_io.mali", [["TENSOR", [1, 4, 224, 224], "float32"], ["TENSOR", [4, 32, 3, 3], "float32"], [2, 2], [1, 1, 1, 1], [1, 1], "NCHW", "NCHW4c", "float32"], {}], "config": {"index": 3711, "code_hash": null, "entity": [["tile_ic", "sp", [-1, 1, 4]], ["tile_oc", "sp", [-1, 8]], ["tile_ow", "sp", [-1, 1, 2]], ["tile_oh", "sp", [-1, 2, 8]]]}, "result": [[0.006828459], 0, 84.501718044281, 1615298641.0598578], "version": 0.2, "tvm_version": "0.8.dev0"}
{"input": ["opencl -keys=mali,opencl,gpu -device=mali -max_num_threads=256", "conv2d_NCHWc_io.mali", [["TENSOR", [1, 4, 224, 224], "float32"], ["TENSOR", [4, 32, 3, 3], "float32"], [2, 2], [1, 1, 1, 1], [1, 1], "NCHW", "NCHW4c", "float32"], {}], "config": {"index": 1263, "code_hash": null, "entity": [["tile_ic", "sp", [-1, 1, 4]], ["tile_oc", "sp", [-1, 8]], ["tile_ow", "sp", [-1, 1, 8]], ["tile_oh", "sp", [-1, 8, 2]]]}, "result": [[0.0143292828], 0, 95.19482755661011, 1615298651.6615925], "version": 0.2, "tvm_version": "0.8.dev0"}
{"input": ["opencl -keys=mali,opencl,gpu -device=mali -max_num_threads=256", "conv2d_NCHWc_io.mali", [["TENSOR", [1, 4, 224, 224], "float32"], ["TENSOR", [4, 32, 3, 3], "float32"], [2, 2], [1, 1, 1, 1], [1, 1], "NCHW", "NCHW4c", "float32"], {}], "config": {"index": 3755, "code_hash": null, "entity": [["tile_ic", "sp", [-1, 1, 4]], ["tile_oc", "sp", [-1, 8]], ["tile_ow", "sp", [-1, 2, 4]], ["tile_oh", "sp", [-1, 2, 8]]]}, "result": [[0.005897729799999999], 0, 106.26055359840393, 1615298662.5471702], "version": 0.2, "tvm_version": "0.8.dev0"}
{"input": ["opencl -keys=mali,opencl,gpu -device=mali -max_num_threads=256", "conv2d_NCHWc_io.mali", [["TENSOR", [1, 4, 224, 224], "float32"], ["TENSOR", [4, 32, 3, 3], "float32"], [2, 2], [1, 1, 1, 1], [1, 1], "NCHW", "NCHW4c", "float32"], {}], "config": {"index": 1061, "code_hash": null, "entity": [["tile_ic", "sp", [-1, 1, 4]], ["tile_oc", "sp", [-1, 2]], ["tile_ow", "sp", [-1, 1, 4]], ["tile_oh", "sp", [-1, 7, 2]]]}, "result": [[0.005314542199999999], 0, 116.3614490032196, 1615298673.168235], "version": 0.2, "tvm_version": "0.8.dev0"}
{"input": ["opencl -keys=mali,opencl,gpu -device=mali -max_num_threads=256", "conv2d_NCHWc_io.mali", [["TENSOR", [1, 4, 224, 224], "float32"], ["TENSOR", [4, 32, 3, 3], "float32"], [2, 2], [1, 1, 1, 1], [1, 1], "NCHW", "NCHW4c", "float32"], {}], "config": {"index": 4723, "code_hash": null, "entity": [["tile_ic", "sp", [-1, 1, 4]], ["tile_oc", "sp", [-1, 8]], ["tile_ow", "sp", [-1, 2, 2]], ["tile_oh", "sp", [-1, 2, 14]]]}, "result": [[0.0057743548], 0, 127.91223216056824, 1615298684.2076774], "version": 0.2, "tvm_version": "0.8.dev0"}
{"input": ["opencl -keys=mali,opencl,gpu -device=mali -max_num_threads=256", "conv2d_NCHWc_io.mali", [["TENSOR", [1, 4, 224, 224], "float32"], ["TENSOR", [4, 32, 3, 3], "float32"], [2, 2], [1, 1, 1, 1], [1, 1], "NCHW", "NCHW4c", "float32"], {}], "config": {"index": 1192, "code_hash": null, "entity": [["tile_ic", "sp", [-1, 1, 4]], ["tile_oc", "sp", [-1, 1]], ["tile_ow", "sp", [-1, 2, 2]], ["tile_oh", "sp", [-1, 8, 2]]]}, "result": [[0.0065256464], 0, 137.46406936645508, 1615298694.3976195], "version": 0.2, "tvm_version": "0.8.dev0"}
{"input": ["opencl -keys=mali,opencl,gpu -device=mali -max_num_threads=256", "conv2d_NCHWc_io.mali", [["TENSOR", [1, 4, 224, 224], "float32"], ["TENSOR", [4, 32, 3, 3], "float32"], [2, 2], [1, 1, 1, 1], [1, 1], "NCHW", "NCHW4c", "float32"], {}], "config": {"index": 896, "code_hash": null, "entity": [["tile_ic", "sp", [-1, 1, 4]], ["tile_oc", "sp", [-1, 1]], ["tile_ow", "sp", [-1, 2, 4]], ["tile_oh", "sp", [-1, 4, 2]]]}, "result": [[0.006347167200000001], 0, 148.17778611183167, 1615298704.9687223], "version": 0.2, "tvm_version": "0.8.dev0"}
{"input": ["opencl -keys=mali,opencl,gpu -device=mali -max_num_threads=256", "conv2d_NCHWc_io.mali", [["TENSOR", [1, 4, 224, 224], "float32"], ["TENSOR", [4, 32, 3, 3], "float32"], [2, 2], [1, 1, 1, 1], [1, 1], "NCHW", "NCHW4c", "float32"], {}], "config": {"index": 2371, "code_hash": null, "entity": [["tile_ic", "sp", [-1, 1, 4]], ["tile_oc", "sp", [-1, 8]], ["tile_ow", "sp", [-1, 2, 2]], ["tile_oh", "sp", [-1, 2, 4]]]}, "result": [[0.00655573], 0, 158.74928545951843, 1615298715.5046299], "version": 0.2, "tvm_version": "0.8.dev0"}
{"input": ["opencl -keys=mali,opencl,gpu -device=mali -max_num_threads=256", "conv2d_NCHWc_io.mali", [["TENSOR", [1, 4, 224, 224], "float32"], ["TENSOR", [4, 32, 3, 3], "float32"], [2, 2], [1, 1, 1, 1], [1, 1], "NCHW", "NCHW4c", "float32"], {}], "config": {"index": 696, "code_hash": null, "entity": [["tile_ic", "sp", [-1, 1, 4]], ["tile_oc", "sp", [-1, 1]], ["tile_ow", "sp", [-1, 7, 2]], ["tile_oh", "sp", [-1, 2, 2]]]}, "result": [[0.0065814587999999995], 0, 10.801737546920776, 1615298739.6505046], "version": 0.2, "tvm_version": "0.8.dev0"}
{"input": ["opencl -keys=mali,opencl,gpu -device=mali -max_num_threads=256", "conv2d_NCHWc_io.mali", [["TENSOR", [1, 4, 224, 224], "float32"], ["TENSOR", [4, 32, 3, 3], "float32"], [2, 2], [1, 1, 1, 1], [1, 1], "NCHW", "NCHW4c", "float32"], {}], "config": {"index": 894, "code_hash": null, "entity": [["tile_ic", "sp", [-1, 1, 4]], ["tile_oc", "sp", [-1, 4]], ["tile_ow", "sp", [-1, 1, 4]], ["tile_oh", "sp", [-1, 4, 2]]]}, "result": [[0.0047763234], 0, 21.22770118713379, 1615298749.9052138], "version": 0.2, "tvm_version": "0.8.dev0"}
{"input": ["opencl -keys=mali,opencl,gpu -device=mali -max_num_threads=256", "conv2d_NCHWc_io.mali", [["TENSOR", [1, 4, 224, 224], "float32"], ["TENSOR", [4, 32, 3, 3], "float32"], [2, 2], [1, 1, 1, 1], [1, 1], "NCHW", "NCHW4c", "float32"], {}], "config": {"index": 731, "code_hash": null, "entity": [["tile_ic", "sp", [-1, 1, 4]], ["tile_oc", "sp", [-1, 8]], ["tile_ow", "sp", [-1, 2, 4]], ["tile_oh", "sp", [-1, 2, 2]]]}, "result": [[0.0074996258], 0, 32.23641300201416, 1615298760.8206687], "version": 0.2, "tvm_version": "0.8.dev0"}
{"input": ["opencl -keys=mali,opencl,gpu -device=mali -max_num_threads=256", "conv2d_NCHWc_io.mali", [["TENSOR", [1, 4, 224, 224], "float32"], ["TENSOR", [4, 32, 3, 3], "float32"], [2, 2], [1, 1, 1, 1], [1, 1], "NCHW", "NCHW4c", "float32"], {}], "config": {"index": 3751, "code_hash": null, "entity": [["tile_ic", "sp", [-1, 1, 4]], ["tile_oc", "sp", [-1, 8]], ["tile_ow", "sp", [-1, 1, 4]], ["tile_oh", "sp", [-1, 2, 8]]]}, "result": [[0.0096468968], 0, 43.60026955604553, 1615298771.8015518], "version": 0.2, "tvm_version": "0.8.dev0"}
{"input": ["opencl -keys=mali,opencl,gpu -device=mali -max_num_threads=256", "conv2d_NCHWc_io.mali", [["TENSOR", [1, 4, 224, 224], "float32"], ["TENSOR", [4, 32, 3, 3], "float32"], [2, 2], [1, 1, 1, 1], [1, 1], "NCHW", "NCHW4c", "float32"], {}], "config": {"index": 1233, "code_hash": null, "entity": [["tile_ic", "sp", [-1, 1, 4]], ["tile_oc", "sp", [-1, 2]], ["tile_ow", "sp", [-1, 2, 4]], ["tile_oh", "sp", [-1, 8, 2]]]}, "result": [[0.0078824486], 0, 53.33533978462219, 1615298782.0492647], "version": 0.2, "tvm_version": "0.8.dev0"}
{"input": ["opencl -keys=mali,opencl,gpu -device=mali -max_num_threads=256", "conv2d_NCHWc_io.mali", [["TENSOR", [1, 4, 224, 224], "float32"], ["TENSOR", [4, 32, 3, 3], "float32"], [2, 2], [1, 1, 1, 1], [1, 1], "NCHW", "NCHW4c", "float32"], {}], "config": {"index": 2411, "code_hash": null, "entity": [["tile_ic", "sp", [-1, 1, 4]], ["tile_oc", "sp", [-1, 8]], ["tile_ow", "sp", [-1, 2, 4]], ["tile_oh", "sp", [-1, 2, 4]]]}, "result": [[0.00900923], 0, 64.07418775558472, 1615298792.5700178], "version": 0.2, "tvm_version": "0.8.dev0"}
{"input": ["opencl -keys=mali,opencl,gpu -device=mali -max_num_threads=256", "conv2d_NCHWc_io.mali", [["TENSOR", [1, 4, 224, 224], "float32"], ["TENSOR", [4, 32, 3, 3], "float32"], [2, 2], [1, 1, 1, 1], [1, 1], "NCHW", "NCHW4c", "float32"], {}], "config": {"index": 733, "code_hash": null, "entity": [["tile_ic", "sp", [-1, 1, 4]], ["tile_oc", "sp", [-1, 2]], ["tile_ow", "sp", [-1, 4, 4]], ["tile_oh", "sp", [-1, 2, 2]]]}, "result": [[0.0050816253999999995], 0, 74.4010591506958, 1615298803.0693617], "version": 0.2, "tvm_version": "0.8.dev0"}
{"input": ["opencl -keys=mali,opencl,gpu -device=mali -max_num_threads=256", "conv2d_NCHWc_io.mali", [["TENSOR", [1, 4, 224, 224], "float32"], ["TENSOR", [4, 32, 3, 3], "float32"], [2, 2], [1, 1, 1, 1], [1, 1], "NCHW", "NCHW4c", "float32"], {}], "config": {"index": 893, "code_hash": null, "entity": [["tile_ic", "sp", [-1, 1, 4]], ["tile_oc", "sp", [-1, 2]], ["tile_ow", "sp", [-1, 1, 4]], ["tile_oh", "sp", [-1, 4, 2]]]}, "result": [[0.0066628654], 0, 85.21154856681824, 1615298813.8967655], "version": 0.2, "tvm_version": "0.8.dev0"}
{"input": ["opencl -keys=mali,opencl,gpu -device=mali -max_num_threads=256", "conv2d_NCHWc_io.mali", [["TENSOR", [1, 4, 224, 224], "float32"], ["TENSOR", [4, 32, 3, 3], "float32"], [2, 2], [1, 1, 1, 1], [1, 1], "NCHW", "NCHW4c", "float32"], {}], "config": {"index": 5395, "code_hash": null, "entity": [["tile_ic", "sp", [-1, 1, 4]], ["tile_oc", "sp", [-1, 8]], ["tile_ow", "sp", [-1, 2, 2]], ["tile_oh", "sp", [-1, 1, 16]]]}, "result": [[0.009778719600000001], 0, 96.86704730987549, 1615298825.1029835], "version": 0.2, "tvm_version": "0.8.dev0"}
{"input": ["opencl -keys=mali,opencl,gpu -device=mali -max_num_threads=256", "conv2d_NCHWc_io.mali", [["TENSOR", [1, 4, 224, 224], "float32"], ["TENSOR", [4, 32, 3, 3], "float32"], [2, 2], [1, 1, 1, 1], [1, 1], "NCHW", "NCHW4c", "float32"], {}], "config": {"index": 899, "code_hash": null, "entity": [["tile_ic", "sp", [-1, 1, 4]], ["tile_oc", "sp", [-1, 8]], ["tile_ow", "sp", [-1, 2, 4]], ["tile_oh", "sp", [-1, 4, 2]]]}, "result": [[0.010711449000000001], 0, 106.48451638221741, 1615298835.2158673], "version": 0.2, "tvm_version": "0.8.dev0"}
{"input": ["opencl -keys=mali,opencl,gpu -device=mali -max_num_threads=256", "conv2d_NCHWc_io.mali", [["TENSOR", [1, 4, 224, 224], "float32"], ["TENSOR", [4, 32, 3, 3], "float32"], [2, 2], [1, 1, 1, 1], [1, 1], "NCHW", "NCHW4c", "float32"], {}], "config": {"index": 1231, "code_hash": null, "entity": [["tile_ic", "sp", [-1, 1, 4]], ["tile_oc", "sp", [-1, 8]], ["tile_ow", "sp", [-1, 1, 4]], ["tile_oh", "sp", [-1, 8, 2]]]}, "result": [[0.010955125999999999], 0, 116.84562110900879, 1615298845.604974], "version": 0.2, "tvm_version": "0.8.dev0"}
{"input": ["opencl -keys=mali,opencl,gpu -device=mali -max_num_threads=256", "conv2d_NCHWc_io.mali", [["TENSOR", [1, 4, 224, 224], "float32"], ["TENSOR", [4, 32, 3, 3], "float32"], [2, 2], [1, 1, 1, 1], [1, 1], "NCHW", "NCHW4c", "float32"], {}], "config": {"index": 1062, "code_hash": null, "entity": [["tile_ic", "sp", [-1, 1, 4]], ["tile_oc", "sp", [-1, 4]], ["tile_ow", "sp", [-1, 1, 4]], ["tile_oh", "sp", [-1, 7, 2]]]}, "result": [[0.0066500736000000005], 0, 127.2316620349884, 1615298856.0457702], "version": 0.2, "tvm_version": "0.8.dev0"}
{"input": ["opencl -keys=mali,opencl,gpu -device=mali -max_num_threads=256", "conv2d_NCHWc_io.mali", [["TENSOR", [1, 4, 224, 224], "float32"], ["TENSOR", [4, 32, 3, 3], "float32"], [2, 2], [1, 1, 1, 1], [1, 1], "NCHW", "NCHW4c", "float32"], {}], "config": {"index": 2375, "code_hash": null, "entity": [["tile_ic", "sp", [-1, 1, 4]], ["tile_oc", "sp", [-1, 8]], ["tile_ow", "sp", [-1, 4, 2]], ["tile_oh", "sp", [-1, 2, 4]]]}, "result": [[0.009293428], 0, 138.06043434143066, 1615298866.860425], "version": 0.2, "tvm_version": "0.8.dev0"}
{"input": ["opencl -keys=mali,opencl,gpu -device=mali -max_num_threads=256", "conv2d_NCHWc_io.mali", [["TENSOR", [1, 4, 224, 224], "float32"], ["TENSOR", [4, 32, 3, 3], "float32"], [2, 2], [1, 1, 1, 1], [1, 1], "NCHW", "NCHW4c", "float32"], {}], "config": {"index": 1095, "code_hash": null, "entity": [["tile_ic", "sp", [-1, 1, 4]], ["tile_oc", "sp", [-1, 8]], ["tile_ow", "sp", [-1, 1, 8]], ["tile_oh", "sp", [-1, 7, 2]]]}, "result": [[0.0130087826], 0, 148.48139715194702, 1615298877.063682], "version": 0.2, "tvm_version": "0.8.dev0"}
{"input": ["opencl -keys=mali,opencl,gpu -device=mali -max_num_threads=256", "conv2d_NCHWc_io.mali", [["TENSOR", [1, 4, 224, 224], "float32"], ["TENSOR", [4, 32, 3, 3], "float32"], [2, 2], [1, 1, 1, 1], [1, 1], "NCHW", "NCHW4c", "float32"], {}], "config": {"index": 895, "code_hash": null, "entity": [["tile_ic", "sp", [-1, 1, 4]], ["tile_oc", "sp", [-1, 8]], ["tile_ow", "sp", [-1, 1, 4]], ["tile_oh", "sp", [-1, 4, 2]]]}, "result": [[0.0074079174], 0, 159.09837245941162, 1615298887.8483717], "version": 0.2, "tvm_version": "0.8.dev0"}
{"input": ["opencl -keys=mali,opencl,gpu -device=mali -max_num_threads=256", "conv2d_NCHWc_io.mali", [["TENSOR", [1, 4, 224, 224], "float32"], ["TENSOR", [4, 32, 3, 3], "float32"], [2, 2], [1, 1, 1, 1], [1, 1], "NCHW", "NCHW4c", "float32"], {}], "config": {"index": 700, "code_hash": null, "entity": [["tile_ic", "sp", [-1, 1, 4]], ["tile_oc", "sp", [-1, 1]], ["tile_ow", "sp", [-1, 8, 2]], ["tile_oh", "sp", [-1, 2, 2]]]}, "result": [[0.006247261], 0, 168.95738196372986, 1615298897.9468164], "version": 0.2, "tvm_version": "0.8.dev0"}
{"input": ["opencl -keys=mali,opencl,gpu -device=mali -max_num_threads=256", "conv2d_NCHWc_io.mali", [["TENSOR", [1, 4, 224, 224], "float32"], ["TENSOR", [4, 32, 3, 3], "float32"], [2, 2], [1, 1, 1, 1], [1, 1], "NCHW", "NCHW4c", "float32"], {}], "config": {"index": 3719, "code_hash": null, "entity": [["tile_ic", "sp", [-1, 1, 4]], ["tile_oc", "sp", [-1, 8]], ["tile_ow", "sp", [-1, 4, 2]], ["tile_oh", "sp", [-1, 2, 8]]]}, "result": [[0.0117991472], 0, 11.307109117507935, 1615298911.5115685], "version": 0.2, "tvm_version": "0.8.dev0"}
{"input": ["opencl -keys=mali,opencl,gpu -device=mali -max_num_threads=256", "conv2d_NCHWc_io.mali", [["TENSOR", [1, 4, 224, 224], "float32"], ["TENSOR", [4, 32, 3, 3], "float32"], [2, 2], [1, 1, 1, 1], [1, 1], "NCHW", "NCHW4c", "float32"], {}], "config": {"index": 691, "code_hash": null, "entity": [["tile_ic", "sp", [-1, 1, 4]], ["tile_oc", "sp", [-1, 8]], ["tile_ow", "sp", [-1, 2, 2]], ["tile_oh", "sp", [-1, 2, 2]]]}, "result": [[0.008319823799999999], 0, 20.691264152526855, 1615298921.3007934], "version": 0.2, "tvm_version": "0.8.dev0"}
{"input": ["opencl -keys=mali,opencl,gpu -device=mali -max_num_threads=256", "conv2d_NCHWc_io.mali", [["TENSOR", [1, 4, 224, 224], "float32"], ["TENSOR", [4, 32, 3, 3], "float32"], [2, 2], [1, 1, 1, 1], [1, 1], "NCHW", "NCHW4c", "float32"], {}], "config": {"index": 2376, "code_hash": null, "entity": [["tile_ic", "sp", [-1, 1, 4]], ["tile_oc", "sp", [-1, 1]], ["tile_ow", "sp", [-1, 7, 2]], ["tile_oh", "sp", [-1, 2, 4]]]}, "result": [[0.005026584], 0, 31.061295747756958, 1615298931.6748574], "version": 0.2, "tvm_version": "0.8.dev0"}
{"input": ["opencl -keys=mali,opencl,gpu -device=mali -max_num_threads=256", "conv2d_NCHWc_io.mali", [["TENSOR", [1, 4, 224, 224], "float32"], ["TENSOR", [4, 32, 3, 3], "float32"], [2, 2], [1, 1, 1, 1], [1, 1], "NCHW", "NCHW4c", "float32"], {}], "config": {"index": 927, "code_hash": null, "entity": [["tile_ic", "sp", [-1, 1, 4]], ["tile_oc", "sp", [-1, 8]], ["tile_ow", "sp", [-1, 1, 8]], ["tile_oh", "sp", [-1, 4, 2]]]}, "result": [[0.0101079176], 0, 42.42648363113403, 1615298942.6916678], "version": 0.2, "tvm_version": "0.8.dev0"}
{"input": ["opencl -keys=mali,opencl,gpu -device=mali -max_num_threads=256", "conv2d_NCHWc_io.mali", [["TENSOR", [1, 4, 224, 224], "float32"], ["TENSOR", [4, 32, 3, 3], "float32"], [2, 2], [1, 1, 1, 1], [1, 1], "NCHW", "NCHW4c", "float32"], {}], "config": {"index": 1275, "code_hash": null, "entity": [["tile_ic", "sp", [-1, 1, 4]], ["tile_oc", "sp", [-1, 8]], ["tile_ow", "sp", [-1, 7, 8]], ["tile_oh", "sp", [-1, 8, 2]]]}, "result": [[0.0165017828], 0, 63.60176944732666, 1615298963.8377814], "version": 0.2, "tvm_version": "0.8.dev0"}
{"input": ["opencl -keys=mali,opencl,gpu -device=mali -max_num_threads=256", "conv2d_NCHWc_io.mali", [["TENSOR", [1, 4, 224, 224], "float32"], ["TENSOR", [4, 32, 3, 3], "float32"], [2, 2], [1, 1, 1, 1], [1, 1], "NCHW", "NCHW4c", "float32"], {}], "config": {"index": 727, "code_hash": null, "entity": [["tile_ic", "sp", [-1, 1, 4]], ["tile_oc", "sp", [-1, 8]], ["tile_ow", "sp", [-1, 1, 4]], ["tile_oh", "sp", [-1, 2, 2]]]}, "result": [[0.0051637922000000004], 0, 52.63286733627319, 1615298953.1435213], "version": 0.2, "tvm_version": "0.8.dev0"}
{"input": ["opencl -keys=mali,opencl,gpu -device=mali -max_num_threads=256", "conv2d_NCHWc_io.mali", [["TENSOR", [1, 4, 224, 224], "float32"], ["TENSOR", [4, 32, 3, 3], "float32"], [2, 2], [1, 1, 1, 1], [1, 1], "NCHW", "NCHW4c", "float32"], {}], "config": {"index": 2374, "code_hash": null, "entity": [["tile_ic", "sp", [-1, 1, 4]], ["tile_oc", "sp", [-1, 4]], ["tile_ow", "sp", [-1, 4, 2]], ["tile_oh", "sp", [-1, 2, 4]]]}, "result": [[0.006402917399999999], 0, 74.0541398525238, 1615298974.595573], "version": 0.2, "tvm_version": "0.8.dev0"}
{"input": ["opencl -keys=mali,opencl,gpu -device=mali -max_num_threads=256", "conv2d_NCHWc_io.mali", [["TENSOR", [1, 4, 224, 224], "float32"], ["TENSOR", [4, 32, 3, 3], "float32"], [2, 2], [1, 1, 1, 1], [1, 1], "NCHW", "NCHW4c", "float32"], {}], "config": {"index": 1235, "code_hash": null, "entity": [["tile_ic", "sp", [-1, 1, 4]], ["tile_oc", "sp", [-1, 8]], ["tile_ow", "sp", [-1, 2, 4]], ["tile_oh", "sp", [-1, 8, 2]]]}, "result": [[0.0111333762], 0, 84.46337413787842, 1615298984.9813604], "version": 0.2, "tvm_version": "0.8.dev0"}
{"input": ["opencl -keys=mali,opencl,gpu -device=mali -max_num_threads=256", "conv2d_NCHWc_io.mali", [["TENSOR", [1, 4, 224, 224], "float32"], ["TENSOR", [4, 32, 3, 3], "float32"], [2, 2], [1, 1, 1, 1], [1, 1], "NCHW", "NCHW4c", "float32"], {}], "config": {"index": 735, "code_hash": null, "entity": [["tile_ic", "sp", [-1, 1, 4]], ["tile_oc", "sp", [-1, 8]], ["tile_ow", "sp", [-1, 4, 4]], ["tile_oh", "sp", [-1, 2, 2]]]}, "result": [[0.0107591782], 0, 94.76099228858948, 1615298995.3970654], "version": 0.2, "tvm_version": "0.8.dev0"}
{"input": ["opencl -keys=mali,opencl,gpu -device=mali -max_num_threads=256", "conv2d_NCHWc_io.mali", [["TENSOR", [1, 4, 224, 224], "float32"], ["TENSOR", [4, 32, 3, 3], "float32"], [2, 2], [1, 1, 1, 1], [1, 1], "NCHW", "NCHW4c", "float32"], {}], "config": {"index": 697, "code_hash": null, "entity": [["tile_ic", "sp", [-1, 1, 4]], ["tile_oc", "sp", [-1, 2]], ["tile_ow", "sp", [-1, 7, 2]], ["tile_oh", "sp", [-1, 2, 2]]]}, "result": [[0.0082593134], 0, 105.37796783447266, 1615299006.074581], "version": 0.2, "tvm_version": "0.8.dev0"}
{"input": ["opencl -keys=mali,opencl,gpu -device=mali -max_num_threads=256", "conv2d_NCHWc_io.mali", [["TENSOR", [1, 4, 224, 224], "float32"], ["TENSOR", [4, 32, 3, 3], "float32"], [2, 2], [1, 1, 1, 1], [1, 1], "NCHW", "NCHW4c", "float32"], {}], "config": {"index": 3551, "code_hash": null, "entity": [["tile_ic", "sp", [-1, 1, 4]], ["tile_oc", "sp", [-1, 8]], ["tile_ow", "sp", [-1, 4, 2]], ["tile_oh", "sp", [-1, 1, 8]]]}, "result": [[0.0080785632], 0, 116.6212568283081, 1615299016.9043176], "version": 0.2, "tvm_version": "0.8.dev0"}
{"input": ["opencl -keys=mali,opencl,gpu -device=mali -max_num_threads=256", "conv2d_NCHWc_io.mali", [["TENSOR", [1, 4, 224, 224], "float32"], ["TENSOR", [4, 32, 3, 3], "float32"], [2, 2], [1, 1, 1, 1], [1, 1], "NCHW", "NCHW4c", "float32"], {}], "config": {"index": 2578, "code_hash": null, "entity": [["tile_ic", "sp", [-1, 1, 4]], ["tile_oc", "sp", [-1, 4]], ["tile_ow", "sp", [-1, 2, 4]], ["tile_oh", "sp", [-1, 4, 4]]]}, "result": [[0.0087078552], 0, 127.17390775680542, 1615299027.524571], "version": 0.2, "tvm_version": "0.8.dev0"}
{"input": ["opencl -keys=mali,opencl,gpu -device=mali -max_num_threads=256", "conv2d_NCHWc_io.mali", [["TENSOR", [1, 4, 224, 224], "float32"], ["TENSOR", [4, 32, 3, 3], "float32"], [2, 2], [1, 1, 1, 1], [1, 1], "NCHW", "NCHW4c", "float32"], {}], "config": {"index": 1064, "code_hash": null, "entity": [["tile_ic", "sp", [-1, 1, 4]], ["tile_oc", "sp", [-1, 1]], ["tile_ow", "sp", [-1, 2, 4]], ["tile_oh", "sp", [-1, 7, 2]]]}, "result": [[0.0055288025999999995], 0, 137.8713982105255, 1615299038.2517436], "version": 0.2, "tvm_version": "0.8.dev0"}
{"input": ["opencl -keys=mali,opencl,gpu -device=mali -max_num_threads=256", "conv2d_NCHWc_io.mali", [["TENSOR", [1, 4, 224, 224], "float32"], ["TENSOR", [4, 32, 3, 3], "float32"], [2, 2], [1, 1, 1, 1], [1, 1], "NCHW", "NCHW4c", "float32"], {}], "config": {"index": 693, "code_hash": null, "entity": [["tile_ic", "sp", [-1, 1, 4]], ["tile_oc", "sp", [-1, 2]], ["tile_ow", "sp", [-1, 4, 2]], ["tile_oh", "sp", [-1, 2, 2]]]}, "result": [[0.0058435006], 0, 148.0771324634552, 1615299048.7237504], "version": 0.2, "tvm_version": "0.8.dev0"}
{"input": ["opencl -keys=mali,opencl,gpu -device=mali -max_num_threads=256", "conv2d_NCHWc_io.mali", [["TENSOR", [1, 4, 224, 224], "float32"], ["TENSOR", [4, 32, 3, 3], "float32"], [2, 2], [1, 1, 1, 1], [1, 1], "NCHW", "NCHW4c", "float32"], {}], "config": {"index": 1262, "code_hash": null, "entity": [["tile_ic", "sp", [-1, 1, 4]], ["tile_oc", "sp", [-1, 4]], ["tile_ow", "sp", [-1, 1, 8]], ["tile_oh", "sp", [-1, 8, 2]]]}, "result": [[0.0099412822], 0, 159.020277261734, 1615299059.409848], "version": 0.2, "tvm_version": "0.8.dev0"}
{"input": ["opencl -keys=mali,opencl,gpu -device=mali -max_num_threads=256", "conv2d_NCHWc_io.mali", [["TENSOR", [1, 4, 224, 224], "float32"], ["TENSOR", [4, 32, 3, 3], "float32"], [2, 2], [1, 1, 1, 1], [1, 1], "NCHW", "NCHW4c", "float32"], {}], "config": {"index": 857, "code_hash": null, "entity": [["tile_ic", "sp", [-1, 1, 4]], ["tile_oc", "sp", [-1, 2]], ["tile_ow", "sp", [-1, 2, 2]], ["tile_oh", "sp", [-1, 4, 2]]]}, "result": [[0.0060488548000000005], 0, 169.12331676483154, 1615299069.5761323], "version": 0.2, "tvm_version": "0.8.dev0"}
{"input": ["opencl -keys=mali,opencl,gpu -device=mali -max_num_threads=256", "conv2d_NCHWc_io.mali", [["TENSOR", [1, 4, 224, 224], "float32"], ["TENSOR", [4, 32, 3, 3], "float32"], [2, 2], [1, 1, 1, 1], [1, 1], "NCHW", "NCHW4c", "float32"], {}], "config": {"index": 3714, "code_hash": null, "entity": [["tile_ic", "sp", [-1, 1, 4]], ["tile_oc", "sp", [-1, 4]], ["tile_ow", "sp", [-1, 2, 2]], ["tile_oh", "sp", [-1, 2, 8]]]}, "result": [[0.006518823599999999], 0, 11.588148593902588, 1615299090.1387706], "version": 0.2, "tvm_version": "0.8.dev0"}
{"input": ["opencl -keys=mali,opencl,gpu -device=mali -max_num_threads=256", "conv2d_NCHWc_io.mali", [["TENSOR", [1, 4, 224, 224], "float32"], ["TENSOR", [4, 32, 3, 3], "float32"], [2, 2], [1, 1, 1, 1], [1, 1], "NCHW", "NCHW4c", "float32"], {}], "config": {"index": 692, "code_hash": null, "entity": [["tile_ic", "sp", [-1, 1, 4]], ["tile_oc", "sp", [-1, 1]], ["tile_ow", "sp", [-1, 4, 2]], ["tile_oh", "sp", [-1, 2, 2]]]}, "result": [[0.007190907000000001], 0, 20.776538372039795, 1615299099.9061527], "version": 0.2, "tvm_version": "0.8.dev0"}
{"input": ["opencl -keys=mali,opencl,gpu -device=mali -max_num_threads=256", "conv2d_NCHWc_io.mali", [["TENSOR", [1, 4, 224, 224], "float32"], ["TENSOR", [4, 32, 3, 3], "float32"], [2, 2], [1, 1, 1, 1], [1, 1], "NCHW", "NCHW4c", "float32"], {}], "config": {"index": 861, "code_hash": null, "entity": [["tile_ic", "sp", [-1, 1, 4]], ["tile_oc", "sp", [-1, 2]], ["tile_ow", "sp", [-1, 4, 2]], ["tile_oh", "sp", [-1, 4, 2]]]}, "result": [[0.0090590426], 0, 42.066028356552124, 1615299121.2301974], "version": 0.2, "tvm_version": "0.8.dev0"}
{"input": ["opencl -keys=mali,opencl,gpu -device=mali -max_num_threads=256", "conv2d_NCHWc_io.mali", [["TENSOR", [1, 4, 224, 224], "float32"], ["TENSOR", [4, 32, 3, 3], "float32"], [2, 2], [1, 1, 1, 1], [1, 1], "NCHW", "NCHW4c", "float32"], {}], "config": {"index": 1230, "code_hash": null, "entity": [["tile_ic", "sp", [-1, 1, 4]], ["tile_oc", "sp", [-1, 4]], ["tile_ow", "sp", [-1, 1, 4]], ["tile_oh", "sp", [-1, 8, 2]]]}, "result": [[0.007490292399999999], 0, 31.89735460281372, 1615299110.7335174], "version": 0.2, "tvm_version": "0.8.dev0"}
{"input": ["opencl -keys=mali,opencl,gpu -device=mali -max_num_threads=256", "conv2d_NCHWc_io.mali", [["TENSOR", [1, 4, 224, 224], "float32"], ["TENSOR", [4, 32, 3, 3], "float32"], [2, 2], [1, 1, 1, 1], [1, 1], "NCHW", "NCHW4c", "float32"], {}], "config": {"index": 4719, "code_hash": null, "entity": [["tile_ic", "sp", [-1, 1, 4]], ["tile_oc", "sp", [-1, 8]], ["tile_ow", "sp", [-1, 1, 2]], ["tile_oh", "sp", [-1, 2, 14]]]}, "result": [[0.009336126], 0, 53.504292488098145, 1615299132.090787], "version": 0.2, "tvm_version": "0.8.dev0"}
{"input": ["opencl -keys=mali,opencl,gpu -device=mali -max_num_threads=256", "conv2d_NCHWc_io.mali", [["TENSOR", [1, 4, 224, 224], "float32"], ["TENSOR", [4, 32, 3, 3], "float32"], [2, 2], [1, 1, 1, 1], [1, 1], "NCHW", "NCHW4c", "float32"], {}], "config": {"index": 901, "code_hash": null, "entity": [["tile_ic", "sp", [-1, 1, 4]], ["tile_oc", "sp", [-1, 2]], ["tile_ow", "sp", [-1, 4, 4]], ["tile_oh", "sp", [-1, 4, 2]]]}, "result": [[0.0074588446], 0, 63.50827765464783, 1615299142.4552753], "version": 0.2, "tvm_version": "0.8.dev0"}
{"input": ["opencl -keys=mali,opencl,gpu -device=mali -max_num_threads=256", "conv2d_NCHWc_io.mali", [["TENSOR", [1, 4, 224, 224], "float32"], ["TENSOR", [4, 32, 3, 3], "float32"], [2, 2], [1, 1, 1, 1], [1, 1], "NCHW", "NCHW4c", "float32"], {}], "config": {"index": 2373, "code_hash": null, "entity": [["tile_ic", "sp", [-1, 1, 4]], ["tile_oc", "sp", [-1, 2]], ["tile_ow", "sp", [-1, 4, 2]], ["tile_oh", "sp", [-1, 2, 4]]]}, "result": [[0.0046164172], 0, 73.638254404068, 1615299152.6026545], "version": 0.2, "tvm_version": "0.8.dev0"}
{"input": ["opencl -keys=mali,opencl,gpu -device=mali -max_num_threads=256", "conv2d_NCHWc_io.mali", [["TENSOR", [1, 4, 224, 224], "float32"], ["TENSOR", [4, 32, 3, 3], "float32"], [2, 2], [1, 1, 1, 1], [1, 1], "NCHW", "NCHW4c", "float32"], {}], "config": {"index": 2370, "code_hash": null, "entity": [["tile_ic", "sp", [-1, 1, 4]], ["tile_oc", "sp", [-1, 4]], ["tile_ow", "sp", [-1, 2, 2]], ["tile_oh", "sp", [-1, 2, 4]]]}, "result": [[0.0046499276], 0, 84.33101010322571, 1615299163.4236603], "version": 0.2, "tvm_version": "0.8.dev0"}
{"input": ["opencl -keys=mali,opencl,gpu -device=mali -max_num_threads=256", "conv2d_NCHWc_io.mali", [["TENSOR", [1, 4, 224, 224], "float32"], ["TENSOR", [4, 32, 3, 3], "float32"], [2, 2], [1, 1, 1, 1], [1, 1], "NCHW", "NCHW4c", "float32"], {}], "config": {"index": 729, "code_hash": null, "entity": [["tile_ic", "sp", [-1, 1, 4]], ["tile_oc", "sp", [-1, 2]], ["tile_ow", "sp", [-1, 2, 4]], ["tile_oh", "sp", [-1, 2, 2]]]}, "result": [[0.0062600214], 0, 95.00647377967834, 1615299173.9729571], "version": 0.2, "tvm_version": "0.8.dev0"}
{"input": ["opencl -keys=mali,opencl,gpu -device=mali -max_num_threads=256", "conv2d_NCHWc_io.mali", [["TENSOR", [1, 4, 224, 224], "float32"], ["TENSOR", [4, 32, 3, 3], "float32"], [2, 2], [1, 1, 1, 1], [1, 1], "NCHW", "NCHW4c", "float32"], {}], "config": {"index": 1067, "code_hash": null, "entity": [["tile_ic", "sp", [-1, 1, 4]], ["tile_oc", "sp", [-1, 8]], ["tile_ow", "sp", [-1, 2, 4]], ["tile_oh", "sp", [-1, 7, 2]]]}, "result": [[0.010209605200000001], 0, 105.21051287651062, 1615299184.5417802], "version": 0.2, "tvm_version": "0.8.dev0"}
{"input": ["opencl -keys=mali,opencl,gpu -device=mali -max_num_threads=256", "conv2d_NCHWc_io.mali", [["TENSOR", [1, 4, 224, 224], "float32"], ["TENSOR", [4, 32, 3, 3], "float32"], [2, 2], [1, 1, 1, 1], [1, 1], "NCHW", "NCHW4c", "float32"], {}], "config": {"index": 2207, "code_hash": null, "entity": [["tile_ic", "sp", [-1, 1, 4]], ["tile_oc", "sp", [-1, 8]], ["tile_ow", "sp", [-1, 4, 2]], ["tile_oh", "sp", [-1, 1, 4]]]}, "result": [[0.006757948599999999], 0, 116.00930690765381, 1615299195.1913433], "version": 0.2, "tvm_version": "0.8.dev0"}
{"input": ["opencl -keys=mali,opencl,gpu -device=mali -max_num_threads=256", "conv2d_NCHWc_io.mali", [["TENSOR", [1, 4, 224, 224], "float32"], ["TENSOR", [4, 32, 3, 3], "float32"], [2, 2], [1, 1, 1, 1], [1, 1], "NCHW", "NCHW4c", "float32"], {}], "config": {"index": 690, "code_hash": null, "entity": [["tile_ic", "sp", [-1, 1, 4]], ["tile_oc", "sp", [-1, 4]], ["tile_ow", "sp", [-1, 2, 2]], ["tile_oh", "sp", [-1, 2, 2]]]}, "result": [[0.006008709], 0, 126.55548048019409, 1615299205.7589443], "version": 0.2, "tvm_version": "0.8.dev0"}
{"input": ["opencl -keys=mali,opencl,gpu -device=mali -max_num_threads=256", "conv2d_NCHWc_io.mali", [["TENSOR", [1, 4, 224, 224], "float32"], ["TENSOR", [4, 32, 3, 3], "float32"], [2, 2], [1, 1, 1, 1], [1, 1], "NCHW", "NCHW4c", "float32"], {}], "config": {"index": 1193, "code_hash": null, "entity": [["tile_ic", "sp", [-1, 1, 4]], ["tile_oc", "sp", [-1, 2]], ["tile_ow", "sp", [-1, 2, 2]], ["tile_oh", "sp", [-1, 8, 2]]]}, "result": [[0.0090250426], 0, 137.52217602729797, 1615299216.75622], "version": 0.2, "tvm_version": "0.8.dev0"}
{"input": ["opencl -keys=mali,opencl,gpu -device=mali -max_num_threads=256", "conv2d_NCHWc_io.mali", [["TENSOR", [1, 4, 224, 224], "float32"], ["TENSOR", [4, 32, 3, 3], "float32"], [2, 2], [1, 1, 1, 1], [1, 1], "NCHW", "NCHW4c", "float32"], {}], "config": {"index": 3115, "code_hash": null, "entity": [["tile_ic", "sp", [-1, 1, 4]], ["tile_oc", "sp", [-1, 8]], ["tile_ow", "sp", [-1, 2, 8]], ["tile_oh", "sp", [-1, 14, 4]]]}, "result": [[0.0090435322], 0, 160.59393119812012, 1615299238.992725], "version": 0.2, "tvm_version": "0.8.dev0"}
{"input": ["opencl -keys=mali,opencl,gpu -device=mali -max_num_threads=256", "conv2d_NCHWc_io.mali", [["TENSOR", [1, 4, 224, 224], "float32"], ["TENSOR", [4, 32, 3, 3], "float32"], [2, 2], [1, 1, 1, 1], [1, 1], "NCHW", "NCHW4c", "float32"], {}], "config": {"index": 2533, "code_hash": null, "entity": [["tile_ic", "sp", [-1, 1, 4]], ["tile_oc", "sp", [-1, 2]], ["tile_ow", "sp", [-1, 1, 2]], ["tile_oh", "sp", [-1, 4, 4]]]}, "result": [[0.006399282000000001], 0, 10.98368215560913, 1615299282.8965068], "version": 0.2, "tvm_version": "0.8.dev0"}
{"input": ["opencl -keys=mali,opencl,gpu -device=mali -max_num_threads=256", "conv2d_NCHWc_io.mali", [["TENSOR", [1, 4, 224, 224], "float32"], ["TENSOR", [4, 32, 3, 3], "float32"], [2, 2], [1, 1, 1, 1], [1, 1], "NCHW", "NCHW4c", "float32"], {}], "config": {"index": 2704, "code_hash": null, "entity": [["tile_ic", "sp", [-1, 1, 4]], ["tile_oc", "sp", [-1, 1]], ["tile_ow", "sp", [-1, 2, 2]], ["tile_oh", "sp", [-1, 7, 4]]]}, "result": [[0.0050573964], 0, 21.240703344345093, 1615299292.9544442], "version": 0.2, "tvm_version": "0.8.dev0"}
{"input": ["opencl -keys=mali,opencl,gpu -device=mali -max_num_threads=256", "conv2d_NCHWc_io.mali", [["TENSOR", [1, 4, 224, 224], "float32"], ["TENSOR", [4, 32, 3, 3], "float32"], [2, 2], [1, 1, 1, 1], [1, 1], "NCHW", "NCHW4c", "float32"], {}], "config": {"index": 2372, "code_hash": null, "entity": [["tile_ic", "sp", [-1, 1, 4]], ["tile_oc", "sp", [-1, 1]], ["tile_ow", "sp", [-1, 4, 2]], ["tile_oh", "sp", [-1, 2, 4]]]}, "result": [[0.0064898444], 0, 31.373050451278687, 1615299303.22476], "version": 0.2, "tvm_version": "0.8.dev0"}
{"input": ["opencl -keys=mali,opencl,gpu -device=mali -max_num_threads=256", "conv2d_NCHWc_io.mali", [["TENSOR", [1, 4, 224, 224], "float32"], ["TENSOR", [4, 32, 3, 3], "float32"], [2, 2], [1, 1, 1, 1], [1, 1], "NCHW", "NCHW4c", "float32"], {}], "config": {"index": 2205, "code_hash": null, "entity": [["tile_ic", "sp", [-1, 1, 4]], ["tile_oc", "sp", [-1, 2]], ["tile_ow", "sp", [-1, 4, 2]], ["tile_oh", "sp", [-1, 1, 4]]]}, "result": [[0.0063106256], 0, 42.40575385093689, 1615299314.33039], "version": 0.2, "tvm_version": "0.8.dev0"}
{"input": ["opencl -keys=mali,opencl,gpu -device=mali -max_num_threads=256", "conv2d_NCHWc_io.mali", [["TENSOR", [1, 4, 224, 224], "float32"], ["TENSOR", [4, 32, 3, 3], "float32"], [2, 2], [1, 1, 1, 1], [1, 1], "NCHW", "NCHW4c", "float32"], {}], "config": {"index": 2206, "code_hash": null, "entity": [["tile_ic", "sp", [-1, 1, 4]], ["tile_oc", "sp", [-1, 4]], ["tile_ow", "sp", [-1, 4, 2]], ["tile_oh", "sp", [-1, 1, 4]]]}, "result": [[0.004632542], 0, 52.85144257545471, 1615299324.7106714], "version": 0.2, "tvm_version": "0.8.dev0"}
{"input": ["opencl -keys=mali,opencl,gpu -device=mali -max_num_threads=256", "conv2d_NCHWc_io.mali", [["TENSOR", [1, 4, 224, 224], "float32"], ["TENSOR", [4, 32, 3, 3], "float32"], [2, 2], [1, 1, 1, 1], [1, 1], "NCHW", "NCHW4c", "float32"], {}], "config": {"index": 2407, "code_hash": null, "entity": [["tile_ic", "sp", [-1, 1, 4]], ["tile_oc", "sp", [-1, 8]], ["tile_ow", "sp", [-1, 1, 4]], ["tile_oh", "sp", [-1, 2, 4]]]}, "result": [[0.0058093964], 0, 63.89127039909363, 1615299335.665778], "version": 0.2, "tvm_version": "0.8.dev0"}
{"input": ["opencl -keys=mali,opencl,gpu -device=mali -max_num_threads=256", "conv2d_NCHWc_io.mali", [["TENSOR", [1, 4, 224, 224], "float32"], ["TENSOR", [4, 32, 3, 3], "float32"], [2, 2], [1, 1, 1, 1], [1, 1], "NCHW", "NCHW4c", "float32"], {}], "config": {"index": 2203, "code_hash": null, "entity": [["tile_ic", "sp", [-1, 1, 4]], ["tile_oc", "sp", [-1, 8]], ["tile_ow", "sp", [-1, 2, 2]], ["tile_oh", "sp", [-1, 1, 4]]]}, "result": [[0.004811531799999999], 0, 73.84189820289612, 1615299345.7994065], "version": 0.2, "tvm_version": "0.8.dev0"}
{"input": ["opencl -keys=mali,opencl,gpu -device=mali -max_num_threads=256", "conv2d_NCHWc_io.mali", [["TENSOR", [1, 4, 224, 224], "float32"], ["TENSOR", [4, 32, 3, 3], "float32"], [2, 2], [1, 1, 1, 1], [1, 1], "NCHW", "NCHW4c", "float32"], {}], "config": {"index": 2366, "code_hash": null, "entity": [["tile_ic", "sp", [-1, 1, 4]], ["tile_oc", "sp", [-1, 4]], ["tile_ow", "sp", [-1, 1, 2]], ["tile_oh", "sp", [-1, 2, 4]]]}, "result": [[0.0064737922], 0, 105.60611391067505, 1615299377.525449], "version": 0.2, "tvm_version": "0.8.dev0"}
{"input": ["opencl -keys=mali,opencl,gpu -device=mali -max_num_threads=256", "conv2d_NCHWc_io.mali", [["TENSOR", [1, 4, 224, 224], "float32"], ["TENSOR", [4, 32, 3, 3], "float32"], [2, 2], [1, 1, 1, 1], [1, 1], "NCHW", "NCHW4c", "float32"], {}], "config": {"index": 2537, "code_hash": null, "entity": [["tile_ic", "sp", [-1, 1, 4]], ["tile_oc", "sp", [-1, 2]], ["tile_ow", "sp", [-1, 2, 2]], ["tile_oh", "sp", [-1, 4, 4]]]}, "result": [[0.0046669066], 0, 84.06536817550659, 1615299355.9425998], "version": 0.2, "tvm_version": "0.8.dev0"}
{"input": ["opencl -keys=mali,opencl,gpu -device=mali -max_num_threads=256", "conv2d_NCHWc_io.mali", [["TENSOR", [1, 4, 224, 224], "float32"], ["TENSOR", [4, 32, 3, 3], "float32"], [2, 2], [1, 1, 1, 1], [1, 1], "NCHW", "NCHW4c", "float32"], {}], "config": {"index": 2534, "code_hash": null, "entity": [["tile_ic", "sp", [-1, 1, 4]], ["tile_oc", "sp", [-1, 4]], ["tile_ow", "sp", [-1, 1, 2]], ["tile_oh", "sp", [-1, 4, 4]]]}, "result": [[0.0047685838], 0, 94.84426879882812, 1615299366.7843518], "version": 0.2, "tvm_version": "0.8.dev0"}
{"input": ["opencl -keys=mali,opencl,gpu -device=mali -max_num_threads=256", "conv2d_NCHWc_io.mali", [["TENSOR", [1, 4, 224, 224], "float32"], ["TENSOR", [4, 32, 3, 3], "float32"], [2, 2], [1, 1, 1, 1], [1, 1], "NCHW", "NCHW4c", "float32"], {}], "config": {"index": 2369, "code_hash": null, "entity": [["tile_ic", "sp", [-1, 1, 4]], ["tile_oc", "sp", [-1, 2]], ["tile_ow", "sp", [-1, 2, 2]], ["tile_oh", "sp", [-1, 2, 4]]]}, "result": [[0.0063244382], 0, 115.91086053848267, 1615299387.8271515], "version": 0.2, "tvm_version": "0.8.dev0"}
{"input": ["opencl -keys=mali,opencl,gpu -device=mali -max_num_threads=256", "conv2d_NCHWc_io.mali", [["TENSOR", [1, 4, 224, 224], "float32"], ["TENSOR", [4, 32, 3, 3], "float32"], [2, 2], [1, 1, 1, 1], [1, 1], "NCHW", "NCHW4c", "float32"], {}], "config": {"index": 2368, "code_hash": null, "entity": [["tile_ic", "sp", [-1, 1, 4]], ["tile_oc", "sp", [-1, 1]], ["tile_ow", "sp", [-1, 2, 2]], ["tile_oh", "sp", [-1, 2, 4]]]}, "result": [[0.008186417599999999], 0, 126.55395174026489, 1615299398.4899428], "version": 0.2, "tvm_version": "0.8.dev0"}
{"input": ["opencl -keys=mali,opencl,gpu -device=mali -max_num_threads=256", "conv2d_NCHWc_io.mali", [["TENSOR", [1, 4, 224, 224], "float32"], ["TENSOR", [4, 32, 3, 3], "float32"], [2, 2], [1, 1, 1, 1], [1, 1], "NCHW", "NCHW4c", "float32"], {}], "config": {"index": 2377, "code_hash": null, "entity": [["tile_ic", "sp", [-1, 1, 4]], ["tile_oc", "sp", [-1, 2]], ["tile_ow", "sp", [-1, 7, 2]], ["tile_oh", "sp", [-1, 2, 4]]]}, "result": [[0.0057174902], 0, 137.275785446167, 1615299409.194126], "version": 0.2, "tvm_version": "0.8.dev0"}
{"input": ["opencl -keys=mali,opencl,gpu -device=mali -max_num_threads=256", "conv2d_NCHWc_io.mali", [["TENSOR", [1, 4, 224, 224], "float32"], ["TENSOR", [4, 32, 3, 3], "float32"], [2, 2], [1, 1, 1, 1], [1, 1], "NCHW", "NCHW4c", "float32"], {}], "config": {"index": 2540, "code_hash": null, "entity": [["tile_ic", "sp", [-1, 1, 4]], ["tile_oc", "sp", [-1, 1]], ["tile_ow", "sp", [-1, 4, 2]], ["tile_oh", "sp", [-1, 4, 4]]]}, "result": [[0.0047771984], 0, 147.6034185886383, 1615299419.5152879], "version": 0.2, "tvm_version": "0.8.dev0"}
{"input": ["opencl -keys=mali,opencl,gpu -device=mali -max_num_threads=256", "conv2d_NCHWc_io.mali", [["TENSOR", [1, 4, 224, 224], "float32"], ["TENSOR", [4, 32, 3, 3], "float32"], [2, 2], [1, 1, 1, 1], [1, 1], "NCHW", "NCHW4c", "float32"], {}], "config": {"index": 2536, "code_hash": null, "entity": [["tile_ic", "sp", [-1, 1, 4]], ["tile_oc", "sp", [-1, 1]], ["tile_ow", "sp", [-1, 2, 2]], ["tile_oh", "sp", [-1, 4, 4]]]}, "result": [[0.006512834], 0, 158.42265057563782, 1615299430.345311], "version": 0.2, "tvm_version": "0.8.dev0"}
{"input": ["opencl -keys=mali,opencl,gpu -device=mali -max_num_threads=256", "conv2d_NCHWc_io.mali", [["TENSOR", [1, 4, 224, 224], "float32"], ["TENSOR", [4, 32, 3, 3], "float32"], [2, 2], [1, 1, 1, 1], [1, 1], "NCHW", "NCHW4c", "float32"], {}], "config": {"index": 2701, "code_hash": null, "entity": [["tile_ic", "sp", [-1, 1, 4]], ["tile_oc", "sp", [-1, 2]], ["tile_ow", "sp", [-1, 1, 2]], ["tile_oh", "sp", [-1, 7, 4]]]}, "result": [[0.0051014276], 0, 169.23732209205627, 1615299441.1937244], "version": 0.2, "tvm_version": "0.8.dev0"}
{"input": ["opencl -keys=mali,opencl,gpu -device=mali -max_num_threads=256", "conv2d_NCHWc_io.mali", [["TENSOR", [1, 4, 224, 224], "float32"], ["TENSOR", [4, 32, 3, 3], "float32"], [2, 2], [1, 1, 1, 1], [1, 1], "NCHW", "NCHW4c", "float32"], {}], "config": {"index": 2380, "code_hash": null, "entity": [["tile_ic", "sp", [-1, 1, 4]], ["tile_oc", "sp", [-1, 1]], ["tile_ow", "sp", [-1, 8, 2]], ["tile_oh", "sp", [-1, 2, 4]]]}, "result": [[0.004568344199999999], 0, 21.377322912216187, 1615299464.921628], "version": 0.2, "tvm_version": "0.8.dev0"}
{"input": ["opencl -keys=mali,opencl,gpu -device=mali -max_num_threads=256", "conv2d_NCHWc_io.mali", [["TENSOR", [1, 4, 224, 224], "float32"], ["TENSOR", [4, 32, 3, 3], "float32"], [2, 2], [1, 1, 1, 1], [1, 1], "NCHW", "NCHW4c", "float32"], {}], "config": {"index": 1396, "code_hash": null, "entity": [["tile_ic", "sp", [-1, 1, 4]], ["tile_oc", "sp", [-1, 1]], ["tile_ow", "sp", [-1, 1, 4]], ["tile_oh", "sp", [-1, 14, 2]]]}, "result": [[0.005695886], 0, 32.08665752410889, 1615299475.633271], "version": 0.2, "tvm_version": "0.8.dev0"}
{"input": ["opencl -keys=mali,opencl,gpu -device=mali -max_num_threads=256", "conv2d_NCHWc_io.mali", [["TENSOR", [1, 4, 224, 224], "float32"], ["TENSOR", [4, 32, 3, 3], "float32"], [2, 2], [1, 1, 1, 1], [1, 1], "NCHW", "NCHW4c", "float32"], {}], "config": {"index": 2209, "code_hash": null, "entity": [["tile_ic", "sp", [-1, 1, 4]], ["tile_oc", "sp", [-1, 2]], ["tile_ow", "sp", [-1, 7, 2]], ["tile_oh", "sp", [-1, 1, 4]]]}, "result": [[0.0047591566], 0, 42.73703932762146, 1615299486.2338336], "version": 0.2, "tvm_version": "0.8.dev0"}
{"input": ["opencl -keys=mali,opencl,gpu -device=mali -max_num_threads=256", "conv2d_NCHWc_io.mali", [["TENSOR", [1, 4, 224, 224], "float32"], ["TENSOR", [4, 32, 3, 3], "float32"], [2, 2], [1, 1, 1, 1], [1, 1], "NCHW", "NCHW4c", "float32"], {}], "config": {"index": 1024, "code_hash": null, "entity": [["tile_ic", "sp", [-1, 1, 4]], ["tile_oc", "sp", [-1, 1]], ["tile_ow", "sp", [-1, 2, 2]], ["tile_oh", "sp", [-1, 7, 2]]]}, "result": [[0.0064123444000000005], 0, 53.14829349517822, 1615299496.743959], "version": 0.2, "tvm_version": "0.8.dev0"}
{"input": ["opencl -keys=mali,opencl,gpu -device=mali -max_num_threads=256", "conv2d_NCHWc_io.mali", [["TENSOR", [1, 4, 224, 224], "float32"], ["TENSOR", [4, 32, 3, 3], "float32"], [2, 2], [1, 1, 1, 1], [1, 1], "NCHW", "NCHW4c", "float32"], {}], "config": {"index": 860, "code_hash": null, "entity": [["tile_ic", "sp", [-1, 1, 4]], ["tile_oc", "sp", [-1, 1]], ["tile_ow", "sp", [-1, 4, 2]], ["tile_oh", "sp", [-1, 4, 2]]]}, "result": [[0.006334250600000001], 0, 63.64527463912964, 1615299507.1427999], "version": 0.2, "tvm_version": "0.8.dev0"}
{"input": ["opencl -keys=mali,opencl,gpu -device=mali -max_num_threads=256", "conv2d_NCHWc_io.mali", [["TENSOR", [1, 4, 224, 224], "float32"], ["TENSOR", [4, 32, 3, 3], "float32"], [2, 2], [1, 1, 1, 1], [1, 1], "NCHW", "NCHW4c", "float32"], {}], "config": {"index": 4722, "code_hash": null, "entity": [["tile_ic", "sp", [-1, 1, 4]], ["tile_oc", "sp", [-1, 4]], ["tile_ow", "sp", [-1, 2, 2]], ["tile_oh", "sp", [-1, 2, 14]]]}, "result": [[0.0096650844], 0, 85.76461887359619, 1615299528.877459], "version": 0.2, "tvm_version": "0.8.dev0"}
{"input": ["opencl -keys=mali,opencl,gpu -device=mali -max_num_threads=256", "conv2d_NCHWc_io.mali", [["TENSOR", [1, 4, 224, 224], "float32"], ["TENSOR", [4, 32, 3, 3], "float32"], [2, 2], [1, 1, 1, 1], [1, 1], "NCHW", "NCHW4c", "float32"], {}], "config": {"index": 1188, "code_hash": null, "entity": [["tile_ic", "sp", [-1, 1, 4]], ["tile_oc", "sp", [-1, 1]], ["tile_ow", "sp", [-1, 1, 2]], ["tile_oh", "sp", [-1, 8, 2]]]}, "result": [[0.006970479999999999], 0, 74.12513375282288, 1615299517.76566], "version": 0.2, "tvm_version": "0.8.dev0"}
{"input": ["opencl -keys=mali,opencl,gpu -device=mali -max_num_threads=256", "conv2d_NCHWc_io.mali", [["TENSOR", [1, 4, 224, 224], "float32"], ["TENSOR", [4, 32, 3, 3], "float32"], [2, 2], [1, 1, 1, 1], [1, 1], "NCHW", "NCHW4c", "float32"], {}], "config": {"index": 2700, "code_hash": null, "entity": [["tile_ic", "sp", [-1, 1, 4]], ["tile_oc", "sp", [-1, 1]], ["tile_ow", "sp", [-1, 1, 2]], ["tile_oh", "sp", [-1, 7, 4]]]}, "result": [[0.0067743964], 0, 95.34634637832642, 1615299538.8787565], "version": 0.2, "tvm_version": "0.8.dev0"}
{"input": ["opencl -keys=mali,opencl,gpu -device=mali -max_num_threads=256", "conv2d_NCHWc_io.mali", [["TENSOR", [1, 4, 224, 224], "float32"], ["TENSOR", [4, 32, 3, 3], "float32"], [2, 2], [1, 1, 1, 1], [1, 1], "NCHW", "NCHW4c", "float32"], {}], "config": {"index": 2367, "code_hash": null, "entity": [["tile_ic", "sp", [-1, 1, 4]], ["tile_oc", "sp", [-1, 8]], ["tile_ow", "sp", [-1, 1, 2]], ["tile_oh", "sp", [-1, 2, 4]]]}, "result": [[0.0045790006], 0, 106.8378643989563, 1615299550.3926473], "version": 0.2, "tvm_version": "0.8.dev0"}
{"input": ["opencl -keys=mali,opencl,gpu -device=mali -max_num_threads=256", "conv2d_NCHWc_io.mali", [["TENSOR", [1, 4, 224, 224], "float32"], ["TENSOR", [4, 32, 3, 3], "float32"], [2, 2], [1, 1, 1, 1], [1, 1], "NCHW", "NCHW4c", "float32"], {}], "config": {"index": 566, "code_hash": null, "entity": [["tile_ic", "sp", [-1, 1, 4]], ["tile_oc", "sp", [-1, 4]], ["tile_ow", "sp", [-1, 4, 4]], ["tile_oh", "sp", [-1, 1, 2]]]}, "result": [[0.004685136], 0, 116.922682762146, 1615299560.489565], "version": 0.2, "tvm_version": "0.8.dev0"}
{"input": ["opencl -keys=mali,opencl,gpu -device=mali -max_num_threads=256", "conv2d_NCHWc_io.mali", [["TENSOR", [1, 4, 224, 224], "float32"], ["TENSOR", [4, 32, 3, 3], "float32"], [2, 2], [1, 1, 1, 1], [1, 1], "NCHW", "NCHW4c", "float32"], {}], "config": {"index": 736, "code_hash": null, "entity": [["tile_ic", "sp", [-1, 1, 4]], ["tile_oc", "sp", [-1, 1]], ["tile_ow", "sp", [-1, 7, 4]], ["tile_oh", "sp", [-1, 2, 2]]]}, "result": [[0.0054752714000000004], 0, 127.26262378692627, 1615299570.8190162], "version": 0.2, "tvm_version": "0.8.dev0"}
{"input": ["opencl -keys=mali,opencl,gpu -device=mali -max_num_threads=256", "conv2d_NCHWc_io.mali", [["TENSOR", [1, 4, 224, 224], "float32"], ["TENSOR", [4, 32, 3, 3], "float32"], [2, 2], [1, 1, 1, 1], [1, 1], "NCHW", "NCHW4c", "float32"], {}], "config": {"index": 856, "code_hash": null, "entity": [["tile_ic", "sp", [-1, 1, 4]], ["tile_oc", "sp", [-1, 1]], ["tile_ow", "sp", [-1, 2, 2]], ["tile_oh", "sp", [-1, 4, 2]]]}, "result": [[0.0071665318000000006], 0, 137.86569547653198, 1615299581.539298], "version": 0.2, "tvm_version": "0.8.dev0"}
{"input": ["opencl -keys=mali,opencl,gpu -device=mali -max_num_threads=256", "conv2d_NCHWc_io.mali", [["TENSOR", [1, 4, 224, 224], "float32"], ["TENSOR", [4, 32, 3, 3], "float32"], [2, 2], [1, 1, 1, 1], [1, 1], "NCHW", "NCHW4c", "float32"], {}], "config": {"index": 726, "code_hash": null, "entity": [["tile_ic", "sp", [-1, 1, 4]], ["tile_oc", "sp", [-1, 4]], ["tile_ow", "sp", [-1, 1, 4]], ["tile_oh", "sp", [-1, 2, 2]]]}, "result": [[0.0066601466], 0, 148.2729630470276, 1615299591.83843], "version": 0.2, "tvm_version": "0.8.dev0"}
{"input": ["opencl -keys=mali,opencl,gpu -device=mali -max_num_threads=256", "conv2d_NCHWc_io.mali", [["TENSOR", [1, 4, 224, 224], "float32"], ["TENSOR", [4, 32, 3, 3], "float32"], [2, 2], [1, 1, 1, 1], [1, 1], "NCHW", "NCHW4c", "float32"], {}], "config": {"index": 854, "code_hash": null, "entity": [["tile_ic", "sp", [-1, 1, 4]], ["tile_oc", "sp", [-1, 4]], ["tile_ow", "sp", [-1, 1, 2]], ["tile_oh", "sp", [-1, 4, 2]]]}, "result": [[0.0062850424], 0, 158.66780972480774, 1615299602.310745], "version": 0.2, "tvm_version": "0.8.dev0"}
{"input": ["opencl -keys=mali,opencl,gpu -device=mali -max_num_threads=256", "conv2d_NCHWc_io.mali", [["TENSOR", [1, 4, 224, 224], "float32"], ["TENSOR", [4, 32, 3, 3], "float32"], [2, 2], [1, 1, 1, 1], [1, 1], "NCHW", "NCHW4c", "float32"], {}], "config": {"index": 3710, "code_hash": null, "entity": [["tile_ic", "sp", [-1, 1, 4]], ["tile_oc", "sp", [-1, 4]], ["tile_ow", "sp", [-1, 1, 2]], ["tile_oh", "sp", [-1, 2, 8]]]}, "result": [[0.008630000799999999], 0, 12.186046838760376, 1615299627.3162937], "version": 0.2, "tvm_version": "0.8.dev0"}
{"input": ["opencl -keys=mali,opencl,gpu -device=mali -max_num_threads=256", "conv2d_NCHWc_io.mali", [["TENSOR", [1, 4, 224, 224], "float32"], ["TENSOR", [4, 32, 3, 3], "float32"], [2, 2], [1, 1, 1, 1], [1, 1], "NCHW", "NCHW4c", "float32"], {}], "config": {"index": 2541, "code_hash": null, "entity": [["tile_ic", "sp", [-1, 1, 4]], ["tile_oc", "sp", [-1, 2]], ["tile_ow", "sp", [-1, 4, 2]], ["tile_oh", "sp", [-1, 4, 4]]]}, "result": [[0.006600063200000001], 0, 22.07146382331848, 1615299637.3561203], "version": 0.2, "tvm_version": "0.8.dev0"}
{"input": ["opencl -keys=mali,opencl,gpu -device=mali -max_num_threads=256", "conv2d_NCHWc_io.mali", [["TENSOR", [1, 4, 224, 224], "float32"], ["TENSOR", [4, 32, 3, 3], "float32"], [2, 2], [1, 1, 1, 1], [1, 1], "NCHW", "NCHW4c", "float32"], {}], "config": {"index": 2208, "code_hash": null, "entity": [["tile_ic", "sp", [-1, 1, 4]], ["tile_oc", "sp", [-1, 1]], ["tile_ow", "sp", [-1, 7, 2]], ["tile_oh", "sp", [-1, 1, 4]]]}, "result": [[0.0070660632], 0, 32.04692983627319, 1615299647.9200509], "version": 0.2, "tvm_version": "0.8.dev0"}
{"input": ["opencl -keys=mali,opencl,gpu -device=mali -max_num_threads=256", "conv2d_NCHWc_io.mali", [["TENSOR", [1, 4, 224, 224], "float32"], ["TENSOR", [4, 32, 3, 3], "float32"], [2, 2], [1, 1, 1, 1], [1, 1], "NCHW", "NCHW4c", "float32"], {}], "config": {"index": 2213, "code_hash": null, "entity": [["tile_ic", "sp", [-1, 1, 4]], ["tile_oc", "sp", [-1, 2]], ["tile_ow", "sp", [-1, 8, 2]], ["tile_oh", "sp", [-1, 1, 4]]]}, "result": [[0.00434649], 0, 42.90382933616638, 1615299658.2731757], "version": 0.2, "tvm_version": "0.8.dev0"}
{"input": ["opencl -keys=mali,opencl,gpu -device=mali -max_num_threads=256", "conv2d_NCHWc_io.mali", [["TENSOR", [1, 4, 224, 224], "float32"], ["TENSOR", [4, 32, 3, 3], "float32"], [2, 2], [1, 1, 1, 1], [1, 1], "NCHW", "NCHW4c", "float32"], {}], "config": {"index": 853, "code_hash": null, "entity": [["tile_ic", "sp", [-1, 1, 4]], ["tile_oc", "sp", [-1, 2]], ["tile_ow", "sp", [-1, 1, 2]], ["tile_oh", "sp", [-1, 4, 2]]]}, "result": [[0.0069909382], 0, 63.756770849227905, 1615299679.5250094], "version": 0.2, "tvm_version": "0.8.dev0"}
{"input": ["opencl -keys=mali,opencl,gpu -device=mali -max_num_threads=256", "conv2d_NCHWc_io.mali", [["TENSOR", [1, 4, 224, 224], "float32"], ["TENSOR", [4, 32, 3, 3], "float32"], [2, 2], [1, 1, 1, 1], [1, 1], "NCHW", "NCHW4c", "float32"], {}], "config": {"index": 2574, "code_hash": null, "entity": [["tile_ic", "sp", [-1, 1, 4]], ["tile_oc", "sp", [-1, 4]], ["tile_ow", "sp", [-1, 1, 4]], ["tile_oh", "sp", [-1, 4, 4]]]}, "result": [[0.0063776985999999996], 0, 55.53685712814331, 1615299670.7901685], "version": 0.2, "tvm_version": "0.8.dev0"}
