test_and_tune/llv-climgfloatr32.mobilenet_v1_1.0_224.log.tmp
{"input": ["opencl -keys=mali,opencl,gpu -device=mali -max_num_threads=256", "conv2d_NCHWc_io.mali", [["TENSOR", [1, 4, 224, 224], "climgfloatw32"], ["TENSOR", [4, 32, 3, 3], "climgfloatw32"], [2, 2], [1, 1, 1, 1], [1, 1], "NCHW", "NCHW4c", "climgfloatw32"], {}], "config": {"index": 7052, "code_hash": null, "entity": [["tile_ic", "sp", [-1, 1, 4]], ["tile_oc", "sp", [-1, 1]], ["tile_ow", "sp", [-1, 4, 28]], ["tile_oh", "sp", [-1, 4, 28]]]}, "result": [[0.0010332113474178404], 0, 2.0461983680725098, 1615383435.0477152], "version": 0.2, "tvm_version": "0.8.dev0"}
{"input": ["opencl -keys=mali,opencl,gpu -device=mali -max_num_threads=256", "conv2d_NCHWc_io.mali", [["TENSOR", [1, 4, 224, 224], "climgfloatw32"], ["TENSOR", [4, 32, 3, 3], "climgfloatw32"], [2, 2], [1, 1, 1, 1], [1, 1], "NCHW", "NCHW4c", "climgfloatw32"], {}], "config": {"index": 2811, "code_hash": null, "entity": [["tile_ic", "sp", [-1, 1, 4]], ["tile_oc", "sp", [-1, 8]], ["tile_ow", "sp", [-1, 7, 14]], ["tile_oh", "sp", [-1, 7, 4]]]}, "result": [[0.0021157073564356437], 0, 2.1281094551086426, 1615383436.6107917], "version": 0.2, "tvm_version": "0.8.dev0"}
{"input": ["opencl -keys=mali,opencl,gpu -device=mali -max_num_threads=256", "conv2d_NCHWc_io.mali", [["TENSOR", [1, 4, 224, 224], "climgfloatw32"], ["TENSOR", [4, 32, 3, 3], "climgfloatw32"], [2, 2], [1, 1, 1, 1], [1, 1], "NCHW", "NCHW4c", "climgfloatw32"], {}], "config": {"index": 6028, "code_hash": null, "entity": [["tile_ic", "sp", [-1, 1, 4]], ["tile_oc", "sp", [-1, 1]], ["tile_ow", "sp", [-1, 1, 56]], ["tile_oh", "sp", [-1, 7, 16]]]}, "result": [[0.0007664293951048951], 0, 2.037919282913208, 1615383438.117134], "version": 0.2, "tvm_version": "0.8.dev0"}
{"input": ["opencl -keys=mali,opencl,gpu -device=mali -max_num_threads=256", "conv2d_NCHWc_io.mali", [["TENSOR", [1, 4, 224, 224], "climgfloatw32"], ["TENSOR", [4, 32, 3, 3], "climgfloatw32"], [2, 2], [1, 1, 1, 1], [1, 1], "NCHW", "NCHW4c", "climgfloatw32"], {}], "config": {"index": 4998, "code_hash": null, "entity": [["tile_ic", "sp", [-1, 1, 4]], ["tile_oc", "sp", [-1, 4]], ["tile_ow", "sp", [-1, 8, 14]], ["tile_oh", "sp", [-1, 4, 14]]]}, "result": [[0.0018490060168067225], 0, 2.1192069053649902, 1615383439.6283398], "version": 0.2, "tvm_version": "0.8.dev0"}
{"input": ["opencl -keys=mali,opencl,gpu -device=mali -max_num_threads=256", "conv2d_NCHWc_io.mali", [["TENSOR", [1, 4, 224, 224], "climgfloatw32"], ["TENSOR", [4, 32, 3, 3], "climgfloatw32"], [2, 2], [1, 1, 1, 1], [1, 1], "NCHW", "NCHW4c", "climgfloatw32"], {}], "config": {"index": 3007, "code_hash": null, "entity": [["tile_ic", "sp", [-1, 1, 4]], ["tile_oc", "sp", [-1, 8]], ["tile_ow", "sp", [-1, 1, 56]], ["tile_oh", "sp", [-1, 8, 4]]]}, "result": [[0.001353593186746988], 0, 2.016275405883789, 1615383441.1523054], "version": 0.2, "tvm_version": "0.8.dev0"}
{"input": ["opencl -keys=mali,opencl,gpu -device=mali -max_num_threads=256", "conv2d_NCHWc_io.mali", [["TENSOR", [1, 4, 224, 224], "climgfloatw32"], ["TENSOR", [4, 32, 3, 3], "climgfloatw32"], [2, 2], [1, 1, 1, 1], [1, 1], "NCHW", "NCHW4c", "climgfloatw32"], {}], "config": {"index": 317, "code_hash": null, "entity": [["tile_ic", "sp", [-1, 1, 4]], ["tile_oc", "sp", [-1, 2]], ["tile_ow", "sp", [-1, 1, 56]], ["tile_oh", "sp", [-1, 2, 32]]]}, "result": [[0.000838242768558952], 0, 2.012341260910034, 1615383442.5595586], "version": 0.2, "tvm_version": "0.8.dev0"}
{"input": ["opencl -keys=mali,opencl,gpu -device=mali -max_num_threads=256", "conv2d_NCHWc_io.mali", [["TENSOR", [1, 4, 224, 224], "climgfloatw32"], ["TENSOR", [4, 32, 3, 3], "climgfloatw32"], [2, 2], [1, 1, 1, 1], [1, 1], "NCHW", "NCHW4c", "climgfloatw32"], {}], "config": {"index": 120, "code_hash": null, "entity": [["tile_ic", "sp", [-1, 1, 4]], ["tile_oc", "sp", [-1, 1]], ["tile_ow", "sp", [-1, 7, 14]], ["tile_oh", "sp", [-1, 1, 32]]]}, "result": [[0.000911436424], 0, 2.1510274410247803, 1615383444.0950558], "version": 0.2, "tvm_version": "0.8.dev0"}
{"input": ["opencl -keys=mali,opencl,gpu -device=mali -max_num_threads=256", "conv2d_NCHWc_io.mali", [["TENSOR", [1, 4, 224, 224], "climgfloatw32"], ["TENSOR", [4, 32, 3, 3], "climgfloatw32"], [2, 2], [1, 1, 1, 1], [1, 1], "NCHW", "NCHW4c", "climgfloatw32"], {}], "config": {"index": 159, "code_hash": null, "entity": [["tile_ic", "sp", [-1, 1, 4]], ["tile_oc", "sp", [-1, 8]], ["tile_ow", "sp", [-1, 1, 28]], ["tile_oh", "sp", [-1, 1, 32]]]}, "result": [[0.0008076022412587412], 0, 2.0649967193603516, 1615383445.6036305], "version": 0.2, "tvm_version": "0.8.dev0"}
{"input": ["opencl -keys=mali,opencl,gpu -device=mali -max_num_threads=256", "conv2d_NCHWc_io.mali", [["TENSOR", [1, 4, 224, 224], "climgfloatw32"], ["TENSOR", [4, 32, 3, 3], "climgfloatw32"], [2, 2], [1, 1, 1, 1], [1, 1], "NCHW", "NCHW4c", "climgfloatw32"], {}], "config": {"index": 4551, "code_hash": null, "entity": [["tile_ic", "sp", [-1, 1, 4]], ["tile_oc", "sp", [-1, 8]], ["tile_ow", "sp", [-1, 1, 2]], ["tile_oh", "sp", [-1, 1, 14]]]}, "result": [[0.0006735161601208459], 0, 2.0350213050842285, 1615383447.1525848], "version": 0.2, "tvm_version": "0.8.dev0"}
{"input": ["opencl -keys=mali,opencl,gpu -device=mali -max_num_threads=256", "conv2d_NCHWc_io.mali", [["TENSOR", [1, 4, 224, 224], "climgfloatw32"], ["TENSOR", [4, 32, 3, 3], "climgfloatw32"], [2, 2], [1, 1, 1, 1], [1, 1], "NCHW", "NCHW4c", "climgfloatw32"], {}], "config": {"index": 6480, "code_hash": null, "entity": [["tile_ic", "sp", [-1, 1, 4]], ["tile_oc", "sp", [-1, 1]], ["tile_ow", "sp", [-1, 7, 8]], ["tile_oh", "sp", [-1, 2, 56]]]}, "result": [[0.0006612608486842105], 0, 2.0428459644317627, 1615383448.6157036], "version": 0.2, "tvm_version": "0.8.dev0"}
{"input": ["opencl -keys=mali,opencl,gpu -device=mali -max_num_threads=256", "conv2d_NCHWc_io.mali", [["TENSOR", [1, 4, 224, 224], "climgfloatw32"], ["TENSOR", [4, 32, 3, 3], "climgfloatw32"], [2, 2], [1, 1, 1, 1], [1, 1], "NCHW", "NCHW4c", "climgfloatw32"], {}], "config": {"index": 4745, "code_hash": null, "entity": [["tile_ic", "sp", [-1, 1, 4]], ["tile_oc", "sp", [-1, 2]], ["tile_ow", "sp", [-1, 56, 2]], ["tile_oh", "sp", [-1, 2, 14]]]}, "result": [[0.0006902559212598426], 0, 1.968256950378418, 1615383449.9670796], "version": 0.2, "tvm_version": "0.8.dev0"}
{"input": ["opencl -keys=mali,opencl,gpu -device=mali -max_num_threads=256", "conv2d_NCHWc_io.mali", [["TENSOR", [1, 4, 224, 224], "climgfloatw32"], ["TENSOR", [4, 32, 3, 3], "climgfloatw32"], [2, 2], [1, 1, 1, 1], [1, 1], "NCHW", "NCHW4c", "climgfloatw32"], {}], "config": {"index": 4470, "code_hash": null, "entity": [["tile_ic", "sp", [-1, 1, 4]], ["tile_oc", "sp", [-1, 4]], ["tile_ow", "sp", [-1, 8, 8]], ["tile_oh", "sp", [-1, 14, 8]]]}, "result": [[0.002171773806122449], 0, 2.1750917434692383, 1615383451.5270739], "version": 0.2, "tvm_version": "0.8.dev0"}
{"input": ["opencl -keys=mali,opencl,gpu -device=mali -max_num_threads=256", "conv2d_NCHWc_io.mali", [["TENSOR", [1, 4, 224, 224], "climgfloatw32"], ["TENSOR", [4, 32, 3, 3], "climgfloatw32"], [2, 2], [1, 1, 1, 1], [1, 1], "NCHW", "NCHW4c", "climgfloatw32"], {}], "config": {"index": 2369, "code_hash": null, "entity": [["tile_ic", "sp", [-1, 1, 4]], ["tile_oc", "sp", [-1, 2]], ["tile_ow", "sp", [-1, 2, 2]], ["tile_oh", "sp", [-1, 2, 4]]]}, "result": [[0.0008172726761904762], 0, 1.7467951774597168, 1615383452.7013595], "version": 0.2, "tvm_version": "0.8.dev0"}
{"input": ["opencl -keys=mali,opencl,gpu -device=mali -max_num_threads=256", "conv2d_NCHWc_io.mali", [["TENSOR", [1, 4, 224, 224], "climgfloatw32"], ["TENSOR", [4, 32, 3, 3], "climgfloatw32"], [2, 2], [1, 1, 1, 1], [1, 1], "NCHW", "NCHW4c", "climgfloatw32"], {}], "config": {"index": 6493, "code_hash": null, "entity": [["tile_ic", "sp", [-1, 1, 4]], ["tile_oc", "sp", [-1, 2]], ["tile_ow", "sp", [-1, 1, 14]], ["tile_oh", "sp", [-1, 2, 56]]]}, "result": [[0.0007013623723723724], 0, 2.1167140007019043, 1615383454.2575314], "version": 0.2, "tvm_version": "0.8.dev0"}
{"input": ["opencl -keys=mali,opencl,gpu -device=mali -max_num_threads=256", "conv2d_NCHWc_io.mali", [["TENSOR", [1, 4, 224, 224], "climgfloatw32"], ["TENSOR", [4, 32, 3, 3], "climgfloatw32"], [2, 2], [1, 1, 1, 1], [1, 1], "NCHW", "NCHW4c", "climgfloatw32"], {}], "config": {"index": 2962, "code_hash": null, "entity": [["tile_ic", "sp", [-1, 1, 4]], ["tile_oc", "sp", [-1, 4]], ["tile_ow", "sp", [-1, 14, 8]], ["tile_oh", "sp", [-1, 8, 4]]]}, "result": [[0.0012573516568047337], 0, 2.0752999782562256, 1615383455.7874858], "version": 0.2, "tvm_version": "0.8.dev0"}
{"input": ["opencl -keys=mali,opencl,gpu -device=mali -max_num_threads=256", "conv2d_NCHWc_io.mali", [["TENSOR", [1, 4, 224, 224], "climgfloatw32"], ["TENSOR", [4, 32, 3, 3], "climgfloatw32"], [2, 2], [1, 1, 1, 1], [1, 1], "NCHW", "NCHW4c", "climgfloatw32"], {}], "config": {"index": 5901, "code_hash": null, "entity": [["tile_ic", "sp", [-1, 1, 4]], ["tile_oc", "sp", [-1, 2]], ["tile_ow", "sp", [-1, 4, 2]], ["tile_oh", "sp", [-1, 7, 16]]]}, "result": [[0.0005844710241286863], 0, 2.131157636642456, 1615383457.3316805], "version": 0.2, "tvm_version": "0.8.dev0"}
{"input": ["opencl -keys=mali,opencl,gpu -device=mali -max_num_threads=256", "conv2d_NCHWc_io.mali", [["TENSOR", [1, 4, 224, 224], "climgfloatw32"], ["TENSOR", [4, 32, 3, 3], "climgfloatw32"], [2, 2], [1, 1, 1, 1], [1, 1], "NCHW", "NCHW4c", "climgfloatw32"], {}], "config": {"index": 4784, "code_hash": null, "entity": [["tile_ic", "sp", [-1, 1, 4]], ["tile_oc", "sp", [-1, 1]], ["tile_ow", "sp", [-1, 28, 4]], ["tile_oh", "sp", [-1, 2, 14]]]}, "result": [[0.0005899089825870647], 0, 2.1329123973846436, 1615383459.7933414], "version": 0.2, "tvm_version": "0.8.dev0"}
{"input": ["opencl -keys=mali,opencl,gpu -device=mali -max_num_threads=256", "conv2d_NCHWc_io.mali", [["TENSOR", [1, 4, 224, 224], "climgfloatw32"], ["TENSOR", [4, 32, 3, 3], "climgfloatw32"], [2, 2], [1, 1, 1, 1], [1, 1], "NCHW", "NCHW4c", "climgfloatw32"], {}], "config": {"index": 1485, "code_hash": null, "entity": [["tile_ic", "sp", [-1, 1, 4]], ["tile_oc", "sp", [-1, 2]], ["tile_ow", "sp", [-1, 7, 16]], ["tile_oh", "sp", [-1, 14, 2]]]}, "result": [[0.0007172594117647058], 0, 2.07157039642334, 1615383461.3036008], "version": 0.2, "tvm_version": "0.8.dev0"}
{"input": ["opencl -keys=mali,opencl,gpu -device=mali -max_num_threads=256", "conv2d_NCHWc_io.mali", [["TENSOR", [1, 4, 224, 224], "climgfloatw32"], ["TENSOR", [4, 32, 3, 3], "climgfloatw32"], [2, 2], [1, 1, 1, 1], [1, 1], "NCHW", "NCHW4c", "climgfloatw32"], {}], "config": {"index": 731, "code_hash": null, "entity": [["tile_ic", "sp", [-1, 1, 4]], ["tile_oc", "sp", [-1, 8]], ["tile_ow", "sp", [-1, 2, 4]], ["tile_oh", "sp", [-1, 2, 2]]]}, "result": [[0.0007468257922535211], 0, 2.091262102127075, 1615383462.808116], "version": 0.2, "tvm_version": "0.8.dev0"}
{"input": ["opencl -keys=mali,opencl,gpu -device=mali -max_num_threads=256", "conv2d_NCHWc_io.mali", [["TENSOR", [1, 4, 224, 224], "climgfloatw32"], ["TENSOR", [4, 32, 3, 3], "climgfloatw32"], [2, 2], [1, 1, 1, 1], [1, 1], "NCHW", "NCHW4c", "climgfloatw32"], {}], "config": {"index": 1431, "code_hash": null, "entity": [["tile_ic", "sp", [-1, 1, 4]], ["tile_oc", "sp", [-1, 8]], ["tile_ow", "sp", [-1, 1, 8]], ["tile_oh", "sp", [-1, 14, 2]]]}, "result": [[0.000634168604719764], 0, 2.2706055641174316, 1615383464.4857602], "version": 0.2, "tvm_version": "0.8.dev0"}
{"input": ["opencl -keys=mali,opencl,gpu -device=mali -max_num_threads=256", "conv2d_NCHWc_io.mali", [["TENSOR", [1, 4, 224, 224], "climgfloatw32"], ["TENSOR", [4, 32, 3, 3], "climgfloatw32"], [2, 2], [1, 1, 1, 1], [1, 1], "NCHW", "NCHW4c", "climgfloatw32"], {}], "config": {"index": 4671, "code_hash": null, "entity": [["tile_ic", "sp", [-1, 1, 4]], ["tile_oc", "sp", [-1, 8]], ["tile_ow", "sp", [-1, 2, 16]], ["tile_oh", "sp", [-1, 1, 14]]]}, "result": [[0.0007265640918367347], 0, 2.18937611579895, 1615383465.9947846], "version": 0.2, "tvm_version": "0.8.dev0"}
{"input": ["opencl -keys=mali,opencl,gpu -device=mali -max_num_threads=256", "conv2d_NCHWc_io.mali", [["TENSOR", [1, 4, 224, 224], "climgfloatw32"], ["TENSOR", [4, 32, 3, 3], "climgfloatw32"], [2, 2], [1, 1, 1, 1], [1, 1], "NCHW", "NCHW4c", "climgfloatw32"], {}], "config": {"index": 3366, "code_hash": null, "entity": [["tile_ic", "sp", [-1, 1, 4]], ["tile_oc", "sp", [-1, 4]], ["tile_ow", "sp", [-1, 2, 32]], ["tile_oh", "sp", [-1, 28, 4]]]}, "result": [[0.00247788633], 0, 2.2408909797668457, 1615383467.6023006], "version": 0.2, "tvm_version": "0.8.dev0"}
{"input": ["opencl -keys=mali,opencl,gpu -device=mali -max_num_threads=256", "conv2d_NCHWc_io.mali", [["TENSOR", [1, 4, 224, 224], "climgfloatw32"], ["TENSOR", [4, 32, 3, 3], "climgfloatw32"], [2, 2], [1, 1, 1, 1], [1, 1], "NCHW", "NCHW4c", "climgfloatw32"], {}], "config": {"index": 1193, "code_hash": null, "entity": [["tile_ic", "sp", [-1, 1, 4]], ["tile_oc", "sp", [-1, 2]], ["tile_ow", "sp", [-1, 2, 2]], ["tile_oh", "sp", [-1, 8, 2]]]}, "result": [[0.00081715334], 0, 2.130769729614258, 1615383469.1670256], "version": 0.2, "tvm_version": "0.8.dev0"}
{"input": ["opencl -keys=mali,opencl,gpu -device=mali -max_num_threads=256", "conv2d_NCHWc_io.mali", [["TENSOR", [1, 4, 224, 224], "climgfloatw32"], ["TENSOR", [4, 32, 3, 3], "climgfloatw32"], [2, 2], [1, 1, 1, 1], [1, 1], "NCHW", "NCHW4c", "climgfloatw32"], {}], "config": {"index": 7051, "code_hash": null, "entity": [["tile_ic", "sp", [-1, 1, 4]], ["tile_oc", "sp", [-1, 8]], ["tile_ow", "sp", [-1, 2, 28]], ["tile_oh", "sp", [-1, 4, 28]]]}, "result": [[0.003049024257575757], 0, 2.1671223640441895, 1615383470.7627733], "version": 0.2, "tvm_version": "0.8.dev0"}
{"input": ["opencl -keys=mali,opencl,gpu -device=mali -max_num_threads=256", "conv2d_NCHWc_io.mali", [["TENSOR", [1, 4, 224, 224], "climgfloatw32"], ["TENSOR", [4, 32, 3, 3], "climgfloatw32"], [2, 2], [1, 1, 1, 1], [1, 1], "NCHW", "NCHW4c", "climgfloatw32"], {}], "config": {"index": 1362, "code_hash": null, "entity": [["tile_ic", "sp", [-1, 1, 4]], ["tile_oc", "sp", [-1, 4]], ["tile_ow", "sp", [-1, 2, 2]], ["tile_oh", "sp", [-1, 14, 2]]]}, "result": [[0.0008301951336633663], 0, 1.9809541702270508, 1615383472.1108532], "version": 0.2, "tvm_version": "0.8.dev0"}
{"input": ["opencl -keys=mali,opencl,gpu -device=mali -max_num_threads=256", "conv2d_NCHWc_io.mali", [["TENSOR", [1, 4, 224, 224], "climgfloatw32"], ["TENSOR", [4, 32, 3, 3], "climgfloatw32"], [2, 2], [1, 1, 1, 1], [1, 1], "NCHW", "NCHW4c", "climgfloatw32"], {}], "config": {"index": 2200, "code_hash": null, "entity": [["tile_ic", "sp", [-1, 1, 4]], ["tile_oc", "sp", [-1, 1]], ["tile_ow", "sp", [-1, 2, 2]], ["tile_oh", "sp", [-1, 1, 4]]]}, "result": [[0.0008135406359447005], 0, 1.742788314819336, 1615383473.306807], "version": 0.2, "tvm_version": "0.8.dev0"}
{"input": ["opencl -keys=mali,opencl,gpu -device=mali -max_num_threads=256", "conv2d_NCHWc_io.mali", [["TENSOR", [1, 4, 224, 224], "climgfloatw32"], ["TENSOR", [4, 32, 3, 3], "climgfloatw32"], [2, 2], [1, 1, 1, 1], [1, 1], "NCHW", "NCHW4c", "climgfloatw32"], {}], "config": {"index": 2276, "code_hash": null, "entity": [["tile_ic", "sp", [-1, 1, 4]], ["tile_oc", "sp", [-1, 1]], ["tile_ow", "sp", [-1, 4, 8]], ["tile_oh", "sp", [-1, 1, 4]]]}, "result": [[0.0008712919074074074], 0, 1.9338891506195068, 1615383474.6193178], "version": 0.2, "tvm_version": "0.8.dev0"}
{"input": ["opencl -keys=mali,opencl,gpu -device=mali -max_num_threads=256", "conv2d_NCHWc_io.mali", [["TENSOR", [1, 4, 224, 224], "climgfloatw32"], ["TENSOR", [4, 32, 3, 3], "climgfloatw32"], [2, 2], [1, 1, 1, 1], [1, 1], "NCHW", "NCHW4c", "climgfloatw32"], {}], "config": {"index": 1516, "code_hash": null, "entity": [["tile_ic", "sp", [-1, 1, 4]], ["tile_oc", "sp", [-1, 1]], ["tile_ow", "sp", [-1, 2, 32]], ["tile_oh", "sp", [-1, 16, 2]]]}, "result": [[0.0007608033097643097], 0, 2.226752281188965, 1615383476.1864927], "version": 0.2, "tvm_version": "0.8.dev0"}
{"input": ["opencl -keys=mali,opencl,gpu -device=mali -max_num_threads=256", "conv2d_NCHWc_io.mali", [["TENSOR", [1, 4, 224, 224], "climgfloatw32"], ["TENSOR", [4, 32, 3, 3], "climgfloatw32"], [2, 2], [1, 1, 1, 1], [1, 1], "NCHW", "NCHW4c", "climgfloatw32"], {}], "config": {"index": 1011, "code_hash": null, "entity": [["tile_ic", "sp", [-1, 1, 4]], ["tile_oc", "sp", [-1, 8]], ["tile_ow", "sp", [-1, 1, 32]], ["tile_oh", "sp", [-1, 7, 2]]]}, "result": [[0.0007264297042801556], 0, 2.0407633781433105, 1615383477.593176], "version": 0.2, "tvm_version": "0.8.dev0"}
{"input": ["opencl -keys=mali,opencl,gpu -device=mali -max_num_threads=256", "conv2d_NCHWc_io.mali", [["TENSOR", [1, 4, 224, 224], "climgfloatw32"], ["TENSOR", [4, 32, 3, 3], "climgfloatw32"], [2, 2], [1, 1, 1, 1], [1, 1], "NCHW", "NCHW4c", "climgfloatw32"], {}], "config": {"index": 4120, "code_hash": null, "entity": [["tile_ic", "sp", [-1, 1, 4]], ["tile_oc", "sp", [-1, 1]], ["tile_ow", "sp", [-1, 2, 8]], ["tile_oh", "sp", [-1, 7, 8]]]}, "result": [[0.0005658601471389646], 0, 2.1458182334899902, 1615383479.145817], "version": 0.2, "tvm_version": "0.8.dev0"}
{"input": ["opencl -keys=mali,opencl,gpu -device=mali -max_num_threads=256", "conv2d_NCHWc_io.mali", [["TENSOR", [1, 4, 224, 224], "climgfloatw32"], ["TENSOR", [4, 32, 3, 3], "climgfloatw32"], [2, 2], [1, 1, 1, 1], [1, 1], "NCHW", "NCHW4c", "climgfloatw32"], {}], "config": {"index": 1677, "code_hash": null, "entity": [["tile_ic", "sp", [-1, 1, 4]], ["tile_oc", "sp", [-1, 2]], ["tile_ow", "sp", [-1, 4, 28]], ["tile_oh", "sp", [-1, 16, 2]]]}, "result": [[0.0008743631328413284], 0, 2.189079999923706, 1615383480.7081733], "version": 0.2, "tvm_version": "0.8.dev0"}
{"input": ["opencl -keys=mali,opencl,gpu -device=mali -max_num_threads=256", "conv2d_NCHWc_io.mali", [["TENSOR", [1, 4, 224, 224], "climgfloatw32"], ["TENSOR", [4, 32, 3, 3], "climgfloatw32"], [2, 2], [1, 1, 1, 1], [1, 1], "NCHW", "NCHW4c", "climgfloatw32"], {}], "config": {"index": 118, "code_hash": null, "entity": [["tile_ic", "sp", [-1, 1, 4]], ["tile_oc", "sp", [-1, 4]], ["tile_ow", "sp", [-1, 4, 14]], ["tile_oh", "sp", [-1, 1, 32]]]}, "result": [[0.0007906125301587301], 0, 2.35774827003479, 1615383482.4291966], "version": 0.2, "tvm_version": "0.8.dev0"}
{"input": ["opencl -keys=mali,opencl,gpu -device=mali -max_num_threads=256", "conv2d_NCHWc_io.mali", [["TENSOR", [1, 4, 224, 224], "climgfloatw32"], ["TENSOR", [4, 32, 3, 3], "climgfloatw32"], [2, 2], [1, 1, 1, 1], [1, 1], "NCHW", "NCHW4c", "climgfloatw32"], {}], "config": {"index": 3226, "code_hash": null, "entity": [["tile_ic", "sp", [-1, 1, 4]], ["tile_oc", "sp", [-1, 4]], ["tile_ow", "sp", [-1, 14, 2]], ["tile_oh", "sp", [-1, 16, 4]]]}, "result": [[0.0008091137773584906], 0, 2.059872627258301, 1615383484.8537512], "version": 0.2, "tvm_version": "0.8.dev0"}
{"input": ["opencl -keys=mali,opencl,gpu -device=mali -max_num_threads=256", "conv2d_NCHWc_io.mali", [["TENSOR", [1, 4, 224, 224], "climgfloatw32"], ["TENSOR", [4, 32, 3, 3], "climgfloatw32"], [2, 2], [1, 1, 1, 1], [1, 1], "NCHW", "NCHW4c", "climgfloatw32"], {}], "config": {"index": 4574, "code_hash": null, "entity": [["tile_ic", "sp", [-1, 1, 4]], ["tile_oc", "sp", [-1, 4]], ["tile_ow", "sp", [-1, 16, 2]], ["tile_oh", "sp", [-1, 1, 14]]]}, "result": [[0.0007376144915824916], 0, 2.041701078414917, 1615383486.3600042], "version": 0.2, "tvm_version": "0.8.dev0"}
{"input": ["opencl -keys=mali,opencl,gpu -device=mali -max_num_threads=256", "conv2d_NCHWc_io.mali", [["TENSOR", [1, 4, 224, 224], "climgfloatw32"], ["TENSOR", [4, 32, 3, 3], "climgfloatw32"], [2, 2], [1, 1, 1, 1], [1, 1], "NCHW", "NCHW4c", "climgfloatw32"], {}], "config": {"index": 1503, "code_hash": null, "entity": [["tile_ic", "sp", [-1, 1, 4]], ["tile_oc", "sp", [-1, 8]], ["tile_ow", "sp", [-1, 1, 28]], ["tile_oh", "sp", [-1, 14, 2]]]}, "result": [[0.000800716622406639], 0, 1.9801111221313477, 1615383487.808325], "version": 0.2, "tvm_version": "0.8.dev0"}
{"input": ["opencl -keys=mali,opencl,gpu -device=mali -max_num_threads=256", "conv2d_NCHWc_io.mali", [["TENSOR", [1, 4, 224, 224], "climgfloatw32"], ["TENSOR", [4, 32, 3, 3], "climgfloatw32"], [2, 2], [1, 1, 1, 1], [1, 1], "NCHW", "NCHW4c", "climgfloatw32"], {}], "config": {"index": 4364, "code_hash": null, "entity": [["tile_ic", "sp", [-1, 1, 4]], ["tile_oc", "sp", [-1, 1]], ["tile_ow", "sp", [-1, 4, 28]], ["tile_oh", "sp", [-1, 8, 8]]]}, "result": [[0.0008052765619834711], 0, 1.9526560306549072, 1615383489.2332683], "version": 0.2, "tvm_version": "0.8.dev0"}
{"input": ["opencl -keys=mali,opencl,gpu -device=mali -max_num_threads=256", "conv2d_NCHWc_io.mali", [["TENSOR", [1, 4, 224, 224], "climgfloatw32"], ["TENSOR", [4, 32, 3, 3], "climgfloatw32"], [2, 2], [1, 1, 1, 1], [1, 1], "NCHW", "NCHW4c", "climgfloatw32"], {}], "config": {"index": 1532, "code_hash": null, "entity": [["tile_ic", "sp", [-1, 1, 4]], ["tile_oc", "sp", [-1, 1]], ["tile_ow", "sp", [-1, 4, 2]], ["tile_oh", "sp", [-1, 16, 2]]]}, "result": [[0.0010390570171428571], 0, 1.7591094970703125, 1615383490.475575], "version": 0.2, "tvm_version": "0.8.dev0"}
{"input": ["opencl -keys=mali,opencl,gpu -device=mali -max_num_threads=256", "conv2d_NCHWc_io.mali", [["TENSOR", [1, 4, 224, 224], "climgfloatw32"], ["TENSOR", [4, 32, 3, 3], "climgfloatw32"], [2, 2], [1, 1, 1, 1], [1, 1], "NCHW", "NCHW4c", "climgfloatw32"], {}], "config": {"index": 155, "code_hash": null, "entity": [["tile_ic", "sp", [-1, 1, 4]], ["tile_oc", "sp", [-1, 8]], ["tile_ow", "sp", [-1, 2, 56]], ["tile_oh", "sp", [-1, 1, 32]]]}, "result": [[0.0021115105436893206], 0, 2.0174365043640137, 1615383491.9757857], "version": 0.2, "tvm_version": "0.8.dev0"}
{"input": ["opencl -keys=mali,opencl,gpu -device=mali -max_num_threads=256", "conv2d_NCHWc_io.mali", [["TENSOR", [1, 4, 224, 224], "climgfloatw32"], ["TENSOR", [4, 32, 3, 3], "climgfloatw32"], [2, 2], [1, 1, 1, 1], [1, 1], "NCHW", "NCHW4c", "climgfloatw32"], {}], "config": {"index": 2319, "code_hash": null, "entity": [["tile_ic", "sp", [-1, 1, 4]], ["tile_oc", "sp", [-1, 8]], ["tile_ow", "sp", [-1, 2, 16]], ["tile_oh", "sp", [-1, 1, 4]]]}, "result": [[0.0007599418943396226], 0, 2.152501106262207, 1615383493.5426788], "version": 0.2, "tvm_version": "0.8.dev0"}
{"input": ["opencl -keys=mali,opencl,gpu -device=mali -max_num_threads=256", "conv2d_NCHWc_io.mali", [["TENSOR", [1, 4, 224, 224], "climgfloatw32"], ["TENSOR", [4, 32, 3, 3], "climgfloatw32"], [2, 2], [1, 1, 1, 1], [1, 1], "NCHW", "NCHW4c", "climgfloatw32"], {}], "config": {"index": 6207, "code_hash": null, "entity": [["tile_ic", "sp", [-1, 1, 4]], ["tile_oc", "sp", [-1, 8]], ["tile_ow", "sp", [-1, 1, 28]], ["tile_oh", "sp", [-1, 1, 112]]]}, "result": [[0.001839596663865546], 0, 2.0294792652130127, 1615383495.0688667], "version": 0.2, "tvm_version": "0.8.dev0"}
{"input": ["opencl -keys=mali,opencl,gpu -device=mali -max_num_threads=256", "conv2d_NCHWc_io.mali", [["TENSOR", [1, 4, 224, 224], "climgfloatw32"], ["TENSOR", [4, 32, 3, 3], "climgfloatw32"], [2, 2], [1, 1, 1, 1], [1, 1], "NCHW", "NCHW4c", "climgfloatw32"], {}], "config": {"index": 498, "code_hash": null, "entity": [["tile_ic", "sp", [-1, 1, 4]], ["tile_oc", "sp", [-1, 4]], ["tile_ow", "sp", [-1, 2, 28]], ["tile_oh", "sp", [-1, 32, 2]]]}, "result": [[0.0013668356272727273], 0, 2.0425825119018555, 1615383496.465827], "version": 0.2, "tvm_version": "0.8.dev0"}
{"input": ["opencl -keys=mali,opencl,gpu -device=mali -max_num_threads=256", "conv2d_NCHWc_io.mali", [["TENSOR", [1, 4, 224, 224], "climgfloatw32"], ["TENSOR", [4, 32, 3, 3], "climgfloatw32"], [2, 2], [1, 1, 1, 1], [1, 1], "NCHW", "NCHW4c", "climgfloatw32"], {}], "config": {"index": 1190, "code_hash": null, "entity": [["tile_ic", "sp", [-1, 1, 4]], ["tile_oc", "sp", [-1, 4]], ["tile_ow", "sp", [-1, 1, 2]], ["tile_oh", "sp", [-1, 8, 2]]]}, "result": [[0.0007879057981651376], 0, 1.8561203479766846, 1615383497.8244388], "version": 0.2, "tvm_version": "0.8.dev0"}
{"input": ["opencl -keys=mali,opencl,gpu -device=mali -max_num_threads=256", "conv2d_NCHWc_io.mali", [["TENSOR", [1, 4, 224, 224], "climgfloatw32"], ["TENSOR", [4, 32, 3, 3], "climgfloatw32"], [2, 2], [1, 1, 1, 1], [1, 1], "NCHW", "NCHW4c", "climgfloatw32"], {}], "config": {"index": 2038, "code_hash": null, "entity": [["tile_ic", "sp", [-1, 1, 4]], ["tile_oc", "sp", [-1, 4]], ["tile_ow", "sp", [-1, 4, 2]], ["tile_oh", "sp", [-1, 1, 64]]]}, "result": [[0.0006156188011204482], 0, 2.049093246459961, 1615383499.294981], "version": 0.2, "tvm_version": "0.8.dev0"}
{"input": ["opencl -keys=mali,opencl,gpu -device=mali -max_num_threads=256", "conv2d_NCHWc_io.mali", [["TENSOR", [1, 4, 224, 224], "climgfloatw32"], ["TENSOR", [4, 32, 3, 3], "climgfloatw32"], [2, 2], [1, 1, 1, 1], [1, 1], "NCHW", "NCHW4c", "climgfloatw32"], {}], "config": {"index": 4513, "code_hash": null, "entity": [["tile_ic", "sp", [-1, 1, 4]], ["tile_oc", "sp", [-1, 2]], ["tile_ow", "sp", [-1, 1, 112]], ["tile_oh", "sp", [-1, 14, 8]]]}, "result": [[0.0017877881496062994], 0, 2.0084712505340576, 1615383500.823777], "version": 0.2, "tvm_version": "0.8.dev0"}
{"input": ["opencl -keys=mali,opencl,gpu -device=mali -max_num_threads=256", "conv2d_NCHWc_io.mali", [["TENSOR", [1, 4, 224, 224], "climgfloatw32"], ["TENSOR", [4, 32, 3, 3], "climgfloatw32"], [2, 2], [1, 1, 1, 1], [1, 1], "NCHW", "NCHW4c", "climgfloatw32"], {}], "config": {"index": 2890, "code_hash": null, "entity": [["tile_ic", "sp", [-1, 1, 4]], ["tile_oc", "sp", [-1, 4]], ["tile_ow", "sp", [-1, 14, 2]], ["tile_oh", "sp", [-1, 8, 4]]]}, "result": [[0.000696278319218241], 0, 2.113138437271118, 1615383502.3226976], "version": 0.2, "tvm_version": "0.8.dev0"}
{"input": ["opencl -keys=mali,opencl,gpu -device=mali -max_num_threads=256", "conv2d_NCHWc_io.mali", [["TENSOR", [1, 4, 224, 224], "climgfloatw32"], ["TENSOR", [4, 32, 3, 3], "climgfloatw32"], [2, 2], [1, 1, 1, 1], [1, 1], "NCHW", "NCHW4c", "climgfloatw32"], {}], "config": {"index": 5526, "code_hash": null, "entity": [["tile_ic", "sp", [-1, 1, 4]], ["tile_oc", "sp", [-1, 4]], ["tile_ow", "sp", [-1, 1, 56]], ["tile_oh", "sp", [-1, 1, 16]]]}, "result": [[0.0006483527605633803], 0, 2.0011377334594727, 1615383503.8547807], "version": 0.2, "tvm_version": "0.8.dev0"}
{"input": ["opencl -keys=mali,opencl,gpu -device=mali -max_num_threads=256", "conv2d_NCHWc_io.mali", [["TENSOR", [1, 4, 224, 224], "climgfloatw32"], ["TENSOR", [4, 32, 3, 3], "climgfloatw32"], [2, 2], [1, 1, 1, 1], [1, 1], "NCHW", "NCHW4c", "climgfloatw32"], {}], "config": {"index": 204, "code_hash": null, "entity": [["tile_ic", "sp", [-1, 1, 4]], ["tile_oc", "sp", [-1, 1]], ["tile_ow", "sp", [-1, 16, 2]], ["tile_oh", "sp", [-1, 2, 32]]]}, "result": [[0.000780209263888889], 0, 2.1970105171203613, 1615383505.3868718], "version": 0.2, "tvm_version": "0.8.dev0"}
{"input": ["opencl -keys=mali,opencl,gpu -device=mali -max_num_threads=256", "conv2d_NCHWc_io.mali", [["TENSOR", [1, 4, 224, 224], "climgfloatw32"], ["TENSOR", [4, 32, 3, 3], "climgfloatw32"], [2, 2], [1, 1, 1, 1], [1, 1], "NCHW", "NCHW4c", "climgfloatw32"], {}], "config": {"index": 4149, "code_hash": null, "entity": [["tile_ic", "sp", [-1, 1, 4]], ["tile_oc", "sp", [-1, 2]], ["tile_ow", "sp", [-1, 4, 14]], ["tile_oh", "sp", [-1, 7, 8]]]}, "result": [[0.0007220207956989248], 0, 2.0637125968933105, 1615383506.8112373], "version": 0.2, "tvm_version": "0.8.dev0"}
{"input": ["opencl -keys=mali,opencl,gpu -device=mali -max_num_threads=256", "conv2d_NCHWc_io.mali", [["TENSOR", [1, 4, 224, 224], "climgfloatw32"], ["TENSOR", [4, 32, 3, 3], "climgfloatw32"], [2, 2], [1, 1, 1, 1], [1, 1], "NCHW", "NCHW4c", "climgfloatw32"], {}], "config": {"index": 856, "code_hash": null, "entity": [["tile_ic", "sp", [-1, 1, 4]], ["tile_oc", "sp", [-1, 1]], ["tile_ow", "sp", [-1, 2, 2]], ["tile_oh", "sp", [-1, 4, 2]]]}, "result": [[0.0008792511483050847], 0, 2.0914394855499268, 1615383509.2304688], "version": 0.2, "tvm_version": "0.8.dev0"}
{"input": ["opencl -keys=mali,opencl,gpu -device=mali -max_num_threads=256", "conv2d_NCHWc_io.mali", [["TENSOR", [1, 4, 224, 224], "climgfloatw32"], ["TENSOR", [4, 32, 3, 3], "climgfloatw32"], [2, 2], [1, 1, 1, 1], [1, 1], "NCHW", "NCHW4c", "climgfloatw32"], {}], "config": {"index": 3102, "code_hash": null, "entity": [["tile_ic", "sp", [-1, 1, 4]], ["tile_oc", "sp", [-1, 4]], ["tile_ow", "sp", [-1, 16, 4]], ["tile_oh", "sp", [-1, 14, 4]]]}, "result": [[0.0011545569488636365], 0, 2.002243757247925, 1615383510.7031538], "version": 0.2, "tvm_version": "0.8.dev0"}
{"input": ["opencl -keys=mali,opencl,gpu -device=mali -max_num_threads=256", "conv2d_NCHWc_io.mali", [["TENSOR", [1, 4, 224, 224], "climgfloatw32"], ["TENSOR", [4, 32, 3, 3], "climgfloatw32"], [2, 2], [1, 1, 1, 1], [1, 1], "NCHW", "NCHW4c", "climgfloatw32"], {}], "config": {"index": 1888, "code_hash": null, "entity": [["tile_ic", "sp", [-1, 1, 4]], ["tile_oc", "sp", [-1, 1]], ["tile_ow", "sp", [-1, 56, 2]], ["tile_oh", "sp", [-1, 28, 2]]]}, "result": [[0.0014945027062499999], 0, 2.171485662460327, 1615383512.3706634], "version": 0.2, "tvm_version": "0.8.dev0"}
{"input": ["opencl -keys=mali,opencl,gpu -device=mali -max_num_threads=256", "conv2d_NCHWc_io.mali", [["TENSOR", [1, 4, 224, 224], "climgfloatw32"], ["TENSOR", [4, 32, 3, 3], "climgfloatw32"], [2, 2], [1, 1, 1, 1], [1, 1], "NCHW", "NCHW4c", "climgfloatw32"], {}], "config": {"index": 4498, "code_hash": null, "entity": [["tile_ic", "sp", [-1, 1, 4]], ["tile_oc", "sp", [-1, 4]], ["tile_ow", "sp", [-1, 1, 16]], ["tile_oh", "sp", [-1, 14, 8]]]}, "result": [[0.000592340451697128], 0, 1.9445006847381592, 1615383513.90393], "version": 0.2, "tvm_version": "0.8.dev0"}
{"input": ["opencl -keys=mali,opencl,gpu -device=mali -max_num_threads=256", "conv2d_NCHWc_io.mali", [["TENSOR", [1, 4, 224, 224], "climgfloatw32"], ["TENSOR", [4, 32, 3, 3], "climgfloatw32"], [2, 2], [1, 1, 1, 1], [1, 1], "NCHW", "NCHW4c", "climgfloatw32"], {}], "config": {"index": 4287, "code_hash": null, "entity": [["tile_ic", "sp", [-1, 1, 4]], ["tile_oc", "sp", [-1, 8]], ["tile_ow", "sp", [-1, 1, 8]], ["tile_oh", "sp", [-1, 8, 8]]]}, "result": [[0.0007149669748427673], 0, 2.0720138549804688, 1615383515.4655972], "version": 0.2, "tvm_version": "0.8.dev0"}
{"input": ["opencl -keys=mali,opencl,gpu -device=mali -max_num_threads=256", "conv2d_NCHWc_io.mali", [["TENSOR", [1, 4, 224, 224], "climgfloatw32"], ["TENSOR", [4, 32, 3, 3], "climgfloatw32"], [2, 2], [1, 1, 1, 1], [1, 1], "NCHW", "NCHW4c", "climgfloatw32"], {}], "config": {"index": 664, "code_hash": null, "entity": [["tile_ic", "sp", [-1, 1, 4]], ["tile_oc", "sp", [-1, 1]], ["tile_ow", "sp", [-1, 2, 28]], ["tile_oh", "sp", [-1, 1, 2]]]}, "result": [[0.0007849379404761905], 0, 1.9774835109710693, 1615383516.9502752], "version": 0.2, "tvm_version": "0.8.dev0"}
{"input": ["opencl -keys=mali,opencl,gpu -device=mali -max_num_threads=256", "conv2d_NCHWc_io.mali", [["TENSOR", [1, 4, 224, 224], "climgfloatw32"], ["TENSOR", [4, 32, 3, 3], "climgfloatw32"], [2, 2], [1, 1, 1, 1], [1, 1], "NCHW", "NCHW4c", "climgfloatw32"], {}], "config": {"index": 4961, "code_hash": null, "entity": [["tile_ic", "sp", [-1, 1, 4]], ["tile_oc", "sp", [-1, 2]], ["tile_ow", "sp", [-1, 2, 8]], ["tile_oh", "sp", [-1, 4, 14]]]}, "result": [[0.0005426113411214953], 0, 2.029780626296997, 1615383518.4881663], "version": 0.2, "tvm_version": "0.8.dev0"}
{"input": ["opencl -keys=mali,opencl,gpu -device=mali -max_num_threads=256", "conv2d_NCHWc_io.mali", [["TENSOR", [1, 4, 224, 224], "climgfloatw32"], ["TENSOR", [4, 32, 3, 3], "climgfloatw32"], [2, 2], [1, 1, 1, 1], [1, 1], "NCHW", "NCHW4c", "climgfloatw32"], {}], "config": {"index": 6577, "code_hash": null, "entity": [["tile_ic", "sp", [-1, 1, 4]], ["tile_oc", "sp", [-1, 2]], ["tile_ow", "sp", [-1, 7, 2]], ["tile_oh", "sp", [-1, 1, 28]]]}, "result": [[0.0006310669721115538], 0, 1.7373130321502686, 1615383519.6613877], "version": 0.2, "tvm_version": "0.8.dev0"}
{"input": ["opencl -keys=mali,opencl,gpu -device=mali -max_num_threads=256", "conv2d_NCHWc_io.mali", [["TENSOR", [1, 4, 224, 224], "climgfloatw32"], ["TENSOR", [4, 32, 3, 3], "climgfloatw32"], [2, 2], [1, 1, 1, 1], [1, 1], "NCHW", "NCHW4c", "climgfloatw32"], {}], "config": {"index": 5333, "code_hash": null, "entity": [["tile_ic", "sp", [-1, 1, 4]], ["tile_oc", "sp", [-1, 2]], ["tile_ow", "sp", [-1, 8, 14]], ["tile_oh", "sp", [-1, 8, 14]]]}, "result": [[0.0019028432658227848], 0, 1.9083912372589111, 1615383521.079855], "version": 0.2, "tvm_version": "0.8.dev0"}
{"input": ["opencl -keys=mali,opencl,gpu -device=mali -max_num_threads=256", "conv2d_NCHWc_io.mali", [["TENSOR", [1, 4, 224, 224], "climgfloatw32"], ["TENSOR", [4, 32, 3, 3], "climgfloatw32"], [2, 2], [1, 1, 1, 1], [1, 1], "NCHW", "NCHW4c", "climgfloatw32"], {}], "config": {"index": 3926, "code_hash": null, "entity": [["tile_ic", "sp", [-1, 1, 4]], ["tile_oc", "sp", [-1, 4]], ["tile_ow", "sp", [-1, 4, 4]], ["tile_oh", "sp", [-1, 4, 8]]]}, "result": [[0.0006302259538043478], 0, 2.1002416610717773, 1615383522.6181655], "version": 0.2, "tvm_version": "0.8.dev0"}
{"input": ["opencl -keys=mali,opencl,gpu -device=mali -max_num_threads=256", "conv2d_NCHWc_io.mali", [["TENSOR", [1, 4, 224, 224], "climgfloatw32"], ["TENSOR", [4, 32, 3, 3], "climgfloatw32"], [2, 2], [1, 1, 1, 1], [1, 1], "NCHW", "NCHW4c", "climgfloatw32"], {}], "config": {"index": 5954, "code_hash": null, "entity": [["tile_ic", "sp", [-1, 1, 4]], ["tile_oc", "sp", [-1, 4]], ["tile_ow", "sp", [-1, 14, 4]], ["tile_oh", "sp", [-1, 7, 16]]]}, "result": [[0.0016110313893129772], 0, 2.0148301124572754, 1615383524.1422946], "version": 0.2, "tvm_version": "0.8.dev0"}
{"input": ["opencl -keys=mali,opencl,gpu -device=mali -max_num_threads=256", "conv2d_NCHWc_io.mali", [["TENSOR", [1, 4, 224, 224], "climgfloatw32"], ["TENSOR", [4, 32, 3, 3], "climgfloatw32"], [2, 2], [1, 1, 1, 1], [1, 1], "NCHW", "NCHW4c", "climgfloatw32"], {}], "config": {"index": 5579, "code_hash": null, "entity": [["tile_ic", "sp", [-1, 1, 4]], ["tile_oc", "sp", [-1, 8]], ["tile_ow", "sp", [-1, 14, 2]], ["tile_oh", "sp", [-1, 2, 16]]]}, "result": [[0.0007362692993197279], 0, 2.067636251449585, 1615383525.6603749], "version": 0.2, "tvm_version": "0.8.dev0"}
{"input": ["opencl -keys=mali,opencl,gpu -device=mali -max_num_threads=256", "conv2d_NCHWc_io.mali", [["TENSOR", [1, 4, 224, 224], "climgfloatw32"], ["TENSOR", [4, 32, 3, 3], "climgfloatw32"], [2, 2], [1, 1, 1, 1], [1, 1], "NCHW", "NCHW4c", "climgfloatw32"], {}], "config": {"index": 4628, "code_hash": null, "entity": [["tile_ic", "sp", [-1, 1, 4]], ["tile_oc", "sp", [-1, 1]], ["tile_ow", "sp", [-1, 4, 8]], ["tile_oh", "sp", [-1, 1, 14]]]}, "result": [[0.0008160613095238096], 0, 2.0175981521606445, 1615383527.1465695], "version": 0.2, "tvm_version": "0.8.dev0"}
{"input": ["opencl -keys=mali,opencl,gpu -device=mali -max_num_threads=256", "conv2d_NCHWc_io.mali", [["TENSOR", [1, 4, 224, 224], "climgfloatw32"], ["TENSOR", [4, 32, 3, 3], "climgfloatw32"], [2, 2], [1, 1, 1, 1], [1, 1], "NCHW", "NCHW4c", "climgfloatw32"], {}], "config": {"index": 827, "code_hash": null, "entity": [["tile_ic", "sp", [-1, 1, 4]], ["tile_oc", "sp", [-1, 8]], ["tile_ow", "sp", [-1, 2, 56]], ["tile_oh", "sp", [-1, 2, 2]]]}, "result": [[0.0006821893468634686], 0, 1.8889110088348389, 1615383528.5020447], "version": 0.2, "tvm_version": "0.8.dev0"}
{"input": ["opencl -keys=mali,opencl,gpu -device=mali -max_num_threads=256", "conv2d_NCHWc_io.mali", [["TENSOR", [1, 4, 224, 224], "climgfloatw32"], ["TENSOR", [4, 32, 3, 3], "climgfloatw32"], [2, 2], [1, 1, 1, 1], [1, 1], "NCHW", "NCHW4c", "climgfloatw32"], {}], "config": {"index": 3515, "code_hash": null, "entity": [["tile_ic", "sp", [-1, 1, 4]], ["tile_oc", "sp", [-1, 8]], ["tile_ow", "sp", [-1, 2, 56]], ["tile_oh", "sp", [-1, 28, 4]]]}, "result": [[0.004639068151515152], 0, 1.8824949264526367, 1615383529.9126694], "version": 0.2, "tvm_version": "0.8.dev0"}
{"input": ["opencl -keys=mali,opencl,gpu -device=mali -max_num_threads=256", "conv2d_NCHWc_io.mali", [["TENSOR", [1, 4, 224, 224], "climgfloatw32"], ["TENSOR", [4, 32, 3, 3], "climgfloatw32"], [2, 2], [1, 1, 1, 1], [1, 1], "NCHW", "NCHW4c", "climgfloatw32"], {}], "config": {"index": 791, "code_hash": null, "entity": [["tile_ic", "sp", [-1, 1, 4]], ["tile_oc", "sp", [-1, 8]], ["tile_ow", "sp", [-1, 4, 14]], ["tile_oh", "sp", [-1, 2, 2]]]}, "result": [[0.0006570759759759761], 0, 2.1034648418426514, 1615383531.438368], "version": 0.2, "tvm_version": "0.8.dev0"}
{"input": ["opencl -keys=mali,opencl,gpu -device=mali -max_num_threads=256", "depthwise_conv2d_NCHWc_io.mali", [["TENSOR", [1, 32, 112, 112], "climgfloatw32"], ["TENSOR", [1, 32, 3, 3], "climgfloatw32"], [16, 16], [1, 1, 1, 1], [1, 1], "NCHW", "NCHW4c", "climgfloatw32"], {}], "config": {"index": 159, "code_hash": null, "entity": [["tile_ic", "ot", 4], ["tile_oc", "ot", 4], ["tile_cp", "sp", [-1, 8]], ["tile_hp", "sp", [-1, 1, 1]], ["tile_wp", "sp", [-1, 7, 1]], ["ann_spatial", "an", ["unroll", "unroll"]]]}, "result": [[0.0001463421143208359], 0, 2.477628707885742, 1615383579.9469867], "version": 0.2, "tvm_version": "0.8.dev0"}
{"input": ["opencl -keys=mali,opencl,gpu -device=mali -max_num_threads=256", "depthwise_conv2d_NCHWc_io.mali", [["TENSOR", [1, 32, 112, 112], "climgfloatw32"], ["TENSOR", [1, 32, 3, 3], "climgfloatw32"], [16, 16], [1, 1, 1, 1], [1, 1], "NCHW", "NCHW4c", "climgfloatw32"], {}], "config": {"index": 224, "code_hash": null, "entity": [["tile_ic", "ot", 4], ["tile_oc", "ot", 4], ["tile_cp", "sp", [-1, 1]], ["tile_hp", "sp", [-1, 1, 7]], ["tile_wp", "sp", [-1, 1, 1]], ["ann_spatial", "an", ["vec", "none"]]]}, "result": [[0.00021523961016243234], 0, 2.661130666732788, 1615383582.053813], "version": 0.2, "tvm_version": "0.8.dev0"}
{"input": ["opencl -keys=mali,opencl,gpu -device=mali -max_num_threads=256", "depthwise_conv2d_NCHWc_io.mali", [["TENSOR", [1, 32, 112, 112], "climgfloatw32"], ["TENSOR", [1, 32, 3, 3], "climgfloatw32"], [16, 16], [1, 1, 1, 1], [1, 1], "NCHW", "NCHW4c", "climgfloatw32"], {}], "config": {"index": 284, "code_hash": null, "entity": [["tile_ic", "ot", 4], ["tile_oc", "ot", 4], ["tile_cp", "sp", [-1, 1]], ["tile_hp", "sp", [-1, 1, 7]], ["tile_wp", "sp", [-1, 1, 7]], ["ann_spatial", "an", ["vec", "unroll"]]]}, "result": [[0.00020505725751421606], 0, 2.790271043777466, 1615383584.228178], "version": 0.2, "tvm_version": "0.8.dev0"}
{"input": ["opencl -keys=mali,opencl,gpu -device=mali -max_num_threads=256", "depthwise_conv2d_NCHWc_io.mali", [["TENSOR", [1, 32, 112, 112], "climgfloatw32"], ["TENSOR", [1, 32, 3, 3], "climgfloatw32"], [16, 16], [1, 1, 1, 1], [1, 1], "NCHW", "NCHW4c", "climgfloatw32"], {}], "config": {"index": 81, "code_hash": null, "entity": [["tile_ic", "ot", 4], ["tile_oc", "ot", 4], ["tile_cp", "sp", [-1, 2]], ["tile_hp", "sp", [-1, 1, 7]], ["tile_wp", "sp", [-1, 1, 1]], ["ann_spatial", "an", ["none", "vec"]]]}, "result": [[9.61564874251497e-05], 0, 1.9103832244873047, 1615383585.537972], "version": 0.2, "tvm_version": "0.8.dev0"}
{"input": ["opencl -keys=mali,opencl,gpu -device=mali -max_num_threads=256", "depthwise_conv2d_NCHWc_io.mali", [["TENSOR", [1, 32, 112, 112], "climgfloatw32"], ["TENSOR", [1, 32, 3, 3], "climgfloatw32"], [16, 16], [1, 1, 1, 1], [1, 1], "NCHW", "NCHW4c", "climgfloatw32"], {}], "config": {"index": 96, "code_hash": null, "entity": [["tile_ic", "ot", 4], ["tile_oc", "ot", 4], ["tile_cp", "sp", [-1, 1]], ["tile_hp", "sp", [-1, 1, 1]], ["tile_wp", "sp", [-1, 1, 7]], ["ann_spatial", "an", ["none", "vec"]]]}, "result": [[0.00021332863340807178], 0, 3.1089370250701904, 1615383588.0288396], "version": 0.2, "tvm_version": "0.8.dev0"}
{"input": ["opencl -keys=mali,opencl,gpu -device=mali -max_num_threads=256", "depthwise_conv2d_NCHWc_io.mali", [["TENSOR", [1, 32, 112, 112], "climgfloatw32"], ["TENSOR", [1, 32, 3, 3], "climgfloatw32"], [16, 16], [1, 1, 1, 1], [1, 1], "NCHW", "NCHW4c", "climgfloatw32"], {}], "config": {"index": 73, "code_hash": null, "entity": [["tile_ic", "ot", 4], ["tile_oc", "ot", 4], ["tile_cp", "sp", [-1, 2]], ["tile_hp", "sp", [-1, 1, 1]], ["tile_wp", "sp", [-1, 1, 1]], ["ann_spatial", "an", ["none", "vec"]]]}, "result": [[0.00020033408638420405], 0, 2.665461301803589, 1615383590.021275], "version": 0.2, "tvm_version": "0.8.dev0"}
{"input": ["opencl -keys=mali,opencl,gpu -device=mali -max_num_threads=256", "depthwise_conv2d_NCHWc_io.mali", [["TENSOR", [1, 32, 112, 112], "climgfloatw32"], ["TENSOR", [1, 32, 3, 3], "climgfloatw32"], [16, 16], [1, 1, 1, 1], [1, 1], "NCHW", "NCHW4c", "climgfloatw32"], {}], "config": {"index": 69, "code_hash": null, "entity": [["tile_ic", "ot", 4], ["tile_oc", "ot", 4], ["tile_cp", "sp", [-1, 2]], ["tile_hp", "sp", [-1, 1, 7]], ["tile_wp", "sp", [-1, 1, 7]], ["ann_spatial", "an", ["none", "unroll"]]]}, "result": [[0.0001608078329764454], 0, 2.0806195735931396, 1615383591.5191646], "version": 0.2, "tvm_version": "0.8.dev0"}
{"input": ["opencl -keys=mali,opencl,gpu -device=mali -max_num_threads=256", "depthwise_conv2d_NCHWc_io.mali", [["TENSOR", [1, 32, 112, 112], "climgfloatw32"], ["TENSOR", [1, 32, 3, 3], "climgfloatw32"], [16, 16], [1, 1, 1, 1], [1, 1], "NCHW", "NCHW4c", "climgfloatw32"], {}], "config": {"index": 266, "code_hash": null, "entity": [["tile_ic", "ot", 4], ["tile_oc", "ot", 4], ["tile_cp", "sp", [-1, 4]], ["tile_hp", "sp", [-1, 1, 1]], ["tile_wp", "sp", [-1, 7, 1]], ["ann_spatial", "an", ["vec", "unroll"]]]}, "result": [[0.00016231848578701738], 0, 2.538743019104004, 1615383593.4949157], "version": 0.2, "tvm_version": "0.8.dev0"}
{"input": ["opencl -keys=mali,opencl,gpu -device=mali -max_num_threads=256", "depthwise_conv2d_NCHWc_io.mali", [["TENSOR", [1, 32, 112, 112], "climgfloatw32"], ["TENSOR", [1, 32, 3, 3], "climgfloatw32"], [16, 16], [1, 1, 1, 1], [1, 1], "NCHW", "NCHW4c", "climgfloatw32"], {}], "config": {"index": 35, "code_hash": null, "entity": [["tile_ic", "ot", 4], ["tile_oc", "ot", 4], ["tile_cp", "sp", [-1, 8]], ["tile_hp", "sp", [-1, 1, 7]], ["tile_wp", "sp", [-1, 1, 7]], ["ann_spatial", "an", ["none", "none"]]]}, "result": [[9.886865897580191e-05], 0, 2.0596656799316406, 1615383594.9207802], "version": 0.2, "tvm_version": "0.8.dev0"}
{"input": ["opencl -keys=mali,opencl,gpu -device=mali -max_num_threads=256", "depthwise_conv2d_NCHWc_io.mali", [["TENSOR", [1, 32, 112, 112], "climgfloatw32"], ["TENSOR", [1, 32, 3, 3], "climgfloatw32"], [16, 16], [1, 1, 1, 1], [1, 1], "NCHW", "NCHW4c", "climgfloatw32"], {}], "config": {"index": 259, "code_hash": null, "entity": [["tile_ic", "ot", 4], ["tile_oc", "ot", 4], ["tile_cp", "sp", [-1, 8]], ["tile_hp", "sp", [-1, 7, 1]], ["tile_wp", "sp", [-1, 1, 1]], ["ann_spatial", "an", ["vec", "unroll"]]]}, "result": [[0.000159858103030303], 0, 2.460588216781616, 1615383596.741218], "version": 0.2, "tvm_version": "0.8.dev0"}
{"input": ["opencl -keys=mali,opencl,gpu -device=mali -max_num_threads=256", "depthwise_conv2d_NCHWc_io.mali", [["TENSOR", [1, 32, 112, 112], "climgfloatw32"], ["TENSOR", [1, 32, 3, 3], "climgfloatw32"], [16, 16], [1, 1, 1, 1], [1, 1], "NCHW", "NCHW4c", "climgfloatw32"], {}], "config": {"index": 80, "code_hash": null, "entity": [["tile_ic", "ot", 4], ["tile_oc", "ot", 4], ["tile_cp", "sp", [-1, 1]], ["tile_hp", "sp", [-1, 1, 7]], ["tile_wp", "sp", [-1, 1, 1]], ["ann_spatial", "an", ["none", "vec"]]]}, "result": [[0.00016846204804392588], 0, 2.1343748569488525, 1615383598.1866164], "version": 0.2, "tvm_version": "0.8.dev0"}
{"input": ["opencl -keys=mali,opencl,gpu -device=mali -max_num_threads=256", "depthwise_conv2d_NCHWc_io.mali", [["TENSOR", [1, 32, 112, 112], "climgfloatw32"], ["TENSOR", [1, 32, 3, 3], "climgfloatw32"], [16, 16], [1, 1, 1, 1], [1, 1], "NCHW", "NCHW4c", "climgfloatw32"], {}], "config": {"index": 184, "code_hash": null, "entity": [["tile_ic", "ot", 4], ["tile_oc", "ot", 4], ["tile_cp", "sp", [-1, 1]], ["tile_hp", "sp", [-1, 7, 1]], ["tile_wp", "sp", [-1, 1, 1]], ["ann_spatial", "an", ["unroll", "vec"]]]}, "result": [[0.00013472802324616023], 0, 2.5124924182891846, 1615383599.9984143], "version": 0.2, "tvm_version": "0.8.dev0"}
{"input": ["opencl -keys=mali,opencl,gpu -device=mali -max_num_threads=256", "depthwise_conv2d_NCHWc_io.mali", [["TENSOR", [1, 32, 112, 112], "climgfloatw32"], ["TENSOR", [1, 32, 3, 3], "climgfloatw32"], [16, 16], [1, 1, 1, 1], [1, 1], "NCHW", "NCHW4c", "climgfloatw32"], {}], "config": {"index": 165, "code_hash": null, "entity": [["tile_ic", "ot", 4], ["tile_oc", "ot", 4], ["tile_cp", "sp", [-1, 2]], ["tile_hp", "sp", [-1, 1, 7]], ["tile_wp", "sp", [-1, 7, 1]], ["ann_spatial", "an", ["unroll", "unroll"]]]}, "result": [[0.0001419210849484536], 0, 2.443800687789917, 1615383601.7576342], "version": 0.2, "tvm_version": "0.8.dev0"}
{"input": ["opencl -keys=mali,opencl,gpu -device=mali -max_num_threads=256", "depthwise_conv2d_NCHWc_io.mali", [["TENSOR", [1, 32, 112, 112], "climgfloatw32"], ["TENSOR", [1, 32, 3, 3], "climgfloatw32"], [16, 16], [1, 1, 1, 1], [1, 1], "NCHW", "NCHW4c", "climgfloatw32"], {}], "config": {"index": 77, "code_hash": null, "entity": [["tile_ic", "ot", 4], ["tile_oc", "ot", 4], ["tile_cp", "sp", [-1, 2]], ["tile_hp", "sp", [-1, 7, 1]], ["tile_wp", "sp", [-1, 1, 1]], ["ann_spatial", "an", ["none", "vec"]]]}, "result": [[0.00013337096086191733], 0, 2.4559433460235596, 1615383603.528927], "version": 0.2, "tvm_version": "0.8.dev0"}
{"input": ["opencl -keys=mali,opencl,gpu -device=mali -max_num_threads=256", "depthwise_conv2d_NCHWc_io.mali", [["TENSOR", [1, 32, 112, 112], "climgfloatw32"], ["TENSOR", [1, 32, 3, 3], "climgfloatw32"], [16, 16], [1, 1, 1, 1], [1, 1], "NCHW", "NCHW4c", "climgfloatw32"], {}], "config": {"index": 16, "code_hash": null, "entity": [["tile_ic", "ot", 4], ["tile_oc", "ot", 4], ["tile_cp", "sp", [-1, 1]], ["tile_hp", "sp", [-1, 7, 1]], ["tile_wp", "sp", [-1, 7, 1]], ["ann_spatial", "an", ["none", "none"]]]}, "result": [[0.00015019713384244375], 0, 2.643894672393799, 1615383605.5101435], "version": 0.2, "tvm_version": "0.8.dev0"}
{"input": ["opencl -keys=mali,opencl,gpu -device=mali -max_num_threads=256", "depthwise_conv2d_NCHWc_io.mali", [["TENSOR", [1, 32, 112, 112], "climgfloatw32"], ["TENSOR", [1, 32, 3, 3], "climgfloatw32"], [16, 16], [1, 1, 1, 1], [1, 1], "NCHW", "NCHW4c", "climgfloatw32"], {}], "config": {"index": 216, "code_hash": null, "entity": [["tile_ic", "ot", 4], ["tile_oc", "ot", 4], ["tile_cp", "sp", [-1, 1]], ["tile_hp", "sp", [-1, 1, 1]], ["tile_wp", "sp", [-1, 1, 1]], ["ann_spatial", "an", ["vec", "none"]]]}, "result": [[0.00017119063299170326], 0, 2.16573166847229, 1615383606.9616573], "version": 0.2, "tvm_version": "0.8.dev0"}
{"input": ["opencl -keys=mali,opencl,gpu -device=mali -max_num_threads=256", "depthwise_conv2d_NCHWc_io.mali", [["TENSOR", [1, 32, 112, 112], "climgfloatw32"], ["TENSOR", [1, 32, 3, 3], "climgfloatw32"], [16, 16], [1, 1, 1, 1], [1, 1], "NCHW", "NCHW4c", "climgfloatw32"], {}], "config": {"index": 246, "code_hash": null, "entity": [["tile_ic", "ot", 4], ["tile_oc", "ot", 4], ["tile_cp", "sp", [-1, 4]], ["tile_hp", "sp", [-1, 7, 1]], ["tile_wp", "sp", [-1, 1, 7]], ["ann_spatial", "an", ["vec", "none"]]]}, "result": [[9.540164665841584e-05], 0, 1.9186341762542725, 1615383609.2522528], "version": 0.2, "tvm_version": "0.8.dev0"}
{"input": ["opencl -keys=mali,opencl,gpu -device=mali -max_num_threads=256", "depthwise_conv2d_NCHWc_io.mali", [["TENSOR", [1, 32, 112, 112], "climgfloatw32"], ["TENSOR", [1, 32, 3, 3], "climgfloatw32"], [16, 16], [1, 1, 1, 1], [1, 1], "NCHW", "NCHW4c", "climgfloatw32"], {}], "config": {"index": 146, "code_hash": null, "entity": [["tile_ic", "ot", 4], ["tile_oc", "ot", 4], ["tile_cp", "sp", [-1, 4]], ["tile_hp", "sp", [-1, 1, 1]], ["tile_wp", "sp", [-1, 1, 1]], ["ann_spatial", "an", ["unroll", "unroll"]]]}, "result": [[0.00018720900221402215], 0, 2.357405424118042, 1615383611.128005], "version": 0.2, "tvm_version": "0.8.dev0"}
{"input": ["opencl -keys=mali,opencl,gpu -device=mali -max_num_threads=256", "depthwise_conv2d_NCHWc_io.mali", [["TENSOR", [1, 32, 112, 112], "climgfloatw32"], ["TENSOR", [1, 32, 3, 3], "climgfloatw32"], [16, 16], [1, 1, 1, 1], [1, 1], "NCHW", "NCHW4c", "climgfloatw32"], {}], "config": {"index": 236, "code_hash": null, "entity": [["tile_ic", "ot", 4], ["tile_oc", "ot", 4], ["tile_cp", "sp", [-1, 1]], ["tile_hp", "sp", [-1, 1, 7]], ["tile_wp", "sp", [-1, 7, 1]], ["ann_spatial", "an", ["vec", "none"]]]}, "result": [[9.547302056866304e-05], 0, 1.8369600772857666, 1615383612.36396], "version": 0.2, "tvm_version": "0.8.dev0"}
{"input": ["opencl -keys=mali,opencl,gpu -device=mali -max_num_threads=256", "depthwise_conv2d_NCHWc_io.mali", [["TENSOR", [1, 32, 112, 112], "climgfloatw32"], ["TENSOR", [1, 32, 3, 3], "climgfloatw32"], [16, 16], [1, 1, 1, 1], [1, 1], "NCHW", "NCHW4c", "climgfloatw32"], {}], "config": {"index": 1, "code_hash": null, "entity": [["tile_ic", "ot", 4], ["tile_oc", "ot", 4], ["tile_cp", "sp", [-1, 2]], ["tile_hp", "sp", [-1, 1, 1]], ["tile_wp", "sp", [-1, 1, 1]], ["ann_spatial", "an", ["none", "none"]]]}, "result": [[0.00012832270125151394], 0, 2.5022830963134766, 1615383614.261453], "version": 0.2, "tvm_version": "0.8.dev0"}
{"input": ["opencl -keys=mali,opencl,gpu -device=mali -max_num_threads=256", "depthwise_conv2d_NCHWc_io.mali", [["TENSOR", [1, 32, 112, 112], "climgfloatw32"], ["TENSOR", [1, 32, 3, 3], "climgfloatw32"], [16, 16], [1, 1, 1, 1], [1, 1], "NCHW", "NCHW4c", "climgfloatw32"], {}], "config": {"index": 15, "code_hash": null, "entity": [["tile_ic", "ot", 4], ["tile_oc", "ot", 4], ["tile_cp", "sp", [-1, 8]], ["tile_hp", "sp", [-1, 1, 1]], ["tile_wp", "sp", [-1, 7, 1]], ["ann_spatial", "an", ["none", "none"]]]}, "result": [[0.0001549338417884781], 0, 2.1601481437683105, 1615383615.9413977], "version": 0.2, "tvm_version": "0.8.dev0"}
{"input": ["opencl -keys=mali,opencl,gpu -device=mali -max_num_threads=256", "depthwise_conv2d_NCHWc_io.mali", [["TENSOR", [1, 32, 112, 112], "climgfloatw32"], ["TENSOR", [1, 32, 3, 3], "climgfloatw32"], [16, 16], [1, 1, 1, 1], [1, 1], "NCHW", "NCHW4c", "climgfloatw32"], {}], "config": {"index": 148, "code_hash": null, "entity": [["tile_ic", "ot", 4], ["tile_oc", "ot", 4], ["tile_cp", "sp", [-1, 1]], ["tile_hp", "sp", [-1, 7, 1]], ["tile_wp", "sp", [-1, 1, 1]], ["ann_spatial", "an", ["unroll", "unroll"]]]}, "result": [[0.00015229926918075424], 0, 2.3289170265197754, 1615383617.6664402], "version": 0.2, "tvm_version": "0.8.dev0"}
{"input": ["opencl -keys=mali,opencl,gpu -device=mali -max_num_threads=256", "depthwise_conv2d_NCHWc_io.mali", [["TENSOR", [1, 32, 112, 112], "climgfloatw32"], ["TENSOR", [1, 32, 3, 3], "climgfloatw32"], [16, 16], [1, 1, 1, 1], [1, 1], "NCHW", "NCHW4c", "climgfloatw32"], {}], "config": {"index": 286, "code_hash": null, "entity": [["tile_ic", "ot", 4], ["tile_oc", "ot", 4], ["tile_cp", "sp", [-1, 4]], ["tile_hp", "sp", [-1, 1, 7]], ["tile_wp", "sp", [-1, 1, 7]], ["ann_spatial", "an", ["vec", "unroll"]]]}, "result": [[9.489789156626505e-05], 0, 1.9580316543579102, 1615383619.0285778], "version": 0.2, "tvm_version": "0.8.dev0"}
{"input": ["opencl -keys=mali,opencl,gpu -device=mali -max_num_threads=256", "depthwise_conv2d_NCHWc_io.mali", [["TENSOR", [1, 32, 112, 112], "climgfloatw32"], ["TENSOR", [1, 32, 3, 3], "climgfloatw32"], [16, 16], [1, 1, 1, 1], [1, 1], "NCHW", "NCHW4c", "climgfloatw32"], {}], "config": {"index": 18, "code_hash": null, "entity": [["tile_ic", "ot", 4], ["tile_oc", "ot", 4], ["tile_cp", "sp", [-1, 4]], ["tile_hp", "sp", [-1, 7, 1]], ["tile_wp", "sp", [-1, 7, 1]], ["ann_spatial", "an", ["none", "none"]]]}, "result": [[0.00015953031344574146], 0, 2.5191595554351807, 1615383620.9202745], "version": 0.2, "tvm_version": "0.8.dev0"}
{"input": ["opencl -keys=mali,opencl,gpu -device=mali -max_num_threads=256", "depthwise_conv2d_NCHWc_io.mali", [["TENSOR", [1, 32, 112, 112], "climgfloatw32"], ["TENSOR", [1, 32, 3, 3], "climgfloatw32"], [16, 16], [1, 1, 1, 1], [1, 1], "NCHW", "NCHW4c", "climgfloatw32"], {}], "config": {"index": 281, "code_hash": null, "entity": [["tile_ic", "ot", 4], ["tile_oc", "ot", 4], ["tile_cp", "sp", [-1, 2]], ["tile_hp", "sp", [-1, 7, 1]], ["tile_wp", "sp", [-1, 1, 7]], ["ann_spatial", "an", ["vec", "unroll"]]]}, "result": [[9.277950632149309e-05], 0, 1.7320754528045654, 1615383622.0734646], "version": 0.2, "tvm_version": "0.8.dev0"}
{"input": ["opencl -keys=mali,opencl,gpu -device=mali -max_num_threads=256", "depthwise_conv2d_NCHWc_io.mali", [["TENSOR", [1, 32, 112, 112], "climgfloatw32"], ["TENSOR", [1, 32, 3, 3], "climgfloatw32"], [16, 16], [1, 1, 1, 1], [1, 1], "NCHW", "NCHW4c", "climgfloatw32"], {}], "config": {"index": 4, "code_hash": null, "entity": [["tile_ic", "ot", 4], ["tile_oc", "ot", 4], ["tile_cp", "sp", [-1, 1]], ["tile_hp", "sp", [-1, 7, 1]], ["tile_wp", "sp", [-1, 1, 1]], ["ann_spatial", "an", ["none", "none"]]]}, "result": [[9.263349178403756e-05], 0, 2.3179221153259277, 1615383623.8184574], "version": 0.2, "tvm_version": "0.8.dev0"}
{"input": ["opencl -keys=mali,opencl,gpu -device=mali -max_num_threads=256", "depthwise_conv2d_NCHWc_io.mali", [["TENSOR", [1, 32, 112, 112], "climgfloatw32"], ["TENSOR", [1, 32, 3, 3], "climgfloatw32"], [16, 16], [1, 1, 1, 1], [1, 1], "NCHW", "NCHW4c", "climgfloatw32"], {}], "config": {"index": 170, "code_hash": null, "entity": [["tile_ic", "ot", 4], ["tile_oc", "ot", 4], ["tile_cp", "sp", [-1, 4]], ["tile_hp", "sp", [-1, 1, 1]], ["tile_wp", "sp", [-1, 1, 7]], ["ann_spatial", "an", ["unroll", "unroll"]]]}, "result": [[8.985756538895152e-05], 0, 1.7555632591247559, 1615383625.0161016], "version": 0.2, "tvm_version": "0.8.dev0"}
{"input": ["opencl -keys=mali,opencl,gpu -device=mali -max_num_threads=256", "depthwise_conv2d_NCHWc_io.mali", [["TENSOR", [1, 32, 112, 112], "climgfloatw32"], ["TENSOR", [1, 32, 3, 3], "climgfloatw32"], [16, 16], [1, 1, 1, 1], [1, 1], "NCHW", "NCHW4c", "climgfloatw32"], {}], "config": {"index": 151, "code_hash": null, "entity": [["tile_ic", "ot", 4], ["tile_oc", "ot", 4], ["tile_cp", "sp", [-1, 8]], ["tile_hp", "sp", [-1, 7, 1]], ["tile_wp", "sp", [-1, 1, 1]], ["ann_spatial", "an", ["unroll", "unroll"]]]}, "result": [[9.250062561576355e-05], 0, 1.7312586307525635, 1615383626.1044707], "version": 0.2, "tvm_version": "0.8.dev0"}
{"input": ["opencl -keys=mali,opencl,gpu -device=mali -max_num_threads=256", "depthwise_conv2d_NCHWc_io.mali", [["TENSOR", [1, 32, 112, 112], "climgfloatw32"], ["TENSOR", [1, 32, 3, 3], "climgfloatw32"], [16, 16], [1, 1, 1, 1], [1, 1], "NCHW", "NCHW4c", "climgfloatw32"], {}], "config": {"index": 141, "code_hash": null, "entity": [["tile_ic", "ot", 4], ["tile_oc", "ot", 4], ["tile_cp", "sp", [-1, 2]], ["tile_hp", "sp", [-1, 1, 7]], ["tile_wp", "sp", [-1, 1, 7]], ["ann_spatial", "an", ["unroll", "none"]]]}, "result": [[9.41166237804878e-05], 0, 1.9182040691375732, 1615383627.3958395], "version": 0.2, "tvm_version": "0.8.dev0"}
{"input": ["opencl -keys=mali,opencl,gpu -device=mali -max_num_threads=256", "depthwise_conv2d_NCHWc_io.mali", [["TENSOR", [1, 32, 112, 112], "climgfloatw32"], ["TENSOR", [1, 32, 3, 3], "climgfloatw32"], [16, 16], [1, 1, 1, 1], [1, 1], "NCHW", "NCHW4c", "climgfloatw32"], {}], "config": {"index": 154, "code_hash": null, "entity": [["tile_ic", "ot", 4], ["tile_oc", "ot", 4], ["tile_cp", "sp", [-1, 4]], ["tile_hp", "sp", [-1, 1, 7]], ["tile_wp", "sp", [-1, 1, 1]], ["ann_spatial", "an", ["unroll", "unroll"]]]}, "result": [[0.0001601640373673036], 0, 2.389873743057251, 1615383629.1534705], "version": 0.2, "tvm_version": "0.8.dev0"}
{"input": ["opencl -keys=mali,opencl,gpu -device=mali -max_num_threads=256", "depthwise_conv2d_NCHWc_io.mali", [["TENSOR", [1, 32, 112, 112], "climgfloatw32"], ["TENSOR", [1, 32, 3, 3], "climgfloatw32"], [16, 16], [1, 1, 1, 1], [1, 1], "NCHW", "NCHW4c", "climgfloatw32"], {}], "config": {"index": 217, "code_hash": null, "entity": [["tile_ic", "ot", 4], ["tile_oc", "ot", 4], ["tile_cp", "sp", [-1, 2]], ["tile_hp", "sp", [-1, 1, 1]], ["tile_wp", "sp", [-1, 1, 1]], ["ann_spatial", "an", ["vec", "none"]]]}, "result": [[8.672592545771579e-05], 0, 2.163982629776001, 1615383630.7155027], "version": 0.2, "tvm_version": "0.8.dev0"}
{"input": ["opencl -keys=mali,opencl,gpu -device=mali -max_num_threads=256", "depthwise_conv2d_NCHWc_io.mali", [["TENSOR", [1, 32, 112, 112], "climgfloatw32"], ["TENSOR", [1, 32, 3, 3], "climgfloatw32"], [16, 16], [1, 1, 1, 1], [1, 1], "NCHW", "NCHW4c", "climgfloatw32"], {}], "config": {"index": 179, "code_hash": null, "entity": [["tile_ic", "ot", 4], ["tile_oc", "ot", 4], ["tile_cp", "sp", [-1, 8]], ["tile_hp", "sp", [-1, 1, 7]], ["tile_wp", "sp", [-1, 1, 7]], ["ann_spatial", "an", ["unroll", "unroll"]]]}, "result": [[0.00011992349865681665], 0, 2.4549636840820312, 1615383632.5361717], "version": 0.2, "tvm_version": "0.8.dev0"}
{"input": ["opencl -keys=mali,opencl,gpu -device=mali -max_num_threads=256", "depthwise_conv2d_NCHWc_io.mali", [["TENSOR", [1, 32, 112, 112], "climgfloatw32"], ["TENSOR", [1, 32, 3, 3], "climgfloatw32"], [16, 16], [1, 1, 1, 1], [1, 1], "NCHW", "NCHW4c", "climgfloatw32"], {}], "config": {"index": 56, "code_hash": null, "entity": [["tile_ic", "ot", 4], ["tile_oc", "ot", 4], ["tile_cp", "sp", [-1, 1]], ["tile_hp", "sp", [-1, 1, 7]], ["tile_wp", "sp", [-1, 7, 1]], ["ann_spatial", "an", ["none", "unroll"]]]}, "result": [[0.00016141155504395145], 0, 2.2938177585601807, 1615383635.2171528], "version": 0.2, "tvm_version": "0.8.dev0"}
{"input": ["opencl -keys=mali,opencl,gpu -device=mali -max_num_threads=256", "depthwise_conv2d_NCHWc_io.mali", [["TENSOR", [1, 32, 112, 112], "climgfloatw32"], ["TENSOR", [1, 32, 3, 3], "climgfloatw32"], [16, 16], [1, 1, 1, 1], [1, 1], "NCHW", "NCHW4c", "climgfloatw32"], {}], "config": {"index": 155, "code_hash": null, "entity": [["tile_ic", "ot", 4], ["tile_oc", "ot", 4], ["tile_cp", "sp", [-1, 8]], ["tile_hp", "sp", [-1, 1, 7]], ["tile_wp", "sp", [-1, 1, 1]], ["ann_spatial", "an", ["unroll", "unroll"]]]}, "result": [[9.240360692588092e-05], 0, 1.646644115447998, 1615383636.3361895], "version": 0.2, "tvm_version": "0.8.dev0"}
{"input": ["opencl -keys=mali,opencl,gpu -device=mali -max_num_threads=256", "depthwise_conv2d_NCHWc_io.mali", [["TENSOR", [1, 32, 112, 112], "climgfloatw32"], ["TENSOR", [1, 32, 3, 3], "climgfloatw32"], [16, 16], [1, 1, 1, 1], [1, 1], "NCHW", "NCHW4c", "climgfloatw32"], {}], "config": {"index": 88, "code_hash": null, "entity": [["tile_ic", "ot", 4], ["tile_oc", "ot", 4], ["tile_cp", "sp", [-1, 1]], ["tile_hp", "sp", [-1, 7, 1]], ["tile_wp", "sp", [-1, 7, 1]], ["ann_spatial", "an", ["none", "vec"]]]}, "result": [[0.0001809792522052927], 0, 2.4671945571899414, 1615383638.2836392], "version": 0.2, "tvm_version": "0.8.dev0"}
{"input": ["opencl -keys=mali,opencl,gpu -device=mali -max_num_threads=256", "depthwise_conv2d_NCHWc_io.mali", [["TENSOR", [1, 32, 112, 112], "climgfloatw32"], ["TENSOR", [1, 32, 3, 3], "climgfloatw32"], [16, 16], [1, 1, 1, 1], [1, 1], "NCHW", "NCHW4c", "climgfloatw32"], {}], "config": {"index": 239, "code_hash": null, "entity": [["tile_ic", "ot", 4], ["tile_oc", "ot", 4], ["tile_cp", "sp", [-1, 8]], ["tile_hp", "sp", [-1, 1, 7]], ["tile_wp", "sp", [-1, 7, 1]], ["ann_spatial", "an", ["vec", "none"]]]}, "result": [[9.562624540628829e-05], 0, 2.2328872680664062, 1615383639.988761], "version": 0.2, "tvm_version": "0.8.dev0"}
{"input": ["opencl -keys=mali,opencl,gpu -device=mali -max_num_threads=256", "depthwise_conv2d_NCHWc_io.mali", [["TENSOR", [1, 32, 112, 112], "climgfloatw32"], ["TENSOR", [1, 32, 3, 3], "climgfloatw32"], [16, 16], [1, 1, 1, 1], [1, 1], "NCHW", "NCHW4c", "climgfloatw32"], {}], "config": {"index": 24, "code_hash": null, "entity": [["tile_ic", "ot", 4], ["tile_oc", "ot", 4], ["tile_cp", "sp", [-1, 1]], ["tile_hp", "sp", [-1, 1, 1]], ["tile_wp", "sp", [-1, 1, 7]], ["ann_spatial", "an", ["none", "none"]]]}, "result": [[0.00016507908533333333], 0, 1.8617937564849854, 1615383641.2636974], "version": 0.2, "tvm_version": "0.8.dev0"}
{"input": ["opencl -keys=mali,opencl,gpu -device=mali -max_num_threads=256", "depthwise_conv2d_NCHWc_io.mali", [["TENSOR", [1, 32, 112, 112], "climgfloatw32"], ["TENSOR", [1, 32, 3, 3], "climgfloatw32"], [16, 16], [1, 1, 1, 1], [1, 1], "NCHW", "NCHW4c", "climgfloatw32"], {}], "config": {"index": 115, "code_hash": null, "entity": [["tile_ic", "ot", 4], ["tile_oc", "ot", 4], ["tile_cp", "sp", [-1, 8]], ["tile_hp", "sp", [-1, 7, 1]], ["tile_wp", "sp", [-1, 1, 1]], ["ann_spatial", "an", ["unroll", "none"]]]}, "result": [[9.414489918256131e-05], 0, 2.140782117843628, 1615383642.8483536], "version": 0.2, "tvm_version": "0.8.dev0"}
{"input": ["opencl -keys=mali,opencl,gpu -device=mali -max_num_threads=256", "depthwise_conv2d_NCHWc_io.mali", [["TENSOR", [1, 32, 112, 112], "climgfloatw32"], ["TENSOR", [1, 32, 3, 3], "climgfloatw32"], [16, 16], [1, 1, 1, 1], [1, 1], "NCHW", "NCHW4c", "climgfloatw32"], {}], "config": {"index": 59, "code_hash": null, "entity": [["tile_ic", "ot", 4], ["tile_oc", "ot", 4], ["tile_cp", "sp", [-1, 8]], ["tile_hp", "sp", [-1, 1, 7]], ["tile_wp", "sp", [-1, 7, 1]], ["ann_spatial", "an", ["none", "unroll"]]]}, "result": [[9.516370304904994e-05], 0, 2.0605568885803223, 1615383644.4189465], "version": 0.2, "tvm_version": "0.8.dev0"}
{"input": ["opencl -keys=mali,opencl,gpu -device=mali -max_num_threads=256", "depthwise_conv2d_NCHWc_io.mali", [["TENSOR", [1, 32, 112, 112], "climgfloatw32"], ["TENSOR", [1, 32, 3, 3], "climgfloatw32"], [16, 16], [1, 1, 1, 1], [1, 1], "NCHW", "NCHW4c", "climgfloatw32"], {}], "config": {"index": 263, "code_hash": null, "entity": [["tile_ic", "ot", 4], ["tile_oc", "ot", 4], ["tile_cp", "sp", [-1, 8]], ["tile_hp", "sp", [-1, 1, 7]], ["tile_wp", "sp", [-1, 1, 1]], ["ann_spatial", "an", ["vec", "unroll"]]]}, "result": [[0.00016339619425019425], 0, 1.957385540008545, 1615383645.7974024], "version": 0.2, "tvm_version": "0.8.dev0"}
{"input": ["opencl -keys=mali,opencl,gpu -device=mali -max_num_threads=256", "depthwise_conv2d_NCHWc_io.mali", [["TENSOR", [1, 32, 112, 112], "climgfloatw32"], ["TENSOR", [1, 32, 3, 3], "climgfloatw32"], [16, 16], [1, 1, 1, 1], [1, 1], "NCHW", "NCHW4c", "climgfloatw32"], {}], "config": {"index": 171, "code_hash": null, "entity": [["tile_ic", "ot", 4], ["tile_oc", "ot", 4], ["tile_cp", "sp", [-1, 8]], ["tile_hp", "sp", [-1, 1, 1]], ["tile_wp", "sp", [-1, 1, 7]], ["ann_spatial", "an", ["unroll", "unroll"]]]}, "result": [[9.318633863519753e-05], 0, 1.8624358177185059, 1615383647.1305428], "version": 0.2, "tvm_version": "0.8.dev0"}
{"input": ["opencl -keys=mali,opencl,gpu -device=mali -max_num_threads=256", "depthwise_conv2d_NCHWc_io.mali", [["TENSOR", [1, 32, 112, 112], "climgfloatw32"], ["TENSOR", [1, 32, 3, 3], "climgfloatw32"], [16, 16], [1, 1, 1, 1], [1, 1], "NCHW", "NCHW4c", "climgfloatw32"], {}], "config": {"index": 150, "code_hash": null, "entity": [["tile_ic", "ot", 4], ["tile_oc", "ot", 4], ["tile_cp", "sp", [-1, 4]], ["tile_hp", "sp", [-1, 7, 1]], ["tile_wp", "sp", [-1, 1, 1]], ["ann_spatial", "an", ["unroll", "unroll"]]]}, "result": [[9.243009527439025e-05], 0, 2.40739369392395, 1615383648.9940608], "version": 0.2, "tvm_version": "0.8.dev0"}
{"input": ["opencl -keys=mali,opencl,gpu -device=mali -max_num_threads=256", "depthwise_conv2d_NCHWc_io.mali", [["TENSOR", [1, 32, 112, 112], "climgfloatw32"], ["TENSOR", [1, 32, 3, 3], "climgfloatw32"], [16, 16], [1, 1, 1, 1], [1, 1], "NCHW", "NCHW4c", "climgfloatw32"], {}], "config": {"index": 27, "code_hash": null, "entity": [["tile_ic", "ot", 4], ["tile_oc", "ot", 4], ["tile_cp", "sp", [-1, 8]], ["tile_hp", "sp", [-1, 1, 1]], ["tile_wp", "sp", [-1, 1, 7]], ["ann_spatial", "an", ["none", "none"]]]}, "result": [[9.275311154031869e-05], 0, 2.1061432361602783, 1615383650.5024264], "version": 0.2, "tvm_version": "0.8.dev0"}
