test_and_tune/llv-float32.mobilenet_v1_1.0_224.log.tmp
{"input": ["opencl -keys=mali,opencl,gpu -device=mali -max_num_threads=256", "conv2d_NCHWc_io.mali", [["TENSOR", [1, 4, 224, 224], "float32"], ["TENSOR", [4, 32, 3, 3], "float32"], [2, 2], [1, 1, 1, 1], [1, 1], "NCHW", "NCHW4c", "float32"], {}], "config": {"index": 7052, "code_hash": null, "entity": [["tile_ic", "sp", [-1, 1, 4]], ["tile_oc", "sp", [-1, 1]], ["tile_ow", "sp", [-1, 4, 28]], ["tile_oh", "sp", [-1, 4, 28]]]}, "result": [[0.0007517773819444444], 0, 2.0379481315612793, 1615377308.5636194], "version": 0.2, "tvm_version": "0.8.dev0"}
{"input": ["opencl -keys=mali,opencl,gpu -device=mali -max_num_threads=256", "conv2d_NCHWc_io.mali", [["TENSOR", [1, 4, 224, 224], "float32"], ["TENSOR", [4, 32, 3, 3], "float32"], [2, 2], [1, 1, 1, 1], [1, 1], "NCHW", "NCHW4c", "float32"], {}], "config": {"index": 2811, "code_hash": null, "entity": [["tile_ic", "sp", [-1, 1, 4]], ["tile_oc", "sp", [-1, 8]], ["tile_ow", "sp", [-1, 7, 14]], ["tile_oh", "sp", [-1, 7, 4]]]}, "result": [[0.0012663612826086957], 0, 2.2322843074798584, 1615377310.2012405], "version": 0.2, "tvm_version": "0.8.dev0"}
{"input": ["opencl -keys=mali,opencl,gpu -device=mali -max_num_threads=256", "conv2d_NCHWc_io.mali", [["TENSOR", [1, 4, 224, 224], "float32"], ["TENSOR", [4, 32, 3, 3], "float32"], [2, 2], [1, 1, 1, 1], [1, 1], "NCHW", "NCHW4c", "float32"], {}], "config": {"index": 6028, "code_hash": null, "entity": [["tile_ic", "sp", [-1, 1, 4]], ["tile_oc", "sp", [-1, 1]], ["tile_ow", "sp", [-1, 1, 56]], ["tile_oh", "sp", [-1, 7, 16]]]}, "result": [[0.000431602838150289], 0, 2.003710985183716, 1615377311.685], "version": 0.2, "tvm_version": "0.8.dev0"}
{"input": ["opencl -keys=mali,opencl,gpu -device=mali -max_num_threads=256", "conv2d_NCHWc_io.mali", [["TENSOR", [1, 4, 224, 224], "float32"], ["TENSOR", [4, 32, 3, 3], "float32"], [2, 2], [1, 1, 1, 1], [1, 1], "NCHW", "NCHW4c", "float32"], {}], "config": {"index": 4998, "code_hash": null, "entity": [["tile_ic", "sp", [-1, 1, 4]], ["tile_oc", "sp", [-1, 4]], ["tile_ow", "sp", [-1, 8, 14]], ["tile_oh", "sp", [-1, 4, 14]]]}, "result": [[0.0012121206927083333], 0, 2.0090792179107666, 1615377313.2076902], "version": 0.2, "tvm_version": "0.8.dev0"}
{"input": ["opencl -keys=mali,opencl,gpu -device=mali -max_num_threads=256", "conv2d_NCHWc_io.mali", [["TENSOR", [1, 4, 224, 224], "float32"], ["TENSOR", [4, 32, 3, 3], "float32"], [2, 2], [1, 1, 1, 1], [1, 1], "NCHW", "NCHW4c", "float32"], {}], "config": {"index": 3007, "code_hash": null, "entity": [["tile_ic", "sp", [-1, 1, 4]], ["tile_oc", "sp", [-1, 8]], ["tile_ow", "sp", [-1, 1, 56]], ["tile_oh", "sp", [-1, 8, 4]]]}, "result": [[0.0009464419724409448], 0, 2.10506272315979, 1615377314.731446], "version": 0.2, "tvm_version": "0.8.dev0"}
{"input": ["opencl -keys=mali,opencl,gpu -device=mali -max_num_threads=256", "conv2d_NCHWc_io.mali", [["TENSOR", [1, 4, 224, 224], "float32"], ["TENSOR", [4, 32, 3, 3], "float32"], [2, 2], [1, 1, 1, 1], [1, 1], "NCHW", "NCHW4c", "float32"], {}], "config": {"index": 317, "code_hash": null, "entity": [["tile_ic", "sp", [-1, 1, 4]], ["tile_oc", "sp", [-1, 2]], ["tile_ow", "sp", [-1, 1, 56]], ["tile_oh", "sp", [-1, 2, 32]]]}, "result": [[0.0005163515371621622], 0, 1.6533517837524414, 1615377315.821387], "version": 0.2, "tvm_version": "0.8.dev0"}
{"input": ["opencl -keys=mali,opencl,gpu -device=mali -max_num_threads=256", "conv2d_NCHWc_io.mali", [["TENSOR", [1, 4, 224, 224], "float32"], ["TENSOR", [4, 32, 3, 3], "float32"], [2, 2], [1, 1, 1, 1], [1, 1], "NCHW", "NCHW4c", "float32"], {}], "config": {"index": 120, "code_hash": null, "entity": [["tile_ic", "sp", [-1, 1, 4]], ["tile_oc", "sp", [-1, 1]], ["tile_ow", "sp", [-1, 7, 14]], ["tile_oh", "sp", [-1, 1, 32]]]}, "result": [[0.0006462170866666666], 0, 1.8932201862335205, 1615377317.146288], "version": 0.2, "tvm_version": "0.8.dev0"}
{"input": ["opencl -keys=mali,opencl,gpu -device=mali -max_num_threads=256", "conv2d_NCHWc_io.mali", [["TENSOR", [1, 4, 224, 224], "float32"], ["TENSOR", [4, 32, 3, 3], "float32"], [2, 2], [1, 1, 1, 1], [1, 1], "NCHW", "NCHW4c", "float32"], {}], "config": {"index": 159, "code_hash": null, "entity": [["tile_ic", "sp", [-1, 1, 4]], ["tile_oc", "sp", [-1, 8]], ["tile_ow", "sp", [-1, 1, 28]], ["tile_oh", "sp", [-1, 1, 32]]]}, "result": [[0.0005186258040201005], 0, 1.9585950374603271, 1615377318.532916], "version": 0.2, "tvm_version": "0.8.dev0"}
{"input": ["opencl -keys=mali,opencl,gpu -device=mali -max_num_threads=256", "conv2d_NCHWc_io.mali", [["TENSOR", [1, 4, 224, 224], "float32"], ["TENSOR", [4, 32, 3, 3], "float32"], [2, 2], [1, 1, 1, 1], [1, 1], "NCHW", "NCHW4c", "float32"], {}], "config": {"index": 4551, "code_hash": null, "entity": [["tile_ic", "sp", [-1, 1, 4]], ["tile_oc", "sp", [-1, 8]], ["tile_ow", "sp", [-1, 1, 2]], ["tile_oh", "sp", [-1, 1, 14]]]}, "result": [[0.00035828882553956836], 0, 1.93104887008667, 1615377319.9724426], "version": 0.2, "tvm_version": "0.8.dev0"}
{"input": ["opencl -keys=mali,opencl,gpu -device=mali -max_num_threads=256", "conv2d_NCHWc_io.mali", [["TENSOR", [1, 4, 224, 224], "float32"], ["TENSOR", [4, 32, 3, 3], "float32"], [2, 2], [1, 1, 1, 1], [1, 1], "NCHW", "NCHW4c", "float32"], {}], "config": {"index": 6480, "code_hash": null, "entity": [["tile_ic", "sp", [-1, 1, 4]], ["tile_oc", "sp", [-1, 1]], ["tile_ow", "sp", [-1, 7, 8]], ["tile_oh", "sp", [-1, 2, 56]]]}, "result": [[0.0003985204737678855], 0, 2.2061455249786377, 1615377321.6384108], "version": 0.2, "tvm_version": "0.8.dev0"}
{"input": ["opencl -keys=mali,opencl,gpu -device=mali -max_num_threads=256", "conv2d_NCHWc_io.mali", [["TENSOR", [1, 4, 224, 224], "float32"], ["TENSOR", [4, 32, 3, 3], "float32"], [2, 2], [1, 1, 1, 1], [1, 1], "NCHW", "NCHW4c", "float32"], {}], "config": {"index": 4745, "code_hash": null, "entity": [["tile_ic", "sp", [-1, 1, 4]], ["tile_oc", "sp", [-1, 2]], ["tile_ow", "sp", [-1, 56, 2]], ["tile_oh", "sp", [-1, 2, 14]]]}, "result": [[0.00037300782462057334], 0, 1.9917809963226318, 1615377323.0804577], "version": 0.2, "tvm_version": "0.8.dev0"}
{"input": ["opencl -keys=mali,opencl,gpu -device=mali -max_num_threads=256", "conv2d_NCHWc_io.mali", [["TENSOR", [1, 4, 224, 224], "float32"], ["TENSOR", [4, 32, 3, 3], "float32"], [2, 2], [1, 1, 1, 1], [1, 1], "NCHW", "NCHW4c", "float32"], {}], "config": {"index": 4470, "code_hash": null, "entity": [["tile_ic", "sp", [-1, 1, 4]], ["tile_oc", "sp", [-1, 4]], ["tile_ow", "sp", [-1, 8, 8]], ["tile_oh", "sp", [-1, 14, 8]]]}, "result": [[0.0012312979895833334], 0, 2.1508476734161377, 1615377324.668704], "version": 0.2, "tvm_version": "0.8.dev0"}
{"input": ["opencl -keys=mali,opencl,gpu -device=mali -max_num_threads=256", "conv2d_NCHWc_io.mali", [["TENSOR", [1, 4, 224, 224], "float32"], ["TENSOR", [4, 32, 3, 3], "float32"], [2, 2], [1, 1, 1, 1], [1, 1], "NCHW", "NCHW4c", "float32"], {}], "config": {"index": 2369, "code_hash": null, "entity": [["tile_ic", "sp", [-1, 1, 4]], ["tile_oc", "sp", [-1, 2]], ["tile_ow", "sp", [-1, 2, 2]], ["tile_oh", "sp", [-1, 2, 4]]]}, "result": [[0.00048750084916201114], 0, 1.8578886985778809, 1615377326.007224], "version": 0.2, "tvm_version": "0.8.dev0"}
{"input": ["opencl -keys=mali,opencl,gpu -device=mali -max_num_threads=256", "conv2d_NCHWc_io.mali", [["TENSOR", [1, 4, 224, 224], "float32"], ["TENSOR", [4, 32, 3, 3], "float32"], [2, 2], [1, 1, 1, 1], [1, 1], "NCHW", "NCHW4c", "float32"], {}], "config": {"index": 6493, "code_hash": null, "entity": [["tile_ic", "sp", [-1, 1, 4]], ["tile_oc", "sp", [-1, 2]], ["tile_ow", "sp", [-1, 1, 14]], ["tile_oh", "sp", [-1, 2, 56]]]}, "result": [[0.00044051747712418296], 0, 1.8887178897857666, 1615377327.3810306], "version": 0.2, "tvm_version": "0.8.dev0"}
{"input": ["opencl -keys=mali,opencl,gpu -device=mali -max_num_threads=256", "conv2d_NCHWc_io.mali", [["TENSOR", [1, 4, 224, 224], "float32"], ["TENSOR", [4, 32, 3, 3], "float32"], [2, 2], [1, 1, 1, 1], [1, 1], "NCHW", "NCHW4c", "float32"], {}], "config": {"index": 2962, "code_hash": null, "entity": [["tile_ic", "sp", [-1, 1, 4]], ["tile_oc", "sp", [-1, 4]], ["tile_ow", "sp", [-1, 14, 8]], ["tile_oh", "sp", [-1, 8, 4]]]}, "result": [[0.0007392361533333333], 0, 2.0792367458343506, 1615377328.893301], "version": 0.2, "tvm_version": "0.8.dev0"}
{"input": ["opencl -keys=mali,opencl,gpu -device=mali -max_num_threads=256", "conv2d_NCHWc_io.mali", [["TENSOR", [1, 4, 224, 224], "float32"], ["TENSOR", [4, 32, 3, 3], "float32"], [2, 2], [1, 1, 1, 1], [1, 1], "NCHW", "NCHW4c", "float32"], {}], "config": {"index": 5901, "code_hash": null, "entity": [["tile_ic", "sp", [-1, 1, 4]], ["tile_oc", "sp", [-1, 2]], ["tile_ow", "sp", [-1, 4, 2]], ["tile_oh", "sp", [-1, 7, 16]]]}, "result": [[0.0003786893646209386], 0, 1.8994224071502686, 1615377330.2718976], "version": 0.2, "tvm_version": "0.8.dev0"}
{"input": ["opencl -keys=mali,opencl,gpu -device=mali -max_num_threads=256", "conv2d_NCHWc_io.mali", [["TENSOR", [1, 4, 224, 224], "float32"], ["TENSOR", [4, 32, 3, 3], "float32"], [2, 2], [1, 1, 1, 1], [1, 1], "NCHW", "NCHW4c", "float32"], {}], "config": {"index": 4784, "code_hash": null, "entity": [["tile_ic", "sp", [-1, 1, 4]], ["tile_oc", "sp", [-1, 1]], ["tile_ow", "sp", [-1, 28, 4]], ["tile_oh", "sp", [-1, 2, 14]]]}, "result": [[0.0003681632953367876], 0, 2.009398937225342, 1615377332.5013306], "version": 0.2, "tvm_version": "0.8.dev0"}
{"input": ["opencl -keys=mali,opencl,gpu -device=mali -max_num_threads=256", "conv2d_NCHWc_io.mali", [["TENSOR", [1, 4, 224, 224], "float32"], ["TENSOR", [4, 32, 3, 3], "float32"], [2, 2], [1, 1, 1, 1], [1, 1], "NCHW", "NCHW4c", "float32"], {}], "config": {"index": 1485, "code_hash": null, "entity": [["tile_ic", "sp", [-1, 1, 4]], ["tile_oc", "sp", [-1, 2]], ["tile_ow", "sp", [-1, 7, 16]], ["tile_oh", "sp", [-1, 14, 2]]]}, "result": [[0.00037675231239935584], 0, 2.053341865539551, 1615377334.0251062], "version": 0.2, "tvm_version": "0.8.dev0"}
{"input": ["opencl -keys=mali,opencl,gpu -device=mali -max_num_threads=256", "conv2d_NCHWc_io.mali", [["TENSOR", [1, 4, 224, 224], "float32"], ["TENSOR", [4, 32, 3, 3], "float32"], [2, 2], [1, 1, 1, 1], [1, 1], "NCHW", "NCHW4c", "float32"], {}], "config": {"index": 731, "code_hash": null, "entity": [["tile_ic", "sp", [-1, 1, 4]], ["tile_oc", "sp", [-1, 8]], ["tile_ow", "sp", [-1, 2, 4]], ["tile_oh", "sp", [-1, 2, 2]]]}, "result": [[0.00037090724212271973], 0, 1.9953382015228271, 1615377335.4722733], "version": 0.2, "tvm_version": "0.8.dev0"}
{"input": ["opencl -keys=mali,opencl,gpu -device=mali -max_num_threads=256", "conv2d_NCHWc_io.mali", [["TENSOR", [1, 4, 224, 224], "float32"], ["TENSOR", [4, 32, 3, 3], "float32"], [2, 2], [1, 1, 1, 1], [1, 1], "NCHW", "NCHW4c", "float32"], {}], "config": {"index": 1431, "code_hash": null, "entity": [["tile_ic", "sp", [-1, 1, 4]], ["tile_oc", "sp", [-1, 8]], ["tile_ow", "sp", [-1, 1, 8]], ["tile_oh", "sp", [-1, 14, 2]]]}, "result": [[0.00037815559961315283], 0, 1.930706262588501, 1615377336.8876748], "version": 0.2, "tvm_version": "0.8.dev0"}
{"input": ["opencl -keys=mali,opencl,gpu -device=mali -max_num_threads=256", "conv2d_NCHWc_io.mali", [["TENSOR", [1, 4, 224, 224], "float32"], ["TENSOR", [4, 32, 3, 3], "float32"], [2, 2], [1, 1, 1, 1], [1, 1], "NCHW", "NCHW4c", "float32"], {}], "config": {"index": 4671, "code_hash": null, "entity": [["tile_ic", "sp", [-1, 1, 4]], ["tile_oc", "sp", [-1, 8]], ["tile_ow", "sp", [-1, 2, 16]], ["tile_oh", "sp", [-1, 1, 14]]]}, "result": [[0.0005741626346153846], 0, 2.025942802429199, 1615377338.342924], "version": 0.2, "tvm_version": "0.8.dev0"}
{"input": ["opencl -keys=mali,opencl,gpu -device=mali -max_num_threads=256", "conv2d_NCHWc_io.mali", [["TENSOR", [1, 4, 224, 224], "float32"], ["TENSOR", [4, 32, 3, 3], "float32"], [2, 2], [1, 1, 1, 1], [1, 1], "NCHW", "NCHW4c", "float32"], {}], "config": {"index": 3366, "code_hash": null, "entity": [["tile_ic", "sp", [-1, 1, 4]], ["tile_oc", "sp", [-1, 4]], ["tile_ow", "sp", [-1, 2, 32]], ["tile_oh", "sp", [-1, 28, 4]]]}, "result": [[0.0017751756818181817], 0, 2.1002585887908936, 1615377339.869961], "version": 0.2, "tvm_version": "0.8.dev0"}
{"input": ["opencl -keys=mali,opencl,gpu -device=mali -max_num_threads=256", "conv2d_NCHWc_io.mali", [["TENSOR", [1, 4, 224, 224], "float32"], ["TENSOR", [4, 32, 3, 3], "float32"], [2, 2], [1, 1, 1, 1], [1, 1], "NCHW", "NCHW4c", "float32"], {}], "config": {"index": 1193, "code_hash": null, "entity": [["tile_ic", "sp", [-1, 1, 4]], ["tile_oc", "sp", [-1, 2]], ["tile_ow", "sp", [-1, 2, 2]], ["tile_oh", "sp", [-1, 8, 2]]]}, "result": [[0.0004106696247464503], 0, 1.9125957489013672, 1615377341.231596], "version": 0.2, "tvm_version": "0.8.dev0"}
{"input": ["opencl -keys=mali,opencl,gpu -device=mali -max_num_threads=256", "conv2d_NCHWc_io.mali", [["TENSOR", [1, 4, 224, 224], "float32"], ["TENSOR", [4, 32, 3, 3], "float32"], [2, 2], [1, 1, 1, 1], [1, 1], "NCHW", "NCHW4c", "float32"], {}], "config": {"index": 7051, "code_hash": null, "entity": [["tile_ic", "sp", [-1, 1, 4]], ["tile_oc", "sp", [-1, 8]], ["tile_ow", "sp", [-1, 2, 28]], ["tile_oh", "sp", [-1, 4, 28]]]}, "result": [[0.0019280785384615385], 0, 1.721790075302124, 1615377342.4325454], "version": 0.2, "tvm_version": "0.8.dev0"}
{"input": ["opencl -keys=mali,opencl,gpu -device=mali -max_num_threads=256", "conv2d_NCHWc_io.mali", [["TENSOR", [1, 4, 224, 224], "float32"], ["TENSOR", [4, 32, 3, 3], "float32"], [2, 2], [1, 1, 1, 1], [1, 1], "NCHW", "NCHW4c", "float32"], {}], "config": {"index": 1362, "code_hash": null, "entity": [["tile_ic", "sp", [-1, 1, 4]], ["tile_oc", "sp", [-1, 4]], ["tile_ow", "sp", [-1, 2, 2]], ["tile_oh", "sp", [-1, 14, 2]]]}, "result": [[0.00042094058659217877], 0, 1.9633896350860596, 1615377343.8504725], "version": 0.2, "tvm_version": "0.8.dev0"}
{"input": ["opencl -keys=mali,opencl,gpu -device=mali -max_num_threads=256", "conv2d_NCHWc_io.mali", [["TENSOR", [1, 4, 224, 224], "float32"], ["TENSOR", [4, 32, 3, 3], "float32"], [2, 2], [1, 1, 1, 1], [1, 1], "NCHW", "NCHW4c", "float32"], {}], "config": {"index": 2200, "code_hash": null, "entity": [["tile_ic", "sp", [-1, 1, 4]], ["tile_oc", "sp", [-1, 1]], ["tile_ow", "sp", [-1, 2, 2]], ["tile_oh", "sp", [-1, 1, 4]]]}, "result": [[0.0003807085522648084], 0, 1.9398999214172363, 1615377345.286526], "version": 0.2, "tvm_version": "0.8.dev0"}
{"input": ["opencl -keys=mali,opencl,gpu -device=mali -max_num_threads=256", "conv2d_NCHWc_io.mali", [["TENSOR", [1, 4, 224, 224], "float32"], ["TENSOR", [4, 32, 3, 3], "float32"], [2, 2], [1, 1, 1, 1], [1, 1], "NCHW", "NCHW4c", "float32"], {}], "config": {"index": 2276, "code_hash": null, "entity": [["tile_ic", "sp", [-1, 1, 4]], ["tile_oc", "sp", [-1, 1]], ["tile_ow", "sp", [-1, 4, 8]], ["tile_oh", "sp", [-1, 1, 4]]]}, "result": [[0.0005232613558139535], 0, 2.131014108657837, 1615377346.8356373], "version": 0.2, "tvm_version": "0.8.dev0"}
{"input": ["opencl -keys=mali,opencl,gpu -device=mali -max_num_threads=256", "conv2d_NCHWc_io.mali", [["TENSOR", [1, 4, 224, 224], "float32"], ["TENSOR", [4, 32, 3, 3], "float32"], [2, 2], [1, 1, 1, 1], [1, 1], "NCHW", "NCHW4c", "float32"], {}], "config": {"index": 1516, "code_hash": null, "entity": [["tile_ic", "sp", [-1, 1, 4]], ["tile_oc", "sp", [-1, 1]], ["tile_ow", "sp", [-1, 2, 32]], ["tile_oh", "sp", [-1, 16, 2]]]}, "result": [[0.000624867289017341], 0, 2.0947189331054688, 1615377348.3426602], "version": 0.2, "tvm_version": "0.8.dev0"}
{"input": ["opencl -keys=mali,opencl,gpu -device=mali -max_num_threads=256", "conv2d_NCHWc_io.mali", [["TENSOR", [1, 4, 224, 224], "float32"], ["TENSOR", [4, 32, 3, 3], "float32"], [2, 2], [1, 1, 1, 1], [1, 1], "NCHW", "NCHW4c", "float32"], {}], "config": {"index": 1011, "code_hash": null, "entity": [["tile_ic", "sp", [-1, 1, 4]], ["tile_oc", "sp", [-1, 8]], ["tile_ow", "sp", [-1, 1, 32]], ["tile_oh", "sp", [-1, 7, 2]]]}, "result": [[0.0004387500884210526], 0, 1.964266300201416, 1615377349.7531588], "version": 0.2, "tvm_version": "0.8.dev0"}
{"input": ["opencl -keys=mali,opencl,gpu -device=mali -max_num_threads=256", "conv2d_NCHWc_io.mali", [["TENSOR", [1, 4, 224, 224], "float32"], ["TENSOR", [4, 32, 3, 3], "float32"], [2, 2], [1, 1, 1, 1], [1, 1], "NCHW", "NCHW4c", "float32"], {}], "config": {"index": 4120, "code_hash": null, "entity": [["tile_ic", "sp", [-1, 1, 4]], ["tile_oc", "sp", [-1, 1]], ["tile_ow", "sp", [-1, 2, 8]], ["tile_oh", "sp", [-1, 7, 8]]]}, "result": [[0.0003628798076923077], 0, 1.967667818069458, 1615377351.1858718], "version": 0.2, "tvm_version": "0.8.dev0"}
{"input": ["opencl -keys=mali,opencl,gpu -device=mali -max_num_threads=256", "conv2d_NCHWc_io.mali", [["TENSOR", [1, 4, 224, 224], "float32"], ["TENSOR", [4, 32, 3, 3], "float32"], [2, 2], [1, 1, 1, 1], [1, 1], "NCHW", "NCHW4c", "float32"], {}], "config": {"index": 1677, "code_hash": null, "entity": [["tile_ic", "sp", [-1, 1, 4]], ["tile_oc", "sp", [-1, 2]], ["tile_ow", "sp", [-1, 4, 28]], ["tile_oh", "sp", [-1, 16, 2]]]}, "result": [[0.0006396759918918919], 0, 2.0763208866119385, 1615377352.7030034], "version": 0.2, "tvm_version": "0.8.dev0"}
{"input": ["opencl -keys=mali,opencl,gpu -device=mali -max_num_threads=256", "conv2d_NCHWc_io.mali", [["TENSOR", [1, 4, 224, 224], "float32"], ["TENSOR", [4, 32, 3, 3], "float32"], [2, 2], [1, 1, 1, 1], [1, 1], "NCHW", "NCHW4c", "float32"], {}], "config": {"index": 118, "code_hash": null, "entity": [["tile_ic", "sp", [-1, 1, 4]], ["tile_oc", "sp", [-1, 4]], ["tile_ow", "sp", [-1, 4, 14]], ["tile_oh", "sp", [-1, 1, 32]]]}, "result": [[0.0005137429693877552], 0, 1.9661622047424316, 1615377354.1157408], "version": 0.2, "tvm_version": "0.8.dev0"}
{"input": ["opencl -keys=mali,opencl,gpu -device=mali -max_num_threads=256", "depthwise_conv2d_NCHWc_io.mali", [["TENSOR", [1, 32, 112, 112], "float32"], ["TENSOR", [1, 32, 3, 3], "float32"], [16, 16], [1, 1, 1, 1], [1, 1], "NCHW", "NCHW4c", "float32"], {}], "config": {"index": 154, "code_hash": null, "entity": [["tile_ic", "ot", 4], ["tile_oc", "ot", 4], ["tile_cp", "sp", [-1, 4]], ["tile_hp", "sp", [-1, 1, 7]], ["tile_wp", "sp", [-1, 1, 1]], ["ann_spatial", "an", ["unroll", "unroll"]]]}, "result": [[1.3887349448610498e-05], 0, 1.5965137481689453, 1615377356.9253826], "version": 0.2, "tvm_version": "0.8.dev0"}
{"input": ["opencl -keys=mali,opencl,gpu -device=mali -max_num_threads=256", "depthwise_conv2d_NCHWc_io.mali", [["TENSOR", [1, 32, 112, 112], "float32"], ["TENSOR", [1, 32, 3, 3], "float32"], [16, 16], [1, 1, 1, 1], [1, 1], "NCHW", "NCHW4c", "float32"], {}], "config": {"index": 268, "code_hash": null, "entity": [["tile_ic", "ot", 4], ["tile_oc", "ot", 4], ["tile_cp", "sp", [-1, 1]], ["tile_hp", "sp", [-1, 7, 1]], ["tile_wp", "sp", [-1, 7, 1]], ["ann_spatial", "an", ["vec", "unroll"]]]}, "result": [[1.206912816229117e-05], 0, 1.5867881774902344, 1615377357.9837892], "version": 0.2, "tvm_version": "0.8.dev0"}
{"input": ["opencl -keys=mali,opencl,gpu -device=mali -max_num_threads=256", "depthwise_conv2d_NCHWc_io.mali", [["TENSOR", [1, 32, 112, 112], "float32"], ["TENSOR", [1, 32, 3, 3], "float32"], [16, 16], [1, 1, 1, 1], [1, 1], "NCHW", "NCHW4c", "float32"], {}], "config": {"index": 155, "code_hash": null, "entity": [["tile_ic", "ot", 4], ["tile_oc", "ot", 4], ["tile_cp", "sp", [-1, 8]], ["tile_hp", "sp", [-1, 1, 7]], ["tile_wp", "sp", [-1, 1, 1]], ["ann_spatial", "an", ["unroll", "unroll"]]]}, "result": [[1.2710414438988907e-05], 0, 1.8794047832489014, 1615377359.347255], "version": 0.2, "tvm_version": "0.8.dev0"}
{"input": ["opencl -keys=mali,opencl,gpu -device=mali -max_num_threads=256", "depthwise_conv2d_NCHWc_io.mali", [["TENSOR", [1, 32, 112, 112], "float32"], ["TENSOR", [1, 32, 3, 3], "float32"], [16, 16], [1, 1, 1, 1], [1, 1], "NCHW", "NCHW4c", "float32"], {}], "config": {"index": 271, "code_hash": null, "entity": [["tile_ic", "ot", 4], ["tile_oc", "ot", 4], ["tile_cp", "sp", [-1, 8]], ["tile_hp", "sp", [-1, 7, 1]], ["tile_wp", "sp", [-1, 7, 1]], ["ann_spatial", "an", ["vec", "unroll"]]]}, "result": [[7.247559242813741e-06], 0, 1.755342721939087, 1615377360.6207693], "version": 0.2, "tvm_version": "0.8.dev0"}
{"input": ["opencl -keys=mali,opencl,gpu -device=mali -max_num_threads=256", "depthwise_conv2d_NCHWc_io.mali", [["TENSOR", [1, 32, 112, 112], "float32"], ["TENSOR", [1, 32, 3, 3], "float32"], [16, 16], [1, 1, 1, 1], [1, 1], "NCHW", "NCHW4c", "float32"], {}], "config": {"index": 63, "code_hash": null, "entity": [["tile_ic", "ot", 4], ["tile_oc", "ot", 4], ["tile_cp", "sp", [-1, 8]], ["tile_hp", "sp", [-1, 1, 1]], ["tile_wp", "sp", [-1, 1, 7]], ["ann_spatial", "an", ["none", "unroll"]]]}, "result": [[1.867884442836469e-05], 0, 1.6757073402404785, 1615377361.780376], "version": 0.2, "tvm_version": "0.8.dev0"}
{"input": ["opencl -keys=mali,opencl,gpu -device=mali -max_num_threads=256", "depthwise_conv2d_NCHWc_io.mali", [["TENSOR", [1, 32, 112, 112], "float32"], ["TENSOR", [1, 32, 3, 3], "float32"], [16, 16], [1, 1, 1, 1], [1, 1], "NCHW", "NCHW4c", "float32"], {}], "config": {"index": 166, "code_hash": null, "entity": [["tile_ic", "ot", 4], ["tile_oc", "ot", 4], ["tile_cp", "sp", [-1, 4]], ["tile_hp", "sp", [-1, 1, 7]], ["tile_wp", "sp", [-1, 7, 1]], ["ann_spatial", "an", ["unroll", "unroll"]]]}, "result": [[1.0789058224985869e-05], 0, 1.610280990600586, 1615377362.8656282], "version": 0.2, "tvm_version": "0.8.dev0"}
{"input": ["opencl -keys=mali,opencl,gpu -device=mali -max_num_threads=256", "depthwise_conv2d_NCHWc_io.mali", [["TENSOR", [1, 32, 112, 112], "float32"], ["TENSOR", [1, 32, 3, 3], "float32"], [16, 16], [1, 1, 1, 1], [1, 1], "NCHW", "NCHW4c", "float32"], {}], "config": {"index": 204, "code_hash": null, "entity": [["tile_ic", "ot", 4], ["tile_oc", "ot", 4], ["tile_cp", "sp", [-1, 1]], ["tile_hp", "sp", [-1, 1, 1]], ["tile_wp", "sp", [-1, 1, 7]], ["ann_spatial", "an", ["unroll", "vec"]]]}, "result": [[2.0370269074675325e-05], 0, 1.5531988143920898, 1615377363.8999538], "version": 0.2, "tvm_version": "0.8.dev0"}
{"input": ["opencl -keys=mali,opencl,gpu -device=mali -max_num_threads=256", "depthwise_conv2d_NCHWc_io.mali", [["TENSOR", [1, 32, 112, 112], "float32"], ["TENSOR", [1, 32, 3, 3], "float32"], [16, 16], [1, 1, 1, 1], [1, 1], "NCHW", "NCHW4c", "float32"], {}], "config": {"index": 53, "code_hash": null, "entity": [["tile_ic", "ot", 4], ["tile_oc", "ot", 4], ["tile_cp", "sp", [-1, 2]], ["tile_hp", "sp", [-1, 7, 1]], ["tile_wp", "sp", [-1, 7, 1]], ["ann_spatial", "an", ["none", "unroll"]]]}, "result": [[1.1643746972351283e-05], 0, 1.8955707550048828, 1615377365.294962], "version": 0.2, "tvm_version": "0.8.dev0"}
{"input": ["opencl -keys=mali,opencl,gpu -device=mali -max_num_threads=256", "depthwise_conv2d_NCHWc_io.mali", [["TENSOR", [1, 32, 112, 112], "float32"], ["TENSOR", [1, 32, 3, 3], "float32"], [16, 16], [1, 1, 1, 1], [1, 1], "NCHW", "NCHW4c", "float32"], {}], "config": {"index": 43, "code_hash": null, "entity": [["tile_ic", "ot", 4], ["tile_oc", "ot", 4], ["tile_cp", "sp", [-1, 8]], ["tile_hp", "sp", [-1, 7, 1]], ["tile_wp", "sp", [-1, 1, 1]], ["ann_spatial", "an", ["none", "unroll"]]]}, "result": [[1.4582620754605921e-05], 0, 2.027040958404541, 1615377366.82828], "version": 0.2, "tvm_version": "0.8.dev0"}
{"input": ["opencl -keys=mali,opencl,gpu -device=mali -max_num_threads=256", "depthwise_conv2d_NCHWc_io.mali", [["TENSOR", [1, 32, 112, 112], "float32"], ["TENSOR", [1, 32, 3, 3], "float32"], [16, 16], [1, 1, 1, 1], [1, 1], "NCHW", "NCHW4c", "float32"], {}], "config": {"index": 30, "code_hash": null, "entity": [["tile_ic", "ot", 4], ["tile_oc", "ot", 4], ["tile_cp", "sp", [-1, 4]], ["tile_hp", "sp", [-1, 7, 1]], ["tile_wp", "sp", [-1, 1, 7]], ["ann_spatial", "an", ["none", "none"]]]}, "result": [[1.9749207834888917e-05], 0, 1.631789207458496, 1615377367.9243233], "version": 0.2, "tvm_version": "0.8.dev0"}
{"input": ["opencl -keys=mali,opencl,gpu -device=mali -max_num_threads=256", "depthwise_conv2d_NCHWc_io.mali", [["TENSOR", [1, 32, 112, 112], "float32"], ["TENSOR", [1, 32, 3, 3], "float32"], [16, 16], [1, 1, 1, 1], [1, 1], "NCHW", "NCHW4c", "float32"], {}], "config": {"index": 191, "code_hash": null, "entity": [["tile_ic", "ot", 4], ["tile_oc", "ot", 4], ["tile_cp", "sp", [-1, 8]], ["tile_hp", "sp", [-1, 1, 7]], ["tile_wp", "sp", [-1, 1, 1]], ["ann_spatial", "an", ["unroll", "vec"]]]}, "result": [[1.2855170694736842e-05], 0, 1.520197868347168, 1615377368.95373], "version": 0.2, "tvm_version": "0.8.dev0"}
{"input": ["opencl -keys=mali,opencl,gpu -device=mali -max_num_threads=256", "depthwise_conv2d_NCHWc_io.mali", [["TENSOR", [1, 32, 112, 112], "float32"], ["TENSOR", [1, 32, 3, 3], "float32"], [16, 16], [1, 1, 1, 1], [1, 1], "NCHW", "NCHW4c", "float32"], {}], "config": {"index": 104, "code_hash": null, "entity": [["tile_ic", "ot", 4], ["tile_oc", "ot", 4], ["tile_cp", "sp", [-1, 1]], ["tile_hp", "sp", [-1, 1, 7]], ["tile_wp", "sp", [-1, 1, 7]], ["ann_spatial", "an", ["none", "vec"]]]}, "result": [[1.764232487782174e-05], 0, 1.5541086196899414, 1615377370.0178418], "version": 0.2, "tvm_version": "0.8.dev0"}
{"input": ["opencl -keys=mali,opencl,gpu -device=mali -max_num_threads=256", "depthwise_conv2d_NCHWc_io.mali", [["TENSOR", [1, 32, 112, 112], "float32"], ["TENSOR", [1, 32, 3, 3], "float32"], [16, 16], [1, 1, 1, 1], [1, 1], "NCHW", "NCHW4c", "float32"], {}], "config": {"index": 152, "code_hash": null, "entity": [["tile_ic", "ot", 4], ["tile_oc", "ot", 4], ["tile_cp", "sp", [-1, 1]], ["tile_hp", "sp", [-1, 1, 7]], ["tile_wp", "sp", [-1, 1, 1]], ["ann_spatial", "an", ["unroll", "unroll"]]]}, "result": [[1.652777850446915e-05], 0, 1.5665841102600098, 1615377371.0858421], "version": 0.2, "tvm_version": "0.8.dev0"}
{"input": ["opencl -keys=mali,opencl,gpu -device=mali -max_num_threads=256", "depthwise_conv2d_NCHWc_io.mali", [["TENSOR", [1, 32, 112, 112], "float32"], ["TENSOR", [1, 32, 3, 3], "float32"], [16, 16], [1, 1, 1, 1], [1, 1], "NCHW", "NCHW4c", "float32"], {}], "config": {"index": 213, "code_hash": null, "entity": [["tile_ic", "ot", 4], ["tile_oc", "ot", 4], ["tile_cp", "sp", [-1, 2]], ["tile_hp", "sp", [-1, 1, 7]], ["tile_wp", "sp", [-1, 1, 7]], ["ann_spatial", "an", ["unroll", "vec"]]]}, "result": [[1.802213497005988e-05], 0, 1.6365606784820557, 1615377372.2178233], "version": 0.2, "tvm_version": "0.8.dev0"}
{"input": ["opencl -keys=mali,opencl,gpu -device=mali -max_num_threads=256", "depthwise_conv2d_NCHWc_io.mali", [["TENSOR", [1, 32, 112, 112], "float32"], ["TENSOR", [1, 32, 3, 3], "float32"], [16, 16], [1, 1, 1, 1], [1, 1], "NCHW", "NCHW4c", "float32"], {}], "config": {"index": 20, "code_hash": null, "entity": [["tile_ic", "ot", 4], ["tile_oc", "ot", 4], ["tile_cp", "sp", [-1, 1]], ["tile_hp", "sp", [-1, 1, 7]], ["tile_wp", "sp", [-1, 7, 1]], ["ann_spatial", "an", ["none", "none"]]]}, "result": [[1.216210935553008e-05], 0, 1.9861981868743896, 1615377373.7039368], "version": 0.2, "tvm_version": "0.8.dev0"}
{"input": ["opencl -keys=mali,opencl,gpu -device=mali -max_num_threads=256", "depthwise_conv2d_NCHWc_io.mali", [["TENSOR", [1, 32, 112, 112], "float32"], ["TENSOR", [1, 32, 3, 3], "float32"], [16, 16], [1, 1, 1, 1], [1, 1], "NCHW", "NCHW4c", "float32"], {}], "config": {"index": 202, "code_hash": null, "entity": [["tile_ic", "ot", 4], ["tile_oc", "ot", 4], ["tile_cp", "sp", [-1, 4]], ["tile_hp", "sp", [-1, 1, 7]], ["tile_wp", "sp", [-1, 7, 1]], ["ann_spatial", "an", ["unroll", "vec"]]]}, "result": [[1.09376884255931e-05], 0, 1.592780351638794, 1615377374.7694695], "version": 0.2, "tvm_version": "0.8.dev0"}
{"input": ["opencl -keys=mali,opencl,gpu -device=mali -max_num_threads=256", "depthwise_conv2d_NCHWc_io.mali", [["TENSOR", [1, 32, 112, 112], "float32"], ["TENSOR", [1, 32, 3, 3], "float32"], [16, 16], [1, 1, 1, 1], [1, 1], "NCHW", "NCHW4c", "float32"], {}], "config": {"index": 279, "code_hash": null, "entity": [["tile_ic", "ot", 4], ["tile_oc", "ot", 4], ["tile_cp", "sp", [-1, 8]], ["tile_hp", "sp", [-1, 1, 1]], ["tile_wp", "sp", [-1, 1, 7]], ["ann_spatial", "an", ["vec", "unroll"]]]}, "result": [[1.926328893785139e-05], 0, 1.9640817642211914, 1615377376.963018], "version": 0.2, "tvm_version": "0.8.dev0"}
{"input": ["opencl -keys=mali,opencl,gpu -device=mali -max_num_threads=256", "depthwise_conv2d_NCHWc_io.mali", [["TENSOR", [1, 32, 112, 112], "float32"], ["TENSOR", [1, 32, 3, 3], "float32"], [16, 16], [1, 1, 1, 1], [1, 1], "NCHW", "NCHW4c", "float32"], {}], "config": {"index": 8, "code_hash": null, "entity": [["tile_ic", "ot", 4], ["tile_oc", "ot", 4], ["tile_cp", "sp", [-1, 1]], ["tile_hp", "sp", [-1, 1, 7]], ["tile_wp", "sp", [-1, 1, 1]], ["ann_spatial", "an", ["none", "none"]]]}, "result": [[1.6857390215797193e-05], 0, 1.6023247241973877, 1615377378.0943172], "version": 0.2, "tvm_version": "0.8.dev0"}
{"input": ["opencl -keys=mali,opencl,gpu -device=mali -max_num_threads=256", "depthwise_conv2d_NCHWc_io.mali", [["TENSOR", [1, 32, 112, 112], "float32"], ["TENSOR", [1, 32, 3, 3], "float32"], [16, 16], [1, 1, 1, 1], [1, 1], "NCHW", "NCHW4c", "float32"], {}], "config": {"index": 276, "code_hash": null, "entity": [["tile_ic", "ot", 4], ["tile_oc", "ot", 4], ["tile_cp", "sp", [-1, 1]], ["tile_hp", "sp", [-1, 1, 1]], ["tile_wp", "sp", [-1, 1, 7]], ["ann_spatial", "an", ["vec", "unroll"]]]}, "result": [[2.045686760637597e-05], 0, 1.5305862426757812, 1615377379.1489663], "version": 0.2, "tvm_version": "0.8.dev0"}
{"input": ["opencl -keys=mali,opencl,gpu -device=mali -max_num_threads=256", "depthwise_conv2d_NCHWc_io.mali", [["TENSOR", [1, 32, 112, 112], "float32"], ["TENSOR", [1, 32, 3, 3], "float32"], [16, 16], [1, 1, 1, 1], [1, 1], "NCHW", "NCHW4c", "float32"], {}], "config": {"index": 156, "code_hash": null, "entity": [["tile_ic", "ot", 4], ["tile_oc", "ot", 4], ["tile_cp", "sp", [-1, 1]], ["tile_hp", "sp", [-1, 1, 1]], ["tile_wp", "sp", [-1, 7, 1]], ["ann_spatial", "an", ["unroll", "unroll"]]]}, "result": [[1.6508361029101642e-05], 0, 1.5347800254821777, 1615377380.2131093], "version": 0.2, "tvm_version": "0.8.dev0"}
{"input": ["opencl -keys=mali,opencl,gpu -device=mali -max_num_threads=256", "depthwise_conv2d_NCHWc_io.mali", [["TENSOR", [1, 32, 112, 112], "float32"], ["TENSOR", [1, 32, 3, 3], "float32"], [16, 16], [1, 1, 1, 1], [1, 1], "NCHW", "NCHW4c", "float32"], {}], "config": {"index": 34, "code_hash": null, "entity": [["tile_ic", "ot", 4], ["tile_oc", "ot", 4], ["tile_cp", "sp", [-1, 4]], ["tile_hp", "sp", [-1, 1, 7]], ["tile_wp", "sp", [-1, 1, 7]], ["ann_spatial", "an", ["none", "none"]]]}, "result": [[2.016337721992255e-05], 0, 1.9048686027526855, 1615377381.640315], "version": 0.2, "tvm_version": "0.8.dev0"}
{"input": ["opencl -keys=mali,opencl,gpu -device=mali -max_num_threads=256", "depthwise_conv2d_NCHWc_io.mali", [["TENSOR", [1, 32, 112, 112], "float32"], ["TENSOR", [1, 32, 3, 3], "float32"], [16, 16], [1, 1, 1, 1], [1, 1], "NCHW", "NCHW4c", "float32"], {}], "config": {"index": 207, "code_hash": null, "entity": [["tile_ic", "ot", 4], ["tile_oc", "ot", 4], ["tile_cp", "sp", [-1, 8]], ["tile_hp", "sp", [-1, 1, 1]], ["tile_wp", "sp", [-1, 1, 7]], ["ann_spatial", "an", ["unroll", "vec"]]]}, "result": [[1.881111336461329e-05], 0, 1.9521338939666748, 1615377383.1168666], "version": 0.2, "tvm_version": "0.8.dev0"}
{"input": ["opencl -keys=mali,opencl,gpu -device=mali -max_num_threads=256", "depthwise_conv2d_NCHWc_io.mali", [["TENSOR", [1, 32, 112, 112], "float32"], ["TENSOR", [1, 32, 3, 3], "float32"], [16, 16], [1, 1, 1, 1], [1, 1], "NCHW", "NCHW4c", "float32"], {}], "config": {"index": 190, "code_hash": null, "entity": [["tile_ic", "ot", 4], ["tile_oc", "ot", 4], ["tile_cp", "sp", [-1, 4]], ["tile_hp", "sp", [-1, 1, 7]], ["tile_wp", "sp", [-1, 1, 1]], ["ann_spatial", "an", ["unroll", "vec"]]]}, "result": [[1.390591346242085e-05], 0, 1.5246939659118652, 1615377384.1916168], "version": 0.2, "tvm_version": "0.8.dev0"}
{"input": ["opencl -keys=mali,opencl,gpu -device=mali -max_num_threads=256", "depthwise_conv2d_NCHWc_io.mali", [["TENSOR", [1, 32, 112, 112], "float32"], ["TENSOR", [1, 32, 3, 3], "float32"], [16, 16], [1, 1, 1, 1], [1, 1], "NCHW", "NCHW4c", "float32"], {}], "config": {"index": 123, "code_hash": null, "entity": [["tile_ic", "ot", 4], ["tile_oc", "ot", 4], ["tile_cp", "sp", [-1, 8]], ["tile_hp", "sp", [-1, 1, 1]], ["tile_wp", "sp", [-1, 7, 1]], ["ann_spatial", "an", ["unroll", "none"]]]}, "result": [[1.2915735641963755e-05], 0, 1.5687968730926514, 1615377385.2813056], "version": 0.2, "tvm_version": "0.8.dev0"}
{"input": ["opencl -keys=mali,opencl,gpu -device=mali -max_num_threads=256", "depthwise_conv2d_NCHWc_io.mali", [["TENSOR", [1, 32, 112, 112], "float32"], ["TENSOR", [1, 32, 3, 3], "float32"], [16, 16], [1, 1, 1, 1], [1, 1], "NCHW", "NCHW4c", "float32"], {}], "config": {"index": 179, "code_hash": null, "entity": [["tile_ic", "ot", 4], ["tile_oc", "ot", 4], ["tile_cp", "sp", [-1, 8]], ["tile_hp", "sp", [-1, 1, 7]], ["tile_wp", "sp", [-1, 1, 7]], ["ann_spatial", "an", ["unroll", "unroll"]]]}, "result": [[1.735443736488793e-05], 0, 1.802631139755249, 1615377386.618092], "version": 0.2, "tvm_version": "0.8.dev0"}
{"input": ["opencl -keys=mali,opencl,gpu -device=mali -max_num_threads=256", "depthwise_conv2d_NCHWc_io.mali", [["TENSOR", [1, 32, 112, 112], "float32"], ["TENSOR", [1, 32, 3, 3], "float32"], [16, 16], [1, 1, 1, 1], [1, 1], "NCHW", "NCHW4c", "float32"], {}], "config": {"index": 234, "code_hash": null, "entity": [["tile_ic", "ot", 4], ["tile_oc", "ot", 4], ["tile_cp", "sp", [-1, 4]], ["tile_hp", "sp", [-1, 7, 1]], ["tile_wp", "sp", [-1, 7, 1]], ["ann_spatial", "an", ["vec", "none"]]]}, "result": [[1.0848697609998067e-05], 0, 1.5825707912445068, 1615377387.7585967], "version": 0.2, "tvm_version": "0.8.dev0"}
{"input": ["opencl -keys=mali,opencl,gpu -device=mali -max_num_threads=256", "depthwise_conv2d_NCHWc_io.mali", [["TENSOR", [1, 32, 112, 112], "float32"], ["TENSOR", [1, 32, 3, 3], "float32"], [16, 16], [1, 1, 1, 1], [1, 1], "NCHW", "NCHW4c", "float32"], {}], "config": {"index": 1, "code_hash": null, "entity": [["tile_ic", "ot", 4], ["tile_oc", "ot", 4], ["tile_cp", "sp", [-1, 2]], ["tile_hp", "sp", [-1, 1, 1]], ["tile_wp", "sp", [-1, 1, 1]], ["ann_spatial", "an", ["none", "none"]]]}, "result": [[2.357795539625647e-05], 0, 1.7171828746795654, 1615377389.0267286], "version": 0.2, "tvm_version": "0.8.dev0"}
{"input": ["opencl -keys=mali,opencl,gpu -device=mali -max_num_threads=256", "depthwise_conv2d_NCHWc_io.mali", [["TENSOR", [1, 32, 112, 112], "float32"], ["TENSOR", [1, 32, 3, 3], "float32"], [16, 16], [1, 1, 1, 1], [1, 1], "NCHW", "NCHW4c", "float32"], {}], "config": {"index": 242, "code_hash": null, "entity": [["tile_ic", "ot", 4], ["tile_oc", "ot", 4], ["tile_cp", "sp", [-1, 4]], ["tile_hp", "sp", [-1, 1, 1]], ["tile_wp", "sp", [-1, 1, 7]], ["ann_spatial", "an", ["vec", "none"]]]}, "result": [[1.9011676246407597e-05], 0, 1.585437536239624, 1615377390.1338], "version": 0.2, "tvm_version": "0.8.dev0"}
{"input": ["opencl -keys=mali,opencl,gpu -device=mali -max_num_threads=256", "depthwise_conv2d_NCHWc_io.mali", [["TENSOR", [1, 32, 112, 112], "float32"], ["TENSOR", [1, 32, 3, 3], "float32"], [16, 16], [1, 1, 1, 1], [1, 1], "NCHW", "NCHW4c", "float32"], {}], "config": {"index": 54, "code_hash": null, "entity": [["tile_ic", "ot", 4], ["tile_oc", "ot", 4], ["tile_cp", "sp", [-1, 4]], ["tile_hp", "sp", [-1, 7, 1]], ["tile_wp", "sp", [-1, 7, 1]], ["ann_spatial", "an", ["none", "unroll"]]]}, "result": [[1.0827718623763757e-05], 0, 1.547471046447754, 1615377391.1915228], "version": 0.2, "tvm_version": "0.8.dev0"}
{"input": ["opencl -keys=mali,opencl,gpu -device=mali -max_num_threads=256", "depthwise_conv2d_NCHWc_io.mali", [["TENSOR", [1, 32, 112, 112], "float32"], ["TENSOR", [1, 32, 3, 3], "float32"], [16, 16], [1, 1, 1, 1], [1, 1], "NCHW", "NCHW4c", "float32"], {}], "config": {"index": 17, "code_hash": null, "entity": [["tile_ic", "ot", 4], ["tile_oc", "ot", 4], ["tile_cp", "sp", [-1, 2]], ["tile_hp", "sp", [-1, 7, 1]], ["tile_wp", "sp", [-1, 7, 1]], ["ann_spatial", "an", ["none", "none"]]]}, "result": [[1.1615325678989061e-05], 0, 1.9970202445983887, 1615377392.7092047], "version": 0.2, "tvm_version": "0.8.dev0"}
{"input": ["opencl -keys=mali,opencl,gpu -device=mali -max_num_threads=256", "depthwise_conv2d_NCHWc_io.mali", [["TENSOR", [1, 32, 112, 112], "float32"], ["TENSOR", [1, 32, 3, 3], "float32"], [16, 16], [1, 1, 1, 1], [1, 1], "NCHW", "NCHW4c", "float32"], {}], "config": {"index": 266, "code_hash": null, "entity": [["tile_ic", "ot", 4], ["tile_oc", "ot", 4], ["tile_cp", "sp", [-1, 4]], ["tile_hp", "sp", [-1, 1, 1]], ["tile_wp", "sp", [-1, 7, 1]], ["ann_spatial", "an", ["vec", "unroll"]]]}, "result": [[1.4138273357360687e-05], 0, 1.55485200881958, 1615377393.80425], "version": 0.2, "tvm_version": "0.8.dev0"}
{"input": ["opencl -keys=mali,opencl,gpu -device=mali -max_num_threads=256", "depthwise_conv2d_NCHWc_io.mali", [["TENSOR", [1, 32, 112, 112], "float32"], ["TENSOR", [1, 32, 3, 3], "float32"], [16, 16], [1, 1, 1, 1], [1, 1], "NCHW", "NCHW4c", "float32"], {}], "config": {"index": 27, "code_hash": null, "entity": [["tile_ic", "ot", 4], ["tile_oc", "ot", 4], ["tile_cp", "sp", [-1, 8]], ["tile_hp", "sp", [-1, 1, 1]], ["tile_wp", "sp", [-1, 1, 7]], ["ann_spatial", "an", ["none", "none"]]]}, "result": [[1.867196086105675e-05], 0, 1.5860011577606201, 1615377394.9214294], "version": 0.2, "tvm_version": "0.8.dev0"}
{"input": ["opencl -keys=mali,opencl,gpu -device=mali -max_num_threads=256", "conv2d_NCHWc_io.mali", [["TENSOR", [1, 32, 7, 7], "float32"], ["TENSOR", [32, 64, 1, 1], "float32"], [1, 1], [0, 0, 0, 0], [1, 1], "NCHW", "NCHW4c", "float32"], {}], "config": {"index": 443, "code_hash": null, "entity": [["tile_ic", "sp", [-1, 8, 4]], ["tile_oc", "sp", [-1, 16]], ["tile_ow", "sp", [-1, 1, 4]], ["tile_oh", "sp", [-1, 1, 4]]]}, "result": [[3.099507974398893e-05], 0, 1.7132937908172607, 1615377398.13014], "version": 0.2, "tvm_version": "0.8.dev0"}
{"input": ["opencl -keys=mali,opencl,gpu -device=mali -max_num_threads=256", "conv2d_NCHWc_io.mali", [["TENSOR", [1, 32, 7, 7], "float32"], ["TENSOR", [32, 64, 1, 1], "float32"], [1, 1], [0, 0, 0, 0], [1, 1], "NCHW", "NCHW4c", "float32"], {}], "config": {"index": 420, "code_hash": null, "entity": [["tile_ic", "sp", [-1, 1, 4]], ["tile_oc", "sp", [-1, 4]], ["tile_ow", "sp", [-1, 1, 4]], ["tile_oh", "sp", [-1, 1, 4]]]}, "result": [[2.6118492135121195e-05], 0, 1.7220935821533203, 1615377399.3361485], "version": 0.2, "tvm_version": "0.8.dev0"}
{"input": ["opencl -keys=mali,opencl,gpu -device=mali -max_num_threads=256", "conv2d_NCHWc_io.mali", [["TENSOR", [1, 32, 7, 7], "float32"], ["TENSOR", [32, 64, 1, 1], "float32"], [1, 1], [0, 0, 0, 0], [1, 1], "NCHW", "NCHW4c", "float32"], {}], "config": {"index": 435, "code_hash": null, "entity": [["tile_ic", "sp", [-1, 2, 8]], ["tile_oc", "sp", [-1, 8]], ["tile_ow", "sp", [-1, 1, 4]], ["tile_oh", "sp", [-1, 1, 4]]]}, "result": [[2.8300582988980716e-05], 0, 1.7382724285125732, 1615377400.5487225], "version": 0.2, "tvm_version": "0.8.dev0"}
{"input": ["opencl -keys=mali,opencl,gpu -device=mali -max_num_threads=256", "conv2d_NCHWc_io.mali", [["TENSOR", [1, 32, 7, 7], "float32"], ["TENSOR", [32, 64, 1, 1], "float32"], [1, 1], [0, 0, 0, 0], [1, 1], "NCHW", "NCHW4c", "float32"], {}], "config": {"index": 221, "code_hash": null, "entity": [["tile_ic", "sp", [-1, 2, 4]], ["tile_oc", "sp", [-1, 4]], ["tile_ow", "sp", [-1, 2, 2]], ["tile_oh", "sp", [-1, 2, 2]]]}, "result": [[2.5415366859213953e-05], 0, 1.6915335655212402, 1615377401.7345383], "version": 0.2, "tvm_version": "0.8.dev0"}
{"input": ["opencl -keys=mali,opencl,gpu -device=mali -max_num_threads=256", "conv2d_NCHWc_io.mali", [["TENSOR", [1, 32, 7, 7], "float32"], ["TENSOR", [32, 64, 1, 1], "float32"], [1, 1], [0, 0, 0, 0], [1, 1], "NCHW", "NCHW4c", "float32"], {}], "config": {"index": 181, "code_hash": null, "entity": [["tile_ic", "sp", [-1, 2, 4]], ["tile_oc", "sp", [-1, 8]], ["tile_ow", "sp", [-1, 1, 2]], ["tile_oh", "sp", [-1, 2, 2]]]}, "result": [[2.3243074920485334e-05], 0, 1.7441825866699219, 1615377402.9735026], "version": 0.2, "tvm_version": "0.8.dev0"}
{"input": ["opencl -keys=mali,opencl,gpu -device=mali -max_num_threads=256", "conv2d_NCHWc_io.mali", [["TENSOR", [1, 32, 7, 7], "float32"], ["TENSOR", [32, 64, 1, 1], "float32"], [1, 1], [0, 0, 0, 0], [1, 1], "NCHW", "NCHW4c", "float32"], {}], "config": {"index": 253, "code_hash": null, "entity": [["tile_ic", "sp", [-1, 8, 4]], ["tile_oc", "sp", [-1, 1]], ["tile_ow", "sp", [-1, 1, 4]], ["tile_oh", "sp", [-1, 2, 2]]]}, "result": [[2.287428959276018e-05], 0, 1.5422987937927246, 1615377404.0125678], "version": 0.2, "tvm_version": "0.8.dev0"}
{"input": ["opencl -keys=mali,opencl,gpu -device=mali -max_num_threads=256", "conv2d_NCHWc_io.mali", [["TENSOR", [1, 32, 7, 7], "float32"], ["TENSOR", [32, 64, 1, 1], "float32"], [1, 1], [0, 0, 0, 0], [1, 1], "NCHW", "NCHW4c", "float32"], {}], "config": {"index": 402, "code_hash": null, "entity": [["tile_ic", "sp", [-1, 4, 4]], ["tile_oc", "sp", [-1, 1]], ["tile_ow", "sp", [-1, 1, 4]], ["tile_oh", "sp", [-1, 1, 4]]]}, "result": [[2.8913847108903866e-05], 0, 1.496847152709961, 1615377405.0078096], "version": 0.2, "tvm_version": "0.8.dev0"}
{"input": ["opencl -keys=mali,opencl,gpu -device=mali -max_num_threads=256", "conv2d_NCHWc_io.mali", [["TENSOR", [1, 32, 7, 7], "float32"], ["TENSOR", [32, 64, 1, 1], "float32"], [1, 1], [0, 0, 0, 0], [1, 1], "NCHW", "NCHW4c", "float32"], {}], "config": {"index": 375, "code_hash": null, "entity": [["tile_ic", "sp", [-1, 2, 8]], ["tile_oc", "sp", [-1, 4]], ["tile_ow", "sp", [-1, 2, 2]], ["tile_oh", "sp", [-1, 1, 4]]]}, "result": [[2.3011443037974685e-05], 0, 1.4713935852050781, 1615377405.9748995], "version": 0.2, "tvm_version": "0.8.dev0"}
{"input": ["opencl -keys=mali,opencl,gpu -device=mali -max_num_threads=256", "conv2d_NCHWc_io.mali", [["TENSOR", [1, 32, 7, 7], "float32"], ["TENSOR", [32, 64, 1, 1], "float32"], [1, 1], [0, 0, 0, 0], [1, 1], "NCHW", "NCHW4c", "float32"], {}], "config": {"index": 213, "code_hash": null, "entity": [["tile_ic", "sp", [-1, 8, 4]], ["tile_oc", "sp", [-1, 2]], ["tile_ow", "sp", [-1, 2, 2]], ["tile_oh", "sp", [-1, 2, 2]]]}, "result": [[2.454879822795006e-05], 0, 1.5632176399230957, 1615377407.04537], "version": 0.2, "tvm_version": "0.8.dev0"}
{"input": ["opencl -keys=mali,opencl,gpu -device=mali -max_num_threads=256", "conv2d_NCHWc_io.mali", [["TENSOR", [1, 32, 7, 7], "float32"], ["TENSOR", [32, 64, 1, 1], "float32"], [1, 1], [0, 0, 0, 0], [1, 1], "NCHW", "NCHW4c", "float32"], {}], "config": {"index": 258, "code_hash": null, "entity": [["tile_ic", "sp", [-1, 2, 16]], ["tile_oc", "sp", [-1, 1]], ["tile_ow", "sp", [-1, 1, 4]], ["tile_oh", "sp", [-1, 2, 2]]]}, "result": [[2.556699041533546e-05], 0, 1.6385481357574463, 1615377408.1905074], "version": 0.2, "tvm_version": "0.8.dev0"}
{"input": ["opencl -keys=mali,opencl,gpu -device=mali -max_num_threads=256", "conv2d_NCHWc_io.mali", [["TENSOR", [1, 32, 7, 7], "float32"], ["TENSOR", [32, 64, 1, 1], "float32"], [1, 1], [0, 0, 0, 0], [1, 1], "NCHW", "NCHW4c", "float32"], {}], "config": {"index": 239, "code_hash": null, "entity": [["tile_ic", "sp", [-1, 1, 32]], ["tile_oc", "sp", [-1, 8]], ["tile_ow", "sp", [-1, 2, 2]], ["tile_oh", "sp", [-1, 2, 2]]]}, "result": [[2.4107725953102568e-05], 0, 1.733539342880249, 1615377409.40488], "version": 0.2, "tvm_version": "0.8.dev0"}
{"input": ["opencl -keys=mali,opencl,gpu -device=mali -max_num_threads=256", "conv2d_NCHWc_io.mali", [["TENSOR", [1, 32, 7, 7], "float32"], ["TENSOR", [32, 64, 1, 1], "float32"], [1, 1], [0, 0, 0, 0], [1, 1], "NCHW", "NCHW4c", "float32"], {}], "config": {"index": 91, "code_hash": null, "entity": [["tile_ic", "sp", [-1, 2, 4]], ["tile_oc", "sp", [-1, 16]], ["tile_ow", "sp", [-1, 2, 2]], ["tile_oh", "sp", [-1, 1, 2]]]}, "result": [[2.3214922460227983e-05], 0, 1.5507259368896484, 1615377410.4659567], "version": 0.2, "tvm_version": "0.8.dev0"}
{"input": ["opencl -keys=mali,opencl,gpu -device=mali -max_num_threads=256", "conv2d_NCHWc_io.mali", [["TENSOR", [1, 32, 7, 7], "float32"], ["TENSOR", [32, 64, 1, 1], "float32"], [1, 1], [0, 0, 0, 0], [1, 1], "NCHW", "NCHW4c", "float32"], {}], "config": {"index": 236, "code_hash": null, "entity": [["tile_ic", "sp", [-1, 4, 8]], ["tile_oc", "sp", [-1, 8]], ["tile_ow", "sp", [-1, 2, 2]], ["tile_oh", "sp", [-1, 2, 2]]]}, "result": [[2.5293803258717835e-05], 0, 1.471224308013916, 1615377411.4183161], "version": 0.2, "tvm_version": "0.8.dev0"}
{"input": ["opencl -keys=mali,opencl,gpu -device=mali -max_num_threads=256", "conv2d_NCHWc_io.mali", [["TENSOR", [1, 32, 7, 7], "float32"], ["TENSOR", [32, 64, 1, 1], "float32"], [1, 1], [0, 0, 0, 0], [1, 1], "NCHW", "NCHW4c", "float32"], {}], "config": {"index": 35, "code_hash": null, "entity": [["tile_ic", "sp", [-1, 2, 8]], ["tile_oc", "sp", [-1, 8]], ["tile_ow", "sp", [-1, 1, 2]], ["tile_oh", "sp", [-1, 1, 2]]]}, "result": [[2.585504496100321e-05], 0, 1.588118076324463, 1615377412.4927678], "version": 0.2, "tvm_version": "0.8.dev0"}
{"input": ["opencl -keys=mali,opencl,gpu -device=mali -max_num_threads=256", "conv2d_NCHWc_io.mali", [["TENSOR", [1, 32, 7, 7], "float32"], ["TENSOR", [32, 64, 1, 1], "float32"], [1, 1], [0, 0, 0, 0], [1, 1], "NCHW", "NCHW4c", "float32"], {}], "config": {"index": 246, "code_hash": null, "entity": [["tile_ic", "sp", [-1, 4, 8]], ["tile_oc", "sp", [-1, 16]], ["tile_ow", "sp", [-1, 2, 2]], ["tile_oh", "sp", [-1, 2, 2]]]}, "result": [[2.8263954004408525e-05], 0, 1.584378719329834, 1615377413.568815], "version": 0.2, "tvm_version": "0.8.dev0"}
{"input": ["opencl -keys=mali,opencl,gpu -device=mali -max_num_threads=256", "conv2d_NCHWc_io.mali", [["TENSOR", [1, 32, 7, 7], "float32"], ["TENSOR", [32, 64, 1, 1], "float32"], [1, 1], [0, 0, 0, 0], [1, 1], "NCHW", "NCHW4c", "float32"], {}], "config": {"index": 269, "code_hash": null, "entity": [["tile_ic", "sp", [-1, 1, 32]], ["tile_oc", "sp", [-1, 2]], ["tile_ow", "sp", [-1, 1, 4]], ["tile_oh", "sp", [-1, 2, 2]]]}, "result": [[2.4665230454359394e-05], 0, 1.6311380863189697, 1615377414.722364], "version": 0.2, "tvm_version": "0.8.dev0"}
{"input": ["opencl -keys=mali,opencl,gpu -device=mali -max_num_threads=256", "conv2d_NCHWc_io.mali", [["TENSOR", [1, 32, 7, 7], "float32"], ["TENSOR", [32, 64, 1, 1], "float32"], [1, 1], [0, 0, 0, 0], [1, 1], "NCHW", "NCHW4c", "float32"], {}], "config": {"index": 322, "code_hash": null, "entity": [["tile_ic", "sp", [-1, 4, 4]], ["tile_oc", "sp", [-1, 4]], ["tile_ow", "sp", [-1, 1, 2]], ["tile_oh", "sp", [-1, 1, 4]]]}, "result": [[2.367441229034919e-05], 0, 1.6220829486846924, 1615377416.5683422], "version": 0.2, "tvm_version": "0.8.dev0"}
{"input": ["opencl -keys=mali,opencl,gpu -device=mali -max_num_threads=256", "conv2d_NCHWc_io.mali", [["TENSOR", [1, 32, 7, 7], "float32"], ["TENSOR", [32, 64, 1, 1], "float32"], [1, 1], [0, 0, 0, 0], [1, 1], "NCHW", "NCHW4c", "float32"], {}], "config": {"index": 3, "code_hash": null, "entity": [["tile_ic", "sp", [-1, 8, 4]], ["tile_oc", "sp", [-1, 1]], ["tile_ow", "sp", [-1, 1, 2]], ["tile_oh", "sp", [-1, 1, 2]]]}, "result": [[2.8882692272449603e-05], 0, 1.6190185546875, 1615377417.6621625], "version": 0.2, "tvm_version": "0.8.dev0"}
{"input": ["opencl -keys=mali,opencl,gpu -device=mali -max_num_threads=256", "conv2d_NCHWc_io.mali", [["TENSOR", [1, 32, 7, 7], "float32"], ["TENSOR", [32, 64, 1, 1], "float32"], [1, 1], [0, 0, 0, 0], [1, 1], "NCHW", "NCHW4c", "float32"], {}], "config": {"index": 27, "code_hash": null, "entity": [["tile_ic", "sp", [-1, 1, 16]], ["tile_oc", "sp", [-1, 4]], ["tile_ow", "sp", [-1, 1, 2]], ["tile_oh", "sp", [-1, 1, 2]]]}, "result": [[2.5807539825668767e-05], 0, 1.5635831356048584, 1615377418.7181396], "version": 0.2, "tvm_version": "0.8.dev0"}
{"input": ["opencl -keys=mali,opencl,gpu -device=mali -max_num_threads=256", "conv2d_NCHWc_io.mali", [["TENSOR", [1, 32, 7, 7], "float32"], ["TENSOR", [32, 64, 1, 1], "float32"], [1, 1], [0, 0, 0, 0], [1, 1], "NCHW", "NCHW4c", "float32"], {}], "config": {"index": 148, "code_hash": null, "entity": [["tile_ic", "sp", [-1, 2, 16]], ["tile_oc", "sp", [-1, 16]], ["tile_ow", "sp", [-1, 1, 4]], ["tile_oh", "sp", [-1, 1, 2]]]}, "result": [[2.516940631808279e-05], 0, 1.7166330814361572, 1615377419.9281971], "version": 0.2, "tvm_version": "0.8.dev0"}
{"input": ["opencl -keys=mali,opencl,gpu -device=mali -max_num_threads=256", "conv2d_NCHWc_io.mali", [["TENSOR", [1, 32, 7, 7], "float32"], ["TENSOR", [32, 64, 1, 1], "float32"], [1, 1], [0, 0, 0, 0], [1, 1], "NCHW", "NCHW4c", "float32"], {}], "config": {"index": 376, "code_hash": null, "entity": [["tile_ic", "sp", [-1, 4, 8]], ["tile_oc", "sp", [-1, 4]], ["tile_ow", "sp", [-1, 2, 2]], ["tile_oh", "sp", [-1, 1, 4]]]}, "result": [[2.4531457480862908e-05], 0, 1.5662424564361572, 1615377420.9898503], "version": 0.2, "tvm_version": "0.8.dev0"}
{"input": ["opencl -keys=mali,opencl,gpu -device=mali -max_num_threads=256", "conv2d_NCHWc_io.mali", [["TENSOR", [1, 32, 7, 7], "float32"], ["TENSOR", [32, 64, 1, 1], "float32"], [1, 1], [0, 0, 0, 0], [1, 1], "NCHW", "NCHW4c", "float32"], {}], "config": {"index": 314, "code_hash": null, "entity": [["tile_ic", "sp", [-1, 1, 8]], ["tile_oc", "sp", [-1, 2]], ["tile_ow", "sp", [-1, 1, 2]], ["tile_oh", "sp", [-1, 1, 4]]]}, "result": [[2.5533180544371074e-05], 0, 1.5234694480895996, 1615377422.0363328], "version": 0.2, "tvm_version": "0.8.dev0"}
{"input": ["opencl -keys=mali,opencl,gpu -device=mali -max_num_threads=256", "conv2d_NCHWc_io.mali", [["TENSOR", [1, 32, 7, 7], "float32"], ["TENSOR", [32, 64, 1, 1], "float32"], [1, 1], [0, 0, 0, 0], [1, 1], "NCHW", "NCHW4c", "float32"], {}], "config": {"index": 81, "code_hash": null, "entity": [["tile_ic", "sp", [-1, 2, 4]], ["tile_oc", "sp", [-1, 8]], ["tile_ow", "sp", [-1, 2, 2]], ["tile_oh", "sp", [-1, 1, 2]]]}, "result": [[2.2961119982981137e-05], 0, 1.4614064693450928, 1615377423.0013328], "version": 0.2, "tvm_version": "0.8.dev0"}
{"input": ["opencl -keys=mali,opencl,gpu -device=mali -max_num_threads=256", "conv2d_NCHWc_io.mali", [["TENSOR", [1, 32, 7, 7], "float32"], ["TENSOR", [32, 64, 1, 1], "float32"], [1, 1], [0, 0, 0, 0], [1, 1], "NCHW", "NCHW4c", "float32"], {}], "config": {"index": 287, "code_hash": null, "entity": [["tile_ic", "sp", [-1, 1, 16]], ["tile_oc", "sp", [-1, 8]], ["tile_ow", "sp", [-1, 1, 4]], ["tile_oh", "sp", [-1, 2, 2]]]}, "result": [[2.4259690374585112e-05], 0, 1.5604393482208252, 1615377424.050191], "version": 0.2, "tvm_version": "0.8.dev0"}
{"input": ["opencl -keys=mali,opencl,gpu -device=mali -max_num_threads=256", "conv2d_NCHWc_io.mali", [["TENSOR", [1, 32, 7, 7], "float32"], ["TENSOR", [32, 64, 1, 1], "float32"], [1, 1], [0, 0, 0, 0], [1, 1], "NCHW", "NCHW4c", "float32"], {}], "config": {"index": 186, "code_hash": null, "entity": [["tile_ic", "sp", [-1, 4, 8]], ["tile_oc", "sp", [-1, 8]], ["tile_ow", "sp", [-1, 1, 2]], ["tile_oh", "sp", [-1, 2, 2]]]}, "result": [[2.5415173472474286e-05], 0, 1.6188218593597412, 1615377425.173331], "version": 0.2, "tvm_version": "0.8.dev0"}
{"input": ["opencl -keys=mali,opencl,gpu -device=mali -max_num_threads=256", "conv2d_NCHWc_io.mali", [["TENSOR", [1, 32, 7, 7], "float32"], ["TENSOR", [32, 64, 1, 1], "float32"], [1, 1], [0, 0, 0, 0], [1, 1], "NCHW", "NCHW4c", "float32"], {}], "config": {"index": 68, "code_hash": null, "entity": [["tile_ic", "sp", [-1, 2, 16]], ["tile_oc", "sp", [-1, 2]], ["tile_ow", "sp", [-1, 2, 2]], ["tile_oh", "sp", [-1, 1, 2]]]}, "result": [[2.6126812020294003e-05], 0, 1.6098902225494385, 1615377426.2859395], "version": 0.2, "tvm_version": "0.8.dev0"}
{"input": ["opencl -keys=mali,opencl,gpu -device=mali -max_num_threads=256", "conv2d_NCHWc_io.mali", [["TENSOR", [1, 32, 7, 7], "float32"], ["TENSOR", [32, 64, 1, 1], "float32"], [1, 1], [0, 0, 0, 0], [1, 1], "NCHW", "NCHW4c", "float32"], {}], "config": {"index": 174, "code_hash": null, "entity": [["tile_ic", "sp", [-1, 1, 8]], ["tile_oc", "sp", [-1, 4]], ["tile_ow", "sp", [-1, 1, 2]], ["tile_oh", "sp", [-1, 2, 2]]]}, "result": [[2.7072612596057466e-05], 0, 1.5207326412200928, 1615377427.2803247], "version": 0.2, "tvm_version": "0.8.dev0"}
{"input": ["opencl -keys=mali,opencl,gpu -device=mali -max_num_threads=256", "conv2d_NCHWc_io.mali", [["TENSOR", [1, 32, 7, 7], "float32"], ["TENSOR", [32, 64, 1, 1], "float32"], [1, 1], [0, 0, 0, 0], [1, 1], "NCHW", "NCHW4c", "float32"], {}], "config": {"index": 25, "code_hash": null, "entity": [["tile_ic", "sp", [-1, 2, 8]], ["tile_oc", "sp", [-1, 4]], ["tile_ow", "sp", [-1, 1, 2]], ["tile_oh", "sp", [-1, 1, 2]]]}, "result": [[2.6328268241295186e-05], 0, 1.8070580959320068, 1615377428.5958555], "version": 0.2, "tvm_version": "0.8.dev0"}
{"input": ["opencl -keys=mali,opencl,gpu -device=mali -max_num_threads=256", "conv2d_NCHWc_io.mali", [["TENSOR", [1, 32, 7, 7], "float32"], ["TENSOR", [32, 64, 1, 1], "float32"], [1, 1], [0, 0, 0, 0], [1, 1], "NCHW", "NCHW4c", "float32"], {}], "config": {"index": 46, "code_hash": null, "entity": [["tile_ic", "sp", [-1, 4, 8]], ["tile_oc", "sp", [-1, 16]], ["tile_ow", "sp", [-1, 1, 2]], ["tile_oh", "sp", [-1, 1, 2]]]}, "result": [[2.4633598309784762e-05], 0, 1.6748335361480713, 1615377429.781672], "version": 0.2, "tvm_version": "0.8.dev0"}
{"input": ["opencl -keys=mali,opencl,gpu -device=mali -max_num_threads=256", "conv2d_NCHWc_io.mali", [["TENSOR", [1, 32, 7, 7], "float32"], ["TENSOR", [32, 64, 1, 1], "float32"], [1, 1], [0, 0, 0, 0], [1, 1], "NCHW", "NCHW4c", "float32"], {}], "config": {"index": 24, "code_hash": null, "entity": [["tile_ic", "sp", [-1, 1, 8]], ["tile_oc", "sp", [-1, 4]], ["tile_ow", "sp", [-1, 1, 2]], ["tile_oh", "sp", [-1, 1, 2]]]}, "result": [[2.7803093745312733e-05], 0, 1.6015982627868652, 1615377430.874758], "version": 0.2, "tvm_version": "0.8.dev0"}
{"input": ["opencl -keys=mali,opencl,gpu -device=mali -max_num_threads=256", "conv2d_NCHWc_io.mali", [["TENSOR", [1, 32, 7, 7], "float32"], ["TENSOR", [32, 64, 1, 1], "float32"], [1, 1], [0, 0, 0, 0], [1, 1], "NCHW", "NCHW4c", "float32"], {}], "config": {"index": 285, "code_hash": null, "entity": [["tile_ic", "sp", [-1, 2, 8]], ["tile_oc", "sp", [-1, 8]], ["tile_ow", "sp", [-1, 1, 4]], ["tile_oh", "sp", [-1, 2, 2]]]}, "result": [[2.3176769519953733e-05], 0, 1.6284618377685547, 1615377431.9785657], "version": 0.2, "tvm_version": "0.8.dev0"}
{"input": ["opencl -keys=mali,opencl,gpu -device=mali -max_num_threads=256", "conv2d_NCHWc_io.mali", [["TENSOR", [1, 32, 7, 7], "float32"], ["TENSOR", [32, 64, 1, 1], "float32"], [1, 1], [0, 0, 0, 0], [1, 1], "NCHW", "NCHW4c", "float32"], {}], "config": {"index": 178, "code_hash": null, "entity": [["tile_ic", "sp", [-1, 2, 16]], ["tile_oc", "sp", [-1, 4]], ["tile_ow", "sp", [-1, 1, 2]], ["tile_oh", "sp", [-1, 2, 2]]]}, "result": [[2.578894406856112e-05], 0, 1.5905232429504395, 1615377433.074893], "version": 0.2, "tvm_version": "0.8.dev0"}
