test_and_tune/bak/android.topinhw4c.log.tmp
{"input": ["opencl -keys=opencl,gpu -max_num_threads=256", "tutorial/conv2d_no_batching", [1, 40, 40, 512, 256, 1, 1, [1, 1], [0, 0]], {}], "config": {"index": 22904, "code_hash": null, "entity": [["tile_ic", "sp", [-1, 1, 4]], ["tile_oc", "sp", [-1, 1]], ["tile_ow", "sp", [-1, 5, 2]], ["tile_oh", "sp", [-1, 1, 8]]]}, "result": [[0.0242900701], 0, 47.311949014663696, 1611936391.915691], "version": 0.2, "tvm_version": "0.8.dev0"}
{"input": ["opencl -keys=opencl,gpu -max_num_threads=256", "tutorial/conv2d_no_batching", [1, 40, 40, 512, 256, 1, 1, [1, 1], [0, 0]], {}], "config": {"index": 5152, "code_hash": null, "entity": [["tile_ic", "sp", [-1, 1, 4]], ["tile_oc", "sp", [-1, 1]], ["tile_ow", "sp", [-1, 4, 4]], ["tile_oh", "sp", [-1, 4, 2]]]}, "result": [[0.0208280177], 0, 42.60241389274597, 1611936460.7614005], "version": 0.2, "tvm_version": "0.8.dev0"}
{"input": ["opencl -keys=opencl,gpu -max_num_threads=256", "tutorial/conv2d_no_batching", [1, 40, 40, 512, 256, 1, 1, [1, 1], [0, 0]], {}], "config": {"index": 31894, "code_hash": null, "entity": [["tile_ic", "sp", [-1, 4, 4]], ["tile_oc", "sp", [-1, 16]], ["tile_ow", "sp", [-1, 2, 2]], ["tile_oh", "sp", [-1, 2, 10]]]}, "result": [[0.0264220756], 0, 81.53690433502197, 1611936499.6768737], "version": 0.2, "tvm_version": "0.8.dev0"}
{"input": ["opencl -keys=opencl,gpu -max_num_threads=256", "tutorial/conv2d_no_batching", [1, 40, 40, 512, 256, 1, 1, [1, 1], [0, 0]], {}], "config": {"index": 5761, "code_hash": null, "entity": [["tile_ic", "sp", [-1, 1, 4]], ["tile_oc", "sp", [-1, 128]], ["tile_ow", "sp", [-1, 2, 10]], ["tile_oh", "sp", [-1, 4, 2]]]}, "result": [[0.039931118599999996], 0, 21.274256944656372, 1611936534.5662766], "version": 0.2, "tvm_version": "0.8.dev0"}
{"input": ["opencl -keys=opencl,gpu -max_num_threads=256", "tutorial/conv2d_no_batching", [1, 40, 40, 512, 256, 1, 1, [1, 1], [0, 0]], {}], "config": {"index": 18853, "code_hash": null, "entity": [["tile_ic", "sp", [-1, 4, 4]], ["tile_oc", "sp", [-1, 32]], ["tile_ow", "sp", [-1, 5, 4]], ["tile_oh", "sp", [-1, 5, 4]]]}, "result": [[0.022676882500000002], 0, 54.237957239151, 1611936652.4776077], "version": 0.2, "tvm_version": "0.8.dev0"}
{"input": ["opencl -keys=opencl,gpu -max_num_threads=256", "tutorial/conv2d_no_batching", [1, 40, 40, 512, 256, 1, 1, [1, 1], [0, 0]], {}], "config": {"index": 5397, "code_hash": null, "entity": [["tile_ic", "sp", [-1, 1, 4]], ["tile_oc", "sp", [-1, 8]], ["tile_ow", "sp", [-1, 1, 8]], ["tile_oh", "sp", [-1, 4, 2]]]}, "result": [[0.0041226254], 0, 4.376191139221191, 1611936698.2641156], "version": 0.2, "tvm_version": "0.8.dev0"}
{"input": ["opencl -keys=opencl,gpu -max_num_threads=256", "tutorial/conv2d_no_batching", [1, 40, 40, 512, 256, 1, 1, [1, 1], [0, 0]], {}], "config": {"index": 5404, "code_hash": null, "entity": [["tile_ic", "sp", [-1, 1, 4]], ["tile_oc", "sp", [-1, 16]], ["tile_ow", "sp", [-1, 1, 8]], ["tile_oh", "sp", [-1, 4, 2]]]}, "result": [[0.0023816304], 0, 9.07175874710083, 1611936702.9611747], "version": 0.2, "tvm_version": "0.8.dev0"}
{"input": ["opencl -keys=opencl,gpu -max_num_threads=256", "tutorial/conv2d_no_batching", [1, 40, 40, 512, 256, 1, 1, [1, 1], [0, 0]], {}], "config": {"index": 5418, "code_hash": null, "entity": [["tile_ic", "sp", [-1, 1, 4]], ["tile_oc", "sp", [-1, 64]], ["tile_ow", "sp", [-1, 1, 8]], ["tile_oh", "sp", [-1, 4, 2]]]}, "result": [[0.0023910158], 0, 29.052155017852783, 1611936722.9419234], "version": 0.2, "tvm_version": "0.8.dev0"}
{"input": ["opencl -keys=opencl,gpu -max_num_threads=256", "tutorial/conv2d_no_batching", [1, 40, 40, 512, 256, 1, 1, [1, 1], [0, 0]], {}], "config": {"index": 5411, "code_hash": null, "entity": [["tile_ic", "sp", [-1, 1, 4]], ["tile_oc", "sp", [-1, 32]], ["tile_ow", "sp", [-1, 1, 8]], ["tile_oh", "sp", [-1, 4, 2]]]}, "result": [[0.0023595992], 0, 19.647577047348022, 1611936713.587889], "version": 0.2, "tvm_version": "0.8.dev0"}
{"input": ["opencl -keys=opencl,gpu -max_num_threads=256", "tutorial/conv2d_no_batching", [1, 40, 40, 512, 256, 1, 1, [1, 1], [0, 0]], {}], "config": {"index": 6916, "code_hash": null, "entity": [["tile_ic", "sp", [-1, 1, 4]], ["tile_oc", "sp", [-1, 16]], ["tile_ow", "sp", [-1, 1, 8]], ["tile_oh", "sp", [-1, 5, 2]]]}, "result": [[0.0035151410000000003], 0, 24.365089893341064, 1611936718.300302], "version": 0.2, "tvm_version": "0.8.dev0"}
{"input": ["opencl -keys=opencl,gpu -max_num_threads=256", "tutorial/conv2d_no_batching", [1, 40, 40, 512, 256, 1, 1, [1, 1], [0, 0]], {}], "config": {"index": 5420, "code_hash": null, "entity": [["tile_ic", "sp", [-1, 4, 4]], ["tile_oc", "sp", [-1, 64]], ["tile_ow", "sp", [-1, 1, 8]], ["tile_oh", "sp", [-1, 4, 2]]]}, "result": [[0.0222874293], 0, 34.41296124458313, 1611936728.3390226], "version": 0.2, "tvm_version": "0.8.dev0"}
{"input": ["opencl -keys=opencl,gpu -max_num_threads=256", "tutorial/conv2d_no_batching", [1, 40, 40, 512, 256, 1, 1, [1, 1], [0, 0]], {}], "config": {"index": 5425, "code_hash": null, "entity": [["tile_ic", "sp", [-1, 1, 4]], ["tile_oc", "sp", [-1, 128]], ["tile_ow", "sp", [-1, 1, 8]], ["tile_oh", "sp", [-1, 4, 2]]]}, "result": [[0.0025251409], 0, 81.91587924957275, 1611936775.904245], "version": 0.2, "tvm_version": "0.8.dev0"}
{"input": ["opencl -keys=opencl,gpu -max_num_threads=256", "tutorial/conv2d_no_batching", [1, 40, 40, 512, 256, 1, 1, [1, 1], [0, 0]], {}], "config": {"index": 5413, "code_hash": null, "entity": [["tile_ic", "sp", [-1, 4, 4]], ["tile_oc", "sp", [-1, 32]], ["tile_ow", "sp", [-1, 1, 8]], ["tile_oh", "sp", [-1, 4, 2]]]}, "result": [[0.0220881897], 0, 51.3786838054657, 1611936745.3528237], "version": 0.2, "tvm_version": "0.8.dev0"}
{"input": ["opencl -keys=opencl,gpu -max_num_threads=256", "tutorial/conv2d_no_batching", [1, 40, 40, 512, 256, 1, 1, [1, 1], [0, 0]], {}], "config": {"index": 6923, "code_hash": null, "entity": [["tile_ic", "sp", [-1, 1, 4]], ["tile_oc", "sp", [-1, 32]], ["tile_ow", "sp", [-1, 1, 8]], ["tile_oh", "sp", [-1, 5, 2]]]}, "result": [[0.0028043128], 0, 55.77632713317871, 1611936749.7996302], "version": 0.2, "tvm_version": "0.8.dev0"}
{"input": ["opencl -keys=opencl,gpu -max_num_threads=256", "tutorial/conv2d_no_batching", [1, 40, 40, 512, 256, 1, 1, [1, 1], [0, 0]], {}], "config": {"index": 5427, "code_hash": null, "entity": [["tile_ic", "sp", [-1, 4, 4]], ["tile_oc", "sp", [-1, 128]], ["tile_ow", "sp", [-1, 1, 8]], ["tile_oh", "sp", [-1, 4, 2]]]}, "result": [[0.022513195], 0, 77.6654908657074, 1611936771.6732025], "version": 0.2, "tvm_version": "0.8.dev0"}
{"input": ["opencl -keys=opencl,gpu -max_num_threads=256", "tutorial/conv2d_no_batching", [1, 40, 40, 512, 256, 1, 1, [1, 1], [0, 0]], {}], "config": {"index": 6909, "code_hash": null, "entity": [["tile_ic", "sp", [-1, 1, 4]], ["tile_oc", "sp", [-1, 8]], ["tile_ow", "sp", [-1, 1, 8]], ["tile_oh", "sp", [-1, 5, 2]]]}, "result": [[0.0037660785], 0, 66.37489700317383, 1611936760.404737], "version": 0.2, "tvm_version": "0.8.dev0"}
{"input": ["opencl -keys=opencl,gpu -max_num_threads=256", "tutorial/conv2d_no_batching", [1, 40, 40, 512, 256, 1, 1, [1, 1], [0, 0]], {}], "config": {"index": 12971, "code_hash": null, "entity": [["tile_ic", "sp", [-1, 1, 4]], ["tile_oc", "sp", [-1, 32]], ["tile_ow", "sp", [-1, 1, 8]], ["tile_oh", "sp", [-1, 20, 2]]]}, "result": [[0.0025071096], 0, 9.940318584442139, 1611936786.7128909], "version": 0.2, "tvm_version": "0.8.dev0"}
{"input": ["opencl -keys=opencl,gpu -max_num_threads=256", "tutorial/conv2d_no_batching", [1, 40, 40, 512, 256, 1, 1, [1, 1], [0, 0]], {}], "config": {"index": 12964, "code_hash": null, "entity": [["tile_ic", "sp", [-1, 1, 4]], ["tile_oc", "sp", [-1, 16]], ["tile_ow", "sp", [-1, 1, 8]], ["tile_oh", "sp", [-1, 20, 2]]]}, "result": [[0.0024997815], 0, 14.564489603042603, 1611936791.3241143], "version": 0.2, "tvm_version": "0.8.dev0"}
{"input": ["opencl -keys=opencl,gpu -max_num_threads=256", "tutorial/conv2d_no_batching", [1, 40, 40, 512, 256, 1, 1, [1, 1], [0, 0]], {}], "config": {"index": 9940, "code_hash": null, "entity": [["tile_ic", "sp", [-1, 1, 4]], ["tile_oc", "sp", [-1, 16]], ["tile_ow", "sp", [-1, 1, 8]], ["tile_oh", "sp", [-1, 10, 2]]]}, "result": [[0.0027508388], 0, 24.73965311050415, 1611936801.5053172], "version": 0.2, "tvm_version": "0.8.dev0"}
{"input": ["opencl -keys=opencl,gpu -max_num_threads=256", "tutorial/conv2d_no_batching", [1, 40, 40, 512, 256, 1, 1, [1, 1], [0, 0]], {}], "config": {"index": 9933, "code_hash": null, "entity": [["tile_ic", "sp", [-1, 1, 4]], ["tile_oc", "sp", [-1, 8]], ["tile_ow", "sp", [-1, 1, 8]], ["tile_oh", "sp", [-1, 10, 2]]]}, "result": [[0.0036322087000000003], 0, 34.792397260665894, 1611936811.5797477], "version": 0.2, "tvm_version": "0.8.dev0"}
{"input": ["opencl -keys=opencl,gpu -max_num_threads=256", "tutorial/conv2d_no_batching", [1, 40, 40, 512, 256, 1, 1, [1, 1], [0, 0]], {}], "config": {"index": 18726, "code_hash": null, "entity": [["tile_ic", "sp", [-1, 2, 4]], ["tile_oc", "sp", [-1, 8]], ["tile_ow", "sp", [-1, 2, 4]], ["tile_oh", "sp", [-1, 5, 4]]]}, "result": [[0.0456541868], 0, 40.64996099472046, 1611936817.4304202], "version": 0.2, "tvm_version": "0.8.dev0"}
{"input": ["opencl -keys=opencl,gpu -max_num_threads=256", "tutorial/conv2d_no_batching", [1, 40, 40, 512, 256, 1, 1, [1, 1], [0, 0]], {}], "config": {"index": 6932, "code_hash": null, "entity": [["tile_ic", "sp", [-1, 4, 4]], ["tile_oc", "sp", [-1, 64]], ["tile_ow", "sp", [-1, 1, 8]], ["tile_oh", "sp", [-1, 5, 2]]]}, "result": [[0.022121950100000003], 0, 62.680524587631226, 1611936839.466322], "version": 0.2, "tvm_version": "0.8.dev0"}
{"input": ["opencl -keys=opencl,gpu -max_num_threads=256", "tutorial/conv2d_no_batching", [1, 40, 40, 512, 256, 1, 1, [1, 1], [0, 0]], {}], "config": {"index": 12957, "code_hash": null, "entity": [["tile_ic", "sp", [-1, 1, 4]], ["tile_oc", "sp", [-1, 8]], ["tile_ow", "sp", [-1, 1, 8]], ["tile_oh", "sp", [-1, 20, 2]]]}, "result": [[0.0029068701], 0, 72.41834044456482, 1611936849.2273262], "version": 0.2, "tvm_version": "0.8.dev0"}
{"input": ["opencl -keys=opencl,gpu -max_num_threads=256", "tutorial/conv2d_no_batching", [1, 40, 40, 512, 256, 1, 1, [1, 1], [0, 0]], {}], "config": {"index": 6925, "code_hash": null, "entity": [["tile_ic", "sp", [-1, 4, 4]], ["tile_oc", "sp", [-1, 32]], ["tile_ow", "sp", [-1, 1, 8]], ["tile_oh", "sp", [-1, 5, 2]]]}, "result": [[0.021278299], 0, 67.73715043067932, 1611936844.5403016], "version": 0.2, "tvm_version": "0.8.dev0"}
{"input": ["opencl -keys=opencl,gpu -max_num_threads=256", "tutorial/conv2d_no_batching", [1, 40, 40, 512, 256, 1, 1, [1, 1], [0, 0]], {}], "config": {"index": 18739, "code_hash": null, "entity": [["tile_ic", "sp", [-1, 1, 4]], ["tile_oc", "sp", [-1, 32]], ["tile_ow", "sp", [-1, 2, 4]], ["tile_oh", "sp", [-1, 5, 4]]]}, "result": [[0.002239495], 0, 3.984905242919922, 1611936854.044201], "version": 0.2, "tvm_version": "0.8.dev0"}
{"input": ["opencl -keys=opencl,gpu -max_num_threads=256", "tutorial/conv2d_no_batching", [1, 40, 40, 512, 256, 1, 1, [1, 1], [0, 0]], {}], "config": {"index": 6939, "code_hash": null, "entity": [["tile_ic", "sp", [-1, 4, 4]], ["tile_oc", "sp", [-1, 128]], ["tile_ow", "sp", [-1, 1, 8]], ["tile_oh", "sp", [-1, 5, 2]]]}, "result": [[0.0229052679], 0, 9.319482564926147, 1611936859.3512626], "version": 0.2, "tvm_version": "0.8.dev0"}
{"input": ["opencl -keys=opencl,gpu -max_num_threads=256", "tutorial/conv2d_no_batching", [1, 40, 40, 512, 256, 1, 1, [1, 1], [0, 0]], {}], "config": {"index": 6937, "code_hash": null, "entity": [["tile_ic", "sp", [-1, 1, 4]], ["tile_oc", "sp", [-1, 128]], ["tile_ow", "sp", [-1, 1, 8]], ["tile_oh", "sp", [-1, 5, 2]]]}, "result": [[0.0024082815], 0, 18.435065269470215, 1611936868.5055184], "version": 0.2, "tvm_version": "0.8.dev0"}
{"input": ["opencl -keys=opencl,gpu -max_num_threads=256", "tutorial/conv2d_no_batching", [1, 40, 40, 512, 256, 1, 1, [1, 1], [0, 0]], {}], "config": {"index": 18718, "code_hash": null, "entity": [["tile_ic", "sp", [-1, 1, 4]], ["tile_oc", "sp", [-1, 4]], ["tile_ow", "sp", [-1, 2, 4]], ["tile_oh", "sp", [-1, 5, 4]]]}, "result": [[0.0033662816], 0, 13.95460295677185, 1611936864.0369966], "version": 0.2, "tvm_version": "0.8.dev0"}
{"input": ["opencl -keys=opencl,gpu -max_num_threads=256", "tutorial/conv2d_no_batching", [1, 40, 40, 512, 256, 1, 1, [1, 1], [0, 0]], {}], "config": {"index": 12973, "code_hash": null, "entity": [["tile_ic", "sp", [-1, 4, 4]], ["tile_oc", "sp", [-1, 32]], ["tile_ow", "sp", [-1, 1, 8]], ["tile_oh", "sp", [-1, 20, 2]]]}, "result": [[0.0227056898], 0, 28.4935519695282, 1611936878.5502586], "version": 0.2, "tvm_version": "0.8.dev0"}
{"input": ["opencl -keys=opencl,gpu -max_num_threads=256", "tutorial/conv2d_no_batching", [1, 40, 40, 512, 256, 1, 1, [1, 1], [0, 0]], {}], "config": {"index": 18746, "code_hash": null, "entity": [["tile_ic", "sp", [-1, 1, 4]], ["tile_oc", "sp", [-1, 64]], ["tile_ow", "sp", [-1, 2, 4]], ["tile_oh", "sp", [-1, 5, 4]]]}, "result": [[0.0022379325], 0, 22.974980115890503, 1611936873.0554407], "version": 0.2, "tvm_version": "0.8.dev0"}
{"input": ["opencl -keys=opencl,gpu -max_num_threads=256", "tutorial/conv2d_no_batching", [1, 40, 40, 512, 256, 1, 1, [1, 1], [0, 0]], {}], "config": {"index": 21758, "code_hash": null, "entity": [["tile_ic", "sp", [-1, 4, 4]], ["tile_oc", "sp", [-1, 16]], ["tile_ow", "sp", [-1, 2, 4]], ["tile_oh", "sp", [-1, 10, 4]]]}, "result": [[0.0242117107], 0, 39.263471364974976, 1611936889.3569498], "version": 0.2, "tvm_version": "0.8.dev0"}
{"input": ["opencl -keys=opencl,gpu -max_num_threads=256", "tutorial/conv2d_no_batching", [1, 40, 40, 512, 256, 1, 1, [1, 1], [0, 0]], {}], "config": {"index": 21756, "code_hash": null, "entity": [["tile_ic", "sp", [-1, 1, 4]], ["tile_oc", "sp", [-1, 16]], ["tile_ow", "sp", [-1, 2, 4]], ["tile_oh", "sp", [-1, 10, 4]]]}, "result": [[0.0022473804], 0, 43.48484563827515, 1611936893.5984688], "version": 0.2, "tvm_version": "0.8.dev0"}
{"input": ["opencl -keys=opencl,gpu -max_num_threads=256", "tutorial/conv2d_no_batching", [1, 40, 40, 512, 256, 1, 1, [1, 1], [0, 0]], {}], "config": {"index": 18748, "code_hash": null, "entity": [["tile_ic", "sp", [-1, 4, 4]], ["tile_oc", "sp", [-1, 64]], ["tile_ow", "sp", [-1, 2, 4]], ["tile_oh", "sp", [-1, 5, 4]]]}, "result": [[0.0236486274], 0, 55.05206274986267, 1611936905.1486146], "version": 0.2, "tvm_version": "0.8.dev0"}
{"input": ["opencl -keys=opencl,gpu -max_num_threads=256", "tutorial/conv2d_no_batching", [1, 40, 40, 512, 256, 1, 1, [1, 1], [0, 0]], {}], "config": {"index": 9954, "code_hash": null, "entity": [["tile_ic", "sp", [-1, 1, 4]], ["tile_oc", "sp", [-1, 64]], ["tile_ow", "sp", [-1, 1, 8]], ["tile_oh", "sp", [-1, 10, 2]]]}, "result": [[0.0023566252], 0, 59.2956919670105, 1611936909.4329119], "version": 0.2, "tvm_version": "0.8.dev0"}
{"input": ["opencl -keys=opencl,gpu -max_num_threads=256", "tutorial/conv2d_no_batching", [1, 40, 40, 512, 256, 1, 1, [1, 1], [0, 0]], {}], "config": {"index": 9947, "code_hash": null, "entity": [["tile_ic", "sp", [-1, 1, 4]], ["tile_oc", "sp", [-1, 32]], ["tile_ow", "sp", [-1, 1, 8]], ["tile_oh", "sp", [-1, 10, 2]]]}, "result": [[0.0023244169], 0, 63.89112734794617, 1611936914.0339508], "version": 0.2, "tvm_version": "0.8.dev0"}
{"input": ["opencl -keys=opencl,gpu -max_num_threads=256", "tutorial/conv2d_no_batching", [1, 40, 40, 512, 256, 1, 1, [1, 1], [0, 0]], {}], "config": {"index": 18734, "code_hash": null, "entity": [["tile_ic", "sp", [-1, 4, 4]], ["tile_oc", "sp", [-1, 16]], ["tile_ow", "sp", [-1, 2, 4]], ["tile_oh", "sp", [-1, 5, 4]]]}, "result": [[0.0224100022], 0, 21.082863092422485, 1611936945.8419254], "version": 0.2, "tvm_version": "0.8.dev0"}
{"input": ["opencl -keys=opencl,gpu -max_num_threads=256", "tutorial/conv2d_no_batching", [1, 40, 40, 512, 256, 1, 1, [1, 1], [0, 0]], {}], "config": {"index": 18732, "code_hash": null, "entity": [["tile_ic", "sp", [-1, 1, 4]], ["tile_oc", "sp", [-1, 16]], ["tile_ow", "sp", [-1, 2, 4]], ["tile_oh", "sp", [-1, 5, 4]]]}, "result": [[0.0025990003000000003], 0, 29.766789436340332, 1611936954.5635903], "version": 0.2, "tvm_version": "0.8.dev0"}
{"input": ["opencl -keys=opencl,gpu -max_num_threads=256", "tutorial/conv2d_no_batching", [1, 40, 40, 512, 256, 1, 1, [1, 1], [0, 0]], {}], "config": {"index": 21749, "code_hash": null, "entity": [["tile_ic", "sp", [-1, 1, 4]], ["tile_oc", "sp", [-1, 8]], ["tile_ow", "sp", [-1, 2, 4]], ["tile_oh", "sp", [-1, 10, 4]]]}, "result": [[0.0026922867], 0, 25.375502586364746, 1611936950.1827433], "version": 0.2, "tvm_version": "0.8.dev0"}
{"input": ["opencl -keys=opencl,gpu -max_num_threads=256", "tutorial/conv2d_no_batching", [1, 40, 40, 512, 256, 1, 1, [1, 1], [0, 0]], {}], "config": {"index": 18741, "code_hash": null, "entity": [["tile_ic", "sp", [-1, 4, 4]], ["tile_oc", "sp", [-1, 32]], ["tile_ow", "sp", [-1, 2, 4]], ["tile_oh", "sp", [-1, 5, 4]]]}, "result": [[0.0230768304], 0, 34.92682123184204, 1611936959.7076044], "version": 0.2, "tvm_version": "0.8.dev0"}
{"input": ["opencl -keys=opencl,gpu -max_num_threads=256", "tutorial/conv2d_no_batching", [1, 40, 40, 512, 256, 1, 1, [1, 1], [0, 0]], {}], "config": {"index": 18725, "code_hash": null, "entity": [["tile_ic", "sp", [-1, 1, 4]], ["tile_oc", "sp", [-1, 8]], ["tile_ow", "sp", [-1, 2, 4]], ["tile_oh", "sp", [-1, 5, 4]]]}, "result": [[0.0032814742], 0, 50.40523838996887, 1611936975.2313223], "version": 0.2, "tvm_version": "0.8.dev0"}
{"input": ["opencl -keys=opencl,gpu -max_num_threads=256", "tutorial/conv2d_no_batching", [1, 40, 40, 512, 256, 1, 1, [1, 1], [0, 0]], {}], "config": {"index": 18683, "code_hash": null, "entity": [["tile_ic", "sp", [-1, 1, 4]], ["tile_oc", "sp", [-1, 32]], ["tile_ow", "sp", [-1, 1, 4]], ["tile_oh", "sp", [-1, 5, 4]]]}, "result": [[0.00259837], 0, 4.30134391784668, 1611937004.2894218], "version": 0.2, "tvm_version": "0.8.dev0"}
{"input": ["opencl -keys=opencl,gpu -max_num_threads=256", "tutorial/conv2d_no_batching", [1, 40, 40, 512, 256, 1, 1, [1, 1], [0, 0]], {}], "config": {"index": 5083, "code_hash": null, "entity": [["tile_ic", "sp", [-1, 2, 4]], ["tile_oc", "sp", [-1, 64]], ["tile_ow", "sp", [-1, 1, 4]], ["tile_oh", "sp", [-1, 4, 2]]]}, "result": [[0.0023466773], 0, 8.840819120407104, 1611937008.852318], "version": 0.2, "tvm_version": "0.8.dev0"}
{"input": ["opencl -keys=opencl,gpu -max_num_threads=256", "tutorial/conv2d_no_batching", [1, 40, 40, 512, 256, 1, 1, [1, 1], [0, 0]], {}], "config": {"index": 5075, "code_hash": null, "entity": [["tile_ic", "sp", [-1, 1, 4]], ["tile_oc", "sp", [-1, 32]], ["tile_ow", "sp", [-1, 1, 4]], ["tile_oh", "sp", [-1, 4, 2]]]}, "result": [[0.0019295106], 0, 13.32425856590271, 1611937013.3226876], "version": 0.2, "tvm_version": "0.8.dev0"}
{"input": ["opencl -keys=opencl,gpu -max_num_threads=256", "tutorial/conv2d_no_batching", [1, 40, 40, 512, 256, 1, 1, [1, 1], [0, 0]], {}], "config": {"index": 6636, "code_hash": null, "entity": [["tile_ic", "sp", [-1, 1, 4]], ["tile_oc", "sp", [-1, 16]], ["tile_ow", "sp", [-1, 2, 4]], ["tile_oh", "sp", [-1, 5, 2]]]}, "result": [[0.0022120158], 0, 17.795443534851074, 1611937017.8451285], "version": 0.2, "tvm_version": "0.8.dev0"}
{"input": ["opencl -keys=opencl,gpu -max_num_threads=256", "tutorial/conv2d_no_batching", [1, 40, 40, 512, 256, 1, 1, [1, 1], [0, 0]], {}], "config": {"index": 5124, "code_hash": null, "entity": [["tile_ic", "sp", [-1, 1, 4]], ["tile_oc", "sp", [-1, 16]], ["tile_ow", "sp", [-1, 2, 4]], ["tile_oh", "sp", [-1, 4, 2]]]}, "result": [[0.0019451929], 0, 22.284483194351196, 1611937022.3319573], "version": 0.2, "tvm_version": "0.8.dev0"}
{"input": ["opencl -keys=opencl,gpu -max_num_threads=256", "tutorial/conv2d_no_batching", [1, 40, 40, 512, 256, 1, 1, [1, 1], [0, 0]], {}], "config": {"index": 4627, "code_hash": null, "entity": [["tile_ic", "sp", [-1, 1, 4]], ["tile_oc", "sp", [-1, 32]], ["tile_ow", "sp", [-1, 1, 2]], ["tile_oh", "sp", [-1, 4, 2]]]}, "result": [[0.0022528126999999997], 0, 26.668896913528442, 1611937026.7190893], "version": 0.2, "tvm_version": "0.8.dev0"}
{"input": ["opencl -keys=opencl,gpu -max_num_threads=256", "tutorial/conv2d_no_batching", [1, 40, 40, 512, 256, 1, 1, [1, 1], [0, 0]], {}], "config": {"index": 4739, "code_hash": null, "entity": [["tile_ic", "sp", [-1, 1, 4]], ["tile_oc", "sp", [-1, 32]], ["tile_ow", "sp", [-1, 4, 2]], ["tile_oh", "sp", [-1, 4, 2]]]}, "result": [[0.0022929064], 0, 31.07383108139038, 1611937031.1521585], "version": 0.2, "tvm_version": "0.8.dev0"}
{"input": ["opencl -keys=opencl,gpu -max_num_threads=256", "tutorial/conv2d_no_batching", [1, 40, 40, 512, 256, 1, 1, [1, 1], [0, 0]], {}], "config": {"index": 6587, "code_hash": null, "entity": [["tile_ic", "sp", [-1, 1, 4]], ["tile_oc", "sp", [-1, 32]], ["tile_ow", "sp", [-1, 1, 4]], ["tile_oh", "sp", [-1, 5, 2]]]}, "result": [[0.002240344], 0, 35.529605865478516, 1611937035.5941339], "version": 0.2, "tvm_version": "0.8.dev0"}
{"input": ["opencl -keys=opencl,gpu -max_num_threads=256", "tutorial/conv2d_no_batching", [1, 40, 40, 512, 256, 1, 1, [1, 1], [0, 0]], {}], "config": {"index": 18690, "code_hash": null, "entity": [["tile_ic", "sp", [-1, 1, 4]], ["tile_oc", "sp", [-1, 64]], ["tile_ow", "sp", [-1, 1, 4]], ["tile_oh", "sp", [-1, 5, 4]]]}, "result": [[0.0022291669], 0, 40.167797565460205, 1611937040.2442565], "version": 0.2, "tvm_version": "0.8.dev0"}
{"input": ["opencl -keys=opencl,gpu -max_num_threads=256", "tutorial/conv2d_no_batching", [1, 40, 40, 512, 256, 1, 1, [1, 1], [0, 0]], {}], "config": {"index": 5132, "code_hash": null, "entity": [["tile_ic", "sp", [-1, 2, 4]], ["tile_oc", "sp", [-1, 32]], ["tile_ow", "sp", [-1, 2, 4]], ["tile_oh", "sp", [-1, 4, 2]]]}, "result": [[0.0023596408], 0, 44.61062836647034, 1611937044.69589], "version": 0.2, "tvm_version": "0.8.dev0"}
{"input": ["opencl -keys=opencl,gpu -max_num_threads=256", "tutorial/conv2d_no_batching", [1, 40, 40, 512, 256, 1, 1, [1, 1], [0, 0]], {}], "config": {"index": 5139, "code_hash": null, "entity": [["tile_ic", "sp", [-1, 2, 4]], ["tile_oc", "sp", [-1, 64]], ["tile_ow", "sp", [-1, 2, 4]], ["tile_oh", "sp", [-1, 4, 2]]]}, "result": [[0.0023437294000000003], 0, 49.02430701255798, 1611937049.1292531], "version": 0.2, "tvm_version": "0.8.dev0"}
{"input": ["opencl -keys=opencl,gpu -max_num_threads=256", "tutorial/conv2d_no_batching", [1, 40, 40, 512, 256, 1, 1, [1, 1], [0, 0]], {}], "config": {"index": 5082, "code_hash": null, "entity": [["tile_ic", "sp", [-1, 1, 4]], ["tile_oc", "sp", [-1, 64]], ["tile_ow", "sp", [-1, 1, 4]], ["tile_oh", "sp", [-1, 4, 2]]]}, "result": [[0.0019218751999999998], 0, 57.615689516067505, 1611937057.7365916], "version": 0.2, "tvm_version": "0.8.dev0"}
{"input": ["opencl -keys=opencl,gpu -max_num_threads=256", "tutorial/conv2d_no_batching", [1, 40, 40, 512, 256, 1, 1, [1, 1], [0, 0]], {}], "config": {"index": 18235, "code_hash": null, "entity": [["tile_ic", "sp", [-1, 1, 4]], ["tile_oc", "sp", [-1, 32]], ["tile_ow", "sp", [-1, 1, 2]], ["tile_oh", "sp", [-1, 5, 4]]]}, "result": [[0.0022669637], 0, 53.35951781272888, 1611937053.4815], "version": 0.2, "tvm_version": "0.8.dev0"}
{"input": ["opencl -keys=opencl,gpu -max_num_threads=256", "tutorial/conv2d_no_batching", [1, 40, 40, 512, 256, 1, 1, [1, 1], [0, 0]], {}], "config": {"index": 15219, "code_hash": null, "entity": [["tile_ic", "sp", [-1, 2, 4]], ["tile_oc", "sp", [-1, 64]], ["tile_ow", "sp", [-1, 1, 2]], ["tile_oh", "sp", [-1, 2, 4]]]}, "result": [[0.0023773751999999998], 0, 61.95533299446106, 1611937062.089822], "version": 0.2, "tvm_version": "0.8.dev0"}
{"input": ["opencl -keys=opencl,gpu -max_num_threads=256", "tutorial/conv2d_no_batching", [1, 40, 40, 512, 256, 1, 1, [1, 1], [0, 0]], {}], "config": {"index": 5131, "code_hash": null, "entity": [["tile_ic", "sp", [-1, 1, 4]], ["tile_oc", "sp", [-1, 32]], ["tile_ow", "sp", [-1, 2, 4]], ["tile_oh", "sp", [-1, 4, 2]]]}, "result": [[0.0019153908000000002], 0, 66.5030369758606, 1611937066.6631389], "version": 0.2, "tvm_version": "0.8.dev0"}
{"input": ["opencl -keys=opencl,gpu -max_num_threads=256", "tutorial/conv2d_no_batching", [1, 40, 40, 512, 256, 1, 1, [1, 1], [0, 0]], {}], "config": {"index": 6644, "code_hash": null, "entity": [["tile_ic", "sp", [-1, 2, 4]], ["tile_oc", "sp", [-1, 32]], ["tile_ow", "sp", [-1, 2, 4]], ["tile_oh", "sp", [-1, 5, 2]]]}, "result": [[0.0023612867], 0, 71.31592512130737, 1611937071.4771678], "version": 0.2, "tvm_version": "0.8.dev0"}
{"input": ["opencl -keys=opencl,gpu -max_num_threads=256", "tutorial/conv2d_no_batching", [1, 40, 40, 512, 256, 1, 1, [1, 1], [0, 0]], {}], "config": {"index": 6643, "code_hash": null, "entity": [["tile_ic", "sp", [-1, 1, 4]], ["tile_oc", "sp", [-1, 32]], ["tile_ow", "sp", [-1, 2, 4]], ["tile_oh", "sp", [-1, 5, 2]]]}, "result": [[0.0019340626999999999], 0, 4.116469621658325, 1611937076.4872043], "version": 0.2, "tvm_version": "0.8.dev0"}
{"input": ["opencl -keys=opencl,gpu -max_num_threads=256", "tutorial/conv2d_no_batching", [1, 40, 40, 512, 256, 1, 1, [1, 1], [0, 0]], {}], "config": {"index": 5068, "code_hash": null, "entity": [["tile_ic", "sp", [-1, 1, 4]], ["tile_oc", "sp", [-1, 16]], ["tile_ow", "sp", [-1, 1, 4]], ["tile_oh", "sp", [-1, 4, 2]]]}, "result": [[0.0019248387], 0, 8.799538373947144, 1611937081.1460378], "version": 0.2, "tvm_version": "0.8.dev0"}
{"input": ["opencl -keys=opencl,gpu -max_num_threads=256", "tutorial/conv2d_no_batching", [1, 40, 40, 512, 256, 1, 1, [1, 1], [0, 0]], {}], "config": {"index": 4795, "code_hash": null, "entity": [["tile_ic", "sp", [-1, 1, 4]], ["tile_oc", "sp", [-1, 32]], ["tile_ow", "sp", [-1, 5, 2]], ["tile_oh", "sp", [-1, 4, 2]]]}, "result": [[0.0023452085000000003], 0, 17.89559841156006, 1611937090.2636766], "version": 0.2, "tvm_version": "0.8.dev0"}
{"input": ["opencl -keys=opencl,gpu -max_num_threads=256", "tutorial/conv2d_no_batching", [1, 40, 40, 512, 256, 1, 1, [1, 1], [0, 0]], {}], "config": {"index": 4683, "code_hash": null, "entity": [["tile_ic", "sp", [-1, 1, 4]], ["tile_oc", "sp", [-1, 32]], ["tile_ow", "sp", [-1, 2, 2]], ["tile_oh", "sp", [-1, 4, 2]]]}, "result": [[0.00230062], 0, 13.25779914855957, 1611937085.6367943], "version": 0.2, "tvm_version": "0.8.dev0"}
{"input": ["opencl -keys=opencl,gpu -max_num_threads=256", "tutorial/conv2d_no_batching", [1, 40, 40, 512, 256, 1, 1, [1, 1], [0, 0]], {}], "config": {"index": 15267, "code_hash": null, "entity": [["tile_ic", "sp", [-1, 1, 4]], ["tile_oc", "sp", [-1, 32]], ["tile_ow", "sp", [-1, 2, 2]], ["tile_oh", "sp", [-1, 2, 4]]]}, "result": [[0.0019537398], 0, 22.564173460006714, 1611937094.9213517], "version": 0.2, "tvm_version": "0.8.dev0"}
{"input": ["opencl -keys=opencl,gpu -max_num_threads=256", "tutorial/conv2d_no_batching", [1, 40, 40, 512, 256, 1, 1, [1, 1], [0, 0]], {}], "config": {"index": 15316, "code_hash": null, "entity": [["tile_ic", "sp", [-1, 1, 4]], ["tile_oc", "sp", [-1, 16]], ["tile_ow", "sp", [-1, 4, 2]], ["tile_oh", "sp", [-1, 2, 4]]]}, "result": [[0.0019517294], 0, 27.19819927215576, 1611937099.5636446], "version": 0.2, "tvm_version": "0.8.dev0"}
{"input": ["opencl -keys=opencl,gpu -max_num_threads=256", "tutorial/conv2d_no_batching", [1, 40, 40, 512, 256, 1, 1, [1, 1], [0, 0]], {}], "config": {"index": 6650, "code_hash": null, "entity": [["tile_ic", "sp", [-1, 1, 4]], ["tile_oc", "sp", [-1, 64]], ["tile_ow", "sp", [-1, 2, 4]], ["tile_oh", "sp", [-1, 5, 2]]]}, "result": [[0.0019271669000000002], 0, 31.829092979431152, 1611937104.2066875], "version": 0.2, "tvm_version": "0.8.dev0"}
{"input": ["opencl -keys=opencl,gpu -max_num_threads=256", "tutorial/conv2d_no_batching", [1, 40, 40, 512, 256, 1, 1, [1, 1], [0, 0]], {}], "config": {"index": 5076, "code_hash": null, "entity": [["tile_ic", "sp", [-1, 2, 4]], ["tile_oc", "sp", [-1, 32]], ["tile_ow", "sp", [-1, 1, 4]], ["tile_oh", "sp", [-1, 4, 2]]]}, "result": [[0.0023363492], 0, 36.46459221839905, 1611937108.845033], "version": 0.2, "tvm_version": "0.8.dev0"}
{"input": ["opencl -keys=opencl,gpu -max_num_threads=256", "tutorial/conv2d_no_batching", [1, 40, 40, 512, 256, 1, 1, [1, 1], [0, 0]], {}], "config": {"index": 3283, "code_hash": null, "entity": [["tile_ic", "sp", [-1, 1, 4]], ["tile_oc", "sp", [-1, 32]], ["tile_ow", "sp", [-1, 5, 2]], ["tile_oh", "sp", [-1, 2, 2]]]}, "result": [[0.0022822346], 0, 41.106513261795044, 1611937113.4957955], "version": 0.2, "tvm_version": "0.8.dev0"}
{"input": ["opencl -keys=opencl,gpu -max_num_threads=256", "tutorial/conv2d_no_batching", [1, 40, 40, 512, 256, 1, 1, [1, 1], [0, 0]], {}], "config": {"index": 4740, "code_hash": null, "entity": [["tile_ic", "sp", [-1, 2, 4]], ["tile_oc", "sp", [-1, 32]], ["tile_ow", "sp", [-1, 4, 2]], ["tile_oh", "sp", [-1, 4, 2]]]}, "result": [[0.002299495], 0, 45.63877272605896, 1611937118.030841], "version": 0.2, "tvm_version": "0.8.dev0"}
{"input": ["opencl -keys=opencl,gpu -max_num_threads=256", "tutorial/conv2d_no_batching", [1, 40, 40, 512, 256, 1, 1, [1, 1], [0, 0]], {}], "config": {"index": 18292, "code_hash": null, "entity": [["tile_ic", "sp", [-1, 2, 4]], ["tile_oc", "sp", [-1, 32]], ["tile_ow", "sp", [-1, 2, 2]], ["tile_oh", "sp", [-1, 5, 4]]]}, "result": [[0.0023641252], 0, 50.30641460418701, 1611937122.709014], "version": 0.2, "tvm_version": "0.8.dev0"}
{"input": ["opencl -keys=opencl,gpu -max_num_threads=256", "tutorial/conv2d_no_batching", [1, 40, 40, 512, 256, 1, 1, [1, 1], [0, 0]], {}], "config": {"index": 6755, "code_hash": null, "entity": [["tile_ic", "sp", [-1, 1, 4]], ["tile_oc", "sp", [-1, 32]], ["tile_ow", "sp", [-1, 5, 4]], ["tile_oh", "sp", [-1, 5, 2]]]}, "result": [[0.0020673074999999997], 0, 54.8598268032074, 1611937127.2787404], "version": 0.2, "tvm_version": "0.8.dev0"}
{"input": ["opencl -keys=opencl,gpu -max_num_threads=256", "tutorial/conv2d_no_batching", [1, 40, 40, 512, 256, 1, 1, [1, 1], [0, 0]], {}], "config": {"index": 15275, "code_hash": null, "entity": [["tile_ic", "sp", [-1, 2, 4]], ["tile_oc", "sp", [-1, 64]], ["tile_ow", "sp", [-1, 2, 2]], ["tile_oh", "sp", [-1, 2, 4]]]}, "result": [[0.0023715107], 0, 59.51208162307739, 1611937131.9191236], "version": 0.2, "tvm_version": "0.8.dev0"}
{"input": ["opencl -keys=opencl,gpu -max_num_threads=256", "tutorial/conv2d_no_batching", [1, 40, 40, 512, 256, 1, 1, [1, 1], [0, 0]], {}], "config": {"index": 4676, "code_hash": null, "entity": [["tile_ic", "sp", [-1, 1, 4]], ["tile_oc", "sp", [-1, 16]], ["tile_ow", "sp", [-1, 2, 2]], ["tile_oh", "sp", [-1, 4, 2]]]}, "result": [[0.0022923492], 0, 64.08608269691467, 1611937136.5133343], "version": 0.2, "tvm_version": "0.8.dev0"}
{"input": ["opencl -keys=opencl,gpu -max_num_threads=256", "tutorial/conv2d_no_batching", [1, 40, 40, 512, 256, 1, 1, [1, 1], [0, 0]], {}], "config": {"index": 15372, "code_hash": null, "entity": [["tile_ic", "sp", [-1, 1, 4]], ["tile_oc", "sp", [-1, 16]], ["tile_ow", "sp", [-1, 5, 2]], ["tile_oh", "sp", [-1, 2, 4]]]}, "result": [[0.0022119325], 0, 68.73219919204712, 1611937141.1534054], "version": 0.2, "tvm_version": "0.8.dev0"}
{"input": ["opencl -keys=opencl,gpu -max_num_threads=256", "tutorial/conv2d_no_batching", [1, 40, 40, 512, 256, 1, 1, [1, 1], [0, 0]], {}], "config": {"index": 27307, "code_hash": null, "entity": [["tile_ic", "sp", [-1, 1, 4]], ["tile_oc", "sp", [-1, 32]], ["tile_ow", "sp", [-1, 1, 2]], ["tile_oh", "sp", [-1, 5, 8]]]}, "result": [[0.0027122711], 0, 73.4238543510437, 1611937145.8582788], "version": 0.2, "tvm_version": "0.8.dev0"}
{"input": ["opencl -keys=opencl,gpu -max_num_threads=256", "tutorial/conv2d_no_batching", [1, 40, 40, 512, 256, 1, 1, [1, 1], [0, 0]], {}], "config": {"index": 15260, "code_hash": null, "entity": [["tile_ic", "sp", [-1, 1, 4]], ["tile_oc", "sp", [-1, 16]], ["tile_ow", "sp", [-1, 2, 2]], ["tile_oh", "sp", [-1, 2, 4]]]}, "result": [[0.0019083023], 0, 4.005908012390137, 1611937150.7651675], "version": 0.2, "tvm_version": "0.8.dev0"}
{"input": ["opencl -keys=opencl,gpu -max_num_threads=256", "tutorial/conv2d_no_batching", [1, 40, 40, 512, 256, 1, 1, [1, 1], [0, 0]], {}], "config": {"index": 15323, "code_hash": null, "entity": [["tile_ic", "sp", [-1, 1, 4]], ["tile_oc", "sp", [-1, 32]], ["tile_ow", "sp", [-1, 4, 2]], ["tile_oh", "sp", [-1, 2, 4]]]}, "result": [[0.0019392658], 0, 8.408675909042358, 1611937155.1681952], "version": 0.2, "tvm_version": "0.8.dev0"}
{"input": ["opencl -keys=opencl,gpu -max_num_threads=256", "tutorial/conv2d_no_batching", [1, 40, 40, 512, 256, 1, 1, [1, 1], [0, 0]], {}], "config": {"index": 3227, "code_hash": null, "entity": [["tile_ic", "sp", [-1, 1, 4]], ["tile_oc", "sp", [-1, 32]], ["tile_ow", "sp", [-1, 4, 2]], ["tile_oh", "sp", [-1, 2, 2]]]}, "result": [[0.0023169638], 0, 12.8432137966156, 1611937159.588219], "version": 0.2, "tvm_version": "0.8.dev0"}
{"input": ["opencl -keys=opencl,gpu -max_num_threads=256", "tutorial/conv2d_no_batching", [1, 40, 40, 512, 256, 1, 1, [1, 1], [0, 0]], {}], "config": {"index": 15666, "code_hash": null, "entity": [["tile_ic", "sp", [-1, 1, 4]], ["tile_oc", "sp", [-1, 64]], ["tile_ow", "sp", [-1, 1, 4]], ["tile_oh", "sp", [-1, 2, 4]]]}, "result": [[0.002228495], 0, 17.606169939041138, 1611937164.3406315], "version": 0.2, "tvm_version": "0.8.dev0"}
{"input": ["opencl -keys=opencl,gpu -max_num_threads=256", "tutorial/conv2d_no_batching", [1, 40, 40, 512, 256, 1, 1, [1, 1], [0, 0]], {}], "config": {"index": 6748, "code_hash": null, "entity": [["tile_ic", "sp", [-1, 1, 4]], ["tile_oc", "sp", [-1, 16]], ["tile_ow", "sp", [-1, 5, 4]], ["tile_oh", "sp", [-1, 5, 2]]]}, "result": [[0.0021483283], 0, 22.216581344604492, 1611937168.9692307], "version": 0.2, "tvm_version": "0.8.dev0"}
{"input": ["opencl -keys=opencl,gpu -max_num_threads=256", "tutorial/conv2d_no_batching", [1, 40, 40, 512, 256, 1, 1, [1, 1], [0, 0]], {}], "config": {"index": 18284, "code_hash": null, "entity": [["tile_ic", "sp", [-1, 1, 4]], ["tile_oc", "sp", [-1, 16]], ["tile_ow", "sp", [-1, 2, 2]], ["tile_oh", "sp", [-1, 5, 4]]]}, "result": [[0.0022604378], 0, 31.370689868927002, 1611937178.1325612], "version": 0.2, "tvm_version": "0.8.dev0"}
{"input": ["opencl -keys=opencl,gpu -max_num_threads=256", "tutorial/conv2d_no_batching", [1, 40, 40, 512, 256, 1, 1, [1, 1], [0, 0]], {}], "config": {"index": 6651, "code_hash": null, "entity": [["tile_ic", "sp", [-1, 2, 4]], ["tile_oc", "sp", [-1, 64]], ["tile_ow", "sp", [-1, 2, 4]], ["tile_oh", "sp", [-1, 5, 2]]]}, "result": [[0.0023428856], 0, 26.85775089263916, 1611937173.6088119], "version": 0.2, "tvm_version": "0.8.dev0"}
{"input": ["opencl -keys=opencl,gpu -max_num_threads=256", "tutorial/conv2d_no_batching", [1, 40, 40, 512, 256, 1, 1, [1, 1], [0, 0]], {}], "config": {"index": 18291, "code_hash": null, "entity": [["tile_ic", "sp", [-1, 1, 4]], ["tile_oc", "sp", [-1, 32]], ["tile_ow", "sp", [-1, 2, 2]], ["tile_oh", "sp", [-1, 5, 4]]]}, "result": [[0.0019231877], 0, 35.902852058410645, 1611937182.6829898], "version": 0.2, "tvm_version": "0.8.dev0"}
{"input": ["opencl -keys=opencl,gpu -max_num_threads=256", "tutorial/conv2d_no_batching", [1, 40, 40, 512, 256, 1, 1, [1, 1], [0, 0]], {}], "config": {"index": 5125, "code_hash": null, "entity": [["tile_ic", "sp", [-1, 2, 4]], ["tile_oc", "sp", [-1, 16]], ["tile_ow", "sp", [-1, 2, 4]], ["tile_oh", "sp", [-1, 4, 2]]]}, "result": [[0.0023473439], 0, 40.4409294128418, 1611937187.2344644], "version": 0.2, "tvm_version": "0.8.dev0"}
{"input": ["opencl -keys=opencl,gpu -max_num_threads=256", "tutorial/conv2d_no_batching", [1, 40, 40, 512, 256, 1, 1, [1, 1], [0, 0]], {}], "config": {"index": 15211, "code_hash": null, "entity": [["tile_ic", "sp", [-1, 1, 4]], ["tile_oc", "sp", [-1, 32]], ["tile_ow", "sp", [-1, 1, 2]], ["tile_oh", "sp", [-1, 2, 4]]]}, "result": [[0.0019378387000000001], 0, 44.90950345993042, 1611937191.697476], "version": 0.2, "tvm_version": "0.8.dev0"}
{"input": ["opencl -keys=opencl,gpu -max_num_threads=256", "tutorial/conv2d_no_batching", [1, 40, 40, 512, 256, 1, 1, [1, 1], [0, 0]], {}], "config": {"index": 6595, "code_hash": null, "entity": [["tile_ic", "sp", [-1, 2, 4]], ["tile_oc", "sp", [-1, 64]], ["tile_ow", "sp", [-1, 1, 4]], ["tile_oh", "sp", [-1, 5, 2]]]}, "result": [[0.0023418232], 0, 49.444313049316406, 1611937196.2391217], "version": 0.2, "tvm_version": "0.8.dev0"}
{"input": ["opencl -keys=opencl,gpu -max_num_threads=256", "tutorial/conv2d_no_batching", [1, 40, 40, 512, 256, 1, 1, [1, 1], [0, 0]], {}], "config": {"index": 3115, "code_hash": null, "entity": [["tile_ic", "sp", [-1, 1, 4]], ["tile_oc", "sp", [-1, 32]], ["tile_ow", "sp", [-1, 1, 2]], ["tile_oh", "sp", [-1, 2, 2]]]}, "result": [[0.0023620315], 0, 53.93072509765625, 1611937200.739805], "version": 0.2, "tvm_version": "0.8.dev0"}
{"input": ["opencl -keys=opencl,gpu -max_num_threads=256", "tutorial/conv2d_no_batching", [1, 40, 40, 512, 256, 1, 1, [1, 1], [0, 0]], {}], "config": {"index": 4620, "code_hash": null, "entity": [["tile_ic", "sp", [-1, 1, 4]], ["tile_oc", "sp", [-1, 16]], ["tile_ow", "sp", [-1, 1, 2]], ["tile_oh", "sp", [-1, 4, 2]]]}, "result": [[0.0022895627], 0, 58.40833330154419, 1611937205.222781], "version": 0.2, "tvm_version": "0.8.dev0"}
{"input": ["opencl -keys=opencl,gpu -max_num_threads=256", "tutorial/conv2d_no_batching", [1, 40, 40, 512, 256, 1, 1, [1, 1], [0, 0]], {}], "config": {"index": 6930, "code_hash": null, "entity": [["tile_ic", "sp", [-1, 1, 4]], ["tile_oc", "sp", [-1, 64]], ["tile_ow", "sp", [-1, 1, 8]], ["tile_oh", "sp", [-1, 5, 2]]]}, "result": [[0.0023734638], 0, 63.082414865493774, 1611937209.8965406], "version": 0.2, "tvm_version": "0.8.dev0"}
{"input": ["opencl -keys=opencl,gpu -max_num_threads=256", "tutorial/conv2d_no_batching", [1, 40, 40, 512, 256, 1, 1, [1, 1], [0, 0]], {}], "config": {"index": 15218, "code_hash": null, "entity": [["tile_ic", "sp", [-1, 1, 4]], ["tile_oc", "sp", [-1, 64]], ["tile_ow", "sp", [-1, 1, 2]], ["tile_oh", "sp", [-1, 2, 4]]]}, "result": [[0.0019346304000000003], 0, 67.71130037307739, 1611937214.5389757], "version": 0.2, "tvm_version": "0.8.dev0"}
{"input": ["opencl -keys=opencl,gpu -max_num_threads=256", "tutorial/conv2d_no_batching", [1, 40, 40, 512, 256, 1, 1, [1, 1], [0, 0]], {}], "config": {"index": 15268, "code_hash": null, "entity": [["tile_ic", "sp", [-1, 2, 4]], ["tile_oc", "sp", [-1, 32]], ["tile_ow", "sp", [-1, 2, 2]], ["tile_oh", "sp", [-1, 2, 4]]]}, "result": [[0.0023654274], 0, 72.29578685760498, 1611937219.1265228], "version": 0.2, "tvm_version": "0.8.dev0"}
{"input": ["opencl -keys=opencl,gpu -max_num_threads=256", "tutorial/conv2d_no_batching", [1, 40, 40, 512, 256, 1, 1, [1, 1], [0, 0]], {}], "config": {"index": 15274, "code_hash": null, "entity": [["tile_ic", "sp", [-1, 1, 4]], ["tile_oc", "sp", [-1, 64]], ["tile_ow", "sp", [-1, 2, 2]], ["tile_oh", "sp", [-1, 2, 4]]]}, "result": [[0.0019321669], 0, 63.471078872680664, 1611937287.0406446], "version": 0.2, "tvm_version": "0.8.dev0"}
{"input": ["opencl -keys=opencl,gpu -max_num_threads=256", "tutorial/conv2d_no_batching", [1, 40, 40, 512, 256, 1, 1, [1, 1], [0, 0]], {}], "config": {"index": 6594, "code_hash": null, "entity": [["tile_ic", "sp", [-1, 1, 4]], ["tile_oc", "sp", [-1, 64]], ["tile_ow", "sp", [-1, 1, 4]], ["tile_oh", "sp", [-1, 5, 2]]]}, "result": [[0.0019182502], 0, 67.91121482849121, 1611937291.4660926], "version": 0.2, "tvm_version": "0.8.dev0"}
{"input": ["opencl -keys=opencl,gpu -max_num_threads=256", "tutorial/conv2d_no_batching", [1, 40, 40, 512, 256, 1, 1, [1, 1], [0, 0]], {}], "config": {"index": 9611, "code_hash": null, "entity": [["tile_ic", "sp", [-1, 1, 4]], ["tile_oc", "sp", [-1, 32]], ["tile_ow", "sp", [-1, 1, 4]], ["tile_oh", "sp", [-1, 10, 2]]]}, "result": [[0.001917271], 0, 72.27903008460999, 1611937295.8425405], "version": 0.2, "tvm_version": "0.8.dev0"}
{"input": ["opencl -keys=opencl,gpu -max_num_threads=256", "tutorial/conv2d_no_batching", [1, 40, 40, 512, 256, 1, 1, [1, 1], [0, 0]], {}], "config": {"index": 18347, "code_hash": null, "entity": [["tile_ic", "sp", [-1, 1, 4]], ["tile_oc", "sp", [-1, 32]], ["tile_ow", "sp", [-1, 4, 2]], ["tile_oh", "sp", [-1, 5, 4]]]}, "result": [[0.0020397658], 0, 76.84056401252747, 1611937300.3912811], "version": 0.2, "tvm_version": "0.8.dev0"}
{"input": ["opencl -keys=opencl,gpu -max_num_threads=256", "tutorial/conv2d_no_batching", [1, 40, 40, 512, 256, 1, 1, [1, 1], [0, 0]], {}], "config": {"index": 3171, "code_hash": null, "entity": [["tile_ic", "sp", [-1, 1, 4]], ["tile_oc", "sp", [-1, 32]], ["tile_ow", "sp", [-1, 2, 2]], ["tile_oh", "sp", [-1, 2, 2]]]}, "result": [[0.0022884794], 0, 81.5331642627716, 1611937305.1247337], "version": 0.2, "tvm_version": "0.8.dev0"}
{"input": ["opencl -keys=opencl,gpu -max_num_threads=256", "tutorial/conv2d_no_batching", [1, 40, 40, 512, 256, 1, 1, [1, 1], [0, 0]], {}], "config": {"index": 6195, "code_hash": null, "entity": [["tile_ic", "sp", [-1, 1, 4]], ["tile_oc", "sp", [-1, 32]], ["tile_ow", "sp", [-1, 2, 2]], ["tile_oh", "sp", [-1, 5, 2]]]}, "result": [[0.0022965783999999998], 0, 4.329031705856323, 1611937319.2375045], "version": 0.2, "tvm_version": "0.8.dev0"}
{"input": ["opencl -keys=opencl,gpu -max_num_threads=256", "tutorial/conv2d_no_batching", [1, 40, 40, 512, 256, 1, 1, [1, 1], [0, 0]], {}], "config": {"index": 18242, "code_hash": null, "entity": [["tile_ic", "sp", [-1, 1, 4]], ["tile_oc", "sp", [-1, 64]], ["tile_ow", "sp", [-1, 1, 2]], ["tile_oh", "sp", [-1, 5, 4]]]}, "result": [[0.0019680939], 0, 8.821051120758057, 1611937323.775205], "version": 0.2, "tvm_version": "0.8.dev0"}
{"input": ["opencl -keys=opencl,gpu -max_num_threads=256", "tutorial/conv2d_no_batching", [1, 40, 40, 512, 256, 1, 1, [1, 1], [0, 0]], {}], "config": {"index": 6202, "code_hash": null, "entity": [["tile_ic", "sp", [-1, 1, 4]], ["tile_oc", "sp", [-1, 64]], ["tile_ow", "sp", [-1, 2, 2]], ["tile_oh", "sp", [-1, 5, 2]]]}, "result": [[0.0022789638], 0, 13.395430326461792, 1611937328.323409], "version": 0.2, "tvm_version": "0.8.dev0"}
{"input": ["opencl -keys=opencl,gpu -max_num_threads=256", "tutorial/conv2d_no_batching", [1, 40, 40, 512, 256, 1, 1, [1, 1], [0, 0]], {}], "config": {"index": 16779, "code_hash": null, "entity": [["tile_ic", "sp", [-1, 1, 4]], ["tile_oc", "sp", [-1, 32]], ["tile_ow", "sp", [-1, 2, 2]], ["tile_oh", "sp", [-1, 4, 4]]]}, "result": [[0.0039311775], 0, 18.111852645874023, 1611937333.0747657], "version": 0.2, "tvm_version": "0.8.dev0"}
{"input": ["opencl -keys=opencl,gpu -max_num_threads=256", "tutorial/conv2d_no_batching", [1, 40, 40, 512, 256, 1, 1, [1, 1], [0, 0]], {}], "config": {"index": 21308, "code_hash": null, "entity": [["tile_ic", "sp", [-1, 1, 4]], ["tile_oc", "sp", [-1, 16]], ["tile_ow", "sp", [-1, 2, 2]], ["tile_oh", "sp", [-1, 10, 4]]]}, "result": [[0.0019968179], 0, 22.73981738090515, 1611937337.690174], "version": 0.2, "tvm_version": "0.8.dev0"}
{"input": ["opencl -keys=opencl,gpu -max_num_threads=256", "tutorial/conv2d_no_batching", [1, 40, 40, 512, 256, 1, 1, [1, 1], [0, 0]], {}], "config": {"index": 16730, "code_hash": null, "entity": [["tile_ic", "sp", [-1, 1, 4]], ["tile_oc", "sp", [-1, 64]], ["tile_ow", "sp", [-1, 1, 2]], ["tile_oh", "sp", [-1, 4, 4]]]}, "result": [[0.0039671879], 0, 27.431637287139893, 1611937342.4189246], "version": 0.2, "tvm_version": "0.8.dev0"}
{"input": ["opencl -keys=opencl,gpu -max_num_threads=256", "tutorial/conv2d_no_batching", [1, 40, 40, 512, 256, 1, 1, [1, 1], [0, 0]], {}], "config": {"index": 15309, "code_hash": null, "entity": [["tile_ic", "sp", [-1, 1, 4]], ["tile_oc", "sp", [-1, 8]], ["tile_ow", "sp", [-1, 4, 2]], ["tile_oh", "sp", [-1, 2, 4]]]}, "result": [[0.0019670887000000003], 0, 41.1921911239624, 1611937356.1602874], "version": 0.2, "tvm_version": "0.8.dev0"}
{"input": ["opencl -keys=opencl,gpu -max_num_threads=256", "tutorial/conv2d_no_batching", [1, 40, 40, 512, 256, 1, 1, [1, 1], [0, 0]], {}], "config": {"index": 18340, "code_hash": null, "entity": [["tile_ic", "sp", [-1, 1, 4]], ["tile_oc", "sp", [-1, 16]], ["tile_ow", "sp", [-1, 4, 2]], ["tile_oh", "sp", [-1, 5, 4]]]}, "result": [[0.0020129325], 0, 36.62828993797302, 1611937351.5983021], "version": 0.2, "tvm_version": "0.8.dev0"}
{"input": ["opencl -keys=opencl,gpu -max_num_threads=256", "tutorial/conv2d_no_batching", [1, 40, 40, 512, 256, 1, 1, [1, 1], [0, 0]], {}], "config": {"index": 6203, "code_hash": null, "entity": [["tile_ic", "sp", [-1, 2, 4]], ["tile_oc", "sp", [-1, 64]], ["tile_ow", "sp", [-1, 2, 2]], ["tile_oh", "sp", [-1, 5, 2]]]}, "result": [[0.0022982398], 0, 32.003544330596924, 1611937347.0023296], "version": 0.2, "tvm_version": "0.8.dev0"}
{"input": ["opencl -keys=opencl,gpu -max_num_threads=256", "tutorial/conv2d_no_batching", [1, 40, 40, 512, 256, 1, 1, [1, 1], [0, 0]], {}], "config": {"index": 21364, "code_hash": null, "entity": [["tile_ic", "sp", [-1, 1, 4]], ["tile_oc", "sp", [-1, 16]], ["tile_ow", "sp", [-1, 4, 2]], ["tile_oh", "sp", [-1, 10, 4]]]}, "result": [[0.0020302867], 0, 45.65485978126526, 1611937360.6833932], "version": 0.2, "tvm_version": "0.8.dev0"}
{"input": ["opencl -keys=opencl,gpu -max_num_threads=256", "tutorial/conv2d_no_batching", [1, 40, 40, 512, 256, 1, 1, [1, 1], [0, 0]], {}], "config": {"index": 15253, "code_hash": null, "entity": [["tile_ic", "sp", [-1, 1, 4]], ["tile_oc", "sp", [-1, 8]], ["tile_ow", "sp", [-1, 2, 2]], ["tile_oh", "sp", [-1, 2, 4]]]}, "result": [[0.0033427867999999998], 0, 50.341105222702026, 1611937365.3764598], "version": 0.2, "tvm_version": "0.8.dev0"}
{"input": ["opencl -keys=opencl,gpu -max_num_threads=256", "tutorial/conv2d_no_batching", [1, 40, 40, 512, 256, 1, 1, [1, 1], [0, 0]], {}], "config": {"index": 5117, "code_hash": null, "entity": [["tile_ic", "sp", [-1, 1, 4]], ["tile_oc", "sp", [-1, 8]], ["tile_ow", "sp", [-1, 2, 4]], ["tile_oh", "sp", [-1, 4, 2]]]}, "result": [[0.0019418023], 0, 54.74291491508484, 1611937369.791672], "version": 0.2, "tvm_version": "0.8.dev0"}
{"input": ["opencl -keys=opencl,gpu -max_num_threads=256", "tutorial/conv2d_no_batching", [1, 40, 40, 512, 256, 1, 1, [1, 1], [0, 0]], {}], "config": {"index": 4684, "code_hash": null, "entity": [["tile_ic", "sp", [-1, 2, 4]], ["tile_oc", "sp", [-1, 32]], ["tile_ow", "sp", [-1, 2, 2]], ["tile_oh", "sp", [-1, 4, 2]]]}, "result": [[0.0023111617], 0, 59.262818574905396, 1611937374.31576], "version": 0.2, "tvm_version": "0.8.dev0"}
{"input": ["opencl -keys=opencl,gpu -max_num_threads=256", "tutorial/conv2d_no_batching", [1, 40, 40, 512, 256, 1, 1, [1, 1], [0, 0]], {}], "config": {"index": 4690, "code_hash": null, "entity": [["tile_ic", "sp", [-1, 1, 4]], ["tile_oc", "sp", [-1, 64]], ["tile_ow", "sp", [-1, 2, 2]], ["tile_oh", "sp", [-1, 4, 2]]]}, "result": [[0.0022718649], 0, 73.00968956947327, 1611937388.077027], "version": 0.2, "tvm_version": "0.8.dev0"}
{"input": ["opencl -keys=opencl,gpu -max_num_threads=256", "tutorial/conv2d_no_batching", [1, 40, 40, 512, 256, 1, 1, [1, 1], [0, 0]], {}], "config": {"index": 4634, "code_hash": null, "entity": [["tile_ic", "sp", [-1, 1, 4]], ["tile_oc", "sp", [-1, 64]], ["tile_ow", "sp", [-1, 1, 2]], ["tile_oh", "sp", [-1, 4, 2]]]}, "result": [[0.0022634325], 0, 63.921143531799316, 1611937378.9972906], "version": 0.2, "tvm_version": "0.8.dev0"}
{"input": ["opencl -keys=opencl,gpu -max_num_threads=256", "tutorial/conv2d_no_batching", [1, 40, 40, 512, 256, 1, 1, [1, 1], [0, 0]], {}], "config": {"index": 3178, "code_hash": null, "entity": [["tile_ic", "sp", [-1, 1, 4]], ["tile_oc", "sp", [-1, 64]], ["tile_ow", "sp", [-1, 2, 2]], ["tile_oh", "sp", [-1, 2, 2]]]}, "result": [[0.0022673908], 0, 68.48911046981812, 1611937383.565968], "version": 0.2, "tvm_version": "0.8.dev0"}
{"input": ["opencl -keys=opencl,gpu -max_num_threads=256", "tutorial/conv2d_no_batching", [1, 40, 40, 512, 256, 1, 1, [1, 1], [0, 0]], {}], "config": {"index": 21252, "code_hash": null, "entity": [["tile_ic", "sp", [-1, 1, 4]], ["tile_oc", "sp", [-1, 16]], ["tile_ow", "sp", [-1, 1, 2]], ["tile_oh", "sp", [-1, 10, 4]]]}, "result": [[0.0023290575], 0, 4.086772441864014, 1611937393.0565426], "version": 0.2, "tvm_version": "0.8.dev0"}
{"input": ["opencl -keys=opencl,gpu -max_num_threads=256", "tutorial/conv2d_no_batching", [1, 40, 40, 512, 256, 1, 1, [1, 1], [0, 0]], {}], "config": {"index": 15225, "code_hash": null, "entity": [["tile_ic", "sp", [-1, 1, 4]], ["tile_oc", "sp", [-1, 128]], ["tile_ow", "sp", [-1, 1, 2]], ["tile_oh", "sp", [-1, 2, 4]]]}, "result": [[0.0019525627], 0, 8.551884412765503, 1611937397.526176], "version": 0.2, "tvm_version": "0.8.dev0"}
{"input": ["opencl -keys=opencl,gpu -max_num_threads=256", "tutorial/conv2d_no_batching", [1, 40, 40, 512, 256, 1, 1, [1, 1], [0, 0]], {}], "config": {"index": 15204, "code_hash": null, "entity": [["tile_ic", "sp", [-1, 1, 4]], ["tile_oc", "sp", [-1, 16]], ["tile_ow", "sp", [-1, 1, 2]], ["tile_oh", "sp", [-1, 2, 4]]]}, "result": [[0.0033124379000000004], 0, 13.073239803314209, 1611937402.057121], "version": 0.2, "tvm_version": "0.8.dev0"}
{"input": ["opencl -keys=opencl,gpu -max_num_threads=256", "tutorial/conv2d_no_batching", [1, 40, 40, 512, 256, 1, 1, [1, 1], [0, 0]], {}], "config": {"index": 6146, "code_hash": null, "entity": [["tile_ic", "sp", [-1, 1, 4]], ["tile_oc", "sp", [-1, 64]], ["tile_ow", "sp", [-1, 1, 2]], ["tile_oh", "sp", [-1, 5, 2]]]}, "result": [[0.0023219637], 0, 17.46367883682251, 1611937406.4598095], "version": 0.2, "tvm_version": "0.8.dev0"}
{"input": ["opencl -keys=opencl,gpu -max_num_threads=256", "tutorial/conv2d_no_batching", [1, 40, 40, 512, 256, 1, 1, [1, 1], [0, 0]], {}], "config": {"index": 12628, "code_hash": null, "entity": [["tile_ic", "sp", [-1, 1, 4]], ["tile_oc", "sp", [-1, 16]], ["tile_ow", "sp", [-1, 1, 4]], ["tile_oh", "sp", [-1, 20, 2]]]}, "result": [[0.0020394169], 0, 21.86947989463806, 1611937410.86102], "version": 0.2, "tvm_version": "0.8.dev0"}
{"input": ["opencl -keys=opencl,gpu -max_num_threads=256", "tutorial/conv2d_no_batching", [1, 40, 40, 512, 256, 1, 1, [1, 1], [0, 0]], {}], "config": {"index": 18298, "code_hash": null, "entity": [["tile_ic", "sp", [-1, 1, 4]], ["tile_oc", "sp", [-1, 64]], ["tile_ow", "sp", [-1, 2, 2]], ["tile_oh", "sp", [-1, 5, 4]]]}, "result": [[0.0019780054], 0, 26.359169721603394, 1611937415.3434827], "version": 0.2, "tvm_version": "0.8.dev0"}
{"input": ["opencl -keys=opencl,gpu -max_num_threads=256", "tutorial/conv2d_no_batching", [1, 40, 40, 512, 256, 1, 1, [1, 1], [0, 0]], {}], "config": {"index": 15302, "code_hash": null, "entity": [["tile_ic", "sp", [-1, 1, 4]], ["tile_oc", "sp", [-1, 4]], ["tile_ow", "sp", [-1, 4, 2]], ["tile_oh", "sp", [-1, 2, 4]]]}, "result": [[0.0033738389], 0, 35.588390588760376, 1611937424.5757616], "version": 0.2, "tvm_version": "0.8.dev0"}
{"input": ["opencl -keys=opencl,gpu -max_num_threads=256", "tutorial/conv2d_no_batching", [1, 40, 40, 512, 256, 1, 1, [1, 1], [0, 0]], {}], "config": {"index": 3612, "code_hash": null, "entity": [["tile_ic", "sp", [-1, 1, 4]], ["tile_oc", "sp", [-1, 16]], ["tile_ow", "sp", [-1, 2, 4]], ["tile_oh", "sp", [-1, 2, 2]]]}, "result": [[0.0019169950000000001], 0, 30.838403463363647, 1611937419.8384583], "version": 0.2, "tvm_version": "0.8.dev0"}
{"input": ["opencl -keys=opencl,gpu -max_num_threads=256", "tutorial/conv2d_no_batching", [1, 40, 40, 512, 256, 1, 1, [1, 1], [0, 0]], {}], "config": {"index": 21420, "code_hash": null, "entity": [["tile_ic", "sp", [-1, 1, 4]], ["tile_oc", "sp", [-1, 16]], ["tile_ow", "sp", [-1, 5, 2]], ["tile_oh", "sp", [-1, 10, 4]]]}, "result": [[0.0020845522], 0, 40.11629581451416, 1611937429.1254828], "version": 0.2, "tvm_version": "0.8.dev0"}
{"input": ["opencl -keys=opencl,gpu -max_num_threads=256", "tutorial/conv2d_no_batching", [1, 40, 40, 512, 256, 1, 1, [1, 1], [0, 0]], {}], "config": {"index": 9667, "code_hash": null, "entity": [["tile_ic", "sp", [-1, 1, 4]], ["tile_oc", "sp", [-1, 32]], ["tile_ow", "sp", [-1, 2, 4]], ["tile_oh", "sp", [-1, 10, 2]]]}, "result": [[0.0020275731], 0, 49.17366433143616, 1611937438.1898494], "version": 0.2, "tvm_version": "0.8.dev0"}
{"input": ["opencl -keys=opencl,gpu -max_num_threads=256", "tutorial/conv2d_no_batching", [1, 40, 40, 512, 256, 1, 1, [1, 1], [0, 0]], {}], "config": {"index": 6188, "code_hash": null, "entity": [["tile_ic", "sp", [-1, 1, 4]], ["tile_oc", "sp", [-1, 16]], ["tile_ow", "sp", [-1, 2, 2]], ["tile_oh", "sp", [-1, 5, 2]]]}, "result": [[0.0027293857], 0, 44.627241373062134, 1611937433.6538608], "version": 0.2, "tvm_version": "0.8.dev0"}
{"input": ["opencl -keys=opencl,gpu -max_num_threads=256", "tutorial/conv2d_no_batching", [1, 40, 40, 512, 256, 1, 1, [1, 1], [0, 0]], {}], "config": {"index": 8099, "code_hash": null, "entity": [["tile_ic", "sp", [-1, 1, 4]], ["tile_oc", "sp", [-1, 32]], ["tile_ow", "sp", [-1, 1, 4]], ["tile_oh", "sp", [-1, 8, 2]]]}, "result": [[0.0031786305], 0, 62.68006896972656, 1611937451.7050452], "version": 0.2, "tvm_version": "0.8.dev0"}
{"input": ["opencl -keys=opencl,gpu -max_num_threads=256", "tutorial/conv2d_no_batching", [1, 40, 40, 512, 256, 1, 1, [1, 1], [0, 0]], {}], "config": {"index": 6580, "code_hash": null, "entity": [["tile_ic", "sp", [-1, 1, 4]], ["tile_oc", "sp", [-1, 16]], ["tile_ow", "sp", [-1, 1, 4]], ["tile_oh", "sp", [-1, 5, 2]]]}, "result": [[0.0029398493], 0, 67.1373553276062, 1611937456.1774976], "version": 0.2, "tvm_version": "0.8.dev0"}
{"input": ["opencl -keys=opencl,gpu -max_num_threads=256", "tutorial/conv2d_no_batching", [1, 40, 40, 512, 256, 1, 1, [1, 1], [0, 0]], {}], "config": {"index": 4732, "code_hash": null, "entity": [["tile_ic", "sp", [-1, 1, 4]], ["tile_oc", "sp", [-1, 16]], ["tile_ow", "sp", [-1, 4, 2]], ["tile_oh", "sp", [-1, 4, 2]]]}, "result": [[0.0022635107], 0, 53.61734652519226, 1611937442.6632786], "version": 0.2, "tvm_version": "0.8.dev0"}
{"input": ["opencl -keys=opencl,gpu -max_num_threads=256", "tutorial/conv2d_no_batching", [1, 40, 40, 512, 256, 1, 1, [1, 1], [0, 0]], {}], "config": {"index": 16772, "code_hash": null, "entity": [["tile_ic", "sp", [-1, 1, 4]], ["tile_oc", "sp", [-1, 16]], ["tile_ow", "sp", [-1, 2, 2]], ["tile_oh", "sp", [-1, 4, 4]]]}, "result": [[0.0039445889], 0, 58.17710280418396, 1611937447.2447903], "version": 0.2, "tvm_version": "0.8.dev0"}
{"input": ["opencl -keys=opencl,gpu -max_num_threads=256", "tutorial/conv2d_no_batching", [1, 40, 40, 512, 256, 1, 1, [1, 1], [0, 0]], {}], "config": {"index": 3563, "code_hash": null, "entity": [["tile_ic", "sp", [-1, 1, 4]], ["tile_oc", "sp", [-1, 32]], ["tile_ow", "sp", [-1, 1, 4]], ["tile_oh", "sp", [-1, 2, 2]]]}, "result": [[0.001907297], 0, 71.64692449569702, 1611937460.7267985], "version": 0.2, "tvm_version": "0.8.dev0"}
{"input": ["opencl -keys=opencl,gpu -max_num_threads=256", "tutorial/conv2d_no_batching", [1, 40, 40, 512, 256, 1, 1, [1, 1], [0, 0]], {}], "config": {"index": 21315, "code_hash": null, "entity": [["tile_ic", "sp", [-1, 1, 4]], ["tile_oc", "sp", [-1, 32]], ["tile_ow", "sp", [-1, 2, 2]], ["tile_oh", "sp", [-1, 10, 4]]]}, "result": [[0.001996594], 0, 4.069863319396973, 1611937465.6597567], "version": 0.2, "tvm_version": "0.8.dev0"}
{"input": ["opencl -keys=opencl,gpu -max_num_threads=256", "tutorial/conv2d_no_batching", [1, 40, 40, 512, 256, 1, 1, [1, 1], [0, 0]], {}], "config": {"index": 9618, "code_hash": null, "entity": [["tile_ic", "sp", [-1, 1, 4]], ["tile_oc", "sp", [-1, 64]], ["tile_ow", "sp", [-1, 1, 4]], ["tile_oh", "sp", [-1, 10, 2]]]}, "result": [[0.0019057345], 0, 8.625998497009277, 1611937470.1941895], "version": 0.2, "tvm_version": "0.8.dev0"}
{"input": ["opencl -keys=opencl,gpu -max_num_threads=256", "tutorial/conv2d_no_batching", [1, 40, 40, 512, 256, 1, 1, [1, 1], [0, 0]], {}], "config": {"index": 5061, "code_hash": null, "entity": [["tile_ic", "sp", [-1, 1, 4]], ["tile_oc", "sp", [-1, 8]], ["tile_ow", "sp", [-1, 1, 4]], ["tile_oh", "sp", [-1, 4, 2]]]}, "result": [[0.0033662295000000003], 0, 13.137007713317871, 1611937474.7263513], "version": 0.2, "tvm_version": "0.8.dev0"}
{"input": ["opencl -keys=opencl,gpu -max_num_threads=256", "tutorial/conv2d_no_batching", [1, 40, 40, 512, 256, 1, 1, [1, 1], [0, 0]], {}], "config": {"index": 21259, "code_hash": null, "entity": [["tile_ic", "sp", [-1, 1, 4]], ["tile_oc", "sp", [-1, 32]], ["tile_ow", "sp", [-1, 1, 2]], ["tile_oh", "sp", [-1, 10, 4]]]}, "result": [[0.0019513178999999998], 0, 17.649291038513184, 1611937479.244507], "version": 0.2, "tvm_version": "0.8.dev0"}
{"input": ["opencl -keys=opencl,gpu -max_num_threads=256", "tutorial/conv2d_no_batching", [1, 40, 40, 512, 256, 1, 1, [1, 1], [0, 0]], {}], "config": {"index": 16828, "code_hash": null, "entity": [["tile_ic", "sp", [-1, 1, 4]], ["tile_oc", "sp", [-1, 16]], ["tile_ow", "sp", [-1, 4, 2]], ["tile_oh", "sp", [-1, 4, 4]]]}, "result": [[0.0039602816], 0, 22.14604687690735, 1611937483.7371595], "version": 0.2, "tvm_version": "0.8.dev0"}
{"input": ["opencl -keys=opencl,gpu -max_num_threads=256", "tutorial/conv2d_no_batching", [1, 40, 40, 512, 256, 1, 1, [1, 1], [0, 0]], {}], "config": {"index": 6251, "code_hash": null, "entity": [["tile_ic", "sp", [-1, 1, 4]], ["tile_oc", "sp", [-1, 32]], ["tile_ow", "sp", [-1, 4, 2]], ["tile_oh", "sp", [-1, 5, 2]]]}, "result": [[0.002328896], 0, 26.649493932724, 1611937488.2548127], "version": 0.2, "tvm_version": "0.8.dev0"}
{"input": ["opencl -keys=opencl,gpu -max_num_threads=256", "tutorial/conv2d_no_batching", [1, 40, 40, 512, 256, 1, 1, [1, 1], [0, 0]], {}], "config": {"index": 9219, "code_hash": null, "entity": [["tile_ic", "sp", [-1, 1, 4]], ["tile_oc", "sp", [-1, 32]], ["tile_ow", "sp", [-1, 2, 2]], ["tile_oh", "sp", [-1, 10, 2]]]}, "result": [[0.0023535263], 0, 40.39761805534363, 1611937502.0078008], "version": 0.2, "tvm_version": "0.8.dev0"}
{"input": ["opencl -keys=opencl,gpu -max_num_threads=256", "tutorial/conv2d_no_batching", [1, 40, 40, 512, 256, 1, 1, [1, 1], [0, 0]], {}], "config": {"index": 9171, "code_hash": null, "entity": [["tile_ic", "sp", [-1, 2, 4]], ["tile_oc", "sp", [-1, 64]], ["tile_ow", "sp", [-1, 1, 2]], ["tile_oh", "sp", [-1, 10, 2]]]}, "result": [[0.002303271], 0, 31.150793313980103, 1611937492.7652342], "version": 0.2, "tvm_version": "0.8.dev0"}
{"input": ["opencl -keys=opencl,gpu -max_num_threads=256", "tutorial/conv2d_no_batching", [1, 40, 40, 512, 256, 1, 1, [1, 1], [0, 0]], {}], "config": {"index": 16765, "code_hash": null, "entity": [["tile_ic", "sp", [-1, 1, 4]], ["tile_oc", "sp", [-1, 8]], ["tile_ow", "sp", [-1, 2, 2]], ["tile_oh", "sp", [-1, 4, 4]]]}, "result": [[0.0039404795999999995], 0, 35.772751331329346, 1611937497.3863766], "version": 0.2, "tvm_version": "0.8.dev0"}
{"input": ["opencl -keys=opencl,gpu -max_num_threads=256", "tutorial/conv2d_no_batching", [1, 40, 40, 512, 256, 1, 1, [1, 1], [0, 0]], {}], "config": {"index": 3172, "code_hash": null, "entity": [["tile_ic", "sp", [-1, 2, 4]], ["tile_oc", "sp", [-1, 32]], ["tile_ow", "sp", [-1, 2, 2]], ["tile_oh", "sp", [-1, 2, 2]]]}, "result": [[0.0023024638], 0, 44.93614315986633, 1611937506.5620883], "version": 0.2, "tvm_version": "0.8.dev0"}
{"input": ["opencl -keys=opencl,gpu -max_num_threads=256", "tutorial/conv2d_no_batching", [1, 40, 40, 512, 256, 1, 1, [1, 1], [0, 0]], {}], "config": {"index": 6196, "code_hash": null, "entity": [["tile_ic", "sp", [-1, 2, 4]], ["tile_oc", "sp", [-1, 32]], ["tile_ow", "sp", [-1, 2, 2]], ["tile_oh", "sp", [-1, 5, 2]]]}, "result": [[0.0023560158], 0, 49.44725775718689, 1611937511.0821292], "version": 0.2, "tvm_version": "0.8.dev0"}
{"input": ["opencl -keys=opencl,gpu -max_num_threads=256", "tutorial/conv2d_no_batching", [1, 40, 40, 512, 256, 1, 1, [1, 1], [0, 0]], {}], "config": {"index": 12684, "code_hash": null, "entity": [["tile_ic", "sp", [-1, 1, 4]], ["tile_oc", "sp", [-1, 16]], ["tile_ow", "sp", [-1, 2, 4]], ["tile_oh", "sp", [-1, 20, 2]]]}, "result": [[0.0020827709999999998], 0, 67.30936741828918, 1611937528.9470038], "version": 0.2, "tvm_version": "0.8.dev0"}
{"input": ["opencl -keys=opencl,gpu -max_num_threads=256", "tutorial/conv2d_no_batching", [1, 40, 40, 512, 256, 1, 1, [1, 1], [0, 0]], {}], "config": {"index": 15358, "code_hash": null, "entity": [["tile_ic", "sp", [-1, 1, 4]], ["tile_oc", "sp", [-1, 4]], ["tile_ow", "sp", [-1, 5, 2]], ["tile_oh", "sp", [-1, 2, 4]]]}, "result": [[0.0029786826], 0, 53.92785906791687, 1611937515.5770314], "version": 0.2, "tvm_version": "0.8.dev0"}
{"input": ["opencl -keys=opencl,gpu -max_num_threads=256", "tutorial/conv2d_no_batching", [1, 40, 40, 512, 256, 1, 1, [1, 1], [0, 0]], {}], "config": {"index": 16723, "code_hash": null, "entity": [["tile_ic", "sp", [-1, 1, 4]], ["tile_oc", "sp", [-1, 32]], ["tile_ow", "sp", [-1, 1, 2]], ["tile_oh", "sp", [-1, 4, 4]]]}, "result": [[0.0039727713], 0, 58.485292196273804, 1611937520.1319783], "version": 0.2, "tvm_version": "0.8.dev0"}
{"input": ["opencl -keys=opencl,gpu -max_num_threads=256", "tutorial/conv2d_no_batching", [1, 40, 40, 512, 256, 1, 1, [1, 1], [0, 0]], {}], "config": {"index": 9604, "code_hash": null, "entity": [["tile_ic", "sp", [-1, 1, 4]], ["tile_oc", "sp", [-1, 16]], ["tile_ow", "sp", [-1, 1, 4]], ["tile_oh", "sp", [-1, 10, 2]]]}, "result": [[0.0022598283], 0, 62.89115118980408, 1611937524.553407], "version": 0.2, "tvm_version": "0.8.dev0"}
{"input": ["opencl -keys=opencl,gpu -max_num_threads=256", "tutorial/conv2d_no_batching", [1, 40, 40, 512, 256, 1, 1, [1, 1], [0, 0]], {}], "config": {"index": 19747, "code_hash": null, "entity": [["tile_ic", "sp", [-1, 1, 4]], ["tile_oc", "sp", [-1, 32]], ["tile_ow", "sp", [-1, 1, 2]], ["tile_oh", "sp", [-1, 8, 4]]]}, "result": [[0.0052386984], 0, 72.04553031921387, 1611937533.722912], "version": 0.2, "tvm_version": "0.8.dev0"}
{"input": ["opencl -keys=opencl,gpu -max_num_threads=256", "tutorial/conv2d_no_batching", [1, 40, 40, 512, 256, 1, 1, [1, 1], [0, 0]], {}], "config": {"index": 18333, "code_hash": null, "entity": [["tile_ic", "sp", [-1, 1, 4]], ["tile_oc", "sp", [-1, 8]], ["tile_ow", "sp", [-1, 4, 2]], ["tile_oh", "sp", [-1, 5, 4]]]}, "result": [[0.0023179846], 0, 4.139968395233154, 1611937539.1177995], "version": 0.2, "tvm_version": "0.8.dev0"}
{"input": ["opencl -keys=opencl,gpu -max_num_threads=256", "tutorial/conv2d_no_batching", [1, 40, 40, 512, 256, 1, 1, [1, 1], [0, 0]], {}], "config": {"index": 9163, "code_hash": null, "entity": [["tile_ic", "sp", [-1, 1, 4]], ["tile_oc", "sp", [-1, 32]], ["tile_ow", "sp", [-1, 1, 2]], ["tile_oh", "sp", [-1, 10, 2]]]}, "result": [[0.0023236826], 0, 26.351288557052612, 1611937561.3454816], "version": 0.2, "tvm_version": "0.8.dev0"}
{"input": ["opencl -keys=opencl,gpu -max_num_threads=256", "tutorial/conv2d_no_batching", [1, 40, 40, 512, 256, 1, 1, [1, 1], [0, 0]], {}], "config": {"index": 5054, "code_hash": null, "entity": [["tile_ic", "sp", [-1, 1, 4]], ["tile_oc", "sp", [-1, 4]], ["tile_ow", "sp", [-1, 1, 4]], ["tile_oh", "sp", [-1, 4, 2]]]}, "result": [[0.0065211465], 0, 8.717540979385376, 1611937543.7076368], "version": 0.2, "tvm_version": "0.8.dev0"}
{"input": ["opencl -keys=opencl,gpu -max_num_threads=256", "tutorial/conv2d_no_batching", [1, 40, 40, 512, 256, 1, 1, [1, 1], [0, 0]], {}], "config": {"index": 15246, "code_hash": null, "entity": [["tile_ic", "sp", [-1, 1, 4]], ["tile_oc", "sp", [-1, 4]], ["tile_ow", "sp", [-1, 2, 2]], ["tile_oh", "sp", [-1, 2, 4]]]}, "result": [[0.006514521400000001], 0, 13.24297547340393, 1611937548.2428856], "version": 0.2, "tvm_version": "0.8.dev0"}
{"input": ["opencl -keys=opencl,gpu -max_num_threads=256", "tutorial/conv2d_no_batching", [1, 40, 40, 512, 256, 1, 1, [1, 1], [0, 0]], {}], "config": {"index": 21357, "code_hash": null, "entity": [["tile_ic", "sp", [-1, 1, 4]], ["tile_oc", "sp", [-1, 8]], ["tile_ow", "sp", [-1, 4, 2]], ["tile_oh", "sp", [-1, 10, 4]]]}, "result": [[0.0020440522], 0, 17.629807472229004, 1611937552.6195424], "version": 0.2, "tvm_version": "0.8.dev0"}
{"input": ["opencl -keys=opencl,gpu -max_num_threads=256", "tutorial/conv2d_no_batching", [1, 40, 40, 512, 256, 1, 1, [1, 1], [0, 0]], {}], "config": {"index": 18221, "code_hash": null, "entity": [["tile_ic", "sp", [-1, 1, 4]], ["tile_oc", "sp", [-1, 8]], ["tile_ow", "sp", [-1, 1, 2]], ["tile_oh", "sp", [-1, 5, 4]]]}, "result": [[0.0029504118], 0, 21.991933584213257, 1611937557.0008416], "version": 0.2, "tvm_version": "0.8.dev0"}
