test_and_tune/remote_tmali/tmp/Adreno640.maliexp.log.tmp
{"input": ["opencl -keys=opencl,gpu -max_num_threads=256", "conv2d_no_batching", [1, 28, 28, 256, 256, 1, 1, [1, 1], [0, 0, 0, 0]], {}], "config": {"index": 505, "code_hash": null, "entity": [["tile_ic", "sp", [-1, 2, 4]], ["tile_oc", "sp", [-1, 1]], ["tile_ow", "sp", [-1, 1, 2]], ["tile_oh", "sp", [-1, 14, 2]], ["cmpat_when_kernel", "ot", 1]]}, "result": [[0.0021547008], 0, 0.9798929691314697, 1618483403.7280073], "end_time": 1618483427, "version": 0.2, "tvm_version": "0.8.dev0"}
{"input": ["opencl -keys=opencl,gpu -max_num_threads=256", "conv2d_no_batching", [1, 28, 28, 256, 256, 1, 1, [1, 1], [0, 0, 0, 0]], {}], "config": {"index": 335, "code_hash": null, "entity": [["tile_ic", "sp", [-1, 8, 4]], ["tile_oc", "sp", [-1, 64]], ["tile_ow", "sp", [-1, 7, 4]], ["tile_oh", "sp", [-1, 2, 2]], ["cmpat_when_kernel", "ot", 1]]}, "result": [[0.014047641600000002], 0, 2.5924370288848877, 1618483405.2133093], "end_time": 1618483427, "version": 0.2, "tvm_version": "0.8.dev0"}
{"input": ["opencl -keys=opencl,gpu -max_num_threads=256", "conv2d_no_batching", [1, 28, 28, 256, 256, 1, 1, [1, 1], [0, 0, 0, 0]], {}], "config": {"index": 222, "code_hash": null, "entity": [["tile_ic", "sp", [-1, 4, 4]], ["tile_oc", "sp", [-1, 64]], ["tile_ow", "sp", [-1, 2, 2]], ["tile_oh", "sp", [-1, 2, 2]], ["cmpat_when_kernel", "ot", 1]]}, "result": [[0.0026940416], 0, 3.4398038387298584, 1618483406.2012062], "end_time": 1618483427, "version": 0.2, "tvm_version": "0.8.dev0"}
{"input": ["opencl -keys=opencl,gpu -max_num_threads=256", "conv2d_no_batching", [1, 28, 28, 256, 256, 1, 1, [1, 1], [0, 0, 0, 0]], {}], "config": {"index": 338, "code_hash": null, "entity": [["tile_ic", "sp", [-1, 4, 4]], ["tile_oc", "sp", [-1, 1]], ["tile_ow", "sp", [-1, 1, 2]], ["tile_oh", "sp", [-1, 7, 2]], ["cmpat_when_kernel", "ot", 1]]}, "result": [[0.022796697600000002], 0, 5.0820348262786865, 1618483407.814117], "end_time": 1618483427, "version": 0.2, "tvm_version": "0.8.dev0"}
{"input": ["opencl -keys=opencl,gpu -max_num_threads=256", "conv2d_no_batching", [1, 28, 28, 256, 256, 1, 1, [1, 1], [0, 0, 0, 0]], {}], "config": {"index": 562, "code_hash": null, "entity": [["tile_ic", "sp", [-1, 4, 4]], ["tile_oc", "sp", [-1, 1]], ["tile_ow", "sp", [-1, 7, 2]], ["tile_oh", "sp", [-1, 14, 2]], ["cmpat_when_kernel", "ot", 1]]}, "result": [[0.0041500415999999995], 0, 6.104456186294556, 1618483408.8620377], "end_time": 1618483427, "version": 0.2, "tvm_version": "0.8.dev0"}
{"input": ["opencl -keys=opencl,gpu -max_num_threads=256", "conv2d_no_batching", [1, 28, 28, 256, 256, 1, 1, [1, 1], [0, 0, 0, 0]], {}], "config": {"index": 788, "code_hash": null, "entity": [["tile_ic", "sp", [-1, 1, 4]], ["tile_oc", "sp", [-1, 2]], ["tile_ow", "sp", [-1, 1, 4]], ["tile_oh", "sp", [-1, 1, 4]], ["cmpat_when_kernel", "ot", 1]]}, "result": [[0.033887155200000005], 0, 8.110722064971924, 1618483410.852521], "end_time": 1618483427, "version": 0.2, "tvm_version": "0.8.dev0"}
{"input": ["opencl -keys=opencl,gpu -max_num_threads=256", "conv2d_no_batching", [1, 28, 28, 256, 256, 1, 1, [1, 1], [0, 0, 0, 0]], {}], "config": {"index": 632, "code_hash": null, "entity": [["tile_ic", "sp", [-1, 1, 4]], ["tile_oc", "sp", [-1, 16]], ["tile_ow", "sp", [-1, 1, 4]], ["tile_oh", "sp", [-1, 14, 2]], ["cmpat_when_kernel", "ot", 1]]}, "result": [[0.0005586688000000001], 0, 8.920847654342651, 1618483411.7117422], "end_time": 1618483427, "version": 0.2, "tvm_version": "0.8.dev0"}
{"input": ["opencl -keys=opencl,gpu -max_num_threads=256", "conv2d_no_batching", [1, 28, 28, 256, 256, 1, 1, [1, 1], [0, 0, 0, 0]], {}], "config": {"index": 818, "code_hash": null, "entity": [["tile_ic", "sp", [-1, 4, 4]], ["tile_oc", "sp", [-1, 2]], ["tile_ow", "sp", [-1, 7, 4]], ["tile_oh", "sp", [-1, 1, 4]], ["cmpat_when_kernel", "ot", 1]]}, "result": [[0.010033536000000001], 0, 10.445834875106812, 1618483413.0666983], "end_time": 1618483427, "version": 0.2, "tvm_version": "0.8.dev0"}
{"input": ["opencl -keys=opencl,gpu -max_num_threads=256", "conv2d_no_batching", [1, 28, 28, 256, 256, 1, 1, [1, 1], [0, 0, 0, 0]], {}], "config": {"index": 90, "code_hash": null, "entity": [["tile_ic", "sp", [-1, 4, 4]], ["tile_oc", "sp", [-1, 2]], ["tile_ow", "sp", [-1, 14, 2]], ["tile_oh", "sp", [-1, 1, 2]], ["cmpat_when_kernel", "ot", 1]]}, "result": [[0.0058714624], 0, 11.412322998046875, 1618483414.191679], "end_time": 1618483427, "version": 0.2, "tvm_version": "0.8.dev0"}
{"input": ["opencl -keys=opencl,gpu -max_num_threads=256", "conv2d_no_batching", [1, 28, 28, 256, 256, 1, 1, [1, 1], [0, 0, 0, 0]], {}], "config": {"index": 925, "code_hash": null, "entity": [["tile_ic", "sp", [-1, 2, 4]], ["tile_oc", "sp", [-1, 1]], ["tile_ow", "sp", [-1, 14, 2]], ["tile_oh", "sp", [-1, 7, 4]], ["cmpat_when_kernel", "ot", 1]]}, "result": [[0.0009780736], 0, 12.310180902481079, 1618483415.1114473], "end_time": 1618483427, "version": 0.2, "tvm_version": "0.8.dev0"}
{"input": ["opencl -keys=opencl,gpu -max_num_threads=256", "conv2d_no_batching", [1, 28, 28, 256, 256, 1, 1, [1, 1], [0, 0, 0, 0]], {}], "config": {"index": 781, "code_hash": null, "entity": [["tile_ic", "sp", [-1, 2, 4]], ["tile_oc", "sp", [-1, 64]], ["tile_ow", "sp", [-1, 14, 2]], ["tile_oh", "sp", [-1, 1, 4]], ["cmpat_when_kernel", "ot", 1]]}, "result": [[0.0006529024], 0, 13.182975769042969, 1618483415.9884057], "end_time": 1618483427, "version": 0.2, "tvm_version": "0.8.dev0"}
{"input": ["opencl -keys=opencl,gpu -max_num_threads=256", "conv2d_no_batching", [1, 28, 28, 256, 256, 1, 1, [1, 1], [0, 0, 0, 0]], {}], "config": {"index": 840, "code_hash": null, "entity": [["tile_ic", "sp", [-1, 1, 4]], ["tile_oc", "sp", [-1, 1]], ["tile_ow", "sp", [-1, 1, 2]], ["tile_oh", "sp", [-1, 7, 4]], ["cmpat_when_kernel", "ot", 1]]}, "result": [[0.0037172223999999998], 0, 14.13671350479126, 1618483416.9544225], "end_time": 1618483427, "version": 0.2, "tvm_version": "0.8.dev0"}
{"input": ["opencl -keys=opencl,gpu -max_num_threads=256", "conv2d_no_batching", [1, 28, 28, 256, 256, 1, 1, [1, 1], [0, 0, 0, 0]], {}], "config": {"index": 468, "code_hash": null, "entity": [["tile_ic", "sp", [-1, 1, 4]], ["tile_oc", "sp", [-1, 32]], ["tile_ow", "sp", [-1, 1, 4]], ["tile_oh", "sp", [-1, 7, 2]], ["cmpat_when_kernel", "ot", 1]]}, "result": [[0.0005413120000000001], 0, 14.986979484558105, 1618483417.80323], "end_time": 1618483427, "version": 0.2, "tvm_version": "0.8.dev0"}
{"input": ["opencl -keys=opencl,gpu -max_num_threads=256", "conv2d_no_batching", [1, 28, 28, 256, 256, 1, 1, [1, 1], [0, 0, 0, 0]], {}], "config": {"index": 782, "code_hash": null, "entity": [["tile_ic", "sp", [-1, 4, 4]], ["tile_oc", "sp", [-1, 64]], ["tile_ow", "sp", [-1, 14, 2]], ["tile_oh", "sp", [-1, 1, 4]], ["cmpat_when_kernel", "ot", 1]]}, "result": [[0.023938892800000004], 0, 16.754120111465454, 1618483419.5137951], "end_time": 1618483427, "version": 0.2, "tvm_version": "0.8.dev0"}
{"input": ["opencl -keys=opencl,gpu -max_num_threads=256", "conv2d_no_batching", [1, 28, 28, 256, 256, 1, 1, [1, 1], [0, 0, 0, 0]], {}], "config": {"index": 736, "code_hash": null, "entity": [["tile_ic", "sp", [-1, 1, 4]], ["tile_oc", "sp", [-1, 4]], ["tile_ow", "sp", [-1, 7, 2]], ["tile_oh", "sp", [-1, 1, 4]], ["cmpat_when_kernel", "ot", 1]]}, "result": [[0.0009177088], 0, 17.57642388343811, 1618483420.4001615], "end_time": 1618483427, "version": 0.2, "tvm_version": "0.8.dev0"}
{"input": ["opencl -keys=opencl,gpu -max_num_threads=256", "conv2d_no_batching", [1, 28, 28, 256, 256, 1, 1, [1, 1], [0, 0, 0, 0]], {}], "config": {"index": 658, "code_hash": null, "entity": [["tile_ic", "sp", [-1, 4, 4]], ["tile_oc", "sp", [-1, 8]], ["tile_ow", "sp", [-1, 7, 4]], ["tile_oh", "sp", [-1, 14, 2]], ["cmpat_when_kernel", "ot", 1]]}, "result": [[0.028178534400000003], 0, 19.462193965911865, 1618483422.2326741], "end_time": 1618483427, "version": 0.2, "tvm_version": "0.8.dev0"}
{"input": ["opencl -keys=opencl,gpu -max_num_threads=256", "conv2d_no_batching", [1, 28, 28, 256, 256, 1, 1, [1, 1], [0, 0, 0, 0]], {}], "config": {"index": 889, "code_hash": null, "entity": [["tile_ic", "sp", [-1, 2, 4]], ["tile_oc", "sp", [-1, 32]], ["tile_ow", "sp", [-1, 2, 2]], ["tile_oh", "sp", [-1, 7, 4]], ["cmpat_when_kernel", "ot", 1]]}, "result": [[0.000592256], 0, 20.33629083633423, 1618483423.1395168], "end_time": 1618483427, "version": 0.2, "tvm_version": "0.8.dev0"}
{"input": ["opencl -keys=opencl,gpu -max_num_threads=256", "conv2d_no_batching", [1, 28, 28, 256, 256, 1, 1, [1, 1], [0, 0, 0, 0]], {}], "config": {"index": 774, "code_hash": null, "entity": [["tile_ic", "sp", [-1, 4, 4]], ["tile_oc", "sp", [-1, 16]], ["tile_ow", "sp", [-1, 14, 2]], ["tile_oh", "sp", [-1, 1, 4]], ["cmpat_when_kernel", "ot", 1]]}, "result": [[0.0250208512], 0, 22.071674346923828, 1618483424.8525476], "end_time": 1618483427, "version": 0.2, "tvm_version": "0.8.dev0"}
{"input": ["opencl -keys=opencl,gpu -max_num_threads=256", "conv2d_no_batching", [1, 28, 28, 256, 256, 1, 1, [1, 1], [0, 0, 0, 0]], {}], "config": {"index": 958, "code_hash": null, "entity": [["tile_ic", "sp", [-1, 4, 4]], ["tile_oc", "sp", [-1, 2]], ["tile_ow", "sp", [-1, 1, 4]], ["tile_oh", "sp", [-1, 7, 4]], ["cmpat_when_kernel", "ot", 1]]}, "result": [[0.0101286144], 0, 23.58185362815857, 1618483426.2424223], "end_time": 1618483427, "version": 0.2, "tvm_version": "0.8.dev0"}
{"input": ["opencl -keys=opencl,gpu -max_num_threads=256", "conv2d_no_batching", [1, 28, 28, 256, 256, 1, 1, [1, 1], [0, 0, 0, 0]], {}], "config": {"index": 845, "code_hash": null, "entity": [["tile_ic", "sp", [-1, 2, 4]], ["tile_oc", "sp", [-1, 2]], ["tile_ow", "sp", [-1, 1, 2]], ["tile_oh", "sp", [-1, 7, 4]], ["cmpat_when_kernel", "ot", 1]]}, "result": [[0.0024123136], 0, 24.40022873878479, 1618483427.214739], "end_time": 1618483427, "version": 0.2, "tvm_version": "0.8.dev0"}
