test_and_tune/x86debug/climgfloatr32.mobilenet_v1_1.0_224.log.tmp
{"input": ["opencl -keys=opencl,gpu -max_num_threads=256", "tutorial/conv2d_no_batching", [1, 40, 40, 128, 16, 1, 1, [1, 1], [0, 0]], {}], "config": {"index": 4823, "code_hash": null, "entity": [["tile_ic", "sp", [-1, 1, 16]], ["tile_oc", "sp", [-1, 32]], ["tile_ow", "sp", [-1, 4, 2]], ["tile_oh", "sp", [-1, 7, 2]]]}, "result": [[0.0018584898], 0, 6.691999912261963, 1615549166.620477], "version": 0.2, "tvm_version": "0.8.dev0"}
{"input": ["opencl -keys=opencl,gpu -max_num_threads=256", "tutorial/conv2d_no_batching", [1, 40, 40, 128, 16, 1, 1, [1, 1], [0, 0]], {}], "config": {"index": 889, "code_hash": null, "entity": [["tile_ic", "sp", [-1, 2, 4]], ["tile_oc", "sp", [-1, 16]], ["tile_ow", "sp", [-1, 3, 8]], ["tile_oh", "sp", [-1, 1, 2]]]}, "result": [[0.001191021], 0, 8.258264541625977, 1615549168.5887396], "version": 0.2, "tvm_version": "0.8.dev0"}
{"input": ["opencl -keys=opencl,gpu -max_num_threads=256", "tutorial/conv2d_no_batching", [1, 40, 40, 128, 16, 1, 1, [1, 1], [0, 0]], {}], "config": {"index": 1986, "code_hash": null, "entity": [["tile_ic", "sp", [-1, 1, 4]], ["tile_oc", "sp", [-1, 2]], ["tile_ow", "sp", [-1, 4, 2]], ["tile_oh", "sp", [-1, 3, 2]]]}, "result": [[0.00039272939999999995], 0, 7.886472940444946, 1615549169.5869522], "version": 0.2, "tvm_version": "0.8.dev0"}
{"input": ["opencl -keys=opencl,gpu -max_num_threads=256", "tutorial/conv2d_no_batching", [1, 40, 40, 128, 16, 1, 1, [1, 1], [0, 0]], {}], "config": {"index": 533, "code_hash": null, "entity": [["tile_ic", "sp", [-1, 1, 16]], ["tile_oc", "sp", [-1, 16]], ["tile_ow", "sp", [-1, 7, 4]], ["tile_oh", "sp", [-1, 1, 2]]]}, "result": [[0.0013351460000000002], 0, 10.083496809005737, 1615549171.43398], "version": 0.2, "tvm_version": "0.8.dev0"}
{"input": ["opencl -keys=opencl,gpu -max_num_threads=256", "tutorial/conv2d_no_batching", [1, 40, 40, 128, 16, 1, 1, [1, 1], [0, 0]], {}], "config": {"index": 22507, "code_hash": null, "entity": [["tile_ic", "sp", [-1, 2, 4]], ["tile_oc", "sp", [-1, 2]], ["tile_ow", "sp", [-1, 2, 2]], ["tile_oh", "sp", [-1, 3, 8]]]}, "result": [[0.002225969], 0, 18.04118275642395, 1615549205.2120135], "version": 0.2, "tvm_version": "0.8.dev0"}
{"input": ["opencl -keys=opencl,gpu -max_num_threads=256", "tutorial/conv2d_no_batching", [1, 40, 40, 128, 16, 1, 1, [1, 1], [0, 0]], {}], "config": {"index": 12949, "code_hash": null, "entity": [["tile_ic", "sp", [-1, 2, 4]], ["tile_oc", "sp", [-1, 16]], ["tile_ow", "sp", [-1, 7, 6]], ["tile_oh", "sp", [-1, 6, 4]]]}, "result": [[0.0014186772], 0, 19.772939205169678, 1615549206.7117684], "version": 0.2, "tvm_version": "0.8.dev0"}
{"input": ["opencl -keys=opencl,gpu -max_num_threads=256", "tutorial/conv2d_no_batching", [1, 40, 40, 128, 16, 1, 1, [1, 1], [0, 0]], {}], "config": {"index": 17039, "code_hash": null, "entity": [["tile_ic", "sp", [-1, 1, 16]], ["tile_oc", "sp", [-1, 2]], ["tile_ow", "sp", [-1, 7, 2]], ["tile_oh", "sp", [-1, 3, 6]]]}, "result": [[0.0012166148], 0, 20.995831966400146, 1615549208.6022272], "version": 0.2, "tvm_version": "0.8.dev0"}
{"input": ["opencl -keys=opencl,gpu -max_num_threads=256", "tutorial/conv2d_no_batching", [1, 40, 40, 128, 16, 1, 1, [1, 1], [0, 0]], {}], "config": {"index": 10523, "code_hash": null, "entity": [["tile_ic", "sp", [-1, 1, 16]], ["tile_oc", "sp", [-1, 2]], ["tile_ow", "sp", [-1, 8, 2]], ["tile_oh", "sp", [-1, 3, 4]]]}, "result": [[0.0012625314], 0, 23.08036708831787, 1615549210.5077586], "version": 0.2, "tvm_version": "0.8.dev0"}
{"input": ["opencl -keys=opencl,gpu -max_num_threads=256", "tutorial/conv2d_no_batching", [1, 40, 40, 128, 16, 1, 1, [1, 1], [0, 0]], {}], "config": {"index": 10146, "code_hash": null, "entity": [["tile_ic", "sp", [-1, 1, 4]], ["tile_oc", "sp", [-1, 32]], ["tile_ow", "sp", [-1, 7, 6]], ["tile_oh", "sp", [-1, 2, 4]]]}, "result": [[0.001256219], 0, 23.554758071899414, 1615549211.7251468], "version": 0.2, "tvm_version": "0.8.dev0"}
{"input": ["opencl -keys=opencl,gpu -max_num_threads=256", "tutorial/conv2d_no_batching", [1, 40, 40, 128, 16, 1, 1, [1, 1], [0, 0]], {}], "config": {"index": 5592, "code_hash": null, "entity": [["tile_ic", "sp", [-1, 1, 4]], ["tile_oc", "sp", [-1, 4]], ["tile_ow", "sp", [-1, 4, 8]], ["tile_oh", "sp", [-1, 7, 2]]]}, "result": [[0.0018317814000000001], 0, 6.281838655471802, 1615549232.666361], "version": 0.2, "tvm_version": "0.8.dev0"}
{"input": ["opencl -keys=opencl,gpu -max_num_threads=256", "tutorial/conv2d_no_batching", [1, 40, 40, 128, 16, 1, 1, [1, 1], [0, 0]], {}], "config": {"index": 20919, "code_hash": null, "entity": [["tile_ic", "sp", [-1, 1, 8]], ["tile_oc", "sp", [-1, 1]], ["tile_ow", "sp", [-1, 1, 4]], ["tile_oh", "sp", [-1, 1, 8]]]}, "result": [[0.0104020532], 0, 8.650968313217163, 1615549234.7394893], "version": 0.2, "tvm_version": "0.8.dev0"}
{"input": ["opencl -keys=opencl,gpu -max_num_threads=256", "tutorial/conv2d_no_batching", [1, 40, 40, 128, 16, 1, 1, [1, 1], [0, 0]], {}], "config": {"index": 14544, "code_hash": null, "entity": [["tile_ic", "sp", [-1, 1, 4]], ["tile_oc", "sp", [-1, 1]], ["tile_ow", "sp", [-1, 7, 4]], ["tile_oh", "sp", [-1, 8, 4]]]}, "result": [[0.0016202293999999999], 0, 10.747598648071289, 1615549237.984118], "version": 0.2, "tvm_version": "0.8.dev0"}
{"input": ["opencl -keys=opencl,gpu -max_num_threads=256", "tutorial/conv2d_no_batching", [1, 40, 40, 128, 16, 1, 1, [1, 1], [0, 0]], {}], "config": {"index": 18522, "code_hash": null, "entity": [["tile_ic", "sp", [-1, 1, 4]], ["tile_oc", "sp", [-1, 8]], ["tile_ow", "sp", [-1, 6, 6]], ["tile_oh", "sp", [-1, 4, 6]]]}, "result": [[0.0020825732], 0, 10.85895586013794, 1615549236.7434757], "version": 0.2, "tvm_version": "0.8.dev0"}
{"input": ["opencl -keys=opencl,gpu -max_num_threads=256", "tutorial/conv2d_no_batching", [1, 40, 40, 128, 16, 1, 1, [1, 1], [0, 0]], {}], "config": {"index": 12427, "code_hash": null, "entity": [["tile_ic", "sp", [-1, 2, 4]], ["tile_oc", "sp", [-1, 2]], ["tile_ow", "sp", [-1, 14, 2]], ["tile_oh", "sp", [-1, 6, 4]]]}, "result": [[0.0013530732], 0, 11.88336730003357, 1615549239.3378859], "version": 0.2, "tvm_version": "0.8.dev0"}
{"input": ["opencl -keys=opencl,gpu -max_num_threads=256", "tutorial/conv2d_no_batching", [1, 40, 40, 128, 16, 1, 1, [1, 1], [0, 0]], {}], "config": {"index": 19201, "code_hash": null, "entity": [["tile_ic", "sp", [-1, 2, 4]], ["tile_oc", "sp", [-1, 4]], ["tile_ow", "sp", [-1, 6, 4]], ["tile_oh", "sp", [-1, 6, 6]]]}, "result": [[0.0019313752], 0, 16.016635417938232, 1615549242.393154], "version": 0.2, "tvm_version": "0.8.dev0"}
{"input": ["opencl -keys=opencl,gpu -max_num_threads=256", "tutorial/conv2d_no_batching", [1, 40, 40, 128, 16, 1, 1, [1, 1], [0, 0]], {}], "config": {"index": 23461, "code_hash": null, "entity": [["tile_ic", "sp", [-1, 2, 4]], ["tile_oc", "sp", [-1, 16]], ["tile_ow", "sp", [-1, 2, 2]], ["tile_oh", "sp", [-1, 4, 8]]]}, "result": [[0.0015607187999999998], 0, 8.307131290435791, 1615549264.6821878], "version": 0.2, "tvm_version": "0.8.dev0"}
{"input": ["opencl -keys=opencl,gpu -max_num_threads=256", "tutorial/conv2d_no_batching", [1, 40, 40, 128, 16, 1, 1, [1, 1], [0, 0]], {}], "config": {"index": 21349, "code_hash": null, "entity": [["tile_ic", "sp", [-1, 2, 4]], ["tile_oc", "sp", [-1, 1]], ["tile_ow", "sp", [-1, 7, 6]], ["tile_oh", "sp", [-1, 1, 8]]]}, "result": [[0.0060159902], 0, 20.712096214294434, 1615549276.9171531], "version": 0.2, "tvm_version": "0.8.dev0"}
{"input": ["opencl -keys=opencl,gpu -max_num_threads=256", "tutorial/conv2d_no_batching", [1, 40, 40, 128, 16, 1, 1, [1, 1], [0, 0]], {}], "config": {"index": 5748, "code_hash": null, "entity": [["tile_ic", "sp", [-1, 1, 4]], ["tile_oc", "sp", [-1, 16]], ["tile_ow", "sp", [-1, 4, 2]], ["tile_oh", "sp", [-1, 8, 2]]]}, "result": [[0.00032676060000000004], 0, 19.947284698486328, 1615549277.9713464], "version": 0.2, "tvm_version": "0.8.dev0"}
{"input": ["opencl -keys=opencl,gpu -max_num_threads=256", "tutorial/conv2d_no_batching", [1, 40, 40, 128, 16, 1, 1, [1, 1], [0, 0]], {}], "config": {"index": 23220, "code_hash": null, "entity": [["tile_ic", "sp", [-1, 1, 4]], ["tile_oc", "sp", [-1, 1]], ["tile_ow", "sp", [-1, 7, 6]], ["tile_oh", "sp", [-1, 3, 8]]]}, "result": [[0.0049569691999999995], 0, 22.675006866455078, 1615549279.4480648], "version": 0.2, "tvm_version": "0.8.dev0"}
{"input": ["opencl -keys=opencl,gpu -max_num_threads=256", "tutorial/conv2d_no_batching", [1, 40, 40, 128, 16, 1, 1, [1, 1], [0, 0]], {}], "config": {"index": 12791, "code_hash": null, "entity": [["tile_ic", "sp", [-1, 1, 16]], ["tile_oc", "sp", [-1, 2]], ["tile_ow", "sp", [-1, 2, 6]], ["tile_oh", "sp", [-1, 6, 4]]]}, "result": [[0.002223323], 0, 29.984588146209717, 1615549285.3666427], "version": 0.2, "tvm_version": "0.8.dev0"}
{"input": ["opencl -keys=opencl,gpu -max_num_threads=256", "tutorial/conv2d_no_batching", [1, 40, 40, 128, 16, 1, 1, [1, 1], [0, 0]], {}], "config": {"index": 283, "code_hash": null, "entity": [["tile_ic", "sp", [-1, 2, 4]], ["tile_oc", "sp", [-1, 32]], ["tile_ow", "sp", [-1, 14, 2]], ["tile_oh", "sp", [-1, 1, 2]]]}, "result": [[0.00032059359999999997], 0, 28.116398096084595, 1615549286.414458], "version": 0.2, "tvm_version": "0.8.dev0"}
{"input": ["opencl -keys=opencl,gpu -max_num_threads=256", "tutorial/conv2d_no_batching", [1, 40, 40, 128, 16, 1, 1, [1, 1], [0, 0]], {}], "config": {"index": 21718, "code_hash": null, "entity": [["tile_ic", "sp", [-1, 2, 8]], ["tile_oc", "sp", [-1, 2]], ["tile_ow", "sp", [-1, 7, 2]], ["tile_oh", "sp", [-1, 2, 8]]]}, "result": [[0.000923323], 0, 30.92899751663208, 1615549288.3000562], "version": 0.2, "tvm_version": "0.8.dev0"}
{"input": ["opencl -keys=opencl,gpu -max_num_threads=256", "tutorial/conv2d_no_batching", [1, 40, 40, 128, 16, 1, 1, [1, 1], [0, 0]], {}], "config": {"index": 3536, "code_hash": null, "entity": [["tile_ic", "sp", [-1, 4, 4]], ["tile_oc", "sp", [-1, 2]], ["tile_ow", "sp", [-1, 6, 6]], ["tile_oh", "sp", [-1, 4, 2]]]}, "result": [[0.0013804272], 0, 9.190325260162354, 1615549310.866373], "version": 0.2, "tvm_version": "0.8.dev0"}
{"input": ["opencl -keys=opencl,gpu -max_num_threads=256", "tutorial/conv2d_no_batching", [1, 40, 40, 128, 16, 1, 1, [1, 1], [0, 0]], {}], "config": {"index": 6208, "code_hash": null, "entity": [["tile_ic", "sp", [-1, 2, 8]], ["tile_oc", "sp", [-1, 4]], ["tile_ow", "sp", [-1, 1, 6]], ["tile_oh", "sp", [-1, 8, 2]]]}, "result": [[0.0008307083999999999], 0, 9.791857481002808, 1615549312.2669053], "version": 0.2, "tvm_version": "0.8.dev0"}
{"input": ["opencl -keys=opencl,gpu -max_num_threads=256", "tutorial/conv2d_no_batching", [1, 40, 40, 128, 16, 1, 1, [1, 1], [0, 0]], {}], "config": {"index": 6933, "code_hash": null, "entity": [["tile_ic", "sp", [-1, 1, 8]], ["tile_oc", "sp", [-1, 8]], ["tile_ow", "sp", [-1, 2, 4]], ["tile_oh", "sp", [-1, 14, 2]]]}, "result": [[0.0016699272000000002], 0, 10.090213775634766, 1615549313.6682613], "version": 0.2, "tvm_version": "0.8.dev0"}
{"input": ["opencl -keys=opencl,gpu -max_num_threads=256", "tutorial/conv2d_no_batching", [1, 40, 40, 128, 16, 1, 1, [1, 1], [0, 0]], {}], "config": {"index": 5300, "code_hash": null, "entity": [["tile_ic", "sp", [-1, 4, 4]], ["tile_oc", "sp", [-1, 2]], ["tile_ow", "sp", [-1, 2, 6]], ["tile_oh", "sp", [-1, 7, 2]]]}, "result": [[0.0014101042], 0, 15.930359840393066, 1615549318.6874104], "version": 0.2, "tvm_version": "0.8.dev0"}
{"input": ["opencl -keys=opencl,gpu -max_num_threads=256", "tutorial/conv2d_no_batching", [1, 40, 40, 128, 16, 1, 1, [1, 1], [0, 0]], {}], "config": {"index": 16017, "code_hash": null, "entity": [["tile_ic", "sp", [-1, 1, 8]], ["tile_oc", "sp", [-1, 32]], ["tile_ow", "sp", [-1, 3, 2]], ["tile_oh", "sp", [-1, 2, 6]]]}, "result": [[0.001429021], 0, 11.385925054550171, 1615549315.1029756], "version": 0.2, "tvm_version": "0.8.dev0"}
{"input": ["opencl -keys=opencl,gpu -max_num_threads=256", "tutorial/conv2d_no_batching", [1, 40, 40, 128, 16, 1, 1, [1, 1], [0, 0]], {}], "config": {"index": 5823, "code_hash": null, "entity": [["tile_ic", "sp", [-1, 1, 8]], ["tile_oc", "sp", [-1, 16]], ["tile_ow", "sp", [-1, 7, 2]], ["tile_oh", "sp", [-1, 8, 2]]]}, "result": [[0.0003154792], 0, 15.294244766235352, 1615549319.7592957], "version": 0.2, "tvm_version": "0.8.dev0"}
{"input": ["opencl -keys=opencl,gpu -max_num_threads=256", "tutorial/conv2d_no_batching", [1, 40, 40, 128, 16, 1, 1, [1, 1], [0, 0]], {}], "config": {"index": 6664, "code_hash": null, "entity": [["tile_ic", "sp", [-1, 2, 8]], ["tile_oc", "sp", [-1, 1]], ["tile_ow", "sp", [-1, 4, 2]], ["tile_oh", "sp", [-1, 14, 2]]]}, "result": [[0.0013639481999999999], 0, 17.35815167427063, 1615549321.5422013], "version": 0.2, "tvm_version": "0.8.dev0"}
{"input": ["opencl -keys=opencl,gpu -max_num_threads=256", "tutorial/conv2d_no_batching", [1, 40, 40, 128, 16, 1, 1, [1, 1], [0, 0]], {}], "config": {"index": 1626, "code_hash": null, "entity": [["tile_ic", "sp", [-1, 1, 4]], ["tile_oc", "sp", [-1, 2]], ["tile_ow", "sp", [-1, 4, 6]], ["tile_oh", "sp", [-1, 2, 2]]]}, "result": [[0.0012675208000000001], 0, 5.605346918106079, 1615549342.8698325], "version": 0.2, "tvm_version": "0.8.dev0"}
{"input": ["opencl -keys=opencl,gpu -max_num_threads=256", "tutorial/conv2d_no_batching", [1, 40, 40, 128, 16, 1, 1, [1, 1], [0, 0]], {}], "config": {"index": 15188, "code_hash": null, "entity": [["tile_ic", "sp", [-1, 4, 4]], ["tile_oc", "sp", [-1, 32]], ["tile_ow", "sp", [-1, 7, 2]], ["tile_oh", "sp", [-1, 1, 6]]]}, "result": [[0.0010621772], 0, 6.703932046890259, 1615549344.228416], "version": 0.2, "tvm_version": "0.8.dev0"}
{"input": ["opencl -keys=opencl,gpu -max_num_threads=256", "tutorial/conv2d_no_batching", [1, 40, 40, 128, 16, 1, 1, [1, 1], [0, 0]], {}], "config": {"index": 14811, "code_hash": null, "entity": [["tile_ic", "sp", [-1, 1, 8]], ["tile_oc", "sp", [-1, 4]], ["tile_ow", "sp", [-1, 7, 6]], ["tile_oh", "sp", [-1, 8, 4]]]}, "result": [[0.0011668126], 0, 8.948880672454834, 1615549345.7153637], "version": 0.2, "tvm_version": "0.8.dev0"}
{"input": ["opencl -keys=opencl,gpu -max_num_threads=256", "tutorial/conv2d_no_batching", [1, 40, 40, 128, 16, 1, 1, [1, 1], [0, 0]], {}], "config": {"index": 16427, "code_hash": null, "entity": [["tile_ic", "sp", [-1, 1, 16]], ["tile_oc", "sp", [-1, 2]], ["tile_ow", "sp", [-1, 7, 4]], ["tile_oh", "sp", [-1, 2, 6]]]}, "result": [[0.0021554482], 0, 18.90421175956726, 1615549354.0776978], "version": 0.2, "tvm_version": "0.8.dev0"}
{"input": ["opencl -keys=opencl,gpu -max_num_threads=256", "tutorial/conv2d_no_batching", [1, 40, 40, 128, 16, 1, 1, [1, 1], [0, 0]], {}], "config": {"index": 17398, "code_hash": null, "entity": [["tile_ic", "sp", [-1, 2, 8]], ["tile_oc", "sp", [-1, 2]], ["tile_ow", "sp", [-1, 8, 4]], ["tile_oh", "sp", [-1, 3, 6]]]}, "result": [[0.0021909898000000002], 0, 28.13867950439453, 1615549363.3391652], "version": 0.2, "tvm_version": "0.8.dev0"}
{"input": ["opencl -keys=opencl,gpu -max_num_threads=256", "tutorial/conv2d_no_batching", [1, 40, 40, 128, 16, 1, 1, [1, 1], [0, 0]], {}], "config": {"index": 11942, "code_hash": null, "entity": [["tile_ic", "sp", [-1, 4, 4]], ["tile_oc", "sp", [-1, 16]], ["tile_ow", "sp", [-1, 4, 6]], ["tile_oh", "sp", [-1, 4, 4]]]}, "result": [[0.0018366667999999999], 0, 35.04799199104309, 1615549370.4124782], "version": 0.2, "tvm_version": "0.8.dev0"}
{"input": ["opencl -keys=opencl,gpu -max_num_threads=256", "tutorial/conv2d_no_batching", [1, 40, 40, 128, 16, 1, 1, [1, 1], [0, 0]], {}], "config": {"index": 22680, "code_hash": null, "entity": [["tile_ic", "sp", [-1, 1, 4]], ["tile_oc", "sp", [-1, 1]], ["tile_ow", "sp", [-1, 8, 2]], ["tile_oh", "sp", [-1, 3, 8]]]}, "result": [[0.0016236774], 0, 33.98939609527588, 1615549371.866878], "version": 0.2, "tvm_version": "0.8.dev0"}
{"input": ["opencl -keys=opencl,gpu -max_num_threads=256", "tutorial/conv2d_no_batching", [1, 40, 40, 128, 16, 1, 1, [1, 1], [0, 0]], {}], "config": {"index": 15546, "code_hash": null, "entity": [["tile_ic", "sp", [-1, 1, 4]], ["tile_oc", "sp", [-1, 32]], ["tile_ow", "sp", [-1, 8, 4]], ["tile_oh", "sp", [-1, 1, 6]]]}, "result": [[0.0014779063999999999], 0, 7.641454458236694, 1615549394.7837296], "version": 0.2, "tvm_version": "0.8.dev0"}
{"input": ["opencl -keys=opencl,gpu -max_num_threads=256", "tutorial/conv2d_no_batching", [1, 40, 40, 128, 16, 1, 1, [1, 1], [0, 0]], {}], "config": {"index": 1608, "code_hash": null, "entity": [["tile_ic", "sp", [-1, 1, 4]], ["tile_oc", "sp", [-1, 16]], ["tile_ow", "sp", [-1, 3, 6]], ["tile_oh", "sp", [-1, 2, 2]]]}, "result": [[0.0014400834], 0, 8.013546466827393, 1615549396.170823], "version": 0.2, "tvm_version": "0.8.dev0"}
{"input": ["opencl -keys=opencl,gpu -max_num_threads=256", "tutorial/conv2d_no_batching", [1, 40, 40, 128, 16, 1, 1, [1, 1], [0, 0]], {}], "config": {"index": 20841, "code_hash": null, "entity": [["tile_ic", "sp", [-1, 1, 8]], ["tile_oc", "sp", [-1, 32]], ["tile_ow", "sp", [-1, 8, 2]], ["tile_oh", "sp", [-1, 1, 8]]]}, "result": [[0.0016002501999999997], 0, 10.521350622177124, 1615549398.0556283], "version": 0.2, "tvm_version": "0.8.dev0"}
{"input": ["opencl -keys=opencl,gpu -max_num_threads=256", "tutorial/conv2d_no_batching", [1, 40, 40, 128, 16, 1, 1, [1, 1], [0, 0]], {}], "config": {"index": 20910, "code_hash": null, "entity": [["tile_ic", "sp", [-1, 1, 4]], ["tile_oc", "sp", [-1, 32]], ["tile_ow", "sp", [-1, 16, 2]], ["tile_oh", "sp", [-1, 1, 8]]]}, "result": [[0.001414823], 0, 10.85166883468628, 1615549399.303945], "version": 0.2, "tvm_version": "0.8.dev0"}
{"input": ["opencl -keys=opencl,gpu -max_num_threads=256", "tutorial/conv2d_no_batching", [1, 40, 40, 128, 16, 1, 1, [1, 1], [0, 0]], {}], "config": {"index": 8221, "code_hash": null, "entity": [["tile_ic", "sp", [-1, 2, 4]], ["tile_oc", "sp", [-1, 4]], ["tile_ow", "sp", [-1, 6, 6]], ["tile_oh", "sp", [-1, 16, 2]]]}, "result": [[0.0016172918000000001], 0, 8.686694860458374, 1615549422.7827039], "version": 0.2, "tvm_version": "0.8.dev0"}
{"input": ["opencl -keys=opencl,gpu -max_num_threads=256", "tutorial/conv2d_no_batching", [1, 40, 40, 128, 16, 1, 1, [1, 1], [0, 0]], {}], "config": {"index": 8438, "code_hash": null, "entity": [["tile_ic", "sp", [-1, 4, 4]], ["tile_oc", "sp", [-1, 4]], ["tile_ow", "sp", [-1, 1, 2]], ["tile_oh", "sp", [-1, 1, 4]]]}, "result": [[0.0014919897999999998], 0, 8.91870927810669, 1615549424.136718], "version": 0.2, "tvm_version": "0.8.dev0"}
{"input": ["opencl -keys=opencl,gpu -max_num_threads=256", "tutorial/conv2d_no_batching", [1, 40, 40, 128, 16, 1, 1, [1, 1], [0, 0]], {}], "config": {"index": 1290, "code_hash": null, "entity": [["tile_ic", "sp", [-1, 1, 4]], ["tile_oc", "sp", [-1, 32]], ["tile_ow", "sp", [-1, 1, 4]], ["tile_oh", "sp", [-1, 2, 2]]]}, "result": [[0.0002545104], 0, 9.621236324310303, 1615549425.1912477], "version": 0.2, "tvm_version": "0.8.dev0"}
{"input": ["opencl -keys=opencl,gpu -max_num_threads=256", "tutorial/conv2d_no_batching", [1, 40, 40, 128, 16, 1, 1, [1, 1], [0, 0]], {}], "config": {"index": 12422, "code_hash": null, "entity": [["tile_ic", "sp", [-1, 4, 4]], ["tile_oc", "sp", [-1, 1]], ["tile_ow", "sp", [-1, 14, 2]], ["tile_oh", "sp", [-1, 6, 4]]]}, "result": [[0.0013003856], 0, 11.704928159713745, 1615549427.047937], "version": 0.2, "tvm_version": "0.8.dev0"}
{"input": ["opencl -keys=opencl,gpu -max_num_threads=256", "tutorial/conv2d_no_batching", [1, 40, 40, 128, 16, 1, 1, [1, 1], [0, 0]], {}], "config": {"index": 1722, "code_hash": null, "entity": [["tile_ic", "sp", [-1, 1, 4]], ["tile_oc", "sp", [-1, 32]], ["tile_ow", "sp", [-1, 7, 6]], ["tile_oh", "sp", [-1, 2, 2]]]}, "result": [[0.001064698], 0, 5.5977537631988525, 1615549618.664219], "version": 0.2, "tvm_version": "0.8.dev0"}
{"input": ["opencl -keys=opencl,gpu -max_num_threads=256", "tutorial/conv2d_no_batching", [1, 40, 40, 128, 16, 1, 1, [1, 1], [0, 0]], {}], "config": {"index": 8634, "code_hash": null, "entity": [["tile_ic", "sp", [-1, 1, 4]], ["tile_oc", "sp", [-1, 32]], ["tile_ow", "sp", [-1, 7, 2]], ["tile_oh", "sp", [-1, 1, 4]]]}, "result": [[0.0002732084], 0, 6.663388967514038, 1615549619.9978607], "version": 0.2, "tvm_version": "0.8.dev0"}
{"input": ["opencl -keys=opencl,gpu -max_num_threads=256", "tutorial/conv2d_no_batching", [1, 40, 40, 128, 16, 1, 1, [1, 1], [0, 0]], {}], "config": {"index": 8490, "code_hash": null, "entity": [["tile_ic", "sp", [-1, 1, 4]], ["tile_oc", "sp", [-1, 32]], ["tile_ow", "sp", [-1, 2, 2]], ["tile_oh", "sp", [-1, 1, 4]]]}, "result": [[0.000260823], 0, 7.720775604248047, 1615549621.0782459], "version": 0.2, "tvm_version": "0.8.dev0"}
{"input": ["opencl -keys=opencl,gpu -max_num_threads=256", "tutorial/conv2d_no_batching", [1, 40, 40, 128, 16, 1, 1, [1, 1], [0, 0]], {}], "config": {"index": 1146, "code_hash": null, "entity": [["tile_ic", "sp", [-1, 1, 4]], ["tile_oc", "sp", [-1, 32]], ["tile_ow", "sp", [-1, 7, 2]], ["tile_oh", "sp", [-1, 2, 2]]]}, "result": [[0.00039663540000000003], 0, 8.576767444610596, 1615549622.130235], "version": 0.2, "tvm_version": "0.8.dev0"}
{"input": ["opencl -keys=opencl,gpu -max_num_threads=256", "tutorial/conv2d_no_batching", [1, 40, 40, 128, 16, 1, 1, [1, 1], [0, 0]], {}], "config": {"index": 66, "code_hash": null, "entity": [["tile_ic", "sp", [-1, 1, 4]], ["tile_oc", "sp", [-1, 32]], ["tile_ow", "sp", [-1, 2, 2]], ["tile_oh", "sp", [-1, 1, 2]]]}, "result": [[0.0003260002], 0, 9.21712040901184, 1615549623.106589], "version": 0.2, "tvm_version": "0.8.dev0"}
{"input": ["opencl -keys=opencl,gpu -max_num_threads=256", "tutorial/conv2d_no_batching", [1, 40, 40, 128, 16, 1, 1, [1, 1], [0, 0]], {}], "config": {"index": 1140, "code_hash": null, "entity": [["tile_ic", "sp", [-1, 1, 4]], ["tile_oc", "sp", [-1, 16]], ["tile_ow", "sp", [-1, 7, 2]], ["tile_oh", "sp", [-1, 2, 2]]]}, "result": [[0.0002862188], 0, 10.286597490310669, 1615549624.1170678], "version": 0.2, "tvm_version": "0.8.dev0"}
{"input": ["opencl -keys=opencl,gpu -max_num_threads=256", "tutorial/conv2d_no_batching", [1, 40, 40, 128, 16, 1, 1, [1, 1], [0, 0]], {}], "config": {"index": 498, "code_hash": null, "entity": [["tile_ic", "sp", [-1, 1, 4]], ["tile_oc", "sp", [-1, 32]], ["tile_ow", "sp", [-1, 6, 4]], ["tile_oh", "sp", [-1, 1, 2]]]}, "result": [[0.0003898438], 0, 11.26560091972351, 1615549625.2100668], "version": 0.2, "tvm_version": "0.8.dev0"}
{"input": ["opencl -keys=opencl,gpu -max_num_threads=256", "tutorial/conv2d_no_batching", [1, 40, 40, 128, 16, 1, 1, [1, 1], [0, 0]], {}], "config": {"index": 8526, "code_hash": null, "entity": [["tile_ic", "sp", [-1, 1, 4]], ["tile_oc", "sp", [-1, 32]], ["tile_ow", "sp", [-1, 3, 2]], ["tile_oh", "sp", [-1, 1, 4]]]}, "result": [[0.0002679376], 0, 12.15214467048645, 1615549626.2743213], "version": 0.2, "tvm_version": "0.8.dev0"}
{"input": ["opencl -keys=opencl,gpu -max_num_threads=256", "tutorial/conv2d_no_batching", [1, 40, 40, 128, 16, 1, 1, [1, 1], [0, 0]], {}], "config": {"index": 354, "code_hash": null, "entity": [["tile_ic", "sp", [-1, 1, 4]], ["tile_oc", "sp", [-1, 32]], ["tile_ow", "sp", [-1, 1, 4]], ["tile_oh", "sp", [-1, 1, 2]]]}, "result": [[0.0002549896], 0, 5.459505558013916, 1615549645.0423257], "version": 0.2, "tvm_version": "0.8.dev0"}
{"input": ["opencl -keys=opencl,gpu -max_num_threads=256", "tutorial/conv2d_no_batching", [1, 40, 40, 128, 16, 1, 1, [1, 1], [0, 0]], {}], "config": {"index": 1434, "code_hash": null, "entity": [["tile_ic", "sp", [-1, 1, 4]], ["tile_oc", "sp", [-1, 32]], ["tile_ow", "sp", [-1, 6, 4]], ["tile_oh", "sp", [-1, 2, 2]]]}, "result": [[0.0002994166], 0, 7.7288978099823, 1615549647.3877156], "version": 0.2, "tvm_version": "0.8.dev0"}
{"input": ["opencl -keys=opencl,gpu -max_num_threads=256", "tutorial/conv2d_no_batching", [1, 40, 40, 128, 16, 1, 1, [1, 1], [0, 0]], {}], "config": {"index": 210, "code_hash": null, "entity": [["tile_ic", "sp", [-1, 1, 4]], ["tile_oc", "sp", [-1, 32]], ["tile_ow", "sp", [-1, 7, 2]], ["tile_oh", "sp", [-1, 1, 2]]]}, "result": [[0.00023431260000000002], 0, 6.382670640945435, 1615549646.3124893], "version": 0.2, "tvm_version": "0.8.dev0"}
{"input": ["opencl -keys=opencl,gpu -max_num_threads=256", "tutorial/conv2d_no_batching", [1, 40, 40, 128, 16, 1, 1, [1, 1], [0, 0]], {}], "config": {"index": 1143, "code_hash": null, "entity": [["tile_ic", "sp", [-1, 1, 8]], ["tile_oc", "sp", [-1, 16]], ["tile_ow", "sp", [-1, 7, 2]], ["tile_oh", "sp", [-1, 2, 2]]]}, "result": [[0.0002728022], 0, 8.399926900863647, 1615549648.4537425], "version": 0.2, "tvm_version": "0.8.dev0"}
{"input": ["opencl -keys=opencl,gpu -max_num_threads=256", "tutorial/conv2d_no_batching", [1, 40, 40, 128, 16, 1, 1, [1, 1], [0, 0]], {}], "config": {"index": 8454, "code_hash": null, "entity": [["tile_ic", "sp", [-1, 1, 4]], ["tile_oc", "sp", [-1, 32]], ["tile_ow", "sp", [-1, 1, 2]], ["tile_oh", "sp", [-1, 1, 4]]]}, "result": [[0.0004340834], 0, 9.418823957443237, 1615549649.494643], "version": 0.2, "tvm_version": "0.8.dev0"}
{"input": ["opencl -keys=opencl,gpu -max_num_threads=256", "tutorial/conv2d_no_batching", [1, 40, 40, 128, 16, 1, 1, [1, 1], [0, 0]], {}], "config": {"index": 8635, "code_hash": null, "entity": [["tile_ic", "sp", [-1, 2, 4]], ["tile_oc", "sp", [-1, 32]], ["tile_ow", "sp", [-1, 7, 2]], ["tile_oh", "sp", [-1, 1, 4]]]}, "result": [[0.0008841666], 0, 10.348511695861816, 1615549650.542335], "version": 0.2, "tvm_version": "0.8.dev0"}
{"input": ["opencl -keys=opencl,gpu -max_num_threads=256", "tutorial/conv2d_no_batching", [1, 40, 40, 128, 16, 1, 1, [1, 1], [0, 0]], {}], "config": {"index": 2364, "code_hash": null, "entity": [["tile_ic", "sp", [-1, 1, 4]], ["tile_oc", "sp", [-1, 16]], ["tile_ow", "sp", [-1, 6, 4]], ["tile_oh", "sp", [-1, 3, 2]]]}, "result": [[0.0003369896], 0, 11.269952297210693, 1615549651.669768], "version": 0.2, "tvm_version": "0.8.dev0"}
{"input": ["opencl -keys=opencl,gpu -max_num_threads=256", "tutorial/conv2d_no_batching", [1, 40, 40, 128, 16, 1, 1, [1, 1], [0, 0]], {}], "config": {"index": 1428, "code_hash": null, "entity": [["tile_ic", "sp", [-1, 1, 4]], ["tile_oc", "sp", [-1, 16]], ["tile_ow", "sp", [-1, 6, 4]], ["tile_oh", "sp", [-1, 2, 2]]]}, "result": [[0.0005308856], 0, 12.439308166503906, 1615549652.7451303], "version": 0.2, "tvm_version": "0.8.dev0"}
{"input": ["opencl -keys=opencl,gpu -max_num_threads=256", "tutorial/conv2d_no_batching", [1, 40, 40, 128, 16, 1, 1, [1, 1], [0, 0]], {}], "config": {"index": 1141, "code_hash": null, "entity": [["tile_ic", "sp", [-1, 2, 4]], ["tile_oc", "sp", [-1, 16]], ["tile_ow", "sp", [-1, 7, 2]], ["tile_oh", "sp", [-1, 2, 2]]]}, "result": [[0.000302448], 0, 5.090674638748169, 1615549670.6865196], "version": 0.2, "tvm_version": "0.8.dev0"}
{"input": ["opencl -keys=opencl,gpu -max_num_threads=256", "tutorial/conv2d_no_batching", [1, 40, 40, 128, 16, 1, 1, [1, 1], [0, 0]], {}], "config": {"index": 102, "code_hash": null, "entity": [["tile_ic", "sp", [-1, 1, 4]], ["tile_oc", "sp", [-1, 32]], ["tile_ow", "sp", [-1, 3, 2]], ["tile_oh", "sp", [-1, 1, 2]]]}, "result": [[0.0003600834], 0, 5.893227577209473, 1615549671.8360724], "version": 0.2, "tvm_version": "0.8.dev0"}
{"input": ["opencl -keys=opencl,gpu -max_num_threads=256", "tutorial/conv2d_no_batching", [1, 40, 40, 128, 16, 1, 1, [1, 1], [0, 0]], {}], "config": {"index": 1725, "code_hash": null, "entity": [["tile_ic", "sp", [-1, 1, 8]], ["tile_oc", "sp", [-1, 32]], ["tile_ow", "sp", [-1, 7, 6]], ["tile_oh", "sp", [-1, 2, 2]]]}, "result": [[0.0012273022], 0, 7.6197710037231445, 1615549673.0046184], "version": 0.2, "tvm_version": "0.8.dev0"}
{"input": ["opencl -keys=opencl,gpu -max_num_threads=256", "tutorial/conv2d_no_batching", [1, 40, 40, 128, 16, 1, 1, [1, 1], [0, 0]], {}], "config": {"index": 1716, "code_hash": null, "entity": [["tile_ic", "sp", [-1, 1, 4]], ["tile_oc", "sp", [-1, 16]], ["tile_ow", "sp", [-1, 7, 6]], ["tile_oh", "sp", [-1, 2, 2]]]}, "result": [[0.0012118647999999998], 0, 8.114397048950195, 1615549674.06524], "version": 0.2, "tvm_version": "0.8.dev0"}
{"input": ["opencl -keys=opencl,gpu -max_num_threads=256", "tutorial/conv2d_no_batching", [1, 40, 40, 128, 16, 1, 1, [1, 1], [0, 0]], {}], "config": {"index": 786, "code_hash": null, "entity": [["tile_ic", "sp", [-1, 1, 4]], ["tile_oc", "sp", [-1, 32]], ["tile_ow", "sp", [-1, 7, 6]], ["tile_oh", "sp", [-1, 1, 2]]]}, "result": [[0.0007667188000000001], 0, 8.870580434799194, 1615549675.124426], "version": 0.2, "tvm_version": "0.8.dev0"}
{"input": ["opencl -keys=opencl,gpu -max_num_threads=256", "tutorial/conv2d_no_batching", [1, 40, 40, 128, 16, 1, 1, [1, 1], [0, 0]], {}], "config": {"index": 1723, "code_hash": null, "entity": [["tile_ic", "sp", [-1, 2, 4]], ["tile_oc", "sp", [-1, 32]], ["tile_ow", "sp", [-1, 7, 6]], ["tile_oh", "sp", [-1, 2, 2]]]}, "result": [[0.001138875], 0, 10.636352300643921, 1615549676.343199], "version": 0.2, "tvm_version": "0.8.dev0"}
{"input": ["opencl -keys=opencl,gpu -max_num_threads=256", "tutorial/conv2d_no_batching", [1, 40, 40, 128, 16, 1, 1, [1, 1], [0, 0]], {}], "config": {"index": 1122, "code_hash": null, "entity": [["tile_ic", "sp", [-1, 1, 4]], ["tile_oc", "sp", [-1, 2]], ["tile_ow", "sp", [-1, 7, 2]], ["tile_oh", "sp", [-1, 2, 2]]]}, "result": [[0.00034675], 0, 10.823386430740356, 1615549677.3582342], "version": 0.2, "tvm_version": "0.8.dev0"}
{"input": ["opencl -keys=opencl,gpu -max_num_threads=256", "tutorial/conv2d_no_batching", [1, 40, 40, 128, 16, 1, 1, [1, 1], [0, 0]], {}], "config": {"index": 1147, "code_hash": null, "entity": [["tile_ic", "sp", [-1, 2, 4]], ["tile_oc", "sp", [-1, 32]], ["tile_ow", "sp", [-1, 7, 2]], ["tile_oh", "sp", [-1, 2, 2]]]}, "result": [[0.00034594780000000004], 0, 11.902359008789062, 1615549678.436906], "version": 0.2, "tvm_version": "0.8.dev0"}
{"input": ["opencl -keys=opencl,gpu -max_num_threads=256", "tutorial/conv2d_no_batching", [1, 40, 40, 128, 16, 1, 1, [1, 1], [0, 0]], {}], "config": {"index": 1134, "code_hash": null, "entity": [["tile_ic", "sp", [-1, 1, 4]], ["tile_oc", "sp", [-1, 8]], ["tile_ow", "sp", [-1, 7, 2]], ["tile_oh", "sp", [-1, 2, 2]]]}, "result": [[0.00025856260000000004], 0, 5.0404462814331055, 1615549696.4205832], "version": 0.2, "tvm_version": "0.8.dev0"}
{"input": ["opencl -keys=opencl,gpu -max_num_threads=256", "tutorial/conv2d_no_batching", [1, 40, 40, 128, 16, 1, 1, [1, 1], [0, 0]], {}], "config": {"index": 273, "code_hash": null, "entity": [["tile_ic", "sp", [-1, 1, 8]], ["tile_oc", "sp", [-1, 8]], ["tile_ow", "sp", [-1, 14, 2]], ["tile_oh", "sp", [-1, 1, 2]]]}, "result": [[0.00030037499999999997], 0, 6.567523956298828, 1615549697.74466], "version": 0.2, "tvm_version": "0.8.dev0"}
{"input": ["opencl -keys=opencl,gpu -max_num_threads=256", "tutorial/conv2d_no_batching", [1, 40, 40, 128, 16, 1, 1, [1, 1], [0, 0]], {}], "config": {"index": 1002, "code_hash": null, "entity": [["tile_ic", "sp", [-1, 1, 4]], ["tile_oc", "sp", [-1, 32]], ["tile_ow", "sp", [-1, 2, 2]], ["tile_oh", "sp", [-1, 2, 2]]]}, "result": [[0.00041475], 0, 7.1559460163116455, 1615549698.7210822], "version": 0.2, "tvm_version": "0.8.dev0"}
{"input": ["opencl -keys=opencl,gpu -max_num_threads=256", "tutorial/conv2d_no_batching", [1, 40, 40, 128, 16, 1, 1, [1, 1], [0, 0]], {}], "config": {"index": 499, "code_hash": null, "entity": [["tile_ic", "sp", [-1, 2, 4]], ["tile_oc", "sp", [-1, 32]], ["tile_ow", "sp", [-1, 6, 4]], ["tile_oh", "sp", [-1, 1, 2]]]}, "result": [[0.0015589898], 0, 9.528667449951172, 1615549701.1278017], "version": 0.2, "tvm_version": "0.8.dev0"}
{"input": ["opencl -keys=opencl,gpu -max_num_threads=256", "tutorial/conv2d_no_batching", [1, 40, 40, 128, 16, 1, 1, [1, 1], [0, 0]], {}], "config": {"index": 1149, "code_hash": null, "entity": [["tile_ic", "sp", [-1, 1, 8]], ["tile_oc", "sp", [-1, 32]], ["tile_ow", "sp", [-1, 7, 2]], ["tile_oh", "sp", [-1, 2, 2]]]}, "result": [[0.000299302], 0, 8.029383420944214, 1615549699.7705219], "version": 0.2, "tvm_version": "0.8.dev0"}
{"input": ["opencl -keys=opencl,gpu -max_num_threads=256", "tutorial/conv2d_no_batching", [1, 40, 40, 128, 16, 1, 1, [1, 1], [0, 0]], {}], "config": {"index": 5796, "code_hash": null, "entity": [["tile_ic", "sp", [-1, 1, 4]], ["tile_oc", "sp", [-1, 1]], ["tile_ow", "sp", [-1, 7, 2]], ["tile_oh", "sp", [-1, 8, 2]]]}, "result": [[0.0002954896], 0, 10.089280843734741, 1615549702.1174185], "version": 0.2, "tvm_version": "0.8.dev0"}
{"input": ["opencl -keys=opencl,gpu -max_num_threads=256", "tutorial/conv2d_no_batching", [1, 40, 40, 128, 16, 1, 1, [1, 1], [0, 0]], {}], "config": {"index": 8637, "code_hash": null, "entity": [["tile_ic", "sp", [-1, 1, 8]], ["tile_oc", "sp", [-1, 32]], ["tile_ow", "sp", [-1, 7, 2]], ["tile_oh", "sp", [-1, 1, 4]]]}, "result": [[0.0010011458], 0, 11.231804609298706, 1615549703.2459402], "version": 0.2, "tvm_version": "0.8.dev0"}
{"input": ["opencl -keys=opencl,gpu -max_num_threads=256", "tutorial/conv2d_no_batching", [1, 40, 40, 128, 16, 1, 1, [1, 1], [0, 0]], {}], "config": {"index": 2658, "code_hash": null, "entity": [["tile_ic", "sp", [-1, 1, 4]], ["tile_oc", "sp", [-1, 32]], ["tile_ow", "sp", [-1, 7, 6]], ["tile_oh", "sp", [-1, 3, 2]]]}, "result": [[0.0009141042000000001], 0, 11.926182746887207, 1615549704.2933226], "version": 0.2, "tvm_version": "0.8.dev0"}
{"input": ["opencl -keys=opencl,gpu -max_num_threads=256", "tutorial/conv2d_no_batching", [1, 40, 40, 128, 16, 1, 1, [1, 1], [0, 0]], {}], "config": {"index": 279, "code_hash": null, "entity": [["tile_ic", "sp", [-1, 1, 8]], ["tile_oc", "sp", [-1, 16]], ["tile_ow", "sp", [-1, 14, 2]], ["tile_oh", "sp", [-1, 1, 2]]]}, "result": [[0.0003530522], 0, 5.326933145523071, 1615549722.9980876], "version": 0.2, "tvm_version": "0.8.dev0"}
{"input": ["opencl -keys=opencl,gpu -max_num_threads=256", "tutorial/conv2d_no_batching", [1, 40, 40, 128, 16, 1, 1, [1, 1], [0, 0]], {}], "config": {"index": 246, "code_hash": null, "entity": [["tile_ic", "sp", [-1, 1, 4]], ["tile_oc", "sp", [-1, 32]], ["tile_ow", "sp", [-1, 8, 2]], ["tile_oh", "sp", [-1, 1, 2]]]}, "result": [[0.0003988646], 0, 7.5444581508636475, 1615549725.4036164], "version": 0.2, "tvm_version": "0.8.dev0"}
{"input": ["opencl -keys=opencl,gpu -max_num_threads=256", "tutorial/conv2d_no_batching", [1, 40, 40, 128, 16, 1, 1, [1, 1], [0, 0]], {}], "config": {"index": 8670, "code_hash": null, "entity": [["tile_ic", "sp", [-1, 1, 4]], ["tile_oc", "sp", [-1, 32]], ["tile_ow", "sp", [-1, 8, 2]], ["tile_oh", "sp", [-1, 1, 4]]]}, "result": [[0.0005204584], 0, 6.568980932235718, 1615549724.4091399], "version": 0.2, "tvm_version": "0.8.dev0"}
{"input": ["opencl -keys=opencl,gpu -max_num_threads=256", "tutorial/conv2d_no_batching", [1, 40, 40, 128, 16, 1, 1, [1, 1], [0, 0]], {}], "config": {"index": 285, "code_hash": null, "entity": [["tile_ic", "sp", [-1, 1, 8]], ["tile_oc", "sp", [-1, 32]], ["tile_ow", "sp", [-1, 14, 2]], ["tile_oh", "sp", [-1, 1, 2]]]}, "result": [[0.0004711876], 0, 8.201039791107178, 1615549726.4851947], "version": 0.2, "tvm_version": "0.8.dev0"}
{"input": ["opencl -keys=opencl,gpu -max_num_threads=256", "tutorial/conv2d_no_batching", [1, 40, 40, 128, 16, 1, 1, [1, 1], [0, 0]], {}], "config": {"index": 1719, "code_hash": null, "entity": [["tile_ic", "sp", [-1, 1, 8]], ["tile_oc", "sp", [-1, 16]], ["tile_ow", "sp", [-1, 7, 6]], ["tile_oh", "sp", [-1, 2, 2]]]}, "result": [[0.0010162188], 0, 9.843422651290894, 1615549727.6745791], "version": 0.2, "tvm_version": "0.8.dev0"}
{"input": ["opencl -keys=opencl,gpu -max_num_threads=256", "tutorial/conv2d_no_batching", [1, 40, 40, 128, 16, 1, 1, [1, 1], [0, 0]], {}], "config": {"index": 1038, "code_hash": null, "entity": [["tile_ic", "sp", [-1, 1, 4]], ["tile_oc", "sp", [-1, 32]], ["tile_ow", "sp", [-1, 3, 2]], ["tile_oh", "sp", [-1, 2, 2]]]}, "result": [[0.0002350834], 0, 10.995039939880371, 1615549729.6621938], "version": 0.2, "tvm_version": "0.8.dev0"}
{"input": ["opencl -keys=opencl,gpu -max_num_threads=256", "tutorial/conv2d_no_batching", [1, 40, 40, 128, 16, 1, 1, [1, 1], [0, 0]], {}], "config": {"index": 174, "code_hash": null, "entity": [["tile_ic", "sp", [-1, 1, 4]], ["tile_oc", "sp", [-1, 32]], ["tile_ow", "sp", [-1, 6, 2]], ["tile_oh", "sp", [-1, 1, 2]]]}, "result": [[0.0002357188], 0, 10.150336742401123, 1615549728.6614969], "version": 0.2, "tvm_version": "0.8.dev0"}
{"input": ["opencl -keys=opencl,gpu -max_num_threads=256", "tutorial/conv2d_no_batching", [1, 40, 40, 128, 16, 1, 1, [1, 1], [0, 0]], {}], "config": {"index": 271, "code_hash": null, "entity": [["tile_ic", "sp", [-1, 2, 4]], ["tile_oc", "sp", [-1, 8]], ["tile_ow", "sp", [-1, 14, 2]], ["tile_oh", "sp", [-1, 1, 2]]]}, "result": [[0.00041576039999999996], 0, 12.012125968933105, 1615549730.735997], "version": 0.2, "tvm_version": "0.8.dev0"}
{"input": ["opencl -keys=opencl,gpu -max_num_threads=256", "tutorial/conv2d_no_batching", [1, 40, 40, 128, 16, 1, 1, [1, 1], [0, 0]], {}], "config": {"index": 426, "code_hash": null, "entity": [["tile_ic", "sp", [-1, 1, 4]], ["tile_oc", "sp", [-1, 32]], ["tile_ow", "sp", [-1, 3, 4]], ["tile_oh", "sp", [-1, 1, 2]]]}, "result": [[0.0003025624], 0, 5.571005344390869, 1615549750.6747231], "version": 0.2, "tvm_version": "0.8.dev0"}
{"input": ["opencl -keys=opencl,gpu -max_num_threads=256", "tutorial/conv2d_no_batching", [1, 40, 40, 128, 16, 1, 1, [1, 1], [0, 0]], {}], "config": {"index": 1717, "code_hash": null, "entity": [["tile_ic", "sp", [-1, 2, 4]], ["tile_oc", "sp", [-1, 16]], ["tile_ow", "sp", [-1, 7, 6]], ["tile_oh", "sp", [-1, 2, 2]]]}, "result": [[0.0010462606], 0, 7.12474799156189, 1615549752.0544684], "version": 0.2, "tvm_version": "0.8.dev0"}
{"input": ["opencl -keys=opencl,gpu -max_num_threads=256", "tutorial/conv2d_no_batching", [1, 40, 40, 128, 16, 1, 1, [1, 1], [0, 0]], {}], "config": {"index": 1110, "code_hash": null, "entity": [["tile_ic", "sp", [-1, 1, 4]], ["tile_oc", "sp", [-1, 32]], ["tile_ow", "sp", [-1, 6, 2]], ["tile_oh", "sp", [-1, 2, 2]]]}, "result": [[0.0003215208], 0, 7.89124321937561, 1615549754.1219635], "version": 0.2, "tvm_version": "0.8.dev0"}
{"input": ["opencl -keys=opencl,gpu -max_num_threads=256", "tutorial/conv2d_no_batching", [1, 40, 40, 128, 16, 1, 1, [1, 1], [0, 0]], {}], "config": {"index": 390, "code_hash": null, "entity": [["tile_ic", "sp", [-1, 1, 4]], ["tile_oc", "sp", [-1, 32]], ["tile_ow", "sp", [-1, 2, 4]], ["tile_oh", "sp", [-1, 1, 2]]]}, "result": [[0.0002725416], 0, 7.246978998184204, 1615549753.1056974], "version": 0.2, "tvm_version": "0.8.dev0"}
{"input": ["opencl -keys=opencl,gpu -max_num_threads=256", "tutorial/conv2d_no_batching", [1, 40, 40, 128, 16, 1, 1, [1, 1], [0, 0]], {}], "config": {"index": 213, "code_hash": null, "entity": [["tile_ic", "sp", [-1, 1, 8]], ["tile_oc", "sp", [-1, 32]], ["tile_ow", "sp", [-1, 7, 2]], ["tile_oh", "sp", [-1, 1, 2]]]}, "result": [[0.0002714792], 0, 8.618766784667969, 1615549755.0874841], "version": 0.2, "tvm_version": "0.8.dev0"}
{"input": ["opencl -keys=opencl,gpu -max_num_threads=256", "tutorial/conv2d_no_batching", [1, 40, 40, 128, 16, 1, 1, [1, 1], [0, 0]], {}], "config": {"index": 2076, "code_hash": null, "entity": [["tile_ic", "sp", [-1, 1, 4]], ["tile_oc", "sp", [-1, 16]], ["tile_ow", "sp", [-1, 7, 2]], ["tile_oh", "sp", [-1, 3, 2]]]}, "result": [[0.0002469376], 0, 9.283804178237915, 1615549756.0425243], "version": 0.2, "tvm_version": "0.8.dev0"}
{"input": ["opencl -keys=opencl,gpu -max_num_threads=256", "tutorial/conv2d_no_batching", [1, 40, 40, 128, 16, 1, 1, [1, 1], [0, 0]], {}], "config": {"index": 204, "code_hash": null, "entity": [["tile_ic", "sp", [-1, 1, 4]], ["tile_oc", "sp", [-1, 16]], ["tile_ow", "sp", [-1, 7, 2]], ["tile_oh", "sp", [-1, 1, 2]]]}, "result": [[0.000254875], 0, 10.261311054229736, 1615549757.0310295], "version": 0.2, "tvm_version": "0.8.dev0"}
{"input": ["opencl -keys=opencl,gpu -max_num_threads=256", "tutorial/conv2d_no_batching", [1, 40, 40, 128, 16, 1, 1, [1, 1], [0, 0]], {}], "config": {"index": 277, "code_hash": null, "entity": [["tile_ic", "sp", [-1, 2, 4]], ["tile_oc", "sp", [-1, 16]], ["tile_ow", "sp", [-1, 14, 2]], ["tile_oh", "sp", [-1, 1, 2]]]}, "result": [[0.0003220312], 0, 10.956685781478882, 1615549758.0644603], "version": 0.2, "tvm_version": "0.8.dev0"}
{"input": ["opencl -keys=opencl,gpu -max_num_threads=256", "tutorial/conv2d_no_batching", [1, 40, 40, 128, 16, 1, 1, [1, 1], [0, 0]], {}], "config": {"index": 207, "code_hash": null, "entity": [["tile_ic", "sp", [-1, 1, 8]], ["tile_oc", "sp", [-1, 16]], ["tile_ow", "sp", [-1, 7, 2]], ["tile_oh", "sp", [-1, 1, 2]]]}, "result": [[0.000228875], 0, 5.355931758880615, 1615549777.710398], "version": 0.2, "tvm_version": "0.8.dev0"}
{"input": ["opencl -keys=opencl,gpu -max_num_threads=256", "tutorial/conv2d_no_batching", [1, 40, 40, 128, 16, 1, 1, [1, 1], [0, 0]], {}], "config": {"index": 789, "code_hash": null, "entity": [["tile_ic", "sp", [-1, 1, 8]], ["tile_oc", "sp", [-1, 32]], ["tile_ow", "sp", [-1, 7, 6]], ["tile_oh", "sp", [-1, 1, 2]]]}, "result": [[0.0006543022], 0, 6.80991005897522, 1615549779.1753776], "version": 0.2, "tvm_version": "0.8.dev0"}
{"input": ["opencl -keys=opencl,gpu -max_num_threads=256", "tutorial/conv2d_no_batching", [1, 40, 40, 128, 16, 1, 1, [1, 1], [0, 0]], {}], "config": {"index": 8628, "code_hash": null, "entity": [["tile_ic", "sp", [-1, 1, 4]], ["tile_oc", "sp", [-1, 16]], ["tile_ow", "sp", [-1, 7, 2]], ["tile_oh", "sp", [-1, 1, 4]]]}, "result": [[0.0002598022], 0, 7.85831618309021, 1615549780.2417808], "version": 0.2, "tvm_version": "0.8.dev0"}
{"input": ["opencl -keys=opencl,gpu -max_num_threads=256", "tutorial/conv2d_no_batching", [1, 40, 40, 128, 16, 1, 1, [1, 1], [0, 0]], {}], "config": {"index": 1435, "code_hash": null, "entity": [["tile_ic", "sp", [-1, 2, 4]], ["tile_oc", "sp", [-1, 32]], ["tile_ow", "sp", [-1, 6, 4]], ["tile_oh", "sp", [-1, 2, 2]]]}, "result": [[0.0016114376], 0, 9.343806266784668, 1615549781.5802677], "version": 0.2, "tvm_version": "0.8.dev0"}
{"input": ["opencl -keys=opencl,gpu -max_num_threads=256", "tutorial/conv2d_no_batching", [1, 40, 40, 128, 16, 1, 1, [1, 1], [0, 0]], {}], "config": {"index": 30, "code_hash": null, "entity": [["tile_ic", "sp", [-1, 1, 4]], ["tile_oc", "sp", [-1, 32]], ["tile_ow", "sp", [-1, 1, 2]], ["tile_oh", "sp", [-1, 1, 2]]]}, "result": [[0.00027425], 0, 9.482518911361694, 1615549782.5339873], "version": 0.2, "tvm_version": "0.8.dev0"}
{"input": ["opencl -keys=opencl,gpu -max_num_threads=256", "tutorial/conv2d_no_batching", [1, 40, 40, 128, 16, 1, 1, [1, 1], [0, 0]], {}], "config": {"index": 255, "code_hash": null, "entity": [["tile_ic", "sp", [-1, 1, 8]], ["tile_oc", "sp", [-1, 1]], ["tile_ow", "sp", [-1, 14, 2]], ["tile_oh", "sp", [-1, 1, 2]]]}, "result": [[0.0007045313999999999], 0, 10.616030216217041, 1615549783.6244948], "version": 0.2, "tvm_version": "0.8.dev0"}
{"input": ["opencl -keys=opencl,gpu -max_num_threads=256", "tutorial/conv2d_no_batching", [1, 40, 40, 128, 16, 1, 1, [1, 1], [0, 0]], {}], "config": {"index": 492, "code_hash": null, "entity": [["tile_ic", "sp", [-1, 1, 4]], ["tile_oc", "sp", [-1, 16]], ["tile_ow", "sp", [-1, 6, 4]], ["tile_oh", "sp", [-1, 1, 2]]]}, "result": [[0.0003016876], 0, 11.642224073410034, 1615549784.6866863], "version": 0.2, "tvm_version": "0.8.dev0"}
{"input": ["opencl -keys=opencl,gpu -max_num_threads=256", "tutorial/conv2d_no_batching", [1, 40, 40, 128, 16, 1, 1, [1, 1], [0, 0]], {}], "config": {"index": 2226, "code_hash": null, "entity": [["tile_ic", "sp", [-1, 1, 4]], ["tile_oc", "sp", [-1, 32]], ["tile_ow", "sp", [-1, 1, 4]], ["tile_oh", "sp", [-1, 3, 2]]]}, "result": [[0.0004293438], 0, 12.620738506317139, 1615549785.709203], "version": 0.2, "tvm_version": "0.8.dev0"}
{"input": ["opencl -keys=opencl,gpu -max_num_threads=256", "tutorial/conv2d_no_batching", [1, 40, 40, 128, 16, 1, 1, [1, 1], [0, 0]], {}], "config": {"index": 534, "code_hash": null, "entity": [["tile_ic", "sp", [-1, 1, 4]], ["tile_oc", "sp", [-1, 32]], ["tile_ow", "sp", [-1, 7, 4]], ["tile_oh", "sp", [-1, 1, 2]]]}, "result": [[0.00032423959999999997], 0, 5.47767186164856, 1615549805.9151921], "version": 0.2, "tvm_version": "0.8.dev0"}
{"input": ["opencl -keys=opencl,gpu -max_num_threads=256", "tutorial/conv2d_no_batching", [1, 40, 40, 128, 16, 1, 1, [1, 1], [0, 0]], {}], "config": {"index": 243, "code_hash": null, "entity": [["tile_ic", "sp", [-1, 1, 8]], ["tile_oc", "sp", [-1, 16]], ["tile_ow", "sp", [-1, 8, 2]], ["tile_oh", "sp", [-1, 1, 2]]]}, "result": [[0.000310771], 0, 6.405644178390503, 1615549807.1161656], "version": 0.2, "tvm_version": "0.8.dev0"}
{"input": ["opencl -keys=opencl,gpu -max_num_threads=256", "tutorial/conv2d_no_batching", [1, 40, 40, 128, 16, 1, 1, [1, 1], [0, 0]], {}], "config": {"index": 261, "code_hash": null, "entity": [["tile_ic", "sp", [-1, 1, 8]], ["tile_oc", "sp", [-1, 2]], ["tile_ow", "sp", [-1, 14, 2]], ["tile_oh", "sp", [-1, 1, 2]]]}, "result": [[0.0004950938], 0, 7.13241982460022, 1615549808.1479383], "version": 0.2, "tvm_version": "0.8.dev0"}
{"input": ["opencl -keys=opencl,gpu -max_num_threads=256", "tutorial/conv2d_no_batching", [1, 40, 40, 128, 16, 1, 1, [1, 1], [0, 0]], {}], "config": {"index": 5802, "code_hash": null, "entity": [["tile_ic", "sp", [-1, 1, 4]], ["tile_oc", "sp", [-1, 2]], ["tile_ow", "sp", [-1, 7, 2]], ["tile_oh", "sp", [-1, 8, 2]]]}, "result": [[0.00030454179999999997], 0, 7.980584383010864, 1615549809.147106], "version": 0.2, "tvm_version": "0.8.dev0"}
{"input": ["opencl -keys=opencl,gpu -max_num_threads=256", "tutorial/conv2d_no_batching", [1, 40, 40, 128, 16, 1, 1, [1, 1], [0, 0]], {}], "config": {"index": 1158, "code_hash": null, "entity": [["tile_ic", "sp", [-1, 1, 4]], ["tile_oc", "sp", [-1, 2]], ["tile_ow", "sp", [-1, 8, 2]], ["tile_oh", "sp", [-1, 2, 2]]]}, "result": [[0.0003954376], 0, 8.93336796760559, 1615549810.169886], "version": 0.2, "tvm_version": "0.8.dev0"}
{"input": ["opencl -keys=opencl,gpu -max_num_threads=256", "tutorial/conv2d_no_batching", [1, 40, 40, 128, 16, 1, 1, [1, 1], [0, 0]], {}], "config": {"index": 387, "code_hash": null, "entity": [["tile_ic", "sp", [-1, 1, 8]], ["tile_oc", "sp", [-1, 16]], ["tile_ow", "sp", [-1, 2, 4]], ["tile_oh", "sp", [-1, 1, 2]]]}, "result": [[0.0013868334], 0, 10.399123668670654, 1615549811.5286431], "version": 0.2, "tvm_version": "0.8.dev0"}
{"input": ["opencl -keys=opencl,gpu -max_num_threads=256", "tutorial/conv2d_no_batching", [1, 40, 40, 128, 16, 1, 1, [1, 1], [0, 0]], {}], "config": {"index": 205, "code_hash": null, "entity": [["tile_ic", "sp", [-1, 2, 4]], ["tile_oc", "sp", [-1, 16]], ["tile_ow", "sp", [-1, 7, 2]], ["tile_oh", "sp", [-1, 1, 2]]]}, "result": [[0.0002455106], 0, 5.301012277603149, 1615549932.7598422], "version": 0.2, "tvm_version": "0.8.dev0"}
{"input": ["opencl -keys=opencl,gpu -max_num_threads=256", "tutorial/conv2d_no_batching", [1, 40, 40, 128, 16, 1, 1, [1, 1], [0, 0]], {}], "config": {"index": 240, "code_hash": null, "entity": [["tile_ic", "sp", [-1, 1, 4]], ["tile_oc", "sp", [-1, 16]], ["tile_ow", "sp", [-1, 8, 2]], ["tile_oh", "sp", [-1, 1, 2]]]}, "result": [[0.0002084168], 0, 6.352142095565796, 1615549934.0089686], "version": 0.2, "tvm_version": "0.8.dev0"}
{"input": ["opencl -keys=opencl,gpu -max_num_threads=256", "tutorial/conv2d_no_batching", [1, 40, 40, 128, 16, 1, 1, [1, 1], [0, 0]], {}], "config": {"index": 168, "code_hash": null, "entity": [["tile_ic", "sp", [-1, 1, 4]], ["tile_oc", "sp", [-1, 16]], ["tile_ow", "sp", [-1, 6, 2]], ["tile_oh", "sp", [-1, 1, 2]]]}, "result": [[0.000658198], 0, 7.029542446136475, 1615549934.954374], "version": 0.2, "tvm_version": "0.8.dev0"}
{"input": ["opencl -keys=opencl,gpu -max_num_threads=256", "tutorial/conv2d_no_batching", [1, 40, 40, 128, 16, 1, 1, [1, 1], [0, 0]], {}], "config": {"index": 3012, "code_hash": null, "entity": [["tile_ic", "sp", [-1, 1, 4]], ["tile_oc", "sp", [-1, 16]], ["tile_ow", "sp", [-1, 7, 2]], ["tile_oh", "sp", [-1, 4, 2]]]}, "result": [[0.00026795819999999996], 0, 8.108123302459717, 1615549935.9219525], "version": 0.2, "tvm_version": "0.8.dev0"}
{"input": ["opencl -keys=opencl,gpu -max_num_threads=256", "tutorial/conv2d_no_batching", [1, 40, 40, 128, 16, 1, 1, [1, 1], [0, 0]], {}], "config": {"index": 211, "code_hash": null, "entity": [["tile_ic", "sp", [-1, 2, 4]], ["tile_oc", "sp", [-1, 32]], ["tile_ow", "sp", [-1, 7, 2]], ["tile_oh", "sp", [-1, 1, 2]]]}, "result": [[0.000305177], 0, 8.918547868728638, 1615549936.8903785], "version": 0.2, "tvm_version": "0.8.dev0"}
{"input": ["opencl -keys=opencl,gpu -max_num_threads=256", "tutorial/conv2d_no_batching", [1, 40, 40, 128, 16, 1, 1, [1, 1], [0, 0]], {}], "config": {"index": 198, "code_hash": null, "entity": [["tile_ic", "sp", [-1, 1, 4]], ["tile_oc", "sp", [-1, 8]], ["tile_ow", "sp", [-1, 7, 2]], ["tile_oh", "sp", [-1, 1, 2]]]}, "result": [[0.0002867708], 0, 9.486960172653198, 1615549937.9187875], "version": 0.2, "tvm_version": "0.8.dev0"}
{"input": ["opencl -keys=opencl,gpu -max_num_threads=256", "tutorial/conv2d_no_batching", [1, 40, 40, 128, 16, 1, 1, [1, 1], [0, 0]], {}], "config": {"index": 1326, "code_hash": null, "entity": [["tile_ic", "sp", [-1, 1, 4]], ["tile_oc", "sp", [-1, 32]], ["tile_ow", "sp", [-1, 2, 4]], ["tile_oh", "sp", [-1, 2, 2]]]}, "result": [[0.000366823], 0, 10.816773653030396, 1615549939.0396035], "version": 0.2, "tvm_version": "0.8.dev0"}
{"input": ["opencl -keys=opencl,gpu -max_num_threads=256", "tutorial/conv2d_no_batching", [1, 40, 40, 128, 16, 1, 1, [1, 1], [0, 0]], {}], "config": {"index": 1362, "code_hash": null, "entity": [["tile_ic", "sp", [-1, 1, 4]], ["tile_oc", "sp", [-1, 32]], ["tile_ow", "sp", [-1, 3, 4]], ["tile_oh", "sp", [-1, 2, 2]]]}, "result": [[0.0004330832], 0, 11.890193223953247, 1615549940.1800303], "version": 0.2, "tvm_version": "0.8.dev0"}
{"input": ["opencl -keys=opencl,gpu -max_num_threads=256", "tutorial/conv2d_no_batching", [1, 40, 40, 128, 16, 1, 1, [1, 1], [0, 0]], {}], "config": {"index": 171, "code_hash": null, "entity": [["tile_ic", "sp", [-1, 1, 8]], ["tile_oc", "sp", [-1, 16]], ["tile_ow", "sp", [-1, 6, 2]], ["tile_oh", "sp", [-1, 1, 2]]]}, "result": [[0.00031241659999999997], 0, 5.909555196762085, 1615549958.4324894], "version": 0.2, "tvm_version": "0.8.dev0"}
{"input": ["opencl -keys=opencl,gpu -max_num_threads=256", "tutorial/conv2d_no_batching", [1, 40, 40, 128, 16, 1, 1, [1, 1], [0, 0]], {}], "config": {"index": 456, "code_hash": null, "entity": [["tile_ic", "sp", [-1, 1, 4]], ["tile_oc", "sp", [-1, 16]], ["tile_ow", "sp", [-1, 4, 4]], ["tile_oh", "sp", [-1, 1, 2]]]}, "result": [[0.00046457299999999997], 0, 7.068743705749512, 1615549959.6276755], "version": 0.2, "tvm_version": "0.8.dev0"}
{"input": ["opencl -keys=opencl,gpu -max_num_threads=256", "tutorial/conv2d_no_batching", [1, 40, 40, 128, 16, 1, 1, [1, 1], [0, 0]], {}], "config": {"index": 2040, "code_hash": null, "entity": [["tile_ic", "sp", [-1, 1, 4]], ["tile_oc", "sp", [-1, 16]], ["tile_ow", "sp", [-1, 6, 2]], ["tile_oh", "sp", [-1, 3, 2]]]}, "result": [[0.0002925624], 0, 7.56489109992981, 1615549960.6408262], "version": 0.2, "tvm_version": "0.8.dev0"}
{"input": ["opencl -keys=opencl,gpu -max_num_threads=256", "tutorial/conv2d_no_batching", [1, 40, 40, 128, 16, 1, 1, [1, 1], [0, 0]], {}], "config": {"index": 169, "code_hash": null, "entity": [["tile_ic", "sp", [-1, 2, 4]], ["tile_oc", "sp", [-1, 16]], ["tile_ow", "sp", [-1, 6, 2]], ["tile_oh", "sp", [-1, 1, 2]]]}, "result": [[0.00033893759999999997], 0, 8.485236167907715, 1615549961.6811697], "version": 0.2, "tvm_version": "0.8.dev0"}
{"input": ["opencl -keys=opencl,gpu -max_num_threads=256", "tutorial/conv2d_no_batching", [1, 40, 40, 128, 16, 1, 1, [1, 1], [0, 0]], {}], "config": {"index": 138, "code_hash": null, "entity": [["tile_ic", "sp", [-1, 1, 4]], ["tile_oc", "sp", [-1, 32]], ["tile_ow", "sp", [-1, 4, 2]], ["tile_oh", "sp", [-1, 1, 2]]]}, "result": [[0.0002637398], 0, 9.275204420089722, 1615549962.742158], "version": 0.2, "tvm_version": "0.8.dev0"}
{"input": ["opencl -keys=opencl,gpu -max_num_threads=256", "tutorial/conv2d_no_batching", [1, 40, 40, 128, 16, 1, 1, [1, 1], [0, 0]], {}], "config": {"index": 162, "code_hash": null, "entity": [["tile_ic", "sp", [-1, 1, 4]], ["tile_oc", "sp", [-1, 8]], ["tile_ow", "sp", [-1, 6, 2]], ["tile_oh", "sp", [-1, 1, 2]]]}, "result": [[0.0002645938], 0, 10.079313516616821, 1615549963.7642496], "version": 0.2, "tvm_version": "0.8.dev0"}
{"input": ["opencl -keys=opencl,gpu -max_num_threads=256", "tutorial/conv2d_no_batching", [1, 40, 40, 128, 16, 1, 1, [1, 1], [0, 0]], {}], "config": {"index": 276, "code_hash": null, "entity": [["tile_ic", "sp", [-1, 1, 4]], ["tile_oc", "sp", [-1, 16]], ["tile_ow", "sp", [-1, 14, 2]], ["tile_oh", "sp", [-1, 1, 2]]]}, "result": [[0.00027413540000000003], 0, 10.928832054138184, 1615549964.8437643], "version": 0.2, "tvm_version": "0.8.dev0"}
{"input": ["opencl -keys=opencl,gpu -max_num_threads=256", "tutorial/conv2d_no_batching", [1, 40, 40, 128, 16, 1, 1, [1, 1], [0, 0]], {}], "config": {"index": 5820, "code_hash": null, "entity": [["tile_ic", "sp", [-1, 1, 4]], ["tile_oc", "sp", [-1, 16]], ["tile_ow", "sp", [-1, 7, 2]], ["tile_oh", "sp", [-1, 8, 2]]]}, "result": [[0.0002964272], 0, 11.760420560836792, 1615549965.9093566], "version": 0.2, "tvm_version": "0.8.dev0"}
{"input": ["opencl -keys=opencl,gpu -max_num_threads=256", "tutorial/conv2d_no_batching", [1, 40, 40, 128, 16, 1, 1, [1, 1], [0, 0]], {}], "config": {"index": 9564, "code_hash": null, "entity": [["tile_ic", "sp", [-1, 1, 4]], ["tile_oc", "sp", [-1, 16]], ["tile_ow", "sp", [-1, 7, 2]], ["tile_oh", "sp", [-1, 2, 4]]]}, "result": [[0.00034197920000000003], 0, 5.803005695343018, 1615549986.0871222], "version": 0.2, "tvm_version": "0.8.dev0"}
{"input": ["opencl -keys=opencl,gpu -max_num_threads=256", "tutorial/conv2d_no_batching", [1, 40, 40, 128, 16, 1, 1, [1, 1], [0, 0]], {}], "config": {"index": 1104, "code_hash": null, "entity": [["tile_ic", "sp", [-1, 1, 4]], ["tile_oc", "sp", [-1, 16]], ["tile_ow", "sp", [-1, 6, 2]], ["tile_oh", "sp", [-1, 2, 2]]]}, "result": [[0.000268771], 0, 7.2489707469940186, 1615549987.3860888], "version": 0.2, "tvm_version": "0.8.dev0"}
{"input": ["opencl -keys=opencl,gpu -max_num_threads=256", "tutorial/conv2d_no_batching", [1, 40, 40, 128, 16, 1, 1, [1, 1], [0, 0]], {}], "config": {"index": 1035, "code_hash": null, "entity": [["tile_ic", "sp", [-1, 1, 8]], ["tile_oc", "sp", [-1, 16]], ["tile_ow", "sp", [-1, 3, 2]], ["tile_oh", "sp", [-1, 2, 2]]]}, "result": [[0.0004181562], 0, 8.146673440933228, 1615549988.5857902], "version": 0.2, "tvm_version": "0.8.dev0"}
{"input": ["opencl -keys=opencl,gpu -max_num_threads=256", "tutorial/conv2d_no_batching", [1, 40, 40, 128, 16, 1, 1, [1, 1], [0, 0]], {}], "config": {"index": 60, "code_hash": null, "entity": [["tile_ic", "sp", [-1, 1, 4]], ["tile_oc", "sp", [-1, 16]], ["tile_ow", "sp", [-1, 2, 2]], ["tile_oh", "sp", [-1, 1, 2]]]}, "result": [[0.00029225000000000003], 0, 8.603511571884155, 1615549989.605629], "version": 0.2, "tvm_version": "0.8.dev0"}
{"input": ["opencl -keys=opencl,gpu -max_num_threads=256", "tutorial/conv2d_no_batching", [1, 40, 40, 128, 16, 1, 1, [1, 1], [0, 0]], {}], "config": {"index": 528, "code_hash": null, "entity": [["tile_ic", "sp", [-1, 1, 4]], ["tile_oc", "sp", [-1, 16]], ["tile_ow", "sp", [-1, 7, 4]], ["tile_oh", "sp", [-1, 1, 2]]]}, "result": [[0.00032331259999999996], 0, 9.558733463287354, 1615549990.6218512], "version": 0.2, "tvm_version": "0.8.dev0"}
{"input": ["opencl -keys=opencl,gpu -max_num_threads=256", "tutorial/conv2d_no_batching", [1, 40, 40, 128, 16, 1, 1, [1, 1], [0, 0]], {}], "config": {"index": 2079, "code_hash": null, "entity": [["tile_ic", "sp", [-1, 1, 8]], ["tile_oc", "sp", [-1, 16]], ["tile_ow", "sp", [-1, 7, 2]], ["tile_oh", "sp", [-1, 3, 2]]]}, "result": [[0.0002829168], 0, 10.329156875610352, 1615549991.6702774], "version": 0.2, "tvm_version": "0.8.dev0"}
{"input": ["opencl -keys=opencl,gpu -max_num_threads=256", "tutorial/conv2d_no_batching", [1, 40, 40, 128, 16, 1, 1, [1, 1], [0, 0]], {}], "config": {"index": 2077, "code_hash": null, "entity": [["tile_ic", "sp", [-1, 2, 4]], ["tile_oc", "sp", [-1, 16]], ["tile_ow", "sp", [-1, 7, 2]], ["tile_oh", "sp", [-1, 3, 2]]]}, "result": [[0.0003718854], 0, 12.302483558654785, 1615549993.686599], "version": 0.2, "tvm_version": "0.8.dev0"}
{"input": ["opencl -keys=opencl,gpu -max_num_threads=256", "tutorial/conv2d_no_batching", [1, 40, 40, 128, 16, 1, 1, [1, 1], [0, 0]], {}], "config": {"index": 348, "code_hash": null, "entity": [["tile_ic", "sp", [-1, 1, 4]], ["tile_oc", "sp", [-1, 16]], ["tile_ow", "sp", [-1, 1, 4]], ["tile_oh", "sp", [-1, 1, 2]]]}, "result": [[0.000351521], 0, 11.514847755432129, 1615549992.6809664], "version": 0.2, "tvm_version": "0.8.dev0"}
{"input": ["opencl -keys=opencl,gpu -max_num_threads=256", "tutorial/conv2d_no_batching", [1, 40, 40, 128, 16, 1, 1, [1, 1], [0, 0]], {}], "config": {"index": 1032, "code_hash": null, "entity": [["tile_ic", "sp", [-1, 1, 4]], ["tile_oc", "sp", [-1, 16]], ["tile_ow", "sp", [-1, 3, 2]], ["tile_oh", "sp", [-1, 2, 2]]]}, "result": [[0.00026371879999999997], 0, 6.694674015045166, 1615550015.0959373], "version": 0.2, "tvm_version": "0.8.dev0"}
{"input": ["opencl -keys=opencl,gpu -max_num_threads=256", "tutorial/conv2d_no_batching", [1, 40, 40, 128, 16, 1, 1, [1, 1], [0, 0]], {}], "config": {"index": 241, "code_hash": null, "entity": [["tile_ic", "sp", [-1, 2, 4]], ["tile_oc", "sp", [-1, 16]], ["tile_ow", "sp", [-1, 8, 2]], ["tile_oh", "sp", [-1, 1, 2]]]}, "result": [[0.000248375], 0, 8.135055780410767, 1615550016.1923172], "version": 0.2, "tvm_version": "0.8.dev0"}
{"input": ["opencl -keys=opencl,gpu -max_num_threads=256", "tutorial/conv2d_no_batching", [1, 40, 40, 128, 16, 1, 1, [1, 1], [0, 0]], {}], "config": {"index": 2070, "code_hash": null, "entity": [["tile_ic", "sp", [-1, 1, 4]], ["tile_oc", "sp", [-1, 8]], ["tile_ow", "sp", [-1, 7, 2]], ["tile_oh", "sp", [-1, 3, 2]]]}, "result": [[0.00028134380000000004], 0, 5.720524072647095, 1615550013.9917867], "version": 0.2, "tvm_version": "0.8.dev0"}
{"input": ["opencl -keys=opencl,gpu -max_num_threads=256", "tutorial/conv2d_no_batching", [1, 40, 40, 128, 16, 1, 1, [1, 1], [0, 0]], {}], "config": {"index": 1137, "code_hash": null, "entity": [["tile_ic", "sp", [-1, 1, 8]], ["tile_oc", "sp", [-1, 8]], ["tile_ow", "sp", [-1, 7, 2]], ["tile_oh", "sp", [-1, 2, 2]]]}, "result": [[0.0002735626], 0, 8.387057065963745, 1615550017.2653222], "version": 0.2, "tvm_version": "0.8.dev0"}
{"input": ["opencl -keys=opencl,gpu -max_num_threads=256", "tutorial/conv2d_no_batching", [1, 40, 40, 128, 16, 1, 1, [1, 1], [0, 0]], {}], "config": {"index": 165, "code_hash": null, "entity": [["tile_ic", "sp", [-1, 1, 8]], ["tile_oc", "sp", [-1, 8]], ["tile_ow", "sp", [-1, 6, 2]], ["tile_oh", "sp", [-1, 1, 2]]]}, "result": [[0.0002914896], 0, 9.500374794006348, 1615550018.49964], "version": 0.2, "tvm_version": "0.8.dev0"}
{"input": ["opencl -keys=opencl,gpu -max_num_threads=256", "tutorial/conv2d_no_batching", [1, 40, 40, 128, 16, 1, 1, [1, 1], [0, 0]], {}], "config": {"index": 5821, "code_hash": null, "entity": [["tile_ic", "sp", [-1, 2, 4]], ["tile_oc", "sp", [-1, 16]], ["tile_ow", "sp", [-1, 7, 2]], ["tile_oh", "sp", [-1, 8, 2]]]}, "result": [[0.00031738539999999997], 0, 10.476560831069946, 1615550019.5658264], "version": 0.2, "tvm_version": "0.8.dev0"}
{"input": ["opencl -keys=opencl,gpu -max_num_threads=256", "tutorial/conv2d_no_batching", [1, 40, 40, 128, 16, 1, 1, [1, 1], [0, 0]], {}], "config": {"index": 132, "code_hash": null, "entity": [["tile_ic", "sp", [-1, 1, 4]], ["tile_oc", "sp", [-1, 16]], ["tile_ow", "sp", [-1, 4, 2]], ["tile_oh", "sp", [-1, 1, 2]]]}, "result": [[0.0002738646], 0, 11.247625827789307, 1615550020.5308897], "version": 0.2, "tvm_version": "0.8.dev0"}
{"input": ["opencl -keys=opencl,gpu -max_num_threads=256", "tutorial/conv2d_no_batching", [1, 40, 40, 128, 16, 1, 1, [1, 1], [0, 0]], {}], "config": {"index": 10500, "code_hash": null, "entity": [["tile_ic", "sp", [-1, 1, 4]], ["tile_oc", "sp", [-1, 16]], ["tile_ow", "sp", [-1, 7, 2]], ["tile_oh", "sp", [-1, 3, 4]]]}, "result": [[0.00041893759999999996], 0, 12.172837495803833, 1615550021.5670998], "version": 0.2, "tvm_version": "0.8.dev0"}
{"input": ["opencl -keys=opencl,gpu -max_num_threads=256", "tutorial/conv2d_no_batching", [1, 40, 40, 128, 16, 1, 1, [1, 1], [0, 0]], {}], "config": {"index": 420, "code_hash": null, "entity": [["tile_ic", "sp", [-1, 1, 4]], ["tile_oc", "sp", [-1, 16]], ["tile_ow", "sp", [-1, 3, 4]], ["tile_oh", "sp", [-1, 1, 2]]]}, "result": [[0.0003797396], 0, 5.5970070362091064, 1615550039.9692223], "version": 0.2, "tvm_version": "0.8.dev0"}
{"input": ["opencl -keys=opencl,gpu -max_num_threads=256", "tutorial/conv2d_no_batching", [1, 40, 40, 128, 16, 1, 1, [1, 1], [0, 0]], {}], "config": {"index": 564, "code_hash": null, "entity": [["tile_ic", "sp", [-1, 1, 4]], ["tile_oc", "sp", [-1, 16]], ["tile_ow", "sp", [-1, 8, 4]], ["tile_oh", "sp", [-1, 1, 2]]]}, "result": [[0.0003597292], 0, 6.692744016647339, 1615550041.2119634], "version": 0.2, "tvm_version": "0.8.dev0"}
{"input": ["opencl -keys=opencl,gpu -max_num_threads=256", "tutorial/conv2d_no_batching", [1, 40, 40, 128, 16, 1, 1, [1, 1], [0, 0]], {}], "config": {"index": 3948, "code_hash": null, "entity": [["tile_ic", "sp", [-1, 1, 4]], ["tile_oc", "sp", [-1, 16]], ["tile_ow", "sp", [-1, 7, 2]], ["tile_oh", "sp", [-1, 6, 2]]]}, "result": [[0.0002762812], 0, 7.050432205200195, 1615550042.1766474], "version": 0.2, "tvm_version": "0.8.dev0"}
{"input": ["opencl -keys=opencl,gpu -max_num_threads=256", "tutorial/conv2d_no_batching", [1, 40, 40, 128, 16, 1, 1, [1, 1], [0, 0]], {}], "config": {"index": 96, "code_hash": null, "entity": [["tile_ic", "sp", [-1, 1, 4]], ["tile_oc", "sp", [-1, 16]], ["tile_ow", "sp", [-1, 3, 2]], ["tile_oh", "sp", [-1, 1, 2]]]}, "result": [[0.0003058022], 0, 8.050113677978516, 1615550043.2183306], "version": 0.2, "tvm_version": "0.8.dev0"}
{"input": ["opencl -keys=opencl,gpu -max_num_threads=256", "tutorial/conv2d_no_batching", [1, 40, 40, 128, 16, 1, 1, [1, 1], [0, 0]], {}], "config": {"index": 3949, "code_hash": null, "entity": [["tile_ic", "sp", [-1, 2, 4]], ["tile_oc", "sp", [-1, 16]], ["tile_ow", "sp", [-1, 7, 2]], ["tile_oh", "sp", [-1, 6, 2]]]}, "result": [[0.0003409272], 0, 9.434840679168701, 1615550044.3070185], "version": 0.2, "tvm_version": "0.8.dev0"}
{"input": ["opencl -keys=opencl,gpu -max_num_threads=256", "tutorial/conv2d_no_batching", [1, 40, 40, 128, 16, 1, 1, [1, 1], [0, 0]], {}], "config": {"index": 2922, "code_hash": null, "entity": [["tile_ic", "sp", [-1, 1, 4]], ["tile_oc", "sp", [-1, 2]], ["tile_ow", "sp", [-1, 4, 2]], ["tile_oh", "sp", [-1, 4, 2]]]}, "result": [[0.0005105312], 0, 10.021912574768066, 1615550045.3381283], "version": 0.2, "tvm_version": "0.8.dev0"}
{"input": ["opencl -keys=opencl,gpu -max_num_threads=256", "tutorial/conv2d_no_batching", [1, 40, 40, 128, 16, 1, 1, [1, 1], [0, 0]], {}], "config": {"index": 3942, "code_hash": null, "entity": [["tile_ic", "sp", [-1, 1, 4]], ["tile_oc", "sp", [-1, 8]], ["tile_ow", "sp", [-1, 7, 2]], ["tile_oh", "sp", [-1, 6, 2]]]}, "result": [[0.0002841354], 0, 10.856325387954712, 1615550046.343505], "version": 0.2, "tvm_version": "0.8.dev0"}
{"input": ["opencl -keys=opencl,gpu -max_num_threads=256", "tutorial/conv2d_no_batching", [1, 40, 40, 128, 16, 1, 1, [1, 1], [0, 0]], {}], "config": {"index": 3013, "code_hash": null, "entity": [["tile_ic", "sp", [-1, 2, 4]], ["tile_oc", "sp", [-1, 16]], ["tile_ow", "sp", [-1, 7, 2]], ["tile_oh", "sp", [-1, 4, 2]]]}, "result": [[0.000531073], 0, 11.669843912124634, 1615550047.4190278], "version": 0.2, "tvm_version": "0.8.dev0"}
{"input": ["opencl -keys=opencl,gpu -max_num_threads=256", "tutorial/conv2d_no_batching", [1, 40, 40, 128, 16, 1, 1, [1, 1], [0, 0]], {}], "config": {"index": 1128, "code_hash": null, "entity": [["tile_ic", "sp", [-1, 1, 4]], ["tile_oc", "sp", [-1, 4]], ["tile_ow", "sp", [-1, 7, 2]], ["tile_oh", "sp", [-1, 2, 2]]]}, "result": [[0.0002925314], 0, 4.985823392868042, 1615550065.7146485], "version": 0.2, "tvm_version": "0.8.dev0"}
