test_and_tune/x86debug/x86.topi_winograd.log.tmp
{"input": ["opencl -keys=opencl,gpu -max_num_threads=256", "tutorial/conv2d_no_batching", [1, 40, 40, 64, 64, 3, 3, [1, 1], [1, 1]], {}], "config": {"index": 216253103, "code_hash": null, "entity": [["inv_cp", "sp", [-1, 8]], ["inv_wp", "sp", [-1, 10, 1]], ["inv_hp", "sp", [-1, 2, 4]], ["kernel_cp", "sp", [-1, 4]], ["kernel_kp", "sp", [-1, 4]], ["data_cp", "sp", [-1, 16]], ["data_wp", "sp", [-1, 4, 4]], ["data_hp", "sp", [-1, 1, 4]], ["bgemm_kp", "sp", [-1, 4]], ["bgemm_wp", "sp", [-1, 2, 4]], ["bgemm_hp", "sp", [-1, 2]]]}, "result": [[0.00837195], 0, 20.092353343963623, 1615692677.793969], "version": 0.2, "tvm_version": "0.8.dev0"}
{"input": ["opencl -keys=opencl,gpu -max_num_threads=256", "tutorial/conv2d_no_batching", [1, 40, 40, 64, 64, 3, 3, [1, 1], [1, 1]], {}], "config": {"index": 757210785, "code_hash": null, "entity": [["inv_cp", "sp", [-1, 2]], ["inv_wp", "sp", [-1, 200, 2]], ["inv_hp", "sp", [-1, 1, 4]], ["kernel_cp", "sp", [-1, 8]], ["kernel_kp", "sp", [-1, 8]], ["data_cp", "sp", [-1, 1]], ["data_wp", "sp", [-1, 1, 4]], ["data_hp", "sp", [-1, 1, 16]], ["bgemm_kp", "sp", [-1, 16]], ["bgemm_wp", "sp", [-1, 2, 4]], ["bgemm_hp", "sp", [-1, 16]]]}, "result": [[0.01939286], 0, 17.140600442886353, 1615692674.8096006], "version": 0.2, "tvm_version": "0.8.dev0"}
{"input": ["opencl -keys=opencl,gpu -max_num_threads=256", "tutorial/conv2d_no_batching", [1, 40, 40, 64, 64, 3, 3, [1, 1], [1, 1]], {}], "config": {"index": 335312078, "code_hash": null, "entity": [["inv_cp", "sp", [-1, 4]], ["inv_wp", "sp", [-1, 5, 5]], ["inv_hp", "sp", [-1, 1, 4]], ["kernel_cp", "sp", [-1, 16]], ["kernel_kp", "sp", [-1, 1]], ["data_cp", "sp", [-1, 16]], ["data_wp", "sp", [-1, 1, 16]], ["data_hp", "sp", [-1, 4, 4]], ["bgemm_kp", "sp", [-1, 4]], ["bgemm_wp", "sp", [-1, 1, 16]], ["bgemm_hp", "sp", [-1, 2]]]}, "result": [[0.006348810000000001], 0, 22.8948757648468, 1615692680.9973238], "version": 0.2, "tvm_version": "0.8.dev0"}
{"input": ["opencl -keys=opencl,gpu -max_num_threads=256", "tutorial/conv2d_no_batching", [1, 40, 40, 64, 64, 3, 3, [1, 1], [1, 1]], {}], "config": {"index": 55087331, "code_hash": null, "entity": [["inv_cp", "sp", [-1, 8]], ["inv_wp", "sp", [-1, 20, 4]], ["inv_hp", "sp", [-1, 4, 4]], ["kernel_cp", "sp", [-1, 1]], ["kernel_kp", "sp", [-1, 2]], ["data_cp", "sp", [-1, 1]], ["data_wp", "sp", [-1, 2, 8]], ["data_hp", "sp", [-1, 4, 4]], ["bgemm_kp", "sp", [-1, 16]], ["bgemm_wp", "sp", [-1, 2, 4]], ["bgemm_hp", "sp", [-1, 1]]]}, "result": [[0.0055506800000000005], 0, 25.60170030593872, 1615692683.9658642], "version": 0.2, "tvm_version": "0.8.dev0"}
{"input": ["opencl -keys=opencl,gpu -max_num_threads=256", "tutorial/conv2d_no_batching", [1, 40, 40, 64, 64, 3, 3, [1, 1], [1, 1]], {}], "config": {"index": 733829836, "code_hash": null, "entity": [["inv_cp", "sp", [-1, 1]], ["inv_wp", "sp", [-1, 8, 2]], ["inv_hp", "sp", [-1, 1, 4]], ["kernel_cp", "sp", [-1, 4]], ["kernel_kp", "sp", [-1, 1]], ["data_cp", "sp", [-1, 16]], ["data_wp", "sp", [-1, 1, 16]], ["data_hp", "sp", [-1, 2, 8]], ["bgemm_kp", "sp", [-1, 1]], ["bgemm_wp", "sp", [-1, 2, 4]], ["bgemm_hp", "sp", [-1, 16]]]}, "result": [[0.00796732], 0, 28.93425679206848, 1615692687.1727185], "version": 0.2, "tvm_version": "0.8.dev0"}
{"input": ["opencl -keys=opencl,gpu -max_num_threads=256", "tutorial/conv2d_no_batching", [1, 40, 40, 64, 64, 3, 3, [1, 1], [1, 1]], {}], "config": {"index": 634716268, "code_hash": null, "entity": [["inv_cp", "sp", [-1, 1]], ["inv_wp", "sp", [-1, 10, 20]], ["inv_hp", "sp", [-1, 1, 4]], ["kernel_cp", "sp", [-1, 1]], ["kernel_kp", "sp", [-1, 1]], ["data_cp", "sp", [-1, 1]], ["data_wp", "sp", [-1, 1, 4]], ["data_hp", "sp", [-1, 1, 16]], ["bgemm_kp", "sp", [-1, 8]], ["bgemm_wp", "sp", [-1, 1, 8]], ["bgemm_hp", "sp", [-1, 8]]]}, "result": [[0.01999835], 0, 87.72246146202087, 1615692746.1539109], "version": 0.2, "tvm_version": "0.8.dev0"}
{"input": ["opencl -keys=opencl,gpu -max_num_threads=256", "tutorial/conv2d_no_batching", [1, 40, 40, 64, 64, 3, 3, [1, 1], [1, 1]], {}], "config": {"index": 210827662, "code_hash": null, "entity": [["inv_cp", "sp", [-1, 4]], ["inv_wp", "sp", [-1, 100, 4]], ["inv_hp", "sp", [-1, 4, 4]], ["kernel_cp", "sp", [-1, 1]], ["kernel_kp", "sp", [-1, 1]], ["data_cp", "sp", [-1, 4]], ["data_wp", "sp", [-1, 1, 16]], ["data_hp", "sp", [-1, 1, 4]], ["bgemm_kp", "sp", [-1, 2]], ["bgemm_wp", "sp", [-1, 2, 4]], ["bgemm_hp", "sp", [-1, 2]]]}, "result": [[0.01281129], 0, 91.0076813697815, 1615692749.4508107], "version": 0.2, "tvm_version": "0.8.dev0"}
{"input": ["opencl -keys=opencl,gpu -max_num_threads=256", "tutorial/conv2d_no_batching", [1, 40, 40, 64, 64, 3, 3, [1, 1], [1, 1]], {}], "config": {"index": 725330294, "code_hash": null, "entity": [["inv_cp", "sp", [-1, 4]], ["inv_wp", "sp", [-1, 25, 4]], ["inv_hp", "sp", [-1, 1, 4]], ["kernel_cp", "sp", [-1, 16]], ["kernel_kp", "sp", [-1, 8]], ["data_cp", "sp", [-1, 2]], ["data_wp", "sp", [-1, 2, 4]], ["data_hp", "sp", [-1, 4, 4]], ["bgemm_kp", "sp", [-1, 16]], ["bgemm_wp", "sp", [-1, 1, 4]], ["bgemm_hp", "sp", [-1, 16]]]}, "result": [[0.00541303], 0, 93.59868025779724, 1615692752.5129569], "version": 0.2, "tvm_version": "0.8.dev0"}
