test_and_tune/remote_tmali/Adreno640.wino3x3_t.log.tmp
{"input": ["opencl -keys=mali,opencl,gpu -device=mali -max_num_threads=256", "winograd_2", [1, 28, 28, 128, 128, 3, 3, [1, 1], [1, 1, 1, 1]], {}], "config": {"index": 20118871, "code_hash": null, "entity": [["inv_cp", "sp", [-1, 2]], ["inv_wp", "sp", [-1, 8, 2]], ["inv_hp", "sp", [-1, 14, 2]], ["kernel_cp", "sp", [-1, 1]], ["kernel_kp", "sp", [-1, 8]], ["data_cp", "sp", [-1, 1]], ["data_wp", "sp", [-1, 1, 1]], ["data_hp", "sp", [-1, 4, 1]], ["bgemm_kp", "sp", [-1, 2]], ["bgemm_wp", "sp", [-1, 8, 4]], ["bgemm_hp", "sp", [-1, 1]]]}, "result": [[0.0018432767999999999], 0, 6.208261013031006, 1618290593.9492679], "version": 0.2, "tvm_version": "0.8.dev0"}
{"input": ["opencl -keys=mali,opencl,gpu -device=mali -max_num_threads=256", "winograd_2", [1, 28, 28, 128, 128, 3, 3, [1, 1], [1, 1, 1, 1]], {}], "config": {"index": 14208598, "code_hash": null, "entity": [["inv_cp", "sp", [-1, 8]], ["inv_wp", "sp", [-1, 14, 2]], ["inv_hp", "sp", [-1, 7, 2]], ["kernel_cp", "sp", [-1, 1]], ["kernel_kp", "sp", [-1, 4]], ["data_cp", "sp", [-1, 1]], ["data_wp", "sp", [-1, 1, 1]], ["data_hp", "sp", [-1, 14, 1]], ["bgemm_kp", "sp", [-1, 8]], ["bgemm_wp", "sp", [-1, 4, 4]], ["bgemm_hp", "sp", [-1, 1]]]}, "result": [[0.0009583360000000001], 0, 10.01540756225586, 1618290594.8055623], "version": 0.2, "tvm_version": "0.8.dev0"}
{"input": ["opencl -keys=mali,opencl,gpu -device=mali -max_num_threads=256", "winograd_2", [1, 28, 28, 128, 128, 3, 3, [1, 1], [1, 1, 1, 1]], {}], "config": {"index": 36940624, "code_hash": null, "entity": [["inv_cp", "sp", [-1, 16]], ["inv_wp", "sp", [-1, 4, 2]], ["inv_hp", "sp", [-1, 14, 2]], ["kernel_cp", "sp", [-1, 4]], ["kernel_kp", "sp", [-1, 4]], ["data_cp", "sp", [-1, 8]], ["data_wp", "sp", [-1, 2, 1]], ["data_hp", "sp", [-1, 4, 1]], ["bgemm_kp", "sp", [-1, 16]], ["bgemm_wp", "sp", [-1, 28, 4]], ["bgemm_hp", "sp", [-1, 1]]]}, "result": [[0.0005455104000000001], 0, 9.002458333969116, 1618290595.6595356], "version": 0.2, "tvm_version": "0.8.dev0"}
{"input": ["opencl -keys=mali,opencl,gpu -device=mali -max_num_threads=256", "winograd_2", [1, 28, 28, 128, 128, 3, 3, [1, 1], [1, 1, 1, 1]], {}], "config": {"index": 34265057, "code_hash": null, "entity": [["inv_cp", "sp", [-1, 4]], ["inv_wp", "sp", [-1, 14, 2]], ["inv_hp", "sp", [-1, 4, 2]], ["kernel_cp", "sp", [-1, 4]], ["kernel_kp", "sp", [-1, 4]], ["data_cp", "sp", [-1, 16]], ["data_wp", "sp", [-1, 4, 1]], ["data_hp", "sp", [-1, 1, 1]], ["bgemm_kp", "sp", [-1, 1]], ["bgemm_wp", "sp", [-1, 28, 4]], ["bgemm_hp", "sp", [-1, 1]]]}, "result": [[0.001102592], 0, 11.708385944366455, 1618290596.540797], "version": 0.2, "tvm_version": "0.8.dev0"}
{"input": ["opencl -keys=mali,opencl,gpu -device=mali -max_num_threads=256", "winograd_2", [1, 28, 28, 128, 128, 3, 3, [1, 1], [1, 1, 1, 1]], {}], "config": {"index": 23116008, "code_hash": null, "entity": [["inv_cp", "sp", [-1, 8]], ["inv_wp", "sp", [-1, 7, 2]], ["inv_hp", "sp", [-1, 4, 2]], ["kernel_cp", "sp", [-1, 2]], ["kernel_kp", "sp", [-1, 2]], ["data_cp", "sp", [-1, 8]], ["data_wp", "sp", [-1, 14, 1]], ["data_hp", "sp", [-1, 1, 1]], ["bgemm_kp", "sp", [-1, 1]], ["bgemm_wp", "sp", [-1, 14, 4]], ["bgemm_hp", "sp", [-1, 1]]]}, "result": [[0.002100608], 0, 11.027547597885132, 1618290597.4612985], "version": 0.2, "tvm_version": "0.8.dev0"}
{"input": ["opencl -keys=mali,opencl,gpu -device=mali -max_num_threads=256", "winograd_2", [1, 28, 28, 128, 128, 3, 3, [1, 1], [1, 1, 1, 1]], {}], "config": {"index": 28080992, "code_hash": null, "entity": [["inv_cp", "sp", [-1, 4]], ["inv_wp", "sp", [-1, 8, 2]], ["inv_hp", "sp", [-1, 7, 2]], ["kernel_cp", "sp", [-1, 32]], ["kernel_kp", "sp", [-1, 2]], ["data_cp", "sp", [-1, 32]], ["data_wp", "sp", [-1, 14, 1]], ["data_hp", "sp", [-1, 1, 1]], ["bgemm_kp", "sp", [-1, 4]], ["bgemm_wp", "sp", [-1, 16, 4]], ["bgemm_hp", "sp", [-1, 1]]]}, "result": [[0.0006145536], 0, 12.091676712036133, 1618290599.181159], "version": 0.2, "tvm_version": "0.8.dev0"}
{"input": ["opencl -keys=mali,opencl,gpu -device=mali -max_num_threads=256", "winograd_2", [1, 28, 28, 128, 128, 3, 3, [1, 1], [1, 1, 1, 1]], {}], "config": {"index": 22423556, "code_hash": null, "entity": [["inv_cp", "sp", [-1, 2]], ["inv_wp", "sp", [-1, 14, 2]], ["inv_hp", "sp", [-1, 7, 2]], ["kernel_cp", "sp", [-1, 8]], ["kernel_kp", "sp", [-1, 16]], ["data_cp", "sp", [-1, 4]], ["data_wp", "sp", [-1, 2, 1]], ["data_hp", "sp", [-1, 1, 1]], ["bgemm_kp", "sp", [-1, 32]], ["bgemm_wp", "sp", [-1, 14, 4]], ["bgemm_hp", "sp", [-1, 1]]]}, "result": [[0.0005765632000000001], 0, 12.438873529434204, 1618290598.3340244], "version": 0.2, "tvm_version": "0.8.dev0"}
