test_and_tune/remote_tmali/Adreno630.topinhw4c1.log.tmp
{"input": ["opencl -keys=opencl,gpu -max_num_threads=256", "tutorial/conv2d_no_batching", [1, 14, 14, 512, 256, 3, 3, [2, 2], [1, 1, 1, 1]], {}], "config": {"index": 1689, "code_hash": null, "entity": [["tile_ic", "sp", [-1, 2, 4]], ["tile_oc", "sp", [-1, 64]], ["tile_ow", "sp", [-1, 2, 2]], ["tile_oh", "sp", [-1, 7, 1]]]}, "result": [[0.000912047], 0, 0.9329330921173096, 1615983248.8992937], "version": 0.2, "tvm_version": "0.8.dev0"}
{"input": ["opencl -keys=opencl,gpu -max_num_threads=256", "tutorial/conv2d_no_batching", [1, 14, 14, 512, 256, 3, 3, [2, 2], [1, 1, 1, 1]], {}], "config": {"index": 6873, "code_hash": null, "entity": [["tile_ic", "sp", [-1, 2, 4]], ["tile_oc", "sp", [-1, 64]], ["tile_ow", "sp", [-1, 8, 1]], ["tile_oh", "sp", [-1, 1, 8]]]}, "result": [[0.0055670162], 0, 2.228907346725464, 1615983250.054848], "version": 0.2, "tvm_version": "0.8.dev0"}
{"input": ["opencl -keys=opencl,gpu -max_num_threads=256", "tutorial/conv2d_no_batching", [1, 14, 14, 512, 256, 3, 3, [2, 2], [1, 1, 1, 1]], {}], "config": {"index": 5334, "code_hash": null, "entity": [["tile_ic", "sp", [-1, 4, 4]], ["tile_oc", "sp", [-1, 32]], ["tile_ow", "sp", [-1, 2, 1]], ["tile_oh", "sp", [-1, 2, 4]]]}, "result": [[0.0062184536999999995], 0, 3.3946375846862793, 1615983251.293782], "version": 0.2, "tvm_version": "0.8.dev0"}
{"input": ["opencl -keys=opencl,gpu -max_num_threads=256", "tutorial/conv2d_no_batching", [1, 14, 14, 512, 256, 3, 3, [2, 2], [1, 1, 1, 1]], {}], "config": {"index": 3898, "code_hash": null, "entity": [["tile_ic", "sp", [-1, 4, 4]], ["tile_oc", "sp", [-1, 64]], ["tile_ow", "sp", [-1, 2, 1]], ["tile_oh", "sp", [-1, 4, 2]]]}, "result": [[0.0018340731], 0, 4.310338258743286, 1615983252.2526977], "version": 0.2, "tvm_version": "0.8.dev0"}
{"input": ["opencl -keys=opencl,gpu -max_num_threads=256", "tutorial/conv2d_no_batching", [1, 14, 14, 512, 256, 3, 3, [2, 2], [1, 1, 1, 1]], {}], "config": {"index": 6275, "code_hash": null, "entity": [["tile_ic", "sp", [-1, 8, 4]], ["tile_oc", "sp", [-1, 1]], ["tile_ow", "sp", [-1, 2, 1]], ["tile_oh", "sp", [-1, 2, 7]]]}, "result": [[0.0288480289], 0, 6.5209736824035645, 1615983254.3776107], "version": 0.2, "tvm_version": "0.8.dev0"}
{"input": ["opencl -keys=opencl,gpu -max_num_threads=256", "tutorial/conv2d_no_batching", [1, 14, 14, 512, 256, 3, 3, [2, 2], [1, 1, 1, 1]], {}], "config": {"index": 1949, "code_hash": null, "entity": [["tile_ic", "sp", [-1, 2, 4]], ["tile_oc", "sp", [-1, 128]], ["tile_ow", "sp", [-1, 1, 1]], ["tile_oh", "sp", [-1, 8, 1]]]}, "result": [[0.0006945313], 0, 9.673284769058228, 1615983257.7115722], "version": 0.2, "tvm_version": "0.8.dev0"}
{"input": ["opencl -keys=opencl,gpu -max_num_threads=256", "tutorial/conv2d_no_batching", [1, 14, 14, 512, 256, 3, 3, [2, 2], [1, 1, 1, 1]], {}], "config": {"index": 2255, "code_hash": null, "entity": [["tile_ic", "sp", [-1, 8, 4]], ["tile_oc", "sp", [-1, 8]], ["tile_ow", "sp", [-1, 1, 4]], ["tile_oh", "sp", [-1, 8, 1]]]}, "result": [[0.0099346416], 0, 9.336260080337524, 1615983256.957355], "version": 0.2, "tvm_version": "0.8.dev0"}
{"input": ["opencl -keys=opencl,gpu -max_num_threads=256", "tutorial/conv2d_no_batching", [1, 14, 14, 512, 256, 3, 3, [2, 2], [1, 1, 1, 1]], {}], "config": {"index": 3130, "code_hash": null, "entity": [["tile_ic", "sp", [-1, 4, 4]], ["tile_oc", "sp", [-1, 64]], ["tile_ow", "sp", [-1, 2, 2]], ["tile_oh", "sp", [-1, 1, 2]]]}, "result": [[0.0079489123], 0, 14.650195121765137, 1615983262.5208154], "version": 0.2, "tvm_version": "0.8.dev0"}
{"input": ["opencl -keys=opencl,gpu -max_num_threads=256", "tutorial/conv2d_no_batching", [1, 14, 14, 512, 256, 3, 3, [2, 2], [1, 1, 1, 1]], {}], "config": {"index": 4270, "code_hash": null, "entity": [["tile_ic", "sp", [-1, 4, 4]], ["tile_oc", "sp", [-1, 8]], ["tile_ow", "sp", [-1, 2, 7]], ["tile_oh", "sp", [-1, 4, 2]]]}, "result": [[0.0057834224], 0, 12.57201600074768, 1615983260.0763826], "version": 0.2, "tvm_version": "0.8.dev0"}
{"input": ["opencl -keys=opencl,gpu -max_num_threads=256", "tutorial/conv2d_no_batching", [1, 14, 14, 512, 256, 3, 3, [2, 2], [1, 1, 1, 1]], {}], "config": {"index": 3656, "code_hash": null, "entity": [["tile_ic", "sp", [-1, 1, 4]], ["tile_oc", "sp", [-1, 4]], ["tile_ow", "sp", [-1, 7, 2]], ["tile_oh", "sp", [-1, 2, 2]]]}, "result": [[0.000745771], 0, 12.861905813217163, 1615983260.8831744], "version": 0.2, "tvm_version": "0.8.dev0"}
{"input": ["opencl -keys=opencl,gpu -max_num_threads=256", "tutorial/conv2d_no_batching", [1, 14, 14, 512, 256, 3, 3, [2, 2], [1, 1, 1, 1]], {}], "config": {"index": 4853, "code_hash": null, "entity": [["tile_ic", "sp", [-1, 2, 4]], ["tile_oc", "sp", [-1, 32]], ["tile_ow", "sp", [-1, 2, 1]], ["tile_oh", "sp", [-1, 1, 4]]]}, "result": [[0.0006697553000000001], 0, 16.035074949264526, 1615983264.0491998], "version": 0.2, "tvm_version": "0.8.dev0"}
{"input": ["opencl -keys=opencl,gpu -max_num_threads=256", "tutorial/conv2d_no_batching", [1, 14, 14, 512, 256, 3, 3, [2, 2], [1, 1, 1, 1]], {}], "config": {"index": 584, "code_hash": null, "entity": [["tile_ic", "sp", [-1, 1, 4]], ["tile_oc", "sp", [-1, 4]], ["tile_ow", "sp", [-1, 7, 1]], ["tile_oh", "sp", [-1, 2, 1]]]}, "result": [[0.0015979637000000002], 0, 15.191218376159668, 1615983263.2683802], "version": 0.2, "tvm_version": "0.8.dev0"}
{"input": ["opencl -keys=opencl,gpu -max_num_threads=256", "tutorial/conv2d_no_batching", [1, 14, 14, 512, 256, 3, 3, [2, 2], [1, 1, 1, 1]], {}], "config": {"index": 3564, "code_hash": null, "entity": [["tile_ic", "sp", [-1, 1, 4]], ["tile_oc", "sp", [-1, 8]], ["tile_ow", "sp", [-1, 1, 2]], ["tile_oh", "sp", [-1, 2, 2]]]}, "result": [[0.0019397919], 0, 19.85486364364624, 1615983267.900814], "version": 0.2, "tvm_version": "0.8.dev0"}
{"input": ["opencl -keys=opencl,gpu -max_num_threads=256", "tutorial/conv2d_no_batching", [1, 14, 14, 512, 256, 3, 3, [2, 2], [1, 1, 1, 1]], {}], "config": {"index": 6445, "code_hash": null, "entity": [["tile_ic", "sp", [-1, 2, 4]], ["tile_oc", "sp", [-1, 8]], ["tile_ow", "sp", [-1, 1, 2]], ["tile_oh", "sp", [-1, 2, 7]]]}, "result": [[0.007561849800000001], 0, 18.21398162841797, 1615983266.188224], "version": 0.2, "tvm_version": "0.8.dev0"}
{"input": ["opencl -keys=opencl,gpu -max_num_threads=256", "tutorial/conv2d_no_batching", [1, 14, 14, 512, 256, 3, 3, [2, 2], [1, 1, 1, 1]], {}], "config": {"index": 23, "code_hash": null, "entity": [["tile_ic", "sp", [-1, 8, 4]], ["tile_oc", "sp", [-1, 32]], ["tile_ow", "sp", [-1, 1, 1]], ["tile_oh", "sp", [-1, 1, 1]]]}, "result": [[0.0023034325], 0, 16.838804006576538, 1615983264.8879995], "version": 0.2, "tvm_version": "0.8.dev0"}
{"input": ["opencl -keys=opencl,gpu -max_num_threads=256", "tutorial/conv2d_no_batching", [1, 14, 14, 512, 256, 3, 3, [2, 2], [1, 1, 1, 1]], {}], "config": {"index": 3081, "code_hash": null, "entity": [["tile_ic", "sp", [-1, 2, 4]], ["tile_oc", "sp", [-1, 4]], ["tile_ow", "sp", [-1, 1, 2]], ["tile_oh", "sp", [-1, 1, 2]]]}, "result": [[0.004310365], 0, 19.034435272216797, 1615983267.0873334], "version": 0.2, "tvm_version": "0.8.dev0"}
{"input": ["opencl -keys=opencl,gpu -max_num_threads=256", "tutorial/conv2d_no_batching", [1, 14, 14, 512, 256, 3, 3, [2, 2], [1, 1, 1, 1]], {}], "config": {"index": 1656, "code_hash": null, "entity": [["tile_ic", "sp", [-1, 1, 4]], ["tile_oc", "sp", [-1, 64]], ["tile_ow", "sp", [-1, 1, 2]], ["tile_oh", "sp", [-1, 7, 1]]]}, "result": [[0.0003626355], 0, 21.987728595733643, 1615983270.1248095], "version": 0.2, "tvm_version": "0.8.dev0"}
{"input": ["opencl -keys=opencl,gpu -max_num_threads=256", "tutorial/conv2d_no_batching", [1, 14, 14, 512, 256, 3, 3, [2, 2], [1, 1, 1, 1]], {}], "config": {"index": 3309, "code_hash": null, "entity": [["tile_ic", "sp", [-1, 2, 4]], ["tile_oc", "sp", [-1, 8]], ["tile_ow", "sp", [-1, 2, 7]], ["tile_oh", "sp", [-1, 1, 2]]]}, "result": [[0.007641078900000001], 0, 21.275237798690796, 1615983269.2438269], "version": 0.2, "tvm_version": "0.8.dev0"}
{"input": ["opencl -keys=opencl,gpu -max_num_threads=256", "tutorial/conv2d_no_batching", [1, 14, 14, 512, 256, 3, 3, [2, 2], [1, 1, 1, 1]], {}], "config": {"index": 5192, "code_hash": null, "entity": [["tile_ic", "sp", [-1, 1, 4]], ["tile_oc", "sp", [-1, 4]], ["tile_ow", "sp", [-1, 1, 7]], ["tile_oh", "sp", [-1, 1, 4]]]}, "result": [[0.0165994808], 0, 24.128132104873657, 1615983271.9678078], "version": 0.2, "tvm_version": "0.8.dev0"}
{"input": ["opencl -keys=opencl,gpu -max_num_threads=256", "tutorial/conv2d_no_batching", [1, 14, 14, 512, 256, 3, 3, [2, 2], [1, 1, 1, 1]], {}], "config": {"index": 2422, "code_hash": null, "entity": [["tile_ic", "sp", [-1, 4, 4]], ["tile_oc", "sp", [-1, 32]], ["tile_ow", "sp", [-1, 1, 1]], ["tile_oh", "sp", [-1, 14, 1]]]}, "result": [[0.0017090105000000001], 0, 10.653578281402588, 1615983284.1526623], "version": 0.2, "tvm_version": "0.8.dev0"}
{"input": ["opencl -keys=opencl,gpu -max_num_threads=256", "tutorial/conv2d_no_batching", [1, 14, 14, 512, 256, 3, 3, [2, 2], [1, 1, 1, 1]], {}], "config": {"index": 620, "code_hash": null, "entity": [["tile_ic", "sp", [-1, 1, 4]], ["tile_oc", "sp", [-1, 8]], ["tile_ow", "sp", [-1, 8, 1]], ["tile_oh", "sp", [-1, 2, 1]]]}, "result": [[0.0008263751], 0, 2.3797640800476074, 1615983275.882084], "version": 0.2, "tvm_version": "0.8.dev0"}
{"input": ["opencl -keys=opencl,gpu -max_num_threads=256", "tutorial/conv2d_no_batching", [1, 14, 14, 512, 256, 3, 3, [2, 2], [1, 1, 1, 1]], {}], "config": {"index": 1615, "code_hash": null, "entity": [["tile_ic", "sp", [-1, 8, 4]], ["tile_oc", "sp", [-1, 8]], ["tile_ow", "sp", [-1, 14, 1]], ["tile_oh", "sp", [-1, 7, 1]]]}, "result": [[0.001424245], 0, 0.8851757049560547, 1615983274.3277164], "version": 0.2, "tvm_version": "0.8.dev0"}
{"input": ["opencl -keys=opencl,gpu -max_num_threads=256", "tutorial/conv2d_no_batching", [1, 14, 14, 512, 256, 3, 3, [2, 2], [1, 1, 1, 1]], {}], "config": {"index": 5412, "code_hash": null, "entity": [["tile_ic", "sp", [-1, 1, 4]], ["tile_oc", "sp", [-1, 2]], ["tile_ow", "sp", [-1, 8, 1]], ["tile_oh", "sp", [-1, 2, 4]]]}, "result": [[0.0014640001999999999], 0, 1.6961910724639893, 1615983275.131582], "version": 0.2, "tvm_version": "0.8.dev0"}
{"input": ["opencl -keys=opencl,gpu -max_num_threads=256", "tutorial/conv2d_no_batching", [1, 14, 14, 512, 256, 3, 3, [2, 2], [1, 1, 1, 1]], {}], "config": {"index": 2543, "code_hash": null, "entity": [["tile_ic", "sp", [-1, 8, 4]], ["tile_oc", "sp", [-1, 8]], ["tile_ow", "sp", [-1, 8, 1]], ["tile_oh", "sp", [-1, 14, 1]]]}, "result": [[0.019991746799999998], 0, 3.952838659286499, 1615983277.361627], "version": 0.2, "tvm_version": "0.8.dev0"}
{"input": ["opencl -keys=opencl,gpu -max_num_threads=256", "tutorial/conv2d_no_batching", [1, 14, 14, 512, 256, 3, 3, [2, 2], [1, 1, 1, 1]], {}], "config": {"index": 4577, "code_hash": null, "entity": [["tile_ic", "sp", [-1, 2, 4]], ["tile_oc", "sp", [-1, 1]], ["tile_ow", "sp", [-1, 4, 2]], ["tile_oh", "sp", [-1, 7, 2]]]}, "result": [[0.0021874898], 0, 4.902595520019531, 1615983278.3474503], "version": 0.2, "tvm_version": "0.8.dev0"}
{"input": ["opencl -keys=opencl,gpu -max_num_threads=256", "tutorial/conv2d_no_batching", [1, 14, 14, 512, 256, 3, 3, [2, 2], [1, 1, 1, 1]], {}], "config": {"index": 388, "code_hash": null, "entity": [["tile_ic", "sp", [-1, 1, 4]], ["tile_oc", "sp", [-1, 2]], ["tile_ow", "sp", [-1, 1, 7]], ["tile_oh", "sp", [-1, 1, 1]]]}, "result": [[0.0080967456], 0, 16.68461537361145, 1615983290.1868696], "version": 0.2, "tvm_version": "0.8.dev0"}
{"input": ["opencl -keys=opencl,gpu -max_num_threads=256", "tutorial/conv2d_no_batching", [1, 14, 14, 512, 256, 3, 3, [2, 2], [1, 1, 1, 1]], {}], "config": {"index": 1179, "code_hash": null, "entity": [["tile_ic", "sp", [-1, 8, 4]], ["tile_oc", "sp", [-1, 64]], ["tile_ow", "sp", [-1, 1, 2]], ["tile_oh", "sp", [-1, 4, 1]]]}, "result": [[0.0045153859], 0, 17.928665161132812, 1615983291.3112588], "version": 0.2, "tvm_version": "0.8.dev0"}
{"input": ["opencl -keys=opencl,gpu -max_num_threads=256", "tutorial/conv2d_no_batching", [1, 14, 14, 512, 256, 3, 3, [2, 2], [1, 1, 1, 1]], {}], "config": {"index": 270, "code_hash": null, "entity": [["tile_ic", "sp", [-1, 4, 4]], ["tile_oc", "sp", [-1, 8]], ["tile_ow", "sp", [-1, 4, 2]], ["tile_oh", "sp", [-1, 1, 1]]]}, "result": [[0.0026953857], 0, 18.77904462814331, 1615983292.2439003], "version": 0.2, "tvm_version": "0.8.dev0"}
{"input": ["opencl -keys=opencl,gpu -max_num_threads=256", "tutorial/conv2d_no_batching", [1, 14, 14, 512, 256, 3, 3, [2, 2], [1, 1, 1, 1]], {}], "config": {"index": 424, "code_hash": null, "entity": [["tile_ic", "sp", [-1, 1, 4]], ["tile_oc", "sp", [-1, 4]], ["tile_ow", "sp", [-1, 2, 7]], ["tile_oh", "sp", [-1, 1, 1]]]}, "result": [[0.0020905263], 0, 19.50115180015564, 1615983293.0079143], "version": 0.2, "tvm_version": "0.8.dev0"}
{"input": ["opencl -keys=opencl,gpu -max_num_threads=256", "tutorial/conv2d_no_batching", [1, 14, 14, 512, 256, 3, 3, [2, 2], [1, 1, 1, 1]], {}], "config": {"index": 2950, "code_hash": null, "entity": [["tile_ic", "sp", [-1, 4, 4]], ["tile_oc", "sp", [-1, 2]], ["tile_ow", "sp", [-1, 4, 1]], ["tile_oh", "sp", [-1, 1, 2]]]}, "result": [[0.0042902556], 0, 26.296617031097412, 1615983299.7778995], "version": 0.2, "tvm_version": "0.8.dev0"}
{"input": ["opencl -keys=opencl,gpu -max_num_threads=256", "tutorial/conv2d_no_batching", [1, 14, 14, 512, 256, 3, 3, [2, 2], [1, 1, 1, 1]], {}], "config": {"index": 1487, "code_hash": null, "entity": [["tile_ic", "sp", [-1, 8, 4]], ["tile_oc", "sp", [-1, 8]], ["tile_ow", "sp", [-1, 2, 1]], ["tile_oh", "sp", [-1, 7, 1]]]}, "result": [[0.0013818699999999999], 0, 20.299352407455444, 1615983293.788757], "version": 0.2, "tvm_version": "0.8.dev0"}
{"input": ["opencl -keys=opencl,gpu -max_num_threads=256", "tutorial/conv2d_no_batching", [1, 14, 14, 512, 256, 3, 3, [2, 2], [1, 1, 1, 1]], {}], "config": {"index": 1076, "code_hash": null, "entity": [["tile_ic", "sp", [-1, 1, 4]], ["tile_oc", "sp", [-1, 32]], ["tile_ow", "sp", [-1, 7, 1]], ["tile_oh", "sp", [-1, 4, 1]]]}, "result": [[0.0008492136000000001], 0, 32.00581407546997, 1615983305.54802], "version": 0.2, "tvm_version": "0.8.dev0"}
{"input": ["opencl -keys=opencl,gpu -max_num_threads=256", "tutorial/conv2d_no_batching", [1, 14, 14, 512, 256, 3, 3, [2, 2], [1, 1, 1, 1]], {}], "config": {"index": 5061, "code_hash": null, "entity": [["tile_ic", "sp", [-1, 2, 4]], ["tile_oc", "sp", [-1, 2]], ["tile_ow", "sp", [-1, 4, 2]], ["tile_oh", "sp", [-1, 1, 4]]]}, "result": [[0.0166686736], 0, 34.4575138092041, 1615983307.781622], "version": 0.2, "tvm_version": "0.8.dev0"}
{"input": ["opencl -keys=opencl,gpu -max_num_threads=256", "tutorial/conv2d_no_batching", [1, 14, 14, 512, 256, 3, 3, [2, 2], [1, 1, 1, 1]], {}], "config": {"index": 6124, "code_hash": null, "entity": [["tile_ic", "sp", [-1, 1, 4]], ["tile_oc", "sp", [-1, 8]], ["tile_ow", "sp", [-1, 2, 4]], ["tile_oh", "sp", [-1, 1, 7]]]}, "result": [[0.0191669967], 0, 37.33841919898987, 1615983310.5516908], "version": 0.2, "tvm_version": "0.8.dev0"}
{"input": ["opencl -keys=opencl,gpu -max_num_threads=256", "tutorial/conv2d_no_batching", [1, 14, 14, 512, 256, 3, 3, [2, 2], [1, 1, 1, 1]], {}], "config": {"index": 5081, "code_hash": null, "entity": [["tile_ic", "sp", [-1, 2, 4]], ["tile_oc", "sp", [-1, 64]], ["tile_ow", "sp", [-1, 4, 2]], ["tile_oh", "sp", [-1, 1, 4]]]}, "result": [[0.0085537612], 0, 39.19878125190735, 1615983312.5450757], "version": 0.2, "tvm_version": "0.8.dev0"}
{"input": ["opencl -keys=opencl,gpu -max_num_threads=256", "tutorial/conv2d_no_batching", [1, 14, 14, 512, 256, 3, 3, [2, 2], [1, 1, 1, 1]], {}], "config": {"index": 3435, "code_hash": null, "entity": [["tile_ic", "sp", [-1, 8, 4]], ["tile_oc", "sp", [-1, 4]], ["tile_ow", "sp", [-1, 4, 1]], ["tile_oh", "sp", [-1, 2, 2]]]}, "result": [[0.0126200273], 0, 3.740907907485962, 1615983317.621175], "version": 0.2, "tvm_version": "0.8.dev0"}
{"input": ["opencl -keys=opencl,gpu -max_num_threads=256", "tutorial/conv2d_no_batching", [1, 14, 14, 512, 256, 3, 3, [2, 2], [1, 1, 1, 1]], {}], "config": {"index": 1265, "code_hash": null, "entity": [["tile_ic", "sp", [-1, 2, 4]], ["tile_oc", "sp", [-1, 16]], ["tile_ow", "sp", [-1, 7, 2]], ["tile_oh", "sp", [-1, 4, 1]]]}, "result": [[0.0005361719], 0, 14.465975999832153, 1615983328.5421174], "version": 0.2, "tvm_version": "0.8.dev0"}
{"input": ["opencl -keys=opencl,gpu -max_num_threads=256", "tutorial/conv2d_no_batching", [1, 14, 14, 512, 256, 3, 3, [2, 2], [1, 1, 1, 1]], {}], "config": {"index": 6721, "code_hash": null, "entity": [["tile_ic", "sp", [-1, 2, 4]], ["tile_oc", "sp", [-1, 1]], ["tile_ow", "sp", [-1, 1, 1]], ["tile_oh", "sp", [-1, 1, 8]]]}, "result": [[0.037405045399999996], 0, 16.47417449951172, 1615983330.5382917], "version": 0.2, "tvm_version": "0.8.dev0"}
{"input": ["opencl -keys=opencl,gpu -max_num_threads=256", "tutorial/conv2d_no_batching", [1, 14, 14, 512, 256, 3, 3, [2, 2], [1, 1, 1, 1]], {}], "config": {"index": 6927, "code_hash": null, "entity": [["tile_ic", "sp", [-1, 8, 4]], ["tile_oc", "sp", [-1, 8]], ["tile_ow", "sp", [-1, 1, 2]], ["tile_oh", "sp", [-1, 1, 8]]]}, "result": [[0.020073002], 0, 20.981494426727295, 1615983334.624227], "version": 0.2, "tvm_version": "0.8.dev0"}
{"input": ["opencl -keys=opencl,gpu -max_num_threads=256", "tutorial/conv2d_no_batching", [1, 14, 14, 512, 256, 3, 3, [2, 2], [1, 1, 1, 1]], {}], "config": {"index": 2732, "code_hash": null, "entity": [["tile_ic", "sp", [-1, 1, 4]], ["tile_oc", "sp", [-1, 8]], ["tile_ow", "sp", [-1, 1, 4]], ["tile_oh", "sp", [-1, 14, 1]]]}, "result": [[0.00046996879999999997], 0, 21.32216453552246, 1615983335.4377956], "version": 0.2, "tvm_version": "0.8.dev0"}
{"input": ["opencl -keys=opencl,gpu -max_num_threads=256", "tutorial/conv2d_no_batching", [1, 14, 14, 512, 256, 3, 3, [2, 2], [1, 1, 1, 1]], {}], "config": {"index": 3752, "code_hash": null, "entity": [["tile_ic", "sp", [-1, 1, 4]], ["tile_oc", "sp", [-1, 4]], ["tile_ow", "sp", [-1, 1, 7]], ["tile_oh", "sp", [-1, 2, 2]]]}, "result": [[0.006297177700000001], 0, 22.682300090789795, 1615983336.6149626], "version": 0.2, "tvm_version": "0.8.dev0"}
{"input": ["opencl -keys=opencl,gpu -max_num_threads=256", "tutorial/conv2d_no_batching", [1, 14, 14, 512, 256, 3, 3, [2, 2], [1, 1, 1, 1]], {}], "config": {"index": 411, "code_hash": null, "entity": [["tile_ic", "sp", [-1, 8, 4]], ["tile_oc", "sp", [-1, 64]], ["tile_ow", "sp", [-1, 1, 7]], ["tile_oh", "sp", [-1, 1, 1]]]}, "result": [[0.0071600892], 0, 24.16700768470764, 1615983338.0901775], "version": 0.2, "tvm_version": "0.8.dev0"}
{"input": ["opencl -keys=opencl,gpu -max_num_threads=256", "tutorial/conv2d_no_batching", [1, 14, 14, 512, 256, 3, 3, [2, 2], [1, 1, 1, 1]], {}], "config": {"index": 2033, "code_hash": null, "entity": [["tile_ic", "sp", [-1, 2, 4]], ["tile_oc", "sp", [-1, 16]], ["tile_ow", "sp", [-1, 7, 1]], ["tile_oh", "sp", [-1, 8, 1]]]}, "result": [[0.0007338334000000001], 0, 24.700509786605835, 1615983338.8300643], "version": 0.2, "tvm_version": "0.8.dev0"}
{"input": ["opencl -keys=opencl,gpu -max_num_threads=256", "tutorial/conv2d_no_batching", [1, 14, 14, 512, 256, 3, 3, [2, 2], [1, 1, 1, 1]], {}], "config": {"index": 3418, "code_hash": null, "entity": [["tile_ic", "sp", [-1, 4, 4]], ["tile_oc", "sp", [-1, 64]], ["tile_ow", "sp", [-1, 2, 1]], ["tile_oh", "sp", [-1, 2, 2]]]}, "result": [[0.0018119428999999999], 0, 25.714385747909546, 1615983339.7882843], "version": 0.2, "tvm_version": "0.8.dev0"}
{"input": ["opencl -keys=opencl,gpu -max_num_threads=256", "tutorial/conv2d_no_batching", [1, 14, 14, 512, 256, 3, 3, [2, 2], [1, 1, 1, 1]], {}], "config": {"index": 951, "code_hash": null, "entity": [["tile_ic", "sp", [-1, 8, 4]], ["tile_oc", "sp", [-1, 32]], ["tile_ow", "sp", [-1, 1, 8]], ["tile_oh", "sp", [-1, 2, 1]]]}, "result": [[0.008239631], 0, 33.005648136138916, 1615983346.855306], "version": 0.2, "tvm_version": "0.8.dev0"}
{"input": ["opencl -keys=opencl,gpu -max_num_threads=256", "tutorial/conv2d_no_batching", [1, 14, 14, 512, 256, 3, 3, [2, 2], [1, 1, 1, 1]], {}], "config": {"index": 3031, "code_hash": null, "entity": [["tile_ic", "sp", [-1, 8, 4]], ["tile_oc", "sp", [-1, 32]], ["tile_ow", "sp", [-1, 8, 1]], ["tile_oh", "sp", [-1, 1, 2]]]}, "result": [[0.013128480500000001], 0, 34.42678642272949, 1615983348.4130428], "version": 0.2, "tvm_version": "0.8.dev0"}
{"input": ["opencl -keys=opencl,gpu -max_num_threads=256", "tutorial/conv2d_no_batching", [1, 14, 14, 512, 256, 3, 3, [2, 2], [1, 1, 1, 1]], {}], "config": {"index": 2424, "code_hash": null, "entity": [["tile_ic", "sp", [-1, 1, 4]], ["tile_oc", "sp", [-1, 64]], ["tile_ow", "sp", [-1, 1, 1]], ["tile_oh", "sp", [-1, 14, 1]]]}, "result": [[0.0008796042], 0, 34.990814208984375, 1615983349.1753385], "version": 0.2, "tvm_version": "0.8.dev0"}
{"input": ["opencl -keys=opencl,gpu -max_num_threads=256", "tutorial/conv2d_no_batching", [1, 14, 14, 512, 256, 3, 3, [2, 2], [1, 1, 1, 1]], {}], "config": {"index": 5400, "code_hash": null, "entity": [["tile_ic", "sp", [-1, 1, 4]], ["tile_oc", "sp", [-1, 64]], ["tile_ow", "sp", [-1, 7, 1]], ["tile_oh", "sp", [-1, 2, 4]]]}, "result": [[0.0006120572999999999], 0, 35.84153413772583, 1615983349.9778206], "version": 0.2, "tvm_version": "0.8.dev0"}
{"input": ["opencl -keys=opencl,gpu -max_num_threads=256", "tutorial/conv2d_no_batching", [1, 14, 14, 512, 256, 3, 3, [2, 2], [1, 1, 1, 1]], {}], "config": {"index": 3250, "code_hash": null, "entity": [["tile_ic", "sp", [-1, 4, 4]], ["tile_oc", "sp", [-1, 16]], ["tile_ow", "sp", [-1, 2, 4]], ["tile_oh", "sp", [-1, 1, 2]]]}, "result": [[0.0151573244], 0, 38.51920247077942, 1615983352.4360409], "version": 0.2, "tvm_version": "0.8.dev0"}
{"input": ["opencl -keys=opencl,gpu -max_num_threads=256", "tutorial/conv2d_no_batching", [1, 14, 14, 512, 256, 3, 3, [2, 2], [1, 1, 1, 1]], {}], "config": {"index": 1479, "code_hash": null, "entity": [["tile_ic", "sp", [-1, 8, 4]], ["tile_oc", "sp", [-1, 2]], ["tile_ow", "sp", [-1, 2, 1]], ["tile_oh", "sp", [-1, 7, 1]]]}, "result": [[0.0027876669], 0, 44.25437903404236, 1615983358.3821006], "version": 0.2, "tvm_version": "0.8.dev0"}
{"input": ["opencl -keys=opencl,gpu -max_num_threads=256", "tutorial/conv2d_no_batching", [1, 14, 14, 512, 256, 3, 3, [2, 2], [1, 1, 1, 1]], {}], "config": {"index": 2240, "code_hash": null, "entity": [["tile_ic", "sp", [-1, 1, 4]], ["tile_oc", "sp", [-1, 1]], ["tile_ow", "sp", [-1, 1, 4]], ["tile_oh", "sp", [-1, 8, 1]]]}, "result": [[0.0033037451000000003], 0, 45.07459020614624, 1615983359.213194], "version": 0.2, "tvm_version": "0.8.dev0"}
{"input": ["opencl -keys=opencl,gpu -max_num_threads=256", "tutorial/conv2d_no_batching", [1, 14, 14, 512, 256, 3, 3, [2, 2], [1, 1, 1, 1]], {}], "config": {"index": 3956, "code_hash": null, "entity": [["tile_ic", "sp", [-1, 1, 4]], ["tile_oc", "sp", [-1, 32]], ["tile_ow", "sp", [-1, 7, 1]], ["tile_oh", "sp", [-1, 4, 2]]]}, "result": [[0.0007899428], 0, 1.1292040348052979, 1615983361.788815], "version": 0.2, "tvm_version": "0.8.dev0"}
{"input": ["opencl -keys=opencl,gpu -max_num_threads=256", "tutorial/conv2d_no_batching", [1, 14, 14, 512, 256, 3, 3, [2, 2], [1, 1, 1, 1]], {}], "config": {"index": 2562, "code_hash": null, "entity": [["tile_ic", "sp", [-1, 4, 4]], ["tile_oc", "sp", [-1, 1]], ["tile_ow", "sp", [-1, 14, 1]], ["tile_oh", "sp", [-1, 14, 1]]]}, "result": [[0.0019849377000000002], 0, 2.828061580657959, 1615983363.5374603], "version": 0.2, "tvm_version": "0.8.dev0"}
{"input": ["opencl -keys=opencl,gpu -max_num_threads=256", "tutorial/conv2d_no_batching", [1, 14, 14, 512, 256, 3, 3, [2, 2], [1, 1, 1, 1]], {}], "config": {"index": 5917, "code_hash": null, "entity": [["tile_ic", "sp", [-1, 2, 4]], ["tile_oc", "sp", [-1, 128]], ["tile_ow", "sp", [-1, 8, 1]], ["tile_oh", "sp", [-1, 1, 7]]]}, "result": [[0.0041391619], 0, 2.526397228240967, 1615983362.7975152], "version": 0.2, "tvm_version": "0.8.dev0"}
{"input": ["opencl -keys=opencl,gpu -max_num_threads=256", "tutorial/conv2d_no_batching", [1, 14, 14, 512, 256, 3, 3, [2, 2], [1, 1, 1, 1]], {}], "config": {"index": 264, "code_hash": null, "entity": [["tile_ic", "sp", [-1, 1, 4]], ["tile_oc", "sp", [-1, 4]], ["tile_ow", "sp", [-1, 4, 2]], ["tile_oh", "sp", [-1, 1, 1]]]}, "result": [[0.0025700732], 0, 3.4868202209472656, 1615983364.288157], "version": 0.2, "tvm_version": "0.8.dev0"}
{"input": ["opencl -keys=opencl,gpu -max_num_threads=256", "tutorial/conv2d_no_batching", [1, 14, 14, 512, 256, 3, 3, [2, 2], [1, 1, 1, 1]], {}], "config": {"index": 4928, "code_hash": null, "entity": [["tile_ic", "sp", [-1, 1, 4]], ["tile_oc", "sp", [-1, 1]], ["tile_ow", "sp", [-1, 8, 1]], ["tile_oh", "sp", [-1, 1, 4]]]}, "result": [[0.0040184118], 0, 4.443328142166138, 1615983365.11548], "version": 0.2, "tvm_version": "0.8.dev0"}
{"input": ["opencl -keys=opencl,gpu -max_num_threads=256", "tutorial/conv2d_no_batching", [1, 14, 14, 512, 256, 3, 3, [2, 2], [1, 1, 1, 1]], {}], "config": {"index": 5317, "code_hash": null, "entity": [["tile_ic", "sp", [-1, 2, 4]], ["tile_oc", "sp", [-1, 2]], ["tile_ow", "sp", [-1, 2, 1]], ["tile_oh", "sp", [-1, 2, 4]]]}, "result": [[0.0051500787], 0, 5.5120697021484375, 1615983366.0399137], "version": 0.2, "tvm_version": "0.8.dev0"}
{"input": ["opencl -keys=opencl,gpu -max_num_threads=256", "tutorial/conv2d_no_batching", [1, 14, 14, 512, 256, 3, 3, [2, 2], [1, 1, 1, 1]], {}], "config": {"index": 6368, "code_hash": null, "entity": [["tile_ic", "sp", [-1, 1, 4]], ["tile_oc", "sp", [-1, 1]], ["tile_ow", "sp", [-1, 8, 1]], ["tile_oh", "sp", [-1, 2, 7]]]}, "result": [[0.0016961512000000002], 0, 8.189812183380127, 1615983368.858561], "version": 0.2, "tvm_version": "0.8.dev0"}
{"input": ["opencl -keys=opencl,gpu -max_num_threads=256", "tutorial/conv2d_no_batching", [1, 14, 14, 512, 256, 3, 3, [2, 2], [1, 1, 1, 1]], {}], "config": {"index": 5958, "code_hash": null, "entity": [["tile_ic", "sp", [-1, 4, 4]], ["tile_oc", "sp", [-1, 2]], ["tile_ow", "sp", [-1, 1, 2]], ["tile_oh", "sp", [-1, 1, 7]]]}, "result": [[0.025521059800000002], 0, 7.719384431838989, 1615983368.0621123], "version": 0.2, "tvm_version": "0.8.dev0"}
{"input": ["opencl -keys=opencl,gpu -max_num_threads=256", "tutorial/conv2d_no_batching", [1, 14, 14, 512, 256, 3, 3, [2, 2], [1, 1, 1, 1]], {}], "config": {"index": 6773, "code_hash": null, "entity": [["tile_ic", "sp", [-1, 2, 4]], ["tile_oc", "sp", [-1, 32]], ["tile_ow", "sp", [-1, 2, 1]], ["tile_oh", "sp", [-1, 1, 8]]]}, "result": [[0.0016121146999999998], 0, 17.039202451705933, 1615983377.7365508], "version": 0.2, "tvm_version": "0.8.dev0"}
{"input": ["opencl -keys=opencl,gpu -max_num_threads=256", "tutorial/conv2d_no_batching", [1, 14, 14, 512, 256, 3, 3, [2, 2], [1, 1, 1, 1]], {}], "config": {"index": 4671, "code_hash": null, "entity": [["tile_ic", "sp", [-1, 8, 4]], ["tile_oc", "sp", [-1, 128]], ["tile_ow", "sp", [-1, 1, 4]], ["tile_oh", "sp", [-1, 7, 2]]]}, "result": [[0.0107498552], 0, 11.217094659805298, 1615983371.6222453], "version": 0.2, "tvm_version": "0.8.dev0"}
{"input": ["opencl -keys=opencl,gpu -max_num_threads=256", "tutorial/conv2d_no_batching", [1, 14, 14, 512, 256, 3, 3, [2, 2], [1, 1, 1, 1]], {}], "config": {"index": 30, "code_hash": null, "entity": [["tile_ic", "sp", [-1, 4, 4]], ["tile_oc", "sp", [-1, 128]], ["tile_ow", "sp", [-1, 1, 1]], ["tile_oh", "sp", [-1, 1, 1]]]}, "result": [[0.0019644585], 0, 26.737884044647217, 1615983387.5795946], "version": 0.2, "tvm_version": "0.8.dev0"}
{"input": ["opencl -keys=opencl,gpu -max_num_threads=256", "tutorial/conv2d_no_batching", [1, 14, 14, 512, 256, 3, 3, [2, 2], [1, 1, 1, 1]], {}], "config": {"index": 1779, "code_hash": null, "entity": [["tile_ic", "sp", [-1, 8, 4]], ["tile_oc", "sp", [-1, 16]], ["tile_ow", "sp", [-1, 1, 4]], ["tile_oh", "sp", [-1, 7, 1]]]}, "result": [[0.0174187048], 0, 29.472871780395508, 1615983389.8391442], "version": 0.2, "tvm_version": "0.8.dev0"}
{"input": ["opencl -keys=opencl,gpu -max_num_threads=256", "tutorial/conv2d_no_batching", [1, 14, 14, 512, 256, 3, 3, [2, 2], [1, 1, 1, 1]], {}], "config": {"index": 5064, "code_hash": null, "entity": [["tile_ic", "sp", [-1, 1, 4]], ["tile_oc", "sp", [-1, 4]], ["tile_ow", "sp", [-1, 4, 2]], ["tile_oh", "sp", [-1, 1, 4]]]}, "result": [[0.0038067243], 0, 36.112370014190674, 1615983396.6398385], "version": 0.2, "tvm_version": "0.8.dev0"}
{"input": ["opencl -keys=opencl,gpu -max_num_threads=256", "tutorial/conv2d_no_batching", [1, 14, 14, 512, 256, 3, 3, [2, 2], [1, 1, 1, 1]], {}], "config": {"index": 6513, "code_hash": null, "entity": [["tile_ic", "sp", [-1, 2, 4]], ["tile_oc", "sp", [-1, 16]], ["tile_ow", "sp", [-1, 4, 2]], ["tile_oh", "sp", [-1, 2, 7]]]}, "result": [[0.008103058100000001], 0, 33.52387595176697, 1615983393.4447286], "version": 0.2, "tvm_version": "0.8.dev0"}
{"input": ["opencl -keys=opencl,gpu -max_num_threads=256", "tutorial/conv2d_no_batching", [1, 14, 14, 512, 256, 3, 3, [2, 2], [1, 1, 1, 1]], {}], "config": {"index": 1862, "code_hash": null, "entity": [["tile_ic", "sp", [-1, 4, 4]], ["tile_oc", "sp", [-1, 2]], ["tile_ow", "sp", [-1, 2, 7]], ["tile_oh", "sp", [-1, 7, 1]]]}, "result": [[0.0077456883], 0, 35.08260941505432, 1615983395.5588005], "version": 0.2, "tvm_version": "0.8.dev0"}
{"input": ["opencl -keys=opencl,gpu -max_num_threads=256", "tutorial/conv2d_no_batching", [1, 14, 14, 512, 256, 3, 3, [2, 2], [1, 1, 1, 1]], {}], "config": {"index": 2498, "code_hash": null, "entity": [["tile_ic", "sp", [-1, 4, 4]], ["tile_oc", "sp", [-1, 1]], ["tile_ow", "sp", [-1, 7, 1]], ["tile_oh", "sp", [-1, 14, 1]]]}, "result": [[0.0020097396999999998], 0, 33.36790370941162, 1615983394.2541165], "version": 0.2, "tvm_version": "0.8.dev0"}
{"input": ["opencl -keys=opencl,gpu -max_num_threads=256", "tutorial/conv2d_no_batching", [1, 14, 14, 512, 256, 3, 3, [2, 2], [1, 1, 1, 1]], {}], "config": {"index": 1652, "code_hash": null, "entity": [["tile_ic", "sp", [-1, 1, 4]], ["tile_oc", "sp", [-1, 32]], ["tile_ow", "sp", [-1, 1, 2]], ["tile_oh", "sp", [-1, 7, 1]]]}, "result": [[0.00039265100000000005], 0, 1.2257053852081299, 1615983428.498065], "version": 0.2, "tvm_version": "0.8.dev0"}
{"input": ["opencl -keys=opencl,gpu -max_num_threads=256", "tutorial/conv2d_no_batching", [1, 14, 14, 512, 256, 3, 3, [2, 2], [1, 1, 1, 1]], {}], "config": {"index": 5328, "code_hash": null, "entity": [["tile_ic", "sp", [-1, 1, 4]], ["tile_oc", "sp", [-1, 16]], ["tile_ow", "sp", [-1, 2, 1]], ["tile_oh", "sp", [-1, 2, 4]]]}, "result": [[0.0005987396], 0, 2.116966962814331, 1615983429.2522693], "version": 0.2, "tvm_version": "0.8.dev0"}
{"input": ["opencl -keys=opencl,gpu -max_num_threads=256", "tutorial/conv2d_no_batching", [1, 14, 14, 512, 256, 3, 3, [2, 2], [1, 1, 1, 1]], {}], "config": {"index": 1484, "code_hash": null, "entity": [["tile_ic", "sp", [-1, 1, 4]], ["tile_oc", "sp", [-1, 8]], ["tile_ow", "sp", [-1, 2, 1]], ["tile_oh", "sp", [-1, 7, 1]]]}, "result": [[0.000949349], 0, 2.6113290786743164, 1615983429.9627874], "version": 0.2, "tvm_version": "0.8.dev0"}
{"input": ["opencl -keys=opencl,gpu -max_num_threads=256", "tutorial/conv2d_no_batching", [1, 14, 14, 512, 256, 3, 3, [2, 2], [1, 1, 1, 1]], {}], "config": {"index": 1648, "code_hash": null, "entity": [["tile_ic", "sp", [-1, 1, 4]], ["tile_oc", "sp", [-1, 16]], ["tile_ow", "sp", [-1, 1, 2]], ["tile_oh", "sp", [-1, 7, 1]]]}, "result": [[0.00040149490000000005], 0, 3.9954781532287598, 1615983431.3762195], "version": 0.2, "tvm_version": "0.8.dev0"}
{"input": ["opencl -keys=opencl,gpu -max_num_threads=256", "tutorial/conv2d_no_batching", [1, 14, 14, 512, 256, 3, 3, [2, 2], [1, 1, 1, 1]], {}], "config": {"index": 3892, "code_hash": null, "entity": [["tile_ic", "sp", [-1, 1, 4]], ["tile_oc", "sp", [-1, 32]], ["tile_ow", "sp", [-1, 2, 1]], ["tile_oh", "sp", [-1, 4, 2]]]}, "result": [[0.0007678751], 0, 5.573314666748047, 1615983432.8466766], "version": 0.2, "tvm_version": "0.8.dev0"}
{"input": ["opencl -keys=opencl,gpu -max_num_threads=256", "tutorial/conv2d_no_batching", [1, 14, 14, 512, 256, 3, 3, [2, 2], [1, 1, 1, 1]], {}], "config": {"index": 5300, "code_hash": null, "entity": [["tile_ic", "sp", [-1, 1, 4]], ["tile_oc", "sp", [-1, 32]], ["tile_ow", "sp", [-1, 1, 1]], ["tile_oh", "sp", [-1, 2, 4]]]}, "result": [[0.0006040053], 0, 7.109151363372803, 1615983434.2771313], "version": 0.2, "tvm_version": "0.8.dev0"}
{"input": ["opencl -keys=opencl,gpu -max_num_threads=256", "tutorial/conv2d_no_batching", [1, 14, 14, 512, 256, 3, 3, [2, 2], [1, 1, 1, 1]], {}], "config": {"index": 2132, "code_hash": null, "entity": [["tile_ic", "sp", [-1, 1, 4]], ["tile_oc", "sp", [-1, 32]], ["tile_ow", "sp", [-1, 1, 2]], ["tile_oh", "sp", [-1, 8, 1]]]}, "result": [[0.0005402865], 0, 3.401092529296875, 1615983430.6842062], "version": 0.2, "tvm_version": "0.8.dev0"}
{"input": ["opencl -keys=opencl,gpu -max_num_threads=256", "tutorial/conv2d_no_batching", [1, 14, 14, 512, 256, 3, 3, [2, 2], [1, 1, 1, 1]], {}], "config": {"index": 4052, "code_hash": null, "entity": [["tile_ic", "sp", [-1, 1, 4]], ["tile_oc", "sp", [-1, 32]], ["tile_ow", "sp", [-1, 1, 2]], ["tile_oh", "sp", [-1, 4, 2]]]}, "result": [[0.0006234532], 0, 7.755112648010254, 1615983435.0105574], "version": 0.2, "tvm_version": "0.8.dev0"}
{"input": ["opencl -keys=opencl,gpu -max_num_threads=256", "tutorial/conv2d_no_batching", [1, 14, 14, 512, 256, 3, 3, [2, 2], [1, 1, 1, 1]], {}], "config": {"index": 1644, "code_hash": null, "entity": [["tile_ic", "sp", [-1, 1, 4]], ["tile_oc", "sp", [-1, 8]], ["tile_ow", "sp", [-1, 1, 2]], ["tile_oh", "sp", [-1, 7, 1]]]}, "result": [[0.0004021719], 0, 8.2509024143219, 1615983435.7046921], "version": 0.2, "tvm_version": "0.8.dev0"}
{"input": ["opencl -keys=opencl,gpu -max_num_threads=256", "tutorial/conv2d_no_batching", [1, 14, 14, 512, 256, 3, 3, [2, 2], [1, 1, 1, 1]], {}], "config": {"index": 1488, "code_hash": null, "entity": [["tile_ic", "sp", [-1, 1, 4]], ["tile_oc", "sp", [-1, 16]], ["tile_ow", "sp", [-1, 2, 1]], ["tile_oh", "sp", [-1, 7, 1]]]}, "result": [[0.0009553126], 0, 6.050326824188232, 1615983433.5351925], "version": 0.2, "tvm_version": "0.8.dev0"}
{"input": ["opencl -keys=opencl,gpu -max_num_threads=256", "tutorial/conv2d_no_batching", [1, 14, 14, 512, 256, 3, 3, [2, 2], [1, 1, 1, 1]], {}], "config": {"index": 3860, "code_hash": null, "entity": [["tile_ic", "sp", [-1, 1, 4]], ["tile_oc", "sp", [-1, 32]], ["tile_ow", "sp", [-1, 1, 1]], ["tile_oh", "sp", [-1, 4, 2]]]}, "result": [[0.0007877343999999999], 0, 4.798248291015625, 1615983432.1211393], "version": 0.2, "tvm_version": "0.8.dev0"}
{"input": ["opencl -keys=opencl,gpu -max_num_threads=256", "tutorial/conv2d_no_batching", [1, 14, 14, 512, 256, 3, 3, [2, 2], [1, 1, 1, 1]], {}], "config": {"index": 4048, "code_hash": null, "entity": [["tile_ic", "sp", [-1, 1, 4]], ["tile_oc", "sp", [-1, 16]], ["tile_ow", "sp", [-1, 1, 2]], ["tile_oh", "sp", [-1, 4, 2]]]}, "result": [[0.0006468541999999999], 0, 9.258282661437988, 1615983436.4252665], "version": 0.2, "tvm_version": "0.8.dev0"}
{"input": ["opencl -keys=opencl,gpu -max_num_threads=256", "tutorial/conv2d_no_batching", [1, 14, 14, 512, 256, 3, 3, [2, 2], [1, 1, 1, 1]], {}], "config": {"index": 5384, "code_hash": null, "entity": [["tile_ic", "sp", [-1, 1, 4]], ["tile_oc", "sp", [-1, 4]], ["tile_ow", "sp", [-1, 7, 1]], ["tile_oh", "sp", [-1, 2, 4]]]}, "result": [[0.0007043126], 0, 9.988025903701782, 1615983437.1724343], "version": 0.2, "tvm_version": "0.8.dev0"}
{"input": ["opencl -keys=opencl,gpu -max_num_threads=256", "tutorial/conv2d_no_batching", [1, 14, 14, 512, 256, 3, 3, [2, 2], [1, 1, 1, 1]], {}], "config": {"index": 2128, "code_hash": null, "entity": [["tile_ic", "sp", [-1, 1, 4]], ["tile_oc", "sp", [-1, 16]], ["tile_ow", "sp", [-1, 1, 2]], ["tile_oh", "sp", [-1, 8, 1]]]}, "result": [[0.0005826563], 0, 10.521198987960815, 1615983437.8585258], "version": 0.2, "tvm_version": "0.8.dev0"}
{"input": ["opencl -keys=opencl,gpu -max_num_threads=256", "tutorial/conv2d_no_batching", [1, 14, 14, 512, 256, 3, 3, [2, 2], [1, 1, 1, 1]], {}], "config": {"index": 1732, "code_hash": null, "entity": [["tile_ic", "sp", [-1, 1, 4]], ["tile_oc", "sp", [-1, 2]], ["tile_ow", "sp", [-1, 7, 2]], ["tile_oh", "sp", [-1, 7, 1]]]}, "result": [[0.0004539063], 0, 12.440871238708496, 1615983439.9317117], "version": 0.2, "tvm_version": "0.8.dev0"}
{"input": ["opencl -keys=opencl,gpu -max_num_threads=256", "tutorial/conv2d_no_batching", [1, 14, 14, 512, 256, 3, 3, [2, 2], [1, 1, 1, 1]], {}], "config": {"index": 5388, "code_hash": null, "entity": [["tile_ic", "sp", [-1, 1, 4]], ["tile_oc", "sp", [-1, 8]], ["tile_ow", "sp", [-1, 7, 1]], ["tile_oh", "sp", [-1, 2, 4]]]}, "result": [[0.0006982241], 0, 11.2793607711792, 1615983438.5857298], "version": 0.2, "tvm_version": "0.8.dev0"}
{"input": ["opencl -keys=opencl,gpu -max_num_threads=256", "tutorial/conv2d_no_batching", [1, 14, 14, 512, 256, 3, 3, [2, 2], [1, 1, 1, 1]], {}], "config": {"index": 1969, "code_hash": null, "entity": [["tile_ic", "sp", [-1, 2, 4]], ["tile_oc", "sp", [-1, 16]], ["tile_ow", "sp", [-1, 2, 1]], ["tile_oh", "sp", [-1, 8, 1]]]}, "result": [[0.0006959324], 0, 11.801322221755981, 1615983439.2627933], "version": 0.2, "tvm_version": "0.8.dev0"}
{"input": ["opencl -keys=opencl,gpu -max_num_threads=256", "tutorial/conv2d_no_batching", [1, 14, 14, 512, 256, 3, 3, [2, 2], [1, 1, 1, 1]], {}], "config": {"index": 696, "code_hash": null, "entity": [["tile_ic", "sp", [-1, 1, 4]], ["tile_oc", "sp", [-1, 64]], ["tile_ow", "sp", [-1, 1, 2]], ["tile_oh", "sp", [-1, 2, 1]]]}, "result": [[0.0003634427], 0, 14.526395320892334, 1615983442.001503], "version": 0.2, "tvm_version": "0.8.dev0"}
{"input": ["opencl -keys=opencl,gpu -max_num_threads=256", "tutorial/conv2d_no_batching", [1, 14, 14, 512, 256, 3, 3, [2, 2], [1, 1, 1, 1]], {}], "config": {"index": 1489, "code_hash": null, "entity": [["tile_ic", "sp", [-1, 2, 4]], ["tile_oc", "sp", [-1, 16]], ["tile_ow", "sp", [-1, 2, 1]], ["tile_oh", "sp", [-1, 7, 1]]]}, "result": [[0.001235823], 0, 13.087352752685547, 1615983440.62077], "version": 0.2, "tvm_version": "0.8.dev0"}
{"input": ["opencl -keys=opencl,gpu -max_num_threads=256", "tutorial/conv2d_no_batching", [1, 14, 14, 512, 256, 3, 3, [2, 2], [1, 1, 1, 1]], {}], "config": {"index": 5392, "code_hash": null, "entity": [["tile_ic", "sp", [-1, 1, 4]], ["tile_oc", "sp", [-1, 16]], ["tile_ow", "sp", [-1, 7, 1]], ["tile_oh", "sp", [-1, 2, 4]]]}, "result": [[0.0006972449000000001], 0, 13.89470887184143, 1615983441.32731], "version": 0.2, "tvm_version": "0.8.dev0"}
{"input": ["opencl -keys=opencl,gpu -max_num_threads=256", "tutorial/conv2d_no_batching", [1, 14, 14, 512, 256, 3, 3, [2, 2], [1, 1, 1, 1]], {}], "config": {"index": 1464, "code_hash": null, "entity": [["tile_ic", "sp", [-1, 1, 4]], ["tile_oc", "sp", [-1, 64]], ["tile_ow", "sp", [-1, 1, 1]], ["tile_oh", "sp", [-1, 7, 1]]]}, "result": [[0.0009782865999999999], 0, 0.9779946804046631, 1615983443.576333], "version": 0.2, "tvm_version": "0.8.dev0"}
{"input": ["opencl -keys=opencl,gpu -max_num_threads=256", "tutorial/conv2d_no_batching", [1, 14, 14, 512, 256, 3, 3, [2, 2], [1, 1, 1, 1]], {}], "config": {"index": 1456, "code_hash": null, "entity": [["tile_ic", "sp", [-1, 1, 4]], ["tile_oc", "sp", [-1, 16]], ["tile_ow", "sp", [-1, 1, 1]], ["tile_oh", "sp", [-1, 7, 1]]]}, "result": [[0.0009673177999999999], 0, 1.6065738201141357, 1615983444.2871456], "version": 0.2, "tvm_version": "0.8.dev0"}
{"input": ["opencl -keys=opencl,gpu -max_num_threads=256", "tutorial/conv2d_no_batching", [1, 14, 14, 512, 256, 3, 3, [2, 2], [1, 1, 1, 1]], {}], "config": {"index": 1657, "code_hash": null, "entity": [["tile_ic", "sp", [-1, 2, 4]], ["tile_oc", "sp", [-1, 64]], ["tile_ow", "sp", [-1, 1, 2]], ["tile_oh", "sp", [-1, 7, 1]]]}, "result": [[0.000373448], 0, 3.2001616954803467, 1615983445.7513514], "version": 0.2, "tvm_version": "0.8.dev0"}
{"input": ["opencl -keys=opencl,gpu -max_num_threads=256", "tutorial/conv2d_no_batching", [1, 14, 14, 512, 256, 3, 3, [2, 2], [1, 1, 1, 1]], {}], "config": {"index": 1172, "code_hash": null, "entity": [["tile_ic", "sp", [-1, 1, 4]], ["tile_oc", "sp", [-1, 32]], ["tile_ow", "sp", [-1, 1, 2]], ["tile_oh", "sp", [-1, 4, 1]]]}, "result": [[0.0005680469], 0, 3.9119532108306885, 1615983446.4936554], "version": 0.2, "tvm_version": "0.8.dev0"}
{"input": ["opencl -keys=opencl,gpu -max_num_threads=256", "tutorial/conv2d_no_batching", [1, 14, 14, 512, 256, 3, 3, [2, 2], [1, 1, 1, 1]], {}], "config": {"index": 2904, "code_hash": null, "entity": [["tile_ic", "sp", [-1, 1, 4]], ["tile_oc", "sp", [-1, 64]], ["tile_ow", "sp", [-1, 1, 1]], ["tile_oh", "sp", [-1, 1, 2]]]}, "result": [[0.00042600529999999996], 0, 2.454777240753174, 1615983445.0108445], "version": 0.2, "tvm_version": "0.8.dev0"}
{"input": ["opencl -keys=opencl,gpu -max_num_threads=256", "tutorial/conv2d_no_batching", [1, 14, 14, 512, 256, 3, 3, [2, 2], [1, 1, 1, 1]], {}], "config": {"index": 2133, "code_hash": null, "entity": [["tile_ic", "sp", [-1, 2, 4]], ["tile_oc", "sp", [-1, 32]], ["tile_ow", "sp", [-1, 1, 2]], ["tile_oh", "sp", [-1, 8, 1]]]}, "result": [[0.0005281719], 0, 4.736815452575684, 1615983447.235294], "version": 0.2, "tvm_version": "0.8.dev0"}
{"input": ["opencl -keys=opencl,gpu -max_num_threads=256", "tutorial/conv2d_no_batching", [1, 14, 14, 512, 256, 3, 3, [2, 2], [1, 1, 1, 1]], {}], "config": {"index": 1653, "code_hash": null, "entity": [["tile_ic", "sp", [-1, 2, 4]], ["tile_oc", "sp", [-1, 32]], ["tile_ow", "sp", [-1, 1, 2]], ["tile_oh", "sp", [-1, 7, 1]]]}, "result": [[0.000411698], 0, 5.40345573425293, 1615983447.965811], "version": 0.2, "tvm_version": "0.8.dev0"}
{"input": ["opencl -keys=opencl,gpu -max_num_threads=256", "tutorial/conv2d_no_batching", [1, 14, 14, 512, 256, 3, 3, [2, 2], [1, 1, 1, 1]], {}], "config": {"index": 692, "code_hash": null, "entity": [["tile_ic", "sp", [-1, 1, 4]], ["tile_oc", "sp", [-1, 32]], ["tile_ow", "sp", [-1, 1, 2]], ["tile_oh", "sp", [-1, 2, 1]]]}, "result": [[0.00036253129999999997], 0, 5.9889514446258545, 1615983448.683346], "version": 0.2, "tvm_version": "0.8.dev0"}
{"input": ["opencl -keys=opencl,gpu -max_num_threads=256", "tutorial/conv2d_no_batching", [1, 14, 14, 512, 256, 3, 3, [2, 2], [1, 1, 1, 1]], {}], "config": {"index": 5296, "code_hash": null, "entity": [["tile_ic", "sp", [-1, 1, 4]], ["tile_oc", "sp", [-1, 16]], ["tile_ow", "sp", [-1, 1, 1]], ["tile_oh", "sp", [-1, 2, 4]]]}, "result": [[0.0011120001], 0, 6.868391752243042, 1615983449.438349], "version": 0.2, "tvm_version": "0.8.dev0"}
{"input": ["opencl -keys=opencl,gpu -max_num_threads=256", "tutorial/conv2d_no_batching", [1, 14, 14, 512, 256, 3, 3, [2, 2], [1, 1, 1, 1]], {}], "config": {"index": 3572, "code_hash": null, "entity": [["tile_ic", "sp", [-1, 1, 4]], ["tile_oc", "sp", [-1, 32]], ["tile_ow", "sp", [-1, 1, 2]], ["tile_oh", "sp", [-1, 2, 2]]]}, "result": [[0.0006384011000000001], 0, 7.7026917934417725, 1615983450.241747], "version": 0.2, "tvm_version": "0.8.dev0"}
{"input": ["opencl -keys=opencl,gpu -max_num_threads=256", "tutorial/conv2d_no_batching", [1, 14, 14, 512, 256, 3, 3, [2, 2], [1, 1, 1, 1]], {}], "config": {"index": 3949, "code_hash": null, "entity": [["tile_ic", "sp", [-1, 2, 4]], ["tile_oc", "sp", [-1, 8]], ["tile_ow", "sp", [-1, 7, 1]], ["tile_oh", "sp", [-1, 4, 2]]]}, "result": [[0.0010738126000000001], 0, 8.61537218093872, 1615983451.0644014], "version": 0.2, "tvm_version": "0.8.dev0"}
{"input": ["opencl -keys=opencl,gpu -max_num_threads=256", "tutorial/conv2d_no_batching", [1, 14, 14, 512, 256, 3, 3, [2, 2], [1, 1, 1, 1]], {}], "config": {"index": 4053, "code_hash": null, "entity": [["tile_ic", "sp", [-1, 2, 4]], ["tile_oc", "sp", [-1, 32]], ["tile_ow", "sp", [-1, 1, 2]], ["tile_oh", "sp", [-1, 4, 2]]]}, "result": [[0.000755323], 0, 9.433178424835205, 1615983451.9103487], "version": 0.2, "tvm_version": "0.8.dev0"}
{"input": ["opencl -keys=opencl,gpu -max_num_threads=256", "tutorial/conv2d_no_batching", [1, 14, 14, 512, 256, 3, 3, [2, 2], [1, 1, 1, 1]], {}], "config": {"index": 3412, "code_hash": null, "entity": [["tile_ic", "sp", [-1, 1, 4]], ["tile_oc", "sp", [-1, 32]], ["tile_ow", "sp", [-1, 2, 1]], ["tile_oh", "sp", [-1, 2, 2]]]}, "result": [[0.0007612917], 0, 10.057064056396484, 1615983452.6573741], "version": 0.2, "tvm_version": "0.8.dev0"}
{"input": ["opencl -keys=opencl,gpu -max_num_threads=256", "tutorial/conv2d_no_batching", [1, 14, 14, 512, 256, 3, 3, [2, 2], [1, 1, 1, 1]], {}], "config": {"index": 3380, "code_hash": null, "entity": [["tile_ic", "sp", [-1, 1, 4]], ["tile_oc", "sp", [-1, 32]], ["tile_ow", "sp", [-1, 1, 1]], ["tile_oh", "sp", [-1, 2, 2]]]}, "result": [[0.000777724], 0, 11.492679834365845, 1615983454.0857153], "version": 0.2, "tvm_version": "0.8.dev0"}
{"input": ["opencl -keys=opencl,gpu -max_num_threads=256", "tutorial/conv2d_no_batching", [1, 14, 14, 512, 256, 3, 3, [2, 2], [1, 1, 1, 1]], {}], "config": {"index": 3948, "code_hash": null, "entity": [["tile_ic", "sp", [-1, 1, 4]], ["tile_oc", "sp", [-1, 8]], ["tile_ow", "sp", [-1, 7, 1]], ["tile_oh", "sp", [-1, 4, 2]]]}, "result": [[0.0009421251000000001], 0, 12.120179653167725, 1615983454.850836], "version": 0.2, "tvm_version": "0.8.dev0"}
{"input": ["opencl -keys=opencl,gpu -max_num_threads=256", "tutorial/conv2d_no_batching", [1, 14, 14, 512, 256, 3, 3, [2, 2], [1, 1, 1, 1]], {}], "config": {"index": 1460, "code_hash": null, "entity": [["tile_ic", "sp", [-1, 1, 4]], ["tile_oc", "sp", [-1, 32]], ["tile_ow", "sp", [-1, 1, 1]], ["tile_oh", "sp", [-1, 7, 1]]]}, "result": [[0.0009382813999999999], 0, 10.708398342132568, 1615983453.3787603], "version": 0.2, "tvm_version": "0.8.dev0"}
{"input": ["opencl -keys=opencl,gpu -max_num_threads=256", "tutorial/conv2d_no_batching", [1, 14, 14, 512, 256, 3, 3, [2, 2], [1, 1, 1, 1]], {}], "config": {"index": 3856, "code_hash": null, "entity": [["tile_ic", "sp", [-1, 1, 4]], ["tile_oc", "sp", [-1, 16]], ["tile_ow", "sp", [-1, 1, 1]], ["tile_oh", "sp", [-1, 4, 2]]]}, "result": [[0.0007814584], 0, 12.946629524230957, 1615983455.594614], "version": 0.2, "tvm_version": "0.8.dev0"}
{"input": ["opencl -keys=opencl,gpu -max_num_threads=256", "tutorial/conv2d_no_batching", [1, 14, 14, 512, 256, 3, 3, [2, 2], [1, 1, 1, 1]], {}], "config": {"index": 2129, "code_hash": null, "entity": [["tile_ic", "sp", [-1, 2, 4]], ["tile_oc", "sp", [-1, 16]], ["tile_ow", "sp", [-1, 1, 2]], ["tile_oh", "sp", [-1, 8, 1]]]}, "result": [[0.0005283282000000001], 0, 13.616189956665039, 1615983456.3522282], "version": 0.2, "tvm_version": "0.8.dev0"}
{"input": ["opencl -keys=opencl,gpu -max_num_threads=256", "tutorial/conv2d_no_batching", [1, 14, 14, 512, 256, 3, 3, [2, 2], [1, 1, 1, 1]], {}], "config": {"index": 1496, "code_hash": null, "entity": [["tile_ic", "sp", [-1, 1, 4]], ["tile_oc", "sp", [-1, 64]], ["tile_ow", "sp", [-1, 2, 1]], ["tile_oh", "sp", [-1, 7, 1]]]}, "result": [[0.0008730468999999999], 0, 14.996209144592285, 1615983457.7556098], "version": 0.2, "tvm_version": "0.8.dev0"}
{"input": ["opencl -keys=opencl,gpu -max_num_threads=256", "tutorial/conv2d_no_batching", [1, 14, 14, 512, 256, 3, 3, [2, 2], [1, 1, 1, 1]], {}], "config": {"index": 2932, "code_hash": null, "entity": [["tile_ic", "sp", [-1, 1, 4]], ["tile_oc", "sp", [-1, 32]], ["tile_ow", "sp", [-1, 2, 1]], ["tile_oh", "sp", [-1, 1, 2]]]}, "result": [[0.0003406198], 0, 14.224496841430664, 1615983457.0321405], "version": 0.2, "tvm_version": "0.8.dev0"}
{"input": ["opencl -keys=opencl,gpu -max_num_threads=256", "tutorial/conv2d_no_batching", [1, 14, 14, 512, 256, 3, 3, [2, 2], [1, 1, 1, 1]], {}], "config": {"index": 5301, "code_hash": null, "entity": [["tile_ic", "sp", [-1, 2, 4]], ["tile_oc", "sp", [-1, 32]], ["tile_ow", "sp", [-1, 1, 1]], ["tile_oh", "sp", [-1, 2, 4]]]}, "result": [[0.0009554636], 0, 0.9139082431793213, 1615983458.9600642], "version": 0.2, "tvm_version": "0.8.dev0"}
{"input": ["opencl -keys=opencl,gpu -max_num_threads=256", "tutorial/conv2d_no_batching", [1, 14, 14, 512, 256, 3, 3, [2, 2], [1, 1, 1, 1]], {}], "config": {"index": 3944, "code_hash": null, "entity": [["tile_ic", "sp", [-1, 1, 4]], ["tile_oc", "sp", [-1, 4]], ["tile_ow", "sp", [-1, 7, 1]], ["tile_oh", "sp", [-1, 4, 2]]]}, "result": [[0.0009608907], 0, 1.6093840599060059, 1615983459.6892602], "version": 0.2, "tvm_version": "0.8.dev0"}
{"input": ["opencl -keys=opencl,gpu -max_num_threads=256", "tutorial/conv2d_no_batching", [1, 14, 14, 512, 256, 3, 3, [2, 2], [1, 1, 1, 1]], {}], "config": {"index": 1493, "code_hash": null, "entity": [["tile_ic", "sp", [-1, 2, 4]], ["tile_oc", "sp", [-1, 32]], ["tile_ow", "sp", [-1, 2, 1]], ["tile_oh", "sp", [-1, 7, 1]]]}, "result": [[0.0012695262], 0, 2.3179399967193604, 1615983460.418108], "version": 0.2, "tvm_version": "0.8.dev0"}
{"input": ["opencl -keys=opencl,gpu -max_num_threads=256", "tutorial/conv2d_no_batching", [1, 14, 14, 512, 256, 3, 3, [2, 2], [1, 1, 1, 1]], {}], "config": {"index": 3893, "code_hash": null, "entity": [["tile_ic", "sp", [-1, 2, 4]], ["tile_oc", "sp", [-1, 32]], ["tile_ow", "sp", [-1, 2, 1]], ["tile_oh", "sp", [-1, 4, 2]]]}, "result": [[0.0009063022000000001], 0, 3.1581408977508545, 1615983461.2140527], "version": 0.2, "tvm_version": "0.8.dev0"}
{"input": ["opencl -keys=opencl,gpu -max_num_threads=256", "tutorial/conv2d_no_batching", [1, 14, 14, 512, 256, 3, 3, [2, 2], [1, 1, 1, 1]], {}], "config": {"index": 2124, "code_hash": null, "entity": [["tile_ic", "sp", [-1, 1, 4]], ["tile_oc", "sp", [-1, 8]], ["tile_ow", "sp", [-1, 1, 2]], ["tile_oh", "sp", [-1, 8, 1]]]}, "result": [[0.0008892501000000001], 0, 3.8449454307556152, 1615983461.9434516], "version": 0.2, "tvm_version": "0.8.dev0"}
{"input": ["opencl -keys=opencl,gpu -max_num_threads=256", "tutorial/conv2d_no_batching", [1, 14, 14, 512, 256, 3, 3, [2, 2], [1, 1, 1, 1]], {}], "config": {"index": 3953, "code_hash": null, "entity": [["tile_ic", "sp", [-1, 2, 4]], ["tile_oc", "sp", [-1, 16]], ["tile_ow", "sp", [-1, 7, 1]], ["tile_oh", "sp", [-1, 4, 2]]]}, "result": [[0.0009536928], 0, 4.665444612503052, 1615983462.738473], "version": 0.2, "tvm_version": "0.8.dev0"}
{"input": ["opencl -keys=opencl,gpu -max_num_threads=256", "tutorial/conv2d_no_batching", [1, 14, 14, 512, 256, 3, 3, [2, 2], [1, 1, 1, 1]], {}], "config": {"index": 1168, "code_hash": null, "entity": [["tile_ic", "sp", [-1, 1, 4]], ["tile_oc", "sp", [-1, 16]], ["tile_ow", "sp", [-1, 1, 2]], ["tile_oh", "sp", [-1, 4, 1]]]}, "result": [[0.0008765209], 0, 5.367762565612793, 1615983463.4761221], "version": 0.2, "tvm_version": "0.8.dev0"}
{"input": ["opencl -keys=opencl,gpu -max_num_threads=256", "tutorial/conv2d_no_batching", [1, 14, 14, 512, 256, 3, 3, [2, 2], [1, 1, 1, 1]], {}], "config": {"index": 2736, "code_hash": null, "entity": [["tile_ic", "sp", [-1, 1, 4]], ["tile_oc", "sp", [-1, 16]], ["tile_ow", "sp", [-1, 1, 4]], ["tile_oh", "sp", [-1, 14, 1]]]}, "result": [[0.0004543074], 0, 6.111366033554077, 1615983464.2140756], "version": 0.2, "tvm_version": "0.8.dev0"}
{"input": ["opencl -keys=opencl,gpu -max_num_threads=256", "tutorial/conv2d_no_batching", [1, 14, 14, 512, 256, 3, 3, [2, 2], [1, 1, 1, 1]], {}], "config": {"index": 3888, "code_hash": null, "entity": [["tile_ic", "sp", [-1, 1, 4]], ["tile_oc", "sp", [-1, 16]], ["tile_ow", "sp", [-1, 2, 1]], ["tile_oh", "sp", [-1, 4, 2]]]}, "result": [[0.0007692032], 0, 6.856157541275024, 1615983464.9599657], "version": 0.2, "tvm_version": "0.8.dev0"}
{"input": ["opencl -keys=opencl,gpu -max_num_threads=256", "tutorial/conv2d_no_batching", [1, 14, 14, 512, 256, 3, 3, [2, 2], [1, 1, 1, 1]], {}], "config": {"index": 5332, "code_hash": null, "entity": [["tile_ic", "sp", [-1, 1, 4]], ["tile_oc", "sp", [-1, 32]], ["tile_ow", "sp", [-1, 2, 1]], ["tile_oh", "sp", [-1, 2, 4]]]}, "result": [[0.0005847501], 0, 7.619549989700317, 1615983465.7228668], "version": 0.2, "tvm_version": "0.8.dev0"}
{"input": ["opencl -keys=opencl,gpu -max_num_threads=256", "tutorial/conv2d_no_batching", [1, 14, 14, 512, 256, 3, 3, [2, 2], [1, 1, 1, 1]], {}], "config": {"index": 1492, "code_hash": null, "entity": [["tile_ic", "sp", [-1, 1, 4]], ["tile_oc", "sp", [-1, 32]], ["tile_ow", "sp", [-1, 2, 1]], ["tile_oh", "sp", [-1, 7, 1]]]}, "result": [[0.0009726303], 0, 8.300767183303833, 1615983466.4462137], "version": 0.2, "tvm_version": "0.8.dev0"}
{"input": ["opencl -keys=opencl,gpu -max_num_threads=256", "tutorial/conv2d_no_batching", [1, 14, 14, 512, 256, 3, 3, [2, 2], [1, 1, 1, 1]], {}], "config": {"index": 3573, "code_hash": null, "entity": [["tile_ic", "sp", [-1, 2, 4]], ["tile_oc", "sp", [-1, 32]], ["tile_ow", "sp", [-1, 1, 2]], ["tile_oh", "sp", [-1, 2, 2]]]}, "result": [[0.0007331042], 0, 9.244121313095093, 1615983467.2894447], "version": 0.2, "tvm_version": "0.8.dev0"}
{"input": ["opencl -keys=opencl,gpu -max_num_threads=256", "tutorial/conv2d_no_batching", [1, 14, 14, 512, 256, 3, 3, [2, 2], [1, 1, 1, 1]], {}], "config": {"index": 1073, "code_hash": null, "entity": [["tile_ic", "sp", [-1, 2, 4]], ["tile_oc", "sp", [-1, 16]], ["tile_ow", "sp", [-1, 7, 1]], ["tile_oh", "sp", [-1, 4, 1]]]}, "result": [[0.0006973386], 0, 9.9138023853302, 1615983468.0473998], "version": 0.2, "tvm_version": "0.8.dev0"}
{"input": ["opencl -keys=opencl,gpu -max_num_threads=256", "tutorial/conv2d_no_batching", [1, 14, 14, 512, 256, 3, 3, [2, 2], [1, 1, 1, 1]], {}], "config": {"index": 1780, "code_hash": null, "entity": [["tile_ic", "sp", [-1, 1, 4]], ["tile_oc", "sp", [-1, 32]], ["tile_ow", "sp", [-1, 1, 4]], ["tile_oh", "sp", [-1, 7, 1]]]}, "result": [[0.0004626876], 0, 10.67447566986084, 1615983468.8076935], "version": 0.2, "tvm_version": "0.8.dev0"}
{"input": ["opencl -keys=opencl,gpu -max_num_threads=256", "tutorial/conv2d_no_batching", [1, 14, 14, 512, 256, 3, 3, [2, 2], [1, 1, 1, 1]], {}], "config": {"index": 1260, "code_hash": null, "entity": [["tile_ic", "sp", [-1, 1, 4]], ["tile_oc", "sp", [-1, 8]], ["tile_ow", "sp", [-1, 7, 2]], ["tile_oh", "sp", [-1, 4, 1]]]}, "result": [[0.000593], 0, 12.163334846496582, 1615983470.3079877], "version": 0.2, "tvm_version": "0.8.dev0"}
{"input": ["opencl -keys=opencl,gpu -max_num_threads=256", "tutorial/conv2d_no_batching", [1, 14, 14, 512, 256, 3, 3, [2, 2], [1, 1, 1, 1]], {}], "config": {"index": 3864, "code_hash": null, "entity": [["tile_ic", "sp", [-1, 1, 4]], ["tile_oc", "sp", [-1, 64]], ["tile_ow", "sp", [-1, 1, 1]], ["tile_oh", "sp", [-1, 4, 2]]]}, "result": [[0.0007925781999999999], 0, 11.429834365844727, 1615983469.5708094], "version": 0.2, "tvm_version": "0.8.dev0"}
{"input": ["opencl -keys=opencl,gpu -max_num_threads=256", "tutorial/conv2d_no_batching", [1, 14, 14, 512, 256, 3, 3, [2, 2], [1, 1, 1, 1]], {}], "config": {"index": 1736, "code_hash": null, "entity": [["tile_ic", "sp", [-1, 1, 4]], ["tile_oc", "sp", [-1, 4]], ["tile_ow", "sp", [-1, 7, 2]], ["tile_oh", "sp", [-1, 7, 1]]]}, "result": [[0.0004540105], 0, 12.849198818206787, 1615983471.0106766], "version": 0.2, "tvm_version": "0.8.dev0"}
{"input": ["opencl -keys=opencl,gpu -max_num_threads=256", "tutorial/conv2d_no_batching", [1, 14, 14, 512, 256, 3, 3, [2, 2], [1, 1, 1, 1]], {}], "config": {"index": 1941, "code_hash": null, "entity": [["tile_ic", "sp", [-1, 2, 4]], ["tile_oc", "sp", [-1, 32]], ["tile_ow", "sp", [-1, 1, 1]], ["tile_oh", "sp", [-1, 8, 1]]]}, "result": [[0.0006872917], 0, 13.603298664093018, 1615983471.7560923], "version": 0.2, "tvm_version": "0.8.dev0"}
{"input": ["opencl -keys=opencl,gpu -max_num_threads=256", "tutorial/conv2d_no_batching", [1, 14, 14, 512, 256, 3, 3, [2, 2], [1, 1, 1, 1]], {}], "config": {"index": 1469, "code_hash": null, "entity": [["tile_ic", "sp", [-1, 2, 4]], ["tile_oc", "sp", [-1, 128]], ["tile_ow", "sp", [-1, 1, 1]], ["tile_oh", "sp", [-1, 7, 1]]]}, "result": [[0.0012072188], 0, 14.36005711555481, 1615983472.5326424], "version": 0.2, "tvm_version": "0.8.dev0"}
{"input": ["opencl -keys=opencl,gpu -max_num_threads=256", "tutorial/conv2d_no_batching", [1, 14, 14, 512, 256, 3, 3, [2, 2], [1, 1, 1, 1]], {}], "config": {"index": 1604, "code_hash": null, "entity": [["tile_ic", "sp", [-1, 1, 4]], ["tile_oc", "sp", [-1, 2]], ["tile_ow", "sp", [-1, 14, 1]], ["tile_oh", "sp", [-1, 7, 1]]]}, "result": [[0.0010336771999999998], 0, 15.063044548034668, 1615983473.2502167], "version": 0.2, "tvm_version": "0.8.dev0"}
{"input": ["opencl -keys=opencl,gpu -max_num_threads=256", "tutorial/conv2d_no_batching", [1, 14, 14, 512, 256, 3, 3, [2, 2], [1, 1, 1, 1]], {}], "config": {"index": 216, "code_hash": null, "entity": [["tile_ic", "sp", [-1, 1, 4]], ["tile_oc", "sp", [-1, 64]], ["tile_ow", "sp", [-1, 1, 2]], ["tile_oh", "sp", [-1, 1, 1]]]}, "result": [[0.0004159792], 0, 3.562957763671875, 1615983490.7849162], "version": 0.2, "tvm_version": "0.8.dev0"}
{"input": ["opencl -keys=opencl,gpu -max_num_threads=256", "tutorial/conv2d_no_batching", [1, 14, 14, 512, 256, 3, 3, [2, 2], [1, 1, 1, 1]], {}], "config": {"index": 780, "code_hash": null, "entity": [["tile_ic", "sp", [-1, 1, 4]], ["tile_oc", "sp", [-1, 8]], ["tile_ow", "sp", [-1, 7, 2]], ["tile_oh", "sp", [-1, 2, 1]]]}, "result": [[0.0004025053], 0, 0.9400634765625, 1615983488.138144], "version": 0.2, "tvm_version": "0.8.dev0"}
{"input": ["opencl -keys=opencl,gpu -max_num_threads=256", "tutorial/conv2d_no_batching", [1, 14, 14, 512, 256, 3, 3, [2, 2], [1, 1, 1, 1]], {}], "config": {"index": 1300, "code_hash": null, "entity": [["tile_ic", "sp", [-1, 1, 4]], ["tile_oc", "sp", [-1, 32]], ["tile_ow", "sp", [-1, 1, 4]], ["tile_oh", "sp", [-1, 4, 1]]]}, "result": [[0.00048521880000000004], 0, 1.623805284500122, 1615983488.847628], "version": 0.2, "tvm_version": "0.8.dev0"}
{"input": ["opencl -keys=opencl,gpu -max_num_threads=256", "tutorial/conv2d_no_batching", [1, 14, 14, 512, 256, 3, 3, [2, 2], [1, 1, 1, 1]], {}], "config": {"index": 1740, "code_hash": null, "entity": [["tile_ic", "sp", [-1, 1, 4]], ["tile_oc", "sp", [-1, 8]], ["tile_ow", "sp", [-1, 7, 2]], ["tile_oh", "sp", [-1, 7, 1]]]}, "result": [[0.00040870840000000006], 0, 4.16944146156311, 1615983491.4199183], "version": 0.2, "tvm_version": "0.8.dev0"}
{"input": ["opencl -keys=opencl,gpu -max_num_threads=256", "tutorial/conv2d_no_batching", [1, 14, 14, 512, 256, 3, 3, [2, 2], [1, 1, 1, 1]], {}], "config": {"index": 784, "code_hash": null, "entity": [["tile_ic", "sp", [-1, 1, 4]], ["tile_oc", "sp", [-1, 16]], ["tile_ow", "sp", [-1, 7, 2]], ["tile_oh", "sp", [-1, 2, 1]]]}, "result": [[0.00039506769999999994], 0, 2.27416729927063, 1615983489.4795146], "version": 0.2, "tvm_version": "0.8.dev0"}
{"input": ["opencl -keys=opencl,gpu -max_num_threads=256", "tutorial/conv2d_no_batching", [1, 14, 14, 512, 256, 3, 3, [2, 2], [1, 1, 1, 1]], {}], "config": {"index": 3096, "code_hash": null, "entity": [["tile_ic", "sp", [-1, 1, 4]], ["tile_oc", "sp", [-1, 64]], ["tile_ow", "sp", [-1, 1, 2]], ["tile_oh", "sp", [-1, 1, 2]]]}, "result": [[0.0003391458], 0, 2.781604051589966, 1615983490.1274042], "version": 0.2, "tvm_version": "0.8.dev0"}
{"input": ["opencl -keys=opencl,gpu -max_num_threads=256", "tutorial/conv2d_no_batching", [1, 14, 14, 512, 256, 3, 3, [2, 2], [1, 1, 1, 1]], {}], "config": {"index": 697, "code_hash": null, "entity": [["tile_ic", "sp", [-1, 2, 4]], ["tile_oc", "sp", [-1, 64]], ["tile_ow", "sp", [-1, 1, 2]], ["tile_oh", "sp", [-1, 2, 1]]]}, "result": [[0.0003768281], 0, 4.8405232429504395, 1615983492.109819], "version": 0.2, "tvm_version": "0.8.dev0"}
{"input": ["opencl -keys=opencl,gpu -max_num_threads=256", "tutorial/conv2d_no_batching", [1, 14, 14, 512, 256, 3, 3, [2, 2], [1, 1, 1, 1]], {}], "config": {"index": 820, "code_hash": null, "entity": [["tile_ic", "sp", [-1, 1, 4]], ["tile_oc", "sp", [-1, 32]], ["tile_ow", "sp", [-1, 1, 4]], ["tile_oh", "sp", [-1, 2, 1]]]}, "result": [[0.0004250469], 0, 5.501394271850586, 1615983492.7643456], "version": 0.2, "tvm_version": "0.8.dev0"}
{"input": ["opencl -keys=opencl,gpu -max_num_threads=256", "tutorial/conv2d_no_batching", [1, 14, 14, 512, 256, 3, 3, [2, 2], [1, 1, 1, 1]], {}], "config": {"index": 1808, "code_hash": null, "entity": [["tile_ic", "sp", [-1, 1, 4]], ["tile_oc", "sp", [-1, 16]], ["tile_ow", "sp", [-1, 2, 4]], ["tile_oh", "sp", [-1, 7, 1]]]}, "result": [[0.0006988126], 0, 6.208749771118164, 1615983493.4657242], "version": 0.2, "tvm_version": "0.8.dev0"}
{"input": ["opencl -keys=opencl,gpu -max_num_threads=256", "tutorial/conv2d_no_batching", [1, 14, 14, 512, 256, 3, 3, [2, 2], [1, 1, 1, 1]], {}], "config": {"index": 848, "code_hash": null, "entity": [["tile_ic", "sp", [-1, 1, 4]], ["tile_oc", "sp", [-1, 16]], ["tile_ow", "sp", [-1, 2, 4]], ["tile_oh", "sp", [-1, 2, 1]]]}, "result": [[0.0006686147], 0, 7.6008923053741455, 1615983494.8541443], "version": 0.2, "tvm_version": "0.8.dev0"}
{"input": ["opencl -keys=opencl,gpu -max_num_threads=256", "tutorial/conv2d_no_batching", [1, 14, 14, 512, 256, 3, 3, [2, 2], [1, 1, 1, 1]], {}], "config": {"index": 1776, "code_hash": null, "entity": [["tile_ic", "sp", [-1, 1, 4]], ["tile_oc", "sp", [-1, 16]], ["tile_ow", "sp", [-1, 1, 4]], ["tile_oh", "sp", [-1, 7, 1]]]}, "result": [[0.000480698], 0, 6.804405212402344, 1615983494.154103], "version": 0.2, "tvm_version": "0.8.dev0"}
{"input": ["opencl -keys=opencl,gpu -max_num_threads=256", "tutorial/conv2d_no_batching", [1, 14, 14, 512, 256, 3, 3, [2, 2], [1, 1, 1, 1]], {}], "config": {"index": 304, "code_hash": null, "entity": [["tile_ic", "sp", [-1, 1, 4]], ["tile_oc", "sp", [-1, 16]], ["tile_ow", "sp", [-1, 7, 2]], ["tile_oh", "sp", [-1, 1, 1]]]}, "result": [[0.0003768229], 0, 8.06714916229248, 1615983495.4965122], "version": 0.2, "tvm_version": "0.8.dev0"}
{"input": ["opencl -keys=opencl,gpu -max_num_threads=256", "tutorial/conv2d_no_batching", [1, 14, 14, 512, 256, 3, 3, [2, 2], [1, 1, 1, 1]], {}], "config": {"index": 2740, "code_hash": null, "entity": [["tile_ic", "sp", [-1, 1, 4]], ["tile_oc", "sp", [-1, 32]], ["tile_ow", "sp", [-1, 1, 4]], ["tile_oh", "sp", [-1, 14, 1]]]}, "result": [[0.00043087510000000003], 0, 8.801345586776733, 1615983496.1834042], "version": 0.2, "tvm_version": "0.8.dev0"}
{"input": ["opencl -keys=opencl,gpu -max_num_threads=256", "tutorial/conv2d_no_batching", [1, 14, 14, 512, 256, 3, 3, [2, 2], [1, 1, 1, 1]], {}], "config": {"index": 3092, "code_hash": null, "entity": [["tile_ic", "sp", [-1, 1, 4]], ["tile_oc", "sp", [-1, 32]], ["tile_ow", "sp", [-1, 1, 2]], ["tile_oh", "sp", [-1, 1, 2]]]}, "result": [[0.0005413438], 0, 9.558537721633911, 1615983496.8709128], "version": 0.2, "tvm_version": "0.8.dev0"}
{"input": ["opencl -keys=opencl,gpu -max_num_threads=256", "tutorial/conv2d_no_batching", [1, 14, 14, 512, 256, 3, 3, [2, 2], [1, 1, 1, 1]], {}], "config": {"index": 2256, "code_hash": null, "entity": [["tile_ic", "sp", [-1, 1, 4]], ["tile_oc", "sp", [-1, 16]], ["tile_ow", "sp", [-1, 1, 4]], ["tile_oh", "sp", [-1, 8, 1]]]}, "result": [[0.0004890104], 0, 10.181371688842773, 1615983497.551148], "version": 0.2, "tvm_version": "0.8.dev0"}
{"input": ["opencl -keys=opencl,gpu -max_num_threads=256", "tutorial/conv2d_no_batching", [1, 14, 14, 512, 256, 3, 3, [2, 2], [1, 1, 1, 1]], {}], "config": {"index": 1784, "code_hash": null, "entity": [["tile_ic", "sp", [-1, 1, 4]], ["tile_oc", "sp", [-1, 64]], ["tile_ow", "sp", [-1, 1, 4]], ["tile_oh", "sp", [-1, 7, 1]]]}, "result": [[0.00044264589999999996], 0, 12.222565412521362, 1615983499.55733], "version": 0.2, "tvm_version": "0.8.dev0"}
{"input": ["opencl -keys=opencl,gpu -max_num_threads=256", "tutorial/conv2d_no_batching", [1, 14, 14, 512, 256, 3, 3, [2, 2], [1, 1, 1, 1]], {}], "config": {"index": 372, "code_hash": null, "entity": [["tile_ic", "sp", [-1, 1, 4]], ["tile_oc", "sp", [-1, 32]], ["tile_ow", "sp", [-1, 2, 4]], ["tile_oh", "sp", [-1, 1, 1]]]}, "result": [[0.0005664063000000001], 0, 12.800098419189453, 1615983500.2505994], "version": 0.2, "tvm_version": "0.8.dev0"}
