test_and_tune/remote_tmali/Adreno630.wino3x3.log.tmp
{"input": ["opencl -keys=mali,opencl,gpu -device=mali -max_num_threads=256", "winograd_2", [1, 7, 7, 512, 512, 3, 3, [1, 1], [1, 1, 1, 1]], {}], "config": {"index": 242940, "code_hash": null, "entity": [["inv_cp", "sp", [-1, 8]], ["inv_wp", "sp", [-1, 4, 2]], ["inv_hp", "sp", [-1, 4, 2]], ["kernel_cp", "sp", [-1, 2]], ["kernel_kp", "sp", [-1, 32]], ["data_cp", "sp", [-1, 16]], ["data_wp", "sp", [-1, 2, 1]], ["data_hp", "sp", [-1, 4, 1]], ["bgemm_kp", "sp", [-1, 16]], ["bgemm_wp", "sp", [-1, 4, 4]], ["bgemm_hp", "sp", [-1, 1]]]}, "result": [[0.0014730581333333335], 0, 15.795848608016968, 1618312323.569416], "version": 0.2, "tvm_version": "0.8.dev0"}
{"input": ["opencl -keys=mali,opencl,gpu -device=mali -max_num_threads=256", "winograd_2", [1, 7, 7, 512, 512, 3, 3, [1, 1], [1, 1, 1, 1]], {}], "config": {"index": 52171, "code_hash": null, "entity": [["inv_cp", "sp", [-1, 32]], ["inv_wp", "sp", [-1, 4, 2]], ["inv_hp", "sp", [-1, 4, 2]], ["kernel_cp", "sp", [-1, 2]], ["kernel_kp", "sp", [-1, 32]], ["data_cp", "sp", [-1, 8]], ["data_wp", "sp", [-1, 2, 1]], ["data_hp", "sp", [-1, 4, 1]], ["bgemm_kp", "sp", [-1, 4]], ["bgemm_wp", "sp", [-1, 1, 4]], ["bgemm_hp", "sp", [-1, 1]]]}, "result": [[0.01441160533333333], 0, 20.865620136260986, 1618312327.870774], "version": 0.2, "tvm_version": "0.8.dev0"}
{"input": ["opencl -keys=mali,opencl,gpu -device=mali -max_num_threads=256", "winograd_2", [1, 7, 7, 512, 512, 3, 3, [1, 1], [1, 1, 1, 1]], {}], "config": {"index": 28658, "code_hash": null, "entity": [["inv_cp", "sp", [-1, 32]], ["inv_wp", "sp", [-1, 4, 2]], ["inv_hp", "sp", [-1, 4, 2]], ["kernel_cp", "sp", [-1, 4]], ["kernel_kp", "sp", [-1, 8]], ["data_cp", "sp", [-1, 32]], ["data_wp", "sp", [-1, 1, 1]], ["data_hp", "sp", [-1, 1, 1]], ["bgemm_kp", "sp", [-1, 2]], ["bgemm_wp", "sp", [-1, 1, 4]], ["bgemm_hp", "sp", [-1, 1]]]}, "result": [[0.027266525866666665], 0, 13.3339684009552, 1618312319.9910302], "version": 0.2, "tvm_version": "0.8.dev0"}
{"input": ["opencl -keys=mali,opencl,gpu -device=mali -max_num_threads=256", "winograd_2", [1, 7, 7, 512, 512, 3, 3, [1, 1], [1, 1, 1, 1]], {}], "config": {"index": 78242, "code_hash": null, "entity": [["inv_cp", "sp", [-1, 4]], ["inv_wp", "sp", [-1, 4, 2]], ["inv_hp", "sp", [-1, 4, 2]], ["kernel_cp", "sp", [-1, 32]], ["kernel_kp", "sp", [-1, 2]], ["data_cp", "sp", [-1, 16]], ["data_wp", "sp", [-1, 1, 1]], ["data_hp", "sp", [-1, 4, 1]], ["bgemm_kp", "sp", [-1, 16]], ["bgemm_wp", "sp", [-1, 1, 4]], ["bgemm_hp", "sp", [-1, 1]]]}, "result": [[0.004219972266666666], 0, 20.940511226654053, 1618312331.4578116], "version": 0.2, "tvm_version": "0.8.dev0"}
{"input": ["opencl -keys=mali,opencl,gpu -device=mali -max_num_threads=256", "winograd_2", [1, 7, 7, 512, 512, 3, 3, [1, 1], [1, 1, 1, 1]], {}], "config": {"index": 86574, "code_hash": null, "entity": [["inv_cp", "sp", [-1, 8]], ["inv_wp", "sp", [-1, 4, 2]], ["inv_hp", "sp", [-1, 4, 2]], ["kernel_cp", "sp", [-1, 2]], ["kernel_kp", "sp", [-1, 4]], ["data_cp", "sp", [-1, 2]], ["data_wp", "sp", [-1, 1, 1]], ["data_hp", "sp", [-1, 2, 1]], ["bgemm_kp", "sp", [-1, 32]], ["bgemm_wp", "sp", [-1, 2, 4]], ["bgemm_hp", "sp", [-1, 1]]]}, "result": [[0.0018079743999999999], 0, 32.772324562072754, 1618312338.7685306], "version": 0.2, "tvm_version": "0.8.dev0"}
{"input": ["opencl -keys=mali,opencl,gpu -device=mali -max_num_threads=256", "winograd_2", [1, 7, 7, 512, 512, 3, 3, [1, 1], [1, 1, 1, 1]], {}], "config": {"index": 135715, "code_hash": null, "entity": [["inv_cp", "sp", [-1, 16]], ["inv_wp", "sp", [-1, 4, 2]], ["inv_hp", "sp", [-1, 4, 2]], ["kernel_cp", "sp", [-1, 2]], ["kernel_kp", "sp", [-1, 4]], ["data_cp", "sp", [-1, 16]], ["data_wp", "sp", [-1, 4, 1]], ["data_hp", "sp", [-1, 4, 1]], ["bgemm_kp", "sp", [-1, 4]], ["bgemm_wp", "sp", [-1, 2, 4]], ["bgemm_hp", "sp", [-1, 1]]]}, "result": [[0.006918178133333333], 0, 28.431577444076538, 1618312335.2606788], "version": 0.2, "tvm_version": "0.8.dev0"}
{"input": ["opencl -keys=mali,opencl,gpu -device=mali -max_num_threads=256", "winograd_2", [1, 7, 7, 512, 512, 3, 3, [1, 1], [1, 1, 1, 1]], {}], "config": {"index": 154853, "code_hash": null, "entity": [["inv_cp", "sp", [-1, 16]], ["inv_wp", "sp", [-1, 4, 2]], ["inv_hp", "sp", [-1, 4, 2]], ["kernel_cp", "sp", [-1, 32]], ["kernel_kp", "sp", [-1, 2]], ["data_cp", "sp", [-1, 4]], ["data_wp", "sp", [-1, 1, 1]], ["data_hp", "sp", [-1, 2, 1]], ["bgemm_kp", "sp", [-1, 16]], ["bgemm_wp", "sp", [-1, 2, 4]], ["bgemm_hp", "sp", [-1, 1]]]}, "result": [[0.0026803882666666667], 0, 36.282193183898926, 1618312342.2510393], "version": 0.2, "tvm_version": "0.8.dev0"}
{"input": ["opencl -keys=mali,opencl,gpu -device=mali -max_num_threads=256", "winograd_2", [1, 7, 7, 512, 512, 3, 3, [1, 1], [1, 1, 1, 1]], {}], "config": {"index": 176527, "code_hash": null, "entity": [["inv_cp", "sp", [-1, 2]], ["inv_wp", "sp", [-1, 4, 2]], ["inv_hp", "sp", [-1, 4, 2]], ["kernel_cp", "sp", [-1, 1]], ["kernel_kp", "sp", [-1, 4]], ["data_cp", "sp", [-1, 16]], ["data_wp", "sp", [-1, 4, 1]], ["data_hp", "sp", [-1, 4, 1]], ["bgemm_kp", "sp", [-1, 32]], ["bgemm_wp", "sp", [-1, 4, 4]], ["bgemm_hp", "sp", [-1, 1]]]}, "result": [[0.0014927189333333334], 0, 42.340022563934326, 1618312349.2015097], "version": 0.2, "tvm_version": "0.8.dev0"}
{"input": ["opencl -keys=mali,opencl,gpu -device=mali -max_num_threads=256", "winograd_2", [1, 7, 7, 512, 512, 3, 3, [1, 1], [1, 1, 1, 1]], {}], "config": {"index": 123735, "code_hash": null, "entity": [["inv_cp", "sp", [-1, 4]], ["inv_wp", "sp", [-1, 4, 2]], ["inv_hp", "sp", [-1, 4, 2]], ["kernel_cp", "sp", [-1, 1]], ["kernel_kp", "sp", [-1, 32]], ["data_cp", "sp", [-1, 32]], ["data_wp", "sp", [-1, 1, 1]], ["data_hp", "sp", [-1, 1, 1]], ["bgemm_kp", "sp", [-1, 4]], ["bgemm_wp", "sp", [-1, 2, 4]], ["bgemm_hp", "sp", [-1, 1]]]}, "result": [[0.0069035519999999986], 0, 38.56293606758118, 1618312345.8278344], "version": 0.2, "tvm_version": "0.8.dev0"}
{"input": ["opencl -keys=mali,opencl,gpu -device=mali -max_num_threads=256", "winograd_2", [1, 7, 7, 512, 512, 3, 3, [1, 1], [1, 1, 1, 1]], {}], "config": {"index": 55999, "code_hash": null, "entity": [["inv_cp", "sp", [-1, 16]], ["inv_wp", "sp", [-1, 4, 2]], ["inv_hp", "sp", [-1, 4, 2]], ["kernel_cp", "sp", [-1, 2]], ["kernel_kp", "sp", [-1, 1]], ["data_cp", "sp", [-1, 1]], ["data_wp", "sp", [-1, 2, 1]], ["data_hp", "sp", [-1, 1, 1]], ["bgemm_kp", "sp", [-1, 8]], ["bgemm_wp", "sp", [-1, 1, 4]], ["bgemm_hp", "sp", [-1, 1]]]}, "result": [[0.0076000597333333334], 0, 46.943313121795654, 1618312353.116604], "version": 0.2, "tvm_version": "0.8.dev0"}
{"input": ["opencl -keys=mali,opencl,gpu -device=mali -max_num_threads=256", "winograd_2", [1, 7, 7, 512, 512, 3, 3, [1, 1], [1, 1, 1, 1]], {}], "config": {"index": 36869, "code_hash": null, "entity": [["inv_cp", "sp", [-1, 32]], ["inv_wp", "sp", [-1, 4, 2]], ["inv_hp", "sp", [-1, 4, 2]], ["kernel_cp", "sp", [-1, 32]], ["kernel_kp", "sp", [-1, 1]], ["data_cp", "sp", [-1, 4]], ["data_wp", "sp", [-1, 1, 1]], ["data_hp", "sp", [-1, 4, 1]], ["bgemm_kp", "sp", [-1, 2]], ["bgemm_wp", "sp", [-1, 1, 4]], ["bgemm_hp", "sp", [-1, 1]]]}, "result": [[0.02716501333333333], 0, 47.203253507614136, 1618312357.904096], "version": 0.2, "tvm_version": "0.8.dev0"}
{"input": ["opencl -keys=mali,opencl,gpu -device=mali -max_num_threads=256", "winograd_2", [1, 7, 7, 512, 512, 3, 3, [1, 1], [1, 1, 1, 1]], {}], "config": {"index": 182880, "code_hash": null, "entity": [["inv_cp", "sp", [-1, 8]], ["inv_wp", "sp", [-1, 4, 2]], ["inv_hp", "sp", [-1, 4, 2]], ["kernel_cp", "sp", [-1, 2]], ["kernel_kp", "sp", [-1, 8]], ["data_cp", "sp", [-1, 32]], ["data_wp", "sp", [-1, 1, 1]], ["data_hp", "sp", [-1, 2, 1]], ["bgemm_kp", "sp", [-1, 1]], ["bgemm_wp", "sp", [-1, 4, 4]], ["bgemm_hp", "sp", [-1, 1]]]}, "result": [[0.012347716266666666], 0, 13.199423789978027, 1618312372.312915], "version": 0.2, "tvm_version": "0.8.dev0"}
{"input": ["opencl -keys=mali,opencl,gpu -device=mali -max_num_threads=256", "winograd_2", [1, 7, 7, 512, 512, 3, 3, [1, 1], [1, 1, 1, 1]], {}], "config": {"index": 72698, "code_hash": null, "entity": [["inv_cp", "sp", [-1, 4]], ["inv_wp", "sp", [-1, 4, 2]], ["inv_hp", "sp", [-1, 4, 2]], ["kernel_cp", "sp", [-1, 32]], ["kernel_kp", "sp", [-1, 2]], ["data_cp", "sp", [-1, 1]], ["data_wp", "sp", [-1, 1, 1]], ["data_hp", "sp", [-1, 2, 1]], ["bgemm_kp", "sp", [-1, 16]], ["bgemm_wp", "sp", [-1, 1, 4]], ["bgemm_hp", "sp", [-1, 1]]]}, "result": [[0.004261000533333334], 0, 23.12793207168579, 1618312383.6872752], "version": 0.2, "tvm_version": "0.8.dev0"}
{"input": ["opencl -keys=mali,opencl,gpu -device=mali -max_num_threads=256", "winograd_2", [1, 7, 7, 512, 512, 3, 3, [1, 1], [1, 1, 1, 1]], {}], "config": {"index": 235066, "code_hash": null, "entity": [["inv_cp", "sp", [-1, 16]], ["inv_wp", "sp", [-1, 4, 2]], ["inv_hp", "sp", [-1, 4, 2]], ["kernel_cp", "sp", [-1, 16]], ["kernel_kp", "sp", [-1, 8]], ["data_cp", "sp", [-1, 4]], ["data_wp", "sp", [-1, 4, 1]], ["data_hp", "sp", [-1, 1, 1]], ["bgemm_kp", "sp", [-1, 16]], ["bgemm_wp", "sp", [-1, 4, 4]], ["bgemm_hp", "sp", [-1, 1]]]}, "result": [[0.0015709354666666665], 0, 17.63169503211975, 1618312376.2545393], "version": 0.2, "tvm_version": "0.8.dev0"}
{"input": ["opencl -keys=mali,opencl,gpu -device=mali -max_num_threads=256", "winograd_2", [1, 7, 7, 512, 512, 3, 3, [1, 1], [1, 1, 1, 1]], {}], "config": {"index": 5903, "code_hash": null, "entity": [["inv_cp", "sp", [-1, 64]], ["inv_wp", "sp", [-1, 4, 2]], ["inv_hp", "sp", [-1, 4, 2]], ["kernel_cp", "sp", [-1, 8]], ["kernel_kp", "sp", [-1, 2]], ["data_cp", "sp", [-1, 32]], ["data_wp", "sp", [-1, 1, 1]], ["data_hp", "sp", [-1, 2, 1]], ["bgemm_kp", "sp", [-1, 32]], ["bgemm_wp", "sp", [-1, 1, 4]], ["bgemm_hp", "sp", [-1, 1]]]}, "result": [[0.0027016021333333335], 0, 20.138235330581665, 1618312379.9960945], "version": 0.2, "tvm_version": "0.8.dev0"}
{"input": ["opencl -keys=mali,opencl,gpu -device=mali -max_num_threads=256", "winograd_2", [1, 7, 7, 512, 512, 3, 3, [1, 1], [1, 1, 1, 1]], {}], "config": {"index": 132825, "code_hash": null, "entity": [["inv_cp", "sp", [-1, 32]], ["inv_wp", "sp", [-1, 4, 2]], ["inv_hp", "sp", [-1, 4, 2]], ["kernel_cp", "sp", [-1, 8]], ["kernel_kp", "sp", [-1, 32]], ["data_cp", "sp", [-1, 32]], ["data_wp", "sp", [-1, 1, 1]], ["data_hp", "sp", [-1, 4, 1]], ["bgemm_kp", "sp", [-1, 4]], ["bgemm_wp", "sp", [-1, 2, 4]], ["bgemm_hp", "sp", [-1, 1]]]}, "result": [[0.006932548266666667], 0, 24.025425672531128, 1618312387.626623], "version": 0.2, "tvm_version": "0.8.dev0"}
{"input": ["opencl -keys=mali,opencl,gpu -device=mali -max_num_threads=256", "winograd_2", [1, 7, 7, 512, 512, 3, 3, [1, 1], [1, 1, 1, 1]], {}], "config": {"index": 244798, "code_hash": null, "entity": [["inv_cp", "sp", [-1, 2]], ["inv_wp", "sp", [-1, 4, 2]], ["inv_hp", "sp", [-1, 4, 2]], ["kernel_cp", "sp", [-1, 8]], ["kernel_kp", "sp", [-1, 2]], ["data_cp", "sp", [-1, 32]], ["data_wp", "sp", [-1, 4, 1]], ["data_hp", "sp", [-1, 4, 1]], ["bgemm_kp", "sp", [-1, 16]], ["bgemm_wp", "sp", [-1, 4, 4]], ["bgemm_hp", "sp", [-1, 1]]]}, "result": [[0.0015129941333333335], 0, 30.789737701416016, 1618312390.993623], "version": 0.2, "tvm_version": "0.8.dev0"}
{"input": ["opencl -keys=mali,opencl,gpu -device=mali -max_num_threads=256", "winograd_2", [1, 7, 7, 512, 512, 3, 3, [1, 1], [1, 1, 1, 1]], {}], "config": {"index": 223427, "code_hash": null, "entity": [["inv_cp", "sp", [-1, 2]], ["inv_wp", "sp", [-1, 4, 2]], ["inv_hp", "sp", [-1, 4, 2]], ["kernel_cp", "sp", [-1, 16]], ["kernel_kp", "sp", [-1, 4]], ["data_cp", "sp", [-1, 16]], ["data_wp", "sp", [-1, 1, 1]], ["data_hp", "sp", [-1, 2, 1]], ["bgemm_kp", "sp", [-1, 8]], ["bgemm_wp", "sp", [-1, 4, 4]], ["bgemm_hp", "sp", [-1, 1]]]}, "result": [[0.0027324757333333336], 0, 35.164934158325195, 1618312394.7418985], "version": 0.2, "tvm_version": "0.8.dev0"}
{"input": ["opencl -keys=mali,opencl,gpu -device=mali -max_num_threads=256", "winograd_2", [1, 7, 7, 512, 512, 3, 3, [1, 1], [1, 1, 1, 1]], {}], "config": {"index": 70834, "code_hash": null, "entity": [["inv_cp", "sp", [-1, 2]], ["inv_wp", "sp", [-1, 4, 2]], ["inv_hp", "sp", [-1, 4, 2]], ["kernel_cp", "sp", [-1, 8]], ["kernel_kp", "sp", [-1, 32]], ["data_cp", "sp", [-1, 32]], ["data_wp", "sp", [-1, 2, 1]], ["data_hp", "sp", [-1, 1, 1]], ["bgemm_kp", "sp", [-1, 16]], ["bgemm_wp", "sp", [-1, 1, 4]], ["bgemm_hp", "sp", [-1, 1]]]}, "result": [[0.004429294933333333], 0, 39.71901726722717, 1618312398.4981964], "version": 0.2, "tvm_version": "0.8.dev0"}
{"input": ["opencl -keys=mali,opencl,gpu -device=mali -max_num_threads=256", "winograd_2", [1, 7, 7, 512, 512, 3, 3, [1, 1], [1, 1, 1, 1]], {}], "config": {"index": 110785, "code_hash": null, "entity": [["inv_cp", "sp", [-1, 4]], ["inv_wp", "sp", [-1, 4, 2]], ["inv_hp", "sp", [-1, 4, 2]], ["kernel_cp", "sp", [-1, 16]], ["kernel_kp", "sp", [-1, 4]], ["data_cp", "sp", [-1, 2]], ["data_wp", "sp", [-1, 2, 1]], ["data_hp", "sp", [-1, 1, 1]], ["bgemm_kp", "sp", [-1, 2]], ["bgemm_wp", "sp", [-1, 2, 4]], ["bgemm_hp", "sp", [-1, 1]]]}, "result": [[0.012959692799999997], 0, 48.57269883155823, 1618312407.438201], "version": 0.2, "tvm_version": "0.8.dev0"}
{"input": ["opencl -keys=mali,opencl,gpu -device=mali -max_num_threads=256", "winograd_2", [1, 7, 7, 512, 512, 3, 3, [1, 1], [1, 1, 1, 1]], {}], "config": {"index": 217167, "code_hash": null, "entity": [["inv_cp", "sp", [-1, 16]], ["inv_wp", "sp", [-1, 4, 2]], ["inv_hp", "sp", [-1, 4, 2]], ["kernel_cp", "sp", [-1, 8]], ["kernel_kp", "sp", [-1, 8]], ["data_cp", "sp", [-1, 8]], ["data_wp", "sp", [-1, 4, 1]], ["data_hp", "sp", [-1, 4, 1]], ["bgemm_kp", "sp", [-1, 4]], ["bgemm_wp", "sp", [-1, 4, 4]], ["bgemm_hp", "sp", [-1, 1]]]}, "result": [[0.003741474133333333], 0, 54.03323531150818, 1618312414.9687448], "version": 0.2, "tvm_version": "0.8.dev0"}
{"input": ["opencl -keys=mali,opencl,gpu -device=mali -max_num_threads=256", "winograd_2", [1, 7, 7, 512, 512, 3, 3, [1, 1], [1, 1, 1, 1]], {}], "config": {"index": 37635, "code_hash": null, "entity": [["inv_cp", "sp", [-1, 4]], ["inv_wp", "sp", [-1, 4, 2]], ["inv_hp", "sp", [-1, 4, 2]], ["kernel_cp", "sp", [-1, 1]], ["kernel_kp", "sp", [-1, 2]], ["data_cp", "sp", [-1, 32]], ["data_wp", "sp", [-1, 1, 1]], ["data_hp", "sp", [-1, 4, 1]], ["bgemm_kp", "sp", [-1, 2]], ["bgemm_wp", "sp", [-1, 1, 4]], ["bgemm_hp", "sp", [-1, 1]]]}, "result": [[0.027113881599999997], 0, 39.1003954410553, 1618312403.321198], "version": 0.2, "tvm_version": "0.8.dev0"}
{"input": ["opencl -keys=mali,opencl,gpu -device=mali -max_num_threads=256", "winograd_2", [1, 7, 7, 512, 512, 3, 3, [1, 1], [1, 1, 1, 1]], {}], "config": {"index": 190559, "code_hash": null, "entity": [["inv_cp", "sp", [-1, 8]], ["inv_wp", "sp", [-1, 4, 2]], ["inv_hp", "sp", [-1, 4, 2]], ["kernel_cp", "sp", [-1, 1]], ["kernel_kp", "sp", [-1, 1]], ["data_cp", "sp", [-1, 1]], ["data_wp", "sp", [-1, 1, 1]], ["data_hp", "sp", [-1, 1, 1]], ["bgemm_kp", "sp", [-1, 2]], ["bgemm_wp", "sp", [-1, 4, 4]], ["bgemm_hp", "sp", [-1, 1]]]}, "result": [[0.006565239466666667], 0, 48.97717475891113, 1618312411.2147646], "version": 0.2, "tvm_version": "0.8.dev0"}
{"input": ["opencl -keys=mali,opencl,gpu -device=mali -max_num_threads=256", "winograd_2", [1, 7, 7, 512, 512, 3, 3, [1, 1], [1, 1, 1, 1]], {}], "config": {"index": 80123, "code_hash": null, "entity": [["inv_cp", "sp", [-1, 2]], ["inv_wp", "sp", [-1, 4, 2]], ["inv_hp", "sp", [-1, 4, 2]], ["kernel_cp", "sp", [-1, 16]], ["kernel_kp", "sp", [-1, 16]], ["data_cp", "sp", [-1, 32]], ["data_wp", "sp", [-1, 2, 1]], ["data_hp", "sp", [-1, 4, 1]], ["bgemm_kp", "sp", [-1, 16]], ["bgemm_wp", "sp", [-1, 1, 4]], ["bgemm_hp", "sp", [-1, 1]]]}, "result": [[0.004459502933333334], 0, 16.509546995162964, 1618312436.3143647], "version": 0.2, "tvm_version": "0.8.dev0"}
{"input": ["opencl -keys=mali,opencl,gpu -device=mali -max_num_threads=256", "winograd_2", [1, 7, 7, 512, 512, 3, 3, [1, 1], [1, 1, 1, 1]], {}], "config": {"index": 153104, "code_hash": null, "entity": [["inv_cp", "sp", [-1, 32]], ["inv_wp", "sp", [-1, 4, 2]], ["inv_hp", "sp", [-1, 4, 2]], ["kernel_cp", "sp", [-1, 4]], ["kernel_kp", "sp", [-1, 4]], ["data_cp", "sp", [-1, 2]], ["data_wp", "sp", [-1, 4, 1]], ["data_hp", "sp", [-1, 1, 1]], ["bgemm_kp", "sp", [-1, 16]], ["bgemm_wp", "sp", [-1, 2, 4]], ["bgemm_hp", "sp", [-1, 1]]]}, "result": [[0.0026897919999999994], 0, 15.955613374710083, 1618312432.4176142], "version": 0.2, "tvm_version": "0.8.dev0"}
{"input": ["opencl -keys=mali,opencl,gpu -device=mali -max_num_threads=256", "winograd_2", [1, 7, 7, 512, 512, 3, 3, [1, 1], [1, 1, 1, 1]], {}], "config": {"index": 231899, "code_hash": null, "entity": [["inv_cp", "sp", [-1, 4]], ["inv_wp", "sp", [-1, 4, 2]], ["inv_hp", "sp", [-1, 4, 2]], ["kernel_cp", "sp", [-1, 4]], ["kernel_kp", "sp", [-1, 1]], ["data_cp", "sp", [-1, 4]], ["data_wp", "sp", [-1, 1, 1]], ["data_hp", "sp", [-1, 1, 1]], ["bgemm_kp", "sp", [-1, 16]], ["bgemm_wp", "sp", [-1, 4, 4]], ["bgemm_hp", "sp", [-1, 1]]]}, "result": [[0.0015580842666666668], 0, 10.737756490707397, 1618312428.760793], "version": 0.2, "tvm_version": "0.8.dev0"}
{"input": ["opencl -keys=mali,opencl,gpu -device=mali -max_num_threads=256", "winograd_2", [1, 7, 7, 512, 512, 3, 3, [1, 1], [1, 1, 1, 1]], {}], "config": {"index": 72302, "code_hash": null, "entity": [["inv_cp", "sp", [-1, 16]], ["inv_wp", "sp", [-1, 4, 2]], ["inv_hp", "sp", [-1, 4, 2]], ["kernel_cp", "sp", [-1, 4]], ["kernel_kp", "sp", [-1, 16]], ["data_cp", "sp", [-1, 16]], ["data_wp", "sp", [-1, 4, 1]], ["data_hp", "sp", [-1, 1, 1]], ["bgemm_kp", "sp", [-1, 16]], ["bgemm_wp", "sp", [-1, 1, 4]], ["bgemm_hp", "sp", [-1, 1]]]}, "result": [[0.004409668266666667], 0, 33.636751890182495, 1618312450.1761436], "version": 0.2, "tvm_version": "0.8.dev0"}
{"input": ["opencl -keys=mali,opencl,gpu -device=mali -max_num_threads=256", "winograd_2", [1, 7, 7, 512, 512, 3, 3, [1, 1], [1, 1, 1, 1]], {}], "config": {"index": 221198, "code_hash": null, "entity": [["inv_cp", "sp", [-1, 8]], ["inv_wp", "sp", [-1, 4, 2]], ["inv_hp", "sp", [-1, 4, 2]], ["kernel_cp", "sp", [-1, 8]], ["kernel_kp", "sp", [-1, 8]], ["data_cp", "sp", [-1, 2]], ["data_wp", "sp", [-1, 4, 1]], ["data_hp", "sp", [-1, 1, 1]], ["bgemm_kp", "sp", [-1, 8]], ["bgemm_wp", "sp", [-1, 4, 4]], ["bgemm_hp", "sp", [-1, 1]]]}, "result": [[0.002776610133333333], 0, 37.31731176376343, 1618312453.9435287], "version": 0.2, "tvm_version": "0.8.dev0"}
{"input": ["opencl -keys=mali,opencl,gpu -device=mali -max_num_threads=256", "winograd_2", [1, 7, 7, 512, 512, 3, 3, [1, 1], [1, 1, 1, 1]], {}], "config": {"index": 27704, "code_hash": null, "entity": [["inv_cp", "sp", [-1, 8]], ["inv_wp", "sp", [-1, 4, 2]], ["inv_hp", "sp", [-1, 4, 2]], ["kernel_cp", "sp", [-1, 8]], ["kernel_kp", "sp", [-1, 16]], ["data_cp", "sp", [-1, 2]], ["data_wp", "sp", [-1, 1, 1]], ["data_hp", "sp", [-1, 1, 1]], ["bgemm_kp", "sp", [-1, 2]], ["bgemm_wp", "sp", [-1, 1, 4]], ["bgemm_hp", "sp", [-1, 1]]]}, "result": [[0.027102105599999995], 0, 27.82157850265503, 1618312446.3507605], "version": 0.2, "tvm_version": "0.8.dev0"}
{"input": ["opencl -keys=mali,opencl,gpu -device=mali -max_num_threads=256", "winograd_2", [1, 7, 7, 512, 512, 3, 3, [1, 1], [1, 1, 1, 1]], {}], "config": {"index": 204072, "code_hash": null, "entity": [["inv_cp", "sp", [-1, 2]], ["inv_wp", "sp", [-1, 4, 2]], ["inv_hp", "sp", [-1, 4, 2]], ["kernel_cp", "sp", [-1, 32]], ["kernel_kp", "sp", [-1, 8]], ["data_cp", "sp", [-1, 32]], ["data_wp", "sp", [-1, 4, 1]], ["data_hp", "sp", [-1, 4, 1]], ["bgemm_kp", "sp", [-1, 2]], ["bgemm_wp", "sp", [-1, 4, 4]], ["bgemm_hp", "sp", [-1, 1]]]}, "result": [[0.006483455999999999], 0, 38.876343727111816, 1618312457.572185], "version": 0.2, "tvm_version": "0.8.dev0"}
{"input": ["opencl -keys=mali,opencl,gpu -device=mali -max_num_threads=256", "winograd_2", [1, 7, 7, 512, 512, 3, 3, [1, 1], [1, 1, 1, 1]], {}], "config": {"index": 222988, "code_hash": null, "entity": [["inv_cp", "sp", [-1, 4]], ["inv_wp", "sp", [-1, 4, 2]], ["inv_hp", "sp", [-1, 4, 2]], ["kernel_cp", "sp", [-1, 2]], ["kernel_kp", "sp", [-1, 16]], ["data_cp", "sp", [-1, 4]], ["data_wp", "sp", [-1, 1, 1]], ["data_hp", "sp", [-1, 2, 1]], ["bgemm_kp", "sp", [-1, 8]], ["bgemm_wp", "sp", [-1, 4, 4]], ["bgemm_hp", "sp", [-1, 1]]]}, "result": [[0.002735189333333334], 0, 43.20646834373474, 1618312461.2914405], "version": 0.2, "tvm_version": "0.8.dev0"}
{"input": ["opencl -keys=mali,opencl,gpu -device=mali -max_num_threads=256", "winograd_2", [1, 7, 7, 512, 512, 3, 3, [1, 1], [1, 1, 1, 1]], {}], "config": {"index": 229691, "code_hash": null, "entity": [["inv_cp", "sp", [-1, 32]], ["inv_wp", "sp", [-1, 4, 2]], ["inv_hp", "sp", [-1, 4, 2]], ["kernel_cp", "sp", [-1, 32]], ["kernel_kp", "sp", [-1, 2]], ["data_cp", "sp", [-1, 32]], ["data_wp", "sp", [-1, 2, 1]], ["data_hp", "sp", [-1, 4, 1]], ["bgemm_kp", "sp", [-1, 8]], ["bgemm_wp", "sp", [-1, 4, 4]], ["bgemm_hp", "sp", [-1, 1]]]}, "result": [[0.002739899733333334], 0, 10.023548603057861, 1618312474.9662821], "version": 0.2, "tvm_version": "0.8.dev0"}
{"input": ["opencl -keys=mali,opencl,gpu -device=mali -max_num_threads=256", "winograd_2", [1, 7, 7, 512, 512, 3, 3, [1, 1], [1, 1, 1, 1]], {}], "config": {"index": 175803, "code_hash": null, "entity": [["inv_cp", "sp", [-1, 8]], ["inv_wp", "sp", [-1, 4, 2]], ["inv_hp", "sp", [-1, 4, 2]], ["kernel_cp", "sp", [-1, 16]], ["kernel_kp", "sp", [-1, 4]], ["data_cp", "sp", [-1, 2]], ["data_wp", "sp", [-1, 4, 1]], ["data_hp", "sp", [-1, 4, 1]], ["bgemm_kp", "sp", [-1, 32]], ["bgemm_wp", "sp", [-1, 4, 4]], ["bgemm_hp", "sp", [-1, 1]]]}, "result": [[0.0015600469333333332], 0, 15.024734020233154, 1618312478.4977498], "version": 0.2, "tvm_version": "0.8.dev0"}
{"input": ["opencl -keys=mali,opencl,gpu -device=mali -max_num_threads=256", "winograd_2", [1, 7, 7, 512, 512, 3, 3, [1, 1], [1, 1, 1, 1]], {}], "config": {"index": 45575, "code_hash": null, "entity": [["inv_cp", "sp", [-1, 8]], ["inv_wp", "sp", [-1, 4, 2]], ["inv_hp", "sp", [-1, 4, 2]], ["kernel_cp", "sp", [-1, 1]], ["kernel_kp", "sp", [-1, 16]], ["data_cp", "sp", [-1, 1]], ["data_wp", "sp", [-1, 1, 1]], ["data_hp", "sp", [-1, 2, 1]], ["bgemm_kp", "sp", [-1, 4]], ["bgemm_wp", "sp", [-1, 1, 4]], ["bgemm_hp", "sp", [-1, 1]]]}, "result": [[0.014318609066666665], 0, 20.207019805908203, 1618312482.6512654], "version": 0.2, "tvm_version": "0.8.dev0"}
{"input": ["opencl -keys=mali,opencl,gpu -device=mali -max_num_threads=256", "winograd_2", [1, 7, 7, 512, 512, 3, 3, [1, 1], [1, 1, 1, 1]], {}], "config": {"index": 96857, "code_hash": null, "entity": [["inv_cp", "sp", [-1, 8]], ["inv_wp", "sp", [-1, 4, 2]], ["inv_hp", "sp", [-1, 4, 2]], ["kernel_cp", "sp", [-1, 1]], ["kernel_kp", "sp", [-1, 2]], ["data_cp", "sp", [-1, 1]], ["data_wp", "sp", [-1, 2, 1]], ["data_hp", "sp", [-1, 1, 1]], ["bgemm_kp", "sp", [-1, 1]], ["bgemm_wp", "sp", [-1, 2, 4]], ["bgemm_hp", "sp", [-1, 1]]]}, "result": [[0.024993894399999998], 0, 25.29683494567871, 1618312487.310603], "version": 0.2, "tvm_version": "0.8.dev0"}
{"input": ["opencl -keys=mali,opencl,gpu -device=mali -max_num_threads=256", "winograd_2", [1, 7, 7, 512, 512, 3, 3, [1, 1], [1, 1, 1, 1]], {}], "config": {"index": 43896, "code_hash": null, "entity": [["inv_cp", "sp", [-1, 16]], ["inv_wp", "sp", [-1, 4, 2]], ["inv_hp", "sp", [-1, 4, 2]], ["kernel_cp", "sp", [-1, 1]], ["kernel_kp", "sp", [-1, 1]], ["data_cp", "sp", [-1, 1]], ["data_wp", "sp", [-1, 4, 1]], ["data_hp", "sp", [-1, 1, 1]], ["bgemm_kp", "sp", [-1, 4]], ["bgemm_wp", "sp", [-1, 1, 4]], ["bgemm_hp", "sp", [-1, 1]]]}, "result": [[0.014470775466666665], 0, 29.651827335357666, 1618312491.4584832], "version": 0.2, "tvm_version": "0.8.dev0"}
{"input": ["opencl -keys=mali,opencl,gpu -device=mali -max_num_threads=256", "winograd_2", [1, 7, 7, 512, 512, 3, 3, [1, 1], [1, 1, 1, 1]], {}], "config": {"index": 242488, "code_hash": null, "entity": [["inv_cp", "sp", [-1, 2]], ["inv_wp", "sp", [-1, 4, 2]], ["inv_hp", "sp", [-1, 4, 2]], ["kernel_cp", "sp", [-1, 8]], ["kernel_kp", "sp", [-1, 1]], ["data_cp", "sp", [-1, 4]], ["data_wp", "sp", [-1, 2, 1]], ["data_hp", "sp", [-1, 4, 1]], ["bgemm_kp", "sp", [-1, 16]], ["bgemm_wp", "sp", [-1, 4, 4]], ["bgemm_hp", "sp", [-1, 1]]]}, "result": [[0.0015185237333333332], 0, 34.60383486747742, 1618312498.9827037], "version": 0.2, "tvm_version": "0.8.dev0"}
{"input": ["opencl -keys=mali,opencl,gpu -device=mali -max_num_threads=256", "winograd_2", [1, 7, 7, 512, 512, 3, 3, [1, 1], [1, 1, 1, 1]], {}], "config": {"index": 187606, "code_hash": null, "entity": [["inv_cp", "sp", [-1, 16]], ["inv_wp", "sp", [-1, 4, 2]], ["inv_hp", "sp", [-1, 4, 2]], ["kernel_cp", "sp", [-1, 16]], ["kernel_kp", "sp", [-1, 2]], ["data_cp", "sp", [-1, 1]], ["data_wp", "sp", [-1, 2, 1]], ["data_hp", "sp", [-1, 4, 1]], ["bgemm_kp", "sp", [-1, 1]], ["bgemm_wp", "sp", [-1, 4, 4]], ["bgemm_hp", "sp", [-1, 1]]]}, "result": [[0.01234517333333333], 0, 42.912790060043335, 1618312506.8456721], "version": 0.2, "tvm_version": "0.8.dev0"}
{"input": ["opencl -keys=mali,opencl,gpu -device=mali -max_num_threads=256", "winograd_2", [1, 7, 7, 512, 512, 3, 3, [1, 1], [1, 1, 1, 1]], {}], "config": {"index": 86493, "code_hash": null, "entity": [["inv_cp", "sp", [-1, 2]], ["inv_wp", "sp", [-1, 4, 2]], ["inv_hp", "sp", [-1, 4, 2]], ["kernel_cp", "sp", [-1, 4]], ["kernel_kp", "sp", [-1, 1]], ["data_cp", "sp", [-1, 2]], ["data_wp", "sp", [-1, 1, 1]], ["data_hp", "sp", [-1, 2, 1]], ["bgemm_kp", "sp", [-1, 32]], ["bgemm_wp", "sp", [-1, 2, 4]], ["bgemm_hp", "sp", [-1, 1]]]}, "result": [[0.0016636757333333336], 0, 31.936514616012573, 1618312495.1143987], "version": 0.2, "tvm_version": "0.8.dev0"}
{"input": ["opencl -keys=mali,opencl,gpu -device=mali -max_num_threads=256", "winograd_2", [1, 7, 7, 512, 512, 3, 3, [1, 1], [1, 1, 1, 1]], {}], "config": {"index": 92433, "code_hash": null, "entity": [["inv_cp", "sp", [-1, 8]], ["inv_wp", "sp", [-1, 4, 2]], ["inv_hp", "sp", [-1, 4, 2]], ["kernel_cp", "sp", [-1, 16]], ["kernel_kp", "sp", [-1, 8]], ["data_cp", "sp", [-1, 1]], ["data_wp", "sp", [-1, 2, 1]], ["data_hp", "sp", [-1, 4, 1]], ["bgemm_kp", "sp", [-1, 32]], ["bgemm_wp", "sp", [-1, 2, 4]], ["bgemm_hp", "sp", [-1, 1]]]}, "result": [[0.0017449984000000001], 0, 38.52618050575256, 1618312502.6092741], "version": 0.2, "tvm_version": "0.8.dev0"}
{"input": ["opencl -keys=mali,opencl,gpu -device=mali -max_num_threads=256", "winograd_2", [1, 7, 7, 512, 512, 3, 3, [1, 1], [1, 1, 1, 1]], {}], "config": {"index": 244081, "code_hash": null, "entity": [["inv_cp", "sp", [-1, 8]], ["inv_wp", "sp", [-1, 4, 2]], ["inv_hp", "sp", [-1, 4, 2]], ["kernel_cp", "sp", [-1, 4]], ["kernel_kp", "sp", [-1, 4]], ["data_cp", "sp", [-1, 4]], ["data_wp", "sp", [-1, 4, 1]], ["data_hp", "sp", [-1, 4, 1]], ["bgemm_kp", "sp", [-1, 16]], ["bgemm_wp", "sp", [-1, 4, 4]], ["bgemm_hp", "sp", [-1, 1]]]}, "result": [[0.0015205205333333333], 0, 7.341640472412109, 1618314791.5953972], "version": 0.2, "tvm_version": "0.8.dev0"}
{"input": ["opencl -keys=mali,opencl,gpu -device=mali -max_num_threads=256", "winograd_2", [1, 7, 7, 512, 512, 3, 3, [1, 1], [1, 1, 1, 1]], {}], "config": {"index": 244004, "code_hash": null, "entity": [["inv_cp", "sp", [-1, 8]], ["inv_wp", "sp", [-1, 4, 2]], ["inv_hp", "sp", [-1, 4, 2]], ["kernel_cp", "sp", [-1, 8]], ["kernel_kp", "sp", [-1, 1]], ["data_cp", "sp", [-1, 4]], ["data_wp", "sp", [-1, 4, 1]], ["data_hp", "sp", [-1, 4, 1]], ["bgemm_kp", "sp", [-1, 16]], ["bgemm_wp", "sp", [-1, 4, 4]], ["bgemm_hp", "sp", [-1, 1]]]}, "result": [[0.0015412223999999998], 0, 10.585394620895386, 1618314794.9462054], "version": 0.2, "tvm_version": "0.8.dev0"}
{"input": ["opencl -keys=mali,opencl,gpu -device=mali -max_num_threads=256", "winograd_2", [1, 7, 7, 512, 512, 3, 3, [1, 1], [1, 1, 1, 1]], {}], "config": {"index": 243948, "code_hash": null, "entity": [["inv_cp", "sp", [-1, 8]], ["inv_wp", "sp", [-1, 4, 2]], ["inv_hp", "sp", [-1, 4, 2]], ["kernel_cp", "sp", [-1, 2]], ["kernel_kp", "sp", [-1, 32]], ["data_cp", "sp", [-1, 4]], ["data_wp", "sp", [-1, 4, 1]], ["data_hp", "sp", [-1, 4, 1]], ["bgemm_kp", "sp", [-1, 16]], ["bgemm_wp", "sp", [-1, 4, 4]], ["bgemm_hp", "sp", [-1, 1]]]}, "result": [[0.0015123456], 0, 14.236857414245605, 1618314798.541481], "version": 0.2, "tvm_version": "0.8.dev0"}
{"input": ["opencl -keys=mali,opencl,gpu -device=mali -max_num_threads=256", "winograd_2", [1, 7, 7, 512, 512, 3, 3, [1, 1], [1, 1, 1, 1]], {}], "config": {"index": 244074, "code_hash": null, "entity": [["inv_cp", "sp", [-1, 8]], ["inv_wp", "sp", [-1, 4, 2]], ["inv_hp", "sp", [-1, 4, 2]], ["kernel_cp", "sp", [-1, 2]], ["kernel_kp", "sp", [-1, 4]], ["data_cp", "sp", [-1, 4]], ["data_wp", "sp", [-1, 4, 1]], ["data_hp", "sp", [-1, 4, 1]], ["bgemm_kp", "sp", [-1, 16]], ["bgemm_wp", "sp", [-1, 4, 4]], ["bgemm_hp", "sp", [-1, 1]]]}, "result": [[0.0015733077333333332], 0, 18.057390928268433, 1618314802.2807903], "version": 0.2, "tvm_version": "0.8.dev0"}
{"input": ["opencl -keys=mali,opencl,gpu -device=mali -max_num_threads=256", "winograd_2", [1, 7, 7, 512, 512, 3, 3, [1, 1], [1, 1, 1, 1]], {}], "config": {"index": 243962, "code_hash": null, "entity": [["inv_cp", "sp", [-1, 8]], ["inv_wp", "sp", [-1, 4, 2]], ["inv_hp", "sp", [-1, 4, 2]], ["kernel_cp", "sp", [-1, 8]], ["kernel_kp", "sp", [-1, 32]], ["data_cp", "sp", [-1, 4]], ["data_wp", "sp", [-1, 4, 1]], ["data_hp", "sp", [-1, 4, 1]], ["bgemm_kp", "sp", [-1, 16]], ["bgemm_wp", "sp", [-1, 4, 4]], ["bgemm_hp", "sp", [-1, 1]]]}, "result": [[0.0015353173333333334], 0, 21.358365535736084, 1618314805.6736372], "version": 0.2, "tvm_version": "0.8.dev0"}
{"input": ["opencl -keys=mali,opencl,gpu -device=mali -max_num_threads=256", "winograd_2", [1, 7, 7, 512, 512, 3, 3, [1, 1], [1, 1, 1, 1]], {}], "config": {"index": 244067, "code_hash": null, "entity": [["inv_cp", "sp", [-1, 8]], ["inv_wp", "sp", [-1, 4, 2]], ["inv_hp", "sp", [-1, 4, 2]], ["kernel_cp", "sp", [-1, 1]], ["kernel_kp", "sp", [-1, 4]], ["data_cp", "sp", [-1, 4]], ["data_wp", "sp", [-1, 4, 1]], ["data_hp", "sp", [-1, 4, 1]], ["bgemm_kp", "sp", [-1, 16]], ["bgemm_wp", "sp", [-1, 4, 4]], ["bgemm_hp", "sp", [-1, 1]]]}, "result": [[0.001501952], 0, 24.90200924873352, 1618314809.244373], "version": 0.2, "tvm_version": "0.8.dev0"}
{"input": ["opencl -keys=mali,opencl,gpu -device=mali -max_num_threads=256", "winograd_2", [1, 7, 7, 512, 512, 3, 3, [1, 1], [1, 1, 1, 1]], {}], "config": {"index": 244102, "code_hash": null, "entity": [["inv_cp", "sp", [-1, 8]], ["inv_wp", "sp", [-1, 4, 2]], ["inv_hp", "sp", [-1, 4, 2]], ["kernel_cp", "sp", [-1, 32]], ["kernel_kp", "sp", [-1, 4]], ["data_cp", "sp", [-1, 4]], ["data_wp", "sp", [-1, 4, 1]], ["data_hp", "sp", [-1, 4, 1]], ["bgemm_kp", "sp", [-1, 16]], ["bgemm_wp", "sp", [-1, 4, 4]], ["bgemm_hp", "sp", [-1, 1]]]}, "result": [[0.0015538005333333336], 0, 28.382599592208862, 1618314812.8011706], "version": 0.2, "tvm_version": "0.8.dev0"}
{"input": ["opencl -keys=mali,opencl,gpu -device=mali -max_num_threads=256", "winograd_2", [1, 7, 7, 512, 512, 3, 3, [1, 1], [1, 1, 1, 1]], {}], "config": {"index": 244039, "code_hash": null, "entity": [["inv_cp", "sp", [-1, 8]], ["inv_wp", "sp", [-1, 4, 2]], ["inv_hp", "sp", [-1, 4, 2]], ["kernel_cp", "sp", [-1, 4]], ["kernel_kp", "sp", [-1, 2]], ["data_cp", "sp", [-1, 4]], ["data_wp", "sp", [-1, 4, 1]], ["data_hp", "sp", [-1, 4, 1]], ["bgemm_kp", "sp", [-1, 16]], ["bgemm_wp", "sp", [-1, 4, 4]], ["bgemm_hp", "sp", [-1, 1]]]}, "result": [[0.0015546879999999998], 0, 32.19132924079895, 1618314816.5400958], "version": 0.2, "tvm_version": "0.8.dev0"}
{"input": ["opencl -keys=mali,opencl,gpu -device=mali -max_num_threads=256", "winograd_2", [1, 7, 7, 512, 512, 3, 3, [1, 1], [1, 1, 1, 1]], {}], "config": {"index": 244018, "code_hash": null, "entity": [["inv_cp", "sp", [-1, 8]], ["inv_wp", "sp", [-1, 4, 2]], ["inv_hp", "sp", [-1, 4, 2]], ["kernel_cp", "sp", [-1, 32]], ["kernel_kp", "sp", [-1, 1]], ["data_cp", "sp", [-1, 4]], ["data_wp", "sp", [-1, 4, 1]], ["data_hp", "sp", [-1, 4, 1]], ["bgemm_kp", "sp", [-1, 16]], ["bgemm_wp", "sp", [-1, 4, 4]], ["bgemm_hp", "sp", [-1, 1]]]}, "result": [[0.0014920874666666665], 0, 36.02962851524353, 1618314820.3104672], "version": 0.2, "tvm_version": "0.8.dev0"}
{"input": ["opencl -keys=mali,opencl,gpu -device=mali -max_num_threads=256", "winograd_2", [1, 7, 7, 512, 512, 3, 3, [1, 1], [1, 1, 1, 1]], {}], "config": {"index": 244144, "code_hash": null, "entity": [["inv_cp", "sp", [-1, 8]], ["inv_wp", "sp", [-1, 4, 2]], ["inv_hp", "sp", [-1, 4, 2]], ["kernel_cp", "sp", [-1, 32]], ["kernel_kp", "sp", [-1, 8]], ["data_cp", "sp", [-1, 4]], ["data_wp", "sp", [-1, 4, 1]], ["data_hp", "sp", [-1, 4, 1]], ["bgemm_kp", "sp", [-1, 16]], ["bgemm_wp", "sp", [-1, 4, 4]], ["bgemm_hp", "sp", [-1, 1]]]}, "result": [[0.0015193258666666666], 0, 39.30474495887756, 1618314823.6910462], "version": 0.2, "tvm_version": "0.8.dev0"}
{"input": ["opencl -keys=mali,opencl,gpu -device=mali -max_num_threads=256", "winograd_2", [1, 7, 7, 512, 512, 3, 3, [1, 1], [1, 1, 1, 1]], {}], "config": {"index": 243983, "code_hash": null, "entity": [["inv_cp", "sp", [-1, 8]], ["inv_wp", "sp", [-1, 4, 2]], ["inv_hp", "sp", [-1, 4, 2]], ["kernel_cp", "sp", [-1, 1]], ["kernel_kp", "sp", [-1, 1]], ["data_cp", "sp", [-1, 4]], ["data_wp", "sp", [-1, 4, 1]], ["data_hp", "sp", [-1, 4, 1]], ["bgemm_kp", "sp", [-1, 16]], ["bgemm_wp", "sp", [-1, 4, 4]], ["bgemm_hp", "sp", [-1, 1]]]}, "result": [[0.0015041024000000001], 0, 42.78939151763916, 1618314827.1810527], "version": 0.2, "tvm_version": "0.8.dev0"}
{"input": ["opencl -keys=mali,opencl,gpu -device=mali -max_num_threads=256", "winograd_2", [1, 7, 7, 512, 512, 3, 3, [1, 1], [1, 1, 1, 1]], {}], "config": {"index": 244088, "code_hash": null, "entity": [["inv_cp", "sp", [-1, 8]], ["inv_wp", "sp", [-1, 4, 2]], ["inv_hp", "sp", [-1, 4, 2]], ["kernel_cp", "sp", [-1, 8]], ["kernel_kp", "sp", [-1, 4]], ["data_cp", "sp", [-1, 4]], ["data_wp", "sp", [-1, 4, 1]], ["data_hp", "sp", [-1, 4, 1]], ["bgemm_kp", "sp", [-1, 16]], ["bgemm_wp", "sp", [-1, 4, 4]], ["bgemm_hp", "sp", [-1, 1]]]}, "result": [[0.0015153493333333334], 0, 46.29489874839783, 1618314830.7505934], "version": 0.2, "tvm_version": "0.8.dev0"}
{"input": ["opencl -keys=mali,opencl,gpu -device=mali -max_num_threads=256", "winograd_2", [1, 7, 7, 512, 512, 3, 3, [1, 1], [1, 1, 1, 1]], {}], "config": {"index": 244165, "code_hash": null, "entity": [["inv_cp", "sp", [-1, 8]], ["inv_wp", "sp", [-1, 4, 2]], ["inv_hp", "sp", [-1, 4, 2]], ["kernel_cp", "sp", [-1, 4]], ["kernel_kp", "sp", [-1, 16]], ["data_cp", "sp", [-1, 4]], ["data_wp", "sp", [-1, 4, 1]], ["data_hp", "sp", [-1, 4, 1]], ["bgemm_kp", "sp", [-1, 16]], ["bgemm_wp", "sp", [-1, 4, 4]], ["bgemm_hp", "sp", [-1, 1]]]}, "result": [[0.0015419050666666669], 0, 50.028080224990845, 1618314834.40102], "version": 0.2, "tvm_version": "0.8.dev0"}
{"input": ["opencl -keys=mali,opencl,gpu -device=mali -max_num_threads=256", "winograd_2", [1, 7, 7, 512, 512, 3, 3, [1, 1], [1, 1, 1, 1]], {}], "config": {"index": 244137, "code_hash": null, "entity": [["inv_cp", "sp", [-1, 8]], ["inv_wp", "sp", [-1, 4, 2]], ["inv_hp", "sp", [-1, 4, 2]], ["kernel_cp", "sp", [-1, 16]], ["kernel_kp", "sp", [-1, 8]], ["data_cp", "sp", [-1, 4]], ["data_wp", "sp", [-1, 4, 1]], ["data_hp", "sp", [-1, 4, 1]], ["bgemm_kp", "sp", [-1, 16]], ["bgemm_wp", "sp", [-1, 4, 4]], ["bgemm_hp", "sp", [-1, 1]]]}, "result": [[0.0015336448], 0, 53.66654992103577, 1618314838.061078], "version": 0.2, "tvm_version": "0.8.dev0"}
{"input": ["opencl -keys=mali,opencl,gpu -device=mali -max_num_threads=256", "winograd_2", [1, 7, 7, 512, 512, 3, 3, [1, 1], [1, 1, 1, 1]], {}], "config": {"index": 243976, "code_hash": null, "entity": [["inv_cp", "sp", [-1, 8]], ["inv_wp", "sp", [-1, 4, 2]], ["inv_hp", "sp", [-1, 4, 2]], ["kernel_cp", "sp", [-1, 32]], ["kernel_kp", "sp", [-1, 32]], ["data_cp", "sp", [-1, 4]], ["data_wp", "sp", [-1, 4, 1]], ["data_hp", "sp", [-1, 4, 1]], ["bgemm_kp", "sp", [-1, 16]], ["bgemm_wp", "sp", [-1, 4, 4]], ["bgemm_hp", "sp", [-1, 1]]]}, "result": [[0.0015250602666666666], 0, 57.159502267837524, 1618314841.6403127], "version": 0.2, "tvm_version": "0.8.dev0"}
{"input": ["opencl -keys=mali,opencl,gpu -device=mali -max_num_threads=256", "winograd_2", [1, 7, 7, 512, 512, 3, 3, [1, 1], [1, 1, 1, 1]], {}], "config": {"index": 244025, "code_hash": null, "entity": [["inv_cp", "sp", [-1, 8]], ["inv_wp", "sp", [-1, 4, 2]], ["inv_hp", "sp", [-1, 4, 2]], ["kernel_cp", "sp", [-1, 1]], ["kernel_kp", "sp", [-1, 2]], ["data_cp", "sp", [-1, 4]], ["data_wp", "sp", [-1, 4, 1]], ["data_hp", "sp", [-1, 4, 1]], ["bgemm_kp", "sp", [-1, 16]], ["bgemm_wp", "sp", [-1, 4, 4]], ["bgemm_hp", "sp", [-1, 1]]]}, "result": [[0.0014964224000000002], 0, 60.742976665496826, 1618314845.217921], "version": 0.2, "tvm_version": "0.8.dev0"}
{"input": ["opencl -keys=mali,opencl,gpu -device=mali -max_num_threads=256", "winograd_2", [1, 7, 7, 512, 512, 3, 3, [1, 1], [1, 1, 1, 1]], {}], "config": {"index": 244158, "code_hash": null, "entity": [["inv_cp", "sp", [-1, 8]], ["inv_wp", "sp", [-1, 4, 2]], ["inv_hp", "sp", [-1, 4, 2]], ["kernel_cp", "sp", [-1, 2]], ["kernel_kp", "sp", [-1, 16]], ["data_cp", "sp", [-1, 4]], ["data_wp", "sp", [-1, 4, 1]], ["data_hp", "sp", [-1, 4, 1]], ["bgemm_kp", "sp", [-1, 16]], ["bgemm_wp", "sp", [-1, 4, 4]], ["bgemm_hp", "sp", [-1, 1]]]}, "result": [[0.0015120213333333335], 0, 64.38365697860718, 1618314848.8518572], "version": 0.2, "tvm_version": "0.8.dev0"}
{"input": ["opencl -keys=mali,opencl,gpu -device=mali -max_num_threads=256", "winograd_2", [1, 7, 7, 512, 512, 3, 3, [1, 1], [1, 1, 1, 1]], {}], "config": {"index": 244095, "code_hash": null, "entity": [["inv_cp", "sp", [-1, 8]], ["inv_wp", "sp", [-1, 4, 2]], ["inv_hp", "sp", [-1, 4, 2]], ["kernel_cp", "sp", [-1, 16]], ["kernel_kp", "sp", [-1, 4]], ["data_cp", "sp", [-1, 4]], ["data_wp", "sp", [-1, 4, 1]], ["data_hp", "sp", [-1, 4, 1]], ["bgemm_kp", "sp", [-1, 16]], ["bgemm_wp", "sp", [-1, 4, 4]], ["bgemm_hp", "sp", [-1, 1]]]}, "result": [[0.0015342079999999998], 0, 67.9260745048523, 1618314852.4264069], "version": 0.2, "tvm_version": "0.8.dev0"}
{"input": ["opencl -keys=mali,opencl,gpu -device=mali -max_num_threads=256", "winograd_2", [1, 7, 7, 512, 512, 3, 3, [1, 1], [1, 1, 1, 1]], {}], "config": {"index": 244011, "code_hash": null, "entity": [["inv_cp", "sp", [-1, 8]], ["inv_wp", "sp", [-1, 4, 2]], ["inv_hp", "sp", [-1, 4, 2]], ["kernel_cp", "sp", [-1, 16]], ["kernel_kp", "sp", [-1, 1]], ["data_cp", "sp", [-1, 4]], ["data_wp", "sp", [-1, 4, 1]], ["data_hp", "sp", [-1, 4, 1]], ["bgemm_kp", "sp", [-1, 16]], ["bgemm_wp", "sp", [-1, 4, 4]], ["bgemm_hp", "sp", [-1, 1]]]}, "result": [[0.0015353002666666667], 0, 71.51185750961304, 1618314855.9547262], "version": 0.2, "tvm_version": "0.8.dev0"}
{"input": ["opencl -keys=mali,opencl,gpu -device=mali -max_num_threads=256", "winograd_2", [1, 7, 7, 512, 512, 3, 3, [1, 1], [1, 1, 1, 1]], {}], "config": {"index": 243941, "code_hash": null, "entity": [["inv_cp", "sp", [-1, 8]], ["inv_wp", "sp", [-1, 4, 2]], ["inv_hp", "sp", [-1, 4, 2]], ["kernel_cp", "sp", [-1, 1]], ["kernel_kp", "sp", [-1, 32]], ["data_cp", "sp", [-1, 4]], ["data_wp", "sp", [-1, 4, 1]], ["data_hp", "sp", [-1, 4, 1]], ["bgemm_kp", "sp", [-1, 16]], ["bgemm_wp", "sp", [-1, 4, 4]], ["bgemm_hp", "sp", [-1, 1]]]}, "result": [[0.0015022250666666666], 0, 75.1554582118988, 1618314859.5938344], "version": 0.2, "tvm_version": "0.8.dev0"}
{"input": ["opencl -keys=mali,opencl,gpu -device=mali -max_num_threads=256", "winograd_2", [1, 7, 7, 512, 512, 3, 3, [1, 1], [1, 1, 1, 1]], {}], "config": {"index": 244032, "code_hash": null, "entity": [["inv_cp", "sp", [-1, 8]], ["inv_wp", "sp", [-1, 4, 2]], ["inv_hp", "sp", [-1, 4, 2]], ["kernel_cp", "sp", [-1, 2]], ["kernel_kp", "sp", [-1, 2]], ["data_cp", "sp", [-1, 4]], ["data_wp", "sp", [-1, 4, 1]], ["data_hp", "sp", [-1, 4, 1]], ["bgemm_kp", "sp", [-1, 16]], ["bgemm_wp", "sp", [-1, 4, 4]], ["bgemm_hp", "sp", [-1, 1]]]}, "result": [[0.0015248042666666664], 0, 11.714215755462646, 1618314872.4045744], "version": 0.2, "tvm_version": "0.8.dev0"}
{"input": ["opencl -keys=mali,opencl,gpu -device=mali -max_num_threads=256", "winograd_2", [1, 7, 7, 512, 512, 3, 3, [1, 1], [1, 1, 1, 1]], {}], "config": {"index": 244123, "code_hash": null, "entity": [["inv_cp", "sp", [-1, 8]], ["inv_wp", "sp", [-1, 4, 2]], ["inv_hp", "sp", [-1, 4, 2]], ["kernel_cp", "sp", [-1, 4]], ["kernel_kp", "sp", [-1, 8]], ["data_cp", "sp", [-1, 4]], ["data_wp", "sp", [-1, 4, 1]], ["data_hp", "sp", [-1, 4, 1]], ["bgemm_kp", "sp", [-1, 16]], ["bgemm_wp", "sp", [-1, 4, 4]], ["bgemm_hp", "sp", [-1, 1]]]}, "result": [[0.0014826325333333332], 0, 14.754598617553711, 1618314875.9187999], "version": 0.2, "tvm_version": "0.8.dev0"}
{"input": ["opencl -keys=mali,opencl,gpu -device=mali -max_num_threads=256", "winograd_2", [1, 7, 7, 512, 512, 3, 3, [1, 1], [1, 1, 1, 1]], {}], "config": {"index": 244151, "code_hash": null, "entity": [["inv_cp", "sp", [-1, 8]], ["inv_wp", "sp", [-1, 4, 2]], ["inv_hp", "sp", [-1, 4, 2]], ["kernel_cp", "sp", [-1, 1]], ["kernel_kp", "sp", [-1, 16]], ["data_cp", "sp", [-1, 4]], ["data_wp", "sp", [-1, 4, 1]], ["data_hp", "sp", [-1, 4, 1]], ["bgemm_kp", "sp", [-1, 16]], ["bgemm_wp", "sp", [-1, 4, 4]], ["bgemm_hp", "sp", [-1, 1]]]}, "result": [[0.0015042730666666665], 0, 18.033013582229614, 1618314879.363046], "version": 0.2, "tvm_version": "0.8.dev0"}
{"input": ["opencl -keys=mali,opencl,gpu -device=mali -max_num_threads=256", "winograd_2", [1, 7, 7, 512, 512, 3, 3, [1, 1], [1, 1, 1, 1]], {}], "config": {"index": 243969, "code_hash": null, "entity": [["inv_cp", "sp", [-1, 8]], ["inv_wp", "sp", [-1, 4, 2]], ["inv_hp", "sp", [-1, 4, 2]], ["kernel_cp", "sp", [-1, 16]], ["kernel_kp", "sp", [-1, 32]], ["data_cp", "sp", [-1, 4]], ["data_wp", "sp", [-1, 4, 1]], ["data_hp", "sp", [-1, 4, 1]], ["bgemm_kp", "sp", [-1, 16]], ["bgemm_wp", "sp", [-1, 4, 4]], ["bgemm_hp", "sp", [-1, 1]]]}, "result": [[0.0015213568000000005], 0, 22.68804383277893, 1618314883.03314], "version": 0.2, "tvm_version": "0.8.dev0"}
{"input": ["opencl -keys=mali,opencl,gpu -device=mali -max_num_threads=256", "winograd_2", [1, 7, 7, 512, 512, 3, 3, [1, 1], [1, 1, 1, 1]], {}], "config": {"index": 244109, "code_hash": null, "entity": [["inv_cp", "sp", [-1, 8]], ["inv_wp", "sp", [-1, 4, 2]], ["inv_hp", "sp", [-1, 4, 2]], ["kernel_cp", "sp", [-1, 1]], ["kernel_kp", "sp", [-1, 8]], ["data_cp", "sp", [-1, 4]], ["data_wp", "sp", [-1, 4, 1]], ["data_hp", "sp", [-1, 4, 1]], ["bgemm_kp", "sp", [-1, 16]], ["bgemm_wp", "sp", [-1, 4, 4]], ["bgemm_hp", "sp", [-1, 1]]]}, "result": [[0.0014860629333333332], 0, 26.325324058532715, 1618314886.5943007], "version": 0.2, "tvm_version": "0.8.dev0"}
{"input": ["opencl -keys=mali,opencl,gpu -device=mali -max_num_threads=256", "winograd_2", [1, 7, 7, 512, 512, 3, 3, [1, 1], [1, 1, 1, 1]], {}], "config": {"index": 243955, "code_hash": null, "entity": [["inv_cp", "sp", [-1, 8]], ["inv_wp", "sp", [-1, 4, 2]], ["inv_hp", "sp", [-1, 4, 2]], ["kernel_cp", "sp", [-1, 4]], ["kernel_kp", "sp", [-1, 32]], ["data_cp", "sp", [-1, 4]], ["data_wp", "sp", [-1, 4, 1]], ["data_hp", "sp", [-1, 4, 1]], ["bgemm_kp", "sp", [-1, 16]], ["bgemm_wp", "sp", [-1, 4, 4]], ["bgemm_hp", "sp", [-1, 1]]]}, "result": [[0.0015268181333333332], 0, 28.67465305328369, 1618314890.2518256], "version": 0.2, "tvm_version": "0.8.dev0"}
{"input": ["opencl -keys=mali,opencl,gpu -device=mali -max_num_threads=256", "winograd_2", [1, 7, 7, 512, 512, 3, 3, [1, 1], [1, 1, 1, 1]], {}], "config": {"index": 243990, "code_hash": null, "entity": [["inv_cp", "sp", [-1, 8]], ["inv_wp", "sp", [-1, 4, 2]], ["inv_hp", "sp", [-1, 4, 2]], ["kernel_cp", "sp", [-1, 2]], ["kernel_kp", "sp", [-1, 1]], ["data_cp", "sp", [-1, 4]], ["data_wp", "sp", [-1, 4, 1]], ["data_hp", "sp", [-1, 4, 1]], ["bgemm_kp", "sp", [-1, 16]], ["bgemm_wp", "sp", [-1, 4, 4]], ["bgemm_hp", "sp", [-1, 1]]]}, "result": [[0.0014934698666666665], 0, 33.36012077331543, 1618314893.9919562], "version": 0.2, "tvm_version": "0.8.dev0"}
{"input": ["opencl -keys=mali,opencl,gpu -device=mali -max_num_threads=256", "winograd_2", [1, 7, 7, 512, 512, 3, 3, [1, 1], [1, 1, 1, 1]], {}], "config": {"index": 244172, "code_hash": null, "entity": [["inv_cp", "sp", [-1, 8]], ["inv_wp", "sp", [-1, 4, 2]], ["inv_hp", "sp", [-1, 4, 2]], ["kernel_cp", "sp", [-1, 8]], ["kernel_kp", "sp", [-1, 16]], ["data_cp", "sp", [-1, 4]], ["data_wp", "sp", [-1, 4, 1]], ["data_hp", "sp", [-1, 4, 1]], ["bgemm_kp", "sp", [-1, 16]], ["bgemm_wp", "sp", [-1, 4, 4]], ["bgemm_hp", "sp", [-1, 1]]]}, "result": [[0.0015324501333333336], 0, 36.70386528968811, 1618314897.6850305], "version": 0.2, "tvm_version": "0.8.dev0"}
{"input": ["opencl -keys=mali,opencl,gpu -device=mali -max_num_threads=256", "winograd_2", [1, 7, 7, 512, 512, 3, 3, [1, 1], [1, 1, 1, 1]], {}], "config": {"index": 244130, "code_hash": null, "entity": [["inv_cp", "sp", [-1, 8]], ["inv_wp", "sp", [-1, 4, 2]], ["inv_hp", "sp", [-1, 4, 2]], ["kernel_cp", "sp", [-1, 8]], ["kernel_kp", "sp", [-1, 8]], ["data_cp", "sp", [-1, 4]], ["data_wp", "sp", [-1, 4, 1]], ["data_hp", "sp", [-1, 4, 1]], ["bgemm_kp", "sp", [-1, 16]], ["bgemm_wp", "sp", [-1, 4, 4]], ["bgemm_hp", "sp", [-1, 1]]]}, "result": [[0.0015020885333333334], 0, 39.755478858947754, 1618314901.194907], "version": 0.2, "tvm_version": "0.8.dev0"}
{"input": ["opencl -keys=mali,opencl,gpu -device=mali -max_num_threads=256", "winograd_2", [1, 7, 7, 512, 512, 3, 3, [1, 1], [1, 1, 1, 1]], {}], "config": {"index": 244179, "code_hash": null, "entity": [["inv_cp", "sp", [-1, 8]], ["inv_wp", "sp", [-1, 4, 2]], ["inv_hp", "sp", [-1, 4, 2]], ["kernel_cp", "sp", [-1, 16]], ["kernel_kp", "sp", [-1, 16]], ["data_cp", "sp", [-1, 4]], ["data_wp", "sp", [-1, 4, 1]], ["data_hp", "sp", [-1, 4, 1]], ["bgemm_kp", "sp", [-1, 16]], ["bgemm_wp", "sp", [-1, 4, 4]], ["bgemm_hp", "sp", [-1, 1]]]}, "result": [[0.0014948352000000002], 0, 42.07754373550415, 1618314904.69495], "version": 0.2, "tvm_version": "0.8.dev0"}
{"input": ["opencl -keys=mali,opencl,gpu -device=mali -max_num_threads=256", "winograd_2", [1, 7, 7, 512, 512, 3, 3, [1, 1], [1, 1, 1, 1]], {}], "config": {"index": 244186, "code_hash": null, "entity": [["inv_cp", "sp", [-1, 8]], ["inv_wp", "sp", [-1, 4, 2]], ["inv_hp", "sp", [-1, 4, 2]], ["kernel_cp", "sp", [-1, 32]], ["kernel_kp", "sp", [-1, 16]], ["data_cp", "sp", [-1, 4]], ["data_wp", "sp", [-1, 4, 1]], ["data_hp", "sp", [-1, 4, 1]], ["bgemm_kp", "sp", [-1, 16]], ["bgemm_wp", "sp", [-1, 4, 4]], ["bgemm_hp", "sp", [-1, 1]]]}, "result": [[0.0015273813333333333], 0, 47.70354127883911, 1618314908.5091746], "version": 0.2, "tvm_version": "0.8.dev0"}
{"input": ["opencl -keys=mali,opencl,gpu -device=mali -max_num_threads=256", "winograd_2", [1, 7, 7, 512, 512, 3, 3, [1, 1], [1, 1, 1, 1]], {}], "config": {"index": 243997, "code_hash": null, "entity": [["inv_cp", "sp", [-1, 8]], ["inv_wp", "sp", [-1, 4, 2]], ["inv_hp", "sp", [-1, 4, 2]], ["kernel_cp", "sp", [-1, 4]], ["kernel_kp", "sp", [-1, 1]], ["data_cp", "sp", [-1, 4]], ["data_wp", "sp", [-1, 4, 1]], ["data_hp", "sp", [-1, 4, 1]], ["bgemm_kp", "sp", [-1, 16]], ["bgemm_wp", "sp", [-1, 4, 4]], ["bgemm_hp", "sp", [-1, 1]]]}, "result": [[0.0015172778666666666], 0, 49.01703596115112, 1618314912.2819757], "version": 0.2, "tvm_version": "0.8.dev0"}
{"input": ["opencl -keys=mali,opencl,gpu -device=mali -max_num_threads=256", "winograd_2", [1, 7, 7, 512, 512, 3, 3, [1, 1], [1, 1, 1, 1]], {}], "config": {"index": 244053, "code_hash": null, "entity": [["inv_cp", "sp", [-1, 8]], ["inv_wp", "sp", [-1, 4, 2]], ["inv_hp", "sp", [-1, 4, 2]], ["kernel_cp", "sp", [-1, 16]], ["kernel_kp", "sp", [-1, 2]], ["data_cp", "sp", [-1, 4]], ["data_wp", "sp", [-1, 4, 1]], ["data_hp", "sp", [-1, 4, 1]], ["bgemm_kp", "sp", [-1, 16]], ["bgemm_wp", "sp", [-1, 4, 4]], ["bgemm_hp", "sp", [-1, 1]]]}, "result": [[0.0015294975999999997], 0, 58.59468460083008, 1618314919.676634], "version": 0.2, "tvm_version": "0.8.dev0"}
{"input": ["opencl -keys=mali,opencl,gpu -device=mali -max_num_threads=256", "winograd_2", [1, 7, 7, 512, 512, 3, 3, [1, 1], [1, 1, 1, 1]], {}], "config": {"index": 244060, "code_hash": null, "entity": [["inv_cp", "sp", [-1, 8]], ["inv_wp", "sp", [-1, 4, 2]], ["inv_hp", "sp", [-1, 4, 2]], ["kernel_cp", "sp", [-1, 32]], ["kernel_kp", "sp", [-1, 2]], ["data_cp", "sp", [-1, 4]], ["data_wp", "sp", [-1, 4, 1]], ["data_hp", "sp", [-1, 4, 1]], ["bgemm_kp", "sp", [-1, 16]], ["bgemm_wp", "sp", [-1, 4, 4]], ["bgemm_hp", "sp", [-1, 1]]]}, "result": [[0.0015157930666666666], 0, 53.72759795188904, 1618314916.025066], "version": 0.2, "tvm_version": "0.8.dev0"}
{"input": ["opencl -keys=mali,opencl,gpu -device=mali -max_num_threads=256", "winograd_2", [1, 7, 7, 512, 512, 3, 3, [1, 1], [1, 1, 1, 1]], {}], "config": {"index": 244046, "code_hash": null, "entity": [["inv_cp", "sp", [-1, 8]], ["inv_wp", "sp", [-1, 4, 2]], ["inv_hp", "sp", [-1, 4, 2]], ["kernel_cp", "sp", [-1, 8]], ["kernel_kp", "sp", [-1, 2]], ["data_cp", "sp", [-1, 4]], ["data_wp", "sp", [-1, 4, 1]], ["data_hp", "sp", [-1, 4, 1]], ["bgemm_kp", "sp", [-1, 16]], ["bgemm_wp", "sp", [-1, 4, 4]], ["bgemm_hp", "sp", [-1, 1]]]}, "result": [[0.0015196160000000001], 0, 61.25123572349548, 1618314923.2002032], "version": 0.2, "tvm_version": "0.8.dev0"}
{"input": ["opencl -keys=mali,opencl,gpu -device=mali -max_num_threads=256", "winograd_2", [1, 7, 7, 512, 512, 3, 3, [1, 1], [1, 1, 1, 1]], {}], "config": {"index": 244116, "code_hash": null, "entity": [["inv_cp", "sp", [-1, 8]], ["inv_wp", "sp", [-1, 4, 2]], ["inv_hp", "sp", [-1, 4, 2]], ["kernel_cp", "sp", [-1, 2]], ["kernel_kp", "sp", [-1, 8]], ["data_cp", "sp", [-1, 4]], ["data_wp", "sp", [-1, 4, 1]], ["data_hp", "sp", [-1, 4, 1]], ["bgemm_kp", "sp", [-1, 16]], ["bgemm_wp", "sp", [-1, 4, 4]], ["bgemm_hp", "sp", [-1, 1]]]}, "result": [[0.0015518037333333335], 0, 62.753798961639404, 1618314926.803343], "version": 0.2, "tvm_version": "0.8.dev0"}
{"input": ["opencl -keys=mali,opencl,gpu -device=mali -max_num_threads=256", "winograd_2", [1, 7, 7, 512, 512, 3, 3, [1, 1], [1, 1, 1, 1]], {}], "config": {"index": 243738, "code_hash": null, "entity": [["inv_cp", "sp", [-1, 8]], ["inv_wp", "sp", [-1, 4, 2]], ["inv_hp", "sp", [-1, 4, 2]], ["kernel_cp", "sp", [-1, 2]], ["kernel_kp", "sp", [-1, 1]], ["data_cp", "sp", [-1, 2]], ["data_wp", "sp", [-1, 4, 1]], ["data_hp", "sp", [-1, 4, 1]], ["bgemm_kp", "sp", [-1, 16]], ["bgemm_wp", "sp", [-1, 4, 4]], ["bgemm_hp", "sp", [-1, 1]]]}, "result": [[0.001535351466666667], 0, 68.57978987693787, 1618314930.4572287], "version": 0.2, "tvm_version": "0.8.dev0"}
{"input": ["opencl -keys=mali,opencl,gpu -device=mali -max_num_threads=256", "winograd_2", [1, 7, 7, 512, 512, 3, 3, [1, 1], [1, 1, 1, 1]], {}], "config": {"index": 243745, "code_hash": null, "entity": [["inv_cp", "sp", [-1, 8]], ["inv_wp", "sp", [-1, 4, 2]], ["inv_hp", "sp", [-1, 4, 2]], ["kernel_cp", "sp", [-1, 4]], ["kernel_kp", "sp", [-1, 1]], ["data_cp", "sp", [-1, 2]], ["data_wp", "sp", [-1, 4, 1]], ["data_hp", "sp", [-1, 4, 1]], ["bgemm_kp", "sp", [-1, 16]], ["bgemm_wp", "sp", [-1, 4, 4]], ["bgemm_hp", "sp", [-1, 1]]]}, "result": [[0.0015602346666666665], 0, 72.67293810844421, 1618314934.0355976], "version": 0.2, "tvm_version": "0.8.dev0"}
{"input": ["opencl -keys=mali,opencl,gpu -device=mali -max_num_threads=256", "winograd_2", [1, 7, 7, 512, 512, 3, 3, [1, 1], [1, 1, 1, 1]], {}], "config": {"index": 243759, "code_hash": null, "entity": [["inv_cp", "sp", [-1, 8]], ["inv_wp", "sp", [-1, 4, 2]], ["inv_hp", "sp", [-1, 4, 2]], ["kernel_cp", "sp", [-1, 16]], ["kernel_kp", "sp", [-1, 1]], ["data_cp", "sp", [-1, 2]], ["data_wp", "sp", [-1, 4, 1]], ["data_hp", "sp", [-1, 4, 1]], ["bgemm_kp", "sp", [-1, 16]], ["bgemm_wp", "sp", [-1, 4, 4]], ["bgemm_hp", "sp", [-1, 1]]]}, "result": [[0.0015439872], 0, 75.43421697616577, 1618314937.6364126], "version": 0.2, "tvm_version": "0.8.dev0"}
{"input": ["opencl -keys=mali,opencl,gpu -device=mali -max_num_threads=256", "winograd_2", [1, 7, 7, 512, 512, 3, 3, [1, 1], [1, 1, 1, 1]], {}], "config": {"index": 243808, "code_hash": null, "entity": [["inv_cp", "sp", [-1, 8]], ["inv_wp", "sp", [-1, 4, 2]], ["inv_hp", "sp", [-1, 4, 2]], ["kernel_cp", "sp", [-1, 32]], ["kernel_kp", "sp", [-1, 2]], ["data_cp", "sp", [-1, 2]], ["data_wp", "sp", [-1, 4, 1]], ["data_hp", "sp", [-1, 4, 1]], ["bgemm_kp", "sp", [-1, 16]], ["bgemm_wp", "sp", [-1, 4, 4]], ["bgemm_hp", "sp", [-1, 1]]]}, "result": [[0.0014844245333333335], 0, 80.16951107978821, 1618314941.2131143], "version": 0.2, "tvm_version": "0.8.dev0"}
{"input": ["opencl -keys=mali,opencl,gpu -device=mali -max_num_threads=256", "winograd_2", [1, 7, 7, 512, 512, 3, 3, [1, 1], [1, 1, 1, 1]], {}], "config": {"index": 243752, "code_hash": null, "entity": [["inv_cp", "sp", [-1, 8]], ["inv_wp", "sp", [-1, 4, 2]], ["inv_hp", "sp", [-1, 4, 2]], ["kernel_cp", "sp", [-1, 8]], ["kernel_kp", "sp", [-1, 1]], ["data_cp", "sp", [-1, 2]], ["data_wp", "sp", [-1, 4, 1]], ["data_hp", "sp", [-1, 4, 1]], ["bgemm_kp", "sp", [-1, 16]], ["bgemm_wp", "sp", [-1, 4, 4]], ["bgemm_hp", "sp", [-1, 1]]]}, "result": [[0.0015520768], 0, 9.478398561477661, 1618314953.8647609], "version": 0.2, "tvm_version": "0.8.dev0"}
{"input": ["opencl -keys=mali,opencl,gpu -device=mali -max_num_threads=256", "winograd_2", [1, 7, 7, 512, 512, 3, 3, [1, 1], [1, 1, 1, 1]], {}], "config": {"index": 243773, "code_hash": null, "entity": [["inv_cp", "sp", [-1, 8]], ["inv_wp", "sp", [-1, 4, 2]], ["inv_hp", "sp", [-1, 4, 2]], ["kernel_cp", "sp", [-1, 1]], ["kernel_kp", "sp", [-1, 2]], ["data_cp", "sp", [-1, 2]], ["data_wp", "sp", [-1, 4, 1]], ["data_hp", "sp", [-1, 4, 1]], ["bgemm_kp", "sp", [-1, 16]], ["bgemm_wp", "sp", [-1, 4, 4]], ["bgemm_hp", "sp", [-1, 1]]]}, "result": [[0.0015430314666666665], 0, 12.69105339050293, 1618314957.4057727], "version": 0.2, "tvm_version": "0.8.dev0"}
{"input": ["opencl -keys=mali,opencl,gpu -device=mali -max_num_threads=256", "winograd_2", [1, 7, 7, 512, 512, 3, 3, [1, 1], [1, 1, 1, 1]], {}], "config": {"index": 243794, "code_hash": null, "entity": [["inv_cp", "sp", [-1, 8]], ["inv_wp", "sp", [-1, 4, 2]], ["inv_hp", "sp", [-1, 4, 2]], ["kernel_cp", "sp", [-1, 8]], ["kernel_kp", "sp", [-1, 2]], ["data_cp", "sp", [-1, 2]], ["data_wp", "sp", [-1, 4, 1]], ["data_hp", "sp", [-1, 4, 1]], ["bgemm_kp", "sp", [-1, 16]], ["bgemm_wp", "sp", [-1, 4, 4]], ["bgemm_hp", "sp", [-1, 1]]]}, "result": [[0.0015376383999999997], 0, 19.36198878288269, 1618314960.9722219], "version": 0.2, "tvm_version": "0.8.dev0"}
{"input": ["opencl -keys=mali,opencl,gpu -device=mali -max_num_threads=256", "winograd_2", [1, 7, 7, 512, 512, 3, 3, [1, 1], [1, 1, 1, 1]], {}], "config": {"index": 243857, "code_hash": null, "entity": [["inv_cp", "sp", [-1, 8]], ["inv_wp", "sp", [-1, 4, 2]], ["inv_hp", "sp", [-1, 4, 2]], ["kernel_cp", "sp", [-1, 1]], ["kernel_kp", "sp", [-1, 8]], ["data_cp", "sp", [-1, 2]], ["data_wp", "sp", [-1, 4, 1]], ["data_hp", "sp", [-1, 4, 1]], ["bgemm_kp", "sp", [-1, 16]], ["bgemm_wp", "sp", [-1, 4, 4]], ["bgemm_hp", "sp", [-1, 1]]]}, "result": [[0.0015248383999999999], 0, 22.2161545753479, 1618314964.7644153], "version": 0.2, "tvm_version": "0.8.dev0"}
{"input": ["opencl -keys=mali,opencl,gpu -device=mali -max_num_threads=256", "winograd_2", [1, 7, 7, 512, 512, 3, 3, [1, 1], [1, 1, 1, 1]], {}], "config": {"index": 243850, "code_hash": null, "entity": [["inv_cp", "sp", [-1, 8]], ["inv_wp", "sp", [-1, 4, 2]], ["inv_hp", "sp", [-1, 4, 2]], ["kernel_cp", "sp", [-1, 32]], ["kernel_kp", "sp", [-1, 4]], ["data_cp", "sp", [-1, 2]], ["data_wp", "sp", [-1, 4, 1]], ["data_hp", "sp", [-1, 4, 1]], ["bgemm_kp", "sp", [-1, 16]], ["bgemm_wp", "sp", [-1, 4, 4]], ["bgemm_hp", "sp", [-1, 1]]]}, "result": [[0.0014979071999999998], 0, 25.329099893569946, 1618314968.3840969], "version": 0.2, "tvm_version": "0.8.dev0"}
{"input": ["opencl -keys=mali,opencl,gpu -device=mali -max_num_threads=256", "winograd_2", [1, 7, 7, 512, 512, 3, 3, [1, 1], [1, 1, 1, 1]], {}], "config": {"index": 243836, "code_hash": null, "entity": [["inv_cp", "sp", [-1, 8]], ["inv_wp", "sp", [-1, 4, 2]], ["inv_hp", "sp", [-1, 4, 2]], ["kernel_cp", "sp", [-1, 8]], ["kernel_kp", "sp", [-1, 4]], ["data_cp", "sp", [-1, 2]], ["data_wp", "sp", [-1, 4, 1]], ["data_hp", "sp", [-1, 4, 1]], ["bgemm_kp", "sp", [-1, 16]], ["bgemm_wp", "sp", [-1, 4, 4]], ["bgemm_hp", "sp", [-1, 1]]]}, "result": [[0.0015693141333333333], 0, 32.86943173408508, 1618314975.5500004], "version": 0.2, "tvm_version": "0.8.dev0"}
{"input": ["opencl -keys=mali,opencl,gpu -device=mali -max_num_threads=256", "winograd_2", [1, 7, 7, 512, 512, 3, 3, [1, 1], [1, 1, 1, 1]], {}], "config": {"index": 243766, "code_hash": null, "entity": [["inv_cp", "sp", [-1, 8]], ["inv_wp", "sp", [-1, 4, 2]], ["inv_hp", "sp", [-1, 4, 2]], ["kernel_cp", "sp", [-1, 32]], ["kernel_kp", "sp", [-1, 1]], ["data_cp", "sp", [-1, 2]], ["data_wp", "sp", [-1, 4, 1]], ["data_hp", "sp", [-1, 4, 1]], ["bgemm_kp", "sp", [-1, 16]], ["bgemm_wp", "sp", [-1, 4, 4]], ["bgemm_hp", "sp", [-1, 1]]]}, "result": [[0.0015243946666666668], 0, 29.021512746810913, 1618314971.982305], "version": 0.2, "tvm_version": "0.8.dev0"}
{"input": ["opencl -keys=mali,opencl,gpu -device=mali -max_num_threads=256", "winograd_2", [1, 7, 7, 512, 512, 3, 3, [1, 1], [1, 1, 1, 1]], {}], "config": {"index": 243787, "code_hash": null, "entity": [["inv_cp", "sp", [-1, 8]], ["inv_wp", "sp", [-1, 4, 2]], ["inv_hp", "sp", [-1, 4, 2]], ["kernel_cp", "sp", [-1, 4]], ["kernel_kp", "sp", [-1, 2]], ["data_cp", "sp", [-1, 2]], ["data_wp", "sp", [-1, 4, 1]], ["data_hp", "sp", [-1, 4, 1]], ["bgemm_kp", "sp", [-1, 16]], ["bgemm_wp", "sp", [-1, 4, 4]], ["bgemm_hp", "sp", [-1, 1]]]}, "result": [[0.0015046144000000002], 0, 35.95901012420654, 1618314978.9554613], "version": 0.2, "tvm_version": "0.8.dev0"}
{"input": ["opencl -keys=mali,opencl,gpu -device=mali -max_num_threads=256", "winograd_2", [1, 7, 7, 512, 512, 3, 3, [1, 1], [1, 1, 1, 1]], {}], "config": {"index": 243780, "code_hash": null, "entity": [["inv_cp", "sp", [-1, 8]], ["inv_wp", "sp", [-1, 4, 2]], ["inv_hp", "sp", [-1, 4, 2]], ["kernel_cp", "sp", [-1, 2]], ["kernel_kp", "sp", [-1, 2]], ["data_cp", "sp", [-1, 2]], ["data_wp", "sp", [-1, 4, 1]], ["data_hp", "sp", [-1, 4, 1]], ["bgemm_kp", "sp", [-1, 16]], ["bgemm_wp", "sp", [-1, 4, 4]], ["bgemm_hp", "sp", [-1, 1]]]}, "result": [[0.0015482879999999999], 0, 39.70721220970154, 1618314982.5211604], "version": 0.2, "tvm_version": "0.8.dev0"}
{"input": ["opencl -keys=mali,opencl,gpu -device=mali -max_num_threads=256", "winograd_2", [1, 7, 7, 512, 512, 3, 3, [1, 1], [1, 1, 1, 1]], {}], "config": {"index": 243864, "code_hash": null, "entity": [["inv_cp", "sp", [-1, 8]], ["inv_wp", "sp", [-1, 4, 2]], ["inv_hp", "sp", [-1, 4, 2]], ["kernel_cp", "sp", [-1, 2]], ["kernel_kp", "sp", [-1, 8]], ["data_cp", "sp", [-1, 2]], ["data_wp", "sp", [-1, 4, 1]], ["data_hp", "sp", [-1, 4, 1]], ["bgemm_kp", "sp", [-1, 16]], ["bgemm_wp", "sp", [-1, 4, 4]], ["bgemm_hp", "sp", [-1, 1]]]}, "result": [[0.0015257600000000001], 0, 43.39599943161011, 1618314986.2671514], "version": 0.2, "tvm_version": "0.8.dev0"}
{"input": ["opencl -keys=mali,opencl,gpu -device=mali -max_num_threads=256", "winograd_2", [1, 7, 7, 512, 512, 3, 3, [1, 1], [1, 1, 1, 1]], {}], "config": {"index": 243801, "code_hash": null, "entity": [["inv_cp", "sp", [-1, 8]], ["inv_wp", "sp", [-1, 4, 2]], ["inv_hp", "sp", [-1, 4, 2]], ["kernel_cp", "sp", [-1, 16]], ["kernel_kp", "sp", [-1, 2]], ["data_cp", "sp", [-1, 2]], ["data_wp", "sp", [-1, 4, 1]], ["data_hp", "sp", [-1, 4, 1]], ["bgemm_kp", "sp", [-1, 16]], ["bgemm_wp", "sp", [-1, 4, 4]], ["bgemm_hp", "sp", [-1, 1]]]}, "result": [[0.001521698133333333], 0, 47.48726940155029, 1618314989.9294858], "version": 0.2, "tvm_version": "0.8.dev0"}
{"input": ["opencl -keys=mali,opencl,gpu -device=mali -max_num_threads=256", "winograd_2", [1, 7, 7, 512, 512, 3, 3, [1, 1], [1, 1, 1, 1]], {}], "config": {"index": 243913, "code_hash": null, "entity": [["inv_cp", "sp", [-1, 8]], ["inv_wp", "sp", [-1, 4, 2]], ["inv_hp", "sp", [-1, 4, 2]], ["kernel_cp", "sp", [-1, 4]], ["kernel_kp", "sp", [-1, 16]], ["data_cp", "sp", [-1, 2]], ["data_wp", "sp", [-1, 4, 1]], ["data_hp", "sp", [-1, 4, 1]], ["bgemm_kp", "sp", [-1, 16]], ["bgemm_wp", "sp", [-1, 4, 4]], ["bgemm_hp", "sp", [-1, 1]]]}, "result": [[0.0015736319999999995], 0, 51.140636682510376, 1618314993.5637805], "version": 0.2, "tvm_version": "0.8.dev0"}
{"input": ["opencl -keys=mali,opencl,gpu -device=mali -max_num_threads=256", "winograd_2", [1, 7, 7, 512, 512, 3, 3, [1, 1], [1, 1, 1, 1]], {}], "config": {"index": 243892, "code_hash": null, "entity": [["inv_cp", "sp", [-1, 8]], ["inv_wp", "sp", [-1, 4, 2]], ["inv_hp", "sp", [-1, 4, 2]], ["kernel_cp", "sp", [-1, 32]], ["kernel_kp", "sp", [-1, 8]], ["data_cp", "sp", [-1, 2]], ["data_wp", "sp", [-1, 4, 1]], ["data_hp", "sp", [-1, 4, 1]], ["bgemm_kp", "sp", [-1, 16]], ["bgemm_wp", "sp", [-1, 4, 4]], ["bgemm_hp", "sp", [-1, 1]]]}, "result": [[0.0015429632], 0, 54.24827289581299, 1618314997.2118566], "version": 0.2, "tvm_version": "0.8.dev0"}
{"input": ["opencl -keys=mali,opencl,gpu -device=mali -max_num_threads=256", "winograd_2", [1, 7, 7, 512, 512, 3, 3, [1, 1], [1, 1, 1, 1]], {}], "config": {"index": 243934, "code_hash": null, "entity": [["inv_cp", "sp", [-1, 8]], ["inv_wp", "sp", [-1, 4, 2]], ["inv_hp", "sp", [-1, 4, 2]], ["kernel_cp", "sp", [-1, 32]], ["kernel_kp", "sp", [-1, 16]], ["data_cp", "sp", [-1, 2]], ["data_wp", "sp", [-1, 4, 1]], ["data_hp", "sp", [-1, 4, 1]], ["bgemm_kp", "sp", [-1, 16]], ["bgemm_wp", "sp", [-1, 4, 4]], ["bgemm_hp", "sp", [-1, 1]]]}, "result": [[0.0014751914666666667], 0, 58.26064968109131, 1618315000.8959646], "version": 0.2, "tvm_version": "0.8.dev0"}
{"input": ["opencl -keys=mali,opencl,gpu -device=mali -max_num_threads=256", "winograd_2", [1, 7, 7, 512, 512, 3, 3, [1, 1], [1, 1, 1, 1]], {}], "config": {"index": 243885, "code_hash": null, "entity": [["inv_cp", "sp", [-1, 8]], ["inv_wp", "sp", [-1, 4, 2]], ["inv_hp", "sp", [-1, 4, 2]], ["kernel_cp", "sp", [-1, 16]], ["kernel_kp", "sp", [-1, 8]], ["data_cp", "sp", [-1, 2]], ["data_wp", "sp", [-1, 4, 1]], ["data_hp", "sp", [-1, 4, 1]], ["bgemm_kp", "sp", [-1, 16]], ["bgemm_wp", "sp", [-1, 4, 4]], ["bgemm_hp", "sp", [-1, 1]]]}, "result": [[0.0015254869333333335], 0, 62.1622154712677, 1618315004.5260313], "version": 0.2, "tvm_version": "0.8.dev0"}
{"input": ["opencl -keys=mali,opencl,gpu -device=mali -max_num_threads=256", "winograd_2", [1, 7, 7, 512, 512, 3, 3, [1, 1], [1, 1, 1, 1]], {}], "config": {"index": 243878, "code_hash": null, "entity": [["inv_cp", "sp", [-1, 8]], ["inv_wp", "sp", [-1, 4, 2]], ["inv_hp", "sp", [-1, 4, 2]], ["kernel_cp", "sp", [-1, 8]], ["kernel_kp", "sp", [-1, 8]], ["data_cp", "sp", [-1, 2]], ["data_wp", "sp", [-1, 4, 1]], ["data_hp", "sp", [-1, 4, 1]], ["bgemm_kp", "sp", [-1, 16]], ["bgemm_wp", "sp", [-1, 4, 4]], ["bgemm_hp", "sp", [-1, 1]]]}, "result": [[0.0015154005333333333], 0, 65.85379695892334, 1618315008.2483668], "version": 0.2, "tvm_version": "0.8.dev0"}
{"input": ["opencl -keys=mali,opencl,gpu -device=mali -max_num_threads=256", "winograd_2", [1, 7, 7, 512, 512, 3, 3, [1, 1], [1, 1, 1, 1]], {}], "config": {"index": 243843, "code_hash": null, "entity": [["inv_cp", "sp", [-1, 8]], ["inv_wp", "sp", [-1, 4, 2]], ["inv_hp", "sp", [-1, 4, 2]], ["kernel_cp", "sp", [-1, 16]], ["kernel_kp", "sp", [-1, 4]], ["data_cp", "sp", [-1, 2]], ["data_wp", "sp", [-1, 4, 1]], ["data_hp", "sp", [-1, 4, 1]], ["bgemm_kp", "sp", [-1, 16]], ["bgemm_wp", "sp", [-1, 4, 4]], ["bgemm_hp", "sp", [-1, 1]]]}, "result": [[0.0015427925333333335], 0, 69.3403115272522, 1618315011.981655], "version": 0.2, "tvm_version": "0.8.dev0"}
