test_and_tune/remote_tmali/Adreno640.wino3x3.log.tmp
{"input": ["opencl -keys=mali,opencl,gpu -device=mali -max_num_threads=256", "winograd_2", [1, 14, 14, 256, 256, 3, 3, [1, 1], [1, 1, 1, 1]], {}], "config": {"index": 1008719, "code_hash": null, "entity": [["inv_cp", "sp", [-1, 16]], ["inv_wp", "sp", [-1, 7, 2]], ["inv_hp", "sp", [-1, 7, 2]], ["kernel_cp", "sp", [-1, 16]], ["kernel_kp", "sp", [-1, 2]], ["data_cp", "sp", [-1, 4]], ["data_wp", "sp", [-1, 4, 1]], ["data_hp", "sp", [-1, 1, 1]], ["bgemm_kp", "sp", [-1, 32]], ["bgemm_wp", "sp", [-1, 4, 4]], ["bgemm_hp", "sp", [-1, 1]]]}, "result": [[0.0007299413333333332], 0, 10.194419145584106, 1618312226.2299452], "version": 0.2, "tvm_version": "0.8.dev0"}
{"input": ["opencl -keys=mali,opencl,gpu -device=mali -max_num_threads=256", "winograd_2", [1, 14, 14, 256, 256, 3, 3, [1, 1], [1, 1, 1, 1]], {}], "config": {"index": 217889, "code_hash": null, "entity": [["inv_cp", "sp", [-1, 16]], ["inv_wp", "sp", [-1, 4, 2]], ["inv_hp", "sp", [-1, 7, 2]], ["kernel_cp", "sp", [-1, 32]], ["kernel_kp", "sp", [-1, 1]], ["data_cp", "sp", [-1, 32]], ["data_wp", "sp", [-1, 4, 1]], ["data_hp", "sp", [-1, 4, 1]], ["bgemm_kp", "sp", [-1, 2]], ["bgemm_wp", "sp", [-1, 1, 4]], ["bgemm_hp", "sp", [-1, 1]]]}, "result": [[0.015055820799999996], 0, 9.72212529182434, 1618312228.097089], "version": 0.2, "tvm_version": "0.8.dev0"}
{"input": ["opencl -keys=mali,opencl,gpu -device=mali -max_num_threads=256", "winograd_2", [1, 14, 14, 256, 256, 3, 3, [1, 1], [1, 1, 1, 1]], {}], "config": {"index": 552089, "code_hash": null, "entity": [["inv_cp", "sp", [-1, 16]], ["inv_wp", "sp", [-1, 4, 2]], ["inv_hp", "sp", [-1, 7, 2]], ["kernel_cp", "sp", [-1, 16]], ["kernel_kp", "sp", [-1, 16]], ["data_cp", "sp", [-1, 2]], ["data_wp", "sp", [-1, 4, 1]], ["data_hp", "sp", [-1, 4, 1]], ["bgemm_kp", "sp", [-1, 32]], ["bgemm_wp", "sp", [-1, 2, 4]], ["bgemm_hp", "sp", [-1, 1]]]}, "result": [[0.0013098154666666664], 0, 10.923557043075562, 1618312229.3296106], "version": 0.2, "tvm_version": "0.8.dev0"}
{"input": ["opencl -keys=mali,opencl,gpu -device=mali -max_num_threads=256", "winograd_2", [1, 14, 14, 256, 256, 3, 3, [1, 1], [1, 1, 1, 1]], {}], "config": {"index": 102456, "code_hash": null, "entity": [["inv_cp", "sp", [-1, 32]], ["inv_wp", "sp", [-1, 4, 2]], ["inv_hp", "sp", [-1, 4, 2]], ["kernel_cp", "sp", [-1, 4]], ["kernel_kp", "sp", [-1, 4]], ["data_cp", "sp", [-1, 8]], ["data_wp", "sp", [-1, 7, 1]], ["data_hp", "sp", [-1, 1, 1]], ["bgemm_kp", "sp", [-1, 1]], ["bgemm_wp", "sp", [-1, 1, 4]], ["bgemm_hp", "sp", [-1, 1]]]}, "result": [[0.02803145386666667], 0, 16.665648221969604, 1618312232.0128343], "version": 0.2, "tvm_version": "0.8.dev0"}
{"input": ["opencl -keys=mali,opencl,gpu -device=mali -max_num_threads=256", "winograd_2", [1, 14, 14, 256, 256, 3, 3, [1, 1], [1, 1, 1, 1]], {}], "config": {"index": 51917, "code_hash": null, "entity": [["inv_cp", "sp", [-1, 16]], ["inv_wp", "sp", [-1, 4, 2]], ["inv_hp", "sp", [-1, 4, 2]], ["kernel_cp", "sp", [-1, 4]], ["kernel_kp", "sp", [-1, 32]], ["data_cp", "sp", [-1, 32]], ["data_wp", "sp", [-1, 4, 1]], ["data_hp", "sp", [-1, 4, 1]], ["bgemm_kp", "sp", [-1, 32]], ["bgemm_wp", "sp", [-1, 1, 4]], ["bgemm_hp", "sp", [-1, 1]]]}, "result": [[0.0012666197333333332], 0, 14.741463899612427, 1618312233.1894279], "version": 0.2, "tvm_version": "0.8.dev0"}
{"input": ["opencl -keys=mali,opencl,gpu -device=mali -max_num_threads=256", "winograd_2", [1, 14, 14, 256, 256, 3, 3, [1, 1], [1, 1, 1, 1]], {}], "config": {"index": 1257601, "code_hash": null, "entity": [["inv_cp", "sp", [-1, 2]], ["inv_wp", "sp", [-1, 4, 2]], ["inv_hp", "sp", [-1, 4, 2]], ["kernel_cp", "sp", [-1, 2]], ["kernel_kp", "sp", [-1, 4]], ["data_cp", "sp", [-1, 4]], ["data_wp", "sp", [-1, 4, 1]], ["data_hp", "sp", [-1, 1, 1]], ["bgemm_kp", "sp", [-1, 4]], ["bgemm_wp", "sp", [-1, 4, 4]], ["bgemm_hp", "sp", [-1, 1]]]}, "result": [[0.0022541824], 0, 17.90686273574829, 1618312234.3899672], "version": 0.2, "tvm_version": "0.8.dev0"}
{"input": ["opencl -keys=mali,opencl,gpu -device=mali -max_num_threads=256", "winograd_2", [1, 14, 14, 256, 256, 3, 3, [1, 1], [1, 1, 1, 1]], {}], "config": {"index": 1083814, "code_hash": null, "entity": [["inv_cp", "sp", [-1, 8]], ["inv_wp", "sp", [-1, 7, 2]], ["inv_hp", "sp", [-1, 7, 2]], ["kernel_cp", "sp", [-1, 2]], ["kernel_kp", "sp", [-1, 2]], ["data_cp", "sp", [-1, 32]], ["data_wp", "sp", [-1, 2, 1]], ["data_hp", "sp", [-1, 1, 1]], ["bgemm_kp", "sp", [-1, 1]], ["bgemm_wp", "sp", [-1, 4, 4]], ["bgemm_hp", "sp", [-1, 1]]]}, "result": [[0.008464401066666665], 0, 11.170189619064331, 1618312246.0726593], "version": 0.2, "tvm_version": "0.8.dev0"}
{"input": ["opencl -keys=mali,opencl,gpu -device=mali -max_num_threads=256", "winograd_2", [1, 14, 14, 256, 256, 3, 3, [1, 1], [1, 1, 1, 1]], {}], "config": {"index": 2041058, "code_hash": null, "entity": [["inv_cp", "sp", [-1, 64]], ["inv_wp", "sp", [-1, 4, 2]], ["inv_hp", "sp", [-1, 4, 2]], ["kernel_cp", "sp", [-1, 32]], ["kernel_kp", "sp", [-1, 2]], ["data_cp", "sp", [-1, 8]], ["data_wp", "sp", [-1, 2, 1]], ["data_hp", "sp", [-1, 4, 1]], ["bgemm_kp", "sp", [-1, 32]], ["bgemm_wp", "sp", [-1, 13, 4]], ["bgemm_hp", "sp", [-1, 1]]]}, "result": [[0.0005924352], 0, 10.557623624801636, 1618312247.268061], "version": 0.2, "tvm_version": "0.8.dev0"}
{"input": ["opencl -keys=mali,opencl,gpu -device=mali -max_num_threads=256", "winograd_2", [1, 14, 14, 256, 256, 3, 3, [1, 1], [1, 1, 1, 1]], {}], "config": {"index": 502288, "code_hash": null, "entity": [["inv_cp", "sp", [-1, 8]], ["inv_wp", "sp", [-1, 4, 2]], ["inv_hp", "sp", [-1, 7, 2]], ["kernel_cp", "sp", [-1, 32]], ["kernel_kp", "sp", [-1, 2]], ["data_cp", "sp", [-1, 16]], ["data_wp", "sp", [-1, 1, 1]], ["data_hp", "sp", [-1, 1, 1]], ["bgemm_kp", "sp", [-1, 32]], ["bgemm_wp", "sp", [-1, 2, 4]], ["bgemm_hp", "sp", [-1, 1]]]}, "result": [[0.0012950698666666669], 0, 13.43100118637085, 1618312248.419011], "version": 0.2, "tvm_version": "0.8.dev0"}
{"input": ["opencl -keys=mali,opencl,gpu -device=mali -max_num_threads=256", "winograd_2", [1, 14, 14, 256, 256, 3, 3, [1, 1], [1, 1, 1, 1]], {}], "config": {"index": 1161672, "code_hash": null, "entity": [["inv_cp", "sp", [-1, 32]], ["inv_wp", "sp", [-1, 4, 2]], ["inv_hp", "sp", [-1, 4, 2]], ["kernel_cp", "sp", [-1, 1]], ["kernel_kp", "sp", [-1, 4]], ["data_cp", "sp", [-1, 32]], ["data_wp", "sp", [-1, 1, 1]], ["data_hp", "sp", [-1, 1, 1]], ["bgemm_kp", "sp", [-1, 2]], ["bgemm_wp", "sp", [-1, 4, 4]], ["bgemm_hp", "sp", [-1, 1]]]}, "result": [[0.004368196266666667], 0, 13.483950138092041, 1618312249.7453623], "version": 0.2, "tvm_version": "0.8.dev0"}
{"input": ["opencl -keys=mali,opencl,gpu -device=mali -max_num_threads=256", "winograd_2", [1, 14, 14, 256, 256, 3, 3, [1, 1], [1, 1, 1, 1]], {}], "config": {"index": 2132052, "code_hash": null, "entity": [["inv_cp", "sp", [-1, 32]], ["inv_wp", "sp", [-1, 4, 2]], ["inv_hp", "sp", [-1, 7, 2]], ["kernel_cp", "sp", [-1, 16]], ["kernel_kp", "sp", [-1, 4]], ["data_cp", "sp", [-1, 1]], ["data_wp", "sp", [-1, 7, 1]], ["data_hp", "sp", [-1, 4, 1]], ["bgemm_kp", "sp", [-1, 1]], ["bgemm_wp", "sp", [-1, 13, 4]], ["bgemm_hp", "sp", [-1, 1]]]}, "result": [[0.0021259093333333336], 0, 14.550544261932373, 1618312251.0435984], "version": 0.2, "tvm_version": "0.8.dev0"}
{"input": ["opencl -keys=mali,opencl,gpu -device=mali -max_num_threads=256", "winograd_2", [1, 14, 14, 256, 256, 3, 3, [1, 1], [1, 1, 1, 1]], {}], "config": {"index": 1786375, "code_hash": null, "entity": [["inv_cp", "sp", [-1, 2]], ["inv_wp", "sp", [-1, 7, 2]], ["inv_hp", "sp", [-1, 4, 2]], ["kernel_cp", "sp", [-1, 2]], ["kernel_kp", "sp", [-1, 4]], ["data_cp", "sp", [-1, 4]], ["data_wp", "sp", [-1, 1, 1]], ["data_hp", "sp", [-1, 4, 1]], ["bgemm_kp", "sp", [-1, 4]], ["bgemm_wp", "sp", [-1, 8, 4]], ["bgemm_hp", "sp", [-1, 1]]]}, "result": [[0.0011596629333333335], 0, 14.551590919494629, 1618312252.232639], "version": 0.2, "tvm_version": "0.8.dev0"}
{"input": ["opencl -keys=mali,opencl,gpu -device=mali -max_num_threads=256", "winograd_2", [1, 14, 14, 256, 256, 3, 3, [1, 1], [1, 1, 1, 1]], {}], "config": {"index": 1210392, "code_hash": null, "entity": [["inv_cp", "sp", [-1, 32]], ["inv_wp", "sp", [-1, 4, 2]], ["inv_hp", "sp", [-1, 4, 2]], ["kernel_cp", "sp", [-1, 4]], ["kernel_kp", "sp", [-1, 16]], ["data_cp", "sp", [-1, 2]], ["data_wp", "sp", [-1, 2, 1]], ["data_hp", "sp", [-1, 4, 1]], ["bgemm_kp", "sp", [-1, 2]], ["bgemm_wp", "sp", [-1, 4, 4]], ["bgemm_hp", "sp", [-1, 1]]]}, "result": [[0.0043729408], 0, 16.935762405395508, 1618312253.5482123], "version": 0.2, "tvm_version": "0.8.dev0"}
{"input": ["opencl -keys=mali,opencl,gpu -device=mali -max_num_threads=256", "winograd_2", [1, 14, 14, 256, 256, 3, 3, [1, 1], [1, 1, 1, 1]], {}], "config": {"index": 1131373, "code_hash": null, "entity": [["inv_cp", "sp", [-1, 2]], ["inv_wp", "sp", [-1, 4, 2]], ["inv_hp", "sp", [-1, 7, 2]], ["kernel_cp", "sp", [-1, 8]], ["kernel_kp", "sp", [-1, 2]], ["data_cp", "sp", [-1, 1]], ["data_wp", "sp", [-1, 4, 1]], ["data_hp", "sp", [-1, 4, 1]], ["bgemm_kp", "sp", [-1, 1]], ["bgemm_wp", "sp", [-1, 4, 4]], ["bgemm_hp", "sp", [-1, 1]]]}, "result": [[0.0085244416], 0, 8.039909601211548, 1618312265.1751869], "version": 0.2, "tvm_version": "0.8.dev0"}
{"input": ["opencl -keys=mali,opencl,gpu -device=mali -max_num_threads=256", "winograd_2", [1, 14, 14, 256, 256, 3, 3, [1, 1], [1, 1, 1, 1]], {}], "config": {"index": 148269, "code_hash": null, "entity": [["inv_cp", "sp", [-1, 4]], ["inv_wp", "sp", [-1, 7, 2]], ["inv_hp", "sp", [-1, 7, 2]], ["kernel_cp", "sp", [-1, 4]], ["kernel_kp", "sp", [-1, 4]], ["data_cp", "sp", [-1, 4]], ["data_wp", "sp", [-1, 1, 1]], ["data_hp", "sp", [-1, 7, 1]], ["bgemm_kp", "sp", [-1, 1]], ["bgemm_wp", "sp", [-1, 1, 4]], ["bgemm_hp", "sp", [-1, 1]]]}, "result": [[0.02786049706666667], 0, 13.866759777069092, 1618312267.7387106], "version": 0.2, "tvm_version": "0.8.dev0"}
{"input": ["opencl -keys=mali,opencl,gpu -device=mali -max_num_threads=256", "winograd_2", [1, 14, 14, 256, 256, 3, 3, [1, 1], [1, 1, 1, 1]], {}], "config": {"index": 1680121, "code_hash": null, "entity": [["inv_cp", "sp", [-1, 2]], ["inv_wp", "sp", [-1, 4, 2]], ["inv_hp", "sp", [-1, 4, 2]], ["kernel_cp", "sp", [-1, 4]], ["kernel_kp", "sp", [-1, 4]], ["data_cp", "sp", [-1, 32]], ["data_wp", "sp", [-1, 1, 1]], ["data_hp", "sp", [-1, 2, 1]], ["bgemm_kp", "sp", [-1, 2]], ["bgemm_wp", "sp", [-1, 8, 4]], ["bgemm_hp", "sp", [-1, 1]]]}, "result": [[0.0021563562666666665], 0, 14.947783946990967, 1618312269.003764], "version": 0.2, "tvm_version": "0.8.dev0"}
{"input": ["opencl -keys=mali,opencl,gpu -device=mali -max_num_threads=256", "winograd_2", [1, 14, 14, 256, 256, 3, 3, [1, 1], [1, 1, 1, 1]], {}], "config": {"index": 516074, "code_hash": null, "entity": [["inv_cp", "sp", [-1, 64]], ["inv_wp", "sp", [-1, 4, 2]], ["inv_hp", "sp", [-1, 4, 2]], ["kernel_cp", "sp", [-1, 16]], ["kernel_kp", "sp", [-1, 1]], ["data_cp", "sp", [-1, 4]], ["data_wp", "sp", [-1, 7, 1]], ["data_hp", "sp", [-1, 1, 1]], ["bgemm_kp", "sp", [-1, 32]], ["bgemm_wp", "sp", [-1, 2, 4]], ["bgemm_hp", "sp", [-1, 1]]]}, "result": [[0.0013237759999999998], 0, 15.763112545013428, 1618312270.3807642], "version": 0.2, "tvm_version": "0.8.dev0"}
{"input": ["opencl -keys=mali,opencl,gpu -device=mali -max_num_threads=256", "winograd_2", [1, 14, 14, 256, 256, 3, 3, [1, 1], [1, 1, 1, 1]], {}], "config": {"index": 1876897, "code_hash": null, "entity": [["inv_cp", "sp", [-1, 2]], ["inv_wp", "sp", [-1, 4, 2]], ["inv_hp", "sp", [-1, 4, 2]], ["kernel_cp", "sp", [-1, 32]], ["kernel_kp", "sp", [-1, 2]], ["data_cp", "sp", [-1, 32]], ["data_wp", "sp", [-1, 4, 1]], ["data_hp", "sp", [-1, 4, 1]], ["bgemm_kp", "sp", [-1, 8]], ["bgemm_wp", "sp", [-1, 8, 4]], ["bgemm_hp", "sp", [-1, 1]]]}, "result": [[0.0006758912], 0, 14.037696838378906, 1618312271.5150318], "version": 0.2, "tvm_version": "0.8.dev0"}
{"input": ["opencl -keys=mali,opencl,gpu -device=mali -max_num_threads=256", "winograd_2", [1, 14, 14, 256, 256, 3, 3, [1, 1], [1, 1, 1, 1]], {}], "config": {"index": 930553, "code_hash": null, "entity": [["inv_cp", "sp", [-1, 2]], ["inv_wp", "sp", [-1, 4, 2]], ["inv_hp", "sp", [-1, 4, 2]], ["kernel_cp", "sp", [-1, 1]], ["kernel_kp", "sp", [-1, 32]], ["data_cp", "sp", [-1, 4]], ["data_wp", "sp", [-1, 7, 1]], ["data_hp", "sp", [-1, 1, 1]], ["bgemm_kp", "sp", [-1, 16]], ["bgemm_wp", "sp", [-1, 2, 4]], ["bgemm_hp", "sp", [-1, 1]]]}, "result": [[0.0012292949333333333], 0, 18.734230518341064, 1618312272.657404], "version": 0.2, "tvm_version": "0.8.dev0"}
{"input": ["opencl -keys=mali,opencl,gpu -device=mali -max_num_threads=256", "winograd_2", [1, 14, 14, 256, 256, 3, 3, [1, 1], [1, 1, 1, 1]], {}], "config": {"index": 1675912, "code_hash": null, "entity": [["inv_cp", "sp", [-1, 8]], ["inv_wp", "sp", [-1, 4, 2]], ["inv_hp", "sp", [-1, 7, 2]], ["kernel_cp", "sp", [-1, 1]], ["kernel_kp", "sp", [-1, 8]], ["data_cp", "sp", [-1, 1]], ["data_wp", "sp", [-1, 7, 1]], ["data_hp", "sp", [-1, 1, 1]], ["bgemm_kp", "sp", [-1, 2]], ["bgemm_wp", "sp", [-1, 8, 4]], ["bgemm_hp", "sp", [-1, 1]]]}, "result": [[0.0021872810666666662], 0, 18.79575276374817, 1618312273.8604634], "version": 0.2, "tvm_version": "0.8.dev0"}
{"input": ["opencl -keys=mali,opencl,gpu -device=mali -max_num_threads=256", "winograd_2", [1, 14, 14, 256, 256, 3, 3, [1, 1], [1, 1, 1, 1]], {}], "config": {"index": 304213, "code_hash": null, "entity": [["inv_cp", "sp", [-1, 2]], ["inv_wp", "sp", [-1, 4, 2]], ["inv_hp", "sp", [-1, 7, 2]], ["kernel_cp", "sp", [-1, 4]], ["kernel_kp", "sp", [-1, 32]], ["data_cp", "sp", [-1, 8]], ["data_wp", "sp", [-1, 4, 1]], ["data_hp", "sp", [-1, 4, 1]], ["bgemm_kp", "sp", [-1, 4]], ["bgemm_wp", "sp", [-1, 1, 4]], ["bgemm_hp", "sp", [-1, 1]]]}, "result": [[0.0080933376], 0, 17.86081099510193, 1618312275.3931966], "version": 0.2, "tvm_version": "0.8.dev0"}
{"input": ["opencl -keys=mali,opencl,gpu -device=mali -max_num_threads=256", "winograd_2", [1, 14, 14, 256, 256, 3, 3, [1, 1], [1, 1, 1, 1]], {}], "config": {"index": 2205603, "code_hash": null, "entity": [["inv_cp", "sp", [-1, 4]], ["inv_wp", "sp", [-1, 4, 2]], ["inv_hp", "sp", [-1, 4, 2]], ["kernel_cp", "sp", [-1, 8]], ["kernel_kp", "sp", [-1, 8]], ["data_cp", "sp", [-1, 2]], ["data_wp", "sp", [-1, 2, 1]], ["data_hp", "sp", [-1, 4, 1]], ["bgemm_kp", "sp", [-1, 2]], ["bgemm_wp", "sp", [-1, 13, 4]], ["bgemm_hp", "sp", [-1, 1]]]}, "result": [[0.0011251541333333333], 0, 20.542137622833252, 1618312276.5899985], "version": 0.2, "tvm_version": "0.8.dev0"}
{"input": ["opencl -keys=mali,opencl,gpu -device=mali -max_num_threads=256", "winograd_2", [1, 14, 14, 256, 256, 3, 3, [1, 1], [1, 1, 1, 1]], {}], "config": {"index": 680890, "code_hash": null, "entity": [["inv_cp", "sp", [-1, 8]], ["inv_wp", "sp", [-1, 7, 2]], ["inv_hp", "sp", [-1, 4, 2]], ["kernel_cp", "sp", [-1, 2]], ["kernel_kp", "sp", [-1, 32]], ["data_cp", "sp", [-1, 2]], ["data_wp", "sp", [-1, 7, 1]], ["data_hp", "sp", [-1, 1, 1]], ["bgemm_kp", "sp", [-1, 2]], ["bgemm_wp", "sp", [-1, 2, 4]], ["bgemm_hp", "sp", [-1, 1]]]}, "result": [[0.0074070016], 0, 23.62663459777832, 1618312278.107511], "version": 0.2, "tvm_version": "0.8.dev0"}
{"input": ["opencl -keys=mali,opencl,gpu -device=mali -max_num_threads=256", "winograd_2", [1, 14, 14, 256, 256, 3, 3, [1, 1], [1, 1, 1, 1]], {}], "config": {"index": 1819483, "code_hash": null, "entity": [["inv_cp", "sp", [-1, 2]], ["inv_wp", "sp", [-1, 7, 2]], ["inv_hp", "sp", [-1, 7, 2]], ["kernel_cp", "sp", [-1, 1]], ["kernel_kp", "sp", [-1, 16]], ["data_cp", "sp", [-1, 16]], ["data_wp", "sp", [-1, 4, 1]], ["data_hp", "sp", [-1, 7, 1]], ["bgemm_kp", "sp", [-1, 4]], ["bgemm_wp", "sp", [-1, 8, 4]], ["bgemm_hp", "sp", [-1, 1]]]}, "result": [[0.0011420842666666666], 0, 24.821547508239746, 1618312279.3045409], "version": 0.2, "tvm_version": "0.8.dev0"}
{"input": ["opencl -keys=mali,opencl,gpu -device=mali -max_num_threads=256", "winograd_2", [1, 14, 14, 256, 256, 3, 3, [1, 1], [1, 1, 1, 1]], {}], "config": {"index": 173661, "code_hash": null, "entity": [["inv_cp", "sp", [-1, 4]], ["inv_wp", "sp", [-1, 7, 2]], ["inv_hp", "sp", [-1, 7, 2]], ["kernel_cp", "sp", [-1, 16]], ["kernel_kp", "sp", [-1, 16]], ["data_cp", "sp", [-1, 2]], ["data_wp", "sp", [-1, 2, 1]], ["data_hp", "sp", [-1, 1, 1]], ["bgemm_kp", "sp", [-1, 2]], ["bgemm_wp", "sp", [-1, 1, 4]], ["bgemm_hp", "sp", [-1, 1]]]}, "result": [[0.014796543999999998], 0, 26.400683403015137, 1618312281.166826], "version": 0.2, "tvm_version": "0.8.dev0"}
{"input": ["opencl -keys=mali,opencl,gpu -device=mali -max_num_threads=256", "winograd_2", [1, 14, 14, 256, 256, 3, 3, [1, 1], [1, 1, 1, 1]], {}], "config": {"index": 573300, "code_hash": null, "entity": [["inv_cp", "sp", [-1, 32]], ["inv_wp", "sp", [-1, 4, 2]], ["inv_hp", "sp", [-1, 7, 2]], ["kernel_cp", "sp", [-1, 1]], ["kernel_kp", "sp", [-1, 4]], ["data_cp", "sp", [-1, 4]], ["data_wp", "sp", [-1, 4, 1]], ["data_hp", "sp", [-1, 7, 1]], ["bgemm_kp", "sp", [-1, 32]], ["bgemm_wp", "sp", [-1, 2, 4]], ["bgemm_hp", "sp", [-1, 1]]]}, "result": [[0.0013933909333333331], 0, 8.737393856048584, 1618312291.7782502], "version": 0.2, "tvm_version": "0.8.dev0"}
{"input": ["opencl -keys=mali,opencl,gpu -device=mali -max_num_threads=256", "winograd_2", [1, 14, 14, 256, 256, 3, 3, [1, 1], [1, 1, 1, 1]], {}], "config": {"index": 575007, "code_hash": null, "entity": [["inv_cp", "sp", [-1, 4]], ["inv_wp", "sp", [-1, 4, 2]], ["inv_hp", "sp", [-1, 7, 2]], ["kernel_cp", "sp", [-1, 32]], ["kernel_kp", "sp", [-1, 4]], ["data_cp", "sp", [-1, 16]], ["data_wp", "sp", [-1, 4, 1]], ["data_hp", "sp", [-1, 7, 1]], ["bgemm_kp", "sp", [-1, 32]], ["bgemm_wp", "sp", [-1, 2, 4]], ["bgemm_hp", "sp", [-1, 1]]]}, "result": [[0.0012115285333333331], 0, 9.698037385940552, 1618312292.944674], "version": 0.2, "tvm_version": "0.8.dev0"}
{"input": ["opencl -keys=mali,opencl,gpu -device=mali -max_num_threads=256", "winograd_2", [1, 14, 14, 256, 256, 3, 3, [1, 1], [1, 1, 1, 1]], {}], "config": {"index": 212939, "code_hash": null, "entity": [["inv_cp", "sp", [-1, 16]], ["inv_wp", "sp", [-1, 7, 2]], ["inv_hp", "sp", [-1, 4, 2]], ["kernel_cp", "sp", [-1, 8]], ["kernel_kp", "sp", [-1, 2]], ["data_cp", "sp", [-1, 32]], ["data_wp", "sp", [-1, 2, 1]], ["data_hp", "sp", [-1, 4, 1]], ["bgemm_kp", "sp", [-1, 2]], ["bgemm_wp", "sp", [-1, 1, 4]], ["bgemm_hp", "sp", [-1, 1]]]}, "result": [[0.015236505599999998], 0, 9.116328001022339, 1618312294.8307495], "version": 0.2, "tvm_version": "0.8.dev0"}
{"input": ["opencl -keys=mali,opencl,gpu -device=mali -max_num_threads=256", "winograd_2", [1, 14, 14, 256, 256, 3, 3, [1, 1], [1, 1, 1, 1]], {}], "config": {"index": 895378, "code_hash": null, "entity": [["inv_cp", "sp", [-1, 8]], ["inv_wp", "sp", [-1, 7, 2]], ["inv_hp", "sp", [-1, 4, 2]], ["kernel_cp", "sp", [-1, 16]], ["kernel_kp", "sp", [-1, 1]], ["data_cp", "sp", [-1, 8]], ["data_wp", "sp", [-1, 1, 1]], ["data_hp", "sp", [-1, 7, 1]], ["bgemm_kp", "sp", [-1, 8]], ["bgemm_wp", "sp", [-1, 2, 4]], ["bgemm_hp", "sp", [-1, 1]]]}, "result": [[0.0020165290666666665], 0, 14.40217399597168, 1618312296.0754387], "version": 0.2, "tvm_version": "0.8.dev0"}
{"input": ["opencl -keys=mali,opencl,gpu -device=mali -max_num_threads=256", "winograd_2", [1, 14, 14, 256, 256, 3, 3, [1, 1], [1, 1, 1, 1]], {}], "config": {"index": 2046813, "code_hash": null, "entity": [["inv_cp", "sp", [-1, 4]], ["inv_wp", "sp", [-1, 7, 2]], ["inv_hp", "sp", [-1, 7, 2]], ["kernel_cp", "sp", [-1, 16]], ["kernel_kp", "sp", [-1, 16]], ["data_cp", "sp", [-1, 8]], ["data_wp", "sp", [-1, 4, 1]], ["data_hp", "sp", [-1, 4, 1]], ["bgemm_kp", "sp", [-1, 32]], ["bgemm_wp", "sp", [-1, 13, 4]], ["bgemm_hp", "sp", [-1, 1]]]}, "result": [[0.0005919061333333332], 0, 12.287320137023926, 1618312297.3569956], "version": 0.2, "tvm_version": "0.8.dev0"}
{"input": ["opencl -keys=mali,opencl,gpu -device=mali -max_num_threads=256", "winograd_2", [1, 14, 14, 256, 256, 3, 3, [1, 1], [1, 1, 1, 1]], {}], "config": {"index": 1141420, "code_hash": null, "entity": [["inv_cp", "sp", [-1, 8]], ["inv_wp", "sp", [-1, 4, 2]], ["inv_hp", "sp", [-1, 4, 2]], ["kernel_cp", "sp", [-1, 4]], ["kernel_kp", "sp", [-1, 32]], ["data_cp", "sp", [-1, 1]], ["data_wp", "sp", [-1, 1, 1]], ["data_hp", "sp", [-1, 7, 1]], ["bgemm_kp", "sp", [-1, 1]], ["bgemm_wp", "sp", [-1, 4, 4]], ["bgemm_hp", "sp", [-1, 1]]]}, "result": [[0.008614911999999999], 0, 17.428953170776367, 1618312298.974293], "version": 0.2, "tvm_version": "0.8.dev0"}
{"input": ["opencl -keys=mali,opencl,gpu -device=mali -max_num_threads=256", "winograd_2", [1, 14, 14, 256, 256, 3, 3, [1, 1], [1, 1, 1, 1]], {}], "config": {"index": 2125929, "code_hash": null, "entity": [["inv_cp", "sp", [-1, 4]], ["inv_wp", "sp", [-1, 7, 2]], ["inv_hp", "sp", [-1, 4, 2]], ["kernel_cp", "sp", [-1, 2]], ["kernel_kp", "sp", [-1, 4]], ["data_cp", "sp", [-1, 32]], ["data_wp", "sp", [-1, 4, 1]], ["data_hp", "sp", [-1, 4, 1]], ["bgemm_kp", "sp", [-1, 1]], ["bgemm_wp", "sp", [-1, 13, 4]], ["bgemm_hp", "sp", [-1, 1]]]}, "result": [[0.0021207381333333336], 0, 13.668300867080688, 1618312300.1331348], "version": 0.2, "tvm_version": "0.8.dev0"}
{"input": ["opencl -keys=mali,opencl,gpu -device=mali -max_num_threads=256", "winograd_2", [1, 14, 14, 256, 256, 3, 3, [1, 1], [1, 1, 1, 1]], {}], "config": {"index": 575299, "code_hash": null, "entity": [["inv_cp", "sp", [-1, 2]], ["inv_wp", "sp", [-1, 7, 2]], ["inv_hp", "sp", [-1, 7, 2]], ["kernel_cp", "sp", [-1, 32]], ["kernel_kp", "sp", [-1, 16]], ["data_cp", "sp", [-1, 16]], ["data_wp", "sp", [-1, 4, 1]], ["data_hp", "sp", [-1, 7, 1]], ["bgemm_kp", "sp", [-1, 32]], ["bgemm_wp", "sp", [-1, 2, 4]], ["bgemm_hp", "sp", [-1, 1]]]}, "result": [[0.0013635413333333332], 0, 19.5837562084198, 1618312301.4996536], "version": 0.2, "tvm_version": "0.8.dev0"}
{"input": ["opencl -keys=mali,opencl,gpu -device=mali -max_num_threads=256", "winograd_2", [1, 14, 14, 256, 256, 3, 3, [1, 1], [1, 1, 1, 1]], {}], "config": {"index": 1240043, "code_hash": null, "entity": [["inv_cp", "sp", [-1, 16]], ["inv_wp", "sp", [-1, 7, 2]], ["inv_hp", "sp", [-1, 4, 2]], ["kernel_cp", "sp", [-1, 2]], ["kernel_kp", "sp", [-1, 1]], ["data_cp", "sp", [-1, 1]], ["data_wp", "sp", [-1, 7, 1]], ["data_hp", "sp", [-1, 7, 1]], ["bgemm_kp", "sp", [-1, 2]], ["bgemm_wp", "sp", [-1, 4, 4]], ["bgemm_hp", "sp", [-1, 1]]]}, "result": [[0.0043706368], 0, 21.38366436958313, 1618312302.8312426], "version": 0.2, "tvm_version": "0.8.dev0"}
{"input": ["opencl -keys=mali,opencl,gpu -device=mali -max_num_threads=256", "winograd_2", [1, 14, 14, 256, 256, 3, 3, [1, 1], [1, 1, 1, 1]], {}], "config": {"index": 1738229, "code_hash": null, "entity": [["inv_cp", "sp", [-1, 16]], ["inv_wp", "sp", [-1, 4, 2]], ["inv_hp", "sp", [-1, 4, 2]], ["kernel_cp", "sp", [-1, 32]], ["kernel_kp", "sp", [-1, 16]], ["data_cp", "sp", [-1, 1]], ["data_wp", "sp", [-1, 7, 1]], ["data_hp", "sp", [-1, 7, 1]], ["bgemm_kp", "sp", [-1, 2]], ["bgemm_wp", "sp", [-1, 8, 4]], ["bgemm_hp", "sp", [-1, 1]]]}, "result": [[0.0021615104], 0, 21.63756799697876, 1618312304.0663147], "version": 0.2, "tvm_version": "0.8.dev0"}
{"input": ["opencl -keys=mali,opencl,gpu -device=mali -max_num_threads=256", "winograd_2", [1, 14, 14, 256, 256, 3, 3, [1, 1], [1, 1, 1, 1]], {}], "config": {"index": 403957, "code_hash": null, "entity": [["inv_cp", "sp", [-1, 2]], ["inv_wp", "sp", [-1, 4, 2]], ["inv_hp", "sp", [-1, 7, 2]], ["kernel_cp", "sp", [-1, 1]], ["kernel_kp", "sp", [-1, 4]], ["data_cp", "sp", [-1, 16]], ["data_wp", "sp", [-1, 2, 1]], ["data_hp", "sp", [-1, 7, 1]], ["bgemm_kp", "sp", [-1, 8]], ["bgemm_wp", "sp", [-1, 1, 4]], ["bgemm_hp", "sp", [-1, 1]]]}, "result": [[0.0037658794666666673], 0, 23.11619806289673, 1618312305.4709408], "version": 0.2, "tvm_version": "0.8.dev0"}
{"input": ["opencl -keys=mali,opencl,gpu -device=mali -max_num_threads=256", "winograd_2", [1, 14, 14, 256, 256, 3, 3, [1, 1], [1, 1, 1, 1]], {}], "config": {"index": 240389, "code_hash": null, "entity": [["inv_cp", "sp", [-1, 16]], ["inv_wp", "sp", [-1, 4, 2]], ["inv_hp", "sp", [-1, 4, 2]], ["kernel_cp", "sp", [-1, 2]], ["kernel_kp", "sp", [-1, 1]], ["data_cp", "sp", [-1, 2]], ["data_wp", "sp", [-1, 4, 1]], ["data_hp", "sp", [-1, 7, 1]], ["bgemm_kp", "sp", [-1, 2]], ["bgemm_wp", "sp", [-1, 1, 4]], ["bgemm_hp", "sp", [-1, 1]]]}, "result": [[0.014563327999999997], 0, 24.266878604888916, 1618312307.576472], "version": 0.2, "tvm_version": "0.8.dev0"}
{"input": ["opencl -keys=mali,opencl,gpu -device=mali -max_num_threads=256", "winograd_2", [1, 14, 14, 256, 256, 3, 3, [1, 1], [1, 1, 1, 1]], {}], "config": {"index": 1028086, "code_hash": null, "entity": [["inv_cp", "sp", [-1, 8]], ["inv_wp", "sp", [-1, 7, 2]], ["inv_hp", "sp", [-1, 7, 2]], ["kernel_cp", "sp", [-1, 2]], ["kernel_kp", "sp", [-1, 16]], ["data_cp", "sp", [-1, 1]], ["data_wp", "sp", [-1, 4, 1]], ["data_hp", "sp", [-1, 2, 1]], ["bgemm_kp", "sp", [-1, 32]], ["bgemm_wp", "sp", [-1, 4, 4]], ["bgemm_hp", "sp", [-1, 1]]]}, "result": [[0.0007255210666666667], 0, 27.02581286430359, 1618312308.803517], "version": 0.2, "tvm_version": "0.8.dev0"}
{"input": ["opencl -keys=mali,opencl,gpu -device=mali -max_num_threads=256", "winograd_2", [1, 14, 14, 256, 256, 3, 3, [1, 1], [1, 1, 1, 1]], {}], "config": {"index": 1054083, "code_hash": null, "entity": [["inv_cp", "sp", [-1, 4]], ["inv_wp", "sp", [-1, 4, 2]], ["inv_hp", "sp", [-1, 4, 2]], ["kernel_cp", "sp", [-1, 32]], ["kernel_kp", "sp", [-1, 32]], ["data_cp", "sp", [-1, 2]], ["data_wp", "sp", [-1, 7, 1]], ["data_hp", "sp", [-1, 4, 1]], ["bgemm_kp", "sp", [-1, 32]], ["bgemm_wp", "sp", [-1, 4, 4]], ["bgemm_hp", "sp", [-1, 1]]]}, "result": [[0.0007122432000000001], 0, 8.574631929397583, 1618314255.3149562], "version": 0.2, "tvm_version": "0.8.dev0"}
{"input": ["opencl -keys=mali,opencl,gpu -device=mali -max_num_threads=256", "winograd_2", [1, 14, 14, 256, 256, 3, 3, [1, 1], [1, 1, 1, 1]], {}], "config": {"index": 1054107, "code_hash": null, "entity": [["inv_cp", "sp", [-1, 4]], ["inv_wp", "sp", [-1, 4, 2]], ["inv_hp", "sp", [-1, 4, 2]], ["kernel_cp", "sp", [-1, 1]], ["kernel_kp", "sp", [-1, 32]], ["data_cp", "sp", [-1, 2]], ["data_wp", "sp", [-1, 7, 1]], ["data_hp", "sp", [-1, 4, 1]], ["bgemm_kp", "sp", [-1, 32]], ["bgemm_wp", "sp", [-1, 4, 4]], ["bgemm_hp", "sp", [-1, 1]]]}, "result": [[0.0007246165333333334], 0, 9.754552841186523, 1618314256.437781], "version": 0.2, "tvm_version": "0.8.dev0"}
{"input": ["opencl -keys=mali,opencl,gpu -device=mali -max_num_threads=256", "winograd_2", [1, 14, 14, 256, 256, 3, 3, [1, 1], [1, 1, 1, 1]], {}], "config": {"index": 1054131, "code_hash": null, "entity": [["inv_cp", "sp", [-1, 4]], ["inv_wp", "sp", [-1, 4, 2]], ["inv_hp", "sp", [-1, 4, 2]], ["kernel_cp", "sp", [-1, 2]], ["kernel_kp", "sp", [-1, 32]], ["data_cp", "sp", [-1, 2]], ["data_wp", "sp", [-1, 7, 1]], ["data_hp", "sp", [-1, 4, 1]], ["bgemm_kp", "sp", [-1, 32]], ["bgemm_wp", "sp", [-1, 4, 4]], ["bgemm_hp", "sp", [-1, 1]]]}, "result": [[0.0007089664000000001], 0, 10.873883485794067, 1618314257.5747368], "version": 0.2, "tvm_version": "0.8.dev0"}
{"input": ["opencl -keys=mali,opencl,gpu -device=mali -max_num_threads=256", "winograd_2", [1, 14, 14, 256, 256, 3, 3, [1, 1], [1, 1, 1, 1]], {}], "config": {"index": 1054203, "code_hash": null, "entity": [["inv_cp", "sp", [-1, 4]], ["inv_wp", "sp", [-1, 4, 2]], ["inv_hp", "sp", [-1, 4, 2]], ["kernel_cp", "sp", [-1, 16]], ["kernel_kp", "sp", [-1, 32]], ["data_cp", "sp", [-1, 2]], ["data_wp", "sp", [-1, 7, 1]], ["data_hp", "sp", [-1, 4, 1]], ["bgemm_kp", "sp", [-1, 32]], ["bgemm_wp", "sp", [-1, 4, 4]], ["bgemm_hp", "sp", [-1, 1]]]}, "result": [[0.0007178069333333333], 0, 11.958747148513794, 1618314258.7352333], "version": 0.2, "tvm_version": "0.8.dev0"}
{"input": ["opencl -keys=mali,opencl,gpu -device=mali -max_num_threads=256", "winograd_2", [1, 14, 14, 256, 256, 3, 3, [1, 1], [1, 1, 1, 1]], {}], "config": {"index": 1054179, "code_hash": null, "entity": [["inv_cp", "sp", [-1, 4]], ["inv_wp", "sp", [-1, 4, 2]], ["inv_hp", "sp", [-1, 4, 2]], ["kernel_cp", "sp", [-1, 8]], ["kernel_kp", "sp", [-1, 32]], ["data_cp", "sp", [-1, 2]], ["data_wp", "sp", [-1, 7, 1]], ["data_hp", "sp", [-1, 4, 1]], ["bgemm_kp", "sp", [-1, 32]], ["bgemm_wp", "sp", [-1, 4, 4]], ["bgemm_hp", "sp", [-1, 1]]]}, "result": [[0.0007244970666666666], 0, 13.08022403717041, 1618314259.8974395], "version": 0.2, "tvm_version": "0.8.dev0"}
{"input": ["opencl -keys=mali,opencl,gpu -device=mali -max_num_threads=256", "winograd_2", [1, 14, 14, 256, 256, 3, 3, [1, 1], [1, 1, 1, 1]], {}], "config": {"index": 1054155, "code_hash": null, "entity": [["inv_cp", "sp", [-1, 4]], ["inv_wp", "sp", [-1, 4, 2]], ["inv_hp", "sp", [-1, 4, 2]], ["kernel_cp", "sp", [-1, 4]], ["kernel_kp", "sp", [-1, 32]], ["data_cp", "sp", [-1, 2]], ["data_wp", "sp", [-1, 7, 1]], ["data_hp", "sp", [-1, 4, 1]], ["bgemm_kp", "sp", [-1, 32]], ["bgemm_wp", "sp", [-1, 4, 4]], ["bgemm_hp", "sp", [-1, 1]]]}, "result": [[0.0007192405333333334], 0, 14.265887975692749, 1618314261.0215092], "version": 0.2, "tvm_version": "0.8.dev0"}
{"input": ["opencl -keys=mali,opencl,gpu -device=mali -max_num_threads=256", "winograd_2", [1, 14, 14, 256, 256, 3, 3, [1, 1], [1, 1, 1, 1]], {}], "config": {"index": 1054227, "code_hash": null, "entity": [["inv_cp", "sp", [-1, 4]], ["inv_wp", "sp", [-1, 4, 2]], ["inv_hp", "sp", [-1, 4, 2]], ["kernel_cp", "sp", [-1, 32]], ["kernel_kp", "sp", [-1, 1]], ["data_cp", "sp", [-1, 2]], ["data_wp", "sp", [-1, 7, 1]], ["data_hp", "sp", [-1, 4, 1]], ["bgemm_kp", "sp", [-1, 32]], ["bgemm_wp", "sp", [-1, 4, 4]], ["bgemm_hp", "sp", [-1, 1]]]}, "result": [[0.0007192234666666666], 0, 15.398050546646118, 1618314262.2814052], "version": 0.2, "tvm_version": "0.8.dev0"}
{"input": ["opencl -keys=mali,opencl,gpu -device=mali -max_num_threads=256", "winograd_2", [1, 14, 14, 256, 256, 3, 3, [1, 1], [1, 1, 1, 1]], {}], "config": {"index": 1054299, "code_hash": null, "entity": [["inv_cp", "sp", [-1, 4]], ["inv_wp", "sp", [-1, 4, 2]], ["inv_hp", "sp", [-1, 4, 2]], ["kernel_cp", "sp", [-1, 4]], ["kernel_kp", "sp", [-1, 1]], ["data_cp", "sp", [-1, 2]], ["data_wp", "sp", [-1, 7, 1]], ["data_hp", "sp", [-1, 4, 1]], ["bgemm_kp", "sp", [-1, 32]], ["bgemm_wp", "sp", [-1, 4, 4]], ["bgemm_hp", "sp", [-1, 1]]]}, "result": [[0.0007289685333333333], 0, 16.80223274230957, 1618314263.5251577], "version": 0.2, "tvm_version": "0.8.dev0"}
{"input": ["opencl -keys=mali,opencl,gpu -device=mali -max_num_threads=256", "winograd_2", [1, 14, 14, 256, 256, 3, 3, [1, 1], [1, 1, 1, 1]], {}], "config": {"index": 1054251, "code_hash": null, "entity": [["inv_cp", "sp", [-1, 4]], ["inv_wp", "sp", [-1, 4, 2]], ["inv_hp", "sp", [-1, 4, 2]], ["kernel_cp", "sp", [-1, 1]], ["kernel_kp", "sp", [-1, 1]], ["data_cp", "sp", [-1, 2]], ["data_wp", "sp", [-1, 7, 1]], ["data_hp", "sp", [-1, 4, 1]], ["bgemm_kp", "sp", [-1, 32]], ["bgemm_wp", "sp", [-1, 4, 4]], ["bgemm_hp", "sp", [-1, 1]]]}, "result": [[0.0007241898666666666], 0, 17.81135368347168, 1618314264.8061585], "version": 0.2, "tvm_version": "0.8.dev0"}
{"input": ["opencl -keys=mali,opencl,gpu -device=mali -max_num_threads=256", "winograd_2", [1, 14, 14, 256, 256, 3, 3, [1, 1], [1, 1, 1, 1]], {}], "config": {"index": 1054467, "code_hash": null, "entity": [["inv_cp", "sp", [-1, 4]], ["inv_wp", "sp", [-1, 4, 2]], ["inv_hp", "sp", [-1, 4, 2]], ["kernel_cp", "sp", [-1, 8]], ["kernel_kp", "sp", [-1, 2]], ["data_cp", "sp", [-1, 2]], ["data_wp", "sp", [-1, 7, 1]], ["data_hp", "sp", [-1, 4, 1]], ["bgemm_kp", "sp", [-1, 32]], ["bgemm_wp", "sp", [-1, 4, 4]], ["bgemm_hp", "sp", [-1, 1]]]}, "result": [[0.0007253162666666667], 0, 19.157429456710815, 1618314266.0967484], "version": 0.2, "tvm_version": "0.8.dev0"}
{"input": ["opencl -keys=mali,opencl,gpu -device=mali -max_num_threads=256", "winograd_2", [1, 14, 14, 256, 256, 3, 3, [1, 1], [1, 1, 1, 1]], {}], "config": {"index": 1054347, "code_hash": null, "entity": [["inv_cp", "sp", [-1, 4]], ["inv_wp", "sp", [-1, 4, 2]], ["inv_hp", "sp", [-1, 4, 2]], ["kernel_cp", "sp", [-1, 16]], ["kernel_kp", "sp", [-1, 1]], ["data_cp", "sp", [-1, 2]], ["data_wp", "sp", [-1, 7, 1]], ["data_hp", "sp", [-1, 4, 1]], ["bgemm_kp", "sp", [-1, 32]], ["bgemm_wp", "sp", [-1, 4, 4]], ["bgemm_hp", "sp", [-1, 1]]]}, "result": [[0.0007176362666666665], 0, 20.41832971572876, 1618314267.2383919], "version": 0.2, "tvm_version": "0.8.dev0"}
{"input": ["opencl -keys=mali,opencl,gpu -device=mali -max_num_threads=256", "winograd_2", [1, 14, 14, 256, 256, 3, 3, [1, 1], [1, 1, 1, 1]], {}], "config": {"index": 1054611, "code_hash": null, "entity": [["inv_cp", "sp", [-1, 4]], ["inv_wp", "sp", [-1, 4, 2]], ["inv_hp", "sp", [-1, 4, 2]], ["kernel_cp", "sp", [-1, 8]], ["kernel_kp", "sp", [-1, 4]], ["data_cp", "sp", [-1, 2]], ["data_wp", "sp", [-1, 7, 1]], ["data_hp", "sp", [-1, 4, 1]], ["bgemm_kp", "sp", [-1, 32]], ["bgemm_wp", "sp", [-1, 4, 4]], ["bgemm_hp", "sp", [-1, 1]]]}, "result": [[0.0007307776], 0, 21.51866841316223, 1618314268.3781343], "version": 0.2, "tvm_version": "0.8.dev0"}
{"input": ["opencl -keys=mali,opencl,gpu -device=mali -max_num_threads=256", "winograd_2", [1, 14, 14, 256, 256, 3, 3, [1, 1], [1, 1, 1, 1]], {}], "config": {"index": 1054275, "code_hash": null, "entity": [["inv_cp", "sp", [-1, 4]], ["inv_wp", "sp", [-1, 4, 2]], ["inv_hp", "sp", [-1, 4, 2]], ["kernel_cp", "sp", [-1, 2]], ["kernel_kp", "sp", [-1, 1]], ["data_cp", "sp", [-1, 2]], ["data_wp", "sp", [-1, 7, 1]], ["data_hp", "sp", [-1, 4, 1]], ["bgemm_kp", "sp", [-1, 32]], ["bgemm_wp", "sp", [-1, 4, 4]], ["bgemm_hp", "sp", [-1, 1]]]}, "result": [[0.0007274154666666667], 0, 22.821415901184082, 1618314269.5263379], "version": 0.2, "tvm_version": "0.8.dev0"}
{"input": ["opencl -keys=mali,opencl,gpu -device=mali -max_num_threads=256", "winograd_2", [1, 14, 14, 256, 256, 3, 3, [1, 1], [1, 1, 1, 1]], {}], "config": {"index": 1054323, "code_hash": null, "entity": [["inv_cp", "sp", [-1, 4]], ["inv_wp", "sp", [-1, 4, 2]], ["inv_hp", "sp", [-1, 4, 2]], ["kernel_cp", "sp", [-1, 8]], ["kernel_kp", "sp", [-1, 1]], ["data_cp", "sp", [-1, 2]], ["data_wp", "sp", [-1, 7, 1]], ["data_hp", "sp", [-1, 4, 1]], ["bgemm_kp", "sp", [-1, 32]], ["bgemm_wp", "sp", [-1, 4, 4]], ["bgemm_hp", "sp", [-1, 1]]]}, "result": [[0.0007210837333333334], 0, 23.744577169418335, 1618314270.7323442], "version": 0.2, "tvm_version": "0.8.dev0"}
{"input": ["opencl -keys=mali,opencl,gpu -device=mali -max_num_threads=256", "winograd_2", [1, 14, 14, 256, 256, 3, 3, [1, 1], [1, 1, 1, 1]], {}], "config": {"index": 1054443, "code_hash": null, "entity": [["inv_cp", "sp", [-1, 4]], ["inv_wp", "sp", [-1, 4, 2]], ["inv_hp", "sp", [-1, 4, 2]], ["kernel_cp", "sp", [-1, 4]], ["kernel_kp", "sp", [-1, 2]], ["data_cp", "sp", [-1, 2]], ["data_wp", "sp", [-1, 7, 1]], ["data_hp", "sp", [-1, 4, 1]], ["bgemm_kp", "sp", [-1, 32]], ["bgemm_wp", "sp", [-1, 4, 4]], ["bgemm_hp", "sp", [-1, 1]]]}, "result": [[0.00072832], 0, 25.121699571609497, 1618314271.9140995], "version": 0.2, "tvm_version": "0.8.dev0"}
{"input": ["opencl -keys=mali,opencl,gpu -device=mali -max_num_threads=256", "winograd_2", [1, 14, 14, 256, 256, 3, 3, [1, 1], [1, 1, 1, 1]], {}], "config": {"index": 1054419, "code_hash": null, "entity": [["inv_cp", "sp", [-1, 4]], ["inv_wp", "sp", [-1, 4, 2]], ["inv_hp", "sp", [-1, 4, 2]], ["kernel_cp", "sp", [-1, 2]], ["kernel_kp", "sp", [-1, 2]], ["data_cp", "sp", [-1, 2]], ["data_wp", "sp", [-1, 7, 1]], ["data_hp", "sp", [-1, 4, 1]], ["bgemm_kp", "sp", [-1, 32]], ["bgemm_wp", "sp", [-1, 4, 4]], ["bgemm_hp", "sp", [-1, 1]]]}, "result": [[0.0007210837333333334], 0, 26.032986164093018, 1618314273.0249388], "version": 0.2, "tvm_version": "0.8.dev0"}
{"input": ["opencl -keys=mali,opencl,gpu -device=mali -max_num_threads=256", "winograd_2", [1, 14, 14, 256, 256, 3, 3, [1, 1], [1, 1, 1, 1]], {}], "config": {"index": 1054371, "code_hash": null, "entity": [["inv_cp", "sp", [-1, 4]], ["inv_wp", "sp", [-1, 4, 2]], ["inv_hp", "sp", [-1, 4, 2]], ["kernel_cp", "sp", [-1, 32]], ["kernel_kp", "sp", [-1, 2]], ["data_cp", "sp", [-1, 2]], ["data_wp", "sp", [-1, 7, 1]], ["data_hp", "sp", [-1, 4, 1]], ["bgemm_kp", "sp", [-1, 32]], ["bgemm_wp", "sp", [-1, 4, 4]], ["bgemm_hp", "sp", [-1, 1]]]}, "result": [[0.0007222101333333332], 0, 27.299283266067505, 1618314274.185457], "version": 0.2, "tvm_version": "0.8.dev0"}
{"input": ["opencl -keys=mali,opencl,gpu -device=mali -max_num_threads=256", "winograd_2", [1, 14, 14, 256, 256, 3, 3, [1, 1], [1, 1, 1, 1]], {}], "config": {"index": 1054395, "code_hash": null, "entity": [["inv_cp", "sp", [-1, 4]], ["inv_wp", "sp", [-1, 4, 2]], ["inv_hp", "sp", [-1, 4, 2]], ["kernel_cp", "sp", [-1, 1]], ["kernel_kp", "sp", [-1, 2]], ["data_cp", "sp", [-1, 2]], ["data_wp", "sp", [-1, 7, 1]], ["data_hp", "sp", [-1, 4, 1]], ["bgemm_kp", "sp", [-1, 32]], ["bgemm_wp", "sp", [-1, 4, 4]], ["bgemm_hp", "sp", [-1, 1]]]}, "result": [[0.0007215274666666667], 0, 28.645704984664917, 1618314275.5291913], "version": 0.2, "tvm_version": "0.8.dev0"}
{"input": ["opencl -keys=mali,opencl,gpu -device=mali -max_num_threads=256", "winograd_2", [1, 14, 14, 256, 256, 3, 3, [1, 1], [1, 1, 1, 1]], {}], "config": {"index": 1054587, "code_hash": null, "entity": [["inv_cp", "sp", [-1, 4]], ["inv_wp", "sp", [-1, 4, 2]], ["inv_hp", "sp", [-1, 4, 2]], ["kernel_cp", "sp", [-1, 4]], ["kernel_kp", "sp", [-1, 4]], ["data_cp", "sp", [-1, 2]], ["data_wp", "sp", [-1, 7, 1]], ["data_hp", "sp", [-1, 4, 1]], ["bgemm_kp", "sp", [-1, 32]], ["bgemm_wp", "sp", [-1, 4, 4]], ["bgemm_hp", "sp", [-1, 1]]]}, "result": [[0.0007240533333333333], 0, 29.61223816871643, 1618314276.6973982], "version": 0.2, "tvm_version": "0.8.dev0"}
{"input": ["opencl -keys=mali,opencl,gpu -device=mali -max_num_threads=256", "winograd_2", [1, 14, 14, 256, 256, 3, 3, [1, 1], [1, 1, 1, 1]], {}], "config": {"index": 1054707, "code_hash": null, "entity": [["inv_cp", "sp", [-1, 4]], ["inv_wp", "sp", [-1, 4, 2]], ["inv_hp", "sp", [-1, 4, 2]], ["kernel_cp", "sp", [-1, 2]], ["kernel_kp", "sp", [-1, 8]], ["data_cp", "sp", [-1, 2]], ["data_wp", "sp", [-1, 7, 1]], ["data_hp", "sp", [-1, 4, 1]], ["bgemm_kp", "sp", [-1, 32]], ["bgemm_wp", "sp", [-1, 4, 4]], ["bgemm_hp", "sp", [-1, 1]]]}, "result": [[0.0007164415999999998], 0, 31.003474235534668, 1618314277.9833906], "version": 0.2, "tvm_version": "0.8.dev0"}
{"input": ["opencl -keys=mali,opencl,gpu -device=mali -max_num_threads=256", "winograd_2", [1, 14, 14, 256, 256, 3, 3, [1, 1], [1, 1, 1, 1]], {}], "config": {"index": 2032221, "code_hash": null, "entity": [["inv_cp", "sp", [-1, 4]], ["inv_wp", "sp", [-1, 7, 2]], ["inv_hp", "sp", [-1, 7, 2]], ["kernel_cp", "sp", [-1, 4]], ["kernel_kp", "sp", [-1, 32]], ["data_cp", "sp", [-1, 32]], ["data_wp", "sp", [-1, 1, 1]], ["data_hp", "sp", [-1, 4, 1]], ["bgemm_kp", "sp", [-1, 32]], ["bgemm_wp", "sp", [-1, 13, 4]], ["bgemm_hp", "sp", [-1, 1]]]}, "result": [[0.0005898922666666667], 0, 6.738816261291504, 1618319084.169889], "version": 0.2, "tvm_version": "0.8.dev0"}
{"input": ["opencl -keys=mali,opencl,gpu -device=mali -max_num_threads=256", "winograd_2", [1, 14, 14, 256, 256, 3, 3, [1, 1], [1, 1, 1, 1]], {}], "config": {"index": 2032533, "code_hash": null, "entity": [["inv_cp", "sp", [-1, 4]], ["inv_wp", "sp", [-1, 7, 2]], ["inv_hp", "sp", [-1, 7, 2]], ["kernel_cp", "sp", [-1, 8]], ["kernel_kp", "sp", [-1, 2]], ["data_cp", "sp", [-1, 32]], ["data_wp", "sp", [-1, 1, 1]], ["data_hp", "sp", [-1, 4, 1]], ["bgemm_kp", "sp", [-1, 32]], ["bgemm_wp", "sp", [-1, 13, 4]], ["bgemm_hp", "sp", [-1, 1]]]}, "result": [[0.0005933909333333333], 0, 7.987928867340088, 1618319085.3424401], "version": 0.2, "tvm_version": "0.8.dev0"}
{"input": ["opencl -keys=mali,opencl,gpu -device=mali -max_num_threads=256", "winograd_2", [1, 14, 14, 256, 256, 3, 3, [1, 1], [1, 1, 1, 1]], {}], "config": {"index": 2032173, "code_hash": null, "entity": [["inv_cp", "sp", [-1, 4]], ["inv_wp", "sp", [-1, 7, 2]], ["inv_hp", "sp", [-1, 7, 2]], ["kernel_cp", "sp", [-1, 1]], ["kernel_kp", "sp", [-1, 32]], ["data_cp", "sp", [-1, 32]], ["data_wp", "sp", [-1, 1, 1]], ["data_hp", "sp", [-1, 4, 1]], ["bgemm_kp", "sp", [-1, 32]], ["bgemm_wp", "sp", [-1, 13, 4]], ["bgemm_hp", "sp", [-1, 1]]]}, "result": [[0.000592384], 0, 9.029697895050049, 1618319086.5089219], "version": 0.2, "tvm_version": "0.8.dev0"}
{"input": ["opencl -keys=mali,opencl,gpu -device=mali -max_num_threads=256", "winograd_2", [1, 14, 14, 256, 256, 3, 3, [1, 1], [1, 1, 1, 1]], {}], "config": {"index": 2032197, "code_hash": null, "entity": [["inv_cp", "sp", [-1, 4]], ["inv_wp", "sp", [-1, 7, 2]], ["inv_hp", "sp", [-1, 7, 2]], ["kernel_cp", "sp", [-1, 2]], ["kernel_kp", "sp", [-1, 32]], ["data_cp", "sp", [-1, 32]], ["data_wp", "sp", [-1, 1, 1]], ["data_hp", "sp", [-1, 4, 1]], ["bgemm_kp", "sp", [-1, 32]], ["bgemm_wp", "sp", [-1, 13, 4]], ["bgemm_hp", "sp", [-1, 1]]]}, "result": [[0.0005929130666666665], 0, 10.273107051849365, 1618319087.6810877], "version": 0.2, "tvm_version": "0.8.dev0"}
{"input": ["opencl -keys=mali,opencl,gpu -device=mali -max_num_threads=256", "winograd_2", [1, 14, 14, 256, 256, 3, 3, [1, 1], [1, 1, 1, 1]], {}], "config": {"index": 2032413, "code_hash": null, "entity": [["inv_cp", "sp", [-1, 4]], ["inv_wp", "sp", [-1, 7, 2]], ["inv_hp", "sp", [-1, 7, 2]], ["kernel_cp", "sp", [-1, 16]], ["kernel_kp", "sp", [-1, 1]], ["data_cp", "sp", [-1, 32]], ["data_wp", "sp", [-1, 1, 1]], ["data_hp", "sp", [-1, 4, 1]], ["bgemm_kp", "sp", [-1, 32]], ["bgemm_wp", "sp", [-1, 13, 4]], ["bgemm_hp", "sp", [-1, 1]]]}, "result": [[0.0005935104], 0, 11.351438283920288, 1618319088.846001], "version": 0.2, "tvm_version": "0.8.dev0"}
{"input": ["opencl -keys=mali,opencl,gpu -device=mali -max_num_threads=256", "winograd_2", [1, 14, 14, 256, 256, 3, 3, [1, 1], [1, 1, 1, 1]], {}], "config": {"index": 2032437, "code_hash": null, "entity": [["inv_cp", "sp", [-1, 4]], ["inv_wp", "sp", [-1, 7, 2]], ["inv_hp", "sp", [-1, 7, 2]], ["kernel_cp", "sp", [-1, 32]], ["kernel_kp", "sp", [-1, 2]], ["data_cp", "sp", [-1, 32]], ["data_wp", "sp", [-1, 1, 1]], ["data_hp", "sp", [-1, 4, 1]], ["bgemm_kp", "sp", [-1, 32]], ["bgemm_wp", "sp", [-1, 13, 4]], ["bgemm_hp", "sp", [-1, 1]]]}, "result": [[0.0005925717333333334], 0, 12.55585789680481, 1618319090.0210521], "version": 0.2, "tvm_version": "0.8.dev0"}
{"input": ["opencl -keys=mali,opencl,gpu -device=mali -max_num_threads=256", "winograd_2", [1, 14, 14, 256, 256, 3, 3, [1, 1], [1, 1, 1, 1]], {}], "config": {"index": 2032461, "code_hash": null, "entity": [["inv_cp", "sp", [-1, 4]], ["inv_wp", "sp", [-1, 7, 2]], ["inv_hp", "sp", [-1, 7, 2]], ["kernel_cp", "sp", [-1, 1]], ["kernel_kp", "sp", [-1, 2]], ["data_cp", "sp", [-1, 32]], ["data_wp", "sp", [-1, 1, 1]], ["data_hp", "sp", [-1, 4, 1]], ["bgemm_kp", "sp", [-1, 32]], ["bgemm_wp", "sp", [-1, 13, 4]], ["bgemm_hp", "sp", [-1, 1]]]}, "result": [[0.0005930837333333333], 0, 13.784715175628662, 1618319091.2976077], "version": 0.2, "tvm_version": "0.8.dev0"}
{"input": ["opencl -keys=mali,opencl,gpu -device=mali -max_num_threads=256", "winograd_2", [1, 14, 14, 256, 256, 3, 3, [1, 1], [1, 1, 1, 1]], {}], "config": {"index": 2032701, "code_hash": null, "entity": [["inv_cp", "sp", [-1, 4]], ["inv_wp", "sp", [-1, 7, 2]], ["inv_hp", "sp", [-1, 7, 2]], ["kernel_cp", "sp", [-1, 16]], ["kernel_kp", "sp", [-1, 4]], ["data_cp", "sp", [-1, 32]], ["data_wp", "sp", [-1, 1, 1]], ["data_hp", "sp", [-1, 4, 1]], ["bgemm_kp", "sp", [-1, 32]], ["bgemm_wp", "sp", [-1, 13, 4]], ["bgemm_hp", "sp", [-1, 1]]]}, "result": [[0.0005923498666666665], 0, 15.056646823883057, 1618319092.5128617], "version": 0.2, "tvm_version": "0.8.dev0"}
{"input": ["opencl -keys=mali,opencl,gpu -device=mali -max_num_threads=256", "winograd_2", [1, 14, 14, 256, 256, 3, 3, [1, 1], [1, 1, 1, 1]], {}], "config": {"index": 2032677, "code_hash": null, "entity": [["inv_cp", "sp", [-1, 4]], ["inv_wp", "sp", [-1, 7, 2]], ["inv_hp", "sp", [-1, 7, 2]], ["kernel_cp", "sp", [-1, 8]], ["kernel_kp", "sp", [-1, 4]], ["data_cp", "sp", [-1, 32]], ["data_wp", "sp", [-1, 1, 1]], ["data_hp", "sp", [-1, 4, 1]], ["bgemm_kp", "sp", [-1, 32]], ["bgemm_wp", "sp", [-1, 13, 4]], ["bgemm_hp", "sp", [-1, 1]]]}, "result": [[0.0005919061333333334], 0, 16.18981099128723, 1618319093.7019339], "version": 0.2, "tvm_version": "0.8.dev0"}
{"input": ["opencl -keys=mali,opencl,gpu -device=mali -max_num_threads=256", "winograd_2", [1, 14, 14, 256, 256, 3, 3, [1, 1], [1, 1, 1, 1]], {}], "config": {"index": 2032773, "code_hash": null, "entity": [["inv_cp", "sp", [-1, 4]], ["inv_wp", "sp", [-1, 7, 2]], ["inv_hp", "sp", [-1, 7, 2]], ["kernel_cp", "sp", [-1, 2]], ["kernel_kp", "sp", [-1, 8]], ["data_cp", "sp", [-1, 32]], ["data_wp", "sp", [-1, 1, 1]], ["data_hp", "sp", [-1, 4, 1]], ["bgemm_kp", "sp", [-1, 32]], ["bgemm_wp", "sp", [-1, 13, 4]], ["bgemm_hp", "sp", [-1, 1]]]}, "result": [[0.0005921109333333333], 0, 17.532558917999268, 1618319095.1249356], "version": 0.2, "tvm_version": "0.8.dev0"}
{"input": ["opencl -keys=mali,opencl,gpu -device=mali -max_num_threads=256", "winograd_2", [1, 14, 14, 256, 256, 3, 3, [1, 1], [1, 1, 1, 1]], {}], "config": {"index": 2032245, "code_hash": null, "entity": [["inv_cp", "sp", [-1, 4]], ["inv_wp", "sp", [-1, 7, 2]], ["inv_hp", "sp", [-1, 7, 2]], ["kernel_cp", "sp", [-1, 8]], ["kernel_kp", "sp", [-1, 32]], ["data_cp", "sp", [-1, 32]], ["data_wp", "sp", [-1, 1, 1]], ["data_hp", "sp", [-1, 4, 1]], ["bgemm_kp", "sp", [-1, 32]], ["bgemm_wp", "sp", [-1, 13, 4]], ["bgemm_hp", "sp", [-1, 1]]]}, "result": [[0.0005941418666666668], 0, 18.95950222015381, 1618319096.523673], "version": 0.2, "tvm_version": "0.8.dev0"}
{"input": ["opencl -keys=mali,opencl,gpu -device=mali -max_num_threads=256", "winograd_2", [1, 14, 14, 256, 256, 3, 3, [1, 1], [1, 1, 1, 1]], {}], "config": {"index": 2032821, "code_hash": null, "entity": [["inv_cp", "sp", [-1, 4]], ["inv_wp", "sp", [-1, 7, 2]], ["inv_hp", "sp", [-1, 7, 2]], ["kernel_cp", "sp", [-1, 8]], ["kernel_kp", "sp", [-1, 8]], ["data_cp", "sp", [-1, 32]], ["data_wp", "sp", [-1, 1, 1]], ["data_hp", "sp", [-1, 4, 1]], ["bgemm_kp", "sp", [-1, 32]], ["bgemm_wp", "sp", [-1, 13, 4]], ["bgemm_hp", "sp", [-1, 1]]]}, "result": [[0.0005914282666666667], 0, 20.199910879135132, 1618319097.9542203], "version": 0.2, "tvm_version": "0.8.dev0"}
{"input": ["opencl -keys=mali,opencl,gpu -device=mali -max_num_threads=256", "winograd_2", [1, 14, 14, 256, 256, 3, 3, [1, 1], [1, 1, 1, 1]], {}], "config": {"index": 2032341, "code_hash": null, "entity": [["inv_cp", "sp", [-1, 4]], ["inv_wp", "sp", [-1, 7, 2]], ["inv_hp", "sp", [-1, 7, 2]], ["kernel_cp", "sp", [-1, 2]], ["kernel_kp", "sp", [-1, 1]], ["data_cp", "sp", [-1, 32]], ["data_wp", "sp", [-1, 1, 1]], ["data_hp", "sp", [-1, 4, 1]], ["bgemm_kp", "sp", [-1, 32]], ["bgemm_wp", "sp", [-1, 13, 4]], ["bgemm_hp", "sp", [-1, 1]]]}, "result": [[0.0005925546666666667], 0, 21.595450401306152, 1618319099.3509443], "version": 0.2, "tvm_version": "0.8.dev0"}
{"input": ["opencl -keys=mali,opencl,gpu -device=mali -max_num_threads=256", "winograd_2", [1, 14, 14, 256, 256, 3, 3, [1, 1], [1, 1, 1, 1]], {}], "config": {"index": 2032293, "code_hash": null, "entity": [["inv_cp", "sp", [-1, 4]], ["inv_wp", "sp", [-1, 7, 2]], ["inv_hp", "sp", [-1, 7, 2]], ["kernel_cp", "sp", [-1, 32]], ["kernel_kp", "sp", [-1, 1]], ["data_cp", "sp", [-1, 32]], ["data_wp", "sp", [-1, 1, 1]], ["data_hp", "sp", [-1, 4, 1]], ["bgemm_kp", "sp", [-1, 32]], ["bgemm_wp", "sp", [-1, 13, 4]], ["bgemm_hp", "sp", [-1, 1]]]}, "result": [[0.0005906090666666666], 0, 23.05277729034424, 1618319100.6644597], "version": 0.2, "tvm_version": "0.8.dev0"}
{"input": ["opencl -keys=mali,opencl,gpu -device=mali -max_num_threads=256", "winograd_2", [1, 14, 14, 256, 256, 3, 3, [1, 1], [1, 1, 1, 1]], {}], "config": {"index": 2032893, "code_hash": null, "entity": [["inv_cp", "sp", [-1, 4]], ["inv_wp", "sp", [-1, 7, 2]], ["inv_hp", "sp", [-1, 7, 2]], ["kernel_cp", "sp", [-1, 1]], ["kernel_kp", "sp", [-1, 16]], ["data_cp", "sp", [-1, 32]], ["data_wp", "sp", [-1, 1, 1]], ["data_hp", "sp", [-1, 4, 1]], ["bgemm_kp", "sp", [-1, 32]], ["bgemm_wp", "sp", [-1, 13, 4]], ["bgemm_hp", "sp", [-1, 1]]]}, "result": [[0.0005932202666666665], 0, 24.356332063674927, 1618319102.0763066], "version": 0.2, "tvm_version": "0.8.dev0"}
{"input": ["opencl -keys=mali,opencl,gpu -device=mali -max_num_threads=256", "winograd_2", [1, 14, 14, 256, 256, 3, 3, [1, 1], [1, 1, 1, 1]], {}], "config": {"index": 2032605, "code_hash": null, "entity": [["inv_cp", "sp", [-1, 4]], ["inv_wp", "sp", [-1, 7, 2]], ["inv_hp", "sp", [-1, 7, 2]], ["kernel_cp", "sp", [-1, 1]], ["kernel_kp", "sp", [-1, 4]], ["data_cp", "sp", [-1, 32]], ["data_wp", "sp", [-1, 1, 1]], ["data_hp", "sp", [-1, 4, 1]], ["bgemm_kp", "sp", [-1, 32]], ["bgemm_wp", "sp", [-1, 13, 4]], ["bgemm_hp", "sp", [-1, 1]]]}, "result": [[0.0005917866666666666], 0, 25.616904497146606, 1618319103.5200148], "version": 0.2, "tvm_version": "0.8.dev0"}
{"input": ["opencl -keys=mali,opencl,gpu -device=mali -max_num_threads=256", "winograd_2", [1, 14, 14, 256, 256, 3, 3, [1, 1], [1, 1, 1, 1]], {}], "config": {"index": 2032797, "code_hash": null, "entity": [["inv_cp", "sp", [-1, 4]], ["inv_wp", "sp", [-1, 7, 2]], ["inv_hp", "sp", [-1, 7, 2]], ["kernel_cp", "sp", [-1, 4]], ["kernel_kp", "sp", [-1, 8]], ["data_cp", "sp", [-1, 32]], ["data_wp", "sp", [-1, 1, 1]], ["data_hp", "sp", [-1, 4, 1]], ["bgemm_kp", "sp", [-1, 32]], ["bgemm_wp", "sp", [-1, 13, 4]], ["bgemm_hp", "sp", [-1, 1]]]}, "result": [[0.0005938346666666665], 0, 27.18223524093628, 1618319104.8662424], "version": 0.2, "tvm_version": "0.8.dev0"}
{"input": ["opencl -keys=mali,opencl,gpu -device=mali -max_num_threads=256", "winograd_2", [1, 14, 14, 256, 256, 3, 3, [1, 1], [1, 1, 1, 1]], {}], "config": {"index": 2032749, "code_hash": null, "entity": [["inv_cp", "sp", [-1, 4]], ["inv_wp", "sp", [-1, 7, 2]], ["inv_hp", "sp", [-1, 7, 2]], ["kernel_cp", "sp", [-1, 1]], ["kernel_kp", "sp", [-1, 8]], ["data_cp", "sp", [-1, 32]], ["data_wp", "sp", [-1, 1, 1]], ["data_hp", "sp", [-1, 4, 1]], ["bgemm_kp", "sp", [-1, 32]], ["bgemm_wp", "sp", [-1, 13, 4]], ["bgemm_hp", "sp", [-1, 1]]]}, "result": [[0.0005915135999999999], 0, 28.207897663116455, 1618319106.090408], "version": 0.2, "tvm_version": "0.8.dev0"}
{"input": ["opencl -keys=mali,opencl,gpu -device=mali -max_num_threads=256", "winograd_2", [1, 14, 14, 256, 256, 3, 3, [1, 1], [1, 1, 1, 1]], {}], "config": {"index": 2032629, "code_hash": null, "entity": [["inv_cp", "sp", [-1, 4]], ["inv_wp", "sp", [-1, 7, 2]], ["inv_hp", "sp", [-1, 7, 2]], ["kernel_cp", "sp", [-1, 2]], ["kernel_kp", "sp", [-1, 4]], ["data_cp", "sp", [-1, 32]], ["data_wp", "sp", [-1, 1, 1]], ["data_hp", "sp", [-1, 4, 1]], ["bgemm_kp", "sp", [-1, 32]], ["bgemm_wp", "sp", [-1, 13, 4]], ["bgemm_hp", "sp", [-1, 1]]]}, "result": [[0.0005952853333333335], 0, 29.428946018218994, 1618319107.338268], "version": 0.2, "tvm_version": "0.8.dev0"}
{"input": ["opencl -keys=mali,opencl,gpu -device=mali -max_num_threads=256", "winograd_2", [1, 14, 14, 256, 256, 3, 3, [1, 1], [1, 1, 1, 1]], {}], "config": {"index": 2032149, "code_hash": null, "entity": [["inv_cp", "sp", [-1, 4]], ["inv_wp", "sp", [-1, 7, 2]], ["inv_hp", "sp", [-1, 7, 2]], ["kernel_cp", "sp", [-1, 32]], ["kernel_kp", "sp", [-1, 32]], ["data_cp", "sp", [-1, 32]], ["data_wp", "sp", [-1, 1, 1]], ["data_hp", "sp", [-1, 4, 1]], ["bgemm_kp", "sp", [-1, 32]], ["bgemm_wp", "sp", [-1, 13, 4]], ["bgemm_hp", "sp", [-1, 1]]]}, "result": [[0.0005923327999999999], 0, 30.711851596832275, 1618319108.7934043], "version": 0.2, "tvm_version": "0.8.dev0"}
{"input": ["opencl -keys=mali,opencl,gpu -device=mali -max_num_threads=256", "winograd_2", [1, 14, 14, 256, 256, 3, 3, [1, 1], [1, 1, 1, 1]], {}], "config": {"index": 1790515, "code_hash": null, "entity": [["inv_cp", "sp", [-1, 2]], ["inv_wp", "sp", [-1, 7, 2]], ["inv_hp", "sp", [-1, 7, 2]], ["kernel_cp", "sp", [-1, 32]], ["kernel_kp", "sp", [-1, 2]], ["data_cp", "sp", [-1, 2]], ["data_wp", "sp", [-1, 2, 1]], ["data_hp", "sp", [-1, 4, 1]], ["bgemm_kp", "sp", [-1, 4]], ["bgemm_wp", "sp", [-1, 8, 4]], ["bgemm_hp", "sp", [-1, 1]]]}, "result": [[0.0011448490666666664], 0, 7.609734773635864, 1618321333.5133617], "version": 0.2, "tvm_version": "0.8.dev0"}
{"input": ["opencl -keys=mali,opencl,gpu -device=mali -max_num_threads=256", "winograd_2", [1, 14, 14, 256, 256, 3, 3, [1, 1], [1, 1, 1, 1]], {}], "config": {"index": 1790563, "code_hash": null, "entity": [["inv_cp", "sp", [-1, 2]], ["inv_wp", "sp", [-1, 7, 2]], ["inv_hp", "sp", [-1, 7, 2]], ["kernel_cp", "sp", [-1, 2]], ["kernel_kp", "sp", [-1, 2]], ["data_cp", "sp", [-1, 2]], ["data_wp", "sp", [-1, 2, 1]], ["data_hp", "sp", [-1, 4, 1]], ["bgemm_kp", "sp", [-1, 4]], ["bgemm_wp", "sp", [-1, 8, 4]], ["bgemm_hp", "sp", [-1, 1]]]}, "result": [[0.0011395754666666668], 0, 8.958142757415771, 1618321334.6716256], "version": 0.2, "tvm_version": "0.8.dev0"}
{"input": ["opencl -keys=mali,opencl,gpu -device=mali -max_num_threads=256", "winograd_2", [1, 14, 14, 256, 256, 3, 3, [1, 1], [1, 1, 1, 1]], {}], "config": {"index": 1790539, "code_hash": null, "entity": [["inv_cp", "sp", [-1, 2]], ["inv_wp", "sp", [-1, 7, 2]], ["inv_hp", "sp", [-1, 7, 2]], ["kernel_cp", "sp", [-1, 1]], ["kernel_kp", "sp", [-1, 2]], ["data_cp", "sp", [-1, 2]], ["data_wp", "sp", [-1, 2, 1]], ["data_hp", "sp", [-1, 4, 1]], ["bgemm_kp", "sp", [-1, 4]], ["bgemm_wp", "sp", [-1, 8, 4]], ["bgemm_hp", "sp", [-1, 1]]]}, "result": [[0.0011480234666666664], 0, 9.89594578742981, 1618321335.8433857], "version": 0.2, "tvm_version": "0.8.dev0"}
{"input": ["opencl -keys=mali,opencl,gpu -device=mali -max_num_threads=256", "winograd_2", [1, 14, 14, 256, 256, 3, 3, [1, 1], [1, 1, 1, 1]], {}], "config": {"index": 1790755, "code_hash": null, "entity": [["inv_cp", "sp", [-1, 2]], ["inv_wp", "sp", [-1, 7, 2]], ["inv_hp", "sp", [-1, 7, 2]], ["kernel_cp", "sp", [-1, 8]], ["kernel_kp", "sp", [-1, 4]], ["data_cp", "sp", [-1, 2]], ["data_wp", "sp", [-1, 2, 1]], ["data_hp", "sp", [-1, 4, 1]], ["bgemm_kp", "sp", [-1, 4]], ["bgemm_wp", "sp", [-1, 8, 4]], ["bgemm_hp", "sp", [-1, 1]]]}, "result": [[0.0011638272], 0, 10.985551118850708, 1618321337.079563], "version": 0.2, "tvm_version": "0.8.dev0"}
{"input": ["opencl -keys=mali,opencl,gpu -device=mali -max_num_threads=256", "winograd_2", [1, 14, 14, 256, 256, 3, 3, [1, 1], [1, 1, 1, 1]], {}], "config": {"index": 1790275, "code_hash": null, "entity": [["inv_cp", "sp", [-1, 2]], ["inv_wp", "sp", [-1, 7, 2]], ["inv_hp", "sp", [-1, 7, 2]], ["kernel_cp", "sp", [-1, 2]], ["kernel_kp", "sp", [-1, 32]], ["data_cp", "sp", [-1, 2]], ["data_wp", "sp", [-1, 2, 1]], ["data_hp", "sp", [-1, 4, 1]], ["bgemm_kp", "sp", [-1, 4]], ["bgemm_wp", "sp", [-1, 8, 4]], ["bgemm_hp", "sp", [-1, 1]]]}, "result": [[0.0011525632000000004], 0, 12.271817207336426, 1618321338.2923083], "version": 0.2, "tvm_version": "0.8.dev0"}
{"input": ["opencl -keys=mali,opencl,gpu -device=mali -max_num_threads=256", "winograd_2", [1, 14, 14, 256, 256, 3, 3, [1, 1], [1, 1, 1, 1]], {}], "config": {"index": 1790251, "code_hash": null, "entity": [["inv_cp", "sp", [-1, 2]], ["inv_wp", "sp", [-1, 7, 2]], ["inv_hp", "sp", [-1, 7, 2]], ["kernel_cp", "sp", [-1, 1]], ["kernel_kp", "sp", [-1, 32]], ["data_cp", "sp", [-1, 2]], ["data_wp", "sp", [-1, 2, 1]], ["data_hp", "sp", [-1, 4, 1]], ["bgemm_kp", "sp", [-1, 4]], ["bgemm_wp", "sp", [-1, 8, 4]], ["bgemm_hp", "sp", [-1, 1]]]}, "result": [[0.001147665066666667], 0, 13.830326557159424, 1618321339.634205], "version": 0.2, "tvm_version": "0.8.dev0"}
{"input": ["opencl -keys=mali,opencl,gpu -device=mali -max_num_threads=256", "winograd_2", [1, 14, 14, 256, 256, 3, 3, [1, 1], [1, 1, 1, 1]], {}], "config": {"index": 1791067, "code_hash": null, "entity": [["inv_cp", "sp", [-1, 2]], ["inv_wp", "sp", [-1, 7, 2]], ["inv_hp", "sp", [-1, 7, 2]], ["kernel_cp", "sp", [-1, 16]], ["kernel_kp", "sp", [-1, 16]], ["data_cp", "sp", [-1, 2]], ["data_wp", "sp", [-1, 2, 1]], ["data_hp", "sp", [-1, 4, 1]], ["bgemm_kp", "sp", [-1, 4]], ["bgemm_wp", "sp", [-1, 8, 4]], ["bgemm_hp", "sp", [-1, 1]]]}, "result": [[0.0011566421333333336], 0, 14.642544746398926, 1618321340.8107755], "version": 0.2, "tvm_version": "0.8.dev0"}
{"input": ["opencl -keys=mali,opencl,gpu -device=mali -max_num_threads=256", "winograd_2", [1, 14, 14, 256, 256, 3, 3, [1, 1], [1, 1, 1, 1]], {}], "config": {"index": 1790803, "code_hash": null, "entity": [["inv_cp", "sp", [-1, 2]], ["inv_wp", "sp", [-1, 7, 2]], ["inv_hp", "sp", [-1, 7, 2]], ["kernel_cp", "sp", [-1, 32]], ["kernel_kp", "sp", [-1, 8]], ["data_cp", "sp", [-1, 2]], ["data_wp", "sp", [-1, 2, 1]], ["data_hp", "sp", [-1, 4, 1]], ["bgemm_kp", "sp", [-1, 4]], ["bgemm_wp", "sp", [-1, 8, 4]], ["bgemm_hp", "sp", [-1, 1]]]}, "result": [[0.0011551232], 0, 15.998929738998413, 1618321341.9912121], "version": 0.2, "tvm_version": "0.8.dev0"}
{"input": ["opencl -keys=mali,opencl,gpu -device=mali -max_num_threads=256", "winograd_2", [1, 14, 14, 256, 256, 3, 3, [1, 1], [1, 1, 1, 1]], {}], "config": {"index": 1790827, "code_hash": null, "entity": [["inv_cp", "sp", [-1, 2]], ["inv_wp", "sp", [-1, 7, 2]], ["inv_hp", "sp", [-1, 7, 2]], ["kernel_cp", "sp", [-1, 1]], ["kernel_kp", "sp", [-1, 8]], ["data_cp", "sp", [-1, 2]], ["data_wp", "sp", [-1, 2, 1]], ["data_hp", "sp", [-1, 4, 1]], ["bgemm_kp", "sp", [-1, 4]], ["bgemm_wp", "sp", [-1, 8, 4]], ["bgemm_hp", "sp", [-1, 1]]]}, "result": [[0.0011528192], 0, 17.141971588134766, 1618321343.2645261], "version": 0.2, "tvm_version": "0.8.dev0"}
{"input": ["opencl -keys=mali,opencl,gpu -device=mali -max_num_threads=256", "winograd_2", [1, 14, 14, 256, 256, 3, 3, [1, 1], [1, 1, 1, 1]], {}], "config": {"index": 1790467, "code_hash": null, "entity": [["inv_cp", "sp", [-1, 2]], ["inv_wp", "sp", [-1, 7, 2]], ["inv_hp", "sp", [-1, 7, 2]], ["kernel_cp", "sp", [-1, 8]], ["kernel_kp", "sp", [-1, 1]], ["data_cp", "sp", [-1, 2]], ["data_wp", "sp", [-1, 2, 1]], ["data_hp", "sp", [-1, 4, 1]], ["bgemm_kp", "sp", [-1, 4]], ["bgemm_wp", "sp", [-1, 8, 4]], ["bgemm_hp", "sp", [-1, 1]]]}, "result": [[0.0011559936], 0, 18.410009384155273, 1618321344.5527031], "version": 0.2, "tvm_version": "0.8.dev0"}
{"input": ["opencl -keys=mali,opencl,gpu -device=mali -max_num_threads=256", "winograd_2", [1, 14, 14, 256, 256, 3, 3, [1, 1], [1, 1, 1, 1]], {}], "config": {"index": 1790587, "code_hash": null, "entity": [["inv_cp", "sp", [-1, 2]], ["inv_wp", "sp", [-1, 7, 2]], ["inv_hp", "sp", [-1, 7, 2]], ["kernel_cp", "sp", [-1, 4]], ["kernel_kp", "sp", [-1, 2]], ["data_cp", "sp", [-1, 2]], ["data_wp", "sp", [-1, 2, 1]], ["data_hp", "sp", [-1, 4, 1]], ["bgemm_kp", "sp", [-1, 4]], ["bgemm_wp", "sp", [-1, 8, 4]], ["bgemm_hp", "sp", [-1, 1]]]}, "result": [[0.001155584], 0, 19.612292051315308, 1618321345.7790558], "version": 0.2, "tvm_version": "0.8.dev0"}
{"input": ["opencl -keys=mali,opencl,gpu -device=mali -max_num_threads=256", "winograd_2", [1, 14, 14, 256, 256, 3, 3, [1, 1], [1, 1, 1, 1]], {}], "config": {"index": 1790899, "code_hash": null, "entity": [["inv_cp", "sp", [-1, 2]], ["inv_wp", "sp", [-1, 7, 2]], ["inv_hp", "sp", [-1, 7, 2]], ["kernel_cp", "sp", [-1, 8]], ["kernel_kp", "sp", [-1, 8]], ["data_cp", "sp", [-1, 2]], ["data_wp", "sp", [-1, 2, 1]], ["data_hp", "sp", [-1, 4, 1]], ["bgemm_kp", "sp", [-1, 4]], ["bgemm_wp", "sp", [-1, 8, 4]], ["bgemm_hp", "sp", [-1, 1]]]}, "result": [[0.0011595264000000003], 0, 20.82592487335205, 1618321346.963081], "version": 0.2, "tvm_version": "0.8.dev0"}
{"input": ["opencl -keys=mali,opencl,gpu -device=mali -max_num_threads=256", "winograd_2", [1, 14, 14, 256, 256, 3, 3, [1, 1], [1, 1, 1, 1]], {}], "config": {"index": 1790971, "code_hash": null, "entity": [["inv_cp", "sp", [-1, 2]], ["inv_wp", "sp", [-1, 7, 2]], ["inv_hp", "sp", [-1, 7, 2]], ["kernel_cp", "sp", [-1, 1]], ["kernel_kp", "sp", [-1, 16]], ["data_cp", "sp", [-1, 2]], ["data_wp", "sp", [-1, 2, 1]], ["data_hp", "sp", [-1, 4, 1]], ["bgemm_kp", "sp", [-1, 4]], ["bgemm_wp", "sp", [-1, 8, 4]], ["bgemm_hp", "sp", [-1, 1]]]}, "result": [[0.0011535018666666667], 0, 22.041921138763428, 1618321348.1544101], "version": 0.2, "tvm_version": "0.8.dev0"}
{"input": ["opencl -keys=mali,opencl,gpu -device=mali -max_num_threads=256", "winograd_2", [1, 14, 14, 256, 256, 3, 3, [1, 1], [1, 1, 1, 1]], {}], "config": {"index": 1790947, "code_hash": null, "entity": [["inv_cp", "sp", [-1, 2]], ["inv_wp", "sp", [-1, 7, 2]], ["inv_hp", "sp", [-1, 7, 2]], ["kernel_cp", "sp", [-1, 32]], ["kernel_kp", "sp", [-1, 16]], ["data_cp", "sp", [-1, 2]], ["data_wp", "sp", [-1, 2, 1]], ["data_hp", "sp", [-1, 4, 1]], ["bgemm_kp", "sp", [-1, 4]], ["bgemm_wp", "sp", [-1, 8, 4]], ["bgemm_hp", "sp", [-1, 1]]]}, "result": [[0.0011517781333333333], 0, 23.046431303024292, 1618321349.3097365], "version": 0.2, "tvm_version": "0.8.dev0"}
{"input": ["opencl -keys=mali,opencl,gpu -device=mali -max_num_threads=256", "winograd_2", [1, 14, 14, 256, 256, 3, 3, [1, 1], [1, 1, 1, 1]], {}], "config": {"index": 1790851, "code_hash": null, "entity": [["inv_cp", "sp", [-1, 2]], ["inv_wp", "sp", [-1, 7, 2]], ["inv_hp", "sp", [-1, 7, 2]], ["kernel_cp", "sp", [-1, 2]], ["kernel_kp", "sp", [-1, 8]], ["data_cp", "sp", [-1, 2]], ["data_wp", "sp", [-1, 2, 1]], ["data_hp", "sp", [-1, 4, 1]], ["bgemm_kp", "sp", [-1, 4]], ["bgemm_wp", "sp", [-1, 8, 4]], ["bgemm_hp", "sp", [-1, 1]]]}, "result": [[0.0011472042666666666], 0, 24.46798872947693, 1618321350.6112542], "version": 0.2, "tvm_version": "0.8.dev0"}
{"input": ["opencl -keys=mali,opencl,gpu -device=mali -max_num_threads=256", "winograd_2", [1, 14, 14, 256, 256, 3, 3, [1, 1], [1, 1, 1, 1]], {}], "config": {"index": 1790875, "code_hash": null, "entity": [["inv_cp", "sp", [-1, 2]], ["inv_wp", "sp", [-1, 7, 2]], ["inv_hp", "sp", [-1, 7, 2]], ["kernel_cp", "sp", [-1, 4]], ["kernel_kp", "sp", [-1, 8]], ["data_cp", "sp", [-1, 2]], ["data_wp", "sp", [-1, 2, 1]], ["data_hp", "sp", [-1, 4, 1]], ["bgemm_kp", "sp", [-1, 4]], ["bgemm_wp", "sp", [-1, 8, 4]], ["bgemm_hp", "sp", [-1, 1]]]}, "result": [[0.001130752], 0, 25.23474955558777, 1618321351.70989], "version": 0.2, "tvm_version": "0.8.dev0"}
{"input": ["opencl -keys=mali,opencl,gpu -device=mali -max_num_threads=256", "winograd_2", [1, 14, 14, 256, 256, 3, 3, [1, 1], [1, 1, 1, 1]], {}], "config": {"index": 1790419, "code_hash": null, "entity": [["inv_cp", "sp", [-1, 2]], ["inv_wp", "sp", [-1, 7, 2]], ["inv_hp", "sp", [-1, 7, 2]], ["kernel_cp", "sp", [-1, 2]], ["kernel_kp", "sp", [-1, 1]], ["data_cp", "sp", [-1, 2]], ["data_wp", "sp", [-1, 2, 1]], ["data_hp", "sp", [-1, 4, 1]], ["bgemm_kp", "sp", [-1, 4]], ["bgemm_wp", "sp", [-1, 8, 4]], ["bgemm_hp", "sp", [-1, 1]]]}, "result": [[0.0011556010666666668], 0, 26.746270656585693, 1618321353.102707], "version": 0.2, "tvm_version": "0.8.dev0"}
{"input": ["opencl -keys=mali,opencl,gpu -device=mali -max_num_threads=256", "winograd_2", [1, 14, 14, 256, 256, 3, 3, [1, 1], [1, 1, 1, 1]], {}], "config": {"index": 1791043, "code_hash": null, "entity": [["inv_cp", "sp", [-1, 2]], ["inv_wp", "sp", [-1, 7, 2]], ["inv_hp", "sp", [-1, 7, 2]], ["kernel_cp", "sp", [-1, 8]], ["kernel_kp", "sp", [-1, 16]], ["data_cp", "sp", [-1, 2]], ["data_wp", "sp", [-1, 2, 1]], ["data_hp", "sp", [-1, 4, 1]], ["bgemm_kp", "sp", [-1, 4]], ["bgemm_wp", "sp", [-1, 8, 4]], ["bgemm_hp", "sp", [-1, 1]]]}, "result": [[0.0011462485333333333], 0, 27.697521686553955, 1618321354.3178258], "version": 0.2, "tvm_version": "0.8.dev0"}
{"input": ["opencl -keys=mali,opencl,gpu -device=mali -max_num_threads=256", "winograd_2", [1, 14, 14, 256, 256, 3, 3, [1, 1], [1, 1, 1, 1]], {}], "config": {"index": 1790923, "code_hash": null, "entity": [["inv_cp", "sp", [-1, 2]], ["inv_wp", "sp", [-1, 7, 2]], ["inv_hp", "sp", [-1, 7, 2]], ["kernel_cp", "sp", [-1, 16]], ["kernel_kp", "sp", [-1, 8]], ["data_cp", "sp", [-1, 2]], ["data_wp", "sp", [-1, 2, 1]], ["data_hp", "sp", [-1, 4, 1]], ["bgemm_kp", "sp", [-1, 4]], ["bgemm_wp", "sp", [-1, 8, 4]], ["bgemm_hp", "sp", [-1, 1]]]}, "result": [[0.0011510442666666668], 0, 28.87513279914856, 1618321355.4875264], "version": 0.2, "tvm_version": "0.8.dev0"}
