test_and_tune/remote_tmali/Adreno630.wino3x3_t.log.tmp
{"input": ["opencl -keys=mali,opencl,gpu -device=mali -max_num_threads=256", "winograd_2", [1, 73, 73, 192, 80, 3, 3, [1, 1], [0, 0, 0, 0]], {}], "config": {"index": 6325804, "code_hash": null, "entity": [["inv_cp", "sp", [-1, 6]], ["inv_wp", "sp", [-1, 32, 2]], ["inv_hp", "sp", [-1, 4, 2]], ["kernel_cp", "sp", [-1, 20]], ["kernel_kp", "sp", [-1, 4]], ["data_cp", "sp", [-1, 20]], ["data_wp", "sp", [-1, 1, 1]], ["data_hp", "sp", [-1, 1, 1]], ["bgemm_kp", "sp", [-1, 4]], ["bgemm_wp", "sp", [-1, 64, 4]], ["bgemm_hp", "sp", [-1, 1]]]}, "result": [[0.009288396800000001], 0, 12.544553518295288, 1618286961.3623953], "version": 0.2, "tvm_version": "0.8.dev0"}
{"input": ["opencl -keys=mali,opencl,gpu -device=mali -max_num_threads=256", "winograd_2", [1, 73, 73, 192, 80, 3, 3, [1, 1], [0, 0, 0, 0]], {}], "config": {"index": 36352081, "code_hash": null, "entity": [["inv_cp", "sp", [-1, 2]], ["inv_wp", "sp", [-1, 8, 2]], ["inv_hp", "sp", [-1, 4, 2]], ["kernel_cp", "sp", [-1, 1]], ["kernel_kp", "sp", [-1, 8]], ["data_cp", "sp", [-1, 5]], ["data_wp", "sp", [-1, 32, 1]], ["data_hp", "sp", [-1, 1, 1]], ["bgemm_kp", "sp", [-1, 1]], ["bgemm_wp", "sp", [-1, 2, 4]], ["bgemm_hp", "sp", [-1, 1]]]}, "result": [[0.1086827776], 0, 17.849138259887695, 1618286966.4470594], "version": 0.2, "tvm_version": "0.8.dev0"}
{"input": ["opencl -keys=mali,opencl,gpu -device=mali -max_num_threads=256", "winograd_2", [1, 73, 73, 192, 80, 3, 3, [1, 1], [0, 0, 0, 0]], {}], "config": {"index": 56533347, "code_hash": null, "entity": [["inv_cp", "sp", [-1, 16]], ["inv_wp", "sp", [-1, 16, 2]], ["inv_hp", "sp", [-1, 4, 2]], ["kernel_cp", "sp", [-1, 10]], ["kernel_kp", "sp", [-1, 12]], ["data_cp", "sp", [-1, 8]], ["data_wp", "sp", [-1, 32, 1]], ["data_hp", "sp", [-1, 1, 1]], ["bgemm_kp", "sp", [-1, 2]], ["bgemm_wp", "sp", [-1, 128, 4]], ["bgemm_hp", "sp", [-1, 1]]]}, "result": [[0.0105924864], 0, 19.520970582962036, 1618286968.4686344], "version": 0.2, "tvm_version": "0.8.dev0"}
{"input": ["opencl -keys=mali,opencl,gpu -device=mali -max_num_threads=256", "winograd_2", [1, 73, 73, 192, 80, 3, 3, [1, 1], [0, 0, 0, 0]], {}], "config": {"index": 65707984, "code_hash": null, "entity": [["inv_cp", "sp", [-1, 6]], ["inv_wp", "sp", [-1, 8, 2]], ["inv_hp", "sp", [-1, 16, 2]], ["kernel_cp", "sp", [-1, 20]], ["kernel_kp", "sp", [-1, 4]], ["data_cp", "sp", [-1, 4]], ["data_wp", "sp", [-1, 1, 1]], ["data_hp", "sp", [-1, 37, 1]], ["bgemm_kp", "sp", [-1, 8]], ["bgemm_wp", "sp", [-1, 128, 4]], ["bgemm_hp", "sp", [-1, 1]]]}, "result": [[0.0105713408], 0, 18.64277482032776, 1618286970.5044367], "version": 0.2, "tvm_version": "0.8.dev0"}
{"input": ["opencl -keys=mali,opencl,gpu -device=mali -max_num_threads=256", "winograd_2", [1, 73, 73, 192, 80, 3, 3, [1, 1], [0, 0, 0, 0]], {}], "config": {"index": 93418823, "code_hash": null, "entity": [["inv_cp", "sp", [-1, 4]], ["inv_wp", "sp", [-1, 37, 2]], ["inv_hp", "sp", [-1, 4, 2]], ["kernel_cp", "sp", [-1, 5]], ["kernel_kp", "sp", [-1, 24]], ["data_cp", "sp", [-1, 10]], ["data_wp", "sp", [-1, 37, 1]], ["data_hp", "sp", [-1, 1, 1]], ["bgemm_kp", "sp", [-1, 2]], ["bgemm_wp", "sp", [-1, 196, 4]], ["bgemm_hp", "sp", [-1, 1]]]}, "result": [[0.0097033216], 0, 13.191498517990112, 1618287001.1086864], "version": 0.2, "tvm_version": "0.8.dev0"}
{"input": ["opencl -keys=mali,opencl,gpu -device=mali -max_num_threads=256", "winograd_2", [1, 73, 73, 192, 80, 3, 3, [1, 1], [0, 0, 0, 0]], {}], "config": {"index": 194181791, "code_hash": null, "entity": [["inv_cp", "sp", [-1, 2]], ["inv_wp", "sp", [-1, 16, 2]], ["inv_hp", "sp", [-1, 32, 2]], ["kernel_cp", "sp", [-1, 20]], ["kernel_kp", "sp", [-1, 16]], ["data_cp", "sp", [-1, 5]], ["data_wp", "sp", [-1, 37, 1]], ["data_hp", "sp", [-1, 1, 1]], ["bgemm_kp", "sp", [-1, 12]], ["bgemm_wp", "sp", [-1, 16, 4]], ["bgemm_hp", "sp", [-1, 1]]]}, "result": [[0.0041761792], 0, 14.322457551956177, 1618287002.9520388], "version": 0.2, "tvm_version": "0.8.dev0"}
{"input": ["opencl -keys=mali,opencl,gpu -device=mali -max_num_threads=256", "winograd_2", [1, 73, 73, 192, 80, 3, 3, [1, 1], [0, 0, 0, 0]], {}], "config": {"index": 242852363, "code_hash": null, "entity": [["inv_cp", "sp", [-1, 4]], ["inv_wp", "sp", [-1, 4, 2]], ["inv_hp", "sp", [-1, 37, 2]], ["kernel_cp", "sp", [-1, 2]], ["kernel_kp", "sp", [-1, 16]], ["data_cp", "sp", [-1, 5]], ["data_wp", "sp", [-1, 16, 1]], ["data_hp", "sp", [-1, 1, 1]], ["bgemm_kp", "sp", [-1, 4]], ["bgemm_wp", "sp", [-1, 32, 4]], ["bgemm_hp", "sp", [-1, 1]]]}, "result": [[0.0045231616], 0, 12.735636711120605, 1618287008.099871], "version": 0.2, "tvm_version": "0.8.dev0"}
{"input": ["opencl -keys=mali,opencl,gpu -device=mali -max_num_threads=256", "winograd_2", [1, 28, 28, 128, 128, 3, 3, [1, 1], [1, 1, 1, 1]], {}], "config": {"index": 30956160, "code_hash": null, "entity": [["inv_cp", "sp", [-1, 32]], ["inv_wp", "sp", [-1, 4, 2]], ["inv_hp", "sp", [-1, 4, 2]], ["kernel_cp", "sp", [-1, 32]], ["kernel_kp", "sp", [-1, 8]], ["data_cp", "sp", [-1, 2]], ["data_wp", "sp", [-1, 7, 1]], ["data_hp", "sp", [-1, 8, 1]], ["bgemm_kp", "sp", [-1, 1]], ["bgemm_wp", "sp", [-1, 49, 4]], ["bgemm_hp", "sp", [-1, 1]]]}, "result": [[0.0007949311999999999], 0, 8.75118088722229, 1618290530.9614263], "version": 0.2, "tvm_version": "0.8.dev0"}
{"input": ["opencl -keys=mali,opencl,gpu -device=mali -max_num_threads=256", "winograd_2", [1, 28, 28, 128, 128, 3, 3, [1, 1], [1, 1, 1, 1]], {}], "config": {"index": 21089552, "code_hash": null, "entity": [["inv_cp", "sp", [-1, 4]], ["inv_wp", "sp", [-1, 8, 2]], ["inv_hp", "sp", [-1, 7, 2]], ["kernel_cp", "sp", [-1, 4]], ["kernel_kp", "sp", [-1, 8]], ["data_cp", "sp", [-1, 2]], ["data_wp", "sp", [-1, 4, 1]], ["data_hp", "sp", [-1, 14, 1]], ["bgemm_kp", "sp", [-1, 4]], ["bgemm_wp", "sp", [-1, 8, 4]], ["bgemm_hp", "sp", [-1, 1]]]}, "result": [[0.0011706624000000002], 0, 11.11569094657898, 1618290533.6162107], "version": 0.2, "tvm_version": "0.8.dev0"}
{"input": ["opencl -keys=mali,opencl,gpu -device=mali -max_num_threads=256", "winograd_2", [1, 28, 28, 128, 128, 3, 3, [1, 1], [1, 1, 1, 1]], {}], "config": {"index": 7914171, "code_hash": null, "entity": [["inv_cp", "sp", [-1, 2]], ["inv_wp", "sp", [-1, 8, 2]], ["inv_hp", "sp", [-1, 4, 2]], ["kernel_cp", "sp", [-1, 16]], ["kernel_kp", "sp", [-1, 16]], ["data_cp", "sp", [-1, 16]], ["data_wp", "sp", [-1, 2, 1]], ["data_hp", "sp", [-1, 8, 1]], ["bgemm_kp", "sp", [-1, 32]], ["bgemm_wp", "sp", [-1, 2, 4]], ["bgemm_hp", "sp", [-1, 1]]]}, "result": [[0.0009666047999999999], 0, 11.206115961074829, 1618290532.7312565], "version": 0.2, "tvm_version": "0.8.dev0"}
{"input": ["opencl -keys=mali,opencl,gpu -device=mali -max_num_threads=256", "winograd_2", [1, 28, 28, 128, 128, 3, 3, [1, 1], [1, 1, 1, 1]], {}], "config": {"index": 11646973, "code_hash": null, "entity": [["inv_cp", "sp", [-1, 8]], ["inv_wp", "sp", [-1, 8, 2]], ["inv_hp", "sp", [-1, 4, 2]], ["kernel_cp", "sp", [-1, 4]], ["kernel_kp", "sp", [-1, 32]], ["data_cp", "sp", [-1, 32]], ["data_wp", "sp", [-1, 4, 1]], ["data_hp", "sp", [-1, 8, 1]], ["bgemm_kp", "sp", [-1, 32]], ["bgemm_wp", "sp", [-1, 4, 4]], ["bgemm_hp", "sp", [-1, 1]]]}, "result": [[0.0006655487999999999], 0, 9.151947259902954, 1618290531.837892], "version": 0.2, "tvm_version": "0.8.dev0"}
{"input": ["opencl -keys=mali,opencl,gpu -device=mali -max_num_threads=256", "winograd_2", [1, 28, 28, 128, 128, 3, 3, [1, 1], [1, 1, 1, 1]], {}], "config": {"index": 24055347, "code_hash": null, "entity": [["inv_cp", "sp", [-1, 4]], ["inv_wp", "sp", [-1, 7, 2]], ["inv_hp", "sp", [-1, 14, 2]], ["kernel_cp", "sp", [-1, 1]], ["kernel_kp", "sp", [-1, 4]], ["data_cp", "sp", [-1, 32]], ["data_wp", "sp", [-1, 1, 1]], ["data_hp", "sp", [-1, 8, 1]], ["bgemm_kp", "sp", [-1, 2]], ["bgemm_wp", "sp", [-1, 14, 4]], ["bgemm_hp", "sp", [-1, 1]]]}, "result": [[0.0013667584], 0, 12.47648310661316, 1618290534.5284016], "version": 0.2, "tvm_version": "0.8.dev0"}
{"input": ["opencl -keys=mali,opencl,gpu -device=mali -max_num_threads=256", "winograd_2", [1, 28, 28, 128, 128, 3, 3, [1, 1], [1, 1, 1, 1]], {}], "config": {"index": 22825476, "code_hash": null, "entity": [["inv_cp", "sp", [-1, 2]], ["inv_wp", "sp", [-1, 14, 2]], ["inv_hp", "sp", [-1, 7, 2]], ["kernel_cp", "sp", [-1, 32]], ["kernel_kp", "sp", [-1, 4]], ["data_cp", "sp", [-1, 16]], ["data_wp", "sp", [-1, 1, 1]], ["data_hp", "sp", [-1, 8, 1]], ["bgemm_kp", "sp", [-1, 32]], ["bgemm_wp", "sp", [-1, 14, 4]], ["bgemm_hp", "sp", [-1, 1]]]}, "result": [[0.0006912255999999998], 0, 14.062922716140747, 1618290536.324296], "version": 0.2, "tvm_version": "0.8.dev0"}
{"input": ["opencl -keys=mali,opencl,gpu -device=mali -max_num_threads=256", "winograd_2", [1, 28, 28, 128, 128, 3, 3, [1, 1], [1, 1, 1, 1]], {}], "config": {"index": 20827125, "code_hash": null, "entity": [["inv_cp", "sp", [-1, 32]], ["inv_wp", "sp", [-1, 7, 2]], ["inv_hp", "sp", [-1, 4, 2]], ["kernel_cp", "sp", [-1, 16]], ["kernel_kp", "sp", [-1, 4]], ["data_cp", "sp", [-1, 1]], ["data_wp", "sp", [-1, 14, 1]], ["data_hp", "sp", [-1, 4, 1]], ["bgemm_kp", "sp", [-1, 4]], ["bgemm_wp", "sp", [-1, 8, 4]], ["bgemm_hp", "sp", [-1, 1]]]}, "result": [[0.0011659008], 0, 10.339385032653809, 1618290535.4345784], "version": 0.2, "tvm_version": "0.8.dev0"}
{"input": ["opencl -keys=mali,opencl,gpu -device=mali -max_num_threads=256", "winograd_2", [1, 28, 28, 128, 128, 3, 3, [1, 1], [1, 1, 1, 1]], {}], "config": {"index": 12132931, "code_hash": null, "entity": [["inv_cp", "sp", [-1, 2]], ["inv_wp", "sp", [-1, 8, 2]], ["inv_hp", "sp", [-1, 8, 2]], ["kernel_cp", "sp", [-1, 16]], ["kernel_kp", "sp", [-1, 8]], ["data_cp", "sp", [-1, 32]], ["data_wp", "sp", [-1, 1, 1]], ["data_hp", "sp", [-1, 7, 1]], ["bgemm_kp", "sp", [-1, 1]], ["bgemm_wp", "sp", [-1, 4, 4]], ["bgemm_hp", "sp", [-1, 1]]]}, "result": [[0.008017792], 0, 15.577503442764282, 1618290537.437717], "version": 0.2, "tvm_version": "0.8.dev0"}
{"input": ["opencl -keys=mali,opencl,gpu -device=mali -max_num_threads=256", "winograd_2", [1, 28, 28, 128, 128, 3, 3, [1, 1], [1, 1, 1, 1]], {}], "config": {"index": 954192, "code_hash": null, "entity": [["inv_cp", "sp", [-1, 4]], ["inv_wp", "sp", [-1, 8, 2]], ["inv_hp", "sp", [-1, 7, 2]], ["kernel_cp", "sp", [-1, 16]], ["kernel_kp", "sp", [-1, 1]], ["data_cp", "sp", [-1, 1]], ["data_wp", "sp", [-1, 2, 1]], ["data_hp", "sp", [-1, 7, 1]], ["bgemm_kp", "sp", [-1, 1]], ["bgemm_wp", "sp", [-1, 32, 4]], ["bgemm_hp", "sp", [-1, 1]]]}, "result": [[0.0013827840000000002], 0, 15.596639156341553, 1618290538.351582], "version": 0.2, "tvm_version": "0.8.dev0"}
{"input": ["opencl -keys=mali,opencl,gpu -device=mali -max_num_threads=256", "winograd_2", [1, 28, 28, 128, 128, 3, 3, [1, 1], [1, 1, 1, 1]], {}], "config": {"index": 23118516, "code_hash": null, "entity": [["inv_cp", "sp", [-1, 2]], ["inv_wp", "sp", [-1, 14, 2]], ["inv_hp", "sp", [-1, 7, 2]], ["kernel_cp", "sp", [-1, 4]], ["kernel_kp", "sp", [-1, 1]], ["data_cp", "sp", [-1, 16]], ["data_wp", "sp", [-1, 14, 1]], ["data_hp", "sp", [-1, 1, 1]], ["bgemm_kp", "sp", [-1, 1]], ["bgemm_wp", "sp", [-1, 14, 4]], ["bgemm_hp", "sp", [-1, 1]]]}, "result": [[0.0026379776], 0, 14.972039222717285, 1618290539.3012364], "version": 0.2, "tvm_version": "0.8.dev0"}
{"input": ["opencl -keys=mali,opencl,gpu -device=mali -max_num_threads=256", "winograd_2", [1, 28, 28, 128, 128, 3, 3, [1, 1], [1, 1, 1, 1]], {}], "config": {"index": 16704007, "code_hash": null, "entity": [["inv_cp", "sp", [-1, 4]], ["inv_wp", "sp", [-1, 7, 2]], ["inv_hp", "sp", [-1, 4, 2]], ["kernel_cp", "sp", [-1, 32]], ["kernel_kp", "sp", [-1, 32]], ["data_cp", "sp", [-1, 8]], ["data_wp", "sp", [-1, 1, 1]], ["data_hp", "sp", [-1, 14, 1]], ["bgemm_kp", "sp", [-1, 2]], ["bgemm_wp", "sp", [-1, 7, 4]], ["bgemm_hp", "sp", [-1, 1]]]}, "result": [[0.0022391296], 0, 15.303390979766846, 1618290540.247078], "version": 0.2, "tvm_version": "0.8.dev0"}
