test_and_tune/remote_tmali/MaliG76.topinhw4c1.log.tmp
{"input": ["opencl -keys=opencl,gpu -max_num_threads=256", "tutorial/conv2d_no_batching", [1, 14, 14, 512, 256, 3, 3, [2, 2], [1, 1, 1, 1]], {}], "config": {"index": 22273, "code_hash": null, "entity": [["idtype", "ot", 1], ["kdtype", "ot", 0], ["wdtype", "ot", 0], ["tile_ic", "sp", [-1, 1, 4]], ["tile_ow", "sp", [-1, 1]], ["tile_oh", "sp", [-1, 4]], ["tile_bindthread", "sp", [-1, 1, 2, 2, 1, 1]]]}, "result": [[0.0015994116], 0, 1.9568963050842285, 1615984378.181047], "version": 0.2, "tvm_version": "0.8.dev0"}
{"input": ["opencl -keys=opencl,gpu -max_num_threads=256", "tutorial/conv2d_no_batching", [1, 14, 14, 512, 256, 3, 3, [2, 2], [1, 1, 1, 1]], {}], "config": {"index": 284944, "code_hash": null, "entity": [["idtype", "ot", 0], ["kdtype", "ot", 0], ["wdtype", "ot", 0], ["tile_ic", "sp", [-1, 4, 4]], ["tile_ow", "sp", [-1, 1]], ["tile_oh", "sp", [-1, 4]], ["tile_bindthread", "sp", [-1, 2, 8, 1, 1, 4]]]}, "result": [[0.0048993077], 0, 1.1111407279968262, 1615984377.3092835], "version": 0.2, "tvm_version": "0.8.dev0"}
{"input": ["opencl -keys=opencl,gpu -max_num_threads=256", "tutorial/conv2d_no_batching", [1, 14, 14, 512, 256, 3, 3, [2, 2], [1, 1, 1, 1]], {}], "config": {"index": 202180, "code_hash": null, "entity": [["idtype", "ot", 0], ["kdtype", "ot", 0], ["wdtype", "ot", 2], ["tile_ic", "sp", [-1, 1, 4]], ["tile_ow", "sp", [-1, 4]], ["tile_oh", "sp", [-1, 8]], ["tile_bindthread", "sp", [-1, 1, 1, 8, 1, 2]]]}, "result": [[0.0149367692], 0, 3.6299591064453125, 1615984379.6773994], "version": 0.2, "tvm_version": "0.8.dev0"}
{"input": ["opencl -keys=opencl,gpu -max_num_threads=256", "tutorial/conv2d_no_batching", [1, 14, 14, 512, 256, 3, 3, [2, 2], [1, 1, 1, 1]], {}], "config": {"index": 343131, "code_hash": null, "entity": [["idtype", "ot", 1], ["kdtype", "ot", 1], ["wdtype", "ot", 0], ["tile_ic", "sp", [-1, 8, 4]], ["tile_ow", "sp", [-1, 4]], ["tile_oh", "sp", [-1, 1]], ["tile_bindthread", "sp", [-1, 16, 1, 1, 1, 8]]]}, "result": [[0.007312269200000001], 0, 4.8347859382629395, 1615984380.8476777], "version": 0.2, "tvm_version": "0.8.dev0"}
{"input": ["opencl -keys=opencl,gpu -max_num_threads=256", "tutorial/conv2d_no_batching", [1, 14, 14, 512, 256, 3, 3, [2, 2], [1, 1, 1, 1]], {}], "config": {"index": 50495, "code_hash": null, "entity": [["idtype", "ot", 1], ["kdtype", "ot", 1], ["wdtype", "ot", 2], ["tile_ic", "sp", [-1, 8, 4]], ["tile_ow", "sp", [-1, 2]], ["tile_oh", "sp", [-1, 4]], ["tile_bindthread", "sp", [-1, 2, 8, 8, 1, 1]]]}, "result": [[0.0079530577], 0, 6.517675399780273, 1615984382.4504316], "version": 0.2, "tvm_version": "0.8.dev0"}
{"input": ["opencl -keys=opencl,gpu -max_num_threads=256", "tutorial/conv2d_no_batching", [1, 14, 14, 512, 256, 3, 3, [2, 2], [1, 1, 1, 1]], {}], "config": {"index": 294231, "code_hash": null, "entity": [["idtype", "ot", 1], ["kdtype", "ot", 1], ["wdtype", "ot", 2], ["tile_ic", "sp", [-1, 4, 4]], ["tile_ow", "sp", [-1, 4]], ["tile_oh", "sp", [-1, 4]], ["tile_bindthread", "sp", [-1, 2, 8, 2, 1, 4]]]}, "result": [[0.0109163577], 0, 8.481624364852905, 1615984384.3319864], "version": 0.2, "tvm_version": "0.8.dev0"}
{"input": ["opencl -keys=opencl,gpu -max_num_threads=256", "tutorial/conv2d_no_batching", [1, 14, 14, 512, 256, 3, 3, [2, 2], [1, 1, 1, 1]], {}], "config": {"index": 165424, "code_hash": null, "entity": [["idtype", "ot", 0], ["kdtype", "ot", 0], ["wdtype", "ot", 0], ["tile_ic", "sp", [-1, 4, 4]], ["tile_ow", "sp", [-1, 2]], ["tile_oh", "sp", [-1, 1]], ["tile_bindthread", "sp", [-1, 1, 2, 2, 32, 1]]]}, "result": [[0.0060465577], 0, 9.277465105056763, 1615984385.5461395], "version": 0.2, "tvm_version": "0.8.dev0"}
{"input": ["opencl -keys=opencl,gpu -max_num_threads=256", "tutorial/conv2d_no_batching", [1, 14, 14, 512, 256, 3, 3, [2, 2], [1, 1, 1, 1]], {}], "config": {"index": 324406, "code_hash": null, "entity": [["idtype", "ot", 0], ["kdtype", "ot", 1], ["wdtype", "ot", 2], ["tile_ic", "sp", [-1, 4, 4]], ["tile_ow", "sp", [-1, 2]], ["tile_oh", "sp", [-1, 4]], ["tile_bindthread", "sp", [-1, 4, 1, 1, 4, 4]]]}, "result": [[0.00789845], 0, 10.827356100082397, 1615984386.9331424], "version": 0.2, "tvm_version": "0.8.dev0"}
{"input": ["opencl -keys=opencl,gpu -max_num_threads=256", "tutorial/conv2d_no_batching", [1, 14, 14, 512, 256, 3, 3, [2, 2], [1, 1, 1, 1]], {}], "config": {"index": 67304, "code_hash": null, "entity": [["idtype", "ot", 0], ["kdtype", "ot", 0], ["wdtype", "ot", 0], ["tile_ic", "sp", [-1, 2, 4]], ["tile_ow", "sp", [-1, 8]], ["tile_oh", "sp", [-1, 2]], ["tile_bindthread", "sp", [-1, 16, 2, 1, 2, 1]]]}, "result": [[0.0170821577], 0, 12.581571817398071, 1615984388.7287133], "version": 0.2, "tvm_version": "0.8.dev0"}
{"input": ["opencl -keys=opencl,gpu -max_num_threads=256", "tutorial/conv2d_no_batching", [1, 14, 14, 512, 256, 3, 3, [2, 2], [1, 1, 1, 1]], {}], "config": {"index": 202638, "code_hash": null, "entity": [["idtype", "ot", 0], ["kdtype", "ot", 1], ["wdtype", "ot", 2], ["tile_ic", "sp", [-1, 2, 4]], ["tile_ow", "sp", [-1, 1]], ["tile_oh", "sp", [-1, 8]], ["tile_bindthread", "sp", [-1, 2, 1, 8, 1, 2]]]}, "result": [[0.0047795615], 0, 13.548855304718018, 1615984389.7472827], "version": 0.2, "tvm_version": "0.8.dev0"}
{"input": ["opencl -keys=opencl,gpu -max_num_threads=256", "tutorial/conv2d_no_batching", [1, 14, 14, 512, 256, 3, 3, [2, 2], [1, 1, 1, 1]], {}], "config": {"index": 78503, "code_hash": null, "entity": [["idtype", "ot", 1], ["kdtype", "ot", 1], ["wdtype", "ot", 2], ["tile_ic", "sp", [-1, 1, 4]], ["tile_ow", "sp", [-1, 2]], ["tile_oh", "sp", [-1, 2]], ["tile_bindthread", "sp", [-1, 32, 1, 2, 2, 1]]]}, "result": [[0.00113745], 0, 14.390486001968384, 1615984390.64643], "version": 0.2, "tvm_version": "0.8.dev0"}
{"input": ["opencl -keys=opencl,gpu -max_num_threads=256", "tutorial/conv2d_no_batching", [1, 14, 14, 512, 256, 3, 3, [2, 2], [1, 1, 1, 1]], {}], "config": {"index": 200676, "code_hash": null, "entity": [["idtype", "ot", 0], ["kdtype", "ot", 0], ["wdtype", "ot", 2], ["tile_ic", "sp", [-1, 1, 4]], ["tile_ow", "sp", [-1, 8]], ["tile_oh", "sp", [-1, 8]], ["tile_bindthread", "sp", [-1, 1, 8, 4, 1, 2]]]}, "result": [[0.0106231308], 0, 16.083602905273438, 1615984392.0199342], "version": 0.2, "tvm_version": "0.8.dev0"}
{"input": ["opencl -keys=opencl,gpu -max_num_threads=256", "tutorial/conv2d_no_batching", [1, 14, 14, 512, 256, 3, 3, [2, 2], [1, 1, 1, 1]], {}], "config": {"index": 84445, "code_hash": null, "entity": [["idtype", "ot", 1], ["kdtype", "ot", 0], ["wdtype", "ot", 2], ["tile_ic", "sp", [-1, 8, 4]], ["tile_ow", "sp", [-1, 4]], ["tile_oh", "sp", [-1, 8]], ["tile_bindthread", "sp", [-1, 2, 8, 2, 2, 1]]]}, "result": [[0.0320708385], 0, 21.472233295440674, 1615984396.9916177], "version": 0.2, "tvm_version": "0.8.dev0"}
{"input": ["opencl -keys=opencl,gpu -max_num_threads=256", "tutorial/conv2d_no_batching", [1, 14, 14, 512, 256, 3, 3, [2, 2], [1, 1, 1, 1]], {}], "config": {"index": 121711, "code_hash": null, "entity": [["idtype", "ot", 1], ["kdtype", "ot", 1], ["wdtype", "ot", 2], ["tile_ic", "sp", [-1, 2, 4]], ["tile_ow", "sp", [-1, 8]], ["tile_oh", "sp", [-1, 4]], ["tile_bindthread", "sp", [-1, 1, 8, 2, 4, 1]]]}, "result": [[0.017799503799999998], 0, 24.08142113685608, 1615984399.9384637], "version": 0.2, "tvm_version": "0.8.dev0"}
{"input": ["opencl -keys=opencl,gpu -max_num_threads=256", "tutorial/conv2d_no_batching", [1, 14, 14, 512, 256, 3, 3, [2, 2], [1, 1, 1, 1]], {}], "config": {"index": 192655, "code_hash": null, "entity": [["idtype", "ot", 1], ["kdtype", "ot", 1], ["wdtype", "ot", 2], ["tile_ic", "sp", [-1, 2, 4]], ["tile_ow", "sp", [-1, 1]], ["tile_oh", "sp", [-1, 2]], ["tile_bindthread", "sp", [-1, 1, 16, 2, 1, 2]]]}, "result": [[0.0013507308000000001], 0, 21.860701084136963, 1615984398.1035821], "version": 0.2, "tvm_version": "0.8.dev0"}
{"input": ["opencl -keys=opencl,gpu -max_num_threads=256", "tutorial/conv2d_no_batching", [1, 14, 14, 512, 256, 3, 3, [2, 2], [1, 1, 1, 1]], {}], "config": {"index": 61821, "code_hash": null, "entity": [["idtype", "ot", 1], ["kdtype", "ot", 0], ["wdtype", "ot", 2], ["tile_ic", "sp", [-1, 8, 4]], ["tile_ow", "sp", [-1, 8]], ["tile_oh", "sp", [-1, 4]], ["tile_bindthread", "sp", [-1, 1, 1, 1, 2, 1]]]}, "result": [[0.0421380154], 0, 29.818440198898315, 1615984405.4033334], "version": 0.2, "tvm_version": "0.8.dev0"}
{"input": ["opencl -keys=opencl,gpu -max_num_threads=256", "tutorial/conv2d_no_batching", [1, 14, 14, 512, 256, 3, 3, [2, 2], [1, 1, 1, 1]], {}], "config": {"index": 271237, "code_hash": null, "entity": [["idtype", "ot", 1], ["kdtype", "ot", 0], ["wdtype", "ot", 2], ["tile_ic", "sp", [-1, 1, 4]], ["tile_ow", "sp", [-1, 1]], ["tile_oh", "sp", [-1, 8]], ["tile_bindthread", "sp", [-1, 2, 2, 1, 16, 2]]]}, "result": [[0.0039844616], 0, 24.736280918121338, 1615984400.974426], "version": 0.2, "tvm_version": "0.8.dev0"}
{"input": ["opencl -keys=opencl,gpu -max_num_threads=256", "tutorial/conv2d_no_batching", [1, 14, 14, 512, 256, 3, 3, [2, 2], [1, 1, 1, 1]], {}], "config": {"index": 185778, "code_hash": null, "entity": [["idtype", "ot", 0], ["kdtype", "ot", 1], ["wdtype", "ot", 0], ["tile_ic", "sp", [-1, 4, 4]], ["tile_ow", "sp", [-1, 2]], ["tile_oh", "sp", [-1, 8]], ["tile_bindthread", "sp", [-1, 16, 1, 2, 1, 2]]]}, "result": [[0.0144514269], 0, 31.66798496246338, 1615984407.6962419], "version": 0.2, "tvm_version": "0.8.dev0"}
{"input": ["opencl -keys=opencl,gpu -max_num_threads=256", "tutorial/conv2d_no_batching", [1, 14, 14, 512, 256, 3, 3, [2, 2], [1, 1, 1, 1]], {}], "config": {"index": 294734, "code_hash": null, "entity": [["idtype", "ot", 0], ["kdtype", "ot", 1], ["wdtype", "ot", 2], ["tile_ic", "sp", [-1, 2, 4]], ["tile_ow", "sp", [-1, 4]], ["tile_oh", "sp", [-1, 4]], ["tile_bindthread", "sp", [-1, 1, 16, 2, 1, 4]]]}, "result": [[0.0101652154], 0, 33.148069620132446, 1615984409.2469923], "version": 0.2, "tvm_version": "0.8.dev0"}
{"input": ["opencl -keys=opencl,gpu -max_num_threads=256", "tutorial/conv2d_no_batching", [1, 14, 14, 512, 256, 3, 3, [2, 2], [1, 1, 1, 1]], {}], "config": {"index": 2970, "code_hash": null, "entity": [["idtype", "ot", 0], ["kdtype", "ot", 1], ["wdtype", "ot", 0], ["tile_ic", "sp", [-1, 8, 4]], ["tile_ow", "sp", [-1, 1]], ["tile_oh", "sp", [-1, 8]], ["tile_bindthread", "sp", [-1, 32, 1, 1, 1, 1]]]}, "result": [[0.026397023], 0, 35.14872479438782, 1615984411.213488], "version": 0.2, "tvm_version": "0.8.dev0"}
{"input": ["opencl -keys=opencl,gpu -max_num_threads=256", "tutorial/conv2d_no_batching", [1, 14, 14, 512, 256, 3, 3, [2, 2], [1, 1, 1, 1]], {}], "config": {"index": 362591, "code_hash": null, "entity": [["idtype", "ot", 1], ["kdtype", "ot", 1], ["wdtype", "ot", 2], ["tile_ic", "sp", [-1, 8, 4]], ["tile_ow", "sp", [-1, 4]], ["tile_oh", "sp", [-1, 1]], ["tile_bindthread", "sp", [-1, 1, 4, 1, 2, 8]]]}, "result": [[0.0071742654], 0, 1.4974803924560547, 1615984413.3987842], "version": 0.2, "tvm_version": "0.8.dev0"}
{"input": ["opencl -keys=opencl,gpu -max_num_threads=256", "tutorial/conv2d_no_batching", [1, 14, 14, 512, 256, 3, 3, [2, 2], [1, 1, 1, 1]], {}], "config": {"index": 287826, "code_hash": null, "entity": [["idtype", "ot", 0], ["kdtype", "ot", 1], ["wdtype", "ot", 0], ["tile_ic", "sp", [-1, 4, 4]], ["tile_ow", "sp", [-1, 4]], ["tile_oh", "sp", [-1, 1]], ["tile_bindthread", "sp", [-1, 2, 1, 2, 1, 4]]]}, "result": [[0.0050516769000000005], 0, 2.501918077468872, 1615984414.4036329], "version": 0.2, "tvm_version": "0.8.dev0"}
{"input": ["opencl -keys=opencl,gpu -max_num_threads=256", "tutorial/conv2d_no_batching", [1, 14, 14, 512, 256, 3, 3, [2, 2], [1, 1, 1, 1]], {}], "config": {"index": 63817, "code_hash": null, "entity": [["idtype", "ot", 1], ["kdtype", "ot", 0], ["wdtype", "ot", 0], ["tile_ic", "sp", [-1, 2, 4]], ["tile_ow", "sp", [-1, 4]], ["tile_oh", "sp", [-1, 4]], ["tile_bindthread", "sp", [-1, 16, 1, 1, 2, 1]]]}, "result": [[0.0166435653], 0, 4.3089330196380615, 1615984416.0024993], "version": 0.2, "tvm_version": "0.8.dev0"}
{"input": ["opencl -keys=opencl,gpu -max_num_threads=256", "tutorial/conv2d_no_batching", [1, 14, 14, 512, 256, 3, 3, [2, 2], [1, 1, 1, 1]], {}], "config": {"index": 127909, "code_hash": null, "entity": [["idtype", "ot", 1], ["kdtype", "ot", 0], ["wdtype", "ot", 2], ["tile_ic", "sp", [-1, 1, 4]], ["tile_ow", "sp", [-1, 2]], ["tile_oh", "sp", [-1, 8]], ["tile_bindthread", "sp", [-1, 1, 8, 4, 4, 1]]]}, "result": [[0.0095160769], 0, 5.0797600746154785, 1615984417.1848555], "version": 0.2, "tvm_version": "0.8.dev0"}
{"input": ["opencl -keys=opencl,gpu -max_num_threads=256", "tutorial/conv2d_no_batching", [1, 14, 14, 512, 256, 3, 3, [2, 2], [1, 1, 1, 1]], {}], "config": {"index": 159355, "code_hash": null, "entity": [["idtype", "ot", 1], ["kdtype", "ot", 1], ["wdtype", "ot", 0], ["tile_ic", "sp", [-1, 8, 4]], ["tile_ow", "sp", [-1, 8]], ["tile_oh", "sp", [-1, 1]], ["tile_bindthread", "sp", [-1, 1, 1, 4, 16, 1]]]}, "result": [[0.0062603192], 0, 6.5874924659729, 1615984418.3064427], "version": 0.2, "tvm_version": "0.8.dev0"}
{"input": ["opencl -keys=opencl,gpu -max_num_threads=256", "tutorial/conv2d_no_batching", [1, 14, 14, 512, 256, 3, 3, [2, 2], [1, 1, 1, 1]], {}], "config": {"index": 371426, "code_hash": null, "entity": [["idtype", "ot", 0], ["kdtype", "ot", 1], ["wdtype", "ot", 0], ["tile_ic", "sp", [-1, 1, 4]], ["tile_ow", "sp", [-1, 8]], ["tile_oh", "sp", [-1, 2]], ["tile_bindthread", "sp", [-1, 2, 2, 1, 4, 8]]]}, "result": [[0.008725588400000001], 0, 7.431816101074219, 1615984419.3704128], "version": 0.2, "tvm_version": "0.8.dev0"}
{"input": ["opencl -keys=opencl,gpu -max_num_threads=256", "tutorial/conv2d_no_batching", [1, 14, 14, 512, 256, 3, 3, [2, 2], [1, 1, 1, 1]], {}], "config": {"index": 18552, "code_hash": null, "entity": [["idtype", "ot", 0], ["kdtype", "ot", 0], ["wdtype", "ot", 0], ["tile_ic", "sp", [-1, 8, 4]], ["tile_ow", "sp", [-1, 8]], ["tile_oh", "sp", [-1, 1]], ["tile_bindthread", "sp", [-1, 1, 1, 2, 1, 1]]]}, "result": [[0.013270726899999998], 0, 9.044560432434082, 1615984420.803394], "version": 0.2, "tvm_version": "0.8.dev0"}
{"input": ["opencl -keys=opencl,gpu -max_num_threads=256", "tutorial/conv2d_no_batching", [1, 14, 14, 512, 256, 3, 3, [2, 2], [1, 1, 1, 1]], {}], "config": {"index": 155014, "code_hash": null, "entity": [["idtype", "ot", 0], ["kdtype", "ot", 1], ["wdtype", "ot", 2], ["tile_ic", "sp", [-1, 1, 4]], ["tile_ow", "sp", [-1, 1]], ["tile_oh", "sp", [-1, 8]], ["tile_bindthread", "sp", [-1, 1, 4, 1, 16, 1]]]}, "result": [[0.004682588499999999], 0, 9.717895269393921, 1615984421.7595055], "version": 0.2, "tvm_version": "0.8.dev0"}
{"input": ["opencl -keys=opencl,gpu -max_num_threads=256", "tutorial/conv2d_no_batching", [1, 14, 14, 512, 256, 3, 3, [2, 2], [1, 1, 1, 1]], {}], "config": {"index": 67227, "code_hash": null, "entity": [["idtype", "ot", 1], ["kdtype", "ot", 1], ["wdtype", "ot", 0], ["tile_ic", "sp", [-1, 8, 4]], ["tile_ow", "sp", [-1, 1]], ["tile_oh", "sp", [-1, 2]], ["tile_bindthread", "sp", [-1, 16, 2, 1, 2, 1]]]}, "result": [[0.015587923100000001], 0, 11.274620532989502, 1615984423.0647373], "version": 0.2, "tvm_version": "0.8.dev0"}
{"input": ["opencl -keys=opencl,gpu -max_num_threads=256", "tutorial/conv2d_no_batching", [1, 14, 14, 512, 256, 3, 3, [2, 2], [1, 1, 1, 1]], {}], "config": {"index": 61927, "code_hash": null, "entity": [["idtype", "ot", 1], ["kdtype", "ot", 1], ["wdtype", "ot", 2], ["tile_ic", "sp", [-1, 1, 4]], ["tile_ow", "sp", [-1, 8]], ["tile_oh", "sp", [-1, 8]], ["tile_bindthread", "sp", [-1, 1, 1, 1, 2, 1]]]}, "result": [[0.0198767307], 0, 13.374323844909668, 1615984424.8833318], "version": 0.2, "tvm_version": "0.8.dev0"}
{"input": ["opencl -keys=opencl,gpu -max_num_threads=256", "tutorial/conv2d_no_batching", [1, 14, 14, 512, 256, 3, 3, [2, 2], [1, 1, 1, 1]], {}], "config": {"index": 256259, "code_hash": null, "entity": [["idtype", "ot", 1], ["kdtype", "ot", 1], ["wdtype", "ot", 0], ["tile_ic", "sp", [-1, 1, 4]], ["tile_ow", "sp", [-1, 1]], ["tile_oh", "sp", [-1, 4]], ["tile_bindthread", "sp", [-1, 1, 4, 4, 4, 2]]]}, "result": [[0.0012348538], 0, 13.63055157661438, 1615984425.7781043], "version": 0.2, "tvm_version": "0.8.dev0"}
{"input": ["opencl -keys=opencl,gpu -max_num_threads=256", "tutorial/conv2d_no_batching", [1, 14, 14, 512, 256, 3, 3, [2, 2], [1, 1, 1, 1]], {}], "config": {"index": 9872, "code_hash": null, "entity": [["idtype", "ot", 0], ["kdtype", "ot", 0], ["wdtype", "ot", 0], ["tile_ic", "sp", [-1, 4, 4]], ["tile_ow", "sp", [-1, 1]], ["tile_oh", "sp", [-1, 2]], ["tile_bindthread", "sp", [-1, 16, 4, 1, 1, 1]]]}, "result": [[0.0192776885], 0, 15.036196947097778, 1615984427.1738513], "version": 0.2, "tvm_version": "0.8.dev0"}
{"input": ["opencl -keys=opencl,gpu -max_num_threads=256", "tutorial/conv2d_no_batching", [1, 14, 14, 512, 256, 3, 3, [2, 2], [1, 1, 1, 1]], {}], "config": {"index": 118569, "code_hash": null, "entity": [["idtype", "ot", 1], ["kdtype", "ot", 0], ["wdtype", "ot", 0], ["tile_ic", "sp", [-1, 2, 4]], ["tile_ow", "sp", [-1, 2]], ["tile_oh", "sp", [-1, 4]], ["tile_bindthread", "sp", [-1, 2, 2, 2, 4, 1]]]}, "result": [[0.0052891731], 0, 17.199742794036865, 1615984429.2529736], "version": 0.2, "tvm_version": "0.8.dev0"}
{"input": ["opencl -keys=opencl,gpu -max_num_threads=256", "tutorial/conv2d_no_batching", [1, 14, 14, 512, 256, 3, 3, [2, 2], [1, 1, 1, 1]], {}], "config": {"index": 136396, "code_hash": null, "entity": [["idtype", "ot", 0], ["kdtype", "ot", 0], ["wdtype", "ot", 2], ["tile_ic", "sp", [-1, 2, 4]], ["tile_ow", "sp", [-1, 4]], ["tile_oh", "sp", [-1, 2]], ["tile_bindthread", "sp", [-1, 2, 2, 1, 8, 1]]]}, "result": [[0.0051817308], 0, 18.478747129440308, 1615984430.4234526], "version": 0.2, "tvm_version": "0.8.dev0"}
{"input": ["opencl -keys=opencl,gpu -max_num_threads=256", "tutorial/conv2d_no_batching", [1, 14, 14, 512, 256, 3, 3, [2, 2], [1, 1, 1, 1]], {}], "config": {"index": 234032, "code_hash": null, "entity": [["idtype", "ot", 0], ["kdtype", "ot", 0], ["wdtype", "ot", 0], ["tile_ic", "sp", [-1, 4, 4]], ["tile_ow", "sp", [-1, 2]], ["tile_oh", "sp", [-1, 1]], ["tile_bindthread", "sp", [-1, 1, 4, 4, 2, 2]]]}, "result": [[0.0054798499], 0, 16.139636516571045, 1615984428.1288877], "version": 0.2, "tvm_version": "0.8.dev0"}
{"input": ["opencl -keys=opencl,gpu -max_num_threads=256", "tutorial/conv2d_no_batching", [1, 14, 14, 512, 256, 3, 3, [2, 2], [1, 1, 1, 1]], {}], "config": {"index": 354672, "code_hash": null, "entity": [["idtype", "ot", 0], ["kdtype", "ot", 0], ["wdtype", "ot", 0], ["tile_ic", "sp", [-1, 4, 4]], ["tile_ow", "sp", [-1, 8]], ["tile_oh", "sp", [-1, 4]], ["tile_bindthread", "sp", [-1, 2, 1, 4, 1, 8]]]}, "result": [[0.0223386808], 0, 21.81282091140747, 1615984433.3897135], "version": 0.2, "tvm_version": "0.8.dev0"}
{"input": ["opencl -keys=opencl,gpu -max_num_threads=256", "tutorial/conv2d_no_batching", [1, 14, 14, 512, 256, 3, 3, [2, 2], [1, 1, 1, 1]], {}], "config": {"index": 186797, "code_hash": null, "entity": [["idtype", "ot", 1], ["kdtype", "ot", 0], ["wdtype", "ot", 2], ["tile_ic", "sp", [-1, 2, 4]], ["tile_ow", "sp", [-1, 2]], ["tile_oh", "sp", [-1, 8]], ["tile_bindthread", "sp", [-1, 1, 2, 2, 1, 2]]]}, "result": [[0.011026734600000001], 0, 25.80656147003174, 1615984437.6148815], "version": 0.2, "tvm_version": "0.8.dev0"}
{"input": ["opencl -keys=opencl,gpu -max_num_threads=256", "tutorial/conv2d_no_batching", [1, 14, 14, 512, 256, 3, 3, [2, 2], [1, 1, 1, 1]], {}], "config": {"index": 60699, "code_hash": null, "entity": [["idtype", "ot", 1], ["kdtype", "ot", 1], ["wdtype", "ot", 0], ["tile_ic", "sp", [-1, 8, 4]], ["tile_ow", "sp", [-1, 1]], ["tile_oh", "sp", [-1, 4]], ["tile_bindthread", "sp", [-1, 1, 2, 64, 1, 1]]]}, "result": [[0.007423607699999999], 0, 26.939141035079956, 1615984438.8804326], "version": 0.2, "tvm_version": "0.8.dev0"}
{"input": ["opencl -keys=opencl,gpu -max_num_threads=256", "tutorial/conv2d_no_batching", [1, 14, 14, 512, 256, 3, 3, [2, 2], [1, 1, 1, 1]], {}], "config": {"index": 120206, "code_hash": null, "entity": [["idtype", "ot", 0], ["kdtype", "ot", 1], ["wdtype", "ot", 2], ["tile_ic", "sp", [-1, 2, 4]], ["tile_ow", "sp", [-1, 1]], ["tile_oh", "sp", [-1, 8]], ["tile_bindthread", "sp", [-1, 1, 4, 2, 4, 1]]]}, "result": [[0.0040980885], 0, 27.73220920562744, 1615984439.9156213], "version": 0.2, "tvm_version": "0.8.dev0"}
{"input": ["opencl -keys=opencl,gpu -max_num_threads=256", "tutorial/conv2d_no_batching", [1, 14, 14, 512, 256, 3, 3, [2, 2], [1, 1, 1, 1]], {}], "config": {"index": 186314, "code_hash": null, "entity": [["idtype", "ot", 0], ["kdtype", "ot", 1], ["wdtype", "ot", 0], ["tile_ic", "sp", [-1, 2, 4]], ["tile_ow", "sp", [-1, 4]], ["tile_oh", "sp", [-1, 8]], ["tile_bindthread", "sp", [-1, 32, 1, 2, 1, 2]]]}, "result": [[0.0258477], 0, 24.207640171051025, 1615984436.1103475], "version": 0.2, "tvm_version": "0.8.dev0"}
{"input": ["opencl -keys=opencl,gpu -max_num_threads=256", "tutorial/conv2d_no_batching", [1, 14, 14, 512, 256, 3, 3, [2, 2], [1, 1, 1, 1]], {}], "config": {"index": 216833, "code_hash": null, "entity": [["idtype", "ot", 1], ["kdtype", "ot", 0], ["wdtype", "ot", 0], ["tile_ic", "sp", [-1, 1, 4]], ["tile_ow", "sp", [-1, 1]], ["tile_oh", "sp", [-1, 4]], ["tile_bindthread", "sp", [-1, 8, 2, 1, 2, 2]]]}, "result": [[0.0010586769], 0, 0.8572356700897217, 1615984441.6541536], "version": 0.2, "tvm_version": "0.8.dev0"}
{"input": ["opencl -keys=opencl,gpu -max_num_threads=256", "tutorial/conv2d_no_batching", [1, 14, 14, 512, 256, 3, 3, [2, 2], [1, 1, 1, 1]], {}], "config": {"index": 390839, "code_hash": null, "entity": [["idtype", "ot", 1], ["kdtype", "ot", 1], ["wdtype", "ot", 2], ["tile_ic", "sp", [-1, 4, 4]], ["tile_ow", "sp", [-1, 2]], ["tile_oh", "sp", [-1, 2]], ["tile_bindthread", "sp", [-1, 2, 1, 2, 2, 16]]]}, "result": [[0.0060658731], 0, 1.9024889469146729, 1615984442.636337], "version": 0.2, "tvm_version": "0.8.dev0"}
{"input": ["opencl -keys=opencl,gpu -max_num_threads=256", "tutorial/conv2d_no_batching", [1, 14, 14, 512, 256, 3, 3, [2, 2], [1, 1, 1, 1]], {}], "config": {"index": 27397, "code_hash": null, "entity": [["idtype", "ot", 1], ["kdtype", "ot", 0], ["wdtype", "ot", 2], ["tile_ic", "sp", [-1, 1, 4]], ["tile_ow", "sp", [-1, 1]], ["tile_oh", "sp", [-1, 4]], ["tile_bindthread", "sp", [-1, 16, 4, 2, 1, 1]]]}, "result": [[0.0017893347], 0, 2.719726324081421, 1615984443.5322788], "version": 0.2, "tvm_version": "0.8.dev0"}
{"input": ["opencl -keys=opencl,gpu -max_num_threads=256", "tutorial/conv2d_no_batching", [1, 14, 14, 512, 256, 3, 3, [2, 2], [1, 1, 1, 1]], {}], "config": {"index": 69396, "code_hash": null, "entity": [["idtype", "ot", 0], ["kdtype", "ot", 0], ["wdtype", "ot", 2], ["tile_ic", "sp", [-1, 4, 4]], ["tile_ow", "sp", [-1, 1]], ["tile_oh", "sp", [-1, 4]], ["tile_bindthread", "sp", [-1, 4, 4, 1, 2, 1]]]}, "result": [[0.0107862385], 0, 3.950735092163086, 1615984444.711524], "version": 0.2, "tvm_version": "0.8.dev0"}
{"input": ["opencl -keys=opencl,gpu -max_num_threads=256", "tutorial/conv2d_no_batching", [1, 14, 14, 512, 256, 3, 3, [2, 2], [1, 1, 1, 1]], {}], "config": {"index": 178311, "code_hash": null, "entity": [["idtype", "ot", 1], ["kdtype", "ot", 1], ["wdtype", "ot", 2], ["tile_ic", "sp", [-1, 1, 4]], ["tile_ow", "sp", [-1, 1]], ["tile_oh", "sp", [-1, 2]], ["tile_bindthread", "sp", [-1, 1, 8, 1, 1, 2]]]}, "result": [[0.0019658076999999998], 0, 4.7481279373168945, 1615984445.537934], "version": 0.2, "tvm_version": "0.8.dev0"}
{"input": ["opencl -keys=opencl,gpu -max_num_threads=256", "tutorial/conv2d_no_batching", [1, 14, 14, 512, 256, 3, 3, [2, 2], [1, 1, 1, 1]], {}], "config": {"index": 279966, "code_hash": null, "entity": [["idtype", "ot", 0], ["kdtype", "ot", 1], ["wdtype", "ot", 2], ["tile_ic", "sp", [-1, 8, 4]], ["tile_ow", "sp", [-1, 1]], ["tile_oh", "sp", [-1, 8]], ["tile_bindthread", "sp", [-1, 1, 2, 1, 1, 4]]]}, "result": [[0.0079752808], 0, 6.185147285461426, 1615984446.8464942], "version": 0.2, "tvm_version": "0.8.dev0"}
{"input": ["opencl -keys=opencl,gpu -max_num_threads=256", "tutorial/conv2d_no_batching", [1, 14, 14, 512, 256, 3, 3, [2, 2], [1, 1, 1, 1]], {}], "config": {"index": 79919, "code_hash": null, "entity": [["idtype", "ot", 1], ["kdtype", "ot", 1], ["wdtype", "ot", 2], ["tile_ic", "sp", [-1, 2, 4]], ["tile_ow", "sp", [-1, 2]], ["tile_oh", "sp", [-1, 1]], ["tile_bindthread", "sp", [-1, 4, 2, 2, 2, 1]]]}, "result": [[0.0016699654000000002], 0, 6.769985914230347, 1615984447.5588923], "version": 0.2, "tvm_version": "0.8.dev0"}
{"input": ["opencl -keys=opencl,gpu -max_num_threads=256", "tutorial/conv2d_no_batching", [1, 14, 14, 512, 256, 3, 3, [2, 2], [1, 1, 1, 1]], {}], "config": {"index": 69622, "code_hash": null, "entity": [["idtype", "ot", 0], ["kdtype", "ot", 1], ["wdtype", "ot", 2], ["tile_ic", "sp", [-1, 4, 4]], ["tile_ow", "sp", [-1, 8]], ["tile_oh", "sp", [-1, 8]], ["tile_bindthread", "sp", [-1, 4, 4, 1, 2, 1]]]}, "result": [[0.0501427615], 0, 12.34624719619751, 1615984452.639425], "version": 0.2, "tvm_version": "0.8.dev0"}
{"input": ["opencl -keys=opencl,gpu -max_num_threads=256", "tutorial/conv2d_no_batching", [1, 14, 14, 512, 256, 3, 3, [2, 2], [1, 1, 1, 1]], {}], "config": {"index": 101209, "code_hash": null, "entity": [["idtype", "ot", 1], ["kdtype", "ot", 0], ["wdtype", "ot", 0], ["tile_ic", "sp", [-1, 8, 4]], ["tile_ow", "sp", [-1, 4]], ["tile_oh", "sp", [-1, 4]], ["tile_bindthread", "sp", [-1, 1, 2, 16, 2, 1]]]}, "result": [[0.0112192846], 0, 14.683624744415283, 1615984455.205756], "version": 0.2, "tvm_version": "0.8.dev0"}
{"input": ["opencl -keys=opencl,gpu -max_num_threads=256", "tutorial/conv2d_no_batching", [1, 14, 14, 512, 256, 3, 3, [2, 2], [1, 1, 1, 1]], {}], "config": {"index": 271035, "code_hash": null, "entity": [["idtype", "ot", 1], ["kdtype", "ot", 1], ["wdtype", "ot", 0], ["tile_ic", "sp", [-1, 8, 4]], ["tile_ow", "sp", [-1, 2]], ["tile_oh", "sp", [-1, 2]], ["tile_bindthread", "sp", [-1, 2, 2, 1, 16, 2]]]}, "result": [[0.0078741731], 0, 16.06119179725647, 1615984456.68574], "version": 0.2, "tvm_version": "0.8.dev0"}
{"input": ["opencl -keys=opencl,gpu -max_num_threads=256", "tutorial/conv2d_no_batching", [1, 14, 14, 512, 256, 3, 3, [2, 2], [1, 1, 1, 1]], {}], "config": {"index": 133948, "code_hash": null, "entity": [["idtype", "ot", 0], ["kdtype", "ot", 0], ["wdtype", "ot", 2], ["tile_ic", "sp", [-1, 8, 4]], ["tile_ow", "sp", [-1, 2]], ["tile_oh", "sp", [-1, 4]], ["tile_bindthread", "sp", [-1, 2, 1, 1, 8, 1]]]}, "result": [[0.0078769692], 0, 17.50432300567627, 1615984458.2208114], "version": 0.2, "tvm_version": "0.8.dev0"}
{"input": ["opencl -keys=opencl,gpu -max_num_threads=256", "tutorial/conv2d_no_batching", [1, 14, 14, 512, 256, 3, 3, [2, 2], [1, 1, 1, 1]], {}], "config": {"index": 365167, "code_hash": null, "entity": [["idtype", "ot", 1], ["kdtype", "ot", 1], ["wdtype", "ot", 2], ["tile_ic", "sp", [-1, 2, 4]], ["tile_ow", "sp", [-1, 8]], ["tile_oh", "sp", [-1, 1]], ["tile_bindthread", "sp", [-1, 4, 1, 2, 2, 8]]]}, "result": [[0.003981034600000001], 0, 18.53425168991089, 1615984459.3272536], "version": 0.2, "tvm_version": "0.8.dev0"}
{"input": ["opencl -keys=opencl,gpu -max_num_threads=256", "tutorial/conv2d_no_batching", [1, 14, 14, 512, 256, 3, 3, [2, 2], [1, 1, 1, 1]], {}], "config": {"index": 376067, "code_hash": null, "entity": [["idtype", "ot", 1], ["kdtype", "ot", 1], ["wdtype", "ot", 0], ["tile_ic", "sp", [-1, 1, 4]], ["tile_ow", "sp", [-1, 1]], ["tile_oh", "sp", [-1, 4]], ["tile_bindthread", "sp", [-1, 1, 1, 2, 8, 8]]]}, "result": [[0.0011757231], 0, 19.290217876434326, 1615984460.1477773], "version": 0.2, "tvm_version": "0.8.dev0"}
{"input": ["opencl -keys=opencl,gpu -max_num_threads=256", "tutorial/conv2d_no_batching", [1, 14, 14, 512, 256, 3, 3, [2, 2], [1, 1, 1, 1]], {}], "config": {"index": 388704, "code_hash": null, "entity": [["idtype", "ot", 0], ["kdtype", "ot", 0], ["wdtype", "ot", 0], ["tile_ic", "sp", [-1, 1, 4]], ["tile_ow", "sp", [-1, 8]], ["tile_oh", "sp", [-1, 1]], ["tile_bindthread", "sp", [-1, 1, 2, 1, 2, 16]]]}, "result": [[0.0056859615], 0, 20.28119683265686, 1615984461.152687], "version": 0.2, "tvm_version": "0.8.dev0"}
{"input": ["opencl -keys=opencl,gpu -max_num_threads=256", "tutorial/conv2d_no_batching", [1, 14, 14, 512, 256, 3, 3, [2, 2], [1, 1, 1, 1]], {}], "config": {"index": 225514, "code_hash": null, "entity": [["idtype", "ot", 0], ["kdtype", "ot", 1], ["wdtype", "ot", 0], ["tile_ic", "sp", [-1, 2, 4]], ["tile_ow", "sp", [-1, 8]], ["tile_oh", "sp", [-1, 2]], ["tile_bindthread", "sp", [-1, 1, 2, 2, 2, 2]]]}, "result": [[0.0092471423], 0, 21.74250602722168, 1615984462.511952], "version": 0.2, "tvm_version": "0.8.dev0"}
{"input": ["opencl -keys=opencl,gpu -max_num_threads=256", "tutorial/conv2d_no_batching", [1, 14, 14, 512, 256, 3, 3, [2, 2], [1, 1, 1, 1]], {}], "config": {"index": 236847, "code_hash": null, "entity": [["idtype", "ot", 1], ["kdtype", "ot", 1], ["wdtype", "ot", 2], ["tile_ic", "sp", [-1, 2, 4]], ["tile_ow", "sp", [-1, 2]], ["tile_oh", "sp", [-1, 4]], ["tile_bindthread", "sp", [-1, 4, 1, 8, 2, 2]]]}, "result": [[0.0053557192], 0, 22.993772745132446, 1615984463.6578972], "version": 0.2, "tvm_version": "0.8.dev0"}
{"input": ["opencl -keys=opencl,gpu -max_num_threads=256", "tutorial/conv2d_no_batching", [1, 14, 14, 512, 256, 3, 3, [2, 2], [1, 1, 1, 1]], {}], "config": {"index": 285034, "code_hash": null, "entity": [["idtype", "ot", 0], ["kdtype", "ot", 1], ["wdtype", "ot", 0], ["tile_ic", "sp", [-1, 2, 4]], ["tile_ow", "sp", [-1, 8]], ["tile_oh", "sp", [-1, 4]], ["tile_bindthread", "sp", [-1, 2, 8, 1, 1, 4]]]}, "result": [[0.0263132692], 0, 25.397088050842285, 1615984466.0951173], "version": 0.2, "tvm_version": "0.8.dev0"}
{"input": ["opencl -keys=opencl,gpu -max_num_threads=256", "tutorial/conv2d_no_batching", [1, 14, 14, 512, 256, 3, 3, [2, 2], [1, 1, 1, 1]], {}], "config": {"index": 203180, "code_hash": null, "entity": [["idtype", "ot", 0], ["kdtype", "ot", 0], ["wdtype", "ot", 2], ["tile_ic", "sp", [-1, 2, 4]], ["tile_ow", "sp", [-1, 2]], ["tile_oh", "sp", [-1, 8]], ["tile_bindthread", "sp", [-1, 4, 1, 8, 1, 2]]]}, "result": [[0.0087701346], 0, 26.902417182922363, 1615984467.6427658], "version": 0.2, "tvm_version": "0.8.dev0"}
{"input": ["opencl -keys=opencl,gpu -max_num_threads=256", "tutorial/conv2d_no_batching", [1, 14, 14, 512, 256, 3, 3, [2, 2], [1, 1, 1, 1]], {}], "config": {"index": 173535, "code_hash": null, "entity": [["idtype", "ot", 1], ["kdtype", "ot", 1], ["wdtype", "ot", 2], ["tile_ic", "sp", [-1, 8, 4]], ["tile_ow", "sp", [-1, 4]], ["tile_oh", "sp", [-1, 8]], ["tile_bindthread", "sp", [-1, 2, 2, 1, 1, 2]]]}, "result": [[0.0471958845], 0, 32.04064416885376, 1615984472.3239377], "version": 0.2, "tvm_version": "0.8.dev0"}
{"input": ["opencl -keys=opencl,gpu -max_num_threads=256", "tutorial/conv2d_no_batching", [1, 14, 14, 512, 256, 3, 3, [2, 2], [1, 1, 1, 1]], {}], "config": {"index": 168362, "code_hash": null, "entity": [["idtype", "ot", 0], ["kdtype", "ot", 1], ["wdtype", "ot", 0], ["tile_ic", "sp", [-1, 2, 4]], ["tile_ow", "sp", [-1, 2]], ["tile_oh", "sp", [-1, 8]], ["tile_bindthread", "sp", [-1, 1, 1, 2, 64, 1]]]}, "result": [[0.0087099769], 0, 33.46139645576477, 1615984474.1775181], "version": 0.2, "tvm_version": "0.8.dev0"}
