test_and_tune/remote_tmali/MaliG72.topinhw4c1.log.tmp
{"input": ["opencl -keys=opencl,gpu -max_num_threads=256", "tutorial/conv2d_no_batching", [1, 14, 14, 512, 256, 3, 3, [2, 2], [1, 1, 1, 1]], {}], "config": {"index": 251624, "code_hash": null, "entity": [["idtype", "ot", 0], ["kdtype", "ot", 0], ["wdtype", "ot", 0], ["tile_ic", "sp", [-1, 2, 4]], ["tile_ow", "sp", [-1, 8]], ["tile_oh", "sp", [-1, 2]], ["tile_bindthread", "sp", [-1, 4, 2, 2, 4, 2]]]}, "result": [[0.0167892708], 0, 1.8148784637451172, 1615984369.0201664], "version": 0.2, "tvm_version": "0.8.dev0"}
{"input": ["opencl -keys=opencl,gpu -max_num_threads=256", "tutorial/conv2d_no_batching", [1, 14, 14, 512, 256, 3, 3, [2, 2], [1, 1, 1, 1]], {}], "config": {"index": 392726, "code_hash": null, "entity": [["idtype", "ot", 0], ["kdtype", "ot", 1], ["wdtype", "ot", 2], ["tile_ic", "sp", [-1, 4, 4]], ["tile_ow", "sp", [-1, 1]], ["tile_oh", "sp", [-1, 1]], ["tile_bindthread", "sp", [-1, 2, 1, 1, 4, 16]]]}, "result": [[0.0104304167], 0, 3.0471508502960205, 1615984370.342959], "version": 0.2, "tvm_version": "0.8.dev0"}
{"input": ["opencl -keys=opencl,gpu -max_num_threads=256", "tutorial/conv2d_no_batching", [1, 14, 14, 512, 256, 3, 3, [2, 2], [1, 1, 1, 1]], {}], "config": {"index": 167168, "code_hash": null, "entity": [["idtype", "ot", 0], ["kdtype", "ot", 0], ["wdtype", "ot", 0], ["tile_ic", "sp", [-1, 1, 4]], ["tile_ow", "sp", [-1, 1]], ["tile_oh", "sp", [-1, 4]], ["tile_bindthread", "sp", [-1, 2, 1, 1, 64, 1]]]}, "result": [[0.0017591666999999997], 0, 9.22723388671875, 1615984376.5586522], "version": 0.2, "tvm_version": "0.8.dev0"}
{"input": ["opencl -keys=opencl,gpu -max_num_threads=256", "tutorial/conv2d_no_batching", [1, 14, 14, 512, 256, 3, 3, [2, 2], [1, 1, 1, 1]], {}], "config": {"index": 101732, "code_hash": null, "entity": [["idtype", "ot", 0], ["kdtype", "ot", 0], ["wdtype", "ot", 2], ["tile_ic", "sp", [-1, 1, 4]], ["tile_ow", "sp", [-1, 8]], ["tile_oh", "sp", [-1, 4]], ["tile_bindthread", "sp", [-1, 2, 2, 16, 2, 1]]]}, "result": [[0.0210093229], 0, 11.332683563232422, 1615984378.4848514], "version": 0.2, "tvm_version": "0.8.dev0"}
{"input": ["opencl -keys=opencl,gpu -max_num_threads=256", "tutorial/conv2d_no_batching", [1, 14, 14, 512, 256, 3, 3, [2, 2], [1, 1, 1, 1]], {}], "config": {"index": 163215, "code_hash": null, "entity": [["idtype", "ot", 1], ["kdtype", "ot", 1], ["wdtype", "ot", 2], ["tile_ic", "sp", [-1, 2, 4]], ["tile_ow", "sp", [-1, 1]], ["tile_oh", "sp", [-1, 8]], ["tile_bindthread", "sp", [-1, 1, 2, 1, 32, 1]]]}, "result": [[0.0075872916], 0, 12.52792763710022, 1615984379.778754], "version": 0.2, "tvm_version": "0.8.dev0"}
{"input": ["opencl -keys=opencl,gpu -max_num_threads=256", "tutorial/conv2d_no_batching", [1, 14, 14, 512, 256, 3, 3, [2, 2], [1, 1, 1, 1]], {}], "config": {"index": 337031, "code_hash": null, "entity": [["idtype", "ot", 1], ["kdtype", "ot", 1], ["wdtype", "ot", 2], ["tile_ic", "sp", [-1, 1, 4]], ["tile_ow", "sp", [-1, 1]], ["tile_oh", "sp", [-1, 2]], ["tile_bindthread", "sp", [-1, 2, 1, 2, 8, 4]]]}, "result": [[0.0006492187], 0, 13.29953145980835, 1615984380.612055], "version": 0.2, "tvm_version": "0.8.dev0"}
{"input": ["opencl -keys=opencl,gpu -max_num_threads=256", "tutorial/conv2d_no_batching", [1, 14, 14, 512, 256, 3, 3, [2, 2], [1, 1, 1, 1]], {}], "config": {"index": 197160, "code_hash": null, "entity": [["idtype", "ot", 0], ["kdtype", "ot", 0], ["wdtype", "ot", 0], ["tile_ic", "sp", [-1, 2, 4]], ["tile_ow", "sp", [-1, 2]], ["tile_oh", "sp", [-1, 1]], ["tile_bindthread", "sp", [-1, 2, 2, 4, 1, 2]]]}, "result": [[0.0015386979], 0, 14.21863079071045, 1615984381.5409286], "version": 0.2, "tvm_version": "0.8.dev0"}
{"input": ["opencl -keys=opencl,gpu -max_num_threads=256", "tutorial/conv2d_no_batching", [1, 14, 14, 512, 256, 3, 3, [2, 2], [1, 1, 1, 1]], {}], "config": {"index": 177028, "code_hash": null, "entity": [["idtype", "ot", 0], ["kdtype", "ot", 0], ["wdtype", "ot", 2], ["tile_ic", "sp", [-1, 1, 4]], ["tile_ow", "sp", [-1, 1]], ["tile_oh", "sp", [-1, 8]], ["tile_bindthread", "sp", [-1, 4, 4, 1, 1, 2]]]}, "result": [[0.0080811458], 0, 15.371164083480835, 1615984382.7007043], "version": 0.2, "tvm_version": "0.8.dev0"}
{"input": ["opencl -keys=opencl,gpu -max_num_threads=256", "tutorial/conv2d_no_batching", [1, 14, 14, 512, 256, 3, 3, [2, 2], [1, 1, 1, 1]], {}], "config": {"index": 320725, "code_hash": null, "entity": [["idtype", "ot", 1], ["kdtype", "ot", 0], ["wdtype", "ot", 2], ["tile_ic", "sp", [-1, 4, 4]], ["tile_ow", "sp", [-1, 4]], ["tile_oh", "sp", [-1, 2]], ["tile_bindthread", "sp", [-1, 1, 4, 4, 2, 4]]]}, "result": [[0.01203], 0, 17.30764126777649, 1615984384.5237172], "version": 0.2, "tvm_version": "0.8.dev0"}
{"input": ["opencl -keys=opencl,gpu -max_num_threads=256", "tutorial/conv2d_no_batching", [1, 14, 14, 512, 256, 3, 3, [2, 2], [1, 1, 1, 1]], {}], "config": {"index": 288199, "code_hash": null, "entity": [["idtype", "ot", 1], ["kdtype", "ot", 1], ["wdtype", "ot", 2], ["tile_ic", "sp", [-1, 1, 4]], ["tile_ow", "sp", [-1, 4]], ["tile_oh", "sp", [-1, 8]], ["tile_bindthread", "sp", [-1, 2, 1, 2, 1, 4]]]}, "result": [[0.0157432292], 0, 19.514512300491333, 1615984386.5731509], "version": 0.2, "tvm_version": "0.8.dev0"}
{"input": ["opencl -keys=opencl,gpu -max_num_threads=256", "tutorial/conv2d_no_batching", [1, 14, 14, 512, 256, 3, 3, [2, 2], [1, 1, 1, 1]], {}], "config": {"index": 311016, "code_hash": null, "entity": [["idtype", "ot", 0], ["kdtype", "ot", 0], ["wdtype", "ot", 0], ["tile_ic", "sp", [-1, 2, 4]], ["tile_ow", "sp", [-1, 8]], ["tile_oh", "sp", [-1, 2]], ["tile_bindthread", "sp", [-1, 4, 4, 1, 2, 4]]]}, "result": [[0.0172971354], 0, 21.650561809539795, 1615984388.9222713], "version": 0.2, "tvm_version": "0.8.dev0"}
{"input": ["opencl -keys=opencl,gpu -max_num_threads=256", "tutorial/conv2d_no_batching", [1, 14, 14, 512, 256, 3, 3, [2, 2], [1, 1, 1, 1]], {}], "config": {"index": 300638, "code_hash": null, "entity": [["idtype", "ot", 0], ["kdtype", "ot", 1], ["wdtype", "ot", 2], ["tile_ic", "sp", [-1, 8, 4]], ["tile_ow", "sp", [-1, 4]], ["tile_oh", "sp", [-1, 1]], ["tile_bindthread", "sp", [-1, 2, 1, 8, 1, 4]]]}, "result": [[0.0156245833], 0, 23.777600049972534, 1615984390.972666], "version": 0.2, "tvm_version": "0.8.dev0"}
{"input": ["opencl -keys=opencl,gpu -max_num_threads=256", "tutorial/conv2d_no_batching", [1, 14, 14, 512, 256, 3, 3, [2, 2], [1, 1, 1, 1]], {}], "config": {"index": 142415, "code_hash": null, "entity": [["idtype", "ot", 1], ["kdtype", "ot", 1], ["wdtype", "ot", 2], ["tile_ic", "sp", [-1, 2, 4]], ["tile_ow", "sp", [-1, 4]], ["tile_oh", "sp", [-1, 1]], ["tile_bindthread", "sp", [-1, 8, 1, 2, 8, 1]]]}, "result": [[0.0090597917], 0, 24.94702434539795, 1615984392.2529218], "version": 0.2, "tvm_version": "0.8.dev0"}
{"input": ["opencl -keys=opencl,gpu -max_num_threads=256", "tutorial/conv2d_no_batching", [1, 14, 14, 512, 256, 3, 3, [2, 2], [1, 1, 1, 1]], {}], "config": {"index": 299119, "code_hash": null, "entity": [["idtype", "ot", 1], ["kdtype", "ot", 1], ["wdtype", "ot", 2], ["tile_ic", "sp", [-1, 2, 4]], ["tile_ow", "sp", [-1, 8]], ["tile_oh", "sp", [-1, 1]], ["tile_bindthread", "sp", [-1, 2, 4, 4, 1, 4]]]}, "result": [[0.0077139583], 0, 26.345446825027466, 1615984393.6050391], "version": 0.2, "tvm_version": "0.8.dev0"}
{"input": ["opencl -keys=opencl,gpu -max_num_threads=256", "tutorial/conv2d_no_batching", [1, 14, 14, 512, 256, 3, 3, [2, 2], [1, 1, 1, 1]], {}], "config": {"index": 250112, "code_hash": null, "entity": [["idtype", "ot", 0], ["kdtype", "ot", 0], ["wdtype", "ot", 0], ["tile_ic", "sp", [-1, 1, 4]], ["tile_ow", "sp", [-1, 1]], ["tile_oh", "sp", [-1, 4]], ["tile_bindthread", "sp", [-1, 8, 1, 2, 4, 2]]]}, "result": [[0.00077875], 0, 32.29024624824524, 1615984399.6575062], "version": 0.2, "tvm_version": "0.8.dev0"}
{"input": ["opencl -keys=opencl,gpu -max_num_threads=256", "tutorial/conv2d_no_batching", [1, 14, 14, 512, 256, 3, 3, [2, 2], [1, 1, 1, 1]], {}], "config": {"index": 209417, "code_hash": null, "entity": [["idtype", "ot", 1], ["kdtype", "ot", 0], ["wdtype", "ot", 0], ["tile_ic", "sp", [-1, 2, 4]], ["tile_ow", "sp", [-1, 1]], ["tile_oh", "sp", [-1, 1]], ["tile_bindthread", "sp", [-1, 1, 4, 16, 1, 2]]]}, "result": [[0.0006707811999999999], 0, 33.0640594959259, 1615984400.4247267], "version": 0.2, "tvm_version": "0.8.dev0"}
{"input": ["opencl -keys=opencl,gpu -max_num_threads=256", "tutorial/conv2d_no_batching", [1, 14, 14, 512, 256, 3, 3, [2, 2], [1, 1, 1, 1]], {}], "config": {"index": 357147, "code_hash": null, "entity": [["idtype", "ot", 1], ["kdtype", "ot", 1], ["wdtype", "ot", 0], ["tile_ic", "sp", [-1, 8, 4]], ["tile_ow", "sp", [-1, 1]], ["tile_oh", "sp", [-1, 4]], ["tile_bindthread", "sp", [-1, 1, 1, 8, 1, 8]]]}, "result": [[0.0141355208], 0, 34.901968240737915, 1615984402.1294904], "version": 0.2, "tvm_version": "0.8.dev0"}
{"input": ["opencl -keys=opencl,gpu -max_num_threads=256", "tutorial/conv2d_no_batching", [1, 14, 14, 512, 256, 3, 3, [2, 2], [1, 1, 1, 1]], {}], "config": {"index": 169898, "code_hash": null, "entity": [["idtype", "ot", 0], ["kdtype", "ot", 1], ["wdtype", "ot", 0], ["tile_ic", "sp", [-1, 2, 4]], ["tile_ow", "sp", [-1, 2]], ["tile_oh", "sp", [-1, 8]], ["tile_bindthread", "sp", [-1, 2, 1, 1, 1, 2]]]}, "result": [[0.027119895900000003], 0, 37.003071784973145, 1615984404.2893906], "version": 0.2, "tvm_version": "0.8.dev0"}
{"input": ["opencl -keys=opencl,gpu -max_num_threads=256", "tutorial/conv2d_no_batching", [1, 14, 14, 512, 256, 3, 3, [2, 2], [1, 1, 1, 1]], {}], "config": {"index": 89369, "code_hash": null, "entity": [["idtype", "ot", 1], ["kdtype", "ot", 0], ["wdtype", "ot", 0], ["tile_ic", "sp", [-1, 8, 4]], ["tile_ow", "sp", [-1, 1]], ["tile_oh", "sp", [-1, 4]], ["tile_bindthread", "sp", [-1, 1, 2, 4, 2, 1]]]}, "result": [[0.0131645313], 0, 5.084620475769043, 1615984411.2049744], "version": 0.2, "tvm_version": "0.8.dev0"}
{"input": ["opencl -keys=opencl,gpu -max_num_threads=256", "tutorial/conv2d_no_batching", [1, 14, 14, 512, 256, 3, 3, [2, 2], [1, 1, 1, 1]], {}], "config": {"index": 103733, "code_hash": null, "entity": [["idtype", "ot", 1], ["kdtype", "ot", 0], ["wdtype", "ot", 2], ["tile_ic", "sp", [-1, 4, 4]], ["tile_ow", "sp", [-1, 2]], ["tile_oh", "sp", [-1, 4]], ["tile_bindthread", "sp", [-1, 1, 2, 32, 2, 1]]]}, "result": [[0.0145666146], 0, 3.276111602783203, 1615984409.3755376], "version": 0.2, "tvm_version": "0.8.dev0"}
{"input": ["opencl -keys=opencl,gpu -max_num_threads=256", "tutorial/conv2d_no_batching", [1, 14, 14, 512, 256, 3, 3, [2, 2], [1, 1, 1, 1]], {}], "config": {"index": 184067, "code_hash": null, "entity": [["idtype", "ot", 1], ["kdtype", "ot", 1], ["wdtype", "ot", 0], ["tile_ic", "sp", [-1, 1, 4]], ["tile_ow", "sp", [-1, 1]], ["tile_oh", "sp", [-1, 4]], ["tile_bindthread", "sp", [-1, 2, 1, 2, 1, 2]]]}, "result": [[0.000958698], 0, 1.3960182666778564, 1615984407.4819713], "version": 0.2, "tvm_version": "0.8.dev0"}
{"input": ["opencl -keys=opencl,gpu -max_num_threads=256", "tutorial/conv2d_no_batching", [1, 14, 14, 512, 256, 3, 3, [2, 2], [1, 1, 1, 1]], {}], "config": {"index": 330963, "code_hash": null, "entity": [["idtype", "ot", 1], ["kdtype", "ot", 1], ["wdtype", "ot", 0], ["tile_ic", "sp", [-1, 4, 4]], ["tile_ow", "sp", [-1, 4]], ["tile_oh", "sp", [-1, 2]], ["tile_bindthread", "sp", [-1, 1, 4, 2, 4, 4]]]}, "result": [[0.012784479100000001], 0, 8.268704891204834, 1615984413.9531024], "version": 0.2, "tvm_version": "0.8.dev0"}
{"input": ["opencl -keys=opencl,gpu -max_num_threads=256", "tutorial/conv2d_no_batching", [1, 14, 14, 512, 256, 3, 3, [2, 2], [1, 1, 1, 1]], {}], "config": {"index": 24679, "code_hash": null, "entity": [["idtype", "ot", 1], ["kdtype", "ot", 1], ["wdtype", "ot", 2], ["tile_ic", "sp", [-1, 1, 4]], ["tile_ow", "sp", [-1, 8]], ["tile_oh", "sp", [-1, 1]], ["tile_bindthread", "sp", [-1, 32, 2, 2, 1, 1]]]}, "result": [[0.0110201563], 0, 6.035533905029297, 1615984412.4741285], "version": 0.2, "tvm_version": "0.8.dev0"}
{"input": ["opencl -keys=opencl,gpu -max_num_threads=256", "tutorial/conv2d_no_batching", [1, 14, 14, 512, 256, 3, 3, [2, 2], [1, 1, 1, 1]], {}], "config": {"index": 346786, "code_hash": null, "entity": [["idtype", "ot", 0], ["kdtype", "ot", 1], ["wdtype", "ot", 0], ["tile_ic", "sp", [-1, 1, 4]], ["tile_ow", "sp", [-1, 2]], ["tile_oh", "sp", [-1, 2]], ["tile_bindthread", "sp", [-1, 4, 4, 1, 1, 8]]]}, "result": [[0.0008699999999999999], 0, 8.674030065536499, 1615984414.8500051], "version": 0.2, "tvm_version": "0.8.dev0"}
{"input": ["opencl -keys=opencl,gpu -max_num_threads=256", "tutorial/conv2d_no_batching", [1, 14, 14, 512, 256, 3, 3, [2, 2], [1, 1, 1, 1]], {}], "config": {"index": 8749, "code_hash": null, "entity": [["idtype", "ot", 1], ["kdtype", "ot", 0], ["wdtype", "ot", 2], ["tile_ic", "sp", [-1, 2, 4]], ["tile_ow", "sp", [-1, 2]], ["tile_oh", "sp", [-1, 1]], ["tile_bindthread", "sp", [-1, 4, 4, 1, 1, 1]]]}, "result": [[0.0021052084], 0, 14.833625555038452, 1615984421.1464274], "version": 0.2, "tvm_version": "0.8.dev0"}
{"input": ["opencl -keys=opencl,gpu -max_num_threads=256", "tutorial/conv2d_no_batching", [1, 14, 14, 512, 256, 3, 3, [2, 2], [1, 1, 1, 1]], {}], "config": {"index": 368061, "code_hash": null, "entity": [["idtype", "ot", 1], ["kdtype", "ot", 0], ["wdtype", "ot", 2], ["tile_ic", "sp", [-1, 8, 4]], ["tile_ow", "sp", [-1, 2]], ["tile_oh", "sp", [-1, 8]], ["tile_bindthread", "sp", [-1, 2, 1, 4, 2, 8]]]}, "result": [[0.0354209896], 0, 15.139620542526245, 1615984420.0725281], "version": 0.2, "tvm_version": "0.8.dev0"}
{"input": ["opencl -keys=opencl,gpu -max_num_threads=256", "tutorial/conv2d_no_batching", [1, 14, 14, 512, 256, 3, 3, [2, 2], [1, 1, 1, 1]], {}], "config": {"index": 6173, "code_hash": null, "entity": [["idtype", "ot", 1], ["kdtype", "ot", 0], ["wdtype", "ot", 2], ["tile_ic", "sp", [-1, 8, 4]], ["tile_ow", "sp", [-1, 1]], ["tile_oh", "sp", [-1, 1]], ["tile_bindthread", "sp", [-1, 16, 2, 1, 1, 1]]]}, "result": [[0.011794375], 0, 10.051965236663818, 1615984416.121605], "version": 0.2, "tvm_version": "0.8.dev0"}
{"input": ["opencl -keys=opencl,gpu -max_num_threads=256", "tutorial/conv2d_no_batching", [1, 14, 14, 512, 256, 3, 3, [2, 2], [1, 1, 1, 1]], {}], "config": {"index": 38714, "code_hash": null, "entity": [["idtype", "ot", 0], ["kdtype", "ot", 1], ["wdtype", "ot", 0], ["tile_ic", "sp", [-1, 8, 4]], ["tile_ow", "sp", [-1, 2]], ["tile_oh", "sp", [-1, 4]], ["tile_bindthread", "sp", [-1, 1, 4, 4, 1, 1]]]}, "result": [[0.025144166699999998], 0, 18.330281972885132, 1615984424.060028], "version": 0.2, "tvm_version": "0.8.dev0"}
{"input": ["opencl -keys=opencl,gpu -max_num_threads=256", "tutorial/conv2d_no_batching", [1, 14, 14, 512, 256, 3, 3, [2, 2], [1, 1, 1, 1]], {}], "config": {"index": 305362, "code_hash": null, "entity": [["idtype", "ot", 0], ["kdtype", "ot", 1], ["wdtype", "ot", 0], ["tile_ic", "sp", [-1, 4, 4]], ["tile_ow", "sp", [-1, 4]], ["tile_oh", "sp", [-1, 2]], ["tile_bindthread", "sp", [-1, 1, 1, 1, 2, 4]]]}, "result": [[0.0120397917], 0, 20.050865173339844, 1615984426.1007056], "version": 0.2, "tvm_version": "0.8.dev0"}
{"input": ["opencl -keys=opencl,gpu -max_num_threads=256", "tutorial/conv2d_no_batching", [1, 14, 14, 512, 256, 3, 3, [2, 2], [1, 1, 1, 1]], {}], "config": {"index": 90379, "code_hash": null, "entity": [["idtype", "ot", 1], ["kdtype", "ot", 1], ["wdtype", "ot", 0], ["tile_ic", "sp", [-1, 2, 4]], ["tile_ow", "sp", [-1, 1]], ["tile_oh", "sp", [-1, 4]], ["tile_bindthread", "sp", [-1, 4, 2, 4, 2, 1]]]}, "result": [[0.0101876563], 0, 32.88382267951965, 1615984439.0723844], "version": 0.2, "tvm_version": "0.8.dev0"}
{"input": ["opencl -keys=opencl,gpu -max_num_threads=256", "tutorial/conv2d_no_batching", [1, 14, 14, 512, 256, 3, 3, [2, 2], [1, 1, 1, 1]], {}], "config": {"index": 20684, "code_hash": null, "entity": [["idtype", "ot", 0], ["kdtype", "ot", 0], ["wdtype", "ot", 2], ["tile_ic", "sp", [-1, 2, 4]], ["tile_ow", "sp", [-1, 4]], ["tile_oh", "sp", [-1, 2]], ["tile_bindthread", "sp", [-1, 16, 1, 2, 1, 1]]]}, "result": [[0.012108020799999999], 0, 21.619093894958496, 1615984427.8530796], "version": 0.2, "tvm_version": "0.8.dev0"}
{"input": ["opencl -keys=opencl,gpu -max_num_threads=256", "tutorial/conv2d_no_batching", [1, 14, 14, 512, 256, 3, 3, [2, 2], [1, 1, 1, 1]], {}], "config": {"index": 263475, "code_hash": null, "entity": [["idtype", "ot", 1], ["kdtype", "ot", 1], ["wdtype", "ot", 0], ["tile_ic", "sp", [-1, 4, 4]], ["tile_ow", "sp", [-1, 2]], ["tile_oh", "sp", [-1, 4]], ["tile_bindthread", "sp", [-1, 1, 8, 1, 8, 2]]]}, "result": [[0.013341198000000002], 0, 23.620006322860718, 1615984429.713596], "version": 0.2, "tvm_version": "0.8.dev0"}
{"input": ["opencl -keys=opencl,gpu -max_num_threads=256", "tutorial/conv2d_no_batching", [1, 14, 14, 512, 256, 3, 3, [2, 2], [1, 1, 1, 1]], {}], "config": {"index": 380668, "code_hash": null, "entity": [["idtype", "ot", 0], ["kdtype", "ot", 0], ["wdtype", "ot", 2], ["tile_ic", "sp", [-1, 8, 4]], ["tile_ow", "sp", [-1, 8]], ["tile_oh", "sp", [-1, 2]], ["tile_bindthread", "sp", [-1, 1, 4, 1, 1, 16]]]}, "result": [[0.0302621875], 0, 27.746949672698975, 1615984433.1974351], "version": 0.2, "tvm_version": "0.8.dev0"}
{"input": ["opencl -keys=opencl,gpu -max_num_threads=256", "tutorial/conv2d_no_batching", [1, 14, 14, 512, 256, 3, 3, [2, 2], [1, 1, 1, 1]], {}], "config": {"index": 249183, "code_hash": null, "entity": [["idtype", "ot", 1], ["kdtype", "ot", 1], ["wdtype", "ot", 2], ["tile_ic", "sp", [-1, 8, 4]], ["tile_ow", "sp", [-1, 4]], ["tile_oh", "sp", [-1, 4]], ["tile_bindthread", "sp", [-1, 2, 1, 2, 4, 2]]]}, "result": [[0.054958125000000004], 0, 32.8803174495697, 1615984437.615598], "version": 0.2, "tvm_version": "0.8.dev0"}
{"input": ["opencl -keys=opencl,gpu -max_num_threads=256", "tutorial/conv2d_no_batching", [1, 14, 14, 512, 256, 3, 3, [2, 2], [1, 1, 1, 1]], {}], "config": {"index": 281628, "code_hash": null, "entity": [["idtype", "ot", 0], ["kdtype", "ot", 0], ["wdtype", "ot", 2], ["tile_ic", "sp", [-1, 8, 4]], ["tile_ow", "sp", [-1, 1]], ["tile_oh", "sp", [-1, 1]], ["tile_bindthread", "sp", [-1, 16, 2, 1, 1, 4]]]}, "result": [[0.0203378125], 0, 35.105929136276245, 1615984441.4097688], "version": 0.2, "tvm_version": "0.8.dev0"}
{"input": ["opencl -keys=opencl,gpu -max_num_threads=256", "tutorial/conv2d_no_batching", [1, 14, 14, 512, 256, 3, 3, [2, 2], [1, 1, 1, 1]], {}], "config": {"index": 368132, "code_hash": null, "entity": [["idtype", "ot", 0], ["kdtype", "ot", 0], ["wdtype", "ot", 2], ["tile_ic", "sp", [-1, 1, 4]], ["tile_ow", "sp", [-1, 1]], ["tile_oh", "sp", [-1, 1]], ["tile_bindthread", "sp", [-1, 1, 2, 4, 2, 8]]]}, "result": [[0.0011428646000000002], 0, 33.47515106201172, 1615984439.8785512], "version": 0.2, "tvm_version": "0.8.dev0"}
{"input": ["opencl -keys=opencl,gpu -max_num_threads=256", "tutorial/conv2d_no_batching", [1, 14, 14, 512, 256, 3, 3, [2, 2], [1, 1, 1, 1]], {}], "config": {"index": 123513, "code_hash": null, "entity": [["idtype", "ot", 1], ["kdtype", "ot", 0], ["wdtype", "ot", 0], ["tile_ic", "sp", [-1, 8, 4]], ["tile_ow", "sp", [-1, 8]], ["tile_oh", "sp", [-1, 1]], ["tile_bindthread", "sp", [-1, 2, 1, 4, 4, 1]]]}, "result": [[0.013577187499999999], 0, 43.211193799972534, 1615984449.2057927], "version": 0.2, "tvm_version": "0.8.dev0"}
