test_and_tune/remote_tmali/MaliG76.wino3x3.log.tmp
{"input": ["opencl -keys=mali,opencl,gpu -device=mali -max_num_threads=256", "winograd_2", [1, 14, 14, 256, 256, 3, 3, [1, 1], [1, 1, 1, 1]], {}], "config": {"index": 387655, "code_hash": null, "entity": [["inv_cp", "sp", [-1, 2]], ["inv_wp", "sp", [-1, 7, 2]], ["inv_hp", "sp", [-1, 4, 2]], ["kernel_cp", "sp", [-1, 32]], ["kernel_kp", "sp", [-1, 8]], ["data_cp", "sp", [-1, 8]], ["data_wp", "sp", [-1, 4, 1]], ["data_hp", "sp", [-1, 4, 1]], ["bgemm_kp", "sp", [-1, 8]], ["bgemm_wp", "sp", [-1, 1, 4]], ["bgemm_hp", "sp", [-1, 1]]]}, "result": [[0.0023248272666666664], 0, 7.32245397567749, 1618312228.6312056], "version": 0.2, "tvm_version": "0.8.dev0"}
{"input": ["opencl -keys=mali,opencl,gpu -device=mali -max_num_threads=256", "winograd_2", [1, 14, 14, 256, 256, 3, 3, [1, 1], [1, 1, 1, 1]], {}], "config": {"index": 1715680, "code_hash": null, "entity": [["inv_cp", "sp", [-1, 8]], ["inv_wp", "sp", [-1, 4, 2]], ["inv_hp", "sp", [-1, 7, 2]], ["kernel_cp", "sp", [-1, 2]], ["kernel_kp", "sp", [-1, 8]], ["data_cp", "sp", [-1, 16]], ["data_wp", "sp", [-1, 4, 1]], ["data_hp", "sp", [-1, 4, 1]], ["bgemm_kp", "sp", [-1, 2]], ["bgemm_wp", "sp", [-1, 8, 4]], ["bgemm_hp", "sp", [-1, 1]]]}, "result": [[0.0021632448666666663], 0, 9.168347358703613, 1618312229.943786], "version": 0.2, "tvm_version": "0.8.dev0"}
{"input": ["opencl -keys=mali,opencl,gpu -device=mali -max_num_threads=256", "winograd_2", [1, 14, 14, 256, 256, 3, 3, [1, 1], [1, 1, 1, 1]], {}], "config": {"index": 2083777, "code_hash": null, "entity": [["inv_cp", "sp", [-1, 2]], ["inv_wp", "sp", [-1, 4, 2]], ["inv_hp", "sp", [-1, 4, 2]], ["kernel_cp", "sp", [-1, 8]], ["kernel_kp", "sp", [-1, 8]], ["data_cp", "sp", [-1, 16]], ["data_wp", "sp", [-1, 2, 1]], ["data_hp", "sp", [-1, 1, 1]], ["bgemm_kp", "sp", [-1, 1]], ["bgemm_wp", "sp", [-1, 13, 4]], ["bgemm_hp", "sp", [-1, 1]]]}, "result": [[0.0021700074666666665], 0, 10.786932229995728, 1618312241.322935], "version": 0.2, "tvm_version": "0.8.dev0"}
{"input": ["opencl -keys=mali,opencl,gpu -device=mali -max_num_threads=256", "winograd_2", [1, 14, 14, 256, 256, 3, 3, [1, 1], [1, 1, 1, 1]], {}], "config": {"index": 995911, "code_hash": null, "entity": [["inv_cp", "sp", [-1, 2]], ["inv_wp", "sp", [-1, 7, 2]], ["inv_hp", "sp", [-1, 4, 2]], ["kernel_cp", "sp", [-1, 32]], ["kernel_kp", "sp", [-1, 8]], ["data_cp", "sp", [-1, 32]], ["data_wp", "sp", [-1, 1, 1]], ["data_hp", "sp", [-1, 1, 1]], ["bgemm_kp", "sp", [-1, 32]], ["bgemm_wp", "sp", [-1, 4, 4]], ["bgemm_hp", "sp", [-1, 1]]]}, "result": [[0.0021267440000000003], 0, 11.848152875900269, 1618312242.619012], "version": 0.2, "tvm_version": "0.8.dev0"}
{"input": ["opencl -keys=mali,opencl,gpu -device=mali -max_num_threads=256", "winograd_2", [1, 14, 14, 256, 256, 3, 3, [1, 1], [1, 1, 1, 1]], {}], "config": {"index": 2164131, "code_hash": null, "entity": [["inv_cp", "sp", [-1, 4]], ["inv_wp", "sp", [-1, 4, 2]], ["inv_hp", "sp", [-1, 4, 2]], ["kernel_cp", "sp", [-1, 8]], ["kernel_kp", "sp", [-1, 8]], ["data_cp", "sp", [-1, 2]], ["data_wp", "sp", [-1, 2, 1]], ["data_hp", "sp", [-1, 1, 1]], ["bgemm_kp", "sp", [-1, 2]], ["bgemm_wp", "sp", [-1, 13, 4]], ["bgemm_hp", "sp", [-1, 1]]]}, "result": [[0.0020953502666666663], 0, 13.919443607330322, 1618312245.170173], "version": 0.2, "tvm_version": "0.8.dev0"}
{"input": ["opencl -keys=mali,opencl,gpu -device=mali -max_num_threads=256", "winograd_2", [1, 14, 14, 256, 256, 3, 3, [1, 1], [1, 1, 1, 1]], {}], "config": {"index": 251860, "code_hash": null, "entity": [["inv_cp", "sp", [-1, 8]], ["inv_wp", "sp", [-1, 4, 2]], ["inv_hp", "sp", [-1, 4, 2]], ["kernel_cp", "sp", [-1, 32]], ["kernel_kp", "sp", [-1, 4]], ["data_cp", "sp", [-1, 4]], ["data_wp", "sp", [-1, 1, 1]], ["data_hp", "sp", [-1, 1, 1]], ["bgemm_kp", "sp", [-1, 4]], ["bgemm_wp", "sp", [-1, 1, 4]], ["bgemm_hp", "sp", [-1, 1]]]}, "result": [[0.0036016401333333337], 0, 11.416659116744995, 1618312243.919613], "version": 0.2, "tvm_version": "0.8.dev0"}
{"input": ["opencl -keys=mali,opencl,gpu -device=mali -max_num_threads=256", "winograd_2", [1, 14, 14, 256, 256, 3, 3, [1, 1], [1, 1, 1, 1]], {}], "config": {"index": 966147, "code_hash": null, "entity": [["inv_cp", "sp", [-1, 4]], ["inv_wp", "sp", [-1, 4, 2]], ["inv_hp", "sp", [-1, 4, 2]], ["kernel_cp", "sp", [-1, 2]], ["kernel_kp", "sp", [-1, 1]], ["data_cp", "sp", [-1, 2]], ["data_wp", "sp", [-1, 4, 1]], ["data_hp", "sp", [-1, 4, 1]], ["bgemm_kp", "sp", [-1, 16]], ["bgemm_wp", "sp", [-1, 2, 4]], ["bgemm_hp", "sp", [-1, 1]]]}, "result": [[0.002190436066666667], 0, 12.737287044525146, 1618312247.7295077], "version": 0.2, "tvm_version": "0.8.dev0"}
{"input": ["opencl -keys=mali,opencl,gpu -device=mali -max_num_threads=256", "winograd_2", [1, 14, 14, 256, 256, 3, 3, [1, 1], [1, 1, 1, 1]], {}], "config": {"index": 1844683, "code_hash": null, "entity": [["inv_cp", "sp", [-1, 2]], ["inv_wp", "sp", [-1, 7, 2]], ["inv_hp", "sp", [-1, 7, 2]], ["kernel_cp", "sp", [-1, 1]], ["kernel_kp", "sp", [-1, 32]], ["data_cp", "sp", [-1, 16]], ["data_wp", "sp", [-1, 7, 1]], ["data_hp", "sp", [-1, 1, 1]], ["bgemm_kp", "sp", [-1, 8]], ["bgemm_wp", "sp", [-1, 8, 4]], ["bgemm_hp", "sp", [-1, 1]]]}, "result": [[0.0021837026666666672], 0, 16.12117028236389, 1618312246.4706683], "version": 0.2, "tvm_version": "0.8.dev0"}
{"input": ["opencl -keys=mali,opencl,gpu -device=mali -max_num_threads=256", "winograd_2", [1, 14, 14, 256, 256, 3, 3, [1, 1], [1, 1, 1, 1]], {}], "config": {"index": 972049, "code_hash": null, "entity": [["inv_cp", "sp", [-1, 2]], ["inv_wp", "sp", [-1, 4, 2]], ["inv_hp", "sp", [-1, 4, 2]], ["kernel_cp", "sp", [-1, 2]], ["kernel_kp", "sp", [-1, 32]], ["data_cp", "sp", [-1, 4]], ["data_wp", "sp", [-1, 7, 1]], ["data_hp", "sp", [-1, 4, 1]], ["bgemm_kp", "sp", [-1, 16]], ["bgemm_wp", "sp", [-1, 2, 4]], ["bgemm_hp", "sp", [-1, 1]]]}, "result": [[0.0021922574666666667], 0, 6.583346605300903, 1618312258.8143742], "version": 0.2, "tvm_version": "0.8.dev0"}
{"input": ["opencl -keys=mali,opencl,gpu -device=mali -max_num_threads=256", "winograd_2", [1, 14, 14, 256, 256, 3, 3, [1, 1], [1, 1, 1, 1]], {}], "config": {"index": 1531528, "code_hash": null, "entity": [["inv_cp", "sp", [-1, 8]], ["inv_wp", "sp", [-1, 4, 2]], ["inv_hp", "sp", [-1, 7, 2]], ["kernel_cp", "sp", [-1, 4]], ["kernel_kp", "sp", [-1, 4]], ["data_cp", "sp", [-1, 2]], ["data_wp", "sp", [-1, 7, 1]], ["data_hp", "sp", [-1, 2, 1]], ["bgemm_kp", "sp", [-1, 32]], ["bgemm_wp", "sp", [-1, 8, 4]], ["bgemm_hp", "sp", [-1, 1]]]}, "result": [[0.0020528334666666667], 0, 11.77406096458435, 1618312260.0669625], "version": 0.2, "tvm_version": "0.8.dev0"}
{"input": ["opencl -keys=mali,opencl,gpu -device=mali -max_num_threads=256", "winograd_2", [1, 14, 14, 256, 256, 3, 3, [1, 1], [1, 1, 1, 1]], {}], "config": {"index": 2165074, "code_hash": null, "entity": [["inv_cp", "sp", [-1, 8]], ["inv_wp", "sp", [-1, 7, 2]], ["inv_hp", "sp", [-1, 4, 2]], ["kernel_cp", "sp", [-1, 1]], ["kernel_kp", "sp", [-1, 16]], ["data_cp", "sp", [-1, 4]], ["data_wp", "sp", [-1, 2, 1]], ["data_hp", "sp", [-1, 1, 1]], ["bgemm_kp", "sp", [-1, 2]], ["bgemm_wp", "sp", [-1, 13, 4]], ["bgemm_hp", "sp", [-1, 1]]]}, "result": [[0.0020832806666666666], 0, 11.751645803451538, 1618312261.324855], "version": 0.2, "tvm_version": "0.8.dev0"}
{"input": ["opencl -keys=mali,opencl,gpu -device=mali -max_num_threads=256", "winograd_2", [1, 14, 14, 256, 256, 3, 3, [1, 1], [1, 1, 1, 1]], {}], "config": {"index": 567184, "code_hash": null, "entity": [["inv_cp", "sp", [-1, 8]], ["inv_wp", "sp", [-1, 4, 2]], ["inv_hp", "sp", [-1, 7, 2]], ["kernel_cp", "sp", [-1, 8]], ["kernel_kp", "sp", [-1, 2]], ["data_cp", "sp", [-1, 2]], ["data_wp", "sp", [-1, 2, 1]], ["data_hp", "sp", [-1, 7, 1]], ["bgemm_kp", "sp", [-1, 32]], ["bgemm_wp", "sp", [-1, 2, 4]], ["bgemm_hp", "sp", [-1, 1]]]}, "result": [[0.002116412266666667], 0, 14.349588632583618, 1618312262.557956], "version": 0.2, "tvm_version": "0.8.dev0"}
{"input": ["opencl -keys=mali,opencl,gpu -device=mali -max_num_threads=256", "winograd_2", [1, 14, 14, 256, 256, 3, 3, [1, 1], [1, 1, 1, 1]], {}], "config": {"index": 2342917, "code_hash": null, "entity": [["inv_cp", "sp", [-1, 2]], ["inv_wp", "sp", [-1, 4, 2]], ["inv_hp", "sp", [-1, 7, 2]], ["kernel_cp", "sp", [-1, 1]], ["kernel_kp", "sp", [-1, 8]], ["data_cp", "sp", [-1, 16]], ["data_wp", "sp", [-1, 7, 1]], ["data_hp", "sp", [-1, 1, 1]], ["bgemm_kp", "sp", [-1, 8]], ["bgemm_wp", "sp", [-1, 13, 4]], ["bgemm_hp", "sp", [-1, 1]]]}, "result": [[0.0018598935999999998], 0, 15.731322526931763, 1618312265.1358552], "version": 0.2, "tvm_version": "0.8.dev0"}
{"input": ["opencl -keys=mali,opencl,gpu -device=mali -max_num_threads=256", "winograd_2", [1, 14, 14, 256, 256, 3, 3, [1, 1], [1, 1, 1, 1]], {}], "config": {"index": 1323616, "code_hash": null, "entity": [["inv_cp", "sp", [-1, 8]], ["inv_wp", "sp", [-1, 4, 2]], ["inv_hp", "sp", [-1, 7, 2]], ["kernel_cp", "sp", [-1, 8]], ["kernel_kp", "sp", [-1, 16]], ["data_cp", "sp", [-1, 1]], ["data_wp", "sp", [-1, 7, 1]], ["data_hp", "sp", [-1, 7, 1]], ["bgemm_kp", "sp", [-1, 4]], ["bgemm_wp", "sp", [-1, 4, 4]], ["bgemm_hp", "sp", [-1, 1]]]}, "result": [[0.002192413733333333], 0, 19.529860258102417, 1618312267.6465952], "version": 0.2, "tvm_version": "0.8.dev0"}
{"input": ["opencl -keys=mali,opencl,gpu -device=mali -max_num_threads=256", "winograd_2", [1, 14, 14, 256, 256, 3, 3, [1, 1], [1, 1, 1, 1]], {}], "config": {"index": 1719511, "code_hash": null, "entity": [["inv_cp", "sp", [-1, 2]], ["inv_wp", "sp", [-1, 7, 2]], ["inv_hp", "sp", [-1, 4, 2]], ["kernel_cp", "sp", [-1, 32]], ["kernel_kp", "sp", [-1, 1]], ["data_cp", "sp", [-1, 8]], ["data_wp", "sp", [-1, 7, 1]], ["data_hp", "sp", [-1, 4, 1]], ["bgemm_kp", "sp", [-1, 2]], ["bgemm_wp", "sp", [-1, 8, 4]], ["bgemm_hp", "sp", [-1, 1]]]}, "result": [[0.0021580485999999994], 0, 11.48816990852356, 1618312263.8587925], "version": 0.2, "tvm_version": "0.8.dev0"}
{"input": ["opencl -keys=mali,opencl,gpu -device=mali -max_num_threads=256", "winograd_2", [1, 14, 14, 256, 256, 3, 3, [1, 1], [1, 1, 1, 1]], {}], "config": {"index": 1930611, "code_hash": null, "entity": [["inv_cp", "sp", [-1, 4]], ["inv_wp", "sp", [-1, 4, 2]], ["inv_hp", "sp", [-1, 4, 2]], ["kernel_cp", "sp", [-1, 32]], ["kernel_kp", "sp", [-1, 4]], ["data_cp", "sp", [-1, 2]], ["data_wp", "sp", [-1, 1, 1]], ["data_hp", "sp", [-1, 2, 1]], ["bgemm_kp", "sp", [-1, 16]], ["bgemm_wp", "sp", [-1, 8, 4]], ["bgemm_hp", "sp", [-1, 1]]]}, "result": [[0.0020694227999999994], 0, 20.291827917099, 1618312268.978615], "version": 0.2, "tvm_version": "0.8.dev0"}
{"input": ["opencl -keys=mali,opencl,gpu -device=mali -max_num_threads=256", "winograd_2", [1, 14, 14, 256, 256, 3, 3, [1, 1], [1, 1, 1, 1]], {}], "config": {"index": 2214760, "code_hash": null, "entity": [["inv_cp", "sp", [-1, 8]], ["inv_wp", "sp", [-1, 4, 2]], ["inv_hp", "sp", [-1, 7, 2]], ["kernel_cp", "sp", [-1, 1]], ["kernel_kp", "sp", [-1, 2]], ["data_cp", "sp", [-1, 1]], ["data_wp", "sp", [-1, 7, 1]], ["data_hp", "sp", [-1, 4, 1]], ["bgemm_kp", "sp", [-1, 2]], ["bgemm_wp", "sp", [-1, 13, 4]], ["bgemm_hp", "sp", [-1, 1]]]}, "result": [[0.0020893810666666665], 0, 14.067051649093628, 1618312266.4072597], "version": 0.2, "tvm_version": "0.8.dev0"}
{"input": ["opencl -keys=mali,opencl,gpu -device=mali -max_num_threads=256", "winograd_2", [1, 14, 14, 256, 256, 3, 3, [1, 1], [1, 1, 1, 1]], {}], "config": {"index": 403309, "code_hash": null, "entity": [["inv_cp", "sp", [-1, 2]], ["inv_wp", "sp", [-1, 4, 2]], ["inv_hp", "sp", [-1, 7, 2]], ["kernel_cp", "sp", [-1, 8]], ["kernel_kp", "sp", [-1, 8]], ["data_cp", "sp", [-1, 8]], ["data_wp", "sp", [-1, 2, 1]], ["data_hp", "sp", [-1, 7, 1]], ["bgemm_kp", "sp", [-1, 8]], ["bgemm_wp", "sp", [-1, 1, 4]], ["bgemm_hp", "sp", [-1, 1]]]}, "result": [[0.0023021658000000004], 0, 8.881635665893555, 1618312278.1183987], "version": 0.2, "tvm_version": "0.8.dev0"}
{"input": ["opencl -keys=mali,opencl,gpu -device=mali -max_num_threads=256", "winograd_2", [1, 14, 14, 256, 256, 3, 3, [1, 1], [1, 1, 1, 1]], {}], "config": {"index": 439513, "code_hash": null, "entity": [["inv_cp", "sp", [-1, 2]], ["inv_wp", "sp", [-1, 4, 2]], ["inv_hp", "sp", [-1, 4, 2]], ["kernel_cp", "sp", [-1, 1]], ["kernel_kp", "sp", [-1, 8]], ["data_cp", "sp", [-1, 8]], ["data_wp", "sp", [-1, 1, 1]], ["data_hp", "sp", [-1, 2, 1]], ["bgemm_kp", "sp", [-1, 16]], ["bgemm_wp", "sp", [-1, 1, 4]], ["bgemm_hp", "sp", [-1, 1]]]}, "result": [[0.0023189336000000002], 0, 9.942140102386475, 1618312279.4309778], "version": 0.2, "tvm_version": "0.8.dev0"}
{"input": ["opencl -keys=mali,opencl,gpu -device=mali -max_num_threads=256", "winograd_2", [1, 14, 14, 256, 256, 3, 3, [1, 1], [1, 1, 1, 1]], {}], "config": {"index": 2468032, "code_hash": null, "entity": [["inv_cp", "sp", [-1, 8]], ["inv_wp", "sp", [-1, 4, 2]], ["inv_hp", "sp", [-1, 7, 2]], ["kernel_cp", "sp", [-1, 32]], ["kernel_kp", "sp", [-1, 4]], ["data_cp", "sp", [-1, 32]], ["data_wp", "sp", [-1, 1, 1]], ["data_hp", "sp", [-1, 7, 1]], ["bgemm_kp", "sp", [-1, 16]], ["bgemm_wp", "sp", [-1, 13, 4]], ["bgemm_hp", "sp", [-1, 1]]]}, "result": [[0.0018611754666666663], 0, 11.028987169265747, 1618312280.6942022], "version": 0.2, "tvm_version": "0.8.dev0"}
{"input": ["opencl -keys=mali,opencl,gpu -device=mali -max_num_threads=256", "winograd_2", [1, 14, 14, 256, 256, 3, 3, [1, 1], [1, 1, 1, 1]], {}], "config": {"index": 1567965, "code_hash": null, "entity": [["inv_cp", "sp", [-1, 4]], ["inv_wp", "sp", [-1, 7, 2]], ["inv_hp", "sp", [-1, 7, 2]], ["kernel_cp", "sp", [-1, 4]], ["kernel_kp", "sp", [-1, 8]], ["data_cp", "sp", [-1, 2]], ["data_wp", "sp", [-1, 4, 1]], ["data_hp", "sp", [-1, 7, 1]], ["bgemm_kp", "sp", [-1, 32]], ["bgemm_wp", "sp", [-1, 8, 4]], ["bgemm_hp", "sp", [-1, 1]]]}, "result": [[0.002055677], 0, 12.209743976593018, 1618312281.9904022], "version": 0.2, "tvm_version": "0.8.dev0"}
{"input": ["opencl -keys=mali,opencl,gpu -device=mali -max_num_threads=256", "winograd_2", [1, 14, 14, 256, 256, 3, 3, [1, 1], [1, 1, 1, 1]], {}], "config": {"index": 1764771, "code_hash": null, "entity": [["inv_cp", "sp", [-1, 4]], ["inv_wp", "sp", [-1, 4, 2]], ["inv_hp", "sp", [-1, 4, 2]], ["kernel_cp", "sp", [-1, 2]], ["kernel_kp", "sp", [-1, 4]], ["data_cp", "sp", [-1, 2]], ["data_wp", "sp", [-1, 1, 1]], ["data_hp", "sp", [-1, 2, 1]], ["bgemm_kp", "sp", [-1, 4]], ["bgemm_wp", "sp", [-1, 8, 4]], ["bgemm_hp", "sp", [-1, 1]]]}, "result": [[0.0021783068666666665], 0, 13.62195873260498, 1618312283.2552173], "version": 0.2, "tvm_version": "0.8.dev0"}
{"input": ["opencl -keys=mali,opencl,gpu -device=mali -max_num_threads=256", "winograd_2", [1, 14, 14, 256, 256, 3, 3, [1, 1], [1, 1, 1, 1]], {}], "config": {"index": 2396357, "code_hash": null, "entity": [["inv_cp", "sp", [-1, 16]], ["inv_wp", "sp", [-1, 4, 2]], ["inv_hp", "sp", [-1, 4, 2]], ["kernel_cp", "sp", [-1, 2]], ["kernel_kp", "sp", [-1, 4]], ["data_cp", "sp", [-1, 1]], ["data_wp", "sp", [-1, 4, 1]], ["data_hp", "sp", [-1, 7, 1]], ["bgemm_kp", "sp", [-1, 8]], ["bgemm_wp", "sp", [-1, 13, 4]], ["bgemm_hp", "sp", [-1, 1]]]}, "result": [[0.001868850733333333], 0, 14.958822965621948, 1618312284.5167997], "version": 0.2, "tvm_version": "0.8.dev0"}
{"input": ["opencl -keys=mali,opencl,gpu -device=mali -max_num_threads=256", "winograd_2", [1, 14, 14, 256, 256, 3, 3, [1, 1], [1, 1, 1, 1]], {}], "config": {"index": 590155, "code_hash": null, "entity": [["inv_cp", "sp", [-1, 2]], ["inv_wp", "sp", [-1, 7, 2]], ["inv_hp", "sp", [-1, 7, 2]], ["kernel_cp", "sp", [-1, 1]], ["kernel_kp", "sp", [-1, 32]], ["data_cp", "sp", [-1, 16]], ["data_wp", "sp", [-1, 2, 1]], ["data_hp", "sp", [-1, 1, 1]], ["bgemm_kp", "sp", [-1, 1]], ["bgemm_wp", "sp", [-1, 2, 4]], ["bgemm_hp", "sp", [-1, 1]]]}, "result": [[0.006109392800000001], 0, 15.64224624633789, 1618312286.000248], "version": 0.2, "tvm_version": "0.8.dev0"}
{"input": ["opencl -keys=mali,opencl,gpu -device=mali -max_num_threads=256", "winograd_2", [1, 14, 14, 256, 256, 3, 3, [1, 1], [1, 1, 1, 1]], {}], "config": {"index": 6297, "code_hash": null, "entity": [["inv_cp", "sp", [-1, 4]], ["inv_wp", "sp", [-1, 7, 2]], ["inv_hp", "sp", [-1, 4, 2]], ["kernel_cp", "sp", [-1, 8]], ["kernel_kp", "sp", [-1, 1]], ["data_cp", "sp", [-1, 1]], ["data_wp", "sp", [-1, 2, 1]], ["data_hp", "sp", [-1, 1, 1]], ["bgemm_kp", "sp", [-1, 32]], ["bgemm_wp", "sp", [-1, 1, 4]], ["bgemm_hp", "sp", [-1, 1]]]}, "result": [[0.002308523133333333], 0, 16.79147505760193, 1618312287.178148], "version": 0.2, "tvm_version": "0.8.dev0"}
{"input": ["opencl -keys=mali,opencl,gpu -device=mali -max_num_threads=256", "winograd_2", [1, 14, 14, 256, 256, 3, 3, [1, 1], [1, 1, 1, 1]], {}], "config": {"index": 1764952, "code_hash": null, "entity": [["inv_cp", "sp", [-1, 8]], ["inv_wp", "sp", [-1, 4, 2]], ["inv_hp", "sp", [-1, 7, 2]], ["kernel_cp", "sp", [-1, 4]], ["kernel_kp", "sp", [-1, 8]], ["data_cp", "sp", [-1, 2]], ["data_wp", "sp", [-1, 1, 1]], ["data_hp", "sp", [-1, 2, 1]], ["bgemm_kp", "sp", [-1, 4]], ["bgemm_wp", "sp", [-1, 8, 4]], ["bgemm_hp", "sp", [-1, 1]]]}, "result": [[0.0021688024000000006], 0, 18.76195788383484, 1618312288.395591], "version": 0.2, "tvm_version": "0.8.dev0"}
{"input": ["opencl -keys=mali,opencl,gpu -device=mali -max_num_threads=256", "winograd_2", [1, 14, 14, 256, 256, 3, 3, [1, 1], [1, 1, 1, 1]], {}], "config": {"index": 2339821, "code_hash": null, "entity": [["inv_cp", "sp", [-1, 2]], ["inv_wp", "sp", [-1, 4, 2]], ["inv_hp", "sp", [-1, 7, 2]], ["kernel_cp", "sp", [-1, 8]], ["kernel_kp", "sp", [-1, 32]], ["data_cp", "sp", [-1, 2]], ["data_wp", "sp", [-1, 7, 1]], ["data_hp", "sp", [-1, 1, 1]], ["bgemm_kp", "sp", [-1, 8]], ["bgemm_wp", "sp", [-1, 13, 4]], ["bgemm_hp", "sp", [-1, 1]]]}, "result": [[0.001858724333333333], 0, 10.993192911148071, 1618312958.6991053], "version": 0.2, "tvm_version": "0.8.dev0"}
{"input": ["opencl -keys=mali,opencl,gpu -device=mali -max_num_threads=256", "winograd_2", [1, 14, 14, 256, 256, 3, 3, [1, 1], [1, 1, 1, 1]], {}], "config": {"index": 2339845, "code_hash": null, "entity": [["inv_cp", "sp", [-1, 2]], ["inv_wp", "sp", [-1, 4, 2]], ["inv_hp", "sp", [-1, 7, 2]], ["kernel_cp", "sp", [-1, 16]], ["kernel_kp", "sp", [-1, 32]], ["data_cp", "sp", [-1, 2]], ["data_wp", "sp", [-1, 7, 1]], ["data_hp", "sp", [-1, 1, 1]], ["bgemm_kp", "sp", [-1, 8]], ["bgemm_wp", "sp", [-1, 13, 4]], ["bgemm_hp", "sp", [-1, 1]]]}, "result": [[0.0018812393333333334], 0, 12.087533712387085, 1618312959.9534388], "version": 0.2, "tvm_version": "0.8.dev0"}
{"input": ["opencl -keys=mali,opencl,gpu -device=mali -max_num_threads=256", "winograd_2", [1, 14, 14, 256, 256, 3, 3, [1, 1], [1, 1, 1, 1]], {}], "config": {"index": 2339917, "code_hash": null, "entity": [["inv_cp", "sp", [-1, 2]], ["inv_wp", "sp", [-1, 4, 2]], ["inv_hp", "sp", [-1, 7, 2]], ["kernel_cp", "sp", [-1, 2]], ["kernel_kp", "sp", [-1, 1]], ["data_cp", "sp", [-1, 2]], ["data_wp", "sp", [-1, 7, 1]], ["data_hp", "sp", [-1, 1, 1]], ["bgemm_kp", "sp", [-1, 8]], ["bgemm_wp", "sp", [-1, 13, 4]], ["bgemm_hp", "sp", [-1, 1]]]}, "result": [[0.0018656269333333336], 0, 13.50986385345459, 1618312961.2904909], "version": 0.2, "tvm_version": "0.8.dev0"}
{"input": ["opencl -keys=mali,opencl,gpu -device=mali -max_num_threads=256", "winograd_2", [1, 14, 14, 256, 256, 3, 3, [1, 1], [1, 1, 1, 1]], {}], "config": {"index": 2339725, "code_hash": null, "entity": [["inv_cp", "sp", [-1, 2]], ["inv_wp", "sp", [-1, 4, 2]], ["inv_hp", "sp", [-1, 7, 2]], ["kernel_cp", "sp", [-1, 32]], ["kernel_kp", "sp", [-1, 32]], ["data_cp", "sp", [-1, 2]], ["data_wp", "sp", [-1, 7, 1]], ["data_hp", "sp", [-1, 1, 1]], ["bgemm_kp", "sp", [-1, 8]], ["bgemm_wp", "sp", [-1, 13, 4]], ["bgemm_hp", "sp", [-1, 1]]]}, "result": [[0.0018777513333333336], 0, 14.761400699615479, 1618312962.503642], "version": 0.2, "tvm_version": "0.8.dev0"}
{"input": ["opencl -keys=mali,opencl,gpu -device=mali -max_num_threads=256", "winograd_2", [1, 14, 14, 256, 256, 3, 3, [1, 1], [1, 1, 1, 1]], {}], "config": {"index": 2340157, "code_hash": null, "entity": [["inv_cp", "sp", [-1, 2]], ["inv_wp", "sp", [-1, 4, 2]], ["inv_hp", "sp", [-1, 7, 2]], ["kernel_cp", "sp", [-1, 32]], ["kernel_kp", "sp", [-1, 4]], ["data_cp", "sp", [-1, 2]], ["data_wp", "sp", [-1, 7, 1]], ["data_hp", "sp", [-1, 1, 1]], ["bgemm_kp", "sp", [-1, 8]], ["bgemm_wp", "sp", [-1, 13, 4]], ["bgemm_hp", "sp", [-1, 1]]]}, "result": [[0.00187595], 0, 15.904540777206421, 1618312963.8059013], "version": 0.2, "tvm_version": "0.8.dev0"}
{"input": ["opencl -keys=mali,opencl,gpu -device=mali -max_num_threads=256", "winograd_2", [1, 14, 14, 256, 256, 3, 3, [1, 1], [1, 1, 1, 1]], {}], "config": {"index": 2339797, "code_hash": null, "entity": [["inv_cp", "sp", [-1, 2]], ["inv_wp", "sp", [-1, 4, 2]], ["inv_hp", "sp", [-1, 7, 2]], ["kernel_cp", "sp", [-1, 4]], ["kernel_kp", "sp", [-1, 32]], ["data_cp", "sp", [-1, 2]], ["data_wp", "sp", [-1, 7, 1]], ["data_hp", "sp", [-1, 1, 1]], ["bgemm_kp", "sp", [-1, 8]], ["bgemm_wp", "sp", [-1, 13, 4]], ["bgemm_hp", "sp", [-1, 1]]]}, "result": [[0.0018434679999999998], 0, 17.170028924942017, 1618312965.1538203], "version": 0.2, "tvm_version": "0.8.dev0"}
{"input": ["opencl -keys=mali,opencl,gpu -device=mali -max_num_threads=256", "winograd_2", [1, 14, 14, 256, 256, 3, 3, [1, 1], [1, 1, 1, 1]], {}], "config": {"index": 2340229, "code_hash": null, "entity": [["inv_cp", "sp", [-1, 2]], ["inv_wp", "sp", [-1, 4, 2]], ["inv_hp", "sp", [-1, 7, 2]], ["kernel_cp", "sp", [-1, 4]], ["kernel_kp", "sp", [-1, 4]], ["data_cp", "sp", [-1, 2]], ["data_wp", "sp", [-1, 7, 1]], ["data_hp", "sp", [-1, 1, 1]], ["bgemm_kp", "sp", [-1, 8]], ["bgemm_wp", "sp", [-1, 13, 4]], ["bgemm_hp", "sp", [-1, 1]]]}, "result": [[0.0018669426], 0, 18.29792618751526, 1618312966.3062375], "version": 0.2, "tvm_version": "0.8.dev0"}
{"input": ["opencl -keys=mali,opencl,gpu -device=mali -max_num_threads=256", "winograd_2", [1, 14, 14, 256, 256, 3, 3, [1, 1], [1, 1, 1, 1]], {}], "config": {"index": 2340013, "code_hash": null, "entity": [["inv_cp", "sp", [-1, 2]], ["inv_wp", "sp", [-1, 4, 2]], ["inv_hp", "sp", [-1, 7, 2]], ["kernel_cp", "sp", [-1, 32]], ["kernel_kp", "sp", [-1, 2]], ["data_cp", "sp", [-1, 2]], ["data_wp", "sp", [-1, 7, 1]], ["data_hp", "sp", [-1, 1, 1]], ["bgemm_kp", "sp", [-1, 8]], ["bgemm_wp", "sp", [-1, 13, 4]], ["bgemm_hp", "sp", [-1, 1]]]}, "result": [[0.0018469338666666666], 0, 19.760631561279297, 1618312967.4839585], "version": 0.2, "tvm_version": "0.8.dev0"}
{"input": ["opencl -keys=mali,opencl,gpu -device=mali -max_num_threads=256", "winograd_2", [1, 14, 14, 256, 256, 3, 3, [1, 1], [1, 1, 1, 1]], {}], "config": {"index": 2340205, "code_hash": null, "entity": [["inv_cp", "sp", [-1, 2]], ["inv_wp", "sp", [-1, 4, 2]], ["inv_hp", "sp", [-1, 7, 2]], ["kernel_cp", "sp", [-1, 2]], ["kernel_kp", "sp", [-1, 4]], ["data_cp", "sp", [-1, 2]], ["data_wp", "sp", [-1, 7, 1]], ["data_hp", "sp", [-1, 1, 1]], ["bgemm_kp", "sp", [-1, 8]], ["bgemm_wp", "sp", [-1, 13, 4]], ["bgemm_hp", "sp", [-1, 1]]]}, "result": [[0.0018494299333333335], 0, 20.764968395233154, 1618312968.5697334], "version": 0.2, "tvm_version": "0.8.dev0"}
{"input": ["opencl -keys=mali,opencl,gpu -device=mali -max_num_threads=256", "winograd_2", [1, 14, 14, 256, 256, 3, 3, [1, 1], [1, 1, 1, 1]], {}], "config": {"index": 2340037, "code_hash": null, "entity": [["inv_cp", "sp", [-1, 2]], ["inv_wp", "sp", [-1, 4, 2]], ["inv_hp", "sp", [-1, 7, 2]], ["kernel_cp", "sp", [-1, 1]], ["kernel_kp", "sp", [-1, 2]], ["data_cp", "sp", [-1, 2]], ["data_wp", "sp", [-1, 7, 1]], ["data_hp", "sp", [-1, 1, 1]], ["bgemm_kp", "sp", [-1, 8]], ["bgemm_wp", "sp", [-1, 13, 4]], ["bgemm_hp", "sp", [-1, 1]]]}, "result": [[0.0018703897333333332], 0, 21.884269952774048, 1618312969.7466407], "version": 0.2, "tvm_version": "0.8.dev0"}
{"input": ["opencl -keys=mali,opencl,gpu -device=mali -max_num_threads=256", "winograd_2", [1, 14, 14, 256, 256, 3, 3, [1, 1], [1, 1, 1, 1]], {}], "config": {"index": 2340061, "code_hash": null, "entity": [["inv_cp", "sp", [-1, 2]], ["inv_wp", "sp", [-1, 4, 2]], ["inv_hp", "sp", [-1, 7, 2]], ["kernel_cp", "sp", [-1, 2]], ["kernel_kp", "sp", [-1, 2]], ["data_cp", "sp", [-1, 2]], ["data_wp", "sp", [-1, 7, 1]], ["data_hp", "sp", [-1, 1, 1]], ["bgemm_kp", "sp", [-1, 8]], ["bgemm_wp", "sp", [-1, 13, 4]], ["bgemm_hp", "sp", [-1, 1]]]}, "result": [[0.0018650574000000004], 0, 23.487576246261597, 1618312971.284977], "version": 0.2, "tvm_version": "0.8.dev0"}
{"input": ["opencl -keys=mali,opencl,gpu -device=mali -max_num_threads=256", "winograd_2", [1, 14, 14, 256, 256, 3, 3, [1, 1], [1, 1, 1, 1]], {}], "config": {"index": 2340349, "code_hash": null, "entity": [["inv_cp", "sp", [-1, 2]], ["inv_wp", "sp", [-1, 4, 2]], ["inv_hp", "sp", [-1, 7, 2]], ["kernel_cp", "sp", [-1, 2]], ["kernel_kp", "sp", [-1, 8]], ["data_cp", "sp", [-1, 2]], ["data_wp", "sp", [-1, 7, 1]], ["data_hp", "sp", [-1, 1, 1]], ["bgemm_kp", "sp", [-1, 8]], ["bgemm_wp", "sp", [-1, 13, 4]], ["bgemm_hp", "sp", [-1, 1]]]}, "result": [[0.0018715327999999998], 0, 24.7839298248291, 1618312972.6483567], "version": 0.2, "tvm_version": "0.8.dev0"}
{"input": ["opencl -keys=mali,opencl,gpu -device=mali -max_num_threads=256", "winograd_2", [1, 14, 14, 256, 256, 3, 3, [1, 1], [1, 1, 1, 1]], {}], "config": {"index": 2339989, "code_hash": null, "entity": [["inv_cp", "sp", [-1, 2]], ["inv_wp", "sp", [-1, 4, 2]], ["inv_hp", "sp", [-1, 7, 2]], ["kernel_cp", "sp", [-1, 16]], ["kernel_kp", "sp", [-1, 1]], ["data_cp", "sp", [-1, 2]], ["data_wp", "sp", [-1, 7, 1]], ["data_hp", "sp", [-1, 1, 1]], ["bgemm_kp", "sp", [-1, 8]], ["bgemm_wp", "sp", [-1, 13, 4]], ["bgemm_hp", "sp", [-1, 1]]]}, "result": [[0.0018588136666666665], 0, 26.00310969352722, 1618312973.941056], "version": 0.2, "tvm_version": "0.8.dev0"}
{"input": ["opencl -keys=mali,opencl,gpu -device=mali -max_num_threads=256", "winograd_2", [1, 14, 14, 256, 256, 3, 3, [1, 1], [1, 1, 1, 1]], {}], "config": {"index": 2339869, "code_hash": null, "entity": [["inv_cp", "sp", [-1, 2]], ["inv_wp", "sp", [-1, 4, 2]], ["inv_hp", "sp", [-1, 7, 2]], ["kernel_cp", "sp", [-1, 32]], ["kernel_kp", "sp", [-1, 1]], ["data_cp", "sp", [-1, 2]], ["data_wp", "sp", [-1, 7, 1]], ["data_hp", "sp", [-1, 1, 1]], ["bgemm_kp", "sp", [-1, 8]], ["bgemm_wp", "sp", [-1, 13, 4]], ["bgemm_hp", "sp", [-1, 1]]]}, "result": [[0.0018570263333333333], 0, 27.33390522003174, 1618312975.2843804], "version": 0.2, "tvm_version": "0.8.dev0"}
{"input": ["opencl -keys=mali,opencl,gpu -device=mali -max_num_threads=256", "winograd_2", [1, 14, 14, 256, 256, 3, 3, [1, 1], [1, 1, 1, 1]], {}], "config": {"index": 2340397, "code_hash": null, "entity": [["inv_cp", "sp", [-1, 2]], ["inv_wp", "sp", [-1, 4, 2]], ["inv_hp", "sp", [-1, 7, 2]], ["kernel_cp", "sp", [-1, 8]], ["kernel_kp", "sp", [-1, 8]], ["data_cp", "sp", [-1, 2]], ["data_wp", "sp", [-1, 7, 1]], ["data_hp", "sp", [-1, 1, 1]], ["bgemm_kp", "sp", [-1, 8]], ["bgemm_wp", "sp", [-1, 13, 4]], ["bgemm_hp", "sp", [-1, 1]]]}, "result": [[0.0018636003333333331], 0, 28.698756217956543, 1618312976.5590522], "version": 0.2, "tvm_version": "0.8.dev0"}
{"input": ["opencl -keys=mali,opencl,gpu -device=mali -max_num_threads=256", "winograd_2", [1, 14, 14, 256, 256, 3, 3, [1, 1], [1, 1, 1, 1]], {}], "config": {"index": 2340109, "code_hash": null, "entity": [["inv_cp", "sp", [-1, 2]], ["inv_wp", "sp", [-1, 4, 2]], ["inv_hp", "sp", [-1, 7, 2]], ["kernel_cp", "sp", [-1, 8]], ["kernel_kp", "sp", [-1, 2]], ["data_cp", "sp", [-1, 2]], ["data_wp", "sp", [-1, 7, 1]], ["data_hp", "sp", [-1, 1, 1]], ["bgemm_kp", "sp", [-1, 8]], ["bgemm_wp", "sp", [-1, 13, 4]], ["bgemm_hp", "sp", [-1, 1]]]}, "result": [[0.0018795562666666667], 0, 30.038133144378662, 1618312978.0503104], "version": 0.2, "tvm_version": "0.8.dev0"}
{"input": ["opencl -keys=mali,opencl,gpu -device=mali -max_num_threads=256", "winograd_2", [1, 14, 14, 256, 256, 3, 3, [1, 1], [1, 1, 1, 1]], {}], "config": {"index": 2340301, "code_hash": null, "entity": [["inv_cp", "sp", [-1, 2]], ["inv_wp", "sp", [-1, 4, 2]], ["inv_hp", "sp", [-1, 7, 2]], ["kernel_cp", "sp", [-1, 32]], ["kernel_kp", "sp", [-1, 8]], ["data_cp", "sp", [-1, 2]], ["data_wp", "sp", [-1, 7, 1]], ["data_hp", "sp", [-1, 1, 1]], ["bgemm_kp", "sp", [-1, 8]], ["bgemm_wp", "sp", [-1, 13, 4]], ["bgemm_hp", "sp", [-1, 1]]]}, "result": [[0.001870487], 0, 31.296616315841675, 1618312979.3072212], "version": 0.2, "tvm_version": "0.8.dev0"}
{"input": ["opencl -keys=mali,opencl,gpu -device=mali -max_num_threads=256", "winograd_2", [1, 14, 14, 256, 256, 3, 3, [1, 1], [1, 1, 1, 1]], {}], "config": {"index": 2340085, "code_hash": null, "entity": [["inv_cp", "sp", [-1, 2]], ["inv_wp", "sp", [-1, 4, 2]], ["inv_hp", "sp", [-1, 7, 2]], ["kernel_cp", "sp", [-1, 4]], ["kernel_kp", "sp", [-1, 2]], ["data_cp", "sp", [-1, 2]], ["data_wp", "sp", [-1, 7, 1]], ["data_hp", "sp", [-1, 1, 1]], ["bgemm_kp", "sp", [-1, 8]], ["bgemm_wp", "sp", [-1, 13, 4]], ["bgemm_hp", "sp", [-1, 1]]]}, "result": [[0.0018845541333333332], 0, 32.565467834472656, 1618312980.6095378], "version": 0.2, "tvm_version": "0.8.dev0"}
{"input": ["opencl -keys=mali,opencl,gpu -device=mali -max_num_threads=256", "winograd_2", [1, 14, 14, 256, 256, 3, 3, [1, 1], [1, 1, 1, 1]], {}], "config": {"index": 2339941, "code_hash": null, "entity": [["inv_cp", "sp", [-1, 2]], ["inv_wp", "sp", [-1, 4, 2]], ["inv_hp", "sp", [-1, 7, 2]], ["kernel_cp", "sp", [-1, 4]], ["kernel_kp", "sp", [-1, 1]], ["data_cp", "sp", [-1, 2]], ["data_wp", "sp", [-1, 7, 1]], ["data_hp", "sp", [-1, 1, 1]], ["bgemm_kp", "sp", [-1, 8]], ["bgemm_wp", "sp", [-1, 13, 4]], ["bgemm_hp", "sp", [-1, 1]]]}, "result": [[0.0018612438], 0, 34.05298399925232, 1618312981.9501219], "version": 0.2, "tvm_version": "0.8.dev0"}
{"input": ["opencl -keys=mali,opencl,gpu -device=mali -max_num_threads=256", "winograd_2", [1, 14, 14, 256, 256, 3, 3, [1, 1], [1, 1, 1, 1]], {}], "config": {"index": 543457, "code_hash": null, "entity": [["inv_cp", "sp", [-1, 2]], ["inv_wp", "sp", [-1, 4, 2]], ["inv_hp", "sp", [-1, 4, 2]], ["kernel_cp", "sp", [-1, 32]], ["kernel_kp", "sp", [-1, 32]], ["data_cp", "sp", [-1, 16]], ["data_wp", "sp", [-1, 1, 1]], ["data_hp", "sp", [-1, 4, 1]], ["bgemm_kp", "sp", [-1, 32]], ["bgemm_wp", "sp", [-1, 2, 4]], ["bgemm_hp", "sp", [-1, 1]]]}, "result": [[0.002175375733333333], 0, 7.134231805801392, 1618317706.5638316], "version": 0.2, "tvm_version": "0.8.dev0"}
{"input": ["opencl -keys=mali,opencl,gpu -device=mali -max_num_threads=256", "winograd_2", [1, 14, 14, 256, 256, 3, 3, [1, 1], [1, 1, 1, 1]], {}], "config": {"index": 543625, "code_hash": null, "entity": [["inv_cp", "sp", [-1, 2]], ["inv_wp", "sp", [-1, 4, 2]], ["inv_hp", "sp", [-1, 4, 2]], ["kernel_cp", "sp", [-1, 1]], ["kernel_kp", "sp", [-1, 1]], ["data_cp", "sp", [-1, 16]], ["data_wp", "sp", [-1, 1, 1]], ["data_hp", "sp", [-1, 4, 1]], ["bgemm_kp", "sp", [-1, 32]], ["bgemm_wp", "sp", [-1, 2, 4]], ["bgemm_hp", "sp", [-1, 1]]]}, "result": [[0.0021133902], 0, 8.289111375808716, 1618317707.8309343], "version": 0.2, "tvm_version": "0.8.dev0"}
{"input": ["opencl -keys=mali,opencl,gpu -device=mali -max_num_threads=256", "winograd_2", [1, 14, 14, 256, 256, 3, 3, [1, 1], [1, 1, 1, 1]], {}], "config": {"index": 543505, "code_hash": null, "entity": [["inv_cp", "sp", [-1, 2]], ["inv_wp", "sp", [-1, 4, 2]], ["inv_hp", "sp", [-1, 4, 2]], ["kernel_cp", "sp", [-1, 2]], ["kernel_kp", "sp", [-1, 32]], ["data_cp", "sp", [-1, 16]], ["data_wp", "sp", [-1, 1, 1]], ["data_hp", "sp", [-1, 4, 1]], ["bgemm_kp", "sp", [-1, 32]], ["bgemm_wp", "sp", [-1, 2, 4]], ["bgemm_hp", "sp", [-1, 1]]]}, "result": [[0.0021133680666666666], 0, 9.842132568359375, 1618317709.2664049], "version": 0.2, "tvm_version": "0.8.dev0"}
{"input": ["opencl -keys=mali,opencl,gpu -device=mali -max_num_threads=256", "winograd_2", [1, 14, 14, 256, 256, 3, 3, [1, 1], [1, 1, 1, 1]], {}], "config": {"index": 543601, "code_hash": null, "entity": [["inv_cp", "sp", [-1, 2]], ["inv_wp", "sp", [-1, 4, 2]], ["inv_hp", "sp", [-1, 4, 2]], ["kernel_cp", "sp", [-1, 32]], ["kernel_kp", "sp", [-1, 1]], ["data_cp", "sp", [-1, 16]], ["data_wp", "sp", [-1, 1, 1]], ["data_hp", "sp", [-1, 4, 1]], ["bgemm_kp", "sp", [-1, 32]], ["bgemm_wp", "sp", [-1, 2, 4]], ["bgemm_hp", "sp", [-1, 1]]]}, "result": [[0.0021573533333333335], 0, 11.058754682540894, 1618317710.5706336], "version": 0.2, "tvm_version": "0.8.dev0"}
{"input": ["opencl -keys=mali,opencl,gpu -device=mali -max_num_threads=256", "winograd_2", [1, 14, 14, 256, 256, 3, 3, [1, 1], [1, 1, 1, 1]], {}], "config": {"index": 544009, "code_hash": null, "entity": [["inv_cp", "sp", [-1, 2]], ["inv_wp", "sp", [-1, 4, 2]], ["inv_hp", "sp", [-1, 4, 2]], ["kernel_cp", "sp", [-1, 16]], ["kernel_kp", "sp", [-1, 4]], ["data_cp", "sp", [-1, 16]], ["data_wp", "sp", [-1, 1, 1]], ["data_hp", "sp", [-1, 4, 1]], ["bgemm_kp", "sp", [-1, 32]], ["bgemm_wp", "sp", [-1, 2, 4]], ["bgemm_hp", "sp", [-1, 1]]]}, "result": [[0.0021579730666666666], 0, 12.399089097976685, 1618317711.8474567], "version": 0.2, "tvm_version": "0.8.dev0"}
{"input": ["opencl -keys=mali,opencl,gpu -device=mali -max_num_threads=256", "winograd_2", [1, 14, 14, 256, 256, 3, 3, [1, 1], [1, 1, 1, 1]], {}], "config": {"index": 543697, "code_hash": null, "entity": [["inv_cp", "sp", [-1, 2]], ["inv_wp", "sp", [-1, 4, 2]], ["inv_hp", "sp", [-1, 4, 2]], ["kernel_cp", "sp", [-1, 8]], ["kernel_kp", "sp", [-1, 1]], ["data_cp", "sp", [-1, 16]], ["data_wp", "sp", [-1, 1, 1]], ["data_hp", "sp", [-1, 4, 1]], ["bgemm_kp", "sp", [-1, 32]], ["bgemm_wp", "sp", [-1, 2, 4]], ["bgemm_hp", "sp", [-1, 1]]]}, "result": [[0.0021222586], 0, 13.726174354553223, 1618317713.2532759], "version": 0.2, "tvm_version": "0.8.dev0"}
{"input": ["opencl -keys=mali,opencl,gpu -device=mali -max_num_threads=256", "winograd_2", [1, 14, 14, 256, 256, 3, 3, [1, 1], [1, 1, 1, 1]], {}], "config": {"index": 543481, "code_hash": null, "entity": [["inv_cp", "sp", [-1, 2]], ["inv_wp", "sp", [-1, 4, 2]], ["inv_hp", "sp", [-1, 4, 2]], ["kernel_cp", "sp", [-1, 1]], ["kernel_kp", "sp", [-1, 32]], ["data_cp", "sp", [-1, 16]], ["data_wp", "sp", [-1, 1, 1]], ["data_hp", "sp", [-1, 4, 1]], ["bgemm_kp", "sp", [-1, 32]], ["bgemm_wp", "sp", [-1, 2, 4]], ["bgemm_hp", "sp", [-1, 1]]]}, "result": [[0.002121260066666667], 0, 14.868159770965576, 1618317714.5696123], "version": 0.2, "tvm_version": "0.8.dev0"}
{"input": ["opencl -keys=mali,opencl,gpu -device=mali -max_num_threads=256", "winograd_2", [1, 14, 14, 256, 256, 3, 3, [1, 1], [1, 1, 1, 1]], {}], "config": {"index": 543553, "code_hash": null, "entity": [["inv_cp", "sp", [-1, 2]], ["inv_wp", "sp", [-1, 4, 2]], ["inv_hp", "sp", [-1, 4, 2]], ["kernel_cp", "sp", [-1, 8]], ["kernel_kp", "sp", [-1, 32]], ["data_cp", "sp", [-1, 16]], ["data_wp", "sp", [-1, 1, 1]], ["data_hp", "sp", [-1, 4, 1]], ["bgemm_kp", "sp", [-1, 32]], ["bgemm_wp", "sp", [-1, 2, 4]], ["bgemm_hp", "sp", [-1, 1]]]}, "result": [[0.0021336141333333338], 0, 16.275946617126465, 1618317715.9053128], "version": 0.2, "tvm_version": "0.8.dev0"}
{"input": ["opencl -keys=mali,opencl,gpu -device=mali -max_num_threads=256", "winograd_2", [1, 14, 14, 256, 256, 3, 3, [1, 1], [1, 1, 1, 1]], {}], "config": {"index": 543577, "code_hash": null, "entity": [["inv_cp", "sp", [-1, 2]], ["inv_wp", "sp", [-1, 4, 2]], ["inv_hp", "sp", [-1, 4, 2]], ["kernel_cp", "sp", [-1, 16]], ["kernel_kp", "sp", [-1, 32]], ["data_cp", "sp", [-1, 16]], ["data_wp", "sp", [-1, 1, 1]], ["data_hp", "sp", [-1, 4, 1]], ["bgemm_kp", "sp", [-1, 32]], ["bgemm_wp", "sp", [-1, 2, 4]], ["bgemm_hp", "sp", [-1, 1]]]}, "result": [[0.0021316026666666674], 0, 17.580915689468384, 1618317717.2123187], "version": 0.2, "tvm_version": "0.8.dev0"}
{"input": ["opencl -keys=mali,opencl,gpu -device=mali -max_num_threads=256", "winograd_2", [1, 14, 14, 256, 256, 3, 3, [1, 1], [1, 1, 1, 1]], {}], "config": {"index": 544201, "code_hash": null, "entity": [["inv_cp", "sp", [-1, 2]], ["inv_wp", "sp", [-1, 4, 2]], ["inv_hp", "sp", [-1, 4, 2]], ["kernel_cp", "sp", [-1, 1]], ["kernel_kp", "sp", [-1, 16]], ["data_cp", "sp", [-1, 16]], ["data_wp", "sp", [-1, 1, 1]], ["data_hp", "sp", [-1, 4, 1]], ["bgemm_kp", "sp", [-1, 32]], ["bgemm_wp", "sp", [-1, 2, 4]], ["bgemm_hp", "sp", [-1, 1]]]}, "result": [[0.0021743431333333335], 0, 18.83326482772827, 1618317718.4858007], "version": 0.2, "tvm_version": "0.8.dev0"}
{"input": ["opencl -keys=mali,opencl,gpu -device=mali -max_num_threads=256", "winograd_2", [1, 14, 14, 256, 256, 3, 3, [1, 1], [1, 1, 1, 1]], {}], "config": {"index": 543649, "code_hash": null, "entity": [["inv_cp", "sp", [-1, 2]], ["inv_wp", "sp", [-1, 4, 2]], ["inv_hp", "sp", [-1, 4, 2]], ["kernel_cp", "sp", [-1, 2]], ["kernel_kp", "sp", [-1, 1]], ["data_cp", "sp", [-1, 16]], ["data_wp", "sp", [-1, 1, 1]], ["data_hp", "sp", [-1, 4, 1]], ["bgemm_kp", "sp", [-1, 32]], ["bgemm_wp", "sp", [-1, 2, 4]], ["bgemm_hp", "sp", [-1, 1]]]}, "result": [[0.0021734576], 0, 20.069705724716187, 1618317719.807915], "version": 0.2, "tvm_version": "0.8.dev0"}
{"input": ["opencl -keys=mali,opencl,gpu -device=mali -max_num_threads=256", "winograd_2", [1, 14, 14, 256, 256, 3, 3, [1, 1], [1, 1, 1, 1]], {}], "config": {"index": 543769, "code_hash": null, "entity": [["inv_cp", "sp", [-1, 2]], ["inv_wp", "sp", [-1, 4, 2]], ["inv_hp", "sp", [-1, 4, 2]], ["kernel_cp", "sp", [-1, 1]], ["kernel_kp", "sp", [-1, 2]], ["data_cp", "sp", [-1, 16]], ["data_wp", "sp", [-1, 1, 1]], ["data_hp", "sp", [-1, 4, 1]], ["bgemm_kp", "sp", [-1, 32]], ["bgemm_wp", "sp", [-1, 2, 4]], ["bgemm_hp", "sp", [-1, 1]]]}, "result": [[0.002178679066666667], 0, 21.455907344818115, 1618317721.2141676], "version": 0.2, "tvm_version": "0.8.dev0"}
{"input": ["opencl -keys=mali,opencl,gpu -device=mali -max_num_threads=256", "winograd_2", [1, 14, 14, 256, 256, 3, 3, [1, 1], [1, 1, 1, 1]], {}], "config": {"index": 544297, "code_hash": null, "entity": [["inv_cp", "sp", [-1, 2]], ["inv_wp", "sp", [-1, 4, 2]], ["inv_hp", "sp", [-1, 4, 2]], ["kernel_cp", "sp", [-1, 16]], ["kernel_kp", "sp", [-1, 16]], ["data_cp", "sp", [-1, 16]], ["data_wp", "sp", [-1, 1, 1]], ["data_hp", "sp", [-1, 4, 1]], ["bgemm_kp", "sp", [-1, 32]], ["bgemm_wp", "sp", [-1, 2, 4]], ["bgemm_hp", "sp", [-1, 1]]]}, "result": [[0.002125205066666667], 0, 22.849852085113525, 1618317722.5091448], "version": 0.2, "tvm_version": "0.8.dev0"}
{"input": ["opencl -keys=mali,opencl,gpu -device=mali -max_num_threads=256", "winograd_2", [1, 14, 14, 256, 256, 3, 3, [1, 1], [1, 1, 1, 1]], {}], "config": {"index": 544081, "code_hash": null, "entity": [["inv_cp", "sp", [-1, 2]], ["inv_wp", "sp", [-1, 4, 2]], ["inv_hp", "sp", [-1, 4, 2]], ["kernel_cp", "sp", [-1, 2]], ["kernel_kp", "sp", [-1, 8]], ["data_cp", "sp", [-1, 16]], ["data_wp", "sp", [-1, 1, 1]], ["data_hp", "sp", [-1, 4, 1]], ["bgemm_kp", "sp", [-1, 32]], ["bgemm_wp", "sp", [-1, 2, 4]], ["bgemm_hp", "sp", [-1, 1]]]}, "result": [[0.0021440163333333335], 0, 24.353445291519165, 1618317723.9136066], "version": 0.2, "tvm_version": "0.8.dev0"}
{"input": ["opencl -keys=mali,opencl,gpu -device=mali -max_num_threads=256", "winograd_2", [1, 14, 14, 256, 256, 3, 3, [1, 1], [1, 1, 1, 1]], {}], "config": {"index": 544273, "code_hash": null, "entity": [["inv_cp", "sp", [-1, 2]], ["inv_wp", "sp", [-1, 4, 2]], ["inv_hp", "sp", [-1, 4, 2]], ["kernel_cp", "sp", [-1, 8]], ["kernel_kp", "sp", [-1, 16]], ["data_cp", "sp", [-1, 16]], ["data_wp", "sp", [-1, 1, 1]], ["data_hp", "sp", [-1, 4, 1]], ["bgemm_kp", "sp", [-1, 32]], ["bgemm_wp", "sp", [-1, 2, 4]], ["bgemm_hp", "sp", [-1, 1]]]}, "result": [[0.0021556937333333335], 0, 25.471822500228882, 1618317725.2609665], "version": 0.2, "tvm_version": "0.8.dev0"}
{"input": ["opencl -keys=mali,opencl,gpu -device=mali -max_num_threads=256", "winograd_2", [1, 14, 14, 256, 256, 3, 3, [1, 1], [1, 1, 1, 1]], {}], "config": {"index": 543793, "code_hash": null, "entity": [["inv_cp", "sp", [-1, 2]], ["inv_wp", "sp", [-1, 4, 2]], ["inv_hp", "sp", [-1, 4, 2]], ["kernel_cp", "sp", [-1, 2]], ["kernel_kp", "sp", [-1, 2]], ["data_cp", "sp", [-1, 16]], ["data_wp", "sp", [-1, 1, 1]], ["data_hp", "sp", [-1, 4, 1]], ["bgemm_kp", "sp", [-1, 32]], ["bgemm_wp", "sp", [-1, 2, 4]], ["bgemm_hp", "sp", [-1, 1]]]}, "result": [[0.0021653008], 0, 26.578914642333984, 1618317726.498898], "version": 0.2, "tvm_version": "0.8.dev0"}
{"input": ["opencl -keys=mali,opencl,gpu -device=mali -max_num_threads=256", "winograd_2", [1, 14, 14, 256, 256, 3, 3, [1, 1], [1, 1, 1, 1]], {}], "config": {"index": 543961, "code_hash": null, "entity": [["inv_cp", "sp", [-1, 2]], ["inv_wp", "sp", [-1, 4, 2]], ["inv_hp", "sp", [-1, 4, 2]], ["kernel_cp", "sp", [-1, 4]], ["kernel_kp", "sp", [-1, 4]], ["data_cp", "sp", [-1, 16]], ["data_wp", "sp", [-1, 1, 1]], ["data_hp", "sp", [-1, 4, 1]], ["bgemm_kp", "sp", [-1, 32]], ["bgemm_wp", "sp", [-1, 2, 4]], ["bgemm_hp", "sp", [-1, 1]]]}, "result": [[0.002163683466666667], 0, 27.903461456298828, 1618317727.802408], "version": 0.2, "tvm_version": "0.8.dev0"}
{"input": ["opencl -keys=mali,opencl,gpu -device=mali -max_num_threads=256", "winograd_2", [1, 14, 14, 256, 256, 3, 3, [1, 1], [1, 1, 1, 1]], {}], "config": {"index": 543673, "code_hash": null, "entity": [["inv_cp", "sp", [-1, 2]], ["inv_wp", "sp", [-1, 4, 2]], ["inv_hp", "sp", [-1, 4, 2]], ["kernel_cp", "sp", [-1, 4]], ["kernel_kp", "sp", [-1, 1]], ["data_cp", "sp", [-1, 16]], ["data_wp", "sp", [-1, 1, 1]], ["data_hp", "sp", [-1, 4, 1]], ["bgemm_kp", "sp", [-1, 32]], ["bgemm_wp", "sp", [-1, 2, 4]], ["bgemm_hp", "sp", [-1, 1]]]}, "result": [[0.0021469438666666665], 0, 28.99096989631653, 1618317729.0062711], "version": 0.2, "tvm_version": "0.8.dev0"}
{"input": ["opencl -keys=mali,opencl,gpu -device=mali -max_num_threads=256", "winograd_2", [1, 14, 14, 256, 256, 3, 3, [1, 1], [1, 1, 1, 1]], {}], "config": {"index": 544153, "code_hash": null, "entity": [["inv_cp", "sp", [-1, 2]], ["inv_wp", "sp", [-1, 4, 2]], ["inv_hp", "sp", [-1, 4, 2]], ["kernel_cp", "sp", [-1, 16]], ["kernel_kp", "sp", [-1, 8]], ["data_cp", "sp", [-1, 16]], ["data_wp", "sp", [-1, 1, 1]], ["data_hp", "sp", [-1, 4, 1]], ["bgemm_kp", "sp", [-1, 32]], ["bgemm_wp", "sp", [-1, 2, 4]], ["bgemm_hp", "sp", [-1, 1]]]}, "result": [[0.0021328025333333333], 0, 30.295395612716675, 1618317730.2933447], "version": 0.2, "tvm_version": "0.8.dev0"}
{"input": ["opencl -keys=mali,opencl,gpu -device=mali -max_num_threads=256", "winograd_2", [1, 14, 14, 256, 256, 3, 3, [1, 1], [1, 1, 1, 1]], {}], "config": {"index": 544057, "code_hash": null, "entity": [["inv_cp", "sp", [-1, 2]], ["inv_wp", "sp", [-1, 4, 2]], ["inv_hp", "sp", [-1, 4, 2]], ["kernel_cp", "sp", [-1, 1]], ["kernel_kp", "sp", [-1, 8]], ["data_cp", "sp", [-1, 16]], ["data_wp", "sp", [-1, 1, 1]], ["data_hp", "sp", [-1, 4, 1]], ["bgemm_kp", "sp", [-1, 32]], ["bgemm_wp", "sp", [-1, 2, 4]], ["bgemm_hp", "sp", [-1, 1]]]}, "result": [[0.002115454933333333], 0, 31.758675813674927, 1618317731.7317634], "version": 0.2, "tvm_version": "0.8.dev0"}
{"input": ["opencl -keys=mali,opencl,gpu -device=mali -max_num_threads=256", "winograd_2", [1, 14, 14, 256, 256, 3, 3, [1, 1], [1, 1, 1, 1]], {}], "config": {"index": 543889, "code_hash": null, "entity": [["inv_cp", "sp", [-1, 2]], ["inv_wp", "sp", [-1, 4, 2]], ["inv_hp", "sp", [-1, 4, 2]], ["kernel_cp", "sp", [-1, 32]], ["kernel_kp", "sp", [-1, 4]], ["data_cp", "sp", [-1, 16]], ["data_wp", "sp", [-1, 1, 1]], ["data_hp", "sp", [-1, 4, 1]], ["bgemm_kp", "sp", [-1, 32]], ["bgemm_wp", "sp", [-1, 2, 4]], ["bgemm_hp", "sp", [-1, 1]]]}, "result": [[0.0021744003333333335], 0, 10.151333093643188, 1618317746.4243941], "version": 0.2, "tvm_version": "0.8.dev0"}
{"input": ["opencl -keys=mali,opencl,gpu -device=mali -max_num_threads=256", "winograd_2", [1, 14, 14, 256, 256, 3, 3, [1, 1], [1, 1, 1, 1]], {}], "config": {"index": 544249, "code_hash": null, "entity": [["inv_cp", "sp", [-1, 2]], ["inv_wp", "sp", [-1, 4, 2]], ["inv_hp", "sp", [-1, 4, 2]], ["kernel_cp", "sp", [-1, 4]], ["kernel_kp", "sp", [-1, 16]], ["data_cp", "sp", [-1, 16]], ["data_wp", "sp", [-1, 1, 1]], ["data_hp", "sp", [-1, 4, 1]], ["bgemm_kp", "sp", [-1, 32]], ["bgemm_wp", "sp", [-1, 2, 4]], ["bgemm_hp", "sp", [-1, 1]]]}, "result": [[0.002118081], 0, 12.196716070175171, 1618317747.7476513], "version": 0.2, "tvm_version": "0.8.dev0"}
{"input": ["opencl -keys=mali,opencl,gpu -device=mali -max_num_threads=256", "winograd_2", [1, 14, 14, 256, 256, 3, 3, [1, 1], [1, 1, 1, 1]], {}], "config": {"index": 460873, "code_hash": null, "entity": [["inv_cp", "sp", [-1, 2]], ["inv_wp", "sp", [-1, 4, 2]], ["inv_hp", "sp", [-1, 4, 2]], ["kernel_cp", "sp", [-1, 4]], ["kernel_kp", "sp", [-1, 2]], ["data_cp", "sp", [-1, 16]], ["data_wp", "sp", [-1, 1, 1]], ["data_hp", "sp", [-1, 4, 1]], ["bgemm_kp", "sp", [-1, 16]], ["bgemm_wp", "sp", [-1, 1, 4]], ["bgemm_hp", "sp", [-1, 1]]]}, "result": [[0.002310574533333333], 0, 13.45226526260376, 1618317749.2275496], "version": 0.2, "tvm_version": "0.8.dev0"}
{"input": ["opencl -keys=mali,opencl,gpu -device=mali -max_num_threads=256", "winograd_2", [1, 7, 7, 512, 512, 3, 3, [1, 1], [1, 1, 1, 1]], {}], "config": {"index": 119076, "code_hash": null, "entity": [["inv_cp", "sp", [-1, 16]], ["inv_wp", "sp", [-1, 4, 2]], ["inv_hp", "sp", [-1, 4, 2]], ["kernel_cp", "sp", [-1, 1]], ["kernel_kp", "sp", [-1, 4]], ["data_cp", "sp", [-1, 16]], ["data_wp", "sp", [-1, 1, 1]], ["data_hp", "sp", [-1, 4, 1]], ["bgemm_kp", "sp", [-1, 2]], ["bgemm_wp", "sp", [-1, 2, 4]], ["bgemm_hp", "sp", [-1, 1]]]}, "result": [[0.005219620800000001], 0, 7.376070737838745, 1618317764.1133919], "version": 0.2, "tvm_version": "0.8.dev0"}
{"input": ["opencl -keys=mali,opencl,gpu -device=mali -max_num_threads=256", "winograd_2", [1, 7, 7, 512, 512, 3, 3, [1, 1], [1, 1, 1, 1]], {}], "config": {"index": 18469, "code_hash": null, "entity": [["inv_cp", "sp", [-1, 4]], ["inv_wp", "sp", [-1, 4, 2]], ["inv_hp", "sp", [-1, 4, 2]], ["kernel_cp", "sp", [-1, 16]], ["kernel_kp", "sp", [-1, 1]], ["data_cp", "sp", [-1, 2]], ["data_wp", "sp", [-1, 1, 1]], ["data_hp", "sp", [-1, 2, 1]], ["bgemm_kp", "sp", [-1, 1]], ["bgemm_wp", "sp", [-1, 1, 4]], ["bgemm_hp", "sp", [-1, 1]]]}, "result": [[0.018272296599999998], 0, 14.372040748596191, 1618317767.5938692], "version": 0.2, "tvm_version": "0.8.dev0"}
{"input": ["opencl -keys=mali,opencl,gpu -device=mali -max_num_threads=256", "winograd_2", [1, 7, 7, 512, 512, 3, 3, [1, 1], [1, 1, 1, 1]], {}], "config": {"index": 92644, "code_hash": null, "entity": [["inv_cp", "sp", [-1, 16]], ["inv_wp", "sp", [-1, 4, 2]], ["inv_hp", "sp", [-1, 4, 2]], ["kernel_cp", "sp", [-1, 16]], ["kernel_kp", "sp", [-1, 4]], ["data_cp", "sp", [-1, 2]], ["data_wp", "sp", [-1, 2, 1]], ["data_hp", "sp", [-1, 4, 1]], ["bgemm_kp", "sp", [-1, 32]], ["bgemm_wp", "sp", [-1, 2, 4]], ["bgemm_hp", "sp", [-1, 1]]]}, "result": [[0.0030207285333333335], 0, 15.21622109413147, 1618317770.0457764], "version": 0.2, "tvm_version": "0.8.dev0"}
{"input": ["opencl -keys=mali,opencl,gpu -device=mali -max_num_threads=256", "winograd_2", [1, 7, 7, 512, 512, 3, 3, [1, 1], [1, 1, 1, 1]], {}], "config": {"index": 18864, "code_hash": null, "entity": [["inv_cp", "sp", [-1, 16]], ["inv_wp", "sp", [-1, 4, 2]], ["inv_hp", "sp", [-1, 4, 2]], ["kernel_cp", "sp", [-1, 1]], ["kernel_kp", "sp", [-1, 16]], ["data_cp", "sp", [-1, 4]], ["data_wp", "sp", [-1, 1, 1]], ["data_hp", "sp", [-1, 2, 1]], ["bgemm_kp", "sp", [-1, 1]], ["bgemm_wp", "sp", [-1, 1, 4]], ["bgemm_hp", "sp", [-1, 1]]]}, "result": [[0.01826075513333333], 0, 19.73206114768982, 1618317773.462429], "version": 0.2, "tvm_version": "0.8.dev0"}
{"input": ["opencl -keys=mali,opencl,gpu -device=mali -max_num_threads=256", "winograd_2", [1, 7, 7, 512, 512, 3, 3, [1, 1], [1, 1, 1, 1]], {}], "config": {"index": 139070, "code_hash": null, "entity": [["inv_cp", "sp", [-1, 2]], ["inv_wp", "sp", [-1, 4, 2]], ["inv_hp", "sp", [-1, 4, 2]], ["kernel_cp", "sp", [-1, 2]], ["kernel_kp", "sp", [-1, 16]], ["data_cp", "sp", [-1, 32]], ["data_wp", "sp", [-1, 2, 1]], ["data_hp", "sp", [-1, 1, 1]], ["bgemm_kp", "sp", [-1, 8]], ["bgemm_wp", "sp", [-1, 2, 4]], ["bgemm_hp", "sp", [-1, 1]]]}, "result": [[0.0028668092666666667], 0, 26.878833532333374, 1618317778.9038796], "version": 0.2, "tvm_version": "0.8.dev0"}
{"input": ["opencl -keys=mali,opencl,gpu -device=mali -max_num_threads=256", "winograd_2", [1, 7, 7, 512, 512, 3, 3, [1, 1], [1, 1, 1, 1]], {}], "config": {"index": 150837, "code_hash": null, "entity": [["inv_cp", "sp", [-1, 2]], ["inv_wp", "sp", [-1, 4, 2]], ["inv_hp", "sp", [-1, 4, 2]], ["kernel_cp", "sp", [-1, 4]], ["kernel_kp", "sp", [-1, 4]], ["data_cp", "sp", [-1, 16]], ["data_wp", "sp", [-1, 1, 1]], ["data_hp", "sp", [-1, 1, 1]], ["bgemm_kp", "sp", [-1, 16]], ["bgemm_wp", "sp", [-1, 2, 4]], ["bgemm_hp", "sp", [-1, 1]]]}, "result": [[0.0029004269999999997], 0, 21.89948010444641, 1618317776.1851323], "version": 0.2, "tvm_version": "0.8.dev0"}
{"input": ["opencl -keys=mali,opencl,gpu -device=mali -max_num_threads=256", "winograd_2", [1, 7, 7, 512, 512, 3, 3, [1, 1], [1, 1, 1, 1]], {}], "config": {"index": 138291, "code_hash": null, "entity": [["inv_cp", "sp", [-1, 16]], ["inv_wp", "sp", [-1, 4, 2]], ["inv_hp", "sp", [-1, 4, 2]], ["kernel_cp", "sp", [-1, 8]], ["kernel_kp", "sp", [-1, 8]], ["data_cp", "sp", [-1, 4]], ["data_wp", "sp", [-1, 2, 1]], ["data_hp", "sp", [-1, 1, 1]], ["bgemm_kp", "sp", [-1, 8]], ["bgemm_wp", "sp", [-1, 2, 4]], ["bgemm_hp", "sp", [-1, 1]]]}, "result": [[0.0029481858], 0, 29.66749906539917, 1618317781.6706054], "version": 0.2, "tvm_version": "0.8.dev0"}
{"input": ["opencl -keys=mali,opencl,gpu -device=mali -max_num_threads=256", "winograd_2", [1, 7, 7, 512, 512, 3, 3, [1, 1], [1, 1, 1, 1]], {}], "config": {"index": 232382, "code_hash": null, "entity": [["inv_cp", "sp", [-1, 4]], ["inv_wp", "sp", [-1, 4, 2]], ["inv_hp", "sp", [-1, 4, 2]], ["kernel_cp", "sp", [-1, 32]], ["kernel_kp", "sp", [-1, 32]], ["data_cp", "sp", [-1, 16]], ["data_wp", "sp", [-1, 1, 1]], ["data_hp", "sp", [-1, 1, 1]], ["bgemm_kp", "sp", [-1, 16]], ["bgemm_wp", "sp", [-1, 4, 4]], ["bgemm_hp", "sp", [-1, 1]]]}, "result": [[0.0029400810666666667], 0, 32.0410943031311, 1618317787.0894055], "version": 0.2, "tvm_version": "0.8.dev0"}
{"input": ["opencl -keys=mali,opencl,gpu -device=mali -max_num_threads=256", "winograd_2", [1, 7, 7, 512, 512, 3, 3, [1, 1], [1, 1, 1, 1]], {}], "config": {"index": 72904, "code_hash": null, "entity": [["inv_cp", "sp", [-1, 16]], ["inv_wp", "sp", [-1, 4, 2]], ["inv_hp", "sp", [-1, 4, 2]], ["kernel_cp", "sp", [-1, 16]], ["kernel_kp", "sp", [-1, 1]], ["data_cp", "sp", [-1, 2]], ["data_wp", "sp", [-1, 1, 1]], ["data_hp", "sp", [-1, 2, 1]], ["bgemm_kp", "sp", [-1, 16]], ["bgemm_wp", "sp", [-1, 1, 4]], ["bgemm_hp", "sp", [-1, 1]]]}, "result": [[0.003116225], 0, 30.371777057647705, 1618317784.3653514], "version": 0.2, "tvm_version": "0.8.dev0"}
{"input": ["opencl -keys=mali,opencl,gpu -device=mali -max_num_threads=256", "winograd_2", [1, 7, 7, 512, 512, 3, 3, [1, 1], [1, 1, 1, 1]], {}], "config": {"index": 146278, "code_hash": null, "entity": [["inv_cp", "sp", [-1, 16]], ["inv_wp", "sp", [-1, 4, 2]], ["inv_hp", "sp", [-1, 4, 2]], ["kernel_cp", "sp", [-1, 16]], ["kernel_kp", "sp", [-1, 2]], ["data_cp", "sp", [-1, 16]], ["data_wp", "sp", [-1, 1, 1]], ["data_hp", "sp", [-1, 4, 1]], ["bgemm_kp", "sp", [-1, 8]], ["bgemm_wp", "sp", [-1, 2, 4]], ["bgemm_hp", "sp", [-1, 1]]]}, "result": [[0.0028860878666666662], 0, 31.9697048664093, 1618317789.604317], "version": 0.2, "tvm_version": "0.8.dev0"}
{"input": ["opencl -keys=mali,opencl,gpu -device=mali -max_num_threads=256", "winograd_2", [1, 7, 7, 512, 512, 3, 3, [1, 1], [1, 1, 1, 1]], {}], "config": {"index": 81919, "code_hash": null, "entity": [["inv_cp", "sp", [-1, 8]], ["inv_wp", "sp", [-1, 4, 2]], ["inv_hp", "sp", [-1, 4, 2]], ["kernel_cp", "sp", [-1, 4]], ["kernel_kp", "sp", [-1, 32]], ["data_cp", "sp", [-1, 2]], ["data_wp", "sp", [-1, 1, 1]], ["data_hp", "sp", [-1, 1, 1]], ["bgemm_kp", "sp", [-1, 32]], ["bgemm_wp", "sp", [-1, 2, 4]], ["bgemm_hp", "sp", [-1, 1]]]}, "result": [[0.002904517], 0, 39.54263210296631, 1618317795.112561], "version": 0.2, "tvm_version": "0.8.dev0"}
{"input": ["opencl -keys=mali,opencl,gpu -device=mali -max_num_threads=256", "winograd_2", [1, 7, 7, 512, 512, 3, 3, [1, 1], [1, 1, 1, 1]], {}], "config": {"index": 198159, "code_hash": null, "entity": [["inv_cp", "sp", [-1, 4]], ["inv_wp", "sp", [-1, 4, 2]], ["inv_hp", "sp", [-1, 4, 2]], ["kernel_cp", "sp", [-1, 1]], ["kernel_kp", "sp", [-1, 2]], ["data_cp", "sp", [-1, 1]], ["data_wp", "sp", [-1, 4, 1]], ["data_hp", "sp", [-1, 2, 1]], ["bgemm_kp", "sp", [-1, 2]], ["bgemm_wp", "sp", [-1, 4, 4]], ["bgemm_hp", "sp", [-1, 1]]]}, "result": [[0.0029681828000000005], 0, 40.83874177932739, 1618317792.3753119], "version": 0.2, "tvm_version": "0.8.dev0"}
{"input": ["opencl -keys=mali,opencl,gpu -device=mali -max_num_threads=256", "winograd_2", [1, 7, 7, 512, 512, 3, 3, [1, 1], [1, 1, 1, 1]], {}], "config": {"index": 186138, "code_hash": null, "entity": [["inv_cp", "sp", [-1, 2]], ["inv_wp", "sp", [-1, 4, 2]], ["inv_hp", "sp", [-1, 4, 2]], ["kernel_cp", "sp", [-1, 32]], ["kernel_kp", "sp", [-1, 4]], ["data_cp", "sp", [-1, 1]], ["data_wp", "sp", [-1, 1, 1]], ["data_hp", "sp", [-1, 4, 1]], ["bgemm_kp", "sp", [-1, 1]], ["bgemm_wp", "sp", [-1, 4, 4]], ["bgemm_hp", "sp", [-1, 1]]]}, "result": [[0.0049784393333333335], 0, 6.884302139282227, 1618317807.9934225], "version": 0.2, "tvm_version": "0.8.dev0"}
{"input": ["opencl -keys=mali,opencl,gpu -device=mali -max_num_threads=256", "winograd_2", [1, 7, 7, 512, 512, 3, 3, [1, 1], [1, 1, 1, 1]], {}], "config": {"index": 207821, "code_hash": null, "entity": [["inv_cp", "sp", [-1, 8]], ["inv_wp", "sp", [-1, 4, 2]], ["inv_hp", "sp", [-1, 4, 2]], ["kernel_cp", "sp", [-1, 1]], ["kernel_kp", "sp", [-1, 8]], ["data_cp", "sp", [-1, 4]], ["data_wp", "sp", [-1, 4, 1]], ["data_hp", "sp", [-1, 1, 1]], ["bgemm_kp", "sp", [-1, 4]], ["bgemm_wp", "sp", [-1, 4, 4]], ["bgemm_hp", "sp", [-1, 1]]]}, "result": [[0.0030440550666666674], 0, 14.286681175231934, 1618317810.7281845], "version": 0.2, "tvm_version": "0.8.dev0"}
{"input": ["opencl -keys=mali,opencl,gpu -device=mali -max_num_threads=256", "winograd_2", [1, 7, 7, 512, 512, 3, 3, [1, 1], [1, 1, 1, 1]], {}], "config": {"index": 141121, "code_hash": null, "entity": [["inv_cp", "sp", [-1, 2]], ["inv_wp", "sp", [-1, 4, 2]], ["inv_hp", "sp", [-1, 4, 2]], ["kernel_cp", "sp", [-1, 1]], ["kernel_kp", "sp", [-1, 32]], ["data_cp", "sp", [-1, 4]], ["data_wp", "sp", [-1, 1, 1]], ["data_hp", "sp", [-1, 2, 1]], ["bgemm_kp", "sp", [-1, 8]], ["bgemm_wp", "sp", [-1, 2, 4]], ["bgemm_hp", "sp", [-1, 1]]]}, "result": [[0.002882434733333334], 0, 15.07532262802124, 1618317813.442063], "version": 0.2, "tvm_version": "0.8.dev0"}
{"input": ["opencl -keys=mali,opencl,gpu -device=mali -max_num_threads=256", "winograd_2", [1, 7, 7, 512, 512, 3, 3, [1, 1], [1, 1, 1, 1]], {}], "config": {"index": 14783, "code_hash": null, "entity": [["inv_cp", "sp", [-1, 16]], ["inv_wp", "sp", [-1, 4, 2]], ["inv_hp", "sp", [-1, 4, 2]], ["kernel_cp", "sp", [-1, 32]], ["kernel_kp", "sp", [-1, 4]], ["data_cp", "sp", [-1, 16]], ["data_wp", "sp", [-1, 1, 1]], ["data_hp", "sp", [-1, 1, 1]], ["bgemm_kp", "sp", [-1, 1]], ["bgemm_wp", "sp", [-1, 1, 4]], ["bgemm_hp", "sp", [-1, 1]]]}, "result": [[0.018280840933333334], 0, 17.552428007125854, 1618317816.881978], "version": 0.2, "tvm_version": "0.8.dev0"}
{"input": ["opencl -keys=mali,opencl,gpu -device=mali -max_num_threads=256", "winograd_2", [1, 7, 7, 512, 512, 3, 3, [1, 1], [1, 1, 1, 1]], {}], "config": {"index": 186359, "code_hash": null, "entity": [["inv_cp", "sp", [-1, 8]], ["inv_wp", "sp", [-1, 4, 2]], ["inv_hp", "sp", [-1, 4, 2]], ["kernel_cp", "sp", [-1, 1]], ["kernel_kp", "sp", [-1, 4]], ["data_cp", "sp", [-1, 2]], ["data_wp", "sp", [-1, 1, 1]], ["data_hp", "sp", [-1, 4, 1]], ["bgemm_kp", "sp", [-1, 1]], ["bgemm_wp", "sp", [-1, 4, 4]], ["bgemm_hp", "sp", [-1, 1]]]}, "result": [[0.004985213600000001], 0, 18.22711205482483, 1618317819.7484038], "version": 0.2, "tvm_version": "0.8.dev0"}
{"input": ["opencl -keys=mali,opencl,gpu -device=mali -max_num_threads=256", "winograd_2", [1, 7, 7, 512, 512, 3, 3, [1, 1], [1, 1, 1, 1]], {}], "config": {"index": 187034, "code_hash": null, "entity": [["inv_cp", "sp", [-1, 2]], ["inv_wp", "sp", [-1, 4, 2]], ["inv_hp", "sp", [-1, 4, 2]], ["kernel_cp", "sp", [-1, 2]], ["kernel_kp", "sp", [-1, 1]], ["data_cp", "sp", [-1, 16]], ["data_wp", "sp", [-1, 1, 1]], ["data_hp", "sp", [-1, 4, 1]], ["bgemm_kp", "sp", [-1, 1]], ["bgemm_wp", "sp", [-1, 4, 4]], ["bgemm_hp", "sp", [-1, 1]]]}, "result": [[0.0049858628], 0, 20.828064680099487, 1618317822.5172317], "version": 0.2, "tvm_version": "0.8.dev0"}
{"input": ["opencl -keys=mali,opencl,gpu -device=mali -max_num_threads=256", "winograd_2", [1, 7, 7, 512, 512, 3, 3, [1, 1], [1, 1, 1, 1]], {}], "config": {"index": 203314, "code_hash": null, "entity": [["inv_cp", "sp", [-1, 16]], ["inv_wp", "sp", [-1, 4, 2]], ["inv_hp", "sp", [-1, 4, 2]], ["kernel_cp", "sp", [-1, 16]], ["kernel_kp", "sp", [-1, 8]], ["data_cp", "sp", [-1, 4]], ["data_wp", "sp", [-1, 4, 1]], ["data_hp", "sp", [-1, 4, 1]], ["bgemm_kp", "sp", [-1, 2]], ["bgemm_wp", "sp", [-1, 4, 4]], ["bgemm_hp", "sp", [-1, 1]]]}, "result": [[0.0029292719999999997], 0, 24.91177749633789, 1618317825.4705796], "version": 0.2, "tvm_version": "0.8.dev0"}
{"input": ["opencl -keys=mali,opencl,gpu -device=mali -max_num_threads=256", "winograd_2", [1, 7, 7, 512, 512, 3, 3, [1, 1], [1, 1, 1, 1]], {}], "config": {"index": 224367, "code_hash": null, "entity": [["inv_cp", "sp", [-1, 4]], ["inv_wp", "sp", [-1, 4, 2]], ["inv_hp", "sp", [-1, 4, 2]], ["kernel_cp", "sp", [-1, 1]], ["kernel_kp", "sp", [-1, 2]], ["data_cp", "sp", [-1, 4]], ["data_wp", "sp", [-1, 2, 1]], ["data_hp", "sp", [-1, 2, 1]], ["bgemm_kp", "sp", [-1, 8]], ["bgemm_wp", "sp", [-1, 4, 4]], ["bgemm_hp", "sp", [-1, 1]]]}, "result": [[0.0029594760666666665], 0, 32.302393674850464, 1618317828.1639967], "version": 0.2, "tvm_version": "0.8.dev0"}
{"input": ["opencl -keys=mali,opencl,gpu -device=mali -max_num_threads=256", "winograd_2", [1, 7, 7, 512, 512, 3, 3, [1, 1], [1, 1, 1, 1]], {}], "config": {"index": 127233, "code_hash": null, "entity": [["inv_cp", "sp", [-1, 2]], ["inv_wp", "sp", [-1, 4, 2]], ["inv_hp", "sp", [-1, 4, 2]], ["kernel_cp", "sp", [-1, 4]], ["kernel_kp", "sp", [-1, 16]], ["data_cp", "sp", [-1, 1]], ["data_wp", "sp", [-1, 1, 1]], ["data_hp", "sp", [-1, 2, 1]], ["bgemm_kp", "sp", [-1, 4]], ["bgemm_wp", "sp", [-1, 2, 4]], ["bgemm_hp", "sp", [-1, 1]]]}, "result": [[0.0028558176000000003], 0, 32.01049017906189, 1618317830.8382804], "version": 0.2, "tvm_version": "0.8.dev0"}
{"input": ["opencl -keys=mali,opencl,gpu -device=mali -max_num_threads=256", "winograd_2", [1, 7, 7, 512, 512, 3, 3, [1, 1], [1, 1, 1, 1]], {}], "config": {"index": 141839, "code_hash": null, "entity": [["inv_cp", "sp", [-1, 8]], ["inv_wp", "sp", [-1, 4, 2]], ["inv_hp", "sp", [-1, 4, 2]], ["kernel_cp", "sp", [-1, 1]], ["kernel_kp", "sp", [-1, 16]], ["data_cp", "sp", [-1, 16]], ["data_wp", "sp", [-1, 1, 1]], ["data_hp", "sp", [-1, 2, 1]], ["bgemm_kp", "sp", [-1, 8]], ["bgemm_wp", "sp", [-1, 2, 4]], ["bgemm_hp", "sp", [-1, 1]]]}, "result": [[0.002898659933333333], 0, 35.43298697471619, 1618317833.4110658], "version": 0.2, "tvm_version": "0.8.dev0"}
{"input": ["opencl -keys=mali,opencl,gpu -device=mali -max_num_threads=256", "winograd_2", [1, 7, 7, 512, 512, 3, 3, [1, 1], [1, 1, 1, 1]], {}], "config": {"index": 109558, "code_hash": null, "entity": [["inv_cp", "sp", [-1, 2]], ["inv_wp", "sp", [-1, 4, 2]], ["inv_hp", "sp", [-1, 4, 2]], ["kernel_cp", "sp", [-1, 8]], ["kernel_kp", "sp", [-1, 8]], ["data_cp", "sp", [-1, 4]], ["data_wp", "sp", [-1, 1, 1]], ["data_hp", "sp", [-1, 1, 1]], ["bgemm_kp", "sp", [-1, 2]], ["bgemm_wp", "sp", [-1, 2, 4]], ["bgemm_hp", "sp", [-1, 1]]]}, "result": [[0.005231899999999999], 0, 36.94081974029541, 1618317836.3963983], "version": 0.2, "tvm_version": "0.8.dev0"}
{"input": ["opencl -keys=mali,opencl,gpu -device=mali -max_num_threads=256", "winograd_2", [1, 7, 7, 512, 512, 3, 3, [1, 1], [1, 1, 1, 1]], {}], "config": {"index": 159178, "code_hash": null, "entity": [["inv_cp", "sp", [-1, 8]], ["inv_wp", "sp", [-1, 4, 2]], ["inv_hp", "sp", [-1, 4, 2]], ["kernel_cp", "sp", [-1, 32]], ["kernel_kp", "sp", [-1, 4]], ["data_cp", "sp", [-1, 2]], ["data_wp", "sp", [-1, 1, 1]], ["data_hp", "sp", [-1, 4, 1]], ["bgemm_kp", "sp", [-1, 16]], ["bgemm_wp", "sp", [-1, 2, 4]], ["bgemm_hp", "sp", [-1, 1]]]}, "result": [[0.002895300266666667], 0, 6.4464271068573, 1618317849.2051356], "version": 0.2, "tvm_version": "0.8.dev0"}
{"input": ["opencl -keys=mali,opencl,gpu -device=mali -max_num_threads=256", "winograd_2", [1, 7, 7, 512, 512, 3, 3, [1, 1], [1, 1, 1, 1]], {}], "config": {"index": 178030, "code_hash": null, "entity": [["inv_cp", "sp", [-1, 16]], ["inv_wp", "sp", [-1, 4, 2]], ["inv_hp", "sp", [-1, 4, 2]], ["kernel_cp", "sp", [-1, 16]], ["kernel_kp", "sp", [-1, 2]], ["data_cp", "sp", [-1, 16]], ["data_wp", "sp", [-1, 1, 1]], ["data_hp", "sp", [-1, 1, 1]], ["bgemm_kp", "sp", [-1, 1]], ["bgemm_wp", "sp", [-1, 4, 4]], ["bgemm_hp", "sp", [-1, 1]]]}, "result": [[0.0049853282], 0, 10.299960374832153, 1618317852.1822493], "version": 0.2, "tvm_version": "0.8.dev0"}
{"input": ["opencl -keys=mali,opencl,gpu -device=mali -max_num_threads=256", "winograd_2", [1, 7, 7, 512, 512, 3, 3, [1, 1], [1, 1, 1, 1]], {}], "config": {"index": 17715, "code_hash": null, "entity": [["inv_cp", "sp", [-1, 8]], ["inv_wp", "sp", [-1, 4, 2]], ["inv_hp", "sp", [-1, 4, 2]], ["kernel_cp", "sp", [-1, 16]], ["kernel_kp", "sp", [-1, 1]], ["data_cp", "sp", [-1, 16]], ["data_wp", "sp", [-1, 4, 1]], ["data_hp", "sp", [-1, 1, 1]], ["bgemm_kp", "sp", [-1, 1]], ["bgemm_wp", "sp", [-1, 1, 4]], ["bgemm_hp", "sp", [-1, 1]]]}, "result": [[0.018273985933333337], 0, 20.983694553375244, 1618317858.5850918], "version": 0.2, "tvm_version": "0.8.dev0"}
{"input": ["opencl -keys=mali,opencl,gpu -device=mali -max_num_threads=256", "winograd_2", [1, 7, 7, 512, 512, 3, 3, [1, 1], [1, 1, 1, 1]], {}], "config": {"index": 151824, "code_hash": null, "entity": [["inv_cp", "sp", [-1, 2]], ["inv_wp", "sp", [-1, 4, 2]], ["inv_hp", "sp", [-1, 4, 2]], ["kernel_cp", "sp", [-1, 32]], ["kernel_kp", "sp", [-1, 2]], ["data_cp", "sp", [-1, 4]], ["data_wp", "sp", [-1, 2, 1]], ["data_hp", "sp", [-1, 1, 1]], ["bgemm_kp", "sp", [-1, 16]], ["bgemm_wp", "sp", [-1, 2, 4]], ["bgemm_hp", "sp", [-1, 1]]]}, "result": [[0.0028776905333333324], 0, 16.716667413711548, 1618317854.9247077], "version": 0.2, "tvm_version": "0.8.dev0"}
{"input": ["opencl -keys=mali,opencl,gpu -device=mali -max_num_threads=256", "winograd_2", [1, 7, 7, 512, 512, 3, 3, [1, 1], [1, 1, 1, 1]], {}], "config": {"index": 240493, "code_hash": null, "entity": [["inv_cp", "sp", [-1, 2]], ["inv_wp", "sp", [-1, 4, 2]], ["inv_hp", "sp", [-1, 4, 2]], ["kernel_cp", "sp", [-1, 1]], ["kernel_kp", "sp", [-1, 2]], ["data_cp", "sp", [-1, 1]], ["data_wp", "sp", [-1, 1, 1]], ["data_hp", "sp", [-1, 4, 1]], ["bgemm_kp", "sp", [-1, 16]], ["bgemm_wp", "sp", [-1, 4, 4]], ["bgemm_hp", "sp", [-1, 1]]]}, "result": [[0.0029869833333333335], 0, 18.616200923919678, 1618317861.329545], "version": 0.2, "tvm_version": "0.8.dev0"}
{"input": ["opencl -keys=mali,opencl,gpu -device=mali -max_num_threads=256", "winograd_2", [1, 7, 7, 512, 512, 3, 3, [1, 1], [1, 1, 1, 1]], {}], "config": {"index": 178148, "code_hash": null, "entity": [["inv_cp", "sp", [-1, 8]], ["inv_wp", "sp", [-1, 4, 2]], ["inv_hp", "sp", [-1, 4, 2]], ["kernel_cp", "sp", [-1, 8]], ["kernel_kp", "sp", [-1, 16]], ["data_cp", "sp", [-1, 16]], ["data_wp", "sp", [-1, 1, 1]], ["data_hp", "sp", [-1, 1, 1]], ["bgemm_kp", "sp", [-1, 1]], ["bgemm_wp", "sp", [-1, 4, 4]], ["bgemm_hp", "sp", [-1, 1]]]}, "result": [[0.004987996], 0, 24.33458948135376, 1618317864.388319], "version": 0.2, "tvm_version": "0.8.dev0"}
